"昵称","性别","IP","UID","等级","装扮","用户权重","获赞数","粉丝团等级","评论"
"在地面阴暗爬行","保密","无IP","2876688","6","梦塔・雪谜城","10000","5","","老话说的好，你我本无缘，全靠我砸钱。,剧情里若陀也说过：若是有缘，必回再见。,所以，若陀进卡池，gkd！！！！！"
"非凡大}","保密","无IP","11800233","6","快把我哥带走","10000","5","12","完所有配音，是感又信渥ξ丁"
"梨子不是桃子","保密","无IP","44086482","6","2021拜年纪","10000","5","","没人觉得这说书很棒吗？想起小时候跟爷爷一起去听书的情景了"
"怕锤客","保密","无IP","236675892","6","2020拜年祭（鼠）","10000","5","","这英配也就比点菜强了一万倍而已啦[微笑]"
"文人亦可勇笔墨用作兵","男","无IP","286985512","6","","10000","5","","做了剧情真觉得你们做慢点真的理解，太牛了"
"姒妄R","女","无IP","30851046","6","","10000","5","","若陀龙王的bgm什么时候能出啊[大哭]，那个也太震撼了"
"LowEarthOrbit_","男","无IP","662113159","5","","10000","5","","求英配有字幕版……英语课前展示想用这个……！太喜欢了"
"鸪行","保密","无IP","294637741","6","","10000","5","","米哈游做动画吧，我真的想看，每次pv都做得那么好[脱单doge]"
"花与鸟与爱之诗","保密","无IP","176427313","6","泠鸢yousa登门喜鹊","10000","5","","这pv里钟离说话的部分是事实，说书人说话部分是野史改编"
"锅包肉加糖不要辣","女","无IP","408066631","5","EveOneCat2","10000","5","","怎么说呢，反正就是来给mhy一些关于主角配音的建议[妙啊],首先，配音少，想让玩家更有代入感，我是能够理解的[OK]但是，有些地方没有配音，我就会觉得特别有违和感（比如兄妹见面那几段，没有配音就没有那种感觉[辣眼睛]）。作为一个剧情党，我真的很喜欢看那些游戏里的配音剧情什么的，就像在看番剧（年更的 。[热词系列_好耶],建议mhy装个自由开关语音包（举个例子，我之前玩的波西亚时光就是可以开关语音包的，想不想听都随你，就那种）反正我是喜欢听的，【毕竟我选的哥哥，我一个少女也不能把自己的声音代入吧，更奇怪了啊喂[OK]】,ps：其实我就是想听龙哥说话[doge],pss：这段是躺床上现打的，有点语无伦次，都是想到哪里写都哪里[辣眼睛]"
"雷电2564789","保密","无IP","17582212","6","","10000","5","","阿贝多画的龙,钟离画的龙.jpg"
"有求必应巫","保密","无IP","168110263","6","#EveOneCat","10000","5","","若陀龙王因何被封印？若干年前……,,若陀龙王：我倒了，要帝君亲亲一下才能起来～,,帝君：如你所愿（亲）,,若陀龙王：不够 再来一下～,,帝君：你违背了契约"
"石灰扬诺夫","保密","无IP","79299720","6","","10000","5","","BV1uQ4y1f7g9,守家了，朋友。虽然不是本家而是分家，请有空的人务必来协助一下。"
"照怜","保密","无IP","297929799","5","","10000","5","","我是没有提前看这个pv的，彼时我用了一个小时一字一句的过完了整篇古闻之章第二篇，在最后略有伤感之际，田铁嘴一声抖擞，真的，这篇说书十分惊艳。在最后诗出时，鼓掌高声称好。[打call]吹爆。"
"rがxれる","男","无IP","214212104","6","","10000","5","11","兄弟们楼下魔怔人乳角色麻烦举报一下[OK]名字是idzxcvb"
"江海有小舟","男","无IP","321996068","6","","10000","5","","英配最后的诗：,The crash of a spear brought billowing dust,,,the mountains and waters made way at the sound.,,The sight of a dragon bestowed with a touch,,,the promise of rainwater blessing the ground."
"Asuka-Zhu","男","无IP","411582019","5","星座系列：巨蟹座","10000","5","","说吧  文案秃了几个"
"大FFF团后勤部","保密","无IP","24767252","6","","10000","5","","龙王的磨损大概是理性的消失情感的扭曲毕竟他是地脉的产物天生能联通地脉，人们开采矿脉造成的环境污染，和地脉经历战争被魔神污染的力量都会侵蚀龙王，这也是无法逆转的，最后若坨龙王成为了一个狂暴的魔神，再也看不见那个温和为璃月遮风避雨的巨龙。,摩拉克斯的磨损很可能就是他自己说过的记忆太好了，魔神的大战就算是摩拉克斯也连连送走了很多志同道合的战友，一位位追随他的战友在光明前倒下，摩拉克斯永远记得那个时候的一定一定这也在蚕丝他的心灵，他累了，但他是契约之神他也是璃月的庇护神，于是他庇护着璃月过了数千年，数千年的时光曾经的7神他们在湖泊旁边饮酒在畅谈自己的理想，他们成为了朋友，但七神更替，摩拉克斯认可的友人不断的离开世间，友人离去的哀伤沉痛因为摩拉克斯良好的记忆不曾离去，永远徘徊在摩拉克斯的心灵上，人们觉得岩王爷所向无敌，永远淡定自若，殊不知摩拉克斯他为了苍生安宁付出了多少代价，当钟离现身的时候他就不是那位只能赢只能前进的帝君，而是一个与老友饮酒，看花听书的普通人，世间能与钟离以朋友相称的生命不多了，而钟离的生命极其长远，可能走到最后的友人除了可爱的老子，也只剩下巴巴托斯这个元素生命了，但可爱的老子又何尝不是以敬佩与依赖的态度面对钟离呢？(^ω^ )"
"--我就是太阳--","保密","无IP","391766575","5","","10000","5","","钟离说自己和坨子哥五五开,,实际上他和谁比都说自己五五开[doge]"
"ロ不会o做饭ロ","保密","无IP","268612529","6","快把我哥带走","10000","5","5","所以最近米哈游在b站咋变成了日本公司？懂了原神不是国产之光，幻塔才是！[OK]我直接秒懂[脱单doge]这就再去充两单抽钟离四命。"
"于清平","男","无IP","4431932","6","","10000","5","","陀子哥的体型应了那句话,“运动是必要的！”,――咕噜咕噜滚下山真君"
"あてもなく","男","无IP","259073912","6","","10000","5","","玩着玩着就哭了[tv_笑哭][tv_笑哭]可真有你的"
"苍萝卜卜卜","保密","无IP","8019363","6","EveOneCat2","10000","5","","“你还是老样子，偏爱铁匠的很。”,因为他始终记得，你是将他雕琢、赐他光明之人（神）。"
"天上_飞","男","无IP","33357796","6","","10000","5","","／ ￣￣ ＼　 ,|　～　～ \　,|　 　 |        ―――――――――――,\　　 　/ ∠   Odomu, mi muhe sada unu(yuan, ＼　　 イ　 shi ), todo mimi.       /,／　　　\        _        _       _             _,/　|　　　 \ ,|　|　　　 | |"
"植物大战坦克","男","无IP","160918077","5","斯莱特林","10000","5","","钟离：昆兄,派蒙：小昆[doge]"
"名称已满","保密","无IP","447310133","5","","10000","5","","我愿称之为最强剧情PV（目前），应该没有人反对吧[抠鼻]"
"正义天启哥","男","无IP","434177818","6","","10000","5","","我懂了，诺艾尔邀约任务里说书人的话有自己瞎编的成分，暗示钟离传说任务pv里说的有些也是他瞎编的[热词系列_知识增加][热词系列_妙啊]"
"月尽星稀","保密","无IP","352037175","6","","10000","5","9","钟离出个皮肤吧，魔神战争时期的神装好戳我！"
"V泉水gloria","保密","无IP","435814849","5","","10000","5","","说来你可能不信，我看这个看的心脏痛[呆]"
"收破烂的小缘结神","女","无IP","10026687","6","#EveOneCat","10000","5","23","求一个pv尘世闲游的变奏！！mhy你不要不识好歹[脱单doge]"
"99999羽","女","无IP","454530907","5","","10000","5","","离宝不愧是你，应急食品都那么大只[doge]"
"长为云中客","男","无IP","661202656","5","崩坏：星穹铁道","10000","5","8","让我猜猜，盐神、若坨后面会是归终吗？[嗑瓜子]"
"-豚豚-","男","无IP","179069913","6","梦100","10000","5","","第一"
"_声息","女","河北","289072420","5","","10000","5","","能不能等到若陀龙王化人形实装的那一天[保卫萝卜_哭哭][保卫萝卜_哭哭][保卫萝卜_哭哭][保卫萝卜_哭哭][保卫萝卜_哭哭]"
"方浼","保密","湖南","2124542517","4","","10000","5","","这个剧情里面说钟离说自己已经不是岩之神了，若陀龙王说他能感受的到。有没有一种可能钟离通过给自己办葬礼把岩神位置给卸下来，只有岩神神座却没有岩神了。然后后面若陀龙王复活获得岩元素完整的力量。感觉岩系在提瓦特世界没那么简单，毕竟可以吸收除草元素风元素其他四种元素能量。若陀龙王后面绝对有剧情。"
"三丝腊肠炒米粉","保密","广东","13533575","6","","10000","5","","这种水平的剧情还会有吗[2233娘_委屈]"
"南有令泱丶","男","贵州","5077691","6","","10000","5","","神装岩系不沾地，我叫钟离别忘记。[脱单doge]"
"一天一天dayyy","男","河北","316576354","5","巅峰荣耀","10000","5","","“我们曾同行于巍岩之间”"
"青枫皓月眸若晨星","男","海南","20319114","6","","10000","5","","帝君的兜帽皮肤真想要啊啊啊啊啊"
"梦希娅","保密","广东","93077329","5","","10000","5","","个人觉得，哪个国家的游戏（动漫）就要用哪个国家的语言，这样才正宗，也不会觉得怪怪的"
"巷中の食米B","女","安徽","23178703","6","","10000","5","","pv设计的好巧妙，真的绝了"
"诺尔坦","男","黑龙江","109310354","6","","10000","5","","田铁嘴和钟离一人两句像对话似的"
"邀月就要月","保密","河南","1677706365","5","","10000","5","","帝君声音，真优雅啊"
"特佩斯年幼末裔的骑士","保密","陕西","9445664","6","拳皇","10000","5","","3.3坨子哥还是没进卡池_(:з」∠)_"
"wsad4073","保密","湖北","35986280","6","","10000","5","","奥罗巴斯钻地缝，找到了渊下宫和日月前事。,摩拉克斯钻地缝，找到了一个元素龙王。"
"摩拉几克斯","男","山东","517291621","5","","10000","5","","今时尽岁到尘埃，盘山与水尽为开。,创龙点金得助力，盘桓遂引雨露来。"
"账号已注销","保密","新疆","1794666512","0","","5000","5","","岩王爷:璃月地下的大多数岩元素生物都没有视千百年来不见天日，若陀便是如此，我应他愿望将他带上地面，我赋予了他看清事物的双眼与他约法三章，我应允他与地上的人共生，但若有一日他破坏了秩序就要再度被封入黑暗，说书人说创龙，岩王爷说点睛"
"劝我早归家mm","保密","美国","397433648","5","","10000","5","","超，做完任务进这个pv，直接被bgm和彭导声音干哭了，再来看一遍，md"
"亭潼","保密","湖北","320325879","5","","10000","5","10","呜呜呜呜这个PV的背景音乐是我最喜欢的，开头的一段有种恢弘大气又悲怆的感觉"
"o7_1o","男","湖北","647938231","5","刺客伍六七","10000","5","","帝君终于出了！！！！小保底七十多发歪了大保底又八十一发才出[笑哭][笑哭][笑哭]肝得我心痛，最后还是续了小月卡[原神_喝茶],以后每天在璃月港听书人那里下线！"
"冬哒冬哒","女","四川","353154783","5","","10000","5","","只愿荡涤四方，护得浮世一隅。"
"风之恋符","男","无IP","333160586","5","","10000","5","","你应称之为宿命，若陀龙王[doge][doge]"
"-庄颜","保密","无IP","75622824","6","","10000","5","","钟离什么时候出个这个皮肤啊，好帅啊啊啊"
"究极跳坑人","保密","无IP","501459266","5","","10000","5","","跟我一起喊：若陀实装gkd！"
"时山雨","女","无IP","96470939","6","","10000","5","","若陀，你什么时候实装啊[大哭]"
"闪光的秸秆","男","无IP","2513383","6","","10000","5","","玩了这么久第一次想起来看《创龙点睛》PV的其他语言版本，没想到英语版本和《说书人》一样本地化创作――不论是文本还是配音都非常优秀"
"Kurlve","男","无IP","479026600","5","","10000","6","","胖陀祝我复刻小保底不歪[保佑]"
"可爱的申鹤","女","无IP","474706593","5","","10000","6","","可莉今天去璃月玩，碰见了奇怪的大蜥蜴[藏狐]然后被可莉削了"
"超高校级的lsp","男","无IP","470599872","5","","10000","6","","诶呦。。。。。坨子哥我的坨子哥。。。。。。。可不可以有个人形呀。。。。。"
"钟不离真君","女","湖南","15633613","6","","10000","6","","帝君的声音也变成了恢宏大气的音乐"
"PeterFuZz","男","广东","162825253","6","","10000","6","","这音乐依旧神，做任务的时候尘世闲游变奏直接鸡皮疙瘩起"
"沐风Live","男","四川","348486486","6","","10000","6","","这个名片很喜欢，用了很久了。"
"永远喜g爱莉希雅","保密","北京","226765136","6","","10000","6","","陀子哥不进池是我玩原神最大的遗憾呜呜呜呜呜"
"阿克默","男","无IP","99910","6","原神","10000","6","6","帝君晚安，又是帝君带来安全感的一天[嘟嘟]"
"MiAmore_Cadanza","保密","无IP","290694128","5","","10000","6","","特意回来看扇子"
"夜行观览车539号","保密","无IP","1715083","6","拉文克劳","10000","6","","把我的老石还给我！！！！！"
"王湾湾","保密","无IP","13795312","6","","10000","6","6","给我出若陀啊！！！！！！！！[酸了][酸了][酸了]"
"足立00","保密","无IP","283420932","5","","10000","6","","每日一遍，坚定信念，陀子哥你快来吧等你来了我氪648也要把摩拉克斯抽出来"
"dixfre-","保密","无IP","7824629","6","","10000","6","","""我们曾同行于巍岩之间。"""
"光明骑士崛起","保密","无IP","269810174","6","崩坏3・天穹流星","10000","8","13","有小丑出没，大家默默举报，别理它[歪嘴]"
"云游碧水东","女","无IP","382434347","5","","10000","8","","https://www.bilibili.com/read/cv11205572 直接闪现开团[吃瓜]"
"斯文的放荡","男","无IP","23987699","6","地中海","10000","8","","米哈游，不要无脑要用数据堆强度拉流水了好吗，想不出好的技能可以参考下恐怖黎明这款游戏的技能搭配，无脑拉数据强度来提高流水能力dnf就是你的前车之鉴，希望你不要不识抬举[doge]"
"Hau-hau-","男","无IP","14357071","6","","10000","9","","冲崩三的逆天们，别恶心到这边来哈[傲娇]"
"bili_10694734","保密","无IP","10694734","6","RNG战队","10000","9","","pv真不错，搭配听书人，完美,但刚卸了崩坏3的我有点怕了，以前你的每个新角色我都会强抽，哪怕是大保底，但现在不敢投入那么多了，不光是金钱，感情也不敢投入太多了,原神最近很好，不管是内容还是运营，但跟米哈游打交道快三年了，时而惊艳时而恶心的操作有些折腾人。,最后希望原神的运营能永远像现在这样岁月静好，希望所有玩家都能在游戏里收获快乐，在现实里收获成功"
"超高校级的lsp","男","无IP","470599872","5","","10000","9","","米桑。2.7如果开层岩的话能出个若陀的人型吗。不求进池子了"
"麻烦事可真多","女","无IP","496200873","5","","10000","16","","求官方别作死搞成崩崩崩现在那样,现在以经开始怕原神的末来了。"
"hsupright10","保密","无IP","403931422","5","hanser","10000","6","","奇异的怪石头算病句吧"
"辽声","保密","无IP","7364800","6","","10000","6","","虽然很喜欢若陀但只有剧情互动就行了[无语]老爷子有我就够了"
"黎相","保密","无IP","166289548","5","","10000","6","","怎么听都是中文顺耳"
"憨色-","男","无IP","273694633","6","","10000","6","","弹幕跟TM有毛病一样没人在意你出不出"
"法iv","男","无IP","473230293","5","雪未来","10000","6","","其实挺多人都是觉得这个，和平常的游戏有些不同，所以才来玩的，这么搞的话，又被规划到，那些，传统氪金游戏，唉[辣眼睛]"
"派大星在看你","保密","无IP","347691708","5","","10000","6","","看我动态，他们已经开始骂人了[OK]"
"芹g久远","保密","无IP","38444756","6","","10000","6","","原啊，这期深渊难度还有点意思，再接再厉"
"FoolChirus","保密","无IP","420950710","5","","10000","6","","有三个人在比较谁更nb,美工：我会画好看的画面和动画,音乐：我会演奏动听的歌曲,美工：我会给玩家们画老婆,音乐：角色的一些特效音不要我配？,这时配音走了进来,配音：你们在干嘛,众人：比谁更nb,配音：我懂了，我会给老婆和npc配音,这时大家吧眼光转移向了策划,众人：你会干什么，策划,策划沉默了一会儿,策划：我只会恶心玩家，坑玩家的钱,众人：好吧你赢了,[doge]"
"上官子正","保密","无IP","499457717","5","崩坏：星穹铁道","10000","6","","cv10870501,xdm，这里请求支援"
"胤辞","保密","无IP","8351888","6","","10000","6","","唉我真的，过这个剧情任务后真是由衷感受到我对钟离的喜欢又上升了一个层次，最后他站在石碑前感觉他太孤独了想直接次元折跃去陪陪他[跪了]"
"有见过可爱的阿超吗","保密","无IP","268566769","6","EveOneCat2","10000","6","","还是中文的说书带劲啊  别的语音一点感觉都没有[吃瓜]"
"世o末_の魔g","保密","无IP","358176906","6","原神","10000","6","","天动万象山海化形"
"伽弦l","保密","无IP","252499895","5","","10000","6","","画龙点睛？创龙点睛！ 我们千年的文明中到底沉淀了多少未曾被点亮的瑰宝啊"
"这位更是这位这位","男","无IP","252957431","5","","10000","5","","那会做任务本来以为要结束了，然后甩了这个PV出来真的非常震撼"
"一大只的懵逼","女","无IP","49860922","6","","10000","5","","我又来辣!!!年度报告重复观看最多的视频!!不愧我当年当音乐单曲循环[OK]帝君讲故事的声音太好听了我能听一年!"
"Spercell-GG","保密","无IP","62920738","5","","10000","5","","坨子哥不丑好吧[大哭]"
"浮世一隅","保密","无IP","7646798","6","","10000","5","","知君仙骨无寒暑，千载相逢犹旦暮"
"哇居然从来没中过奖","保密","无IP","355592178","5","","10000","5","","陀子哥啥时候进池子[大哭]"
"66枚硬","男","无IP","454933675","5","","10000","5","","惹陀快进卡池，米哈游不要不知好歹，要不然我跪下求你[脱单doge]"
"米格防冻液","女","无IP","354544320","6","少女前线","10000","5","","金石迸碎荡尘埃，磐石纡水尽为开。,创龙点睛得助力，盘桓遂引雨露来！"
"玉山之将倾","保密","无IP","527245192","5","","10000","5","","知君仙骨无寒暑。千载相逢犹旦暮。故将别语恼佳人，要看梨花枝上雨。"
"卿卿符华","保密","无IP","248562036","6","时光代理人","10000","5","","“若有缘必会再见”，米忽悠你告诉我这是不是有出的希望，我要看层岩和若陀人形自机一起上线[大哭][大哭][大哭]"
"绫华酱的女朋友","保密","江苏","16037459","5","EveOneCat2","10000","5","","米哈游我求你出陀子哥自机 求求你啦求求你啦.gif"
"ajaikk","保密","河北","1834101395","5","","10000","5","","英配杀疯了[原神_哇][原神_哇][原神_哇]"
"灯火岚","女","陕西","395163059","5","梦塔・雪谜城","10000","5","","好像要陀子哥呀，快让他进卡池[大哭]"
"达拉崩吧大地瓜","男","山东","354822547","6","快把我哥带走","10000","5","","交响乐版的听书人。太绝了，奈何播放量一直上不去[辣眼睛]"
"可爱但是不多真君","女","重庆","33401403","6","","10000","5","","若陀快进池子吧！"
"数学是精神折磨吧","保密","河南","1325305492","4","","10000","5","","3.0钟离不歪，玩到关服！！！"
"Dhdyo","保密","无IP","47607078","6","","10000","5","","我的老石！！！必须还回来！！！！！"
"钟离の爱犬","保密","无IP","593848202","5","国民老公带回家","10000","5","","好想让若陀进卡池啊[保卫萝卜_哇]进必抽"
"laoG0051","女","无IP","344840444","6","","10000","5","","实装啊陀子哥，弥补一下我抽雾切歪无公的痛(Д｀)"
"千姬姐姐","保密","无IP","385751041","6","","10000","5","","能不能出个帝君的皮肤，就这个这个视频里这种[呲牙]"
"ArSpiritual","保密","无IP","3743617","6","","10000","5","","@英配真的很超神，我^了一年回砘匚读"
"后后猴吼吼吼","保密","无IP","4836351","6","","10000","5","","pv里的钉子绝对和砣子有关"
"路过的偷税犯","保密","无IP","526123313","5","","10000","5","","个人看法：目前坨子哥已经可以说是岩龙王了，风龙王疑似彻底发育或者正常发育的特瓦林（二者均为位列于各自顶点的元素创生物）水龙王未知但疑似心海剩下的未知"
"任青涯","男","无IP","15643197","6","","10000","5","","若陀人形进池子！！！"
"再来根烟呀","保密","无IP","19939692","6","巅峰荣耀","10000","5","","我爱中配那味儿，结果英配的沉重感一下把我镇住了，好家伙，好重一股传说味，不但有当年被支配恐惧，还有看史诗大片的惊艳…………日韩……有点烫啊，语言太快反而没有那股浓缩历史的沉淀感，韩配帝君还行，就是吃了语言的亏[原神_喝茶]"
"乔莼vivian","女","无IP","12174596","6","","10000","5","","千载相逢犹旦暮啊！我从1.5之后的每个调查问卷写得都是“希望若陀能自机”，现在渊下宫资料一出感觉希望更渺茫了，但是只要万一呢"
"年糕亲","保密","无IP","284956576","5","","10000","4","","今天依旧是等若陀进卡池的一天[原神_喝茶]"
"小闫同学知足常乐","男","无IP","310713701","5","","10000","4","","为了岩王帝君[打call][打call][打call]"
"这位更是这位这位","男","无IP","252957431","5","","10000","4","","若坨好歹也是钟离的战友，亲生封印若坨对于钟离来说非常地痛苦"
"双木权","保密","无IP","438849814","5","","10000","4","","这种画风有没有教程[藏狐]"
"重云小姨夫","保密","无IP","178785767","5","三周年恋曲","10000","4","10","若陀进卡池啊！"
"晚上修仙中","保密","无IP","430913509","5","","10000","4","","老岩头没退休还是摩拉克斯的时候应该和钟离的脸不一样，不然为什么剧情里面甘雨认不出"
"月橘蓝","保密","无IP","674182394","4","","10000","4","","草！英配真杀疯了"
"喝着酸奶吃饼干","保密","无IP","37183391","6","","10000","4","","这个bgm是那个[大哭]找不到"
"多足动物恐惧症患者","男","无IP","510639990","5","","10000","4","","诗是挺好的，但翻译组没骂街，也挺意外的[笑哭]"
"--Anima--","女","无IP","472712677","5","","10000","4","","陀哥进池吧求求了[大哭]"
"摩根的狗狗","保密","无IP","123354452","6","","10000","4","5","若陀二阶段音乐是我觉得原神最让我惊喜震撼的音乐[惊喜]"
"九灵gcs","男","无IP","1661717181","5","公主连结凯露","10000","4","","谁听到这个BGM？心情很激动？[微笑][OK]"
"塔奇克马的天空","保密","无IP","4949216","6","","10000","4","","这画面加上配乐太宏伟了"
"自带全自动电梯的男人","保密","无IP","455992149","5","","10000","4","4","出不完七国，陀子哥就得现人形。人设背景样样都有，武器就用岩大剑就行。,毕竟“若有缘，他日必将再会。”"
"箐葙子","女","无IP","351985231","5","","10000","4","","天动万象，山海化形。,荒地生星，灿如烈阳。"
"A8S2","保密","无IP","691515009","3","","10000","4","","下次还填非常简单[傲娇]（指被龙王团灭5次[无语]）"
"爷的瓜呢","保密","无IP","220319344","6","","10000","4","","怎么那么多人在等若陀啊，啊我也是？那没事了[傲娇]"
"想暴富不想上班","保密","无IP","11749128","6","","10000","4","","欲买桂花同载酒，只可惜故人已经变成了周本"
"龙王不进池子我不改名","男","无IP","473992170","5","","10000","4","","《等若陀》"
"吃竹子的企鹅","保密","无IP","43802125","5","","10000","4","","钟离，我命运般的老婆"
"机智の汤圆","保密","无IP","357228797","6","","10000","4","","我亲爱的原神，龙王本bgm歌词发一下呗"
"Roscid_Yii","保密","无IP","107787147","6","","10000","4","","钟离的视频，台词也好，文案功底、美术音乐，越看越有韵味[脱单doge]"
"阿长反而的","保密","无IP","85796326","6","原神","10000","4","11","田铁嘴的声优太强了吧"
"Trifecta_","保密","无IP","21053977","6","","10000","4","","今日满好感，可以说我玩原神的目的已经完成了哈哈哈。这个pv我好爱，就算以后不玩了也会经常重温[脱单doge][给心心]"
"箔晃","女","无IP","324583002","6","","10000","4","","若陀什么时候进池子!!!![大哭]"
"wenliaia","女","无IP","26585339","6","精灵王","10000","4","","下次钟离复刻会是什么时候啊，新手上来就错过了呜呜呜[大哭]，我只想要钟离"
"嘻嘻嘻点灯","男","无IP","505988807","5","","10000","4","","帝君皮肤出来我氪爆"
"skyblue天蓝色","保密","无IP","691496209","5","","10000","4","","日常求陀哥自机！岩5星！出必氪~MHY快来赚钱阿阿阿~~~~"
"拳头大大大","保密","无IP","169643859","5","公主连结佩可莉姆","10000","4","","大大们，有没有创龙点睛的bgm呀！！！！！！[doge][doge][doge][doge]"
