"昵称","性别","IP","UID","等级","装扮","用户权重","获赞数","粉丝团等级","评论"
"哈尼会发光","男","无IP","231260944","6","","10000","1","","五星岩系大剑，mhy你不要不识抬举，若陀一出，648大大滴有"
"出包王女有生之年系列","男","无IP","512556427","6","还有醒着的么","10000","1","14","原宝今天因为是劳动节吗，你涨了1w多粉[doge]"
"这个名字有人吗","女","无IP","10029660","6","雪未来","10000","1","6","朋友们，我池子垫了78发了，小保底快出来了，有必要抽一命钟离嘛，还是说给下面的角色？好纠结。。。"
"绝望圣约","保密","无IP","91803357","6","","10000","1","","氪了个648出了，特来抱怨"
"KIKI哭哭KIKI","保密","无IP","451162950","5","","10000","1","","为什么我的钟离是风系的呀[tv_晕]"
"一莲超人","保密","无IP","50711958","6","","10000","1","","韩语翻译交白卷？？？？"
"风前之尘i","男","无IP","63239121","5","","10000","1","","小保底歪琴了 唯一还算好的就是烟绯也出来了 不然真吐了"
"奋斗-无悔","保密","无IP","398331065","5","","10000","1","8","70抽4金，一命钟离，2把武器天空之脊和新法器，这下钟离和烟绯都有看的过去的东西了，爽[捂眼]"
"w","保密","无IP","85444227","6","","10000","1","","我抽烟绯已经出四只dio娜一个女仆还有好几把武器了啊[笑哭]"
"住在珈百璃家的狂三","保密","无IP","385672574","6","良辰美景・不问天","10000","1","","我要古闻第三章"
"Fun氵","男","无IP","104864167","6","阴阳师・平安物语","10000","1","","帝君已歪，前来还怨"
"辽声","保密","无IP","7364800","6","","10000","1","","太棒了，英配真的好棒"
"ロリ好き","保密","无IP","212014886","6","","10000","1","","请问...保底是几十抽啊..我无氪萌新差不多抽了80次还是没出金..我 快 裂 开 了"
"伴风p舞","保密","无IP","40010238","6","星尘","10000","1","","希望下个版本的家园能放更多东西qwq"
"Apotheosis丶","男","无IP","4377932","6","","10000","1","","有钟离兜帽形态的皮肤没有啊[大哭][大哭][大哭][大哭]"
"我脸接大招","男","无IP","243389840","6","","10000","1","10","龙王二阶段音乐gkd"
"巫的潘妮桑","保密","无IP","7626007","6","","10000","1","10","这次英配真是神了，颇有中土史诗的味"
"下辈子转生做麒麟","保密","无IP","522495005","5","","10000","1","","标签能试着换换吗？那个日系风总被那些认为原神卖文化的人死咬着不放[无语]"
"路人不留名emm","保密","无IP","548142917","3","","10000","1","","翻译退出群聊"
"SoraChan-","男","无IP","22880410","6","-阿库娅","10000","1","","85抽出的钟离 怎么敢的啊"
"变成电棍守护嘉然小姐","男","无IP","351569146","5","公主连结佩可莉姆","10000","1","","把新活动bug修复一下啊"
"账号已注销","保密","无IP","27366019","0","罗小黑战记","5000","1","","奔腾千里荡尘埃，渡水登山紫雾开。 掣断丝缰摇玉辔，火龙飞下九天来。化用得很棒！[OK]"
"折涓","保密","无IP","351667365","6","EveOneCat2","10000","1","","创，，，"
"小骑-麟心","男","无IP","348640070","5","","10000","1","","钟离已歪BV1aB4y1c7fe"
"你怎么睡的着哒","男","无IP","33142372","5","","10000","1","","五一yyds！！一号换的五发直接一个刻师傅一个钟离，常驻池出了绿枪（保底）,我两个室友不服气，然后都特么昨天刚出钟离今天一命[笑哭]"
"坡倪Pony","保密","无IP","205359242","6","EveOneCat2","10000","1","","“倘若天下无神，这里便是人的国度”,“我曾是人的神，理应见证人的兴衰”,温迪：所以别喷我摸鱼了⑧[doge]"
"没头发浪子","保密","无IP","40716490","6","横扫全场","10000","1","","果然像陀螺[doge]"
"顾鸽","男","无IP","15349905","6","碧蓝航线","10000","1","","我今天就要看看这外服怎么翻译的"
"柠九家的柠檬酸","保密","无IP","226197585","5","不思议之旅","10000","1","","我淦昨天看钟离剧情把我看哭了"
"星辰大海螺","保密","无IP","354488204","6","原神","10000","1","","100万冲！[打call]"
"Vactorian","保密","无IP","344828797","6","明日方舟","10000","1","","这种剧情PV能不能和那本《风，勇气与翅膀 》一样放在游戏里啊"
"非法字字符","保密","无IP","6070780","6","#EveOneCat","10000","1","","永生的代价[原神_哭哭]"
"打瞌睡的Beam","保密","无IP","271155363","5","","10000","1","","嗯，问一下，下一个武器池会有可能有贯虹吗？好想要～[惊喜]"
"艾米娜米","保密","无IP","40047703","6","","10000","1","","这个活动我没钟离的时候2200分，抽到拉满之后能打到6000分[跪了]"
"寥寥若晨星","保密","无IP","37494370","6","","10000","1","","陀子哥落地[原神_期待][原神_期待][原神_期待]"
"是孤独又温柔的人呀","保密","无IP","168197980","5","","10000","1","","有没有人跟我一样，那个新活动好像有bug？就是那个扭曲幽域，第一没法多人组队，连选项都没有。第二，奖励明明写的是累计积分获得，但是实际上确实最高积分，我都打了几把了积分也没有累计，而且就算把所有选项完也达不到两万分。我就想问问，是我没搞懂这活动还是都是这样？"
"洗衣基","男","无IP","179085436","5","","10000","1","","垃圾游戏，爪巴"
"泠晦","男","无IP","347499131","5","泠鸢yousa登门喜鹊","10000","1","","坨子哥好浪漫啊一半只记得恨他，一半只记得爱他。"
"彩符密码48","保密","无IP","303258112","3","","10000","1","","你跌都屏蔽了，怎么天天给你跌推送广告真晦气"
"皮皮喵我们走","保密","无IP","182352315","5","","10000","1","","亲爱的原神: md这次活动怎么这么难, 是人打的吗"
"坏尸","保密","无IP","6660528","6","","10000","1","","《龙》[doge]"
"未名时青","男","无IP","391554819","5","","10000","1","5","这美工剧情，去拍电影吧[]"
"星途绘梦","男","无IP","420986778","5","","10000","1","","没错，我又卡了[大哭][大哭][大哭]"
"花与鸟与爱之诗","保密","无IP","176427313","6","泠鸢yousa登门喜鹊","10000","1","","若坨龙王bgm第二段歌词什么时候放一下"
"我且问你","男","无IP","87181677","6","","10000","1","","这次的圆盘比无相交响诗好玩[吃瓜]"
"一颗坍缩星","男","无IP","29190259","6","","10000","1","","原宝快出帝君神装皮啊啊啊啊啊啊！"
"长叹息掩涕兮","女","无IP","5804798","6","橘猫挂件","10000","1","","若陀龙王的剧情真的给我整哭了[大哭]"
"夜の影深Y","保密","无IP","355279119","6","","10000","1","4","歪了个刻晴，二命了[微笑]"
"辞晏捏","女","无IP","438289811","5","","10000","1","","hi！老公！"
"沥风","保密","无IP","179312416","5","","10000","1","","太短了，摩多摩多.jpg"
"萝卜159357","保密","无IP","695619969","5","","10000","1","","韩语笑死"
"荆棘之槐","女","无IP","347115521","5","","10000","1","","十连三个烟绯的我算非还是欧[捂脸]"
"桉的四叶草","保密","无IP","431062624","5","","10000","1","10","韩版遭老头空耳我已经搞了，祝你听的愉快[笑哭]"
"L^-^|","男","无IP","164665321","6","","10000","1","11","坨子哥不进卡池吗？"
"我是格蕾修的狗啊","保密","无IP","470983595","4","","10000","1","","每次小保底都歪，平均80抽才出货，已经充了4000多，这次又歪卢姥爷，我真的撑不住了，再见。"
"雾悠悠悠悠","女","无IP","480573822","5","","10000","1","","已出钟离，前来还愿[doge][OK]"
"非法字字符","保密","无IP","6070780","6","#EveOneCat","10000","1","","这次的剧情打完龙王就一直在哭[原神_哭哭][原神_哭哭][原神_哭哭]原神你做的好啊！"
"robinbia","保密","无IP","481060442","2","","10000","1","","中配一直没让人失望"
"御坂02033号","男","无IP","411489810","5","明日方舟-愚夜密函","10000","1","","听书人PV里中配那个大叔有凳子了[笑哭]，不过英日韩还没加"
"伯牙舞爪","保密","无IP","312813720","4","","10000","1","","磐石生星，灿烈若阳"
"蕞微小人","保密","无IP","503731866","5","","10000","1","","求，bgm太棒了，打算单曲循环[鼓掌]"
"やとがみとおかあ","保密","无IP","401408504","5","","10000","1","","这次英配好厉害"
"四代吃瓜鹿人","保密","无IP","475877801","5","","10000","1","","若陀龙王也太好看了吧"
"昵称好难取啊---","保密","无IP","487454604","5","","10000","1","","帝君已出，一发入魂，前来还愿"
"式与织_","保密","无IP","126116016","6","公主连结佩可莉姆","10000","1","","英配杀疯了"
"左手布右手剪","保密","无IP","32481270","5","","10000","1","","@原神 什么时候搞个躲猫猫模式"
"无色辉火-","女","无IP","358592891","6","","10000","1","","歪了莫娜 呜呜呜"
"子米花拉","保密","无IP","898634","4","","10000","1","","在钟离的任务里出现了比钟离还帅的男人是怎么想的[doge]"
"曾志春","保密","无IP","25251953","6","2233幻星集","10000","1","","这个说书人说的不错，味太足了"
"夜之o","男","无IP","229521492","6","","10000","1","","出个仙侠风的女角色呗，我想玩这样的人物[吃瓜]"
"625号实验体","男","无IP","352560741","5","崩坏：星穹铁道","10000","1","4","钟离在璃月人心中的地位真的好高"
"咸鱼最初","男","无IP","29187352","6","初音未来13周年","10000","1","1","金石迸碎荡尘埃，磐山@水尽为开,创龙点睛得助力，盘桓遂引雨露来"
"白给-king","男","无IP","343559759","5","","10000","1","2","哇哇哇，这个英配感觉像是在看功夫熊猫[热词系列_妙啊][热词系列_妙啊][热词系列_妙啊]"
"七号-浪影","男","无IP","455561564","5","异常生物","10000","1","","十一发，已出钟离[吃瓜]"
"奥托的狗","保密","无IP","33731630","5","原神","10000","1","9","呜呜呜呜哭死我了，这次的传说任务好让人难过"
"啊伊","男","无IP","52401","6","","10000","1","","为什么我的钟离不会磁悬浮？"
"沉默空白_","保密","无IP","177769639","5","","10000","1","","“这无故的攀比之心，从何而来啊？”――――指在别的配音里面说自己喜欢的最好"
"明日之ss","保密","无IP","386370591","5","约战：精灵再临","10000","1","","哎，小保底抽到了[笑哭]"
"怀里拥月月","男","无IP","11885737","6","","10000","1","","派蒙：一开始总喊他家伙家伙的，龙王不会记恨吃了我吧！"
"我没到一米六","保密","无IP","3198915","5","","10000","1","","我直接强娶"
"双月错轮","保密","无IP","40897435","5","","10000","1","","如果出若陀龙王的角色一定抽爆"
"百万念心","保密","无IP","36613419","6","中野二乃","10000","1","","英文那一p有字幕没"
"`柒贰d","保密","无IP","451871671","5","崩坏：星穹铁道","10000","1","","上次温迪池刚保底，公子池抽了一次十连，这一次才刚十连两钟离[呲牙]"
"luckybooy","保密","无IP","69688930","5","","10000","1","","我好羡慕你们能玩原神啊！手机太卡了！"
"若者はろくでなしです","男","无IP","3528291","6","","10000","1","","正当我想知道若陀和龙王的关系，这段就插进来了，真棒"
"致灭幻想","保密","无IP","400974581","5","","10000","1","","md！想出烟绯却歪了帝君[大哭]"
"荒野硬核说","保密","无IP","36112371","6","","10000","1","","过剧情录屏了，刚想发到b站，没想到官方发了，草率了[笑哭]"
"d森都","男","无IP","6263564","6","","10000","1","","好家伙，说书人2.0"
"铃铃铃兰-","男","无IP","23159605","6","","10000","1","10","岩元素创生生物：坨子哥,风元素创生生物：温蒂（我记得温蒂说过他是风精灵来着）[doge]"
"求抱抱的武藏亲","保密","无IP","26325875","6","格兰芬多","10000","1","","我的家族世世代代相传着一个有关神龙兄弟都传说"
"万星园","保密","无IP","37715867","6","","10000","1","","说书人：岩王爷创造了若陀,钟离：我不是，我没有"
"白筱-","男","无IP","34778761","6","","10000","1","","迪卢克已出，前来咒怨"
"开车好累","男","无IP","34742932","6","星座系列：水瓶座","10000","1","","外景磐石的小字注释笑死我了哈哈哈哈哈哈哈"
"启明灯勋","男","无IP","22510595","6","","10000","1","","岩元素生物因在地下所以大多不能视，但是钟离是天星，也就是陨石，无论是在天上还是坠在地表都沐浴在阳光下，所以才能看见，是这样理解吗"
"从后来的前方","男","无IP","170567974","6","总之就是非常可爱","10000","1","10","什么时候能增加一下武器原胚的爆率啊，现在55级了，印象中除了任务和解谜的几个原胚，就掉过一次"
"破碎红茶","男","无IP","5107973","6","至尊戒","10000","1","","龙画龙点睛[doge][原神_鸽子][原神_鸽子]"
"心晴_qwq","男","无IP","9441116","6","","10000","1","","一人血书若陀龙王加强，战斗太爽了，好久没有这种爽快感了[OK]还有，战斗BGM太好听了，希望以后能出一个现场演奏的视频，像是最早那个璃月地区战斗音乐现场那个，非常棒"
"Tequila99","男","无IP","341729234","6","","10000","1","","呜呜呜呜呜 好爱这个pv 吹爆1.5"
"饿货来条士力加","保密","无IP","10753360","6","","10000","1","11","[打call]"
"花生小菜鸟","男","无IP","36904513","6","拜年祭粉丝专鼠","10000","1","","有没有和我一样登上去掉帧的啊？电脑端"
"帆鹤丨","男","无IP","332690883","6","","10000","1","","“敌军围困万千重，我自岿然不动”,很适合钟离"
"抽不完的卷纸","男","无IP","32402083","6","","10000","1","","74发歪莫娜然后75发才出的钟离[笑哭]能不能整点阳间的东西"
"绅士大先生","保密","无IP","29149693","6","","10000","1","","「此番创龙乃君臣之义，故友之谊，正是明光一线，烈阳烁目，得此仙骨，尘世可赴。」,――野史话本《璃月今世新说演义 ・ 创龙点睛》,,戏观史，真假莫辨，冷暖善恶自知；,山观人，天地长寿，难改昙华易逝；,友观朋，万世飞电，千载亦犹旦暮。,,CV：,摩拉克斯――彭博,田铁嘴――许棕哲,,《原神》bilibili服下载地址：,https://www.biligame.com/detail/?id=103496,望周知[OK][OK][OK][OK]"
"SybIa_R","男","无IP","293788784","6","","10000","1","","新人想问下，下官服好点还是b服好点"
"没事犯迷糊","保密","无IP","76067858","6","","10000","1","","翻译们：MD，这活我不干了，你们爱找谁找谁[傲娇][傲娇][傲娇]"
"三七Q-Q","女","无IP","490834701","5","","10000","1","","有大佬吗？求英文版翻译啊啊啊啊啊啊，球球了球球了"
"任青涯","男","无IP","15643197","6","","10000","1","","层岩巨渊不安排下若陀龙王的池子嘛？[狗子]"
"暮秋mz","男","无IP","513228849","5","原神","10000","1","","上次公子歪了，这次钟离又歪了[笑哭]，我刚开始两个五星全歪了我有种预感接下来所以up我都会歪，不说了莫娜跑图真的爽[呆][辣眼睛][灵魂出窍][大哭]"
"出包王女有生之年系列","男","无IP","512556427","6","还有醒着的么","10000","1","14","....嘿嘿，希望坨子哥进卡池ˉ辍ニ岩[热词系列_知识增加]"
"洛云_Iris","男","无IP","12892378","6","罗小黑战记","10000","1","","这次剧情真的是太棒了"
"boundary6","男","无IP","25983964","5","","10000","1","","英语好啊，这个游戏从头到尾我都是英配，好听还听得懂"
"林知恩saki","女","无IP","62208935","6","","10000","1","","真的非常期待之后关于归终的剧情[酸了][酸了]"
"取舍啊","女","无IP","362479353","5","","10000","1","","若陀实装"
"作品35","男","无IP","1846212","5","","10000","1","","田铁嘴yyds"
"花里实乃理一款大狗狗","男","无IP","473913303","5","","10000","1","","强请帝君，回来干翻原神，未定永存"
"与芙共枕眠","保密","无IP","271509469","6","","10000","1","","“这无故的攀比之心，从何而来啊？”帝君，您这话令我深深的受益！所以，这次小保底还是歪了，但我看开了，别人都拥有你我就得必须拥有你吗？是我错了，我不该和别人攀比，谢谢你送了个女儿七七给我，七七很可爱！我还能给她找个妈，也是冰属性的！谢谢"
"balance1lcsz","保密","无IP","13199647","4","","10000","1","","你就告诉我这皮肤啥时候出！"
"夏叶的思念","男","无IP","51890814","6","原神","10000","1","","这次传说任务做的太棒了"
"-深刻-","保密","无IP","76143157","6","2020拜年祭（鼠）","10000","1","","我手拿两把长剑 从蒙德砍到璃月 所过之处 寸木不剩[doge]"
"DarkLZ_","男","无IP","12250146","6","","10000","1","","放别的pv把字幕加上呗，为什么一直不放字幕啊这。"
"鸽子与熊","保密","无IP","417291077","5","","10000","1","","给我吹爆剧情好吗！！！爷已经爱上这个男人了"
"鸽子与熊","保密","无IP","417291077","5","","10000","1","","mhy把岩王给我从屏幕里摘出来！！！[大哭][大哭][大哭]"
"泛滥的呱","男","无IP","106714178","6","星座系列：摩羯座","10000","1","","我：打开原神，打开池子，纠缠之缘x10一一啪！的一下直接金光，好莫娜1命了。[],然后我把剩下的40发抽完再加3发单抽才出了钟离老爷"
"憋说-摆","保密","无IP","386155697","5","","10000","1","","众所周知七神身边都有一条龙，五爪金龙gkd[doge]"
"肆一一o神","女","无IP","15699632","6","原神","10000","1","8","我听你的，帝君[脱单doge]"
"哈哈大王的肉肉同学","保密","无IP","100380794","5","原神","10000","1","","龙王的bgm太TM强了，爱死你了我的原神！"
"是邱邱酱","保密","无IP","266225096","5","","10000","1","","呜呜呜好想让坨子哥进卡池"
"优库莉伍德-海尔赛兹","男","无IP","60374326","5","","10000","1","","这次剧情做的可以，鸡厂一个日本公司对中国文化这么了解，肯定是做足了功课吧"
"倒错人","保密","无IP","3982911","6","","10000","1","","得到帝君了[羞羞][羞羞]"
"浓缩果蔬汁","保密","无IP","11372925","6","","10000","1","","般配[妙啊]"
"这下梁木了","男","无IP","124124133","6","EveOneCat2","10000","1","","英配的说书先生杀疯了"
"无声的火花","保密","无IP","408183078","5","","10000","1","","英配杀疯了.."
"去沙县整点蒸饺","男","无IP","19172438","6","","10000","1","7","太棒了这个pv"
"人类的力量是有极限的","男","无IP","20215340","5","","10000","1","7","陀子哥快落地啊！"
"哆啦丨え梦","男","无IP","30583465","6","","10000","1","","英配太有感觉了，跟功夫熊猫一样[doge]"
"柏木-凛","保密","无IP","355212217","5","","10000","1","","英配给我一种看功夫熊猫的感觉"
"冰钩钩果汁","女","无IP","37475553","6","","10000","1","","剧情里坨子哥声音真的巨好听[大哭]不进卡池可惜了 拜托以后让他进卡池吧"
"L空花人","男","无IP","29129550","5","橘猫挂件","10000","1","","这就比较能体现出中文的优势了：音节少，言简意赅。按原意翻译成日文之后音节太多了，导致听起来说话比较着急，念诗也没有感觉。"
"恭喜08","男","无IP","354478208","6","","10000","1","","这翻译好牛"
"Muye-丹枫","保密","无IP","109429308","5","","10000","1","","40发没出，我同学2发10连出2 个[酸了][酸了]"
"智乃哥哥","保密","无IP","88228048","6","原神","10000","1","7","英配鲨疯了"
"Fantastic空想","保密","无IP","5750934","6","初音未来13周年","10000","1","","钟离80了没突破 有必要拉到90么"
"此翌时","保密","无IP","25300343","6","崩坏：星穹铁道","10000","1","","他灿若烈阳，赋予了力量强大但目不能视的地龙以双目，然而时间却让地龙的部分仇视甚至诋毁他，真是可悲可叹，懂得都懂。"
"落镶蓝","保密","无IP","76991585","5","","10000","1","","有没有英文版全文……对照着看简直奇妙无穷"
"嗯嗯嗯l没错l你说的对","女","无IP","31724521","6","","10000","1","","我想玩原魔。。。"
"执法大仙张芬芳z","男","无IP","439674249","5","","10000","1","","道理我都懂，可是为什么平姥姥可以闭着嘴说话"
"雪羽花辞镜","男","无IP","436747077","5","公主连结佩可莉姆","10000","1","","说书人什么时候up[doge][doge][doge]"
"天堂春","保密","无IP","35381143","6","-阿库娅","10000","1","5","150发一个77一个钟离，5个烟绯，没出dio娜，一堆女仆[大哭]"
"DRMORY","女","无IP","15358850","6","原神","10000","1","","这个配乐真的真的太太太强了，太震撼了，鸡皮疙瘩起来了！！！想起了熄星的pv！官方如果能上传熄星的pv的话就好了[原神_干杯]"
"雾雨花散里","女","无IP","848731","6","","10000","1","","陀子哥自机，mhy不要不识好歹[doge]"
"断剑丛云","保密","无IP","6783595","6","","10000","1","","七国是要凑七神加七龙吗"
"渊M","男","无IP","24029383","6","希萝Hiiro","10000","1","","我在想到时候七个国家全开了新手就有的肝了[doge]"
"账号已注销","保密","无IP","53305482","0","白蛇2：青蛇劫起","5000","1","","开始我以为他俩就是敌对关系，结果这剧情谈不上泪目，但也看的很惆怅。"
"Xiao_an_awa","男","无IP","431094160","6","","10000","1","11","钟离已歪，前来还怨[tv_流泪][tv_流泪]"
"小骑-麟心","男","无IP","348640070","5","","10000","1","","BV1ZK4y1o7EK"
"_moxi_","保密","无IP","74364940","6","原神","10000","1","","金石迸碎荡尘埃，磐山纡水尽为开。创龙点睛得助力，盘桓遂引雨露来。"
"南iK1","男","无IP","508155889","5","","10000","1","","感谢帝君从肥坨jio下救我苟命[笑哭]"
"雀翎v","保密","无IP","407020007","5","","10000","1","","这配乐在中配上简直绝了"
"樱岛麻衣sama","女","无IP","9965854","6","碧蓝航线","10000","1","","米哈游的音乐美术真的NB[脱单doge]"
"nm-mn","保密","无IP","410957750","5","","10000","1","10","其实钟离，和说书的人，他们是各说各的故事，钟离的是真，说书人的是伪[热词系列_知识增加]"
"宕机言论","保密","无IP","503212213","5","","10000","1","10","岩龙守护"
"Xgnehz啸可可丶","保密","无IP","5589579","6","异常生物","10000","1","","万人血书求两个版本的bgm！"
"休与月眠","女","无IP","125101312","6","崩坏：星穹铁道","10000","1","","这作画配上这个bgm，简直一绝"
"\色貘f","保密","无IP","32121636","6","","10000","1","","原宝让坨子哥进池子吧 岩大剑秋梨膏[大哭]"
"勿忘夕雨","保密","无IP","76308616","6","","10000","1","","这个OST还是很棒的"
"添柴_official","保密","无IP","23445297","6","","10000","1","","韬玉之石，可明八荒。,灿若天星，纵横无双。,天动万象，山海化形。,荒地生星，璨若烈阳。,皎月落枝，南天龙吟。,灿阳一瞬，不动岩心。"
"游手好闲的矿工钟离","男","无IP","306835493","5","","10000","1","","歪了刻晴[辣眼睛]"
"泡泡面要垫书","女","无IP","406245343","5","","10000","1","","中配杀疯了"
"姬彦宿","保密","无IP","23654686","6","","10000","1","","做任务看到这个我都想哭了[笑哭]"
"莱因哈特_罗严克拉姆","女","无IP","28337308","6","","10000","1","","我真的很喜欢钟离"
"GreenSpace","保密","无IP","6915553","6","","10000","1","12","好诗好诗[打call][打call]"
"去沙县整点蒸饺","男","无IP","19172438","6","","10000","1","7","中英质量真高，有内味了"
"齐之文","女","无IP","13877978","6","","10000","1","","钟离这次的传说任务我吹爆"
"苏家小萌新","男","无IP","14702108","6","原神","10000","1","","日版的说书人感觉没有哪个味[doge]"
"时间领主dalk","保密","无IP","44810523","5","","10000","1","","再歪莫娜就退游，破游戏，心心念念想钟离想的睡不着再给我歪咯"
"隔壁过来的","男","无IP","1909622","6","","10000","1","","@原神  出来修bug啊！ps4版好多bug！"
"秋水墨凉つ","保密","无IP","7034966","6","","10000","1","","为什么没人关注帝君神装是阔腿裤（）"
"酸萝卜真好吃","保密","无IP","8866484","5","","10000","1","","比起说书人的吹吹吹，钟离说的事实更美好。话说帝君到底有几个故人啊？"
"ONEking1028","男","无IP","71601170","6","","10000","1","","十连发 莫出悲 又见黄 爷爱离[doge]"
"炸团了哈哈哈","男","无IP","38052060","6","","10000","1","","帝君审美真差，雕了一只肥龙"
"Auroraayato","女","无IP","4369959","6","","10000","1","","做完这个传说任务都不太想去刷坨子哥的周本 感觉很悲伤又很无奈 不忍心再打他了 「假如后面出了很戳我xp的角色需要材料 那么当我放屁[doge]」"
"魈魈_月","保密","无IP","33965296","5","原神","10000","1","","钟离和若陀太虐了[大哭][大哭][大哭]"
"掉地上的一颗原石","男","无IP","504274292","5","","10000","1","","45发路过,。,。,。,。,。,。,。,45发了还没出呢，估计能最近还有活动吗？我怕我等不到小保底[大哭]"
"克莱恩Moretti","保密","无IP","401368766","5","","10000","1","","帝君已歪，前来还怨"
"旋转突进的鲜血魔娘","保密","无IP","9167111","6","","10000","1","","这定场诗太为难翻译了[笑哭]"
