"昵称","性别","IP","UID","等级","装扮","用户权重","获赞数","粉丝团等级","评论"
"曦鹤靡米","保密","无IP","350661293","5","明日方舟音律系列","10000","1","","好耶"
"びんにんhV","男","无IP","432065088","5","","10000","1","","没人说吗？陈老师yyds！"
"{喁沉浮","保密","无IP","521932672","5","","10000","1","","编剧可以看看你吗[微笑]"
"滴滴哒滴滴哒哒2","男","无IP","2039250402","6","","10000","1","","陈老师yyds"
"逆七芒星","保密","无IP","558188114","5","","10000","1","","第一次那么早，我要热评，求求你了[星星眼]"
"这年头起网名真难","保密","无IP","406323486","5","","10000","1","","好耶！"
"Apokolips","保密","无IP","79223973","6","","10000","1","","全体目光向他看齐"
"是胡鸽咯咯","男","无IP","629242866","5","","10000","1","8","[脱单doge]"
"Azrael-小志","男","无IP","438305531","5","","10000","1","","rnm 煞笔公司 加强心海"
"账号已注销","保密","无IP","265240187","0","","5000","1","","臭铁公鸡[tv_皱眉]"
"啊我想中奖啊","保密","无IP","346943451","5","","10000","1","","等1小时后我再回来看热评[doge][doge]，现在没意思"
"Pardofe1is","女","无IP","374403150","6","hanser","10000","1","11","就爱看这个[脱单doge]"
"由崎つかさの旦那","女","无IP","14462046","6","总之就是非常可爱","10000","1","10","哦哦哦哦哦哦！！！！"
"正在传火的苇名掉色人","男","无IP","31880860","6","","10000","1","",""
"Azrael-小志","男","无IP","438305531","5","","10000","1","","煞笔公司"
"晏__清","保密","无IP","416238103","5","良辰美景・不问天","10000","1","","刚刚[原神_喝茶]"
"小林道生","保密","无IP","29161311","6","","10000","1","","芜湖"
"炭烧鲨鱼火锅","保密","无IP","346770435","5","","10000","1","10","陈致逸老师yyds[Cat_dash]"
"鱼冻是光吖","女","无IP","21131081","5","","10000","1","","刚刚"
"banananananaMace","保密","无IP","399612124","5","","10000","1","","[热词系列_好耶]"
"凑翼kk","男","无IP","393690113","5","","10000","1","","陈老师yyds！"
"沉默是今天滴啥","男","无IP","351330175","6","至尊戒","10000","1","","来了"
"六到飞的翔","男","无IP","86390517","6","","10000","1","","[原神_喝茶][原神_G嘿][原神_嗯][原神_哼][原神_哇][原神_生气]"
"FloppyFlea","女","美国","17472353","6","","10000","1","","这个视频看完出了一身冷汗。作为旁观者尚如此，很难想象视频里的各位老师当时面临着多大压力和沟通不畅。真的很感谢不分国界的音乐与美、感谢各位老师"
"Dormiveglia77","保密","山东","1294455537","5","","10000","1","","两年了对这个制作过程还是很有印象，日本人的沟通hhh真很有趣"
"樱华月葬","男","浙江","356553","6","2021拜年纪活动专属","10000","1","","我不太了解，作曲家都是什么乐器的谱子都会写的吗[笑哭]"
"吾知少年","男","四川","11804369","6","","10000","1","","参加音乐制作的所有人情商都好高啊"
"小嗓辘","保密","陕西","66963356","5","","10000","1","","其实对于双方都是一次突破"
"小棉花花","保密","江苏","2597575","5","","10000","1","","在日本作曲家的地位是非常非常非常高的（成功的曲作家）。"
"老师好呀好","男","四川","437387547","5","","10000","1","","每一个幕后，都是一个伟大作品的诞生"
"江岸拾款冬","保密","浙江","8317633","6","","10000","1","","陈老师辛苦了"
"某文弱的学术分子","保密","辽宁","473012058","5","","10000","1","","我已经n刷了，非常期待更多的音乐幕后[打call]"
"TheSah","保密","美国","390223386","5","","10000","1","","谢谢米哈游 各个地区的音乐我apple music都收藏了 热血沸腾的时候跟着嗨 到荒凉悲哀的时候跟着安静下来 感谢这么棒的音乐人"
"189狐妖家の兔仔","保密","广西","11873172","6","初音未来13周年","10000","1","11","这视频里逆天弹幕真多啊"
"柠檬盐水鸭_","女","无IP","351434250","5","","10000","1","","什么时候能看到须弥的[脱单doge]"
"形容qwq","男","无IP","41366165","5","","10000","1","","太优雅了！"
"_炒米粉","男","无IP","19848154","6","","10000","1","","里面有个长得很像大伟哥的哥们，摄影师是不是故意给他很多镜头的[喜极而泣][doge]"
"璃月挖矿真君","男","无IP","19280923","6","","10000","10","","音乐很好听，但这不是策划和编剧乱搞的理由。大家该冲还是要冲的，不然以后原神就是下一个崩三。,冲的时候分开就好了。"
"清风十六里","男","无IP","130218651","5","良辰美景・不问天","10000","2","6","好了，看见我你就不用往下翻了，全是"
"小秋~","保密","无IP","368087798","5","明日方舟音律系列","10000","2","","我好圻@N於作的深入介Bl!"
"Illustriousex","保密","无IP","220165261","6","","10000","2","","确实是国产之光"
"咕嘟大麦茶","女","无IP","23510357","6","","10000","2","","看到油管的好几条日本人的评论都是“奥运会有这个我就看了”[笑哭][笑哭][喜极而泣],什么叫国际共识啊"
"三玖感冒特别灵","男","无IP","10439893","6","爱上她的理由","10000","2","","真的感谢米哈游制作团队的如此巨献，让我能真正体会到工匠精神，也要感谢各位氪佬，没有你们，就没有这么精致的游戏。祝原神越来越好[OK]"
"鳄鱼王者","男","无IP","25114724","5","","10000","2","","讲真，越来越随便的剧情和人物设定的敷衍真的对不起如此优秀的音乐和美工，希望mhy能够三思，这和木桶效应短板是一个道理。原神打动我的绝对是音乐第一，画风第二，如果没有这两点这无聊的打工人式的剧情早就退坑了"
"账号已注销","保密","无IP","35396767","0","","5000","2","","“在未来的版本中，我们还会根据分析结果持续评估和打磨，让每一位旅行者喜爱的角色都有发挥能力的舞台”"
"五餐都吃小孩","男","无IP","31139303","5","","10000","2","","狗策划对得起这音乐嘛"
"璃殇ks","保密","无IP","519881857","5","","10000","2","","在坐各位投资者满意吗？[给心心]"
"孢子飘飘","男","无IP","8894105","6","","10000","2","11","音乐制作棒极了，这种幕后视频也很有意思。希望来个心海幕后视频，一来是想谢谢做美术的，另一方面是想看看做文案剧情和数值的长什么样[呲牙]"
"图莱杜拉的琉璃","保密","无IP","12400947","6","","10000","2","","又是感慨音乐美工要每天骑着ch和文案上班的一天"
"下北泽のmio酱","男","无IP","441493139","5","公主连结可可萝","10000","2","11","别修复心海水上行走的bug好不好，或者改成进入战斗状态消失也行，风景党凭借这个特性可以去好多好看的地方，也可以拍摄到许多美丽的提瓦特风景，拜托了。"
"Z2HANG","男","无IP","513752830","5","","10000","2","","音乐美工没的说，策划和编剧[疑惑]"
"熊本熊看看看","女","无IP","329003965","6","","10000","2","","太棒了这个视频，可以看到米哈游和演奏家们的敬业精神，以及跨国沟通所带来的困难和如何克服这些问题的方式，非常inspiring！音乐超级好听！"
"了卡","男","无IP","356153968","5","","10000","2","","不氪金真的对不起他们的付出[打call]"
"一里百都千","保密","无IP","6950159","6","","10000","2","","为啥感觉原神的音乐总监和索尼音乐总监一样有点高傲的感觉，反倒是乐手和陈老师特别谦虚"
"蘑菇多好吃啊","保密","无IP","7184076","6","","10000","2","","你们的策划能不能像陈致逸老师一样有水平（握紧拳头）"
"Menggutop批占","男","无IP","34931766","6","EveOneCat2","10000","2","","mhy的音乐美术真的没的说，就是这次编剧和策划让人血压拉满，"
"账号已注销","保密","无IP","486266732","0","","5000","2","","哪怕运营策划有美术音乐团队千分之一的用心..."
"某神经的","男","无IP","26243361","5","","10000","2","","确实文化差异，但不是民族文化差异，而是商业文化差异，且我觉得是发展中经济体和发达经济体的商业文化差异。就我有限的个人经历而言，国内的资金的支配权极大，乙方普遍卑微――自己的心情不值一提，只要最后能挣到钱就行。在相对发达的经济体，服务方的工作感受的占比会变高，同时合同会写得非常细，有时候超出范围的一点都做不了。我觉得这个事儿一方面问题在于老陈所谓自己的不成熟，毕竟任何处过领导位置的人都知道“士气”这个东西看不见摸不着，但极其影响效率，有时候能决定一个项目的成败；另一方面可能是很多东西没有写清楚，比如是否允许这种情况发生，遇到这种情况用什么流程处理，老陈的责任是什么，乐队的责任是什么等等。"
"|雪莲Official-","女","无IP","21120769","6","","10000","2","9","键盘侠少爷们就不要催什么地图更新慢了，不要真以为东西到规定时间就绝对会出来的，这种事情变数不稳定，不要觉得人是机器，定时到点取货。"
"五米天平","保密","无IP","435203814","6","","10000","2","","看完之后有点感动啊，剧情策划做个人吧这么用心的音乐和美工，你怎么敢那么敷衍的写心海的剧情的"
"Xiner","保密","无IP","10195316","6","原神","10000","2","","[响指]这就叫专业.gif"
"悠游优","男","无IP","34512305","5","","10000","2","","又在找哦，休息一下好不好"
"天龙三天","保密","无IP","514642670","5","","10000","2","","请广大网友做好心理准备，接下来你们可能会面临一大群xxs的涌入，请所有人确保好自己的账号安全，谢谢[脱单doge][脱单doge][脱单doge]"
"泠鸢hanser","男","无IP","35955179","6","","10000","2","","三味线那段，乐手说“这次是面向全世界展现日本传统音乐的机会，也让我觉得身负重担”,原神输出日本文化石锤了[doge]"
"我永远喜欢三上悠亚","保密","无IP","39658926","6","星座系列：处女座","10000","2","10","知道我氪的钱没有被浪费，真是太好了[吃瓜]"
"慕清隆_原铁代肝","保密","无IP","174945001","6","","10000","2","9","你可以永远相信米哈游.jpg[OK]"
"每天不干人事真君","女","无IP","23270570","6","","10000","2","","看到陈老师这么辛苦我挺心疼的，所以剧情编剧能不能给点力把剧情写好啊[大哭]"
"负片效果","男","无IP","11606090","6","","10000","2","","本视频“日本”含量极高，敬请各只们注意心脏，当心心肌梗塞"
"_Tukimi_","保密","无IP","38954347","6","赏樱大会欧皇","10000","2","","美工无敌，音乐无敌，策划要盈利我理解，可编剧它配把自己的故事塞进来了吗。"
"沟式","男","无IP","517914528","5","原神","10000","2","","请问我投个胎能有这水平吗[思考]"
"式波明日香本香","男","无IP","399454747","5","某科学的超电磁炮T","10000","2","","我服了一堆人复制这个热评，我不是水军都看的烦了"
"Huanyoutiao","保密","无IP","300268910","6","","10000","2","","别在音乐下冲谢谢[微笑]"
"幕依兮","男","无IP","28684089","6","2021拜年纪","10000","2","","趁着猴还没来我赶紧解释一下，传统乐器和特色乐器是两个概念，就比如说筷子虽然发源于中国，但在亚洲各国都有非常悠久的历史，所以你可以说筷子是“中国、韩国、日本的传统餐具”，同样，尺八虽然发源于中国，但在唐朝就已流传至日本，在日本历史同样十分悠久，所以也可以说是日本的传统乐器，之前就因为这件事起过节奏，所以这次视频中还把尺八细分了，将“日本尺八”独立了出来，着重强调“日本的传统乐器是日本尺八”，这已经是十分谨慎了。,原热评――@sky红枫"
"夜家月痕","男","无IP","85444264","6","","10000","2","","这种幕后确实好看,啥时候放璃月的![doge]"
"昵称已存在已存存存存存在","保密","无IP","34130377","6","","10000","2","","趁着猴还没来我赶紧解释一下，传统乐器和特色乐器是两个概念，就比如说筷子虽然发源于中国，但在亚洲各国都有非常悠久的历史，所以你可以说筷子是“中国、韩国、日本的传统餐具”，同样，尺八虽然发源于中国，但在唐朝就已流传至日本，在日本历史同样十分悠久，所以也可以说是日本的传统乐器，之前就因为这件事起过节奏，所以这次视频中还把尺八细分了，将“日本尺八”独立了出来，着重强调“日本的传统乐器是日本尺八”，这已经是十分谨慎了。,原热评――@sky红枫"
"亿颗圣女果","保密","无IP","471083436","5","","10000","2","10","趁着猴还没来我赶紧解释一下，传统乐器和特色乐器是两个概念，就比如说筷子虽然发源于中国，但在亚洲各国都有非常悠久的历史，所以你可以说筷子是“中国、韩国、日本的传统餐具”，同样，尺八虽然发源于中国，但在唐朝就已流传至日本，在日本历史同样十分悠久，所以也可以说是日本的传统乐器，之前就因为这件事起过节奏，所以这次视频中还把尺八细分了，将“日本尺八”独立了出来，着重强调“日本的传统乐器是日本尺八”，这已经是十分谨慎了。,原热评――@sky红枫"
"你杠就是我对--","男","无IP","522444214","5","","10000","2","","趁着猴还没来我赶紧解释一下，传统乐器和特色乐器是两个概念，就比如说筷子虽然发源于中国，但在亚洲各国都有非常悠久的历史，所以你可以说筷子是“中国、韩国、日本的传统餐具”，同样，尺八虽然发源于中国，但在唐朝就已流传至日本，在日本历史同样十分悠久，所以也可以说是日本的传统乐器，之前就因为这件事起过节奏，所以这次视频中还把尺八细分了，将“日本尺八”独立了出来，着重强调“日本的传统乐器是日本尺八”，这已经是十分谨慎了。,原热评― ―@sky红枫"
"三月七派蒙","保密","无IP","345794817","5","三周年恋曲","10000","2","","麻了，官方评论也没了？[尴尬]"
"_狂暴吃饭组长","保密","无IP","1122306483","5","原神","10000","2","","管他什么问题，哼爷也是来听歌的[原神_哼]"
"M的小虾米","男","无IP","2871256","5","","10000","2","","觉得自己冲的648值了的来这"
"天道饶过谁hhhhh","保密","无IP","275242342","5","","10000","2","","音乐好，ch爬"
"阿斯塔-利斯克","保密","无IP","23125398","6","三周年恋曲","10000","2","9","bgm里，,风神的象征是里拉琴，,岩神的象征是二胡，,冰神的象征是管风琴，,雷神是什么？,求解答[害羞]"
"清酒听雨の","男","无IP","72959167","6","星座系列：射手座","10000","2","","笑死我了，推特上一堆在这个视频底下喊周年庆奖励还有加强心海"
"何其高尚的希望之花","保密","无IP","48146254","6","","10000","2","","策划和大伟是不是有仇"
"尘冥将军-有无","保密","无IP","1765157616","4","","10000","2","","22:37"
"bili_87644","保密","无IP","87644","6","","10000","3","","官方承诺https://b23.tv/6axrRY ，钟离事件之后你对玩家的承诺去哪里了？米哈游？“在未来的版本中，我们还会根据分析结果持续评估和打磨，让每一位旅行者喜爱的角色都有发挥能力的舞台，还请各位旅行者继续保持耐心等待。”这段话现在看来不就是个笑话？看到的兄弟们转出去，让更多人看到"
"夜空yozora哒","男","无IP","182820196","6","","10000","7","","音乐好听是好听，但是策划什么时候死呢[热词系列_张三]"
"幽冥息A","男","无IP","185767505","6","","10000","4","8","CH你对得起这样的美工和音乐吗？你配的上吗？你的良心不会痛吗？你们但凡有他们一半的工作态度都不至于被冲成这样"
"依殿万岁","女","无IP","676146669","5","魔法学院","10000","4","","冷知识：日本传统乐器尺八原是中国乐器。,冷知识2：中国传统乐器唢呐原是波斯乐器。,,来自评论已不存在"
"鲸睨","保密","无IP","631802947","5","","10000","4","","趁着猴还没来我赶紧解释一下，传统乐器和特色乐器是两个概念，就比如说筷子虽然发源于中国，但在亚洲各国都有非常悠久的历史，所以你可以说筷子是“中国、韩国、日本的传统餐具”，同样，尺八虽然发源于中国，但在唐朝就已流传至日本，在日本历史同样十分悠久，所以也可以说是日本的传统乐器，之前就因为这件事起过节奏，所以这次视频中还把尺八细分了，将“日本尺八”独立了出来，着重强调“日本的传统乐器是日本尺八”，这已经是十分谨慎了。,原热评――@sky红枫"
"何小猪肘","保密","无IP","222352694","4","","10000","1","","所以那首马林巴琴到底是哪首呀？"
"奇味奇","保密","无IP","14120146","6","","10000","1","","不知道普通的音乐人看到这纪录片是什么感受"
"-普洱-","保密","湖北","522004285","5","","10000","1","","[打call][打call][打call][打call][打call][打call][打call]"
"酸辣味的彩虹屁","女","山东","228850074","5","","10000","1","","如果其他国家的音乐幕后也是这样的类纪录片形式就好了[大哭]"
"鱼鱼和yuumi","保密","河北","277870988","3","","10000","1","","额 战斗曲很好听 但是我已经肝麻了 听到有生理反应"
"法力风暴","男","宁夏","16503845","6","向晚大魔王","10000","1","","有没有层岩的"
"飞天栗子","男","无IP","1871180","6","","10000","1","","须弥什么时候发"
"次克立6","男","无IP","576003840","5","","10000","1","","https://b23.tv/BV1Dt4y1h7Mr"
"沃德-田娜","女","无IP","694840162","5","2021拜年纪活动专属","10000","1","","非常宝贵的经验，感谢分享！"
"好吃的柚柚","保密","无IP","1732683040","4","","10000","1","","非常简单"
"鸣弦sTRiNG","男","无IP","397008535","5","工作细胞","10000","1","","@索尼音乐中国 [doge]"
"初中音乐教师赵赫","男","无IP","6562210","6","","10000","1","11","太了不起了"
"艾lie","保密","无IP","225324802","6","拳皇","10000","5","","重担哈哈"
"米酒啾咪","保密","湖北","827101","5","碧蓝之海","10000","6","","栗田博文这个指挥是直接和原神闹掰了吧，只参与录音，后来音乐会都没有他，他名气还挺大，音乐会那个指挥小哥连署名都没有。再回头看一遍他在现场的时候真的很刚，这还只是剪出来的部分，只是个人采访才相对收敛了一点说场面话。"
"我永远喜欢花鸟卷","男","无IP","13343313","6","阴阳师花鸟卷","10000","2","","尺八好像原来也是中国乐器，但是在中国失传了，在日本却传承下来了。"
"Stellar银星","女","无IP","297440404","5","","10000","6","","要是2.1的编剧有音乐老师的十分之一认真，也不至于做成这个鬼样[傲娇],心海人都给我看麻了，我对剧情的要求其实很低，一些烂剧我还能看得津津有味，但心海传说任务真的……我都看不下去[捂脸]"
"家妻02呐","保密","无IP","2032983495","5","","10000","4","","／ ￣策￣ ＼　               ,|   v    划u \       ／￣￣￣￣￣￣￣￣￣＼,|　 　 |    /     \,\         　/ ∠   , ＼　　 イ　   \ 让我看看周年庆被冲要用哪本/ ,／        　\          \锦囊。                           /,/                \            ―――――――――――   ,/　|    　　\ ,|　|             |,,复制的"
"啊哎呀唉呀","男","无IP","352962416","5","","10000","4","10","音乐音乐帮是真的棒，但数值和文案需要好好整一整"
"和平对战","保密","无IP","470553648","5","","10000","7","","ch和编剧对得起美术和音乐的付出吗[捂脸]"
"他们叫我鸽子王","男","无IP","260310740","6","","10000","6","","ch就是挡舆论冲击的盾牌。牺牲一个不值钱的策划，牺牲一个本就是为了牺牲而诞生的岗位，保护公司真正的核心利益，能保住骗钱的美工音乐米哈游是大赚。,,原神团队是个整体。好的时候全体享受赞美，差的时候推出ch挨打，其他人继续粉蛋糕。打蛇打七寸，美工、音乐不疼，米哈游不改。陈致逸要是快被骂跑了，你猜原神会不会害怕，钟离美工制作组扛不住了，你说米哈游急不急。,,原神变差不只是ch的问题，这是团队的锅。哪怕看似美工音乐不沾边，他们也有责任（因为吃了蛋糕），这才叫团队。"
"weiziz","保密","无IP","13163000","5","","10000","6","","把全部冒险奖励(宝箱，主支线奖励）排除的话,6月，6397,7月，6950,8月，5386,9月，6219,6月加7月为，13347。8月加9月11605,两个一减不就是1742原石，这一对比，签到七天的10连不就是抠出来的吗,,现在突然有点怀念以前的百万水军，当时那样的节奏至少让原神还是有点忌惮害怕，努力做好游戏，发放大量奖励，还有多少人记得当时原神拿奖感谢大家发了1600原石，原神现在没有一点压力，而且随着时间推移水军和猴越来越少，我不是说越来越少不好。就连仅存的一点压力都没有了，原神现在是毫无竞争压力，已经开始在剧情和一些地方不走心了!!水能载舟，亦能覆舟。大家加油好好让原神看看玩家的决心，你要是不好好做，甚至在该有福利的时候不发，就休想从我们这里拿走一分钱![再见][再见][再见]宝，都是玩家的情绪啊[辣眼睛]那有什么节奏？,它会为了首充重置特地发邮件提醒，却不肯在一周年当天发邮件庆祝。,,以后充648的时候我希望大家冷静的想一想，收入这么高的MHY都这么节省，你那点微薄收入好意思乱花钱吗？,,之前看过一个采访某游戏ch的视频，ch本人亲自说的：“所有ch就是为了从玩家口袋赚更多的钱，所以也没什么互相理不理解的，这就是我的工作。“ ,还有一段“ch就是要试探玩家的底线啊。对ch来说，多给玩家送一个十连，那大概率就会少一个十连的氪金量，所以一般ch会准备好几套方案，先给出一个最低的值，玩家要是觉得可以，那就按那个来，之后还可以继续试探，玩家要是不同意，那也就是把原本准备的方案放出来。一步一步的为了从玩家那弄到更多钱。”,还有一段最离谱的“ch就是做各种不同样子的屎给玩家吃，然后一堆玩家还会为此买账，那躺着能赚钱为啥要站着赚。”,,角色平衡我唯唯诺诺,有利bug我重拳出击,原石奖励我扣扣搜搜,广告宣传我一掷千金,,我只有一个648，要充给哪个游戏呢？抽一下吧，哎呀不好意思米哈游，你没有中奖呢[爱心]，下次再试试吧，648氪给其他游戏啦,                                    ―――已消失的热评 整合版（转"
"-北天极-","男","无IP","21519773","6","","10000","5","","身负重担[大哭]"
"听卜见","男","无IP","2646363","6","公主连结可可萝","10000","5","","不用原道都能听哭还得是原神"
"晓辉映月","保密","无IP","13798773","6","双生视界・花嫁","10000","4","","19：30，我刘路啊"
"哥伦比娅幻梦","女","无IP","410673477","5","","10000","4","6","希望原宝以后能别再犯这种错误了"
"庖丁宰牛","男","无IP","37605413","6","","10000","5","","趁着猴还没来我赶紧解释一下，传统乐器和特色乐器是两个概念，就比如说筷子虽然发源于中国，但在亚洲各国都有非常悠久的历史，所以你可以说筷子是“中国、韩国、日本的传统餐具”，同样，尺八虽然发源于中国，但在唐朝就已流传至日本，在日本历史同样十分悠久，所以也可以说是日本的传统乐器，之前就因为这件事起过节奏，所以这次视频中还把尺八细分了，将“日本尺八”独立了出来，着重强调“日本的传统乐器是日本尺八”，这已经是十分谨慎了。,原热评――@sky红枫"
"midgap","女","无IP","394044577","6","战双帕弥什","10000","4","","19:32"
"敏鬼","男","无IP","431699154","5","","10000","4","","尺八是中国的啊！"
"泉与千景","女","无IP","2925272","6","","10000","2","","评论里的猴有点好笑了"
"残血浪全图","保密","无IP","405343670","5","","10000","2","","你们的周年福利都扔到这里了！[嗑瓜子]"
"天行知琦雁","男","无IP","509831705","5","","10000","2","","有人玩原神把音乐关了吗？"
"天龙三天","保密","无IP","514642670","5","","10000","2","","请广大网友做好心理准备，接下来你们可能会面临一大群xxs的涌入，请所有人确保好自己的账号安全，谢谢[脱单doge][脱单doge][脱单doge]"
"xIsv","男","无IP","26220271","6","","10000","2","11","还说什么剧情问题？不知道游戏里出问卷了吗？[疑惑]有反馈的地方还在这跳什么跳？[嗑瓜子]"
