"昵称","性别","IP","UID","等级","装扮","用户权重","获赞数","粉丝团等级","评论"
"深い森のなかで","保密","无IP","504852809","5","","10000","9","","趁着猴还没来我赶紧解释一下，传统乐器和特色乐器是两个概念，就比如说筷子虽然发源于中国，但在亚洲各国都有非常悠久的历史，所以你可以说筷子是“中国、韩国、日本的传统餐具”，同样，尺八虽然发源于中国，但在唐朝就已流传至日本，在日本历史同样十分悠久，所以也可以说是日本的传统乐器，之前就因为这件事起过节奏，所以这次视频中还把尺八细分了，将“日本尺八”独立了出来，着重强调“日本的传统乐器是日本尺八”，这已经是十分谨慎了。,原热评――@sky红枫,我就不信猴这么有耐心"
"通常召唤DD开普勒","保密","无IP","6803466","6","贝拉kira","10000","5","","评论里的猴有点好笑了，应该不停的感恩[给心心][给心心][吐][妙啊][doge][妙啊][妙啊][doge][妙啊][妙啊]"
"swordfish-ll","保密","无IP","282376628","4","","10000","2","1","很期待渊下宫的音乐"
"八重小狐狸","保密","无IP","4764919","6","","10000","2","","要是编剧能拿出音乐制作一半的用心就好了"
"暮云琉钊","男","无IP","331492253","4","","10000","2","","看到这，翻译同志真是辛苦了哈"
"喜欢糯糯吗","保密","无IP","449286589","4","2233白色情人节","10000","2","","[Cat2_Astromeawt!][Cat2_Nyampage]"
"桉-_-","保密","无IP","474083063","5","","10000","2","4","辛苦了"
"手残技术菜瘾大没理解","男","无IP","17055793","6","阴阳师海国之境","10000","2","","陈致逸联动关大洲！！！@原神"
"死洛这名字至少好读嘛","男","无IP","385640764","5","","10000","2","","预言一波蒙德音乐被某些人说亲欧[doge]"
"夜叉の瞳","保密","无IP","239310650","5","","10000","2","","我觉得下次录音之前是不是让演奏家了解一下故事背景，看看游戏画面，感受一下，是不是能更好把握一些"
"フロ`ス","女","无IP","85725653","6","EveOneCat2","10000","2","","看完了，我果然好喜欢音乐啊"
"虔诚的敲钟天使","保密","无IP","407559910","5","","10000","2","","期待音乐会[脱单doge]"
"Starvirtual星痕","男","无IP","375538421","5","一周年纪念装扮","10000","14","","原神,不推荐,总时数114.514小时,,玩家就是韭菜，ch无视玩家意见，知错不改，明明流水这么高，周年庆还这么抠，RNM退钱！,,我是散兵,,这篇评测是否有价值？,是否 欢乐奖励,有114514人觉得这篇评测有价值,有1919810人觉得这篇评测很欢乐"
"__混沌","男","无IP","32182585","6","","10000","2","","兄弟们，还有不到一小时周年庆就结束啦。"
"Vasehotep","男","无IP","131606119","6","~るる","10000","2","","BV1xp4y16761你好，请了解一下这个五分钟的文化输出吧"
"Mora_x","保密","无IP","1594188","5","","10000","2","","陈老师写的，比真正的日本乐在某些乐句多了一分大气，就不全是日本调式。所以感觉虽然做的是日本乐曲，却有一点中国灵魂。"
"鬼月狐音","保密","无IP","3014582","6","","10000","2","6","很难想象这是线上交流出来的音乐，尤其是那几位翻译，本来用语言描述音乐就很困难了，这些大佬居然还要把这种感觉翻译过去，也不知道mihoyo从哪里挖到的这些大佬"
"森林-会记住一切","保密","无IP","58671655","6","至尊戒","10000","2","8","我中间看的一段发现都没戴口罩，后来反应过来要用嘴吹[笑哭]"
"忙着窝窝","保密","无IP","216201312","6","","10000","2","","原神的音乐真的一绝"
"永h的rt幼月","保密","无IP","27924974","6","","10000","2","","12:38"
"hkid","男","无IP","7631324","6","","10000","2","11","光看了前6分钟就能感到制作的难度了，看着都难受"
"墨子八号的小跟屁虫","女","无IP","142458884","5","","10000","2","","长线游戏内容质量的起起伏伏都是正常的事，但音乐这个方面从来都没有令人失望过。,在原神做的不好时，我们可以表达不满。,但在原神表现自己的好的一面时，希望大家不要吝啬自己的赞美。"
"可爱想rua_","女","无IP","23211391","6","","10000","2","","[藏狐]阿，我还以为大伟哥在那吹乐器来着"
"木水流光","保密","无IP","6835","6","","10000","2","","老板, 再来50分钟的量!"
"一集天灾","保密","无IP","35322316","5","","10000","2","","音乐雀氏没毛病，28号能不能给我们一点惊喜啊[吃瓜][吃瓜]"
"-Melrose_","保密","无IP","503334431","5","","10000","2","","原宝，28号还有硬货的对吧"
"钟归远_我的桂花糕呢","保密","无IP","353964041","6","","10000","2","","原宝，你28号搞点事情呗"
"头像这是我老婆","保密","无IP","1264377058","5","","10000","2","","如果我可以打反抗军，我绝对会全干掉了[无语]"
"犯困嫌疑人1_1","男","无IP","488517448","5","","10000","2","","想要看直播的，那是up主联合做的，去搜原神生日会就行[脱单doge]"
"胡桃遍地跑","保密","无IP","298120976","5","","10000","2","","？不是说九点开吗？"
"小王爱打篮球","保密","无IP","418489568","5","","10000","2","","开始直播了吗？"
"死就好了","男","无IP","382557389","5","","10000","2","","我很喜欢这种记录类型的片希望能长更多"
"晴天偏是雨渐渐","男","无IP","384899910","6","","10000","2","","冬季奥运会会办成这样，都是这些大佬去给原神做音乐，mhy你坏事做尽[doge]再多来点[给心心]"
"芝士小瑞","男","无IP","168209109","6","","10000","2","","这次确实很深刻的感受到了日本传统音乐的美丽。"
"兰秋麋芜","保密","无IP","387450482","5","呜米","10000","2","","剧情策划和数据策划就应该来给音乐策划和美术策划磕头！"
"万军丛中取手机","男","无IP","398878951","5","","10000","2","","音乐美工都不错，就是，就是剧情拉了腿，，拜托不要在整心海那种没脑子的剧情好不好"
"雪霁う","保密","无IP","39029870","6","崩坏3・天穹流星","10000","2","","璃月音乐幕后gkd[崩坏3_拜托了]"
"红月为誓永不分离","男","无IP","9428329","6","","10000","2","","转自百科：,一、中国古代尺八,又名地无管。六孔，管身细短。,古代尺八一般在普化宗明暗尺八流派中继续保存，在竹材尺寸、形态要求上非常严格，依靠天然符合要求的竹材才能制作出精良的地无尺八，其音色自然、古朴、深邃。,二、日本现代尺八,也称地涂管。五孔，管身粗长，前四后一，无凤眼。,因地无尺八必须依靠天然符合要求的竹材，所以随着科技的进步，到了近现代尺八制作师通过地涂技术，让一些天然不符合要求的竹材通过技术填充达到性能的要求，从而实现尺八的音准、性能的最大优化。,其特点是精确符合现代律准，共鸣泛音层次丰富。,尺八传播历史：,尺八在1300多年前就已东传日本，融入日本本土。据记载尺八是南北朝末年至唐初（公元581－618年），相当于日本的奈良时代作为演奏唐代的雅乐的乐器而由中国传去的。,从隋高祖开皇20年（600年）起，日本圣德太子之时，日本曾屡派“遣隋使”和“遣唐使”前往中国，尺八和许多诸如龙笛等中国乐器东传日本。,至今日本正仓院还保存有唐制尺八多种。,最早传入日本的尺八仅用于宫廷雅乐，六孔，称为“古代尺八”，也常作为达官贵人的玩物，故也叫“雅乐尺八”。,据传，日本圣德太子特别喜爱尺八，他当时所用的中国尺八，如今还珍藏在奈良的法隆寺中。"
"应离离离离","男","无IP","1509022","6","RNG战队","10000","2","","太短了！！！为什么不做成纪录片拍个一季！我还想看！"
"是バ？","保密","无IP","148123","6","","10000","2","10","论内鬼为什么要死"
"NekoSama_DG","女","无IP","242650191","5","","10000","2","","太棒了呜呜，我何德何能能玩到原神"
"Dennis_TheMenace","保密","无IP","486468303","5","","10000","2","","与此同时 编剧和策划在办公室里摸鱼"
"无与伦比300","保密","无IP","501473143","5","","10000","2","","看完音乐组的辛苦，回头看看数值策划真是吃shi[辣眼睛]"
"时雨不及时","女","无IP","241397854","6","原神","10000","2","10","每一次听到原神的音乐，每一次看到他们的制作过程都会让我心潮澎湃，让被迫放弃音乐的我又想起来了当年的梦想"
"恶魔辉","保密","无IP","153408319","6","原神","10000","2","6","强烈想听听陈老师“更难”的版本[吃瓜]"
"紫晶-幻","保密","无IP","152436842","6","星座系列：处女座","10000","2","","我想问问，之前剧情里说的队服可以实装吗，起码哲平的。。。。。。"
"维他奶嘤嘤嘤","保密","无IP","8338889","6","","10000","2","","[doge]甲方：我的错，写的有点反人类了。。实在不行我就改改。  乙方：就这？[doge]甲方：？？"
"bitterlemon","保密","无IP","91542428","5","","10000","2","","策划和编剧对不起音乐和美工啊"
"环靥","女","无IP","5092719","6","","10000","2","","我真的好喜欢看这种幕后的故事，能看到一个个好的作品都是经过了怎样的打磨才创作出来，感谢背后的每一个工作人员。"
"克鲁鲁ツェペシ","男","无IP","6639930","6","初音未来13周年","10000","2","11","[tv_白眼]"
"风化模样","保密","无IP","564914748","5","","10000","2","","除了剧情和抠门，我好像真没什么能冲的地方[藏狐]"
"whiot","保密","无IP","40178638","6","三周年恋曲","10000","2","","孩子喜欢 多拍点[打call]"
"枯萎-穿心攻击","男","无IP","1087610991","5","","10000","2","2","感觉世界和平真好"
"{州中学猎牛人","男","无IP","4431833","6","公主连结凯露","10000","2","","须弥。。印度传统音乐是啥啊，，有科普视频吗，让我有个心理准备"
"闲水悠然","保密","无IP","259938130","5","","10000","2","","烤肉man快行动啊，爷要看外网反应[doge][doge][doge]"
"明明就是死傲娇","男","无IP","736839","6","","10000","2","","哪天出个璃月音乐的花絮"
"爱莉丝威震天","保密","无IP","25463","6","","10000","2","","女士的ＢＧＭ是找俄罗斯演奏的吗？"
"我叫嗯哼","女","无IP","23969775","6","少女前线","10000","2","","线上音乐会在哪里买票呀"
"参","女","无IP","489545","6","","10000","2","","我想看三小时起步的幕后制作大电影[脱单doge]"
"天街小项","保密","无IP","23219447","6","","10000","2","","东京奥运会开幕式拉胯的原因找到了！米哈游把音乐人都拉走了"
"Nanarin-","保密","无IP","272728778","6","","10000","2","","我越来越期至冬音乐里的管风琴了"
"一挽轻风","男","无IP","291753765","6","","10000","2","10","音乐真的很棒，请再接再厉吧！"
"果然日光之下并无新事","女","无IP","333981853","5","","10000","2","","兄弟们记得签到哦[藏狐]https://b23.tv/GkFhHY"
"梦の石","保密","无IP","290571192","3","","10000","2","","有细节，有态度，有格局！我这全角色满命没白氪！"
"HANA_and_GUU","女","无IP","2349399","6","","10000","2","","看到弹幕说期待唢呐・・・我一想 我也超级期待唢呐了！！,期待陈老师会用唢呐给我们带来什么样的惊喜！！,啊啊啊啊想想就很激动！ 等着！"
"玖弈绿","男","无IP","535209324","5","崩坏3・天穹流星","10000","2","","替所有零氪朋友感谢月卡党和氪佬的付出,再吐槽一下自己,这也是我配白嫖的音乐？[辣眼睛]"
"RonalYu","男","无IP","319132980","5","","10000","2","10","一首一首精挑细选从网易云音乐下载下来搬到我QQ音乐收藏歌单里面的，搬完之后发现QQ音乐居然也上架了，小丑竟是我自己[藏狐]"
"春秋蝉c","男","无IP","35612840","6","","10000","2","","我一直喜欢在绀田村听村长的小曲儿，这次有索尼介入，加上一流的团队，陈老师的才华，使得稻妻地区对其原型日本的音乐风格把握相当完美，其中还融入了中国元素，每出一个国家，我都感叹原神的制作水平，很多情况下，米哈游全体成员应该向美工和音乐鞠躬。"
"活跃的灵胖","男","无IP","197506109","6","原神","10000","2","10","事实证明，神一般的甲方加上神一般的乙方结合起来就是超越神级一般的音乐[保佑]"
"崂山拳王","男","无IP","25577492","6","原神","10000","2","","伦敦爱乐 东京爱乐 上海交响乐团 还有一众民乐演奏家[笑哭] 后过头看这些名字都有点不敢相信[笑哭] 这人脉 能请得动这些顶级大佬演奏家[笑哭] 做梦都可能没有这么异想天开[笑哭]"
"青驹篁岭行客","保密","无IP","437718380","5","原神","10000","2","","原宝多发些这些创作的幕后，我太喜欢了。648大大滴有"
"Tsujikura_Supika","保密","无IP","1150638293","4","原神","10000","2","11","看完这个视频更想提议把写剧情的开了[傲娇][傲娇]高攀了属于是"
"撑伞滴孩子","保密","无IP","336550679","5","","10000","2","","很喜欢看这样的幕后 希望原神越来越好"
"Cc__0224","男","无IP","46475019","6","魔法学院","10000","2","","太棒了真的"
"会有猫的猫叔","男","无IP","8852315","6","","10000","2","11","谁不愿意免费的听一场国际音乐会呢[打call]，原宝yyds[OK]"
"胡桃桃x","保密","无IP","349442418","5","","10000","2","","别忘了签到哦，有40原石的,https://b23.tv/6aBf1d[脱单doge]"
"腊肉韭菜包","男","无IP","20070737","6","拜年祭粉丝专鼠","10000","2","","写剧情的跟人家学学，别辜负了这些音乐"
"珍妮玛-代劲","男","无IP","43495515","6","原神","10000","2","","年度大片巨制《我写的太难》[doge][doge]"
"钉钉办公软件","男","无IP","8129405","6","原神","10000","2","","快出闪耀的群星2啊可恶[热词系列_锤]"
"阿布的小yi","保密","无IP","107825047","5","","10000","2","","太棒了。。。果然ps5版优化这么棒是有特别的小心思[脱单doge]"
"向崩3dalao递茶","保密","无IP","31547584","6","","10000","2","","音乐美工做的很好，其他方面除了愤怒就是失望[无语]"
"落汐悦悦","男","无IP","501104057","5","暮光幻影","10000","2","","https://b23.tv/6aBf1d 兄弟们记得签到[doge]"
"mk大人辛苦了QAQ","男","无IP","36679129","6","","10000","2","8","一般游戏看了这个真的是汗颜。。。根本追不上，只能望其项背"
"草梅友仁","男","无IP","10822025","6","原神","10000","2","","音乐是最容易刻进DNA的，当熟悉的BGM想起的时候，画面感就出来了（同时血压可能也会升高[doge]）"
"仰望星空ZP","保密","无IP","506956264","6","","10000","2","","mhy在音乐方面真是下了血本了，钱没白充，真有你的mhy[脱单doge]"
"Five-dollar","保密","无IP","279763883","5","","10000","2","","音乐真的非常好，希望你们文案剧情能不要再拉跨下去了，不要辜负了这么多人的努力...."
"od名","男","无IP","29243449","6","","10000","2","7","那个。。不来一期女士的制作幕后嘛，像陀子哥那样，上次看直播说8个月才做出来，音乐也很好听，同意的顶我上去[doge]"
"予蚁玫瑰_","女","无IP","271672681","6","异常生物","10000","2","","这是我能免费看的吗[笑哭]哦我大保底了[辣眼睛]"
"红莉栖的龟波功","男","无IP","227100997","5","","10000","2","","你们冲的不要在这冲了，留个安静的地方听听音乐[藏狐]"
"碎窗玻璃真君","男","无IP","45848031","6","","10000","2","","知道为什么陈致逸老师写的曲子那么难吗？,因为以前合作过的老师都填的非常简单！[藏狐]"
"bilibiliGyn","男","无IP","5517335","6","至尊戒","10000","2","","去掉乐器那段让我这个卑微程序员想起偶尔辛辛苦苦做完的东西产品经理最后说不要了的痛苦。"
"Celeste伊人","男","无IP","13157733","6","2233・群星闪耀时・双子座头像框","10000","2","1","哇哇哇啊哇哇，"
"啊木木栗","男","无IP","86268900","6","RNG战队","10000","2","","经费在燃烧啊[笑哭][笑哭]"
"出包王女有生之年系列","男","无IP","512556427","6","还有醒着的么","10000","2","14","陈老师肉眼可见的眼袋....挺大的，注意休息!"
"又要睡觉了","男","无IP","7888522","6","","10000","2","","太强了，每位老师的眼里都有光！,辛苦了[保佑][保佑][保佑]"
"字宙大烧麦","保密","无IP","357063","6","","10000","2","","真心觉得陈老师加入hoyomix是双赢。,米哈游和玩家得到了完美的音乐，陈老师也得到了更多发展和交流的空间。"
"幼稚园六当家","保密","无IP","426390256","5","","10000","2","10","《甲方乙方》"
"青玉笼-妙韵","保密","无IP","25479131","6","","10000","2","8","无论是我们这边的各位老师还是日方的东爱乐团的各位老师都辛苦了！！感谢你们带来如此高质量如此美妙的音乐――！！大家都是yyds！[打call][打call][打call]"
"红鲱鱼S_K_","女","无IP","14682724","6","","10000","2","","三味线老师参加过ARASHI的演唱会的演奏！超帅的啊啊啊！"
"支配审判庭","男","无IP","2555619","6","","10000","2","","一人血书陈老师写一首唢呐的曲子！"
"黑之源","保密","无IP","135306296","6","平安物语","10000","2","","真好听，就是有点忧愁[捂脸]"
"Presentfy","保密","无IP","516827760","5","","10000","2","","若陀龙王的幕后真是太逊了 才22分钟 看看别人稻妻音乐的幕后都26分钟 唉真是太逊了 久久久久久久久久久久久久[脱单doge]"
"单推香香","男","无IP","347554101","5","","10000","2","","https://b23.tv/6aBf1d签到"
"起个破名好难啊！","保密","无IP","28853331","6","","10000","2","","策划每天上班之前应该跟音乐和美术磕个头，然后心怀感激的上班。"
"邦妮娅","女","无IP","399516523","6","崩坏3・天穹流星","10000","2","","深感人类文明的伟大"
"风铃鸣雪","保密","无IP","6495252","6","","10000","2","","我突然开始怀疑mhy是不是已经地图都做好了，就等音乐制作完毕了"
"桑荼荼","男","无IP","164567289","5","2233幻星集","10000","2","","我直说了，我喜欢这个系列，请一直保持下去！！！[脱单doge]"
"大力没啥力","保密","无IP","25620821","6","","10000","2","","这真的是我免费能玩的游戏吗？不行我得葱俩648[捂眼]"
"王庭序曲","保密","无IP","427066","6","","10000","2","","结尾有ps5的画面，太羡慕了，pc画质不能看，不知道什么时候pc也跟进这个效果"
"万象如新","保密","无IP","108864492","6","崩坏：星穹铁道","10000","2","15","我居然认认真真看完了？？？[原神_震撼][原神_震撼][原神_震撼]"
"超星空没石了","保密","无IP","64734214","5","","10000","2","","我不敢想象以后的须弥，枫丹，纳塔，至冬究竟是一番怎样的光景，实在是令人期待。"
"易白给","保密","无IP","70326781","5","","10000","2","","看完音乐创作的过程,我很想看看剧情创作过程中的视频 看看是不是经费没给够[doge]"
"黑暗草莓圣代","男","无IP","5687511","6","","10000","2","12","好有趣啊哈哈哈哈"
"丶苏小艾","女","无IP","13720461","6","","10000","2","","麻了，这个沟通交流……夹在中间的翻译小哥的颤抖我是真的感受到了[OK]跨国的合作真的很艰难而且不能到现场，非常感谢为了这一切努力的各位幕后工作人员[热词系列_三连]"
"GhostRem","男","无IP","34024230","6","","10000","2","","牛"
"挪巍怡","保密","无IP","269443014","6","","10000","2","","这个视频看得我一把鼻涕一把泪的"
"沐鱼532","保密","无IP","89501129","6","hanser","10000","2","8","抵制内鬼！！！！！"
"步孤独","男","无IP","628803779","5","","10000","2","","为陈老师点赞[打call]"
"u田源氏","男","无IP","2770422","6","","10000","2","","如果找川井宪次就好了，这位经常和中国合作，正好也是日本名乐大师，有几首曲子就有点川井风，毕竟日本民乐[脱单doge]"
"不改名就抽不中吗","保密","无IP","1205529661","3","","10000","2","","预言一下，猜对了记得刀我,视频第一首我是真的在游戏里没印象，但既然是日本乐团演奏的，那肯定是稻妻的，且稻妻还有一个岛没开放，正常怪物战斗曲应该不至于用这个，所以应该是与散兵的战斗曲[doge]"
"传说之鱼","保密","无IP","8785702","6","","10000","2","","刚才介绍传统乐器和发源地的关系的热评怎么消失了？水军举报的太厉害了吧[热词系列_害]"
"冬瓜来了丶","男","无IP","128694085","5","橘猫挂件","10000","2","","一秒没放过，看完了[OK]"
"焰烬罪灭","女","无IP","20323133","6","崩坏3・天穹流星","10000","2","","雷光签到,https://b23.tv/GkFhHY"
"等待mhy道歉的米游伥","男","无IP","10896289","6","七濑胡桃","10000","2","13","向所有为了《原神》游戏音乐辛苦付出和不懈努力的老师们，鞠躬！,感谢你们，让我们领略到了如此优秀的音乐！"
"法式水性笔","保密","无IP","38702664","6","","10000","2","","原神是我唯一一款从不静音、登录的时候到处找耳机的游戏，静音玩游戏跑图的时候总觉得缺了点什么[笑哭]"
"境界妖闲","男","无IP","3035726","6","","10000","2","","太短了不够看啊[tv_大哭]多来点多来点"
"沧海舜","男","无IP","140328539","5","异常生物","10000","2","11","音乐方面真的太厉害了[星星眼][星星眼]"
"初若梦星辰","保密","无IP","1316709168","4","","10000","2","","诶嘿[妙啊][妙啊][妙啊]"
"Pkoiily","保密","无IP","23202897","6","斯莱特林","10000","2","","陈老师对于各种风格音乐的理解是很到位的，但这不代表就得完完全全照着传统的风格做而不做创新和变式。不是叫不够日本而是和风的变式，原神的音乐创新的部分还少么？有些弹幕真的得三思一下"
"名六次一枚币","男","无IP","475172978","4","","10000","2","","完了，居然比晚到"
"看去到请叫我学习","保密","无IP","356106197","6","","10000","2","","外行尽自己所能查找资料分享一个细节[doge],原神音乐幕后的标题《旅人的“韵律”》：,韵律分声韵和节律，是诗词中的平仄格式和押韵规则，引申为“音响”的节奏规律，韵律是音乐带给人的整体印象。对应原神主题曲定下的整个游戏的基调。,  ,璃月音乐幕后的标题《旅人的“弦歌”》：,“弦乐器”的音色统一，有多层次的表现力；合奏时澎湃激昂，独奏时温柔婉约；又因为丰富多变的弓法（颤、碎、拨、跳等）而具有灵动的色彩。对应了璃月的历史沉淀和开放多元。既有“犹抱琵琶半遮面”的婉约，也有“人事有代谢，往来成古今。江山留胜迹，我辈复登临”的传承与积淀。, ,稻妻音乐幕后的标题《旅人的“幽思”》：“幽思”就是指隐藏、郁结于心的思想感情。对应了日本的“物哀”，即接触人和事物时，会情不自禁产生幽深玄静的情感，游戏里对应了稻妻的凄婉之美：稻妻处处无不在讲述悲剧，又往往让人迷恋其中，宛如那月下的白鹭之舞……,还有至冬的印象乐器――管风琴BV1At4y1q7UQ其最适合在庄严的气氛中演奏严肃神圣的宗教音乐……也是个人最喜欢的风格，真的很期待hoyomix能在至冬带给我们什么样的惊喜（虽然那一天可能要好久[笑哭]）"
"林GLye","保密","无IP","434281833","5","原神","10000","2","11","这tm不比东京奥运会开幕式好看？"
"幻空_时冥之殇","保密","无IP","1224203948","3","","10000","2","","我感觉这一首歌的成本不会比一集旧版猫和老鼠的配乐成本低。。。人员，反复的调试，语言的隔阂，一切都是钱和问题。(猫和老鼠一集的成本是5万美元左右，上世纪80年代美国黄金期的5万美元。),向所有原神音乐工作者致以敬意。[跪了][支持]"
"四维金箔","男","无IP","335947144","6","原神","10000","2","9","丝绸之路，这波啊，这波叫认祖归宗[脱单doge][保佑]属实格局大了"
"吃土少女的忧郁","保密","无IP","3283801","6","","10000","2","8","看了感觉好感动啊，一群超厉害的家伙们聚在一起，从陌生到熟悉，互相不服输，为了自己的专业和热爱，为了一个目标一起拼的样子，太热血了[打call][打call]"
"游络碎空","保密","无IP","242538240","6","","10000","2","","太棒了！还是希望艺术不要有国界的。"
"邮差vk","保密","无IP","382282773","6","原神","10000","2","","S  T  O  P,很抱歉打断你的浏览,但是我想提醒您一句,你签到了吗[doge],https://b23.tv/GkFhHY [脱单doge]"
"瑰夏之夜","男","无IP","403413511","6","萌妻食神","10000","2","11","作为一个交响乐爱好者，可以说心情太好了，不仅自己能在喜欢的游戏里听到喜欢的音乐，也能看到很多人借游戏喜欢上交响乐，能一起分享这种快乐太激动了"
"星河杂货店","保密","无IP","446572599","5","星座系列：水瓶座","10000","2","","啥时候给旅行者安排套时装？"
