"昵称","性别","IP","UID","等级","装扮","用户权重","获赞数","粉丝团等级","评论"
"四眼鱼人哈斯族","男","无IP","21624220","6","","10000","0","","新深渊谁设计的啊，把那傻逼开了吧"
"道数五十遁去其一","保密","无IP","11504463","6","","10000","0","","好！！（鼓掌）真有听书那味儿"
"两色彼天","女","无IP","26638151","5","快把我哥带走","10000","0","","打若陀的时候它踩几脚帝君的盾都挡不住，若陀你看看你都胖成啥样了，一脚的威力那么大"
"推巨石的西西弗斯-","男","无IP","22174750","6","","10000","0","12","这次的剧情真的太棒了，精妙绝伦，若陀boss设计的也很棒，啊啊啊啊啊啊啊啊啊刚打完激动的不行[星星眼][星星眼][星星眼][给心心][给心心][给心心]"
"鄙人苦茶","男","无IP","383550299","5","希萝Hiiro","10000","0","","我Diao你X的，这1.5版本深渊是哪个粪货设计的？真就来恶心人了吧，ch阴兵上线,？？？？？？"
"LanH_teez","保密","无IP","15190313","6","","10000","0","","今早出的钟离，太香了太香了"
"黑猫会梦见勇者吗","保密","无IP","176474317","6","","10000","0","","新人第三十抽出了七七，能玩吗"
"吃竹子的企鹅","保密","无IP","43802125","5","","10000","0","","氪金出的！幸好也没歪！"
"秋已为期终会归","保密","无IP","390480015","5","","10000","0","","能不能壶内放置指南针？我房子想要精确坐北朝南"
"落繁缕","男","无IP","14337882","6","","10000","0","","配音不错，中配最好，英配也不错，化真龙那一部分很出色。[doge]"
"落繁缕","男","无IP","14337882","6","","10000","0","","不是，说话说不过就拉黑，那确实精神胜利法有一手的，这点我不如mxzmvb。[呲牙]还说起公司无好坏来了，是非不分，混淆黑白有一手，也不知道是资本来这了，还是一群所谓的精神奴隶来了，笑死，原神是个好游戏，但这不耽误他mhy有些东西就是不行，看不得我说不好？那是什么成分，自己清楚。[呲牙]"
"-_老柴kovsky_-","女","无IP","215134053","6","","10000","0","","许愿帝君[大哭]"
"拾-八","保密","无IP","22220314","6","","10000","0","","亲爱的原神，请你把家园的负荷属性删掉吧，不行提高上限也可以啊，我不要仙力也可以的[doge]"
"叫我天罪啊hh","男","无IP","40055151","6","进击的冰糖","10000","0","","英配那段吼的真有劲啊[给心心]"
"叫我天罪啊hh","男","无IP","40055151","6","进击的冰糖","10000","0","","考虑过段时间回坑了[笑哭]"
"蟹老板的奇妙生活","保密","无IP","512850222","5","","10000","0","","是刀啊"
"去沙县整点蒸饺","男","无IP","19172438","6","","10000","0","7","针不戳"
"账号已注销","保密","无IP","39239287","0","","5000","0","8","好诗好诗"
"蕾姆是我大哥","保密","无IP","702322209","3","碧蓝航线","10000","0","","请问 原神可以结婚吗"
"shokne","保密","无IP","26459216","4","原神","10000","0","","这伏笔，妙"
"EternalBlueHZ","男","无IP","49475217","6","","10000","0","","陀子哥 nb"
"老咸鱼9号","保密","无IP","390235859","5","","10000","0","","这pv太帅了"
"麋鹿茸茸茸茸","保密","无IP","24602530","6","","10000","0","","好耶～抽到帝君啦～"
"勇敢妹宝直球出击","女","无IP","265548360","6","雪未来","10000","0","","十连出了钟离和烟绯，前来还愿"
"呈现呈现着","保密","无IP","1510357","6","","10000","0","","wr，英配好带感"
"j哥の","男","无IP","14229856","6","良辰美景・不问天","10000","0","","吐了，三十发两个迪奥娜一个女仆，米哈游这是故意要气死我"
"风吹扬尘","男","无IP","26436499","6","","10000","0","","坨子哥惨啊"
"死神裘卡","保密","无IP","73627","6","","10000","0","12","这个pv的质量也太高了！"
"来自兔兔星的拉菲","男","无IP","224632396","6","碧蓝航线2020","10000","0","","若陀龙王：被动：因为若陀龙王实力深厚，掩盖了自己的气息，他人无法查看他的信息[doge]"
"未央中黑夜","保密","无IP","169231010","5","","10000","0","","歪出一只卢锅巴就很气"
"Mjxdex233","保密","无IP","424636203","5","","10000","0","","钟离出了，但是红斯卡蒂没出，pcr井了个emt，这就是与帝君契约的代价吗"
"Guardwl","男","无IP","32808485","5","","10000","0","","说书人好棒啊[doge]"
"烁辰旭尧","保密","无IP","170111463","6","","10000","0","","她不起身，徐凤年便一直撑着伞。 老剑神李淳罡望向这一幕，瞪大眼睛。随即眼中黯然落寞缅怀追忆皆有。那一年背负那女子上斩魔台，一样是大雨天气，一样是撑伞。 世人不知这位剑神当年被齐玄帧所误，木马牛被折并不算什么，只剩独臂也不算什么，这都不是李淳罡境界大跌的根由，哪怕在听潮亭下被困二十年，李淳罡也不曾走出那个自己的画地为牢。原本与世已是无敌，与己又当如何?李淳罡想起她临终时的容颜，当时她已说不出一个字,可今日想来，不就是那不悔两字吗? !李淳罡走到大雪坪崖畔，身后是如他与绿袍女子场景的撑伞男女。她被一剑洞穿心胸时,曾惨白笑言:“天不生你李淳罡，很无趣呢。”,,李淳罡大声道:“天不生我李淳罡，剑道万古如长夜!”,,徽山103385264个剑士的全部佩剑一齐出鞘，向大雪坪飞来。龙虎山道士各式千柄桃木剑一概出鞘，浩浩荡荡飞向牯牛大岗。两拨飞剑。遮天蔽日。这一日,剑神李淳罡再入陆地剑仙境界。"
"-亚儿我要上厕索","保密","无IP","353483560","5","","10000","0","","原宝我一进尘歌壶就闪退，连游戏都给我关了怎么回事（我是PC端的）"
"Teio_official","男","无IP","455714637","5","","10000","0","","歪了刻晴，前来还怨,另外mhy真有你的，我零氪50级号上一共四金，三刻晴[捂脸][]"
"账号已注销","保密","无IP","39239287","0","","5000","0","8","感谢钟师傅拯救我的手残"
"喵帕斯小圆脸","保密","无IP","416483642","5","","10000","0","","帝君真个厉害人物，把肥坨雕成这样"
"V我49就好了啦","保密","无IP","12844930","6","","10000","0","","二命了，元气大伤，但还挺快乐[笑哭]"
"mnem0nic","女","无IP","114423828","6","","10000","0","9","太有感觉了，中配yyds"
"含笑饮砒霜--","女","无IP","38253838","6","","10000","0","7","我把帝君抽出来了，嘿嘿嘿嘿嘿圆满了"
"永远喜欢蟹哥","保密","无IP","483454488","5","","10000","0","","太惹了"
"口卩","男","无IP","34526754","5","","10000","0","","应该很快就无了"
"妖怪吃我一棒","男","无IP","12391377","6","贝拉kira","10000","0","","莫娜已出，前来还怨"
"口卩","男","无IP","34526754","5","","10000","0","","饭圈"
"风之旅者-","保密","无IP","6077988","6","琉晶之礼","10000","0","","陀子哥何时进池子啊"
"Ainyom","保密","无IP","107148760","5","墨清弦2nd生日纪念","10000","0","","烟老师：钟三在望舒客栈吃饭不给钱，想吃霸王餐，魈四不乐意了，想打一顿钟三，谁知钟三被魈四打了几巴掌后直接恼羞成怒用天星砸了望舒饭店，造成了大量人员伤亡，魈四还被砸成了脑震荡，试问这件事双方有什么责任，钟三该判什么罪?"
"绘梨衣のbear","男","无IP","525153478","4","","10000","0","","许愿钟离"
"真啊真白","保密","无IP","47332654","6","","10000","0","","一个月九十还是有点多啊"
"jobsiksm","保密","无IP","349997531","5","","10000","0","","已歪姥爷，但我还是好开心（米哈游糖葫芦）[给心心]"
"真啊真白","保密","无IP","47332654","6","","10000","0","","原神冲啊！,只要能少要我点钱我就一直玩下去。"
"美头登","保密","无IP","137717005","5","","10000","0","","我特别喜欢点睛那几秒的动画，这手，这眼睛，我可以舔一辈子"
"Kuron苦龙","保密","无IP","33189318","6","","10000","0","","虽然第一次看没啥感觉，但看完传说任务第二幕后，这越听越有味，这次英配也是非常不错啊。"
"英灵观星","保密","无IP","302333483","5","","10000","0","","让猿飞日斩来配说书人如何[吃瓜]"
"jnshdhkkw","保密","无IP","454053129","5","","10000","0","","抽完帝君，手欠想给魈垫垫池子，结果出来一只刻晴，那就和香菱打超载吧。,呜，运气总用在奇奇怪怪的地方(ω` )"
"空の言弹","保密","无IP","252798093","5","星座系列：水瓶座","10000","0","","虽然若陀本身并不是摩拉克斯雕出来的，但不用这种神化的说法就不能让其更像个神话了"
"叹雪Moia","男","无IP","2206800","6","","10000","0","","原神长草对策研究委员会（828562902）招人啦~见到这条评论就说明我们很有缘分，快来一起家园串门互相买货白嫖群友！[Hiiro_Hii皮笑脸][Hiiro_Hii皮笑脸]"
"发光的唐荒","男","无IP","39338416","6","春季特辑・二月律动","10000","0","","从今天开始，求加强77命座，歪77命座太尼玛痛苦了。你给一个奶妈命座里放个增加普攻伤害，你到底几个意思噢"
"冰雪聪明德莉莎","保密","无IP","378801897","6","","10000","0","8","bgm真的杀疯了"
"Mxbabyl","保密","无IP","510695859","5","","10000","0","","。."
"恰sorcerer","男","无IP","695924440","5","EveOneCat2","10000","0","","50发中了帝君[热词系列_妙啊][2233娘_耶]"
"氧化铝","男","无IP","6453388","6","原神","10000","0","","英配介绍若坨故事的诗，突然想到d爷，d爷也总爱说诗"
"阿比盖尔ノ威廉姆斯","保密","无IP","39159171","6","2021拜年纪","10000","0","","若坨：摩拉克斯就是你把我雕这么胖的[生气]"
"ZHI森","男","无IP","296891517","6","","10000","0","","今天原神健康系统时间会三个小时吗"
"TTle2333","保密","无IP","511840440","4","","10000","0","3","小保底歪了莫娜，又补了40抽才拿到钟离，惨 真的惨"
"建国同学l","保密","无IP","399874149","5","EveOneCat2","10000","0","","啥时候服装系统实装啊，钟离能换这套可太帅了"
"AUTO12M","保密","无IP","177362409","6","","10000","0","","连吃两次大保底了。。。"
"Mahoganyの","男","无IP","26236139","6","","10000","0","","我想象了一个画面，温蒂骑着特瓦林在空中飞翔，钟离坐在若坨身上在大地上奔跑，两人两龙并肩作战"
"琪亚娜早点回家鸭","女","无IP","70529058","5","原神","10000","0","","我就想去看看其他语言怎么翻译... 尤其是英文。"
"扬尘清风","男","无IP","61239666","6","","10000","0","","mosi mita dada！"
"走地狼呼噜起飞","保密","无IP","321801424","6","","10000","0","10","老公"
"小友凌青","男","无IP","389373309","4","","10000","0","","原神出bug了吗，我打11－3总是卡退[大哭]"
"一笑奈何dx","男","无IP","106174813","6","","10000","0","","有一说一，深渊是给原石的，你说骗氪？会有傻子为了拿原石氪金？那不是有病吗？深渊又没有pvp又没有排行榜，半个月才更一次又成不了你原石的主要来源，骗氪是你自己脑补的？深渊高层本身就不是给手残党和低于五十级的玩家预备的，深渊又不卡你关键资源。"
"是菘啊","男","无IP","400992714","5","EveOneCat2","10000","0","","加油，兄弟们[doge][doge]"
"是菘啊","男","无IP","400992714","5","EveOneCat2","10000","0","","兄弟们，一发十连完事儿，把欧气给你们"
"假装偶遇","保密","无IP","614692761","5","","10000","0","","许愿钟离，出必还愿[tv_抓狂]"
"rubsj","保密","无IP","505131398","4","","10000","0","","我单抽抽中钟离。"
"什乐","男","无IP","23122479","6","早稻叽","10000","0","11","这次活动主要是三只小的比较麻烦吧 跑起来打不到人都麻了 但是多尝试几次 争取在刚开始直接把两只小的秒掉就可以节省很多时间了"
"曦月ゅ","保密","无IP","93871267","6","","10000","0","","已经百万了，帝君牛逼"
"Lurskii","保密","无IP","33492225","6","","10000","0","","英配的田铁嘴加中配的钟离，就完美了"
"绝望圣约","保密","无IP","91803357","6","","10000","0","","歪了莫娜，特来抱怨"
"呆唯_Official","男","无IP","21743342","6","欧皇","10000","0","","出个昆君吧[笑哭]"
"一只口嗨菌","保密","无IP","154309685","6","C酱です","10000","0","7","nt深渊你游药丸"
"NB的卡怪","保密","无IP","86235254","5","","10000","0","","钟师父2命了，多久出专武器啊"
"往逸云末","女","无IP","1965266","6","","10000","0","","甘雨啥时复刻，真是玩不了了"
"Nimarui","保密","无IP","323752631","6","","10000","0","","这深渊的使徒存粹来恶心人的吧，这个盾真尼玛恶心[笑哭]"
"-暮夕朝-","女","无IP","9062416","6","原神","10000","0","","宝，能不能快出若陀本战斗bgm[哭泣]我好想知道唱词都唱了啥呀！"
"_xwws_","保密","无IP","335768905","5","","10000","0","","深渊和活动把我打成傻子了"
"在云间浅眠","保密","无IP","248510104","5","","10000","0","4","12-3给我打麻了"
"锦依卫zby","男","无IP","182552515","6","","10000","0","","可还行 [脱单doge]"
"芝士奶酪蛋糕_","保密","无IP","54961022","6","初音未来13周年","10000","0","","许棕哲说书人永远的神"
"n弥E","保密","无IP","368309238","5","2021拜年纪","10000","0","","我的钟离会卖牛杂[热词系列_知识增加]"
"bgb羊驼君","保密","无IP","440988901","5","","10000","0","","日版说书人没内味"
"小玖夜夕","保密","无IP","340456052","5","","10000","0","","日配后面的诗歌部分感觉也没你们说得那么难堪"
"asimov12","男","无IP","165455","6","","10000","0","","若陀（照镜子前）：摩拉克斯，谢谢你,若陀（照镜子后）：钟离NMMP"
"Dear印象","男","无IP","330165619","5","","10000","0","","二命钟离没了，特来抱怨（81抽歪的琴也是醉了）[无语]"
"芙姆","男","无IP","8629375","6","","10000","0","","博爱的恩典～"
"冯补缺","保密","无IP","237683442","6","","10000","0","","绘本啊[跪了]"
"无法接受这个名字","男","无IP","498282845","5","","10000","0","","请问网上的黑料是真是假？"
"浮顾","保密","无IP","401750171","5","","10000","0","","钟离出了。害。月卡党充钱了[撇嘴]"
"绯斋咸鱼","女","无IP","41892424","5","","10000","0","","若陀年纪比帝君大吧[思考]"
"深林静飞鸟","保密","无IP","3253155","6","星座系列：双鱼座","10000","0","2","已出 前来还愿（还想要个烟绯啊啊啊啊[打call]）"
"颐","保密","无IP","259557718","6","hanser","10000","0","","钟离池歪了来抱怨一下[热词系列_我裂开了]"
"微草成原","保密","无IP","4612636","5","#EveOneCat","10000","0","","刚刚歪了七七！哈哈哈哈！怎么这么会歪！本来还担心小保底直接出个一命帝君或者歪别的常驻，没想到今天常驻五星全齐了，一次都没歪重复过！这就是又非又欧的感觉吧，大保底也有了，可以抽优或者万叶了诶嘿！[hanser_冲鸭]"
"幸鸢","男","无IP","36403386","6","","10000","0","10","借个楼，胡桃用2千岩+2魔女好还是4魔女好"
"铃山鹿海御浪前","男","无IP","147125289","6","","10000","0","7","这英配好燃啊"
"-胡桃桃桃-","保密","无IP","398731672","5","","10000","0","","月初十发，钟离（第16发）加俩班尼特[doge]"
"摩根的狗狗","保密","无IP","123354452","6","","10000","0","5","破百w了[喜欢]"
"大吉岭的好茶","保密","无IP","280522415","6","国民老公带回家","10000","0","","BGM是什么啊？有发吗？"
"神都烟火","男","无IP","22622789","6","三周年恋曲","10000","0","","骗骗花脱战能不能修一下。打了四轮跑回去三轮就很离谱好吧?[疑惑]"
"LL共此r","女","无IP","36596269","6","","10000","0","10","冲帝君一命歪了姥爷[笑哭]"
"berserker-胡桃","保密","无IP","190855152","6","","10000","0","10","有没有大哥能把英语字幕这出来啊"
"云曦羽风","保密","无IP","502111832","5","","10000","0","","帝君又有一个了，女仆4命了，给个烟绯吧亲"
"660E58A87FCE96EA","保密","无IP","521856491","5","","10000","0","","二十分发，五紫一金，没歪，还好，就是感觉运气差了。。。"
"好想吃炸鸡desu","保密","无IP","454695821","5","","10000","0","","100万了！！！"
"玫兰莎","女","无IP","625722753","5","明日方舟音律系列","10000","0","","帝君啊，为何不来啊，刚才抽的时候转圈圈了(一般都是加载数据)，然后给我激动的，一看是紫光，tm只是网卡了，艹"
"玛亚涅-红莲","保密","无IP","473006010","4","","10000","0","","白嫖降临"
"我玩原铁舟怎么你了","女","无IP","332096447","6","","10000","0","","没出帝君，前来抱怨[大哭]"
"o子弹榨的好","女","无IP","397866523","5","","10000","0","","小保底没歪，开心"
"神偷老K","保密","无IP","357773257","4","","10000","0","","求BGM"
"云堇堇","保密","无IP","359287122","6","喂，看见耳朵啦","10000","0","11","写文本的一定和翻译有仇[tv_尴尬]"
"娜塔莎的夫人","保密","无IP","234025569","5","","10000","0","","pv很好看，但是剧情里我感觉我才是应急食品。[笑哭]"
"这里缺少一个好名字","男","无IP","383761534","5","","10000","0","","打破8888"
"雨忆七","保密","无IP","353783916","6","","10000","0","","前来还愿！"
"这都是什么啊魂淡","男","无IP","65412129","6","","10000","0","","原来龙龙算是帝君的“大表哥”啊。。。那没事了"
"bili_471585802","保密","无IP","471585802","5","","10000","0","","钟离什么时候出钢管舞[doge]"
"梓幕-","女","无IP","484514553","5","","10000","0","","所以真的不来个若陀龙王跟随，或者武器吗？太心疼他们两个了[战双_哭哭]"
"Mikasaa210","保密","无IP","1324391628","4","","10000","0","","啥时候给安卓适配下手柄啊"
"w墨1白w","保密","无IP","525621200","3","","10000","0","","保底在等我"
"明晴缓缓","保密","无IP","30021065","6","","10000","0","","什么时候把女士加入祈愿[脱单doge]"
"时光流韵逝水年华","保密","无IP","472356222","5","","10000","0","","钟离退休天天听说书哈哈哈"
"AKA_LordLu","男","无IP","300703998","6","","10000","0","","一发入魂，前来还愿！[脱单doge]"
"阿萨姆兑老干妈","保密","无IP","7754956","6","三周年恋曲","10000","0","","《我只是来看看每个版本是怎么翻译后面那段诗的》[doge]"
"予色以绿","男","无IP","178348798","6","","10000","0","","已出钟离，前来还愿[星星眼]"
"我永远喜欢然宝","保密","无IP","5742848","6","","10000","0","","从前.... 后面爷忘了100142597[脱单doge]"
"-NamAE-","保密","无IP","55519483","6","","10000","0","6","中配岩王爷yyds，说书人也很好。英配岩王爷不错，说书人很强。韩配岩王爷的声线也挺不错的，但是说书人有点拉。日配，没什么好说的。这个pv个人感觉，中 ≈ 英＞韩＞日"
"Kalenx","保密","无IP","50755292","6","","10000","0","","做了一下这pv的bgm"
"奥莉薇亚单推人","保密","无IP","563477023","5","","10000","0","8","殿堂英配，好！"
"桃姜丝","保密","无IP","24976319","6","","10000","0","","不说别的，让我看看歪出琴的有多少[热词系列_我裂开了]"
"一二月的细雨","保密","无IP","321311088","5","","10000","0","4","mhy快出动画吧"
"Autism_喵","保密","无IP","507144353","5","","10000","0","","27的抽出来钟离"
"馥是心头好","保密","无IP","229700407","5","国民老公带回家","10000","0","","阿离 咱明年见[微笑][大哭]"
"鸽子与熊","保密","无IP","417291077","5","","10000","0","","是的，我又来吹两位的配音了[妙啊]"
"天涯丶浪人","男","无IP","237217916","5","","10000","0","","看我空间（俺是欧皇）"
"anzaki哒","保密","无IP","228267485","6","粉妆玉琢・头像框","10000","0","5","真不戳[doge]"
"如花似堇","保密","无IP","356755093","5","总之就是非常可爱","10000","0","","金石迸碎荡尘埃，磐山纡水尽为开,创龙点睛得助力，盘桓遂引雨露来"
"汤不愣","女","无IP","179393173","6","崩坏3・天穹流星","10000","0","","这次英配杀疯了！！！！！！！好有感觉！[多多poi_冲冲冲][多多poi_冲冲冲][多多poi_冲冲冲]"
"我永远喜欢莲酱","男","无IP","90929358","6","","10000","0","","好耶～有钟离了"
"甘雨姐姐我爱你","保密","无IP","1188891579","5","","10000","0","","许愿帝君出必还愿"
"猿身切割者","男","无IP","485717264","5","","10000","0","","我觉得这个说书人声音超棒"
"遗言顶真","保密","无IP","24961153","6","","10000","0","","若陀龙王的bgm太厉害了"
"CheesyRELX5","保密","无IP","95709367","6","","10000","0","","这回英配可真有味"
"落霞597014","男","无IP","198370210","3","","10000","0","","啥时候做优化啊"
"风其实不幽默","男","无IP","34432627","5","","10000","0","","钟离歪了，莫娜又坏我好事"
"贝贝塔小鹿","女","无IP","51417137","5","阿梓从小就很可爱","10000","0","","哭了，歪了琴呜呜呜[大哭][大哭][大哭][大哭][大哭][大哭]"
"名字无法二个字","保密","无IP","9863529","6","","10000","0","10","让坨子哥变肥的真凶找到了！"
"ZADMN","保密","无IP","2247430","6","citrus","10000","0","","歪了莫娜，我哭了[大哭][大哭][大哭][大哭]"
"薯条要炸三分钟","男","无IP","269528371","6","","10000","0","","尘世闲游变奏的BGM火速上线！火速啊！"
"Apotheosis丶","男","无IP","4377932","6","","10000","0","","[打call]钟离真是传统文化的精髓，我爱死他了"
"蘑菇ava","男","无IP","14045485","6","","10000","0","","终于出了呜呜呜"
"上杉不知火","保密","无IP","477699916","5","","10000","0","11","没法子，就存了20抽，就抱烟绯回家了[笑哭]！"
"4G3G","男","无IP","39388080","5","","10000","0","","帝君已出，特来还愿"
"桉的四叶草","保密","无IP","431062624","5","","10000","0","10","兄弟们，韩版前面一分钟老头空耳在下面，虽然没有胡萝卜那样活跃..."
"大号找不回了","保密","无IP","473355003","5","","10000","0","","我想要这个的纸雕灯，秋梨膏"
"普琉法ZERO","保密","无IP","487658799","5","总之就是非常可爱","10000","0","","韩配确实不错，但是奈何韩语实在太拉跨[笑哭]"
"-亦奇-","保密","无IP","195416524","6","原神","10000","0","","帝君已出前来还愿[原神_点赞][原神_点赞]"
"水月小姐的狗","保密","无IP","442185575","2","","10000","0","","那我再说一遍）笑死，一个饭圈公司的饭圈配音培养了一群饭圈粉丝，还什么中文配音比别的都好，孝死我了，日本配音不比你们强？看你们舔的这个样，有够ex"
"京局CR400BF-Z","男","无IP","393916376","5","洛天依・最美的夜","10000","0","","许愿钟离"
"任青涯","男","无IP","15643197","6","","10000","0","","陀子哥进卡池！"
"安东诺夫卡の苹果","保密","无IP","638615946","5","","10000","0","","我想知道我这阵容要不要抽钟离。冒险等级37级。目前主c北斗（实在没别的c了，主要刚开始我直接抽了二命出来）七七，温迪，加个重云。就差个火主c，想来个胡桃，可又不知道等到什么时候。我又看到好多人在说钟离不抽太亏了，就很烦，到底是等火c，还是抽钟离。[撇嘴][撇嘴]"
"白发戴花_君莫笑","女","无IP","17441580","6","","10000","0","","今天打了五遍陀子哥[脱单doge]"
"草莓红茶拿铁","保密","无IP","10712151","6","罗小黑战记","10000","0","","这次的英配真的惊艳到我了，听的时候就感觉草！燃起来了！[热词系列_妙啊]"
"玖万里风鹏正举","保密","无IP","429854191","6","","10000","0","","Bedrock 基岩"
"reloaded9","保密","无IP","22977568","6","","10000","0","","这波和阿b配合的不是很好"
"又没我啊","保密","无IP","396377900","5","魔法学院","10000","0","15","[热词系列_爱了爱了]"
"chaosAA","保密","无IP","23450397","5","","10000","0","","rnm,1.5前瞻直播放稻妻前瞻图，然后1.6继续过羽球节??搁这画饼呢??"
"TY赤血","男","无IP","15202739","6","明日方舟","10000","0","","派蒙憨憨交流群招人啦！887399351 群里有群主自己做的憨逼机器人小助手，可以提供每日人品测试，自动攻略查找（人工？），还有各种万氪大佬在线回答萌新问题，很适合大家一起来讨论，快来加入吧！"
"麋鹿茸茸茸茸","保密","无IP","24602530","6","","10000","0","","英配起飞"
"冰灵紫雅","女","无IP","387845496","6","良辰美景・不问天","10000","0","","英配好棒[洛天依_goodjob]"
"步悠by","保密","无IP","44375446","6","","10000","0","","英配有股中土味[热词系列_好耶],韩配声音倒是很不错，就是我们不习惯,日配速度太快了，帝君声线过于年轻反倒是最后一名"
"蠢货受死吧","男","无IP","26116486","5","","10000","0","","想问一下有没有手机党更新原神v1.5后就很卡的？之前都不卡，更新v1.5后今天打那个碎片卡得几乎没法玩。"
"卡慕你睡了吗我睡不着","女","无IP","1969224891","5","","10000","0","4","歪了七七，前来还怨"
"参","女","无IP","489545","6","","10000","0","","有一说一，我觉得说书人配得也很有感觉[小电视_赞]"
