"昵称","性别","IP","UID","等级","装扮","用户权重","获赞数","粉丝团等级","评论"
"朝既昌","保密","无IP","27559866","6","","10000","8885","","陈老师要求去掉某一个乐器那段很能感受到中日文化的一些不同了。这种事情在日本人看来会非常非常失礼，上来提意见那位可以看得出都有一点生气了。在中国人看来虽然确实也是后面陈老师所说的那种处理方式更好，但之前那样处理一般也只会被认为不够细腻，并不是太严重的问题，所以陈老师和翻译也没有立马察觉不妥。非常值得借鉴[藏狐]"
"芙列雅吉欧拉尔","女","无IP","85114049","6","","10000","4245","","尺八演奏者：寄田真乃。本人15岁取得师范头衔，成为日本最年轻师范。15岁在『 尺八本曲全国献奏大会』上作为评委演奏。同年师从青木慕。19岁入学东京艺术大学，21岁开始全世界公演。她本人并未获得什么奖，因为很多比赛的评委都没有达到师范，她想参加比赛的时候，官方只允许她作为评委参加了"
"落木之夏","男","无IP","1003914","6","","10000","2310","","我觉得有一个可能的冷水值得一泼。就是原神的音乐演奏阵容，可能稻妻就会是阵容最豪华的唯一一次了。,,索尼音乐在日本音乐界的体量和声望是很难在之后的国家/区域复制的。这次得益于索尼的帮助，加上日本本身音乐界在世界范围内的顶尖水平，才能凑齐如此绝顶的演奏家阵容。之后怕是真的很难再超越了。,,所以希望各位不要过于拔高期望，不要觉得之后每个国家的音乐都能有如稻妻一般豪华的阵容了，作曲本身的质量可能还能保持，但演奏阵容和质量真的很难超越稻妻了。"
"一剑豪","男","无IP","26037180","6","","10000","879","","其实那段现场改动的地方，就是音乐人职场上正常的一幕，作曲家在听了实录效果后觉得还是midi更好，合作方是觉得既然你们觉得midi更好那么事先就应该商量清楚，但是有的时候真的是不现场听，你永远不知道究竟合不合适，这可能就是创作者和演奏者需要去通过不断磨合和尝试去适应去改善。虽然说当下出现这种士气的影响或者说是负责人的不满可能也是在所难免的，但其实最好的方法确实又是当场越早提出不需要越好，毕竟最终成品的质量和完成度才是第一位的，一个项目到最终成品，过程中发生摩擦和不顺利真的可以说是很正常了，而且又是这种线上对接。"
"雾雨艾拉","保密","无IP","10024854","6","雪未来","10000","10465","","冷热知识：那位负责东京爱乐指挥的白发指挥家是栗田博文，指挥过16年至今每年一次的初音交响演奏会，和你的名字原唱联合现场交响配乐演奏会，ff14、怪兽猎人等演出也是他来指挥，真正的老二刺螈[脱单doge]他指挥的时候很风趣，和观众也有很好的互动性，例如在17年初音演奏会在萝卜汁曲子双面指挥观众的拍掌和乐团，结束后还拿初音的小牌子给观众表达感谢，返场安可还皮了好几下。是一位很好玩的指挥家了。[脱单doge]"
"壹伍贰__","男","无IP","5875422","6","","10000","3689","","《关于因为听说玩家很喜欢战斗音乐，我就又搞了一首谱子这件事》by 陈致逸老师,,战斗音乐是唯一一类时长接近4-6分钟的长曲目，为了满足玩家需求（和让我们刮痧海乱鬼的时候不要太过暴躁）陈老师又非常贴心地爆肝了一首战斗乐。,,所以啊，为了尽情享受陈老师的创作成果，我倡议广大旅行者们，在刮海乱鬼武士之前，可以把圣遗物都卸了（狗头）"
"到底是很萌","男","无IP","15629552","6","","10000","3314","","我就想问个问题[笑哭]，稻妻的音乐制作经费一千万怕是打不住吧，请的个个都是人才，耗时颇久，又是去日本又是去英国，诚意满满，我真是超喜欢原神"
"Eight_Hunter","男","无IP","67140015","6","","10000","4765","","“陈老师这样一位中国人写的日本风的曲子，是日本风的旋律像日本又不太日本，有种跨越时空的美感”,真的是会有这样的情况！想起大学时有一位外国留学生，中文并不熟练，但他用中文写的现代小诗总是让我们震惊无比，有种说不出的美感。或许文化之间，这种地道却又不完全地道的，融合了异域风情的艺术，总会有别样的风味"
"sinezx","男","无IP","39374057","6","hanser","10000","1572","10","作为前乐团的打击乐手，中间那段高情商确实还蛮有趣的，与管乐弦乐不同，除了定音鼓小军鼓这种重点乐器，其他乐手大部分时间除了在数拍子，就是看管乐弦乐排练。,像东京爱乐乐团这样的高水平乐团，任何一个打击乐手都应该是十八般武艺样样精通的，本来响板木鱼这类乐器存在感就低，一声令下又给砍掉了，直接把仅有的一点可怜的参与感也取消了，是很丧气的事情。"
"阿非利加大祭司","男","无IP","328069","6","","10000","1274","","我顺便说一下，陈老师反复说自己写的难了不好意思，并不是什么谦辞或者装逼。,,在传统作曲方法中，考虑到演奏难度乃至乐器性能是否能达到效果是作曲家必须掌握的能力。但是现今作曲大多依靠于用软件和音源制作，软件发声是不用考虑技术是否能达到的，你写出来什么音它就能发出什么音，别说超越演奏难度，就算超越乐器自身极限都完全不成问题，习惯了使用音乐软件制作音乐的作曲家，在进行需要乐队实录创作的音乐中，不小心习惯性的提高了写作出的演奏难度（即使有专门注意，也以极高的标准，毕竟只要有人曾经达到，在现代技术下就可以作为参考使用，但实际演奏中不能保证每个人都达到那个标准）。 作曲家创作的难度更多体现在灵感创造上而不是演奏水平。,,举个例子来说，其实这个就好像动作片导演为了美学设计出来的动作镜头，以成龙为标准参考设计，然后要求演员依照这个标准进行一样。并不是什么谦辞或者凡尔赛，是真的不好意思。"
"081mikawa","保密","无IP","404245379","3","","10000","631","","陈老师这样一位中国人写的日本风的曲子，是日本风的旋律像日本又不太日本，有种跨越时空的美感←これ本当にそう思います。私は日本人ですが、どこかかしいような荬猡工毪韦巳毡兢扦下いたことがない新しい音Sで、まさにFg世界の国々をモチ`フにしながらファンタジ`である「原神」にぴったりの音Sでした…[给心心]あと初めてR妻に行ったとき知ってる人いないし暗いしいし雷めっちゃ落ちてくるし心くて璃月にりたいよぉ～[大哭]って思ったんだけど、殛LBGMが今までいていたフレ`ズのアレンジで少し安心してとても勇荬颏猡椁à蓼筏俊Ｎ颐钦姘陈老师！谢谢"
"Virgothic","男","无IP","2775906","6","","10000","1649","","看完之后有点怅然，璃月的音乐的确用了很多民族乐器，但是请来的民乐演奏家分量确实不如日本这几位，纪录片中古筝、二胡的镜头也不如日本筝、尺八和三味线的镜头多。,其实可以理解，璃月音乐实录那时原神还没有公测，而如今原神用一年的时间成长为了世界级的IP，影响力和能调动的资源不可同日而语。,有点期待须弥的音乐了。"
"如水似风","男","无IP","711481","6","","10000","707","","之前也看过蒙德和璃月的幕后视频都是5分多钟看得不够过瘾，这次竟然有26分钟 惊喜。,因为曾经也接触过乐器演奏也参加过交响乐团的演出，所以更加能以一个音乐人的角度来欣赏原神里的曲子(虽然跟视频里的大佬们比不配叫音乐人)。,这么多年来玩过的游戏也好看动漫也好，通过各种途径接触过很多和风音乐。,首先想说的一点 和风音乐跟一般中国传统音乐不同，传统日本音乐较中国风音乐来说要委婉阴柔，比较常用小调而非自然的大调。,初接触者可能根本欣赏不来这种音乐，也包括我。但慢慢了解后也能够欣赏其中独特的内在美。,,最开始认真欣赏和风音乐的契机，还是因为东方的同人作品《梦想夏乡》第一集片头介绍幻想乡的时候。,随着BGM响起的旁白让我脑子里浮现出了伴随着樱花飘落与世无争的桃源乐土的景象，真的感觉好美。,后来也逐渐的了解了一些日本传统经典的包括《樱花》之类的曲子。,不过我听的不是真正传统的日本古风乐，那个我到今天也欣赏不来。,我听的比较多的经过现代化音乐修饰的和风音乐，有种独特的物哀之美但又有一番别样的生机在里面。,,游戏里初到稻妻 在听过稻妻音乐后就能感觉到演奏的难度非常大。但看过视频后才发现此次稻妻音乐的制作难度远远超出我的想象。,看完后只想对中日双方的制作者说声辛苦了，双方都付出了相当大的精力来促成了这次的合作。,尤其是看到演奏三味线的小山丰老师说：“此前从未进行过如此高难度的演奏，但希望通过这次机会向全世界展示日本的传统乐器。""这句话让我自豪又难过。,自豪的是我们国内制作的游戏能达到这样的程度，难过的是这又何尝不是中国传统乐器演奏者的心声呢？,之前也看到过很多群里的朋友和论坛的贴子说：稻妻音乐很“阴间”“压抑”，看到这里我其实挺难过的。,因为一些历史原因(具体这里不想多提 只聊音乐)可能大伙对于一些有日本元素的东西有种反感在里面也可以理解，当然也有人是真欣赏不来稻妻音乐这也正常。,但还是希望大伙仅仅从音乐的角度来静静的品味。而不仅仅一句“阴间”就总结了稻妻的音乐。换个角度从作曲家和演奏者来看，这其实是非常让人伤心的。,蒙德的音乐我很喜欢，稻妻的音乐我也喜欢，当然最喜欢的还是璃月音乐。,3个地区三种不同的风情的音乐主题，演奏出了别样的提瓦特世界。,音乐无国界，音乐也是人类共同的语言。希望大家能多一点耐心，多一点包容，多一点尊重。"
"空花aya","女","无IP","1936831","6","雪未来","10000","200","","做口译的看这段直接汗如雨下…任务太艰巨了许多专业名词以及对音乐细节的要求要表达首先就很考验功底，又是远程交流，更难体会到心情等等。其实不要打击乐那段翻译如果再想一下委婉的措辞或是再跟陈老师提一下意见再提出来会更好的～中日之间的措辞还是有所不同的，沟通交流就是这样的事儿，所以翻译的压力真的很大啊！！已经很优秀了！！"
"纱世由里official","男","无IP","108597262","6","星座系列：巨蟹座","10000","550","","虽然但是，中国的琵琶，箜篌，唢呐等乐器也是当初由波斯传来，却在我们这边发扬光大。这也不能以“这些是由波斯传来的”来否认这些是我国古代的传统乐器吧？我觉得一种文化最重要的或许不是起源，而是它赋予生活在这种文化下的人的意义[藏狐]"
"音o芽","男","无IP","25640","6","","10000","363","","其实看到翻译君的翻译那一下，我一身冷汗，日本人很少会坚决的去拒绝别人，那么直白的译出去就还挺伤人的，既要熟悉乐理还要熟悉文化对翻译的要求也是很高的，两个不同文化的阵容能好好磨合下来带来这么棒的音乐其实真不容易"
"MikeLee23333","男","无IP","11974714","6","绯赤艾莉欧","10000","160","","我看到有很多人把交响乐团与作曲家比作甲方和乙方，说实话，这种比喻很不恰当。交响乐团中的每一位乐手都可以称之为演奏家，可以说是撑劲了自己的前半生心血坐在这个位置。而且对于音乐的演奏并不是单纯的工作，更是自己无数的积累，对音乐的理解的表现。所以每一位坐在团里的乐手都应该得到应有的尊敬，正如以为军人。[保佑]"
"橙下之萌","男","无IP","23173271","6","","10000","6571","","长线游戏内容质量的起起伏伏都是正常的事，但音乐这个方面从来都没有令人失望过。,在原神做的不好时，我们可以表达不满。,但在原神表现自己的好的一面时，希望大家不要吝啬自己的赞美。"
"-忍凝眸-","男","无IP","11286994","6","","10000","3814","","油管评论里好多人说翻译小哥好可怜w"
"付费宅","保密","无IP","103068269","6","","10000","1689","","满屏的商业互吹是咋回事，这种高度的艺术家还要互吹？这是对双方专业的欣赏和肯定，啥时候欣赏别人的优点都成互吹了。[思考]"
"飒飒飒真好","保密","无IP","471788490","5","","10000","3563","","【旅人的弦歌――《原神》璃月音乐的幕后-哔哩哔哩】https://b23.tv/wYpBxf,【旅人的韵律――《原神》游戏音乐的幕后-哔哩哔哩】https://b23.tv/nbH9E7"
"池希研","保密","无IP","41001365","6","","10000","287","","好有魅力啊，这种不同文化的有相同爱好的人在一起，用特别的方式交流，磨合。甚至连困难都充满了快乐。"
"Eight_Hunter","男","无IP","67140015","6","","10000","4765","","“陈老师这样一位中国人写的日本风的曲子，是日本风的旋律像日本又不太日本，有种跨越时空的美感”,真的是会有这样的情况！想起大学时有一位外国留学生，中文并不熟练，但他用中文写的现代小诗总是让我们震惊无比，有种说不出的美感。或许文化之间，这种地道却又不完全地道的，融合了异域风情的艺术，总会有别样的风味"
"如水似风","男","无IP","711481","6","","10000","707","","之前也看过蒙德和璃月的幕后视频都是5分多钟看得不够过瘾，这次竟然有26分钟 惊喜。,因为曾经也接触过乐器演奏也参加过交响乐团的演出，所以更加能以一个音乐人的角度来欣赏原神里的曲子(虽然跟视频里的大佬们比不配叫音乐人)。,这么多年来玩过的游戏也好看动漫也好，通过各种途径接触过很多和风音乐。,首先想说的一点 和风音乐跟一般中国传统音乐不同，传统日本音乐较中国风音乐来说要委婉阴柔，比较常用小调而非自然的大调。,初接触者可能根本欣赏不来这种音乐，也包括我。但慢慢了解后也能够欣赏其中独特的内在美。,,最开始认真欣赏和风音乐的契机，还是因为东方的同人作品《梦想夏乡》第一集片头介绍幻想乡的时候。,随着BGM响起的旁白让我脑子里浮现出了伴随着樱花飘落与世无争的桃源乐土的景象，真的感觉好美。,后来也逐渐的了解了一些日本传统经典的包括《樱花》之类的曲子。,不过我听的不是真正传统的日本古风乐，那个我到今天也欣赏不来。,我听的比较多的经过现代化音乐修饰的和风音乐，有种独特的物哀之美但又有一番别样的生机在里面。,,游戏里初到稻妻 在听过稻妻音乐后就能感觉到演奏的难度非常大。但看过视频后才发现此次稻妻音乐的制作难度远远超出我的想象。,看完后只想对中日双方的制作者说声辛苦了，双方都付出了相当大的精力来促成了这次的合作。,尤其是看到演奏三味线的小山丰老师说：“此前从未进行过如此高难度的演奏，但希望通过这次机会向全世界展示日本的传统乐器。""这句话让我自豪又难过。,自豪的是我们国内制作的游戏能达到这样的程度，难过的是这又何尝不是中国传统乐器演奏者的心声呢？,之前也看到过很多群里的朋友和论坛的贴子说：稻妻音乐很“阴间”“压抑”，看到这里我其实挺难过的。,因为一些历史原因(具体这里不想多提 只聊音乐)可能大伙对于一些有日本元素的东西有种反感在里面也可以理解，当然也有人是真欣赏不来稻妻音乐这也正常。,但还是希望大伙仅仅从音乐的角度来静静的品味。而不仅仅一句“阴间”就总结了稻妻的音乐。换个角度从作曲家和演奏者来看，这其实是非常让人伤心的。,蒙德的音乐我很喜欢，稻妻的音乐我也喜欢，当然最喜欢的还是璃月音乐。,3个地区三种不同的风情的音乐主题，演奏出了别样的提瓦特世界。,音乐无国界，音乐也是人类共同的语言。希望大家能多一点耐心，多一点包容，多一点尊重。"
"一婉苏夏","男","无IP","228085467","6","","10000","289","","我看这种视频还是很心平气和的（可以看到，大家都是在很用心的做音乐）很开心，如果没有人带节奏就更好了[锦鲤]"
"本来何处","保密","无IP","5663346","6","橘猫挂件","10000","671","10","中间有一段陈老师和日本乐团通过翻译来线上交流的场面，然后日方跟中方翻译说话的那个语气和态度，让我想到了平时上课和老师交流的时候了【苦涩】文化的差异真的需要去互相理解啊。,感谢陈老师和各位音乐家带来这么好的作品。,陈老师！！！！！！谢谢您！！！！！！！！！！！！！！！啊啊啊啊啊啊啊啊啊啊啊啊啊啊啊啊啊啊！！！！！！！原神的音乐太好啦！！！！！！！！！"
"旅行者荧","保密","无IP","54709719","6","花园Serena第二弹","10000","1630","7","一般来说信息转三手就会有翻译失真了，这个确实很明显的体会到了[OK]"
"涯角望火","男","无IP","28956237","5","","10000","1232","","为啥hoyomix的评没了[辣眼睛]"
"Virgothic","男","无IP","2775906","6","","10000","1649","","看完之后有点怅然，璃月的音乐的确用了很多民族乐器，但是请来的民乐演奏家分量确实不如日本这几位，纪录片中古筝、二胡的镜头也不如日本筝、尺八和三味线的镜头多。,其实可以理解，璃月音乐实录那时原神还没有公测，而如今原神用一年的时间成长为了世界级的IP，影响力和能调动的资源不可同日而语。,有点期待须弥的音乐了。"
"橙下之萌","男","无IP","23173271","6","","10000","6571","","长线游戏内容质量的起起伏伏都是正常的事，但音乐这个方面从来都没有令人失望过。,在原神做的不好时，我们可以表达不满。,但在原神表现自己的好的一面时，希望大家不要吝啬自己的赞美。"
"夏米丝","保密","无IP","26468668","6","","10000","1323","","看了记录片后，现在想一巴掌拍死内鬼暴露半成品和废案的demo.差点让许多老师们的心血付东流[热词系列_锤]"
"081mikawa","保密","无IP","404245379","3","","10000","631","","陈老师这样一位中国人写的日本风的曲子，是日本风的旋律像日本又不太日本，有种跨越时空的美感←これ本当にそう思います。私は日本人ですが、どこかかしいような荬猡工毪韦巳毡兢扦下いたことがない新しい音Sで、まさにFg世界の国々をモチ`フにしながらファンタジ`である「原神」にぴったりの音Sでした…[给心心]あと初めてR妻に行ったとき知ってる人いないし暗いしいし雷めっちゃ落ちてくるし心くて璃月にりたいよぉ～[大哭]って思ったんだけど、殛LBGMが今までいていたフレ`ズのアレンジで少し安心してとても勇荬颏猡椁à蓼筏俊Ｎ颐钦姘陈老师！谢谢"
"sinezx","男","无IP","39374057","6","hanser","10000","1572","10","作为前乐团的打击乐手，中间那段高情商确实还蛮有趣的，与管乐弦乐不同，除了定音鼓小军鼓这种重点乐器，其他乐手大部分时间除了在数拍子，就是看管乐弦乐排练。,像东京爱乐乐团这样的高水平乐团，任何一个打击乐手都应该是十八般武艺样样精通的，本来响板木鱼这类乐器存在感就低，一声令下又给砍掉了，直接把仅有的一点可怜的参与感也取消了，是很丧气的事情。"
"@花琥珀糖","女","无IP","100167050","5","","10000","962","","好家伙，刚刚看到的关于尺八的高赞科普评论马上就没了[藏狐][藏狐]"
"范德宏","保密","无IP","43756670","5","","10000","1382","","希望层岩巨渊的音乐能看到大佬们用一下唢呐[原神_哇]"
"这把我们就刷出破势","保密","无IP","13064229","6","","10000","490","12","大家也记得回去看看璃月ost的访谈BV1xp4y16761[打call]时隔一年新体验"
"某种名字是丶的生物","保密","无IP","507549239","5","希萝Hiiro","10000","344","","演奏家：下次还填非常困难！[捂脸][捂脸][捂脸]"
"三千潮","男","无IP","352598789","6","干物妹！小埋","10000","2113","8","给你们半年，整上须弥的OST，《足迹》里最带感的音乐就是须弥了[阴险]"
"混乱棉花糖总部","保密","无IP","351093236","5","","10000","497","10","游戏不愧是第九艺术，光是音乐就汇聚了如此心血，其整体的艺术性……真是令人惊叹！"
"阿非利加大祭司","男","无IP","328069","6","","10000","1274","","我顺便说一下，陈老师反复说自己写的难了不好意思，并不是什么谦辞或者装逼。,,在传统作曲方法中，考虑到演奏难度乃至乐器性能是否能达到效果是作曲家必须掌握的能力。但是现今作曲大多依靠于用软件和音源制作，软件发声是不用考虑技术是否能达到的，你写出来什么音它就能发出什么音，别说超越演奏难度，就算超越乐器自身极限都完全不成问题，习惯了使用音乐软件制作音乐的作曲家，在进行需要乐队实录创作的音乐中，不小心习惯性的提高了写作出的演奏难度（即使有专门注意，也以极高的标准，毕竟只要有人曾经达到，在现代技术下就可以作为参考使用，但实际演奏中不能保证每个人都达到那个标准）。 作曲家创作的难度更多体现在灵感创造上而不是演奏水平。,,举个例子来说，其实这个就好像动作片导演为了美学设计出来的动作镜头，以成龙为标准参考设计，然后要求演员依照这个标准进行一样。并不是什么谦辞或者凡尔赛，是真的不好意思。"
"音o芽","男","无IP","25640","6","","10000","363","","其实看到翻译君的翻译那一下，我一身冷汗，日本人很少会坚决的去拒绝别人，那么直白的译出去就还挺伤人的，既要熟悉乐理还要熟悉文化对翻译的要求也是很高的，两个不同文化的阵容能好好磨合下来带来这么棒的音乐其实真不容易"
"纱世由里official","男","无IP","108597262","6","星座系列：巨蟹座","10000","550","","虽然但是，中国的琵琶，箜篌，唢呐等乐器也是当初由波斯传来，却在我们这边发扬光大。这也不能以“这些是由波斯传来的”来否认这些是我国古代的传统乐器吧？我觉得一种文化最重要的或许不是起源，而是它赋予生活在这种文化下的人的意义[藏狐]"
"空花aya","女","无IP","1936831","6","雪未来","10000","200","","做口译的看这段直接汗如雨下…任务太艰巨了许多专业名词以及对音乐细节的要求要表达首先就很考验功底，又是远程交流，更难体会到心情等等。其实不要打击乐那段翻译如果再想一下委婉的措辞或是再跟陈老师提一下意见再提出来会更好的～中日之间的措辞还是有所不同的，沟通交流就是这样的事儿，所以翻译的压力真的很大啊！！已经很优秀了！！"
"强酸柠檬本精","保密","无IP","310156698","5","","10000","277","","我没有想到，我一个臭打游戏的，也能那么上流。[吃瓜][doge]"
"L简秀尔","女","无IP","440658944","4","","10000","179","","友情提示，又有问卷调查了，大家可以把近期对于2.1版本的感受，反馈了，希望原神越来越好。,  也祝原神一周年快乐[OK][打call][原神_G嘿]"
"目前是棒棒糖","保密","无IP","76365976","6","","10000","473","","剧情也许会拉跨，数值也许会出大问题，,但是美工和音乐是永远的野兽,什么是真正的神不用多说了吧[2233娘_耶]"
"我只是只尤物","男","无IP","4375248","6","","10000","260","","陈老师：真是辛苦各位了，请问这次编曲的难度是？,顶尖民乐演奏家们：非常简单！[doge]"
"全能恐龙风阿远","保密","无IP","473699515","6","不思议之旅","10000","705","","等等要被冲烂了感觉，希望大家理性讨论，这个视频是讲音乐的。"
"暖升霄","保密","无IP","181813787","6","一周年纪念装扮","10000","276","","众所周知，miHoYo是HOYO-Mix旗下的游戏公司[doge]"
"等待mhy道歉的米游伥","男","无IP","10896289","6","七濑胡桃","10000","293","13","这里是欣赏音乐和感受音乐家们用心的地方，还请不要把某个游戏人物的戾气带到这里来，谢谢。"
