"昵称","性别","IP","UID","等级","装扮","用户权重","获赞数","粉丝团等级","评论"
"半分行迹_","保密","无IP","34799946","6","","10000","45317","","传说任务标题:,【世多古怪，横生盗匪】,,【事出有因，矿山奇石】,,【易地则明，失线则弗】,,【变乱似流，磐石不转】,,取头尾，,「世事易变，匪石弗转。」"
"时间之类","保密","无IP","86123717","6","","10000","60792","","说书人：岩王爷亲手创造了若陀龙王,钟离：并没有,说书人：是你懂岩王爷还是我懂岩王爷"
"泡面两块钱一包","男","无IP","77549785","6","","10000","27152","11","说下啊这其实是两个版本：,说书人的意思是：陀子哥是石头，帝君雕的，这确实是我们常说的传说了,而帝君说的就是事实：陀子哥是帝君带上地面并赐予了双眼，自此陀子哥便跟随帝君征战四方"
"星月七季","保密","无IP","38703460","6","","10000","33770","","陀子哥应该是自己成型的，钟离应该只是给了他眼睛，我还是比较相信钟离的审美的"
"时间之类","保密","无IP","86123717","6","","10000","21292","","钟离：有人说若陀龙王越来越胖了，在这里我澄清一下，它一直都那么胖,,现在的人们可能没见过若陀瘦的时候，这里说明一下，岩王爷也没有"
"I星奏I","保密","无IP","6185643","6","","10000","25575","10","风神温迪的朋友――特瓦林,岩神摩拉克斯的朋友――若陀龙王,这俩都有龙族友人，那么猜测稻妻雷神是不是也有类似的朋友呢？[脱单doge],八岐大蛇：没错.......,哥斯拉：没错，正是在下！"
"暗情局局长","男","无IP","27024731","6","碧蓝之海","10000","25519","","我突然想到一把刀，岩王爷老是听说书人将过去的事，或许不是听各种吹他，而是为了缓解自身的“磨损”……[tv_思考]"
"电机文士","保密","无IP","190924138","5","希萝Hiiro","10000","20009","2","我一定要让所有人知道，摩拉克丝是个在兜帽上开个小洞只为了放辫子的人！"
"bee-cause","保密","无IP","287480889","5","星座系列：水瓶座","10000","47858","","“这无故的攀比之心，从何而来啊？”"
"圈圈瓶","保密","无IP","5960655","6","","10000","3682","","以前我每次看电视剧，说书人说完台下人一个劲的好！好！好，我毫无感觉，但是看pv最后说的那首诗的时候我也忍不住说了声好。原来当感兴趣的东西被别人表达的很好的时候，确实会忍不住。"
"博凉孤独患者","保密","无IP","166364866","6","冬季","10000","27376","5","“钟离这个角色就是所有中国人心目中最理想的君王姿态。”,其实我并不喜欢所谓的“文化输出”的字样，因为太多人强调这个客观上的概念，反而变本加厉，买椟还珠了,仿佛mhy做原神就是为了文化输出，就是把这些文化塞到老外的脑子里，就是国内一些人狂热的追求，衍生出了很多不必要的，可笑的麻烦,商业游戏的本质终究是盈利，而文化只是用来包装的外壳，当然，mhy对于璃月这个文化体系的打磨让人尊敬，实实在在地塑造了一个外国人觉得有趣，中国人觉得熟悉感动的小小世界，但是我想说，原神并不只有璃月这么一个代表中国人思想的部分。,新手村蒙德同样是承载着中国人本土的思想，接下来的稻妻也是，枫丹也是，包括接下来所有的都是实打实的中国人的故事,知乎上就有一篇有趣的考究，温迪的人设思想原型其实是道家“无为自然”的思想，包括蒙德整个文化的体系，并非古代欧洲或者其他，而是实打实的我们自已人的故事,道理很简单，就像迪士尼的花木兰终究是美国文化的故事，而我们借于好莱坞体系下拍的流浪地球终归是自已的故事，只要掌握文化的话语权，拍成什么都是中国的故事,就像这个世界上为什么会有日式rpg这种类型的题材，勇者斗恶龙这种中世纪欧洲的故事最后被日本掌握了，而我们日后要走的路还很长，我想最先要解决的，就是过度匮乏的民族自信心吧，要把带有中国元素的改编作品正常化，他们和其他题材的作品没什么不一样的，而非动不动上纲上线，动不动捕风捉影，如今的创作者已经很艰难了，请给他们少一点的压力吧,共勉（转，我觉得说得太好了）"
"莫名之蓝","保密","无IP","354181710","6","","10000","8284","","你们璃月就没有一个人是真真正正的摩拉克斯黑吗.jpg"
"Strangic","保密","无IP","257214431","5","公主连结可可萝","10000","8387","","“天动万象，山海化形…”,“…荒地生星，璨如…烈阳…”,,“你双目完好，自然不知道盲龙对阳光的追寻。但摩拉克斯赋予若陀龙王双目一事，我不会忘记。”,,“从前在层岩巨渊，你犹豫过吗？”,“岩石尚可有心，我自然如此。”,……,“要走了吗？”,“摩拉克斯，若有缘，他日必将再会。”,,“正乃金石迸碎荡尘埃，磐山淤水尽为开，创龙点睛得助力，盘桓碎引雨露来。”"
"魔法的教科书目录","男","无IP","638067893","5","实验品家庭","10000","10921","","总结一下：,岩王帝君，钟离,盐王帝君，盐神,阎王帝君，胡桃,炎王帝君，烟绯,言王帝君，田铁嘴,[doge][doge][doge][doge]"
"刹那思见未来","保密","无IP","471416973","5","赫奇帕奇","10000","9958","","欲买桂花同载酒，笑看故人胖成球"
"追风之羽","保密","无IP","16934731","5","","10000","5693","","千万别提前看这个pv！千万别提前看这个pv！去把游戏内任务做了，看任务剧情，然后接到这个pv这里的时候极其惊艳。"
"未来科技之手-程震","男","无IP","25773","6","","10000","6809","10","这次PV展露了日语配音在非日本游戏中最大的问题：音节实在太多了,导致整个PV中日本CV嘴巴不仅从头到尾没停过，很多地方还必须加速念台词，完全体现不出原本台词那种抑扬顿挫的节奏感"
"小rui宝宝eglish","保密","无IP","156845175","6","","10000","4240","10","你们没发现这视频米哈游居然粗心忘了加原神tag了,导致一个百万播放的官号视频进不了原神频道,就离谱"
"狱岚木笔","保密","无IP","336453335","6","","10000","2357","","血书若陀自机！！！mhy你看这个陀子哥像不像你出了五系主c都没有的五星岩c！！！实在不行小陀萝都成！！！只要是陀子哥就行！！！他说了如果层岩巨渊振动还会醒，再醒了进池子好不好[大哭][大哭]"
"御坂11770号","男","无IP","350041866","5","BML2020暗黑版","10000","9066","","今天老师布一作业，题材不限做ppt，要中文英语混一起讲，如果这条评没有沉，当着全班人说原神。,[热词系列_锤]"
"青竹念","保密","无IP","22426726","6","","10000","6061","10","[微笑]这次简介居然还标了野史？这是生怕旅行者们以为龙王是帝君捏的哇，原神你做的好呀，好呀"
"KKOMDA","女","无IP","1740827542","6","","10000","1407","","i like chapter 2 of Zhongli story[给心心]"
"莫名之蓝","保密","无IP","354181710","6","","10000","3158","","奥赛尔              ,天台天台,天台天台,天台角下  公子 若陀龙王 刻晴 ,:奥赛尔你下来吧，我们都是真正的摩拉克斯黑。,“我不信，你们立字据!!!”[脱单doge]"
"BreezePoet","男","无IP","14923562","6","","10000","852","","前排提示，来自nga老哥的话，看这个pv请自动过滤说书人的话语，以帝君自己的自述为准[脱单doge]所以不要再说若陀这么肥是帝君故意的了[傲娇]人家坨坨本来就长这样[doge]帝君只是点了眼镜[大哭]"
"最小化和大佬的交叉熵","男","无IP","11784565","6","原神","10000","8876","13","／ ￣￣ ＼　 ,|　～　～ \　 ／    ￣￣￣￣￣￣        ＼,|　 若     陀 |   | 摩拉克斯哥哥，                  \,\　    　/∠ 你给我点睛，旅行者知道了/ , ＼　　 イ    \ 她不会生~气~吧              /,／　　　\     \不像我，我只会心疼giegie～/,/　|　　　 \       ￣￣￣￣￣￣￣￣￣￣,|　|　　　 | |"
"云遮清璃","男","无IP","33086599","6","","10000","1301","","关于若陀的实力，钟离说自己全盛时期也未必能与独自战胜若陀，后面白若陀接了一句“所以我诞生了”，这说明两者都是这样认为的，而且当年钟离封印龙王需要三位仙人在旁构筑洞天，也可以在侧面佐证龙王与钟离的实力相差无几，钟离必须全力以赴才能应战，根本无暇构建封印,设定上龙王是天地孕育的一条岩龙，本身存在的时间无比悠久，帝君与他实力相当甚至在某些方面略输一筹也是合乎常理的，白若陀所说的灵魂最强大指的应该是帝君灵魂坚韧，不会轻易磨损，而不是说他的实力就是最无敌的,我也是帝君厨，但是这样一个曾与帝君并肩作战，连帝君自己都此等重视的龙王，又怎会是羸弱之物，这样岂不是在看轻钟离？强者需要宿敌，这个宿敌应当是能与强者匹配之人，而非用来衬托其强大的炮灰，若陀对于帝君就是这样的存在……"
"zs叭噗","保密","无IP","35999466","6","良辰美景・不问天","10000","3327","7","“倘若天下无神，这里便是人的国度”,“我曾是人的神，理应见证人的兴衰”[大哭]"
"题我出的难死你们","保密","无IP","14392800","6","请吃红小豆","10000","1195","","一直很想说的是，大家不要纠结日韩翻译差劲，因为这种差劲是必然的。英语是有诗的，语言经年流传，有自己的韵律，有自己的拉丁语种底蕴，翻译的好了自成妙处，这种妙处是一个非母语者虽然不懂但能冥冥中体会到的。但日韩和我们之间的文化不只是断层，还有为了脱亚入欧的那种生硬拧巴感，就没有顺势而为的自然感，翻译起来有狗尾续貂的感觉也是正常，倒不是说他们不行，只是文化这种东西，你得承认，两头讨好真不如任一发扬。不然你看日韩的东西，就是稍微理解一下就很好懂，很浅显，如果你想深入探究，又没有深入的东西，这就很乏味。更让我感兴趣的是原生文化之间的碰撞，无论二者有异有同，通处可堪称绝妙。"
"Bennett0912","保密","无IP","378500973","5","","10000","3089","","派蒙：跟着烟绯走还是注意一下行为吧,爷--点头，然后反手把花坛里的霓裳花和琉璃百合摘走了。"
"Seven7-七","男","无IP","28327186","6","","10000","972","","英配真是太牛批了，特别是说书人，语气语调和文本翻译都绝了！世界顶级的英配表现，教科书级别的翻译用词！"
"KKOMDA","女","无IP","1740827542","6","","10000","5556","","Zhongli daddy[星星眼]"
"陌影深","保密","无IP","629180450","5","","10000","700","","知君仙骨无寒暑。千载相逢犹旦暮。故将别语恼佳人，要看梨花枝上雨。,落花已逐回风去。花本无心莺自诉。明朝归路下塘西，不见莺啼花落处。,――苏轼《木兰花令・次马中玉韵》"
"Creanna","保密","无IP","159148916","6","","10000","2687","","温迪喜欢讲述别人的故事，是因为怕他们被世人遗忘。,而钟离喜欢听别人讲述自己的故事，则是因为只有在故事中，他才能与那些失去的故友们重逢。"
"还蛮AI","男","无IP","244364160","5","","10000","941","","／ ￣￣ ＼　 ,|　～　～ \   ／￣￣￣￣￣￣              ＼,|　 　 |   | 亲爱的原神                         \,\　    　/∠ 不出极品圣遗物的石化古树  /, ＼　　 イ    \      为什么不能砍                /,／　　　\          ￣￣￣￣￣￣,/　|　　　 \       ,|　|　　　 | |"
"小敢","女","无IP","642228","6","","10000","2353","2","啊啊啊啊啊啊啊啊啊啊啊啊啊啊啊啊[原神_躺平]"
"诗乃逢魔兔神zio","男","无IP","40048190","6","原神","10000","809","7","“摩拉克斯，你如今的名字叫做钟离，是吗？”,“正是。”,“不行，我还是习惯叫你摩拉克斯。”,钟离轻叹一声，嘴角微微上扬，但他的表情却带着悲伤，欣慰，无可奈何。,“随你喜欢就好。”,,“天动万象，山海化形…”,“…荒地生星，璨如…烈阳…”,,“你双目完好，自然不知道盲龙对阳光的追寻。但摩拉克斯赋予若陀龙王双目一事，我不会忘记。”,……,若陀：“连你也走到了这一步了啊……丑话说在前头，我可不敢保证下次不会有新的震动将我唤醒。”,钟离：“无妨。即便有那么一天，璃月百姓也该做好面对你的准备了。”,……,“从前在层岩巨渊，你犹豫过吗？”,“岩石尚可有心，我自然如此。”,……,“要走了吗？”,“摩拉克斯，若有缘，他日必将再会。”,,“正乃金石迸碎荡尘埃，磐山淤水尽为开，创龙点睛得助力，盘桓碎引雨露来。”"
"Tarunx","保密","无IP","165551800","6","","10000","2717","11","#前排提示！#,请务必分清哪些话是钟离（亲历者）说的，哪些是说书人讲的（传承的传说）,[打call][打call][打call]"
"红霜柚橘秋未尽","男","无IP","81162962","6","","10000","779","2","传说任务里若陀和钟离只说了点睛之恩，没有说是钟离创造了若陀，说书人的评书还是有待考量的，想必钟离只是给了若陀一双眼睛而已，将他从地底带到人间"
"狱岚木笔","保密","无IP","336453335","6","","10000","2374","","米游社的攻略组把陀子哥技能命名为：肥陀冲撞，肥陀蹦蹦，肥陀甩尾[笑哭][笑哭][笑哭]"
"琳君","男","无IP","384621193","6","初音未来13周年","10000","3793","12","节奏预言,1.为什么要用日本做原型，是不是株式会社?,2.这个npc的脸，怎么设计的和某战犯差不多？,3.为什么要在8月.上线?不知道是什么日子?,4.为什么要在7月.上线?不知道是什么日子?,5.为什么要在10月.上线?不知道是什么日子?,6.这段剧情里面的这句话，是不是在影射玩家？,7.主角为什么要帮日本人做事?是不是故意的？,8.雷属性这么拉跨，为什么不增强？,9.雷属性这么强?是不是故意设计的比璃月强?,10.这段剧情什么意思?是不是***?,11.这里这个东西，有日式rpg那味了，在抄塞尔达了吧！,12.这就是雷神?太弱了吧，-点输出都没有!太废了退钱!,13.雷神又是**卡了是吧，骗氪逼氪老传统了,14.做这么强，岂不是吊打xx?稻妻人物做强些，懂了,15.又没新图了是吧，长草是吧，这游戏就这么点东西?鸽了几个月新图我一-个通,宵就100%,16.乱七八糟东西搞那么多干嘛，玩个游戏比上班还累！,17.果然是9-游戏，这剧情真是弱x,18.这就是剧情策划?我半天都没搞懂在讲啥?,19.新角色pv就这么**看，这就是吹上天的原神吗?笑死了,20.就―一个新角色pv这么多人看?原批真多啊，整无语了,22.这稻妻设计的这么有日本那味，懂了，原神设计组里有*吧,23.这里这艘船，颜色有点深啊，是不是在隐射什么？,24.这个角色，肤色有点深啊，是不是在隐射什么?,25.稻妻角色为什么是西方欧美脸啊，是不是在隐射什么?,26.这个怪物为什么有这个动作，是不是在隐射什么？,27.原神赚那么多就做个这?难道就我一一个人觉得还不如隔壁xx好玩??,28.稻妻的神像为什么要供奉?是不是在隐射什么?,29,这个屋子做的好像神社啊，是不是在隐射什么?,30.稻妻的地图这里为什么要这样设计?是不是在隐射什么?,（转）,[思考]"
"橘猫Leo","男","无IP","3375915","5","","10000","3115","","没人提？,最后这首诗的英文是：The crash of a spear brought billowing dust, the mountains and waters made way at the sound. The sight of a dragon bestowed with a touch, the promise of rainwater blessing the ground.,双押！,billowing dust - bestowed with a touch,waters made way at the sound - rainwater blessing the ground,太牛逼了"
"Yu_Kou","男","无IP","386024445","6","罗小黑战记","10000","832","","小时候不喜欢文学，不喜欢语文课，也讨厌英文，阴差阳错，我去往异国留学，踏上了不得不学习英文的道路，才发觉中文表达的美妙，当初在国内没好好学语文，现在的我是如此思念母语，觉得自己文化水平不够啊，我多希望我可以以自己的方式去传递中国文化和语言，但是我根本不知道如何表达，后悔小时候的我讨厌语文课，但现在觉得骄傲我的母语是中文，看到原神的文化输出如此的成功，心中也无比自豪，对比中英文pv才发觉很多东西是翻译无法做到了因为中文很多都是有历史背景的，但真心佩服原神的这些个负责翻译的人，英文版pv真的很有感觉，真的好厉害。"
"大聪明泷兰","男","无IP","313094265","6","","10000","1987","","我听了三十多遍若坨的bgm，听出了以下内容,君长归兮陌路，恨繁囿兮作土，君叹石拾土为目，伴君开疆扩土，山崩岩殂，坚如磐土,欢迎补充"
"杨哥star","保密","无IP","487472592","5","","10000","728","","我好喜欢剧情里钟离的那个大范围护盾啊～～～希望米哈游以后能出一个七神之战，就是把这些神的神力都归还，我想体验一下岩王爷在魔神战争时的威能[害羞]"
"道以杀生证有情","男","无IP","240822699","6","","10000","2608","","在这里我要由衷的感谢一下漩涡魔神奥赛尔先生，要不是他吸引了深渊的注意力，那么璃月被迫害的可能就是陀子哥了（毕竟陀子哥磨损那么严重说不定比特瓦林还容易蛊惑，可是奥赛尔一跑出来就把深渊的目光吸引了过去，再加上戴因送眼睛让机械大乌贼有了得以实施的条件，陀子哥就更没人理了），既通过自我牺牲化解璃月人与仙的矛盾，促进璃月和平演变，又通过吸引敌人保护璃月元老，果然奥赛尔才是真的对璃月爱的深沉啊[大哭][大哭]"
"Hinaa","保密","无IP","13668420","6","绯赤艾莉欧","10000","647","","／ ￣￣ ＼　 ,|　～　～ \　 ／    ￣￣￣￣￣￣        ＼,|　 　 |   | 亲爱的小保底 ，大保底   \,\　    　/∠    要是知道我出了钟离/ , ＼　　 イ    \       它不会生~气~吧     /,／　　　\      \  不像我，只会心疼小保底 /,/　|　　　 \       ￣￣￣￣￣￣￣￣￣￣,|　|　　　 | |"
"枫_-","保密","无IP","479347426","6","2021拜年纪活动专属","10000","2580","","要致富，先撸树。,低语深林垂香木，,蒙德城里有松树，,明冠峡上长杉木，,望风山地砍桦木，,轻策庄边竹节木，,归离原上小小路，,却砂树上却砂木，,哪种木材是贵物，,苹果落日萃华木。,转载。"
"账号已注销","保密","无IP","284492029","0","","5000","1617","","帝君真的好美啊啊啊啊啊啊――――――――！若陀龙王真的好帅啊啊啊啊啊啊啊啊啊啊又帅又可爱,但是评论区为什么还有人刷归终的啊…………明明帝君都一直把她当朋友的啊……而且不要老是带cp滤镜去看什么东西啊……陀子哥和帝君也是好朋友的……为什么非得凑cp呢……兄弟情就兄弟情嘛,说的不对请指正 我真是太喜欢帝君，太喜欢坨子哥了[脱单doge]"
"神社的博丽灵梦","保密","无IP","17634924","6","EveOneCat2","10000","1539","","若坨龙王这大肚皮，我莫名好想趴在他的肚皮上蹦Q[笑哭]感觉会很软，话说若坨这样子，一翻身会不会跟王八一样，翻不回来，结果等着钟离回来推他"
"e月上三竿e","保密","无IP","382549095","5","hanser","10000","1237","10","／ ￣￣ ＼　 ,|　～　～ \　 ／￣￣￣￣￣￣￣￣￣￣＼,|　 　 |   |　       阿晴，他们都是          \,\　　 　/ ∠     骗你的，怎么会有人有两个/ , ＼　　 イ　 \   传说任务和专属角色PV呢  /,／　　　\        \――――――――――/,/　|　　　 \ ,|　|　　　 | |"
"水清木华_-","男","无IP","15198437","6","","10000","2323","","有人说坨子哥是帝君雕的，有人说帝君只给他点了眼睛，我认为是中间值，说书人在吹，钟离在谦虚。真相即帝君为坨子哥添加了亿点点细节。,自然生长的坨子哥是一种野蛮生长的状态，没有眼睛即盲目，也就是坨子的恶念。,帝君给他雕刻了双眼，眼睛即智慧的象征，赋予眼睛就是赋予了智慧与文明，对应了坨子的善念。[2233娘_耶]"
"流星九霄","男","无IP","88222510","6","初音未来13周年","10000","516","","这五百年来，兄妹之间的感情又磨损了多少呢？"
"乔老板的退休生活","男","无IP","497749570","5","崩坏3・天穹流星","10000","5809","11","提醒一下，民间传说的真实性有待考量，所以坨子哥的肚子不是帝君搞大的[doge]"
"戏中戏言-终难现","保密","无IP","361019593","5","良辰美景・不问天","10000","586","","这是坨子哥的角色pv吗[妙啊]快出坨子哥，最好双手剑"
"WUMING吴铭","女","无IP","9459178","6","","10000","2994","","后排提醒一下，帝君就是个工匠，绿套和岩套都是他的作品。,[doge]“偏――爱 ――工――匠”"
"黑羽铃仙","保密","无IP","1733802846","5","","10000","374","","文化输出这个词语太过有侵略性，不符合我们的格调。实际上我更倾向将之称其为“文化传播”。我们无意将我们的文化强加于对方，只是将我们觉得好的，分享给他人，便恰如其分。至于对方是否能理解，是否能接受，是否愿意为之心动，全在表现在其的一静一动之间。"
"水果味地米酒","保密","无IP","129824776","6","","10000","2038","","看完摩拉克斯和若陀的故事我竟然有些泪目 哎 真可谓算的上是画龙点睛之笔 可惜 世间就是如此残酷,如若有另一个世界存在 是一个只有凡人的世界 我希望他们是一对兄弟 钟离是哥哥 若陀是弟弟 那样就好了 [大哭][大哭][大哭]"
"周敬水","保密","无IP","1768816898","5","","10000","405","","英文版翻译结尾的诗句也挺有感觉:,We have a saying to eulogize these events:‘,,The crash of a spear brought billowing dust; the mountains and waters made way at a sound.,,The sight of a dragon bestowed with a touch, the promise of rainwater...blessing the ground."
"青龙族龙","男","无IP","289155818","5","hanser","10000","1153","","钟离cv彭导是源氏的中配，若陀龙王的cv是半藏的中配[笑哭]而且这两对的关系还都是开始情同手足后边就打的天昏地暗，并且都和龙有关[吃瓜]"
"BV1134y1o7hi有惊喜","保密","无IP","486106105","5","嘉然今天吃什么","10000","492","","钟离：若陀，有的话我不会说出去的，我是契约之神，只不过我不知道你还好这口（扮成蓝发小女孩）。[doge]"
"HanBaGaaa","男","无IP","289162458","6","崩坏3・天穹流星","10000","382","","若陀这么好的赚钱机会不把握一下吗?"
"艾尔海森的书","女","无IP","1639098","6","","10000","332","","简介文案杀疯了[跪了],元素生物目不能视，得帝君点睛，方得智慧光明，以君臣故友之谊，陪伴帝君左右，奔赴尘世万象。,千载亦犹旦暮出自苏轼诗，知君仙骨无寒暑，千载相逢犹旦暮。表达的是苏轼对友人的尊敬和真挚的惜别，悲从中来。两人皆长寿，时光如飞电过隙，千载后故友重逢短暂，复别于旦夕，和原诗意完全贴合。,[跪了][跪了][跪了]谢谢你，米忽悠"
"在下刘某人是也","保密","无IP","6247601","6","","10000","292","","发现一个“可能大家都知道”小彩蛋：,璃月说书人田铁嘴的人物原型，正是我国著名评书表演艺术家田连元老先生（同姓说明一切）"
"CyberTenno","保密","无IP","389673","6","","10000","379","","画龙点睛，点睛墨画的龙才变成真龙。如果按这用典来的话，帝君点睛绝不止于送副眼睛这么简单，同时赠予若坨的还有真龙灵性。"
"他说我叫小林","男","无IP","23775090","6","hanser","10000","456","","为什么爷不能在家里的床上睡觉？,为什么没其他人的壶里有的孟德建筑晚上会开灯？,为什么爷别墅二楼房间不让进？"
"牧语新","保密","无IP","198423462","5","","10000","316","","龙王胖是胖，但真的不丑啊，有种很厚重霸气的感觉，他要是真的站在我们面前，我真的会想跑[笑哭]"
"寒星月影","保密","无IP","69895786","5","中野四叶","10000","319","","原神的剧情真是越来越精彩了，我敢说这次钟离传说任务第二幕有99.9％的人在过程中都没想到最后的结局"
"唔喵嗷嗷嗷","保密","无IP","62411096","6","","10000","348","","坨子哥化人形吧！岩系大剑或者岩弓，求求了(iωi`)呜呜呜"
