"昵称","性别","IP","UID","等级","装扮","用户权重","获赞数","粉丝团等级","评论"
"喻温白","保密","浙江","1852347","6","","10000","0","","须弥地图做的真的进步了好多，真的厉害！！！工作人员们很棒。"
"mhy别刀我派蒙","保密","江苏","274287587","5","","10000","0","","昨天20发绿剑，庆祝我从此拜托非酋之路，愿抽卡的路上不再遇到大保底[tv_点赞]"
"听雨白菜","保密","四川","514683847","5","洛天依9th生日纪念","10000","0","11","原宝马上就1400W粉了！！！"
"j菌冷离","保密","广东","299424385","6","斗破苍穹","10000","0","","米哈游的音乐绝对不会让我失望[吃瓜]"
"海芋之恋","男","广东","20065553","6","","10000","0","","肝疼的声音"
"oneGreco","男","福建","32233240","6","","10000","0","","剧情到回村长家结束了，下一次是什么时候啊"
"纠结的圣光","男","广东","21487343","6","","10000","0","","突然注意到这粉丝量有点恐怖d(д)"
"Hiiro耳朵双推人","保密","福建","1087577358","5","","10000","0","","咖喱味我也喜欢[脱单doge]"
"梦花夜project","男","广东","13167988","5","","10000","0","","我只想月光剑下个池子还能见到，抽到快保底一把都不出"
"夏马西","男","贵州","96993738","5","","10000","0","","音乐真的绝顶！琴弦稍微拨动，上一秒让我置身于浩瀚苍远的沙漠之中，感受那那种时光和岁月的厚重感。下一秒，却又把我带入拿幽远而无际的森林海洋，万物丛生，枝繁叶茂，让内心感受到了来自大自然般的抚慰。这音乐真的让我爱！"
"温情暖意芳馨","女","湖北","34508250","5","","10000","0","","能不能补个璃月的这样的MV[脱单doge][脱单doge][脱单doge]"
"uboaaa","保密","重庆","499820224","4","","10000","0","","太顶了"
"蓝色彩虹岛","男","四川","270669424","6","","10000","0","","旅行者森林书肝完了吗，长草手动代肝"
"抢人类空气的植物","男","陕西","652041008","5","","10000","0","","好听"
"风落惜","保密","广西","99947209","5","星座系列：处女座","10000","0","","我超须弥专辑，你知道我等维摩庄和那首奥摩斯港的等了多久了吗[大哭]还有其他好好也很好听的BGM，快上线啊啊啊啊啊[大哭][大哭][大哭]"
"啦啦啦の啦","男","河北","25976397","6","圣诞节快乐","10000","0","","马上就要3.2版本了 这里有一个100原石的兑换码给兄弟们分享下 KFCFKXQ4VW50"
"北冥阎王","女","北京","24673332","6","崩坏：星穹铁道","10000","0","8","Apple Music 也有哦 而且我感觉音质比QQ音乐好"
"Smokingdingzhen","保密","云南","2028317209","4","","10000","0","","真的真的真的真的好好听"
"君子万福","保密","辽宁","631277737","5","","10000","0","","听着音乐，感觉时间都变慢了"
"真实の光","男","湖北","263209259","6","","10000","0","","前瞻直播搞快点[脱单doge]"
"炸裂吧昵称","保密","广东","395676406","5","","10000","0","","港服，拒绝了我。[无语][无语]"
"川崎","保密","云南","12784029","6","","10000","0","","爷的前瞻预告呢[热]"
"HellNorth","男","河南","472623939","4","","10000","0","","封面以为是什么二创，一眼使命召唤[]"
"奈芙ネフレン","男","河北","538468978","5","2021拜年纪活动专属","10000","0","","这首音乐很符合森林的气氛，非常好听[未来有你_好耶]"
"丶小羽丶丶","男","浙江","294906998","6","","10000","0","","圣遗物套装记忆系统！[热]"
"童话王国的怪蜀黍","保密","辽宁","8253312","6","","10000","0","","香林繁路之夜[打call]"
"亿万东风","男","山东","10076691","6","","10000","0","","异度风情，摇摆至上"
"老原批一个了","保密","山东","1087115835","5","","10000","0","","好啊"
"忘川折柳","保密","河南","19532197","6","","10000","0","","刚从庸子那里来，一下子味儿又上来了[笑哭]"
"戴耳机的苦瓜君","保密","北京","648944","6","","10000","0","","真不错"
"卡塔得","保密","广东","407588592","5","","10000","0","","hoyo mix 永远的神！！"
"CD青蛙创始人锤石_","女","未知","27652623","6","","10000","0","","好耶终于等到你[tv_大哭]"
"米饭酱菜","女","浙江","646313586","5","","10000","0","","苹果音乐已经有了,网易要等下个版本的前一天才有，27，28号"
"江城采桑卜算子","男","江苏","434794889","5","我是江小白","10000","0","10","音乐会上的狮尾之舞怎么改名了呀，英文名也改了，而且灵魂笛子也没了"
"喔哦噢耶嗝","保密","北京","15829751","6","至尊戒","10000","0","","qtmdQQ音乐，我等网易云~"
"派蒙干净又卫生","保密","江西","341576349","6","","10000","0","","森林书大决战那个很燃的音乐是丁谦老师编曲的作品哦，名字叫《沉重的恶意》[保卫萝卜_哇]"
"傻笑的未影_小白","男","广西","511531710","5","不思议之旅","10000","0","","到底是我运气太差了，还是怎么样？为什么我每一次充角色都会给我出个不属于保底的迪卢克？的，我每次抽这个角色还得大保底呀。妮露啊。我都抽了70多抽了。再加上之前迪卢克的100多了呀，为什么还不出啊！[热词系列_破防了]"
"bili_79644280188","保密","浙江","474679601","5","","10000","0","","原宝时不时给我们惊喜"
"乌鹊magpie垩空垩","男","河北","385409719","6","冥冥dlc头像框","10000","0","","大爱须弥！！！！"
"Jason_ZCH","男","江西","7134645","6","","10000","0","","这两首主城的配乐我太喜欢了，陈致逸yyds"
"千灯Nya","女","广东","9040246","6","原神","10000","0","","好诶"
"喜欢喝啤酒WAW","男","北京","19603741","6","","10000","0","","至今还沉浸在喧繁之港的BGM里...真的太好听了[脱单doge]"
"奋斗的暴躁驺吾","女","山西","37929503","6","","10000","0","","太美了我的天"
"那嘿","保密","河南","688702260","4","","10000","0","","识相的就给我3.2复刻胡桃[doge]"
"闪光艾瑞珂","男","广东","2719052","6","","10000","0","","好耶"
"咕噜大宝","保密","安徽","1584358284","5","","10000","0","","干净又卫生家人们！"
"想要啥名字啊","保密","湖北","397712753","5","","10000","0","","@所有人全员核酸检测通知,今日（10月20日，周四）本通讯录进行全员核酸检测，检测时间、地点安排如下：,一、人员：所有人,1.检测时间：17:00―18:30,2.检测地点：肯德基大门口,二、 要求：,1.戴口罩，保持一米线，自觉排队，准备好微信扫一扫，v我50后迅速离开。 ,2.请认真核对人数，确保不漏一人"
"kaylamiu","保密","陕西","1718742","5","请吃红小豆","10000","0","","须弥的bgm全都很好听，超喜欢[原神_哇]"
"人生本来就不完美","保密","黑龙江","312641698","6","","10000","0","","今天帮朋友抽卡[保卫萝卜_哭哭]他帮我抽我的号保底了，帮他抽30发两命妮露加专武。运气被吃了。小草神[保卫萝卜_哭哭][保卫萝卜_哭哭]"
"七月の流星1","男","广东","164804444","5","碧蓝之海","10000","0","","刚玩几天的萌新求带[doge]"
"五米94","保密","福建","18199560","6","绯赤艾莉欧","10000","0","","没错就是我大军师心海[doge]"
"追风者A","保密","广西","353779818","6","","10000","0","","已赞！借楼！大学牲纯手打!绝对诚信！想接几个单子给自己号氪648，需要的可私信哦"
"潜江油焖李浩宇","保密","湖北","2255584","6","","10000","0","","称得上是视听盛宴了"
"神州的摸鱼队长","男","安徽","649808873","5","","10000","0","","你改不改匹配机制[热][热][热]"
"evaliat","保密","广西","452246862","5","","10000","0","10","1400W粉丝 10纠缠[傲娇]"
"白芷蓿也可以叫米莉恩","保密","四川","32924629","6","星座系列：处女座","10000","0","","所以专辑什么时候上线啊啊啊啊啊 须弥这边是开服以来我最喜欢音乐风格的地区了[处女座_nice]"
"白金天堂","保密","云南","178137809","6","","10000","0","","中国人能搞出这么高质量的印度音乐非常恐怖了"
"亮光的亮","男","浙江","24734222","6","星座系列：射手座","10000","0","","热乎的！"
"入诗月旦_ぴ迦绱夯","女","山东","10055778","6","","10000","0","10","好！"
"振袖呼风唤叶","女","江苏","252115340","3","","10000","0","","微信可以搜到耶羊成就小程序啦"
"Doyeo","男","广东","82240259","5","","10000","0","","作曲 陈致逸"
"黑白茶-FA","男","湖北","10076431","6","hanser","10000","0","","大梦的曲调有吗QWQ找不到名字真的太痛苦力QWQ"
"无与伦比_周杰伦","保密","山东","108867232","5","","10000","0","","排面，肝疼"
"神户砂糖盐","保密","贵州","98994372","5","","10000","0","","有妮露跳舞的bgm嘛[脱单doge]"
"Sennyuki风早千雪","男","甘肃","23938690","6","异常生物","10000","0","12","《几初的智愿》真的是我最喜欢的一首了，那种轻柔舒缓却直击内心深处的旋律太让人感动了，每一次听都会产生无数的情绪，真的能让你整个人都愿意慢下来，停下来多看看远处的风景，HOYO-MIX的音乐实在是太棒了[保卫萝卜_哭哭]"
"火止夜","男","江苏","864741","6","","10000","0","","昨晚12点前apple music和spotify就都上线了 音乐这块我宁愿给老外充钱也不愿意给马哥[OK]"
"莫娜MoMo","女","广西","14548113","6","2233白色情人节","10000","0","","[大哭]原宝！你为什么这么短！！！"
"芈子高xiexy","男","云南","456185881","5","","10000","0","","再看不到3.2前瞻直播的话，我的一些就比如说我的美貌，我的美好的品德，甚至是我的灵魂都会被毁掉[热]"
"小问号很多","男","广东","12987741","6","","10000","0","","这首真的太棒了"
"薛腚谔的猫猫猫猫","男","安徽","172146303","6","","10000","0","","一把抢过木苹果汁喝起来，现在在被印度蜜蜂追杀"
"听风过客","女","山西","28615847","5","","10000","0","","呜呜呜，网易云会有吗？我不想再下QQ音乐了"
"清凉的弗洛瓦兹","男","北京","251795934","6","至尊戒","10000","0","8","这是一个干净又卫生的mv"
"xhfywy","保密","辽宁","628506986","4","","10000","0","","1400了快"
"原来是三千哦","保密","新疆","34281720","5","星座系列：水瓶座","10000","0","","好听！！！！！！再多生几个吧求求了"
"你眼中之人仍并非我吗","保密","河南","650193038","4","","10000","0","","好喜欢须弥的音乐，我是精神须弥人!!!（4.0前限定）"
"猴子的香蕉520","男","浙江","149186981","6","原神","10000","0","","3.2前瞻星期天,不用预告了"
"DDo_o","男","河北","56883917","6","我不是胖虎","10000","0","17","音乐真是好，就是听着有点肝疼[原神_躺平]"
"黑油油油","男","湖北","13846388","5","","10000","0","","有一种重新安装游戏进去看看的冲动[藏狐]"
"淋雨日","保密","上海","11854668","6","明日方舟音律系列","10000","0","5","QQ音乐好像没有群星闪耀时这个专辑，总之就是角色演示pv的bgm"
"地末-枕头星","男","湖北","438731306","5","","10000","0","","好！"
"零氪理论玩家","保密","北京","695271665","5","","10000","0","","cool～～～～～"
"木容秀吉","保密","湖南","151089","6","","10000","0","","QQ音乐上了，我TM直奔桓那兰那的曲子（"
"Neon-LightのReed","保密","云南","280753883","5","原神","10000","0","","吉吉吉吉吉吉！！我爱小急祥草王！！[tv_抓狂][tv_抓狂]"
"甲鱼不是鱼呀","保密","浙江","403251798","5","","10000","0","","太美了[大哭][大哭][大哭][大哭]"
"nxkosbxjajmd","保密","湖北","3382307","6","","10000","0","","不懂那首老歌有什么可刷的，意境完全不同"
"子书冰儿","保密","新疆","13834024","6","","10000","0","6","森林中的感觉"
"介之花","女","重庆","8119642","6","","10000","0","","wow～看我发现了什么"
"Chrevenie","女","浙江","32841977","5","","10000","0","","陈致逸老师好棒"
"一只皮卡啾儿","女","山西","34511390","6","","10000","0","","太好听嘞"
"犯中二的DVD","保密","北京","526767969","5","至尊戒","10000","0","","就我一个人关心亚服啥时候好嘛"
"伊雷纳","男","吉林","36865786","5","多多poi","10000","0","","Hustle and Bustle of Ormos 喧繁之港"
"经年待歌","保密","广西","3491169","6","","10000","0","","修复优平砍第一下与第二下之间的缺帧问题！！！！！[热]"
"羊羊啾啾Y","保密","陕西","35038001","5","冬季","10000","0","","bgm还得在出地图之前听，等玩了一阵子再听，我的肝就疼。"
"旺仔仔","保密","广东","663402","6","","10000","0","","超好听！！须弥的黎明，带着露水的寒冷与朝阳的温暖！陈老师作曲yyds，另外夸下编曲，也很厉害！"
"dolbyyyds","男","内蒙古","1779692075","4","公主连结佩可莉姆","10000","0","","太优美了"
"天霜沐轲","女","海南","254648847","6","","10000","0","10","好！再生一个！"
"静听夜虫鸣","保密","天津","16073765","6","良辰美景・不问天","10000","0","","我是小急祥草王！[doge]"
"BlackSL","男","山东","392966132","5","","10000","0","","前瞻公告呢，我很急！"
"杰帕德单推人","女","湖北","8527627","6","","10000","0","","香林繁露之夜，太美了，好喜欢好喜欢[保卫萝卜_哭哭]"
"巡猎专灭孽物弓弓","保密","安徽","1299659659","4","","10000","0","","国内都正常人，起码把国内草神动作改回来吧"
"香甜老双皮奶O_o","女","浙江","2335051","6","","10000","0","","我的币给你留"
"平安健康皆是福","保密","广东","168566194","6","","10000","0","","几天没注意，快1400粉了"
"散华萌神","保密","上海","3570510","6","碧蓝航线","10000","0","11","本来白天上午浮躁的内心，中午趁着午休听完mv感觉整个人沉静了下来，可能这就是音乐的魅力吧。[doge][脱单doge]"
"YAOQING团子","女","广西","19531800","6","斯莱特林","10000","0","","开头咖喱味十足啊！够劲"
"伪史壬脑科中心大夫","保密","河北","1487747861","5","","10000","0","","我穿着袍子一边吃着葡萄一边听着这首曲子好像穿越到了几千年前的丝路古道[笑哭][笑哭]"
"只想一觉到天亮","保密","广东","11447854","6","","10000","0","","还不宣布啥时候前瞻吗"
"文墨小生","保密","广西","498157260","6","","10000","0","11","好耶！"
"十六条哈士奇","女","广东","1270235","6","","10000","0","9","什么？？？"
"账号已注销","保密","河南","1923662819","0","","5000","0","","这曲一听就干净又卫生[藏狐]"
"顾德嘿","男","北京","17689878","6","","10000","0","","听到这两段音乐，真的希望须弥人能够走出阴霾，获得幸福。现实生活中的也能一样。[保佑]"
"吖莓ame","保密","湖南","13349839","6","","10000","0","","制作幕后我需要！！！！哄哄哈哈哈哈哈啊啊啊吼呃呃呃呀哈哈哈如果没有幕后我的一些美好品德就会消失"
"夜临星烁","保密","河南","13575541","6","","10000","0","10","这个bgm！须弥城12点那个！"
"凝光的情夫","女","河北","304682170","5","","10000","0","","家乡的小曲儿"
"稚羽之凤","保密","上海","171857333","5","星座系列：双子座","10000","0","","我的音乐幕后你在哪儿[大哭][大哭][大哭]"
"小小九千","保密","四川","13497888","6","","10000","0","","好听！！"
"每天工作四小时","保密","宁夏","282412494","5","","10000","0","","有没有大佬告诉我一下，森林书任务完成之后，就是重新种下一棵树之后，那旁边的神像在哪儿啊？我怎么找不到[辣眼睛][笑哭][辣眼睛][笑哭]"
"我的名字叫薇塔","保密","浙江","1584883056","4","","10000","0","","垂死梦中惊坐起[脱单doge]"
"大蛮猪","保密","上海","192269627","6","三周年恋曲","10000","0","","好听哭了！"
"光钻今天也很努力","保密","江西","226182592","5","","10000","0","","生少了！再给我生一个！"
"抱歉你身上着火了","男","河北","280996199","6","","10000","0","","有没有维摩庄的孩子们"
"落樱天辰","保密","河南","87805683","6","天谕","10000","0","12","妙啊"
"目前是棒棒糖","保密","广东","76365976","6","","10000","0","","如果没有战乱，没有纷争，中东的人也会这么快乐吧（可叹）"
"可以咬打火机","保密","湖南","260080199","6","至尊戒","10000","0","","大保底捏在手上丝毫不虚"
"刻晴大魔王","保密","广西","13233610","6","向晚大魔王","10000","0","","旅行者和小派蒙，你们听我说哦，我做了一个梦，梦见妮露在跳花神之舞了！"
"盘木森森","男","陕西","32859217","6","择天记","10000","0","","我想知道等当当的等等啊等等的冷的嗯的灯灯是哪首歌，就是在须弥城里经常听到的"
"威---武---","保密","贵州","436162844","5","","10000","0","","这个笛声就代表着美好罢！"
"椰奶香香的","保密","江西","1237403486","5","","10000","0","","原宝，我想看宝宝巴士，求求你了，求求你了，白飞飞堇瓜，鹿哈[原神_哼][原神_哼][原神_哼]"
"佩韦Boy","保密","安徽","361529704","6","崩坏：星穹铁道","10000","0","7","唯独没有璃月OST[原神_生气]"
"让所有人不满意","保密","湖北","352990447","5","","10000","0","","啊啊啊啊多生点啊啊啊啊我爱看"
"灰色de雨天","男","广东","25037465","5","","10000","0","","戴上耳机听着，沉浸在雨林中[原神_哼]"
"老虎家的长猫","男","福建","576167","6","","10000","0","","中东乐器，刷新新认知[打call]"
"抱抱盾","保密","广东","39945650","5","原神","10000","0","14","牛批[doge]"
"_霁雨","保密","福建","226716815","6","星座系列：双鱼座","10000","0","","许个愿！草神是小孩模型但是希望跑路中的姿势有点区别，区别于她是神[鼓掌][鼓掌]"
"棠花予酒","女","北京","506680390","6","","10000","0","","想说谢谢原神，谢谢hoyo-mix。心律不齐或者难受到无法入睡的时候，原神ost就像我的药一样。能把我的心情稳住，给我一个好好活着的体面和理由。真的很感激这些音乐的创作。音乐很美，生活也是！[给心心][给心心][给心心]"
"大家别来无恙吗","男","广东","36394357","6","","10000","0","","太美了"
"Cilinsky","男","北京","74336100","5","","10000","0","","乍一看封面以为那些人都拿的枪[热词系列_知识增加]"
"零Areika","女","贵州","12073829","6","2233十一周年纪念","10000","0","","呜呜呜呜[委屈][委屈][委屈]，太短了！！！[委屈][委屈]，看一会就没了[大哭][大哭][大哭]"
"拾然柒","男","湖北","581516780","5","中野三玖","10000","0","","优雅，实在是太优雅了"
"潋火","女","河南","525132997","5","时光代理人","10000","0","","开门！大风急官！"
"沉迷被窝无法自拔","保密","陕西","480309093","5","","10000","0","","你滴歌大大滴好听"
"初枫菌","男","浙江","157582276","6","","10000","0","","让人宁静的感觉"
"冰璃雨樱","保密","江苏","20866386","6","","10000","0","","想看流金疾驰的现场演奏[脱单doge][脱单doge][脱单doge]"
"天泽一夏小恶魔","男","安徽","322029639","5","","10000","0","","我来这只有一件事:加强妮露，加强妮露，还TM的是加强妮露。不是那么多人说寄吗，那就加强[嗑瓜子]"
"屑中之屑qwer","男","山西","451481012","5","","10000","0","","原宝你加加油再继续生啊！[打call]"
"明曰方舟终末地","保密","内蒙古","381333814","6","明日方舟","10000","0","","太短了！！！！起码来个奥摩斯港！！！！！！！！！！！！！！！！！！！！！"
"青烟あ离歌","女","福建","511662625","5","","10000","0","","感谢原宝，音乐一如既往的好听"
"天冰EX","保密","山东","524890632","5","","10000","0","","原汤化原食，一个地区的音乐果然还是要当地人来才有内味[原神_G嘿]"
"Genshin启动_","保密","广东","439035960","5","","10000","0","6","不会真的宵宫换胡桃了吧，那真是太好了"
"十一月D","男","北京","456489877","5","","10000","0","","音乐里的都是我们的回忆......"
"小岛似有风月","保密","广东","171619706","5","","10000","0","","再生一个！！！！多多益善！！！！MHY太牛了"
"临清文通","保密","江苏","1088692945","4","","10000","0","","啊啊啊最喜欢须弥了！！！[原神_哇][原神_哇][原神_哇]"
"御坂19094","保密","安徽","543809507","5","某科学的超电磁炮T","10000","0","9","再生一个[脱单doge]"
"我来偷个月亮","女","山东","364821899","6","","10000","0","","好诶！！"
"夜班的我很想睡jo","男","陕西","37592485","6","","10000","0","","阿如村音乐呢[难过]，哈亚库哈亚库"
"大辨论家","男","江苏","2090799120","5","","10000","0","9","白发紫眸，何其美丽。,天仙下凡，不过如此！,[冷]"
"-SPtPb-","保密","北京","282151201","5","","10000","0","","正好，吃完午饭就边听边午睡[脱单doge]"
"文x","保密","江苏","1556462365","4","","10000","0","","别那么快复刻胡桃，让我攒原石啊！！！"
"Arthur_GE","保密","未知","3068151","6","","10000","0","","须弥的音乐都好喜欢[保卫萝卜_哇]一种亲近自然的感觉"
"半日木","保密","福建","360131063","5","","10000","0","","网易云怎么没有[保卫萝卜_哭哭]"
"O椿","保密","江西","131438588","6","","10000","0","","安宁悠扬的曲调之下隐藏的是未知的风险与动荡"
"宋朝的雨林","保密","黑龙江","454425918","5","","10000","0","","再生一个[脱单doge]"
"马赛克不正宗","男","广东","379007","6","","10000","0","","太棒了吧！！！"
"一维谐振子----","男","贵州","83888000","6","","10000","0","","最喜欢的bgm，今天突然放出简直是惊喜"
"香葱花花","保密","福建","1079543600","4","","10000","0","","等了这么久 终于等到啦"
"Mr_阿淼","男","江苏","444708931","5","","10000","0","","啊啊啊不要啊梅比乌斯，快快快把音乐暂停，不然她又要在我怀里扭来扭去了[doge][doge][doge]"
"愚人众第33席","保密","湖北","32037083","6","","10000","0","","我的音乐幕后呢！！！！！我的音乐幕后呢！！！[保卫萝卜_哭哭][保卫萝卜_哭哭][保卫萝卜_哭哭]"
"咸鱼鱼啊呀呀","保密","天津","4872573","6","","10000","0","","原宝多生点！[保卫萝卜_哭哭]"
"johsang","保密","未知","232381545","6","崩坏：星穹铁道","10000","0","3","好消息：新专上线了,坏消息：貌似仅YTB"
"王的觉醒","男","浙江","33017162","5","","10000","0","","好耶[琉绮Ruki_害羞]"
"Mx麦元初","男","北京","21626798","6","","10000","0","","须弥音乐幕后创作快快端上来罢[妙啊]"
"岑桉桉桉","保密","山东","86611038","6","","10000","0","","好棒！！！！！！！"
"德玛西亚奥特曼","男","广西","22764455","6","","10000","0","","为什么网易云要到27号……"
"无续集的故事","保密","湖南","1720412781","5","崩坏：星穹铁道","10000","0","6","好耶[崩坏3・光辉矢愿_比心]"
"全都绝版哒","保密","上海","291972518","6","泠鸢yousa登门喜鹊","10000","0","","你听你也摇"
"简约river","保密","上海","32291048","6","原神","10000","0","16","[崩坏3・光辉矢愿_大佬喝可乐][崩坏3・光辉矢愿_大佬喝可乐]"
"十九珈","男","云南","434044112","6","原神","10000","0","","听久了，感觉其实还是可以的"
"棠花予酒","女","未知","506680390","6","","10000","0","","赞美须弥ost！赞美HOYO-MiX！"
"大空岚","男","广西","8002328","6","","10000","0","","等一个桓那兰那"
"编号0863","保密","吉林","490585014","5","","10000","0","","须弥的音乐和地图让我感觉终于有开放世界那味了[妙啊]"
"三三好萌好可爱","男","广东","6763037","6","良辰美景・不问天","10000","0","10","前瞻,急瞻"
"枫铯幻想っ","保密","广东","2795018","6","Kizuna AI","10000","0","","你好短啊，能不能长一点？"
"躲过冬的寂寥","女","湖北","236639410","6","","10000","0","","继续生！！！"
"伊卡洛斯Lc","保密","浙江","430423561","4","","10000","0","","陈老师yyds！！"
"莉雅的女友喜欢吃香菜","女","四川","309922073","5","","10000","0","","荧视角徇察五风活动图片换回荧！！！！！！！"
"ArsenicLatte","女","山东","649070","6","崩坏：星穹铁道","10000","0","10","要看幕后！幕后！[崩坏3・光辉矢愿_up主][崩坏3・光辉矢愿_up主][崩坏3・光辉矢愿_up主]"
"暮秋朔四","保密","北京","18928659","6","","10000","0","","生的好！接着生！"
"工具人本本","男","江苏","73017073","6","雪未来","10000","0","","这次ost里有花神之舞的bgm吗，我真的好喜欢那首[2233娘_大哭]"
"嗯1dh","男","广西","1545797592","5","","10000","0","","音乐真的很好听，以我设想的要高出很多水平，地图设计也是。然后就是，两个版本教令院的仇恨都已经吸满了，所以快点更新，给我预告！我想现在就把贤者全都给痛打一顿，跪着向小草神求情"
"Sync_Error","保密","海南","35485658","6","至尊戒","10000","0","","有种，小时候在森林公园玩的感觉，放的也是这种类型的音乐，同时不会想那么多就是到处跑到处看[笑哭]"
