"昵称","性别","IP","UID","等级","装扮","用户权重","获赞数","粉丝团等级","评论"
"我们也没有多特别","女","黑龙江","20991465","6","沈剑心","10000","2","","感觉听到了仿佛 you raise me up 般生命，希望的感觉，真好听啊[捂眼]"
"本末倒置的g","保密","重庆","1260972360","4","","10000","15","","一开始看见这个视频，听第一首时我并没有感到很惊艳，比起须弥主题曲的震撼和喧繁之港的生机，几初的智愿显得更加平淡，没感觉，不能一下子就记住。过完主线，一想到这是大慈树王最后离开时的音乐就多了一些惆怅，直接就想哭了"
"_Karako_","保密","四川","20679907","6","工作细胞","10000","2","11","呜呜呜  我的大慈树王[原神_哭哭]"
"西南偏左","男","宁夏","288255327","6","","10000","2","7","几初的智愿是真的好听"
"北城之孤酒","保密","湖南","497852409","5","","10000","2","","我要哭了！"
"琴团长","男","吉林","332668599","6","","10000","2","","手中的快乐水突然就变成了芦荟汁[doge]"
"君bog临","保密","四川","170887664","5","凹凸世界","10000","2","","抽了草神的，后面就是纯福利了，因为只剩个水火冰了，冰多半最后了，水火可享受反应了[笑哭]"
"战地钢琴师","保密","广西","1568041","6","","10000","29","","初进须弥城的第二首曲子就是这首，而刚好又是游戏中的黄昏，悠扬充满希望的旋律带着一些淡淡的忧伤，直接把我镇住了，坐在长椅上听完还久久不愿离去，每次在城内一定听完这首曲子我才开始做任务。我当时在想这首曲背后的故事是怎样的，至少是听着想哭，结果做完3.2剧情，后听到这首曲眼泪就像泄洪一样了[藏狐][藏狐]"
"EXEC_C","保密","浙江","14347719","6","2233白色情人节","10000","2","7","音乐真的是有让人放空心灵的力量呀 [w白花音_好耶]"
"全能干饭机器人","男","辽宁","63666015","5","原神","10000","2","","很开心这次在须弥冒险，米哈游把很多印度 伊朗 埃及元素带给我们。虽然是二次元，但是也会有一点现世之旅的感觉"
"枝江衿心糖","保密","福建","8460632","6","嘉然今天吃什么","10000","2","10","痛，太痛了"
"牧濑红莉栖","保密","日本","38658","5","崩坏：星穹铁道","10000","18","","点进来的朋友，向她告别吧。"
"高西沐","保密","浙江","39856695","6","十年大会员","10000","2","","这里面可有我共享的那十几个W[原神_哼哼]"
"98大大","保密","山西","7441446","6","","10000","2","","所以...前瞻直播是什么时候，在哪里发布公告了"
"_小梦ovo","女","四川","244242501","3","","10000","2","","请问前瞻直播是什么时候呀"
"若朝啦","保密","河南","291085296","5","","10000","2","","原宝，隔壁方舟二十三号晚八前瞻，你能不能二十一或者二十二前瞻啊[doge]"
"浅月花落","男","河南","377054374","5","至尊戒","10000","2","","欢迎加入原神游戏群，2014年就已经创的老群427472392，现在正式改名原神群，而且群内增加了原神机器人，有什么不懂的可以直接问机器人，为了振兴群，求求捧个场吧。[笑哭]"
"寒宇-原神代肝","保密","湖北","628745075","5","名侦探柯南","10000","2","","加强赛诺"
"同样又是冬天","保密","福建","11420823","6","","10000","24","","这到底算什么结局，为什么要牺牲自己啊！,呐，树王，我是那么的尊敬你崇拜你，抱歉我没能拯救你...下次好想一起玩耍啊树王，在那个没有灾厄的世界里，听你给我讲你那个时代的美好故事。,提瓦特之神啊，拜托了，这是我出生以来第一次奉献全身的祈祷，假如说我是因为诞生于本世界而无法保存记忆的话，但至少让谁记得树王曾经存在过和存在的意义，谁都行，请把这份记忆交给谁吧…让他见证…让他铭记...,什么吗，你不是在的嘛...身为旅行者的你...只要能够记录...那么...提瓦特的时代和历史...就获得了一种存在的备份...请你好好的保存这份记忆...在未来某日...与你一同前往别的世界......"
"一加手机","保密","上海","9535164","6","","10000","98","20","已收藏 等预告[脱单doge]"
"原神雨巷","男","浙江","1242137324","4","魔法学院","10000","2","10","我认为虽然没有前瞻的消息大家挺失落的，但是请不要用“生错了”来调侃原神的音乐，顶多来句“再生一个”[脱单doge]"
"悦动我听","男","安徽","11295165","6","","10000","20","","For Riddles, for Wonders 几初的智愿》加上大慈树王离开的那段剧情，刻在DNA里场景。[委屈]"
"_阴间水蜜桃","男","北京","397841792","5","","10000","5","","恭喜原宝B站突破1400万粉丝[脱单doge]"
"诺尔坦","男","黑龙江","109310354","6","","10000","2","","这个笛子真的太nb了"
"幸福时光l","保密","黑龙江","1299908902","4","","10000","2","","[原神_哇][原神_哇]"
"核爆_柠檬茶","保密","湖南","1723757776","4","","10000","2","","[原神_哇][原神_哼][原神_嗯][原神_喝茶][原神_生气]"
"冷面鸦","男","广东","472870064","5","","10000","17","","没有过须弥魔神第3章之前你觉得还好听，现在过完之后一听就难过了。[大哭]"
"我要陪我的床","保密","广西","543629273","5","","10000","20","","大慈树王,我想你......[大哭]"
"十个肝的XX人","男","江苏","1481140506","5","挚爱花海","10000","14","8","现在来看，《几初的智愿》，描绘了人来人往的热闹场面，明明很热闹，充满了雨林的生机，但我为什么会哭呢......"
"慕恋的纸鸢","保密","安徽","38029404","6","阿梓从小就很可爱","10000","20","","最喜欢的曲子，几初的智愿，尤其是高潮的部分，只是现在听起来太悲伤了。"
"人g天使の淳平","保密","吉林","281097971","5","","10000","4","","“如果没有战乱的话，这应该是某个中东国普通家庭的日常吧”弹幕兄弟真的扎心了[大哭]"
"次克立6","男","辽宁","576003840","5","","10000","7","","草之国是两代温柔草神的馈赠"
"瞌睡时间","男","湖北","256060192","5","","10000","7","","夕阳下的迪娜泽戴，积极乐观版的林黛玉，这一幕我能记一辈子"
"张老吉的名义","保密","广东","80064781","6","","10000","7","","千朵玫瑰带来的黎明"
"酷范","保密","河南","457631198","5","","10000","102","","关于兰那罗的歌,Melody of Bright New Buds 沃土新芽的曲调,Melody of Sprouting Flowers 颠倒梦想的曲调,Melody of Fresh Dewdrops 晨曦初露的曲调,Melody of Hidden Seeds 生命之谷的曲调,Melody of Brave Seeds 和合大梦的曲调,Melody of Dream Home 染绿乡园的曲调,Melody of Young Leaves 幼叶绽生的曲调,Melody of Distant Green Fields 绿野纤绵的曲调,这几首好像都听过但是好像都没听过，前四首是音乐，后四首有童声，喜欢的可以去听听[脱单doge][脱单doge][脱单doge]"
"萧晓小笑特别喜欢六缘","男","美国","11944222","6","","10000","5","","“须弥的子民们，愿你们今晚得享美梦。”"
"歌德猜想巴赫","女","湖南","627350163","4","","10000","4","","折枝落梦杀我[大哭][大哭]"
"JohnSoong","保密","天津","28359725","5","","10000","6","9","“我的梦中总会出现一片空地，无论周遭的景色如何变化，它都会占据最重要的位置，挺奇怪的吧？我觉得这里曾经应该存在过什么东西，可就算我驱使梦境的权能也无法获得答案。唔，居然梦中也有我不能掌控的东西…”"
"KoronaCA","保密","天津","804206","6","","10000","5","","现在一听就掉泪，大慈树王感人至深"
"看你喵捏","保密","广东","386278901","6","","10000","6","","大慈树王！！[保卫萝卜_哭哭][保卫萝卜_哭哭][保卫萝卜_哭哭]"
"虚_空-","保密","广东","696927148","5","","10000","2","","让世界，遗忘我―――大慈树王"
"接吻酒吧何处有","男","云南","34799769","5","","10000","5","","不知为啥 感觉这里有一束光 只是这束光是慢慢的升起 还很缓慢"
"铃妹可爱捏","男","天津","431417893","5","","10000","5","","让我试试刀吧"
"冻得喵喵喵的吃菜狗","男","天津","87993772","6","","10000","4","","起初，观众还没有明白智愿之本意"
"长庚且上学忙碌版","保密","安徽","689897649","5","","10000","5","","谁懂，音乐刚开始耳边有水声落下[脱单doge]"
"亚尔嘉","女","广西","3922114","6","","10000","4","","这BGM一听就能想到迪娜泽黛"
"爱躺不愿起床的人","保密","江西","1294411095","4","","10000","4","","做了主线后再听会有完全不同的感觉"
"破碎红茶","男","江苏","5107973","6","至尊戒","10000","4","","听后泪水会止不住[tv_流泪]"
"言若初","保密","上海","25306188","5","暮光幻影","10000","1","","马上就是七七up了 相信大家很难歪出纳西妲这里我为大家准备了七七的材料[脱单doge],摩拉 ×1050030,琉璃袋 ×168,大英雄经验 ×419,哀叙冰玉碎屑 ×1,哀叙冰玉断片 ×9,哀叙冰玉块 ×9,哀叙冰玉 ×6,导能绘卷 ×36,封魔绘卷 ×96,禁咒绘卷 ×129,极寒之核 ×46,繁荣的教导 ×9,繁荣的指引 ×63,繁荣的哲学 ×114,智识之冕 ×3,北风之尾 ×18"
"真白小猫","男","湖北","6982969","6","#EveOneCat","10000","1","","关于听了后洗澡水突然变异成恒河水攻击我这件事！！！"
"nikiiibb","保密","广西","1330663020","4","","10000","1","","有大佬知道纳西妲应该戴什么圣遗物吗？主词条精通吗？[思考]"
"百思不得其解啊","男","广东","9982735","6","","10000","1","","我为什么在网易上找不到这个专辑？？？"
"微尘细雪","保密","广东","1370544","6","","10000","1","","印度音乐，好适合睡前听"
"Yuyu呢_","男","广东","243934183","6","","10000","1","","超级好听的纯音乐"
"Y_Avalon","男","陕西","472162","6","","10000","1","","版本直播延期了？"
"鹿来七荒","保密","广东","51453753","6","","10000","1","","真好听啊"
"bili_29918409548","男","河南","1574672017","4","","10000","1","","1400万了[打call][打call][打call]"
"貌合s又神x","保密","广东","176822183","6","","10000","1","","1400万！"
"账号已注销","保密","陕西","629860523","0","","5000","1","","一千四百万了！"
"羽落kylin","保密","江西","404089283","5","","10000","1","","粉丝数1399.9w[热词系列_知识增加]"
"DAME4Mamba","男","辽宁","261525153","6","快把我哥带走","10000","1","6","原宝你要1400万粉丝了不发个邮件庆祝一下么[原神_嗯]"
"天哪灬他居然","保密","广东","10300153","6","","10000","1","","还有十一天我就能去教令院把贤者的皮剥下来了[加油][脱单doge][OK]"
"不冷冷冷冷冷啊","保密","福建","471571043","5","","10000","1","","说实话音乐占原神一半，应该要让陈老师露个脸。"
"冷空气下的尘埃","男","安徽","200696138","5","","10000","1","","希望希望存在 但愿吧"
"粮福儿","男","四川","34904605","6","","10000","1","","陈老师，真的太会写了！！！！！！！"
"拉普兰德德德iii","男","陕西","2141319787","5","","10000","1","","等幕后，基本上把专辑听完了[打call]"
"每天吃粒氨基酸","女","广东","17769039","6","原神","10000","1","","什么时候出小朋友合唱的MV呢宝?"
"方旭茕","女","福建","352880694","5","","10000","1","7","快把幕后制作放出来吧，我等不及了！[大哭][大哭][大哭]你知道我很急，你还让我先别急？"
"十维空间万维世界","男","湖南","14255967","6","","10000","1","","期待啊"
"夏日的谎言","保密","山西","3097627","6","","10000","1","6","好想躺在草地上睡觉啊"
"-一碗猫饭-","女","天津","33606352","5","","10000","1","","原宝啊，咱就是说，须弥音乐幕后什么时候放出来呢[原神_哼]"
"比基尼海滩第一上单","男","山东","250667728","5","","10000","1","","前瞻呢？要是下周的话，也太晚了一定吧"
"时间_深海","男","湖北","168644207","6","","10000","1","","我的前瞻直播预告呢[doge]"
"云","男","黑龙江","220016323","5","","10000","1","","问问大家意见，宵宫带的弹弓，差个公子组万达，武器池垫了45抽，角色池大保底差二十抽左右，已经攒了105抽。听说飞雷这俩都能用，啊，万达的话飞雷冬极哪个更好捏。另外我还想抽将军，哼哼啊啊啊啊，怎么取舍啊，公子将军都想要，武器飞雷冬极只能挑一个啊[委屈][委屈][委屈]"
"千与千泷","保密","浙江","16056538","6","#EveOneCat","10000","1","11","hoyo-mix我的超人！！[打call][打call][打call]"
"是南宫清凝但也是kylin","保密","江苏","672595146","5","","10000","1","","这怎么先把二胎生出来了，我大宝呢？！（不是,）"
"日立菲比C","保密","广东","272987","6","","10000","1","","游戏里第一次听到这个bgm，好有异度装甲的感觉，泪流满脸，太emo了"
"刀锋未","男","湖南","313166417","5","领风者","10000","1","","太好听了8，简直就是天籁！"
"我是达达利亚的死忠狗","女","山东","3461572328425761","2","","10000","0","5","歌曲婉转动听 ，人物属实优雅"
"芙卡洛斯-Justice","保密","江西","478107392","5","","10000","1","","从1分钟那里开始，我总以为这伴奏是那首“客官不可以”那首歌，真的旋律好像[笑哭]"
"夜光凝兰","男","福建","134751696","6","","10000","1","","你好，金色的那莅，我是兰德基，我听兰阿帕斯、兰萨卡、兰茶荼、兰非拉他们说，你愿意为无忧节做准备，我现在正在进行「 烹饪修行」，肯德基,疯狂星期四，是开心的味道，V我50，让新的梦想永远不被无留陀侵蚀，旧的故事与无留陀-同被忘却，森林会记住好那莅的善举"
"兔子机会","保密","辽宁","43608459","6","","10000","1","","前瞻是什么时候啊"
"爱莉莉u喵","保密","四川","1772657480","3","","10000","1","","太享受了"
"私の知らない物Z","保密","江苏","20382043","6","","10000","1","","每次看到听到这种演出，我都觉得氪金没有白花！"
"离逝浮生","保密","山东","457305512","5","雪未来","10000","1","","请问他们会把琴摔断吗[doge]"
"小光焰","女","四川","325323162","6","还有醒着的么","10000","1","","哇塞！！"
"酷枸杞","保密","江西","484734040","5","","10000","1","","太厉害了"
"雪染琴弦","女","广东","7879902","6","","10000","1","","须弥的音乐可是让我那圈外人的舍友都着迷了"
"阿清走天下","男","江苏","667698432","3","","10000","1","","这！这是肝疼的催命曲！"
"YLG_GZ","男","河南","323725097","6","BML2020光明版","10000","1","","把纳西妲飞机跑改了！！！[生气]"
"期盼y久","保密","山东","397138632","5","全职高手","10000","1","12","谢谢，小保底没有不歪过[呲牙]"
"KCNitro_Azusa","保密","广东","29502679","6","Kizuna AI","10000","1","","纳西妲的表情改回来！！！！！！！！！！！！"
"仙家军不卜庐小陈中医","男","江苏","6446922","6","灵笼","10000","1","25","好好听"
"MarkZuo34","男","吉林","250557785","6","多多poi","10000","1","11","音乐yyds"
"小煮猪猪猪猪","男","河北","243463443","4","","10000","1","","[原神_哇]草神不歪[原神_哇]"
"凉亭的等候","男","四川","8846053","6","","10000","1","","草神快给我拿出来！"
"抽屉柜里黑斑猫","女","陕西","445700396","5","","10000","1","","原宝你生得好哇"
"今天出门突然-_-","保密","广东","62434764","6","","10000","1","9","真的好听[保卫萝卜_哭哭]"
"鸽布灵猎嘤","保密","湖北","107173066","5","","10000","1","","这不止印度啊，包含古印度（现孟加拉国、印度、巴基斯坦）和波斯（现伊朗）的文化和乐器"
"暮雨汐梨花","男","山东","11299638","6","","10000","1","","再生一个！[doge]"
"我永远喜欢凉宫遥","男","陕西","320272117","6","","10000","1","","60发两把up武器[脱单doge]"
"小北方39","男","浙江","163109573","6","呜米","10000","1","","网易云啥时候上"
"-佛跳墙-","保密","上海","338919283","5","","10000","1","7","这次不错，比之前音乐会强多了"
"柳絮之诺","保密","江苏","1422753272","5","异常生物","10000","1","","不懂就问，为什么这个up已经快1400个粉了"
"露夕-Saye-羽","女","天津","1975265279","4","","10000","1","","所以原宝我的前瞻预告呢[微笑]"
"文的杂货铺","男","江西","97570151","6","","10000","1","","[脱单doge]音乐真的很棒，什么都能黑就是不能黑音乐。"
"学不好数学不姓廖","女","广西","12349365","6","","10000","1","","好听！[给心心][给心心]谢谢陈老师！！"
"桃安Ann","女","重庆","438776479","5","","10000","1","","提前恭喜原宝1400w[打call]"
"我改name就中奖","保密","重庆","663658989","5","","10000","1","11","我爱你，原宝[喜欢][喜欢][喜欢]"
"无知笑月圆","保密","广东","372648982","3","","10000","1","","3.2许愿胡桃"
"米格-29-歼击机","保密","辽宁","1109043831","5","","10000","1","","我要小草神！！，纳西达快到我怀里来！[tv_色][tv_色][tv_色][tv_色][tv_色]"
"_[","保密","江苏","1637711610","4","","10000","1","","再生一个[脱单doge][脱单doge]"
"真是可爱呢","男","河南","222807281","6","","10000","1","","垂死病中惊坐起，草神老公我自己。"
"丶菜比","男","山东","99801991","6","","10000","1","","可以在奥摩斯港的MV里来一段耍蛇吗[歪嘴]"
"叁玖壹陆号","保密","浙江","1457294","6","实验品家庭","10000","1","","这是我心目中的西域。一片祥和，没有战乱。,音乐，舞蹈，还有我喜欢的烤肉。"
"千人律者人偶444号","保密","江苏","174095106","6","","10000","1","","纪行武器保留背包，求求了"
"蠢熊熊捏","男","山东","31756296","6","","10000","1","","生错了啊啊啊啊啊啊啊啊啊啊"
"我永远喜欢景元将军","男","山东","1768405399","4","","10000","1","","再生一个"
"招兵卖R","保密","山东","12042598","6","","10000","1","","[大哭]我森林书动了，我不听了"
"侥檬的滑稽","男","新疆","181830343","6","原神","10000","1","3","前瞻拖到现在不会是还在考虑草神回退不回退吧？如果是国外的节奏，希望可以像当初国内节奏对待国外那样对待国内。"
"空废气","保密","广东","277740750","5","","10000","1","","原宝再生一个！"
"丫丫也A","保密","湖北","73804084","5","","10000","1","","[热词系列_知识增加][热词系列_知识增加][热词表情_哎呦不错哦]"
"送幸运的好运精灵","保密","上海","124033746","6","","10000","1","","哪位大佬告诉我下开头的那个乐器叫什么？[原神_嗯]"
"暮云栖w","保密","河南","646460496","5","","10000","1","","太好听了[星星眼][星星眼]"
"不想长大长大","女","江苏","393022625","4","","10000","1","","这都是大家的648"
"MoMeaken2","女","湖北","310757064","6","崩坏3・天穹流星","10000","1","11","陈致逸老师，我是你的粉丝啊"
"Aaaa乖宝","保密","陕西","271964965","5","","10000","1","","祝所有旅行者卡池全保底  副本零掉落[害羞]"
"好好学习脚踏实地","女","浙江","484908219","5","","10000","1","10","宝啊，咱不要求加强刻晴了，出几个兰那罗周边行不[热][脱单doge]"
"原星铁崩三代肝","男","江苏","1651519072","5","","10000","1","","[热词系列_知识增加][热词系列_好耶]"
"_安笙_--","女","湖北","1721489902","5","","10000","1","","生错了，在生一个[脱单doge]"
"西八区区长","保密","广东","351933574","5","原神","10000","1","","真的好好听，鸡皮疙瘩都起了，做森林书时听到的，我在那个地方呆了好久"
"阿比酱世界第一可爱_","男","江苏","6888228","6","崩坏：星穹铁道","10000","1","3","想看幕后啊！！！！[少前小剧场_比心]"
"--山-","男","贵州","1256285826","5","","10000","1","","6"
"MrLE0N","保密","湖北","33348613","6","刀说异数","10000","1","","陈老师我的神！"
"我真的没忽悠你","保密","重庆","2323431","6","","10000","1","","音乐制作花絮呢，一直说要放出，都快3.2了"
"大家的抽奖姬","保密","安徽","159441389","6","EveOneCat2","10000","1","13","homomix好棒!"
"麦麦兜兜1221","保密","福建","210925533","6","至尊戒","10000","1","","好听！"
"时_礼","男","浙江","173541215","5","","10000","1","","这么好的二创为什么不点up主激励计划！[doge]"
"砒霜加可乐丶","保密","中国香港","346084679","5","","10000","1","","眼泪不自觉的流出来了"
"伊朱夏树桑","男","广东","1950135","6","国民老公带回家","10000","1","","陈致逸老师yyds"
"_无执-","男","安徽","432253756","5","","10000","1","","七千人同时看，恐怖如斯"
"DuckcK","保密","河南","1411788640","5","","10000","1","","纳西妲pv快来罢，我已经等不及了[脱单doge][doge]"
"夜雨莫言","男","河北","153446965","5","星座系列：水瓶座","10000","1","6","无所谓，我会肝"
"贰椒","男","四川","27484359","6","","10000","1","","真不错"
"刘屿溪","男","陕西","432430942","5","","10000","1","","这是发哪里了？网易QQ酷狗等音乐软件上上线了吗？"
"大礼喵财","男","北京","108200241","6","","10000","1","","吹的是什么乐器，想让我孙子学"
"屈云岚","男","湖南","9842585","6","","10000","1","10","太好听了[大哭]"
"意大利面青年","男","福建","95839076","6","2233十一周年纪念","10000","1","","小吉祥不歪我就不乞求了，起码歪个琴吧[大哭]"
"咸鱼开始摆烂","女","福建","38971874","5","","10000","1","","来了"
"BilibiKing_","男","安徽","551144933","5","","10000","1","","这是真的吗？我是不是在梦里"
"你的一句答应","女","天津","390379698","5","","10000","1","","不是这个！！[崩坏3_？][崩坏3_？]"
"冰璃雨樱","保密","江苏","20866386","6","","10000","1","","纪录片啥时候出啊，别光顾着前瞻"
"奶冻团子-","保密","云南","506458074","5","","10000","1","9","须弥的幕后呢原宝[大哭][大哭][大哭]"
"靥yee","保密","河南","384659280","5","","10000","1","","前瞻啊前瞻[大哭],急急急,我是大疯急官,急急急急急急"
"丽瑟尔-Ein","保密","澳大利亚","1076585864","6","","10000","1","","音乐幕后gkd"
"滴滴哒滴滴哒哒2","男","辽宁","2039250402","6","","10000","1","","原宝，你看赤王陵都那么壮观，璃月的帝君坟是不是也得考虑建一个了[doge]"
"浔久--","男","山西","700656603","4","请吃红小豆","10000","1","","虽然看不懂，但我大为震撼[脱单doge]"
"蓝芊雪_Lucy","女","上海","16052515","6","","10000","1","","所以海哥什么时候才能生出来QAQ"
"超星空没石了","保密","广东","64734214","5","","10000","1","","原神的音乐真的超级顶，手游天花板"
"困人喝开水","女","湖北","401599974","5","","10000","1","","6"
"随风的光影","男","河北","207547289","6","","10000","1","","这须弥快结束了我连剧情妮露都没见到呢[藏狐]自己竟然摆了这么久[吃瓜]"
"春风奶绿","女","湖南","41367478","5","","10000","3","","给我看玩家的诉求！！给我看评论【总结大家的诉求】[热],我们是玩家，我们最大！,最重要的→角色up抽卡别逮着一个人或逮着我们这些非酋薅了！我不希望我小保底次次歪！也不希望次次70-90发才出角色！我们的耐心是有上限的！因为你这破抽卡，好几次我都不想推游给我朋友！, 1.优化下雷极的选择机制吧，四叶印真的好太多，, 2.出个分层地图和锚点吧在须弥经常迷路！, 3.多加几个圣遗物强化槽，6个6个强化太费时间, 4.圣遗物加个记忆功能吧，一个一个扒好费劲,这都是一些小小的优化，但可以大改善体验啊,5.增加派遣上限！探索能不能弄个一键，天天就那几个人来回点,6.能不能出个npc专门卖晶核的，不想捉了,7.什么时候多出点四星的邀约吧原宝,8.自选委托！常驻五星定轨！,9.加强圣遗物！刷圣遗物真的累了,10.加强斗子哥肌肉，拒绝做试验品,11.迪卢克和魈的pV！,12.宝，角色语音可以单个自选嘛！,13.原宝，原胚能不能给点呀,14.原宝，声望任务能不能一次性接3个啊，还要跑来跑去的,15.原宝，能不能多加点地图标记点啊，不求你加到300个，200个也行啊，150个现在根本不够用了，又要标神瞳又要标各种洞口还有钓鱼点什么的，现在都四个国家了就别用当年的标准了呗，多点标记点不影响的,16.宝，尘歌壶摆设太多了，按国家划分好吗,17.博士建模给我改！和pv完全胖若两人！别再高欺诈了！"
"真的想跳楼","保密","广东","607303870","5","","10000","1","","芜湖"
"bzxmxy","男","河南","572279567","5","","10000","1","","前瞻呢，3.1一刻都呆不下去了[大哭]"
