"昵称","性别","IP","UID","等级","装扮","用户权重","获赞数","粉丝团等级","评论"
"云堇神教教皇","保密","无IP","291033098","6","","10000","4","10","胡桃:最近账面不对啊[思考]"
"己兀","女","无IP","258561165","6","","10000","4","","还有七天 你知道这七天我是怎么过的吗"
"遥彼阿橼","男","无IP","11195184","6","","10000","4","8","希望万民堂能扩建！起码加一间40坪的餐厅嘛，然后把厨房放到内部，哪怕让卯师傅站在门口也行。"
"彼丨岸丨","保密","无IP","188073936","5","","10000","4","","话说钟离和冰神的契约不会是无限从公子那里提款吧[吃瓜][吃瓜]"
"星河海哈哈哈","保密","无IP","184620123","5","","10000","4","","突然想到钟离立的契约不会是闲游尘世所有花费都报销给北国银行吧hhhhh"
"今天该取什么名字","保密","无IP","228215216","5","","10000","4","","帝君生日快乐！！！[原神_喝茶]"
"乘风-归","男","无IP","397983358","6","","10000","4","","申鹤原来是不足挂齿真君[脸红]"
"日常爱シャナ","保密","无IP","179605501","6","雪未来","10000","4","","胡桃：[蛆音娘_生气]tmd谁一天到晚在买破石头账单还总往我们往生堂寄啊[蛆音娘_吐血]。钟离你说我要不要去找旅行者帮我抓住这个混蛋[蛆音娘_机智]?,钟离：[蛆音娘_吃惊]……以普遍理性而言，旅行者事务繁忙，还是不要麻烦他了[蛆音娘_害怕]"
"瑟瑟宝","保密","无IP","23348930","6","国民老公带回家","10000","4","","钟离日配也太凶了……"
"四季长春103","男","无IP","68975631","6","碧蓝航线2020","10000","4","","我靠，我想磕钟离和仪倌小妹，我正常吗[喜极而泣]"
"言蹊yuu","保密","无IP","477204193","5","提摩西小队","10000","4","","内啥，cp粉能不能圈地自萌[藏狐],别问哪里/警察，弹幕里有"
"远长风","保密","无IP","341567614","5","","10000","4","","一年了老婆还是这么蛊呜呜呜呜[原神_喝茶]"
"希望岩王帝君不歪","男","无IP","676743218","4","","10000","4","","人家胡桃辛辛苦苦推销，你这样糟蹋。,哦，寄给北国银行啊，没事了。"
"麋失鹿","保密","福建","66708240","5","崩坏：星穹铁道","10000","4","","老爷子，水神PV太刀了，我回来看看你"
"F","保密","黑龙江","1715404966","4","","10000","4","","你说的对，但是你有带钱吗"
"青瓦落红枫","保密","广东","687521483","5","","10000","4","","钟离所有神明里我最喜欢你啊啊啊"
"饭了个饭","保密","浙江","1348687","5","","10000","4","","我来应聘仪馆小妹[脱单doge]"
"框住微凉夏风","保密","福建","357779231","5","","10000","4","","看看、看看，以前pv，tm的质量这么高。都能当个故事或者小剧场看了。看看现在的，一点意思都没有。完完全全就是am策划绞尽脑汁卖卡"
"我是无名氏鸭","保密","北京","416077650","5","","10000","4","","趁现在一个人，许愿今年会有逐月节，逐月节pv里有帝君"
"艾斯ASE","保密","云南","108458010","5","","10000","4","","钟离呜呜你什么时候复刻我都要等不及了，玩这个游戏纯粹是为了你得不到你我变得好脆弱"
"远亲不如静临呀","保密","澳大利亚","5695075","6","","10000","4","","钟离先生能不能缠缠我"
"我永远喜欢景元将军","男","山东","1768405399","4","","10000","4","","最好的PV，没有之一"
"喜欢吃apple的apple","女","新疆","3493118850632601","2","","10000","4","","啊啊啊 为什么钟离先生不缠我 我的钱全给你花呀"
"曼维尔塔","保密","江西","524258485","4","","10000","4","","诶嘿，考古，那个“风车菊贴在湿釉上面烧造”，好像吉州窑的贴上桑叶烧成的瓷器啊，江西人狂喜"
"卷心只有菜","女","河北","86821320","6","","10000","4","","缠上我，快缠上我[大哭][大哭][大哭][大哭][大哭]钟离先生啊[大哭][大哭][大哭]"
"_siGnn","女","广东","312955453","6","名侦探柯南","10000","4","","这个小妹宠溺的语气"
"黄民","男","广东","220242993","6","","10000","4","","往生堂和北国银行表示：钟离先生，我谢谢你[笑哭]"
"改了名字还是miboy","男","安徽","397858728","6","","10000","4","","不足挂齿真君[歪嘴]"
"绝对不当笨蛋","女","安徽","2104500853","4","","10000","4","","我砸锅卖铁养钟离，钟离快来缠我快来快来"
"飞高高咯","男","江西","692328472","5","","10000","4","","3.0不歪，玩到关服"
"名曰小困的勇者","女","江西","269372782","5","","10000","4","","钟离啊啊啊求求了让我出钟离吧[大哭][大哭][大哭]我原神就是为他而来的"
"孜然烤羊肉串","男","广东","552857309","5","","10000","4","","契约之神引诱他人破坏契约？[热词系列_知识增加]"
"钟离の爱犬","保密","无IP","593848202","5","国民老公带回家","10000","4","","老婆我又来看你了[脱单doge][原神_喝茶]"
"东风突入大气层","男","无IP","251139","6","","10000","4","","仪倌小妹是在炫耀吧？她一定是在炫耀吧！"
"一层小笼包","保密","无IP","368055617","6","","10000","4","","才发现这里的清泉林猪肉就是香菱传说任务杜拉夫找香菱推广的，mhy细啊[原神_嗯]"
"鹰院幼儿园班班长","保密","无IP","646170566","5","","10000","4","","钟离老婆请缠上我呜呜呜呜呜"
"江夏月染","保密","无IP","453628221","5","","10000","4","","请仪官小妹吃饭，账还是记在往生堂上，帝君精明的小算盘"
"账号已注销","保密","无IP","319944523","0","","5000","4","","648万!下次复刻赏给米哈游一个648!"
"你瞅瞅啥瞅瞅的","女","无IP","34906604","6","","10000","4","","钟离没有你我可怎么办[tv_生气]"
"暮秋不是沐秋","女","无IP","298980963","5","","10000","4","","帝君已出，前来还愿"
"晚抑云","保密","无IP","450050400","5","领风者","10000","4","","''摩拉克斯会没有摩拉吗？''[doge]"
"初代-神","男","无IP","245812909","5","原神","10000","5","","钟离什么时候还362200摩拉"
"北有狗丘其名太空","男","无IP","31366710","6","","10000","5","","这种人在社会迟早饿死[脱单doge]"
"面团科","女","无IP","16150338","6","","10000","5","","啊啊啊啊啊啊啊啊钟离！！！yyds！！钟离啊啊啊啊啊啊啊啊啊啊啊"
"星纪优空","男","无IP","6066105","6","","10000","5","","【把阿贝多踢成球】运动,璃月的神，不行；蒙德的炼金术师，行！,可以啊，那就别让我在联机里遇到阿贝多，见一个踢一个。没什么，只是怕认错岩神。,钟离武神定位却是个辅助，辅助能力奇差不说还来加强伤害。,整篇调整公告下来钟离的调整还不如双岩队伍加强的多，谁用钟离组双岩哪？！,就为了让阿贝多流水好看强推岩队？未免太小看我们了，，我们不光不抽还会让阿贝多没法在联机里立足，反正又不是副本没有阿贝多就过不去，谁怕谁啊"
"夏树脖子疼","保密","无IP","12160785","6","","10000","5","","璃月的神＝提瓦特病夫"
"落花锒藉","男","无IP","10863753","6","三周年恋曲","10000","5","","据米忽悠内部人员消息本次钟离事件是一个天降海龟高管临时拍板的（这货主张对玩家反馈进行冷处理已经是从崩3就有的事了）[生气]，这货想在年底压一波KPI，于是就把钟离削烂了，咱们抵制她的方法就是少用钟离，降低钟离出场率，用对官方最直接最有效的数据来压垮她，她现在在公司内部不得人心，并且大伟哥已经开始关注此事（大伟哥本来不负责原神）只要咱们玩家好好配合一波，降低钟离使用率，把以她为主的这帮天降搅屎棍干掉，救回咱们钟离。拿钟离挖矿的也别干了，在数据反馈看来就是你钟离上场率有了，受伤和死亡率几乎没有，在数据上就会显得钟离很好用，玩家也很喜欢用[捂脸]求大家把我顶上去，或者转发给更多的人看，这件事不止关乎于钟离，现在不说话，以后ch的刀迟早会砍到你心仪的那个角色头上，兄弟们，加油[抱拳]"
"大卫露西","保密","无IP","492717216","5","","10000","5","","BV1Qa411F7CJ"
"10爷爷","保密","无IP","10857316","5","","10000","5","","祝流水歇b"
"繁花丶渐散","男","无IP","197479334","5","","10000","5","","献祭舍友出钟离，出必还愿[OK]"
"阿茂整饼天台佬","男","无IP","89675058","6","","10000","5","","原本我还随大流偶尔嗑钟离x凝光，钟离x公子，看完这个之后我觉得前面都不行，现在钟离x仪倌小妹这对我吃定了，无论如何这对我死嗑"
"回合制怎么你了","男","无IP","17992481","6","原神","10000","5","","敢情公子勾搭钟离的套路就是陪玩陪笑陪购物，管吃管喝管报销啊[笑哭]怪不得主线吃瘪，这根本不是在搞任务，这就是在泡妞…"
"我是车夫党","男","无IP","10086304","6","","10000","5","10","妈的，我一个直男看了一遍又一遍"
"Lazybird懒鸟","女","无IP","454605519","6","原神","10000","5","","好一个岩神不务正业[热词系列_好家伙]"
"逊咖裤子","保密","广东","391128193","5","","10000","4","","你是要当一辈子的矿工还是十分钟的岩王帝君,天动万象,,                       ,                           ,                                ,                                     2147483647,                                 "
"世界需要主角控","女","河北","518118509","5","","10000","5","","潘塔罗涅 : 达达利亚？你拿我的钱，去、去帮摩拉克斯付钱？？？（气到面孔扭曲）"
"我不做人了jojo正太控","保密","江苏","434320480","6","天宝伏妖录","10000","5","","那个龙凤筷？？？认真的？？？"
"纾艾奇","女","吉林","293774233","5","星座系列：双子座","10000","5","","单抽出钟离，前来还愿[保卫萝卜_哇]萌新的第一个五星级角色"
"fhhnjjkfvy","保密","无IP","626914544","3","","10000","5","","胡桃：你丫是想从客卿变客户？"
"白堕春醪","保密","无IP","26384176","6","","10000","5","","刚从八重那边回来，还是以前的视频用心"
"无赖知识分子","男","无IP","277592640","5","还有醒着的么","10000","6","","没了公子就只剩克斯的摩拉克斯[doge]"
"来一杯桃子摇摇冰","女","无IP","11158713","6","","10000","3","","真的许愿，能欧这么一次以后的648都是你的，钟离先生来我壶里[原神_喝茶][原神_喝茶][原神_喝茶][原神_喝茶][原神_喝茶][原神_喝茶]"
"尘心如练z","保密","无IP","355592250","5","公主连结佩可莉姆","10000","3","","明天，十发出钟离[doge]"
"嘿嘿你要来几发","男","无IP","320557788","5","","10000","3","","其实仪倌小妹是申鹤，原因是，甘雨介绍的工作，而胡桃也对申鹤有兴趣，然后只有钟离可以镇住申鹤吧。[滑稽][2022][虎年]"
"青烟RainMo","女","无IP","1453462041","4","","10000","3","","真名：不足挂齿[嗑瓜子]"
"充钱才更强","男","无IP","455938170","5","","10000","3","","钟离冲冲冲"
"根号三lll","女","无IP","490738066","5","","10000","3","","一定要来我队伍里！！！啊啊啊钟离先生"
"脑子里有发条小人","保密","无IP","24899284","5","异常生物","10000","3","","先生，我为你写了一首藏头诗，生日快乐[脱单doge][脱单doge][脱单doge][脱单doge][脱单doge][脱单doge][脱单doge],我,爱,钟,离"
"默默念R","女","无IP","480191961","5","","10000","3","","帝君好帅好可爱[喜欢][喜欢][脸红]"
"有没有一种可能安","保密","无IP","89319588","2","","10000","3","","英配小妹好棒"
"先遥","保密","无IP","361111107","5","","10000","3","","钟离先生[给心心]希望能早一点复刻"
"不吃氟硫西汀","女","无IP","6128765","6","梦塔・雪谜城","10000","3","","钟离韩配 我心里永远的韩剧男主声线[给心心]"
"海棠盛开的时候","保密","无IP","524115410","5","","10000","3","","下次去钟离抽钟离概率会不会高[doge]（钟离是安徽凤阳附近的一个村镇）[doge]"
"仿生瓦鸡梦到电子滋崩","保密","无IP","330230532","5","","10000","3","","每天一遍，坚定信念[原神_喝茶]"
"颜颜颜颜su","女","无IP","419156830","5","","10000","3","9","钟离大人哎嘿嘿,请务必缠上我[喜欢]"
"账号已注销","保密","无IP","1654983965","0","","5000","3","","我又来啦！老爷子真的太可爱了[亲亲]"
"冷月照壁","保密","无IP","35288253","5","","10000","3","","钟离神之心卖便宜了"
"-公子季-","男","无IP","272941027","6","","10000","3","","我个人觉得 绿川光的那种坂本大佬的声线也挺适合给钟离配音"
"-公子季-","男","无IP","272941027","6","","10000","3","","真的！被钟离先生缠上真的太棒啦！跑地图刷副本不掉一滴血[doge]"
"11235813213455-","男","无IP","474459942","5","","10000","3","","摩拉克斯和巴巴托斯哪个更该被枪毙 一个没金钱概念还没钱让荧公子胡桃付费的一个天天只会哎嘿忽悠人的 巴尔泽布还天天宅着 就一个至冬女皇认真干事 天理:你们是我带的最差的一届神[原神_生气][doge]"
"追风流火","男","无IP","163551782","5","","10000","3","","看到不足挂齿小妹说慷慨的钟离先生总是把账挂往生堂上，这次是北国银行买单，我当场就笑喷了"
"狐神信徒1号","男","无IP","350019116","6","","10000","3","","钟离。。我的老婆。。。嘿嘿。。帝君。。"
"狗的sogol","女","无IP","234478979","5","","10000","3","","胡桃小富婆[doge]"
"疑解同路","保密","无IP","42876326","6","","10000","3","","璃月gdp有一半是岩王爷亲自贡献的[原神_喝茶]"
"山猪白鸽","保密","无IP","255911971","5","","10000","3","","想做先生的钱包[害羞]"
"鹤秋月","保密","无IP","2053511573","2","","10000","3","","先生，你来缠我吧[大笑]真是位妙人呐[羞羞]"
"御雨思月吖","女","无IP","346765674","5","","10000","3","","这种人怎么还没饿死.jpg"
"一条咸鱼突然绝望","保密","无IP","17565325","6","","10000","3","","来缠我来缠我！！快复刻！求你！请你吃饭！"
"八魔亚","女","无IP","248606508","6","Kizuna AI","10000","3","","居然还有50个人在看[狗子]"
"恰逢花儿少年","保密","无IP","286287063","5","","10000","3","","呜呜呜看看钟离先生安慰一下刚刚吃的刀子"
"愿你健康平安","保密","无IP","161272098","6","崩坏3・天穹流星","10000","3","8","草，我今天才知道这才是钟离的PV[笑哭]"
"lonelyrangers","男","无IP","10686781","6","星座系列：摩羯座","10000","3","","我今天才知道仪馆小姐姐和卡莎是一个人配的……[笑哭]"
"梅友仁爱你","保密","无IP","138621727","5","","10000","3","","韩配忽略语种我愿将它排到第二[支持]"
"团栀_","保密","无IP","262906107","6","","10000","3","","为什么我觉得你在撩？老婆你怎么回事？！"
"你说得对所以呢","男","无IP","439905237","5","","10000","3","","印刷厂没钱印刷钱。"
"陈阿姨今天吃什么","男","无IP","327548445","6","","10000","3","21","钟离当上岩王帝君全靠自己辅助自己[doge]"
"芙m我才是最有威赖","女","无IP","644052643","5","原神","10000","3","","老爷子你买东西可以，只要在往生堂经济实力允许的情况下，不行的话就寄到北国银行吧[原神_鸽子]"
"账号已注销","保密","无IP","610551842","0","","5000","3","","BV19541137yy"
"无星忘忆","保密","无IP","88487337","5","","10000","3","","今晚的消费由公子买单[笑哭]"
"布丙硫异","保密","无IP","41260981","6","","10000","3","","听钟离先生说话可真是一种享受啊[羞羞][羞羞][羞羞]"
"委厥美而历兹","女","无IP","17374529","6","如果历史是一群喵","10000","3","5","不是他付钱他当然慷慨了[原神_吃惊]"
"鲰生衣素衣","保密","无IP","691383888","5","","10000","3","","胡桃辛苦赚钱养家容易吗？[脱单doge]"
"雨之铭","保密","无IP","488812964","5","","10000","3","15","还是帅啊！太温柔了，钟离先生！"
"饭我一口一口吃","保密","无IP","698048677","5","","10000","3","","刀了，钟离那么厚的血，果然很浪费粮食"
"南瓜中的西瓜","男","无IP","350016362","6","","10000","3","","胡桃：[捂脸]"
"愿星光璀璨-愿命运","女","无IP","693716367","5","","10000","3","","因为公子回至东国探亲了。所以只能启动备用钱包了。"
"正版Zinc","女","无IP","13956564","6","星尘","10000","3","","虽然我厨他但是真的好好笑救命[tv_笑哭]"
"艾尔海森大人的狗","保密","无IP","473602351","5","","10000","3","","我刷不出好一点的岩伤杯呜呜呜[大哭][大哭][大哭]护摩也死活不复刻[大哭]，抽到那么久了，钟离先生在我这里还是盾辅[酸了]"
"theshyguy118","男","无IP","336967158","5","","10000","3","","钟离嘿嘿嘿老婆我的钟离嘿嘿嘿"
"`灞","男","无IP","399174820","5","","10000","3","","BV125411P74k[doge]"
"是水@不是水果","保密","无IP","386408165","5","","10000","3","","草了，我也想被钟离缠上（转念一想，我还不上账单，所以还是我缠着钟离吧[脱单doge]"
"李扬帆你好","保密","无IP","87927756","6","","10000","3","","太可爱了呜哇哇哇哇哇老婆！！"
"耀舟","男","无IP","23863671","6","","10000","3","","什么时候 能有岩伤杯子！！！"
"摸鱼与熊掌不可得兼","保密","无IP","9251814","6","","10000","3","","钟离永远滴神，现在我可以在手机端玩原神了，只用套盾凝光站撸"
"粥际旅行","女","无IP","18174779","6","愚人节特辑・酒馆魔术师","10000","3","","这个角色pv真的做的超好啊[羞羞]"
"今天我又来b站了","保密","无IP","292878547","5","至尊戒","10000","3","","请先生务必每天缠（馋）我[脱单doge]"
"脑子里有发条小人","保密","无IP","24899284","5","异常生物","10000","3","","晚安阿离"
"橘子味的猫Lb3","男","无IP","1678050070","4","","10000","3","","以前我老听人 说日本配音工业怎么怎么发达， 现在我相信了， 这钟离不就是一副霸道总栽味呗， 反正对于人物拿对应的模板套就完事了呗，果然是工业发达，  这连人物都没搞懂就来配音了我也是服气，  中> 英>韩>日 。 算了 一个岛国的小国寡民哪里懂什么中国文化啊，不怒自威估计也不懂。 日本人眼里估计 就是 我非要这么说话才能对得起我的身份，或者是我这样的身份我就必须这么说话， 算了，小国寡民，真正的自信也不懂是什么，要他们配好钟离，太难为他们了"
"绝世老白干","保密","无IP","214494478","6","","10000","3","","呜呜保底给温迪了 帝君真没钱给你凑保底了 砸锅卖铁也就40多抽 求求你单抽出奇迹吧"
"背景小马","男","无IP","97021666","5","崩坏3・天穹流星","10000","3","","胡桃觉得很淦"
"谦逊的骄傲","保密","无IP","16198004","5","","10000","3","","希望原神能尽快出命座开关功能，有些高命座负提升比较严重，如班尼特6命，影响物理角色输出，钟离6命，影响护摩和控血角色。[打call][打call]"
"超大蛋卷","男","无IP","2022603","6","","10000","3","","我昨天就是带着香菱去万民堂做饭时祈愿，成功召唤一只帝君，建议大家试试[脱单doge][脱单doge]"
"鱼嘎嘎嘎刚","保密","无IP","34012693","6","","10000","3","","各位大佬们 我做了一个钟离的听书人琴的演奏 各位能帮我点开支持一下么BV1Ah411m73A[2020拜年祭_谢谢老板]"
"老仙女不爱吃鱼","保密","无IP","40089203","6","","10000","3","","／ ￣￣ ＼　 ,|　～　～ \　 ／￣￣￣￣￣￣￣￣￣￣￣＼,|　 　 |   |　   亲爱的原神                      \,\　　 　/ ∠   钟离不歪，我玩原神到关服 / , ＼　　 イ　 \ 不要逼我跪下来求你！！！！！ /,／　　　\        \___________________/,/　|　　　 \ ,|　|　　　 | |"
"黑羽零大人","女","无IP","34765608","6","刺客伍六七","10000","3","","老婆，求你了出来吧[大哭]"
"杨小虎蜀黍","男","无IP","2069238","6","","10000","3","","难怪胡桃宝贝要那么努力的去挣钱[大哭]"
"小手QAQ","保密","无IP","26536492","6","EveOneCat2","10000","3","","／ ￣￣ ＼　 ,|　～　～ \　 ／￣￣￣￣￣￣￣￣￣￣￣＼,|　 　 |   |　   亲爱的原神                      \,\　　 　/ ∠   钟离不歪，我玩原神到关服 / , ＼　　 イ　 \ 不要逼我跪下来求你！！！！！ /,／　　　\        \___________________/,/　|　　　 \ ,|　|　　　 | |"
"Gun-鲧","女","无IP","281148970","6","国民老公带回家","10000","3","10","猛吸一口帝君"
"苗木讠成","保密","无IP","415494464","5","","10000","3","","我在想胡桃一直在拉业务，他们往生堂真的很有钱吗 [脱单doge]"
"没有猫的阿奇","女","无IP","347251911","5","","10000","3","","好家伙，好一出借花献佛，借的还是佛手里的花[OK]"
"ANparE","保密","无IP","14903889","6","崩坏：星穹铁道","10000","3","","300w助攻[给心心]"
"大薯条墓墓子","女","无IP","20895512","6","","10000","3","","我大概知道为什么胡桃天天在外忙着拉客谈合作了[笑哭]甚至不惜第二碑半价"
"可以发抖不可以瑟瑟","保密","无IP","323387311","5","","10000","3","","我有一个问题，胡桃天天打折，钟离花销又这么大，往生堂真的还有经费吗"
"白发戴花_君莫笑","女","无IP","17441580","6","","10000","3","","听书人1000w了，来这边看看[脱单doge]"
"LUOYUNN","男","无IP","21244719","6","","10000","3","","这就是“I will have order”吗，我结账你买单xswl"
"-白R妖-","女","无IP","85679910","6","","10000","3","10","离离子严重不足了[大哭]"
"bili_95918838001","保密","无IP","470973262","5","","10000","3","","先生元宵节快乐[给心心]"
"挽梦亦清歌墨染则为华","男","无IP","220299373","6","","10000","3","","胡桃：我想问一下……客卿先生……咱往生堂欠了多少了？（只有请公子吃饭的那次是北国银行买单[doge]）"
"v御坂美琴v","保密","无IP","2502759","6","","10000","3","","我太羡慕钟大爷的白嫖技能了[脱单doge]"
"断念残离","保密","无IP","37625215","6","","10000","3","","一般情况下，度假的钟离，也就是前岩神，摩拉克斯,平时买东西的账单是交给往生堂付款，换句话说是交给胡桃买单,如果在场有任何一个愚人众，那么账单就给北国银行，账单名字大多是记公子名,如果是和旅行者在一起，那么账单基本是给旅行者的，毕竟签了契约,如果在场没有人会给钟离买单，钟离会使用“见多识广”的能力，让这个单子尽可能免费，俗称：讨价还价,但如果说钟离会主动选择请客吃饭，那么钟离会真的带一次钱，虽然只会请客到万民堂这种比较便宜的地方,所以跟钟离在一起除了饿不死以外什么都没有[doge]"
"邈焉","女","无IP","39168319","5","","10000","3","","请务必缠着我(/ω＼)害羞"
"善良的Robin","男","无IP","179835890","5","Kizuna AI","10000","3","","日配声线不错，但要配合视频，语速太快，输在日语的发音上了"
"谷梁子师","男","无IP","26277463","6","崩坏3・天穹流星","10000","3","","现在每天下线都会坐在往生堂门口，看不足挂齿小姐姐[OK]"
"wowna","保密","无IP","479842397","5","","10000","3","","胡桃：所以爱会消失的对吗"
"卖瓜王婆婆_koumi","保密","无IP","8925452","6","Overidea米娅","10000","3","","淦！钟离先生请速来缠我"
"浮世一隅","保密","无IP","7646798","6","","10000","3","","老婆老婆（小声）"
"芙卡洛","保密","无IP","30762749","6","斯莱特林","10000","3","","量入为出，适度消费。,避免盲从，理性消费。,保护环境，绿色消费。,勤俭节约，艰苦奋斗。"
"尼格兰的屠龙者","保密","无IP","91488605","5","BW2021","10000","3","","胡桃：喵喵喵，我的摩拉呢d(д)"
"欣吧唧在线吃瓜","女","无IP","434352449","5","","10000","3","10","[热词系列_AWSL][热词系列_DNA][热词系列_打卡]"
"白勒君","女","无IP","172979285","6","原神","10000","3","","老公晚上好[胜利][胜利]"
"大j想家","保密","无IP","2055066","6","","10000","3","","钟离也太会了[微笑]"
"-荧惑守心-","保密","无IP","171962891","6","","10000","3","","这个pv里真的很可爱[大哭]"
"终末归路","保密","无IP","530973332","5","","10000","3","5","能不能净化一下弹幕，一群人好烦人啊"
"-白R妖-","女","无IP","85679910","6","","10000","3","10","老婆呐[原神_撒花]"
"拨雪寻春续白昼","女","无IP","10724574","6","","10000","3","","老婆午安"
"-白R妖-","女","无IP","85679910","6","","10000","3","10","老婆午好[原神_救救我]"
"愚者座下敲钟天使pvo","女","无IP","398597100","5","","10000","3","","老婆，1.3已经确定啦，虽然改得没多好， 但聊胜于无了"
"xi玄离","保密","无IP","1865759","5","","10000","3","","钟离先生来缠我呀[tv_斜眼笑]"
"肆香叶","保密","无IP","22967830","6","还有醒着的么","10000","3","","胡桃："
"致之至郅","保密","无IP","104771975","6","","10000","3","3","被钟离先生缠上了，可就什么办法都没有了"
