"昵称","性别","IP","UID","等级","装扮","用户权重","获赞数","粉丝团等级","评论"
"正常词条","女","江西","260488543","6","","10000","1","","开学收拾东西错过了前瞻，怎么又多了一个常驻[笑哭]，歪到卢姥爷小提的几率又小了一点[酸了]"
"夜之所愿","保密","四川","484729758","5","","10000","1","","世界遗忘我"
"Dio是我的小面包","保密","山东","1059253768","5","","10000","1","","我的主人凝光真好看[脱单doge]"
"小冷GV","男","河北","92545397","5","","10000","1","","活动复刻频繁，还不如让立本常驻[吃瓜]"
"Z","保密","江苏","389833783","5","春原庄的管理人小姐","10000","1","","我Z要歪了就跟你急[大哭]"
"犬山kora","保密","山东","94913819","6","","10000","1","","他甚至不愿意给夜兰联动立绘刘海下加点阴影"
"diver思凡","男","浙江","13744713","6","","10000","1","","不响玩辣！"
"Agt_von","保密","广东","471959467","5","","10000","1","","优啊 我的优啊啊啊[大哭]"
"初暮白泽","女","山东","401122749","5","","10000","1","","好耶！是新的社死之翼[保卫萝卜_哇]"
"-红尘来呀来去啊去-","男","安徽","302433593","6","","10000","1","","一章一个纠缠，太大方了呢[打call]"
"水煮鱼配胡桃","女","广东","1019240629","5","","10000","1","","[热]"
"遗憾才是青春","男","澳大利亚","42518578","5","","10000","1","","申鹤6+5，绫华0+1。不管来谁都是成女厨的狂喜[脱单doge]"
"佐_侑_为难","保密","广东","442115787","5","还有醒着的么","10000","1","","优？优在七圣召唤里！"
"不取名字了000","男","广东","470660175","5","","10000","1","","迪希雅真的常驻？啊？？"
"石万十","男","广东","343758536","5","","10000","1","","大保底已经50发了不敢抽米卡怎么办宝[小电视_哭泣][小电视_哭泣]"
"Sparklyomia","男","四川","50072451","6","","10000","1","","优有啥好抽的。。"
"周公不解梦meng","男","吉林","511142466","5","","10000","1","","[来古-注意]"
"阿莱斯特t","保密","山东","67013284","6","","10000","1","","这波我必须把头像改成尤拉了[脱单doge]"
"独走南山","男","广西","224548028","5","","10000","1","","好一个蒙德风花节，某位蒙德冰系物理大c甚至连汤都喝不着[热词系列_我故意的][热词系列_我故意的][热词系列_我故意的]"
"CHU-NI-BYO","保密","福建","14719249","6","","10000","1","","游戏是内鬼做的？米哈游背书了？"
"千翎mei","男","山东","292664750","5","","10000","1","","弹幕那些人是记错了还是故意的？人家叫咚咚小圆帽，不是崩[藏狐]"
"-红尘来呀来去啊去-","男","安徽","302433593","6","","10000","1","","优复不复刻不说了，为什么一个物理拐不跟优放一个池子里啊，岂可修"
"月下世界第一可爱","保密","河南","109235930","5","","10000","1","","这提纳里一外出不知何时能归来啊[委屈]"
"盐h星球a","保密","河南","691400933","5","异常生物","10000","1","","加强赛诺啊呜呜呜呜呜[大哭][大哭][大哭]单纯加点充能或者抗打断都行啊"
"启该什么时候眼瞎","男","湖南","497245118","5","","10000","1","","优阿贝多:接下来我要批判一款游戏"
"上班就犯困zZ","女","四川","506750588","5","#EveOneCat!","10000","1","11","谁说风花节没有蒙德五星的！这不还有琴和迪卢克在你们小保底里面嘛？[初音未来圣诞快乐_嘿嘿]嘿嘿开个玩笑，祝大家小保底不歪，都能抽到自己心仪的角色。（就算是歪也是歪你喜欢的角色[初音未来圣诞快乐_发射爱心][初音未来圣诞快乐_爱了]）"
"摸鱼了","男","山西","180336441","6","","10000","1","","把优删了？？？？？？？？？？？NND"
"不语安岚","男","重庆","1944823","6","","10000","1","","没有优化和改进。"
"捡贝壳的元谋人","男","安徽","35838735","6","","10000","1","","哈哈哈，哈哈，我的优，哈哈，我的优，有把迪西亚的大剑也不复刻你，哈哈[呆]"
"一弦青___","保密","江苏","694726637","5","洛天依9th生日纪念","10000","1","","还我优，四百多天不复刻过分了吧"
"magicQ娃","保密","湖北","527890","6","","10000","1","","[doge]我知道原神喜欢把特定的角色在某个时间才会复刻，风花节都不复刻还有哪个点？优快憋死了！"
"充实您de梦","保密","黑龙江","1285582077","5","","10000","1","","米卡放神里申鹤池，感觉所有人不会满意"
"HomoSapienornot","保密","英国","282040177","5","至尊戒","10000","1","","原宝，下次联动送风之翼的时候，想一想可怜的国际服罢[大哭][大哭][大哭]"
"绝色古城","女","北京","284517886","5","至尊戒","10000","1","","米哈游背刺了所有内鬼"
"大笨兔的小兔子","保密","江西","37196203","6","名侦探柯南","10000","1","","要是老米这次再给神里搞个PV那估计会很有意思了[doge]"
"bili_37281354839","保密","山东","525957963","5","","10000","1","","优不复刻难道枫丹有新的物理C，怕影响销量（以上内容都是我个人感觉）"
"乱斗小陈","男","重庆","2006223038","4","","10000","1","","STUFQHAYDSE6"
"老实憨厚的陈粒","男","上海","286640689","5","不思议之旅","10000","1","","尤拉呢》？？？？？"
"眼中星辰望众生","保密","广东","262956023","6","","10000","1","","39:55 这夜兰。。"
"历战王喵一","保密","广东","227298","6","","10000","1","","拆开米卡和优，真有你的,是故意的，还是不小心的？[热词系列_我故意的]"
"希望老板没事","男","江苏","1039682004","5","","10000","1","","所以说up神里与申鹤怎么不请N出来请马老师出来干嘛[思考]"
"Mosaic11","保密","福建","385877680","6","","10000","1","","优这么久不复刻真的好吗，本来以为优会跟着米卡一起的"
"期盼y久","保密","山东","397138632","5","全职高手","10000","1","12","不知道我的无工，迪希雅能不能用上啊[喜极而泣]"
"有问题吗-","保密","辽宁","602430107","5","","10000","1","","已经结束咧！！！阿贝多优无了[辣眼睛][辣眼睛][辣眼睛]"
"蹦米的小甜豆","女","北京","14005645","6","","10000","1","","为啥稻妻还没有角色进常驻，蒙德、璃月、须弥都有了"
"中奖绝缘体已上线","女","内蒙古","132751589","6","原神","10000","1","","不懂就问嗷，为什么会有人觉得迪希雅进常驻不好，获取方式多了不好吗？"
"喂喂喂_小饱","男","广东","9126024","6","","10000","1","","上半又可以攒攒原石了，下半先抽申鹤，绫华随缘了[脱单doge]"
"摄-芝@_","女","云南","11399959","6","","10000","1","","跳过键"
"寻找丢失パンツの乔治","男","湖南","32231572","6","2020拜年祭（鼠）","10000","1","","这个兰10界面[脱单doge]老米不正经"
"天天攒了很多硬币","保密","河北","8025002","6","","10000","1","","我本来百思不得其解这么快又有角色进常驻，后来想了想，可能是为了端水，蒙德姥爷和琴，璃月刻晴和七七，须弥提纳里和迪西雅，这就合理多了，莫娜是在蒙德搞实验并非土生蒙德人，或者有个枫丹身世也说不定[思考]最后，那么谁会进稻妻常驻呢？"
"TequilaDusk","保密","河北","1238597076","4","","10000","1","","hhhc"
"优快妇科","保密","广西","299374771","5","","10000","1","","米卡不跟优一起出，什么意思老米"
"归_帆","保密","宁夏","383125414","6","","10000","1","","内鬼无所谓，主要一个物理拐在冰c的池子了，下个版本或下下个版本再复刻优，这吃相牛的。雷神九条都可以在一个池子里，你卡米和优就不行？"
"百鸟四海为家","保密","辽宁","360672443","5","","10000","1","","兄弟盟不懂就问，必胜客那个联动点外卖也能获得兑换码嘛"
"艾恩","保密","河南","22974926","6","初音未来13周年","10000","1","","国服不是还有byd吗"
"可乐小黄鱼","女","上海","399249739","4","","10000","1","","谢谢你，mhy，我攒了大保底想抽迪希雅的，妙脆角都打完了，现在希望早点给我歪一个，申鹤我来了[脱单doge]"
"我是网络土皇帝","男","河南","344135954","5","游戏新星","10000","1","","谢谢你米哈游前瞻两抽出了若水"
"玄墨幽青","男","四川","9965799","6","","10000","1","","官方演示视频有甘雨，后台挂火终于稳了？"
"挽风抚回忆","男","安徽","400881229","5","","10000","1","","许愿申鹤不歪！我对申鹤一心一意[保佑]"
"白云月秋","保密","云南","312684359","5","","10000","1","","优是谁？还有前段时间你们问的大慈树王又是谁？怎么你们神经兮兮的？[大哭][大哭][大哭]"
"魈宝的旅行者Q","女","江苏","346200664","5","","10000","1","","联动！[微笑]"
"鳄鱼军","保密","山东","1631356520","4","","10000","1","","不是吧，又联动，这次在上学期间，还可能得限量可能没希望了"
"Z1FT尔","保密","江苏","454599407","4","","10000","1","","要不把优变成四星吧[疑惑]"
"Dushduck-","女","上海","85669834","6","","10000","1","","等优已经等的心碎了[大哭][大哭][大哭]"
"难不成测","保密","福建","284600183","5","","10000","1","","这个家没有小提可怎么办啊[doge]"
"彼岸花开为缘倾","保密","四川","14902340","6","","10000","1","","来了来了"
"耗子位置","保密","浙江","387508088","6","","10000","1","","要不优也做成绝版的算了吧，和埃洛伊一起"
"RNGBreathe","保密","湖北","209988600","6","","10000","1","","米卡是在下半吗？"
"纯爱战神怒杀牛头人","男","浙江","290251266","6","","10000","1","","这是致敬[调皮][调皮]"
"岸十绿","女","河北","288106443","5","","10000","1","","居然是宥希！天呢！"
"胯下有骏马","男","河北","177611578","6","星座系列：射手座","10000","1","","任务跳过。。。"
"绫仙一舞","保密","湖北","1725615330","3","","10000","1","","我动态里优圣遗物都准备好了，我的优啊[脱单doge]"
"Ender龙岚","男","浙江","27188241","5","","10000","1","","目前看到最“合理”的解释是，柯莱来蒙德见安柏了，所以优不能出场，策划真的，我哭死[tv_流汗]"
"喝水级萌新","男","河南","443210798","6","汉化日记","10000","1","","放心，优一天不复刻，我的原石一个子儿也不会出手"
"岩神传教士","男","河南","353048723","5","","10000","1","","9STUFQHAYDSE6"
"钚想当非酋","男","河北","1640075211","5","","10000","1","","BV13M411H7Hk"
"背影杀手受害者","保密","广东","25455637","6","","10000","1","","迪希亚进常驻池[脱单doge]"
"被莫名其妙拉黑好恶心","保密","重庆","693778066","4","","10000","1","","无所谓，我有优[初音未来圣诞快乐_嘿嘿]"
"嗯嗯你说得对但是","保密","浙江","173276275","5","","10000","1","","好好好，我先来，米哈游是自由的[吃瓜]"
"原神星铁代肝-哀吻","男","黑龙江","483177143","5","","10000","1","","迪希雅是我的，申鹤也是我的！"
"不守恒的天秤Qia","男","浙江","245860662","6","","10000","1","4","米哈游，你在复刻...，我测...[给心心]"
"爱吖","男","广东","171541306","5","","10000","1","5","不会优厨有人没有优吧[doge]"
"只想要有你的明天","保密","河南","393376811","5","","10000","1","","真的离谱啊UP绫华，现在都是按配队复刻吗？"
"柠檬の魂","保密","广东","107186615","5","碧蓝之海","10000","1","","太牛了，米哈游[疼][疼]"
"弗儿","保密","江苏","694632926","5","","10000","1","","轻扬哥怎么这么有梗啊哈哈哈哈哈哈哈哈哈哈哈哈哈"
"swv5","男","北京","482972170","5","绽放收藏集头像框","10000","1","","快出个剧情跳过功能吧，开个自动非得整几个选项然后选啥都是一样的剧情，那个自动能把选项跳过也行啊"
"记录生活的up主","保密","吉林","546390413","5","","10000","1","","FSCX9HBYDBFW"
"闷骚冬瓜干","男","四川","454726824","5","","10000","1","","[微笑]"
"bili_27173042721","保密","贵州","1004835388","3","","10000","1","","加强刻晴！"
"ETC高速公鹿","男","四川","70644724","6","","10000","1","","基列奴既视感...."
"D等玩家","男","安徽","646015342","5","","10000","1","","迪西亚的专武能歪出来吗[难过][难过][难过]"
"往生堂l胡桃","男","广东","85712966","5","崩坏3・天穹流星","10000","1","","[嗑瓜子]"
"第N个计数君","男","湖南","6592726","6","","10000","1","","什么兰斯10小游戏"
"-Mari--","女","陕西","2958224","6","快把我哥带走","10000","1","","迪希雅进常驻是哪个天才策划想出来的，之前稻妻怎么不搞常驻角色呢，一下子两个全放须弥来，正好省钱了，真行[热词系列_妙啊]"
"墨舞飞鹏","男","江苏","96782814","6","","10000","1","","又复刻绫华，看来没希望大家抽[吃瓜]"
"盖佬本佬","男","四川","167148365","6","少前小剧场","10000","1","","优呢[大哭]"
"学习一部经典","保密","河北","597738085","5","","10000","1","","爷的尤拉呢！！！谁叫你这么快复刻绫华的？爷要攒二命呢啊！"
"打西边出来的太阳","保密","湖南","450727854","5","","10000","1","","必胜客夜兰立绘是在致敬微信转账三百块的梗吗[]"
"MKliver","保密","浙江","346563190","5","","10000","1","","这波啊，这波是来自老米的正义背刺[doge]"
"小德玛","保密","内蒙古","299672472","5","","10000","1","","有人看这个日服的那个兑换码吗？看看前四个字母，虽然说我也是个8U，但是我也没绷住"
"霜华满天c","保密","广东","501533896","5","","10000","1","","为什么不按照内鬼说的来复刻，为什么？[疼][疼][疼]"
"大海中的落尘","女","江西","639569755","5","","10000","1","","[脱单doge]"
"Vickles","男","广西","175381252","6","刺客伍六七","10000","1","","没人骂我是不认可的"
"8569900","保密","山东","1947928561","4","","10000","1","","什么时候开三卡池？"
"穗织の剑圣","男","吉林","1305210157","5","","10000","1","","原石给的不够多，再多给点"
"dddd木林森","保密","福建","383400851","5","","10000","1","","风花节不复刻蒙德角色，优都要一年半没复刻了，凭什么"
"习惯就好114514","保密","广西","694200586","5","","10000","1","","[doge][doge]"
"赛博夜叉诺面","男","广西","21579619","6","原神","10000","1","","这卡池有点意思，风花节相当于海灯节复刻不是璃月五星角色那么奇怪[笑哭]"
"桃桃快到怀里来","保密","河南","544144577","4","","10000","1","","呼呼呼/热乎的@[脱单doge]"
"和温迪守护蒙德一辈子","女","四川","397872748","5","","10000","1","","现在已经囤了115抽了，温迪可能2.8复刻，还能再囤三个版本，应该能囤个两三百抽，温迪等我给你补命座[保卫萝卜_哇]"
"冰雪铸城此志","保密","上海","1734093439","5","","10000","1","","优要是还不复刻，你要么把优放进常驻，要么全服玩家送优[微笑]"
"暮色-teayai","保密","广东","1774331990","5","","10000","1","","我只想说，米哈游……你是自由的"
"ro66fu","保密","四川","34361143","5","","10000","1","","CRAZYTHUVIVO50"
"见到我麻烦让我去学习","保密","江苏","65244233","6","","10000","1","","60级至今没有常驻火系，我现在很慌[无语]"
"羽叶金合欢丶","男","吉林","8598126","6","","10000","1","","上半塞个久岐忍，下半凌华申鹤，3.6上半白术，下半草神复刻。加上现在的胡桃叶兰。直接拉满，听说有人压岁钱和年终奖还没花完[脱单doge]"
"全自动轩辕十四星","男","陕西","1554301502","5","","10000","1","","大板砖不进常住啊 不"
"MSR_霖川","保密","江苏","506400714","4","","10000","1","","带着我的寿命走遍破站[吃瓜]"
"斤古记","保密","河北","177634427","4","","10000","1","","过啥风花节，过温泉节去吧[笑]"
"ZB北漾","保密","辽宁","1361809506","4","地中海","10000","1","","蒙德是自由的城邦，但是似乎自由过头了[tv_目瞪口呆]"
"雀竹竹","女","广西","11321356","6","","10000","1","","赛诺！！！！！！我来了！！！！！！"
"hydzzzzzz","男","浙江","341675388","5","炎炎消防队","10000","1","","优呢"
"回应我吧_爱莉希雅","保密","安徽","438863488","6","中国绊爱2nd纪念","10000","1","","你要是池子不够就再加一个。"
"西伯利亚而来的西北风","保密","四川","694278536","5","","10000","1","","又是个诸武精通，米卡不是冰法，悲[无语]"
"咸_生","男","河南","1352388455","3","","10000","1","","5TVFRHSZCBEJ"
"笑颜三千_","保密","江苏","251366667","6","风灵玉秀收藏集","10000","1","","大佬们，申鹤值得抽吗，有神里和万叶还没心海，抽了申鹤提升咋样，后面补心海，3.4抽完胡桃夜兰1+1现在还有100多抽，不知道草神什么时候复刻，想抽草神2命所以说是抽申鹤还是等2命草神好点，现在0命草神"
"阿斯加隆酱","保密","湖南","546831898","4","","10000","1","","5TVFRHSZCBEJ"
"爆料酱","保密","福建","525298385","5","","10000","1","","来了"
"想被砌进雷神像里","保密","辽宁","1335181690","5","","10000","1","","不懂就问，优是吸毒了吗"
"设计老白","男","天津","34874342","5","","10000","1","","米哈游你是懂自由的"
"c晨最z","男","上海","383588228","6","","10000","1","","所以迪希雅为什么要进常驻呢，我不理解，那我是不是可以理解为以后每一位UP角色都可以因为一句话随意的进入常驻卡池呢？"
"四三二508","保密","江苏","3461564313110554","4","","10000","1","","想复刻的又没复刻，这3.5，不抽也罢[脱单doge]"
"想吃大又","男","黑龙江","346941367","5","大会员5周年","10000","1","","米哈游是自由的，空降绫华申鹤，迪希雅上常住"
"bili_355925075","保密","山东","355925075","5","","10000","1","","阿贝多：我要点名批评一款游戏,优：世界，遗忘我"
"又是无所事事的一天呢","男","北京","22345711","5","","10000","1","","破案了，不复刻优是因为复刻了莺儿（考[doge]"
"志士瑞宝","保密","辽宁","384707488","5","","10000","1","","好好好，我们优又要刷新记录了"
"神梦一刀T_T","保密","广东","107748751","5","","10000","1","","你倒是给我蒙德五星啊啊啊啊啊啊啊"
"不屈飞鱼明武宗朱厚照","男","广东","13843103","5","","10000","1","","同时作为绫华真爱党和优真爱党，这卡池让我一时不知是悲还是喜（恼）"
"艾饺奥迪托雷","保密","江苏","392152264","6","格兰芬多","10000","1","6","又是风花节？我温泉节呢[生气]"
"-梦幻行星-","保密","广东","475260463","4","","10000","1","","这是在一步步揭露坎瑞亚战争的真相，从之前的主线中得知天理并不是为了覆灭坎瑞亚，而是去镇压灾难。再加上纪行中的那一段过场动画说的，所以说更加肯定在渊上这里肯定会有一把大刀。"
"aslanieIce","保密","湖南","454978727","5","","10000","1","","优不会要冲击五百天吧????"
"夜\风高","男","湖北","5020817","6","","10000","1","","白天还在冲不复刻申鹤，现在复刻申鹤了又在冲优，说实话复刻申鹤加优的话更抽象吧，冰拐加上物理c[微笑]"
"枫原万耶儿","男","浙江","37795656","5","","10000","1","","下半卡池29：30"
"自在如风のboy","保密","浙江","14173582","5","","10000","1","","感觉最值得关注的就是必胜客联动有风之翼[OK]"
"脆脆的黄瓜","男","广东","19954684","6","","10000","1","","官方不复刻，快让内鬼想想办法呀，不是说这是内鬼做的游戏吗？[崩坏3_？]"
"祝我们好运OwO","保密","江西","225527465","6","","10000","1","10","没有特意去回看其他角色传说任务的介绍，迪希雅的传说任务中的“第一幕”是少见的吗，还会有可能的后续吗"
"RT波士顿沈维维","男","江苏","358774291","5","","10000","1","","米卡拐申鹤很合理的，申鹤打物攻，吃攻速[吃瓜]"
"你怎懂","保密","福建","293601864","5","","10000","1","7","福利这么好，看来对星穹铁道非常有自信啊"
"铁杆流浪派","保密","广东","16136614","5","","10000","1","","其实吧尤拉晚点复刻也还好又不是等不了那十几天但是把米卡和尤拉池子分开才是让我比较难受的一点[笑哭]"
"你的huang上","男","天津","353886764","5","百妖谱第二季","10000","1","","[原神_G嘿][原神_G嘿][原神_G嘿]"
"埃剖","保密","吉林","1803989629","5","","10000","1","","[原神_嗯][原神_嗯][原神_嗯][原神_嗯]"
"资深御宅か","保密","浙江","454832481","5","","10000","1","","不复刻就尽量攒满命，只要不是完全不复刻就行"
"-浅W唱","保密","北京","394023567","5","碧蓝航线","10000","1","","这个仇我记下了[阴险]"
"艾吖法拉","女","北京","356399230","5","","10000","1","","只要心态好 申鹤雾切都别跑!!!我好喜欢申鹤呀!申鹤!我要去抽申鹤啦!!哈哈!啊!我好喜欢雾切呀!雾切!我要去抽雾切啦!!哈哈!啊!心态好!!心态好就行啦!!哈哈哈!!一起来!真爽啊!!一起来!来!!哈哈!!好呀!!只要心态好 申鹤雾切都别跑!!!!!都别跑!!哈哈!!啊哈哈,其实也没啥事，不就是一起来吗，不就是没原石吗，人活着哪有不疯的时候，不疯的人还活着吗。人又不是葱姜蒜西瓜茄子萝卜芒果猕猴桃。可能我是猴子呢！我是猴子！哈！嘿！吼！哈哈哈哈哈哈哈哈哈哈哈哈哈我是猴子（变成猿猴）（抢夺路人的香蕉）（飞入丛林）（在藤蔓中荡来荡去）（在藤蔓中荡来荡去）（在藤蔓中荡来荡去）（在藤蔓中荡来荡去）（高声吼叫）（高声吼叫）（在藤蔓中荡来荡去）（高声吼叫）（在藤蔓中荡来荡去）（高声吼叫）（在藤蔓中荡来荡去）,变成猴子!扇所有人一个大比兜!荡来荡去!抢走游客的钱包!变成猴子!扇所有人一个大比兜!荡来荡去!抢走游客的钱包!变成猴子！扇所有人一个大比兜！荡来荡去!抢走游客的钱包!变成猴子!扇所有人一个大比兜！荡来荡去!抢走游客的钱包！（怒吼）（变成猴子）（飞进原始森林）（荡树藤）（创飞路过吃香蕉的猴子）（怒吼）（变成猴子）（飞进原始森林）（荡树藤）（创飞路过吃香蕉的猴子）,omgomg妈呀妈呀好崩溃好崩溃~omgomg妈呀妈呀好崩溃好崩溃~omgomgomg妈呀妈呀好崩溃好崩溃~omgomg妈呀妈呀好崩溃好崩溃~omg"
"yousa家的思雨","保密","广东","30767777","6","泠鸢yousa登门喜鹊","10000","1","10","之前那么多优厨不是说米卡没用吗，不是说不想要米卡嘛，不是说这角色不如不出嘛，现在好了进别的池子了多好呀"
"漩涡之遗妻跋掣","保密","广东","603750351","5","至尊戒","10000","1","","[doge]"
"最高贵的HE","保密","湖北","1786597724","5","","10000","1","","无所谓，为了米卡，我会抽池子"
"是你的羽淳呀","保密","江西","426258563","5","","10000","1","","阿贝多出现在了前瞻，但是没有复刻，这又何尝不是一种ntr呢"
"-骐骥","男","广东","314878890","5","实验品家庭","10000","1","","[无语][无语][无语][无语][无语]"
"shuaiBxiaosaonian","男","山东","32810481","6","","10000","1","","垫了45发收手了，给绫华老婆攒石头[星星眼]"
"三氧化五谷杂粮","保密","湖南","604194427","5","","10000","1","","赶紧憋一两句骚话,算了，憋不出来，我想玩新版本"
"一介草鸡","男","上海","475464157","4","","10000","1","","好耶！"
"时空穿越者风","保密","福建","615571313","5","","10000","1","","来喽！"
"一缕青丝6556","保密","浙江","274962384","5","","10000","1","","优去哪里了？是不是没有这个角色？"
"忏悔着的人","男","江苏","435923344","5","","10000","1","","谁有这次直播壁纸无水印版本吗"
"S呀S","保密","广东","277977547","5","","10000","1","","什么时候复刻优[微笑][微笑][微笑][微笑][微笑][微笑][微笑]"
"请叫我大牧神","保密","上海","97474937","6","","10000","1","","送我五星"
"chinchillabutt","男","北京","10277555","6","","10000","1","","神里凌华还值得抽么？当年不懂啥叫专拐，纯凭XP抽了申鹤。"
"我不相信还能重名","女","重庆","3493085151496214","4","","10000","1","","呜呜，石头不够！"
"ZY朝影","男","广东","362851881","5","","10000","1","","嘿嘿，迪希雅嘿嘿"
"钰yu---","女","山东","15020917","5","","10000","1","","为什么我今天80抽歪了小提我要夜兰[大哭][大哭][大哭][大哭][大哭][大哭][大哭][大哭][大哭][大哭][大哭][大哭][大哭][大哭][大哭]"
"娃哈h哈","保密","安徽","349624677","5","","10000","1","","请问兑换码是不是有冒险等级限制？"
"秋飞宇","男","湖南","491157925","4","","10000","1","","[脱单doge][脱单doge][脱单doge]"
"我要回家-_-","保密","广东","652584006","4","","10000","1","","刚刚"
"淡七小咸鱼","男","江苏","661857710","5","碧蓝航线","10000","1","","经典一边度节，一边渡劫[doge][doge][doge]"
"旨窘阡в","男","云南","507391364","3","","10000","1","","《蒙德节日版本没有UP蒙德角色》[妙啊]"
"新手任务开始啦","男","重庆","14340474","6","","10000","1","10","好好好，这次抽了一命夜兰本来就没粉球了，下版本又可以攒原石了，好耶！"
