"昵称","性别","IP","UID","等级","装扮","用户权重","获赞数","粉丝团等级","评论"
"YYSAAAAAA","保密","浙江","41383646","6","","10000","14739","11","荣誉骑士哥哥姐姐，可莉为你导航：,00:01 柯莱赛诺小剧场,02:30 3.5风花的呼吸版本PV,04:47 赛诺柯莱迪希雅阿贝多CV版本介绍,08:47 迪希雅介绍（中配：陈雨 日配：福原绫香）传说任务蝎尾鬃狮之章,13:45 角色祈愿第一期：迪希雅(3.6进常驻）、赛诺 ,14:00 新武器五星大剑苇海信标,15:10 法露珊邀约任务,16:22 版本活动：振晶的复核实验、灵蕈棋阵,22:51 魔神任务：卡利贝尔,23:40 新原魔：冰深渊使徒、黑蛇骑士,24:48 版本活动：地脉移涌,25:14 谁来把可莉放出去o(ini)o,25:52 米卡介绍（中配：邓宥希 日配：三瓶由布子）,29:28 角色祈愿第二期 ：神里绫华、申鹤、米卡,30:05 七圣召唤限时热斗模式（新增珊瑚宫心海、优、九条裟罗角色卡等）,30:55 版本活动：有香自西来,33:05 版本活动：风花节（送四星双手剑饰铁之花）（音游）,38:00 联动活动：必胜客（夜兰、凝光、烹饪、翅膀）,40:50 新增魔神任务奖励（每章一个纠缠之缘加其他、截止3.5共21章）,兑换码:FSCX9HBYDBFW、5TVFRHSZCBEJ、STUFQHAYDSE6"
"阿段JDuan","保密","德国","15704","6","崩坏3・天穹流星","10000","1491","","我觉得，角色越出越多，上下俩池子可能会不够。,我提个方案：分地区池子，即每个版本在蒙德复刻一个角色、稻妻一个、须弥一个，以此类推，玩家只需要做完该地区的主线第二幕后就可以抽该地区up池。这样只需要继续出新角色就可以了[吃瓜],这样即使是新入坑的小伙伴也能对自己喜欢的角色有了盼头，也能加速up角色轮换。"
"婆_T狂小菲","保密","湖南","168705505","6","七濑胡桃","10000","1250","2","迪希雅传说 ,上半：赛诺迪希雅，迪希雅常驻 ,下半：申鹤神里，米卡（四星） ,振晶的复核研究，420 ,灵蕈棋阵：机关奇谭＋蕈兽，420，(蕈兽当棋子干架) ,魔神任务：卡利贝尔 (人的名字 ,新怪：冰使徒，岩黑蛇 ,地脉移涌，没原石 ,米卡，四星物伤拐，武器是枪弩互换，开e切弩给攻速，q给生命 ,七圣召唤热斗：第一回合-骰子 ,迪希雅传说任务 ,珐露珊邀约 ,振晶的复核研究，420 ,灵蕈棋阵：机关奇谭＋蕈兽，420，(蕈兽当棋子干架) ,魔神任务：卡利贝尔 (人的名字） ,补充任务奖励：22纠缠 ,新怪：冰使徒，岩黑蛇 ,地脉移涌，没原石 ,米卡，四星物伤拐，武器是枪弩互换，开e切弩给攻速，q给生命 ,七圣召唤热斗：第一回合-骰子"
"各路子快点好","男","辽宁","8353517","6","三周年恋曲","10000","19508","","我曾三度遭到背叛,其一为火系,其二为大剑,其三为姓迪[酸了]"
"决斗老湿","保密","山东","281329182","6","良辰美景・不问天","10000","1200","","赛诺原来来自天津啊哈哈哈,话说使用来自京津的配音员蛮不多见的，好像一般都是用上海地区的配音员。"
"翠竹青松SQ","男","吉林","1701633387","5","","10000","3874","","所以……没人对新魔神任务好奇吗？我感觉大的要来了！"
"雨歇未歇","女","湖北","551270610","5","","10000","5582","","大娃:卢姥爷,二娃:迪希雅,三娃:琴团长,四娃:提纳里,五娃:莫娜,六娃:七七,七娃:刻晴,常驻七葫，合体！葫芦小金刚！,任何抽卡，终将绳之以法！[妙啊][妙啊]"
"--淼--","保密","云南","354380665","5","斯莱特林","10000","5872","","妮露：儿童船桨,赛诺：标准船桨,迪希雅：巨型船桨"
"我人也麻了","保密","湖南","1654841368","4","","10000","2282","","优距进已有430天未复刻，也即将成为目前史上最久未复刻的角色，望周知[doge]"
"天レ依ム","男","江苏","245094018","6","洛天依9th生日纪念","10000","735","","你好，本人观看了3.5前瞻直播，得知3.5优并不会复刻，在此提出自己的几点观点。首先，优是距上次up时间间隔最长的一位角色，怎么说也该轮到她复刻了吧；其次 ，新角色米卡作为游击小队的队员、优的辅助，两者为什么不一起up；再次风花节作为蒙德的节日没有一个蒙德角色复刻，我实在是不明白为什么这样安排卡池。另外，自2022年12月28日起，优的长E伤害判定较以往有明显的延迟，导致优元素爆发的伤害叠层出现吞层问题，极大地影响了玩家的游戏体验，希望官方尽快处理。"
"沈eating","男","美国","7342434","6","原神","10000","117","","我不是优厨，以前这种节奏我一直站官方骂内鬼，但我认为这次确实该骂。首先这次的节奏和内鬼没关系，即使内鬼确实该死。因为直到前瞻直播之前，内鬼自己的消息都不统一，而以往信了内鬼去冲官方的，都是在官宣前某一内鬼消息的真实性得到了公认，所以他们才深信不疑，这次根本不存在这样的统一意见。这次冲官方的，反而不是看内鬼的，而是人家数着复刻时间等优的，复刻时间公开可查不需要内鬼告诉他们。你可以说米哈游是自由的，但这种自由并不是无限度的，否则它每个池子都up同一个角色别的全雪藏也不该受到指责，这合理吗？不要忘了接受双卡池的前提是，官方给出了承诺双卡池是为了加快角色循环的速度，而玩家其实并没有要求一定严格按照复刻时间表安排卡池，官方为了剧情安排为了流水调整顺序玩家一直是容忍的，但底线是至少要有合理的解释比如剧情需要，以及大体遵循复刻时间表，玩家的容忍就是基于官方会遵守底线的信任，如果完全抛开时间表那双卡池加快循环就成了彻头彻尾的笑话。优都四百多天没复刻了，时间远超神鹤，而且3.5又是蒙德版本剧情上也比神鹤更合适，有什么理由不复刻优呢？这次节奏的本质是官方自己在破坏玩家的信任！别的角色需要等一年半吗？我换位思考下我觉得对人家优厨很不公平，人家的诉求是很合理的。这次池子对我有利因为我在等雾切，但我愿意再等一个版本也要帮优厨说句话，无他，没法对明晃晃的不公平视而不见。"
"Rachel-Furina","保密","湖南","351561354","5","","10000","132","","浅析为何原神3.4版本会让人觉得不那么好玩我想，之所以3.4版本被认为太无趣的原因是，玩家对剧情的发展并不关心。也就是缺乏自主性。,,究其原因，玩家在做任务的过程中是被npc给牵着走的，去找一样东西，去进行一场战斗。推动剧情的效果很有限，但是完成剧情的大部分时间都是在做这种事情，让人觉得很臃肿。,,我认为增加奖励其实并没有多少效果，因为加一点点原石其实无济于事。我认为完全可以换一种方式去做支线任务。,,比如用支线任务来补全卡池中角色的日常。因为角色很多，关于每个角色的剧情其实不多，在传说任务之外，完全可以利用支线任务来补全设定，而且玩家也会更感兴趣，不是吗？并且不一定要想一段很深刻的剧情，就用支线任务去了解一下可莉怎么炸鱼，海哥怎么摸鱼，或者钟离如何喝茶看戏，写起来也不难，但是也很吸引人。,,比如让主角主动去进行一些活动。比如走在路上突然发现一个新奇的物种，派蒙很想尝尝它的味道，主角和派蒙一起去找材料烹饪。或者看到前面的人群熙熙攘攘，决定去凑个热闹，发现他们要去树海一日游，主角决定一同前往。,为什么会有这种想法呢？因为荧在剧情中完全是一个工具人，完全没法有代入感。如果能用支线任务表现出荧自己的意愿，表现出荧的日常。荧的形象才能真正的鲜活起来。才知道为什么派蒙是最好的伙伴。,这个世界或许很精美，可是无论是哪里都没有留下一点痕迹。实在无法让人感到留恋。"
"破影含杀","保密","山东","302227760","5","","10000","818","","打住哈，带节奏的肯定是有的，但是我们优厨是沉默，不是死了[捂脸],430天不复刻，然后出了一个物理辅助，还是冰系，还是对应地区的节日，结果就像诸葛亮借东风，东风都来了，结果周瑜喝酒去了，谁知道下一次东风是什么时间呢[捂脸],很直接的说，这次就好像是海灯节，给你出了火系，还是火辅助，然后胡桃430天不复刻，再怎么想也是胡桃的是一个道理吧[捂脸],别杠，第一次深渊满星就是优打的，大保底都给优留好了，一直想给优补命座，每期深渊都是用优打满的，我好难受啊[捂脸],实在不行你让优替迪希雅进常驻也行啊[捂脸]你们真就是劳伦斯家族呗？[捂脸]这个世界很大，大到可以容下广阔星海天地万象，这个世界又很小，小到容不下这样一颗坚强而又孤独的心[大哭]"
"火堆外的夜夜","男","浙江","434997417","5","","10000","77","4","既然都出了法前辈的邀约，那莱伊拉坎蒂丝什么的也有的在做了吧,（求求莱宝邀约啊"
"-庄颜","保密","福建","75622824","6","","10000","658","","我一直以为常驻现在有六元素了，还差一个岩，我寻思老米以后抬岩的时候会出一个新五星岩进常驻，没想到又放了一个火进去"
"记性差点儿","男","上海","100000827","5","","10000","61","","手机端存在严重bug，大招动画结束后方向键会自动隐藏，需要切换到其他界面再回到游戏才会重新显示。大多数2星角色大招动画比较长，我账号里的5星都会出现。鸿蒙3.0.0可百分百复现，鸿蒙之前的几个系统版本也是一样会出现，在平板上面也有这个问题。,大家看到后，麻烦帮我往上顶一下。,在游戏的反馈功能里反馈好几次了，每次都是ai自动给我回复，然后自动关闭问题了。每次我提交完问题的截图和我手机的系统信息系统就自动把问题给结束了，半年了都没改。"
"saber可以吃吗","男","广西","14626506","6","","10000","65","","多少天复刻都无所谓，所谓再拖个600天，700天再复刻优也只不过是玩笑话，强度跟不上，人气低，流水低也无所谓。总会有一些真正喜爱的人默默等待。,,晚复刻不可怕，可怕的是，当真正她复刻时，没有相关活动剧情，没有新的皮肤，没有新的对话，复刻也仅仅只是单纯的卡池复刻，你除了阔别许久的把她从卡池里接出来，能用辛辛苦苦攒原石抽出优出来时，而你跟优的活动剧情里的对话还仅仅停留在遥远版本中某个活动里她简短的走个场露个面你与她简短的几句交流。,,不仅适用于优，也适用于其他许久未复刻，而在活动剧情中也迟迟没有更新露面的游戏角色。当一个游戏角色很久没有出现在大众视野里，没有在活动中露面，人们开始逐渐淡忘，甚至看到这个角色还要花上几秒钟思考这个角色的时候。,,这，才叫真正的遗忘。"
"依云无云依","男","河北","321537928","5","","10000","301","","首先，一个角色四百多天不复刻，确实是有点问题,你绫华申鹤好久没复刻，复刻没得说,你迪西亚是新角色，出了可以,你赛诺说实话，不算久（但是是新体系卡牌没得说）,优厨等而又等，等的确实失望,其次，一个物理拐，第一次up在冰系池子里，确实不合理（你想想五郎，九条，法路珊）,最后也没啥，就是内鬼爆料不一定准确,实在不行把3up开了吧，加快复刻速度，毕竟有一个蓝色的几抽女孩愣是不复刻"
"若言-初心","男","福建","356614342","6","","10000","472","","其实优有没有up什么的我倒不是很关心，因为没有官宣过。关键是阿贝多没up啊！这说明什么，以后根据前瞻直播中出现的角色来判断谁up了也不准了[酸了]"
"景元将军出门牵我","女","上海","36892601","6","地中海","10000","484","","凯亚拍拍戴因的肩：“兄弟 咱俩的声音好像有点像哈[吃瓜]”"
"bokyemi","男","黑龙江","35661128","6","","10000","9860","","我觉得哪怕真的不厨优的，但是一路各个版本玩下来也都应该感觉的到优太久没复刻了，风花节咋也该给优个场子了，buff叠满不复刻如果只为了单纯的打击内鬼，那角色厨又招谁惹谁了被扣个内鬼厨的帽子。"
"Flora--_--","女","山东","266652127","6","","10000","964","","mhy:迪希雅是常驻,迪卢克：6,mhy：复刻神里申鹤,优：6,不愧是蒙德版本，真的自由[tv_目瞪口呆]"
"橘-","保密","广东","642282473","5","原神","10000","1389","","我是真的蚌埠住，优厨究竟招谁惹谁了？,强度方面：,厨的角色是深渊地板，我们优厨自己慢慢凹，按角度削韧，背板搓招，就是想让优还能出现在深渊使用率排行榜上。,剧情方面：唯一空降还只带着一个设计的和可以和心海传说任务相提并论的浪沫之章的角色，后面复刻剧情仿佛是给阿贝多传说任务第二章当配角。后面足足430天，优总共的台词不超过10句，甚至这平均一天都无法生产出优一个字的文案。稍微看看这究竟合不合理？,现在低命座优已经完全无法在深渊保持基本使用率了，想着看看有没有新的配队，深渊全是物抗怪，钟离有抗打断有减抗，我抽！雷神可以辅助优持续超导增加大招伤害辅助大招充能，我抽！有up说夜兰可以与优雷神配队达到不错的效果，我也抽。米卡据说是个物理专拐，我明白着说我不喜欢米卡，但是我也做好了抽的准备。当米卡技能石锤，我很高兴，风花节，物理辅，与一名目前430天没有复刻的角色。似乎已经明晰了有可以继续让优鏖战深渊的可能。我厨的那名角色可以从两个大版本的仓库中走出来。但是最后告诉我是与版本活动丝毫不相干的申鹤与神里绫华？！,优厨老实本分，除了那次尚不知原因的大招叠层机制暗改，让本身已经足够复杂的优大招叠层手法变得更加苛刻之外（基本上断绝了低命座优常规阵容通关深渊的可能），优厨带过什么节奏？然后在这次的败兴而归中，还要被人莫名冠以内鬼厨的莫名帽子。,内鬼爆出八骏图九骏图，肆无忌惮贴脸爆料的时候，你们这些理智的“不会佩戴虚空”的人在哪里？,从客观的角度，一名角色出现长达430天（实际上将是480天）的复刻空窗本身就已经是个问题。米哈游曾经也是青涩的，热爱二次元的大佬们开创的公司，想必米哈游的策划文案们也是知道一名角色对于角色厨的意义。在曲生酌微梦的剧情里，优走入酒馆，我当时甚至不敢完成优的调酒任务，把优的任务留到了最后一天，让她一直坐在酒馆里。或许在以后的某一天，剧情或活动的视角再次回转到蒙德，能否在稍微给优一个露面的机会？"
"会瞬移的小面包","男","辽宁","549315149","5","","10000","661","","国际服第三个兑换码不是很友善啊哈哈哈哈哈哈哈哈哈哈哈哈哈哈哈哈"
"赤开团时","男","山西","498868656","5","原神","10000","335","","优不愧是大数字女王，复刻时间都是凹最大的数字"
"北斗慈航","保密","吉林","24254159","6","","10000","971","","心疼这位[OK]"
"凉城不是良辰","男","广东","114985742","6","三周年恋曲","10000","473","","不理解，为啥要骂优厨是内鬼厨，复刻间隔时间最长加上物理拐没在同一个池子这次不复刻想抽优的人生气不是应该的吗。。[原神_嗯][原神_嗯]"
"丝灬","男","北京","357165929","5","","10000","220","","下次建议人物专武不一起，这样捞钱更快"
"优不复刻不改","保密","广东","1583584637","4","","10000","426","5","优今天退出了骑士团  离开了蒙德城  来到了至冬国 加入了愚人众 戴上了嗤笑之面 为了推翻旧世界 成为了女皇陛下忠实的仆人 [无语][无语][无语][无语][无语]"
"别梦扰雪幽","保密","北京","498870114","5","","10000","153","","我不理解。蒙德的节日，复刻璃月和稻妻的角色，物理拐米卡不复刻物理角色，优430天还是488天了，老米，你知道上一个绝版的角色是谁吗？那个叫埃洛伊的女的，你是想让优成第二个吗？从3.0就开始有人说复刻优，3.5了，天时地利人和，蒙德的节日，给其他三国的角色都复刻了一遍。真是mhy是自由的（160抽2w2原石3个648就等优，绝了）"
"靓之桃","男","河南","1224520780","5","不思议之旅","10000","152","","你的兑换码是故意的还是不小心的"
"响流_","女","广东","97038050","5","","10000","115","","我要是优厨肯定破防严重"
"熬夜晚比","女","安徽","19446262","6","新月冰冰","10000","210","","800来天的游戏，400多天不复刻[支持]"
"清清清k","保密","河南","1639865540","4","公主连结凯露","10000","96","","首先，我朋友尤拉厨,然后，我朋友哭半时,下来，我安慰不到位,最后，老婆进常驻池[辣眼睛]"
"南宫黑言","保密","吉林","1053924361","4","","10000","812","","核爆凹大数字,深渊队凹深渊,大世界队凹体验,优不一样，她凹复刻时间[辣眼睛][辣眼睛][辣眼睛]"
"Miyukisuki","男","吉林","1568882","6","","10000","106","","前有宵宫2版本光速复刻，后有优雪藏400天，米哈游就是这么对待商业价值不高的角色的[大笑]"
"老爹魔法屋","保密","云南","351406222","5","茶啊二中","10000","205","","《配合版本内容》"
"是我nobu哒","男","北京","381797312","5","","10000","84","","再等等我也不是等不起，但《431+10+42+……》《辅c分售》《剧情少》《机制差，圣遗物毒》《拐不适配》《没环境，使用率低》《蒙德节日+物理辅助+最长时间未复刻+七圣召唤c位+辅助演示+手办 buff叠满不复刻》《为喜爱的角色发声立刻有一堆堵嘴的》"
"稻妻幕府赘婿","保密","山东","175423311","5","汉化日记","10000","98","","请问下，优不超模吧？甚至都不那么顶吧？我已经有优了哈，并不想追命座。我就是纳闷，为什么出凌华衣服的时候不复刻凌华，蒙德过节日却一个蒙德角色都没有呢？而且九条跟着雷神，珐露珊跟着散兵，为啥米卡不跟着优呢？只是请问下为什么，没别的意思。"
"啊温温阿温","男","吉林","43414180","6","斗破苍穹","10000","95","","感觉这次前瞻是提前降低版本热度的，风花节终究是与985们无关啊，玩家过玩家的节日，985们只考虑怎么卖角色。他们好像真的不在意风花节在老玩家们眼里的重要性，四个角色没一个蒙德角色笑死。活动与角色脱节，以后直接发原石吧，别弄那么长的活动了，玩够了"
"网名不取也罢","保密","黑龙江","1238950076","5","","10000","976","","你把内鬼背刺了，爷很高兴[tv_点赞],但是你顺手把优也刺了，爷不喜欢[tv_思考]"
"是葫芦瓜呀","保密","上海","1432489","6","明日方舟音律系列","10000","83","","莫名其妙的决定，本来迪希雅要满命的，你说现在卡池我怎么处理？进了常驻对于我这种就意味着歪满命的存在，根本不可能在你up的时候抽的。也不可能像弹幕说的，补命座，因为真的抽命座就是抽满的，难道之后等歪吗？而且你常驻配系列专武？真搞不懂你们在干嘛…这么好一个人设，铺垫那么久…"
"一只有思想的Requiem","保密","江苏","419813589","5","","10000","522","","你现在这么照顾常驻池，为什么不把常驻定规安排上[doge]"
"灰白的夜空6","保密","上海","35789963","5","冬季","10000","133","","米卡辅助空气优，风花节没蒙德复刻。,惊迪希雅空降常驻，笑旅行者不懂原神。"
"hakuya天真","男","四川","1225339615","4","","10000","1485","","优呢[doge][doge],这次卡池是故意的还是不小心的？[doge][doge]"
"某菜园的白菜","男","天津","396085012","5","","10000","63","","BV1ZT4y197ko,自己听听16:50,不是优厨不讲理，少给ch找补"
"林夕凝晴雨","保密","山东","50701598","6","崩坏3・天穹流星","10000","120","7","本优厨看到整活热评根本笑不出来（叠甲本人有优，第一次up就抽了，只是想补命座和抽专武）"
"~","保密","辽宁","478884955","5","","10000","3204","","虽然不是优厨，但430天不复刻属实有点过了，3.5结束之后480天，3.6再不复刻的话就500天了，这合理吗"
"寒Sae","男","天津","85290811","5","","10000","61","","不是，我还是不能理解，蒙德的版本，蒙德的节日，物理系拐，你凭什么可以不复刻优？？？？"
"暗中观察黑暗力量协会","女","广西","22588068","6","星座系列：金牛座","10000","646","","常驻可以定轨吗[微笑][微笑][微笑][微笑][微笑]"
"可爱丶小熊宝宝","男","湖北","395732525","5","","10000","60","","有没有看国际服的，这个是不是真的啊，哈哈哈哈哈哈哈[吃瓜]"
"奔向梦想的彼岸","保密","江苏","410718607","5","赏樱大会欧皇","10000","60","","3.5拿下！"
"野夕","女","黑龙江","453348796","5","","10000","166","","好离谱啊，一年多没复刻，又是风花节又是新物理拐，我真不是优厨也有优但这也太离谱了吧，厨子真的好惨，哪怕没有内鬼爆料光上面说的这些因素，这都不复刻也太离谱了吧"
"破影含杀","保密","山东","302227760","5","","10000","818","","打住哈，带节奏的肯定是有的，但是我们优厨是沉默，不是死了[捂脸],430天不复刻，然后出了一个物理辅助，还是冰系，还是对应地区的节日，结果就像诸葛亮借东风，东风都来了，结果周瑜喝酒去了，谁知道下一次东风是什么时间呢[捂脸],很直接的说，这次就好像是海灯节，给你出了火系，还是火辅助，然后胡桃430天不复刻，再怎么想也是胡桃的是一个道理吧[捂脸],别杠，第一次深渊满星就是优打的，大保底都给优留好了，一直想给优补命座，每期深渊都是用优打满的，我好难受啊[捂脸],实在不行你让优替迪希雅进常驻也行啊[捂脸]你们真就是劳伦斯家族呗？[捂脸]这个世界很大，大到可以容下广阔星海天地万象，这个世界又很小，小到容不下这样一颗坚强而又孤独的心[大哭]"
"惊鸿刀","保密","江苏","564411499","4","","10000","423","","首先我真的是优厨，其次我真的破防了，最后我眼泪都流出来了。。。"
"小聂小莲","保密","安徽","162952738","5","","10000","46","","当初2.3可是策划说双up加快复刻循环，现在属实是被打脸，况且米卡不跟优一起，属实崩不住了。也不强求什么，只求复刻的时候池子有米卡，不然我高低得回来拍照打卡的[tv_抠鼻]"
"意思是一点也没有吖","保密","湖南","410939408","5","","10000","90","","好消息:申鹤打赢阿贝多了,坏消息:优没打过绫华"
"万界创世尊主","保密","海南","255456538","5","","10000","45","","mhy：我们将复刻一位角色。,优（站起身，心想难道老米想起我了？）,mhy：她是女的，而且是冰系。,优：（眼神期待）,mhy：她曾家道中落。,优：！！！！！！,mhy：她使用剑，并且我们还一同复刻她的一名强有力的拐角色。,优：（伸手，小声急喊：我我我，就是我！）,mhy：没错她是绫华。,优：……"
"元某才不是sister控","男","福建","196496026","5","","10000","361","","请问原宝，能否像隔壁崩铁那样，常驻满多少抽自选一个常驻，你不把我以前两年来抽的算进去也无所谓，给我们这些厨抽不出来的常驻的冤种，一点目标和期待可以吗[保卫萝卜_哭哭][保卫萝卜_哭哭][保卫萝卜_哭哭]你现在还要往常驻加迪希雅，我的七宝越来越遥不可及[跪了]"
"抹布T","男","广东","36200938","6","","10000","72","","我懂了[tv_目瞪口呆],一切都是为了符合剧情,优是罪人不配过风花节,所以3.5不会出现再卡池里,那3.6一定会出吧？到时候还带着米卡,一定是这样的,啊哈哈哈哈哈哈[笑哭][喜极而泣][委屈][大哭]"
"MAITEER","保密","四川","268425787","6","","10000","215","","优再一次破了胡桃的大数字――复刻天数"
"__蒲公英的约定_","男","贵州","89868420","6","","10000","70","","你说的对，但是《风花节复刻优》是由内鬼 自主研发的一款全新，纯虚拟开放游戏。游戏发生在一个被称作「3.5爆料」的幻想世界，在这里，从广大玩家里选中的幸运测试玩家将被授予「流量密码」。你将扮演一位有「签订保密协议」的神秘角色，同时，逐步发掘《下个版本必复刻谁》的真相。"
