"昵称","性别","IP","UID","等级","装扮","用户权重","获赞数","粉丝团等级","评论"
"wanedemhy","保密","广西","504101536","4","","10000","4","","“随着版本的更新”,“已经有越来越多的新朋友和大家见面了”,“有些新玩家呢”,“会希望获得曾经UP过的限定角色”,“但等待心仪的角色返场的时间可能会有点久”,“制作组呢 在听到了这样的反馈意见之后”,“决定今后会配合版本内容”,“适时推进限定角色的复刻”,,                       ――节选《原神2.3版本前瞻》"
"我真的是mmr","保密","河北","595397699","4","","10000","4","","优厨们 42＞431了[星星眼]"
"白金-gold-still","男","广西","513995210","5","","10000","4","","希望新角色能有这么几个台词中的一句,『黎明，随着那希望的火光而升起！』,『奋力向远方奋力前进吧，去追寻那到属于自己的希望之光吧！』,『乌云之上便是光明，而那道希望之光，则在远方的某处地方』"
"猫猫啃白菜","保密","浙江","574487503","5","崩坏：星穹铁道","10000","4","","柯莱cv老师声音好好听555 喜欢"
"袜子-领主","男","辽宁","499158810","5","","10000","4","","懂了，这次风花节的up角色是卢老爷和莫娜，好期待呀，希望我不歪吧[打call]"
"室友阳寿换中奖","保密","黑龙江","1320938220","4","","10000","4","","米卡单拎出来没太看懂"
"YAYA_NANA","保密","四川","177922750","5","","10000","4","","物理拐不跟物理c，确实有一点点抽象…你真的好自由"
"素霉奇阿","保密","江苏","2296153","6","暮光幻影","10000","4","11","我擦  记错时间了  水晶没拿到  血亏"
"唐月饭","保密","黑龙江","14606621","6","","10000","4","","在？为什么不复刻优"
"红色山风","保密","北京","2360515","6","","10000","4","","有的人，错过了就是一辈子[吃瓜]，但是这和我无关，我优上次up就满命了[脱单doge]这次就神鹤米卡一起抽正好"
"杠我给肖战当形怒","男","河南","1240039286","4","","10000","4","","有没有可能 风花节+米卡是物理拐+最久没复刻，不一定是看内鬼看的。一堆人现在都在骂优厨哈哈。[微笑]"
"魔女你也敢追吗","男","内蒙古","1053805335","5","","10000","4","","世界树怕不是把优和散兵都清除了，太惨了"
"野白三犬zz","保密","浙江","1903458521","5","","10000","4","","麻了，我们星期六下午两点半才放学，nmnd没领到"
"傻傻没有脑袋","保密","江苏","37534202","5","","10000","4","","伙计们，870天全勤的卑微B服月卡玩家，优第一次复刻左右喜欢起来了，结果日常歪掉（当时就强度毕业了，无欲无求），一直等到现在，有亿点点心累，有点想离开了的心思，怎么办"
"卡哈hhh","保密","广东","598708874","5","","10000","4","","音游活动能写1200物量？给大家来一点定轨音游震撼！（1200其实已经算是定轨的下限了[doge]）"
"洛小琦a","男","河北","3203748","6","","10000","4","","你说得对，但是有些新玩家呢，会希望获得曾经up过的限定角色，但等待心仪角色复刻的时间可能会『有点久』，制作组听见这样的反馈意见之后，决定今后会配合『版本内容』，『适时』推进限定角色的复刻。"
"这币不可能","保密","中国香港","24430858","6","异常生物","10000","4","","有没有可能，制作组憋了个核爆，优新皮肤和相关剧情正在制作中，所以这次先不up，到时候再开炸[吃瓜]"
"正气丧失","保密","贵州","79723764","6","","10000","4","","优厨不破防的话，我就要破防了"
"が火龙果あ","保密","河北","16205741","6","明日方舟","10000","4","","米哈游:我保留了一部分角色，你才能看出来新版本是有复刻的,玩家:你自己看了吗,米哈游:看了，一点点，我去掉了一部分的选择，保留了流水大的部分，,玩家:你是故意的，还是不小心的,米哈游:故意不小心的"
"yyy986","女","河北","25772128","6","","10000","4","","看到我你就失去了300原石[小电视_发愁]"
"想不出名称啊啊啊","保密","吉林","1206409241","4","","10000","4","","当你看到这条评论时，兑换码已经过期了[脸红]"
"某菜园的白菜","男","天津","396085012","5","","10000","5","","鸠占鹊巢没理的，论剧情某华某鹤压根不沾边，但是有些玩家呢，会希望获得曾经up过的限定角色，但等待心仪的角色返场的时间可能会有点久。制作组呢，在听到了这样的意见反馈之后，决定今后会配合版本内容，适实推进限定角色的复刻，我这并不是带节奏，而且你原神不尊重玩家的必然代价"
"弗朗西斯培根哒","保密","河南","95900235","6","","10000","4","","测，看见优下版本不复刻我想着抽个夜兰弄个辅助玩，出了个琴[跪了]"
"金光闪闪的蛋黄","男","山东","129343601","6","","10000","4","","内鬼爆料几种情况里面都觉得可信度最低的神鹤，结果就是神鹤，优也太久没复刻了吧"
"Doctor没钱","男","安徽","96191718","5","","10000","4","","出个斗虫常驻吧，米哈游！随机养成！比七圣简单还不浪费时间[笑哭]"
"屑狐狸八重神子大人","保密","内蒙古","49893905","6","良辰美景・不问天","10000","4","","哎呀，优小姐现正代表西风骑士团在八重堂参加联谊活动。现给本宫司点个赞~再私聊本宫司一句，可以提前领取优小姐的美照哟[脱单doge][脱单doge][脱单doge]"
"清风qf123","男","河北","492152121","5","","10000","4","","为什么簌簌不主持了呢？[思考]想看簌簌主持"
"小可爱-甘雨","男","广东","1407379722","5","公主连结凯露","10000","4","","武器池大小船桨那个笑死我啦[喜极而泣]"
"嘉然吃什么我就吃什么","男","河北","1947730385","5","","10000","4","","【3.6BETA】,我们在即将到来的版本删除了角色［浪沫的旋舞・优（冰）］，感谢优给我们带来的贡献，人生有梦，各自精彩。"
"用户不在线___","男","河南","1020195233","5","","10000","4","","优6∶"
"总之名字够长就行了吧","保密","湖南","625090590","5","","10000","4","","【3.6BETA】,我们在即将到来的版本删除了角色［浪沫的旋舞・优（冰）］，感谢优给我们带来的贡献，人生有梦，各自精彩。"
"白草净华","保密","河南","510241443","5","","10000","4","","进常驻就进常驻，不要总是歪一个好不好？"
"Element477B","男","河北","611889595","5","","10000","4","","有这么一个角色,TA不断打破复刻时间记录，榜上有名,有这么一个角色,TA自己的拐和自己不在一个池子,有这么一个角色,TA复刻时进深渊却要面对自己不擅长的环境,有这么一个角色,TA复刻时没有任何剧情,优：正是。。。,宵宫：正是在下！,（复刻记录――指最速复刻记录，自己拐――指云瑾，深渊环境――指3.2，3.2连续出现狗子，没有剧情――懂得都懂）,这波啊，优成冰宵宫啦（埃洛伊：？）"
"考研专用号-滚去学习","保密","河南","329012607","5","","10000","4","","我唯二喜欢的女角色――优和迪希雅，待遇都很微妙，看来我和策划xp对冲[藏狐]"
"猫猫丶exe未响应","保密","四川","92961785","6","","10000","4","","没太搞懂迪希雅进常驻这波操作是什么意思？[辣眼睛]"
"他是个球","保密","浙江","503906201","4","","10000","4","","或许还有人记得吗，优第一次复刻真的很猝不及防，谁都没有想到会有她，很多等优的优厨当时都还没怎么准备好，结果第二次到现在都不复刻，优厨真的很无语啊"
"希望联萌","保密","马来西亚","4675184","6","","10000","4","","优拉厨：“是故意的还是不小心的？”,Mhy:""是故意的”（理直气壮）,优拉厨：[捂脸]"
"otokam","男","天津","1663291","6","","10000","4","","所以阿贝多，你只能出现在官方活动里当嘉宾了吗？[doge][doge][doge]"
"你游ch真傻呗","保密","江苏","282963956","6","#EveOneCat!","10000","4","","角色进常驻，专武能不能也进常驻[再见]还有阿贝多老师的五星专武[Cat2_Inbox!]"
"鲵须睡觉","保密","安徽","255507810","5","公主连结可可萝","10000","4","","你可真会整个大活，希望优复刻的时候还有米卡。优厨不想要绫华申鹤千万别捞，防止背刺。还好是优不是那谁，不然我怀疑绫华申鹤要被冲。"
"迪希Yaaa","男","北京","91273244","6","","10000","4","","迪希雅进常驻[怪我咯]以后想补命座都难"
"翻来覆去咸鱼宴","保密","湖南","472198292","5","","10000","4","","救命啊，能不能换个联动啊，必胜客真的不好吃啊。。。我不要去浪费钱[大哭]"
"扣扣米也绝非鳝类","保密","江西","3493095117163271","3","","10000","4","","优厨，冰本坐牢"
"S画廊","保密","云南","354618606","6","","10000","4","","优再见[大哭][大哭][大哭]等不到你，退游罢"
"生吃宵宫绷带","男","山东","1209887448","4","","10000","4","","能不能改一下宵宫那个跟没有一样的对空啊，打个黄金王兽根本打不到。还有那个索敌，雷邱邱人都在脸上了还去锁远处的结核，真的快玩不下去了"
"行きは良いM","保密","江西","104089138","5","","10000","4","","不是手心手背都是肉吗，这放童话里，妥妥是个恶毒皇后来着"
"mikaの杂鱼Pro","男","江西","5015520","6","-阿库娅","10000","4","","你说的对，但是【让每一位旅行者喜爱的角色都有正常复刻时间】是由原神策划自主瞎编的谎言，故事发生在一款被称作原神的游戏中，在这里被优吸引的人将被授予冤种，引导真爱厨力。你将扮演一位优的角色厨，在自由的开放世界中邂逅各种快速复刻的角色，和他们一起发掘优雪藏的真相"
"星言若曾痕","保密","河北","381948303","5","","10000","4","","1.6入坑，2.3上半因为2.2胡桃歪了退过一次坑，绝了你知道吗，刚好都错过优，我600天玩家没见过优up，我笑死了哈哈哈哈哈，过了这次再不复刻我就是700天没见过优复刻的了，优也可以成为500天不复刻的神仙了哈哈哈哈哈哈[尴尬]"
"绾绾问你吃了吗","保密","河北","351568216","5","","10000","4","","这个仇，我记下了"
"桐生kiryu丶","保密","河南","199811044","5","","10000","4","","还不复刻优是真的离谱，这角色是得罪策划了吗，安排这种卡池就突出一个赚钱最重要了，玩家和口碑不重要。"
"阿千不是阿间","男","河南","628666905","4","","10000","4","","你还记得你说过最多六个月复刻，让玩家们尽快抽到自己喜欢的角色这一句话吗[阴险]"
"墨笔书安","女","上海","19146642","6","","10000","4","","不厨。但是我好像很久没见过某个蓝头发双手剑姑娘了，大家有什么头猪吗[思考]"
"暗月Lyx","保密","上海","20382126","6","","10000","4","","优是不是只有0.6%的复刻概率啊？"
"卡夫卡再爱我一次","保密","广东","20260124","6","","10000","4","","虽然不厨优，这400多天不复刻确实有点离谱，才刚出完手办[呆]"
"她即是好梦","男","黑龙江","359820980","5","","10000","4","","本来看到米卡实机演示就是辅优的时候我直接笑着想这回终于来了，四百多天没白等，结果。。。唉，可能热度低强度低的角色就不配复刻吧，真羡慕绫华又出新皮肤剧情又多，复刻还带着拐[辣眼睛]"
"蓝宝石小学生","保密","河南","50229609","5","","10000","4","","包里有个松籁   抽苍古歪的   放了快一年半了[doge]"
"心中之轩","男","浙江","494423061","6","","10000","4","","蒙德主题的风花节不复合蒙德人，优居然还不复刻[微笑]（优厨震怒）"
"清晨鹿益发","保密","广西","347610951","5","","10000","4","","一部主线一个粉球，看来最近不做主线的玩家是越来越多了，反正我也就攒了两个版本的主线没做了，大家都别做，以后给的更多[滑稽]"
"野原新之助122","男","安徽","336803165","6","","10000","4","","太好了，抽出七七还能有专拐米卡！！！[墨镜][墨镜][墨镜]"
"廉贞刻晴","保密","河北","388087381","5","三周年恋曲","10000","4","","额，联动活动夜兰的立绘是不是…………弄错了"
"吃我数万真言","保密","广东","241671934","6","","10000","4","","猜猜是哪个倒霉蛋专拐要去别人的池子里捞[滑稽]"
"xiwxwkolc","保密","北京","3493117145647930","2","","10000","4","","加油"
"蒙德特产喵","保密","湖北","91427537","6","","10000","4","","蒙德厨流下猪泪"
"飘雪_边界","保密","重庆","444221378","5","","10000","4","","更新太慢了，什么时候能去下个地区呢?"
"kcokooo","女","湖南","8130869","5","","10000","4","6","没啥想抽的了，扔20抽给申鹤，没抽到就算了"
"浅仓雪步","保密","河北","2349773","6","","10000","4","","迪希亚常住啦，以后补命座不就是大海捞针了嘛"
"抓星星泡饭捏","女","福建","1048127222","5","","10000","4","","版本前瞻出来前我还真不知道有这么多人厨尤[藏狐][藏狐]"
"BRSAYYYY","保密","重庆","179901231","5","","10000","4","","卢姥爷地位演变史：,开服：全游天花板,璃月3c后：大剑角色天花板,优后：火系大剑角色天花板,迪希雅后（我以为的）：常驻火系大剑天花板,迪希雅后（实际上）：蒙德常驻火系大剑角色天花板,[微笑]"
"山茶花不眠","保密","广西","509561924","5","","10000","4","","问问原来得过风之翼的大佬们，联动点外卖可以得到兑换码换风之翼吗？[给心心]"
"秘烤肋排","男","辽宁","621784675","5","","10000","4","","注：目前共20幕魔神任务，也就是有20抽"
"不异同人","保密","吉林","442498750","5","","10000","4","","你说的很对，但是随着版本的更新，已经有越来越多的新朋友和大家见面了，有些新玩家呢会希望获得曾经UP过的限定角色，但等待心仪的角色返场的时间可能会有点久，制作组呢在听到了这样的反馈意见之后，决定今后配合版本内容，适时推进限定角色的复刻。"
"等于三十","男","山东","94002945","6","","10000","4","","不复刻优拉是怕科莱安珀火葬场是吧[doge]"
"戈尔德的邂逅","男","山东","33844833","6","","10000","4","","迪希雅。。。你为什么进了常驻啊。。。"
"小郁同学yu_","女","云南","346622476","5","少女前线","10000","4","","只要歪得准，天天复刻蒙德人"
"bili_488317356","保密","广东","488317356","5","","10000","4","","刚回坑的时候抽了优，我永远喜欢大姐姐"
"夕阳北上","保密","上海","72910122","6","","10000","4","","突然发现，我21年刚入坑的时候，全凭XP一连抽了胡桃优申鹤，居然是如此的机智[嗑瓜子]"
"木鱼W","男","上海","17725736","6","一周年纪念装扮","10000","4","","说的好啊"
"戏候","保密","山东","3461564036287196","3","","10000","4","","可不可以给猫猫狗狗加一下互动按钮 每次看见他们都好想摸[生气]"
"云陌苍梧","保密","山西","12495051","6","花丸晴琉","10000","4","","我的77,我的77她还在常驻池子里啊！！给个机会，别再稀释了，让她出来吧！！[大哭][大哭][大哭]"
"找好辅助是一被子的事","女","北京","19274028","6","","10000","4","","你多少照顾一下没有过须弥剧情的萌新啊，好家伙直接剧透第一幕[tv_笑哭]"
"某黎明_","保密","广东","1273696452","4","","10000","4","","恭喜常驻池又多了一名角色"
"请在早上五点半叫醒我","保密","山东","30880227","6","泠鸢yousa","10000","4","","[doge]所以为什么蒙德的节日，两个可以复刻的不给位置，给个两个地区的人"
"呆萌水T","男","天津","631230577","5","","10000","4","","18:00 接着玩儿吧 乐死我了[笑哭]"
"狂战士史莱姆","男","江苏","4893682","6","","10000","4","","有一个考哥.ntr的梗，赛诺的cv李轻扬也是假面骑士01变身者――飞电或人的中配，这俩有一个共同的特点，爱讲冷笑话"
"棋落风息","男","辽宁","32892601","6","一周年纪念装扮","10000","4","","好消息：新版本有优[脱单doge],坏消息：在七圣召唤里[辣眼睛]"
"空坂_Shysaka","保密","江苏","109376838","6","hanser","10000","4","","“看见尤拉没复刻就破防的，给你们说一下，尤拉在开池子之后已经复刻过一次了，而有一个冰系辅助五星角色自第一次开池子之后就是唯一一个还没复刻过的角色，你猜是谁”"
"我缺这6个硬币吗","女","重庆","348662862","6","","10000","4","","所以为什么申鹤会放在3.5下半，怎么想都是优复刻更河里啊[热]"
"锱筱F","保密","北京","1137759390","5","","10000","4","","为什么蒙德版本不复刻蒙德5星啊（大雾）"
"桌了个子","保密","广东","872081","6","BW2020","10000","4","3","赛诺：风车应该算得上是一种 《大风机关》吧   有被笑到[doge]"
"品咖的店长","男","江苏","436970442","5","","10000","4","","感觉就是未来会有新体系的建立。输出手段"
"凛新窗边刷牙","女","甘肃","1235082247","4","碧蓝之海","10000","4","","你小子这次让夜兰凝光去必胜客，叔很喜欢，但是叔更喜欢夜兰×申鹤"
"Cetemya","保密","上海","589094946","5","","10000","4","","我的等神里要完结啦[脱单doge]"
"孤狼29","男","上海","31984303","6","","10000","4","","内鬼和内鬼厨双双破防啦哈哈哈哈哈哈哈[doge]"
"摆老师","保密","湖南","98855860","5","","10000","4","","太自由了[doge]"
"德玛西亚黄焖盖饭","保密","山西","407690418","5","不良人","10000","4","","你说得对，但是,“随着版本的更新”,“已经有越来越多的新朋友和大家见面了”,“有些新玩家呢”,“会希望获得曾经UP过的限定角色”,“但等待心仪的角色返场的时间可能会有点久”,“制作组呢 在听到了这样的反馈意见之后”,“决定今后会配合版本内容”,“适时推进限定角色的复刻”"
"诽莲","保密","湖南","693194219","5","","10000","4","","风神:我不知道，也不告诉你,岩神:我知道，但不能告诉你,雷神:我想告诉你，但我真的不知道,戴因:500摩拉，你想知道的我都告诉你"
"炮哥Channel","保密","上海","81088","6","良辰美景・不问天","10000","4","","“你能表演一下那个吗？”,“还要再来一次吗？”,“对对对，就是那个！”,“有些晚入坑的旅行者会希望获得曾经UP的限定角色，制作组在听到了这样的反馈意见之后，决定今后会配合当前版本内容（重点），适时推进限定角色的复刻！”,“哈哈哈哈哈哈哈”"
"清晨的主人","男","湖北","1692525790","5","","10000","4","","好久没玩了。有谁能告诉我，为什么按照时间排序是这个画风吗？"
"短饮清风酒__","保密","广东","441608422","5","","10000","4","","“随着版本的更新”,“已经有越来越多的新朋友和大家见面了”,“有些新玩家呢”,“会希望获得曾经UP过的限定角色”,“但等待心仪的角色返场的时间可能会有点久”,“制作组呢 在听到了这样的反馈意见之后”,“决定今后会配合版本内容”,“适时推进限定角色的复刻”"
"变体精灵芙卡洛斯","男","陕西","1077552107","5","少年歌行","10000","4","","你说得对，但是,“随着版本的更新”,“已经有越来越多的新朋友和大家见面了”,“有些新玩家呢”,“会希望获得曾经UP过的限定角色”,“但等待心仪的角色返场的时间可能会有点久”,“制作组呢 在听到了这样的反馈意见之后”,“决定今后会配合版本内容”,“适时推进限定角色的复刻”,说话如放屁的制作组实在没有信用可言，有点久指的就是500天吗"
"fyek","保密","四川","1885076115","4","","10000","4","","不复刻优，米哈游你在干什么"
"可爱路过的爱莉","保密","山东","1404059710","5","崩坏3・天穹流星","10000","4","","复刻优复刻优复刻优复刻优复刻优复刻优复刻优复刻优复刻优复刻优复刻优复刻优复刻优复刻优复刻优复刻优复刻优复刻优复刻优复刻优复刻优复刻优复刻优复刻优复刻优复刻优复刻优复刻优复刻优复刻优复刻优复刻优复刻优复刻优复刻优复刻优复刻优复刻优复刻优复刻优复刻优复刻优复刻优复刻优复刻优复刻优复刻优复刻优复刻优复刻优复刻优复刻优复刻优复刻优复刻优复刻优复刻优复刻优复刻优复刻优复刻优复刻优复刻优复刻优复刻优复刻优复刻优复刻优复刻优复刻优"
"性感背带蔡徐坤","男","甘肃","662836831","5","崩坏3・天穹流星","10000","4","","说实话，我不是优厨，但是我觉得不怎么公平了，假如我玩优，3.5以后复刻的话，我不会抽的3.5的池，但是下半池又有米卡，我为了米卡可能要花不少，可能会为了米卡的命座抽神里和申鹤，就挺操蛋的"
"伞下的伊卡洛斯","保密","广东","11535631","5","","10000","4","","你可以自由，但不要太自由[微笑]"
"沧者那啥子灵煦","保密","河北","36222270","5","","10000","4","","沙漠很美，人心很脏"
"带恶人哈鱼","保密","江西","1584369239","5","","10000","4","","原神你改不改诺艾尔局内表情，每次我看到她一脸忧郁的样子真的心疼[大哭][大哭][大哭]"
"你的名字为天野阳菜","男","天津","382655591","6","中野四叶","10000","4","","BV1LT411D7eF"
"零M末世","保密","广东","204469956","6","雪未来","10000","4","","“随着版本的更新”,“已经有越来越多的新朋友和大家见面了”,“有些新玩家呢”,“会希望获得曾经UP过的限定角色”,“但等待心仪的角色返场的时间可能会有点久”,“制作组呢 在听到了这样的反馈意见之后”,“决定今后会配合版本内容”,“适时推进限定角色的复刻”,,                       ――节选《原神2.3版本前瞻》"
"o鱼たん","男","广东","314833066","6","原神","10000","4","","已黑化，希望卡池策划一个人拍全家福的时候要开心点"
"一只酚酞","男","河北","442237967","4","","10000","4","","真的，你要是不愿意复刻就删了吧，"
"愿世界厝嵋源","男","河北","22351590","6","hanser","10000","4","","要不把优进常驻行不？起码这样我还能抽到她[笑]"
"危月壁水","男","辽宁","292259284","5","碧蓝之海","10000","4","","看着意思，3.4绫华皮肤，但是3.5绫华才复刻，优可能3.6复刻"
"渣男-_","男","中国香港","198528625","5","","10000","4","","3.5不复刻优无所谓了劳资开始攒满精了[微笑][微笑][微笑]"
"西北旺社天琅","女","山东","432298033","5","","10000","4","","道理我都懂，可为什么蒙德的风花节池里面没有一个蒙德五星[藏狐]"
"Gliian","男","山西","108873774","5","明日方舟音律系列","10000","4","","我和内鬼的区别就是我没p个图发视频，你怎么不信我的预测的卡池，我说3.5卡池是天理和带嘤[OK]"
"猴子的香蕉520","男","浙江","149186981","6","原神","10000","4","","3.5怎么看都是尤拉复刻版本,第一是风花节，剧情有柯莱安柏尤拉,第二是米卡是加物理伤害的物理拐,第三尤拉未复刻天数比神里和申鹤都多,第四卡牌更新了尤拉,第五官方即将卖尤拉手办"
"只有我才会用这个名字","保密","河南","1645968493","5","","10000","4","","讽刺，双复刻实行之后第一个池子就是优和阿贝多，现在呢，四百多天了，蒙德的风花节还不复刻优，甚至连前瞻上的阿贝多都没。论时间论剧情复刻她俩都合情合理。3.2为了复刻公子，宵宫，（没有辱角色的意思）甚至还给他俩强行加了个彩蛋剧情，就这还因为剧情的各种不合理被玩家骂了。我是实在想不通，你官方是没本事防内鬼，就开始背刺玩家？"
"暖冬o期","保密","辽宁","93928660","6","","10000","4","","各种意义上都挺离谱的……彳亍吧"
"塞上夜紫","男","河南","1990460449","4","","10000","4","","你游节奏要笑死我"
"道悠ATO","保密","四川","362741074","4","","10000","4","","我真的不理解为什么风花节不复刻蒙德角色 尤咋怎么说也轮到她了吧如果这波真的是背刺内鬼我觉得真的duck不必[无语]"
"夏槿凝烟","女","江苏","2752940","6","2021拜年纪","10000","4","","风花节没有一个蒙德角色up，你是懂复刻的"
"反驳我的和xz睡","保密","湖北","336054182","5","原神","10000","4","","我真的服了，这是信不信内鬼的问题吗，这是一个角色四百多天不复刻的问题，一个厨四百多天没优，pv一个影子都没有[藏狐]"
"清酒淡浮生","保密","云南","400327665","5","","10000","4","","那么久不复刻优，哪怕我不厨我都觉得过分了，蒙德的节日不复刻蒙德人，你是在想什么。"
"Meat00Ball","男","广东","9559718","6","","10000","4","","兑换码敢不敢时间长一点[辣眼睛]"
"霏雨418","保密","河北","2085565948","5","","10000","4","","虽然但是，我建议优替掉赛诺的位置"
