"昵称","性别","IP","UID","等级","装扮","用户权重","获赞数","粉丝团等级","评论"
"民国豌豆","保密","湖南","484465441","5","","10000","25223","","她就像普通的一根针，却苦苦支撑着枫丹这座倒放的金字塔 。"
"----kokomi----","女","四川","1107236214","4","","10000","5329","","该不会每个语言都有吧？[给心心]"
"白墨永不摆烂","保密","河南","2134615191","5","","10000","13382","","看来老米很看重轻涟这首歌啊[思考] 不过 也不错 希望多出[脱单doge]"
"此若流年","保密","上海","259455373","5","","10000","9442","","不同于女版，这一版是以男主角的视角展开，像是在告诉女主角，即使你离开了，我也会继续思念你，代你看尽世间的美好。"
"DoLoKong","男","河北","95915719","6","","10000","8414","8","做完主线之后，倒是没有水元素充盈，但这两天就是一直心情不好，闷闷的[墨镜]"
"喜欢应是双向奔赴","保密","内蒙古","50932076","6","乃琳Queen","10000","7954","","想看水神终舞那一段动画"
"左拥哒宰右抱闪闪","保密","吉林","14645410","6","","10000","5659","11","中法两个版本从声调到演唱技巧还有断词的处理都有不同，不只是语言的不同，法版给人音乐剧中身临其境的感觉，更能调动情绪，而中版像是剧中的男主，在一切尘埃落定后对后人讲述她的故事的感觉，都好棒！"
"翎辰Reitatsu","女","广东","350360754","6","","10000","4626","","小知识mhy和胡夏老师不是第一次合作，之前未定就合作过一次[脱单doge]"
"经流年梦回春水边","保密","河北","348958546","5","","10000","4547","7","不同演唱者，不同音色，演绎出的故事感也是不同的。法语版和尚雯婕版像是芙芙自己的演绎，中文胡夏版，个人觉得像是以能体会人类感情后的那维莱特视角。"
"团长你要幸福啊团长","女","河北","107694613","6","","10000","3017","","男声像是在带入那维的视角"
"Windyいsky","保密","云南","86690163","5","","10000","694","","太好听了，原宝你要不要花点钱，找这些专业的歌剧演员把《水的女儿》这部歌剧演一下，新年晚会的时候放出来让大家看看，我保证这一定会是最受欢迎的作品，热度会很高的，这个故事非常好，可能会有二创作者也会用这个题材，但是只有神通广大的米老爷才能邀请到这些专业的演员来演出，芙芙和枫丹主线的热度现在这么高，你做了这个歌剧肯定血赚不亏，你肯定已经再准备了对吧！[大哭]"
"冰雨交加GaMing","男","未知","6687136","6","崩坏3・天穹流星","10000","834","","真不是过度解读，这里就是男主视角。也就是那维莱特的视角。[笑哭]谁和我一样在默默流泪，再一次又一次的理解和欣赏《轻涟》中，逐渐理解那维莱特，芙卡洛斯和芙宁娜。[酸了][笑哭][大哭]"
"-劫灰-","男","山东","6979953","6","","10000","1461","","卧槽？！等一下！,轻涟这个歌，胡夏的中文版和尚雯婕的法语版是不是分别对应荒芒属性啊？,歌曲的前奏音乐好像不太一样，舞台布景色调也不一样，一个白色一个蓝色。"
"六神丸铁","保密","上海","154223767","5","","10000","1941","","原宝最自信的一次[笑哭]"
"温柔的十六","保密","河南","31343119","6","","10000","268","","中文特有的含蓄和克制，想水一样流淌、温润。"
"薄荷味空气","保密","湖北","190097199","5","","10000","1940","","当她接过了前代的权能，重担与罪孽后，决然的将自己劈开，分出了神的部分与人的部分。 ,神的部分自我囚禁，用500年时间一点一点打磨出用来刺穿自己心脏的利剑，以求拯救原本必将溶解的众生。 ,人的部分欺瞒众生，用500年时间来扮演舞台之上吸引万众目光的演员，配合另一个自己，用自己182376次单调痛苦的独舞背负枫丹人的“原罪”。,她们是水神之座上绽放的双生莲，是正义国度舞台上不休的歌者与舞者，她们无愧于“众水，众方，众民，众律法的女王”之名。永世领唱，不休独舞。,愿你长眠，芙卡洛斯。,祝你开心，芙宁娜。"
"试作古华","男","江西","490088565","5","","10000","273","","原神剧情曲《轻涟》（中文演绎版）现已发布。,,出品：HOYO-MiX,作曲：苑迪萌@HOYO-MiX,作词：哈尼/项柳/三宝,演唱：胡夏"
"JingClm","保密","山东","384017179","5","原神","10000","155","","我天。“诀别如繁花盛开”这里，真的好适合芙卡洛斯向那维莱特告别那段cg"
"对非惯性系用牛顿第二定律","保密","福建","33701325","6","~るる","10000","637","","胡夏这人怎么不老啊[笑哭]我十年前看他也是这个样"
"lqy半城","保密","安徽","241447661","6","洛天依8th生日纪念","10000","1321","","文本是临时改的，MV是看剧情火了临时录的[doge]"
"神茶配铵盐","保密","天津","5654006","5","格兰芬多","10000","176","","评论有说胡夏唱的没感情，歌手实力不够的搞笑么？？你以为他这么多年不营销没流量依然走到现在甚至成为央视常客靠的是啥？[微笑] 还有不是只有激昂大开大合的才叫有感情好么，温柔克制不是感情么？"
"未有之源-梦","保密","天津","456759279","5","良辰美景・不问天","10000","1003","","真的太动人心了，不知道芙的第二章剧情得多精彩了[喜欢]"
"灭宙龙","保密","江苏","225387898","6","","10000","1237","","【【中文版翻唱】「轻涟」（芙宁娜传说任务《水的女儿》）-哔哩哔哩】 https://b23.tv/ILrqElB,大伙可以听听这个up的版本，也很好听"
"强哥之声","保密","浙江","430358657","4","","10000","597","","论老米的官方神曲：,神女劈观,TruE,水龙吟,轻涟"
"雨亦晴sama","男","江苏","11715812","6","","10000","1529","","我去这什么排面啊？[doge]还有人带节奏说老米对芙不好特意针对，所以这专属双语EP的待遇，请了三位大佬演唱都算不好了么？不说了，我芙伟大，芙门。[保佑]"
"洁身自好克利姆","保密","美国","66781888","5","","10000","204","","虽然唱的也好听，但感觉还是原曲更对味儿。,不知道是因为女声更适合，还是法语更适合的缘故"
"大和牌阎魔刀","保密","广西","3225791","6","","10000","459","","看到尚雯婕版的我：哦唱过《befall》的那位姐姐，米家老朋友了,看到胡夏的我：啊？"
"ADXX47","保密","北京","329797638","5","","10000","22","","芙门！"
"barrybbb","男","江苏","25644666","6","某科学的超电磁炮T","10000","46","","好汀"
"雪辰沙","保密","广东","352751792","5","","10000","43","","就现在看来，法涅斯都快成提瓦特琴酒了，风岩俩润了，雷草直接放权，水神连号都给消了，冰神还打算造反，估计火神也没好到哪里去[tv_斜眼笑][tv_斜眼笑][tv_斜眼笑]"
"我是银枝大人的呜呜伯","女","四川","310764365","5","格兰芬多","10000","82","","Ah,sijepouvaisvivredansl'eau,,啊，若化水复回归途,lemondeserait-ilplusbeau?,令故土朝暮如初,Nouspardonneras-tu,chèremère?,啊母亲可否将我宽恕,L'eaudanssoncourantfaitdansernosvies.,向四季流溯，引万籁驰骛,Etlacité,ellenourrit.,所过处百废复苏,Ainsiquetoi,mondouxamour.,亦充盈挚爱的心湖,,Non,legrandamournesuffitpas.,爱，就将这酣梦深埋,Seulunadieufleurira.,诀别如繁花盛开,C'estnotrehistoiredevie,douceetamère.,似你我往怀，愉快悲哀,Moi,jesuisetseraitoujourslà,,爱，我会在过去未来,àvoirlemondeetsabeauté.,注视这世间精彩,Etanechangerajamais,jamais...,一切从未改，未改……"
"阙山之月","女","江苏","519007904","5","","10000","9","","来啦 来听王子唱歌"
"独属于我的影小姐","保密","四川","52513138","6","","10000","43","","芙芙的新家[脱单doge]"
"sio刚","保密","广东","18237235","6","沈剑心","10000","28","","[芮小凸小凹_震惊]4.2魔神任务也不过如此嘛[芮小凸小凹_哭]"
"古埃及掌管鳕鱼的神","女","浙江","38417895","5","","10000","6","","芙门[墨镜]"
"蓝白相间的熊猫殿下","保密","湖南","72688512","6","hanser","10000","6","10","芙芙！芙芙！[原神_干杯]"
"PPANDAHERO","女","北京","219648","6","乃琳Queen","10000","10","","都让歌手戴胸巾了，一看就是那维莱特吧"
"世界很大的窝","保密","贵州","500072300","5","","10000","5","","芙门！"
"七七Official","女","四川","23930013","6","崩坏：星穹铁道","10000","18","10","芙芙值得！！！！呜呜呜，芙芙你是我心中最好的神明！！！[崩坏：星穹铁道_哭哭]"
"Nanamaa_","保密","福建","490072809","5","","10000","4","","芙门"
"络叶TheRourYei","保密","广西","12953864","6","","10000","4","","[给心心]芙门！"
"拂风_wind","保密","甘肃","3493084960655736","4","","10000","4","","看看我的[保卫萝卜_哇]芙门"
"爱在马德里-伯纳乌","男","浙江","454599952","6","","10000","4","10","芙门[崩坏3_哭哭]"
"Highestlhy","保密","重庆","3493271993060109","3","","10000","10","","过完剧情后：,大小姐，[墨镜]，[墨镜]，[墨镜]以后只能你自己带了。再见了，大小姐[墨镜][墨镜][墨镜][墨镜][墨镜][墨镜][墨镜][墨镜][墨镜][墨镜][墨镜][墨镜][墨镜][墨镜][墨镜][墨镜]"
"纸鸢_korschum","女","陕西","433349099","5","","10000","13","","提前预言一波，b站各路大神的翻唱浪潮就要来了[崩坏：星穹铁道_心]"
"梨アリナ","女","天津","1543617","6","","10000","8","","太好听了第一次听我就哭了[大哭][大哭][大哭][大哭][大哭][大哭][大哭][大哭][大哭][大哭][大哭][大哭][大哭][大哭]"
"酸辣粉好吃好吃","女","河南","3461581411191553","4","","10000","8","","原宝你好会找歌手啊啊啊啊啊他们俩唱的好合适啊啊啊啊"
"UP碳酸钙","男","上海","357149651","6","","10000","7","","看到胡哥就想到战至巅峰，我一直以为胡夏是演员，原来是歌手[星星眼][星星眼][星星眼]"
"花鸟风与诗于你灬","保密","江西","18046981","6","提摩西小队","10000","29","","啊，若化水复回归途,令故土朝暮如初,啊母亲可否将我宽恕,向四季流溯，引万籁驰骛,所过处百废复苏,亦充盈挚爱的心湖,,爱，就将这酣梦深埋,诀别如繁花盛开,似你我往怀，愉快悲哀,爱，我会在过去未来,注视这世间精彩,一切从未改，未改,[崩坏3・光辉矢愿_彩虹水枪][崩坏3・光辉矢愿_彩虹水枪][崩坏3・光辉矢愿_安详]"
"半面狐者","男","吉林","227721758","6","洛天依9th生日纪念","10000","23","","看的出来原宝真的很喜欢这首歌[笑哭]"
"繁花丶无影","男","广东","31123742","6","公主连结佩可莉姆","10000","6","","芙宁娜全名：芙宁娜・德・枫丹,简称：德芙,因此：德芙，纵想丝滑,再简称：芙滑"
"爆裂菊","保密","云南","15563817","6","","10000","7","","谁，胡夏，好多年没看着了"
"飞飞FF","保密","湖南","347504548","5","","10000","15","7","罪人舞步旋，旋步舞人罪，宣布无人罪。"
"LEO丶Mir","男","湖南","8176756","6","","10000","7","","阿？"
"鱼刺ちゃん","女","福建","1658342","6","","10000","10","","这几天脑子里不是这首歌的旋律，就是罪人舞步旋的旋律[保卫萝卜_哭哭]"
"Craborff","男","安徽","402818011","5","","10000","6","","他他他。。。他真的写了一个短短的音乐剧？？？！！！"
"千绿映蓝","女","江苏","34205255","6","","10000","6","","从哪里看来的，她拥有很好的“人”生，但她表演的不是自己[大哭][大哭][大哭]"
"ST雪谛","男","辽宁","29362878","6","","10000","6","","艹突然有种电视剧结尾曲的感觉了[笑哭]好听"
"花开山野烂漫处-","保密","陕西","1383572938","4","","10000","6","","胡夏[打call][打call][打call][打call][打call][打call][打call][打call][打call]"
"Lotusii","男","湖南","34554199","6","","10000","8","11","很喜欢某些人的一句话“米对待芙宁娜的态度只想我让原神成为她一同的灵柩”"
"北往_North","保密","上海","513700801","5","","10000","50","","反复来回听，还是最喜欢胡夏老师这版，个人对于声音是比较挑剔的，几位无疑都是很厉害的老师了，但胡夏这版的音色真的太干净太丝滑了，而且情感也像平静水面下的暗涌，克制深沉但温柔绵长，一如故事中的男主角，也一如不善言辞的那维[保卫萝卜_哭哭]"
"阿诺所长","保密","广东","1136844976","4","","10000","9","","知道为什么原版是法语的？,因为枫丹讲“法”律"
"明白嵛颐靼","保密","中国香港","259586032","5","","10000","6","","原以榉ㄕZ版的中文歌~只是翻g，F在才知道是真的中文版歌~！"
"悲莫悲兮-生别离","男","山西","191951661","6","","10000","5","","原宝来个男女对唱怎么样[打call]"
"爱莉希雅_EIysia","男","安徽","40059979","6","","10000","5","7","听胡夏的第一首歌还是那些年[脱单doge]"
"不动飞鸟asuka","保密","上海","394416628","6","","10000","5","","唉，内部恨，米哈游到底有多恨芙芙，才会找这么多人来唱芙芙的歌[doge]"
"我做了e","保密","江苏","391930187","5","","10000","5","","胡夏的声音太美了[星星眼]"
"瘫客","男","四川","2718600","6","","10000","5","","过完主线剧情以后我久久不能入眠，这故事太感人了，"
"哈豆泥","男","江苏","412986103","5","#EveOneCat","10000","5","","中文有些太柔了，少了原本的那种感觉，不过也很厉害了[打call]"
"羽小嗨","男","广西","30458172","5","实验品家庭","10000","5","11","哎，这中文歌词，越听后劲越大，想想芙卡洛斯，满脑子都是500年的事，就觉得难过[墨镜][大哭]"
"土豆是个洋芋","保密","四川","25769723","5","","10000","5","","感觉周深唱的话应该有另一番味道 嗓子也高感觉也挺 适合的"
"穿-越-者","男","广东","25888629","6","","10000","5","8","罪人舞步旋，反过来念才是它的真意：宣布无人罪"
"没肉的橘子","保密","广东","2166034","6","","10000","5","","不是，你这么看重这歌，你当初来个长点的版本啊！才这么短不够听的！"
"殇星化尘","男","广东","396344298","5","","10000","9","","还有高手？[doge]"
"Aikelsensei1","保密","重庆","1915102630","4","","10000","5","","我芙值得[脱单doge][脱单doge][脱单doge]"
"飘雪不及暗飞花","女","广东","19605098","5","","10000","6","","还特地出中文版有心了[热词系列_知识增加]"
"霉霉的花V太郎","男","四川","352806399","5","崩坏：星穹铁道","10000","6","12","啊？还有高手[崩坏：星穹铁道_吃瓜ing]"
"兮如不屑","保密","广西","415260143","5","魔法学院","10000","6","","越听越好听，越听越心疼[墨镜]"
"叫空格吧","保密","山东","662430321","5","","10000","32","","不像演的[妙啊]"
"手搓黑洞的九歌","女","内蒙古","3493131683105047","4","","10000","5","","在剧情里听到时就已经在想会不会有中文版了！真的来了耶！！"
"芙卡洛斯-枫丹水神","男","江西","1510422184","5","","10000","5","","芙门"
"L7john","男","浙江","3254039","6","初音未来13周年","10000","5","6","短啊，老师们能不能作个长点的版本啊。[大哭]"
"阿u很哇塞","保密","山东","1556865615","4","","10000","5","","终于知道谁是胡夏了。唱歌确实好听"
"万军取首谋黄忠","男","安徽","480743512","5","","10000","5","","“诀别如繁花盛开”,这句给隔壁三蹦子也一样适用[墨镜]"
"Sati酱","女","辽宁","2740808","6","崩坏：星穹铁道","10000","5","","作词的三宝是我想的那个三宝老师吗[惊讶]"
"进击的北","保密","甘肃","1028846381","5","","10000","5","","米哈游你欠芙芙一个完美的收尾剧情[大哭][大哭][大哭][大哭]"
"我喜欢纳西妲qwq","男","北京","1889030850","4","","10000","5","","过完传说任务就来b站了看歌曲了，真不错"
"陈厨不是陈醋","男","四川","280039042","6","崩坏：星穹铁道","10000","5","11","@slime丘 啊？胡夏！芙芙真的值得[委屈]"
"枢几438","保密","北京","33512029","6","","10000","5","","我超 胡夏[哦呼]"
"国崩酱看我","女","浙江","396286921","5","","10000","3324","","芙门!"
"民国豌豆","保密","湖南","484465441","5","","10000","5","","在我潜意识中芙宁娜仍是神明，不管她是否有神秘有神之心，孤独的执行长达500年的面壁，永远一层层的包装着自己，任何人都无法一眼看透她。"
"你不能选择不问","保密","山西","417880053","5","巅峰荣耀","10000","4","","发慢点，热门已经赶不上发的速度了[doge]"
"我的手机壳已经坏了","保密","湖北","1350295130","5","","10000","4","","「罪人舞步旋」倒过来就是「旋步舞人罪」，指须弥的妮露有罪[doge][doge][doge]"
"夏橙三一","保密","山西","32658654","6","罗小黑战记","10000","4","","未定原，是我玩这么久米哈游应得的！下次唱个星铁，我的人生就圆满了！[罗小黑战记_棒棒]"
"小顾野","男","江苏","27574660","5","至尊戒","10000","4","","双厨狂喜！！[酸了]早粉胡夏了……不老男神"
"火舞-流焱","男","四川","284183665","5","","10000","4","","大家带米家游戏玩的时候，总会忘记未定事件簿啊。胡夏的那首未定的注定也超好听"
"克琳","女","河南","385721889","6","不思议之旅","10000","4","","胡夏的声音没得说[墨镜]"
"裘丹莉","女","上海","413400959","6","国民老公带回家","10000","4","","[热词系列_妙啊]"
"TreeNoKi","保密","广西","5441492","6","横扫全场","10000","4","","跑个题[跪了]要是法剧改中文翻唱都能有这水准就好了（"
"Tom_Aubrey","男","北京","472809925","5","","10000","4","","啊？胡夏!"
"凉歌鸿夜","男","浙江","1339850","6","崩坏：星穹铁道","10000","4","11","好听 中文演绎果然别有一番滋味,词写的真好 词作老师里面居然发现了三宝老师,让她降落一直是我歌单里面常备的曲子"
"努力发光的云起","男","福建","1697307540","6","","10000","4","","这双手不知怎么就合上了[墨镜][墨镜][保佑][保佑]芙门"
"宸小山HillChen","男","江西","671671893","5","#EveOneCat!","10000","4","","原神剧情曲《轻涟》（中文演绎版）现已发布。,,出品：HOYO-MiX,作曲：苑迪萌@HOYO-MiX,作词：哈尼/项柳/三宝,演唱：胡夏"
"动漫等于动画加漫画","女","广西","22152849","6","","10000","5","","不是，等，什，啊，啥，什么，啥，原宝你还有多少惊喜是朕不知道的？？？"
"阿``","女","江苏","25979274","6","原神","10000","5","","啊？？？胡夏？？？意想不到的联动[哦呼]"
"宕机九点水","保密","河南","325216520","5","","10000","5","","丫的，谁说的雀巢在唱歌，回不去了[微笑][doge]"
"鸦羽弓","保密","浙江","292041087","6","","10000","5","","快上传QQ音乐[保卫萝卜_笔芯][保卫萝卜_笔芯][保卫萝卜_笔芯]"
"罗秀小姐","男","广东","437078133","5","","10000","4","","我芙她值得！[大哭][大哭][大哭]"
"霍天林","男","辽宁","1671387851","4","","10000","4","","有中文版，这下我也能唱这首歌了[给心心]"
"繁星零乱","保密","四川","49352672","5","","10000","4","","好，这下芙芙得到了她应有的待遇啦，开心[脱单doge]"
"永恒的雷电将军","男","广东","387628463","5","","10000","4","","水神一人独舞，对应了枫丹的“罪人舞步旋”，那后面纳塔的“炽烈的还魂诗”会是什么样子？,我盲猜一波纳塔火神：她自火中新生，她在火中微笑[滑稽]"
"嘎子哥哥","保密","湖北","3871729","6","","10000","4","","还得是胡大包的嗓子符合我对中文版的想象[喜欢][喜欢][喜欢][喜欢][喜欢][喜欢][喜欢][喜欢][喜欢][喜欢][喜欢][喜欢][喜欢][喜欢][喜欢]"
"梦雨萧尘","保密","广西","44103018","6","","10000","4","","终于在原神里听到一首中文歌了，上一次还是在《神女劈观》[墨镜]"
"赤いの豚","男","广东","247034646","6","","10000","4","","有没有大佬整个合唱[脱单doge][脱单doge]"
"shalland","保密","辽宁","192371","6","","10000","4","","好家伙我大芙芙牌面，一个传说任务插曲官方发了四个版本[笑哭][笑哭]"
"selldavid","保密","中国澳门","2329880","6","Kizuna AI","10000","4","","接下来还有日文版英文版韩文版[妙啊]"
"哦漏不虐","保密","天津","367858608","5","","10000","4","","？？？胡夏"
"玩偶巫师","男","上海","102857079","5","","10000","4","10","过完主线之后 再过传说任务 很难不泪目，芙宁娜你可以做自己了  尽情在舞台上表演吧"
"lqy半城","保密","安徽","241447661","6","洛天依8th生日纪念","10000","1321","","文本是临时改的，MV是看剧情火了临时录的[doge]"
"玖哲omo","保密","江苏","50283992","6","","10000","4","","woc 胡夏！突然想起来经典歌曲《那些年》[保卫萝卜_哭哭][保卫萝卜_哭哭]"
"等狗舔完面","男","陕西","527169","6","","10000","4","","唱得挺好，但是芙芙是女的味儿不太对[微笑]"
"武灵潇","保密","天津","5434988","6","","10000","4","","还有高手？"
"哦哈哟小学魈","女","江苏","13515221","6","异常生物","10000","5","","相思鸡柳酥那个你给我拱出去，眼酝酿好了泪水，嘴巴却在笑的喷口水"
"被风吹起的海浪","保密","江西","434299053","5","格兰芬多","10000","4","","第一眼:哟，二创[微笑],第二眼:？？？官方！！！[星星眼]"
"Metlab","保密","北京","601693","6","至尊戒","10000","4","6","不是说歌手唱的不好，但我想听到中文女声的版本，求求了这很重要[星瞳_呜呜]"
"兮如不屑","保密","广西","415260143","5","魔法学院","10000","4","","啊？！"
"旦旦旦宝","男","福建","49506479","5","","10000","4","","原宝！你就拿我的钱做这种事对不对！！！干得好啊你！！"
"哒哒哒哒大佬","保密","未知","650884544","5","","10000","4","","胡夏声音好好听哦[原神_哇][原神_哇][原神_哇]"
"科比QQ群","男","河北","662548730","5","","10000","4","","我只要一句话，就能让在座的各位全部生气圆圆的披萨"
"十六夜心叶","男","浙江","2305525","6","","10000","4","","[KAITO_哦吼]中文版听着像古偶插曲"
"小人物永不老_","保密","广西","456813061","5","","10000","4","","胡夏业务能力确实可以的[吃瓜]"
"神说圣经","保密","江苏","476750710","6","多多poi","10000","4","","好像是第一次原宝联合吧"
"末日兽绽放光芒","保密","广东","3546575240432129","2","","10000","4","","哦哦哦！这是？"
"去冰美式来点热","男","上海","7110093","3","","10000","19","","看到有人说胡夏小鲜肉... 胡夏出道13年 都34岁了还被说小鲜肉 我就当他们在说胡夏长得年轻吧[脱单doge]"
"霜翎鹤不染","保密","福建","2878479","6","","10000","3","","好好听啊，压抑的悲伤，听得眼泪流出来都没察觉[保卫萝卜_哭哭]"
"鹤羽嗣华","保密","浙江","456400035","5","","10000","3","","啊啊啊要龙堕了啊啊啊啊"
"泠点毋","女","山东","456950416","4","","10000","3","","感觉周深唱这个也不错诶"
"冠位摄影师咕哒子","保密","陕西","52585516","6","三周年恋曲","10000","3","","被刀死了啊啊啊啊啊，三个版本的不同感觉曲子，被刀晕了"
"啊咧咧XH","保密","广西","603261703","5","","10000","3","","王子唱得真好听[鼓掌]膝盖献上[跪了]"
"琐琐琐琐琐琐","男","甘肃","3033565","6","","10000","3","","中文版为什么不找谭维维唱[doge]"
"黎明前兆","男","海南","21939609","6","","10000","3","","作词：哈尼/项柳/三宝,不知道作词的这位三宝是不是知名作曲家三宝啊？我很喜欢他的《暗香》、《不见不散》、《我欲成仙》、《相思》[惊讶]"
"麋失鹿","保密","福建","66708240","5","崩坏：星穹铁道","10000","3","","谢谢原宝找到我喜欢的歌手"
"好久不见-取个名好难","保密","辽宁","476200123","5","喂，看见耳朵啦","10000","3","","音乐剧的老前辈三宝老师参与作词诶[保卫萝卜_哇]"
"鸿蒙至高","保密","四川","1163226038","4","","10000","3","","我希望傻芙芙能够获得属于自己的幸福。能为自己活一次。我这个玩家就满足了。[大哭]"
"Realme_Ely","女","陕西","1340026984","5","","10000","3","","快把剧情cg也端上来吧[鼓掌]"
"裂缝中的阳光Twilight","男","内蒙古","647422719","5","至尊戒","10000","3","","原神也开始整有词的歌了，什么时候请个林俊杰就双厨狂喜了"
"老喵内_","女","内蒙古","435123177","5","2021拜年纪活动专属","10000","3","11","非常好芙芙，使我的水元素充盈[墨镜]"
"呜游云巅","保密","江苏","46288482","6","","10000","3","","改成中文版更像电视剧主题曲了 好听的"
