"昵称","性别","IP","UID","等级","装扮","用户权重","获赞数","粉丝团等级","评论"
"聆听者不颂","男","无IP","354584452","5","","10000","1","","新号一直出迪奥娜，3命了都，有人可以告诉我一下迪奥娜应该怎么用吗[无语]"
"bili_334952668","男","无IP","334952668","6","烈焰之刃","10000","1","","50抽没有猫猫[大哭]"
"Koakok","保密","无IP","265994080","5","","10000","1","","好耶，前天单抽一发出"
"元霜专属小汤圆","男","无IP","283453153","5","","10000","1","","二命猫猫已出，感恩。"
"再给我多吃一口","保密","无IP","368142168","6","","10000","1","","二命猫猫混本神器[脱单doge]"
"剑光如闪电","男","无IP","135576976","6","","10000","1","","就让我出个猫猫吧 67抽一个没有啊[哭泣] 一个就好 0命就够用了"
"凯子喵喵喵","保密","无IP","341235664","5","","10000","1","","七夕快乐[脱单doge]"
"智商不糕","保密","无IP","392687355","6","国民老公带回家","10000","1","","kou no dio娜"
"贼帅的夏翎","女","无IP","81463751","6","魔法学院","10000","1","","终于有猫猫了"
"谨臾","女","无IP","4652497","6","崩坏：星穹铁道","10000","1","","猫猫六命啦，可爱猫猫嘿嘿"
"沉入水底的鱼罐头","保密","无IP","597173880","5","","10000","1","","没有替身差评[doge]"
"Qwasxd","女","无IP","258843364","6","不思议之旅","10000","1","","Dio娜yyds[原神_G嘿]"
"克拉拉的亲人","保密","无IP","225342540","6","","10000","1","10","猫猫满命了，血量堆到2w9了[崩坏3_路过]"
"叶尘vk","男","无IP","383002458","5","刺客伍六七","10000","1","","[滑稽]"
"彼女は惜しいと言った","女","无IP","671052000","5","咩栗","10000","1","6","艾琳不改叫艾琳娜？"
"星璃_鲁尼答","男","无IP","313144135","4","","10000","1","","这个的韩语相比别的韩语很优秀"
"闪电法杖","男","无IP","7331379","6","","10000","1","","猫猫真可爱"
"老佐影","保密","无IP","273433437","6","约战・狂三","10000","1","","抽钟离把猫猫抽满命了就离谱"
"松坂绿冲鸭","保密","无IP","349145577","5","","10000","1","","猫猫天下第一可爱!"
"Lin-海民","男","无IP","1620239085","5","","10000","1","","Wryyyyyyyyyyyyyyyyyyy！！！"
"厚实奥","男","无IP","2204287","6","","10000","1","","吮指原味姬[doge]"
"实况就离谱","男","无IP","382507170","5","","10000","1","","气化冷冻法[歪嘴]"
"该账号被永久封禁","保密","无IP","497969733","5","","10000","1","","角色升星单抽抽到的"
"苦瓜可爱","男","无IP","290558867","5","EveOneCat2","10000","1","","娜娜奇！！！好可爱[tv_吐血][tv_吐血]"
"Brisk清新","保密","无IP","288169284","5","三周年恋曲","10000","1","9","六命了，七七彻底成为仓管了[笑哭]"
"牛奶不加冰","保密","无IP","2797319","6","原神","10000","1","14","英语dio娜是真在休息，不是傲娇[原神_吃惊]"
"可汗世界第一可爱","保密","无IP","304756156","5","","10000","1","","许愿雷锤哥，出必满命"
"大大帅锅","保密","无IP","694516736","4","","10000","1","","迪奥娜能不能用绝弦啊"
"造子术","男","无IP","366871227","5","粉妆玉琢・头像框","10000","1","","两命猫带什么武器（四星）"
"梓川春","男","无IP","309580185","5","良辰美景・不问天","10000","1","","你们说迪奥娜和迪卢克[doge]"
"阿里嘎多呦吼","保密","无IP","167410370","6","","10000","1","12","BGM太上头了"
"R桑我的神","保密","无IP","3722999","6","","10000","1","7","送dio那喽"
"熊熊小先森","男","无IP","409550447","5","","10000","1","","加强刻晴！！！"
"芋泥芋泥_","保密","无IP","510395682","4","","10000","1","","这波韩配也太牛了"
"草梅友仁","男","无IP","10822025","6","原神","10000","1","","闲的无聊的时候仔细观察了下猫娘，她确实没有人类耳朵，也就是只有头上两个猫耳（虽然也有可能被头发挡住了）[吃瓜]"
"救扶三当家","男","无IP","13534212","6","","10000","1","","DIO，DA！"
"越谷こ小鞠","保密","无IP","38889800","6","","10000","1","","10次猫娘前来还怨[辣眼睛]"
"Thebladeofdeath","保密","无IP","32853911","6","","10000","1","","wryyyyyyyyyyyyy！[滑稽]"
"鲤鱼打挺的阿草","男","无IP","11998914","6","初音未来13周年","10000","1","","真可爱啊，红豆[doge]"
"唱唱反调--","女","无IP","627518595","5","EveOneCat2","10000","1","","七七和可莉又多一位伙伴，许愿许愿出了就在微信里还原，（怕太非了，抽到找不到这个视频）许愿许愿"
"账号已注销","保密","无IP","25020793","0","","5000","1","","动捕演员大伟哥[吃瓜]"
"蒜蓉粉丝青瓜辣酱","保密","无IP","4106032","6","","10000","1","","哇好可爱"
"新的Power","男","无IP","523129009","5","","10000","1","","吼吼，木卡k诺卡，科诺连者迪奥一起打"
"夜难寂","保密","无IP","454243152","6","萤舞沉眠","10000","1","","一命迪奥娜报道。"
"___やさしい___","保密","无IP","103952908","6","","10000","1","","魈池里我累计抽到了三次猫[笑哭]"
"平安蚓","保密","无IP","393683999","5","","10000","1","","魈池把迪奥娜抽满命了才发现，她好像是踮着脚的"
"ukpkmkk-_","男","无IP","10122495","6","HIME","10000","1","","英配也就只有钟离抓到了精髓"
"啊哎呀唉呀","男","无IP","352962416","5","","10000","1","10","ko no dio na da!"
"Twigbone","男","无IP","291075422","5","","10000","1","","莫名其妙单抽抽到这玩意了[笑哭]"
"南m籼m","男","无IP","85114097","6","拜年祭粉丝专鼠","10000","1","","六北斗一辛焱，猫猫就是不出[大哭]，我抽这个池子只为你啊"
"青山_琴叶","保密","无IP","11481827","6","沈剑心","10000","1","","许愿猫娘"
"下北泽无人区","男","无IP","670413255","4","","10000","1","","jo小鬼真恶心，吐了"
"乌鲁克麦酒","女","无IP","95893850","6","","10000","1","","宝贝儿来吧，要啥管够"
"车车每天都想翘班","男","无IP","130624218","6","","10000","1","","一定是上次忘记弹幕许愿了，到现在还没出猫猫猫猫你快来吧[保佑]"
"尸体在笑_","保密","无IP","510746635","5","","10000","1","","猫猫生日快乐[打call]"
"あいろり","保密","无IP","178109423","5","","10000","1","","猫猫生日快乐"
"英梨梨_粒粒","女","无IP","70887508","5","hanser","10000","1","","为什么总有nt讨论国配不如日配，日配不如国配我寻思自己喜欢什么就喜欢什么不要一踩一扬找存在感，好家伙我见一个举报加黑名单两件套[doge][hanser_小天使][hanser_小天使]"
"向小葵葵花宝典","男","无IP","361915362","5","","10000","1","","取名鬼才"
"雨痴yucii","男","无IP","74108863","6","言和7th生日纪念","10000","1","8","无论看多少遍都好可爱！ ！ ！ 好戳我！但是为什么我没抽到[大哭]4星就差迪奥娜了[委屈]"
"高出力Bardiche","女","无IP","85993676","6","明日方舟音律系列","10000","1","","再来看看我抽了70发都没出的角色…那个池子满命了凝光[笑哭]"
"萤麻了","保密","无IP","86942275","5","群星闪耀时天蝎座","10000","1","10","猫加dio可太草了"
"战术后仰jpg","女","无IP","457832161","4","","10000","1","","竟然无拾枝杂谈"
"我怕_勒芬妮`","保密","无IP","5150486","6","","10000","1","5","太可爱了[tv_大哭][tv_大哭][tv_大哭]"
"wrong-404","保密","无IP","249573704","5","","10000","1","","音乐不错"
"海拉鲁之剑","保密","无IP","171784339","6","崩坏：星穹铁道","10000","1","","我当初一下子出公子就没继续了，好后悔"
"六十五岁批老将","保密","无IP","34987835","6","","10000","1","","这个角色没什么培养的价值吧？"
"咖柚西","女","无IP","134349564","6","","10000","1","","日配太可爱啦，跳的时候还会nyanya的"
"超时空猫猫Yisui","女","无IP","475345659","5","","10000","1","","菲谢尔和迪奥娜如何选择？"
"雪j梅香","保密","无IP","232026647","5","原神","10000","1","","还不快去讨好杜拉夫[doge]"
"和洋_","女","无IP","1673981","5","","10000","1","","昨天普池抽到了，猫猫真的是打猎能手，我的肉不用愁了[喜极而泣][喜极而泣]"
"Raptort","男","无IP","698491990","4","","10000","1","","很好用的角色，有盾有回血，配合雷泽或者卢姥爷都可以"
"黄hjk凯","男","无IP","51604913","6","","10000","1","6","好小一只"
"Nclock","男","无IP","20843621","6","提摩西小队","10000","1","8","忍不住的伸出了罪恶的猪手[抠鼻][抠鼻][抠鼻]"
"柠檬树566","保密","无IP","344450036","5","","10000","1","","歪了。退坑出号。40级号，刻晴七七加魈毕业武器和噗鸳。刻晴带毕业武器匣里龙吟。赠月卡。有意者私聊。走平台微信都可。先看号"
"飘冷灬若霜","女","无IP","13878605","6","","10000","1","","迪奥娜已经满命，配合公子无限冰冻那是真的香[吃瓜][吃瓜]"
"DreamComet","保密","无IP","475831915","5","#EveOneCat!","10000","1","11","这边一位上次22发出可莉，这次21发dio娜凝光北斗全出的欧皇路过[doge],哦对了，上次提前许过愿，但这次没有，补一个感谢实现愿望[doge]"
"echocy29","女","无IP","10428025","6","#EveOneCat","10000","1","","啊，她的小靴子好可爱啊"
"165的十深","保密","无IP","111197335","6","hanser","10000","1","","你们真的抓了一只猫娘来动捕了？"
"kitosuuuu","男","无IP","16022406","6","还有醒着的么2.0头像框","10000","1","10","玛德公子抽到俩了，迪奥娜还没给我，到底谁才是五星，草[疑惑]"
"倒立蹬三轮","男","无IP","327251994","5","原神","10000","1","","童工？矿工[OK]"
"提瓦特头号大废物","保密","无IP","4278436","6","","10000","1","","4星PV的BGM变奏好带感。。。"
"竹纤儿","女","无IP","259465099","5","","10000","1","","抽了60次还没出dio娜，都要出公子了，不敢抽"
"@花时雨","女","无IP","16567083","6","还有醒着的么","10000","1","","能把毛子一杯灌倒 这是什么酒[辣眼睛]"
"天生凡骨YC","保密","无IP","31120415","6","异常生物","10000","1","","请问这个bgm有完整版吗？"
"-Dancing","保密","无IP","275983241","5","星座系列：处女座","10000","1","","感谢，出了七七[保佑]"
"衣郡","保密","无IP","592219221","5","","10000","1","","三个凝光了，望你耗子尾汁"
"生来是个笑话","男","无IP","2436958","6","","10000","1","","bgm交一下？"
"风史莱姆","保密","无IP","406479445","5","","10000","1","","我兄弟迪奥娜满宝了，什么时候老米给杜拉夫装神之眼，我想当他爹"
"烙印融合","男","无IP","355571677","5","","10000","1","","巴克那，这……这就是我在异世界的样子？"
"诸葛孔","男","无IP","535900708","4","鹿乃","10000","1","","猫掌柜？"
"雨糸","保密","无IP","34206185","6","天依游学记・歌行","10000","1","","猫萝莉太可爱了吧！太喜欢了！！"
"Mr绅士一枚","保密","无IP","319704675","5","","10000","1","","说真的，元神的音乐实在是太带感了，跪求乐名[妙啊]"
"大大怪nx","男","无IP","425585999","6","","10000","1","","迪奥和艾莉娜的私生女[doge][doge]"
"押鬼","女","无IP","309240","6","普通小狗・梦幻塔罗","10000","1","","qwq有没有猫耳男角色啊好想要猫耳男角色最好成男猫耳求求米哈游"
"梦幻光o","男","无IP","389492882","6","","10000","1","","这是我玩到世界6后 给官方的想法提议! 你们觉得如何呢? 一起讨论一下吧!,1.希望队伍中其他三位角色的冷却时间能显示看到(比如常常不知道香菱或七七等各种工具人的E (元素战技) 到底好了没而切过去后发现还没好又切回来白切... 很不方便) (尤其是0命公子的玩家),2.连线多人模式时 希望也能进行合成! 不然每次打完三次副本 就要退回单人世界去合那个""浓缩树脂"" 真的很麻烦,3.希望新增一个可以跳过五星角色开大的动画设定 不然平时只能透过卡物体开大 才能跳过动画,4.希望能自订切换队伍的快捷键. 不然每次更换队伍还得打开栏位 做切换 长久下来 真的很麻烦 很希望能设置按键直接切换,5.体力槽的恢复速度希望提升.. 上限就不奢求了(毕竟未来开放下去还会再提升) 但恢复速度真希望能随着等级跟着上去这样平时的游玩体验也会更佳良好更能留住玩家,6.希望角色的""命之座""可以透过勤奋爆肝解任务等等收集材料来兑换! 比如玩家一个月顶多只能换一次也好! 不要这样非得储值祈愿才能拿..这样会让大量的玩家因为自己喜欢的角色命之座提升不了而想退游. 所以为了能留住玩家我觉得命之座提升是很重要的事情. 当然我也知道贵公司要赚钱! 所以提出""有上限"" (比如1月1次或2月1次) 且实际上我身边就有几位已经拥有了4只以上的五星角色却依然退游. 就是因为命之座的关系.,我真心觉得要留住玩家 命之座真的不要吝啬. 吝到很多小课长都退了 这样你们反而损失 .."
"BF天下","男","无IP","6433566","6","-阿库娅","10000","1","","球球了，我出了三个凝光两个北斗一个公子，人物池抽出武器池的up也就算了，素材经验武器都备好了我什么时候能出迪奥娜[大哭]"
"ゴ`ゴ`幽`船","保密","无IP","280373208","6","","10000","1","11","怕不是把董事L拿硬兜[doge]"
"燃烧的洋葱君","男","无IP","26456018","6","","10000","1","","这剪辑看的太舒服了"
"Everlyn_","保密","无IP","46752146","6","","10000","1","","官方pv的剪辑真的太好了。。。给美工磕头"
"暗中观察人事部会长","保密","无IP","40648072","6","2233幻星集","10000","1","7","我就知道有人和我一样每天过来循环播放的[吃瓜]"
"ATG6","保密","无IP","269560963","6","多多poi","10000","1","","冰神：我把神之眼给你就是给你踢来踢去的？"
"Giguk2","男","无IP","188852984","5","2021拜年纪活动专属","10000","1","","[吃瓜]"
"甜田233","保密","无IP","342650773","6","崩坏3・天穹流星","10000","1","","好家伙抽公子歪出七七，我该说什么"
"一只很傻的乌鸦","女","无IP","41809845","5","原神","10000","1","","顺便一提，日配是异种族风俗娘里性转店的矮人[doge]"
"不要香菜不要葱kanLuoY","保密","无IP","394808218","5","","10000","1","","所以凯亚专心挖矿吧"
"少女折寿ing","男","无IP","367411534","6","原神","10000","1","","DIO哒！"
"蓬莱路人","男","无IP","410504393","5","","10000","1","","猫尾酒吧进不去啊！！！被迪卢克的酒吧压的死死的"
"感化猴子功德无量","保密","无IP","66769112","6","","10000","1","","杜拉夫不讲武德！我每天都在他那里买肉，已抽两发10连，连个猫猫影子都没看到。（痛苦面具）下次十连看不到他女儿，接他的任务，必把他的鸽子全宰了做下酒菜，以泄心头之恨！[大哭][大哭][大哭]"
"0狐狸笑笑0","男","无IP","3202234","6","至尊戒","10000","1","","150发，两个公子，三个凝光，五个北斗，三个迪奥娜，一个香菱，一个女仆，公子分别是在30发和50发出，凝光直到150发才出第三个。。。我不禁开始怀疑到底公子是五星还是凝光是五星[阴险]"
"痔疮税","男","无IP","487377330","4","","10000","1","","[doge]这类角色再这么搞下去整不好真被什么有关部门盯上"
"小鳄鱼赛跑","保密","无IP","26123414","6","","10000","1","","我抽的池子全出这个，俺吐辽"
"油小伞","保密","无IP","93567564","5","","10000","1","","歪了个公子"
"手动滑稽emmm大写","男","无IP","430005698","6","","10000","1","","我公子池出了三个弓臧？？？？？？我攒了好久的原石就这样没了？？？我迪奥那呢？？[大哭][大哭][大哭]"
"去北极旅游","保密","无IP","515645125","5","EveOneCat2","10000","1","","许愿DIO娜，出必还愿[doge][保佑]"
"Ari拾意","保密","无IP","485720323","4","","10000","1","","许愿猫娘"
"地狱小火苗","男","无IP","25599953","5","至尊戒","10000","1","","我发现了个问题，四星技能冷却都是5星的2-3倍！"
"害怕马猴烧酒","男","无IP","443413630","5","明日方舟","10000","1","","我感觉官方有人在暗箱操作我号"
"伊然爱莉雅","女","无IP","26297857","6","","10000","1","","公子的输出模式是依靠 元素战技给的断水BUFF打输出。,这里暂且抛开原神本身各个属性的优先级不表。,单说这次公子的命座提升就是米忽悠一个危险的信号,1命 公子战技-20% CD,4命 断流效果每4秒触发一次击中状态,6命 战技状态释放大招重置元素战技,公子角色开的头，就是，米忽悠制造了一个五星角色，然后，是个残废（PS：战技冷却长）。然后我在满命的时候把这个缺点直接移除（PS：6命重置战技），甚至还把1命的效果给吞了（PS：1命 战技CD-20%）,公子按照现在的命座提升来看，是米忽悠一次尝试，这很危险，米忽悠在试着把以后的角色拆分成2部分，只有满命座你才可以有完整的体感，哪怕你1命甚至4命，你都不如满命的完全体在游戏进行中有手感，减少战技CD，还是一个主靠战技CD打输出的五星角色的命座・・・,我不觉得米忽悠的策划是傻瓜，认为米忽悠是傻瓜的玩家才有病,卢姥爷满命强吗？ 强！当然强。提了攻击和攻速,七七满命复活 猛吗？ 猛！ 坑定猛！,可是，这俩人哪怕0命，你的游戏玩法是一样的，只是单纯的提升0命角色属性,而公子，他的命座不像是提升，或者说不仅仅是单纯的提升角色的数值，这他喵简直就是补缺。才补充一个本来就应该有完整输出循环和节奏的角色。,玩家应该有回馈，而不是装死或者往死氪。,这个口子开了以后，这个游戏就就会无比恶心。在氪金方面，现在想稳定捞个五星角色已经很贵了，如果还是个0命残缺体，有何游戏体验。"
"伯努利不会梦见洛必达","男","无IP","349144925","6","","10000","1","","配的太好了"
"雨诺域梦","男","无IP","501701524","5","公主连结可可萝","10000","1","","我和雷锤打架，雷锤欺负我破不了他盾，昨日我于诸葛亮说了这事，我说：诸葛亮大佐这个雷锤不讲武德欺负我没有迪奥娜，这好吗？诸葛亮答曰：这不好，我给皇军你个锦囊明日11点打开即可。今日11点我打开锦囊，里面有一个纸条，上面写了“皇军，我听说有一物叫做创世结晶石头需要648RMB。”我也不知道RMB是何物，如果有人有RMB请给我发648RMB，我让雷锤耗子为汁，好好反思，不要在耍这样的小聪明，小聪明嗷，谢谢大家！[滑稽]"
"桐可可u","女","无IP","481463374","3","","10000","1","","(｀ω)还记得你喝过多少杯调酒吗"
"月下の尘","保密","无IP","21240739","6","中野三玖","10000","1","","要不是这只猫娘，这个池子我是铁定不抽的[歪嘴]"
"妖异久存","男","无IP","316993556","6","原神","10000","1","7","是弓！！！[妙啊][妙啊][妙啊]，两个弓啊。我原石不够啊[笑哭][笑哭]"
"黑白虹","保密","无IP","2663548","6","","10000","1","","辣鸡公子别妨碍我抽猫娘[doge]"
"夏热冬冷春困秋乏","男","无IP","336926766","6","","10000","1","6","伸懒腰可太萌了[鼓掌]"
"比利的滑稽","保密","无IP","14131528","6","新科娘","10000","1","","这是第三个，还差一个就凑齐童子军了[妙啊]"
"偷偷下山","保密","无IP","111697372","6","","10000","1","","唉，无感。。。可是又强，纠结。。。"
"大君5563","保密","无IP","25548328","6","","10000","1","","bgm带感"
"如阳光如我","保密","无IP","357290643","5","EveOneCat2","10000","1","","这个bgm是啥？好想要。。"
"衍梦_刻芙菲莉斯","男","无IP","347860002","6","","10000","1","13","我，迪奥娜，懂？"
"苏古眸","男","无IP","66897625","6","洛天依8th生日纪念","10000","1","","前来许愿迪奥娜[小电视_笑]"
"54273-","保密","无IP","201158316","6","","10000","1","4","这怕不是真的抓了个猫娘来做动捕"
"约束之月","保密","无IP","183646693","5","","10000","1","","这个转场做的真厉害"
"未簌","男","无IP","411047084","5","","10000","1","","开服已经俩个池子了，一个温迪，一个可莉，我都闪过了啊（没出），按照氪金手游自然是点到为止。他公子池子搞偷袭，我大意了啊 ，没有闪，出货了[doge]按照mhy传统必然是点到为止，我大意了啊，公子，迪奥娜满命了。出货概率要以和为贵，谢谢朋友们[doge]"
"至佚名","保密","无IP","27837688","6","","10000","1","","在一个即将发工资的猫奴兽耳萝莉控面前发这个视频真的无法拒绝啊[笑哭]"
"不知名紫花-","保密","无IP","89643887","5","","10000","1","","又一个可以渡海的工具人[doge][妙啊]"
"DDSIBU","男","无IP","161273325","6","","10000","1","","我想抽雷锤，开盾可太帅了[doge]"
"白的空呐","男","无IP","244399983","5","","10000","1","","不抽"
"梦逍遥づ","男","无IP","97068576","6","2020拜年祭（鼠）","10000","1","","好家伙躲猫猫队有了[蛆音娘_卖萌]"
"独葬沙海","保密","无IP","90394266","6","约战・狂三","10000","1","","你可以永远相信米忽悠的美工和角色建模师，他是真的很懂你的xp"
"bansheeJF","保密","无IP","60354","6","","10000","1","","FBI! Open the door"
"卢娜来拿蓝","保密","无IP","486044297","5","","10000","1","","有一起玩的加好友，500228599，b服的"
"咕咕雷","男","无IP","91284035","6","碧蓝航线2020","10000","1","","快进到雷莹术士的猫耳同人[doge]"
"西门吹队友","男","无IP","436944921","5","","10000","1","","原神双十一氪金节即将到来[doge]"
"琴吹丶丶","保密","无IP","70981926","6","","10000","1","4","泷泽萝拉哒"
"苍色幻想QVQ","保密","无IP","22543046","6","-阿库娅","10000","1","","六命自带教官套效果，元素队必备～"
"衍梦_刻芙菲莉斯","男","无IP","347860002","6","","10000","1","13","我命中注定的角色到了！！！"
"玉の出","男","无IP","318199511","5","春原庄的管理人小姐","10000","1","","欺负我小猫的下场[妙啊]"
"缘缘不","男","无IP","58339987","6","初音未来13周年","10000","1","","要什么公子？要什么钟离？老子就要dio娜"
"qwequan110","男","无IP","11015682","6","","10000","1","","凯亚螺旋失业了[喜极而泣]"
"坞獍滋m","保密","无IP","210455","6","","10000","1","","第一次在原神中听到比较JAZZY的BGM，i了i了 。。期待加入更多JAZZ类的元素"
"他们一定会回来","男","无IP","30311933","6","","10000","1","","让我们欢迎菲律宾跳水队新进成员[doge]"
"惠嗲","男","无IP","651418452","5","","10000","1","","几杯猫尿就想灌醉我？起开！我自己来[妙啊][妙啊][妙啊][妙啊]"
"种花家福州兔","保密","无IP","40752983","6","","10000","1","7","许愿，出必还愿，我零氪党终于要破例氪一单了[保佑]"
"---千梦---","男","无IP","446241422","5","","10000","1","","女儿又加了一位"
"以实玛利_アナキズム","女","无IP","244359182","6","神SMea","10000","1","","气化冷冻法"
"第三军团指挥官","男","无IP","473751409","5","","10000","1","","配音演员是谁啊。。。是陶典吗。。。"
"ErnestiEcheva","保密","无IP","296466557","5","","10000","1","","这池子除了北斗我都要了[OK]"
"陌小哲","男","无IP","393086385","5","","10000","1","","是五星人物吗"
"}","男","无IP","26034265","6","","10000","1","","对不起，我有罪。我要保底了，为了不抽到公子。迪奥娜，以后的池子再见吧！"
"唯他零萌茶","保密","无IP","395444939","5","","10000","1","","你都不要公子真是太好了！他就是我的啦"
"松木松鼠","保密","无IP","195603846","6","","10000","1","","dio=不做人=吸血鬼=不是人,迪奥哪=有猫耳有猫尾=不是人,所以我们得出迪奥哪=dio[doge]"
"桶僵尸","男","无IP","281570918","6","#EveOneCat","10000","1","","懂了，这就去让凯亚挖矿"
"10534962780_bili","男","无IP","438304545","5","原神","10000","1","","新建的原神交流群希望大佬入内指导萌新876280852"
"迭卡拉庇安","女","无IP","299548198","6","","10000","1","","dio娜：刚才有个可莉问我dio老师发生甚么事了？我说怎么回事，给我发了几张截图，我一看，嗷，原来是昨天，有两个愚人众（）"
"一只传奇小狐狸","男","无IP","35944880","6","","10000","1","","所以免费送角色安排下[墨镜]"
"名字还没有想好2333333","保密","无IP","34156336","5","","10000","1","","角色越更越多......官漫和新地图还有新剧情就不能优先快些更吗"
"黎明夜铧","男","无IP","91561487","6","魔法学院","10000","1","5","我可莉都还没抽到呢，又来一个小可爱，心好累，都想要[大哭]"
"南北季风","保密","无IP","295037951","5","","10000","1","","ko no DIONA da[tv_目瞪口呆]"
"砾智的笙箫","男","无IP","27584578","6","","10000","1","","awsl"
"梦境使者-爱梅斯","女","无IP","35383633","6","斗破苍穹","10000","1","","有句话叫不患寡而患不均，看来策划的M没教给他，哦我忘了，策划没M，那没事了[偷笑]"
"一键压天南","男","无IP","479849152","5","","10000","1","","既然要玩，那就多叫点小伙伴来……"
