"昵称","性别","IP","UID","等级","装扮","用户权重","获赞数","粉丝团等级","评论"
"小n朝","男","河北","14969205","6","","10000","2","","有一起玩的人么 有群机器人 闲聊群⑨⑥③⑤⑤⑤④⑥①  或点击链接扫码加入 拒绝节奏者 欢迎吃瓜者[doge]  https://t.bilibili.com/656720303919988738?spm_id_from=333.999.0.0,[滑稽][滑稽][呲牙][呲牙][歪嘴][歪嘴]"
"-凌柒-","女","广东","363191062","5","","10000","2","","原宝啥时候出森林书的过场动画[大哭][大哭]"
"那梧桐","保密","江西","390951405","6","罗小黑战记","10000","36","","下次真的别搞线下联动了，某些逆天人被拍到网上真的败名声。。。。。"
"离鱼之歌","男","新疆","253096024","6","崩坏3・天穹流星","10000","2","","乌鲁木齐门都出不去[崩坏3_哭哭哭]"
"黄浩是我女神","女","广西","16988795","6","","10000","2","","笑死，我们这边直接选择关门"
"7chasing7","男","浙江","2628242","6","良辰美景・不问天","10000","2","","BV1NG4y167Y5  兄弟们顶我上去，这破手游都不装的，直接抄"
"逝の往昔","保密","广东","249586","6","","10000","2","","[吃瓜]笑死，别说线下联动，线上APP都废了"
"在下沐七","保密","新疆","1323177454","5","","10000","2","","新疆这边疫情封控着，能不能多整几天aaaa[大哭]"
"抗压吧务1","保密","江苏","15501258","6","恬豆","10000","9","","俺寻思这盘子也妹人要啊"
"82年の拉菲","男","浙江","176506470","6","","10000","2","11","小县城就是好，人不多[脱单doge][脱单doge]"
"末颜辰辰qwq","保密","江西","416025693","6","","10000","2","","又没吸收教训是吧"
"樱小路露娜与小仓朝日","男","广东","497613374","3","","10000","2","","深圳就7家，我去了三四家全封"
"@辘","保密","日本","288311139","6","","10000","2","","谢谢你，原宝，能联动下这边嘛[捂脸][喜极而泣]"
"Gun-鲧","女","美国","281148970","6","国民老公带回家","10000","2","10","@鹤川途归观枫红 [脱单doge]"
"挽风随行","男","福建","357131016","5","","10000","2","","小县城连必胜客都没有[笑哭]，和华莱士德克士什么联动直接买爆好吧[OK]"
"魈宝的青色挑染","女","河南","245061039","5","","10000","2","","这个联动，一言难尽[原神_嗯]"
"繁星不及你耀眼","保密","福建","1456641612","3","","10000","2","","这都联动了不应该把皮肤也安排一下吗?"
"Lulu龙天幕","保密","甘肃","31926543","6","","10000","2","","我这儿没有必胜客，你敢信？"
"夜末盛典","保密","上海","6355238","6","","10000","2","","这份原披套餐我要了[doge]"
"jj不够自律","男","陕西","437149500","5","斗破苍穹","10000","2","","鼠标垫想要尤。厂家二选一，这我能歪？"
"关于改名会中奖这件事","保密","山东","601760240","5","约战・白之女王","10000","2","","我森林书都做完了还没排到…哦哦人多暂停营业了啊[藏狐]"
"沐梦云烟","男","广东","383917994","5","","10000","2","","建议别再跟他们联动了捏[给心心]"
"daimao狸","女","四川","436730588","5","","10000","2","","upup，我关注你十年了，能不能把号给我玩玩[tv_大哭]"
"发你码的披风","女","四川","79552618","6","","10000","2","","安柏干嘛啊，不是说不能骑风史莱姆飞吗[doge]"
"节操lc","男","江苏","10268964","6","","10000","2","","现在压力给到了金拱门"
"再也不玩三国杀了","保密","浙江","538562378","4","","10000","2","","异世相遇，尽享美味[妙啊][妙啊][妙啊]"
"Rightful石子","男","广东","512944908","5","","10000","2","","笑了，小县城根本没有"
"桃子xr","女","河北","386388000","4","","10000","2","","原宝，直接发放总换码吧，排队给等到猴年马月啊..."
"赵一页页页儿","男","北京","435531914","5","hanser","10000","2","","店被封了，门口好多警察，场面一片混乱[热]"
"繁落奈何","保密","辽宁","268554393","6","","10000","2","","为什么我这里告诉我今天的告罄明天再来啊[保卫萝卜_哭哭]，不是不限量的吗？"
"城南往事_cn","女","黑龙江","283242055","6","碧蓝航线2020","10000","2","","兄弟们我问一下，拿到餐盘鼠标垫兑换码，是不是就能兑换了？那个限定是先拿到码先得还是先兑换邮寄先得啊？"
"慕介呀","男","四川","500646435","5","","10000","2","","你这是不是该提醒一下注意疫情防控啊[藏狐]好多人口罩都不戴"
"A哈哈咳咳","保密","陕西","310624223","6","","10000","2","11","明明店里有锚点已激活，为什么不能用[吃瓜]"
"白昼原月","男","浙江","1576903896","5","","10000","2","12","海报怎么保存？有推荐吗？有四张呐。"
"破碎的悠悠","保密","广东","1808342","6","","10000","2","","我只能说太难吃了[热]"
"小御坂Misaka","保密","广东","172786933","6","公主连结凯露","10000","2","","BV1nG4y167os"
"某手残的萌新小璐","女","陕西","5053981","6","","10000","2","9","这个手办能不能安排一下[脱单doge]"
"秋落银叶","女","天津","386093982","5","星尘","10000","2","11","就倍儿尴尬，我10点点的餐，周边的那个让我填地址兑换的那个东西，他一直没有给我发过来。我同学11点点的，一点那个兑换券就给他发过来了。包括那个游戏内礼包兑换码。我也是，到现在都没有。真的是服了呀。本来那个周边的鼠标垫它就限量，你说他现在这么墨迹，我到时候买了个89的双人餐，鼠标垫没有了可咋整"
"山竹夹心糖","女","山东","434099459","5","","10000","2","6","原宝你要不找别家联动吧[笑]"
"叶柠le","女","黑龙江","1380645440","4","","10000","2","7","原宝，冰草不反应是因为优和柯莱抢安柏吗[脸红]"
"空想丶妖梦","男","河北","87706628","6","","10000","2","","乐，隔壁原友四个安柏了，笑死，懂不懂单抽优(指饮料杯子）的含金量啊[张AiNi和老E_点赞][张AiNi和老E_点赞]"
"","保密","四川","356863898","5","","10000","4","","成都银泰因为没有报备，被举报聚众封店了[微笑]"
"林水炎","保密","湖南","302173953","5","","10000","2","","一边排队一边玩原神[doge]"
"七月金夏放河灯","保密","四川","475505413","5","","10000","2","","为什么双人餐只有一个兑换码呀？"
"是ZR不是zr","保密","北京","499055200","5","","10000","2","","人麻了，排了三个小时的队没排到，因为保安和排队的人争执被隔壁海底捞报了警，店关了[热]"
"久恙zy","保密","北京","484163380","4","","10000","2","","我拿到海报了，耶[脱单doge][脱单doge][脱单doge]"
"G嘿hhhhhhhhh","保密","陕西","1910634023","4","","10000","2","","这人太多了，应该再把海报那些的弄多点，不然这一千份几分钟都抢完了[吐]"
"一个新用户233","保密","广东","611143121","4","","10000","2","","老米啊，我们广州旗舰店活动直接被城管叫停了啊！[大哭]"
"拉叽橘子","保密","辽宁","691638536","5","","10000","2","","栓Q，我这边没有店[热]"
"某个人的遗物","男","河北","288573782","5","魔法学院","10000","2","","石家庄疫情啊[灵魂出窍]"
"终于攒够了改名硬币","保密","陕西","44032687","6","乃琳Queen","10000","2","","啥意思？买了两杯饮料，然后给我了两个普通杯子？？？？啥意思？？？50块钱我喝蜜雪冰城不香吗？？？喝你必胜客？？？？@必胜客中国"
"观view","保密","北京","321426004","5","原神","10000","2","","我10点点了一个，坏消息：那袋子放我这桌上，我一拿饮料直接摔了，杯子直接坏了   好消息：那个杯子给我拿错了，我选的优给我拿了个安博的             患有这玩意真的难吃啊[捂脸][原神_倒]"
"祝和丶","保密","河北","135215785","6","星座系列：天蝎座","10000","2","10","石家庄直接封小区了哪都去不了"
"@小路月缘","保密","北京","456239958","6","","10000","2","","北京工体被干停业了[大哭][大哭]"
"唐突trans-am人","保密","广东","948130","6","EveOneCat2","10000","2","4","怎么还和之前KFC一样体验极差………要不下次联动送角色皮肤好吗，感觉为了这么点东西还买不到的自己像个"
"l送消息","保密","中国台湾","1868097960","2","","10000","2","","@要做超久・・・辛苦了l的u作者[奋斗][奋斗][奋斗]"
"烧卷名姓罗","女","北京","434309948","6","","10000","2","","吃完了，等待兑换码[脱单doge][保卫萝卜_哇]"
"鱼仙是只猫","保密","四川","288753600","5","","10000","2","","可是披萨真的好难吃[2233娘_无言]"
"o印良犬","女","浙江","266688746","5","","10000","2","","吃撑了，，[崩坏3_lay了]"
"A3狐","女","江苏","2772749","6","#EveOneCat","10000","2","6","下次别再跟他家联动了，求求了~慢死了不说，根本点不到就店铺忙翻了请稍后再来，那么贵那么点东西坑死人了，不是联动根本不会买好吗，都不是之前没有盒子没有什么问题，是点都不让点了"
"大大泰泰","男","河南","86904585","5","12周年夏日狂欢","10000","2","","坐标南阳，11点去取的，里面就没几个人，两分钟就搞定带走了"
"-素咖喱","保密","山东","1810427741","4","","10000","2","","原神披萨，简称原披[doge]"
"率真的月球专家","保密","江苏","397434048","5","","10000","2","","点外卖配送一个小时，我真怕外卖员馋了给我外卖吃了[笑哭]"
"鹿鸣家的猫","男","福建","40152616","5","","10000","2","","BV1gL4y1z7dp我知道，你们需要这个，祭礼之舞[原神_哇][脱单doge]拿走，不谢"
"那就救救自己吧","男","山东","350195494","5","","10000","2","9","我靠那个蘑菇汤好难喝啊，还有还有，有些店好像夹带私货，套餐里放普通的披萨，不仔细看点了之后根本没有原神的披萨盒，还有哇，我兑换码怎么还没到啊？？？"
"七鸟Nanatori","男","上海","2071563157","4","崩坏：星穹铁道","10000","2","","笨蛋必胜客还没有吸取当初肯德基的教训吗[傲娇]"
"笙篪","男","天津","93802445","6","","10000","2","","我这里今天都没营业[热]"
"鱼于石中","女","甘肃","14191315","6","EveOneCat2","10000","2","","我以为人会多，结果去店里冷冷清清，就好像不是饭点一样[tv_笑哭]顺利拿到，现在正在吃[tv_可爱]"
"Kizuner_琉璃","男","广东","3124954","6","Kizuna AI","10000","2","","服了 早到的人赖着不出来 晚到的越排越久就是腾不出位置 现在连外带都没法外带"
"剑舞扬","男","江西","14096060","5","至尊戒","10000","2","","必胜之旅，前方拥堵[大笑][思考][再见]"
"喵冠ww","男","江苏","310846848","6","良辰美景・不问天","10000","2","","店给封了，我早上排的号直接作废。。"
"韦粕-","女","四川","548222529","5","三周年恋曲","10000","2","","【成都银泰の二次元教主-哔哩哔哩】 https://b23.tv/wh9WzNM"
"烛夜0327","保密","河北","1918749443","3","","10000","2","","旅行者：（站在店门口）各位朋友，听凭风引！！！（吸气）（呼气）（抬手）（踏步）（转圈）（小跳）（来到店员面前）风起必胜，应约而来！！,（眼神坚定）（抬头四十五度角）（叉腰）这个仇，我记下了[doge]"
"bili_3461","保密","江苏","3461562970933259","4","","10000","2","","宝，要不和沙县小吃联动[doge]"
"雾野尽","女","上海","381567700","5","仲夏幻想","10000","2","","排了三小时卖完了[未来有你_头晕晕]"
"四万二千年后的重逢","保密","辽宁","277922498","5","乙女音","10000","2","","给了我三个安柏杯子[热]"
"Frog之勇者成名录","保密","广东","409554236","5","","10000","2","","我6点到的门口，刚好遇上工作人员上班，然后让我们几个卡进去5楼门口了，然后后到的在1楼坐牢"
"啊哈你在摸鱼","保密","江苏","349550022","5","","10000","2","","南京龙江早上五点开始等，十点开店第一批进已经吃完了[脱单doge]"
"2713_","保密","天津","678250669","5","","10000","2","","呜呜呜，没有天津店，去不了了[热]"
"我永远喜欢东条希-","女","上海","532741503","5","","10000","2","","原宝，上海旗舰店排了老半天，越排越远，排了三个小时没号了[藏狐]"
"xy_233","保密","广东","408039548","5","","10000","2","","店给封了[热]，我排的还是第二[辣眼睛]"
"不会画画的冷凝","保密","上海","399774323","5","","10000","2","","救救孩子吧，跑了三家店，全关了"
"双子_艾彼","男","辽宁","652058223","5","","10000","2","","为什么我的兑换码没有收到[热]"
"陆兔兔Haruka","保密","广东","1793930","6","原神","10000","2","","《大厨已下班，餐厅已停止接单》[辣眼睛]"
"透明の芝士","男","河北","281716213","5","","10000","2","","在必胜客玩崩坏3，这何尝不是一种ntr呢[脱单doge][脱单doge]"
"月朝歌","女","四川","9983636","6","","10000","2","7","我无语了啊原宝，我好不容易吃上了餐，工作人员告诉我不点外卖没有鼠标垫……,那我为什么抢一个明显更贵的89元套餐啊？还顶着大热天出门[大哭]"
"玄子空","保密","吉林","275961498","5","","10000","2","8","鼠标垫是快递到外卖地址吗xdm"
"叁h柒_","保密","陕西","402234094","6","","10000","2","","https://b23.tv/BV1jg411Q7KT [崩坏3・光辉矢愿_彩虹水枪]"
"偌陌Romo","保密","湖北","91530391","6","#EveOneCat","10000","2","","很抱歉，目前餐厅忙翻了，暂无法接单，请稍后再试。"
"昼夜颠倒的喵喵","男","北京","168834442","5","","10000","2","","北京主题店基本上都炸了"
"DragonSlave","保密","新疆","277121","6","","10000","2","","原披[doge]"
"第三军团指挥官","男","法国","473751409","5","","10000","2","","羡慕在国内好歹还有机会排队。。。我连排队的机会都没有[大哭]"
"是百万不是百大","保密","新疆","440507267","5","","10000","2","","新疆疫情去不了的来集合[无语]"
"pabutha","保密","广东","430192768","5","一周年纪念装扮","10000","2","","我们这里没什么人无聊死了[热][热]"
"嶙鳞麟琳","男","河北","372640469","5","EveOneCat2","10000","2","","石家庄封城了买不了[Cat2_Boom!]"
"埚ぁ","女","北京","17826845","6","","10000","2","11","主题店好多都关了！就应该搞预约制啊！"
"紫墨幽","保密","浙江","12253274","6","异常生物","10000","2","","套餐售罄了，原宝[热]"
"MDTFDP","男","江苏","15621593","6","","10000","2","","刚吃完，嗝"
"歌言~","女","广东","651873954","5","","10000","2","","深圳大芬店已经爆满了[笑哭]"
"小熊Yuuki","保密","湖北","85327694","6","","10000","2","","谢邀，武汉疫情，大学封校[辣眼睛]烦人"
"walker星宇","男","上海","1408361016","4","","10000","2","","还记得氪卿社死吗"
"我有个问题丶","男","重庆","302262456","6","","10000","2","","哈哈哈哈"
"爱贴贴的网友泥头车","男","广东","31239959","6","","10000","11","","大力度哥们就喜欢看乐子。"
"铭记堕落之时","男","广东","7281318","6","2021拜年纪","10000","16","","皱皮团建又来了[热]"
"不爱吃番茄的帆帆","男","上海","526292792","5","","10000","3","","我就想出个兑换码回个血，怎么就被举报了[热]"
"茗Augety","男","江西","32936164","6","EveOneCat2","10000","3","11","看评论区感觉必胜客人很多，所以说，过一周后去会不会好一点[来古-呆滞]，准备下周六去"
"小露9","男","云南","700861783","5","","10000","3","","我就想问一个12加的游戏，为什么解谜弄得这么难？"
"阿雨很悲伤","保密","四川","1760209702","3","","10000","3","","要是可以的话我希望周年庆是30个粉球，一个风之翼，一个4星自选，一把4星武器，20个翠弱树脂，官方你看可以吗？[脱单doge]"
"蒙古五排上单","男","四川","400580756","5","","10000","3","","都有前车之鉴了，怎么还搞成这样[疑惑]"
"羊汁菌","男","广东","430818976","5","","10000","2","","七点半就去排，十点半开始叫号，人挤人，广州华标店直接关门了[大哭]原宝你没有心[酸了]"
"同葬无光之愿","保密","山东","291202418","6","","10000","3","","能不能下次别联动这种实体店，大家玩游戏又不是不能上网"
"六十五万个小时后","保密","河南","34407480","6","","10000","5","10","联动的很好，下次别找必胜客了OK？难吃不说，搞预售不通知，等我知道了只剩下69套餐，玩呢"
"伊蕾娜v","保密","广东","1379429603","4","","10000","12","","怎么开学了人少了这么多"
"每天健身学习热爱生活","保密","广东","697114891","5","","10000","5","","原神×必胜客 必胜邀约，领取原石 https://www.bilibili.com/audio/au2698891"
"ミク_","保密","广东","34402260","6","星座系列：天蝎座","10000","3","","我看到了丧尸围城"
"草莓战宝指定驾驶员","保密","浙江","88507700","6","","10000","10","","你说得对，但是玩游戏不玩...........忘了"
"刃兄绷不住了","男","浙江","279286275","5","","10000","2","","合作都不知道多备点，必胜客真是！"
"空酱全肯定bot","男","广东","5647743","6","","10000","21","","有一说一，要是原真因为线下小部分nt行为和必胜客的nt操作被查了，米的版号接下来大概要不好过了吧[捂脸][捂脸]明天的各位收敛点吧"
"沽酒剑客","保密","上海","502599665","5","","10000","1","","[tv_大佬][tv_大佬]大学生代买必胜客联动卡，可代吃"
"Jantelsama_","男","宁夏","488263066","5","2233十一周年纪念","10000","1","","考古"
"玻璃天使心","保密","广西","126752525","6","","10000","1","","你倒是出这两个可动手办啊"
"黄大邪","保密","中国香港","245547513","5","","10000","1","","在？妮露专武外观改一下[原神_哼]实在不行跟四星互换模也可"
"无人雪中漫步","保密","山西","377930774","6","刺客伍六七","10000","1","11","没有拿到联动包装[热][热][热]"
"少林核桃酥","保密","广东","88286443","6","提摩西小队","10000","1","","直接上淘宝了，小县城没有必胜客[笑哭]"
"暮蓝_Morlan","男","上海","22896257","5","梦100","10000","1","","I已吃上，很好看~潮玩yyds[原神_G嘿][原神_哇]"
"原神代肝-阿毛鸭","女","安徽","88798746","5","","10000","1","","告诉我这次需要喊什么[脱单doge][脱单doge]"
"十二月的草","女","辽宁","504372885","5","","10000","1","","@阿凝呆呆 已下单[脱单doge]"
"夏目虚空破颜拳","女","广东","30043711","6","天官赐福动画","10000","1","","好可爱啊啊啊啊啊啊"
"属于的世界","保密","吉林","298991821","6","","10000","1","","我要这个粘土小人[打call]"
"这不叫怂叫从心","男","河北","505692782","5","","10000","1","","笑死，小城市没有[保卫萝卜_哭哭]"
"潜水猴","保密","新疆","10007203","6","崩坏：星穹铁道","10000","1","11","这俩小人儿也太可爱了吧！"
"悠然ouo","女","江苏","154177745","6","","10000","1","","我的码呢 过24h了都[跪了]"
"御坂11848","女","福建","395156738","5","星座系列：水瓶座","10000","1","","我着这里没开啊"
"今天想吃炒米粉","保密","山东","11846407","6","","10000","1","","那个，有没有中餐，想要魈的周边_(:з」∠)_"
"星火映渊","男","新疆","600004959","5","","10000","1","","啥？联动？好耶！,哦，我疫情在家出不去，那没事了[热]"
"1米5真君","男","福建","677907626","5","","10000","1","","拍照活动有bug啊！，死活拍不到攻击"
"猫宫双奈","保密","湖北","671311017","4","","10000","1","","明天去捧个场[星星眼][点赞]"
"二十七画工","男","北京","350620870","6","","10000","1","8","原宝，出个兰那罗图鉴吧[难过][难过][难过]"
"你是不是怂了","保密","甘肃","1601813748","2","","10000","1","","额⊙⊙！"
"虚季大人","男","黑龙江","398113902","5","","10000","1","","问一下，这次联动有活动道具吗？"
"W","男","湖北","381576803","5","","10000","1","","加强小保底！！！"
"诗琴悠雨","男","山西","11217162","5","","10000","1","","我想问问官方，想玩这款游戏买那款手机最好。求官方推荐哈。"
"无糖_可","保密","福建","382186316","5","","10000","1","","昨天排队八小时吃到了[委屈][委屈]"
"那梧桐","保密","江西","390951405","6","罗小黑战记","10000","38","","有些逆天是离谱，但当年edg夺冠的时候不一样一堆逆天作妖，那时怎么没见到有人aoe全体玩家呢？"
"诚服是你","女","海南","402433376","4","","10000","1","","什么时候出美食系列的尘歌壶摆件[脱单doge]"
"无神论者小蓝","男","广西","23876427","6","良辰美景・不问天","10000","1","","已经结束了！"
"灼风归潮","男","四川","400173284","5","","10000","1","","成都在哪里啊，想去"
"行走的餐桌球","男","内蒙古","441783470","5","","10000","1","","《关于我们家这里没有必胜客，又一次错过联动系列》"
"sherly山","保密","四川","2106954836","5","","10000","1","","原宝出个大电影吧，最近的都是些啥玩意儿啊[生病]"
"哦我都觉得就到家","保密","山西","690148712","3","","10000","1","","活不过来了直接把我挤成高血压抬医院去了现在还挂着点滴[大哭]"
"小朱嘞","男","福建","535260347","5","","10000","1","","兄弟们，我兑换码被吞了，看我视频[大哭]"
"永恒绿洲","女","山东","543268216","5","","10000","1","","能不能联动点一般人吃的起的[热][热]"
"朝歌揽月三鲜轴","保密","安徽","356776341","6","良辰美景・不问天","10000","1","","恒兰那兰的背景音乐有吗？"
"weeeal","保密","海南","691143372","5","","10000","1","","现在我这里的疫情真的气人[大哭]"
"熬夜的孩子有视频看","男","河北","1531666313","5","2233幻星集","10000","1","","我想问一下各位，你们谁跟我一样，玩到后面掉帧卡的，以前玩的时候就没有试过，手机配置不行吗？还是要求越来越高了？？（米游社看到相同的类似过来的）[笑哭]"
"昔应","保密","江苏","354477212","5","","10000","1","","我的怨种朋友买了八杯，一个安柏三个优，其余的没有包装[原神_喝茶]"
"爱丽丝梦梦啊","保密","北京","624497400","4","","10000","1","","什么时候移动端可以适配一下键鼠呀_(偶像姬-大声bb)"
"猿尊","保密","安徽","592592867","2","","10000","1","","异世相遇"
"BBB乙","男","四川","1162246509","4","","10000","1","","米哈游加强刻晴"
"爱吃猫的秋刀鱼哇","女","福建","355408481","5","","10000","1","","小县城里多得是 就是没有海报[热]"
"是泠绫酱丫","女","河北","289004271","6","洛天依8th生日纪念","10000","1","","我这里没有安柏的盒子[原神_哼][原神_哼][原神_哼]"
"一拳13个陈平安","保密","湖南","1091165324","3","","10000","1","","建议直接现场抽卡出金才能买，有效减少黄牛，增加流水[脱单doge][脱单doge]"
"Qw鹰","男","广西","289970112","5","","10000","1","","求你们了出把枪吧，愚人众那边都有了"
"Livety格子酱","保密","河北","527064825","5","","10000","1","","哭啦[大哭]石家庄有疫情全封了"
"爱饮咖啡纠孤乐","保密","广东","415285455","5","","10000","1","","能不能别限量，旗舰店因为人数太多导致关店了"
"小伙别闹撒","保密","新疆","520017281","5","","10000","12","","太可笑了，连tm盘子都不放过[呲牙]"
"若凌动漫","女","陕西","583652552","5","","10000","1","","我拉了一个冤种的朋友他是来蹭饭的结果他硬生生等了三个小时进店的那一刻，仿佛得到了救赎。幸运的是交到了不少朋友。,其实排队的时候有一个大哥。喊的贼大声的口号。我虽然好了，但没他大呀。还有一大群人一起起哄喊着抽钟离，抽钟离。"
"多来点可以吗","男","广东","186599070","6","","10000","1","","使用了双人餐只给了我一个兑换码[笑哭]"
"得过不得","保密","湖南","26033148","6","我是江小白","10000","1","","24小时了我还没看到必胜客的 任何一个兑换码。客服还排队排不到。我真的醉了"
"Prensen","男","辽宁","396620608","6","","10000","1","","啥时候发兑换码捏"
"Arashiの","女","江苏","20105595","6","","10000","1","","想要安柏同款头盔啊"
"雷电将军的狗呜","保密","山东","1172158906","3","","10000","1","","米哈游加强和璞鸢[大哭][大哭]暴击率调高一点，实在刷不出来，爆伤头，而且还没有暴击率"
"若小离有亿点皮","保密","广东","488695821","5","","10000","1","","深圳的直接不让进，一堆人都被赶走了[热][微笑]"
"送你一根草","女","河北","504619346","5","","10000","1","","问问套餐多少钱"
"OurPlay游戏姬","保密","上海","298666123","5","公主连结可可萝","10000","1","","好耶！"
"微风-之恋","男","浙江","472273338","5","洛天依8th生日纪念","10000","1","","鼠标垫什么时候发货啊[热]"
"芝麻的鱼罐头","女","重庆","381610981","5","","10000","1","","定格动画好厉害！原宝我爱你啊！虽然因为疫情暂时还吃不到[原神_喝茶][原神_喝茶][原神_喝茶]"
"她闻起来真好","保密","北京","65475966","4","","10000","1","","异世相遇，尽享美味"
