"昵称","性别","IP","UID","等级","装扮","用户权重","获赞数","粉丝团等级","评论"
"高坂垌乃","保密","无IP","89239186","6","新月冰冰","10000","0","","好纠结，我现在垫了70发大保底，是抽公子还是等胡桃？如果抽了公子，胡桃没法一命了（还可以冲冲护摩），但一命换公子又觉得亏"
"Anonymous274","保密","无IP","271027682","5","初音未来13周年","10000","0","","哇靠，还要等一个月才胡桃up"
"Dr-漆黑烈焰使","保密","无IP","386436753","5","","10000","0","","这个狗真的是恶心，强行削弱钟离，我攒原石等钟离你给我整这个？他妈的离谱[阴险]"
"G尔布特","保密","无IP","527441062","4","","10000","0","","@原神 请加强心海，给她暴击的机会，蟹蟹。"
"Dark_Powerless","男","无IP","44608388","6","","10000","0","","原世界没有解密！"
"秋豆麻袋鼠","男","无IP","9228293","6","异常生物","10000","0","","还有音游了"
"YeMingLon","保密","无IP","412810770","5","","10000","0","","大家想想，如果把公子换成双神会怎么样？[doge]"
"猴子叫猪","男","无IP","23266300","5","","10000","0","","给我up个雷神也行啊……"
"风行言论","保密","无IP","1858342527","5","","10000","0","","艾落依还给吗"
"刻俄柏の蜜饼","保密","无IP","457909376","5","","10000","0","","堂主没剧情 呜呜呜"
"洛零-ロリン","保密","无IP","280729802","4","","10000","0","","到时至冬又up一次公子"
"鸠野咕","女","无IP","10903836","6","#EveOneCat","10000","0","","原宝，那个音乐会视频...（搓手手）"
"只想要有你的明天","保密","无IP","393376811","5","","10000","0","","长草期来咯"
"游于三辅","保密","无IP","520517145","5","","10000","0","","都喷池子，没人喷怪的吗？,这怪就突出一个恶心，前排站场盾没用就算了，全队扣血？？,盲猜温迪还吸不动，你干脆给怪加个没次攻击即死判定算了，省的大家都麻烦"
"拣起朝露","男","无IP","345162070","5","2233白色情人节","10000","0","","[妙啊]"
"药丸狮","男","无IP","434923411","5","","10000","0","","没有魔神任务吗"
"limjsta","保密","无IP","383030917","5","明日方舟音律系列","10000","0","","为什么我老是觉得这是国际新闻……[原神_嗯]"
"艾斯德斯大人的忠仆","保密","无IP","545967331","5","中野三玖","10000","0","","谢谢你米哈游，让我有时间给甘雨攒大保底"
"行默游","保密","无IP","100813575","6","橘猫挂件","10000","0","","官方从头到尾都没有认可内鬼的爆料，内鬼到底是真的内鬼还是来带节奏的，希望大家都能有一定的认识。而且不要因为听信了内鬼的爆料，结果官方给出的消息跟内鬼不一样就喷官方，这是在本末倒置。最后，希望原神能越来越好，一周年快乐。"
"秋豆麻袋鼠","男","无IP","9228293","6","异常生物","10000","0","","好的，穿盾攻击腐蚀攻击都来了[脱单doge]"
"歪比日日日","女","无IP","96954935","6","明日方舟","10000","0","","xdm问个配队问题，宵宫雷神托马行秋配一队可行吗？现在盾奶位用的是猫猫，托马有盾正好也能凑双火，奶就只靠行秋的雨帘剑了，这样可行否？"
"健菌","保密","无IP","8005571","6","良辰美景・不问天","10000","0","","我想要岩王爷[喜极而泣]"
"你的咪么","男","无IP","42244607","5","","10000","0","","反正复刻谁都有人欢喜有人愁，复刻公子我喜了!开心可以拥有公子了"
"O泡鉴赏家","男","无IP","38908242","6","","10000","0","","萌新想问，公子和胡桃怎么选[脱单doge]"
"浮橘间","女","无IP","12309207","6","崩坏：星穹铁道","10000","0","","是攒原石版本！后面都没什么想要的，已经开始馋须须弥的狗勾了"
"云是半山聚","保密","无IP","358077415","5","","10000","0","","[原神_哇]这次我一定要抽到公子！"
"最后的铁盒","男","无IP","192038355","5","","10000","0","","三别冬都了属于是"
"卢咔咔咔","保密","无IP","66874100","6","","10000","0","","托马进哪个池啊，复刻的两个都不喜欢，只想要托马，大保底估计要没了"
"追逐繁星的人啊","保密","无IP","401658156","6","","10000","0","","你塞常驻得了能不能别整up池？"
"账号忘了可还行","保密","无IP","503477967","4","","10000","0","","新人月卡党(玩了25天)求教各位大佬，达达利亚和胡桃哪个打怪厉害啊？非xp，硬要说的话就喜欢一个甘雨吧。目前攒了不少原石了，所以该选哪个好啊？嗯，要打本伤害高些"
"凌魂舞","男","无IP","388287207","5","","10000","0","","我刚开尘歌壶你就出新场景[呆]"
"慕老半仙","男","无IP","85342888","6","三周年恋曲","10000","0","","公子这次搞个一命，我受够零命了"
"凤某人不是凤狗人","保密","无IP","52700731","6","原神","10000","0","","没时间看完，有吊大的知道先复刻公子还是先复刻胡桃啊。[藏狐]"
"药丸狮","男","无IP","434923411","5","","10000","0","","主线有吗"
"~懿懿","女","无IP","6349495","6","明日方舟","10000","0","","好耶，等胡桃和护摩"
"我是臭猫大王","男","无IP","108043101","5","","10000","0","","麻麻的"
"o法李姐","男","无IP","10788069","5","","10000","0","","我想问下我60发出了雷军后20发心海池出了莫娜那我接下去抽到90直接可以算大保底公子嘛？"
"冰心一弦雪","女","无IP","92442488","6","崩坏：星穹铁道","10000","0","13","完蛋我好纠结啊，我又想给公子一命，又想要托马，又很需要护摩，绝了我钱包都憋了也做不到啊[大哭]"
"飞上白云喝可乐","保密","无IP","10135120","6","","10000","0","","狗ch"
"摩卡烧酒","保密","无IP","253102921","5","","10000","0","","我公子和胡桃都有，所以托马只能等下次了[笑哭]"
"被一眼看穿的硝子同学","保密","无IP","14454380","6","","10000","0","","爹，送朵花[doge]"
"心中的幻想乡","保密","无IP","64669399","6","","10000","0","","好歹轮着来一遍吧，或者开个自选"
"四月一日の君","女","无IP","1596964","6","","10000","0","","目前托马没有戳中我xp，不知道个人剧情咋样，毕竟公子个人剧情之前我也没想抽他的[笑哭]"
"唯意不绝","保密","无IP","1515232159","5","","10000","0","","一个传说任务完全白了，真.."
"阿马泰苏","男","无IP","929836","6","","10000","0","","班尼特和行秋up都抽不到，都是商店换的，有点搞啊。"
"北不见冥山","保密","无IP","138796089","6","","10000","0","","真的是留学狗，我淦，被那个up说中了。"
"周蜍","保密","无IP","497569166","5","","10000","0","","削弱帝君3c统治力，现在胡桃烧血最狠的出来捞钱了[傲娇]，帝君主要强在跟3c配对联动打的好，单拿出来跟雷神综合其实强不了多少，在一下现在深渊都是竞速，我腐蚀怪放深渊了你说你o命帝君带不带奶吧[傲娇]"
"彼方的守望_","女","无IP","106413406","6","","10000","0","","新怪物也太帅了吧[星星眼]"
"折耳猫恰凤梨","男","无IP","491866635","5","","10000","0","","不知道你们信不信，我到现在辛焱都没有抽到过，北斗也是[藏狐][藏狐]"
"横滨掌管茶泡饭的神","保密","无IP","379965582","5","","10000","0","","我的648已经为鸭准备好了，老婆快来"
"神州钢板PLUS","保密","无IP","1489839443","5","","10000","0","","托马(4星),托马(6星)√"
"德梅乌亚","男","无IP","2557404","6","EDG战队","10000","0","","有说武器池复刻呼摩嘛[吃瓜]"
"迷失的音符","保密","无IP","5851357","6","","10000","0","","雷蛇鼠标垫不是应该搞个雷神的么？"
"S坭丶丶","保密","无IP","104182111","6","","10000","0","","没有公子传说任务?"
"镜流へ","保密","无IP","275627720","5","少女前线","10000","0","","看了个弹幕，,预测个鬼啊，人内鬼早就爆料了,合着内鬼是你祖上了是吧"
"不二的哈哈奇","男","无IP","108495977","6","Kizuna AI","10000","0","11","海底为什么还不开？？？这个也要和层岩一样嘛？[大哭]"
"鸭鸭请务必嫁给我","女","无IP","401021736","4","","10000","0","","我想问下2.2有主线剧情吗，之前不是传疯了散兵把公子刀了吗"
"孤鸿云影","保密","无IP","164935181","5","","10000","0","","达达鸭复刻了！！！捏妈，我好开心，我还以为至少要等到明年了啊啊啊啊啊啊啊啊啊啊啊啊啊啊啊这波是我心想事成了woc我梦都不敢这么做米哈游你太行了，爱你"
"那份感情绝无半分虚假","保密","无IP","527275952","5","","10000","0","","活动我都知道了，所以武器池是什么？"
"北默默呀","女","无IP","552124214","5","","10000","0","","原宝~什么时候出个交易功能~"
"老咸咸鱼","男","无IP","34293100","6","","10000","0","","ns版原神有消息了吗"
"Pisces钟幻城","男","无IP","470155840","2","","10000","0","","别喊公子弱了，玩具销售员和达达利亚关公子什么事？[doge]"
"北_-","男","无IP","26243932","5","圣诞节快乐","10000","0","","可以攒一个多月石头碰碰胡桃专武，非常奈斯"
"CuSO4无机化合物","女","无IP","86595953","6","","10000","0","","？不复刻，那你放常驻行不行，真无语。"
"Sakura离珞","女","无IP","282807161","5","","10000","0","","为啥我被删评了[请吃红小豆吧！_哭唧唧]，我只想问一下抽公子还是胡桃而已，[请吃红小豆吧！_哭唧唧][请吃红小豆吧！_哭唧唧][请吃红小豆吧！_哭唧唧]"
"记忆の微凉","女","无IP","59500267","6","","10000","0","","希望你剧情好好做[藏狐]还有邀约 不要天天散步了[藏狐]"
"Molwey","保密","无IP","99798159","5","","10000","0","","你以为出流血狗就能提升心海的使用体验，却从来没想过玩家不用心海不是因为用不到治疗，而是心海的机制根本没法满足玩家的治疗需求。固定的幻海月范围小且边界模糊，大招乱添效果而显得不伦不类...你不仅搁置这些问题，连玩家的建议你也置之不理甚至进行打压。从不要求心海成为什么t0角色，但起码机制要合理且方便，幻海月的跟随治疗既不影响数值，也不会打破平衡，真的希望策划能平心静气的考虑下玩家们的合理需求"
"临风听暮蝉cc","男","无IP","335848578","5","","10000","0","","2.2会开新剧情吗"
"二代目蕾影","男","无IP","39483153","6","EveOneCat2","10000","0","","线下音乐会购票链接有吗原宝[傲娇]"
"可叹an","保密","无IP","493773229","5","三周年恋曲","10000","0","","许愿胡桃，出必还愿……,这次我一定能白嫖到胡桃，[大哭]"
"残g","保密","无IP","282028576","5","","10000","0","","总之这是个摸鱼的版本[妙啊]"
"G尔布特","保密","无IP","527441062","4","","10000","0","","NICE"
"我的Clannad","男","无IP","43571905","6","","10000","0","","攒石头，又是难过的两个版本"
"是令色鬼","保密","无IP","36197606","6","","10000","0","","在，3000的sc为什么秒删？"
"落花浮午盏","保密","无IP","241746384","5","","10000","0","","希望这把五星弓可以比飞雷天空上限稍高一点吧（仅对公子），毕竟外观很合适"
"您的昵称包含特殊字符","保密","无IP","523951671","5","","10000","0","10","40级神樱树有亿点难（懒得肝图"
"平平无奇の唐某人","保密","无IP","244223684","5","","10000","0","","【HS8HXMCR6A46】"
"木下明泽","男","无IP","11394048","6","","10000","0","","策划关键时候又拉了，要我绝对把达先生和托马放一起，榨干公子最后一滴，让从万叶以后都是女角色而压抑了很久的集美们这次想不扣都不行"
"MYNEKRUFTE","保密","无IP","1655462721","4","","10000","0","","我在想为什么我今天早上脑子一热把4800变成了0而且只换来一个北斗和一个冰枪还有一大堆武器"
"YATOKAMUYI","女","无IP","5317460","6","","10000","0","","uu们，目前我有个零命公子，想问问零命胡桃咋样，我是抽一命公子减点cd呢（我确实有点需要减这两三秒，但不是必须，但有时确实就卡两三秒）还是抽个零命胡桃呢，但不知道零命胡桃咋样（不打算抽护魔）主要是想要托马。。。"
"宗Z","男","无IP","436596203","5","","10000","0","","gch"
"苹果翁","男","无IP","107712728","5","","10000","0","","式大将不歪，玩到关服[tv_doge]"
"账号已注销","保密","无IP","1911065057","0","乃琳Queen","5000","0","","看评论区PVP[原神_躺平]"
"标准输入流","保密","无IP","197454996","5","","10000","0","","有没有大佬指个路，音乐会有没有重播，直播没赶上哭了"
"起什么名字好呢e","女","无IP","408814415","5","","10000","0","","我泪目了，攒了80抽了，还有10发大保底,就是为了魈，雷神池都没抽，但我现在又很想抽胡桃和托马[原神_喝茶]"
"梦想一心_","男","无IP","225057522","6","星座系列：水瓶座","10000","0","","诸君有谁有多对肝吗，借我用用[doge][doge][doge]"
"是令色鬼","保密","无IP","36197606","6","","10000","0","","3000的sc为什么秒删？"
"平平无奇の唐某人","保密","无IP","244223684","5","","10000","0","","【SAQHWLVRPTPS】 "
"大MAO90","男","无IP","65703880","5","","10000","0","","许愿公子，等一下，我好像有，那没事了"
"平平无奇の唐某人","保密","无IP","244223684","5","","10000","0","","JARHE4CR6A52"
"收尾人芬恩","保密","无IP","349650074","5","","10000","0","","JARHE4CR6A52"
"永hにですMacross","保密","无IP","346073409","6","2233幻星集","10000","0","","哈哈哈，听内鬼说甘雨弱的，说甘雨是冰安柏的人呢？该！[呲牙][呲牙][呲牙][呲牙]"
"二次元美少女虾饺酱","保密","无IP","9575554","6","","10000","0","","本来想给护膜点个保底的,结果直接来了个四风上下册[笑哭]"
"鲲跑了","保密","无IP","257377923","5","","10000","0","","帝君没来，他的枪要跟过来了"
"泡泡菠萝包","保密","无IP","15120035","6","","10000","0","11","又没皮肤啊，想要新皮肤"
"卡卡比老师","保密","无IP","390481171","5","","10000","0","","加强心海加强心海加强心海加强心海加强心海加强心海加强心海加强心海加强心海加强心海加强心海加强心海加强心海"
"慵懒的紫罗兰","男","无IP","76087713","6","","10000","0","","81发没出金，前来还怨"
"是令色鬼","保密","无IP","36197606","6","","10000","0","","3000的sc为什么秒删？"
"影子里的妖怪桑","保密","无IP","11014232","6","","10000","0","4","我靠，那不会是人偶吧，别"
"掩涕兮哀民生","男","无IP","399817632","5","","10000","0","","加强心海！"
"ACCQMZ","男","无IP","470892024","5","","10000","0","","音乐会呢？还没发吗"
"秧歌starPROMAX","保密","无IP","406936254","5","","10000","0","","胡桃池子不能放第一个嘛[捂脸]"
"芳甸月照花林","保密","无IP","27002382","5","","10000","0","","雷神和心海我已经连着肝了两个卡池了，再来个公子真的肝不动了[大哭][大哭][大哭]零氪玩家想给公子抽六命【做梦】"
"经常被狗捕获","保密","无IP","160045542","5","citrus","10000","0","4","得了，连攒两个版本的原石"
"嫣花似雪","保密","无IP","431777271","5","公主连结凯露","10000","0","","不抽公子，抽胡桃。只玩女角色[吃瓜]"
"卡卡比老师","保密","无IP","390481171","5","","10000","0","","加强心海加强心海加强心海加强心海加强心海加强心海加强心海加强心海加强心海加强心海加强心海加强心海"
"好生快活","保密","无IP","454136753","5","","10000","0","11","胡桃托马一块抽 针不戳"
"Octstep","保密","无IP","277974216","6","","10000","0","","如果这次公子复刻没有大剧情，我tm就…..就…就不补命座了[原神_倒]"
"VilDir","男","无IP","33828392","6","","10000","0","6","[藏狐]一溜下来公子厨预防针打得挺好的，谁敢惹？"
"萤麻了","保密","无IP","86942275","5","群星闪耀时天蝎座","10000","0","10","公子池上次歪了，这次就看公子跟我有没有缘分了，小保底不歪，那很好，歪了就胡桃[崩坏3_糖葫芦]"
"捧起jiojio大快朵颐","男","无IP","383833251","6","","10000","0","","玩家:要求增强心海。,,CH:哦......懂了（增加了无视护盾的怪），这样心海的作用就起来了[tv_鬼脸][tv_鬼脸]"
"暗宇孤帆","男","无IP","291887782","5","","10000","0","","其实细想想，游戏周年庆福利确实寒碜，但办音乐会开销也不小吧，当然也许他门票钱能赚很多，但至少我觉得音乐会的意义比单纯的几个原石更大吧，有的非要说什么有钱办音乐会不如发1600原石，给你1600原石就能抽出东西了吗？抽完没出货还不是和啥都没给一样，相比之下音乐会不是更让人印象深刻吗？当然，游戏里的周年确实寒碜，哪都能感觉到在周年庆，除了游戏里，但我觉得寒碜不在于福利少，而在于氛围，不知道是不是逐月节就算是周年庆活动了，但至少只能感觉到逐月节的活动却没有多少周年庆的氛围，虽然我也不好具体描述，但很明显隔壁崩3的周年氛围就更浓烈。"
"Gray_aa","保密","无IP","37005343","6","","10000","0","","托马老公我已经脱好衣服了[喜欢][害羞][喜欢][害羞][鸡腿][喜欢][鸡腿][大笑]"
"翱游者","保密","无IP","16491020","6","雾山五行","10000","0","11","最近从常驻池出了一把天空弓，有77、胡桃、万叶和琴，那就不抽心海抽公子了[妙啊]"
"超人跨过伽蓝雨","男","无IP","158134","6","","10000","0","","求求阿贝多"
"抠死普罗扫地工","保密","无IP","11868871","6","时光代理人","10000","0","","兄弟们我想问问胡桃除了护摩还能用啥…想抽托马怕歪胡桃先做点准备[原神_哼]（该死的成男分池）"
"伟大理想抱负","男","无IP","397039194","5","","10000","0","","那个。。。稍微提一下加强心海呗"
"鹿橙Luckcheers","男","无IP","279407000","6","崩坏：星穹铁道","10000","0","","还有冬极的强度高的离谱，真别告我你们不削弱就把他上线。上线那个后就等于天空系列是五星阉割版，才一年连同级武器都分369等了还"
"聆点零一分","男","无IP","11642719","6","","10000","0","","字幕按照属性颜色来的哦"
"笼陇","保密","无IP","441026560","5","2021拜年纪","10000","0","","能不能在胡桃之后在复刻。。我的好公子，我记着抽胡桃，都忍了好久，策划，wdnmd，不过，公子的群伤伤害真香[抠鼻][抠鼻]"
"14中国统一","男","无IP","167994342","5","","10000","0","","公子先复刻！我胡桃有啦[大笑]"
"鹿橙Luckcheers","男","无IP","279407000","6","崩坏：星穹铁道","10000","0","","从2.1版本下，一直绝食到2.3以后了都，现在都攒了35抽了没地方动粉球，又是辛火又是公子又是用角色就掉血的胡桃，无语"
"I但丁J","男","无IP","13256933","6","","10000","0","","所以说是先出公子再出胡桃是吗"
"MosesMao","男","无IP","180226186","6","","10000","0","","养的七七终于要派上大用场了[妙啊]"
"笨蛋清雪","保密","无IP","627799460","5","罗小黑战记","10000","0","4","雷神加托马等于.......『雷加火自己知道的』"
"彷徨少年时","男","无IP","7431286","6","","10000","0","11","鹤关推荐配队：重云、胡桃、魈、七七[doge]"
"棹归","保密","无IP","29705836","5","原神","10000","0","5","这2.1我一秒都待不下去了！鸭鸭~我壶还蛮大的！来我壶住一（亿）晚吧~[doge]"
"落雨丶星辰","保密","无IP","6523018","6","梦100","10000","0","","HS8HXMCR6A46"
"脑子奶酥","保密","无IP","433843706","5","","10000","0","","好可爱呜"
"三世舟","保密","无IP","25416055","6","","10000","0","","wok 真复刻公子啊 天啊"
"白前K","男","无IP","11348253","6","","10000","0","","不是公子都复刻一回了啊还来"
"紫涵之心","男","无IP","85594009","6","","10000","0","","五郎下次也有机会上场了，[热词系列_好耶]"
"我还是目光i","男","无IP","102434559","5","","10000","0","","胡桃不用说话的"
"EmperorAriana","保密","无IP","22113336","6","","10000","0","","复刻公子不好吗，这样大家又可以攒原石了，不会真的有人想连着复刻强力角色吧"
"Sugarduck","女","无IP","81249007","6","橘猫挂件","10000","0","","对托马的印象：阳光时尚帅气小伙兼爷的不知道第几个好兄弟[doge]"
"落雨丶星辰","保密","无IP","6523018","6","梦100","10000","0","","JARHE4CR6A52"
"啊受打击","保密","无IP","503254952","5","","10000","0","","S  T  O  P,很抱歉打断你的浏览,但是我想提醒您一句,,你签到了吗[doge],b23.tv/3ZFXGv ,,不好意思放错了[doge],https://b23.tv/GkFhHY [脱单doge]"
"夜行童子","保密","无IP","46504222","5","","10000","0","","在抽公子和抽胡桃一命摇摆不定[笑哭][笑哭]"
"墨画染布","男","无IP","356619703","5","三周年恋曲","10000","0","","诶，我好想要阿贝多啊，那时候退坑了[大哭]，公子都复刻两次啦！不过这次出了剧情，就当你没敷衍我了[生气]"
"二两米粉在这儿吃","男","无IP","414359924","5","","10000","0","","芭芭拉冲呀"
"纷釉补龉","女","无IP","4365813","6","","10000","0","","太好了，可以接公子回家了！"
"星璃yukiri","保密","无IP","24513576","6","真白花音冬日绮梦头像框","10000","0","","草  才换了1个月1+9就来联动了  真希望只是个礼盒不是买台新手机"
"_不如归去丶","女","无IP","67261002","5","","10000","0","","多少有点离谱吧..."
"NGC7293123","男","无IP","400704627","5","","10000","0","","说到底，原神作为一个持续更新的网游，忍受这种创作水平的上下波动（有时还很剧烈）很明显是必然的。,为什么单机游戏很难说这么被持久、反复的骂，因为单机游戏就是有明确的设计寿命的，只要玩家打通主要游戏内容，只要在平台上卖足一个月，之后看情况再出几个DLC资料片，一轮过去之后的事情开发商也管不着了。,这种情况下，单机游戏很明显是最尊重人性的：不要求玩家对着一个玩具连续兴致勃勃好几年，不要求创作者连续保持状态好几年。而这个原则下，单机游戏吃灰，甚至设备吃灰才是正常的。,但是这种吃灰，让单机游戏成了有门槛的玩意，因为游戏太贵了而且还在越来越贵，不仅是价格上的贵，还有时间空间精力上的贵。贵到让很多人想着一定要每天都把玩一下才能值回票价（比如跟风买ns的），贵到让很多人想着花这么一大笔钱没法一次购入长期游玩实在是太奢侈了，贵到让一些人看着Steam里的喜加一就纠结得不行。至于说二手和2小时内退款，难的不是回血，而是最开始的把钱从干瘪的钱包里掏出来那一瞬间。,所以说是最尊重人性的反而是中产以上才享受得起的。就算是欧美日，买游戏机相当于买“家庭娱乐中心”，买的是游戏+影碟一体机，然后买几个枪车球年货就够了，核心玩家占比也不高。,这种情况下，原神存在的意义就是单反价格成千上万情况下的拍照手机，已经是一大批玩家消费能力范围内的顶级游戏了，但他们却要忍受网游一定会有的创作水平波动问题。这是社会的悲哀，原神只是这份悲哀的一员罢了。"
"约翰洛夫克拉夫特","男","无IP","129831459","6","","10000","0","","我对复刻公子没有任何看法，因为我不打算抽，但是请允许我发出我内心的呐喊：你想复刻你复刻一下钟离不好吗？老子缺盾啊！"
"内涵的诗人-腾零","保密","无IP","156947664","6","","10000","0","","公子复刻，我省下了原石，mhy获得了额外一千个公子的流水，只有大祥哥受伤的世界完成了，哦不，是大韭菜来了。[OK]"
"超高校级的熬夜选手","保密","无IP","158088320","6","","10000","0","","所以我的大保底该给谁呢（思考）刚入坑70天的玩家"
"藻","女","无IP","381915819","5","","10000","0","","我根本就不怎么玩尘歌壶。。不懂这种玩意[tv_冷漠]"
"秋息化风","保密","无IP","89526737","6","泠鸢yousa登门喜鹊","10000","0","","哇，到甘雨复刻时，我不会已经屯了个二命甘雨吧[笑哭]，神里就屯的够呛了，就等甘雨出我就终于可以不屯了，开始抽卡自由了，能不能有点消息啊[难过]"
"轩辕梓熙","男","无IP","476731992","5","","10000","0","","公子，我爱你啊！"
"一叶知秋深情","保密","无IP","391488056","5","","10000","0","","总结：公子是ch亲爹"
"渊下攻","女","无IP","354910373","6","原神","10000","0","16","哎嘿，俺意外得到的心海有用武之地了"
"这个名字是随便弄的","保密","无IP","2059838","6","","10000","0","","复刻又咋了，我没抽到，在抽一次不行哦？不让新人好过是吗？哼唧唧[脱单doge]"
"莉莉白小姐的六面墙","男","无IP","455321588","5","三周年恋曲","10000","0","","开时间排序找了几遍也没看到指点角色本身的，一些人没必要那么激动啊[藏狐]我公子复刻入的坑，万达和魔王武装队我都齐了，公子复刻我想要，我也想骂ch啊，太不合理了，看前瞻还是活动剧情，大概率没必要非拉上公子来写剧情"
