"昵称","性别","IP","UID","等级","装扮","用户权重","获赞数","粉丝团等级","评论"
"MYNEKRUFTE","保密","无IP","1655462721","4","","10000","2","","这辈子只打算氪这几个游戏,1、mw modern warships 原因 两个人的团队做两万人做出来的游戏，平衡的一塌糊涂,2、舰b 被人伺候是要给钱的,3、Minecraft 这是童年的问题,4、genshin 玩游戏可以不给钱，比如明日之后，王者荣耀，和平精英，因为他一直想要你充钱。,但是看小说要给钱啊！看电影也要给钱啊！出去旅游也要给钱啊！听音乐会也需要门票啊！"
"卡哇伊の天依","男","无IP","321972307","5","洛天依・最美的夜","10000","2","","复刻公子怎么了？你不要不抽不就可以了，你不抽自然有人会抽。[傲娇]是不是直接up神子又说不给时间准备原石[傲娇]"
"唯你不渝","男","无IP","38939960","5","","10000","2","","[doge]这新版兑换码快赶上周年庆奖励了"
"搂着薇","男","无IP","397657961","5","","10000","2","","不过这次复刻我反而喜欢，0命公子的CD太强了，所以我必抽，你它们爱怎么冲就怎么冲，但因为池子骂角色一踩一捧的多少沾点，不喜欢就别抽简欧，等下一个[吃瓜]"
"暗夜貘良","保密","无IP","422632051","6","","10000","2","","？就复刻个公子怎么了？为什么要骂？就因为没复刻你喜欢的？"
"Reunion___","女","无IP","470505335","5","","10000","2","4","策划你*^%$\&+*！！！"
"Atil3ano_Yuz","保密","无IP","442059749","5","","10000","2","","ntch"
"利尔维塔","保密","无IP","123289182","6","冬季","10000","2","","盾系目测会被淘汰[拥抱]已经被钟离养费的我又得躲技能了，"
"旅者游世","男","无IP","29154661","6","","10000","2","","难怪我有整整30个雷神瞳下落不明，之前对了好几遍攻略愣是不知道遗漏了哪些，原来有新岛啊[笑哭]新的岛，新的冒险，芜湖～（希望稻妻剧情组能稍微给点力，别再整出烂剧情[辣眼睛]）,以及，这会总可以把树开完了吧？我那里都存了90多个雷之印了。[笑哭]"
"柠犹左","保密","无IP","398988507","6","","10000","2","","我对公子这个角色不满已经很久了现在还连续复刻两次那我就借着这个风说一说吧，我是不太理解公子厨厨的到底是公子哪一点？如果只是剧情前面的公子的话还好但到了放出魔神那一段性质就完全不一样了，这完全就是没把一程人的性命放在眼里，公子厨说是公子猜到了钟离没死所以才敢放出魔神的还有说这是钟离策划让公子做的，先不说公子知不知道就说人家帝君为什么敢安排这场试炼因为人家有绝对的实力就算事态控制不住人家一个天动万象立刻就能镇压下来公子呢？公子有什么？而且我对公子知道帝君没死这件事表示怀疑不如说公子是在赌拿一城人的生命赌帝君没死，这一城人死不死在他眼里都无所谓赌赢了神之心有着落了赌输了无所谓，这更是让我讨厌他更别说公子一个传说任务对家人好就能洗白了？这是不是说我一个杀人犯屠城未遂犯对家人好你们就能洗白我夸我好温柔亚撒西，这不是很可笑吗？你们厨公子到底厨哪里如果真的只是厨那一个建模那当我没说。"
"-_蓝桉_--","男","无IP","178503881","5","","10000","2","","今天准备抽行秋，随便垫胡桃池，结果40出了星海[大哭]我的一命胡桃啊啊啊啊"
"青色椰子","保密","无IP","14802504","6","","10000","2","","虽然我也觉得复刻两次很奇怪，上一次可能是临时复刻的啥都没有，这次有剧情。但有什么好生气的[藏狐]，对公子有好感就抽，无好感就多攒一个月石头，最近的节奏真的麻了。"
"wton卫潼","男","无IP","275710193","5","刺客伍六七","10000","2","","地图越来越大，不说送原石，能不能把体力条扩大一点，160，完全不够样越来越多的人物了"
"檬OAO","男","无IP","131472440","6","","10000","2","","音游的系统打磨的是真的烂，而且还都是听吐的背景音乐。上次风花节都玩吐了，要不是有奖励鬼玩啊"
"JoltzS1X","女","无IP","59686333","6","神乐七奈","10000","2","","紫米：明明是我先来的[生病]"
"账号已注销","保密","无IP","450165909","0","","5000","2","","未成年真的哭了，为什么究竟是为什么，说真的，我原本每天花几十分钟就能下线，现在要盯着周六晚上8点，赶着做任务，反而被绑架，沉迷了[无语]"
"0工藤洗衣机0","男","无IP","86817337","5","","10000","2","1","不想抽公子，不抽不就完了？原石攒着不香吗，人气角色接二连三up，你的钱包受得了？"
"高丶不胜寒","保密","无IP","78482894","6","菜菜子","10000","2","","不喷ch喷角色？有毒吧"
"比奇堡-涵","男","无IP","14575423","6","","10000","2","","2.2版本散兵跟公子的剧情应该就是被困在电梯里那个吧[doge]"
"快上课了丶","保密","无IP","514456897","5","","10000","2","","近战弓兵的设定很吸引我。,但是还是更想要胡桃多一点。,纠结。,再看吧，先不决定。"
"北城情长","男","无IP","304697698","6","","10000","2","","会复活的遗迹重机？带了大主教的守护之壳还是某恶心人的突变因子"
"非酋永远中不了","男","无IP","437712054","5","","10000","2","10","一场音乐会让我看清某些“人”确实不配看音乐会，并不是不喜欢音乐会就不配，而是当别人在欣赏时连最基本的尊重都没有。如果连这点素养都没有，还配当人吗？[吐]"
"林小羲QWQ","保密","无IP","349584237","6","","10000","2","","搞个魈应该就没节奏了。哈哈哈[吃瓜]"
"小Mi梦","保密","无IP","1951803316","5","","10000","2","","[doge],"
"不太梦幻的幻梦","保密","无IP","94864375","5","异常生物","10000","2","","辛焱，拔剑！！！[doge]"
"饭搭233727567","保密","无IP","363247415","5","","10000","2","","这账号别叫原神了，下次叫猴山，我看正好[滑稽]"
"霄仙","保密","无IP","30197716","6","","10000","2","","可以存一个版本不氪回血，这竟然还能喷，属实大韭菜[喜极而泣]"
"比安卡小姐可爱捏","保密","无IP","673516823","5","","10000","2","","我看你们还怎么瞧不起七七[傲娇]"
"屠龙勇者肥猫君","男","无IP","435052882","6","","10000","2","","米哈游真的会做音游么，上次的音游，节奏都对不上，玩起来忒难受。。。"
"呼叫大西瓜","保密","无IP","51513397","6","","10000","2","","希望能出地板摆件。"
"星魁星","保密","无IP","285783216","6","","10000","2","","再也看不到紫米强热评啦[tv_doge]"
"凉风君","男","无IP","674130568","5","","10000","2","","这四个人开会,,公子:为什么只有我是反派？,托马：为什么只有我是四星？,胡桃：为什么只有我矮？,玩家：为什么只有我歪琴？"
"星羽清空","保密","无IP","436827719","5","刺客伍六七","10000","2","","JARHE4CR6A52"
"黑涩云端","男","无IP","9645551","6","","10000","2","","心海这卡池是真毒啊，我这种开服到现在没有一次不是大保底，而且平均75发才出一金的人，到心海池40发想歪迪卢克和琴给心海，武器池定轨绿剑给不灭月华，这味真对啊[吃瓜]"
"吾天明王","保密","无IP","436276822","5","","10000","2","","我看以后谁还敢填简单反正我照样填[吃瓜]"
"我不Van游戏","保密","无IP","287972590","5","","10000","2","","尘歌壶里多加几块地吧，我一直想着把壶里变成农场，每天光种菜收菜，然后清心，琉璃袋这些塞满背包[星星眼]"
"小小姚上尉","男","无IP","86897593","6","快把我哥带走","10000","2","","抽完雷神一发没动，已经攒了100连了，再攒一个多月，直接一命胡桃加专武了"
"我的好兄弟心夏","保密","无IP","7076570","6","","10000","2","","见识下师父的枪法吧,太郎丸喷火"
"奈亚拉托提普Offical","保密","无IP","22431281","6","","10000","2","","这2.2一分钟不想呆了[藏狐][脱单doge]"
"寻找小D的路人甲","男","无IP","7374190","5","","10000","2","","SAQHWLVRPTPS"
"喵喵瓶v","保密","无IP","16740785","5","罗小黑战记","10000","2","","本来以为无视护盾要等到须弥[笑哭][笑哭][笑哭]草系穿岩嘛多正常，给岩盾个限制，结果这么早就出了[笑哭]"
"LILINLYU","保密","无IP","10898131","6","罗小黑战记","10000","2","","为什么第二次复刻公子？,（不讨厌角色，不骂角色，公子我自己也抽了练了，单纯表达一下对这种二轮复刻的不满，只针对ch）,公子第一轮复刻是风花节，可以说这次有公子剧情就复刻了，那风花节公子有剧情吗？就硬复刻？要么就是之前风花节复刻被挡刀了，觉得“你不抽攒池子就行了”的，那想要公子想补齐命之座的玩家高兴了，别的厨其他还没复刻的角色的玩家就活该人下人咯？明显属于ch又犯病了，为了那五星弓的流水，以后复刻旧限定角色都给你自带一个新专武池子，满意吗？,说回这次的池子，的确有公子的剧情，那又怎么样？米忽悠的复刻又不是完全按照活动剧情来的，不然胡桃和2.2有剧情关系吗？至少现在看没有吧。明明是ch犯病，骂角色的也不是什么好东西，这不明显分散火力吗？角色又不能自己决定复刻，所以这波就是ch的锅。"
"M仞不改名了","女","无IP","385931490","6","","10000","2","","我就坐着看看有没有冲cv角色的[呲牙]"
"有热度我就蹭","男","无IP","122695209","5","#EveOneCat","10000","2","","哈哈哈，老夫来也，你的盾，根本保护不了你。"
"-冥君-","男","无IP","96842449","6","夏诺雅","10000","2","","我猜你一定在找这个,https://b23.tv/6aBf1d"
"快乐天使之章","保密","无IP","180212008","5","","10000","2","","公子：我不做至冬人啦！女皇！赛高尼嗨铁鸭子[doge][doge][doge]"
"Tempest眼丶","保密","无IP","205493113","6","","10000","2","","一直默默想先公子再胡桃，果然有效~~公子早就满命了，这回可以安安静静攒原石等胡桃了，胡桃还差2命，强迫症一直很难受~至于托马，希望垫的时候自己乖乖来碗里吧[OK]"
"问叔叔柠檬何时酸","保密","无IP","1111543793","2","","10000","2","","紫米：明明是我先来的[大哭][大哭]"
"生产队的氧化钙","男","无IP","83550044","6","","10000","2","","话说为什么我看到公子再次up脑子里蹦出的想法是:,比海澜之家多了一次[doge]我是不是该去逛逛了[藏狐]"
"林笙钰笙涵","保密","无IP","383264428","5","徵羽摩柯","10000","2","","sb策划，老子的魈合甘雨呢！一个角色一年复刻三次？你他妈傻了？阿贝多、魈、甘雨还一次没复刻过？这么喜欢复刻公子那你直接把公子常驻得了，抽公子的开心你也开心多好[生气]"
"啃一口莲蓉蛋黄月饼","保密","无IP","667037989","5","EveOneCat2","10000","2","","说点开心的，今天达达鸭真的帅的我反复去世，小人又可爱的我昏古七，有新的鸭鸭吸好耶！"
"ilg_n","男","无IP","40731858","5","","10000","2","","原魔玩家狂喜，深渊一直打不过钟离boss层，这版本抽狗直接乱杀[doge]"
"竹马竹马青梅竹马","保密","无IP","1999124019","5","","10000","2","","ch，这不公平！甘雨阿贝多和魈都一次没复刻，尤其是魈的池子还那么短！凭什么公子就可以不停复刻?！大家时间都不是时间是吧？别和我扯攒石头，那你不如一直攒到关服算了"
"小小姚上尉","男","无IP","86897593","6","快把我哥带走","10000","2","","办人事啊，托马和胡桃一个池子"
"娑伽罗","男","无IP","11144071","5","","10000","2","","虽然我不喜欢公子这个角色，但是他复刻我还是挺开心的，又省了半个版本的原石"
"Masayume丶真夜","男","无IP","34092702","6","2021拜年纪","10000","2","","看到托马优化香菱的 ,我就很想笑,你是不懂万达队伍里香菱公子输出占比55开吗,后台挂火 狂喜的不是公子 ,是融合流甘雨, 公子挂水频率太高 很难做到刀刀蒸发是公子打的 ,所以万达队伍里都是香菱的蒸发 公子反而是哪个""工具人"""
"栗悟饭与洛伦兹变换","男","无IP","78758772","6","三周年恋曲","10000","2","","雷蛇联动鼠标可以以旧换新吗[藏狐][妙啊]"
"蓝莓葡萄泡芙","保密","无IP","20275715","6","","10000","2","","达达鸭：up池――,温迪一次我一次，钟离一次我一次，胡桃一次我一次，阿贝多一次我一次，可莉一次我一次，万叶一次我一次，神里一次我一次，宵宫一次我一次，魈一次我一次，甘雨一次我一次，雷神一次我一次，心海一次我一次，优一次我一次……,[原神_G嘿]"
"温和悠然","保密","无IP","506608729","5","","10000","2","","接力转一个消失的评论,复刻公子带来的问题不是没有符合某些人的预期，而是失去了公平。,没有赶上温迪的玩家，需要等待4个版本复刻温迪,第一次没赶上公子的玩家需要等3个版本复刻公子,没有钟离的玩家等4个版本,想要可莉的玩家等了6个版本。,而目前，想要甘雨和阿贝多的玩家，就算下个版本就复刻，也等了8个版本了。,凭什么想要公子的玩家可以等5个版本，又再次获得抽公子的机会？而想要阿贝多甘雨的玩家要等8个甚至9个、10个版本？想要魈的玩家要等至少7个版本。,没复刻就当攒原石？你们为什么可以觉得时间成本很廉价？版本在更替，角色更新的同时，怪物也在更新，现在好用的角色，过几个版本就不再好用了。魈和胡桃现在有钟离可以放肆输出，但是2.2新出的猎犬无视护盾流血，可能直接让魈和胡桃退环境。,没法在还能用的版本抽到想要的角色，已经被版本慢慢淘汰才给你复刻，是你们想要的结果吗？"
"_九缘","男","无IP","269919584","5","BW2020","10000","2","","心海我估摸这策划这sβ是不准备改了，可惜了美工那么拼命的c"
"乌云湍","女","无IP","86616507","6","EveOneCat2","10000","2","","我喜欢辛焱！,我 永远 喜欢 辛焱！,这次在海报里看见辛焱简直[原神_哭哭],过年了兄弟们！[原神_哭哭][原神_哭哭][原神_哭哭],我真的爱你！爱你！"
"逆焰之歌","保密","无IP","31495031","6","至尊戒","10000","2","","托马！我的托马老公！我要变成池子把你埋进我的身体里[脱单doge][脱单doge][脱单doge]"
"悲灵光晕","男","无IP","94998792","6","","10000","2","","虽然我知道是为了抬角色，但是看到这侵蚀我是真的烦"
"我比艾伦都自由","保密","无IP","1813037540","5","","10000","2","","转：,我知道，这波肯定有人又要给原神办的音乐会扣点不爱国的帽子，这里提醒一句，上海爱乐的演出本来是线下的，只不过因为疫情延期了[吃瓜]到时候肯定会有录播，想喷的有本事到时候再喷，别在这里丢人[吃瓜][吃瓜]"
"阿葱只是根葱","男","无IP","24259582","5","","10000","2","","紫米:明明是我先来的"
"丨双丨","保密","无IP","5701414","5","","10000","2","","反转了，这波是策划知道你抽完雷神没钱没原石，让你再攒个版本先[OK]"
"黄少爱吃鱼丸粥","保密","无IP","651116648","5","明日方舟-愚夜密函","10000","2","5","又有琴了[热词系列_好耶],琴琴琴琴[热词系列_好耶][原神_躺平]"
"poki子","男","无IP","8116386","6","","10000","2","11","不愧是你，每次直播都能涨10几万粉"
"黑酱大人呀","保密","无IP","326698409","5","","10000","2","","曾经的盾霸天下被砍了，以后就是充能的天下速切流，等八重吧，我感觉武器池绝对有盾系列的，搞0命托马就收手。哎，要不然歪的无工大剑不知道怎么办呢[笑]"
"来份迪西馅饼","女","无IP","90946048","5","","10000","2","","两个可以弹的琴了，希望以后可以出笛子，我感觉它超级适合魈[脱单doge]"
"八幡海0","保密","无IP","439601876","5","40原","10000","2","","胡桃的武器池是啥呀？[藏狐]"
"小浣熊saiko","保密","无IP","480163628","5","","10000","2","","2.2 B服直播新码：,JARHE4CR6A52 ,HS8HXMCR6A46 ,SAQHWLVRPTPS ,有效时间至：2021.10.04 （12：00：00）,,2.2版本（已确定）：,1.公子复刻（先）+胡桃复刻（后）,,2.早柚邀约，托马邀约,,3.新谜境悬兵,,4.镜花听世（新活动）,,5.梦里生花（新花种可以种了）,,6.地脉移涌（倍率提示，一天三次）,,7.新天动/摆设/套装/壶里设计优化,,8.背包上限各1000武器/}遗物更新至1500,,9.原神xRAZER（游戏椅子/滑鼠）,,10.OnePlusx原神（11月开始）"
"纽扣CoCo","女","无IP","12471680","6","2233十一周年纪念","10000","2","10","卡佬紫米打赏了三万多块，这波是请大家看音乐会了[doge]"
"Y_EVOL","保密","无IP","516420823","5","","10000","2","","我公子歪了，我胡桃稳了，我胡桃歪了我下个up稳了，这波，这波我是怎么都不亏啊"
"这枚用户觉得取名难","保密","无IP","368753063","5","","10000","2","","有好心人告诉我托马在哪个池子吗。祝你出双黄msr"
"Beholders冥王","男","无IP","319166187","5","鹿乃","10000","2","","攒两个版本原石等神鹤和八重的有没有[脱单doge]"
"GNIMUW","男","无IP","31325843","6","","10000","2","","流水的嘉宾，铁打的林簌。这就是劳模的宿命吗[脱单doge]"
"甜粽子不甜","保密","无IP","416889757","5","","10000","2","","有人知道钟离大概还要多久才能复刻吗"
"夏夜的梦幻","保密","无IP","202692590","6","","10000","2","","兄弟们，线下音乐会是在上海进行，由上海交响乐团演奏，如果想听正统璃月的歌曲可以等线下，也就是这场音乐会的下半场，抢不到票的小伙伴可以等录播哦。"
"木柄丙","保密","无IP","23813117","6","","10000","2","","亲爱的原宝，你有很多视频要发，还不能休息哦[doge]"
"Ymiiko","女","无IP","399792640","5","","10000","2","","原宝，延长一下兑换码时间吧，你这样让我这个防沉迷玩家十分痛苦[酸了]"
"R2---D2","男","无IP","266121761","6","原神","10000","2","","想问一下新怪的侵蚀效果是仅限战斗中还是持续一定时间即使脱战也不会停？[原神_嗯]"
"盖了帽的老baby","男","无IP","381262527","5","","10000","2","11","未成年光顾着玩原神了，节目都没咋滴看[捂脸]赶紧下载回家看[脱单doge]"
"凉拌菜狗","女","无IP","269528228","5","三周年恋曲","10000","2","","公子…嘿嘿…嘿嘿…嘿…我要你把我踩在脚下，我是您虔诚的信徒，你的一颦一笑还有你那宛若大海漩涡般的蓝眼睛彻底吸引住了我，您是如此的迷人呜呜呜，阿贾克斯，达达利亚我喜欢你公子，我喜欢你"
"詹台信仰","保密","无IP","35393913","6","-阿库娅","10000","2","","我的帝君啊，因为没办法开盾挡伤害，气得内心崩溃，又哭又闹，呜呜呜呜，好可怜啊…[[doge]"
"想吃炒米粉u","保密","无IP","8180826","6","","10000","2","","好耶！公子！[给心心]"
"清茳kiyokawa","保密","无IP","393282128","5","碧蓝航线2020","10000","2","","紫米,谁做的图，你给我出来[笑],冬马            kiss           春希,oneplus                       原神,                  雪菜"
"永2333","保密","无IP","527244961","5","","10000","2","","音乐会有没有回播[原神_喝茶]"
"皇子的野望","保密","无IP","285214095","6","公主连结佩可莉姆","10000","2","","今天，我想提醒您一句,你签到了吗[doge],https://b23.tv/GkFhHY [脱单doge]"
"某自闭的小寂静","保密","无IP","496115537","5","","10000","2","","堂主！我的堂主！"
"莫诺mo","男","无IP","354175901","5","","10000","2","","[打call][打call][打call]"
"啊这这--","女","无IP","52809139","6","","10000","2","","好耶！"
"赠与十四行诗","保密","无IP","541542368","5","","10000","2","4","好耶！达达鸭我是你老婆啊！！！"
"溺死在沙漠里的鸟","保密","无IP","262622394","6","","10000","2","","鱼冻老师，到点了，快到我被窝里来prprpr"
"BF零","男","无IP","492959224","5","","10000","2","","只有我一个人感觉不是很好吗？"
"夜殇丶幻","男","无IP","455764471","5","良辰美景・不问天","10000","2","","公子二次复刻真的纯粹找骂 但骂角色的脑子多少有点问题 一个版本四十二天就两个池子 阿贝多一年了都没复刻 公子却up三次了 肯定有人要说不喜欢你不抽呗 但公子复刻三次就是ch不对"
"兰花先生与他的迷妹们","女","无IP","208790868","6","","10000","2","","达达利亚的话，配一个什么样的四星弓比较强啊？"
"绮良良盒","保密","无IP","199428269","6","","10000","2","","在2.2的早柚邀约任务中，早柚让我们进行忍者训练，我们要扮演忍者去偷袭米国特种部队[doge]"
"元鸢4071","男","无IP","167473131","5","","10000","2","","所以，兑换码可不可以延长点时间，防痴迷领不了……[笑哭][大哭][大哭][大哭]"
"星原夕辉","男","无IP","397554086","5","","10000","2","","幸亏知道这次四十就没了，提前定的四十五闹钟准时兑换，真不愧是我[藏狐]"
"你刚刚说了诶嘿对吧","保密","无IP","29307592","5","","10000","2","","我的紫米啊，因为没办法和原宝联动，气得内心崩溃，又哭又闹，呜呜呜呜，好可怜啊…[doge]"
"大家闺秀王钢蛋","男","无IP","3958631","6","崩坏3・天穹流星","10000","2","11","我喜欢你[崩坏3_吃饭团][崩坏3_口水][原神_吃惊]"
"Chabashira","男","无IP","1765367847","4","","10000","2","","国际服兑换码,LBNDKG8XDTND ,NB6VKHQWVANZ ,BSNUJGQFUTPM"
"玩崩铁玩的","保密","无IP","376950271","5","崩坏：星穹铁道","10000","2","","[doge][doge]"
"忆之过梦","男","无IP","244354199","5","","10000","2","","1"
"白白白神遥","保密","无IP","389249798","6","泠鸢yousa登门喜鹊","10000","2","","刚刚！"
"默默无闻的独行猫溪流","女","福建","407260320","5","","10000","2","","许愿托马"
"茅山林凤娇","保密","天津","31704768","5","","10000","2","","强烈要求：七七的传说任务！七七的皮肤！七七的静态手办！还七七人权！"
"应盼蝶飞回","男","福建","556944676","5","","10000","2","","胡桃！我来带你回家！！"
"镜海Empty","男","无IP","363362961","5","","10000","2","","不要男妈妈[脱单doge]"
"千杯不醉夜光绿","男","无IP","480112842","5","","10000","2","","我很好奇为什么从2.2版本起前瞻节目变这样了？"
"躲不了岁月催老少年","保密","无IP","1496317621","5","","10000","2","","璃月什么时候出剑仙角色@原神"
"落水中的羽","男","无IP","556829087","5","","10000","2","","我:可莉,,可莉:哥哥，你来了，可莉有乖乖听话可莉遵守约定的回来了,我:可莉我....,可莉:怎么了，哥哥你难道没有把粉色的石头带回来吗？,我:不可莉我带来了，但是....,可莉:那为什么不带可莉回家呢？,我:（沉默片刻说道）,我:可莉，对不起，我，我，爱上了别的萝莉。,可莉听到后，先是愣了一下，然后可莉眼角泛起了泪光,可莉:（跑过来抱住了我）（流着泪）哥哥，为什么（哭的更大声了）为什么可莉遵守约定了，哥哥却不带可莉回家？,我忍下心中的痛，用了点力气把可莉推开。,我:对不起，可莉哥哥，哥哥喜欢上了别的萝莉（随后转身把自己的粉色石头给了小草神）这时天空中下起了雨，我急忙把小草神给抱回了家。,可莉在雨中继续哭直到声音被雨声盖过...."
"阿半吖吖","男","无IP","176338526","5","","10000","2","","30:02"
"雪际彼端","保密","无IP","391382180","5","","10000","1","","看这个视频的时候在想公子眼睛是不是忘记点高光了。于是点回官网角色看立绘，发现公子根本就没有高光。"
"荠季777","保密","无IP","411584578","5","","10000","1","","什么时候复刻公子，我要抽个冬极"
"不再看你aaa","保密","无IP","500685450","4","","10000","1","","什么时候加强魈？？建议给风套四件套再加个增加风伤和下落攻击"
"-公子季-","男","无IP","272941027","6","","10000","1","","谁说稻妻没有阳间地图的[藏狐] 海o岛不是挺阳光浪漫的吗"
"玖姬璃","女","无IP","270328255","5","","10000","1","","想不到我10月31号了，都还能自然刷到这个视频[doge]"
"死人在发疯","女","无IP","237285413","5","","10000","1","","许愿一命公子，出必还愿"
"雨林寒流","男","无IP","403837488","6","刺客伍六七","10000","1","","等胡桃等的好难受[tv_思考]"
"老师您喝茶","女","无IP","491874936","5","","10000","1","","12:00"
"耶大号没了","保密","无IP","1783168586","5","","10000","1","","你就说你出不出吧！！！！！"
"钢铁栝鱼","保密","无IP","1415347948","4","","10000","1","","就我一个想要琴吗？"
"三瓶梦野","保密","无IP","8348566","6","明日方舟音律系列","10000","1","","阎王爷：我这不是阴间，我是个锤子阴间。"
"ca长发的孤生","保密","无IP","401393679","5","","10000","1","","公子快点杀青吧[藏狐]"
"o","保密","无IP","349903399","5","星座系列：处女座","10000","1","","胡桃改回来好吗？"
