"昵称","性别","IP","UID","等级","装扮","用户权重","获赞数","粉丝团等级","评论"
"Jamax_爵命","男","内蒙古","37430271","6","公主连结凯露","10000","1","","你说的对，但是正太穿黑丝不是很正常吗出自明日方舟吧《水月穿的是黑丝吗》第25楼"
"文韵溟","保密","吉林","388330163","5","","10000","1","","好喜欢好喜欢！！！兄妹一起联手！！！！！！"
"不是叶神啊","男","广东","442168170","5","","10000","1","","预更新后卡顿问题很严重啊，赶紧修复加补偿吧，玩都玩不了了，点啥画面都得卡一下"
"卢老爷滴小花","保密","四川","400774382","5","刺客伍六七","10000","1","11","你小子，又偷偷发是吧？[崩坏3・光辉矢愿_瞄准]"
"一键连","保密","四川","186765921","5","","10000","1","","不带企鹅玩"
"真男人卫宫士郎2号","保密","河北","2032501282","5","","10000","1","","[打call][打call][打call][打call][打call]"
"是苏北yo","男","河南","476275710","5","","10000","1","","怒屮大伟出奇迹，求单抽出林尼，垫了小保底啊啊啊啊[打call][打call][打call]"
"愉悦的沼跃鱼","保密","河南","11477889","6","","10000","1","","黑丝小男孩快过来，到神父这来[tv_色][tv_色][tv_色][tv_色]"
"是伊宁O","女","江西","1962544051","4","","10000","1","","这是离别的馈赠[脱单doge]"
"智乃酱最可爱啦","保密","上海","305569612","6","新月冰冰","10000","1","","好快"
"liuL雪包","保密","河北","3494371326429332","3","","10000","1","","太帅啦"
"星之风铃","保密","江苏","1876661737","5","","10000","1","","1人观看？"
"一只废星星吖","女","陕西","184592419","6","领风者","10000","1","8","我是急冻树我急急急急急急急急急让我去4.0！！！！！！！"
"无奏黑炎","保密","广东","351913543","6","少前小剧场","10000","1","","我突然好奇林尼的牌能打斗地主吗？[doge]"
"外敷百夜米迦尔","女","湖北","1552444492","4","","10000","1","","你知道林尼没有帽子后会变得怎么样吗,答 会变得很冒失[doge]"
"乙凌法","保密","福建","2017625548","5","","10000","1","","来喽来喽[吃瓜][喜欢][喜欢][喜欢]"
"余小瑜","女","河南","1347663210","4","","10000","1","","刚看到阿猿抱怨没出演示的视频[妙啊]"
"时间之类","保密","江西","86123717","6","","10000","1","","这次不是3d转2d，改成了2d转3d[doge]"
"崩崩圆帽小可爱","保密","安徽","443160256","5","","10000","1","","魔术黑丝帽帽猫，把我米的心魂窍[星星眼][星星眼]"
"自杀未遂的11天","保密","辽宁","1540094623","4","","10000","1","","都这么快的吗？你们在b站买房了吧？"
"MSR_霖川","保密","江苏","506400714","4","","10000","1","","老婆就是老婆，你还非得分性别？[星星眼][吃瓜]"
"四mかぐや-kaguya","男","江苏","59212436","5","总之就是非常可爱","10000","1","","列车会驶向下一个目的地，那么原神呢"
"yuyuanqwq","女","河北","1381985703","4","","10000","1","","希望米哈游多出这样的角色[星星眼]，抽爆[星星眼][星星眼]"
"木瓜星灵zz","男","德国","36624541","5","","10000","1","","优化一下内存吧，现在还能勉强撑住，再更新几次真玩不了了[笑哭]"
"wait-shadow","男","江苏","1686648531","5","橘猫挂件","10000","1","","来了来了来了来了来了来了来了来了来了来了来了来了来了来了来了来了来了来了来了来了来了来了来了来了来了来了来了来了来了来了来了来了来了来了来了来了来了来了来了来了来了来了来了来了来了来了来了来了来了来了来了来了来了来了来了来了来了来了来了来了来了来了来了来了"
"胡桃おくさん","保密","浙江","499033276","5","","10000","1","","[脱单doge]"
"不要过来我会叫的","保密","重庆","269413168","6","明日方舟","10000","1","","[崩坏：星穹铁道_来了][崩坏：星穹铁道_来了][崩坏：星穹铁道_来了]"
"怠惰因子_","保密","湖北","604926403","4","","10000","1","","啊？"
"圣光航线x","保密","广西","33041830","6","魔法学院","10000","1","","我看你也挺急的，要不今天就更新吧"
"朴朴乐","保密","北京","634840078","5","","10000","1","","你好"
"一棵森赫","男","北京","5066571","6","","10000","1","","啊啊啊啊啊啊啊啊下野dd请到我碗里来！！！！！"
"巴巴托斯嘶","保密","浙江","3494370059749681","2","","10000","1","","好帅啊啊啊啊啊啊"
"风之殇-","男","浙江","1003317459","4","","10000","1","","旅行者，我们枫丹见[打call][打call]"
"特麻头tomato","男","陕西","10895654","6","","10000","1","","刚好蹲到"
"区零","保密","河南","180492577","5","","10000","1","","来了来了"
"如果抽中了该取啥名呢","保密","安徽","628821564","5","","10000","1","","第一，我不管"
"巡猎_崇高道德的赞许","男","陕西","352438129","6","双生视界・花嫁","10000","1","14","来辣"
"此生最爱爱莉","男","辽宁","1024125150","5","","10000","1","","啊，被溶解了"
"滴嘟滴嘟兰宵宫","保密","陕西","296463180","6","","10000","1","","妹妹的呢？"
"奈奈奈汐","女","上海","376273782","5","三周年恋曲","10000","1","10","明天娶新老婆了[doge]"
"青穹QWQ","男","安徽","488330472","5","星座系列：巨蟹座","10000","1","11","第一[星星眼][星星眼]"
"gardener233","保密","江西","442382787","5","","10000","1","","为了解决内存危机，我们需要知道这个游戏所有的秘密"
"价值6币の干烧咸鱼","保密","河北","490570831","5","","10000","1","","来了[打call][打call][打call][打call]"
"谢家小弟","男","河南","397454114","5","星座系列：天秤座","10000","1","","来了"
"天边的天","女","河南","494653921","5","","10000","1","","哦哦哦哦哦哦"
"我推の刻晴风男和萝莉","女","四川","1131162763","5","","10000","1","11","恭喜427w[星星眼][星星眼][星星眼][星星眼]晚安哦！"
"咖啡果冻oi","女","江苏","1162360090","4","","10000","1","","林尼！！！！"
"一万个小明","保密","江苏","30592979","4","","10000","1","","我是林尼厨的唯一原因，是因为可以名正言顺的叫仆人爸爸[脱单doge]"
"淤泥深处的Star","女","河南","438850962","5","异常生物","10000","1","","林尼宝贝，复刻给你补命座[tv_坏笑]"
"我推の刻晴风男和萝莉","女","四川","1131162763","5","","10000","0","11","晚安"
"我推の刻晴风男和萝莉","女","四川","1131162763","5","","10000","1","11","林尼！！瞳孔地震）（沉默）（跳起来大叫）（冒雨围着学校跑三圈）（尖叫）（爬行）（尖叫）（爬行）（晕厥）我因六岁生疾病,变成聋哑瞎，眉毛以下高度截肢,生活无望，直到我看到了这张图片，激动的我在雨里抱头痛哭，多年瘫痪的我，飞檐走壁，横跨太平洋，飞过珠穆朗玛，越过喜马拉雅山，走过科迪勒拉山系，林尼！你就是我的光就算我已经咽气棺材板都已经盖上了我也会一把掀开棺材板挺直腰板对您说句：好美啊绝了美到眼泪从嘴角流出淹成钱塘江大潮太美了你是神是我的玫瑰你照亮了我黑暗的生命让我的世界有了意义――晚安林尼[打call][打call]"
"如果一个正常人的如果","保密","无IP","159478250","4","","10000","1","","408.9万了[打call]"
"暴走的万万","男","未知","282502674","6","","10000","1","","aaaaaaaaaaaaaaaaaaaaaaaaaaaaaaa"
"我推の刻晴风男和萝莉","女","四川","1131162763","5","","10000","0","11","晚安林尼[给心心][给心心]"
"淤泥深处的Star","女","河南","438850962","5","异常生物","10000","1","","给林尼宝攒满命[保卫萝卜_哇]"
"睡梦被哈皮","男","广东","586721316","5","","10000","3","","学隔壁小破游闪退是吧"
"一MoMo-","女","江苏","21979401","6","快把我哥带走","10000","1","","宝宝我的林尼宝宝好可爱好可爱我啃啃啃啃啃啃啃啃啃啃啃啃啃啃啃啃啃啃啃啃啃啃啃啃啃啃啃啃啃啃啃啃啃"
"齐家小肆","保密","广西","123769597","5","","10000","1","","啊啊啊啊啊啊啊啊啊可爱死我了啊啊啊啊啊啊啊啊啊啊啊啊啊啊啊啊啊啊啊啊啊啊啊啊啊啊啊啊啊啊啊啊啊啊啊啊啊啊啊啊啊"
"","女","湖北","175997334","5","","10000","1","","萌死了啊啊啊啊啊啊啊啊啊啊啊啊啊啊啊啊啊啊啊"
"水光日月","保密","安徽","1545522149","4","","10000","1","","猫猫猫猫猫猫猫猫猫猫猫猫猫猫猫猫猫猫猫猫猫猫猫猫猫猫猫猫猫猫猫猫琳妮特猫猫[保卫萝卜_哭哭][保卫萝卜_哭哭][保卫萝卜_哭哭][保卫萝卜_哭哭][保卫萝卜_哭哭][保卫萝卜_哭哭][保卫萝卜_哭哭][保卫萝卜_哭哭][保卫萝卜_哭哭][保卫萝卜_哭哭][保卫萝卜_哭哭][保卫萝卜_哭哭][保卫萝卜_哭哭][保卫萝卜_哭哭]"
"斐林_","女","广东","91434262","5","","10000","1","","丝滑好好看啊啊啊啊啊啊啊啊啊啊啊啊啊啊啊啊"
"今天的我超级棒","保密","江西","495961620","5","","10000","1","","好可爱好可爱好可爱好可爱好可爱好可爱好可爱好可爱好可爱好可爱好可爱！！！！！！！！！[tv_大哭]"
"浅滩琉璃","保密","福建","71866562","5","","10000","1","","好可爱好可爱好可爱好可爱好可爱好可爱好可爱好可爱好可爱好可爱好可爱好可爱好可爱好可爱好可爱好可爱好可爱好可爱好可爱好可爱好可爱好可爱好可爱好可爱好可爱好可爱好可爱好可爱好可爱好可爱好可爱好可爱好可爱好可爱好可爱好可爱好可爱好可爱好可爱好可爱好可爱好可爱好可爱好可爱好可爱好可爱[嘟嘟][嘟嘟][嘟嘟][嘟嘟][嘟嘟][嘟嘟][嘟嘟][嘟嘟][嘟嘟][嘟嘟][嘟嘟][嘟嘟][嘟嘟][嘟嘟][嘟嘟][嘟嘟][嘟嘟]"
"鱼莫石定_","保密","广西","475449572","5","","10000","1","6","好好好。[打call][打call][打call]急急急急急急急急急急急急急急急急急急急急急急急急急急急急急急急急急急急急急急急急疯丹来来来来来。[打call][打call][打call]"
"苍蝇派肉松饼国王殿下","女","山东","177115051","5","","10000","1","","酷酷酷酷[奥比岛_点赞]"
"无SX57","女","河北","398554729","5","","10000","1","","好可爱好可爱好可爱啊啊啊啊啊啊啊啊啊啊"
"穗乃果冻","女","河南","30429906","6","","10000","1","","好好好！！！！！"
"巫罗斋","保密","北京","701530395","3","","10000","1","","这个pv太棒了太棒了[保卫萝卜_哭哭][保卫萝卜_哭哭]好绝好绝好绝好绝好绝好绝好绝好绝好绝好绝好绝好绝"
"优澈澈","保密","河北","24074672","5","","10000","1","","太可爱了太可爱了太可爱了太可爱了太可爱了太可爱了太可爱了太可爱了太可爱了太可爱了"
"winterswEEt_3-14","保密","山西","1452945114","3","","10000","1","","三小只呃呃呃呃呃呃呃呃啊啊啊啊啊啊啊啊啊啊啊啊[喜欢][喜欢][喜欢][喜欢][喜欢]"
"裤子着火","女","河南","483037284","5","","10000","1","","黑丝！！！！！黑丝！！！！！！！用黑丝闷死我！！！！！！！！！！！"
"鹿熙zi","女","江苏","491062717","4","","10000","1","","怪笑猫猫帽嘿嘿嘿嘿嘿嘿怪笑帽帽猫嘿嘿嘿[爱心][爱心][爱心]"
"散兵的狗r","女","浙江","1717733172","4","","10000","1","6","林尼林尼林尼林尼林尼！！"
"我推の刻晴风男和萝莉","女","四川","1131162763","5","","10000","1","11","早早早早早[热词系列_好耶]上线带你和弟弟妹妹还有小心海一起打原石咯[热词系列_肥肠自信]399.6w，快了快了"
"神来何似风火","保密","北京","97557449","6","","10000","1","10","等你复刻 宝"
"混沌疯子-玩家","男","山东","504600823","5","","10000","1","","反转「意义」，颠覆「常理」。用「真实」创造虚妄，以「未知」铸就奇迹。"
"我推の刻晴风男和萝莉","女","四川","1131162763","5","","10000","1","11","400w了！！！！！宝[给心心][给心心]"
"御坂16928号","女","河南","417020346","5","","10000","1","","最喜欢的一集"
"新的故事2","保密","河南","401722355","5","","10000","0","","知道吗？我真的要给魔术师给予超能妙喵的赠予使用，作用可以除了辅佐魔术的优秀性之外，也可得到更多的魔术灵感创造出新的奇迹，而在战斗方面中是完全不含糊的，念力就是最擅长的优势，运用念力便可到处飞行"
"小正太猫咪","男","四川","21148764","6","","10000","1","","400w了诶[脱单doge]"
"星空棒棒糖0202","女","西藏","388200475","5","","10000","1","","好可爱好可爱好可爱好可爱好可爱好可爱好可爱好可爱好可爱好可爱好可爱好可爱好可爱好可爱好可爱好可爱好可爱好可爱好可爱好可爱好可爱好可爱好可爱好可爱好可爱好可爱好可爱好可爱好可爱好可爱好可爱好可爱好可爱好可爱好可爱好可爱好可爱好可爱好可爱好可爱好可爱"
"我推の刻晴风男和萝莉","女","四川","1131162763","5","","10000","1","11","等我攒了三只魈，剩下的（如果还有剩下的话[委屈][委屈][委屈]）就都抽你了，下次复刻可能就最多补个二命吧，满命等你再下次复刻了[灵魂出窍][灵魂出窍]关服前总能捞到的[妙啊]！！！（）[给心心][给心心][给心心]晚安林尼宝，一直都有人喜欢着你的[脱单doge][脱单doge][脱单doge]"
"天天睡大觉真君","保密","山东","455202410","4","","10000","1","","猫猫帽，帽帽猫,猫猫是猫猫，帽帽是帽帽,猫猫不是帽帽，猫帽不是帽猫,帽帽猫戴猫猫帽，猫猫帽像帽帽猫,莫把猫猫认成帽，休将帽帽讲成猫"
"我的初恋是PLA","女","浙江","38822955","5","","10000","1","","400w贺电！已经攒了110个球了！[原神_G嘿]"
"噗火","保密","吉林","23642226","6","呜米","10000","1","","猫猫！！！！！！！！！！！！！！！！！！！！！！！！！！！！！！！！！！！！！！！！！！！！！！！！！！！！！！！！！！！！！！！！！！！！！！！！！！！！！！！！！！！！！！！！！！"
"芙芙芙最可爱了","保密","湖南","37277934","5","","10000","1","","400w贺电"
"枯川废子oiiai","保密","福建","88038075","6","","10000","1","","林,尼,老,婆"
"白天八点半","女","广西","510607","6","洛天依8th生日纪念","10000","1","","除了林尼补命座，枫丹版本想抽的目前也只有那芙以及仆人了，还得再攒三个大保底[捂脸][捂脸]"
"海盐芝士h白夜","保密","广东","110512724","5","","10000","1","","啊啊啊啊啊啊啊啊啊啊啊啊啊啊啊啊"
"我推の刻晴风男和萝莉","女","四川","1131162763","5","","10000","1","11","405.1w"
"伊星河神愿花","保密","四川","280018276","6","","10000","1","","啊啊啊啊啊啊啊啊啊啊啊啊啊啊啊"
"o关关雎鸠i","女","浙江","24072004","6","","10000","1","","等你练度高了，带你妹妹弟弟一起上深渊[初音未来_大笑][初音未来_大笑]"
"水仙的时时刻刻","女","广东","2504808","6","明日方舟","10000","1","","等复刻补一命专武(=ω=)"
"香草芋泥椰椰","女","湖北","74477697","5","","10000","1","","老公老公老公老公老公老公老公老公老公老公老公老公老公老公老公公老公老公老公老公老公老公老公老公老公老公老公老公老公老公老公老公老公老公老公"
"斯曼摩尔","保密","四川","534953272","2","","10000","1","","林尼一家都好可爱哈哈哈，还好我三个都有力[请给我一块奶酪_HAPPY！]"
"我推の刻晴风男和萝莉","女","四川","1131162763","5","","10000","1","11","晚安[洛天依][洛天依][洛天依][洛天依][桃源_给花花][桃源_给花花][桃源_给花花][桃源_给花花]"
"桐生整点薯条","保密","广东","8076076","6","","10000","1","","宝贝你什么时候复刻呀 给你补到三命"
"竹墨E","保密","山东","650257089","4","","10000","1","","来早了，坐下来下盘棋吧[doge],, R 象 仕 将 仕 象 R ,├ ┼ ┼ ┼ ┼ ┼ ┼ ┼ ┤,├ E ┼ ┼ ┼ ┼ ┼ E ┤,卒 ┼ 卒 ┼ 卒 ┼ 卒 ┼ 卒,└ ┴ ┴ ┴ ┴ ┴ ┴ ┴ ┘, 楚河（这里不用走）汉界,┌ ┬ ┬ ┬ ┬ ┬ ┬ ┬ ┐,兵 ┼ 兵 ┼ 兵 ┼ 兵 ┼ 兵,├ 炮 ┼ ┼ ┼ ┼ ┼ 炮 ┤,├ ┼ ┼ ┼ ┼ ┼ ┼ ┼ ┤,车 马 相 士 帅 士 相 马 车"
"唯她与秋同在","男","浙江","402364326","5","","10000","75","","两分钟2w播放啊，你们都等着点吗[doge]"
"我推の刻晴风男和萝莉","女","四川","1131162763","5","","10000","1","11","晚安[给心心][给心心][给心心]"
"唯心不","女","辽宁","57272032","6","","10000","1","","400w了好耶[星星眼]"
"chocoearly","保密","辽宁","56316676","6","","10000","1","","啊啊啊啊啊啊啊啊啊啊啊啊啊啊啊啊啊啊啊啊啊啊啊啊啊啊啊啊啊啊啊啊啊啊啊啊啊啊啊啊啊啊啊啊啊啊啊啊啊啊啊啊啊啊啊啊啊啊啊啊啊啊啊啊啊啊啊啊啊啊啊啊啊啊啊啊啊啊啊啊啊啊啊啊啊啊啊啊啊啊啊啊啊啊啊啊啊啊啊啊啊啊啊啊啊啊啊啊啊啊啊啊啊啊啊"
"白天八点半","女","广西","510607","6","洛天依8th生日纪念","10000","1","","又来给你打榜了，使用率喜+0.1％"
"木兆口几丶","女","河北","13608011","6","","10000","1","","林尼你什么时候复刻啊[保卫萝卜_哭哭]为什么我的林尼会剑出影随呢"
"慕甜玖辞是个废","女","陕西","2035178943","3","","10000","1","","啥？林尼和菲米尼都是锦鲤配的？"
"与心维","保密","广东","32650069","6","2233白色情人节","10000","1","","321复刻[十一周年_害羞][十一周年_害羞]"
"芙芙真好看-","保密","安徽","3537118120905444","2","","10000","1","","马上400w了[脱单doge]"
"我推の刻晴风男和萝莉","女","四川","1131162763","5","","10000","1","11","晚安林尼宝贝[跪了][跪了][跪了]"
"柒柒爱七苹果派","女","黑龙江","3546571985652024","2","","10000","1","","我，成功从网易转行到了米哈游"
"我推の刻晴风男和萝莉","女","四川","1131162763","5","","10000","1","11","晚安林尼宝，415w合影[桃源_欢呼][桃源_欢呼][桃源_欢呼]"
"羊尾女","女","福建","2099210281","4","","10000","0","","[doge]"
"白天八点半","女","广西","510607","6","洛天依8th生日纪念","10000","1","","134/203"
"不知世俗","保密","云南","674336752","4","","10000","0","","[tv_色]"
"我推の刻晴风男和萝莉","女","四川","1131162763","5","","10000","0","11","398.9w"
"我推の刻晴风男和萝莉","女","四川","1131162763","5","","10000","0","11","晚上好！[兔年][兔年][兔年]"
"冉汐浣TwokNi","女","未知","24781103","4","","10000","0","","早就发了，等于现在才发"
"一条咸鱼twt","保密","湖北","619706415","5","","10000","0","","燥候复刻"
"执着于1988_","女","河南","24931219","6","","10000","0","","本来对林尼一般，但是刚做完他的传说任务，打完怪进动画的时候，镜头卡到了他的普攻后摇，好帅[喜欢][喜欢]，想抽林尼的心情到了顶峰"
"我推の刻晴风男和萝莉","女","四川","1131162763","5","","10000","0","11","早呀早呀[脱单doge][脱单doge]嘿嘿，昨晚试了林班万香没带钟离（敢想我很少下深渊不带钟离的[坎公骑冠剑_钻石]），打了几次没啥起色，今早一打好像找到感觉了嘿嘿[星星眼]也是六次吧差不多，最后三次按差不多的输出流程（保证不是侥幸）都是倒计时9分内打完了[给心心]（之前林班香钟顶天了剩8分40秒[tv_吐血]我就是太菜了[tv_笑哭]），接下来明天看接着打第二间[tv_晕][tv_晕]"
"我推の刻晴风男和萝莉","女","四川","1131162763","5","","10000","0","11","晚安[tv_腼腆][tv_腼腆]"
"我推の刻晴风男和萝莉","女","四川","1131162763","5","","10000","0","11","398w了宝[来古-震撼][来古-震撼][来古-震撼]"
"白天八点半","女","广西","510607","6","洛天依8th生日纪念","10000","0","","这个点还有七个人在看，你们是听这个入眠吗[灵魂出窍]"
"K肯K","保密","湖北","437119846","5","","10000","0","","关于林尼up池结束我才入坑林尼这件事"
"旧都景","保密","广东","1296356581","5","","10000","0","","原啊，4.2的剧情还有林尼吗[保卫萝卜_哇]还有三小只吗[保卫萝卜_哇]三小只戏份多吗[保卫萝卜_哇]人设会继续完善吗[保卫萝卜_哇]好想快点看到新的剧情啊啊啊啊啊[抓狂][保卫萝卜_哇][保卫萝卜_哇][保卫萝卜_哇]"
"芙芙芙最可爱了","保密","湖南","37277934","5","","10000","0","","林尼！"
"灯与鱼与水","保密","江苏","3546384634480928","3","","10000","0","","封面真帅"
"这么热爱搞鬼畜","保密","江西","3493281872742415","3","","10000","0","","如果林尼特是萧薰儿来配，就更有意思了，这下，大王斗破四人组全都到齐了，来到原神里面，准备开一波组队，到底是准备去蒙德，还是去须弥呢？准备去见见那些可爱的小萝莉们，当然了，还有刻晴，胡桃，这些外来角色人家准时欢迎您"
"Franksss_","保密","山西","438433473","5","","10000","0","","林尼宝宝"
"我推の刻晴风男和萝莉","女","四川","1131162763","5","","10000","0","11","今天最后一遍，晚安林尼宝[打call][打call][打call]"
"拾枫辞","保密","河南","517819358","5","洛少爷","10000","0","","宝宝"
"桐生整点薯条","保密","广东","8076076","6","","10000","0","","宝宝我们是要多久再见啊啊啊啊等不及给你补命座专武了"
"被榨的果立","女","上海","13109671","6","","10000","0","","wow好久没看到那么戳我的角色了"
"海獭没有雨","保密","广东","399240442","4","","10000","0","","晚安[兔年]"
"铁蛋嘻嘻公主","保密","广东","440211528","5","","10000","0","","给你打榜噜宝宝下次就抽专武"
"我推の刻晴风男和萝莉","女","四川","1131162763","5","","10000","0","11","晚安林尼宝贝，今天带你和阿晴队一起把深渊打满了，第二次满星！虽然因为极度手残打得不太顺利但过了！等我把你和琳妮特菲米尼都练好一起嘎嘎下深渊，现在大世界也跑的很开心，就想带一家人[桃源_给花花][桃源_给花花][桃源_给花花][桃源_给花花]"
"祈宫柚子","女","广东","332381421","6","","10000","0","","等复刻拿下[初音未来_大笑]"
"小猪鲤","保密","河北","6764879","6","天宝伏妖录","10000","0","","再来一遍！早日四百万！"
"我推の刻晴风男和萝莉","女","四川","1131162763","5","","10000","0","11","林尼[兔年][兔年][桃源_给花花][桃源_给花花][桃源_给花花][打call][打call][打call]"
"酸菜紫米露lulululu","保密","云南","450301607","5","","10000","0","","等你下次复刻必拿下哦宝贝，专武已经给你捞到啦[脱单doge]"
"白天八点半","女","广西","510607","6","洛天依8th生日纪念","10000","0","","二命抽了之后再抽仆人，一家人整整齐齐[tv_大哭]"
"白天八点半","女","广西","510607","6","洛天依8th生日纪念","10000","0","","4.1主线戏份其实也不少，怎么pv里都没能和琳妮特一起蹭点画面"
"我推の刻晴风男和萝莉","女","四川","1131162763","5","","10000","0","11","晚安[兔年][兔年][兔年]"
"我推の刻晴风男和萝莉","女","四川","1131162763","5","","10000","0","11","400w冲冲冲[兔年][兔年][兔年]"
"我推の刻晴风男和萝莉","女","四川","1131162763","5","","10000","0","11","林尼宝贝好耶[桃源_给花花][桃源_给花花][桃源_给花花]"
"喵咕酱83","保密","江苏","11763011","5","","10000","0","","大哥哥"
"咕噜咕噜泡泡Ooo","保密","陕西","20855161","6","","10000","0","","太优秀了"
"铁蛋嘻嘻公主","保密","广东","440211528","5","","10000","0","","我这辈子注定会爱上小男孩和火弓，所以快点复刻我要抽专武"
"猹查旦日","保密","广东","1246996705","5","","10000","0","","普攻的动作真的蛮漂亮的"
"我推の刻晴风男和萝莉","女","四川","1131162763","5","","10000","0","11","晚安林尼宝[给心心][给心心][桃源_给花花][桃源_给花花][桃源_给花花]"
"小沈不想迟到","保密","新加坡","346635180","5","圣诞节快乐","10000","0","","爱我一次吧宝宝……我要火伤悲"
"我推の刻晴风男和萝莉","女","四川","1131162763","5","","10000","0","11","晚安林尼宝贝[兔年][兔年][兔年]"
"CUTEDORA","保密","中国台湾","3493284250913529","3","","10000","0","","就这个视屏让我给他满命满精"
"我推の刻晴风男和萝莉","女","四川","1131162763","5","","10000","0","11","晚安[保卫萝卜_哇]"
"喵咕酱83","保密","江苏","11763011","5","","10000","0","","这么好的哥哥在哪找"
"为什么说我昵称违规","男","辽宁","56450166","5","","10000","0","","意料之外的高质量"
"zoisekxiong","保密","广东","12769210","6","","10000","0","","有一件我觉得很生草的事，就是这个PV的视频封面小图每次刷到，都幻视林尼坐在中国好声音的旋转椅上！！！！！"
"我推の刻晴风男和萝莉","女","四川","1131162763","5","","10000","0","11","林门！！！！枫丹限定一轮只抽你呀[打call][打call][打call][打call]"
"whtkkorfcnew","保密","江苏","1009248909","4","","10000","0","","宝宝 想你"
"透明的雨滴_","女","江苏","179800237","5","","10000","0","","太帅了[保卫萝卜_哭哭]"
"夏南音","保密","广西","198949","6","","10000","0","","好可爱"
