"昵称","性别","IP","UID","等级","装扮","用户权重","获赞数","粉丝团等级","评论"
"烨岐","保密","浙江","643929082","4","","10000","2","","明天更新我今天开学，我哭死，我的林尼！！！[大哭][大哭][大哭]"
"季子毡","男","上海","21163818","6","","10000","2","","期待把琳妮特或者菲米尼的角色演示做成续集！另外加入小企鹅的魔术秀！[微笑][嗑瓜子]"
"苹果卖了三块二毛八","女","吉林","492839229","5","","10000","2","","把林尼的嘿丝炫我嘴里[给心心][脱单doge]"
"埚ぁ","女","北京","17826845","6","","10000","2","11","这个角色演示简直惊艳"
"猫狸Meoru","保密","江苏","557224303","5","少女前线","10000","2","9","尼儿的牌打的也忒好咧～[2233娘_大笑]"
"月月绽放光芒","保密","未知","1903171669","5","","10000","2","","好耶[崩坏3・终焉归始_出击][崩坏3・终焉归始_出击]"
"栀果ベ","保密","上海","23093939","6","实验品家庭","10000","2","6","此刻，盛大开演！"
"菠萝虾仁球","保密","安徽","622439258","5","阿萨Aza","10000","2","","这一家子都好喜欢www，许愿林尼加专武不歪[OK]"
"W林","男","陕西","451606064","5","","10000","2","","太可爱了这三 嘿嘿[喜欢][脱单doge]"
"弦润萧生","男","黑龙江","20155290","6","","10000","2","","感觉这三位不是亲兄妹，应该是结义的[思考],大哥是人类，二妹是猫女，三弟是人类但长的跟那二位完全不像"
"吃蕃薯吗","女","江苏","58399","6","","10000","2","","三小只好可爱[保卫萝卜_哭哭][保卫萝卜_哭哭]"
"Yury桑","女","河北","440828944","5","","10000","2","","啊啊啊怎么这么帅啊一家三口，我抽，我抽！"
"库库棒槌","保密","福建","383163252","5","","10000","2","","首先我不是林尼厨，我对林尼确实没有什么幻想，毕竟我不是林尼厨。但是该说不说的，林尼真的人美身材好气场强，我真的不是林尼厨，有一说一，确实很好看。我也确实说不喜欢这种绝色美少年，因为这个确实是挺漂亮的，我就不是林尼厨。但是怎么说，一看到林尼，心里就痒痒的，类似一种原始冲动，就像看到影视剧里看到多年未见的老友的重逢，一段崭新情缘的开端一样，激发人向美向善最淳朴的一面。就像登上山峰，目睹潮汐那般自然，仿佛冥冥之中自有天意就是一种朦胧的感觉，像伟大的革命友谊一样，令人憧憬。要是林尼能和我牵个手亲个嘴睡个觉结个芬就更好了，毕竟我不是林尼厨[喜欢][喜欢][喜欢][喜欢][喜欢][喜欢][喜欢][喜欢]"
"是季节啦","保密","重庆","406102863","4","崩坏：星穹铁道","10000","2","","各位粉丝不要一天到晚就知道刷视频，了解历史，提高文化素养，为国家的发展努力学习才是正事，那么就让临时工出几道简单的唐诗考考大家，都答对了才能看视频，请大家把答案写在回复里：,1.待到重阳日，还来（ ）菊花。,2.总为浮云能蔽日，长安（ ）见使人愁。,3.烽火连（ ）月，家书抵万金。,4.在天愿作比翼鸟，在地愿为（ ）理枝。[doge][原神_躺平]"
"追风少年赵某","保密","黑龙江","1339525345","4","","10000","2","","@一颗咕咕星 该你复刻了[脱单doge]"
"脸逸点也不圆","保密","四川","1278593668","3","","10000","2","","林尼别歪求求了"
"来疑沧海尽成空-","男","辽宁","157812361","5","","10000","2","","佩伊可爱捏[保卫萝卜_哇]"
"偷图仔","保密","河南","1925693448","5","","10000","2","","还往下翻呢，十连双黄真君！[doge][doge]"
"青草牛奶茶","女","浙江","97212589","6","","10000","2","","好丝滑啊啊啊啊啊三小只都在耶！"
"新鲜感悟","保密","浙江","306301372","5","","10000","2","","Ladies and gentlemen!就由我魔术师林尼和琳妮特来为大家带来一场华丽的魔术盛会吧，（摘下帽子，身体转动一圈后行礼说道）表演开始了"
"bili_470559297","保密","陕西","470559297","5","","10000","2","","锦鲤一配二是我没想到的，林尼和菲米尼都是他配的"
"无语言音","男","安徽","1159815890","4","","10000","2","","小时候村子前面有两个坡，新点的就叫它新坡。我和我的小伙经常在那个老的坡上玩，是童年最美好的回忆。长大后村子要铺路了，这本是一件皆大欢喜的好事，但我听说那两个坡因为占路被铲平了。我当时泪水就夺眶而出，我控制不住我自己，我跌跌撞撞地跑到两个坡原来的位置声嘶力竭地呼唤我的童年：,“我的老坡！！我的老坡啊！！”,我的老坡啊！！！！！！！"
"霞散L","男","山东","1953497891","4","","10000","2","","让世界为奇迹倾倒！[喜欢]"
"命运的织机","保密","山东","313727335","5","原神","10000","2","","喜悦吧，欢呼吧，为我成为新神正名吧[原神_哼哼]"
"pony仔","保密","河南","376975293","6","","10000","2","","最后一幕[星星眼]尊嘟好可爱！！！"
"弱雪泊舟","男","贵州","105994493","5","","10000","2","","虽然林尼穿黑丝，但感觉也是个很飒爽的一个大哥哥啊，并不那么妖，还不赖啊"
"百陌不是白沫","女","江苏","346345774","6","","10000","2","","好耶!火系大家庭又多了一位活泼开朗爱笑的大可爱!迪卢克前辈，你怎么看？[崩坏3・光辉矢愿_让我摸摸]"
"枝江传媒的小白","保密","江西","144818153","5","乃琳Queen","10000","2","","黑丝小男孩[喜欢]集美们开扣"
"开郎的b-站网友","男","内蒙古","1300211807","5","","10000","2","10","要怎么形容林尼呢？我想可能是凌晨四点未眠的海棠花，是世界上唯一一朵玫瑰，是一天内的四十四次日落，是眼底的克莱因蓝，是白雪下连绵不绝的向日葵，是21g的心脏，是盛夏的最后一缕风，是鼎沸人声中的每一次一眼万年，是恋火焚身时眼里的眷恋，是时间停止依旧为爱意跳动的心脏，是每一次转身的浪漫收场，是崇拜与狂热，是寂寞与窥探，是孤僻与荒凉，是热茶与沉醉，是疯狂与张扬，虽然我能说会道，但是看见苏的样子我还是找不出最完美的词来形容，千言万语汇成一句话不过是：林尼！我！爱！你！c(°°)ノ "
"为水神大人奉上肝脏","男","湖南","646907917","5","","10000","2","","枫丹为什么全是水？因为枫丹有零（林）泥（尼）[微笑]"
"路辰的脸应该申遗","保密","福建","1641009818","3","","10000","2","","愿林门的圣光普照每一位林厨,林尼是谁?,对于盲人来说，他是他们的眼睛。,对于饥饿的人，他是他们的厨师。,对于口渴的人，他是他们的甘露。,不论林尼在想什么，我们都会同意。,不论林尼在说什么，我们都在倾听。,如果林尼只有一个崇拜者，那一定就是我。,如果林尼没有崇拜者，那我就根本不存在。,林门~~~"
"西瓜万能钥匙","保密","天津","450101367","5","","10000","2","","林门！！！！"
"归去来兮女士-","女","湖北","430021409","5","","10000","2","","谁来把我撅晕过去明天再醒来"
"黄毛锁链重度依赖","保密","云南","522872588","5","","10000","2","","林尼和琳妮特很有礼貌 因为他们都有礼帽[喜欢][喜欢][喜欢][喜欢]林尼宝贝你是一只蓝莓软欧包！！！"
"墨寄秋","保密","江苏","14457262","6","","10000","2","","本来魔阴身要发作了，看见林尼了浑身有劲，寿命直接又延长500年，人活着就是为了林尼，嘶哈嘶哈"
"夏莲_米多丽","男","四川","495457811","5","","10000","2","","为了更新我还去买了个固态[热]"
"凌号任务","女","辽宁","1618566446","4","","10000","2","","有一天我喝醉了大声喊:“我要娶林尼！”这时我老婆皱了皱眉，温柔的给我盖好被子，然后亲了我一口又凑到我耳边说“娶我一次了，还想娶第二次？"
"千花UvU","保密","河南","219581621","5","","10000","2","","宝宝，你是一只树莓黑巧蛋糕，别人都想吃掉你[保卫萝卜_哭哭][保卫萝卜_哭哭][保卫萝卜_哭哭]"
"--冬禧--","男","湖北","1113110263","4","","10000","2","","大魔术师的帽子深不见底，号称能装下所有的惊喜。,――真奇妙，究竟是怎么做到？,听闻此言，从那帽底竟传来猫叫，似笑非笑。,[doge][doge][doge]"
"然吟式微","保密","山东","456338526","5","","10000","2","","林尼！[喜欢][喜欢][喜欢][喜欢][喜欢][喜欢][喜欢][喜欢][喜欢][喜欢][喜欢][喜欢][喜欢]"
"盼瑞pan","保密","四川","1435924850","4","","10000","2","","林尼好帅！但一想到还有一年才更新 你让我这么过啊[大哭][大哭][大哭]"
"辉辉into","男","吉林","689692146","5","沈剑心","10000","2","","根据3.0提纳里进常驻 这个不会也。。。"
"奶茶团子佐大列巴","保密","内蒙古","3784907","6","EveOneCat2","10000","8","12","可爱！喜欢最后一幕[未定事件簿_打call]"
"过路口出","保密","湖南","697522995","4","","10000","3","","呜呜呜呜看多少遍还是好喜欢，可爱帅气的宝宝[大哭]"
"GtHD三字梦","男","山东","3494368233130542","3","","10000","86","","林尼好戳我xp啊，可是强度告诉我要抽夜兰，xp与强度需求之间的话我又想抽达达鸭……后悔之前抽钟离了，不然的话就不用犹豫了（另：谢谢米哈游告诉我我还有相当的男同属性，原神里我喜欢的角色在数量上男性明显大于女性）"
"岩舟","女","上海","86947307","5","星座系列：双鱼座","10000","3","","天哪，补了pv，林尼这也太有魅力和吸引力了，还有这个bgm，大概是爵士风格（?），听起来很有魔术师的优雅风范，爱死了wwwww 太优雅了 [热词系列_再来亿遍]"
"佛系玩家在线丢脸","女","安徽","438981270","5","原神","10000","11","","久违的噼咔感"
"馒头不配","保密","海南","1132030967","5","","10000","3","","宝宝 下次复刻我一定要抽到你[大哭]"
"镜言笙离","保密","山东","55115818","5","","10000","4","","你永远在抽取计划上"
"万能双叶","保密","辽宁","195306766","6","雪未来","10000","3","10","怎么突然推送了"
"最欢喜阿琴","女","吉林","190704981","5","","10000","2","","我的林尼宝贝"
"薛定谔式存在","保密","河南","1842104788","4","","10000","2","","为什么@原神 游戏账户突然被注销了？"
"雾里物理勿理无理埋","保密","河南","352104067","5","","10000","2","","大保底且76抽了，怎么还不来，不会真的要让我大保底80+以上吧[大哭]"
"他低八度","保密","山东","1247738669","3","","10000","2","","我真服了，抽这个英雄歪出来一个七七"
"金州理科状元威金斯","男","湖南","37921881","5","","10000","2","","哇 林尼魔术好厉害[星星眼] 等下 游戏里不是想怎么变都可以吗[微笑]"
"通辽汗国驻纽约总领事","男","广东","397136561","5","","10000","2","","小保底57抽拿下[喜欢]"
"--海涛--","男","山东","1158444248","4","","10000","2","","你好，善逸[doge]"
"00氢","女","湖南","401821001","5","","10000","2","","这个pv看了好几遍都还是想看[洛天依]"
"红小豆单推人","保密","宁夏","335370178","5","","10000","2","","给个魔术弓吧，求你了米哈游[保卫萝卜_哭哭][保卫萝卜_哭哭][保卫萝卜_哭哭]"
"_siGnn","女","广东","312955453","6","名侦探柯南","10000","2","","就是为了下野冲的，太棒了，下次能不能请林原来"
"BadTu_","女","广西","525333158","5","崩坏：星穹铁道","10000","2","","求林尼不歪且快出我真的很需要，谢谢米哈游www"
"薄弦","女","河北","504263760","4","","10000","2","","为什么我这边四国语言都变成中配了？"
"阿丸er","保密","河北","1689853753","4","","10000","2","","林尼：我可不是对所有人都这样哦，主要还是因为对象是你~[脱单doge]就冲这句话我直接把我的保底送上"
"里贝里尔_可桑","保密","江苏","687019911","5","","10000","2","","为啥是男的？我不能接受！[妙啊]巴巴托斯是男的已经让我感到遗憾，这个更是"
"ikun时长达两年半","保密","湖南","3494362266732888","3","","10000","2","","奇奇怪怪的圣遗物"
"饭团吃猫","保密","广西","1762081409","4","","10000","2","","原神帮抓晶蝶"
"芙宁娜的守护神","保密","北京","67006001","6","","10000","2","","4.0主线是神！我先充个648，后面的剧情保持这个水准听到没？[给心心]"
"云傲悠悠","男","湖北","402217427","5","","10000","2","","让我看看，你们都藏哪了～  真没蚌住[doge]"
"大会员-正版受害者","保密","四川","2108229365","3","","10000","2","","我想问问，来自石家庄的迪卢克来电是什么情况呢？"
"我推の刻晴风男和萝莉","女","四川","1131162763","5","","10000","2","11","都是新角色肯定相比老角色的优化不一样，不然干嘛叫新角色呢，那些不甘林尼命座加普攻的，就当是甘雨厨觉得不公平，好，那我作为刻晴魈厨岂不是可以说为什么同样激化c刻晴没精通转模的设计？同样单体纯色输出魈的命座二四命那么搞笑？但现在刻晴魈是说打不过了吗，也不至于吧，也没说撕卡之类的吧。只要控制在一定程度内，新老角色的差异肯定客观存在的，各玩各的不好吗，非要特意来踩酸一句，没必要。"
"Kuyuuuu","保密","江西","354795063","5","","10000","2","","大大大大大保底啦[抓狂]林尼很可爱但是米桑是坏蛋"
"草莓甜酒果果果","女","湖南","59263174","5","EveOneCat2","10000","2","7","赶紧修你的bug[Cat2_Boom!][Cat2_Boom!][Cat2_Boom!]"
"自瞄锁头教你退游","保密","广东","15873922","6","少女前线","10000","2","","讲真 水下的码看着贼难受 就感觉屏幕中间有个啥东西在晃你眼睛"
"贵物处理人","保密","福建","45802183","6","实验品家庭","10000","2","","最近几期的角色演示都比pv播放量低，以往都是反过来，怎么会是呢"
"Ishida-Uryuu","男","广东","513917880","5","","10000","2","","剧情不错"
"下江小春_officiaI","保密","浙江","3494373150952005","3","","10000","2","","枫丹开局就弹丸论破"
"帝释天攻腐唯","女","辽宁","443057304","5","","10000","2","","哎呦那维莱特真的对不起，林尼他普攻会发牌啊"
"尘沙风扬","保密","福建","621036690","5","","10000","2","","从某一个地方看到的评论，[doge][滑稽],你以为的水主E技能,突突突突突突突突砰！～,实际上的水主E技能,抽卡蓝蓝蓝蓝蓝蓝蓝蓝蓝保底金,[笑哭][笑哭][笑哭][笑哭][笑哭][笑哭][笑哭]"
"嘻嘻最喜欢看佑友破防","保密","广东","11295195","6","","10000","2","","枫丹城是真的大，我都快迷路了[笑哭]对比之下蒙德跟个小村子一样"
"香蕉味鞍","保密","辽宁","1794576052","3","","10000","2","","你以为他怎么引爆礼花的，其实他嘴里说着君焰"
"ゴ`ゴ`幽`船","保密","重庆","280373208","6","","10000","2","11","啊，你们不是都说原神凉了吗？哥们就出门拿个快递把游戏退了，现在云原神畅玩卡排了半个小时还没进去[大哭][大哭][大哭]"
"Lingering_echo","保密","上海","403779761","6","","10000","2","8","林尼这个角色演示pv的丝滑度让我想起了之前很火的技术流抖音[星星眼]"
"Ameki-shina","男","山东","356139835","5","","10000","2","","磁盘最多也才110GB，结果需要130多GB，咋搞啊xdm"
"影影不要嘤嘤呦","女","山东","400831777","5","","10000","2","8","开了没，开了没"
"四宫辉夜owo","女","广西","386429615","5","","10000","2","","急急急急急急"
"肖九i","保密","山东","179227003","6","","10000","2","","PC端106G[tv_思考]"
"挝纹","男","山西","343790255","5","","10000","2","","记得游戏解压[doge]我解压完67.4g[doge]"
"不会说话的屑喵","保密","福建","1281407099","2","","10000","2","","我6点03被踢了[兔年]"
"秋生Akiya","保密","福建","544830","6","EveOneCat2","10000","2","","平a这么好看你告诉我是打重击的"
"Lyric抱紧小蓝花","男","江苏","543306990","5","","10000","2","","我是坚定的XP党，我抽爆。"
"山城高","保密","广东","386450855","6","","10000","2","","lil"
"账号已注销","保密","黑龙江","677484510","0","","5000","2","","睡不着啊啊啊啊啊啊啊啊[灵魂出窍]"
"Lolirc","女","广西","179479626","5","","10000","2","","你们角色展示都挤在一起[怪怪小黄豆_祈祷],滚动截屏，接上好像有点乱"
"岭南阳木","男","湖南","526647620","5","","10000","2","","急急急急急急急急急急急急我是急急国王让我先急"
"洛希YXM","男","上海","474764195","5","","10000","2","","吐舌笑好俏皮[喜欢]"
"伊尔迷路米Yellmi","女","山东","13292744","6","刺客伍六七","10000","2","","友友们给林尼带什么圣遗物"
"jojo的梦里花","保密","贵州","6658829","6","","10000","2","","登登呢？？登登呢？？？登登呢？？？？"
"蛋挞吃芯不吃皮","保密","辽宁","25521474","4","","10000","2","","林尼不歪，大魔术和林尼出出出！"
"Saf1re","保密","福建","14817967","6","","10000","2","","我要抽三兄妹"
"una444","保密","广东","14822287","5","","10000","2","","为什么妹妹是猫哥哥不是"
"Milleras","女","湖南","38282022","5","","10000","2","","林尼[喜欢][喜欢]嘿嘿嘿嘿嘿嘿"
"天天爱排骨","保密","江苏","682539702","5","","10000","2","","哈哈哈哈，我对你的杀意，如蛆附骨，如影随形，嘿嘿嘿嘿，发牌！！！"
"襟江带","保密","安徽","34647322","5","","10000","2","","md，太兴奋了晚上睡不着[笑哭][灵魂出窍]还有十二个小时赶紧过去吧"
"小流浪唉","男","河南","690053225","4","","10000","2","","大佬们，这个武器池新弓箭还是若水，甘雨是不是都可以用？"
"骐","保密","云南","433600563","5","","10000","2","","林尼我爱你[脱单doge]"
"骐","保密","云南","433600563","5","","10000","2","","从足迹PV看到现在的双子终于要落地了，谢谢米哈游[脱单doge]"
"曼诺江","保密","四川","336214659","5","","10000","2","","把裤子改好点真的还可以"
"浪越改名能中奖吗","保密","广东","1970636","6","时光代理人收藏集","10000","2","","我不觉得是魔术，倒像是魔法[笑哭]"
"言芜胥-","女","法国","106345019","5","","10000","2","","远看群英荟萃 近看锦鲤开会（"
"z酱","女","河北","11895","6","","10000","2","","佩伊：你冲Q币嘛？冲Q币吗？！"
"--","保密","福建","3493256503495059","3","","10000","2","","三小只要是能像隔壁崩三的罗莎莉娅和莉莉娅那样可以协同攻击的话就完美了，直接爆炸，想想都觉得帅气[p[妙啊][妙啊]"
"滨海路崎惟我步","男","陕西","73943847","6","进击的冰糖","10000","2","","这个黑丝 我好了[向晚_嗨起来]"
"薛定谔的猫儿迷死人同好会","保密","上海","407415471","5","","10000","2","","“四是四，十是十”的升级版是吧"
"柏叶","保密","北京","4497110","6","至尊戒","10000","2","","抽爆 就喜欢这种[初音未来_大笑]"
"吉尔伽美什-幼闪","保密","江苏","13655658","6","","10000","2","8","期待一下二创的法语配音版"
"兔子统治地球","保密","安徽","474478984","5","","10000","2","","林尼宝贝，这次十连三金就此转运就靠你了，不过你也不要太有压力，来一只不歪也可以哒[tv_偷笑]"
"超时空要债","保密","中国香港","1272388","6","","10000","2","","拉牌拿出杯子那个动作实在太酷了"
"圆子l手绘l","保密","湖北","1778102837","4","","10000","2","","我想要这同款扑克！"
"向日葵のfa语","保密","北京","1417009540","4","","10000","2","","@一颗咕咕星 [脱单doge]"
"Naofumi777","保密","广东","32710644","6","","10000","2","","[喜欢][喜欢][喜欢][喜欢][喜欢][喜欢][喜欢][喜欢][喜欢][喜欢][喜欢][喜欢][喜欢]"
"十四行诗venti","女","河南","297241797","4","","10000","2","","呜呜呜"
"香芋烤饼","男","福建","329355136","5","","10000","2","","出猫猫帽的周边，别逼我求你"
"南山无梦-","保密","贵州","383304390","5","","10000","2","8","求求了想个办法解决一下内存问题[保卫萝卜_哭哭]"
"C丶PP","男","广东","5175133","6","绯赤艾莉欧","10000","2","11","别的先不说，pv质量是真可以的"
"Kssssssss灬","男","北京","6717591","6","公主连结凯露","10000","2","","咱就是说。能不能。林尼跟琳妮特。在同一队伍中的时候。两个角色的切换时，加一点特殊切人动画呢？比如pv中这个就不错。[脱单doge][脱单doge][脱单doge]"
"M会试着改变","女","四川","483486844","5","","10000","2","","不歪不歪不歪[保佑][保佑][保佑][保佑]"
"-乐塾-","女","上海","1615737","6","","10000","2","","老婆我来了！"
"胡桃不满命就不改名","保密","河北","1069331547","4","","10000","2","","[脱单doge]"
"仁烦渗Q","保密","广东","4389942","6","#EveOneCat","10000","2","","许愿林尼[Cat_fight][Cat_fight][Cat_fight][Cat_fight]"
"DOU子酱","女","云南","18259334","6","","10000","2","","三兄妹cb好好好好"
"我推の次元壁","保密","陕西","1060281211","4","","10000","2","","喜欢林尼和基德的能点进来看一下吗[大哭]？【【原神林尼VS怪盗基德】伟大的奇迹，就像魔术一样-哔哩哔哩】 https://b23.tv/xL51IYE"
"}白司书-安吉拉","保密","湖南","477932954","5","","10000","2","4","更新那天云原神不会爆吧？"
"祭鸠Jiku","女","宁夏","438911311","5","洛天依8th生日纪念","10000","2","","不得不用日配了[星尘_好听]"
"一道积分算一天_","男","广西","20234741","6","","10000","2","","你确定这是魔术不是虚数魔术嘛[脱单doge][笑哭]"
"的的的ののの","男","浙江","435953178","5","","10000","2","9","大保底了[doge][脱单doge]"
"珈啡_人生苦","女","中国台湾","1314244","6","","10000","2","","韬每[打call][打call][打call]"
"一二三三金","保密","江苏","291123106","6","","10000","2","","好喜欢好喜欢好喜欢好喜欢好喜欢好喜欢好喜欢好喜欢好喜欢好喜欢好喜欢好喜欢好喜欢好喜欢好喜欢好喜欢好喜欢好喜欢好喜欢好喜欢好喜欢好喜欢好喜欢好喜欢好喜欢好喜欢好喜欢好喜欢好喜欢好喜欢好喜欢好喜欢好喜欢"
"是谁乱丢垃圾","保密","广东","99854876","6","","10000","2","","我去好可爱"
"嘻嘻一夏","男","山东","66598092","6","刺客伍六七","10000","2","","完全没想想抽的欲望"
"阿旬会想你","女","广东","397753466","5","","10000","2","","我们中老年人喜欢林尼并不是想要图什么也不是完全为了消磨时光，我们是在追随时代的脚步展示真实的爱情;记录美好的生活留下美好的回忆，我们虽然已经不再年轻但是我们有一颗永远年轻的心，与君共勉，亲人们。"
"麻瓜yea","保密","河南","1637148369","4","电子喵","10000","2","","磁盘没空间了，等固态到了才能玩[藏狐]"
"初九但是fw","女","重庆","360777576","4","","10000","2","","锦鲤锦鲤锦鲤锦鲤锦鲤锦鲤林尼林尼林尼林尼林尼林尼林尼"
"魈的内库","保密","广东","64188107","6","","10000","2","","刚才林尼的黑丝飞进我嘴里了，大家有什么头猪吗"
"从隹","保密","安徽","436667242","5","","10000","2","","可惜"
"雪椿-","女","河南","750788","6","原神","10000","2","","好内个啊啊啊啊啊啊啊啊啊"
"正版师颐真","保密","江苏","46892814","5","异常生物","10000","2","","急急急急急急急急"
"孤独血之哀rs","男","上海","19324848","6","","10000","2","","其实我有点不明白，在满是魔法和法师的大陆上，搞魔术这种类魔法的戏法，真的有必要吗[笑哭]，想变牌个活人什么的用召唤类的元素战技不就能做到吗。。。"
"枫桑无语","男","湖北","691088932","4","","10000","2","","求林尼小保底不歪，求求求求求米哈游了，不歪我当你米哈游的亲儿子！！！[大哭][大哭][大哭][大哭][大哭]"
"棉花饼饼丶","保密","江苏","393472965","5","时光代理人","10000","2","","林尼是不是可以召唤琳妮特一起战斗，mhy你快告诉我这是真的[大哭]"
"深深我真的没有墙头","保密","山西","375112594","6","EveOneCat2","10000","2","10","我的天我的天太丝滑了"
"熟鲜","保密","吉林","302586083","5","崩坏：星穹铁道","10000","2","","林尼林尼林尼[打call][打call][打call]我一定要得到你[抓狂][抓狂]"
"Windsor_QAQ","女","未知","270704641","5","","10000","2","","你最好别歪[tv_发怒]别逼我求你 不然只能等复刻了"
"尼古拉斯小德","保密","辽宁","335878631","6","至尊戒","10000","2","","不能立，不能立啊啊啊啊啊[热]"
"厉害的果粒橙子","男","上海","249653166","5","","10000","2","","这不是魔术师，这是魔法师[笑哭]"
"埋饮月奶窗真君","女","河北","1235616515","5","","10000","2","","林尼不歪玩到关服捏[给心心][给心心][给心心]"
"怪笑猫猫帽","女","河北","1171545525","3","","10000","2","","最后根本不是魔术，是魔法吧[doge]"
"云念汀兮","女","山东","589517199","5","崩坏：星穹铁道","10000","2","","好强的技术力"
"小祺不吃余","保密","未知","540061458","5","多多poi","10000","2","","很喜欢，虽然还没攒够，但我现在就要抽林尼！[抓狂][抓狂]"
"看动漫的一位正常人","男","江苏","395963014","5","","10000","2","","菲米尼，你充Q币嘛"
