"昵称","性别","IP","UID","等级","装扮","用户权重","获赞数","粉丝团等级","评论"
"与之化矣","保密","江苏","22308330","6","","10000","0","","完了，头上有个蝴蝶结看着像套了内裤"
"顾屿南歌词","保密","广东","1005680060","5","","10000","0","","可莉真的每次都是夏天的主角[崩坏：星穹铁道_打招呼]"
"谋-纳西妲","保密","山东","1129148032","4","","10000","0","","我先来，保留节目[doge]"
"Alfred-Barkhom","保密","浙江","630858932","5","","10000","0","","第一眼看成清籁，吓死[doge]"
"账号已注销","保密","江西","323320940","0","崩坏3・天穹流星","5000","0","","卧槽，可莉女儿可爱啊！可恶啊，要二战玩不了了。[大哭]"
"极渊_inmost","男","山东","501913292","5","","10000","0","","水下会有战斗吗，感觉不太好做啊(｀ω)"
"ITIFIR","男","河南","50650900","5","","10000","0","","好家伙无相之冰要营业了[笑哭]"
"叶落夕梦","保密","江苏","687185061","5","","10000","0","5","可莉衣服！几星！,还有七七什么时候有新衣服！"
"邪神之徒","男","重庆","302380069","5","星尘","10000","0","","安柏:翅膀要打结了"
"Ventoooo","女","河南","198506148","5","","10000","0","","海岛呜呜，这次没有了"
"咸鱼晒场","保密","湖北","440426923","5","崩坏：星穹铁道","10000","0","7","那个蓝衣服的成女是谁？是新角色哦？[doge]"
"夏祁っ","保密","吉林","419733469","5","","10000","0","","好欢乐啊[原神_哇]"
"libich","保密","山东","453896671","5","","10000","0","","所以，要复刻谁，pv里只出现了可莉，心海和优，第四个是谁"
"一个随便玩游戏的萌新","保密","北京","591780575","4","","10000","0","","这个题目让我想起了海岛"
"一颗栗子挂树上","女","江西","1679796092","5","崩坏：星穹铁道","10000","0","","好耶[崩坏：星穹铁道_冲鸭][崩坏：星穹铁道_冲鸭][崩坏：星穹铁道_冲鸭][崩坏：星穹铁道_冲鸭][崩坏：星穹铁道_冲鸭][崩坏：星穹铁道_冲鸭][崩坏：星穹铁道_冲鸭][崩坏：星穹铁道_打招呼][崩坏：星穹铁道_打招呼][崩坏：星穹铁道_打招呼][崩坏：星穹铁道_打招呼][崩坏：星穹铁道_打招呼][崩坏：星穹铁道_打招呼][崩坏：星穹铁道_打招呼]"
"没事整事","男","辽宁","536586867","5","","10000","0","","大学生别看了，马上期末考试了[doge]"
"DoomProphet","男","未知","12261750","5","三周年恋曲","10000","0","","枫丹合成台旁有俩人[无语]"
"给世上最爱的人2233","男","浙江","397112139","5","","10000","0","","优！！！可莉！！！斯哈斯哈"
"逆熵盟主","保密","四川","113587564","6","","10000","0","","下版本可以抽柯莱吗"
"我是椰果AvA","女","河北","27732211","6","","10000","0","","好可爱的版本噢"
"三无Marred","保密","广东","265668045","5","","10000","0","","安柏：我中间商的差价呢？[微笑]"
"尘世闲游-陵薮市朝","保密","安徽","1408235928","5","","10000","0","","安柏！！！！！！！,柯莱偷家了！！！！！！！[笑哭]"
"猫和猫头鹰的杂交品种","女","福建","1140360762","5","","10000","0","","原宝出息了，和柯南联动，有“新衣”啊[妙啊]"
"江之岛盾子的信徒","男","河北","143587753","6","原神","10000","0","","唉，肝不动了"
"挚爱の优","保密","重庆","80725215","6","圣诞节快乐","10000","0","","优宝贝终于回来了，一年多的等待[大哭]"
"白天八点半","女","广西","510607","6","洛天依8th生日纪念","10000","0","","啊啊可莉宝宝ee亲亲"
"冰皮豆沙包弟","男","江西","436168264","5","洛天依9th生日纪念","10000","0","13","我看到枫丹"
"龙凤傲九天","保密","广东","650438213","5","","10000","0","","终于来了啊！！,虽然但是，我想问一下官方，为什么最近那么多说兑换码1000原石的，想要就要复制什么去什么什么去快手的原神官方下面什么什么的，我觉得是假的，但看上去又是真的(别喷我，真的，辨别能力确实有点差)"
"命运从来不会同情","保密","青海","40666547","6","巅峰荣耀","10000","0","","哇。可莉的皮肤好好看[星星眼]"
"鲶鱼桑爱桑椹","保密","山西","3493131917985924","3","","10000","0","","可莉宝宝不要歪"
"上oo","男","上海","220598963","6","","10000","0","","「原来！你也？玩原神！」"
"季织绪","保密","重庆","403969585","5","","10000","0","","3.8居然出新角色了[tv_白眼]"
"吃苹果的蛇皮","保密","陕西","417249067","5","良辰美景・不问天","10000","0","3","清夏！乐园？大秘境！（x）可莉的魔女之旅（√）[doge][doge]"
"蓝伊悠悦","保密","福建","5178735","6","","10000","0","","凯亚亚！凯亚亚！！"
"徐云寻","保密","内蒙古","211551930","6","","10000","0","","优的美貌"
"宫水飘叶","保密","辽宁","1983387541","4","","10000","0","","我刚剪完就有新pv"
"徐云寻","保密","内蒙古","211551930","6","","10000","0","","优的后背"
"台湾必回归","保密","河北","1581391580","5","","10000","0","","枫丹泰酷辣，快进到4.0"
"藏剑军火商","保密","海南","1605098","6","","10000","0","","[大哭][大哭]感觉攒够散兵大保底了还够一个小保底，是现在抽艾尔海森还是等抽心海啊救命！！！！"
"MikuKina","女","广东","168278488","6","","10000","0","","枫丹英伦音谢谢"
"八桂木樨","男","广西","98539941","6","","10000","0","","零命凯亚都有时装了[黎明觉醒_石化鸦]"
"小隆包飞洋","保密","山东","103487330","6","","10000","0","","芜湖凯亚！"
"徐云寻","保密","内蒙古","211551930","6","","10000","0","","优"
"烤奶全糖加点冰","女","贵州","437419259","5","EveOneCat2","10000","0","","女儿新衣服好可爱啊啊啊啊啊[原神_躺平]"
"恒宿粼海心","男","广东","1474526674","3","","10000","0","","热着"
"佐边天","女","陕西","37174515","6","","10000","0","4","笑死了，一定要让凯亚穿这么花嘛[喜极而泣]第一次见凯亚的印象就是这人怎么穿的这么花里胡哨闪死我了……（）"
"笨蛋阿连","女","安徽","248822144","6","","10000","0","8","有没有过场的那个壁纸啊，好喜欢[崩坏：星穹铁道_哭]"
"挽星辰-入梦","保密","湖南","423747191","5","","10000","0","","心海心海[以闪亮之名_爱你哦]这个夏活可以和你一起度过太好惹[星星眼]我速速回坑"
"离散的陨星","保密","河北","55980480","6","","10000","0","","优啊，我等了那么久，这次大保底一定要出"
"落渊明","保密","浙江","123168148","5","","10000","0","","本来都停月卡两个月了，现在又要半年月卡来买可莉皮肤，嘿嘿嘿，可莉"
"嘘月中存在一丝缥缈","保密","上海","343653601","6","","10000","0","","优"
"安乐于死","保密","山东","501347638","5","","10000","0","","散兵 宝宝 你终于来了[打call][打call][打call][打call][打call]"
"Anderesmanschen","保密","上海","11629923","6","","10000","0","","绫华：又带稻妻卑女去须弥是吧[妙啊]"
"洛-小-梦","保密","山东","485260311","5","","10000","0","","两个都想要，但是"
"永恒的雷电将军","男","广东","387628463","5","","10000","0","","今日我们相聚在此，是为了庆祝优的复刻！优的池子，值得足足2个648！"
"misia安","保密","浙江","1022298323","3","","10000","0","","@笨蛋小提壶 @}宰NN"
"陌熙影","女","河北","5613341","6","橘猫挂件","10000","0","","我等不及了啊啊啊[崩坏：星穹铁道_举牌]，还得等一个星期[崩坏：星穹铁道_哭哭][崩坏：星穹铁道_哭哭]"
"上井草美D","保密","广东","297682571","4","","10000","0","","3.8怎么还没到，我要马上给可莉新衣服[tv_抓狂][tv_抓狂][tv_抓狂]"
"Bit-Sweet","男","福建","23142326","6","格兰芬多","10000","0","","可莉女鹅！妈妈来辣！[星星眼][星星眼]"
"南雨娑","保密","云南","1367794697","5","","10000","0","","泪目啊，时隔500多天优终于复刻了"
"LatteInCan","男","菲律宾","389761032","5","","10000","0","","这两个版本下来，老父亲的嘴都笑裂开了[原神・巡林奇遇_认可][原神・巡林奇遇_认可][原神・巡林奇遇_认可]"
"飞行矮紧瓜","男","山东","27273739","6","崩坏：星穹铁道","10000","0","","可莉刚出就抽到了，但是没练，偶尔让她出来打打无相冰()"
"台湾必回归","保密","河北","1581391580","5","","10000","0","","快进到3.8，我要买衣装"
"顽狐-","保密","广东","375058155","6","","10000","0","","心海，嘿嘿，疯狂地奔跑，撞开其他心海厨，360°旋转起飞，我的心海Σ_(」∠)_[热词系列_泪目]"
"猿邳i圜颠","保密","江苏","44351108","5","","10000","0","","1381381381318138，这个数字是我的祝福我的期盼，我们众多玩家的希望"
"米哈游可莉","女","江苏","1540746926","4","","10000","0","","好耶好耶，可莉来了，冲鸭，曾经的可莉1.6海岛时代又回来了（阿贝多：为啥你们出去玩不带我，呜呜呜）"
"惜曦啥都不会","保密","广东","702071336","5","异常生物","10000","0","10","可莉宝贝啊啊啊啊啊啊啊啊啊啊啊啊啊！[抓狂][抓狂][抓狂][抓狂][抓狂][抓狂]等我给你买新衣服！！！"
"委厥美而历兹","女","黑龙江","17374529","6","如果历史是一群喵","10000","0","5","可莉这个帽子好像穿了魔女帽[tv_笑哭]"
"或许是七","男","辽宁","406039360","5","","10000","0","","我笑那大伟哥无谋，米哈游少智，若其趁此良机，出优皮肤，则吾钱包危矣"
"真无翼天使","保密","广西","249","6","","10000","0","","发现隔壁长草了，就说明这边一定有大动作。"
"库兰塔黄金船","保密","上海","49531620","6","明日方舟-愚夜密函","10000","0","","我做法成功，又有剧情，又有复刻，赢！"
"鸣狼567","男","江苏","410045838","5","纳米核心","10000","0","","上半可莉优，下半心海散兵，幸好没钟离，我还要抽海哥呢，到时候原石不够，这次卡池可以跳了，阿散我已经有了，其他的暂时不需要，期待一下4.0的枫丹，看前瞻结尾的地图挺不错的"
"CaCO3之主","保密","江苏","1283245296","4","","10000","0","","劝君莫玩轻慢圣贤的梗,很折福的。[保佑]"
"你这瓜保熟吗O","保密","贵州","20871126","6","","10000","0","","啊啊啊啊我要去枫丹啊啊啊"
"F涧钟Qing","保密","广东","32059950","6","","10000","0","12","枫丹我已经等不及了[喜欢][喜欢][喜欢][喜欢][喜欢]"
"云起时清","女","江西","2095397752","4","","10000","0","","可莉宝贝亲亲！！！太可爱了[保卫萝卜_哭哭][保卫萝卜_哇]"
"上井草美D","保密","广东","297682571","4","","10000","0","","什么时候直播录像，让我康康枫丹[tv_坏笑]"
"筱狐狸多吃饭","男","广东","226154018","6","崩坏：星穹铁道","10000","0","","3.8版本太期待啦！这次一定要好好保留夏天的回忆！带上好友拍照打卡！当然枫丹也期待哈哈"
"咕浅","保密","安徽","94742346","5","格兰芬多","10000","0","","心海别歪[委屈]"
"那空空_","保密","广东","345050188","5","","10000","0","","实机……我要枫丹实机演示！"
"谦八岁","保密","江西","392515701","5","","10000","0","","活动界面的可莉真的太可爱了！！"
"透明なコラル","保密","广东","280725237","5","","10000","0","","感觉好好玩啊！"
"那维莱特大人的领巾","保密","广东","85089236","6","","10000","0","","跑早了！没看到枫丹彩蛋！"
"深海泡泡虾","保密","广西","11954359","6","","10000","0","","我就知道有可莉的地方绝对很多欢乐[大哭][大哭][大哭]"
"冬v藏","保密","江苏","350312657","5","","10000","0","6","这次夏日活动的地图看起来有点小。"
"慈爱それ微笑","保密","江苏","1942900791","5","原神","10000","0","","七七都歪我身上！！！"
"南河归深海","保密","北京","269530812","5","","10000","0","","简介里面cv怎么没有优"
"怎么我圈名还有人注册","女","河北","597591013","5","","10000","0","","期末考试后一定要来玩噢！！！"
"Lullaby_D","保密","福建","1179125243","5","","10000","0","","啊啊啊啊啊啊啊啊啊啊啊期待~\(RQ)/~"
"风米饭片","保密","辽宁","522601932","5","","10000","0","","柯莱望着优，哇，，，脑补了脑补了！！！！！爆炸了！！！3.8版本名：优！柯莱！安柏呐？"
"南惜北凝","保密","重庆","382862354","5","","10000","0","","兄弟萌，我须弥地图没开 是不是不能参与这个活动了啊？我还有机会吗[大哭]"
"台湾必回归","保密","河北","1581391580","5","","10000","0","","泰酷辣"
"上井草美D","保密","广东","297682571","4","","10000","0","","海岛绝版了啊，还好去年玩了[tv_坏笑]"
"SerendipityKS","男","上海","163054074","6","萌妻食神","10000","0","","新版本是有散兵新剧情吗，还是说只是作为一个正常的五星复刻位"
"萱萱子啦","保密","广东","18249325","6","原神","10000","0","","好耶 可莉皮肤 好耶枫丹"
"L裕","男","江苏","435377906","5","","10000","0","6","到时候枫丹版本会不会有左轮手枪决斗，[思考]"
"一口吞糯米团","保密","云南","13759873","6","","10000","0","","卧槽，忘记了今晚直播了[笑哭]"
"白嫖党积极分子","保密","广东","198582282","5","","10000","0","","啊，新角色！！！！！啊啊啊！原来是…………"
"游城游马","保密","山西","37683940","6","","10000","0","","从去年九月份入坑开始等钟离，等了快一年了，还不复刻[tv_笑哭]"
"风金翎","男","江苏","646501490","5","","10000","0","","这次活动出场的角色较以往有点少。"
"比理想还要荒诞","男","广西","10048450","6","","10000","0","","太好了，又到了度假版本了"
"acfannn","保密","河北","8112452","5","","10000","0","","优终于复刻了[保卫萝卜_哭哭][保卫萝卜_哭哭][保卫萝卜_哭哭]"
"冠军辅助遇上优","男","未知","362175893","5","原神","10000","0","","优！你终于回来了！[原神_哭哭][原神_哭哭][原神_哭哭]"
"花が散る_","保密","山西","255289391","5","","10000","0","10","看情况我觉得水下应该只能主角探索"
"遐籁R","保密","天津","38731411","5","暮光幻影","10000","0","","我大胆猜枫丹剧情：,高科技的上城区和阴暗的下水道，类似设定出现在双城之战和贝洛伯格。,很有可能有几方势力争斗，大概率是两方。旅行者可能救了不该救的人，得罪权贵。然后被抓捕上法庭进监狱，第一个自机角色可能是抓捕的人或者监狱狱长。,正义小福星，越是强调正义，感觉越容易被奸人所蒙蔽，被当枪使。,既然是正义的审判，那旅行者一开始肯定是站在不被枫丹人所认同的不正义一方，很大概率是下水道的一方。"
"天下无敌我最拽","男","河南","1000417696","5","","10000","0","","怎么感觉可莉皮肤挺一般的"
"风起ぅ叶落","男","无IP","1427370090","5","","10000","0","","优！你终于回来了[大哭]我终于能补满命了"
"影月月老公","保密","河北","3461572116613493","4","","10000","0","","游乐园泰酷辣[打call]"
"_bcd_","男","湖北","430091121","4","","10000","0","","会有与新朋友相遇的缘分[tv_doge]"
"holy楼师傅","男","河北","399435074","4","","10000","0","","《大秘境》"
"你所热爱的crnmsmshs","保密","广东","17595882","6","","10000","0","","这下难顶了，复刻的四个角色我都没有，优又想抽，因为怕不抽，不知道啥时候才有了，可莉有皮肤，我种门和神鹤万差个心海，流浪者也想要，大世界体验暴爽[热词系列_破防了]"
"影月月老公","保密","河北","3461572116613493","4","","10000","0","","可莉衣装必拿下[脱单doge]"
"草又さん木いち","保密","新疆","1897936008","4","","10000","0","","直播间在逃人员[doge]"
"浮生映流年","保密","山东","361247326","5","","10000","0","","本来想抽心海，但一想，不对啊，都到枫丹了，我应该抽水神啊[脱单doge]"
"幻梦BIBIBI","保密","四川","23292290","6","","10000","0","","新角色终于复刻了，虽然我出的时候就抽了0+1，也不打算抽命座[doge]"
"晚JING","女","河南","453616006","5","","10000","0","","做骑士动作的空空卡酷一啊啊[打call]帅气的荣誉骑士哥哥！"
"Yonosei","男","日本","5830717","6","","10000","0","","水龙敬乐园[doge]"
"去和风车战斗","保密","内蒙古","627315414","6","","10000","0","10","谢皇堡能不能做成尘歌壶套装啊，还有bgm"
"Snake0423","保密","山东","32662583","5","","10000","0","","刻晴快看，有个4星角色要开传说任务第二章了[滑稽]"
"黑暗瞑煌","保密","广东","27275000","5","大会员5周年","10000","0","","优后个版本入坑，优前个版本退坑，生不逢时，君在我未来，君回我已退"
"光间痕","女","山东","13956087","6","星座系列：狮子座","10000","0","","我的肝隐隐作痛"
"\灬","保密","北京","1019999102","4","","10000","0","","皮肤会买但不咋想给可莉穿，感觉小冒险家元素是可莉的灵魂[思考]"
"GhostRem","男","山西","34024230","6","","10000","0","","码是什么伙伴们"
"正经の阿瑟","男","甘肃","2072989049","5","至尊戒","10000","0","","那个卡牌活动相当于牌佬的深渊，不给原石的，大家也不用这么激动"
"海洋之声","男","广西","12905106","6","崩坏：星穹铁道","10000","0","8","可莉的皮肤好看是好看但我想看新角色，新角色[步玎Pudding_学习]"
"约帅且美人","保密","福建","1336797468","4","","10000","0","","凯子哥，嘿嘿，凯子哥，嘿嘿嘿，凯亚嘿嘿[嘟嘟][嘟嘟][嘟嘟]"
"神秘面具丶刀","保密","广东","111737183","6","","10000","0","","是不是就安柏没皮肤了"
"aqkomi","保密","陕西","85083433","5","","10000","0","","可莉可爱[给心心][给心心]这次又是妈妈送给可莉的故事，七月到了，小可莉来喽[给心心]"
"青天的枫","保密","内蒙古","24317352","5","","10000","0","","安柏真是查无此人了"
"考试加油a","女","陕西","1131860746","2","","10000","0","","许愿心海，出必还愿"
"1872的逢时镇","女","四川","24196274","6","","10000","0","","凯亚的神之眼翅膀是两对！！！不是三对！！！米哈游你改改！！！"
"咖啡永恒半永恒矩阵","男","广东","651410510","3","","10000","0","","卡池有谁"
"段子手大师","保密","广东","1069652636","5","","10000","0","","单抽出优[脱单doge]"
"limonsssss","男","上海","349410718","5","","10000","0","","唉"
"一寻化归途","男","广东","305703295","6","","10000","0","","优你终于回来了[墨镜]"
"逃亡的绵羊","保密","湖北","630815516","5","","10000","0","","柯莱妥妥须弥团宠[脱单doge]"
"谦谦伪君子_","保密","广东","96248648","5","","10000","0","","优终于复刻，优厨落泪，当年就是为了优才玩的原神[跪了]"
"StrawberryMagic","保密","广东","400792744","5","乃琳Queen","10000","0","","期待一下500多天没复刻的女人的剧情[墨镜]这么久没复刻剧情一定很多吧[打call]"
"夏吾左转弯","男","广西","249476781","6","领风者","10000","0","","恭喜优在不复刻挑战中获得了565天的好成绩！你也来挑战一下吧！"
"最美的夜色","男","河南","24407138","6","","10000","0","","可莉不愧是亲女儿[tv_微笑]"
"予枫以花","保密","广东","1090198304","4","初音未来13周年","10000","0","","4.0快来吧，攒了三十多个小月亮准备一口气给主角拉满[脑洞波系列主题装扮-嘉然_嘉心糖]"
"六三好多鱼","保密","江西","57893936","6","","10000","0","","新地图新地图好耶好耶"
"长安晚枫","保密","江苏","172276201","5","原神","10000","0","","你打算什么时候给77补传说，给温迪补传2"
"睡觉盖好被子QWQ","女","广东","400137767","5","","10000","0","","可莉好可爱～啊啊啊啊"
"一抹青荷盛南塘","保密","河南","7071237","6","","10000","0","","可莉真亲女儿啊，每年夏天都有专属活动和地图"
"利のゆき","保密","四川","4028875","6","三周年恋曲","10000","0","","第一次没看官方直播间回来打个卡[脱单doge]"
"尊贵的b站用户-0001","保密","陕西","143531531","5","","10000","0","","内鬼消息真准啊"
"起个网名脑细胞全废my","女","新疆","482716282","5","","10000","0","","可莉宝贝女儿太可爱了太可爱了[崩坏3・光辉矢愿_让我摸摸]"
"凉拌冰淇淋变态辣","女","河南","15949296","6","乐正龙牙三周年","10000","0","","感觉水空好帅草[原神_嗯]"
"夕影xy","女","四川","12318884","6","崩坏：星穹铁道","10000","0","14","优！！！！！！终于等到你"
"镜流镜流流","男","四川","443836582","5","","10000","0","","优：想起了兰那罗大合唱的场景！,我：天不下雨天不刮风天上有太阳？？.."
"xp是实变泛函抽代","保密","山东","522984179","5","","10000","0","","枫丹！枫丹！这3.8我一刻都待不下去了！枫丹！我要抽芙卡洛斯！我要抽芙卡洛斯！"
"狂抹茶叶","男","湖北","1618737","6","崩坏：星穹铁道","10000","0","","好耶d()ノ"
"彤云天","男","湖北","486302002","6","崩坏3・天穹流星","10000","0","","好耶！新的大冒险！[崩坏3_呼呼呼]"
"剑至寂灭依葬花","男","河南","490510888","5","巅峰荣耀","10000","0","","枫丹这次爆料真没惊艳我。。。"
"辉夜大小姐想进潜水社","男","海南","76702191","6","碧蓝之海","10000","0","","可莉皮肤！！"
"_凉拌柚子_","保密","四川","316607056","5","原神","10000","0","","优、可莉、大炮我都想抽[tv_流泪]"
"Star星尘丶","保密","浙江","169986713","6","","10000","0","","问一下大家可莉皮肤多少钱"
"辰醒时分","男","安徽","286507403","5","","10000","0","13","感觉可莉皮肤有些像四星的"
"中野Miku","保密","山东","92220272","6","中野三玖","10000","0","","有新地图挺好的，总算不是海岛dlc了，以后可以考虑把海岛地图开放常驻其实"
"浪缘Ark","男","辽宁","318450449","6","白神遥","10000","0","","可莉女儿等我[doge]"
"好朋友兰罗摩","保密","江苏","35336956","6","","10000","0","","每年暑假都是可莉专场"
"CHARLOTTEealice","保密","江苏","3461580941429266","4","","10000","0","","可莉皮肤是几星？"
"炫肉小熊猫","保密","广东","257205017","5","","10000","0","","福瑞?福瑞！"
"wslynrin","保密","四川","3512605","6","","10000","0","","优终于复刻啦！还有小魔女可莉！你们快快来我身边吧！"
"感觉感觉好看","男","山东","1475350081","5","精灵王","10000","0","","可莉新服装好好看哦，凯亚服装很有特色"
"如花的翠花是村花","保密","广东","1659222201","4","","10000","0","","2CXWMRTESDD6"
"光速打脸啪","保密","重庆","295653670","6","","10000","0","","散厨狂喜，我的宝贝给你补二命[星星眼][脱单doge][嘟嘟][打call]"
"肥啾如是说","保密","未知","70934757","5","多多poi","10000","0","","枫丹要来叻！[崩坏3・终焉归始_燃起来了]"
"秦诵无衣","保密","天津","403438083","5","","10000","0","","这次不过劫了，不过地图严格意义上不算须弥的，所以四舍五入须弥咱一直在渡劫[脱单doge]"
"影之始翼","保密","未知","456210411","5","#EveOneCat!","10000","0","","欧耶 下个版本回归一下 ,我的可莉宝贝呼呲呼呲[保卫萝卜_笔芯][保卫萝卜_笔芯]"
"昔时懒回顾","保密","甘肃","24486885","6","","10000","0","","世界上最可爱的可莉宝宝！！！"
"qdbirdman","保密","山东","2772797","5","","10000","0","","枫丹为啥看起来好像达拉然呢"
"玄天丶","保密","广东","1992083796","5","","10000","0","","这个版本旅行者们就让优厨高兴高兴吧，毕竟三四个版本优池子都没有复刻，必定会触底反弹，只要不走向另一个极端，大家就多多担待[保佑]"
"啊欣阿欣","保密","澳大利亚","13466391","6","","10000","0","","我去，这评论数一看就不简单"
"拾得红炉一片雪","保密","河北","486918148","5","萌宠小狗","10000","0","","有新图吗"
"蓝天不是澜天","男","山东","544571095","5","","10000","0","","今年肯定跟去年须弥一样，会有一个专栏视频分好几步专门介绍枫丹[脱单doge]"
"申鹤不歪-","保密","河北","1620679223","3","","10000","0","","泰酷辣"
"}光叵--o","男","上海","495849427","5","","10000","0","","凯亚新皮肤好耶，我朋友凯亚厨这下狂喜了[笑哭]"
"乌鹊magpie垩空垩","男","河北","385409719","6","冥冥dlc头像框","10000","0","","啊啊给空也出一个吧～敬礼好可爱！"
"账号已注销","保密","湖北","494392502","0","","5000","0","","mad这皮肤真好看，可惜没保底"
"水形幻人","保密","黑龙江","663188767","5","原神","10000","1","","错过直播，评论区有节奏吗[脸红]"
"滑稽剧场版","保密","江西","291816115","6","","10000","0","","海岛有璃月角色吗"
"龙神尊王","保密","陕西","361200123","5","","10000","0","","送的皮肤感觉没有差过的"
"疯狂徒花","男","山东","3701313","6","","10000","0","11","继兽耳娘 精灵后 这次是真正的福瑞角色了？"
"wait-shadow","男","江苏","1686648531","5","橘猫挂件","10000","0","","凯亚衣装太好看了"
