"昵称","性别","IP","UID","等级","装扮","用户权重","获赞数","粉丝团等级","评论"
"-夜雨声繁","男","湖北","77207087","5","","10000","40835","","既然4.0要去未知的枫丹探险，考虑到很多萌新第一次探险遗迹，特别提醒一下各位，进入遗迹以后需要先在东南角点燃一支蜡烛才能开宝箱，如果蜡烛熄灭，须速速退出，不可取一物。这是冒险家行会祖师爷所定的一条活人与死人的契约，千年传承，不得破[OK]"
"玖{","男","河北","622284845","5","","10000","23170","","沙漠中的尤，简称“沙拉”(  )"
"上官序","保密","湖南","73807100","6","","10000","20474","","凯亚成为首个有邀约加传说任务加皮肤的角色[脱单doge]"
"下次_下次一定改--昵称","保密","浙江","510551453","5","刺客伍六七","10000","7188","","因为夹子这个词火了，导致现在听到软糯一点的声音，就有人刷夹子，问题是这本来就是讽刺那些做作不自然，让人听着不舒服的声音的，结果现在听的稍微幼一点，又有人乱刷夹子，属于是学了个词就乱用了，现在就连正经的配音都会被别人说成夹一下，夹一下，我真服了这帮人"
"沉默的拾伍分","男","广东","13891052","6","","10000","2447","","好耶，是可莉皮肤，可莉控狂喜！爱了爱了！这波必拿下！[脱单doge][脱单doge]"
"爱赖床的琪琪子","保密","广东","591932524","5","","10000","457","","米忽悠:我们即将复刻一个很久都没有复刻的角色。,优:切。,米忽悠:她是个女角色。,优:嗯。,米忽悠:她是冰属性神之眼持有者。,优:嗯。,米忽悠:她的专武是蓝色的。,优:（看着旁边的松赖越看越像绿色。）,米忽悠:而且我们将up与她相配的角色。,优:（扭头看了一眼米卡和修女的复刻时间，继续坐着不抱希望）,米忽悠:这个角色就是！！！,优：（起身向门外走去，仿佛这次又不是自己）,米忽悠：优！,优：嗯..嗯？嗯！,一斗：恭喜恭喜！（鼓掌）,米卡：恭喜队长。（鼓掌）,罗莎莉亚：恭喜。（鼓掌）,绫华：恭喜。（鼓掌）,申鹤：恭喜。（鼓掌）,雷将：恭喜。（鼓掌）,阿贝多：恭喜。（鼓掌）,绫人：恭喜。（鼓掌）,温迪：恭喜恭喜！要来一杯吗庆祝一下吗（鼓掌）,钟离：恭喜这位骑士小队队长，这场复刻来之不易（鼓掌）,甘雨：恭喜。（鼓掌）,魈：恭喜。（鼓掌）,胡桃：恭喜啦。（鼓掌）,宵宫：恭喜你！要放烟花庆祝一下吗？！（鼓掌）,草神：恭喜你，这个消息对于你来说就好像雨过天晴。（鼓掌）,妮露：恭喜你！（鼓掌）,赛诺：恭喜。（鼓掌）,海森：恭喜（鼓掌，一脸希望能早点下班。）,万叶：恭喜你蒙德的女士。（鼓掌）,夜兰：恭喜你。（鼓掌）,米忽悠：与此同时，可莉，心海还有阿帽也将跟随复刻！,可莉：恭喜优姐姐！好耶！是和优大姐姐的大冒险!,心海：恭喜你，优小姐。,阿帽：恭喜你了。,米忽悠：不知道旅行者们的原石攒的怎么样了呢，我们拭目以待。"
"究极巨tm可爱的露露","女","安徽","530891594","5","崩坏：星穹铁道","10000","75","","我在想为什么枫丹出现的时候没有须弥那种惊艳感，总结起来感觉是……一方面，是目前放出的东西，没有特别惊艳的，像当初的赤王陵，依托树木而建的须弥城，都是前两个大版本没有的。且当初须弥出来时，放了不少大气的地标，这次没有什么特别引人瞩目的地标。另一方面，可能单纯是因为现在玩家眼光放高了吧？"
"椰奶香香的","保密","江西","1237403486","5","","10000","304","","盛夏！海岛？大冒险！,仲夏！幻夜？奇妙曲！,清夏！乐园？大秘境！,炎夏！火山？大爆发！,孟夏！音乐？交谈会！,凉夏！海滩？奇妙屋！,酷夏！露营？大阴谋！,寒夏！雪花？大迷宫！,宁夏！回族？自治区！,黑夏！背带？打篮球！,帮miHoYo想好了明年的标题[doge]"
"Kuro的帽子","保密","江西","1434195160","4","天官赐福动画","10000","1024","9","省流：优拉复刻了！,上半：优拉 可莉,下半：心海 流浪者,凯亚出邀约了！（大喊）,凯亚和可莉出新衣了！（再次大喊）凯厨过年力,这次版本大活动叫清夏？活动？大秘境！又是传统格式呢（大活动做完一只菜依拉,这次联动联了晨光（？？？,音乐专辑更了（爬行）,更了珍珠之歌里的,七圣召唤又更了（摊）,好啦兑换码奉上,2CXWMRTESDD6,PVEXMQTXSVUJ,SDFW49BXAVDW,（磕头）祝各位旅行者十连出金！角色不歪！3.8见（挥手）"
"千石嘉滕","男","日本","8026912","6","","10000","609","11","直播间好多刷“就这点东西”的，基于每年限时地图的经验，我期望你们不要之后成为刷“肝”的一员。"
"符篆津映真天君","男","陕西","434452292","5","原神","10000","799","","为什么喜欢阿贝多在海边扇扇子？,因为海边有很多“扇贝”"
"盛夏光年sun","男","新疆","32415802","6","","10000","80","","为什么大家都这么急呢？枫丹肯定是主亚特兰蒂斯水世界风格啊，也没说不出蒸汽朋克风格的啊，须弥还两种风格呢，剧情到了枫丹自然会出蒸汽朋克，不可能把整个枫丹全部给你放出来吧？也不知道在失望什么。"
"镜l符凌_wzy","保密","意大利","400905530","5","","10000","887","","4.0快出了，我先提前爆料一个npc ,凯瑟琳[傲娇]"
"滑稽的小天使","男","广东","440996183","5","","10000","47","","希望这个夏日版本可以追求最普通的快乐，不要像之前那样搞角色过去，整得苦大仇深啊，活动也快乐点，愉快点吧，多点乐子(不是说之前的剧情不好，至少单纯的角色这种版本单纯的快乐就行，真的不是说剧情不好，说人物塑造不好，也不是说别的)"
"b站会变质但不会倒闭","保密","广东","70424683","6","","10000","71","11","希望原神在4.0能减少一些宝箱的数量，整合到任务去，须弥探索的体验感太差了，都是靠量，多给些任务补充一下世界观，少给些宝箱和神瞳[尴尬]"
"快去study","保密","黑龙江","24780120","6","原神","10000","2210","","睁眼看前瞻：凯亚，可莉，心海，优,闭眼听前瞻：景元，符玄，艾丝妲，你想要进入忘却之庭吗？[脱单doge]"
"冬眠中的夏狐狸","保密","广东","15055","6","物述有栖","10000","66","","不知道有没有人发现枫丹城市里还有机器人NPC角色，可能代表枫丹之后MHY会使用更多新体型角色了，这个新的福瑞也有可能是新的体型，很值得期待啊，原神里面出现螺丝咕姆类型的角色"
"AI沈阳美食家","保密","中国香港","3546376048741135","3","","10000","20","","笑点解析：这个搞笑视频通过让角色们说出一些幽默、奇怪或者搞笑的台词来制造笑点。比如，可莉是一个剔透而顽强的角色，但她也会说一些让人捧腹的台词，比如快到这个灯前来啦来啦。另外还有凯亚哥哥是搭档荣誉骑士哥哥就是骑士小派蒙的搭档关系，这样的搭配也是令人忍俊不禁的。视频中还有一些滑稽的场景，比如车子飞得好快，风呼呼的就飞过去了，这样的夸张场景也会引发观众的笑声。总的来说，这个视频通过幽默的对话和滑稽的场景给人带来了欢乐，让人忍俊不禁。,@某个_人_ 问的。"
"鱼盐_Yuyan","保密","河北","282876033","6","乐正绫五周年生日","10000","51","","第一次养电子宠物有什么注意事项吗"
"账号已注销","保密","河南","1942469416","0","","5000","22","","你这种情况我没见过 这样吧 你打开""明日方舟"" 然后在""集成战略""界面找到""水月与深蓝之树"" 然后在难度选择15 然后点击开始探索 选择""心胜于物""分队 然后点击""先手必胜""  在狙击卷中选择""寒芒克洛丝"" 在重装卷中选择""斑点"" 在术士卷中选择""预备干员-术士"" 然后点击""探索海洋"""
"槿颜暮安","保密","河南","1166146256","5","","10000","152","","直播一群说不要打牌的，我只想说一下，不打牌不影响拿原石，爱打就打，有什么要不要的。"
"KKOMDA","女","安徽","1740827542","6","","10000","387","","音乐真的太好听啦！"
"4399游戏盒","保密","福建","251347544","6","","10000","78","","[歪嘴]1分钟，我要知道那个粉色小可爱的所有资料！"
"原神第一偶像国崩","女","湖北","485741923","5","崩坏：星穹铁道","10000","216","","原来大家说了这么多了，被不灭月华吓晕了，现在刚醒"
"息所目取","保密","广东","13271358","6","","10000","498","","枫丹地图太棒了，眼前一亮 一锤子把我敲晕到新版本吧！"
"6个硬币没有啦","女","辽宁","85956082","5","","10000","90","","可莉宝贝新皮肤真的好可爱，凯亚老婆也好米[tv_亲亲][tv_亲亲][tv_亲亲]"
"林黛玉倒拔乾清宫","保密","福建","300372887","5","","10000","4542","","上课！摆烂？期末考！"
"陶典典","女","山东","370910889","6","星座系列：水瓶座","10000","544","","01:11 心海已经神志不清了哈哈哈哈哈哈哈哈哈哈哈哈哈"
"民国豌豆","保密","湖南","484465441","5","","10000","1314","","我想吐槽一句 凯亚大哥不是已经有传说任务了吗 为啥还要再给他添一个邀约任务？[笑哭][笑哭]"
"あわあわ君Awaawa","保密","福建","1965528","6","碧蓝之海","10000","468","","你的b站首页里可能突然涌出的一堆1000原石兑换码视频，不要点开不要点开不要点开！！！是快手的营销诈骗！！！是！诈！骗！！！！如果已经用手机号注册用户的，接下来不要轻信任何陌生来电，发现诈骗及时标记！！！！"
"尘世闲游天地晴","保密","浙江","442505192","5","","10000","442","","散兵和班尼特的海报留下来，别逼我跪下来求你[保卫萝卜_哭哭][保卫萝卜_哭哭][保卫萝卜_哭哭]"
"华硕笔记本硬盘","保密","福建","3494359857105230","4","2233幻星集","10000","1271","","一下出自浮夸哥:  对于每个人来说都不存在一个完美的故事，即使是游戏中的故事你可能也会有不喜欢的部分，你可能会更喜欢它之前或者之后的剧情对吧，这些都是很正常的事，但我们作为一个社区，在某些方面必须做的更好，尤其是不要出现又剧情相关的恶意中伤，因为到头来写出这个故事的也是一个活生生的人，那并不是说你不可以表达你对剧情的意见和不满，这是完全可以的，你当然可以分享你的见解，但是表达也得有个正确的方式，比如说“我不是很喜欢这段剧情它不太对我胃口”,而不是，（自行填补一段镍币人言论）"
"红烧麻辣兔头","保密","广东","82163805","5","","10000","537","","突然有点喜欢散兵了，能让这么多人破防太爽了"
"陶典典","女","山东","370910889","6","星座系列：水瓶座","10000","168","","00:31  00:32 ,可莉宝贝天下第一可爱！！！！！！！！！"
"Alaaaaaaaaala","保密","山东","3493112783571275","4","","10000","147","5","凯亚为什么扔了一个蟑螂（）"
"减速剂重水","保密","四川","636339371","5","中野三玖","10000","1936","","高考！成绩？今晚出！[doge]"
"_Celsius_","保密","辽宁","405543369","5","","10000","136","","凯亚皮肤和戴因胸口那个标志很像"
"voidwatchers","男","四川","39876771","6","","10000","134","","你们提瓦特进步挺快啊，连平板都有了[doge]"
"冬天的一杯冰卡诺","保密","江苏","410692763","5","","10000","1627","10","有新地图，等于没活。有枫丹消息，等于没活。活动无聊，水下没新意。这样吧你给我找一个运营时间至少2年的二次元手游，每个版本有新地图，2年每个版本活动都不重复，对了，可不要是一些2d游戏啊[调皮]有这种游戏我肯定跟着你骂"
"lapislazuli__","女","河北","1917139105","5","初音未来13周年","10000","113","","趁没上线把合成台这俩大哥删了好不好）"
"叱咤月海鱼鱼喵喵猫","女","吉林","352321582","6","","10000","120","","恭喜这位b.――b站同志天选之人"
"在某一天或一天","保密","湖南","11788544","6","雾山五行","10000","104","","快给爷做成皮肤啊！！！！"
"知小鸢","保密","江苏","487389672","5","","10000","1220","","一个老富翁把他的三个儿子叫到一个空房间里, “你们谁能把这间房子填满，谁就有资格继承我的遗产。”, 大儿子在房间里铺满了稻草, 老富翁失望地摇了摇头, 二儿子在房间中点了一根蜡烛, 富翁指着他身后的影子笑而不语, 三儿子说：“我觉得散兵很好。”, 顿时来了一堆不明生物，填满了整个房间,这样也行捏[保卫萝卜_哇]"
"卡维的忠犬","保密","重庆","480676842","5","","10000","98","","卡门能否把你比作夏日璀璨？ 你却比夏季更可爱温存； 狂风摧残五月花蕊娇妍， 夏天匆匆离去毫不停顿。 苍天明眸有时过于灼热， 金色面容往往蒙上阴翳； 一切优美形象不免褪色， 偶然摧折或自然地老去。 而你如仲夏繁茂不凋谢， 秀雅风姿将永远翩翩； 死神无法逼你气息奄奄， 你将永生与不朽诗篇。 只要人能呼吸眼不盲， 这诗和你将千秋流芳！"
"许是浮月","女","广东","354898002","5","","10000","1644","","散兵估计500年都去进修音游了，节奏感这么强[藏狐]"
"言默I别给我推恒右了","保密","广东","519598490","5","崩坏：星穹铁道","10000","60","","凯子哥，为了你，我变成狼人的模样！！！"
"次元の殇E","保密","江苏","102675","6","总之就是非常可爱","10000","120","","安柏：家人们谁懂啊？闺蜜和闺蜜跑了不带我[tv_大哭]"
"肥啾如是说","保密","广东","70934757","5","多多poi","10000","105","","好消息：枫丹美爆了！,坏消息：还有五十多年才到4.0[崩坏：星穹铁道_哭]"
"羽筱琰","男","贵州","66572878","5","","10000","123","","都是直播间逃来的？[脱单doge][脱单doge][脱单doge]"
"苏什么七","保密","广东","249048466","6","星座系列：天蝎座","10000","47","","凯亚的神之眼新壳子，感觉是蒙德元素和坎瑞亚元素混合起来了"
"混元大萝金仙","保密","浙江","340746073","5","","10000","108","14","景元带符玄到艾丝妲的地盘旅游[脱单doge]"
"HW的猫","保密","四川","634678186","5","咩栗","10000","90","","可莉的皮肤是真的好看捏[咩栗_nya]"
"_哲影_","男","湖南","497175112","5","","10000","44","","《过滤了异常行为》还不是一样给脚本号刷到了预约奖励[辣眼睛]"
"所以你变成了星星","保密","山东","3461570474543524","4","咩栗","10000","707","","散，更适合原神宝宝的节奏撕逼引流器，只要有他在，就不用担心没节奏，这真的是泰裤辣[未定事件簿_走了]"
"-麦粒太太-Ver-","保密","福建","43367551","6","希萝Hiiro","10000","86","","想要被新衣服的可莉骑在脖子上出去玩，只有我一个人这么想嘛！[微笑]"
"民国豌豆","保密","湖南","484465441","5","","10000","1006","","我想问一句，策划是不是和优有仇啊？一直压到现在的才复刻。[笑哭][笑哭]"
"杏子seiki","女","江苏","454198794","4","中野二乃","10000","85","","啊这，最近原神风气真的越来越差了……尤其是直播方面，希望官方重视，本来玩家都跑到铁道和其他新游戏里去了，流水还创新低，就连动画也没有消息，只能说原宝，你自己看着办吧[原神_喝茶]"
"なにもない","男","陕西","490708","6","","10000","64","","前半段：原神，更适合中国宝宝体质的益智游戏。,后半段：我一刻都不想待在3.8了！让我去枫丹！我要去爱丽舍宫找神瞳！"
"陶典典","女","山东","370910889","6","星座系列：水瓶座","10000","82","","让我去枫丹！！！让我去枫丹！！！让我去枫丹！！！！"
"君洛景明","保密","内蒙古","27992202","6","异常生物","10000","66","","米哈游你最好给我解释清楚凯亚的神之眼为什么多了一对小翅膀！！！！！！"
"牧月-忍冬","男","云南","111202477","6","崩坏3・天穹流星","10000","5446","11","瓶子国,许愿不被瓶子毒奶的世界[doge]"
"一缕千风而已","女","广东","625932806","5","","10000","64","","什么时候装修一下前两个国家，尤其是蒙德，要啥啥没有"
"民国豌豆","保密","湖南","484465441","5","","10000","2403","","我想问一句，复刻卡池里不是有大炮吗？为啥从头到尾就和他没关系？[笑哭][笑哭]"
"尘世闲游天地晴","保密","浙江","442505192","5","","10000","56","","散兵和班班海报留下来，别逼我跪下来求你[保卫萝卜_哭哭][保卫萝卜_哭哭][保卫萝卜_哭哭]"
"有生之年能看到吗","男","安徽","315622780","5","","10000","478","","瓶子国要收集152个瓶子吗[doge]"
"仓库我不是","保密","重庆","631342549","4","","10000","23","","枫丹城里还有机器人"
"明天柚子自由","保密","重庆","13560548","6","","10000","46","12","我只能说新的bgm是我这几天做梦素材了[原神_zzZZ]"
"听说改完名就能中奖","保密","广东","360222848","5","","10000","22","","01:10 眼里没有了高光的心海就像是…就像是…[doge]"
"夏蓝不爱吃香菜","保密","上海","90107030","6","明日方舟","10000","21","7","大半夜被这老哥整笑了"
"我天雷nf","保密","山东","686636821","5","","10000","42","","很喜欢之前看到的一条评论，在散黑和散解干架中最正常的是散兵本人[坎公骑冠剑_无语]"
"来吃小番茄吧","保密","江西","356776379","5","","10000","40","","前瞻所有人都在说可莉多么的可爱，但是我要说的是凯亚皮肤后腰还有镂空呃啊啊啊啊啊啊啊啊啊啊斯哈斯哈斯哈斯哈斯哈涩死我了斯哈斯哈斯哈斯哈斯哈[喜欢][喜欢][喜欢]"
"燧发纳仙","保密","山东","1920077601","5","","10000","29","","旅行者别睡太死，大的（审判）要来力！"
"我们定能重逢","女","广东","442470797","5","","10000","33","","不知道该说什么，那就祝看到这个评论的诸位，十连双黄，最差最差也绝对不会歪[原神_比心]"
"一个人类动物","保密","广东","1752105125","4","","10000","39","","孙晔老师所言即是！"
"旅行者酒馆","保密","四川","489986571","4","","10000","277","","兑换码有效期至2023年6月24日中午12:00,第一个：SDFW49BXAVDW,第二个：PVEXMQTXSVUJ,第三个：2CXWMRTESDD6,,欢迎各位前来原神WIKI玩呀~,原神WIKI：https://wiki.biligame.com/ys"
"重生之主教","保密","河北","668440418","4","","10000","25","","复现温室超导,1.准备一台存储空间100g以上的电脑。, 2.下载原神 m，注册米游社账号。, 3.按照指引完成新手任务，冒险等级到达10级，领取凯亚与丽莎两个角色。, 4.通过释放e技能攻击敌人，为两位角色充能，直到大招能量充满。, 5.选择丽莎开启大招为敌人持续挂雷，切换凯亚开启大招，贴近敌人持续挂冰，这样就能持续不断地触发超导反应。"
"白伶Ely","男","广东","42966022","6","初音未来13周年","10000","1178","","老公不  在 家 ,      独自一人,      寂寞难耐,火☆帷钤☆神☆兑☆换☆码,       激情   ,    SDFW49BXAVDW ,    PVEXMQTXSVUJ,    2CXWMRTESDD6,   300原石搞大我背包"
"一只路过的无名猫","保密","上海","482000318","5","","10000","28","","哇！日本那边联动的卡维好美啊[喜欢][喜欢]"
"机械师艾德","保密","广西","22415988","6","","10000","48","","大家别轻易被带节奏，不分场合无脑黑角色的要么是钓鱼的，要么就是脑子有点（），不然谁会对一个虚拟人物抱有那么大的恶意？可以多用举报拉黑，没必要自降身份在直播间弹幕和他们吵架，不仅不能说服他们，还会让弹幕氛围更糟糕"
"于梦访鲸落","保密","江苏","516283942","4","","10000","29","","已经开始期待了[保卫萝卜_哇][保卫萝卜_哇][保卫萝卜_哇]"
"倾奇者2号","保密","广东","3493078994258540","4","","10000","23","","直播在逃人士来了[doge]"
"心向那纯粹的红色","保密","河北","402654428","5","","10000","22","","河北！中暑？40度！,（最近热成[doge]了）"
"减速剂重水","保密","四川","636339371","5","中野三玖","10000","29","","woc，枫丹！这3.8我待不下去了，我现在就想去4.0[星星眼][星星眼][星星眼]"
"_タ阳_","男","广西","404418056","5","格兰芬多","10000","28","","这不就超导了吗？"
"花の物业","男","河北","449321299","5","","10000","25","","咱们米哈游为什么最近一直内战啊，原神的散兵内战，崩铁是罗刹内战，好像就崩三是对外的，你们有精力打自己人不如保护保护自己的地盘吧(>n<)"
"温迪是可爱的男孩子","保密","广东","456560189","5","","10000","38","","我承认我开弹幕看直播是错误的[藏狐][藏狐]"
"猫修仙人i","保密","广西","235664538","5","","10000","21","11","最新原神盲盒骗局大家不要受骗了，王者那边已经受骗上千万了，没想到蔓延到了原神，怕玩原神的再受骗https://b23.tv/BV1dP411q7Ar"
"泠之昵称太短版","女","安徽","129221350","6","","10000","20","10","好好奇！！！怎么会变成三个翅膀了！！！是做错了还是特意的？？？！！！！"
"酷洛修斯","男","四川","1321599","6","","10000","33","","谁有前瞻散兵那张动图啊。。。蛮帅的。。。没搜到哪里有"
"山木逢","保密","天津","1278410731","5","","10000","43","","原神又有节奏了？,那我只能：,投降不失为一种选择,请温柔的对待我这位手下败将,          ,        ,     [滑稽],Ich liebe Dich"
"瞿池鹿鸣","保密","重庆","1352035412","4","","10000","22","","班班和阿散的海报（直播截屏"
"核污水倒灌鬼子","保密","湖南","604203431","5","","10000","21","","玩游不混圈，前瞻被团建"
"同谐_希佩","女","北京","1064529112","5","","10000","188","","今日NGA，话剧"
"勃艮第酒红","保密","河北","168758036","5","","10000","29","","我室温超导呢"
"小黑子我劝你们荔枝","男","江苏","483046533","5","","10000","27","","最新枫丹消息,1.会有水神像,2.会有一个叫凯瑟琳的npc,3.主角可以切换水系（）"
"贺渐衿","男","天津","524147794","5","","10000","17","","忽然想起来一个事，都快枫丹了博士火烧世界树哪去了，我漏剧情了？"
"中二就是了","保密","浙江","450120878","5","公主连结佩可莉姆","10000","28","","为远征的勇士发放含美洲大蠊的高蛋白饼干"
"G2三三","男","河北","15317377","6","","10000","21","10","看着直播，欢愉使徒很舒服[调皮]"
"骂完人拉黑的真逆天","保密","浙江","3494362149292771","3","","10000","23","","为远征的勇士发放含美洲大蠊的高蛋白饼干和卡布奇诺猴猴"
"稻妻在逃散猫猫","女","江苏","16602403","6","原神","10000","119","","我都玩原神了，已经和世界上一半的人为敌了，又何妨与全世界的人为敌呢？就喜欢这种与整个世界为敌的感觉[大笑]"
"上帝没有怜悯之心","保密","江苏","434244416","5","","10000","27","6","为远征的勇士发放含美洲大蠊的高蛋白饼干"
"Zheng_Zong","男","湖南","35471755","6","2021拜年纪活动专属","10000","25","","沙贝,还是看这个吧,人家实验的直播https://live.bilibili.com/21987615?broadcast_type=0&is_room_feed=1"
"喂你吃了一口","男","江苏","249503612","6","","10000","21","","室温超导！启动！"
"其实我并不想火","男","福建","272045254","6","名侦探柯南","10000","15","","这下不得不抽散兵啦[惊喜]"
"篝之雾枝_official","保密","江苏","497603538","5","国民老公带回家","10000","26","","为远征的勇士发放含美洲大蠊的高蛋白饼干"
"FERRY沐川","男","黑龙江","615726882","4","","10000","14","","凯亚新皮肤真的好像这个[原神_嗯]"
"账号已注销","保密","吉林","1942469416","0","","5000","23","","三年热度爆炸难掩夕阳颓势，四年提纯结晶称霸半壁江山"
"-Blue_Star-","男","河南","387396379","6","","10000","13","","大家抽优心海可莉散兵肯定不歪，我以我的三命枫原万叶做保证[墨镜]"
"消灭舟大","保密","广东","3461568146705343","4","","10000","13","","审判！审判！审判！"
"爱摸鱼的小团雀","保密","四川","291064069","5","","10000","13","","心海被玩坏力（悲[崩坏：星穹铁道_哭哭][崩坏：星穹铁道_哭哭]）"
"夏月昂","男","四川","8314802","6","","10000","128","","兑换码：,SDFW49BXAVDW,PVEXMQTXSVUJ,2CXWMRTESDD6"
"l拂l","保密","广西","387250200","5","","10000","22","","凯亚，3.8版本最大赢家[doge]"
"虚拟歌姬好果汁儿","男","四川","287807129","5","洛天依8th生日纪念","10000","21","","为远征的勇士发放含美洲大蠊的高蛋白饼干"
"威猛鱼1215","女","江苏","431074799","4","","10000","20","","散兵那张图把快睡着的我直接惊到两眼冒光"
"混Z沌C渊Z源","保密","江苏","506591970","5","拳皇","10000","22","","为远征的勇士发放含美洲大蠊的高蛋白饼干"
