"昵称","性别","IP","UID","等级","装扮","用户权重","获赞数","粉丝团等级","评论"
"西浦澈","保密","无IP","316689347","6","","10000","0","","我是恬援♀泉大专处难德招生办主任欢迎来本学校报名[给心心][给心心]"
"暗阁Obliviate","保密","无IP","122647744","6","","10000","0","","不想说丧气话，但改动角色真的对玩家伤害很大，即便只是改动外观。"
"斯卡蒂的蒂骑","保密","无IP","3337424","6","","10000","0","","我就想抽个5命云堇等自选满命你让我花5单，1单一个云堇，是不是有点不合适啊？四星比五星还难抽[捂脸]"
"八点的薯条","男","无IP","291448193","5","","10000","0","","什么时刻可以天降一口虎头铡啊"
"宇文崽崽hhh","保密","无IP","174105150","5","","10000","0","","嗷呜～[doge]"
"一十六花","保密","无IP","687002864","5","良辰美景・不问天","10000","0","","原宝，加油！！！"
"博文哥-","保密","无IP","3776517","6","","10000","0","","穿的是真的多。。。"
"陆元希儿媳妇","女","无IP","286984553","6","刺客伍六七","10000","0","","原宝加油，一直在"
"妄梦晨曦","保密","无IP","424120986","5","","10000","0","","支持的"
"铁甲与鲜花","保密","无IP","442365376","5","","10000","0","","放弃幻想，准备斗争"
"却月凌风度雪清","保密","无IP","168898413","5","","10000","0","","如果打奥赛尔老婆的时候放弃，会到刻晴在的岛上。"
"一莲超人","保密","无IP","50711958","6","","10000","0","","八重外观不要改！！！"
"国家一级保护男酮","男","无IP","476651794","5","","10000","0","","https://b23.tv/QHLRIXd接力"
"心结桃子","保密","无IP","1874822524","5","","10000","0","","米哈游说到底是个小厂，没有后台，夹缝中求生存，退游不可怕，可怕的是对环境失望了"
"四月Vssr","保密","无IP","135294944","5","","10000","0","","谁发的弹幕《炊事班的故事》[藏狐]真是个人才"
"暂远而开","男","无IP","7495719","6","双生视界・花嫁","10000","0","","开放转服求求了"
"牧小诩","男","无IP","20345969","6","","10000","0","","【《请仙》-哔哩哔哩】 https://b23.tv/ggJ0p0a"
"富江吧","保密","无IP","1575173446","4","","10000","0","","我觉得衣服改下也没啥大影响呀[喜极而泣][喜极而泣]原宝各种任务多好玩儿呀，人设也制定的很有趣多样化，这次版本真的绝绝子！！！云先生唱戏那段让人仰目又触动人心，我可太爱了"
"原一今天买泡芙了吗","保密","无IP","35284997","6","星座系列：金牛座","10000","0","11","https://b23.tv/iY2CebR,合理申诉[未来有你_热情]"
"Mobius-LTTD","保密","无IP","1768316","6","少女前线","10000","0","","原宝，快把高清的神女劈观放出来[跪了]"
"换-个风格","保密","无IP","383731665","5","","10000","0","","（举报有用，但是申诉也是有用的，只要有理有据申诉的人量足够大也可以改回来，顶我上去，我真的不希望我那些角色被改了，我都是看xp抽角色，改了我还抽什么）这是我看刚刚被删的评论，现在申诉也不让说了吗[藏狐]"
"一生一个影","男","无IP","95506975","6","","10000","0","","能优化一下吗官方，2.4更新后就很奇怪，打怪不掉血，不产球，掉落也延迟[藏狐]"
"什么练习册我不知道","女","无IP","481720644","5","","10000","0","","虽然但是，莫娜裤子能设计得好看点吗[原神_嗯]"
"一只路过的小狂三","保密","无IP","436538606","5","三周年恋曲","10000","0","","看我空间置顶，我觉得这个比去冲别人有用多了"
"bJ","保密","无IP","628992909","5","","10000","0","","原宝加油啊"
"王乾龙Ashsteins","男","无IP","240274","6","","10000","0","","https://www.bilibili.com/read/cv14710785,.0."
"力论离学","保密","无IP","366826235","5","","10000","0","","角色服装改得我晚上睡得都不踏实。今天想起来还是很难受，角色服装设计没有任何不妥却因为那么一点人改动   实在是…,我们必须联合起来!"
"杨幂Snlsok","保密","无IP","386672301","3","","10000","0","","你让大伙瞅瞅  那改的好看嘛？"
"焱悠翎","保密","无IP","32248087","6","明日方舟音律系列","10000","0","","不是不能冲，而是要冲对了，你们应当知道问题出在哪儿"
"没钱送礼物看","男","无IP","687762695","5","多多poi","10000","0","12","原神我会一直玩下去的，我永远喜欢米哈游"
"潜水的海鱼","男","无IP","351623082","6","白神遥","10000","0","","又不是米哈游要倒闭了，这弹幕都是在干嘛[藏狐]"
"Jayden蚝油","保密","无IP","72644072","6","","10000","0","","哎无奈，只求能带着数据转国际服。。。"
"ドゥルキス","男","无IP","3495074","6","","10000","0","","rnm，退钱"
"油炸土豆丶","男","无IP","3104186","6","","10000","0","","或许，这就是至暗时刻吧...."
"杨幂Snlsok","保密","无IP","386672301","3","","10000","0","","退钱+1"
"LIMI忒","保密","无IP","351634119","6","","10000","0","10","很遗憾不能讨论游戏的事[大哭]但没办法"
"冀州猎犸人","保密","无IP","347960748","6","","10000","0","","我TM直接融入黑暗!,[doge][doge][doge]"
"雪茄之神","保密","无IP","56357664","6","","10000","0","","会聊天真君你放心好了，申鹤我会照顾好的"
"黑萝莉丶芙兰朵露","保密","无IP","9141790","6","约战・狂三","10000","0","","这波喷角色外观的，想起来上次肖战粉丝网暴AO3......[虎年]"
"九亿y","保密","无IP","302915315","5","","10000","0","","真服了"
"A-z27","男","无IP","14818808","6","绯赤艾莉欧","10000","0","","昨天真的是心态差点爆炸[笑哭]刚把莫娜练度拉起来准备玩冰队，更新前就是当头一棒，申鹤池74发歪刻晴，后来又83发终极大保底，若不是云先生的那段戏，怕是真弃坑了[笑哭]"
"前方是坚果-","男","无IP","37362813","6","","10000","0","","原神美工团队：你不相信我们的实力？[doge]"
"红夜夜夜夜","保密","无IP","9853835","6","","10000","0","","我是璃月艾伯特"
"蚵睡虫","男","无IP","174480382","5","","10000","0","6","原宝撑住啊！全村人的希望了[大哭]"
"剑语剑心","男","无IP","322998783","6","地中海","10000","0","","https://zhuanlan.zhihu.com/p/453902363?utm_source=wechat_session&utm_medium=social&utm_oi=983107557287735296&wechatShare=1&s_r=0"
"我本意一无是处","保密","无IP","14171187","6","崩坏：星穹铁道","10000","0","10","大家一起申诉，把角色给改回来"
"你酒楼后","女","无IP","71571468","5","","10000","0","","希望大家冷静点，跟着热评的几条去申诉！"
"睡前一局文明6","保密","无IP","248421655","6","","10000","0","","火使徒说派蒙会背叛旅行者,所以，派蒙=天理[OK]"
"天空之梦-云依","保密","无IP","336365680","6","","10000","0","","神女劈观啥时候出啊[doge]"
"言语匆匆","保密","无IP","220309862","5","","10000","0","","我真的特别喜欢这个版本的剧情。不管是璃月的还是渊下宫我都喜欢（虽然渊下宫全部是刀子）[大哭][大哭]"
"Kongo级Miku","保密","无IP","71991","6","","10000","0","","其实这次不是专属于米哈游的斗争，这次是整个游戏圈的事情。今天手游穿棉袄明日端游着黑袍，再到后日单机也只能出海私逃，到时候想体验原版游戏就得海外见了。少前 fgo 碧蓝 王者 第五 魔法觉醒 哪怕是lol 守望 魔兽 DNF 都没能逃过最后一个个坟头石油面粉袋大花袄。"
"看到我熬夜请叫我睡觉","保密","无IP","12272515","6","","10000","0","","睡一觉醒来还是很不是滋味。[跪了]"
"云华铁骑","保密","无IP","62570699","6","明日方舟","10000","0","","衣服什么时候能回来啊[大哭]"
"99349528275_bili","保密","无IP","395846361","5","乐正龙牙三周年","10000","0","","孤云阁有归终机！"
"焱悠翎","保密","无IP","32248087","6","明日方舟音律系列","10000","0","","不能在视频底下好好讨论角色真的很遗憾，但当下有更重要的事,诸位，加油"
"亚里和多德","男","无IP","23307775","6","","10000","0","","当我说希望妻子是处女时，她们说这不是封建社会，当我喜欢虚拟人物时，她们有说侮辱女性。她们什么时候都有的说"
"太阳黑子1","保密","无IP","14313068","6","","10000","0","","原宝加油！"
"炭","保密","无IP","100702298","6","良辰美景・不问天","10000","0","","原宝，丘丘人不穿衣服就在提瓦特乱跑我不是很认可，建议给丘丘人加军大衣[傲娇]"
"天街丶灯","男","无IP","517712484","5","","10000","0","","原宝，两岸猿声啼不住，轻舟已过万重山"
"新卜栀","保密","无IP","179282195","5","","10000","0","","加油"
"夜落樱华","保密","无IP","68113820","6","","10000","0","9","如果集体申诉会不会又被打成“饭圈”？,真就别人说你是饭圈的时候你最好真是[doge],真就比烂呗"
"伊莉丝的冒险","女","无IP","86387341","5","","10000","0","","心里本来很难受，上线后在魈池子里抽了一发十连，一个魈和俩云堇跟我回家了，心里好多了。我是因为看主播抽甘雨觉得这个角色特别好看才入坑的，当时也是在甘雨池里五发之内把甘雨带回家的，作为萌新一直都是跟着甘雨长大，之后又有大佬一路带着我玩，开荒期刮痧痛苦我基本没体验过，被别人带着爬雪山，打冰本给我的甘雨，把精五试做换成精一阿莫斯，当时喜欢的角色甘雨钟离温迪阿贝多和魈全都抽到了，陪我的大佬虽然退坑了，但是我又开始带新的同学和萌新，每天在提瓦特过的都很快乐，角色改衣服我能接受，但是如果因为一些人所谓的女拳去改衣服，我不能接受，我不认为现在网络上的女拳给我带来了什么利益，我只能看见它们在不断挑战别人的底线并且抱团恶心别人还自以为自己非常正三观"
"西瓜蹲完蘑菇蹲","女","无IP","220104246","6","","10000","0","","原本的样子不管色不色，主要是很好地展示了角色魅力和特点，改了就没内味儿了。。说到底重点错了吧，mhy本身又不想改的，自己辛苦做出的成果乱七八糟一通改他们也难受啊。退坑个米哈游有啥用，还把自己的情绪发泄到自己本来喜欢的东西上，小孩子吗，打不过冲别的发脾气？"
"椰の旅途","女","无IP","14842695","6","","10000","0","","每次原神前瞻我都能被震撼到，如此用心的游戏，如果原神真的被搞的玩完了，那么，或许国内游戏界真的再无光明"
"折磨zemor","保密","无IP","366039565","6","","10000","0","","麻了，池子里全是重云，重云抽满命了"
"三角裤的杯具","保密","无IP","126120674","6","","10000","0","","只改这4个我能接受。[辣眼睛]"
"天使默默","男","无IP","32676663","6","","10000","0","","能发一下神女劈观那一段吗，或者兄弟们有办法找到文件吗，我要存下来[给心心]"
"闪光巨山超力霸","男","无IP","335585882","5","","10000","0","","原宝加油！！"
"KurohimeYuhi","男","无IP","345048976","6","","10000","0","","多和谐点啊 我想多来点原石[打call]"
"下次_下次一定改--昵称","保密","无IP","510551453","5","刺客伍六七","10000","0","","绝了，B站现在开始吞动态了，好多推荐合理申诉的动态全给驳回了，我动态至今未发出去过"
"百合花@坶L篇","男","无IP","488050372","5","","10000","0","","毁灭吧[虎年]"
"方知危楼亦宝楼","保密","无IP","70973957","5","","10000","0","","官方能不能上传一下《神女劈观》啊"
"我灬我不是萝莉控","男","无IP","94658204","5","雪未来","10000","0","","我游戏名 米卫兵首席  知道我成分了吧"
"athenaaaaat","保密","无IP","36641269","6","","10000","0","","九色鹿！出个九色鹿的角色好吗！！！白蛇的也不错啊！"
"西丨界","男","无IP","33845453","6","星座系列：天秤座","10000","0","8","震惊，游戏里面居然有女性角色，这是让宅男来玩弄女性[doge][doge]"
"公佐","男","无IP","197707219","5","","10000","0","","我是云堇的狗!"
"魈大人的小天才手表","女","无IP","16111931","6","","10000","0","","总是在前进的，不过是跑，飞，走，还是爬，都是在前进的。,未来没法抗拒，那就大胆的去面对他，原宝冲呀[保卫萝卜_哇]"
"岚夜Prodorman","保密","无IP","282866329","6","","10000","0","","迷语人个鬼，最后那段明显说的是我们仍未结束的旅行[虎年]"
"Chen_山川","保密","无IP","22118977","5","原神","10000","0","","我一直相信米哈游是和玩家站在一起的。"
"笑而OAO不语","男","无IP","3085615","6","","10000","0","","有些人连为什么要改都没搞清楚就别发言了[翻白眼]"
"玛奇玛大小姐的爱犬","男","无IP","17029354","6","","10000","0","","差不多得了，搞得像只有原神被改了一样，碧蓝航线少女前线等等都改了多少回了[坎公骑冠剑_无语]"
"根正苗t新青年","保密","无IP","69738569","6","雪未来","10000","0","","为什么把飞行模型虚化加上去了，你知道我刻晴买件新衣服结果E跑图的时候开翅膀，人直接没了是什么感受吗"
"许她年岁","保密","无IP","8019991","6","星座系列：白羊座","10000","0","","以前:这世道怎么了 现在:感恩 .jpg"
"教育illustration","保密","无IP","515220511","5","","10000","0","","我喜欢的何止这些角色的身体[原神_喝茶]"
"玄泽子","保密","无IP","291351980","5","","10000","0","","……"
"红伞白杆板板","男","无IP","399401640","5","","10000","0","","不喜欢申鹤无意义涩皮的路过，我同样反对旧角色和谐，但是双方我都不站，你们可劲斗。原神不靠软色情，靠人物情节塑造才是正途，才会更长久"
"少光","保密","无IP","1420406","6","","10000","0","4","米哈游也是受害者，玩家就活该倒霉？觉得新皮好看的就留着，觉得不好看的能退货退款吗？莫娜不要了行不行？"
"42668-","保密","无IP","478601788","4","","10000","0","6","刚刚的热评说申述的去哪了？被吞了？[吐]"
"tokoさん","保密","无IP","628699098","5","不思议之旅","10000","0","","云先生我来了！[打call]"
"吾乃呆呆瓜Noob_Melon","保密","无IP","364807563","6","战双帕弥什","10000","0","","https://b23.tv/CvCXDi2,我用自己的p手，把@不完美的世界，成我所期望的幼[打call]"
"期待成为欧皇的非酋","保密","无IP","431097478","5","星座系列：天秤座","10000","0","9","对不起原宝，这破烂手机真带不动原神，登都登不进去[笑哭]"
"浅香アサカ","女","无IP","60634655","6","怪盗基德","10000","0","","原宝加油"
"蕾姆の486w","女","无IP","171277347","3","","10000","0","","冲冲冲原宝，顶着[星星眼]"
"在下剑圣苇名一星","保密","无IP","21365881","6","","10000","0","","为了守护最后的净土国际服，我把今年我的年终奖，2000刀全氪亚服了"
"温迪の修勾","女","无IP","39502376","5","","10000","0","","原地化为米卫兵，原宝加油，挺过去！我还有648没有给你呢[哭泣]"
"娜维娅Navia","保密","无IP","407552696","5","","10000","0","","所以平时强度党和xp党为什么互怼？也都是各有节奏，而且还有交集的"
"矿泉水一次喝两升","男","无IP","1252356210","4","","10000","0","","七七被借走，申鹤扛着石头去工地[微笑]"
"大快人心2333","保密","无IP","12858127","6","","10000","0","","乐"
"猴吉老","男","无IP","39979918","6","","10000","0","","原宝儿加油！！！！！！！！！！！！！！！"
"文厨一枚","保密","无IP","13462983","6","","10000","0","7","220抽没出云[辣眼睛]，云先生的票价也太贵了吧"
"GArsony","男","无IP","7563153","6","","10000","0","","若改雷神 不充月卡 [吃瓜]"
"Acrher_","男","无IP","162011626","6","","10000","0","","兄弟们，先听我说我20出金了，但是歪了莫娜而且没有云瑾，现在要等甘雨，云瑾只能自选了[大哭]"
"哦俩","保密","无IP","4461346","6","","10000","0","10","如果没有好的建议或者找到合适的渠道去申诉，尽量不要带节奏。现在人心惶惶，节奏四起。我能做的就是尽量不让自己成为添乱的人。如果有好的方法需要大家的话，我等义不容辞。但现在，不偏听偏信，不散布谣言，就是最好的做法了。"
"arashi樱","女","无IP","35268393","5","","10000","0","5","那些随随便便就退坑炎上的人，早点退了好，我巴不得你这种人早点消失[藏狐]"
"甘宁今天吃什么","男","无IP","130876734","6","","10000","0","","假如甘雨雷神等角色接下来也被改，我只能说原神官方是个孬种，只会打内战的玩家也是[嗑瓜子]"
"账号已注销","保密","无IP","395087476","0","","5000","0","","稻妻纪念品商店的胚子被雷神薅无了？[思考]"
"我灬我不是萝莉控","男","无IP","94658204","5","雪未来","10000","0","","真羡慕原魔玩家，可以被云先生按在地上摩擦，我好喜欢啊"
"鸣崖飞折","男","无IP","1781346979","5","","10000","0","","阿晴新衣服真的nice[doge]"
"E_mbers","男","无IP","35597438","5","崩坏3・天穹流星","10000","0","","我昨天还是太生气了，今天冷静下来了，我不会退游的，我玩了这么多年米哈游游戏了，我顶米哈游，tnnd，谁敢搞老子玩的游戏我让它们也不好过。"
"逃逸安逸","保密","无IP","18759918","6","","10000","0","","出转服。能不能gkd"
"crbbay","男","无IP","438645217","5","原神","10000","0","","能够“拯救”原神人的三个东西,拳师，友商，mzr,[辣眼睛][辣眼睛][辣眼睛][辣眼睛]"
"我还是想中奖","女","无IP","29993611","6","时光代理人","10000","0","","原宝撑住啊，原宝你一定要撑住，从今天起我就是米卫战士，你一定要撑住啊！"
"空の言弹","保密","无IP","252798093","5","星座系列：水瓶座","10000","0","","BV1aa411z7EP你行不行啊还不发，别人自己录的都上热了"
"睡--着了","男","无IP","442655857","5","","10000","0","","对于这次服装修改。我能做的就是把月卡买满。然后双倍清空支持一波米忽悠。对于这次的节奏希望各位玩家理性一点，虽然米忽悠抠得要死。ch也不当人。但我们玩家要的顶多烧个ch祭天。可是有些“人”却是要它死。这波节奏少不了一些同行的推波助澜。大家要理性一点，理性一点，理性一点。不要被一些“人”当枪使了。。。最后，请大家相信米忽悠的美工，"
"且看风吹叶摇","保密","无IP","170278542","6","","10000","0","","原神撑住呀，顶住压力，甘雨千万别改呀"
"繁星疏雨","男","无IP","28529241","6","碧蓝之海","10000","0","","刻晴、温迪、万叶释放技能时视角稍微上移，释放后就会因飞行视角虚化，严重影响游戏体验，建议适当调整虚化触发范围"
"心结桃子","保密","无IP","1874822524","5","","10000","0","","原神被女拳举报了，女角色全部改成羽绒服，原神完了"
"白日大饼","男","无IP","195436840","5","","10000","0","","？发生啥事？"
"箪萏","保密","无IP","330402931","5","喂，看见耳朵啦","10000","0","","mhy也是受害者…角色机制数值方面有争议，但这种事没什么可说的"
"扇物语","保密","无IP","24881985","5","","10000","0","","天凉好个秋"
"冠位骗术师梅林","男","无IP","122381560","6","星座系列：摩羯座","10000","0","","乐"
"真嗨冲","男","无IP","203364906","5","三周年恋曲","10000","0","","支持米哈游[热词系列_可以][热词系列_可以][热词系列_可以]"
"芙柠娜","保密","无IP","328066883","5","","10000","0","","来点讨论云堇的，服装的事有专门的动态可以说(我不是不让讨论，好歹热评来几个云堇的吧)"
"不苟岩笑","男","无IP","176860116","6","三周年恋曲","10000","0","10","节奏什么的我都不怕，该我也咬牙挺，但是mhy你拿派蒙刀我我肯定退游[大哭][大哭][大哭]"
"容易恢复的人","保密","无IP","33294867","6","","10000","0","","首冲党破例来单648，抬你一手，加油mhy[doge]"
"小火车ksks","男","无IP","7782872","6","","10000","0","","只有我觉得申鹤建模很奇怪吗？腿长到过分了，躯干甚至不如大腿长，整体感觉不太好"
"破晓自由","男","无IP","357032103","5","","10000","0","","她将以春秋笔法演绎坎瑞亚的心酸灭亡[doge][doge]"
"这确实挺开心的","男","无IP","36623024","6","","10000","0","","速速发神女劈观"
"弘鸽鸽鸽","保密","无IP","179898826","5","","10000","0","","举报有用，但是申诉也是有用的，只要有理有据申诉的人量足够大也可以改回来，顶我上去，我真的不希望我那些角色被改了，我都是看xp抽角色，改了我还抽什么"
"账号已注销","保密","无IP","217781660","0","","5000","0","","https://b23.tv/f5SAoG8,豆瓣女拳"
"抽神子一发入魂","男","无IP","17655699","6","","10000","0","","我从未理会过那些节奏，我只想说。作为一个从崩坏二到原神的老咸鱼，我能看到米忽悠在游戏制作上的提升。我心甘情愿为米忽悠充钱，虽然不能和那些氪佬比，但我愿意为一个游戏公司能给我带来更好的游戏，更高质量的游戏，更有技术含金量的游戏公司充钱。不像某些游戏连一个客户端都有bug,当然我也喷过米忽悠的策划。可是我还是喜欢这个致力于为玩家带来更好的游戏体验的游戏制作公司，尤其是原神他让我"
"你比kd都难上","男","无IP","365239856","6","","10000","0","","原神加油"
"咸鱼逐日","男","无IP","4681395","6","","10000","0","","居然还有人以为是被举爆掉的，认清现状，教培行业规模零头都不如的在线娱乐行业，连pi都不算，掐死就掐死了，臭打游戏的不玩游戏又不会饿死，失业会饿死的教培行业都说完就完。,改变？你想改变什么？"
"蝶梦春朝","女","无IP","14434825","6","崩坏：星穹铁道","10000","0","","这次新地图真的超神了！加油！"
"Fisher少放颜","男","无IP","11811721","6","","10000","0","","快tm把你那个冥鱼优化了，不能因为叫冥鱼就阴间啊！！！！！！！我真的这几天的怨气都在这了，别让游戏玩我行吗？？？？？？"
"13光玉的奇迹","女","无IP","382773414","6","","10000","0","","我很喜欢曹老板的一句话:记住不要愤怒，愤怒，只会降低你的智慧,（曹氏盖饭）m桑一介匹夫！他哪里来的如此胆识 竟敢 明目张胆的改我角色！,（曹氏盖饭）♀冲我来了？！，m桑:“旅行者快走吧！这一我们接不住啊”，不行我头风犯了，头痛欲裂！,（曹氏盖饭）你混账！马上死到临头了你还不反击！,（曹氏盖饭）你把旅行者老婆们给补了？m桑:“我赔他一些原石就是了”，说得好，来人把他推下去砍了！m桑:“我早就想补了”,，啊，反了反了反了！,（曹氏盖饭）我老婆们怎么了！？m桑:“禀旅行者，你老婆她们..........被补了”，啊！！！！（旅行者仰天长啸后然后给m桑一个大逼斗之后就飞奔出去了）,（曹氏盖饭）那些角色原本就是我的，我的！我自有原石会把他们抽出来！干♀何事？！m桑:“它们令我改的，还让我把这块玉玺（价值1200原石)献给丞相”，我要它有何用！,说完，旅行者直接被气到倒地不起"
"响了十二秒的电话","保密","无IP","351321416","6","","10000","0","","第五人格好恐怖   王者荣耀妲己太色了    崩坏这是16+？   原神太露了  是啊  还有什么能拿的出来的游戏呢  哦哦吃鸡啊  吃鸡国际服是内衣   国服就算脱光也有衬衫和裤子呢"
"白昼空想","男","无IP","7915071","6","","10000","0","","提问：为啥外面啥不干也能得皮肤？为了公平吗，那应该都改再发放皮肤这样石头都省了啊"
"今天也要开开心心的o","男","无IP","38276076","6","","10000","0","","琴改了，我受不了[保卫萝卜_白眼][无语]"
"航海世家","保密","无IP","23519850","6","","10000","0","","加油！"
"いて","保密","无IP","185935107","5","星座系列：双鱼座","10000","0","","这次我站米哈游  2.4愉快的心情被这些狗东西毁了   我不想骂人 （你们怎么还没死完）"
"ghost子弹","男","无IP","7098105","6","至尊戒","10000","0","11","原神修改建模申诉（我写了B站专栏在审核）,https://bbs.nga.cn/read.php?forder_by=postdatedesc&page=e&tid=30150531&rand=125"
"_Decorator_","男","无IP","19159576","6","三周年恋曲","10000","0","5","https://b23.tv/EFtdqJw"
"抽神子一发入魂","男","无IP","17655699","6","","10000","0","","原宝加油，米忽悠加油。能打败米忽悠的只能是米哈游。加油"
"WeChat_130698053","保密","无IP","13069803","6","","10000","0","","转服"
"阿拉斯加联大","保密","无IP","66577521","6","","10000","0","","“战场不似舞台” 好像一个四川配音说“战场不是舞台”的时候嘴飘了"
"ypy2333","保密","无IP","110532403","6","","10000","0","","谜语人实锤"
"こころが晴れる","保密","无IP","393238516","5","公主连结可可萝","10000","0","","加油！别被击垮！[加油]"
