"昵称","性别","IP","UID","等级","装扮","用户权重","获赞数","粉丝团等级","评论"
"闲听子也","男","无IP","408286490","5","魔兽世界・暗影国度","10000","2","","我以前对戏曲并不感冒。不明白为什么老一辈的爷爷奶奶都喜欢听戏曲。现在在原神，2.4遇见了云堇，好家伙，因为一个自己喜爱的角色，让我对戏曲产生了浓厚的兴趣，也深切的感觉戏曲的唱法有一种独特的美感。,真的感谢原神。[打call],,中华民族有很多的优秀传统文化在年轻人中流行不开，我个人认为，很大原因是受限于原先的传播平台，或者表现方式。不是不好，只是不容易让现在的孩子接受。,,不说了，云堇老婆叫我回家吃饭，听她唱戏了。[脱单doge]"
"old-ass","男","无IP","11404962","6","","10000","2","","https://b23.tv/EaMsSUg"
"独乐乐和众乐乐","保密","无IP","1931805140","4","","10000","2","","看我动态，短期内不挨删"
"丰年笙歌","男","无IP","12277957","6","","10000","2","","优的PV音乐什么时候出啊，多久了。[保卫萝卜_问号][保卫萝卜_问号]"
"忧忧心忡忡","男","无IP","10609962","6","","10000","2","","只会落井下石跟风倒的他们想怪想退坑就让他们退坑罢了，不去怪这莫名其妙的“应要求”只会没有脑子思考的怪被“搞”的一方还能指望他们能明白事理对错？好好玩自己的就算了反正这种事也没办法无法反抗因为没有渠道，但是只能举报然后就打绿灯或者说要求修改游戏内容这正常吗？游戏圈常态了二次元更是屡见不鲜了，不然血会能是绿色的石灰色的？这个世界上在未满18岁小孩眼里是不会流血不会受伤不会去世的是吧？心里脆弱再怎么隐藏也隐藏不住何必怪游戏动画？现在未成年基本玩不了游戏了也（虽然和我无关），真tm魔幻[辣眼睛][tv_调侃]"
"Elysia_Original","保密","无IP","21649409","6","","10000","2","","我们联合!走合理的申诉渠道, 大家加油哦(芭芭拉声线)!"
"账号已注销","保密","无IP","350990193","0","言和7th生日纪念","5000","2","","原宝你告诉我那个深渊火使徒只是在胡说，派蒙是不会背叛[原神_嗯]的对吧[来古-震撼]"
"KISS素颜！","保密","无IP","30760065","5","春原庄的管理人小姐","10000","2","","攒了2万原石+10个粉球[笑哭]不知道下一批能不能出钟离+甘雨"
"十__X","保密","无IP","178986604","6","记忆U盘","10000","2","","各位接力下，记得保存,https://b23.tv/wRkfrbE"
"Judas-佞","男","无IP","46862222","6","崩坏：星穹铁道","10000","2","","https://b23.tv/KrceyxN,https://b23.tv/kOXS6KJ,请大家帮忙看看顶顶转发，关于玩家如何合理申诉"
"星空之下-一眼千年","保密","无IP","87823234","6","","10000","2","","这次的剧情，地图，还有最后云堇先生的戏，真的看得我鸡皮疙瘩都起来了。如果不是这次的衣服事件，估计这次能引爆全网。,但是改衣服的事情，还是让我很难受啊。我相信米哈游的美术，穿的越多人物越涩，就算真的改版也不会太丑（这次莫娜明显就是没时间改随便搞了一下）。但是，我讨厌的是，我曾经拥有的被人这么肆意玩弄修改，还是因为一些莫名其妙的家伙导致的。,可是我什么都做不到，只能默默伤心然后心里痛骂那些举报狗全部司马。,我知道这不是原神的错，我也能理解那些说“改了就退坑”的人，因为我也有一瞬间产生了退坑的想法。很讽刺，第一次产生退坑的想法是在这种情况下。,但是，你能逃到哪里？只要你还在国内，只要你还打游戏，就会有这样的事情发生。而在国外，呵，国外的zzzq，只会有过之而无不及。,所以，团结起来吧，搞清楚目标和方向。不要互相攻击，退坑，融号都是没有用的，只会让那些人更嚣张。,我不会退坑，我还会一直玩下去，希望有人和我一起坚持"
"海洛混合物","女","无IP","284914412","6","","10000","2","7","https://b23.tv/cSinMyL 补个"
"灰太狠办公窒","保密","无IP","698389807","5","","10000","2","","https://b23.tv/2lVdOMy"
"缘之龙月","男","无IP","102576048","5","","10000","2","","我们要合理申诉，别让某些人达到目的。好好地欣赏2.4剧情就是有力的反击，我永远相信米哈游美工"
"大熊看动画","男","无IP","23665985","5","圣诞节快乐","10000","2","","先生真的惊艳！！！"
"acvily","保密","无IP","526322170","5","","10000","2","","这个评论瞬间清了一半，写申诉的热评全没了[tv_白眼]"
"九和月","保密","无IP","143918754","5","2021拜年纪","10000","2","","https://b23.tv/pXCsLxG签到别忘[doge]"
"DOOUZ","女","无IP","490217955","5","","10000","2","","蒙德崇尚自由，但最先被改的竟是蒙德角色[笑哭]"
"lolo-_-","男","无IP","358626114","6","明日方舟音律系列","10000","2","","希望大家能尽自己一份力[OK]https://t.bilibili.com/612499548010498782?tab=2"
"小豪提不起劲啦","男","无IP","9197219","6","","10000","2","","他们只道原先生工架优美，却不知她的武戏架势是真能御敌的。"
"镜子银","男","无IP","513618806","5","","10000","2","","兄弟们跟团了,复制粘贴下去，这次的服装整改是女权有预谋的，欧美女权早就对游戏出拳，所以欧美游戏中女性都长的十分难看。如果今天你们不抵制女权，以后游戏里也不会有漂亮的女角色,举报人之一@晴明的小公主,想知道为啥改角色立绘和模型来看看这些,https://b23.tv/u1QyWzr,https://b23.tv/HHejxIF,https://b23.tv/7Ur87Gj,https://b23.tv/KY55BtC。,豆瓣,“女性玩家专用组”,♀拳大本营,帮忙过去举报一下,xdm谢谢了（对了别看帖子和评论，容易把晚饭整出来）,顺便借别人的一个评论，表达一下我对mhy的态度,我一直相信mhy美工的，哪怕不露太多也会很好看才更体现实力，所以我并不担心，但心里多少还是有点难受的，另外，我希望说转国际服的只是开个玩笑，我很理解各位的心情，但这次真不是mhy能控制的，我们再不支持还有谁能支持呢？"
"好大一只赤","保密","无IP","504840077","5","","10000","2","","握紧键盘了宝们，我刚刚发现有些很中肯的评论都被举报没了，大家可以翻一翻[藏狐]"
"静谧的城池","男","无IP","37687411","6","","10000","2","","想不到供人娱乐欣赏的纸片人都要改。愚蠢"
"土豆泥iiii","保密","无IP","53969509","5","","10000","2","","“盐之魔神赫乌莉亚柔弱且迁就，她认为只要自己退让，战争就不会波及自己以及自己的子民，但在无底线的退让中，她失去了所有土地，只剩下最后的容身之所”"
"长安逸不","男","无IP","1132773761","5","","10000","2","","我们要做的就是团结一致先从玩家内部开始，不要随意内讧，不要被随便带节奏，相信原神，支持原神[点赞]只要我们能够团结一致这次他们也掀不起什么大风大浪，所以要团结支持原宝。相信米哈游"
"羽笙-Yu","女","无IP","176050406","5","","10000","2","","兄弟们靠我们自己了,https://b23.tv/ZnXQz5d（被和谐了看我动态）,个人空间:https://b23.tv/gA2nbN3,今日割五城，明日割十城，然后得一夕安寝。起视四境，而秦兵又至矣。这一次，决不能后退！,我已经冲了，各位跟上,各位能扩散的扩散一下,（接力）"
"被动劝退","男","无IP","35547867","6","碧蓝航线2020","10000","2","","如果和谐不可避免的话，我有一个想法是，以后出角色能不能考虑一开始就出两个模型供玩家选择。其中一个比较朴素一点，两个模型在最开始的时候都出，一个出问题还有另一个，这样的话可以给绝大多数玩家一定心理预期和缓冲空间，而不会像现在这么突兀了[笑哭]"
"三千椿秋","保密","无IP","480134957","5","战双帕弥什","10000","2","","[思考]有没有可能，我是说可能，原宝一开始就不让我们跳过剧情，只为了今日诸君都能听到云先生的戏[思考]"
"不要看我动态-","保密","无IP","363645215","5","至尊戒","10000","2","","真正问题是,当初因为外服反馈连带改了国服可莉的走路姿势,现在就不能连带着国内国外一起改？最关键的是就算不改外服，你也不应该把国服改动之后的样式当作衣装在外服免费送。,我等2.5版本，如果真如他们所料，国服改了然后还把国服改动衣装送给外服，那不好意思，爷还真不玩了,最后，xz给滚远点"
"Sparklyomia","男","无IP","50072451","6","","10000","2","","为什么云瑾是岩之眼？,因为她是演（岩）戏（系）的。"
"零区绝","保密","无IP","49285811","6","","10000","2","12","可――叹――,秋鸿折单复难双,痴人痴怨恨迷狂,只因那邪牲祭伏定祸殃,若非巾帼拔剑人皆命丧,凡缘朦朦仙缘滔,天伦散去绛府邀,朱丝缚绝烂柯樵,雪泥鸿迹遥,鹤归不见昔华表,蛛丝枉结魂幡飘,因果红尘渺渺,烟消,《神女劈观》到这里本该接近尾声，但今日我再添一笔――,唱与――诸位――听――,曲高未必人不识,自有知音和清词,红缨猎猎剑流星,直指怒潮洗海清,彼时鹤归,茫茫天地无依靠,孤身离去,今日再会,新朋旧友坐满堂,共聚此时"
"青青的成","女","无IP","806253","6","","10000","2","","说点题外话，我看有几个人说不要因为鞋不合适就不吃饭，我突然反应过来，我从昨晚下班看见琴，到现在一直没吃饭，完全没心思做饭。哎"
"工地恐龙","保密","无IP","1549399266","2","","10000","2","","那啥虽然我号被封了但是我是绝对不会退游的，我说的[OK]"
"不在校大学生","男","无IP","85072651","6","","10000","2","","这几天原神一出事，隔壁幻塔倒是更新的挺快的昂"
"老公VoV","保密","无IP","114151668","5","","10000","2","","https://b23.tv/14CMDnp,来领取今日份的签到"
"三年十七次","保密","无IP","374938655","5","总之就是非常可爱","10000","2","","云先生，我是你的狗...啊不是，我是你的戏迷啊！神女劈观怎么还没来啊！"
"南i闲","保密","无IP","517107995","5","","10000","2","","不想看雷神腰间拔刀，以后的角色都像粽子一样的都来私聊我，给你们投诉方式，该帮米忽悠打反击战了！！！！"
"磨磨叽_","保密","无IP","1757221616","5","","10000","2","","改模这事，就保留原来的，把新的那每人送一个，让玩家自己去改，游戏是玩家自己玩，谁愿意换个衣服就换，而且这游戏玩的成年人玩家也不少吧，也不是因为啥xp什么的[doge][doge]，就是改这个一下子换一个新的模型就觉得有些陌生，接受不了，倒不如让玩家自己一点一点的慢慢适应。[doge][doge]"
"HeningManJames","女","无IP","286288287","5","公主连结凯露","10000","2","","举报豆瓣，让它把那些什么鬼小组o下架！"
"黑山基地c区前台","男","无IP","9161575","6","","10000","2","","虽然我们常说外服人均米禁军，（虽然“禁军”“卫兵”之类的词有些不太好）。,但起码这次国服玩家能团结一点，另外别再被人利用了。"
"奥希雅丶","男","无IP","433243199","5","","10000","2","","这种时候才应该团结起来，师夷长技以制夷，我们也要申诉[奋斗][奋斗]"
"依阿两可","保密","无IP","501590326","5","洛天依8th生日纪念","10000","2","7","原宝加油[傲娇]"
"yjkyjk","男","无IP","8641774","6","","10000","2","","我觉得改动已成事实，现在能做的是申诉和及时止损。以举报对抗举报虽然解气，但并不能封住它们的作案途径。今天是真假女拳，明天换个团体身份依旧能恶心你，甚至变本加厉。,另外所谓唯有天理不可与之为敌，不代表不可据理力争。上一个被煽动而动用其他方式的团体是什么下场，我想大家应该都心里有数[tv_思考]，而迪迦重新上架也算做一个及时止损的范例了"
"绿绳子","保密","无IP","65330010","6","春原庄的管理人小姐","10000","2","","宝啊别着急喷原神，他也不想改谁愿意干这吃力不讨好的事呢？但是话说回来，快出皮肤啊原宝，这样我心里还平衡点"
"就不给你灯笼","保密","无IP","381720106","6","洛天依8th生日纪念","10000","2","","我怎么找不到黑子啊[嫌弃]翻了好长时间评论区了"
"浮世嫌","男","无IP","24882007","5","","10000","2","","米哈游，我不怪你，我恨这个无知的世道"
"饭终焉","保密","无IP","368697","6","","10000","2","12","还有猴主动来送，不知道老子这两天火气大吗，两棺材板夹爆猴头"
"不为忆苦","保密","无IP","273126625","6","言和7th生日纪念","10000","2","","游戏这次更新真的很好啊，好的剧情好的地图，甚至新任务里铜雀的庙也有人准备给他修了，这么多的好东西，至少我们应该好好支持游戏啊，如果真的因为某些原因就退坑换服什么的，是不是有点太....."
"且","保密","无IP","475175775","5","","10000","2","","这次改了送1200，下次改了不送就是节奏了，暗改也是节奏。没别的意思，真心希望原宝顶住点压力，1200哪怕不要，我是玩游戏的不是看侯和全吠的。另外说一句...有些东西可能只有肮脏的心灵才会想出来的。"
"原一今天买泡芙了吗","保密","无IP","35284997","6","星座系列：金牛座","10000","2","11","大家可以合理申诉要求改回来！"
"小小刘某","保密","无IP","381667825","5","#EveOneCat!","10000","2","","突袭的敌人[思考]懂得都懂[doge]"
"皮皮emm","保密","无IP","286118132","6","三周年恋曲","10000","2","9","https://b23.tv/fxjNIoT"
"诗经・小雅","女","无IP","31317035","6","异常生物","10000","2","","《神女劈观》赶紧的[脱单doge],这次剧情不错，战争场面还像样，稻妻那跟闹着玩似的，有进步，不愧是我大璃月。但是爷上一秒快挂了，下一秒又跳进去打；还有甘雨搭弓一箭都没射；另外有点欺诈，PV里“大不了再砸一个群玉阁”接申鹤出场超带感，剧情里居然不是这么一回事，有点小失望。,戏曲惊到了，感觉比传统戏曲更像歌曲，好听，和画面搭配也很好。,皮肤改动嘛，预告图里琴的制服我还挺期待的，安柏没看出啥变化，罗莎莉亚中规中矩，莫娜的我还是喜欢连体裤。（女玩家兼女权主义者）,最后，神女劈观速度的，我劝你不要不识抬举[doge]"
"old-ass","男","无IP","11404962","6","","10000","2","","https://b23.tv/enBh94O,薪火相传，这里还有"
"Arain_L","保密","无IP","27559053","6","","10000","2","","申诉通道https://b23.tv/TI6maTS"
"坠灬尘","保密","无IP","391124801","5","","10000","2","","有的东西爱说啥说啥别理它们，它们就想要点存在感蹭点热度别让它们得逞直接跳过，我就不信因为几个歪瓜裂枣的一句话就把角色改了？吹他么牛逼去吧肯定有别的原因。不管因为什么老子绝不退游[奋斗]"
"万愁千扰亦无忧","男","无IP","17365281","6","","10000","2","","受罪的还是玩家，给米哈游哭什么丧呢，数钱能数到手抽筋的人轮得到屏幕前的你给他哭天喊地吗。"
"Vampire丶ll","男","无IP","180856406","5","","10000","2","","过两天尘歌有背景音乐 可以把神女劈观加进去吗？ 最好大世界背景音乐就是"
"Walkの黑夜","保密","无IP","314104224","5","","10000","2","","玩王者遇到无知的家长，玩原神遇到无耻的女，在我国玩游戏就是一种错啊[笑哭][笑哭]"
"Kr来了","保密","无IP","289837540","5","","10000","2","","求复制粘贴！这是我们最后的机会，如果这一次我们选择退让，以后就再无希望！求求你们不要让热度下去！拜托了各位！！！为了中国游戏的未来，复制粘贴下去让更多人知道！这是一次，有组织，有预谋，有计划，有行动或背后有第三方势力支持的一次通过举报角色立绘来达到他们心中的某种目的的行动，性质极为卑劣下贱，这不是第一次，也绝对不是最后一次！如果我们今天不抵制女拳，明天就会有更多的女权站出来区去规划更令人作呕的事情！以后中国就再也不会有好游戏，游戏里更不会有好看的女角色,      同志们！勇敢地站起来！去撕碎这些侵略我们梦想的恶贼！为了中国游戏的未来，我们只有与敌人背水一战！革命尚未成功，我们仍需努力，敌人越猖獗我们就越要团结，就在这一刻，我希望各位玩家能够放下曾经的话题，停止内战一致对外！一定要彻底粉碎女拳的阴谋！,,这是发动侵略的主要战犯之一@晴明的小公主 此人已被封号,,这些都是主战场传送门,https://b23.tv/u1QyWzr,https://b23.tv/HHejxIF,https://b23.tv/7Ur87Gj,https://b23.tv/KY55BtC。，"
"亚蕾斯塔","保密","无IP","382652719","6","黑白无双","10000","2","","原宝别忘了盐之魔神是怎么没的"
"快乐时光玩玩","保密","无IP","324049663","5","","10000","2","","错了各位，这是社会环境所决定的，米哈游也是无奈之举，为什么国产游戏差 这里面多方面原因，国人的才华并不低于世界人民。,,社会环境决定所创造文化[藏狐]我可能以后再也不会支持国产游戏了……"
"灰太狠办公窒","保密","无IP","698389807","5","","10000","2","","要明确一件事，逃是逃不掉的,退坑，又能退到哪里去,,远不止原神，,王者，火影，崩坏，第五人格，明日之后……,,所有手游都不能幸免于难，除非你不玩中国手游,如果放任，手游玩完了，下一个是谁？,,应该团结起来,,退坑，融号是没有用的,互相攻击更是没有用的，,,在这件事情上，所有玩家的利益是一致的,首先要抵制互相攻击，搞清楚目标和方向。"
"_九十九_","男","无IP","500060331","5","一周年纪念装扮","10000","2","","头上的辫子可以剪掉，思想上的呢？"
"苍言","男","无IP","437298613","5","原神","10000","2","","在？什么时候出个回顾剧情？有些剧情看一遍不过瘾"
"令人疑惑的韶昭君","保密","无IP","84898687","6","","10000","2","","我只想说一句话“打得一拳开免得百拳来”"
"星际不粘锅","男","无IP","32904025","6","","10000","2","","为啥我一个臭打工的仅剩的休息、娱乐时间也要被牛鬼蛇神打扰？？？"
"山巅清心云间月","保密","无IP","21928504","6","星座系列：水瓶座","10000","2","","说起来你们没发现间章过完之后送了申鹤的突破材料吗？[星星眼][星星眼][星星眼]"
"青芒变熟芒","男","无IP","91553612","5","","10000","2","","原宝飞行虚化能不能去掉啊，只看到一个翅膀好难受。[大哭][大哭][大哭]"
"狄岐","保密","无IP","400144523","5","","10000","2","","好好的杂谈，全TM是退坑、修改，真的[藏狐]"
"幼稚园的鲤爷","保密","无IP","294464633","6","","10000","2","","其实动静小一点乖乖挨锤，事情慢慢地也就过去了，碧蓝航线就是这样做的。非要把事情闹大，节奏冲起来让米子没台阶下？真的以为以凡人之躯能撼动天理？什么中二之魂。不太懂了。"
"真嗨冲","男","无IP","203364906","5","三周年恋曲","10000","2","","这种时候一定要支持米哈游，退游没用，真的没用，这事情也不是米哈游的错，米哈游也不想改的，退游反而会让们得逞，记住，我们要冷静，要支持米哈游"
"存活万年","保密","无IP","85513156","6","","10000","2","","我支持你，能看到你尽力了。也请大家有辨别是非的能力，不要被节奏带偏。"
"残者","保密","无IP","10259681","6","-阿库娅","10000","2","","申诉！申诉撤回的修改指令比什么都有用"
"小蜜蜂提莫爽爽粉","男","无IP","35342381","6","","10000","2","","小人终究不会有好结果，我们需要团结[奋斗]"
"御坂12484号","女","无IP","353224172","5","雪未来","10000","2","","xp抽卡永不亏,此话死于2022年1.5日"
"翻墨白雨ovo","保密","无IP","94240572","6","","10000","2","","这就像是一个人气爆棚的蛋糕店，他家蛋糕很好吃也吸引了很多人来吃。突然有一天，他家的蛋糕用了一些玛莎拉来做配料，也许蛋糕还是比别人家好吃，但是我在心中肯定会不舒服，也许蛋糕的味道并没有改变很多，但他却不是我本来追求的味道。而且以后加在蛋糕上的玛莎拉可能越来越多，甚至把做这个蛋糕的原配方都给你缩水，蛋糕变得越来越不好吃。你知道这不是蛋糕店的错，但是你还去这家已经不好吃的蛋糕店吃蛋糕么？所以，xdm加油吧。为了你喜欢的角色[鼓掌]"
"茜露菲卡","男","无IP","53877458","6","","10000","2","","真挺惨的，自己在努力往外宣扬改变国外的偏见，结果自己背上被自己人捅了3刀，现在人家彻底知道你这什么情况了[捂脸]"
"幻麟腾","男","无IP","11744091","6","星座系列：白羊座","10000","2","11","前瞻直播谁都能苦着脸，但大伟哥不行[响指]"
"超威吴克-","男","无IP","406063557","6","","10000","2","","直接18吧原宝"
"陋夜过东莞","保密","无IP","3467435","6","","10000","2","","这角色被改是真的难受，而且改得还丑。1200原石拿得像痛苦面具一样"
"DOOUZ","女","无IP","490217955","5","","10000","2","","那些因为角色改衣服就退游的，只能说还是不够喜欢这个游戏，就借改用云先生的一句话吧“我是打定主意要玩原神一辈子的”"
"AIshield","保密","无IP","161099653","5","","10000","2","","话我就放这了 原神就是好游戏 就是国内的一流游戏 爷就是爱玩 爷就是米卫兵  猴猴们看见了快去贴吧挂我 快去快去～"
"空梦-帕朵菲利斯","女","无IP","198411807","6","崩坏3・天穹流星","10000","2","","你该不会以为，单凭你的愿望，就能胜过影的意志吧。有点感慨，这波稻妻人竟是我自己，神之眼说收就收，连小小的愿望也守不住，哲平那卑微的一碰就会碎的愿望都要夺走，提瓦特有旅行者的拯救，现实里的旅行者你在哪"
"Lannannn","保密","无IP","437434163","5","","10000","2","","有一部分人冲错方向了呀!改角色不是米哈游愿意的!每一个角色不知道经过多少打磨，对米哈游来说就是孩子一样!是因为某些人的恶意举报米哈游被迫改角色!"
"椰の旅途","女","无IP","14842695","6","","10000","2","","岂可修，反正一些角色衣服就算被迫改成什么样子，我都会玩这个游戏，因为这个游戏就是好，就算甘雨披上军大袄，我也喜欢甘雨，因为甘雨和其他角色被塑造的很好很有灵魂用了心，那些人以为这样就会让我去支持其他垃圾，想得倒美了，就算是穿军大袄的甘雨或者其他角色，也比其他游戏的角色好看的多了去了，原宝加油！！"
"土-龙の大使","保密","无IP","525533337","5","","10000","2","","这个时候真的不是该冲米哈游的时候，你们想想，如果米哈游真的倒了，以后的互联网会是什么样的场景？[微笑]"
"小梦芽子","男","无IP","3306291","6","","10000","2","","抱歉原神 那天早上太冲动了 逮着你们来出气，加上神女劈观的戏，直接给我干破防了，然后昨晚一晚也没睡，看到一些UP甚至都哭了，哎其实大家都很难过吧"
"-剑备","保密","无IP","358932264","5","","10000","2","","谁能告诉我能确定到底是谁干的吗？"
"星芒星芒","男","无IP","95801287","6","2233白色情人节","10000","2","","请等一下！2.4签到！[doge],https://b23.tv/jDZ4CUz"
"-Phaeton-","男","无IP","275531601","6","总之就是非常可爱","10000","2","","广奠冢局，坟滑部，我表示一下态度:我不愤怒，也不伤心，就是觉得你们挺可悲的[tv_白眼]"
"雀A秋实","保密","无IP","5218206","6","","10000","2","","虽然但是这过渡期也太丑了，莫娜搁这cos奥特曼呢"
"_Decorator_","男","无IP","19159576","6","三周年恋曲","10000","2","5","不能放弃啊xdm来看看,https://b23.tv/88pQjx7"
"玄律7X","男","无IP","385538620","6","初音未来13周年","10000","2","","米哈游是受害者，但玩家也是受害者啊，而且外服是什么意思？不敢惹外边人？要改一起改啊"
"明月五更来","保密","无IP","294685223","5","崩坏3・天穹流星","10000","2","","有些人这样随便搞 是想让mhy没吗[疑惑]"
"海月之逐","保密","无IP","206054171","6","","10000","2","","有谁跟我一样害怕在渊下宫那里掉下去的，只要一掉下去心里就咯噔一下[tv_流泪]原本想要用岩队顺便刷好感的，但不带万叶就没安全感[笑哭]"
"_Decorator_","男","无IP","19159576","6","三周年恋曲","10000","2","5","不能放弃啊xdm,https://b23.tv/88pQjx7"
"白银玄鸟","保密","无IP","366430899","5","","10000","2","","其实我对改建模，意见不怎么大。,我意见很大的是飞行给我改了。就剩一对翅膀,这还飞个毛线。[辣眼睛][辣眼睛][大哭]"
