"昵称","性别","IP","UID","等级","装扮","用户权重","获赞数","粉丝团等级","评论"
"JMR_A咕Tokki","保密","无IP","1747864","6","","10000","1","","原宝挺住，2.4我氪了好多好多钱，能氪的地方我都氪了，大月卡 刻晴皮肤 申鹤和专武，我是永远的原吹[打call][打call][打call]"
"七续z","男","无IP","35494883","6","","10000","1","","原神加油！！！！ 相信你们！！！"
"亮CHN-PJ","男","无IP","479974910","5","","10000","1","","同志们，去北京，捍卫我们的权利"
"唐墨羽h","男","无IP","3914964","6","原神","10000","1","14","这哔哩哔哩的热门是有什么大病吗？怎么这么多八重的实机演示就出来了？这种不想办法去打压封禁，反倒给他挂在热门上，吃流量吃的很饱啊，哔哩哔哩，内鬼现在也太嚣张了，2.4刚开就开始往外放，这种了吗？麻烦管一管吧！"
"R-S-T","男","无IP","21406630","6","","10000","1","","现在最重要的是保持沉默，不是装作什么时都没发生息事宁人，也不是大声嚷嚷扩大影响，要清楚自己的核心需求是什么，不要让自己被别人当棋子，目前的环境还不到那个时候，我们的力量也不足以做出改变，牢记这一切，吸取经验教训，积蓄力量，等待时机，才能从根本上做出改变。"
"贫穷的非酋","男","无IP","335915411","6","","10000","1","8","看到兄弟们都能理性看待这次服装的事我就放心了[OK]"
"轩岑","保密","无IP","4393955","6","崩坏：星穹铁道","10000","1","","那好啊，他弹反我也弹反"
"一枝嘟嘟桃","女","无IP","93876752","6","崩坏：星穹铁道","10000","1","","原宝，快把神女劈观放出来[大哭][大哭]"
"好想当一只修狗","女","无IP","549758927","5","","10000","1","","原宝加油，我们支持你"
"孤烨呀","男","无IP","472636178","5","原神","10000","1","8","mhy今天我生日能不能保我出一命魈[给心心]"
"安hangel","男","无IP","432256416","5","hanser","10000","1","","不是，虽然一开始原神吸引你注意的可能确实是美好的角色外观，但深入了解过原神后如果现在的你因为这么个事情就要放弃，那也说不了什么了，你玩再多游戏也是这样。换衣服这个事咱不能忍气吞声，但真正喜欢原神的人应该也不会因为衣服变了就弃坑吧。"
"阳光开朗dark男孩","男","无IP","275614700","6","","10000","1","","原神被迫被改，也许有挽回的余地，详情：htt删ps://caom掉ei.rth1.m我e/,,第一个是途径，第二个是模板，都是转自其,它被删掉的up,【置顶】有两点注意一下，第一米哈游要写公司全名“上海米哈游天命科技有限公司”（存疑，我目前能查到的资料显示这个是原神的运营主体），第二是投诉标题还有内容不要复制粘贴，容易被系统筛掉，最好自己能用自己的语言重新描述下，尽量让每条投诉都是有效的。记得这段话也接力下"
"萌宠小兀","保密","无IP","646818990","5","","10000","1","","原宝加油！,大伟哥、美工大大辛苦了[给心心]"
"ヨyis","男","无IP","33966036","6","","10000","1","7","太棒了云先生"
"ただのBだ","保密","无IP","171410","6","","10000","1","","这次2.4经历的事情和表现，就好像小说里主角临近参加决赛时被人场下打闷棍打断了一条胳膊，带着伤痛依旧在台上技惊四座，震撼全场[藏狐]但是，我依旧想让那群打闷棍的死[无语]"
"blbl纯路人丶","保密","无IP","35918416","6","","10000","1","","云先生这一波神女劈观按着老外听戏可以说封神了，原宝要顶住了"
"爱看雨的虫子","男","无IP","65822663","6","良辰美景・不问天","10000","1","","原宝加油[原神_干杯]"
"教育守卫者国崩小炮","男","无IP","272489025","6","","10000","1","","在这种大环境下遭到整改只是时间问题，只是我没想到的是这次整改的程度这么离谱(安柏和琴团长居然都能被找茬)，而且还这么仓促！这里面肯定有鬼！"
"榴莲味的杏仁豆腐","女","无IP","24695556","6","灵笼","10000","1","","感觉最近的换皮肤事件有人下场搅浑水，就我这个20粉丝的人，发视频都有人来视频下面发评论，让兄弟们联合起来抵制米哈游换皮肤。更何况别的大UP的视频了，绝对有不少水军在里面搅混水"
"阿尔卑斯山上的星星","保密","无IP","11925456","6","2021拜年纪","10000","1","","原宝别的不说了，我两个号加起来连着吃10多个大保底了，你可以给我道个歉让我好受些吗"
"都别活了毁灭吧","保密","无IP","443668449","5","","10000","1","","好耶！是云堇！也是我生日！我这就去抽一只云堇回来！"
"危秋","男","无IP","522457974","4","","10000","1","","布料又要加一波。"
"斯卡蒂的抱枕","男","无IP","27132336","5","","10000","1","","https://b23.tv/ib0zhL2"
"vinciarts","男","无IP","2459050","5","","10000","1","","灵感打人啦"
"刘芳流明","女","无IP","13214162","6","原神","10000","1","","话说云堇幕后制作视频什么时候放出来啊"
"MuKanyun","女","无IP","9500005","6","","10000","1","","真就年轻人的第一款网游…和谐再常见不过的事也能整得跟游戏要关服一样"
"瘫客","男","无IP","2718600","6","","10000","1","","qq人：我总能给米忽悠带来创作灵感[滑稽]"
"Airsd_","男","无IP","390313558","6","","10000","1","","神女劈观gkd"
"微米色印花","保密","无IP","261204805","6","","10000","1","","能不能不再说了？这次剧情这么好我就想来官方下面看看大家讨论，结果都是衣服衣服衣服！谁让整改的找谁去行不行？既然已成定局就不要在官方这发牢骚了行吗？人家那么做是收了钱，你在干嘛？真蠢吗？冲这个冲那个的，把环境搞得乌烟瘴气，既然不能制定规则，那就遵守规则，等待改变的到来"
"有憾生-","保密","无IP","229506097","5","","10000","1","","蹲蹲云堇攻略[原神_哇]"
"Abloyis","男","无IP","67809334","5","","10000","1","5","加油，嗯，我没啥大能，只能鼓励了"
"此次肌肤","保密","无IP","359754938","6","","10000","1","","能帮铜雀修庙了唉，好耶[原神_G嘿]"
"FOLkwo","保密","无IP","519784358","5","原神","10000","1","","请等一下！2.4签到！[原神_小事一桩],https://b23.tv/jDZ4CUz"
"木明希Violet","男","无IP","523325454","5","","10000","1","","大家都理智一点，米哈游的美工要相信他们啊！c(；；)ノ（说一句，原宝啥时候发云堇唱戏的剧情pv呢？( ｀)）"
"葛文L","保密","无IP","11308869","6","至尊戒","10000","1","10","原宝！快发新魔神任务剧情的结尾的pv！"
"守望着信仰","男","无IP","500985012","5","","10000","1","","估计米哈游早就猜到有这一天，所以出了服装系统，不好看，没关系，换服装[脱单doge]"
"撸大师木源","保密","无IP","37118468","5","","10000","1","","这两天带衣服节奏的都赶紧跟团，什么退游什么换服什么冲的都快点，我们就是代表玩家利益，无论谁都心疼！！！为了更好地玩游戏，与其多点云堇唱戏视频，不如点赞换皮肤的视频，众志成城，我们声音大了就能给他冲回去！想想帝君为什么会二次重做？玩原神玩的不就是建模皮肤？隔壁捏脸游戏虽然比这大比这翘，我为什么不玩，因为他捏的没原神好看！！自己在原神花钱抽的东西，凭什么能随意修改？你的声音越大，怨声越响，上面的人就越难以安稳！这不是带节奏，这是守护我们自己的权益！玩游戏不代表要处处受气！！原友们团结起来，一起反抗不正常的游戏举报政策[点赞][点赞][点赞]"
"美梦神丶","女","无IP","234653598","5","","10000","1","","坚持住那么难吗！"
"bili_38625527","男","无IP","38625527","6","","10000","1","","https://b23.tv/6eD68e1"
"摸鱼划暾婢","男","无IP","313033567","6","原神","10000","1","10","突然想到，如果之后发神女劈观的pv四国语言版的话，是不是重复投稿[doge][doge]"
"账号已注销","保密","无IP","523142730","0","","5000","1","","这件事情还真不是米哈游的锅，但我们要打回去，等事情尘埃落定了，我再去欣赏这次的更新啥的，现在不行，没有心情[藏狐],https://b23.tv/0Ok6Mjz"
"安达垣爱姬","女","无IP","4985444","6","物述有栖","10000","1","3","痛哭，这次没有了家长但是还是败给了“友商"
"苍苇蒲公英之子","男","无IP","9260319","6","星座系列：摩羯座","10000","1","8","米哈游不是在研究丝袜系统吗？大家一起期待吧，说不定不久的将来就会出那种随着战斗越久程度越强，越来越破的丝袜[doge][doge][doge][doge][doge][doge][doge][星星眼]"
"Mr-Z老师","男","无IP","17960233","6","刺客伍六七","10000","1","","就说了一句别带节奏，一群人来对线，厉害了[tv_笑哭][tv_笑哭][tv_笑哭]"
"玻璃瓶与易拉罐","男","无IP","495141354","5","原神","10000","1","","https://b23.tv/yueQH7T"
"能代天下第一可爱","保密","无IP","402639425","5","碧蓝航线2020","10000","1","","有没有像我一样想抽云堇结果40发出申鹤的[大哭]"
"御坂7453号","保密","无IP","401397640","6","第五人格","10000","1","","真的是绝望啊，这只是一个导火索或者一个小角落罢了，让人绝望的不是一件衣服或者龙女仆的一个马赛克，而是一个大环境……日本阿宅们至少能给保守党或者其他鼓励二次元产业的政党投票，除了跟网友对线外，我什么都做不到"
"personaaaaaa_","保密","无IP","21473836","6","2233幻星集","10000","1","","好热闹的拾枝杂谈诶，好多好多人都出镜了，真不错"
"苍古自由之誓-","男","无IP","288672778","6","","10000","1","","道理我都懂，你为啥要带匣里灭辰[doge]"
"老卒喽","男","无IP","212986323","5","","10000","1","","[无语]申鹤都一命了，云堇还没出来"
"沫檬","保密","无IP","349240373","5","","10000","1","10","https://b23.tv/ib0zhL2,https://b23.tv/FYxlPHd,说不定就成了呢！是吧！"
"-休比天下第一-","男","无IP","113431000","6","","10000","1","","还不快给爷把神女劈观发出来[给心心]"
"nidhoggWU","男","无IP","6268504","6","","10000","1","","行动起来！维护合理权益！露大腿违了什么法？!,https://www.zhihu.com/question/509912693/answer/2298355618"
"9564243","保密","无IP","2267130","6","","10000","1","","我觉得不只是女拳，还有看赚钱眼红的，隔壁碧蓝航线也被搞了"
"赤逍遥0926","男","无IP","35800325","6","","10000","1","","女拳恶意举报我们的游戏角色！！！兄弟姐妹们，优其是姐姐妹妹们一定要站起来发言,举报人之一,@雄狮可莉 @-青鸟不传云外信- @我最爱玩原神 @晴明的小公主 战犯名单,想知道为啥改角色立绘和模型来看看这些,https://b23.tv/u1QyWzr,https://b23.tv/HHejxIF,https://b23.tv/7Ur87Gj,https://b23.tv/KY55BtC。， ,国外米卫士已经战胜女拳获得发言自由了！,如果我们不做点什么！就被女拳代表了！女拳说什么就什么！,    我们不出声！就没有发言权了。 "
"沁可啊","女","无IP","403098162","5","","10000","1","","渊下宫层次感、指引、背景音乐都做得太棒了。。我吹爆"
"蒂尔拉斐","保密","无IP","57418113","5","","10000","1","","唉，这飞行也虚化了，我的温蒂从此失去了他存在的意义。[doge]"
"ただのBだ","保密","无IP","171410","6","","10000","1","","我劝你赶紧把神女劈观的pv放出来，不要不识好歹[doge]"
"银闪闪闪","保密","无IP","396050932","5","","10000","1","","改模型这些话不说也躲不了，b站评论区不提，也有玩家心凉，有些游戏的玩家不是吵吵闹闹的退坑而就是不知不觉的，避不开的，原神这游戏是围绕人物抽卡养成的类型，直接角色动刀，玩家有怨言才正常，请不要骂退游转服的玩家，他们没冲mhy，没带节奏，就是表达心声，更何况转服还要重新开始玩，他们要的是不容易改变的模型和体验。望理解吧。"
"深入浅出崩酱","女","无IP","379924855","5","","10000","1","9","原宝挺住，我相信你嗷[原神_G嘿][原神_G嘿][原神_G嘿]"
"QM左最","保密","无IP","348412056","5","","10000","1","","莫被带节奏了"
"解秋亦解忧","保密","无IP","435886331","5","","10000","1","","时长5:21，云堇生日5.21，米宝你好细"
"蒙古上单宇雨","保密","无IP","246575540","5","hanser","10000","1","5","mhy加油！[原神_喝茶][原神_喝茶][原神_G嘿][原神_G嘿]"
"仰望仲夏的星空","男","无IP","495297564","5","","10000","1","","原宝，原宝，我昨天做主线任务进仙人洞天副本里拿浮生石，副本里的宝箱无法交互（就是打不开宝箱），并非在乎宝箱里的奖励，单纯给你们提交一下BUG[OK]"
"好久没有投硬币了","男","无IP","4559326","6","原神","10000","1","","加油原神！"
"傻人有傻芙K","保密","无IP","12766776","6","","10000","1","","谁能告诉我，我该叫她/他，小姐还是先生。毕竟某个不干正事的神让我心生恐惧了[辣眼睛]"
"寻念亦枫","男","无IP","509075399","5","","10000","1","","【置顶】复制粘贴下去，这次的服装整改是女权有预谋的，欧美女权早就对游戏出拳，所以欧美游戏中女性都长的十分难看。如果今天你们不抵制女权，以后游戏里也不会有漂亮的女角色,举报人之一@晴明的小公主,想知道为啥改角色立绘和模型来看看这些,https://b23.tv/u1QyWzr,https://b23.tv/HHejxIF,https://b23.tv/7Ur87Gj,https://b23.tv/KY55BtC。，"
"aaa硬币批发李总","保密","无IP","31368441","6","橘猫挂件","10000","1","","宝，希望你能刚一些，把这次的节奏挺过去，648，懂？[脱单doge]"
"风雪夜归人------","女","无IP","351514741","5","原神","10000","1","","建议开放转服嗷，能把玩家损失降到最低，不然实在是没有精力跑外服重新开始锄地了，[辣眼睛]"
"FYCNFR","男","无IP","19842177","6","","10000","1","","改18+吧，求求了[无语]"
"悟德","保密","无IP","383885200","5","","10000","1","","真的，我就很喜欢我爸说过的几句话,1“你不管干什么，你要你出名了，总有人看不惯你，总有人不服，想方设法的整你”,2“骂你？骂呗，我tm每年几亿几亿的挣，钱多得花不完，想骂随便骂，每天吃香的喝辣的还在乎这么几个nt么”（当人每年几亿的并不是我爸，代指我爸所维护的那一方[笑哭]，这里可以想成mhy）,3“有些人吧就是想在网上找点存在感，发点所谓的争议言论评论就觉得自己牛哄哄的，其实这种人在现实中啥也不是，你体会一下，真正那种三观正的，会不会像那群人一样，出点什么事就在网上胡说海说。”"
"井熄","保密","无IP","309574950","5","","10000","1","","能不能分割鸡啊"
"终越王样","男","无IP","99022550","6","","10000","1","","你改个皮肤，行，可以，但是这四个角色原皮肤就1200？一个角色抽到最多都要花14400（考虑到非酋的情况下）原石，而且是四个？加上命座，如果是六命的话，一个角色最多要100800原石，而且还是四个，你不应该给403200原石？要么你给改的角色四个命座全部点满。如果算上小保底歪的情况下，且把四星当五星算，你至少要给806400原石，否则这道歉不接受。"
"暗月西楼","男","无IP","620699816","5","","10000","1","","原宝，加油啊！"
"我涌出的血温暖我自己","保密","无IP","1532194868","5","","10000","1","","来了来了，都回来了，疯狂复制，一起节奏就有这种操作，生怕别人看不出来有水军[tv_呕吐]"
"切斯特2333","保密","无IP","95976950","6","","10000","1","","78抽出申鹤没云堇[大哭]"
"手残的一只言","女","无IP","21332604","6","","10000","1","","哎呀，这个人带着这么多薄荷、包菜、禽肉瘦肉想干什么啊.jpg,你再骂！"
"SyoんO","男","无IP","28345517","6","","10000","1","","不管是天理还是母拳，请继续加大力度，越搞我会越支持米哈游[脸红]"
"Chennpx","保密","无IP","439404398","5","","10000","1","","评论全是说这个的，能讨论视频相关的吗，搞得原神快没了似的"
"besuri","男","无IP","3724922","6","","10000","1","11","虽然这次很不爽（不准改我的限定角色！），但云堇做的雀食很好，剧情和动画，人设都很棒"
"里","保密","无IP","2088443","6","","10000","1","","我就一句话，我老婆穿啥都好看[胜利]"
"从小爱吃脆脆鲨","保密","无IP","294701954","6","七海Nana7mi","10000","1","","衣服改了就改了，怎么吵也回不去的。更何况还有带节奏的和乱冲的。,应该把这件事当做一次教训，提醒我们总有那么一群人利用公众权力满足自己的私欲 。"
"心理健康协会","保密","无IP","342859471","6","初音未来13周年","10000","1","","我的申鹤真是太惨了[大哭][大哭]"
"Slm也想拥有梦想","保密","无IP","44390508","6","公主连结凯露","10000","1","","队伍不一定需要，但这个角色必须得有[脱单doge]"
"吃的萝卜稻草","男","无IP","323509028","5","","10000","1","","对于这个衣服来说原神也不希望玩家这样，希望希望大家过个好年，所以临近新年大家先开开心过年，至于帐会算的。至少知道某些人，他们是在滥用那些东西，滥用那些东西来为自己寻找快乐。对于这些人绝不会出姑息的（我觉得国家也不会）。"
"锐气迪迪","男","无IP","12755548","5","","10000","1","","四星可不可以定轨啊！！！救命！！！没有云堇我要死了！！！！！"
"侯先生绝赞摸鱼中","男","无IP","66839267","6","","10000","1","","对京剧有兴趣的朋友们可以来我的收藏夹看看,[惊喜]"
"bili_38625527","男","无IP","38625527","6","","10000","1","","https://b23.tv/FYxlPHd,说不定就成了呢！是吧！"
"舰长阿波卡利斯如是说","保密","无IP","108600904","5","公主连结佩可莉姆","10000","1","","我觉得可以吧以前的服装，变成服装，在活动里获取"
"重云小姨夫","保密","无IP","178785767","5","三周年恋曲","10000","1","10","诸位不要退游，让某些别有用心的人得逞，喜欢一个角色绝不会因为服饰的改变而改变。神女劈观的后半截歌词不正是米哈游和我们当前的状况吗？在这次事件中米哈游也是受害者。"
"萧解","保密","无IP","91529604","6","","10000","1","","转发：,很少发评论，这次就试着来表达一下我的看法,首先，明确两件事,第一件事是2.4版本，米哈游做的很用心。渊下宫地图，有京韵特色的云先生，尤其是风起鹤归里人与魔的战斗CG，云先生两分多钟的唱段《神女劈观》。这是原神在这一年的最末，献给原神玩家的献礼。可以预见，如果没有其他节奏的话，这对于原神玩家来说，将是一种狂欢。对于原神的热度和人气，也是一波增长。,第二件事就是关于角色外观。米哈游来不及做出另一套合格衣装，只能是粗略设计实装一套完全失去水准的敷衍行头。很显然，这次勒令整改来的那么的急，那么的恰好。有极大可能是在版本前瞻之后甚至是临近版本上线之前，突然被勒令整改。,这么看，事情就有些微妙。如果真是角色衣装的问题，那么为什么不在早些时候勒令整改。为什么，完全不给米哈游设计新衣装的时间，让部分角色草率整改。,在我看来，这是一场有预谋的袭击。,对2.4版本前瞻之后，一直酝酿到2.4版本开服后的巨大热度的一次致命打击。,这是一颗致命的子弹，能够威胁到原神根基的子弹，打在了原神又要再创新高的时候。,我只能说，这一枪打的太狠了。后续不管是反对这次整改，冲米哈游也好，冲女拳也好，甚至拐弯抹角的讽刺z,f也好。都是他们想看到的，甚至这些节奏都有他们的人。,只要没人关心2.4真正的内容，没人关心米哈游用心做出来的情节，故事，地图。就是他们的胜利。,那些明面上摆出来的女权，都是靶子。如果本次事件还能引起部分玩家对于z,f不满，那更是他们希望看到的。,背后的推手有可能有某看似是自己人的外国游戏公司，国外的反，花势力，甚至国外某些游戏厂商。原神分的蛋糕太大了。,原神的体量很大，但米哈游的体量很小。他们只是一群认真做游戏的人，每一个角色，都是他们的心血，每一段故事都在他们心里演绎。有些人只是在这里发表怨恨，但我相信，真正的原神制作人他们的心在流血。,我希望各位能够，更多的去讨论这次的故事，地图，音乐。（转发）"
"~鸟","男","无IP","188852445","6","七濑胡桃","10000","1","11","没什么心情玩了讲实话"
"迷路的史R姆酱","保密","无IP","21669260","5","","10000","1","11","云先生，能听到的戏，也不枉此间一遭了"
"梦回倚阑珊","男","无IP","5113275","6","","10000","1","","原宝加油呀，要越来越好"
"山东太学","保密","无IP","53011375","6","拜年祭粉丝专鼠","10000","1","","兄弟们我建议信跟团了，希望有更多人能站出来议论这件事，到你喜欢的角色喜欢的其他游戏改动时，你难受已经晚了"
"凤熏夏夜凉","保密","无IP","1860981148","5","","10000","1","","https://b23.tv/FYxlPHd,说不定就成了呢！是吧！"
"殇丶晓","男","无IP","3866313","6","雪未来","10000","1","","刚进宫感觉树木倾斜的趋势很怪，后来发现渊下宫的大部分树除了贴图树都是向着光源生长的，唯独有一种长着结晶一样的树是背光的。[doge]另外，说好的没钥匙谁也进不去的呢？一开门，QQ人，深渊法师，深渊使徒，差点吓得一个传送就准备回蒙德了"
"sir-","女","无IP","249170772","6","明日方舟音律系列","10000","1","10","https://b23.tv/jDZ4CUz,雷光签到！！！！60原石"
"诚如君之所说","男","无IP","85444254","6","异常生物","10000","1","","戴因看到云堇是位歌颂人类的戏曲家后连夹带私货时间的语气都柔和了起来了[tv_鬼脸]"
"芭芭拉爱你哟","男","无IP","130919831","6","","10000","1","","你们反内鬼反了个寂寞，主页全是八重实机视频，放技能也就算了，放剧情的是不是有什么毛病？[原神_哼]"
"冻原上的守望者","男","无IP","355933515","5","小东人鱼","10000","1","","同志们不要被带节奏，不要受制于人！不要因为外观改动就弃坑，这样正中敌人下怀！我们喜欢角色不只在于漂亮帅气的外观，更在于丰富饱满的内在形象！意识到这一点，敌人的意图就无法达到，我们就能挺过这一关！"
"夜莺啼诗","保密","无IP","14517172","5","","10000","1","","别忘了微博超话和活动签到[原神_G嘿]https://b23.tv/voAoUht"
"半月斩丶","男","无IP","95341709","6","","10000","1","","请等一下！2.4签到！[脱单doge],https://b23.tv/jDZ4CUz"
"c呆没有你我可怎么活","女","无IP","383274365","5","","10000","1","","能申诉吗，我还是不想这么放弃，一想到让那群人得逞，真的开心不起来"
"屁王石晋臻","保密","无IP","74466519","6","崩坏3・天穹流星","10000","1","","云婵娟来花婵娟~,风流尽在山水间~[脱单doge]"
"曦之梦丶","保密","无IP","667902347","5","","10000","1","","刚才那个说别被带节奏的没了，嗯。。。挺快的"
"SakUra_Bach","男","无IP","630392094","5","","10000","1","","今日忍气吞声 明日八重穿裤[原神_哼]"
"HF不是氢氟酸","保密","无IP","2007835560","5","","10000","1","","既然你们都知道了，那这戏我就不演了，我就是神里绫华和云堇双料dog,代号单推人[星星眼][星星眼][星星眼]"
"致我永恒的青春","保密","无IP","11842442","6","原神","10000","1","","原宝多的帮不到你，只能投上我的三连支持你们，不信谣不传谣[保卫萝卜_哭哭]"
"暗中观察的人","男","无IP","30168991","6","良辰美景・不问天","10000","1","","一直忘不了当年崩三女王泳装也是被人举报还在测试服下架了，但最终结果是改的比原来还好看而且是免费送（虽然复刻要抽），相信米忽悠能给个令人满意的结果吧[拥抱][拥抱][拥抱]"
"秋山映山红","保密","无IP","689246167","4","","10000","1","","天理与凡人的故事……  .还得等多久"
"白起sk","男","无IP","417233406","5","","10000","1","","神子怎么抽啊，2.4被榨干了，后面还有万叶[大哭]"
"智商有问题的猪vvvvvv","男","无IP","2091954","6","贝拉kira","10000","1","7","这次地图剧情都挺满意的 除了那个醉汉感觉有点突兀 其他都挺棒 继续加油 多的话不说了 会继续玩下去的"
"糖醋悠悠酱","女","无IP","19449978","5","","10000","1","","雪山活动100万人了，记得领原石"
"碳元素生物","保密","无IP","34500777","6","","10000","1","","米哈游的各位，勿让宵小之徒影响了您的创作热情，我很喜欢你们以游戏的方式展示自己的想法。"
"白日梦音","保密","无IP","24605415","5","","10000","1","","原宝加油！我们一直都在！"
