"昵称","性别","IP","UID","等级","装扮","用户权重","获赞数","粉丝团等级","评论"
"影小姐后援会","男","无IP","412689949","5","原神","10000","3","13","是时候拿出我珍藏的82年可乐了,                        [原神_哼],                        "
"几次已成习惯","男","无IP","489578673","5","原神","10000","3","","好家伙今天那个派遣探索活动结束了现在我一堆角色都显示探险中不让我用了[辣眼睛]"
"或守若尘","保密","无IP","1889026368","4","","10000","3","","整治娱乐圈呢，果真的，游戏，动漫还真是娱乐的呢[脱单doge]"
"海之河蟹","男","无IP","490404791","5","","10000","3","","别删评啊，刚看到一条评论说删评，果然一刷就少了十条，自删也不至于这么多啊[辣眼睛]"
"希泪_@","保密","无IP","476069064","5","","10000","3","6","给评论点赞都要争分夺秒[doge]"
"樱星如梦","男","无IP","349235947","6","鹿乃","10000","3","","冲什么，音乐会还比不上一发十连啊，你冲个月卡，都20发了，在乎那干嘛（自己观点，别喷[笑哭]）"
"--------","男","无IP","1517977966","5","","10000","3","","（复制粘贴）我充的每一分钱，都能让我听到一首首反复聆听的上流高质量音乐，所以原宝，下一个池子答应我，别让我大保底好吗~[doge]，我不知道这个有什么问题？"
"上官逸雯","保密","无IP","359069029","5","hanser","10000","3","","我子音姐姐的评论呢！？？？"
"呼唤黎明的出现","男","无IP","53483974","6","","10000","3","12","免费的大型线上音乐会就是对我来说最大的福利，其他厂商做得到吗"
"kim丶XY","男","无IP","339262414","6","","10000","3","","看评论和看弹幕一样还能实时更新的[藏狐]"
"真理钻钻鸭","女","无IP","639573047","5","","10000","3","","我们都是股东 说话嚣张点[doge]"
"胡桃的桃胡","保密","无IP","415934065","5","","10000","3","","为什么还没有璃月的。[吃瓜]"
"有姝姬酱","保密","无IP","370865678","5","","10000","3","","不要说加强心海了，我就不建议加强，因为我没有抽[吃瓜]"
"帝弓信徒小车车","保密","无IP","262855917","5","崩坏3・天穹流星","10000","3","","我TM直接狂喜"
"祖赵","保密","无IP","450035437","5","星座系列：水瓶座","10000","2","","我就直说了,你能不能加强心海[给心心][给心心]"
"哦_豁_","男","无IP","485432363","5","","10000","2","","定个目标，我迟早有一天要把能找到谱子的改编曲全练熟[加油][加油][加油]"
"行素我顾","保密","无IP","13981508","6","","10000","2","11","我已经饥渴难耐了！！！5号还有崩三的音乐会，爽爆[大笑]"
"-克莱恩-莫雷蒂-","男","无IP","602539395","5","","10000","2","","好了，这下不用担心音乐会上的弹幕质量了，到时候扰乱弹幕秩序的全杀了[藏狐]"
"Trevor_Philips","男","无IP","61181268","6","","10000","2","","https://b23.tv/j0rQzU"
"焱悠翎","保密","无IP","32248087","6","明日方舟音律系列","10000","2","","完了。。。看不着了。。。,诸位。。。会有录播吗。。。"
"生锈的铁剑","保密","无IP","25862682","5","","10000","2","","大早上就期待了 但是我夜班只能一边听一边干活了[笑哭]"
"吞洛风","男","无IP","79561606","5","异常生物","10000","2","","就今天！"
"晋白_shinhaku","女","无IP","9147745","6","","10000","2","","大家都嚣张点，这音乐会是大家投资的[doge]"
"轩辕潮汐","保密","无IP","93891541","6","洛天依8th生日纪念","10000","2","","真的期待音乐会啊，原神里的音乐真的非常舒适"
"这三个板块","男","无IP","216691166","6","","10000","2","","搞这些花里胡哨的可以，但别忘了我还是一个游戏玩家"
"茶颜so","保密","无IP","358247299","5","2021拜年纪","10000","2","","g"
"这个世界真的好小","保密","无IP","689314410","5","","10000","2","","音乐会不错"
"丸子轮7号","男","无IP","61850919","5","","10000","2","","可以哦米哈游[doge]"
"威严丶一米六","男","无IP","30519969","6","","10000","2","","原宝，出皮肤呀，赚钱会不会[酸了]"
"国家意志高于一切","男","无IP","37982492","6","原神","10000","2","","我滴原宝，怎么就这样投降了[大哭]"
"友人A与谎言","男","无IP","351286761","6","","10000","2","","准备反向洗地，刚好假期空[doge]"
"Luckyffei","保密","无IP","453493216","5","","10000","2","","我失忆了[doge]"
"江e晚","保密","无IP","443418723","5","","10000","2","","盲猜明天400＋名片"
"汪迷米","保密","无IP","586742191","2","","10000","2","","其实这些都大可不必，毕竟你吃饭也不吃包装袋吧，游戏没有就等于0,干点正事吧，老米家的！"
"歪比巴干饭人","男","无IP","342819719","5","2021拜年纪","10000","2","","不愧是你啊，米忽悠"
"嘤嘤狎","保密","无IP","388818276","5","","10000","2","","就这，周年庆就20破抽，打发要饭的"
"___q___","男","无IP","492368910","5","","10000","2","","400直接失忆"
"绫ikun版","保密","无IP","445608157","5","","10000","2","","爸爸错了[藏狐]"
"hfhjiy","保密","无IP","442281480","5","","10000","2","","我失忆了"
"被雏见泽女同吓晕","保密","无IP","688039137","5","","10000","2","","全给我失忆！[doge]"
"Tohka酱12138","女","无IP","23483597","6","","10000","2","","你扣扣米策划但凡诚意一点，在一周年之际往游戏里来点福利也不至于被全世界玩家骂这么惨，被骂完了才反应过来，何必呢？"
"_纵_横_","男","无IP","396295200","5","2233白色情人节","10000","2","","我失忆了[脱单doge]"
"可爱小花火","女","无IP","87801693","6","","10000","2","","原宝，你醒悟了，谢谢你的翅膀"
"你是积雪我是长街","男","无IP","267589156","5","","10000","2","","好家伙，铁公鸡掉渣了xdm"
"小棋","保密","无IP","289578456","6","","10000","2","","新人玩家入坑请谨慎一点，游戏福利可以说什么没有，策划经常ex玩家，天天惦记着他那转发抽奖，周年庆都是抽10%的玩家过，入坑的话也不要充钱，白瓢就可以了"
"御坂13959号","保密","无IP","580877932","5","","10000","2","","怎么还有那么多人洗ch，这是周年庆啊，就这点奖励？连海灯节都比不上，没有纪念的名片什么的，自选五星倒不要求了，至少自选四星来个啊[疑惑]"
"Ayakaのdoggie","保密","无IP","123442025","5","","10000","2","","别把自己作死了"
"不愧是欧内sama哒","男","无IP","85715212","6","","10000","2","","说一下我玩原神以来的经历吧。我是之前注册了个号但手机带不动就没玩了。但是B站首页有时候也会时不时刷到原神的二创视频（不得不说原神有些二创做的是真好）。就这样我变成了一个原神云玩家。直到有天我刷到了这个视频BV18X4y1N7Yh。才想再去玩玩看。那时候正好也接触到云游戏。就这样我开始了我在提瓦特大陆的冒险。陆陆续续玩了一个月左右虽然前期新手开荒很难敖但玩的很开心。前期没好的角色打个深渊3层想那个香玲都费劲。最后的第3间我是硬生生耗过去的（拿了个零星但还是判定我过了第3层）。做雪山的山中之物死了不知道多少次才过去。这一路走来我现在也终于成为一个45级的萌新。时不时也去60级公子本帮萌新揍公子[doge]"
"新酱那小只","保密","无IP","11544183","6","实验品家庭","10000","2","","纯度真高"
"黄樱","男","无IP","15923157","6","洛天依8th生日纪念","10000","2","","你这剧情要有隔壁一半好都不至于这样啊"
"文文庆丶","男","无IP","43731934","5","2233幻星集","10000","2","","取关了，也不想玩了"
"小羽毛被","女","无IP","37456192","6","","10000","2","","stop 非常抱歉打断你的浏览，我是你的停氪小助手  只有流水降低了ch才会慌， 骂的再凶都没流水降低来的实在   持续接力中（648两月华，精二月华给芭芭拉多开心，再氪我是狗）"
"风云糖糖主","男","无IP","17988732","6","初音未来13周年","10000","2","","开场有恶魔城那味儿了"
"陈期一","男","无IP","53463968","6","","10000","2","","更新的图标我以为是流水第一呢，原来是一周年，笑死。3"
"白苓七","保密","无IP","491097104","5","初音未来13周年","10000","2","","真的有高情商的人来音乐会底下冲啊[疑惑]"
"holdme1234","保密","无IP","286369959","5","","10000","2","6","叔叔的阿瓦隆系统了解一下，你们大概率是在和叔叔的系统对线[藏狐]"
"白夜吹笙","男","无IP","400678623","6","","10000","2","","xdm，第一战区输入评论之后刷新一次就能出现以前的评论"
"MyKoi洵","男","无IP","88763138","6","原神","10000","2","6","米哈游不要脸"
"DebiiroH","保密","无IP","20030117","5","希萝Hiiro","10000","2","","支持[OK]人家mhy的周年庆，关你们什么事[给心心]"
"月亮邮差---","男","无IP","328514041","5","","10000","2","","学姐来查寝，发现腾讯，米哈游，网易三个学生都在场,腾讯在抄作业，,网易正在吃排骨盖饭，,米哈游偷偷摸摸的不知道在藏着什么，学姐偶然间看到了他藏的东西，立马叫住了他,喊到:米哈游，你这福利挺能藏啊！"
"c余生","保密","无IP","355710525","5","","10000","2","","stop 非常抱歉打断你的浏览，我是你的停氪小助手 只有流水降低了ch才会慌， 骂的再凶都没流水降低来的实在 持续接力中"
"花名一生推啊啊啊","保密","无IP","454084404","5","","10000","2","","mhy,牛魔什么时候烧啊"
"不穿PC的miku酱","男","无IP","198547758","6","三周年恋曲","10000","2","","给爷退款行不行啊，56级号就当还你了[藏狐]"
"bili_113528636","女","无IP","113528636","5","","10000","2","","出现了一群这样的玩家，“防沉迷,就这点游戏时间?”,“一周三小时太少了”，诸如此类的发言。我觉得挺奇怪的.,1.大家要知道原神没有欠我们什么，他没有义务给你你想得到的东西，他只是一款游戏,给你带来快乐，还要依着你的小脾气?他就算不让你玩他也没有不对的地方，记住他没欠你,也许我们大家还欠米哈游一句谢谢.,2.周年庆顾名思义是游戏一周年的生日,主角应该是它，收到生日礼物的也应该是它，我们为它准备了什么生日礼物?祝福一句没有，满是时间就这点，还说防沉迷,你呢?,最后记住一点，是我们选择的原神,不是原神选择的我们，原神、米哈游不欠我们,但是我们欠原神、米哈游一句谢谢，以及一年陪伴幸苦了。而不是在这口诛笔伐游戏的时间多少。"
"繁华依旧zq","男","无IP","281961622","5","","10000","2","","勤俭节约米哈游"
"跳墙的黑羊儿","男","无IP","501568621","5","EveOneCat2","10000","2","","感恩捏[Cat_heart]"
"兔兔今天吃昵称","保密","无IP","37888713","6","","10000","2","","原友能处"
"路人丶冰","男","无IP","355467367","5","","10000","2","","rnm,退钱！！！"
"馒头km","保密","无IP","389655666","5","","10000","2","","兄弟们，ch是谁，我想问候一下他[微笑]"
"魔法少女铁观音","男","无IP","4509132","6","小桃","10000","2","","扣扣扣扣扣米游社发，票两字是屏蔽词，大家一起开kai，发fa，票piao和上海12315冲他,心海宣传pv在海里潜水，实际游戏在大世界淹死。"
"装逼曦来大师","保密","无IP","27773571","5","","10000","2","","百万塞尔达玩家竟是我自己[doge]"
"三十块十五斤","保密","无IP","286503610","5","总之就是非常可爱","10000","2","8","把全部冒险奖励(宝箱，主支线奖励）排除的话,6月，6397,7月，6950,8月，5386,9月，6219,6月加7月为，13347。8月加9月11605,两个一减不就是1742原石，这一对比，签到七天的10连不就是抠出来的吗,,现在突然有点怀念以前的百万水军，当时那样的节奏至少让原神还是有点忌惮害怕，努力做好游戏，发放大量奖励，还有多少人记得当时原神拿奖感谢大家发了1600原石，原神现在没有一点压力，而且随着时间推移水军和猴越来越少，我不是说越来越少不好。就连仅存的一点压力都没有了，原神现在是毫无竞争压力，已经开始在剧情和一些地方不走心了!!水能载舟，亦能覆舟。大家加油好好让原神看看玩家的决心，你要是不好好做，甚至在该有福利的时候不发，就休想从我们这里拿走一分钱![再见][再见][再见]宝，都是玩家的情绪啊[辣眼睛]那有什么节奏？,它会为了首充重置特地发邮件提醒，却不肯在一周年当天发邮件庆祝。,,以后充648的时候我希望大家冷静的想一想，收入这么高的MHY都这么节省，你那点微薄收入好意思乱花钱吗？,,之前看过一个采访某游戏ch的视频，ch本人亲自说的：“所有ch就是为了从玩家口袋赚更多的钱，所以也没什么互相理不理解的，这就是我的工作。“ ,还有一段“ch就是要试探玩家的底线啊。对ch来说，多给玩家送一个十连，那大概率就会少一个十连的氪金量，所以一般ch会准备好几套方案，先给出一个最低的值，玩家要是觉得可以，那就按那个来，之后还可以继续试探，玩家要是不同意，那也就是把原本准备的方案放出来。一步一步的为了从玩家那弄到更多钱。”,还有一段最离谱的“ch就是做各种不同样子的屎给玩家吃，然后一堆玩家还会为此买账，那躺着能赚钱为啥要站着赚。”,,角色平衡我唯唯诺诺,有利bug我重拳出击,原石奖励我扣扣搜搜,广告宣传我一掷千金,,我只有一个648，要充给哪个游戏呢？抽一下吧，哎呀不好意思米哈游，你没有中奖呢[爱心]，下次再试试吧，648氪给其他游戏啦,                                    ―――已消失的热评 整合版"
"元无见","保密","无IP","35269567","6","","10000","2","","真金白银的花钱花精力做什么音乐会啊？还不如动动手指发点虚拟数据有用。"
"脉-冲-星","男","无IP","13882295","6","白蛇2：青蛇劫起","10000","2","","米哈游在弘扬除中国以外的文化方面还是很用心的"
"迷失小物","男","无IP","82912367","5","","10000","2","","√喜欢删是吧，转载自消失的转载评论,开服：奖励10抽常驻10抽UP，扣的要命，官方嘲讽不过现实节。大家都说双节还有奖励，结果后来出了一个社区抽奖月卡，大部分玩家全程陪跑....,1.1前瞻直播，钟离巨额伤害欺诈，用原石数量骂玩家250。测底激怒全体玩家，反馈无视，最后发公告声称无问题。,1.2玩家集体冲爆，***，最后被迫才承认有问题，会测试改。,1.3过年，只有10连，为了省声优钱，全程无任何重要人物出场，被玩家怒喷！,1.4被迫无奈，请声优配音，登场几个角色过风花节，不甘心花钱服务玩家，于是扣除10连的原石，成为1.3海灯节的还贷期。,1.5开始尝试空降角色，加满命骗氪，导致尤拉平民玩家体验很差。,1.6唯一一个还算良心些的版本，虽然开始贩卖无特效皮肤，而且价格贵的离谱，虽然开始尝试两命骗氪，开始尝试专武分化角色能力。,2.0开始尝试厨力骗氪，五星强度开始随机性缩水。,2.1剧情开始拉胯，二命一精成为骗氪日常，五星强度开始随机性缩成仓管。明明是一周年，却无任何周年游戏内容，再次10连打发玩家，社区再次抽月卡提纯纯米精灵。,回想这一年，时光过得很快。但有原神的陪伴，平凡的日子也闪烁着稀碎的刚复制的[打call]继续删请继续,,                                        (接力C，复制转载)"
"庚夕子_Official","男","无IP","352851716","6","","10000","2","","我们走后，他们会给你们一些摩拉，一些经验书，一些原石，不是因为他们良心发现，而是因为我们来过。,改自切格瓦拉名言"
"一根小萝卜丶","保密","无IP","89143805","5","","10000","2","","我心里只有感恩[给心心]每天都是感恩节[给心心][给心心][给心心]"
"海拉鲁之剑","保密","无IP","171784339","6","崩坏：星穹铁道","10000","2","","差不多得了"
"KDASHEQIJIASHE","男","无IP","13396998","6","巅峰荣耀","10000","2","","让你们退钱"
"Mitskayase","男","无IP","180647196","5","","10000","2","","哦 是音乐公司 那咱别做游戏了行吗？"
"战损微瑕","男","无IP","352676519","5","","10000","2","6","rnm退钱"
"埋藏在旭光里的温柔","男","无IP","480979915","5","EveOneCat2","10000","2","","rnm退钱"
"原子吐息3","保密","无IP","521797869","5","","10000","2","","大家都停氪吧，Mihoyo只喜欢玩家给他送福利"
"需要6个硬币修改名字","男","无IP","22451679","6","","10000","2","","别复制了，应该是系统删的。重复内容太多"
"一定是西凉马腾","男","无IP","55338244","6","","10000","2","","原神要关服了？"
"silver的声带","男","无IP","384763398","5","","10000","2","","√喜欢删是吧，转载自消失的转载评论,开服：奖励10抽常驻10抽UP，扣的要命，官方嘲讽不过现实节。大家都说双节还有奖励，结果后来出了一个社区抽奖月卡，大部分玩家全程陪跑....,1.1前瞻直播，钟离巨额伤害欺诈，用原石数量骂玩家250。测底激怒全体玩家，反馈无视，最后发公告声称无问题。,1.2玩家集体冲爆，***，最后被迫才承认有问题，会测试改。,1.3过年，只有10连，为了省声优钱，全程无任何重要人物出场，被玩家怒喷！,1.4被迫无奈，请声优配音，登场几个角色过风花节，不甘心花钱服务玩家，于是扣除10连的原石，成为1.3海灯节的还贷期。,1.5开始尝试空降角色，加满命骗氪，导致尤拉平民玩家体验很差。,1.6唯一一个还算良心些的版本，虽然开始贩卖无特效皮肤，而且价格贵的离谱，虽然开始尝试两命骗氪，开始尝试专武分化角色能力。,2.0开始尝试厨力骗氪，五星强度开始随机性缩水。,2.1剧情开始拉胯，二命一精成为骗氪日常，五星强度开始随机性缩成仓管。明明是一周年，却无任何周年游戏内容，再次10连打发玩家，社区再次抽月卡提纯纯米精灵。,回想这一年，时光过得很快。但有原神的陪伴，平凡的日子也闪烁着稀碎的刚复制的[打call]继续删请继续,,                                        (接力C，复制转载)"
"风啸夜","男","无IP","31501535","6","","10000","2","","前天我在这抱怨周年拉胯还被冲了[吃瓜]"
"BiFace丶","保密","无IP","19921905","6","","10000","2","","√喜欢删是吧，转载自消失的转载评论,开服：奖励10抽常驻10抽UP，扣的要命，官方嘲讽不过现实节。大家都说双节还有奖励，结果后来出了一个社区抽奖月卡，大部分玩家全程陪跑....,1.1前瞻直播，钟离巨额伤害欺诈，用原石数量骂玩家250。测底激怒全体玩家，反馈无视，最后发公告声称无问题。,1.2玩家集体冲爆，***，最后被迫才承认有问题，会测试改。,1.3过年，只有10连，为了省声优钱，全程无任何重要人物出场，被玩家怒喷！,1.4被迫无奈，请声优配音，登场几个角色过风花节，不甘心花钱服务玩家，于是扣除10连的原石，成为1.3海灯节的还贷期。,1.5开始尝试空降角色，加满命骗氪，导致尤拉平民玩家体验很差。,1.6唯一一个还算良心些的版本，虽然开始贩卖无特效皮肤，而且价格贵的离谱，虽然开始尝试两命骗氪，开始尝试专武分化角色能力。,2.0开始尝试厨力骗氪，五星强度开始随机性缩水。,2.1剧情开始拉胯，二命一精成为骗氪日常，五星强度开始随机性缩成仓管。明明是一周年，却无任何周年游戏内容，再次10连打发玩家，社区再次抽月卡提纯纯米精灵。,回想这一年，时光过得很快。但有原神的陪伴，平凡的日子也闪烁着稀碎的刚复制的[打call]继续删请继续,,                                        (接力C，复制转载)"
"肝酱默咽","男","无IP","505213459","5","","10000","2","","比鲨游哈米"
"挽月色","保密","无IP","35323119","5","","10000","2","","送点东西可是会要米桑的命的，你们什么意思?"
"sky-suki","保密","无IP","480260341","5","星座系列：射手座","10000","2","","√喜欢删是吧，转载自消失的转载评论,开服：奖励10抽常驻10抽UP，扣的要命，官方嘲讽不过现实节。大家都说双节还有奖励，结果后来出了一个社区抽奖月卡，大部分玩家全程陪跑....,1.1前瞻直播，钟离巨额伤害欺诈，用原石数量骂玩家250。测底激怒全体玩家，反馈无视，最后发公告声称无问题。,1.2玩家集体冲爆，***，最后被迫才承认有问题，会测试改。,1.3过年，只有10连，为了省声优钱，全程无任何重要人物出场，被玩家怒喷！,1.4被迫无奈，请声优配音，登场几个角色过风花节，不甘心花钱服务玩家，于是扣除10连的原石，成为1.3海灯节的还贷期。,1.5开始尝试空降角色，加满命骗氪，导致尤拉平民玩家体验很差。,1.6唯一一个还算良心些的版本，虽然开始贩卖无特效皮肤，而且价格贵的离谱，虽然开始尝试两命骗氪，开始尝试专武分化角色能力。,2.0开始尝试厨力骗氪，五星强度开始随机性缩水。,2.1剧情开始拉胯，二命一精成为骗氪日常，五星强度开始随机性缩成仓管。明明是一周年，却无任何周年游戏内容，再次10连打发玩家，社区再次抽月卡提纯纯米精灵。,回想这一年，时光过得很快。但有原神的陪伴，平凡的日子也闪烁着稀碎的刚复制的[打call]继续删请继续,,                                        (接力C，复制转载)"
"一只白毛嘤","保密","无IP","351352433","5","","10000","2","10","米哈游甚至想在周年庆对所有玩家发起众筹"
"单推AIのDD","保密","无IP","353196918","5","Kizuna AI","10000","2","","复制粘贴挺挺整齐啊[嗑瓜子]"
"林鹤仙","男","无IP","7993636","5","","10000","2","","喜欢删是吧，转载自消失的转载评论,开服：奖励10抽常驻10抽UP，扣的要命，官方嘲讽不过现实节。大家都说双节还有奖励，结果后来出了一个社区抽奖月卡，大部分玩家全程陪跑....,1.1前瞻直播，钟离巨额伤害欺诈，用原石数量骂玩家250。测底激怒全体玩家，反馈无视，最后发公告声称无问题。,1.2玩家集体冲爆，***，最后被迫才承认有问题，会测试改。,1.3过年，只有10连，为了省声优钱，全程无任何重要人物出场，被玩家怒喷！,1.4被迫无奈，请声优配音，登场几个角色过风花节，不甘心花钱服务玩家，于是扣除10连的原石，成为1.3海灯节的还贷期。,1.5开始尝试空降角色，加满命骗氪，导致尤拉平民玩家体验很差。,1.6唯一一个还算良心些的版本，虽然开始贩卖无特效皮肤，而且价格贵的离谱，虽然开始尝试两命骗氪，开始尝试专武分化角色能力。,2.0开始尝试厨力骗氪，五星强度开始随机性缩水。,2.1剧情开始拉胯，二命一精成为骗氪日常，五星强度开始随机性缩成仓管。明明是一周年，却无任何周年游戏内容，再次10连打发玩家，社区再次抽月卡提纯纯米精灵。,回想这一年，时光过得很快。但有原神的陪伴，平凡的日子也闪烁着稀碎的刚复制的[打call]继续删请继续,,                                        (接力C，复制转载)"
"我们都是革命同志","男","无IP","170819518","6","","10000","2","","喜欢删是吧，转载自消失的转载评论,开服：奖励10抽常驻10抽UP，扣的要命，官方嘲讽不过现实节。大家都说双节还有奖励，结果后来出了一个社区抽奖月卡，大部分玩家全程陪跑....,1.1前瞻直播，钟离巨额伤害欺诈，用原石数量骂玩家250。测底激怒全体玩家，反馈无视，最后发公告声称无问题。,1.2玩家集体冲爆，***，最后被迫才承认有问题，会测试改。,1.3过年，只有10连，为了省声优钱，全程无任何重要人物出场，被玩家怒喷！,1.4被迫无奈，请声优配音，登场几个角色过风花节，不甘心花钱服务玩家，于是扣除10连的原石，成为1.3海灯节的还贷期。,1.5开始尝试空降角色，加满命骗氪，导致尤拉平民玩家体验很差。,1.6唯一一个还算良心些的版本，虽然开始贩卖无特效皮肤，而且价格贵的离谱，虽然开始尝试两命骗氪，开始尝试专武分化角色能力。,2.0开始尝试厨力骗氪，五星强度开始随机性缩水。,2.1剧情开始拉胯，二命一精成为骗氪日常，五星强度开始随机性缩成仓管。明明是一周年，却无任何周年游戏内容，再次10连打发玩家，社区再次抽月卡提纯纯米精灵。,回想这一年，时光过得很快。但有原神的陪伴，平凡的日子也闪烁着稀碎的刚复制的[打call]继续删请继续,,                                        (接力C，复制转载)"
