"昵称","性别","IP","UID","等级","装扮","用户权重","获赞数","粉丝团等级","评论"
"我是王者大王_uv","男","无IP","189158818","6","乃琳Queen","10000","0","","胡桃我对不起你，没有一命，等我下次"
"小寒夏至","保密","无IP","33338419","6","","10000","0","","阿贝多无，氪了128出了琴，原宝咱过一段时间再见"
"藤林杏_KYOU","保密","无IP","390444726","6","","10000","0","1","文输菩萨，yyds![星星眼]"
"雾雨魔理沙x爱丽丝","保密","无IP","874391","6","","10000","0","","罗莎莉亚以满命，目标云堇，这期池子真碰都不敢碰"
"乱絮累茶","保密","无IP","500117111","5","","10000","0","","老婆"
"又要改名唉","保密","无IP","306369829","5","","10000","0","","优已出，前来还愿"
"长长长安aaa","男","无IP","504597824","6","","10000","0","","啥时候出的角色？"
"军阀监狱大队长","男","无IP","444329121","5","","10000","0","","敢问阿贝多你和了多少瓶防寒药水呢[doge]"
"灬夜游神灬","男","无IP","254267903","6","原神","10000","0","11","30抽出了阿贝多，抱着试试看的心情，去武器池一发单抽出了松籁！[灵魂出窍][灵魂出窍][灵魂出窍],谢谢你，米哈游！我永远支持你！！[原神_干杯][原神_干杯][原神_干杯]"
"想不出来了Zz","男","无IP","18139909","6","","10000","0","12","银白的希望"
"愚者_积水成渊","保密","无IP","173521838","6","崩坏3・天穹流星","10000","0","","好看！"
"茶夏ouo","女","无IP","17493619","6","星座系列：双鱼座","10000","0","","还是妹忍住抽了一个阿老师，呜呜呜他身材真好啊，腰细腿长[tv_大哭]"
"桦木胶合板_","女","无IP","649884485","5","","10000","0","","阿贝多沉了，前来还怨"
"吃桃子","女","无IP","309242224","5","","10000","0","","完了原石保不住了"
"阿哞之息","保密","无IP","399223340","6","","10000","0","","求求了"
"阿哞之息","保密","无IP","399223340","6","","10000","0","","阿贝多啊啊啊啊啊啊啊"
"__栗悟饭与龟波功__","保密","无IP","258974811","5","","10000","0","","这个狼王就离谱，弓箭手法器平a打不到，对空优势在哪里？（宵宫惨）"
"斯堪纳尔の赫尔什","保密","无IP","293625","6","","10000","0","","所以啥时候能整出个动态壁纸？"
"我家猫猫不给抱","保密","无IP","85687756","6","精灵王","10000","0","","话说新出的黄金王兽，好可爱！！！！我可以养它吗！！！！"
"顾玖曦awa","女","无IP","526798489","5","","10000","0","","阿贝多老师您又在写生了阿  休息一会儿好不好[doge]"
"海老子","保密","无IP","15494232","6","","10000","0","","每期up角色都会出这样的短片吗"
"账号已注销","保密","无IP","1707524678","0","","5000","0","","梦想很梦幻，现实很魔幻[无语]"
"Srtvvs05445","保密","无IP","10727350","6","","10000","0","","给阿贝多加几缕头发不会把你的建模师累死的[无语]"
"Cythereans塞西莉亚","保密","无IP","1013483711","5","","10000","0","","mwb续费成功"
"一只胖榆头","保密","无IP","616979809","4","","10000","0","","阿贝多已出，会审判，谢谢原宝[微笑]"
"Cythereans塞西莉亚","保密","无IP","1013483711","5","","10000","0","","单抽中了啊啊啊啊啊啊啊啊啊啊啊，太棒了！！！！"
"红叶当空落","保密","无IP","391483715","6","","10000","0","","那个原神啊你不会设计副本可以你设计还特么鼓捣你那破虚空狼呢小狼都特么十五万左右的血量了大狼更是直逼30左右一刀下来我钟师傅5w的血量加上流血buff叠加直接干掉三四万你想让玩家更换配置也不是你这样更换的啊我胡桃大世界一刀砍十二三万深渊12一刀少说八九万你出个新副本你知道我胡桃一刀多少吗，五万，五万啊我刷了那么久的火本你就告诉我一刀五万，原神副本设计师吃我一记吃好喝好一路走好，我这次就不寄刀片了我应该寄guhui盒给你们胡桃刚复刻，那些刚抽到的人你们考虑过吗不你没有你只在乎钱，我完了那么久也氪了小三千了我甚至没能出一命胡桃只是武器池无保底69出了护摩，原神概率设计师吃我50%血量攻击"
"小涛不会玩1","保密","无IP","257344264","5","","10000","0","","希望活动多一点"
"飘渺的渺","男","无IP","2421887","6","","10000","0","","白垩之子有了,浪花骑士的份呢[doge]"
"天际风云","男","无IP","15345081","6","黑白无双","10000","0","","10发出阿贝多，10发再出尤拉，前来还愿！[呲牙]许愿申鹤，别歪！"
"绝原崩","保密","无IP","1730277439","5","","10000","0","","放给点验证码吧。给我吧。[笑哭][笑哭][笑哭][笑哭][笑哭][笑哭][笑哭][笑哭][笑哭]"
"去头皆可吃","男","无IP","701381307","5","","10000","0","","[贝拉kira_笔芯][贝拉kira_笔芯][贝拉kira_笔芯][贝拉kira_笔芯][贝拉kira_笔芯]"
"健身中的阿伟","男","无IP","660988064","4","","10000","0","","@qq.com原神，今天入团了[doge]是不是给我个优老婆？[doge][doge]"
"君墨哭","女","无IP","18294585","6","国民老公带回家","10000","0","","第一次双黄，两个阿贝多，好耶"
"一辆win10自行车","男","无IP","5834833","6","某科学的超电磁炮T","10000","0","","用刻晴抽卡出刻晴[喜欢][笑哭]人生第二个刻晴，留到须祢再抽必中保底罢[笑哭]"
"花之大魔术师","男","无IP","362542016","5","","10000","0","","rnm，退钱！上次优池歪了七七这次歪了迪卢克[tv_发怒][tv_发怒][tv_发怒]"
"凯益生菌","保密","无IP","23236212","6","","10000","0","","琴1命了[tv_白眼] 甘雨稳了[tv_皱眉]"
"白凤萧","保密","无IP","483007947","5","","10000","0","","[doge]"
"门接承明近","女","无IP","455343526","4","","10000","0","","虽然我歪刻晴了，但是我是双黄[脱单doge][脱单doge][傲娇]"
"小坨坨qvq","保密","无IP","12318187","6","","10000","0","6","[保卫萝卜_笔芯][保卫萝卜_笔芯]"
"雪糕鲍鲍笛SIX","女","无IP","123334791","6","雪未来","10000","0","25","[热词系列_好耶]"
"TO_ORE","保密","无IP","102757151","6","","10000","0","","谢谢，阿贝多抽到了[打call]"
"纯爱战士居士","女","无IP","175624117","6","","10000","0","","一开始十连双黄以为优专武来了，结果薄荷枪和万叶专武，后来不得不648强抽[大哭][大哭][大哭]"
"为我主献上故乡银月","保密","无IP","318735754","6","","10000","0","","小王子prprpr[脱单doge]"
"粑油食块","保密","无IP","656004","6","","10000","0","","皮"
"下雨的声","男","无IP","511545585","5","","10000","0","10","再见了原宝，要求公示原神圣遗物副词条随机概率，你什么时候改就什么时候回来，再见了[大哭]"
"千年-如一梦","保密","无IP","516379472","4","","10000","0","","求调调按键，自定义那种[大哭][大哭][大哭]"
"爱吃芒果味的小笼包","男","无IP","3507388","6","洛天依8th生日纪念","10000","0","","真是让人肝疼的背景音乐[笑哭]"
"一念无量劫","男","无IP","103674","6","","10000","0","7","我也想rua狐狸..."
"团子吖OvO_","保密","无IP","327392029","5","仲夏幻想","10000","0","5","刻晴能用苍古，好耶！！！[大哭][大哭][大哭]"
"lovefoebloom","女","无IP","21503334","6","小主安康","10000","0","","好家伙，我大保底出阿贝多之后，温迪语音说：“唉，我还没玩够呢……”[藏狐][热词系列_泪目]"
"洛","保密","无IP","62306860","6","","10000","0","","阿贝多老师的爱太沉重了，三发就来[吃瓜]"
"RB-先生","男","无IP","35990924","6","#EveOneCat","10000","0","","阿贝多早有了（指老早以前），前来看戏"
"冬夕不尽","保密","无IP","19877282","6","","10000","0","","老师老师，贝老师上我[不问天_喜喜][不问天_喜喜][不问天_喜喜]"
"养一只次元猫","保密","无IP","104971651","6","","10000","0","","2.4什么时候到[doge]"
"璃月第一偶像--云堇","女","无IP","375160809","6","不思议之旅","10000","0","8","出七七了"
"真的好没意思啊","保密","无IP","8076163","6","","10000","0","","贝贝多!"
"情焰灼魂","保密","无IP","348680063","5","2233幻星集","10000","0","","呃，有没有兄弟是新版本更新完登不上去r[大哭]"
"鲤小十四","男","无IP","651887663","5","碧蓝航线","10000","0","","阿贝多老师已出，前来还愿"
"chb5866cxd","保密","无IP","347376624","5","","10000","0","","为啥胡桃放进诚哥壶，人看不见[思考]"
"百家得","保密","无IP","347483191","6","","10000","0","","爱死阿贝多了[脱单doge]"
"独揽风月R","保密","无IP","138033119","6","","10000","0","","大保底80抽才出，还个N的愿！"
"账号已注销","保密","无IP","1588588770","0","","5000","0","","第一个班尼特爱了爱了"
"传承终焉","保密","无IP","435748214","5","","10000","0","","我跑遍了雪山可是没有找到阿贝多[大哭][大哭][大哭]"
"我与十二有个约定","保密","无IP","28114094","6","","10000","0","","优的ep呢"
"苍裕的晴天","保密","无IP","2284112","6","","10000","0","","鹤观岛屿的雾，野怪隔着二三十米都能看到我追着我砍，而我就站着不动居然还能迷路还tm需要路重新跑图。"
"抱有幻想抱有行囊","男","无IP","234526484","5","","10000","0","","有人带我这个新手吗？,207551158"
"种花家的小银狼","保密","无IP","43989676","6","原神","10000","0","11","阿贝多铁血粉前来报道"
"檬朦鞑","男","无IP","333921019","5","崩坏：星穹铁道","10000","0","","大伙还在抽阿贝多的时候，我好感早就满了，第一次体会到一种异样的快乐[doge]"
"の你大爷永远是你大爷の","保密","无IP","289130950","5","","10000","0","","大声告诉我什么叫实机"
"改名试图脱非入欧","男","无IP","72255738","6","","10000","0","5","74抽阿贝多，ml没石头抽五郎了[大哭]"
"Samuel-Ayers","男","无IP","353863674","6","#EveOneCat","10000","0","","阿贝多以歪，前来还怨[大哭][大哭][大哭][大哭]"
"明月夜醉是动人","保密","无IP","28520679","6","","10000","0","","把我的阿贝多还给我！！！[大哭]"
"我和欧气贴贴","女","无IP","93650758","6","","10000","0","","出了阿贝多[脱单doge]非常感谢"
"高性能哒萝卜子","男","无IP","1872642356","5","初音未来・16岁生贺头像框","10000","0","","一发十连阿贝多[咩栗_羊羊得意]"
"独醉那心殇","男","无IP","334919491","5","","10000","0","","为啥没有皎洁的笑颜，我不能理解[辣眼睛]"
"H对对对你说的对","保密","无IP","434271686","6","","10000","0","","不是 老子一个弓箭手打不到 王兽 玩尼玛？ 宵宫tm 的索敌机制能不能改 改不了删了 看着恶心 c"
"园生yoyo代","保密","无IP","1723119","6","","10000","0","","我阿贝多歪了[大哭][大哭][大哭]"
"WYX2023xm","男","无IP","294099923","5","","10000","0","6","玩到现在两个半月，角色12金9歪3[藏狐]"
"阿斯莫德-Ma","保密","无IP","517158182","5","","10000","0","","此即，扭转万象[doge]"
"七彩光咪咪i","保密","无IP","28741355","6","","10000","0","14","最喜欢雪山了()阿贝多老师真的好温柔好绅士"
"一_四一四","保密","无IP","5524252","6","","10000","0","","[酸了]啊晴和啊贝多都是啊啊啊啊，应该没歪把。"
"observatory77","保密","无IP","413679740","5","","10000","0","7","啊这，竟然没有优的EP吗？"
"萤清菱","女","无IP","399921568","5","","10000","0","","抽到的第一个没有歪的五星角色（可能是上次胡桃池子垫的大保底），虽然可能没有很适合的东西给他，但也挺好的。"
"未来会变成什么样呢","保密","无IP","287806726","6","良辰美景・不问天","10000","0","","好冷啊>_<"
"-乐正司音-","保密","无IP","259167005","6","乐正绫五周年生日","10000","0","","我要是拿这曲子当闹铃估计就更不想起了[藏狐]这么冷的天配上这么冷的曲子更不想离开被窝了[微笑]"
"探究の眼神","男","无IP","358240005","6","","10000","0","","感觉开头那几幕贼适合做电脑壁纸。。"
"ashan7777","保密","无IP","49923548","6","","10000","0","","又歪了，坏事做尽"
"九里丶丶","保密","无IP","356855855","5","鹿乃","10000","0","","阿贝多歪了[大哭]强娶出来的[大哭]"
"魔法少女幼姬酱","保密","无IP","17724017","5","","10000","0","","讲个育碧笑话：抄袭异度之刃2"
"GARO_道外流牙","保密","无IP","432846264","5","","10000","0","","加强刻晴，加强刻晴，加强刻晴"
"给我小电求求了","保密","无IP","12503920","6","EveOneCat2","10000","0","8","原宝，别逼我，赶紧出希娜小姐周边，别逼我跪下来求你，要不然我五郎一个都不抽了[嘟嘟][嘟嘟][嘟嘟][嘟嘟]"
"归于念","男","无IP","1514119952","5","","10000","0","","这2.3我是一秒也待不下去了！什么？2.3还没来？"
"攸才","女","无IP","407263985","5","","10000","0","","笑死我以为大保底优了谁知道我四月份抽过二十几次大保底给胡桃我自己都不知道[大哭]"
"_时雨ovo","保密","无IP","1843571","6","2233十一周年纪念","10000","0","","我要鲨了说阿贝多在挠屁股的人[原神_生气]"
"攸才","女","无IP","407263985","5","","10000","0","","雪山那个活动什么时候开呀？"
"桃饱客服祥子","保密","无IP","503620224","5","","10000","0","","原宝，能不能让我的号变欧点啊。我次次都是大保底。这次护摩还歪了终末，呜呜呜。我身边的朋友动不动就是双黄。"
"看不惯我就和xzsw","男","无IP","351412150","6","#EveOneCat!","10000","0","","歪了刻晴[大哭][大哭]"
"猫不倒翁老师","女","无IP","107299199","5","","10000","0","","又要长草40天2.4能不能开新图！？[蛆音娘_生气]"
"白蛋清0w0y","男","无IP","412708221","4","","10000","0","","抽完马上又小保低了，好耶~[星星眼]"
"浩威_达司马","男","无IP","71238064","6","巅峰荣耀","10000","0","","尤拉池 歪了刻晴[辣眼睛][辣眼睛]"
"Assassin未知","男","无IP","170743663","6","","10000","0","","BV13q4y1g73d这个你们不修一下？"
"出逃的Helen","女","无IP","415229376","5","","10000","0","","感觉像是一个人在早以湮灭的雪国漫步"
"离游之冰","男","无IP","13792874","6","刺客伍六七","10000","0","","OK兄弟萌，全体目光向我看齐，我宣布个事，我是希娜小姐的狗[doge]"
"我打吐了","保密","无IP","631496889","5","","10000","0","","五抽阿贝多前来还愿"
"满脑子都是xx的我","保密","无IP","434134679","5","三周年恋曲","10000","0","","阿贝多老师-昔日的路人"
"我需要亿点地狱迷因","男","无IP","612027279","5","","10000","0","","xdm如果10连出了阿贝多我直播吃屎"
"极耀渣渣","保密","无IP","57491982","6","","10000","0","","告诉我，丢冰刺的阿贝多是骗骗花变的，我不想再打一次喜欢的角色了。,山  配音：mace  声线一样  暴走（黑化） 米哈游的游戏,,另外能不能做一个八重神子吃瘪的场景，我想看她那时那刻什么都做不到只能气的脸红直跺脚（）"
"你的海王水饺饺","女","无IP","13609028","6","","10000","0","","阿老师….老婆…嘿嘿嘿"
"柑桔橙橘","女","无IP","14920154","6","EveOneCat2","10000","0","","下载更新用的流量，现在被限流没法用4K看EP了(Д` )"
"星海杰君","保密","无IP","172354067","6","星尘","10000","0","","攒了三个版本，159发超级大保底，2w5原石才抽出来[灵魂出窍][灵魂出窍][灵魂出窍]"
"Lenzz99","保密","无IP","8353111","6","","10000","0","","梦回第一次爬老滚的雪山，感动"
"逝去的问题","男","无IP","39513819","5","","10000","0","","PC端更新完以后进都进不去了[辣眼睛]"
"忧郁X兔子","女","无IP","163916597","6","异常生物","10000","0","","存了一个星期的原石来了一把笛剑……[嫌弃]"
"胆小的米卫兵","男","无IP","349954061","5","","10000","0","7","兄弟们告诉你们一个好消息：我出金了。不过是个僵尸。[大哭][大哭][大哭]"
"无名的Nuko","保密","无IP","496250500","5","碧蓝航线","10000","0","","前来还怨[灵魂出窍][灵魂出窍]"
"_厄尔忒弥斯_","女","无IP","38829405","5","原神","10000","0","6","新boss感觉还好吧，没评论区说的那么可怕，我岩系都没带，带着雷神公子香菱芭芭拉硬莽过去了，对我来说还没有古岩龙蜥难。,就是尤池歪了七七，这个仇我记下了。我一斗稳了，尤有缘无份。（原神里难得让我心动的女角色）[藏狐]"
"来自时空的平安","保密","无IP","316358750","6","","10000","0","","abd还是强"
"YL情报局","保密","无IP","3840423","6","","10000","0","","一把就出了个梦醒防御沙漏，我哭了，太欧了，然后后面全是海染。。。"
"°d解°","保密","无IP","14066719","5","请吃红小豆","10000","0","","一听这BGM，严寒值就叠满了[妙啊]"
"棒打秀花掌推毒歌","女","无IP","247694","6","Kizuna AI","10000","0","","很贴心哦，都不用做其他处理了，稍微截一下就是4K的动态壁纸了"
"梦菌Dream","男","无IP","2004438331","5","","10000","0","","希望黄金狼王能虚弱这流血太可怕了"
"七星世","保密","无IP","604095350","5","异常生物","10000","0","","这就是新版本？咋啥也没有啊"
"丸兔迷圣衿","男","无IP","14273315","6","贝拉kira","10000","0","","胡桃啥时候能整个皮肤啊，火系她跟迪卢克俩人一身黑，看着好单调"
"流水van桃花","男","无IP","95899475","6","星座系列：双子座","10000","0","","挠屁屁"
"咕噜是我的","女","无IP","7941099","6","","10000","0","","石头没攒够，不能带你回家了宝[大哭]"
"落地闪电","男","无IP","7136151","6","","10000","0","","[doge][doge]为陈致逸老师和HOYO-Mix献上心脏[绯赤艾莉欧_喜欢][绯赤艾莉欧_喜欢]"
"贰拾owo_","保密","无IP","102796236","6","","10000","0","","小保底连歪三次了，真的很崩溃[大哭][大哭][大哭]"
"千灯Nya","女","无IP","9040246","6","原神","10000","0","","小王子！！！！"
"流风旖旎","男","无IP","2708199","6","","10000","0","","雪山音乐yyds"
"得起个dio扎天的昵称","保密","无IP","411971408","5","","10000","0","","4小时凉了"
"韶华不复隐东篱","女","无IP","27222400","6","EveOneCat2","10000","0","","贝老师快来啊呜呜呜[大哭]"
"爱上吃肉oo","保密","无IP","12729054","6","","10000","0","","那个得用岩元素打"
"Racoon雷库恩","男","无IP","18701258","6","","10000","0","10","阿贝多老师，你又在写生哦，休息一下吧，去练个金好不好"
"希儿的小兔","保密","无IP","34611201","5","","10000","0","","什么时候可以把游戏的资源弄的小点啊"
"Az丶Slaine","保密","无IP","240705619","6","三周年恋曲","10000","0","","[思考]是不是以后每年冬天都会回雪山一趟啊[doge]"
"Mercury_Song","男","无IP","1373499803","5","","10000","0","","胡桃池子歪了……阿贝多稳了[doge]"
"十束家的多多良_","保密","无IP","111223967","5","","10000","0","","优没出的来集合一下吧[大哭]"
"梅川内酷晓解","保密","无IP","272571655","6","","10000","0","","蒙德第一偶像芭芭拉，璃月头牌云堇，稻妻知心大姐姐五郎，笑不活了[笑哭]"
"麋失鹿","保密","无IP","66708240","5","崩坏：星穹铁道","10000","0","","小号歪了刻晴，求大号三黄运气好点"
"深夜攻击力提升十倍","保密","无IP","282944289","6","","10000","0","","二十发出了阿老师，还有什么好说的，他心里有我！！！！[大哭][大哭]"
"-公子季-","男","无IP","272941027","6","","10000","0","","大家是否愿意在打北风狼王的时候 给角色增加寒冷条呢[doge]"
"黄瓜炒蛋饼","保密","无IP","339302600","5","","10000","0","","阿贝多已出，一年了，终于等到了[给心心][给心心][给心心]"
"在下所坚持的正义","保密","无IP","5825679","6","三周年恋曲","10000","0","","今天抽到了阿老师，被他的小短裤和小靴子之间的绝对领域和小臂环涩到了，不懂就问，阿老师穿是黑色打底裤吧【思索】"
"阿团牌大耳朵","保密","无IP","72997832","6","少女前线","10000","0","","阿贝多抽到了[打call][打call]"
"江国桃良","女","无IP","33301746","5","","10000","0","","宝贝，给你补到二命了[保卫萝卜_笔芯]"
"音扶弦","女","无IP","24949477","6","","10000","0","","贝师傅，你是做什么工作的？"
"我赌你的椰子里没有奶","男","无IP","343237659","5","","10000","0","","以后能出一个类似火影时光签的补签道具吗？我好买月卡[2233娘_委屈]"
"天边的丘丘人","保密","无IP","396042724","5","","10000","0","","七七。。三命了"
"Allen-a","保密","无IP","379892615","5","","10000","0","","这不是把迪卢克接过来了吗[小电视_汗]"
"夜猫诗人","女","无IP","106418064","6","斗破苍穹","10000","0","","大保底把阿贝多老师带回家了[亲亲][亲亲]"
"世界从不变","保密","无IP","282614730","5","","10000","0","","多给阿贝多点头发吧，我真顶不住优的屁股[笑哭]"
"saturnman123","保密","无IP","384382196","5","","10000","0","","好高清，游戏为什么为这么高清"
"Regression_R","保密","无IP","436603275","5","","10000","0","","什么时候复刻胡桃？"
"寒月照魄","保密","无IP","28125917","6","碧蓝之海","10000","0","","武器池定轨吃满，上个胡桃池也是，米忽悠这把我当来宰吗[辣眼睛]"
"橙子味儿的喵","保密","无IP","46897593","5","","10000","0","","次次160一个up五星，人麻了。[tv_难过]"
"自由的大狗","保密","无IP","87482208","6","原神","10000","0","","优没EP吗[脱单doge]"
"差劲哥哥","保密","无IP","261127912","6","","10000","0","","能出个换主角的功能吗，女角没有带入感.，邀约都不舍得做，跟男性角色做任务又感觉很奇怪"
"若得青叶飞","保密","无IP","16827643","6","2021拜年纪","10000","0","","[原神_鸽子]普通池什么时候弄个保底新五星的机制？我特喵不要武器！"
"琼华修仙研究中心","男","无IP","488911929","5","","10000","0","","新人，问下莫娜能用天空之傲吗？[辣眼睛]"
"爱父王的小莫","保密","无IP","18721295","6","","10000","0","","卧槽，，看完这个视频一点都不想抽优了，阿贝多老师太美了"
"我吓跳一释忍放术","男","无IP","417889548","5","","10000","0","","“宵宫玩家”要来伸张正义啦 快跑啊[抠鼻],  皇女玩家在哪呢？"
"一开始就没有努力","男","无IP","401760428","6","崩坏3・天穹流星","10000","0","","这种双复刻太爽了,14发的阿贝多40发的优[doge][doge]"
"集成式白菜杠精","保密","无IP","37427319","6","明日方舟","10000","0","","不是，活动都没开，ep怎么就出来啦？[藏狐]"
"安然度过yyyyy","女","无IP","337256272","5","","10000","0","","谢谢mhy，前不久小保底给了胡桃，今天第八抽就抽到了阿贝多！！！"
"甜甜的红豆i","男","无IP","13726493","6","2020拜年祭（鼠）","10000","0","","[藏狐]"
"叫我大圆帅","保密","无IP","8803933","6","格兰芬多","10000","0","","阿贝多吃了我20000多个石头才出来[捂脸][捂脸][捂脸][捂脸]"
"年少有为的L先生","男","无IP","660731147","5","","10000","0","","这次的邀约任务像传说任务"
"Hey_broooo","保密","无IP","325112293","5","","10000","0","","崩不住了我最喜欢的bgm[热词系列_三连]"
"K末Terminus","男","无IP","22593033","6","","10000","0","2","讲个笑话，今天用凝光打黄金狗，开大石头全部飞走了，一个都没中，这个锁定到底是没修好[微笑]"
"冬日有雪01","男","无IP","484200890","5","","10000","0","","优拉已出，许愿神子小保底别歪。歪了等复刻不知要多久了"
"原神晓生姐","保密","无IP","471579363","5","","10000","0","","遛两条小狗狗，,一条叫@Re酒歌，,另一条叫@原神百晓生,评论区里的可以随意对这两条小狗狗扔石头"
"jl141117","男","无IP","228933904","6","hanser","10000","0","","可恶啊，这黄金王兽真烦，我甘雨射了几箭解除瞄准发现角色全都红了，边上的黑狼雷电标志的圈也打不满，打个屁啊"
"加薪太肥糖","保密","无IP","7064342","6","原神","10000","0","8","申鹤不要改, 我太爱了,已经准备好满命了!!!"
"零族绯红神","保密","无IP","229061599","6","格兰芬多","10000","0","","十发出俩阿贝多，现在不得不抽二命了[笑哭]"
"爷才不屑呢","保密","无IP","321244387","6","原神","10000","0","","阿老师，我是你的信徒啊"
"contenders","保密","无IP","346069313","5","","10000","0","","突然发现长按屏幕倍速播放直接变成喜剧配乐了[笑哭]"
"风与雨人","保密","无IP","365150558","6","","10000","0","","可以优化一下阿贝多的建模吗，PV里面真的可以说一个成男男神，可惜建模看上去更像一个少年。发量也少了[doge]"
"遄哟笫","男","无IP","332800878","5","","10000","0","","是不是少个神曲没装进去啊~~~~~~[脱单doge]"
"多巴胺Do","保密","无IP","397079931","6","","10000","0","9","158发才出老婆，唉，老保底人了"
"红桥桥桥桥桥桥","女","无IP","348638090","6","","10000","0","","阿贝多老师别歪啊[大哭][大哭]"
