"昵称","性别","IP","UID","等级","装扮","用户权重","获赞数","粉丝团等级","评论"
"门槛上脚过半只","保密","无IP","355272543","5","","10000","1","3","这个热门怎么有点晚？？"
"叫我毛就好了","男","无IP","108918287","6","","10000","1","","封面看着像个锤腰的老大爷[笑哭]"
"ZombieMoew","保密","无IP","325725866","5","","10000","1","","优复刻EP在哪里,[热词系列_我哭了]"
"-YWR-","男","无IP","412883057","5","伍六七之玄武国篇","10000","1","10","在吗？我睡不着了，我的阿贝多怎么变成了冰系单手剑？"
"珉ZM","男","无IP","178065659","6","","10000","1","","阿贝多尤首日流水超雷神了，策划很难不赢麻[doge]，，"
"宵宫酱卡哇伊","保密","无IP","174092115","5","","10000","1","","b服求个好友一起刷刷本，一个月刷不出来好的圣遗物，社恐不喜欢匹配打，主要打火本水本追忆本，一起打其他的也行！uid505407220  滴不到改天在来[原神_喝茶]"
"天下的一切皆归本王","保密","无IP","16603516","6","","10000","1","","更新之后一直黑屏闪烁是怎么肥事啊"
"イノシロ","女","无IP","197592857","6","","10000","1","","雪山最喜欢的几首曲子！齐了！"
"慕梅小可","女","无IP","299840152","6","","10000","1","7","许愿阿贝多！！出必还愿！！[喜欢]"
"alceyy","女","无IP","27636722","6","","10000","1","","抄袭原神？"
"谁还不是个嗑学家了","保密","无IP","498761802","5","","10000","1","","给阿贝多加点头发吧，伟大的炼金术师至于那么秃吗[笑哭]"
"终焉之灵","男","无IP","310037548","6","","10000","1","","优已出[doge]"
"DebiiroH","保密","无IP","20030117","5","希萝Hiiro","10000","1","","看得出来，你在很努力的把申鹤的动态往下推，加油"
"莱斯霜语","男","无IP","2944363","6","","10000","1","","紫米怎么没来[doge]"
"创世菜鸟二号","保密","无IP","46094066","6","","10000","1","","每个池子都单抽出金来还愿了[给心心]"
"六六六六六","保密","无IP","650262207","5","泠鸢yousa登门喜鹊","10000","1","","圣遗物系统！"
"冬名山山神","男","无IP","394758933","5","","10000","1","","接下来一段时间该有大佬在尘哥壶中造迷宫了，然后开始计时比赛[罗小黑_吃瓜]"
"你又响度发乜癫啊","男","无IP","1852382","6","","10000","1","","啊…这黄金兽你们测试人员有没有亲自打过啊，我胡行钟打的异常痛苦[]"
"久远赞颂","保密","无IP","416324770","5","星座系列：水瓶座","10000","1","","■■■■■■■　 ,■～　～ ■■■ ／￣￣￣￣￣￣￣￣￣＼,|　  ●-●   |      |　      亲爱的旅行者       1,\　  ‘` / ∠   \          我回来了          / , ＼　　 イ　           ￣￣￣￣￣￣￣￣￣,／　　　\        ,/　|　　　 \      ,|　|　　　 | |"
"姬千玉","保密","无IP","30609846","6","","10000","1","","改一下阿贝多的头发吧求求了"
"魔法少女幼姬酱","保密","无IP","17724017","5","","10000","1","","为什么原神逐渐饭圈化"
"枕玉老师","女","无IP","6607952","6","","10000","1","","又新出了副本，元宝加点体力上线，好不好？"
"裁冰裁冰","保密","无IP","629070235","5","","10000","1","","我真的是奶妈召唤率拉满了[捂脸]，心海池子入的坑，好家伙我这次阿贝多歪77了，现在这个游戏里几乎全部能奶的角色我都有[捂脸]，能组两个奶妈队，打架死了算我输[藏狐]"
"roco坟刀","男","无IP","388260710","5","","10000","1","","宵宫打新怪空箭，宝"
"哈人大鲨鱼","男","无IP","3051452","6","","10000","1","","2.4,1.渊下宫,2.申鹤五星，云堇四星 甘雨魈复刻,3.凝光和云堇的邀约,4.海灯节,5.躲猫猫复刻,6.炼金术活动(新活动),7.凝光刻晴皮肤 ,8.(不认识的新活动),9.雷印商店,10.愚人众丑角"
"石猴WJ","男","无IP","334948188","6","","10000","1","","七七两命，还带三个昭心，去神社抽签：大吉[微笑]"
"萌动龙宫","保密","无IP","50386326","5","","10000","1","","利用深赤之石可以让火系以外的角色点燃火炬。"
"还是白桃","保密","无IP","504516790","5","","10000","1","","一个伤心的故事，抽班尼特结果被阿贝多吃了大保底"
"WX微笑XW","男","无IP","23182860","5","汉化日记","10000","1","","13发单抽出的，谢谢原神[doge][doge][doge]"
"-公子季-","男","无IP","272941027","6","","10000","1","","为啥版本升级了  神樱树还是没法兑换奖励呢[酸了]"
"耗","男","无IP","1747294766","5","","10000","1","","www来了来了"
"如梦晓风残月","男","无IP","585097003","6","","10000","1","5","@腾讯 速度道歉,承认你是幕后的策划,并且发誓不再买水军带节奏,这样大伙还能原谅你"
"Meis木爽","保密","无IP","15162277","6","","10000","1","7","还愿了，优老婆终于抱回家了，并且松籁响起之时双黄，总的只用了50抽，感谢你米忽悠[doge]"
"黑月下的时间","保密","无IP","17673104","6","","10000","1","11","阿贝多老师太强了"
"云汐zm","男","无IP","400631096","5","","10000","1","8","我今年年初就拥有了阿贝多，你们的宝贝已经被我玩弄了快一年啦[阴险],[原神_G嘿]"
"潸羽","保密","无IP","244056921","6","","10000","1","","我提个建议，海染套那个水泡爆炸声音能不能小亿点，正常当七天移动的时候吵死了"
"风・雷","保密","无IP","7665827","6","崩坏：星穹铁道","10000","1","","【【原神】满体玩家1w体力苍白本能带来什么（其一）-哔哩哔哩】https://b23.tv/F0YF7vB"
"叶公家的小青龙","男","无IP","289577646","6","","10000","1","","原神加油[原神_G嘿]"
"看见我的火力大喵了吗","保密","无IP","170927362","5","星座系列：处女座","10000","1","","不会做弓箭手就别做。平a吞箭，打个距离远的抛锚。打个天上飞的，竟然还不索敌。那出啥的弓箭手呢？这跟近战有什么区别？不会做就做成公子甘雨那样的。你这普攻打输出全是bug，倍率1000也不管用。,肖宵宫做的挺好，下次别做了。（破防）"
"我老公是无敌的承太郎","保密","无IP","97072494","6","请吃红小豆","10000","1","","我可以问一下评论区的大佬吗，为什么寻找宝藏的任务做完了结果任务还在啊[大哭][大哭][大哭]我现在都没办法过胡桃的剧情[大哭][大哭][大哭]我好痛苦啊[大哭][大哭][大哭]我都想把藏宝图吃了[难过]"
"秋-之-羽","男","无IP","410266852","4","","10000","1","","原神加油！！要硬气呀！！！"
"你又不像橘子","保密","无IP","412207579","5","","10000","1","","所以，优的视频在哪里？"
"孔雀哔哔","保密","无IP","38492307","6","","10000","1","","试问这个动态壁纸，在壁纸引擎如何搜索[藏狐]"
"旎蒽","保密","无IP","384721027","6","hanser","10000","1","","[hanser_暗中观察][hanser_暗中观察][hanser_暗中观察]"
"学不好数学不姓廖","女","无IP","12349365","6","","10000","1","","我的小王子阿贝多[给心心][给心心][给心心]我永远喜欢你"
"上秋二十八","保密","无IP","18406645","6","","10000","1","","快出云堇吧，我是一点都不像等了，太爱她了[大哭][大哭][大哭]"
"原初归梦","男","无IP","515255798","5","","10000","1","","啊啊啊本来刚抽胡桃攒甘雨的，这个池子想抽个班尼特。结果20发你给我来一个优？？？"
"Tree_er","男","无IP","291400420","5","","10000","1","","为什么pc端还不开放120帧？iOS端2.2版本就有了"
"梦之凇","保密","无IP","23235250","6","魔兽世界・暗影国度","10000","1","","我tm出阿贝多了！！！"
"ynatsuya","女","无IP","3034088","6","原神","10000","1","","等了一年 终于补到2命了 不枉我攒了4w7原石[大哭]！！！"
"一般路过眼镜男","保密","无IP","51077","6","","10000","1","","xdm,死兆星号能传送了，还从孤云阁上面飞过去的我显得很憨[OK]"
"疯语404","保密","无IP","356538391","5","原神","10000","1","","入坑3个月，卢姥爷2命了！月均一个卢姥爷"
"歌谣立夏","保密","无IP","98726664","6","三周年恋曲","10000","1","","哈哈，抽错池子了，阿贝多一命了[给心心]"
"JoltzS1X","女","无IP","59686333","6","神乐七奈","10000","1","","歪了[大哭]"
"幻羊吟","保密","无IP","1316918489","4","","10000","1","","[原神_哇]"
"念暗","保密","无IP","38985469","5","","10000","1","","为什么，为什么我的阿贝多老师抽出来是紫色的双马尾，还会给刻晴加命座（错乱）"
"设肷林","男","无IP","702493414","5","","10000","1","","我歪莫娜了（三个班尼特+四个诺艾尔+一个罗萨莉亚）角色图鉴里五星只有神里是up，其他五星全是常驻五星角色，好难受"
"欧颜歌基","男","无IP","552555308","5","","10000","1","","好家伙，才发现更新这天我生日[原神_嗯]"
"凌易Azz","男","无IP","411533850","5","公主连结凯露","10000","1","","歪了 啊  我淦"
"月明梨花渡雪","保密","无IP","12931855","6","","10000","1","","歪了迪卢克，看来我注定是一斗的女人了"
"芯Jun","男","无IP","28938026","5","","10000","1","","《皎洁的笑颜》呢！！！！！！！！？？？？？？？？？？"
"橘子爱吃猫猫","女","无IP","505692674","5","","10000","1","","的神樱树咋还是上限的？？"
"mhy一款我的赛博案底","保密","无IP","65991361","6","","10000","1","","开服到现在没有老爷，今天歪出来了[笑哭][笑哭][笑哭]老婆你真是心地善良，可是我更想你来我家啊[大哭][大哭][大哭][大哭]只好这个版本末再来接你了呜呜呜[大哭][大哭][大哭]"
"屑の魔女伊蕾娜","保密","无IP","43923797","6","良辰美景・不问天","10000","1","","已经75小保底卢姥爷+51抽了 阿贝多你不来算了 上一次小保底不歪还是抽钟离的时候 可莉、宵宫、雷神、胡桃全是大保底 小保底70发歪 大保底75发出货 好家伙 非酋真不配玩原神呗 一分钱也不会氪给你了 uid179372545 4月份入坑 如今到现在次次大保底 一个喜欢的限定角色我要准备140抽+，真当我次次给你氪？现在小月卡我都不氪了 再见"
"源气少年Royan","男","无IP","234010542","6","异常生物","10000","1","11","七七已出，前来还怨[微笑]"
"叶叶叶叶梓一","女","无IP","255929335","5","","10000","1","","把早柚，北斗和五郎的邀约任务都做了换了两抽，目前77出迪卢克75未出阿贝多。做邀约的时候为了跑快点队伍里放了凯亚罗莎莉亚温迪万叶，从高处往下跳的时候从不开风之翼，直接往下跳，带着残血跟北斗在归离原找宝藏，差点被冰法和水法团灭"
"斯图亚特CN","保密","无IP","86684418","5","","10000","1","","活的不如一块兽肉[doge]"
"阿狸家的刻晴","保密","无IP","389170026","5","","10000","1","","神子，快给我变，就是那个，嗯嗯嗯，嘿嘿嘿~吸溜[给心心]"
"Alloove","保密","无IP","360927297","5","","10000","1","","1.5万原石抽阿贝多没出 我很开心[呲牙][呲牙][呲牙]"
"夜凌儿SAMA","女","无IP","70573767","6","","10000","1","","是哪个文豪说的“他是在看自己的宿命”！刀死我了呜呜呜[大哭]"
"彼岸归魂","男","无IP","14056999","6","良辰美景・不问天","10000","1","6","虽然没出货，但还是要夸一下，北斗邀约做的不错，人物形象很丰满[OK]"
"Dr山泉","男","无IP","50222433","6","","10000","1","","刚刚抽到了红发冷眼美男阿贝多先生[嘟嘟]"
"孜然烤腊肉","男","无IP","272888147","6","","10000","1","","强烈希望在雪山放个画架！然后做成家具放壶里"
"Belaf终末","保密","无IP","32163903","6","异常生物","10000","1","","陈致逸nb"
"谨临","保密","无IP","23562170","5","","10000","1","","我把那个抬起来的手臂上的黑色袖子看成胸了 还在想建模改了？[tv_思考]"
"白翊语","保密","无IP","1467761108","4","","10000","1","","老人:孩子你来抽角色,我（抱着原石走来）:对呀,老人:你想抽的是单手剑,我:没错,老人:蒙德人,我:对对对,老人:而且位高权重,我:没错就是这样的,老人:孩子你会抽到的。,然后当当当，团长出来[傲娇]"
"无可救药的小凋零","保密","无IP","156548381","6","早稻叽","10000","1","","宵宫"
"听那悠扬之风","保密","无IP","321295292","5","","10000","1","","让我看看哪个保底出了七七的，哈哈哈哈哈哈……呜呜呜呜呜呜呜[酸了][大哭]"
"总悟小可爱","保密","无IP","22987675","6","","10000","1","","为什么喂小狐狸的盘子完成成就就没了，还想回雪山继续喂它们[难过][难过]"
"叠叠心之钢","男","无IP","18798352","6","","10000","1","","为什么预下载了3g这次还要下载2.2g？什么情况"
"孙狗裤","保密","无IP","284971354","5","王子碰碰球","10000","1","","原来阿贝多也会占卜[doge]"
"帕秋莉S蕾姬","保密","无IP","6932368","6","首批购买年度大会员","10000","1","10","156发出阿贝多[灵魂出窍]"
"一只菌云","保密","无IP","439596412","5","","10000","1","","七七加天空书[大哭]"
"忆氪熙咖喱棒","男","无IP","99062648","5","","10000","1","","手歪了，大保底点错了阿贝多的池子，气的我又哭又闹，呜呜呜呜，好可怜啊！对不住了优[委屈][委屈][委屈]告诉我我不是唯一的一个"
"涩会成年少女","保密","无IP","32456906","5","","10000","1","","我阿贝多歪了琴[大哭][大哭][大哭]"
"52115604322_bili","保密","无IP","405782969","4","","10000","1","","我对不起你啊，尤拉[大哭]我的已经被神鹤小姐姐偷走了[害羞]，其实我在三天前还是爱着你的，尤其是你那优美的细腰[吃瓜]，希望以后有缘吧！我保证下次绝不再辜负你[脱单doge]"
"卖胡桃的雷电婆娘","保密","无IP","488433126","4","","10000","1","","啥时候更新地图啊？[嫌弃]"
"北冥-有咸鱼","男","无IP","434364893","5","","10000","1","","小保底歪了莫娜，然后两发单抽出优[滑稽]"
"老夫蜡油","男","无IP","183640873","6","","10000","1","11","听得我，发冷[藏狐]"
"高尚的蓝玫瑰","男","无IP","398126051","6","","10000","1","","整个片子全看完了，心里有很大触动，迸发出无数的热情，让我有一种感觉一定要做点什么的激情!,,于是，我在床上翻了个身,,然后发现充电器太短又翻回来了[doge]"
"古拉斯贝尔","保密","无IP","19660117","6","","10000","1","","假装画画的阿贝多。连颜料盘都不拿，怕不是早就冻住啦，颜料抠都抠不下来。[doge][doge]"
"Ichigyou_Ruri","男","无IP","321598008","5","","10000","1","","为什么我的阿贝多在老年人，伤害和发量都跟不上？"
"星辰-无离殇","保密","无IP","281390553","5","","10000","1","","阿老师真有点惨，五星角色试用就abd拿四星武器[藏狐]"
"橘淘淘橘","保密","无IP","67618355","5","2233幻星集","10000","1","","什么时候可以单独更换角色语音的语言[原神_哼]"
"难免脸红","男","无IP","55908079","6","","10000","1","","40抽结束战斗，阿贝多加优，截图放动态了，哈哈哈哈哈爽爆[给心心]"
"谛乐花","保密","无IP","231921719","6","三周年恋曲","10000","1","","七七4命了 真好"
"JosephSukida","男","无IP","205613814","6","","10000","1","","我这版本神樱眷顾呢？"
"墨蓝Morland","男","无IP","45544343","6","","10000","1","","啥时候出个四季系统啊？想看雪景的璃月"
"GCss","男","无IP","4947574","6","","10000","1","8","所以ED的这些画面能不能快点出动态壁纸啊啊啊啊啊啊啊啊"
"言荒之辞","保密","无IP","49980469","6","","10000","1","","旅行者：姐我来找你约会了,北斗：那敢情好,旅行者：就是上你贼船不太方便，可以让我标个点儿吗？,北斗：麻棱儿地,旅行者：好嘞"
"冷掉的吐司","女","无IP","486169231","5","","10000","1","","歪了莫娜的我哭了[笑哭]"
"灵岛浮翠","男","无IP","13475712","6","","10000","1","7","阿贝多屁股痒的不行[doge]"
"蛊徒波卡是也","保密","无IP","387966300","6","","10000","1","6","阿贝多，你又在画优啊，休息一下好不好，让我画画好不好？"
"想见云小姐_","保密","无IP","359952184","5","泠鸢yousa登门喜鹊","10000","1","","不知道有没有人和我一样，自从预下载之后，进原神都非常卡，体验下降了太多，角色根本走不动，点地图要延迟很久，今天中午版本更新后还是这样，不知道是我自己的问题还是什么"
"找主人的流浪狗","女","无IP","285928248","5","","10000","1","","阿贝多老师我是你的狗，可以摸摸我吗[大哭][大哭][大哭][大哭]"
"喱喱","男","无IP","232571203","5","碧蓝之海","10000","1","","阿贝多：还好旁边有个火炬[滑稽]"
"半见月色莹莹青","保密","无IP","2165590","6","","10000","1","","垫了70后出了琴。正在我撕心裂肺之际下一抽就出了阿贝多。谢谢你，阿贝多老师"
"Ai尼莫斯","男","无IP","470280956","5","","10000","1","","我申鹤稳了[微笑]"
"丿倾城丶繁华","男","无IP","502437580","5","明日方舟","10000","1","","我说那个七七也不能得个八十一啊[doge]"
"Raiden_Murasame","保密","无IP","628637518","5","","10000","1","5","EP有4k画质了[热词系列_知识增加][崩坏3_快乐]"
"x式喵","男","无IP","33559418","6","","10000","1","","你要是为了微博某些云玩家去改申鹤 那我也宁可不玩了 不发声就不配被尊重呗？"
"乌鸦m","男","无IP","1150021367","5","","10000","1","","我优的ep呢[大哭]"
"苍江舞","保密","无IP","652269312","5","","10000","1","6","我尤拉的ep呢？原宝搞快点，我要看打喷嚏，我要看下腰，我要看她给爷送热牛奶[滑稽]"
"磨叽的即墨","男","无IP","23468803","6","","10000","1","","阿贝多歪了[大哭][大哭][大哭]"
"铃木美D呀","男","无IP","212321971","5","约战：精灵再临","10000","1","","没优EP？"
"君的怀中猫あ","保密","无IP","479090272","5","","10000","1","","我是阿贝多的狗！！！！,我是阿贝多的狗！！！！,我是阿贝多的狗！！！！,阿贝多！阿贝多！"
"出彩五星人","保密","无IP","23603045","6","","10000","1","16","北斗爽朗地笑着，然后离开了[大哭][大哭][大哭]"
"感悟心理学完颜慧德","女","无IP","152835156","5","","10000","1","","大保底79发[无语]希望一斗千万别歪了"
"雨过心灵","保密","无IP","394865098","5","","10000","1","","片中bgm好听诶[微笑]"
"中山恒恒","男","无IP","10566257","6","","10000","1","","我快听到温度警报声了"
"零二老公","男","无IP","389590515","5","","10000","1","","松籁一发出了，但是寿命没了"
"徐鹤宵","女","无IP","174357410","5","","10000","1","","我自己没有出优，给好友随手点了十连他出了，关键是他二十连（不是大保底，纯粹的就是二十连）出了优，那一刻火气冲天了"
"老1米6了","保密","无IP","399161367","5","","10000","1","","优可以用苍古吗[微笑]"
"风风在线烤鱿鱼","保密","无IP","183563172","5","","10000","1","","歪了莫娜，但是接下来一个十连出了，20级送的相遇之缘单抽常驻还出了刻晴[doge]"
"清弦亿梦","男","无IP","446407955","5","","10000","1","","可莉：阿贝多哥哥才不是坏人！"
"鸽布灵猎嘤","保密","无IP","107173066","5","","10000","1","","阿贝多你又在写生哦，休息下好不好……我在跟你讲话你有没有听到[原神_喝茶]"
"活着就为了散兵","保密","无IP","1874013104","5","","10000","1","","我现在……满脑子都是八重大人的洗脑，像什么给五郎梳尾巴，摸耳朵什么的……不行了，五郎快来啊"
"北Y柒星","男","无IP","445604942","5","","10000","1","","暴伤头小词条二十几的百分比防御，主防御副双暴的剩遗物已经准备好了，阿贝多你不要不识好歹[doge]"
"z仲达c","男","无IP","38533572","6","原神","10000","1","10","我优十连出了，是个冰系近战，会降低物理抗性，大招还能持续挂冰哈哈哈哈哈哈哈哈哈[原神_哼]"
"SUMIすみ","保密","无IP","16546228","6","","10000","1","6","5555好不容易充了钱结果歪了刻晴[大哭]不想玩了[大哭]看着游戏蚌埠住了QAQ每日任务也没心思了就下了，看到这个视频更难受了"
"柒北神","女","无IP","228123659","6","神SMea","10000","1","","贝老师――！你是我的老婆啊――[傲娇][脱单doge]"
"为世界上所有的美好","保密","无IP","2092357669","4","","10000","1","","阿贝多倒拔寒天钉"
"_叁三叁_","女","无IP","85979455","5","","10000","1","","好耶！出货了"
"LYR178","男","无IP","289642132","5","","10000","1","","手机玩家第一次见到这么美的雪山[大哭][跪了]"
"叁句话","保密","无IP","32011660","6","EveOneCat2","10000","1","","阿贝多老师你又在写生了休息一下好吗？"
"茶鸽子","保密","无IP","57063213","6","","10000","1","","BV1yp4y1q7gABV1BA411s7yVBV1wA411x7yN没经历古战场的去看看这几个评论区吧，看完后应该多少体会到了阿贝多厨的无奈了[原神_喝茶]"
"鬼化豆子酱","保密","无IP","1104108247","5","斩兽之刃","10000","1","","前来还愿，歪了七七，我的申鹤在向我招手"
"始源之律者爱莉希雅_","女","无IP","175019925","6","崩坏：星穹铁道","10000","1","15","弹幕有个发水时长的?我特么直接疑惑，不懂欣赏还是退出去吧[大笑]"
"头发蓬蓬的小透明","男","无IP","13432303","5","EveOneCat2","10000","1","","莫那一命，前来抱怨[原神_嗯]"
"中二の辉桑","男","无IP","330102165","6","原神","10000","1","10","[原神_躺平][原神_躺平][原神_躺平]"
"白给-king","男","无IP","343559759","5","","10000","1","2","之前垫了30发，开服上线单抽三发出阿贝多了[吃瓜][吃瓜][吃瓜][吃瓜][吃瓜][吃瓜][吃瓜]"
"今夜无歌","保密","无IP","424156501","5","","10000","1","","补二命阿贝多，就三十发，顺便你来不来，不来拉倒[傲娇]"
"橘猫林里没有橘子","女","无IP","353057213","5","","10000","1","","对不起宝贝 没钱抽你"
"雷金莱维","女","无IP","627106634","5","神乐七奈","10000","1","8","好耶"
"蜗蜗茶多酚","保密","无IP","2009132546","5","","10000","1","","优呢？优呢？我的优，没有你我怎么活啊！[大哭][大哭][大哭]"
"卤鸭少年气质佳","男","无IP","699388988","5","","10000","1","","未完成的画作和皎洁的笑颜也很好听啊"
"芊施醉影鲤花糕","保密","无IP","49836296","5","魔法学院","10000","1","","阿贝多老师，你又在写生哦，休息一下好不好[doge]"
"Runge444","男","无IP","285338090","6","明日方舟","10000","1","","19发出了阿贝多，哈哈哈哈哈哈哈哈[tv_doge][tv_doge][tv_doge]"
"Christina米希","女","无IP","26221179","6","","10000","1","","阿贝多抽出来了，不过可能是火骗骗花变得，不然为什么武器都拿错了大剑啊[给心心][给心心]"
"下雪の夜晚","男","无IP","32375398","6","须弥头像框","10000","1","14","阿贝多，我还是喜欢你妹妹[Cat2_DoorKeeper!]"
"拥护永雏塔菲柱成神","男","无IP","1526147245","5","原神","10000","1","","写生の阿贝多老师（,典中典了属于是"
"_北阿","女","无IP","491757968","5","","10000","1","","谢谢你阿又歪了[阴险]"
"上班族小明","保密","无IP","14397892","6","","10000","1","","我们想让旅行者抽阿贝多卡池,所以,音乐美术部门,诸位辛苦了[doge][doge][doge]"
"究极无敌可爱的虫虫","男","无IP","525676209","5","","10000","1","","原神加油，不要改"
"狂暴m苕","保密","无IP","507176029","5","","10000","1","","还没入坑的时候我哥把雪山的歌放在电视上听，我听的一脸懵逼觉得挺阴森的，我哥听到合唱的那个直接泪汪汪剩下我一个人懵逼。现在听雪山的歌我也被感动了，后悔没有早点入坑，但又庆幸自己晚入坑了，有一种很奇妙的感觉，感觉这种对比好有趣"
"本鱼吃锦鲤","男","无IP","110480360","6","暮光幻影","10000","1","","在？神樱树为什么不更新？[无语]"
"LUCA和芝士薯片我都要","女","无IP","132496493","6","","10000","1","","为什么的阿贝多很红很烫[原神_哼][原神_哼]"
"小光焰","女","无IP","325323162","6","还有醒着的么","10000","1","","你们知道阿贝多在画谁吗？没错就是我和他的孩子啊，我们俩个已经隐婚多年了，所以我想在这个属于他的活动中来宣告，我和阿贝多已经隐婚多年，连孩子都有了[给心心]"
"小暗本暗","男","无IP","309542394","5","","10000","1","5","阿贝多明明会斩尽牛杂，为什么不能用双手剑"
"风之度丶宏一","男","无IP","86056299","6","良辰美景・不问天","10000","1","","谢谢！！！我30连3金！！！谢谢阿贝多！"
"尼尔已子土","保密","无IP","18354373","6","EveOneCat2","10000","1","","在？阿贝多建模能不能优化一下，头发多一点眼睛小一点[酸了]"
"丘不丘丘","女","无IP","73451591","6","","10000","1","","给自己兄弟画遗照的屑贝多[doge]"
"比尔博_巴金斯","保密","无IP","438360818","5","良辰美景・不问天","10000","1","","新BOSS是会龙卷风摧毁停车场吗[原神_嗯]"
"卡其色琉璃","男","无IP","266210749","6","出游季","10000","1","","希娜小姐就离谱，差点笑疯[doge]"
