"昵称","性别","IP","UID","等级","装扮","用户权重","获赞数","粉丝团等级","评论"
"种花家的秃兔子","女","无IP","335376801","4","","10000","3","","直接听着璃月睡着了，视频循环播放下一首音乐我又醒了[嗑瓜子]"
"_佐酱QAQ","男","无IP","20651799","6","大王不高兴","10000","3","","建议改为《神女劈观（原版）》[吃瓜]"
"重生的","男","无IP","44999","6","","10000","3","","8.5万赞，6.1万硬币，3.1万收藏,[doge]果然没人收藏，都是直接三连的，所以硬币是2倍"
"听雨无声","保密","无IP","2735212","6","","10000","3","","希望疫情快结束，我想去听现场版的"
"爱莉希雅的老攻","男","无IP","8162882","6","","10000","3","","我把弹幕一关，这整个天下，就都是朕的了[妙啊]"
"呜咪呜咪大魔王","女","无IP","23954227","6","","10000","3","10","为什么这么好听的音乐会没有在热门上[委屈]听啊！都给我来听啊！想让全世界都来听听我的神――hoyomix，所创作的音乐[大哭][大哭]"
"影子中的眼泪","保密","无IP","146092508","6","橘猫挂件","10000","3","","这里面的每一首歌我都不会错过一秒[点赞]"
"Bigpancake","保密","无IP","145037294","6","","10000","3","","爽爆了，多谢米忽悠，更感谢各位老师的演奏"
"kilin13","男","无IP","453649156","5","","10000","3","","这里的神女劈观和PV里的不一样（有细微差别）"
"mc_留时","保密","无IP","1957318665","6","","10000","3","","璃月的第二段让我落泪我仿佛看见一个人能把我从绝望中拉回来在璃月的环境中步入正轨"
"是黎棠啊","男","无IP","316399730","5","","10000","3","","太棒了！大爱音乐会，同时也提个建议，把音乐类的往期传送门贴在简介或者开一个话题来方便回顾[星星眼]"
"你猜我闹不闹","保密","无IP","145881314","6","","10000","3","","杨扬老师的眼睛就好像在讲故事一样[脸红]太厉害了[给心心][给心心][给心心]"
"混元形意掌门人","女","无IP","630908394","5","","10000","3","","今年的节目都很满意，还有冬奥会除了男足[藏狐]不是球迷，但感觉很迷惑。"
"慕寒钦","保密","无IP","300145647","5","","10000","3","","[崩坏3_七][崩坏3_十][崩坏3_米][崩坏3_长][崩坏3_刀]好耶！"
"福尔摩丸","保密","无IP","320263791","6","请吃红小豆","10000","3","","[崩坏3_特效][崩坏3_唢呐][崩坏3_琵琶][崩坏3_二胡][崩坏3_笛子][崩坏3_镲]太棒啦"
"默默XO","男","无IP","13525494","5","","10000","3","","2.5版本汇总,2.5版本名称为薄樱初绽时,更新时间2022年2月16日6点,新角色八重神子,特有天赋  合成角色天赋素材时有概率增加,雷电将军进周本,Up  上半    八重神子,        下半  雷电将军和珊瑚宫心海,新武器   神乐之真意和正誓之明瞳（三界路飨祭获取）,雷电将军新任务,天下人之章第二幕,八重神子传说任务,仙狐之章第一慕（环城天下人之章第二幕解锁）,全新怪物  暗色空壳分为敬畏骑手和破阵,新版本活动  ,三界路飨祭,神工天巧,曲生酌微梦,百人一揆活动复制,天赋秘境双倍,2.6层岩巨渊开放,传说中岩王帝君与肥坨此一战,因疫情防控原因一周年音乐会延期二周年举办,兑换码,4AQNK5RWKXTJ,9S9NJMQFFS6,PT8PJMQWJEDS,兑换码有效期至2022年2月5日12点,祝大家新年快乐"
"毅鳞","男","无IP","521787351","4","","10000","3","","漂浮灵就是填“非常简单″的后果[藏狐]"
"执攸_","男","无IP","78038743","6","","10000","3","","真好啊，我是这个游戏的玩家,无论是二创还是每次的更新，都能让我感到惊喜。"
"焰星无一物","男","无IP","1363737147","5","","10000","3","","杯中明月，我听到都快哭了[大哭]那是因为没原神之前听过陈致逸和银临的一杯月，那个歌说实话太好听了[大哭]杯中明月中间是一杯月的伴奏"
"黑猫攻厨","保密","无IP","495732531","5","","10000","3","","新春多放璃月的音乐，有种回到家了的感动"
"-るい","保密","无IP","1300628","6","魔法学院","10000","3","","快进到二周年音乐会补上一周年的份直接四个小时起步！！！"
"水仙十字_雅各布","女","无IP","1397451482","4","","10000","3","","这个直播时我看不了，旁边冬奥会声音太大了"
"夜袭老六村","保密","无IP","100656043","6","","10000","3","","直奔3 5 6的有多少个人[doge]"
"Minecraft中的新世界","男","无IP","284834884","6","","10000","3","","两个惊艳，一个神女劈观一个若坨龙王,一个泪目   璃月"
"刀刀兔子爱时之歌","女","无IP","35971124","6","","10000","3","","最喜欢杯中明月和good night 璃月"
"Metatron星尘","保密","无IP","355354582","6","","10000","3","","今天又是奥运开幕式又是音乐会，像是又过了个除夕夜"
"我永远喜欢娜维娅小姐","保密","无IP","503503880","5","","10000","3","","原宝，你这次好短，又在拿音乐会加时长哦[脱单doge]"
"嫌起名麻烦的溪","保密","无IP","523431501","5","","10000","3","","直接把杨老师请过来我是没想到的，原宝厉害啊"
"-重云他小姨父-","男","无IP","383873680","5","崩坏：星穹铁道","10000","3","","太好听了！！！！！！！！！！二周年音乐会我去定了！！！"
"770-0","保密","无IP","503303667","5","","10000","3","","杨杨老师我大爱，优雅又duang庄"
"一般路过车车众","保密","无IP","87365597","6","","10000","3","","可是可是人家现在在看冬奥开幕的说你这样让我怎么办好啊原宝"
"八岐大蛇d","男","无IP","233216497","6","阴阳师海国之境","10000","3","","我乃若陀龙王，原素结晶创生之物！,大地的震怒！安能平息！"
"嗷卵将爷爷","保密","无IP","277953357","6","战双帕弥什","10000","3","","坨子哥的音乐真的百听不厌"
"斐同寻常Qshy","保密","无IP","2836863","6","原神","10000","3","11","我爱原神！！！！！,听到神女劈观和若陀处刑曲直接泪目！"
"改个名为了中奖","男","无IP","650256053","5","","10000","3","","我直接一个三连，兄弟们我做对了吗！！"
"喱喱","男","无IP","232571203","5","碧蓝之海","10000","3","","好家伙本来一边玩游戏一边听，刚好打完坨子哥。音乐又起来了，纳闷我不是刚打完吗[笑哭]"
"_LLL86","保密","无IP","244105072","5","约战・狂三","10000","3","","我还以为前瞻真这么快就结束，结果有个线上小音乐会，于是边看开幕式变看音乐会[脱单doge]"
"白时x","保密","无IP","660104791","5","","10000","3","","若坨的战斗曲太好听了哦哦哦哦哦哦"
"秋旋P-418_某君桑","男","无IP","523009553","5","","10000","5","","放疾如猛火那段时，我跟我朋友在璃月刷怪，然后发现游戏里和直播里的音乐就正好重了。然后我就听入神了，播完后突然发现我被打死了，我朋友就在旁边一脸懵逼的看着我被打死。[笑哭]"
"遇深","男","无IP","411195940","5","","10000","5","","趁人少，我是米哈游的狗[脱单doge]"
"sadako--","男","无IP","30054411","5","","10000","6","","直播出层岩那时刻就有猴说啥心海被和谐，我是原神动态乱串都没听到这鬼消息，用这来干扰其他人心情，之后的心海没被和谐是我发的，猴猴是真不让人省心"
"XiQ-星绮","男","无IP","1746661002","5","呜米","10000","6","","如果只是为了玩游戏而玩游戏，而不去体会欣赏其中蕴含的美或其他啥，玩啥都不太有意思了，大家说对不[doge]"
"轻纱糖衣_","保密","无IP","135165647","6","总之就是非常可爱","10000","4","","岩壑之崩里40秒和2分40秒出现的乐器是不一样的，分别是二胡和韶琴。,二胡顶部是直的而韶琴是弯曲的，音调上韶琴声音是从上部发出的，所以声音比二胡大一点，并且音色更适合现代流行乐和交响乐，而二胡的声音则更加的低沉有力，有很强的共鸣感。,个人觉得应该是开头那里主要是一段管弦乐为主，二胡在一堆弦乐器里可以抢一下c位。,但是“愆辜安除？”这句之后还有金属乐和鼓打乐器在演奏，二胡很难抢头牌，上稍大的韶琴还能搞一搞。,当然换乐器也是我的个人猜测了，前后乐器的确不一样，也没听说过二胡可以光翼展开变形的。"
"月下临仙","男","浙江","3493087919737367","4","崩坏：星穹铁道","10000","3","","没抢到票的我只能再来看一遍了[脱单doge]"
"pluvio_phile","保密","广东","109777665","6","","10000","3","9","唉，陈老师。"
"庄周梦了个爹","保密","重庆","108564830","4","","10000","3","","等了3年，10月原神音乐会终于又启动了。"
"鸡米不是Jimmy","保密","广东","353734667","5","","10000","3","","谢谢你原神，让我爱上了交响乐"
"回见回聊","保密","甘肃","259882440","5","","10000","3","","这个陈志逸是何许人也，有没有科普的"
"抱着香蕉鱼睡觉的每天","保密","广东","13468974","6","","10000","3","","果然还是最喜欢这个音乐会啦"
"西尔达达达","女","上海","901273","5","","10000","3","","元神2023有线下的音乐会吗？？有的话一定去支持！"
"富97","男","湖南","1838433182","3","","10000","3","","@闻风吹两岸 这个也强烈建议看下，特别是1、3、6、7首。原神音乐会的质量可都是很高的"
"森森不吃余","保密","甘肃","1757678378","4","","10000","3","","@春树夏了了 @诶-----------嘿"
"PonyJun小马君","保密","广东","286511435","6","三周年恋曲","10000","3","","新年快乐"
"命定之缘","保密","江苏","43493824","6","","10000","3","8","@自由魂儿儿儿  wife，this way。P6有若坨龙王歌词"
"东风突入大气层","男","福建","251139","6","","10000","3","","旅行者们，海灯节快乐！"
"宫崎骏和新海诚我都爱","保密","甘肃","1909977139","3","","10000","3","","众所周知原神跟网易游戏只是他们的副业[doge]"
"Owalion","保密","新疆","25328974","5","","10000","3","5","笑死 这词一句接一句跳 字我一个接一个查[辣眼睛]"
"Crynci","女","新疆","8082605","6","","10000","3","","[爱心][爱心][爱心][爱心][热词系列_吹爆]"
"不枯竭的水瓶","保密","美国","7390193","6","","10000","3","","氪对了"
"-Omnitrix-","保密","广东","38020205","5","","10000","3","","[tv_大哭]每次听神女劈观都有想流泪的冲动"
"方塔","男","无IP","20407237","6","轻视频羊咩咩","10000","3","","本来想投币的，发现上次就投过了[鼓掌]"
"非酋的神里绫华","保密","无IP","222292759","5","","10000","3","","能够在游戏中听完全曲的你一定很刮吧[脱单doge]"
"琉璃美人刹","保密","无IP","284171866","2","","10000","3","","杨老师好有气质好美丽，好喜欢神女劈观"
"cfzzz_zz","男","无IP","455003831","5","2021拜年纪活动专属","10000","3","","剪了个音乐串烧【这就是我玩原神的原因!!!(令人心中一颤的bgm串烧-哔哩哔哩】 https://b23.tv/9vkeYSj"
"一个痴迷游戏的人-","保密","无IP","1053420275","5","","10000","3","","[原神_G嘿][原神_G嘿]"
"qwq","男","无IP","323978916","6","#EveOneCat","10000","3","","首席小提琴手的温迪胸针在哪可以买到啊[原神_G嘿]"
"一只小星星x","保密","无IP","1066523412","5","","10000","3","","别说了我想加入乐团有没有和我一样的想法"
"156682144","保密","无IP","156682144","5","","10000","3","","是铠甲勇士BGM的那个陈致逸嘛"
"半杯乌龙半杯茶","保密","无IP","6763848","6","","10000","3","","夜半听海港，明月入梦来。"
"起床开挖掘机了","保密","无IP","23835073","6","C酱です","10000","3","11","https://b23.tv/BV1kq4y1x7zV 套娃开始[doge]"
"应急食品缘结荧","保密","无IP","248982143","5","","10000","3","11","不枉我氪了这六块钱[原神_哼哼]"
"凉风雁","男","无IP","392599669","6","","10000","3","2","各位激动的大佬们，想讨回公道去别的地方，这里和强度无关"
"国产良心","保密","无IP","812537","6","星座系列：狮子座","10000","3","","tm的头一次觉得游戏里的年味比其他地方的浓"
"草日大","女","无IP","17438344","6","","10000","3","","要是开巡演，或者开放版权给各地乐团演就好了，好想参与啊。觉得售票会很好，而且氛围很棒，原来演过暴雪的音乐会，来的魔兽玩家部落联盟分阵营坐的，可热闹了。好想把这些优秀的作品分享给更多的人群欣赏，而不局限于我们二次元玩家。"
"吃西瓜送傻瓜","保密","无IP","288000468","5","","10000","3","","《神女劈观》，不但本人劈，还现场劈,还是你能卷啊，米哈游,现在压力来到二创大佬身上了[doge]"
"茶蓝Berry","女","无IP","600322636","5","","10000","3","","你敢相信我找不到好听的歌后听这个一边写作业吗[辣眼睛]"
"-某科学的赤坂龙之介-","保密","无IP","95720922","6","","10000","3","","听完天霁日出之后迫不及待去绝云间想感受一下，结果时间是晚上，周围全是石鲸叫[辣眼睛][辣眼睛][辣眼睛][辣眼睛]}人"
"三玖_塞高","女","无IP","44757282","5","","10000","3","","所以什么时候发原石[doge][doge]"
"是真的憨憨呀","男","无IP","312955369","5","天谕","10000","3","","这是东方艺术中心 顶我上去！[冰墩墩]"
"stfj","保密","无IP","452684279","5","","10000","3","","不是推广我还真没看到这个，我玩原神为什么之前大数据没推到？[酸了]"
"识践","保密","无IP","700404746","5","","10000","3","","笑死我了，官方内卷终结版[doge]"
"玄吟","保密","无IP","34743830","5","崩坏：星穹铁道","10000","3","","「神女劈观」官方内卷终结版[辣眼睛]"
"漠心初Iris","女","无IP","408019876","6","呜米","10000","3","","「神女劈观」官方内卷终结版,奇怪的推广词增加了[热词系列_知识增加],我好不容易从这里出去，又被吸引进来了[呜米_KiraKira]"
"素和每天转发但不中QAQ","女","无IP","12525453","6","不思议之旅","10000","3","12","官方内卷终结版可还行[羞羞]"
"全场最佳跑龙套","男","无IP","244362620","5","崩坏3・天穹流星","10000","3","","「神女劈观」官方内卷终结版[虎年][虎年]"
"账号已注销","保密","无IP","424447520","0","","5000","3","","看完的集合"
"人形辅助压制队友","男","无IP","2920214","6","","10000","3","","好家伙官方这是要卷死所有同人二层是吧？[doge][辣眼睛][滑稽][原神_G嘿][热词系列_知识增加][公主连结_害怕][公主连结_冷漠][公主连结_厉害了][公主连结_不错][公主连结_emmm][公主连结_惊吓]"
"fffairr","保密","无IP","1395277604","5","","10000","3","","官方内卷终极版，啪就点进去了，很快啊"
"墨梧木","保密","无IP","16384060","6","","10000","3","","“曲高未必人不识”这里，“不--识”间的停顿比PV里的长了一点[脸红]"
"再不尝人间苦","保密","无IP","493939626","2","","10000","3","","这可能就是我会一直玩下去的原因吧"
"杨伟大皇帝","保密","无IP","619270539","5","原神","10000","3","","@记者采访_ @猴王和它的小跟班 这两犬黑原神"
"恰一颗柠萌","女","无IP","11208710","6","","10000","3","9","内卷终极版"
"-_优优_-","保密","无IP","364831736","6","星座系列：天蝎座","10000","3","","弹幕看到一条说：“这锣绝了”，我一下子懵了，这一对不是大镲吗[笑哭]"
"樱桃园主","保密","无IP","400009934","6","","10000","3","11","这个推广有点中二啊，官方内卷终结版[大笑][大笑]"
"鸽子与熊","保密","无IP","417291077","5","","10000","3","","官方内卷终止版是什么鬼[大笑][大笑]"
"知念崎也","保密","无IP","1325521001","3","","10000","3","","这都什么推广词：“官方内卷终极版”[笑哭][笑哭]"
"流苏静聆","保密","无IP","235749213","6","","10000","3","","璃月最后的一段听得让我哽咽，或许过年一直在外，心声共鸣。"
"账号已注销","保密","无IP","499045804","0","","5000","3","","8单648强取绫人和八重，支持mhy[打call][打call]"
"喵君茶太郎","男","无IP","38704187","6","hanser","10000","3","","黑西装！红酒杯！臣服于我！[崩坏3_乱杀]"
"歆籁","保密","无IP","300600896","6","崩坏：星穹铁道","10000","3","10","偷偷换封面是吧"
"蜜枣米粥","男","无IP","355408216","5","","10000","3","","不愧是我投资的音乐会[大笑][大笑]"
"LQ朔夜","保密","无IP","26470526","6","原神","10000","3","","《关于二创卷到原创直接开live这档事》[doge]"
"若星Sama","男","无IP","184075298","6","原神","10000","3","9","原宝，你这不行啊，这么久才100w[傲娇]"
"臣不敢揣测圣意","女","无IP","455756495","5","","10000","3","","这真的是我一个无氪党配免费看的嘛？！！"
"携铃童尧","保密","无IP","442078252","5","","10000","3","","你小子还把封面换了"
"弈轩若华","保密","无IP","287199184","5","","10000","3","","这波啊，这波是属于璃月自己的高光时刻，群星璀璨，熠熠生辉，厚积薄发，娓娓动听，闻曲如此，三生有幸[热词系列_秀]"
"bili_28492933549","保密","无IP","646585122","3","","10000","3","","现在还有300多人看就离谱[热词系列_知识增加]"
"八重单推人","女","无IP","2113555552","4","","10000","3","","【评分7分！不满意！但是还想玩！一个单机游戏玩家的原神深度测评-哔哩哔哩】 https://b23.tv/Z2XLEUe,原宝看下这个[热词系列_知识增加]"
"Q晨曦","男","无IP","383074496","5","","10000","3","","【置顶】陌生人别忘了签到[doge]https://b23.tv/j0rQzU "
"bili_399296890","保密","无IP","399296890","4","","10000","3","","怪不得我打龙王用这么久，原来是因为听这背景音乐，真好听[支持]"
"小小雅apple","女","无IP","381735951","5","","10000","3","","音乐会什么的怎么样都不会嫌多。就像凝光的摩拉"
"却除巫山云归处","保密","无IP","256649240","5","","10000","3","","感谢米哈游，能做出这样的新年音乐会。有这样的社会责任担当的你值得拥有更多原神玩家，值得在新的一年获得更高的成就！你不仅仅是一家游戏公司，你将音乐、文化、风俗完美糅合，向新一代的国人传递，让文化得以传承；向国外玩家及订阅者输出，让更多的国际友人了解中国，认识中国。你将这座文明古国数千年来的底蕴融会贯通，以一种新的形式展现。新的一年，祝愿米哈游百尺竿头更进一步，祝愿原神芝麻开花节节高！"
"树下煎茶","保密","无IP","14092576","6","","10000","3","","原神活动的弹幕总能让我想起当年第一次进入B站的心情，二次元的味道和肯定的味道！"
"何镜尘","保密","无IP","163096095","6","良辰美景・不问天","10000","3","","咱就是说[藏狐]这里是官方视频，歌词就明明白白的在屏幕下方，能不能别刷你那空耳歌词了，管你有多喜欢它在有官方版歌词的地方还搁这刷，这就好比你拿着盗版玩意（没有说空耳版歌词不好的意思）在人正版面前说诶我觉得盗版也不错哦，你不觉得多少沾点哈批气味吗，这么做真的很不尊重原版创作者还给空耳歌词创作者败路人感，要刷看看场合好吗[辣眼睛]"
"荆轲杰","保密","无IP","1993901293","3","","10000","3","","当你为原神充值的钱，都投入到这样的音乐创作，是很值得！当你不玩游戏，躺床上，扣手机，听听原神的音乐也很惬意！"
"亓白术","保密","无IP","234846573","6","","10000","3","9","给原神充的钱会让游戏变得更好，目前原神应该是我最不会后悔充钱的游戏了[干杯][doge]"
"鹰司政平","男","无IP","215631","6","","10000","3","","其实这里面最让我喜欢的是，包含了交响乐，传统乐，还有摇滚乐各种元素在里面。大家同聚一堂，为观众献上作品。,俱收并蓄，海纳百川，才能创造出好作品。,以前各种乐器圈子的彼此攀比拉踩源远流长，真是让人觉得无奈。"
"魂城","女","无IP","1553414942","5","~るる","10000","3","","是什么让我们如此爱着这一款游戏[原神_哇]"
"wreey","保密","无IP","2604456","6","","10000","3","","我唯一的疑问是，我这垃圾声卡、耳机听这个是不是有点过分了，要不还是不投币了，留着买设备。xdm，我的想法对吗？[妙啊]"
"来自多彩世界的kris","保密","无IP","456169286","6","中野四叶","10000","3","","现在压力来到了二创这边[OK]"
"Knaxord","男","无IP","13002499","6","","10000","3","","[热词系列_新年快乐]如果有走亲访友的朋友，希望这个视频能帮到你[妙啊],BV14q4y1F7q8（视频质量有信心，买了150块钱的推广却没人看，真的很痛苦[tv_流泪]"
"果黎子","保密","无IP","399011980","5","","10000","3","","有大气磅礴有淡淡温馨有稍许感动有平安安宁，璃月一直都是如此[原神_哇][大哭]"
"dEndermane","保密","无IP","630173857","5","","10000","3","","我感觉电吉他手长得像陈老师，不知道是不是本人"
"魅晨鬼","保密","无IP","99264911","6","崩坏：星穹铁道","10000","3","13","音乐顺序：上号，人在璃月港，做璃月每日，打架，边打边打开B站每日一刷神女劈观，去庆云顶给歪到的七七捞琉璃袋，体力拿去打若陀，传回璃月港，下线[藏狐]"
"无声_向北","保密","无IP","473917503","5","","10000","3","","陈老师发现自己的作品被如此的重视和善待，并得到这么多人喜欢，一定会更有创作热情吧。"
"徐麟均丶","保密","无IP","1766033","5","明日方舟音律系列","10000","3","","我就问问，原声大碟啥时候出，现在就想要[小电视_赞][小电视_赞][小电视_赞]"
"樱海听海","女","无IP","114342882","6","2233幻星集","10000","3","11","不知道给原宝多少小钱钱了，但是总能让我有种我充的钱值了的味道。原宝，请继续加油呀！"
"两色风景喵","女","无IP","88826710","5","","10000","3","","珠落玉盘，`弦入新梦。, 水流清泠，箫鼓度春风。"
"www诶嘿www","保密","无IP","34455906","6","","10000","3","9","感觉有些曲子的某些乐器的音量给小了，比如若陀曲子的二胡。这次最喜欢绝云间的曲子[爱心]"
"账号已注销","保密","无IP","1048663085","0","","5000","3","","当璃月庆祝海灯节时，天衡山上还有一个孩子在等爸妈回来，唉，米哈游处处都是刀，还记得小姜吗？不要忘记去看看他。"
"唯影避暮","男","无IP","110484809","6","","10000","3","","这种质量的音乐真的是我能免费听的吗"
"何大鹰啊","男","无IP","31184398","6","","10000","3","","这就是中华文化的传承、融合、创新[支持]"
"sign3012","女","无IP","6624971","6","","10000","3","","什么时候才有望舒客栈啊。。最喜欢的曲子了[大哭]"
"开初号机创所有人","保密","无IP","243690101","5","","10000","3","","因为本人不会乐器，所以本人没有参加演奏，在此抱歉"
"凌空漂浮","保密","无IP","46531701","5","","10000","3","","麻烦那位在庆云顶那一段说轻策庄好爱的兄弟站出来。[doge]"
"墨言笙歌书海沧","保密","无IP","2378225","6","","10000","3","","归兮！,f石峦岳毂～转乎！,万川湍流吞穹～庐！,山-崩-岩-！,愆辜安～除！,这一段太燃了吧[支持]"
"罗罗_roro","保密","无IP","202203721","6","","10000","3","","我有罪，没穿西装端"
"驯嘤人","男","无IP","10863197","6","赫奇帕奇","10000","3","","在生日的这天晚上能听到这些还是不错的…虽然我不过生日[妙啊]"
"逝去的K⑹湃","男","无IP","152023489","6","","10000","3","","音乐氛围一级棒，绝云间的看日出云海，若陀的吉他二胡，海灯节的万家霄灯"
"听说改完名就能中奖","保密","无IP","360222848","5","","10000","3","","官方看到二创都这么卷，觉得来一波天神下凡[doge]"
"骨桔子","男","无IP","18366","6","","10000","3","","这音乐一定是雷属性的。,听得人都麻了！,从头到尾都是鸡皮疙瘩状态。"
"巡山老腊肉","保密","无IP","17053432","5","","10000","3","","今年的文体活动有点丰富，简直好戏连台[滑稽]"
"橱窗-壁炉与雪","保密","无IP","84206823","6","","10000","3","","玩家二创那个歌词好是好，但是氛围不对啊，和剧情那一段完全不契合，你在刮磨损的坨子哥呢，bgm宣扬坨子哥的功绩，它不对味啊，那个二创歌词适合后续坨子哥再次为帝君征战，临死之时放。现有这段剧情还是官方的版本更契合，这弹幕踩官方的，真是人都给我看傻了"
"大梦丶丶谁先觉","男","无IP","481500096","6","","10000","3","5","你这演唱会 值2000块吗[吃瓜]"
"子雾在此","男","无IP","161301048","5","","10000","3","","服了，音乐会上要不是报菜名，就是说刮的。"
"追赶时间的人","保密","无IP","17991079","6","","10000","3","","直到视频看到杨扬老师的现场表演才知道现场才是真正的高潮，眼神动作戏曲音乐的结合，才发现这才是完整完全的神女劈观之一。"
"追风狗头","男","无IP","65617118","6","原神","10000","3","","加油，冲击1000万"
"净土勿扰","保密","无IP","66675435","5","","10000","3","","不管了，就算今天若陀周本已经打完了，我还要再打十遍！"
