"昵称","性别","IP","UID","等级","装扮","用户权重","获赞数","粉丝团等级","评论"
"叶梨狸","保密","辽宁","34182083","6","","10000","0","","为什么我的提纳里拿双手剑[保卫萝卜_哭哭][保卫萝卜_哭哭][保卫萝卜_哭哭]"
"阿棺棺棺棺sama","保密","湖南","28825515","5","明日方舟","10000","0","","小提你怎么秋衣只穿半边[热]"
"骜桀","女","河南","441268117","5","","10000","0","","6BE3W5HEEJXA"
"秋落木wa","男","安徽","441384697","5","","10000","0","","脑过载"
"何生久","保密","重庆","141122640","5","","10000","0","","花了7个小时才从主线剧情里出来"
"一千颗卫星","女","天津","35433413","5","","10000","0","5","面不改色的怼人爱了爱了"
"|居居","保密","广东","6848484","6","","10000","0","","更新之后老是掉帧，搞什么"
"青花晓引","男","浙江","38481248","6","","10000","0","","你家是不是移动端优化没做好，为啥我电脑没啥事平板五步一掉帧，游戏体验好差"
"聿暮","保密","江西","435312926","5","魔法学院","10000","0","5","森之章太长了，比神樱大祓还长[原神_嗯]"
"b站吞昵称了","保密","云南","521222831","4","","10000","0","","什么时候把bgm出一遍呢？"
"尤雪瑶","保密","上海","1204482573","5","","10000","0","","[妙啊]"
"SV-98酱","男","澳大利亚","952704","6","","10000","0","","这次的剧情真不错，编剧满命咯"
"流出的普鲁修卡","男","广东","152105662","5","原神","10000","0","","有没有懂哥解释一下剧情，有点懵（没看过轮回向的动漫）,又不是做梦又不是现实，但又一直在重置是什么意思[原神_躺平]"
"该转了","男","广东","290732358","6","领风者","10000","0","","我在快手上看到赛诺的技能了,我以为米哈游已经出了，没想到没出。"
"胖辉啊我是Harris","男","山东","88092006","5","","10000","0","","剧情真不错，继续保持[脱单doge]"
"优势局虞夫人","保密","江西","1062648296","2","","10000","0","","吐了，那在屋他马任务一天又一天。"
"某高等动物雄性个体","男","山西","1212666331","5","","10000","0","","《青春猪头旅行者不会梦到白毛萝莉小草王》"
"秋叶_躺平版","女","广东","520718211","5","","10000","0","","我的提纳里可以找到璃月特产[保卫萝卜_哭哭][保卫萝卜_哭哭]"
"一簇简单的浪花","女","海南","478062770","5","","10000","0","","刻师傅终于猛了"
"无糖升压药","保密","北京","442194291","5","","10000","0","","为什么我的长毛牛牛从某一刻开始会主动打我了[大哭]我最爱的长毛牛牛，我拍了好多照片，看见第一只的时候，我就顿悟了，什么提纳里，什么妮露，什么艾尔海森，什么多莉，我要和毛牛牛过日子。可是，他们突然开始打我了，明明最开始是中立的和平生物[大哭]为什么呀，我的此生挚爱和我反目了。"
"鑫i","保密","广东","316447428","5","","10000","0","","新版本用满命小艾米还是专武神子，有没有大佬指点一下，我两个都没练等草元素上线看看再做打算的"
"白菜Pro-Max","男","广东","477051721","5","","10000","0","","麻了，刚不小心把原神删了"
"日富一日必有金进","保密","湖南","490622291","5","","10000","0","","须弥这剧情搞得我脑过载了"
"TheSupremeR","保密","广东","399269047","5","","10000","0","","旅行者进入须弥的第一天：猪脑过载[tv_鬼脸]"
"白嫖视频的兄N","保密","四川","1292837261","4","","10000","0","","这旁白 是戴因[doge]"
"朝朝朝朝朝雪","保密","贵州","701677137","5","","10000","0","","同样是主线，为什么稻妻就"
"浔夜归鸿","保密","山东","2003663041","2","","10000","0","","谢谢你，歪了迪卢克[微笑]"
"薛定谔的饼","保密","陕西","33945161","6","","10000","0","","我要和迪希雅结婚！"
"亦晗代肝","保密","辽宁","455035117","5","一周年纪念装扮","10000","0","","剧情很好，谢谢你tnnd[辣眼睛]"
"EC_FY233","男","天津","1404530262","5","","10000","0","","@原神 BV1tt4y1n7aw这个是什么鬼？"
"无_内-鬼","保密","广东","34542344","6","","10000","0","8","这次的地图，做的有点好啊"
"夜鸢舞琴","保密","天津","217878365","6","","10000","0","","那个钓鱼商店的人怎么卡石头里了[笑哭]"
"EC_FY233","男","天津","1404530262","5","","10000","0","","BV1tt4y1n7aw"
"乌娃娃zs","男","湖南","2102383551","4","","10000","0","","军训刚回，错过好多[热][热][热]"
"清砚-","女","河南","24923439","6","2021拜年纪活动专属","10000","0","","须弥配音再打磨一下吧，真的有点同质化了[跪了]"
"呜哩雾里无哩","保密","湖北","1597487850","3","","10000","0","","凯瑟琳原来是至冬国的仿生人偶啊[哦呼]"
"W-W---W","保密","云南","415312289","5","","10000","0","","求求你了，好好做妮露，好好做建模，好好做动画"
"反转宇宙-","男","湖南","24026542","5","","10000","0","","这次剧情不错"
"深海薄荷鲨","保密","北京","454959571","5","公主连结凯露","10000","0","","我先去洗澡"
"我给梦淘缘","保密","安徽","312574927","5","","10000","0","","有毛病吗？次次大保底"
"记音","男","上海","173984431","6","","10000","0","","原宝你3.0荧的声线翻车了[原神_生气]https://b23.tv/BV1ea411979k"
"江淮路小猪佩奇","男","江苏","343369302","5","","10000","0","","画质拉满居然掉帧了？啥优化啊？"
"无需多盐-","保密","河南","19175845","5","","10000","0","","https://b23.tv/Tq7UMgQ"
"一只桃子君君","女","云南","371750908","5","","10000","0","","不好意思哈原宝，虽然我才玩一年，不得不退出，越来越大，手机扛不住，云游戏也进不去，[捂脸]"
"Starmy_","保密","吉林","178104565","5","三周年恋曲","10000","0","7","设备荣耀x30，你绝对改我布局了吧！！按键变小了，好难受[热]"
"莱茵-BWT","保密","安徽","490801059","5","雪未来","10000","0","","在须弥QQ人的营地里不是有牛牛吗，那些牛牛如果可以骑就好了，希望米哈游设置一下，然后看见的小伙伴顶我上去，这么可爱的牛牛为什么一定要变成肉呢？"
"路兮耶","保密","湖南","631244745","5","","10000","0","","须弥城也太大了吧"
"020202霖","男","海南","49892780","5","","10000","0","","剧情绝了"
"原野宇落尘","保密","山东","695948592","5","","10000","0","","只有我觉得他们的声线不太正常吗？"
"始是相逢疑梦中","保密","湖北","64926304","5","","10000","0","","剧情好，但是为什么有好多bug，还有穿模"
"左然是我KINO的","女","江西","481295347","6","","10000","0","","我肝了一个晚上终于肝完了提纳里的传说任务，感情都培养到这了，为什么我的小提是僵尸啊[未定事件簿_可怜][未定事件簿_可怜][未定事件簿_可怜][未定事件簿_可怜]"
"风皋第","男","江苏","92835652","6","崩坏：星穹铁道","10000","0","","麻烦草神像bug尽快处理一下，极其影响体验"
"芜湖起飞了雅虎","保密","云南","1724772889","4","","10000","0","","pc端须弥城里掉帧，我琢磨出一个办法：把hdim或DP线插主板上走核显通道，别问我怎么知道的"
"u落","男","安徽","2034921691","4","","10000","0","","新剧情你刀我是吧，呕呃，剧情刀人了，刀人了"
"波子汽水づ","保密","山东","151078727","5","hanser","10000","0","12","主线真有意思"
"FivePower","保密","湖南","6538417","6","","10000","0","","我的草弓呢？[热][热]"
"墨无研","保密","贵州","358616581","6","","10000","0","","主线剧情很好，3.1别垃了"
"琛","保密","山东","394020388","5","","10000","0","","抽到钟离啦，来还愿啦"
"金渐层大喵","男","辽宁","268532576","6","","10000","0","","为什么不能养大脑斧[大哭]"
"木亚0529","保密","广东","1672359828","3","","10000","0","","[保卫萝卜_哇][保卫萝卜_哇][热词系列_好耶]"
"吃包子吃不饱","男","广西","248563894","5","","10000","0","","这剧情，我猪脑过载了"
"李敏好人","男","山东","10262880","6","","10000","0","","护林员对吧"
"活着不挺好","保密","陕西","151454422","6","hanser","10000","0","","我宣布派蒙就是女主"
"不想再花6个币","保密","陕西","398904334","5","公主连结可可萝","10000","0","","米哈游我求求你了，连着三次小保底全歪，而且几乎次次小保底以后六十发才大保底！！！真的，孩子心态炸了，能不能不要逮着我一个人歪啊！！！！！！！！！！！！心态真的炸了，从开始玩到现在就氪了两张小月卡，别人为一个角色攒的原石，我要比他们两倍还多，我全勤玩家眼睁睁看着那些玩一会儿不玩一会儿的同学们二十发一个钟离，单抽一个钟离，小保底不歪出钟离，你知道我的心有多凉么？？？？求求你，不要逮着全勤玩家薅了！！！！！！！！！！真的，这次钟离池子给孩子心态搞炸了，求求你了米哈游！！！！！！uid  162722174[辣眼睛][辣眼睛][辣眼睛][辣眼睛][辣眼睛][辣眼睛][辣眼睛]"
"日系少女八嘎酱lm","保密","河南","523253877","5","崩坏：星穹铁道","10000","0","","我要小草神哼哼哼哼哼哼啊啊啊啊啊啊啊啊"
"凡爱吃饭","保密","山东","593540728","4","","10000","0","","我钟离歪莫娜我可以接受，但是！！！,你给我出三只科莱是什么意思？"
"应司南","保密","广东","475079446","5","","10000","0","10","哭死我了哭死我了卡卡塔呜呜呜呜呜我的卡卡塔[保卫萝卜_哭哭]"
"所以自在","男","黑龙江","20629570","6","","10000","0","","我要开喷了，拉娜这条剧情是真的莫名其妙"
"_鸿渐","女","河南","25733693","6","","10000","0","","循环这梗真够老的了"
"张某尚未寝","女","浙江","646517512","4","","10000","0","","诶嘿，第一把十连抽就抽中了帝君。真不白费我上网查地点。"
"深处有默默","保密","四川","32670019","5","","10000","0","","[辣眼睛]小米11p以前还能玩玩你这游戏，这次更新后烫的玩不了是个什么情况"
"镜影星","保密","广东","500261684","5","","10000","0","13","我还好奇咋这么低播放原来是今天18点发的，那没事了"
"奇瑞旗云","男","广西","433354991","5","","10000","0","","米哈游你个杀千刀的[生气][生气][生气]"
"Twinkle辰","保密","上海","385940106","5","","10000","0","","我一看这个虚空终端就想到""圣神的卡拉链接着我们""[喜极而泣][喜极而泣]"
"尔尔风格","保密","河北","352171404","5","","10000","0","","这回两边都有驴了，可以开始互相伤害了[阴险]"
"妄许人间一清流","男","湖北","598562291","4","","10000","0","","刚刚抽中，快来吸吸我的欧气"
"七月高飞","保密","福建","488539681","5","","10000","0","","没玩够！mihomo搞快点，生产队的驴都不敢这么歇息&"
"平乐login","男","辽宁","92343933","6","至尊戒","10000","0","","多抢到一个必胜客单人餐想要的私信我"
"金币626","男","陕西","1848234559","3","","10000","0","","你这是个什么魔神任务，我淦"
"渊仙羡","保密","河南","442556568","4","","10000","0","","PC端登录界面卡半岩怎么回事"
"鸣濑羽歌","男","江苏","166707559","6","崩坏3・天穹流星","10000","0","","多抢到一个必胜客双人餐想要的私信我"
"快乐の丁真","保密","浙江","432168801","5","","10000","0","","草神的能力有点像识宝，这次主线前面有点无聊后面真的顶，"
"广东队长超人强","保密","湖北","609175557","5","","10000","0","","想垫几发给垫出来了[大哭]"
"486v587","男","北京","37901934","6","","10000","0","","这配音好一个动物世界既视感"
"does若愚","保密","江西","361805883","5","","10000","0","","提纳里强度明显不低（正常五星强度）"
"梦中的观星画师","保密","浙江","45014702","6","2021拜年纪活动专属","10000","0","","谢邀，歪莫娜了，三命"
"三年E班的某同学","保密","江苏","391574421","5","","10000","0","","这是钟离旁白吗[来古-震撼]"
"名字太难了hnn","男","广东","1787755741","4","","10000","0","","为什么剧情中没有戴因"
"xsdwwww","保密","河南","470527566","5","","10000","0","","看我动态，必胜客吞订单了[微笑]"
"聪明豆腐","女","广西","1976616054","4","","10000","0","","都怪你我的内存都没有了，我不管必须要给我十连抽不然这件事情说不过去[害羞][害羞][害羞]，才给300有什么用[大哭][大哭][大哭]"
"冬隐春来","保密","湖北","1453034521","4","","10000","0","","看来，爷是逃不掉在每一个国家都被追捕一次的命运了[doge][doge]"
"Charlotte丶奈wさんです","保密","重庆","1396794691","5","平安物语","10000","0","","我不理解为什么我一进须弥全是会顶人的怪[热]"
"雪杯AE","男","重庆","392064909","5","星座系列：双鱼座","10000","0","","虽然须弥怎么全是洞不过还是比稻妻好多了[脱单doge]"
"菟药","女","江苏","371917485","5","","10000","0","","我想要抓大猫猫[哭哭]"
"徐风飞雨","保密","四川","79538938","5","","10000","0","","是不是比刻晴还弱?"
"D--_--H","男","四川","94834830","5","","10000","0","","迪娜泽黛！！！！还我老婆！！！！！"
"Merry_Mr_Zhou","男","江西","88962634","6","","10000","0","","层岩那里的圣遗物副本，小宝怎么总是回去回血，我动态里也有，可不可以解决下，我知道现在还是八月。[妙啊]"
"雷兽兰雪","保密","广西","71426081","6","","10000","0","10","离谱，连热门都没有[无语]"
"Stars_glacier","女","上海","383777946","5","","10000","0","","嗯嗯提纳里大保底八十抽出了[微笑]"
"NT今日南唐","男","甘肃","436225119","5","","10000","0","","[|雪_好热][|雪_美妙]"
"一个普通的小问号","保密","天津","625827046","5","","10000","0","","我辛辛苦苦给钟离刷了两个月的千岩，为了一个生命杯，我刷到半夜两点多！！！我宵宫池，我一个宵宫也没中啊！！火花骑士！我碰都没碰一下子啊！钟离啊！！！！我把手机都扔了，我后盖都被摔开了啊！！！！！XXXXXXXX[doge]"
"孑然一身轻-","男","河南","51828464","6","","10000","0","7","来让我ruarua你的耳朵！"
"寻找主人特瓦林","保密","湖北","1222177641","4","","10000","0","","官方，我劝你在一天之内。把草绳给我出了。"
"hillhillzi","女","四川","9331025","6","","10000","0","","歪了琴啊啊啊啊啊啊啊啊啊[辣眼睛]"
"-月饼Jun-","女","天津","32772366","6","RNG战队","10000","0","","主线做的我人麻了[热]"
"RB-先生","男","四川","35990924","6","#EveOneCat","10000","0","","谢谢，小保底80发就出了科莱，90发就出了[崩坏3・光辉矢愿_让我摸摸]"
"公子离忧","保密","江苏","646855866","4","","10000","0","","这次的剧情，怎么一股满满的克苏鲁风[热]"
"这可太乐了吧","保密","广东","494202039","5","","10000","0","","幻境无限轮回，可以[doge]"
"只想吃香喝辣","保密","湖南","409741218","5","雪未来","10000","0","7","须弥城做的好棒！[打call][打call]那个……蒙德城和璃月港会优化吗？[保卫萝卜_哇][保卫萝卜_哇]"
"烈火龙心","保密","福建","351546253","5","喂，看见耳朵啦","10000","0","","原神，你有刀我是吧（虽然迪娜泽黛没事）"
"雪落窗纱a","女","江西","249086754","5","","10000","0","","这次提纳里中配不行，咬字不清晰，读字连一起"
"四角方糖","保密","湖南","440229988","5","","10000","0","","喂，你醒了。原神3.0马上就要开服了"
"黑猫与流浪诗","保密","海南","124544934","6","","10000","0","","柯莱为啥没有邀约任务"
"大炮没有你我怎么活啊","女","山东","609663203","4","","10000","0","","笑死了都在玩游戏,[脱单doge]"
"芜湖起飞了雅虎","保密","云南","1724772889","4","","10000","0","","显卡占用没吃满，但帧率跑不满。"
"sdhkkicubh","保密","广东","687438805","5","","10000","0","","三个小时一直在开锚点了，剧情都没来得及开[笑哭]"
"白琪子呀","保密","河北","1204080383","5","我家大师兄脑子有坑","10000","0","","剧情还没玩完，但是现在我的进度来看挺好的，就是稍微吓了我一下还以为我搞错了"
"影华朔","男","内蒙古","296586539","5","","10000","0","","这次剧情说真的没有愚人众还有点不习惯[藏狐]"
"哇好快的刀","保密","河南","485879541","5","","10000","0","","原宝憋了这么久的须弥你们可别一天就玩完了啊[妙啊][doge]"
"Ethew阿修","保密","福建","472968373","5","","10000","0","","感谢策划不刀迪娜泽黛之恩[大哭][大哭][大哭]，虽然感觉有点刻意圆好结局[doge]"
"置阴凉干燥处","保密","湖南","381624261","6","罗小黑战记","10000","0","","早知道主线剧情两个多小时，我就选择不做了，真的又臭又长"
"帕姆的插画集","女","安徽","481312748","5","","10000","0","","主线认真看的，才做完，真的巨长比第一幕稻妻的还长[][][]"
"帝姬蘅","男","山西","1099406450","5","","10000","0","","""你们两个是我的全部″[doge]"
"aonsoyo","保密","重庆","43871715","5","","10000","0","","中立生物牛牛[脱单doge]"
"一块宝藏","男","江苏","1955801774","4","","10000","0","","欢迎来到贝爷看世界[doge]"
"马上开始作战会议","保密","陕西","169947072","6","","10000","0","10","谢谢你米哈游 我下半辈子都不认识兰和那两个字了[藏狐]"
"After-Alive","保密","河南","4185271","6","","10000","0","","要练吗[保卫萝卜_问号]"
"春引秋晴","保密","浙江","1127897269","5","七海演唱会","10000","0","","出了缇纳里是不是就是大保底，然后必出缇纳里，满命轻轻松松[脱单doge]"
"中意雨乐","保密","江西","676176051","4","","10000","0","10","晚上必胜客给我发短信来的订单，呵呵[嫌弃]"
"小邢ll","男","安徽","73640708","6","","10000","0","","加强须弥优化"
"名字太难叉腰","保密","河北","1361416984","4","","10000","0","","rua提纳里的大耳朵[脱单doge]"
"这个不会起名的我","保密","陕西","1809741526","5","","10000","0","","在？我抽钟离歪了，歪了刻晴知道不？我TM刻晴四命了，你知道四命刻晴对于一个十几岁的旅行者有多大的心理伤害吗？[大哭][大哭][大哭]"
"忆丶凉笙","保密","吉林","214259857","6","","10000","0","","米哈游牛逼！！！"
"山落雨","保密","安徽","19521648","6","","10000","0","","歪77的集合[脱单doge]"
"南少骐","保密","江苏","1858750510","4","","10000","0","","[热词系列_打卡]"
"喜多欲die","保密","甘肃","1297519065","5","","10000","0","","内啥，我在想一个问题嗷，既然贤者会复原空间，是不是代表我们可以先把大地锄一遍然后交任务立刻刷新资源[脱单doge]可惜我剧情过完了，哪个好兄弟还没打剧情试试[脱单doge]"
"差零点零几分上岸","女","江苏","435364568","6","魔法学院","10000","0","","你这游戏，有点恐怖……又有点……额，离谱[笑哭]"
"七木kiu","男","河北","399097493","5","","10000","0","","贤者自以为无所不知"
"凡es","保密","上海","1739881217","3","","10000","0","","注意：提纳里是要进常住的！！！"
"桑柘木鹜","保密","云南","475158082","4","","10000","0","","啊~剧情~啊[大哭]"
"富久田保津","保密","河南","24615664","5","","10000","0","","哈哈，须弥……（脚步虚浮）（面黄肌瘦）（蹒跚）（跌坐）"
"木林森林木L","保密","浙江","241788145","5","","10000","0","","吃满定轨，特来还怨"
"苦茶籽蔡虹","保密","广东","519974503","5","","10000","0","","包包再配一遍吧，不知道为什么，旅行者现在说话听起来跟爱莉一样[藏狐]"
"莳什么白","女","河南","405991112","5","斯莱特林","10000","0","","夸夸！！主线好！（赞赏）"
"三锅tie","保密","广东","415164177","5","","10000","0","","你还我小提[抓狂][抓狂][抓狂]"
"飞鹤壁丹","保密","福建","1277417724","4","","10000","0","","[脱单doge][脱单doge][脱单doge]"
"崖边暴风","女","浙江","554502641","5","","10000","0","","大号小号都歪了，前了还怨"
"花花麻耶","保密","河北","368778238","5","","10000","0","","死域满格侵蚀的特效好酷，就是有点费人[辣眼睛][辣眼睛]"
"麟S","男","四川","366597165","6","","10000","0","","这专武的颜值也太。。。。"
"梦里星河者","女","上海","1389808234","3","","10000","0","","戴因，我好想你(*)你带着妹妹回来看看我好不好，我在须弥过得一点都不好(*)"
"太虚台上的冰灯","男","河南","399327966","5","初音未来13周年","10000","0","","为什么我进不去啊"
"高月两人影","保密","贵州","1079309346","5","","10000","0","","小吉祥草王感觉好可怜，教令院居然把二代神架空了"
"","保密","贵州","1455002484","4","","10000","0","","妮露的立绘都出了，为什么我还没有看到实机呢？"
"消失的拉斯尤纳","保密","浙江","135729971","6","","10000","0","","提纳里：你先别急[doge]"
"阿巴杜_","保密","山东","520880698","5","时光代理人","10000","0","","有人必胜客订单现在才付上账吗？"
"瘦下来的泰勒公式","男","山东","8410783","5","","10000","0","","能不能把你那游戏操控界面设计的像人一点，你把那快速移动的按钮正好摆在手机玩家挪视角的地方，视角挪不动你知道吗，你们策划是不是不用手机玩游戏？？？不在乎手机玩家的游戏体验？"
"一十六半夏","保密","河南","622016543","5","","10000","0","","记得科莱吗，原神漫画里"
"しらさわ","女","陕西","33050554","6","","10000","0","","武器池全是贯虹[生气][生气][生气]"
"Blowing_fu","男","安徽","351774631","6","","10000","0","","能不能实装拉娜，我好喜欢她[跪了][跪了]"
"苏打般涌来","保密","重庆","180180466","5","原神","10000","0","","你对我做的史莱姆料理有什么不满[原神_哼哼][原神_哼哼]"
"一只小枪枪","男","云南","12550695","6","崩坏3・天穹流星","10000","0","","[崩坏3・光辉矢愿_吃西瓜冰]地图app里可以搜到维摩，是个乡镇，须弥从云南开的吧？"
"bigbigbig大西瓜","保密","山东","237757602","6","","10000","0","6","这剧情不对劲了，怎么像崩三一样开始塞刀子了[大哭][大哭][大哭]"
"我的一个捣鼓朋友","男","浙江","130924250","6","","10000","0","","一发十连，出了，我该不该高兴呢"
"人类鉴定大师","保密","山东","321855716","4","","10000","0","","须弥的每日没法设，还没做好还是漏实装了？"
"一号洛","保密","河南","406035103","4","","10000","0","","事实证明，什么坎瑞亚科技都是虚的，须弥虚空终端才是真正的未来科技啊[星星眼]"
"我永远喜欢巴巴托斯","男","重庆","587242714","5","","10000","0","","歪了……"
"suleika・V","保密","广东","12754659","5","","10000","0","","都放提纳里杂谈了科隆游戏展的PV怎么还不放出来"
"明天柚子自由","保密","重庆","13560548","6","","10000","0","12","须弥就是一童话幻想乡啊，特别是小精灵那里的BGM好听到流泪[保卫萝卜_哭哭]"
"tofubeatsFans","男","贵州","22600492","6","","10000","0","","我才刚刚和柯莱告别就被拉娜截胡了[doge]"
"-朝瓷-","女","上海","256120991","5","","10000","0","","这次奥莫斯港和战斗音乐太好听了[大哭][大哭]"
"尤小尾","女","江西","199724021","6","","10000","0","","剧情很好  夸夸原宝"
"水月Lunaraqua","保密","湖北","371630763","6","","10000","0","9","戴因出了技能是不是普攻战纪爆发两个被动全是嘲讽"
"好萌者乐之","保密","广西","90662440","6","异常生物","10000","0","","昨晚差一个海螺就能拿到皇女皮肤，然后被弹出了[虎年]"
"灰星_","女","贵州","1517809","6","","10000","0","","果然还是新版本开荒最让人快乐啊，感觉很久没有到处都是惊喜的感觉了，上次还是开荒层岩，而且这次地图风格又又又船新风格，很护眼孩子很喜欢"
"自","男","广东","510025483","5","","10000","0","","剧情应该给有用的东西，而不是告诉你一个卷心菜会催眠"
"南山-原神代肝","男","江苏","1111444172","4","","10000","0","","省流：含草量惊人"
"四维旅人","男","上海","229781878","6","","10000","0","","你们手机还能玩吗？我今天因为手机过烫强制退出了（手机荣耀play4Tpro ，麒麟810芯片）"
"失焦的爱","男","山西","102591605","6","","10000","0","","好NB啊，这个角色机制"
"最爱极乐","男","山东","454461103","5","","10000","0","","我出提纳里了，我要提纳里喂我吃星蕈，我要躺在小提的怀里看彩色小人给我跳舞，啊，想想就幸福。[脱单doge]"
"夜来无风雨","保密","陕西","12111375","6","夏诺雅","10000","0","6","开了日配，纳西妲有那个贝伦的味道[笑哭]剧情还是各种空间，奇迹的魔女找碎片是吧"
"流金怀","保密","陕西","1727758893","4","","10000","0","","提纳里大保底已娶，保佑猎人之径不歪[保卫萝卜_哭哭]"
"一目莫玖酱","女","江苏","1196750361","4","","10000","0","","为啥感觉我手机划屏幕转视角不是很流畅啊……"
"Amynims","保密","四川","496679405","5","","10000","0","","做剧情好像中伊邪那美了"
