"昵称","性别","IP","UID","等级","装扮","用户权重","获赞数","粉丝团等级","评论"
"滚瓜溜圆太","保密","西藏","1753523512","2","","10000","0","","大保底60抽了给我出啊"
"周豫恒","男","浙江","85751074","6","","10000","0","","原宝，任务太多了我肝不动了[脱单doge]"
"清明・四季无安","保密","江西","16784280","6","","10000","0","","增加标记点最好开个300"
"俞鱼樱","保密","福建","472339756","4","","10000","0","","好家伙我在抽到的第一时间就用的雷神心海提纳里[脱单doge]"
"の星绘の","保密","广东","364195247","5","","10000","0","","11抽，钟离提纳里迪卢克,奖励个月卡[脱单doge]"
"柯基吃肉不喝汤","女","湖南","85748753","5","","10000","0","","谢谢，刚歪迪卢克[热]"
"Pnaf-1145","男","福建","1767871132","5","","10000","0","","艹，是生草箭[脱单doge]"
"账号已注销","保密","云南","110741568","0","","5000","0","","在？为什么现在不能查询抽卡结果了？[笑]"
"0零贰","男","江苏","145128543","5","","10000","0","","借楼，原神萌新群招人啦779096327，大佬萌新都可以来~群内还搭建了原神机器人可供抽卡查看面板[脱单doge][脱单doge]"
"牛奶里的泡泡","男","吉林","507730811","5","","10000","0","","这次更新是不是有bug啊 有些怪被打了都不动的 是不是底层逻辑没优化好啊"
"雨灬浩","男","四川","34180394","6","","10000","0","","为啥图案对上了不能进行"
"首次改名期待中奖","保密","上海","378984062","5","#EveOneCat!","10000","0","","电脑玩不了了（悲）"
"星空豆","保密","福建","1061108396","4","","10000","0","","从今天开始，我每天都要喊一遍加强客情"
"帝君忠诚的单推人","男","贵州","230421742","6","原神","10000","0","","抢到啦哈哈哈哈哈"
"彰三","男","内蒙古","583014878","5","","10000","0","11","神像血量上限提到10万了吧"
"黑猩猩阿火","男","甘肃","450553754","5","","10000","0","","主播主播我关注你好久了能送我一个钟离吗[脱单doge][脱单doge]"
"不知名_演奏者","男","湖南","397591743","5","","10000","0","","森林书离大谱啊我超[原神_生气]这么长"
"Swee_one","保密","甘肃","1348292209","5","","10000","0","","终于4级了[保卫萝卜_哇]"
"大三动画学妹","保密","广东","670581356","5","精灵王","10000","0","","问题来了，提纳里为啥是左撇子[妙啊]"
"样人三无","保密","江苏","454454371","5","","10000","0","","八重：3.0大C就是[原神_哼]心海：没错，就是我[妙啊]"
"摘星星的吉吉国王","女","吉林","38806940","5","","10000","0","","我啥都没抽到，连出三个皇女，搞得我不想玩了，幸辛苦苦攒的原石就这么完了，搞得我直接哭了[大哭]"
"小明微胖","男","菲律宾","627411431","5","","10000","0","","我每次有退游的想法的时候，都是因为抽不到钟离，这次也一样。最想要的抽不到，有再多的又有什么用[难过]"
"这是最长的名字吗233","保密","湖北","12703294","6","乃琳Queen","10000","0","","必胜客啊"
"茶夏ouo","女","陕西","17493619","6","星座系列：双鱼座","10000","0","","这次剧情真的不错！！！！[保卫萝卜_哭哭]"
"杨柳萋萋","保密","江西","357732068","5","","10000","0","","奇了怪了，突然掉线上不去了，其他软件还是正常能用的"
"无线生草永动机","保密","贵州","388975610","4","","10000","0","","咳咳，抽到了一只用法器的莫娜里[doge]"
"转发也抽不到奖","男","江西","269100160","5","明日方舟音律系列","10000","0","","请 实装剧情跳过"
"德克萨斯和琪亚娜的狗","保密","河北","1969044365","4","","10000","0","","3发出钟离"
"想被创进二次元","男","广西","669594060","5","","10000","0","","歪了，火系，大剑…懂了我歪了迪希雅！[doge]"
"虞露今莞吃柚米","保密","甘肃","173420562","6","HINA","10000","0","","原能出个配音选择系统吗，想听派蒙日配又不想放弃钟离中配"
"子哓","保密","澳大利亚","320592159","4","","10000","0","","我出了个七七 [再见] 提纳里你怎么不来[大哭]"
"魔法业界卖货人","女","辽宁","1077273009","3","","10000","0","","感觉小保底挺难的，4个号歪了莫娜七七[doge]"
"我个人认为这不对劲","男","上海","1513933246","5","","10000","0","","只有我一个觉得提纳里的剧情配音怪怪的吗[热]"
"游侠子桉兄","男","上海","357488065","5","citrus","10000","0","","提纳里是目前看上去最可爱的男角色[doge]"
"Lucky丶洛红","男","广东","110531390","6","星座系列：摩羯座","10000","0","","啊啊啊妮露，米哈游能不能多给妮露设计几套跳舞的待机动作，求求你了求求你了[保卫萝卜_哭哭][保卫萝卜_哭哭]"
"FLAG旗帜","男","广东","432071736","5","初音未来13周年","10000","0","","草木不会发生，但会有自己的语言[思考],我好像想起了什么不好的回忆,（是树在唱歌[灵魂出窍]）"
"浩瀚_星星与天空","保密","甘肃","1728995735","5","","10000","0","","原宝，管管内鬼吧"
"在下南宫冷","男","山东","457227889","4","","10000","0","","中了岩王爷才来看到[热]"
"单走一个六星星","男","江苏","176159584","5","异常生物","10000","0","","加强八重"
"失眠黄橙子","女","河南","288149552","5","","10000","0","","原宝79发了还不出金你到底是想怎样！！！再这样我要闹了！[大哭]"
"暮色x烟雨","保密","陕西","524689106","4","","10000","0","","这次剧情太棒啦，终于不是8+了[doge]"
"风止灵息","保密","山西","78990711","6","","10000","0","10","璃月去须弥的路只有层岩那一条嘛，感觉不太常规啊坑坑洼洼的，普通人怎么走啊[藏狐]"
"长觥","女","陕西","88795244","5","","10000","0","","派蒙说想快点去下一个国家，在暗示什么"
"醉折桃花海","保密","贵州","223629369","5","","10000","0","","魔神任务可以啊，从中午做到下午"
"兰少威武霸气一桶浆糊","保密","浙江","37001048","5","","10000","0","","我昨天下更新原神，电脑直接崩了，重装系统装到三点多，原神要重新弄"
"猫の生命保险","保密","山东","132938819","6","","10000","0","","太精彩了，尤其是草神中文配音简直是绝绝子，听的我口渴"
"休比ベ","保密","四川","7176001","6","","10000","0","","为什么出了一种探索地图必需的属性不多一个角色栏位呢"
"时坂飒人","男","山东","222322833","6","明日方舟音律系列","10000","0","","虽然但是，驴的耳朵应该非常柔软吧！你说是吧___"
"剪姑秋秋","男","江苏","35185712","5","异常生物","10000","0","","家人们应该对于提纳里没到城里来表示可惜，因为如果提纳里到城里来的话直接就会多一个有记忆的队友了（受到草元素力能力祝福的不仅有主角和派蒙，还有草眼持有者）"
"寄给你看","男","湖南","1608465825","5","","10000","0","","本来之前抽万叶小保底歪莫娜了，结果一个十连就抽到了[惊喜]"
"-HYM-","男","瑞士","21574978","6","","10000","0","","刚看完开端再刷这个第二章很有既视感"
"雅黛Q拉","男","河北","188559998","6","某科学的超电磁炮T","10000","0","10","过主线想到的第一个就是 伊路德人[doge]"
"原来是这样解决的吗_","保密","福建","509465284","5","","10000","0","","白飞飞笨笨"
"时间流尸","男","河南","153570454","6","公主连结可可萝","10000","0","","更新后为什么我感觉派蒙变长了和新图说话都好快[思考]"
"不语_不悔","保密","江苏","1306679848","4","","10000","0","","真有抽提纳里的吗？"
"我真的是UC董事长","男","浙江","32161828","6","贝拉kira","10000","0","","兄弟们，你们有没有感觉钟离护盾变薄了，我今天5w多血被小怪打死了我有点懵。是我的错觉还是什么。"
"IdnwlU","保密","浙江","39567291","6","","10000","0","","有些秘境要用到弓就提前说一下呀[热]"
"河蟹鲵蟆","男","四川","19331707","6","","10000","0","","有谁知道不给50万给50金币是啥剧情[热]"
"LoveMineCat","保密","江苏","96816605","6","初音未来13周年","10000","0","","熟悉的天花板("
"松果儿_seven","保密","湖北","7167252","6","少女前线","10000","0","","你的刀真是太快了，才到须弥城你就刀我！[大哭][大哭][大哭][大哭][大哭][大哭][大哭][大哭]"
"甘蒂0留形","男","新疆","693598156","4","","10000","0","","好家伙，mhy每次都要刀是吧"
"王氏羽","男","新疆","296589164","6","洛天依・最美的夜","10000","0","","这次主线剧情我个人感觉是最精彩的主线剧情，尤其是千朵玫瑰的后半段，简直称神[热词系列_吹爆][热词系列_吹爆]"
"热衷摸鱼的伽塔","保密","陕西","17864679","6","","10000","0","","有人用ipad2021pro玩吗？更新之前60帧完全没问题，更新后基本上十秒左右就得掉一次帧，尤其是转视角的时候，有人一样吗？"
"上上上上川","保密","山东","352699089","6","","10000","0","10","大佬们提纳里破魔弓和王下进侍选择哪个？"
"吵架伤财","保密","浙江","385319198","5","#EveOneCat","10000","0","","米哈游你喵喵吓死我了啊啊啊啊啊啊啊啊啊啊啊啊啊啊啊啊啊啊啊啊啊啊迪娜泽黛!!!!哇哇哇哇哇哇哇哇哇哇哇哇[][][]"
"叶叶快给我滚啊","男","河南","488267545","4","","10000","0","","下个版本移动端请务必适配沙地效果 求求了[原神_哼]"
"白鹭望庭华","保密","湖北","321263798","6","","10000","0","","剧情太好了！！[月隐空夜_开心][月隐空夜_开心][月隐空夜_开心][月隐空夜_开心][月隐空夜_开心][月隐空夜_开心][月隐空夜_开心]"
"PRTS零","男","安徽","450598426","5","","10000","0","","宵宫池出个宵宫然后提纳里池子出了刻晴和提纳里单抽就很离谱兄弟们没超过40抽3金"
"看到我踹我去看一数","保密","湖北","438235632","5","","10000","0","","刚刚抽了一发十连出了，垫了20发（[崩坏3・光辉矢愿_安详]"
"鼠符咒-科比手办","男","福建","401234026","5","洛天依8th生日纪念","10000","0","","原宝魔麟病后面有得治吗？"
"Tompps","男","江西","361474355","5","","10000","0","","原宝你干的好啊干得好！"
"渴望被问路的阿诺德","保密","福建","100891665","6","","10000","0","","加强蒙德璃月稻妻主线剧情！！"
"Frake","男","俄罗斯","15985688","6","","10000","0","","草那个拉娜的任务做的 晚上睡觉梦里都是会说话的蘑菇[热]"
"转发每次必有我","男","山东","174784519","6","少前小剧场","10000","0","","叮"
"短桠","保密","福建","1750864432","4","","10000","0","","谢谢原宝，自从来了须弥做菜爱好者再也没有缺过兽肉了[热]"
"南瓜饼先生","男","山东","8606831","6","","10000","0","","本来想一发垫卡等着小草神，结果给了我缇纳里，感觉小草神要歪了妈的。。。。[热]"
"Hill8","保密","河南","441785780","5","#EveOneCat!","10000","0","","拉娜姐姐好勇敢啊[保卫萝卜_哇]"
"RRRRRUAAA","保密","重庆","475477806","5","","10000","0","","这种无限循环剧情真的好玩"
"水月呕吐物我拌饭吃","女","浙江","210228146","6","-阿库娅","10000","0","","我要妮露跳舞！！！！！！！"
"清尘云纪","保密","广东","1627682675","4","","10000","0","","玩的时候手忙脚乱，啥也不记得了[笑哭]"
"ZZZ泽斯帝姆ZZZ","保密","广东","510078442","5","","10000","0","","艹，氪了第一单，结果歪了莫娜"
"嘛时候是天下第一","保密","广东","3564809","5","","10000","0","","[藏狐]括弧的xp没看懂，好吧其实一直不太懂米忽悠的男的xp"
"RRRRRUAAA","保密","重庆","475477806","5","","10000","0","","已经休息了5分钟了，开肝"
"2787698","保密","广西","1580837562","3","","10000","0","","我本来想着快开学了赶紧肝完，剧情什么的看个大概狂点空格就行了，反正按以往的经验来看主线也就那样吧。结果看着看着忍不住一句一句听完了再点，不知不觉就从头到尾做完了。个人感觉这次剧情真的很棒！"
"小蒙奇灬路飞","男","天津","32255419","6","格兰芬多","10000","0","","剧情可以啊 原宝加油！"
"我爱谦逊和敬畏","男","陕西","502681875","5","","10000","0","","熬夜做完了剧情，真的很不错耶，夸一夸"
"海沫的少女","保密","江苏","355633921","5","","10000","0","","感觉到了须弥后荧妹骚话也多了好多"
"DQlzb","保密","广东","616863316","5","","10000","0","","剧情这么短，我2小时做完了"
"自由吹过的风","保密","山西","630492024","5","","10000","0","","[笑哭][笑哭][笑哭]我不是很想抽丁真的，结果60出了，看来草神池子没有指望了"
"番茄酱蘸老鼠","保密","广西","487606289","5","","10000","0","","（哎 ! 你问为什么叫克利安巴这个名字吗，这个....）原宝你为什么这么会!"
"kasuse","保密","广东","18159347","6","","10000","0","","看前瞻：不就是个须弥,8.24：肝硬化了"
"遗憾是没有遗憾","保密","浙江","693152904","4","","10000","0","","380精通阿忍挂后台触发超绽放都能1万多一炸，好爽"
"cospro的看门犬","保密","江西","487185395","5","","10000","0","","谢谢你 米哈游 7抽万叶25抽钟离 飞雷也没歪 我现在都不敢出门了太爽了"
"Beyer-No88","保密","福建","44567694","6","","10000","0","","求兰那罗的周边，我真的好喜欢这些小东西[保卫萝卜_哭哭][保卫萝卜_哭哭]"
"嘉然今天吃花椰菜","女","浙江","20376952","6","","10000","0","","开服到现在头一次88发还没出货"
"驯г","保密","上海","44994437","6","咩栗","10000","0","","这次剧情和地图设计 只能说完胜稻妻"
"崩3仓检阖家富贵","保密","广东","496234521","5","","10000","0","","这剧情太顶了，映射的东西懂得都懂，说要快进的人真的没脑子"
"樟脑丸给脑梗丸辣","男","四川","389115471","5","","10000","0","","赞美须弥～赞美3.0～赞美剧情策划～"
"嘻嘻嘻亚泽泽","保密","上海","499321866","5","","10000","0","","还差一个本一层水，加油呼呼呼[脱单doge]"
"吃饭要紧3","男","浙江","37970372","5","向晚大魔王","10000","0","","剧情已经薄纱了 找个好一点的导演优化下镜头语言吧，现在的水平真的一般"
"忆梦-风人","保密","江苏","382102787","6","崩坏：星穹铁道","10000","0","","逛地图的时候把我20级的空拿出来了，给神子挂草。我的空带的是盾剑，真的好配(ω`)而且这地图好漂亮，音乐真好听⊙⊙不过没太多时间玩，等过几天放假，好好试试"
"木白玖","女","陕西","13843798","6","","10000","0","10","打了一天终于是把主线推完了[笑哭]原宝你做的好啊，而且这开放面积也忒大了[未定事件簿_宕机]"
"幻宇星12138","保密","山西","24649883","6","","10000","0","","感谢原宝！上个版本抽完宵宫后又垫了10发，早上一个10连出了个姥爷，下午肝了个10连出了一只柯莱，刚刚肝了个10连出了提纳里。总共40发出了两金！！[支持][支持]"
"TCOAM","男","江苏","14956489","5","","10000","0","","一次性肝完导致剧情体验不好，总感觉拖泥带水没有含金量。以后还是慢慢玩吧。。"
"陈什么执_","保密","浙江","516101288","5","","10000","0","","宵宫在须弥真的爽"
"双开门冰箱攻","男","广东","1677492386","5","","10000","0","","哼哼啊啊啊啊啊，音乐好好听啊啊啊啊啊啊！哼哼啊啊啊啊，剧情也好好看啊啊啊啊啊啊！"
"小阿泽cc","女","重庆","11160890","5","","10000","0","","[害羞]会在大雪时候说冷的话，可以把手放进他尾巴毛里的小狐狸谁不喜欢[脱单doge]我从立绘爆料无感→看到待机摸耳朵xp爆炸→日配元气少年可爱死了→抽到已结婚谢谢[OK]"
"ベ你猜ミ","保密","江西","517491126","4","","10000","0","","今天更新完后，我的角色对话就没声音了？这是为什么，玩得我是真的难受"
"gzw吖","保密","浙江","33892551","4","","10000","0","","地图、剧情、人物都夸夸[打call]"
"墨rey","男","陕西","272256872","5","","10000","0","","做了一天光做那个小精灵的任务了，也忒长了吧，支线一堆"
"我不想在想你了","男","天津","38983454","6","EveOneCat2","10000","0","","这次做的很好啊，奖励一个捏捏，虽然每次都很好"
"剪姑秋秋","男","江苏","35185712","5","异常生物","10000","0","","如果受到草元素祝福可以有自我意识的话，须弥城会不会不只有旅行者和派蒙会有既视感？,啊，提纳里柯莱海哥都不在城里啊，那没事了,可城里也会有别的草元素使用者吧？"
"Cyajax","保密","湖北","449688376","5","","10000","0","","我要新剧情！！！"
"momo325","男","青海","8799648","6","国民老公带回家","10000","0","","求求你别刀我了，人老了，见不得这些"
"裁决卿","保密","青海","299539892","5","","10000","0","","小精灵的名字也太难记了"
"是个橘鼠","保密","山东","591184389","4","","10000","0","","剧情吹爆，可是地图好粗糙啊，先不说你北边那个仙灵倒着走，大宝旁边那个草微粒还写成了风微粒[热]"
"一心一昼夜","保密","广东","384614785","5","","10000","0","","怎么一天了才50w[热]"
"上杉不知火","保密","湖北","477699916","5","","10000","0","11","看，终于过完了魔神任务"
"无语Pros","保密","广东","37944124","6","","10000","0","10","来点来自深渊的剧情[doge]"
"膝盖中过一箭qd-bp","保密","山东","226842824","6","EveOneCat2","10000","0","","须弥莎兰树秘境有bug"
"哈慈内miku","男","云南","628725934","5","初音未来13周年","10000","0","","地图好大[初音未来_喜欢]"
"空-bai","男","广东","51399385","6","2021拜年纪","10000","0","","妮露专武希望能改"
"玛卡巴子d","男","山西","601195801","5","","10000","0","","小保底百分百歪呗，刻晴一命，七七一命迪卢克莫娜[微笑][微笑][微笑][微笑][微笑][微笑][微笑]真的感谢你哦"
"呜_是W长","保密","山东","541368741","5","","10000","0","","妮露命座好强[辣眼睛]"
"二十青李焖白菜","男","四川","258503059","5","","10000","0","","所以，可不可以告诉我为什么今晚抽了四十抽出了五个柯莱[委屈]"
"渡边柚","女","河北","131277469","6","","10000","0","","能不能告诉我这货到底多大了，看着是个20多的，但是声音比16还16"
"木yuan晶","保密","广东","1811140169","5","","10000","0","","好结局，好耶[崩坏3・光辉矢愿_比心]"
"sineP_ekaF","保密","广西","7352351","6","","10000","0","","两发十连直接提纳里加两只猫猫补全六命[tv_doge]可是武器池迟迟不敢动，贯虹太毒了，一旦出了纯属浪费原石"
"枸杞岁月留痕","男","江苏","34187000","6","良辰美景・不问天","10000","0","","更新主线！[热词系列_锤]"
"黑色-天空","男","河南","290362391","5","","10000","0","","老玩家帮忙配个队，烟绯钟离。(看了一些配队但是没有行秋)"
"碗儿糕倒拔花椰菜","女","湖北","29520140","5","","10000","0","","[大哭][大哭]被卡卡塔和阿巴图伊的故事虐得死去活来呜呜呜哇"
"喜欢香草巧克力的猫","保密","黑龙江","522142531","5","瑰丽华服","10000","0","","最后一步，那个大刀没刀下去，编剧你有心了。[tv_难过]"
"125炮上的猫","男","广东","11045614","6","","10000","0","","剧情太棒了真的"
"闲识-n号","保密","河南","368982935","5","","10000","0","","剧情进步好大，相当优秀了！"
"卡鲨鲨","保密","上海","1848943454","4","","10000","0","","雪...糕...发...货[保卫萝卜_哭哭][保卫萝卜_哭哭][保卫萝卜_哭哭][保卫萝卜_哭哭][保卫萝卜_哭哭][保卫萝卜_哭哭][保卫萝卜_哭哭][保卫萝卜_哭哭][保卫萝卜_哭哭]"
"山子楂","保密","浙江","689741162","5","","10000","0","","这次的剧情真的吹爆！！[保卫萝卜_哇]"
"Cat猫爪","男","山东","349007376","5","","10000","0","","妮露专武改一改啊[大哭]，你改好看一点我多抽几把都行"
"凌宇zvz","男","广东","507039216","4","电子喵","10000","0","","太棒啦！[OK]"
"九亿____","男","浙江","697406524","5","","10000","0","","买到可莉耳机了！黄牛币斯！"
"一海千寻_","男","江苏","1855403495","5","","10000","0","","想问一下必胜客付完款后礼包券是要到店里买到才会发到手机上是吗[脱单doge]"
"昭丿屿坤g不见伶丨","男","黑龙江","16429483","5","异常生物","10000","0","","瑶瑶什么时候出[惊喜][惊喜][惊喜]这是我目前最想要的萝莉"
"连招就是44444","男","广西","442219041","5","","10000","0","","主线剧情真的不错，先刀后糖"
"窝布座人辣","男","江苏","272906371","6","","10000","0","","“在那个无始无终，层层套叠的幻梦中，智者国度的愚者们不惜牺牲民众也要达成的愿望，最后因为‘人’的意志，由所有人都没有想到的方法实现了”"
"改名好中奖啊","保密","吉林","164625298","5","","10000","0","","当了蜘蛛侠再也不想好好走路了 飞来飞去太过瘾了[打call]"
"律律猫","男","云南","92083842","5","","10000","0","","艾咪喝了汤吃了块肉,刻晴喝了汤吃了肉粒,八重舔了口锅底[doge]"
"茶荼酒糜","女","河北","352192378","4","","10000","0","","耳朵看起来好好摸！"
"无语子子酱","女","湖南","1630589238","4","","10000","0","","我的提纳里是个僵尸[保卫萝卜_哭哭]"
"灞","保密","福建","488398822","5","","10000","0","","剧情点个赞[OK]"
"快被害死了","保密","广东","245061428","5","","10000","0","","兄弟们别忘了暑假有免费领原石[doge],https://www.bilibili.com/audio/au2698891"
"原黑桃海贼团船长","男","河北","337034937","5","","10000","0","","剩下的三国什么时候做完？"
"白色の幽梦","男","四川","39212248","6","原神","10000","0","","好家伙，才几分钟耳机就买没了"
"哈哈可太厉害了","保密","安徽","424750430","5","","10000","0","","谁知道秃秃豆在哪啊，须弥杂货铺没有卖啊[热]"
"主播不要卖萌","保密","广东","44042497","6","约战・狂三","10000","0","","虽然歪了莫娜，但是没有关系，因为我是第一个10连出的。[脱单doge]"
"酒酒井小姐的大噶臂兽","男","河北","402274725","5","","10000","0","","歪七七了www[大哭]"
"玻璃瓶子丨","保密","江苏","73732255","6","","10000","0","","好想摸她的耳朵啊，好在意啊，好在意啊"
"是我制做聪明","保密","重庆","445944307","3","","10000","0","","看pv没有感觉但是实机让我好爱[大哭][大哭]"
"梅兰卡斯","保密","黑龙江","542260445","5","洛天依9th生日纪念","10000","0","6","有没有人觉得海染改了，原来只要奶量足够，可以稳定叠到29699，现在好像吃物抗了，叠不到了"
"那羽","男","吉林","60439269","6","","10000","0","","我被刀了[大哭]，原来是梦[委屈]"
"有罪ADC","男","湖南","176962884","5","","10000","0","","成就搜索功能竟然真的出了！"
"LeberechtHan","男","浙江","351206897","6","良辰美景・不问天","10000","0","","二十连两个提纳里，不错不错"
"不进前两百不改名z","女","福建","2081605856","5","","10000","0","","提纳里你可别穿黑丝是个僵尸成为蒲公英骑士还兼职当暗夜英雄啊[保卫萝卜_哭哭]"
"若得青叶飞","保密","贵州","16827643","6","2021拜年纪","10000","0","","[微笑]所以戴因人呢？"
"希无神域","保密","广西","1176176092","4","","10000","0","","希望柯莱也出一个！"
"萌新小屋","男","河北","121929614","5","","10000","0","","原石抽完没抽到帝君，然后商城又兑换了三发，觉得没希望了，就随便点了一发小提池子，金色就中了，然而因为我太佛系，前置任务没做还不能到须弥[笑哭]"
"这可太乐了吧","保密","广东","494202039","5","","10000","0","","好家伙直接暴露凯瑟琳，好嘛帮至冬打工，爷就是第十二位――旅者[doge]"
"あてもなく","男","重庆","259073912","6","","10000","0","","一波剧情玩下来真是太顺畅了，加上异域的背景音乐，太棒了"
"LKK-OVO","男","上海","449310239","5","约战・白之女王","10000","0","","这次的须弥总体设计比稻妻不知道强了多少倍"
"一般路过蟹味菇","女","湖北","2992927","6","","10000","0","7","须弥地图很好，就是我的手机越来越烫了[妙啊]"
"我想吸走你的多巴胺","保密","广西","36013754","6","2233十一周年纪念","10000","0","","世界...遗忘我[tv_鬼脸]"
"叁点水儿","男","河北","287336345","5","快把我哥带走","10000","0","","别刀派蒙，我真的会哭岔气的[辣眼睛]"
"格莉丝-贝岚多","男","四川","423753612","5","","10000","0","","我觉得他应该是6常驻强度高的了，不打反映伤害也较可观"
"古~子","保密","广东","1337618914","5","","10000","0","","夸夸，剧情写的真好[保卫萝卜_哭哭][保卫萝卜_哭哭]虽然做得很累很长但是很投入"
"溯隐_Hermit","保密","浙江","224604036","5","","10000","0","","嘀――"
"你的小狼狼啊","男","北京","661566177","5","","10000","0","","歪了歪了"
"琳璃_","女","河南","1107261292","4","","10000","0","","那个，可以让派蒙去lofter看看嘛？同一个视频，但是没有声音，已经这样四个小时了[脱单doge][脱单doge]"
"舞う花","男","江西","596115341","5","","10000","0","","派蒙真的好可爱，真的好关心我[给心心]"
