"昵称","性别","IP","UID","等级","装扮","用户权重","获赞数","粉丝团等级","评论"
"uboaaa","保密","四川","499820224","4","","10000","0","","鬼龙院皋月？！"
"妮赣马","保密","山西","412674943","5","","10000","0","","摩拉科斯正在汲取水元素！[脱单doge]"
"苍蓝の叶","女","重庆","18261399","6","赫奇帕奇","10000","0","","呜呜呜姐姐的声音好好听[保卫萝卜_哭哭]"
"我是李小狼","保密","四川","484586123","5","","10000","0","","玛修・基列莱特"
"玉山之将倾","保密","浙江","527245192","5","","10000","0","","omg姐姐你好美…等我！赛诺和你我一定都接回家！"
"Tina阿星","保密","河南","381772492","5","","10000","0","","誓守同学不止四手而已[喜欢]"
"无存档点的二周目","保密","浙江","275346614","6","2021拜年纪活动专属","10000","0","","潘森：哦哦哦哦哦哦哦哦哦哦哦"
"角卷西瓜羊","保密","中国台湾","477862284","5","公主连结凯露","10000","0","","水属性拿船桨肯定没问题[doge]"
"冥","男","上海","2069618","6","","10000","0","","这次日配感觉不够“大姐姐”[傲娇]"
"繁雪芳华","保密","河南","567071948","5","","10000","0","","居然是四星角色，这是我没想到的。"
"奇迹","保密","湖北","454998812","5","","10000","0","","老婆！"
"真心是醉了这昵称","男","江西","22378774","6","","10000","0","","坎蒂丝―纳西妲的妈妈[妙啊]"
"摘星子","保密","浙江","916553","6","异常生物","10000","0","","日配是斩服少女里的皋月，可以配较硬的声音。现在柔和的腔调明显是导演要求的"
"fantasy大堡","保密","上海","335089775","6","","10000","0","","是你！恶灵 妖刀姬"
"九点半还困","女","未知","34460236","6","","10000","0","","姐姐！！我可以！！！"
"duser","男","江苏","6422890","6","","10000","0","","所以，这专武到底是谁的？？[热]"
"此方晚风","保密","江西","13611468","6","","10000","0","","哦姐"
"膝盖中箭假人","男","浙江","12852463","6","","10000","0","","荒泷一斗：醒醒吧，坎蒂斯，让我们把这个须弥，烧成灰"
"未眠要吃小孩","保密","广东","262082578","5","历战觉醒","10000","0","","有盾有枪，是潘森([脱单doge]"
"十七岁想要凯瑞全场","女","四川","33938006","6","","10000","0","","好帅啊姐姐"
"fantasy大堡","保密","上海","335089775","6","","10000","0","","woc是庄晓曼"
"蜀黍的久蔡","保密","上海","173995975","6","","10000","0","","省流：直！接！来吧！,          开祷！"
"zyl猪猪","保密","北京","22525091","5","","10000","0","","欧欧欧"
"Tomo1あ","男","广东","3020201","5","","10000","0","","握住我的枪！老婆！[脱单doge]"
"勉为其难亲亲魈","保密","云南","442701954","5","","10000","0","","姐姐抽我吧[奥比岛_委屈][奥比岛_委屈][奥比岛_委屈]"
"小菌曼那","保密","四川","1001466404","2","","10000","0","","好耶"
"S_E_N","保密","安徽","442335931","5","星座系列：处女座","10000","0","","听取我的战祷[给心心]"
"桂香木木","保密","湖南","88790350","3","","10000","0","","好帅的姐姐[来古-注意]"
"水煮冷吃兔","男","未知","2086371847","5","","10000","0","","这是只有天使才能有的声音啊啊啊啊啊啊啊用再多的辞藻堆砌刻画也无法形容这么美好的声音啊啊啊啊啊啊啊 有生之年能听到这个声音我死而无憾啊啊啊啊啊啊啊啊啊我作为一个声控活着真是太好了啊啊啊啊啊啊啊啊"
"人生孤旅","男","云南","492198430","5","泠鸢yousa登门喜鹊","10000","0","","坎蒂丝老婆，虽然性感、美丽、温柔、妩媚，集万般赞美于一身，但依然，是的，依然无法阻止我对纳西妲的刑之向往，我要继续攒原石，不见纳西妲不拔一毛。（目前，大小月卡保持中，28个彩蛋，135个尘辉，5万+原石了）。[嘟嘟][嘟嘟][嘟嘟][嘟嘟]"
"蓝大人别冲了","保密","山东","287476","6","","10000","0","","开祷"
"沉石若水","保密","湖南","266594542","5","","10000","0","","我来了我来了，真的很戳我"
"ThePictures","保密","新疆","31985772","6","至尊戒","10000","0","","配乐好牛逼啊卧槽卧槽卧槽卧槽卧槽，好听！我要抽我要抽我要抽！[给心心][给心心][给心心]"
"茶卡言佑星","女","吉林","524846345","5","","10000","0","5","我的老婆！！！"
"花名未定呢","保密","四川","76404581","4","","10000","0","","老婆老婆啊呜呜我的老婆"
"bili_436759","保密","北京","436759","6","","10000","0","","埃及艳后"
"玉阙爻光","保密","广东","599932613","5","","10000","0","","坎蒂丝！！！！"
"明越当空","保密","广西","12750422","5","","10000","0","","好看，可惜是四星"
"绅士の逸方君","男","山西","16981440","6","","10000","0","","矛与盾，指众神！,每天的黎明都是诸神的黄昏，因为那时的凡间比星辰更加明亮！"
"Frozel","女","广东","208885251","5","","10000","0","","3.1快来[原神_哇]"
"杜蕾斯也可以吹气球","保密","四川","25531438","6","","10000","0","","赢！"
"白嫖的快乐你们不懂","男","黑龙江","2132850897","4","","10000","0","","好家伙，这才多久，说，剪贴板里放多长时间了"
"小鱼钓猫猫vera","女","江西","38834256","6","","10000","0","","啊啊啊这个姐姐太好看了，太！好！看！啦！"
"とある偶极の二甲亚砜","女","江苏","2193989","6","汉化日记","10000","0","","月卡党为了给纳西妲凑出大保底，再见了赛诺，等复刻我必抽你,（看到坎蒂丝角色演示）,（-648）"
"狗菇Sama","男","广西","4714573","6","崩坏3・天穹流星","10000","0","13","我的老婆是我的，你的老婆还是我的。"
"幻昼啊啊啊","保密","浙江","35353467","5","巅峰荣耀","10000","0","","是你，潘森![doge]"
"逢坂小虎_","男","浙江","231381741","6","公主连结可可萝","10000","0","","我超，柚姐！！！老婆[2233娘_大哭]快跟我回家"
"xpc2505","男","辽宁","2337906","6","","10000","0","","如此精致的模型，设定。  只是个四星。。"
"六边形战士冲啊","保密","广东","13453087","6","鹿乃","10000","0","","这个脸，建模好好看[喜欢]"
"旋转大雪糕","保密","广东","6070510","5","","10000","0","","老婆"
"提桶跑路在今天","男","湖北","24866326","6","","10000","0","","[笑哭]坎蒂丝要是能举盾冲锋就好了"
"业师你带我走吧QWQ","保密","广东","166644426","6","","10000","0","","潘森，伟~大~的潘森~~~哈J哈J哈J哈J哈K"
"死就好了","男","四川","382557389","5","","10000","0","","大佬这次音乐比起沙漠更加像异域风，可能是角色的首饰的感觉后面有点古老的意味更多还是异域风"
"你家米饭量也太少了吧","保密","河南","31367445","6","","10000","0","","老婆！！！好帅！！亲亲＾3＾"
"摸一耶","保密","福建","13542805","6","斯莱特林","10000","0","","她真的好帅哦！！[喜欢]"
"OooJAY","男","浙江","320719972","5","","10000","0","","米哈游我劝你别不知好歹！！！这就是个四星！！！我小保底可以歪但是你可别不给我出这个！[微笑][微笑][微笑][微笑][微笑][微笑]"
"9564243","保密","山东","2267130","6","","10000","0","","啊，经典的异色中的波斯猫一般的眼睛"
"58743521564_bili","男","广东","437168315","5","","10000","0","10","一发十连安排，如果没有，再来一发，毕竟到3.1的原石数为1.38万到1,4万之间，大概"
"泽坤道斯","男","上海","1977305","6","","10000","0","","开沙漠 第一时间 直冲金字塔 马上大地抽卡 说不定 巨神兵 就来了[热词系列_知识增加]"
"名字怎么想不出来了","保密","浙江","97229541","6","","10000","0","","某只鲨鱼：你也想开祷吗[脱单doge]"
"白庭bt","保密","福建","288378011","6","","10000","0","","你好，结婚！"
"张桐轩","保密","四川","518830807","5","","10000","0","","来了，刚吃完饭[星星眼]"
"近藤橘","男","甘肃","411376843","5","","10000","0","","我的"
"T侑","保密","广西","400182188","5","","10000","0","","好美"
"宇宙の英雄","男","四川","131558046","5","星座系列：巨蟹座","10000","0","","一看就很会打牌，我说的是七星召唤[doge]"
"林衣开开心心","保密","河北","210343889","5","","10000","0","","她真好看 像一只猫猫 可爱"
"婴伶不要再摸鱼啦","女","山东","339258627","5","","10000","0","","老婆老婆我的老婆[大哭][大哭][大哭]"
"_炒米粉","男","福建","19848154","6","","10000","0","","她的声音好温柔啊[喜欢]"
"沐飒_风","保密","上海","347387579","6","","10000","0","","所以坎迪斯可以自己主c吗[脱单doge]，她好美啊！,坎迪斯，夜兰，万叶，行秋[脸红]"
"早春呈水部某十八员外","保密","山东","251371507","5","","10000","0","","想要！"
"神里盒盒","男","北京","397433133","6","原神","10000","0","","庄晓曼是天！！！"
"魔鬼丨筋肉人","保密","广东","54057393","5","公主连结佩可莉姆","10000","0","","温柔贤惠的御姐，直呼老婆[tv_色][tv_色][tv_色]"
"早柚是一定会中奖哒","保密","浙江","650457306","5","","10000","0","","我的回合，开祷！！！"
"梦游月","男","广东","92912408","6","早稻叽收藏集头像挂件","10000","0","11","沙漠帕拉丁[脱单doge]"
"uri奈绪","保密","江西","309972379","5","","10000","0","","冒着出金风险，就为了你[打call]"
"茶篮子","男","广西","1629061","6","-阿库娅","10000","0","","“只有盾是不够的”,那加上卡牌呢[doge]"
"明月zzzzzz","保密","广东","211037","6","","10000","0","8","帅气。"
"框框run","保密","广东","1994939","6","","10000","0","","坎蒂丝真的好漂亮啊，我的女神"
"永眠的彼岸","男","重庆","12874967","6","斗破苍穹","10000","0","","她真的好像五星角色[藏狐]"
"阿抬阿抬","保密","四川","14172919","5","","10000","0","6","我真的，太喜欢坎蒂丝了！"
"最可爱的怪物","保密","海南","1472275","6","","10000","0","","六星颜值，换个身份就是异国女武神啊！"
"按落云头","男","广东","25020486","6","","10000","0","","英配坎蒂斯有种月夜湖面静谧的感觉"
"宇宙骑士铁加曼Blade","男","贵州","501408188","5","","10000","0","","我敢保证那群老外又在发病了。"
"西葫芦鸡蛋大包子","女","黑龙江","44411483","6","","10000","0","","40抽40抽 求求了！40抽给我一个就行呜呜呜"
"芹禺针","保密","湖南","7757298","6","三周年恋曲","10000","0","","你就是大名鼎鼎的...坎蒂斯！[脱单doge]"
"如火焚心","保密","四川","328615599","5","","10000","0","","赛诺：你握枪就握枪，干嘛握我的枪[doge]"
"月永喵喵","保密","山东","1503984249","4","","10000","0","","报看[热][热]"
"yiluo","女","四川","1946003","6","","10000","0","","一直在观察坎蒂丝的头饰（帽子？）[思考]她头上那个圈到底是悬浮的还是和额饰连一起算个帽子的呢？"
"名心h","保密","江苏","286662986","5","乃琳Queen","10000","0","","真飒做的"
"名字怎么看不了","男","新疆","70422261","5","","10000","0","","开祷"
"CPTWilliam","保密","重庆","5747236","6","","10000","0","","这额头上是模仿荷鲁斯之眼吗，直接用埃及原版图案不好吗，这个眼睛图案设计看起来憨憨的[辣眼睛]"
"雪深岚木亭","保密","新疆","1897997610","5","","10000","0","","音乐真好听，坎蒂丝的侧脸异瞳很惊艳"
"Nomemories","保密","江苏","179325250","5","星座系列：巨蟹座","10000","0","","尤拉：你听我说，你不要我了吗？,我：你别嗦啦，我要六命坎蒂丝,[大笑][大笑][大笑][大笑]"
"霆BOA","男","广东","518333007","3","","10000","0","","给她出个特效大招啊，开启大招，从异色瞳里放出一道目光，正对准她的人会被定身4秒，无法解除控制"
"卡塔得","保密","广东","407588592","5","","10000","0","","bgm让人想跳舞！！"
"纯爱战神南梦芽","男","上海","3099593","6","碧蓝航线","10000","0","","BGM真的超有感觉[打call]"
"埚ぁ","女","北京","17826845","6","","10000","0","11","这姐姐太美了,真的不是五星吗"
"葫芦呼噜葫芦芦呼噜噜","保密","四川","1914008","6","","10000","0","","卧槽，我看完甚至想给她捞把船桨"
"观岚岚吖","保密","广东","701385409","5","星座系列：巨蟹座","10000","0","","可爱，眼睛好漂亮抽不抽的到是另一回事了"
"Indianm1fan","男","美国","14917794","6","","10000","0","","你这个守护者用三叉戟吗"
"兰珐罗","男","河北","23561779","6","","10000","0","","声优听的好耳熟"
"-侑莉-","保密","黑龙江","303307470","5","","10000","0","","太棒了，她竟然会扔标枪，标枪控狂喜[喜欢]"
"SheepExia","男","广东","3023507","6","","10000","0","","来了来了！"
"干扰器转换者","保密","湖北","364424960","5","白蛇2：青蛇劫起","10000","0","","开祷！[灵魂出窍]"
"蘑菇多好吃啊","保密","湖南","7184076","6","","10000","0","","bgm绝了"
"R框子","女","广东","401585134","6","咩栗","10000","0","","好耶！"
"呆篆笪史","男","湖北","387945784","5","","10000","0","5","都让一让，大荒星陨!"
"灭宙龙","保密","江苏","225387898","6","","10000","0","","妈！（超大声）[doge][doge][doge]"
"Clematis_yi","女","广东","470029246","5","","10000","0","","4星！四星！你知道吗？她是个四星！我的老婆！她那么好看！她又是个四星！！她那么会为我省钱！知道我没钱是个四星！老婆！你知道吗！你这个四星让我直接被您俘获了心啊！老婆！[原神_哇]"
"渣啊喵","保密","四川","28951753","6","#EveOneCat!","10000","0","","Bgm好棒"
"keysofun","男","广东","24731041","5","","10000","0","","迎面走来的你让我如此蠢蠢欲动，这种感觉我从未有Cause I got a crush on you who you"
"WRFMO","保密","广东","37797291","5","","10000","0","","铲子～杀～人～魔～ 啊啊啊啊啊啊啊啊～～"
"染叶ww","女","湖南","355366376","5","","10000","0","","日文cv是没听说过的人，但是柚木凉香这名字是真好听"
"鸡本的信任","保密","天津","6771875","6","","10000","0","","吹爆"
"暮雨汐梨花","男","山东","11299638","6","","10000","0","","卢姥爷：是谁跟我抢bgm[doge]"
"番星丶","男","江苏","7970466","6","","10000","0","","啊啊啊啊啊 坎蒂丝 你带我走吧 坎蒂丝 没有你 我怎么活啊 坎蒂丝！！！！！！！[大哭][大哭][大哭][大哭]"
"史莱姆之王-","保密","河南","276872951","5","雾山五行","10000","0","","@问就是相信光 [偷笑][偷笑][偷笑][难过][难过][难过]"
"狸花猫LiMao","男","浙江","155196918","6","","10000","0","10","开祷！坎门！[tv_色]"
"想吃美少女味的泡面","保密","浙江","434827085","5","星座系列：天秤座","10000","0","","音乐和视频节奏不对，我的评价是可以重做"
"坏的飞机","男","山东","4677700","6","","10000","0","","咱的大保底就是为你准备的[给心心]"
"saybso","保密","广东","27605210","6","","10000","0","","斯巴达战士"
"围炉夜叨叨","女","江苏","5620254","6","","10000","0","","虽然是终末陪跑（已经有了），但是船桨真的好适合，控制不住自己吃定轨的手了"
"-执掌好运的黄黑之王","保密","河南","400385992","5","纳米核心","10000","0","","千年眼！"
"forreverr","保密","新加坡","21243324","6","","10000","0","","英配最近也太强了吧[星星眼]"
"屋舍之灵汲于雨","保密","山东","660491592","5","良辰美景・不问天","10000","1","","哦哦哦哦哦哦哦哦哦哦哦"
"水雷感电","男","福建","440833299","5","异常生物","10000","0","9","老婆？不，直接打牌吧！"
"em学习真困难","男","辽宁","355791226","5","","10000","0","","沙漠皇帝后裔？沙漠皇帝要复活？拿着盾[妙啊] 是希维尔[doge]"
"23度心情","保密","未知","483963437","5","","10000","0","","爱了[抓狂][保卫萝卜_哭哭]"
"哈奇__","男","山东","35972367","5","","10000","0","","啊啊啊啊啊BGM真的不得了啊疯了"
"咸鱼酱哒呦","保密","河南","276848496","5","偶像梦幻祭2","10000","0","10","凯蒂丝姐姐，你还差弟弟吗？我可以的！[脱单doge][脱单doge][脱单doge]"
"EasunGuo","男","福建","186490832","6","汉化日记","10000","0","","快来我家照亮我！！！[星星眼]"
"抓条鱼吃","保密","安徽","102421425","5","","10000","0","","bgm太好听了"
"是御风呐","保密","浙江","59116842","5","","10000","0","","我的回合，抽卡！"
"Renu毛茸茸","保密","山西","295874678","4","","10000","0","","优雅上流"
"日知呸呸","男","湖北","39049844","6","","10000","0","","BGM好好听啊"
"蛋FaJUN","男","四川","38183387","6","花园Serena第二弹","10000","0","","哦雷诺烫，多罗！五盖，到你[崩坏3・光辉矢愿_剪掉]"
"喵堡王限定猫猫汉堡","保密","四川","74539293","6","EveOneCat2","10000","0","","妈的，姐姐真好看[喜欢][喜欢][喜欢][喜欢][喜欢]"
"一大盒阿司匹林","男","广东","6753870","6","赫奇帕奇","10000","0","","抽我抽我抽死我啊啊啊啊"
"兔子不穿秋裤","保密","河南","255334874","5","","10000","0","","谁能想到这么温柔的姐姐会是LOL寡妇呢[脱单doge]"
"本乃妹子","保密","广东","131327275","6","","10000","0","","可惜啊，没有想象中的令人上头"
"多拉A梦也是猫呢","男","陕西","8811130","6","","10000","0","","多说无益！DUEL！"
"大海与我","男","江西","157767831","6","泠鸢yousa登门喜鹊","10000","0","11","我的"
"冰封的时之轮","保密","山东","88673891","6","明日方舟音律系列","10000","0","","坎蒂丝：吼吼，亲爱的大风纪官先生，要来一场快乐的七圣召唤吗[微笑],赛诺：[脸红],赛诺：事不宜迟，开始吧！,坎蒂丝：哈哈哈哈，我发动千年眼的能力，你的牌已经被我看穿啦！胜利是属于我的了！,赛诺：[歪嘴]我早已发动了千年权杖的能力，你所看到的只不过是我想让你看到的。就让我用千年权杖控制住你吧！,坎蒂丝：纳尼！,（千年眼与千年权杖对波后两败俱伤）,哈哈哈哈哈哈！螳螂捕蝉黄雀在后，这样我就有法老王的三部分权能了（此时屑莹从角落里出现）,出现吧，另一个我！（叮）,莹的身形突然发生了转换，与是空出现了,空：这久违的力量[歪嘴]"
"r崎狂三の猫木晴香","女","广西","455591101","6","","10000","0","","坎蒂丝：只有盾是不够的,懂了，还要抽个奶妈,心海你等着我！！！！"
"拉菲药丸","保密","甘肃","40199143","6","","10000","0","","千年钥匙，预测未来，这不伊西斯姐姐么[原神_哼哼]"
"funkyfat","男","黑龙江","1567640","6","异常生物","10000","0","","这个声音吧 不是那种常规二次元姐姐的风格，更接近现实女性说话的声音。安静但是又有安全感"
"账号已注销","保密","山东","1453546262","0","","5000","0","","谁能懂我连续三个新四星都没有抽到的心情[大哭][大哭]"
"垮个小猫批脸-_-","保密","浙江","499414236","5","洛天依・最美的夜","10000","0","","这个投枪 我已经想到香香又要经历什么了[崩坏学园2_记仇]"
"想娶科洛丝","保密","河北","1550063","6","","10000","0","","说八百遍了没准备下池就先别来看pv角色演示[笑哭],我怎么就管不住这手（和中堂脸）！！！"
"墨羽ST","保密","湖南","2999482","6","","10000","0","","新的老婆出现了[喜欢][喜欢][喜欢][喜欢]"
"彰甲之翼","保密","上海","352609242","6","","10000","0","","乖乖站好，不祥之刃！"
"摩拉克斯的宝l","保密","广东","1102401324","3","","10000","0","","卧槽姐姐"
"朔月之拥","保密","广西","12160363","6","灵笼","10000","0","","[藏狐]打算30发捞一捞，最好别把小保底吃了，哪怕她并不算实用，但架不住她好看啊"
"许愿银狼不歪","女","安徽","1500895574","3","","10000","0","","上个池子想要一个砂糖，结果行秋和多莉快满了。这个池子想要一个凯蒂丝，会不会也是一个都不出来[傲娇]"
"三三好萌好可爱","男","广东","6763037","6","良辰美景・不问天","10000","0","10","坐等改bgm的视频，有了就踢死我"
"慕游而已","保密","山东","130768026","5","","10000","0","","坎蒂丝我命中注定的老婆！"
"大头俊康","男","马来西亚","472290653","6","","10000","0","","只能说不愧是张琦老师，配了一种温柔却不失冷酷的感觉，针不戳！"
"不知道萍","保密","福建","399631824","5","","10000","0","","看立绘：不在xp上诶,看pv：好温柔的姐姐，今天晚上让我膝枕好不好~~~[妙啊]"
"免疫力--","保密","四川","94616396","6","","10000","0","","老婆[大哭]我哭"
"Ehime丶Sama","女","广东","5061522","6","","10000","0","","我可以没有赛诺妮露，但是我必须要有坎蒂丝姐姐！！！姐姐！！！我的老婆呜呜呜！！！[喜欢][喜欢]"
"洛羽灵殇","男","山东","37294427","6","","10000","0","","抽不到，我，我，我的回合，印卡"
"先为_力胜","保密","河北","54227633","6","","10000","0","","太漂亮了，要不是离大保底只有五十抽高低得整个满命"
"流沙耶","保密","陕西","628871939","4","","10000","0","","厚礼蟹！ 真美！要了！"
"刘呵呵呦","保密","山东","497876335","5","至尊戒","10000","0","","这是几星？？？"
"我的adolescence","男","上海","385536980","6","暮光幻影","10000","0","","我悟了[脱单doge]魈+帝君！"
"以天为裳","男","广东","387363753","5","","10000","0","","攻击用枪防守用盾，攻防兼备，最是绝妙。"
"-D夜琉命_","男","江西","349875064","6","","10000","0","","这，是第一个四星角色pv用五星武器吧"
"一只住在南极的熊","男","河南","24880018","6","","10000","0","","第一次觉得中文配音碾压了日配，烟绯那是配音监督的问题，这次是都在正常发挥的情况下，让特别喜欢中配。,中文音色有着冷清却不是无法接触的感觉，就是音色高冷却能体会到人不高冷，配合BGM（我不知道算不算jazz，但有须弥酒馆的感觉），一种沙漠神明后裔的感觉就出来了。,太爱了[打call]"
"INorthI","男","浙江","114515778","5","","10000","0","","你赛诺为什么拿着我坎蒂丝的武器"
"神明-艾尔巴特利恩","保密","贵州","1548779436","4","","10000","0","","窝列诺塔，多洛[doge][doge][doge]"
"白玉喵喵喵","女","四川","8756407","6","","10000","0","","感觉英气一点的御姐音更合适一点[原神_喝茶]，但是也还可以"
"Aymoon圭零","男","北京","53366738","6","RNG战队","10000","0","","我的！！[原神_警觉]"
"翎花笺","保密","天津","9252633","6","","10000","0","","是你！大名鼎鼎的v，无胄盟的前排小妹！"
"洛羽灵殇","男","山东","37294427","6","","10000","0","","可惜了，不是白毛，不是帝君的菜"
"小pico","女","河南","54839944","5","","10000","0","","水之一斗也来了[大笑][大笑]我狂喜"
"多米的懒惰铲屎官","女","海南","160957787","6","请吃红小豆","10000","0","","我超，这音乐，一听就是美女[大哭]"
"云雾生紫堇","女","四川","22455436","6","星座系列：双鱼座","10000","0","","bgm真绝了"
"千岁岁呐喵-","保密","河北","1264664163","4","","10000","0","9","她的样子真的很埃及艳后"
"两立的螺旋","保密","江苏","3751439","6","","10000","0","","预测未来，果然是捏他未来战士伊西丝[doge]"
"雷霆一书生","保密","山西","106856296","5","汉化日记","10000","0","","亚！萨！西！"
"365knxi","保密","贵州","2372711","6","","10000","0","","这次是英配撞我的脑内幻想的声线了！[打call]"
"安辣","男","辽宁","271631795","5","","10000","0","","这中配绝了[脱单doge]"
"Wu0o5","女","重庆","2504918","6","","10000","0","","这是少女模还是御姐模捏？看起来是大姐姐但是好像有点矮？[星星眼]"
"夜间出没的痒痒鼠","保密","湖南","170092351","6","洛天依・最美的夜","10000","0","9","草神，草神，草神，每天一遍，坚定意志"
"PCsupper","保密","重庆","43241324","6","","10000","0","","为什么没有邀约啊[热][热][热]"
"沙雕的阿亮","保密","吉林","194016382","6","","10000","0","","cv竟然是守望先锋里的辣个女人？[热词系列_知识增加]"
"未良Q","保密","浙江","28170423","6","","10000","0","","冲了"
"猴子的香蕉520","男","浙江","149186981","6","原神","10000","0","","砍第四抽了不亏,第一个双持武器的战士"
"兰芽归来","男","广东","278326523","6","","10000","0","1","这期的四星真香，没有一个我满命的"
"无影之月","保密","海南","229349","6","","10000","0","","我的回合！抽卡！让一切终结之人，冰狼啊，将你之气息借予我，冻结，比死亡还要宁静，盛极必衰世之常理，神赐予J宿命，不可回避的宿业，如同水低处流一般，夺走全部生命吧，如同时间被冻结般，让我见织一切都停止的世界吧，无人能破坏，甚至不存在欲图破坏之人，让我见识永恒之美的极致，拒绝我之人，只追求绝对之人，多么丑v啊，生命聚集成群蠕动，发出腐臭，衍生数魑魅魍魉，我不允那些，我不理解那些，我所希望一片银白的世界，我所希望的美丽的死之世界，我所希望的一切停止、停止、停止。我发动地形卡摩诃钵特摩地狱！"
