"昵称","性别","IP","UID","等级","装扮","用户权重","获赞数","粉丝团等级","评论"
"百野荬问榧","保密","黑龙江","88093754","6","还有醒着的么","10000","4513","","科普下坎蒂丝的中配和日配cv,中配cv：张琦,主要配音角色：,艾莉丝―――《原神》,申天风―――《九九八十一》,山兔―――《阴阳师・平安物语》第三季(中配版),“我”―――《恋与制作人》,庄晓曼―――《隐形守护者》,V(女性)―――《赛博朋克2077》(玩家主角),鲁鲁―――《布鲁可战队之危客对决》,绒嬷嬷、句芒―――《京剧猫》,唐三(童年)―――《斗罗大陆》,皮皮―――《皮皮特攻队》,小奥―――《思念的温度》,风铃儿―――《风灵玉秀》,秦小路―――《王子碰碰球》,斯卡蒂―――《明日方舟》,辛德拉―――《英雄联盟》,布丽吉塔―――《守望先锋》,妖刀姬―――《永劫无间》,恶灵―――《Apex》"
"柠檬味的桃纸","男","广东","9030736","6","","10000","18703","","坎蒂丝（摇摇头）【像你这样的门外汉......是不可能赢我的。】,斗大的汗珠从荒泷一斗脸颊流下。,荒泷一斗（叹气）【.......就这样结束了吗？】,【老大！】,荒泷一斗猛地扭头，看向观众席。,那里，是久岐忍正在为他加油鼓气。,明明才吵了一架，说再也不理我了才对。,【......你不生气了啊。】,他忽然不怕了。,荒泷一斗（大喊）【我的回合！抽卡！】"
"天空岛的愚者","男","北京","173323339","6","至尊戒","10000","14011","10","坎蒂丝号称赤王后裔，结合她阿如村守护者的身份，可以将其视作【法老】。因为法老就自称为太阳神的儿子，并且自认为是荷鲁斯的化身，荷鲁斯的眼睛很特别，这与坎蒂丝也是一致的，并且她身上也有荷鲁斯之眼的变体首饰。,她的盾牌上刻着象征太阳的圣甲虫，寓意永恒，无畏，牢不可破，文字的意思则是【坚定不屈的胜利】，考虑到这玩意是角色自带的装备，或许是赤王造的神器也说不定，应该存在某些加护。,另外，坎蒂丝的长图立绘上用暗纹写着【被太阳神选中之人】【太阳神之眼】等字样。"
"余璇定理","女","天津","103823407","6","","10000","1239","","坎蒂丝（X）,「诸世界的大冒险家」「很坏很坏的大魔王」「旧蒙德的守护者」「心怀希望的大朋友们的朋友」「提瓦特游览指南作者」「鲸井流手鞠术的宗家」「大名鼎鼎的桑歌玛哈巴依老爷的供货商」「魔女会元老・代号A」「最可爱的可莉的妈妈」艾莉丝女士（）[doge]"
"莱伐子苻","保密","河南","487290976","5","","10000","3542","","村民们常说，坎蒂丝就如同那面被祝福过的盾牌一样，是阿如村最坚实的防线。,但坎蒂丝心中清楚，这面盾牌并无奥妙，只是趁手的武器罢了。,更为重要的，其实是举起盾牌时的决心。"
"艾斯塔Est","保密","山东","36588435","6","","10000","8242","","你们阿如村是人手一把赤沙之杖吗[doge]"
"不开盲盒的食野餮餮","保密","贵州","87710004","5","","10000","1810","","已经开始见到会有很多人配那首bgm。,哦哦哦哦哦哦哦，但我不一样。,我直接――鱼获――》明日香.JPG。[脱单doge]出生小曲-ing"
"名字就叫大梦一场","保密","湖北","312760509","6","","10000","628","","太香了，我是说卡池[doge]"
"天命yue","保密","陕西","297107727","5","","10000","722","","那么坎蒂丝能否打破水系都有钱的定理呢"
"贰式里疾风","男","安徽","93597952","6","","10000","442","","好感动，还有那么多人知道边境的女人，知道传颂之物，你知道找个同好有多难吗[大哭][大哭]"
"你不要叫我做饭啦","男","广西","39642771","6","","10000","1975","6","别人听到的：听取我的战祷！,我听到的：哦哦哦哦哦哦哦哦哦哦哦[doge]"
"游戏茶馆君","女","四川","102308177","6","","10000","5640","","坎蒂丝和戴因啥时候来一场决斗啊，复刻伊西丝打海马就行[脱单doge]"
"笑死改名也中不了奖","保密","浙江","324490668","5","","10000","153","11","安卡可以说是辨识度最高的古埃及标志，被称为“生命钥匙”或“生命十字”，从古埃及王朝初期，即公元前3000多年开始，就已经存在了，属于世界上最古老神秘的护身符之列。,安卡在古埃及是永生的标志。古埃及重要人物经常佩戴安卡作为护身符，比如法老和贵族。另外在神庙里也可以看到，古埃及人供奉的神:不死之神奥西里斯和能让人复活的女神伊西斯经常手持安卡。,埃及学家认为，安卡这种十字标志可以代表水、空气和太阳，在古埃及文化中，这就意味着它能提供和保护生命。,（博物馆的埃及壁画里都可以看到那些埃及神拿着生命之钥的图） 所以这东西不是某些地方的原创哦，而是历史"
"寒炎","男","天津","64954","6","崩坏：星穹铁道","10000","138","","日配是柚木凉香，她配过的一个代表角色是 传颂之物 的女主角 艾露露。,,也许有许多人没看过这个作品(是剧情很棒的系列作品，非常推荐，一代有18+版本)，但艾露露这个角色的主要背景包含如下Tag，,,平时“温柔”，遇事“坚强”的女性，,在故事前期是“村子实际的领导者”，,实际身份为“古代神明的血脉末裔”，,拥有着“上古超科技文明【伟大之父】科技启动的关键道具”,,你说米哈游这个梗狂魔是故意选的她我是完全相信的…毕竟柚木这两年配音工作少了好多…[笑哭],绝对信任的事米哈游的二次元浓度……,,顺带一提 艾露露 还有醋缸属性和生气时候超可怕属性，村子里的老虎神兽都怕她……[翻白眼]"
"阿基正在路上","男","湖北","89582938","5","","10000","37","","村民们常说，坎蒂丝就如同那面被祝福过的盾牌一样，是阿如村最坚实的防线。,但坎蒂丝心中清楚，这面盾牌并无奥妙，只是趁手的武器罢了。,更为重要的，其实是举起盾牌时的决心。"
"NoriAye_","保密","北京","11268223","6","明日方舟-愚夜密函","10000","301","","非常希望出一个新功能：允许玩家在游玩大世界的时候可以给每个角色自由设置不用语种的语音，剧情不强求分语种，起码大世界能自由设置就好了，因为很多玩家对角色的四个语音的主观喜好也不同，如果平时游玩的时候能听到自己喜欢的语音，体验会更好，真的很需要！"
"XY大甘蔗","女","上海","44243","6","","10000","376","","听我说，我的！"
"张佳理筚篥管子","男","北京","393502912","6","","10000","299","","看到大家喜欢这段音乐我就放心了"
"Evelet_泠雨","女","福建","11822358","6","","10000","50","10","坎蒂丝雷泽（凑一队）=风灵玉秀"
"一只天青色","男","甘肃","18305330","6","","10000","65","9","须弥有卖盾与矛者，誉之曰：“ 吾盾之坚 ， 物莫能陷也 。”又誉其矛曰：“ 吾矛之利 ， 于物无不陷也 。”远道而来的旅行者曰：“以子之矛，陷子之盾，何如 ？”"
"贰式里疾风","男","安徽","93597952","6","","10000","442","","好感动，还有那么多人知道边境的女人，知道传颂之物，你知道找个同好有多难吗[大哭][大哭]"
"龙门老近卫","保密","广东","244273032","5","领风者","10000","440","10","我的回合，抽卡！(双重含义)[doge]"
"一个路过的正鲸人","保密","江西","1380514940","5","崩坏：星穹铁道","10000","306","12","有谁是和我一样12点在疯狂刷新动态[doge]"
"EmmaStan","女","云南","4897834","6","","10000","659","","英配完全就是香水广告啊家人们,我来配个广告词[doge]有内味你就给我个赞[妙啊],,神秘而热烈的荒漠秘境,咖啡与乳脂 烟熏草与白麝香,,极致的诱惑于危险并存,在无尽黑夜里绽放沸腾,,Hoyo Beauty 全新女士淡香水 CANDACE,9月28日 全国上市[OK]"
"布尔顿","保密","黑龙江","487209859","5","崩坏：星穹铁道","10000","698","11","卧槽"
"Kii崽","女","未知","76854555","5","","10000","354","","是了是了~『说最温柔的话，甩最牛逼的枪~哦！还有盾！』[tv_偷笑]"
"空明喵喵","女","未知","11421019","6","原神","10000","103","","嘿嘿，坎蒂丝，我的坎蒂丝"
"精木眼里没放盐","保密","未知","49864900","6","工作细胞","10000","79","","0:22 那里 不知道为啥 感觉这张脸特别像那个 埃及猫? ?"
"一颗好吃的土豆蛋子","保密","未知","13099461","6","#EveOneCat","10000","72","","注意看，这是麦外敷！！"
"假夏宇","保密","辽宁","15373488","5","","10000","108","","钟离变全属性计划开始实施[doge][doge][doge],好耶[热词系列_好耶]"
"萌新二次方","男","上海","125776535","6","","10000","68","","[doge]姐姐的盾不错，家里差个饭桌，懂我意思吧"
"万事都可明觉","男","浙江","361552084","5","","10000","65","","这个pv感觉比隔壁赛诺看得让人更有抽的欲望这是可以说的么"
"天天开心小开","保密","江苏","294188009","5","","10000","49","","槽卧！"
"今天给长月寄刀片了嘛","男","广西","10967898","6","罗小黑战记","10000","58","","在？你为什么按照时间顺序来找冰箱评论[脱单doge]"
"派大星","保密","湖南","1195383561","5","","10000","38","","很多人觉得坎蒂丝太漂亮了，但坎蒂丝不会喜欢我的老婆是不会喜欢其他男人说他好看的"
"没有肚脐真君","保密","山东","8574127","6","","10000","37","","穿着凉鞋在沙漠里脚脚不会脏吗？来放我嘴里，我给你洗洗。（节约用水嘛[doge]）[脱单doge]"
"维寒迪之春","男","广东","399889774","5","原神","10000","40","14","都是从冰箱来的是吧[脱单doge]"
"二号寄","保密","福建","1896212808","4","","10000","36","","感觉四星的角色演示要比赛诺的好很多[原神_哼]"
"小胡桃呦","保密","吉林","35427105","6","明日方舟","10000","68","","给配音界一点小小的冰箱震撼[脱单doge]"
"Great影帝","男","广西","400983277","5","刺客伍六七","10000","30","","苏醒吧，冰箱的主人！[脱单doge]"
"小表弟扶他皮","保密","湖北","171248669","6","","10000","29","","沙漠太热了，我要一台冰箱，不过分吧。[傲娇]"
"XY大甘蔗","女","上海","44243","6","","10000","376","","听我说，我的！"
"Ridneo","保密","上海","39313797","6","","10000","38","","建模比立绘还好看啊啊啊啊[保卫萝卜_哭哭]"
"风拂杨柳人倚楼","保密","湖南","198391816","5","","10000","27","","英配才有那种战斗美女的味道"
"HongLongLonga","男","河北","1809294226","4","","10000","36","","我就是回来找冰箱评论的[脱单doge]"
"Michi_滴","保密","广西","344982194","5","碧蓝之海","10000","31","","其实我觉得米哈游可以把四国语言的CV老师的名字都打在简介里[傲娇]英配和韩配老师不配拥有姓名吗"
"春花兰","男","河北","2753795","6","","10000","25","","老婆，我很急"
"绫罗绸缎T花开院","保密","河北","490722640","5","","10000","122","10","别往下翻了，十连双黄的旅行者[脱单doge][脱单doge][脱单doge]"
"HOLO_A","保密","韩国","2019272284","6","","10000","47","","冰箱时代特意回来重看[脱单doge]"
"枫丹第十三商会副会长","保密","中国台湾","43280438","5","","10000","27","","[捂眼]我就知道有人回来看冰箱"
"艾伦・耶格尔","男","吉林","104658","6","EveOneCat2","10000","23","6","我有异瞳,我胸里能拔出刀来,我是电子魅魔。"
"风拂杨柳人倚楼","保密","湖南","198391816","5","","10000","23","","看了隔壁赛诺角色演示，坎蒂丝才是真五星吧"
"执樽","保密","湖南","660000612","5","","10000","24","","感觉赛诺才是陪跑四星[脱单doge]"
"春山霭霭","保密","江苏","4419869","6","","10000","35","","看完赛诺的，回来看坎姐，感觉建模和演示都更五星[辣眼睛]"
"张佳理筚篥管子","男","北京","393502912","6","","10000","299","","看到大家喜欢这段音乐我就放心了"
"清欢b","男","河南","171237111","5","","10000","26","","冰箱[脱单doge]今晚想要我的聚合物吗？"
"27G_K27","女","四川","12059897","6","","10000","21","","这不是爆杀赛诺的角色演示几条街吗"
"众神的祈祷FIEND","男","吉林","53811046","6","物述有栖","10000","25","","坎蒂丝：哎呀哪来的壮小伙（指爷）"
"冷冽谷的天空","男","福建","252162392","5","","10000","31","","无法直视坎蒂丝了[笑哭]不会哪一天真觉醒冰箱属性吧[嗑瓜子]"
"夜如渊","男","安徽","10775628","6","","10000","21","","坎蒂丝，没想到你是这样的冰箱[doge]"
"贝塔桑Beta","保密","湖南","15322235","6","明日方舟音律系列","10000","23","","BV13M4y1Z7jf"
"艾卓尼鲁布观察员","保密","美国","4168394","6","","10000","54","","为了保护珍贵之物，只有盾是不够的，还需要聚合物和部件"
"海遥01","女","安徽","458220287","5","","10000","21","","从迪希雅角色演示过来重温的，老婆[喜欢]"
"-CANDACE","保密","广东","425536531","5","","10000","78","","蓝紫的渐变色搭上金色的装饰显得十分的华贵，而一抹白色加入产生的色彩碰撞更是使华贵中透露出其主人高洁且充满活力的气息，更值得一提的是与温室的花朵不同，成女体型的建模搭上健康小麦色的肌肤突现出其经常运动并且肉眼可见的肚脐处没有一丝赘肉，但个人感觉美中不足的是没有勾勒出若隐若现的马甲线做衬托，认真且冷漠的表情配上异色的瞳孔更是俘获了我这颗二刺猿的心，这异域风情让我顿时感悟“人活着就是为了坎蒂丝”"
"床底王叔叔","保密","湖南","286929347","5","格兰芬多","10000","25","","原子之心，冰箱[滑稽]"
"阿晴下次踩我用力点","男","江苏","503125314","5","","10000","21","","我冰箱动了，我不玩了[Cat2_FallOut!?]"
"申玉菲的脑洞","女","陕西","2150069","6","","10000","21","","所以是台词限制了发挥，尬的都是文本不是配音编剧全责[doge]"
"热血超新星","男","天津","3316084","6","名侦探柯南","10000","27","","原子之心冰箱，原神坎蒂丝都是张琦，都是原[滑稽]"
"wszls12345","男","安徽","321217735","5","","10000","27","","隔壁赛诺片场的还没你的演示好[脱单doge][脱单doge]"
"漓风LF","女","湖北","288964734","6","","10000","30","","感觉坎蒂丝和赛诺的英配都好好听啊[保卫萝卜_哭哭][保卫萝卜_哭哭]"
"小紫的小号","女","江苏","14829832","6","","10000","44","29","坎蒂丝的异瞳，爱了爱了，快点到3.1吧，等不下去了！[tv_亲亲][tv_亲亲]"
"Evelet_泠雨","女","福建","11822358","6","","10000","50","10","坎蒂丝雷泽（凑一队）=风灵玉秀"
"阿珉","女","北京","2037977","6","","10000","20","","这是什么五星建模的四星！！！姐姐快来我壶里！！！"
"利刻暴富","女","河北","261089268","6","","10000","123","","太牛了，中文cv和旅行者说话时妩媚多情，战斗时又充满坚定和力量感，很有韧性的声音，音乐依旧稳定发挥。我本来对坎蒂丝无感但是这个演示让我坠入爱河了[脱单doge][脱单doge][脱单doge]"
"sailko_5","保密","河北","2011389118","4","","10000","20","","我真的无法想象坎蒂丝的cv配过那个冰箱"
"Irin-Vassago","保密","四川","157821209","6","","10000","19","","想到一句话，如果我手里没有枪，我就无法保护你[doge]，那我一直握着枪，那就[doge]"
"Ak12uk1kanna","男","北京","38933349","5","","10000","23","","彦祖，为何打开时间排序"
"小夜爱咕咕","女","江西","4354851","6","阴阳师・平安物语","10000","55","","坎蒂丝就是温柔人设啊[辣眼睛]前瞻特别节目 22:01分开始看不谢，划重点“是一位说话温声细语 散发着温和的治愈光环的成熟女性” “温柔如水的坎蒂丝在面对魔兽的时候会激发出凌厉、果敢的气质” 所以一些玩家就不要拿着自己的印象说坎蒂丝的人设是高冷，然后听到配音演员温柔的声音就开始指责性格都变了[OK]"
"宵宫最美的烟花","保密","上海","49679217","5","至尊戒","10000","33","","骚气的沙漠冰箱[微笑]"
"随云p","女","浙江","332590641","5","","10000","18","","好想你 我在床上哭了9个小时  崩溃了1996次  撞了903次  墙划了8次手臂 幻觉出现三次 幻听出现九次  扇了自己16个巴掌  出现濒死感一次  刚才昏过去了  现在才醒来  看到外面天都黑了  我顿时又崩溃了  因为我怎么想都想不明白  你这么可爱  还这么能干 究竟是怎么做到的 好想你啊 纳西妲 你是我心里永远的宝"
"笑死改名也中不了奖","保密","浙江","324490668","5","","10000","153","11","安卡可以说是辨识度最高的古埃及标志，被称为“生命钥匙”或“生命十字”，从古埃及王朝初期，即公元前3000多年开始，就已经存在了，属于世界上最古老神秘的护身符之列。,安卡在古埃及是永生的标志。古埃及重要人物经常佩戴安卡作为护身符，比如法老和贵族。另外在神庙里也可以看到，古埃及人供奉的神:不死之神奥西里斯和能让人复活的女神伊西斯经常手持安卡。,埃及学家认为，安卡这种十字标志可以代表水、空气和太阳，在古埃及文化中，这就意味着它能提供和保护生命。,（博物馆的埃及壁画里都可以看到那些埃及神拿着生命之钥的图） 所以这东西不是某些地方的原创哦，而是历史"
"本-间-芽-衣-子","男","湖南","1454137160","5","","10000","18","6","岩王帝君正在吸取水元素力[doge]"
"化鲸66","男","陕西","40812357","6","至尊戒","10000","18","","这下不得不练坎蒂丝了[doge]"
"江枫似火l","保密","黑龙江","585961569","5","","10000","17","","比赛诺好看[原神_喝茶]"
"{风Risingsun","男","黑龙江","1772424419","5","","10000","17","","一开始以为是个女战神没想到是个优雅的贵族[doge]"
"卡守76","男","广西","271288933","6","","10000","17","","五星颜值"
"成分复杂的我呀","保密","河北","650502706","5","至尊戒","10000","17","","英配最封神的一次"
"艾赛克丝","保密","湖北","44991314","5","","10000","20","","米哈呦我真的很需要四星定规[大哭]"
"一只天青色","男","甘肃","18305330","6","","10000","65","9","须弥有卖盾与矛者，誉之曰：“ 吾盾之坚 ， 物莫能陷也 。”又誉其矛曰：“ 吾矛之利 ， 于物无不陷也 。”远道而来的旅行者曰：“以子之矛，陷子之盾，何如 ？”"
"铭茗杰儿","保密","广东","547394270","4","","10000","60","","“你好呀，远道而来的旅行者”-20抽（本来是想攒着的[大哭]）"
"岭上茶花方旖旎","保密","河北","1611513627","5","公主连结佩可莉姆","10000","16","","这才是5星演示吧[热]"
"讲笑话不能闷-","保密","湖南","33126335","6","","10000","16","","英配太绝了！是我想象中坎蒂丝的感觉[星星眼]"
"派蒙白飞飞","保密","江西","700450726","5","","10000","82","","妮露:一个热爱跳舞的小姑娘――五星,坎蒂丝:手握枪和盾的战士――四星,[脱单doge][脱单doge][脱单doge]"
"JeremyVolkswagen","男","广东","325030192","5","","10000","17","","菊花花和张琦老师的攀比之心是吧[崩坏3・光辉矢愿_惊][崩坏3・光辉矢愿_惊]"
"WA腐英的橡皮","男","上海","171404908","6","","10000","29","","千年之匙，千年眼，千年首饰，好强大的决斗者（"
"猫行道i","保密","广东","57206420","5","","10000","17","","[脱单doge]冰箱下死手，迪西亚救下小喽。坎蒂丝霸气侧漏！"
"小幽灵高斯特","保密","山东","1037426387","4","","10000","17","","刚看完烧气十足的电冰箱[辣眼睛]好怪，再看一眼"
"全能的小白-MicroLove","男","浙江","100520995","6","","10000","15","","开头用电钢琴，中间还有Moombahton，BGM属实让我越来越想不到了"
"惜九歌","保密","广东","40090172","5","","10000","14","","什么时候出邀约，我想和坎蒂丝约会[脱单doge]"
"月耀日和紫苑草","女","未知","480838443","5","","10000","10","","我发布了一篇笔记，快来看看吧~"
"XGT_T","女","四川","205012556","5","","10000","14","","感觉坎蒂丝姐姐拿那把鸟头枪开大会有魔法少女的气质吧[脱单doge]"
"猫猫小黑","女","陕西","22589382","6","罗小黑战记","10000","14","10","忘了原来的声音了，过来再听一遍[笑哭]"
"筱OP","男","山东","2855329","5","","10000","14","2","反差很大  我喜欢[doge][doge]"
"Toscaf","男","浙江","413010145","5","","10000","14","","此时一位路过的阿贝多握紧了手里的辰砂[doge]"
"か就点进去","女","四川","285815216","5","刺客伍六七","10000","14","","你怎么拿着赛诺的武器呀[脱单doge][脱单doge][脱单doge]"
"饼将军牌来了","保密","湖北","143354928","5","","10000","15","","我真的爱死英配的成熟游刃有余的大姐姐风格了[大哭][大哭][嘟嘟]"
"极乐鸟LA","保密","河北","146892921","6","EveOneCat2","10000","13","","至前有了强尼（一斗cv）和杰克（钟离cv）现在2077的女v配音也来了，男v什么时候也来？[Cat2_OddFriend]"
"雏D月","男","江苏","135658","6","","10000","13","","看完魅魔冰箱后再来听一遍正经的"
"Lee开始恰饭","保密","广东","26200523","6","","10000","15","","红色双开门冰箱！！！！"
"最爱罢嬷缌","保密","河北","454060781","6","日南葵","10000","12","7","限制发挥了"
"只因派蒙","保密","浙江","341961130","4","崩坏：星穹铁道","10000","13","","为了守护珍贵之物，我愿意献上自己的生命，天火，出鞘（不是）"
"寒炎","男","天津","64954","6","崩坏：星穹铁道","10000","138","","日配是柚木凉香，她配过的一个代表角色是 传颂之物 的女主角 艾露露。,,也许有许多人没看过这个作品(是剧情很棒的系列作品，非常推荐，一代有18+版本)，但艾露露这个角色的主要背景包含如下Tag，,,平时“温柔”，遇事“坚强”的女性，,在故事前期是“村子实际的领导者”，,实际身份为“古代神明的血脉末裔”，,拥有着“上古超科技文明【伟大之父】科技启动的关键道具”,,你说米哈游这个梗狂魔是故意选的她我是完全相信的…毕竟柚木这两年配音工作少了好多…[笑哭],绝对信任的事米哈游的二次元浓度……,,顺带一提 艾露露 还有醋缸属性和生气时候超可怕属性，村子里的老虎神兽都怕她……[翻白眼]"
"以下是我昵称","保密","福建","7545468","6","","10000","14","","日配好听是好听，但感觉和角色氛围脸型不太搭啊。。。就好像明明是御姐，开口却是萝莉音的感觉[捂脸][喜极而泣]"
"风拂杨柳人倚楼","保密","湖南","198391816","5","","10000","13","","英配又又又又杀疯了"
"折村新一","男","四川","62463132","6","","10000","11","","牛逼啊v"
"月寻鹤归","女","浙江","164598760","6","","10000","11","","我超，这次的音乐也杀疯了[星星眼][星星眼][星星眼]（但是我一定要说英配好绝我超[打call][打call][打call][脱单doge][脱单doge][脱单doge]"
"菜嘘","保密","广东","322019117","6","","10000","12","","彦，又在看时间排序喔[妙啊]"
"nanmzhao","保密","辽宁","1612890039","5","","10000","11","","[脱单doge]重温冰箱姐"
"影行高山","女","上海","1720134735","5","","10000","11","","她真的好好看啊，是令我疑惑为什么是四星的好看。"
"趑|-r崎狂三","女","海南","37618251","6","约战・狂三","10000","28","","想要，但不想抽赛诺怎么办……在线等"
"济时小哥哥","男","贵州","14548408","6","","10000","42","","只有英配配出了柔美和坚毅并存的坎蒂丝，其他的好像只有柔美[藏狐]"
"Amadeus-11","保密","湖南","1790298099","4","","10000","12","","感觉比赛诺的pv整得好"
"光小元","男","湖北","1390823918","4","","10000","31","","我赛诺呢[大哭]"
"完全气化","男","广西","192218853","6","","10000","11","","我好爱中配，我心目中的大姐姐就是这样的！我好爱！姐姐！呜呜呜[喜欢]"
"咱改名免费","保密","上海","1288126512","2","","10000","11","","这不是五星我不理解，太喜欢了，异色瞳戳死我了"
"秋伶尘","保密","山东","5536044","6","","10000","21","","他们都在等赛诺和妮露，只有我，只有我！在等你！从你出现的那一刻，你前面的五星，我一个都没抽！"
"使徒Redscorch","保密","黑龙江","517010775","5","","10000","15","","有一件事你们发型没有，目前为止没遇到过一个纳塔的NPC！纳塔是出什么事了吗？"
"叮叮猫不是猫_","保密","北京","24074036","6","","10000","11","","呜呜坎蒂丝和冰箱，这反差好大，难顶[捂眼][捂眼][捂眼]"
"原始人的脐洞","保密","湖南","291993043","6","","10000","12","","为什么坎蒂丝不是五星，赛诺是五星啊[大哭][大哭][大哭]，坎蒂丝这建模，这脸，这人设简直太戳人了。"
"帕瓦是谁啊","保密","英国","86723123","6","","10000","11","","来吧宝贝～"
"伪宅的夏天","男","湖北","8552842","6","","10000","16","","你们都在关注角色和配音，难道就只有我一个注意到了BGM吗？BGM也太好听了吧，埃及味十足。"
