"昵称","性别","IP","UID","等级","装扮","用户权重","获赞数","粉丝团等级","评论"
"温暖寒冰-霜冰","保密","广东","296894221","6","","10000","13636","","请大家在入场前把身上的圣遗物套装更换为流浪大地的乐团，以示对各位的尊重"
"怪我咯829","保密","上海","3962381","6","至尊戒","10000","1224","11","在音乐会网页活动拉到最后有一排特别鸣谢！,爱尔兰著名作曲家、指挥家、VGL乐队指挥：Eimear Noone,2014年，Eimear为经典网络游戏《魔兽世界》资料篇《德拉诺之王》作曲，获得,2014年好莱坞音乐传媒奖最佳游戏配乐，并获得2014年5大年度游戏音乐奖提名。曾,指挥费城交响乐团、达拉斯交响乐团、皇家爱乐乐团、悉尼交响乐团、国家交响乐团等,著名乐团。,这位女指挥家也在鸣谢名单里，这份名单还有很多大佬，期待了！"
"王six水","男","山东","543426701","5","","10000","905","","《原神》及HOYO-MiX将联合多位音乐家，共同开启又一段美妙的音乐之旅。延续着往年的余音，那些在提瓦特大陆中回荡的动人旋律即将再次回响。,,音乐会将于10月2日12:00开始，旅行者可前往《原神》官方直播间收看。[脱单doge]"
"著名拔刀演员雷电师傅","保密","吉林","428052020","5","","10000","6041","","以前去听音乐会，觉得音乐虽然好听但是无法理解，现在有了原神的音乐会，每一个音符我都能理解其中的感情[微笑]"
"huyou-mix","保密","河南","336165937","5","","10000","487","11","海岛live版！！！[热词表情_哎呦不错哦][热词系列_好耶],还想要：,激流逐浪live版,难逃之阵live版,渊下宫战斗曲live版（这个好歹有二创了，前两个根本没二创，惨）,层岩战斗曲live版,层岩地上国风曲live版,女士战斗曲live版！！,稻妻鹤观、清籁岛等组曲live版,等等,这次肯定没须弥，就先不提须弥了"
"在Ngranek看雕像","保密","福建","518162276","5","","10000","1874","","大家注意！！！,10月二日中午十二点！十月二日十二点！十月二日十二点！,想看直播的提前设置个提醒，规划好日程安排哦,[星星眼][星星眼][星星眼][星星眼][星星眼]"
"西蒙Sivan","男","安徽","133417256","6","","10000","2204","8","优雅永不过时[脱单doge][脱单doge]"
"KKOMDA","女","安徽","1740827542","6","","10000","5551","","海岛！"
"而他说人民万岁","保密","江苏","22533509","6","","10000","1430","","手中的蜜雪冰城柠檬水突然就变成了红酒[doge]"
"拿弓子的波塞东","保密","上海","504090336","6","","10000","465","","想一起看么？"
"可莉要吃可丽饼","男","海南","32904065","6","雪未来","10000","535","9","手里的炸鸡变成了牛排，手中的可乐变成了红酒，身上的格子衬衫变成了燕尾服[doge],总结：上流[doge]"
"阿玖爱做梦","保密","浙江","37896174","6","碧蓝之海","10000","112","","我曾见过蒙德的风精灵叫乌云散尽，云破天开。,我曾见过龙脊雪山上冰封万里和银白色的哀伤。,我曾见过风龙废墟东风之龙的无尽怒火与憎恶。,我曾见过璃月的岩王无边杀伐之相，岩雨镇魔。,我曾见过层岩巨渊下纵深千里和漆黑色的怒火。,我曾见过伏龙南天无目岩龙的刹那觉醒和意志。,我曾见过稻妻的御建鸣神无想一刀，可裂山河。,我曾见过清赖鹤观中迷雾漫天和深紫色的妒怨。,我曾见过神樱大社九尾灵狐的大道显真和神策。,现在正漫步在林海，疾行于荒漠，只为匡扶须弥。,不畏前行的黑夜，且待重逢的夕阳和相遇的黎明。"
"圣剑灭杀皇","保密","广西","214642204","6","公主连结凯露","10000","404","","我在游戏里充钱不叫盲目氪金，那叫购买观看外国音乐会的演出门票！"
"UnLaUgh","保密","湖南","305584912","5","","10000","481","","又到了一年一度觉得自己钱没白花的现场"
"时间之类","保密","江西","86123717","6","","10000","187","","手中的奶茶突然变成了红茶[doge]"
"绫华的犬太郎","保密","上海","1166775682","4","","10000","161","","回忆，是迷迭香的花语(doge)[脱单doge]"
"堕落之太阳羽翼","保密","中国香港","52833230","5","","10000","35","","有兰那罗们的大合唱完整版吗"
"是七宝捏","女","四川","391619353","5","","10000","81","6","在这里摆一只小猫咪 大家可以拍拍它,　／l、,（° 。 ７, 　l、 ~c,　じしf_, )ノ"
"小紫的小号","女","江苏","14829832","6","","10000","81","29","好耶"
"迷黎君哟","保密","天津","1070258714","5","","10000","54","","浅发一下：官B可以互相联机[打call]"
"堕落之太阳羽翼","保密","中国香港","52833230","5","","10000","35","","有兰那罗们的大合唱完整版吗"
"烟雨绮丽_","女","河南","23318919","6","国民老公带回家","10000","23","","不错 3.1前瞻刚好设在了我要死线交作业的那天 10月2号也刚好是我作业截止后的一天 看不了前瞻的痛 终于可以弥补在音乐会啦[大哭]"
"白彦少佐","保密","广东","59496061","6","登乐V计划","10000","23","","太棒了，是音乐会，好耶！,云堇、申鹤、万宝、神子、芭芭拉还有辛焱的音乐服装好好看啊！"
"萍","男","江苏","401633735","6","","10000","19","","排面[doge]"
"我是Dewey啦","男","黑龙江","471345968","5","","10000","14","11","https://b23.tv/BV1E44y1t7Kn ,等不及的小伙伴可以先欣赏去年的音乐会，解解馋[大笑]"
"X_inla","保密","广东","30317754","6","卡拉彼丘","10000","19","","你还记得去年的线下音乐会吗[阴险][阴险]"
"rhythmVanquisher","男","海南","629999307","5","","10000","13","8","好耶，所以说快点端上来罢，我已经等不急力（喜）"
"花生粘豆包","保密","天津","625072661","5","","10000","139","","厉害[热词系列_知识增加]"
"Sherlock陌","男","四川","45065363","6","","10000","12","11","这段旅途是由我们开始的故事，也将由我们走到结束，里面的每个音符都寄托着一段过往，你说我说的对不对，我的好伊甸"
"尤娅娅","女","湖北","438944712","5","初音未来13周年","10000","12","","一定要有大梦的曲调呀[初音未来_加油]"
"是七宝捏","女","四川","391619353","5","","10000","81","6","在这里摆一只小猫咪 大家可以拍拍它,　／l、,（° 。 ７, 　l、 ~c,　じしf_, )ノ"
"小紫的小号","女","江苏","14829832","6","","10000","81","29","好耶"
"无心插柳柳成荫一","保密","浙江","2040144869","4","","10000","11","9","在你面前的是，原神音乐会赞助者，可控核聚变投资人，脑机接口的推动者（荧／空）[doge]"
"NAT酱","保密","北京","12609154","6","","10000","11","","既然是线上音乐会，把它搬进游戏里吧，每个人带着自己的角色加入一个大联机"
"_Lumine_","保密","江苏","1549646343","4","","10000","92","","卧槽"
"迷黎君哟","保密","天津","1070258714","5","","10000","54","","浅发一下：官B可以互相联机[打call]"
"科瑞林","保密","河南","33474027","6","梦100","10000","13","","最低播放[tv_笑哭]，不过这个视频内容也确实高不了"
"漪液清-逸晔郅磬","保密","四川","696536561","4","","10000","48","","！！！槽卧"
"生名蛋字","保密","湖南","671171632","5","","10000","49","","给这个播放最低的视频贡献点"
"stkkaa","男","四川","441497216","5","","10000","10","","请一定要有层岩巨渊地表的曲子，哪首无所谓但一定要有马头琴！！！"
"横冲直撞小青鸾","保密","浙江","404708115","5","","10000","10","","哦，我的老天，看我发现了什么？如此高雅，一定要开一瓶好酒，穿一身礼服，才配得上这份优雅[脱单doge]"
"昙山_Dre","男","北京","40059647","6","拉文克劳","10000","32","","我多希望我10月2日下午两点上课，这样我还能上课摸鱼听音乐会，但我不能，因为我是授课老师啊喂！（怒摔）"
"小紫的小号","女","江苏","14829832","6","","10000","12","29","是时候再次穿上西装倒上红酒了,[小A和小B_躺][小A和小B_躺][小A和小B_躺]"
"芽芽牙kk","保密","辽宁","44760019","6","Fulgur头像挂件","10000","32","","是时候拿出珍藏的八二年可乐了[脱单doge]"
"@木の下","男","湖南","2051887468","5","","10000","43","","原神最低播放视频"
"落木乱","保密","河北","385442800","3","","10000","32","","无名的王者，为其他视频守护着播放量倒一的宝座"
"Daydream_Warrior","女","安徽","2503105","6","卡拉彼丘","10000","9","7","我一看，特别鸣谢第一个就是鹭巢诗郎，又公款追星是吧"
"盖浇饭厉害吧","男","湖北","174597561","6","星座系列：天蝎座","10000","9","","手里的肯德基联动套餐和必胜客比萨变成了牛排，喜茶变成了红酒，得物买的鞋变成了皮鞋，衣服变成了燕尾服。,上流！"
"梦游月","男","广东","92912408","6","早稻叽收藏集头像挂件","10000","9","11","好耶，还有音乐会，新耳机没白买[原神_哼哼]"
"麻瓜直视爷","男","广东","87228532","6","","10000","31","","请各位股东届时穿好西装、短裤、拖鞋，带着红酒杯和葡萄汁一起观看[脱单doge]"
"Hoshino_lchika","保密","四川","517720526","5","电子喵","10000","9","","这可是我一个一个一个的大小月卡换来的啊（悲[原神_哇]"
"沧海唔姆","男","江西","22366310","6","","10000","9","","一眼以为是发音乐会了，点进来还是预告[保卫萝卜_哭哭]"
"aaaaaaaamy_wei","保密","马来西亚","691700849","5","","10000","21","","中午12点？？你让我一社畜怎么看直播？？？我看看是星期几……哦是星期天啊，那没事了[doge][doge]"
"某条不透露名姓的咸鱼","女","福建","23198929","5","三周年恋曲","10000","24","","手里的可乐突然变成了香槟[脱单doge]"
"一ge小白","男","北京","37477682","6","","10000","9","","要是有线下的就好了，上次在保利听了一个有六首曲子的不够过瘾，什么时候线下来一场全是原神的音乐会[大哭]"
"我叫尹丶樱","保密","天津","346361896","4","三周年恋曲","10000","26","","你也是来看最低播放的！？"
"凌语小浩","男","广东","399140089","5","","10000","26","","欢迎大家来b服群玩呀,群号：1029388901,不会写广告只能蹭原宝的视频和动态了诶嘿~,[脱单doge][脱单doge][脱单doge],（最好来点活跃的人[doge]）"
"焰天-","男","广西","505049938","5","","10000","29","","寻人启事,QQ曾用名，帅气、开朗的龙哥，喵☆恋，一起待过的群，原神b服聊天群（几个月前突然被封了，一点消息都没有）他是管理员。最后一次看到他的账号，57级以上，胡桃头像，优练度特别高。,麻烦大家帮我顶一下，球球了[酸了]"
"快乐大巴每一天","男","四川","396929486","5","公主连结可可萝","10000","10","","最低播放打卡"
"别想投胎嗷","男","江苏","81563953","6","三周年恋曲","10000","10","11","[崩坏3_特效][崩坏3_唢呐][崩坏3_琵琶][崩坏3_二胡][崩坏3_笛子][崩坏3_镲]"
"Liyue-凤尘","保密","江苏","1291645644","5","","10000","23","","急急急，我是急急国王，快出完整版，我已经等不及力（喜）"
"究极DD天羽","男","上海","7555765","6","星座系列：水瓶座","10000","8","","淦！原宝你怎么改中午了，白天上班啊QAQ[大哭][大哭][大哭]"
"KuinTterZxioto","保密","河北","433716775","5","","10000","8","","我要听现场版的女士周本音乐啊！！！！！[大哭][大哭][大哭]"
"今天出门突然-_-","保密","广东","62434764","6","","10000","8","9","中午12点，看来只能拿我点外卖的可乐充当一下红酒了[doge]"
"独留丨清风醉","保密","广东","100479178","5","公主连结凯露","10000","8","","每次一出新视频，日常三连[doge]"
"虾推","男","安徽","340471314","6","崩坏：星穹铁道","10000","8","","换成芭芭拉，带乐团套，拿流浪乐章，我直接化身流浪大地乐团主唱[脱单doge]"
"找个地方睡觉QWQ","男","江西","470620357","5","","10000","8","","把你们的音乐做成音游吧，求求了(òó)"
"osjfl","男","广东","351968222","6","","10000","10","11","手里的杯子突然变成了高脚杯"
"鹫尾鹦鹦","保密","四川","269789523","5","","10000","10","","噢噢来了！期待[热词系列_好耶]"
"cccc_17","男","黑龙江","502203908","5","原神","10000","7","","这次应该就不会有公子的曲子了吧[难过]"
"好像无聊了","男","广东","446851369","5","","10000","7","","优雅，实在是太优雅了！身上的衣服突然变成了燕尾服，手中的矿泉水瓶突然变成了内含红酒的高脚杯！[热词系列_优雅]"
"柚子画圈圈_","女","浙江","24629379","6","粉妆玉琢・头像框","10000","86","","新晋最低播放视频"
"樱龙三觉手工代肝","男","山东","660664038","5","","10000","10","4","去年线上音乐会给的啥奖励来着[脱单doge][脱单doge]"
"LAPoter","男","河北","23646084","6","良辰美景・不问天","10000","6","","明天中午12点，各位旅行者记得穿好燕尾服带瓶红酒入座[原神_G嘿]"
"玄剑子","男","上海","29403588","6","hanser","10000","6","","线上音乐会网页活动有30原石领[脱单doge],米游社→官方资讯-全部→线上音乐盒网页活动→点击参与活动→下滑分享票面30原石到手"
"兰兰","男","福建","26806749","5","","10000","6","","一听到海岛，皇女秘境战斗曲――《仲夏夜绮思》应该稳了[原神_G嘿][原神_G嘿]"
"空山的风","保密","天津","85431590","5","崩坏：星穹铁道","10000","6","","优雅，实在是太优雅了[脱单doge]"
"-ludulge-","男","福建","436996031","5","","10000","6","","可以在生日当天看到这个真是太好了捏[鼓掌][鼓掌]感谢mihomo送来的生日礼物~"
"飞光历历目","保密","山西","6160419","6","珈乐Carol","10000","6","","又到了一年两度氪张大月卡的环节"
"海鱼QAQ二号","男","湖北","7488260","6","崩坏：星穹铁道","10000","6","","大家注意，就这么走的话可就亏了哦～（）"
"勋子今天吃饭了吗","女","江苏","1705632906","4","","10000","6","","燕尾服派上用场了啊[微笑]"
"w文浩Evans","男","广东","94518801","6","","10000","6","","好耶！10月2日刚好是我生日[崩坏3・光辉矢愿_比心][崩坏3・光辉矢愿_彩虹水枪]"
"爱瑞巴蒂66","保密","天津","200328700","5","领风者","10000","6","","还在吃华莱士的我瞬间变装[doge]"
"左九阳","男","天津","175607653","5","12周年夏日狂欢","10000","5","","太好了，是中午，我们学校晚上网贼烂[酸了]"
"猫派popちゃん","女","上海","2029662804","5","","10000","5","","我记得上次的音乐会还在上次"
"坐享祈乘","女","山东","86849567","5","","10000","5","","优雅，永不过时"
"KiriHaram_Oltra","保密","江苏","350713501","5","","10000","7","","我知道你很急，但是，听我说，让我先急"
"lg100只枕梦溪","男","北京","1687353958","5","","10000","6","9","这饼也太多了，比奏大家的煎饼还多[热词系列_知识增加]"
"百草沐蓉","男","辽宁","508651352","5","","10000","6","11","好耶！！！！[保卫萝卜_哇][原神_G嘿]"
"殇隐璃","男","四川","351213491","5","hanser","10000","5","9","什么叫做排面？哦，这么有排面的事儿，已经好几次了？那没事儿了。[脱单doge]"
"神户砂糖盐","保密","贵州","98994372","5","","10000","4","","好耶！明天音乐会[打call][打call]"
"秋梦盈盈","保密","广西","1777188743","5","刀说异数","10000","4","","赏乐的价格也不菲，看来要细水长流[吃瓜]加个鸡腿"
"迟迟长夜m","女","浙江","14617397","5","","10000","4","","等等，音乐会这个时间，这算是生日礼物嘛[惊喜][惊喜][惊喜]"
"天小羽o","保密","河南","506567426","5","","10000","4","","好耶"
"三十三山川","保密","广西","20752764","5","","10000","4","","优雅的迪卢克已换上沉沦之心套装！！！"
"麟酥苏不骑麒麟","保密","黑龙江","274933916","6","EveOneCat2","10000","4","","好耶！是大冒险！[Cat2_Nyampage]"
"子鸢a","男","陕西","197800511","6","星座系列：天蝎座","10000","4","13","好耶[原神_哇]"
"逍遥これ缘","保密","云南","1211695662","5","","10000","8","","还是那句话：加强刻晴[脱单doge][脱单doge]"
"东春百竹","男","四川","519894289","4","","10000","6","","没有坤曲，我不是很认可[doge]"
"窗边瞳子","保密","北京","29150903","6","","10000","4","","官方开直播还是直接发视频？[哦呼]"
"板鸭鸭第一","男","江苏","484688532","5","","10000","4","","你小子[捂眼]"
"穿越火钱灵狐姐","保密","上海","83676932","5","圣诞节快乐","10000","4","","他奶奶滴，饼吃不下啦，不要再喂啦[原神_哼]"
"太虚山符壮士","保密","江苏","95952741","6","","10000","5","","刚看完原神生日会，二创太卷了，看看官方的缓缓劲儿[doge][doge]"
"小傲院长丶","保密","河北","1018353844","4","","10000","3","","好低啊，不过质量高"
"D-FG-L","男","江西","443176652","5","","10000","3","","明天中午12点官方直播间二周年音乐会不见不散兄弟们[吃瓜][打call]"
"凉介之瞳","女","山西","19066123","6","","10000","3","","喜欢原神的音乐 能用交响乐团听简直是盛宴了！！抱抱原宝[原神_哇]"
"星野h","保密","广东","45657350","6","圣诞节快乐","10000","3","7","原来月卡的声音这么好听[崩坏3・光辉矢愿_小喇叭]"
"_zyyyyu","女","河南","523311101","5","","10000","3","","睡衣突然变成了燕尾服[热词系列_知识增加]手中的厕纸变成了红酒杯[热词系列_知识增加]"
"若谷谷谷子","保密","辽宁","28956643","6","","10000","3","","嗯？这是今年的？刚才还想怎么去年的都刷出来了"
"小二来一打萌妹子","男","内蒙古","88541654","6","","10000","3","","也就是我啦，完全没有问题呢，大家也一定非常期待我的演出吧，一定要来看哦，少女的邀请可不可以拒绝哦,我=荧，荧=爱莉，我=爱莉，完美[脱单doge]"
"_LindseyStirling","男","湖北","1693177904","5","原神","10000","3","","好耶[原神_G嘿]"
"薛怡宁","男","山东","436602963","5","2233幻星集","10000","3","","卧槽，上流[脱单doge]"
"我在哪里abc","保密","湖南","299387984","5","原神","10000","3","","优雅"
"我永远单推星宫汐","男","天津","12527779","5","hanser","10000","3","9","来力"
"红炉上一点雪","男","贵州","1773833096","4","","10000","3","","好耶[打call]"
"大鹏小小-","男","广东","64818302","6","","10000","3","8","为达达利亚献出心脏！！"
"捌柒零零","男","辽宁","7226251","6","大会员5周年","10000","5","","我他娘太自豪了，我氪了十几个648啊，我算是赞助商吧？[星星眼]"
"魔法业界卖货人","女","辽宁","1077273009","3","","10000","3","","突然好奇能运行原神的电脑都有哪些，[脱单doge]"
"惜雪染","保密","广西","400661538","5","","10000","3","","[热词系列_优雅]实在太[热词系列_优雅]了"
"星露喵","保密","日本","1619269","6","雪未来","10000","4","","习惯点赞投币了,只要是原神的内容"
"幻书启世录2","保密","福建","499776599","5","","10000","4","","群星的航路终将指向，400年前的地球[大哭][大哭][大哭]"
"西皿西0口0","男","上海","505105471","5","崩坏：星穹铁道","10000","2","4","最低播放打卡"
"PY游戏","男","广东","439452849","6","新月冰冰","10000","2","","结束了啦！！！！已经结束了啦！！！都结束了啦！！！"
"我不知道叫啥来着呢","保密","湖北","523867591","3","","10000","2","","有点短[热]"
"witting-end","保密","湖南","454215893","5","","10000","2","","又到了一年一度的投资方聚会[doge]"
"cherry没____","保密","河南","356261355","6","","10000","2","","啥时候开始，在哪里看，怎么都没说0.0"
"瑞雪兆晴","保密","山西","343405987","5","","10000","2","","我的生日，爱了爱了[给心心]"
"]@人","男","天津","491052440","5","EDG战队","10000","2","","可恶，身上的睡衣变成燕尾服了[脱单doge]"
"啦啦啦嚯呀","保密","山东","272818953","5","圣诞节快乐","10000","2","","今年会提前发节目单嘛？我想要仪式感，顺带一提我好希望有幽夜净土里的曲子哇！[保卫萝卜_哇]"
"随缘摇函树","男","安徽","471697539","5","","10000","2","","英语老师让我们做个PPT或者手抄报作文，写自己最喜欢的音乐人，我给老师露了一手了，直接把原神写上去了，刚写完就看到这个，确实很惊喜[脱单doge]"
"69LJH","男","河南","177317977","6","","10000","2","","老米是真拿钱给玩家搞福利呀，毕竟大伟哥也是个资深二次元。"
"L懒","保密","湖北","9650733","6","橘猫挂件","10000","2","","音乐会办的很好，良好的传统请继续延续下去！"
"对宝可梦公司无语","保密","山东","111181683","6","","10000","2","","@飞花灬雨 @苦修的张三酱 流浪大地的乐团"
"筱っ喵","保密","江苏","481933841","5","小试身手","10000","2","","这是由你开启的故事，这是因你而存在的故事"
"鸢语不华","保密","广东","97001959","6","","10000","2","","好耶！10月2日刚好我生日！[Cat_fight]"
"愿君勿来陶大","保密","江西","229461600","5","","10000","2","","？？？？？？10月2号中午，我记得还有崩坏3的同人电影啊，呜呜呜，原宝，你无情――[微笑]"
"院长HM","男","四川","26066461","6","原神","10000","2","10","等一下，中午十二点？"
"我怎么不记得了","男","马来西亚","490095696","5","","10000","2","","希望有渊下宫和层岩巨渊的OST"
"sisicy","保密","山东","67412491","5","三周年恋曲","10000","2","","现在买礼服还来得及吗"
"凌凌漆丶零","女","湖北","101037470","6","2021拜年纪","10000","2","","愿此世，如黄金般辉煌！[热词系列_优雅][热词系列_吹爆]"
"LXK-坤","男","陕西","386406463","5","","10000","2","","不用看我都知道是什么场景，音乐会就有音乐会的样子，我一开始就认为官方必不可能被比下去！"
"行走的云流走的水","保密","湖南","18347732","6","","10000","2","","好耶"
"不属于你的凛冬","保密","浙江","1890518904","4","","10000","2","","竟然是预告！还以为是正片"
"才没有关心你呢","保密","江西","673905937","5","","10000","2","","卧槽"
"万灯雪","保密","辽宁","259230128","5","","10000","2","","第一次这么前却不知道该说什么[藏狐]"
"独游鲸","男","湖南","522186290","5","","10000","2","","奈何本人没有文化，只能说一句卧槽"
"是赤鸢仙人呀","保密","新疆","85610846","6","","10000","2","","所以会有原石么？（为了即将要出现的妮露疯狂攒原石中）[打call][打call]"
"嘉碗糖","保密","贵州","190286738","5","星座系列：天秤座","10000","2","","是音乐会！！"
"獭獭开獭獭开獭獭开","男","广东","19775337","6","","10000","2","","礼服都准备好好了，冲[热词系列_优雅][热词系列_优雅]"
"Mrs_Chips","保密","中国香港","473095500","5","","10000","2","","期待住了[大哭][大哭][大哭]想听雷神pv无妄无执的现场版"
"黄大叔くみこ","男","山西","406330781","6","","10000","2","11","音乐会 好耶！！！"
"山田凉的喜多酱","男","江西","618479221","5","汉化日记","10000","2","","我超！"
"修马シ","男","江苏","449658758","5","EveOneCat2","10000","2","","优雅，太优雅了（来自完全听不懂的旅行者的感叹）"
"Evelyntwisted","保密","天津","488238443","5","","10000","2","","陈老师yyds"
"Op吃瓜群众","男","云南","22682624","6","","10000","2","","高脚杯准备好了[脱单doge]"
"栖肆_","保密","广东","687371199","5","工作细胞","10000","2","","我超"
"相看泪眼-","男","江西","18787857","5","","10000","2","","垂死病中惊坐起！"
"扶光入沧渊而明","保密","江苏","392851800","6","","10000","7","","真的好好听！！！！,（正确的，客观的，合理的，中肯的，明晰的，真实的，辩证的，理性的，审慎的，深刻的，通达的，优美的，巧妙的，精辟的，雅正的，机智的，全面的，明白晓畅的，不偏不倚的，恰如其分的，滴水不漏的，不容质疑的，切中要害的，一针见血的，淋漓尽致的，深谙事理的，真知灼见的，发蒙振聩的"
"无聊大饿余","保密","浙江","625820688","3","","10000","2","","《原神》及HOYO-MiX将联合多位音乐家，共同开启又一段美妙的音乐之旅。延续着往年的余音，那些在提瓦特大陆中回荡的动人旋律即将再次回响。,,音乐会将于10月2日12:00开始，旅行者可前往《原神》官方直播间收看。"
"我与她的先生","保密","福建","560479703","5","","10000","2","","来了"
"Amadeus-11","保密","湖南","1790298099","4","","10000","2","","这音乐会咋在饭点开呢[脸红]"
"莫娜の房东","保密","广东","516186373","5","","10000","2","","手里的炸鸡变成了狗肝，啤酒杯变成了四角羊尊杯，汗衫变成了丝绸，就连菜盆都变成了青铜鼎,总结：钟鸣鼎食，上流[脱单doge]"
"卡罗拉13","男","浙江","651676415","5","","10000","2","","我去"
"宇宙视觉Y","男","山东","391666044","5","#EveOneCat!","10000","2","","[原神_干杯][原神_干杯][原神_干杯][原神_干杯][原神_交给我吧]"
"o阳大王","男","河南","229118540","6","","10000","2","","管b互通"
