"昵称","性别","IP","UID","等级","装扮","用户权重","获赞数","粉丝团等级","评论"
"咕咕幻丶","保密","无IP","35152435","6","","10000","0","","我今天在网吧看见一个小妹妹在玩原神，我一看，他打f4打了半天，血条都没了，打狼时也不知道闪避，我一问，他说他已经这样好久了，就是打不过，她还说她没什么好友陪她玩，她都是一个人单机的，好友也是现实朋友，还不怎么玩,我看她可怜，默默记下了他的游戏UID100644333,各位好心人可以加一下他，带她锄锄大地，他玩到现在连大地都没锄过，太可怜了。[大哭]"
"微醺星河o","男","无IP","37726433","6","明日方舟-愚夜密函","10000","0","","已经没有摩拉了,全部材料屯仓库里"
"肉松ed","男","无IP","477093427","5","","10000","0","","还请消停点，不要不识抬举，不然我就跪下求你了[热词系列_高产]"
"晴枫_Kae","男","无IP","22574307","6","","10000","0","","想问下风花节持续多久？"
"多云hh","男","无IP","35716235","6","","10000","0","","米卫兵竟是我自己"
"科伊安","保密","无IP","579384","6","","10000","0","","／ ￣￣ ＼　 ,|　`　` \　  ／``````````````````````````````````````````＼,|　 　 |     |            我是诺艾尔玩家            |,\　　 　/ ∠      能给白影剑璃骨剑换个色吗   |, ＼　　 イ　    \         人家明明是女孩子          |      ,／　　　\          \                                          /,/　|　　　 \        ``````````````````````````````````````````,|　|　　　 | |        ,|    |             | |"
"bili_17798209","男","无IP","17798209","6","","10000","0","","没钱了"
"bili_17798209","男","无IP","17798209","6","","10000","0","","罗莎莉亚不会是限定吧[跪了]"
"非典型野龙","保密","无IP","1585470","6","","10000","0","","请问，这次是罗莎莉亚公子温蒂在一个池子吗？三个都up？"
"大石子昂","保密","无IP","23232402","6","","10000","0","","我察，三百原石的兑换吗[惊喜]"
"--可乐加冰__","保密","无IP","359140045","5","","10000","0","","许愿温迪[保佑]"
"苟子白","保密","无IP","507490650","5","","10000","0","","说书人：,话说很久很久以前,水神达达利亚登上神座之前,那一年达达利亚被女士带走,达达利亚的老相好钟离先生抬棺直奔至冬,在他们离开至冬的时候,达达利亚伏在钟离先生的肩上,血染衣袍,只见钟离先生回首一看,说了句,我今天就要带他走,我看谁敢拦我欲知后事如何，且打赏老儿点酒钱,不多不多，也就648RMB"
"猫猫凯露酱","保密","无IP","30553692","5","2233幻星集","10000","0","","装 杯 之 诗：温蒂[喜极而泣]"
"咖喱GAGI","男","无IP","5129054","6","HIME","10000","0","","妹妹的剑，和对抗天理的时候那把是同一个模型，就是颜色变了，哥哥的剑应该是十字形的"
"我才不认识你","保密","无IP","21220381","6","meaqua","10000","0","","风物与诗琴好耶，光遇钢琴玩家狂喜"
"love伊莉雅thebest","保密","无IP","231917737","6","","10000","0","","武器原胚掉落率感人啊，官方能不能提高一点，从世界等级四后我打三个boss都没掉过了"
"风北消亡录","保密","无IP","302197478","6","异常生物","10000","0","","啊啊啊啊啊啊风花节太赞了！！"
"才没有想要呢","男","无IP","37486632","6","","10000","0","","这不比海灯节舒服？？不用打工"
"阿槐手握刻刀","男","无IP","495105743","5","","10000","0","","WBPDBCSLV2DS,ZT6DTDT5D2UW,US6USDTLVKU2 "
"谱奇","男","无IP","16969829","6","","10000","0","","许愿温蒂，出必抱怨"
"喜欢玩小游戏的纸鸢","男","无IP","410082781","5","","10000","0","","我想问一下，这个小纯水是永久的吗？[思考]"
"黑人问号脸点结批计","女","无IP","296135448","6","","10000","0","","周本体力消耗什么时候能取消？本来就一周打一次，已经拉长了培养周期，三个周本还要花费180的体力，一天啥都不干都打不完三个本！！！烦死了"
"路过的猛男_","男","无IP","64921596","6","","10000","0","","难受，准备给胡桃抽把护摩，结果连出两把狼末[大哭][大哭]"
"黑色的帷幕","保密","无IP","2972394","6","","10000","0","","好耶"
"瞳孔d","男","无IP","16104651","6","","10000","0","","我可以不出温蒂，但一定要出罗莎莉亚[吃瓜]"
"-秋枫羽-","保密","无IP","383624436","6","天官赐福动画","10000","0","","温迪永远的神！虽然我已经有温迪了[doge][doge]"
"猫猫凯露酱","保密","无IP","30553692","5","2233幻星集","10000","0","","璃h做宵灯，莫非蒙德做皮球？[喜极而泣][嗑瓜子]"
"|雪の丁真","保密","无IP","174418732","6","","10000","0","","手机玩家狂悲"
"|雪の丁真","保密","无IP","174418732","6","","10000","0","","你这。。。糖豆人？"
"孝嘻乐","男","无IP","23189612","5","","10000","0","","牛，真出角色任务了是吧"
"最靓休伯利安舰长","保密","无IP","18751756","6","崩坏：星穹铁道","10000","0","","罗莎莉亚 ,关于愚人众,先把枪架在他们脖子上，在跟他们慢慢讲道理！"
"没心没肺的小确幸","保密","无IP","435802347","6","#EveOneCat","10000","0","","真不错(*ts`)"
"紫薯芋圆冰","女","无IP","360766318","6","","10000","0","","为什么视频里的茶会角色形象，只有温迪有手指，其他人没有，什么时候我们的琴团长和旅行者才能拥有手指？气抖冷！[doge]"
"xN","保密","无IP","6755655","6","","10000","0","","啥时候联动一波崩3啊[点赞]"
"_谦谦_","男","无IP","11268737","6","","10000","0","","是谁说的风神有倒悬之急艹哈哈哈哈哈哈）"
"海の诺言","女","无IP","226653507","6","","10000","0","7","好期待！"
"骑士团的米哈尔","保密","无IP","35623207","6","","10000","0","","阿贝多什么时候复刻"
"-执掌好运的黄黑之王","保密","无IP","400385992","5","纳米核心","10000","0","","原神糖豆人，galgame，音乐游戏等好多新的活动小游戏。不过好想要刻晴的邀约，第一人称的感受，既然有第一辑就会有第二辑，希望其他的小游戏常驻能经常玩，或者设置周末开放也可以，总之等就是了[打call][doge][星星眼]"
"雨ma","男","无IP","30357541","6","","10000","0","","策划大方点谁会骂，就天天抠怎么办都要骂"
"不死的蓬莱人","保密","无IP","519387","6","灵笼","10000","0","","策划的纯度，也大大提高了[歪嘴]"
"孟达塔","保密","无IP","3204266","6","圣诞节快乐","10000","0","","看了弹幕才意识到星际有多小众[笑哭]"
"西北老hair","保密","无IP","286048617","6","","10000","0","","有温迪的老玩家表示很淦[doge]"
"Bruce烨烨","保密","无IP","409202891","5","","10000","0","","再？考虑过做galgame吗？越涩越好[doge]"
"悲剧的蟑螂","保密","无IP","556089","5","","10000","0","","原神1.4：地下斗技场篇，堂堂连载！"
"绪花ohana","男","无IP","15315427","6","","10000","0","","意外的惊喜，以为会很无聊的"
"klaussang","保密","无IP","178008610","6","","10000","0","","1.4又不更新主线和新地图吗？十分失望"
"小那维莱獭","女","无IP","222381380","5","","10000","0","","Mhy你没有心，什么都没说直接埋伏我一手复刻公子[大哭][大哭]"
"厨偶像的Friends","男","无IP","9406692","6","魔法学院","10000","0","","我今天就是米卫兵[脱单doge]"
"果味喵子","保密","无IP","241866008","5","","10000","0","","WBPDBCSLV2DS,ZT6DTDT5D2UW,US6USDTLVKU2"
"泡泡的炜炜","男","无IP","213304590","5","至尊戒","10000","0","","比心[给心心]"
"7粒粒粒粒粒粒粒粒糖","女","无IP","15125707","6","","10000","0","","烦死了1.4怎么这么有意思"
"喝了假酒的辉夜月","男","无IP","12574989","6","国民老公带回家","10000","0","","快进到一堆人用琴弹大悲咒，仓鼠瑟瑟发抖[doge]"
"肥被","保密","无IP","395964737","5","","10000","0","","WBPDBCSLV2DS,ZT6DTDT5D2UW,US6USDTLVKU2 "
"颐鬟m","保密","无IP","5266567","6","","10000","0","6","【预言】[doge],节日逸闻：全蒙德的花都是我采的,擂台：难度拉满，10秒结束，默默地选了最低难度"
"-执掌好运的黄黑之王","保密","无IP","400385992","5","纳米核心","10000","0","","温蒂公子在一个池子吗？可是我想要温蒂吖，胡桃的50发没出，就等温蒂了[委屈][委屈]"
"小那么小破站啊","保密","无IP","412467053","5","至尊戒","10000","0","","说真的，原神进我的世界偷矿我不管，但是你偷矿还问我你要找的矿在哪里就过分了啊。[笑哭]"
"今夕月今夕月","保密","无IP","249655385","5","","10000","0","","我现在只想说，求求隔壁未定学一学这边的约会[脱单doge]"
"是陈鱼吧","保密","无IP","91553566","5","小主安康","10000","0","","巴巴托斯我爱你"
"EDG-Uzi7","男","无IP","6188194","6","","10000","0","","蒙德劳动节也要来了吗"
"蒸馍服气","男","无IP","38348356","6","","10000","0","","300原石[热词系列_知识增加]"
"某不科学的Nobu","男","无IP","43679931","6","","10000","0","","有没有b服的小伙伴啊 一起玩啊,uid 500460935,我不想玩单机辣呜呜呜"
"0900966fWGLS","保密","无IP","49445862","6","绯赤艾莉欧","10000","0","","所以1.3更新的女仆日语配音能不能修一下，目前质量挺差的"
"箜","保密","无IP","370093760","5","","10000","0","6","还有男女主又是一整个主线剧情哑巴人"
"烛光墨影","男","无IP","472850468","5","明日方舟音律系列","10000","0","","ZT6DTDT5D2UW"
"蚂卡芭卡","保密","无IP","24196225","6","","10000","0","","能不能快点更新啊"
"小栗子・","保密","无IP","4724426","6","","10000","0","","说吧，上次我放了2000多个宵灯，这次是啥[doge]"
"妄想皿","男","无IP","34979103","5","","10000","0","","别再给我歪了，再见了胡桃[酸了]"
"星星上没有玫瑰","保密","无IP","13547015","6","阴阳师海国之境","10000","0","","好耶，光遇退坑玩家可以在原神里继续练曲了[脱单doge]"
"烛光墨影","男","无IP","472850468","5","明日方舟音律系列","10000","0","","WBPDBCSLV2DS"
"h彩","女","无IP","86278143","6","Overidea米娅","10000","0","4","为什么风花节要等上学才开[大哭][大哭][大哭]我直接请假回家参加风花节（不可能[笑哭]）"
"汝妻污养之","保密","无IP","338221831","6","","10000","0","","这个galgame是全语音的吗[脱单doge]"
"蓦兰唱","男","无IP","40909509","6","原神","10000","0","","要刀龙哥了！"
"不是时常","保密","无IP","344375918","6","崩坏3・天穹流星","10000","0","","虽然但是，感觉这次蒙德茶会cv们都不是很跳脱了，调侃什么的也少了很多……果然还是有被影响到了吗[崩坏3_看书][崩坏3_看书]"
"俄罗斯小鸽子","保密","无IP","67908931","5","异常生物","10000","0","","许愿巴巴托斯！出必还愿！"
"大鱼木毛","女","无IP","17216217","6","","10000","0","","温迪温迪温迪温迪温迪……再不出就杀了"
"-为欢几何_","男","无IP","507261219","5","","10000","0","","靠这三百原石抽到胡桃了[热词系列_吹爆]"
"Maiksr","保密","无IP","88647995","6","","10000","0","","我还以为只有温迪就只存了个大保底（还剩30发）"
"吃布丁的熊猫","男","无IP","18505269","5","","10000","0","","抽不抽刻晴"
"箜","保密","无IP","370093760","5","","10000","0","6","又是当劳力的一个节日呵呵"
"韩太岁","男","无IP","25417859","5","","10000","0","","策划在?五星武器全歪破天空枪了，仓检不带这样的"
"账号已注销","保密","无IP","39320221","0","七海演唱会","5000","0","","我的刻晴什么时候有任务啊"
"Maiksr","保密","无IP","88647995","6","","10000","0","","啊，双复刻都是喜欢的，难受"
"培景","男","无IP","459535","6","","10000","0","","WBPDBCSLV2DS"
"莱恩LAN","男","无IP","360646579","5","","10000","0","","拜托原神策划把kfc的活动拓展到俄罗斯吧，海外学生太馋了[大哭]"
"上帝压狗R","保密","无IP","8012564","6","星座系列：天蝎座","10000","0","","这个茶会有韩语版 英语版 日语版的嘛？[2233娘_困惑]"
"洛水河图倾城人","保密","无IP","103120808","5","约战・白之女王","10000","0","","什么时候b服能和官服互通啊！说好和朋友一起玩原神，结果不在一个服[笑哭]"
"何曾似家","保密","无IP","690565120","5","","10000","0","9","麻蛋，睡着了[无语]"
"愿化星辰守护かの","男","无IP","275214996","6","洛天依8th生日纪念","10000","0","10","[给心心]"
"桑扈_","男","无IP","486594155","5","良辰美景・不问天","10000","0","","特别纠结大保底给温迪还是胡桃"
"沣不觉","保密","无IP","479177412","5","","10000","0","","米忽悠大方了啊[吃瓜]"
"165的十深","保密","无IP","111197335","6","hanser","10000","0","","那个琴是永久的，我已经想象到会被玩家玩出花来了"
"浩海游鲸","男","无IP","18665893","6","","10000","0","","男主和女主居然还有配音?"
"金丝克莱恩","保密","无IP","13266882","6","","10000","0","9","我大呼好耶好耶好耶好耶好耶好耶好耶好耶好耶好耶好耶好耶好耶好耶好耶好耶好耶好耶好耶好耶好耶好耶好耶好耶好耶好耶好耶好耶好耶好耶好耶好耶好耶好耶好耶好耶好耶好耶！"
"商遥","保密","无IP","1384183757","5","橘猫挂件","10000","0","","风花节好耶！！！,大保底准备好了，温迪我来啦！！！"
"有梦就追v","保密","无IP","359460450","6","","10000","0","","武器都是换皮"
"WuX1aN","保密","无IP","9837742","6","","10000","0","","两个up池子都有罗莎莉亚吗"
"我是墨一怂","女","无IP","8395218","6","EveOneCat2","10000","0","","我有点想知道1.4版本大概什么时候会来，我现在还有20发就大保底，为了等温蒂，我真的一点都不敢抽啊[七濑胡桃_泪目][七濑胡桃_泪目][七濑胡桃_泪目]"
"一支凉皮","保密","无IP","62933521","6","","10000","0","","萌新想问问，迪卢克，70的精通大约等于多少暴击伤害，有一件70精通的花和一个20爆伤的花，不知道选哪个好"
"MAYOIl","保密","无IP","925485","6","","10000","0","","武器池双UP 能不能改自选/单up！！！！！！！！！狼的上中下路 要吐了"
"星辰败笑","男","无IP","5740325","6","-阿库娅","10000","0","","元和二年，一位旅行者来到了蒙德...."
"账号已注销","保密","无IP","622729299","0","","5000","0","2","最喜欢的其实是邀约[捂眼]芭芭拉真的很可爱啊"
"埃俊凯特","保密","无IP","76865553","5","","10000","0","","三百原石？没拿到[灵魂出窍]"
"万名之人","保密","无IP","502462340","4","","10000","0","","WBPDBCSLV2DS,ZT6DTDT5D2UW,US6USDTLVKU2 "
"自卑的桥","男","无IP","8055993","6","","10000","0","","直播福利给这么多真的合适？7天活动累登也不过如此吧，这种不注意就领不到的大额福利用直播cdk的方式发放不太好吧"
"wwk闲人","男","无IP","440987009","5","","10000","0","","艹，来晚了五分钟"
"若晴呓语","保密","无IP","95789098","6","","10000","0","","好耶()"
"灵曦-盛世","保密","无IP","76988007","5","碧蓝航线","10000","0","","WBPDBCSLV2DS,ZT6DTDT5D2UW,US6USDTLVKU2 "
"mindyCola","保密","无IP","6915900","6","罗伊","10000","0","10","活动小游戏：手机痛苦面具"
"丸子吃小埋","男","无IP","341123805","5","","10000","0","","许愿温迪，出必还愿"
"丸子吃小埋","男","无IP","341123805","5","","10000","0","","许愿公子 出必还愿！！！"
"闭月羞p","男","无IP","355565794","4","","10000","0","","谁能告诉我我这次抽胡桃出了两金，先出的胡桃，后出的琴，那我下次up是不是就必是up"
"n韩n韩n韩n","男","无IP","281210417","6","","10000","0","","电脑端的60桢什么时候开放90桢呢？[微笑][微笑][微笑][吃瓜][嗑瓜子]"
"超级小豆泥","女","无IP","285748756","6","偶像梦幻祭2","10000","0","","好起来了！！好耶！(*°°*)八(*°°*)"
"通辽居委会会长","保密","无IP","27191612","6","","10000","0","","茶会什么时候邀请迪卢克呜呜呜"
"枯叶色","保密","无IP","8207310","6","星座系列：水瓶座","10000","0","","原神道！堂堂连载！！[doge]"
"再见了可可亚","保密","无IP","2739009","6","","10000","0","","男妹妹怎么了，我这就和重云贴贴"
"梦萝Deluxe","保密","无IP","286255027","6","三周年恋曲","10000","0","","WBPDBCSLV2DS,ZT6DTDT5D2UW,US6USDTLVKU2"
"远古的遗骸","男","无IP","598566698","5","","10000","0","","我想玩原神啊该死的手机只有16的内存啊老妈答应给我买手机的时间是五月啊是美错过了呢我想要纸手精灵啊"
"乌鸦在说谎","男","无IP","226829570","6","","10000","0","","发条友善的评论"
"千灯Nya","女","无IP","9040246","6","原神","10000","0","","你们米哈游玩家又开始传统背刺了吗[doge]"
"_Oaths_","男","无IP","83861496","6","","10000","0","","我最喜欢的立本酱呢[doge]"
"限时冰糖","女","无IP","19509752","6","实验品家庭","10000","0","","温蒂，，，公子。。呵我选谁？,怎么办，，公子长在我的xp上了[笑哭],可是温蒂好香！！！"
"Die-Walkvre","男","无IP","353272054","5","原神","10000","0","5","安柏声音不错诶，牛奶君再见[脱单doge]"
"千灯Nya","女","无IP","9040246","6","原神","10000","0","","1. 4的新boss好帅！会变成公子那样的常驻boss吗"
"鱼雷打飞机","男","无IP","18201127","6","","10000","0","","至福…………"
"吃冰蛋挞","保密","无IP","12309492","6","","10000","0","","低情商：我胡桃歪了,高情商：我温蒂稳了"
"Die-Walkvre","男","无IP","353272054","5","原神","10000","0","5","安――柏――"
"账号已注销","保密","无IP","242653183","0","至尊戒","5000","0","","可以，我真的爱了"
"隆夫_三拳","保密","无IP","341274700","6","","10000","0","","／ ￣￣ ＼　 ,|　`　` \　  ／`````````````````````````````````````````````````＼,|　 　 |     |               亲爱的原神                      |,\　　 　/ ∠      求求你让剧情里的小哑巴说话吧  |, ＼　　 イ　   \        我太想听包包配的爷了           |      ,／　　　\          \                                          /,/　|　　　 \        `````````````````````````````````,|　|　　　 | |        ,|    |             | |"
"我一定会娶了御坂美琴","男","无IP","23531332","5","良辰美景・不问天","10000","0","","话说外卖给不给兑换码，我是不是还得跑一趟kfc吗？"
"屿秋雨清","保密","无IP","356316603","5","","10000","0","11","过于离谱，点开原神1.4版本的热搜，显示出来的视频居然没有官方号[辣眼睛]"
"\依l⑸","女","无IP","174867445","6","洛天依・最美的夜","10000","0","","突然发现小人的眨眼更自然了"
"LTIの爱","保密","无IP","152903774","6","2233白色情人节","10000","0","","这不比海灯节有意思.jpg[脱单doge]"
"230岁の但丁","男","无IP","172130","6","","10000","0","","修女姐姐，请帮我解决____[doge]"
"柳印月","保密","无IP","198628988","6","星座系列：巨蟹座","10000","0","1","今天我就是mvb了！,纯月卡的摸鱼玩家如是说"
"橙下之萌","男","无IP","23173271","6","","10000","0","","突然想到一个问题，活动给的这把琴怎么用（包括但不限于ps4）手柄操作"
"中奖啊魂淡","保密","无IP","470858835","5","","10000","0","5","【置顶】三个兑换码:,WBPDBCSLV2DS,ZT6DTDT5D2UW,US6USDTLVKU2 "
"Dp","保密","无IP","319288753","6","星座系列：水瓶座","10000","0","","安卓手柄适配下呗[吃瓜]"
"吃布丁的熊猫","男","无IP","18505269","5","","10000","0","","我不在乎这些 我只在乎送多少石头"
"达咩哟达咩达咩灬","保密","无IP","35432985","6","","10000","0","","许愿温迪！！！！老婆！！！我来啦！！！！！！！"
"吃布丁的熊猫","男","无IP","18505269","5","","10000","0","","[狗子]戴哥什么时候进池子"
"霹雳霹雳太棒了","保密","无IP","159205800","5","","10000","0","","虽然很想给公子抽命座但我还是不想复刻公子，毕竟应该算是持有率最低的五星吧[脱单doge]"
"最值得信任的我","保密","无IP","123723043","6","","10000","0","6","爷和爷、温迪和琴 四风守护[吃瓜]"
"非洲第99酋长","保密","无IP","588150317","5","","10000","0","","ZBC"
"傲娇手办欧提努斯","保密","无IP","11596855","6","","10000","0","","我想让琴，安柏，温迪等这样的人物多和我互动，在路上遇见也行，给我发布任务也行，我不想只在卡池和剧情里遇见他们，我想要一个和他们的日常"
"北极熊爱吃雪糕吗","男","无IP","391809698","5","","10000","0","","法师重击卡顿也没个回复，吐了"
"逍遥的疯","男","无IP","1588433","6","","10000","0","","稻妻这是要到1.6了？"
"先生养的花","保密","无IP","76533012","6","","10000","0","","WBPDBCSLV2DS,ZT6DTDT5D2UW,US6USDTLVKU2 "
"阿鲁JP","男","无IP","87792014","6","珈乐Carol","10000","0","","太充实了真的 好棒"
"月月夜丶","保密","无IP","19438166","6","","10000","0","","[支持]"
"双马尾属性拯救世界","保密","无IP","93883296","6","星尘","10000","0","","小精灵，我爱了"
"ForeverConfusion","男","无IP","73499439","6","原神","10000","0","","有没有考虑过给盾加一个血条，在HP上面或者下面一行，类似于阴阳师那样，以及持续时间，和料理药水的持续时间，方便观察，在打深境螺旋或者别的本时，能更仔细的观察到自己的状态，以免暴毙[doge][doge][doge]"
"谢疏影","男","无IP","16483467","6","鹿乃","10000","0","","视频看完了，就抽一个罗莎莉亚，温迪公子都有了，没意思[doge]"
"正灬派","男","无IP","84500028","6","2021拜年纪","10000","0","","许愿公子，出必还愿[给心心][给心心][给心心]"
"我要中奖啊啊啊啊aa","男","无IP","92470409","6","","10000","0","9","／ ￣￣ ＼　 ,|　`　` \　  ／````````````````````````````````＼,|　 　 |   |           27国登顶还是没有奖励  |,\　　 　/ ∠        爷以后每天都要提醒一  |, ＼　　 イ　   \        下你，臭铁母鸡  /,／　　　\    \            ,/       ||,/　|　　　 \          ``````````````````````````````,|　|　　　 | |        ,|    |            | |"
"夏志13","保密","无IP","2018003","6","","10000","0","","刃牙吧 凋零！"
"h栖YUEQI","女","无IP","108171496","6","初音未来13周年","10000","0","","温迪和公子都想要，但抽不抽的到是个问题。[大哭]"
"嘉然今天吃麻糍","男","无IP","24915621","6","","10000","0","","希望原神越来越好（）"
"千冱","男","无IP","7362636","6","星座系列：狮子座","10000","0","","死神镰刀之类的武器，也是不错的选择~"
"我不管就这吧","男","无IP","88692509","6","","10000","0","","好耶！希望原神越做越好！[打call]"
"彦雨biubiu","保密","无IP","29322859","6","","10000","0","","诶嘿～"
"uni_橘子软糖","女","无IP","434711522","5","","10000","0","","温迪酱，我是你的粉丝啊！[给心心]（飞扑）"
"取名真土耶难","保密","无IP","1092478918","4","","10000","0","","这波mhy绝了，温迪公子，这是要逼死强迫症零氪党 ，不过原神也在听取玩家的建议，棒棒的[呲牙][热词系列_爱了爱了]"
"阿飘233333","男","无IP","355678409","5","","10000","0","","多少干了点正事[doge]"
"破音菌丶","男","无IP","5264100","6","","10000","0","","抽不到温迪我就抽公子，针布戳"
"悠悠的幽幽子","保密","无IP","3272954","6","初音未来13周年","10000","0","","史莱姆缩水了？你们都知道我在说什么，欺骗我幼小的心灵"
"吃布丁的熊猫","男","无IP","18505269","5","","10000","0","","[羞羞]我是拒绝的"
"C耗ф-AiLcn","保密","无IP","89631","6","","10000","0","","分明是个异端审判官[笑哭]"
"朱雪娴","保密","无IP","48756972","6","2021拜年纪","10000","0","","我钱包顶不住啊，这池子一个接一个，能不能缓缓啊[大哭]"
"胶佬GHOST","男","无IP","321076","6","","10000","0","","看了看百发百中活动里的气球，我在想可莉的炸弹和诡雷是不是和这个有关――比如在本篇之前的风花节上故意把炸弹做成这样，结果引发风波[2233娘_疑问]"
"bili_382137066","保密","无IP","382137066","5","#EveOneCat","10000","0","","新年好[脱单doge]"
"夜影无痕","保密","无IP","804489","6","","10000","0","","什么时候联机能释放灵魂，我想看队友奋斗[tv_doge]"
"浪越改名能中奖吗","保密","无IP","1970636","6","时光代理人收藏集","10000","0","","只要不做又臭又长的打工任务，什么都好"
"Ooooooooooops_","男","无IP","9026118","6","","10000","0","","风花节？劳动节？"
"花狐偿情灬","男","无IP","24996200","6","万界仙踪","10000","0","","【置顶】本次特别节目中的兑换码将于3月7日中午12:00失效，旅行者们要尽快兑换哦~,WBPDBCSLV2DS,ZT6DTDT5D2UW,US6USDTLVKU2 "
"枫叶阿猫","男","无IP","3313453","6","","10000","0","","果然是在NETA刃牙吗[tv_doge]"
"十三","男","无IP","3591463","6","","10000","0","","坐等温蒂了，新玩家[大笑]"
"想做宵宫姐姐的太郎丸","保密","无IP","5820194","6","","10000","0","","这个小游戏想到了揍击派对"
