"昵称","性别","IP","UID","等级","装扮","用户权重","获赞数","粉丝团等级","评论"
"_数万_箴言","保密","无IP","3506614","6","","10000","2","","什么时候开新图啊   这1.4说实话还是长草啊   没点啥实质性的新内容啊"
"梧域灬浚","男","无IP","238130936","6","","10000","2","7","我掐指一算，如果没猜错的话，你现在正躺在时崎狂三的怀里玩手机，用着御坂美琴的电给手机充电边上还有个纱雾叫你哥哥，亚丝娜在你床旁坐着，六花在你一旁犯中二病，三笠一口你个你的名字，搞不好旁边还有一个蕾姆在吃醋，而你却在认真的逛b站，又看见了我的评论还点了一下赞。"
"反折性圆环","保密","无IP","25679036","6","异常生物","10000","2","","可不可以追加更换主角性别的功能。呜呜！！！！"
"无心无情何自怜","女","无IP","20223193","6","雪未来","10000","2","","先看看吧，信任是有限的，海灯节很失望，风花节别搞成当初的钟离就满意了。希望结束之后网友的评价不是，mhy老欺诈了。"
"伊蕾娜世界第1可爱","保密","无IP","628694391","5","猫咪和少女","10000","2","11","我要换主角性别[大哭]我要换主角性别[大哭]我要换主角性别[大哭][大哭]"
"倪府卿","男","无IP","11989423","6","","10000","2","","我建议你把周本出货率平均一下，我今天刚刚看的，我至今为止周周刷，杀了20个公子，总共就出过一个魔王之刃，你爆率肯定有问题的"
"桐谷样子","保密","无IP","14165635","6","EveOneCat2","10000","2","","我可以不出温迪，但给我点赞的必出温蒂[doge]"
"东方序羽","保密","无IP","519820473","5","","10000","2","","我想改人物性别，什么时候实装一下[妙啊][妙啊]"
"静谧的城池","男","无IP","37687411","6","","10000","2","","邀请芭芭拉解咒[tv_色][tv_流鼻血]"
"深海里没有你","男","无IP","421437730","5","","10000","2","","太顶了呀，官方是真的听进意见去了[鼓掌]"
"矢量丶一方","保密","无IP","440347852","5","2233白色情人节","10000","2","","好耶！"
"菜是一切根本","男","无IP","41918692","5","","10000","2","","[doge][doge][doge][doge]"
"屑high蚂","保密","无IP","515990251","4","","10000","3","","真就对玩家有利，光速修复。凝光bug下个版本，真就恶心玩家呗[微笑]"
"岁岁归离","女","无IP","38891062","5","","10000","3","","修个bug还能把一些人给整gc了"
"改名是不可能改名","男","无IP","11542192","6","","10000","3","","低情商：米卫兵：借鉴谁了？,高情商：糖豆人！糖豆人！"
"百源lfa","男","无IP","82419411","6","进击的冰糖","10000","4","","靠，三百原石单抽一个胡桃,从今天起我叫mwb[doge]"
"lonelyrangers","男","无IP","10686781","6","星座系列：摩羯座","10000","1","","温迪会选择塞西莉亚花不是没有理由的[笑哭]"
"雪花耶","女","无IP","619958291","5","","10000","1","","2.3版本入的坑[酸了]"
"南小鸟ovo","保密","无IP","86807237","6","","10000","1","","卖唱的风花节会不会复刻呢"
"丨空梦丨","女","无IP","1853653102","4","","10000","1","","哥哥杯里...[doge]"
"-Tuerkis-","保密","无IP","404462745","5","","10000","1","","温迪我好想你啊[大哭]你什么时候复刻阿"
"猫猫真可爱嘿嘿","女","广东","8244092","6","良辰美景・不问天","10000","1","","想念风花节的小游戏了[大哭]"
"想不出来名字还老重复","保密","无IP","523864474","4","","10000","1","","2.6考古"
"广霭~猫","保密","无IP","78959830","6","三周年恋曲","10000","1","","一年了风花节是不是该来了"
"East小东","男","无IP","406761924","6","","10000","1","","不对啊，2.5就应该到风花节了啊，可是却没有，难道风花节不是一年一次吗？"
"躲不了岁月催老少年","保密","无IP","1496317621","5","","10000","6","","璃月什么时候出剑仙角色@原神"
"落水中的羽","男","无IP","556829087","5","","10000","2","","我:可莉,,可莉:哥哥，你来了，可莉有乖乖听话可莉遵守约定的回来了,我:可莉我....,可莉:怎么了，哥哥你难道没有把粉色的石头带回来吗？,我:不可莉我带来了，但是....,可莉:那为什么不带可莉回家呢？,我:（沉默片刻说道）,我:可莉，对不起，我，我，爱上了别的萝莉。,可莉听到后，先是愣了一下，然后可莉眼角泛起了泪光,可莉:（跑过来抱住了我）（流着泪）哥哥，为什么（哭的更大声了）为什么可莉遵守约定了，哥哥却不带可莉回家？,我忍下心中的痛，用了点力气把可莉推开。,我:对不起，可莉，哥哥，哥哥喜欢上了别的萝莉（随后转身把自己的粉色石头给了小草神）这时天空中下起了雨，我急忙把小草神给抱回了家。,可莉在雨中继续哭，直到声音被雨声盖过...."
"飞衡娃娃","保密","无IP","291916299","5","EveOneCat2","10000","3","","谢谢宁让刻晴成了最大的小丑，刻晴厨退开，到底谁才是刻晴黑大家都清楚[微笑]"
"bili_309806","男","无IP","188613745","6","","10000","2","","能不能加强一下雷属性?抽到了刻晴已经打算退游了，你五星角色能不能做平衡一点?差距有多大你们考察过吗"
"开车好累","男","无IP","34742932","6","星座系列：水瓶座","10000","2","","感到欣慰的同时，不由得想到一句话,“若不是真的喜欢，又怎会做到如此？”,米哈游，作为一个游戏公司，你何德何能啊？,让玩家不惜一切代价，从钟离开挂维护武神尊严，“蒙 德 人”等玩家搞笑剪辑，花样队伍百般整活，开发双e打法，各种各样手书二创，到如今玩家自制海灯节，甚至还要自制以后的羽球节，放到任何一个游戏上，那都是令人羡慕的玩家群体，怎么就瘫在了mhy这啊……[热词系列_泪目]"
"迷魔警god","保密","无IP","17465715","6","","10000","2","","三段e修了也就忍了 的确是不科学 二段为什么修？ 本来就够弱了 这技巧也就观赏度高一点"
"了不起的杂鱼弥","男","无IP","337238407","6","","10000","2","7","我看明白了，不论是角色强度还是玩法地图，蒙德真的碾压璃月，每次璃月给人期待却总是节奏不断，蒙德反而吸取璃月的各种教训提前调整，包括钟离阿贝多，雪山，海灯节与风花节对比，你们要的人物剧情来了[星星眼]"
"小细胞人","保密","无IP","181934363","5","2233幻星集","10000","3","","来早了 大家挑个座位坐下吧,,,[脱单doge],,,,"
"璃月七星之摇光","男","无IP","567593","6","异常生物","10000","3","","去你大爷的，B服居然是和国服以及其他平台不互通的，劳资只能删号重连？不然不能和其他朋友一起玩，把劳资冲的钱还给我！！！！！！！！！"
"-松石-","保密","无IP","151372858","6","","10000","3","","贵游为何不把海灯节做好？现在又放个比海灯节丰富的风花节，不该说的我也不说，就希望以后不要出现这种疑似类似的情况，出之前用点心总比事后被骂好，不是我敏感，如果没有感到实实在在的差距也不会多提一嘴。看到风花节内容饱满我也高兴，可是又有另一种落差感，很失望[辣眼睛]。总之就是心情比较复杂，望贵游以后多侧重璃月的节日和活动"
"抽象美食家骚宝","男","无IP","453055161","5","崩坏3・天穹流星","10000","3","","原神不行，我认为完全没有崩3好，玩了几天，什么蜡鸡爆率我直接退坑[崩坏3_看书]"
"瑰弈","男","无IP","327569677","5","","10000","1","","可以  再加强一下刻晴吗[tv_难过][tv_难过][tv_难过]"
"贪饕之星神-奥博洛斯","保密","无IP","1995626402","4","","10000","1","","1:20"
"属性星","男","无IP","2453350","6","","10000","1","","官方求求了，搞个仅此一次的转性别吧"
"黑暗中de大火花","保密","无IP","331718367","5","","10000","1","","温迪已出，一发直接砸脸上～[呲牙][呲牙]"
"牛老卧","保密","无IP","20613332","6","","10000","1","","米忽悠的游戏真的是总能让人感到伤心，以前三蹦子没了触摸，没了mod,还有和谐，现在原神改了视角，改了走路，改了修女模型，真的，玩游戏我感觉不到快乐，只感到伤心，难受[大哭][大哭][大哭]"
"看那月光","男","无IP","162970775","6","","10000","1","","为什么是温迪。。。。[大哭][阴险][灵魂出窍]"
"伊莉雅K酱","保密","无IP","517231739","4","","10000","1","","原神最终BOSS打完后会不会出别的内容，还是就那样没了[tv_白眼][tv_白眼][tv_白眼]"
"逍遥物外-随遇而安","男","无IP","37797817","6","","10000","1","","一点小小的想法，可以给主角（哥哥或者妹妹）搞一个能休息的地方吗[喜极而泣]。每天日夜不休跑来跑去日晒雨淋，然后不管在哪直接下线，就感觉有点惨，哪怕就是个小屋子有张床就成[doge]"
"棉花唐可可","保密","无IP","15311205","6","","10000","1","","今天我在公交车上……, , , , , , , , , , , , , ,后面忘了,uid都忘了,[妙啊]"
"对线霸主","男","无IP","236691494","4","","10000","1","","曾经有人问我，二次元明明不存在，为什么那么痴迷二次元？三次元有什么不好？,我说，三次元的确很好，但是同样也很丑陋。二次元是不一样的。,现在想想,是从什么时候开始,对三次元不抱有任何期望了？,是看着最好的朋友在背后骂你？,是听着最亲的家人讽刺你？,是看着同学若有若无的排斥你？,还是一次次的失望以后,已经绝望。,是从什么时候开始,二次元成了我们的一切？,是遇到烦心事蓝颜的安慰？,是压抑时基友关心耍贱的语音？,是过生日时群员的祝福？,是被骂时朋友怼他们的愤慨？,还是在二次元里，你才是最真实的自己？,为什么会喜欢二次元？,可能是,看清了三次元的尔虞我诈,看懂了三次元的势力虚伪,看到了三次元的残忍恶心,明白了什么是社会,什么是黑暗,什么是不公,所以遇到二次元时才会那么急切,想要脱离这里,知道吗？,在二次元里我们收获了很多友情,不会孤单,在二次元里我们找到了精神寄托,不会伤心,在二次元里我们有了自己的本命,不会寂寞,二次元给我们带来了很多,也教会了我们很多,二次元是一个温暖的地方,二次元是一个团结的地方,二次元是一个热血的地方,二次元是承载了我们梦的地方,二次元是我们的信仰,而二次元,是我们理想的三次元,我不知道为什么二次元的孩子会被人排斥,我不知道为什么看动漫会被骂幼稚,我不知道为什么cosplay会被说成不务正业,我不知道为什么买手办就是败家,我不知道为什么喜欢二次元就是逃避,也不知道,为什么，我们的疯狂,在他们眼里，就是儿戏,明明什么都不懂就否定一个人,明明什么都不知道就排斥一件事,明明什么都不理解就讽刺一样物,明明知道我们喜欢,却还是挖苦,…,所以我更喜欢二次元,…,知道吗？,二次元的孩子们都很傻,在三次元可以为了别人而委屈自己,二次元的孩子们很脆弱,在三次元会因为一句玩笑就想很多,二次元的孩子们很仗义,在三次元只要有事帮忙他们总是第一个说我愿意,二次元的孩子们很让人心疼,他们总是掩盖自己的伤口对你微笑说，别在意。,你们说,三次元有很多旅游胜地,二次元也有,三次元有很多英雄事迹,二次元也有,三次元有名人明星,二次元也有,但三次元的社会中充满了利益牵绊勾心斗角,二次元没有,二次元,梦一般的世界,是我们共同的信仰,共同的疯狂,此生无悔入二次,来世愿生二次元,呐，米娜桑,我们一起去美好的二次元世界吧！"
"原神の荧","保密","无IP","22747352","6","","10000","1","","后悔选妹妹了，我要当海王啊[笑哭]"
"幻仙云","保密","无IP","386525631","5","洛天依8th生日纪念","10000","1","","今天在KFC吃午餐，进来了一个小伙，对着前台小妹悄悄说道:“异世相遇，尽享美味。”小妹微笑着看了下小伙回了句:“没听清可以再说一遍吗？”小伙挣扎了会儿，便脸红着大声喊道:“异世相遇，尽享美味！”只见店里所有人都看向了他，小妹也是愣住了，旁边的小哥赶紧对他说:“我们店没有做这个活动，你可以去其他店找找看。”然后小伙红着脸低着头跑了出去。后来下午我在另一家KFC店又看到了他，只见他已经精神恍惚，失魂落魄的坐在角落的位置上玩着手机，我见他如此，于心不忍，便悄悄走过去看了他的手机，果然在玩原神，于是记下了他的UID:129506663。希望有好心人能安慰一下小伙，走出社死状态。[doge][doge][doge]"
"花心菠萝仔","男","无IP","368771469","5","","10000","1","","风花节（）,劳动节（）"
"一只小泽ze","男","无IP","43779149","5","","10000","1","","强烈建议长枪的攻击距离远一点[呆]"
"田所浩二的呐喊","保密","无IP","165475006","6","","10000","1","","这个争斗潮流玩的全是刃牙的梗，希望纯度能够高一点。( b- b)つロ"
"小藤不是自来卷","保密","无IP","543719461","5","","10000","1","","在？什么时候和fate联动"
"画意yi","女","无IP","38786006","6","","10000","1","","/ ￣￣＼　 ,|　`　`  \　  ／````````````````````````````＼,|　 　 |     |               亲爱的原神               |,\　　 　 /  ∠         为什么提瓦特大陆上        |, ＼　　 イ　     \        没有一个属于我的家       |      ,／　　　\            \                                             /,/　|　　　 \             ```````````````````````````,|　|　　　 | |        ,|  |       | |"
"替死鬼阿伟","男","无IP","15113121","6","崩坏：星穹铁道","10000","1","11","哥哥选对了，可以和芭芭拉还有女仆贴贴了[脱单doge]"
"史莱姆杀手一方通行","保密","无IP","33913014","6","","10000","1","10","我可以不出温迪，给我点赞的也可以不出温迪[doge]"
"藤椒酸菜面","男","无IP","54387452","5","","10000","1","","强烈要求取消武器池双up，改为单up。"
"葫芦翻江海","保密","无IP","33813160","6","","10000","1","","管家（刘伟）：身边男人都叫我“伟哥”，女人都叫我“哥”，貌似是男人女人都很需要的东东嘛 叫我哥的三次元妹纸很多，最迷恋二次元萝莉妹纸。"
"没昵称用了鸭","保密","无IP","557635242","5","神乐七奈","10000","1","","感谢官方的原石，一发出来狼末，现在不知道想哭还是想笑[笑哭]"
"二十二日星期天","男","无IP","501887309","5","","10000","1","","玩了，很好玩，所以下次叫上甘雨吧[doge]"
"卖火柴的小兵长","保密","无IP","372120789","5","","10000","1","","为什么受伤的总是璃月，先是岩王爷被策划打到住院又是海灯节活动翻车[笑哭]"
"夜里冲浪不睡觉","保密","无IP","8954826","6","","10000","1","","喜欢的-集众家之所长，讨厌的-缝合怪。唔，确实。"
"KaNya22","男","无IP","11657788","6","","10000","1","","观感上感觉风花做得要比海灯好，实际上线之后再看吧，你游能不能挽回海灯节败掉的口碑就看这一波了"
"小冷是大魔王","男","无IP","22927954","6","","10000","1","","不能说实话吗？除了体力，其他的全都不痛不痒，但是就不给你体力"
"改札","保密","无IP","22236145","6","","10000","1","","在？能给个机会让我选龙哥和芭芭拉约会吗[脱单doge]"
"稚羽空","保密","无IP","4437967","6","","10000","1","","什么时候可以单独设置角色配音.. 胡桃想听日配 钟离魈又想听中配 好难受啊[无语]"
"小小姚上尉","男","无IP","86897593","6","快把我哥带走","10000","1","","我选的龙哥我自豪[doge]"
"-小峰同学-","男","无IP","318597404","6","","10000","1","","我现状就跪求官方一件事，拜托把1.1和1.2的活动剧情给实装吧[大哭]入坑晚没玩到总感觉游戏玩的不完整[大哭][笑哭]"
"圆圆菜菜求带带QAQ","女","无IP","6919003","6","","10000","1","","()有没有氪温荧cp的()有没有氪温荧cp的，看到了他俩的h文表示根本停不下来！"
"梦萧千痕","男","无IP","282483259","5","明日方舟","10000","1","6","NPC还是有好多角色参与啊，我就等等看正式版本里面会不会改正海灯节pv“欺诈”的问题[吃瓜]"
"紫鬼Y","男","无IP","5093322","6","","10000","1","","这不比什么 璃月人的节日好玩多了[呲牙]"
"L^-^|","男","无IP","164665321","6","","10000","1","11","不平衡了，建议把风花节也整成劳动节，不然本璃月人无法接受"
"昆昆子AAA","男","无IP","50010207","6","","10000","1","","我无法接受温迪是男的！！！,（暗示官方改设定！！！）"
"大相国寺住持","男","无IP","2499645","6","","10000","1","","联机的时候能不能读条结束以后再让房主和其他人看到我进入世界？？？？你是不是觉得我电脑特别好？？？读条非常快？？？有的房主好像赶着去找胡桃，在我读条的时候就疯狂邀请，可我在读条呢！怎么接受啊！然后读条完了房主直接把我给踢了，嫌我不接受！我在读条呢！你显示我已经进入世界了干啥？？？？"
"冷藏鱼干","保密","无IP","524395","6","","10000","1","","最后的邀约，我就问一个…不是恋爱走向吧…吸取一下舰长的前车之鉴吧，梦女梦男可是很可怕的，别把饭圈搞进来了"
"朔间零是我的1_","女","无IP","39569060","5","","10000","1","","为什么是公子XnX，才过去半年不到就复刻啦，好快哦，刚抽完魈没石头根本没想到公子……上次就没抽到这次你快来吧老公[大哭][大哭]"
"ID核心","保密","无IP","555970064","5","","10000","1","4","mwb续费[吃瓜][吃瓜]我爱mhy,我们mhy真是太棒啦！"
"白露早不是黑露早","男","无IP","487278467","6","阿梓从小就很可爱","10000","1","","省流：,1、主线剧情推进，新深渊boss但是不是周常，兄妹发刀,2、KFC联动：败给三个食物，吃肯德基给翅膀（免费代吃）,3、新四星冰枪罗莎莉娅，看样子是副c+挂冰,4、温迪、公子复刻（都有了可以快乐攒石头了 钱包松了一口气）,5、新五星弓（温迪专武）四星新系列 白给满精炼四星弓,5、你甚至可以在原神玩音游,7、你甚至可以在原神玩糖豆人,8、你甚至可以在原神玩galgame,9、射气球游戏,10、打擂台活动,11、打纯水精灵活动送随行小精灵（派蒙：wdnmd）"
"_圆焰可逆不可拆_","保密","无IP","37803502","6","原神","10000","1","","这几天不是都去抽胡桃和Homo了吗，以前的c哪有强度党还会抽的，不是趁着余热赶紧榨干就换环境强退让你继续抽下一个c"
"想西的摆烂渡人","保密","无IP","236560210","6","","10000","1","","纵使你蒙德节开的再好，我还是不会忘你游ch拉夸的事实。[无语]，钟离，海灯节可都在眼里。"
"敬贺初阳","保密","无IP","602802381","5","","10000","1","","朕已阅,US6USDTLVKU2,ZT6DTDT5D2UW,WBPDBCSLV2DS"
"9ccooo","男","无IP","426853231","5","三周年恋曲","10000","1","","早哇[doge]"
"白笙情缘","保密","无IP","348900078","6","","10000","2","","无e烦复刻了，好耶！！！"
"曜如星辰亮","男","无IP","16741859","6","","10000","1","","钟离一到店，所有喝酒的人便都看着他笑，有的叫道，“弟君，你脸上又添上新伤疤了！”他对柜里说:“异世相遇！尽享美味。”便排出九文大钱。他们又故意的高声嚷道，“你一定又偷了人家的东西了！”弟君睁大眼睛说，“你怎么这样凭空污人清白……”,“什么清白？我前天亲眼见你偷了可莉的书，吊着打。”弟君便涨红了脸，额上的青筋条条绽出。引得众人都哄笑起来：店内外充满了快活的空气。"
"哔哩哗哩热评姬","保密","无IP","12542584","6","","10000","1","","中国节日不如洋节好玩是吧"
"同回","保密","无IP","216091961","6","","10000","1","","不开新图至少也开个皮肤吧，不然你怎么好意思出这个1.4？"
"夜d","男","无IP","224387229","5","","10000","1","","400抽4金，我真不想玩了"
"匆匆无从","男","无IP","492157982","5","","10000","1","","？删我评论？[笑哭]"
"Ashiner_","男","无IP","411828262","5","","10000","1","","大主教[大哭][大哭]我的大主教[大哭][大哭]"
"一个白梦境","男","无IP","416084367","5","","10000","1","","和我一起大喊：PVP!"
"勇者一抹多","女","无IP","174409983","6","拜年祭粉丝专鼠","10000","1","","如何评价yp认露娜皮肤抄袭芽衣，不认原神抄袭光遇"
"羽清灵","保密","无IP","32749243","6","","10000","1","","所以就想问问，官方对罗莎莉亚没什么解释吗，雪山版本就出了的角色，等了两个版本，莫名其妙就被改了身材，这也太莫名其妙了。原神等了这么多个版本，就出了这么一个比较喜欢的角色，还给改了？我真的裂开了，之前的活动剧情做的拉跨我也就忍了，角色也能随意修改我是真的不能忍，我现在只想要官方给个说法，性能搞不搞阉割我无所谓，身材也搞阉割是什么道理？"
"LeaFyE叶闪闪","保密","无IP","28027747","6","洛天依・最美的夜","10000","1","","我带主教可太惨了，天天被乳，还要被抄袭到原神"
"--bzzb--","保密","无IP","286363186","5","冬季","10000","1","","算是下不来了是吧[傲娇]"
"消逝の夜翎","男","无IP","19102542","5","","10000","1","","mhy爬！[呲牙]"
"堕落的}黑猫","保密","无IP","28785442","6","","10000","1","","为什么是残疾人公子啊，up卢姥爷不比流水公子高多了，而且公子和风花节八辈子打不着关系吧"
"蓝脸的小红","男","无IP","40111849","6","","10000","2","","求b服和官服互通啊！！！！！！！！,同学都是官服就我一人是b站孤儿........"
"Hello_细数繁星","保密","无IP","38273048","6","","10000","0","","没想到卡关名字是刃牙梗，纯度，大大的提高了呢"
"Scorpio小小蝎","男","无IP","17612375","6","2233十一周年纪念","10000","0","","平时纯水精灵怎么不愤怒一下 她能亲自下来挨打多好啊,[doge]"
"Ni__a","女","无IP","358737238","5","","10000","0","","有哪个好心人告诉我邀约事件在哪吗？[热词系列_知识增加]"
"竹韵k","男","无IP","487454983","5","","10000","0","","[崩坏3_糖葫芦]"
"盖了帽的老baby","男","无IP","381262527","5","","10000","0","11","好家伙"
"清何雨乍晴","保密","无IP","171717555","6","","10000","0","","[原神_G嘿][原神_G嘿][原神_G嘿]"
"塔泽利姆","男","无IP","416206151","5","","10000","0","","深渊使徒和圣堂武士好像啊"
"枫","保密","无IP","661639519","5","","10000","0","","我有一个问题，为什么主角有小点心，温迪和琴没有,[原神_G嘿][原神_喝茶]"
"琪亚娜卡斯兰娜__","女","无IP","2003019005","5","崩坏3・天穹流星","10000","0","3","风花节有一个新出的秘境，我没玩过，是靠我自己理解的，就是躲弹幕那个，那个弹幕喵了个咪的无相雷,无相雷：我谢谢您啊"
"琪亚娜卡斯兰娜__","女","无IP","2003019005","5","崩坏3・天穹流星","10000","0","3","为毛龙哥杯子里有只史莱姆[doge]"
"疯555","女","无IP","499521264","4","","10000","0","","[原神_G嘿]"
"乐平本平","男","无IP","449541621","5","","10000","0","","？？？原来兑换码在这里？！"
"卑微狐狸","保密","无IP","28327009","6","暮光幻影","10000","0","","是塞西莉亚花吗，感觉很像温迪的头饰花"
"永夜抄空间站","保密","无IP","1961235719","5","","10000","0","","我是时空穿越者，来看录播，错过直播了"
"夏天的Ly","女","无IP","346669303","6","","10000","0","","有一起玩的吗110114551"
"99046361910_bili","男","无IP","435265844","5","","10000","0","","[原神_G嘿][原神_喝茶][原神_生气][原神_嗯][原神_哼][原神_哇]"
"口刀叨","保密","无IP","14067559","6","斗破苍穹","10000","0","10","温迪！"
"半w殃","保密","无IP","168146696","5","","10000","0","","有没有这个里面温迪的头像"
"二次元的唇角微笑","保密","无IP","321483317","6","","10000","0","","啊，入坑之时"
"茶叶cayei","女","无IP","630338367","5","","10000","0","","【原神_倒】【原神_倒】"
"若离去不再见","保密","无IP","22061504","5","","10000","0","","草（一种花）"
"超级无敌暴龙战士_-","男","无IP","326101123","5","","10000","0","","278369654（扣扣群号）！希望大家可以进一下呀~群里有萌新也有大佬佬，你也可以在这里找到属于自己的新天地~"
"一只小仓星","保密","无IP","347428693","6","","10000","0","","钟离[保佑]"
"龙鸣三号幽灵","男","无IP","38238130","5","","10000","0","","[崩坏3_入欧][崩坏3_脱非],[崩坏3_糖葫芦]"
"饭桶P","男","无IP","406917473","5","","10000","0","","温迪已出，前来还愿"
"可撩不可撩","男","无IP","13887007","5","","10000","0","","十连出了白史莱姆，特来还愿"
"雍辣背","保密","无IP","212367055","6","","10000","0","","什么时候出新地图"
"天天次水果","女","无IP","20642064","5","","10000","0","","真的好想要大爷啊 就是为了大爷入坑的[哭泣][哭泣][哭泣]"
