"昵称","性别","IP","UID","等级","装扮","用户权重","获赞数","粉丝团等级","评论"
"aIl特曼","男","无IP","482388810","6","","10000","2","2","／ ￣￣ ＼　 ,|　`　` \　  ／````````````````````````````````＼,|　 　 |     |               亲爱的原神               |,\　　 　/ ∠      联机死了尸体能转转脖子吗   |, ＼　　 イ　   \           我想看我队友打           |      ,／　　　\          \                                          /,/　|　　　 \        `````````````````````````````````,|　|　　　 | |        ,|    |             | |"
"咔酷啦","保密","无IP","13505617","6","-阿库娅","10000","2","","降低世界等级还不错，反正我是真正的休闲玩家，体会不到秒怪的感觉，只练喜欢的角色，还卡材料什么的没升满天赋，世界五打个怪要磨一阵子，什么时候手机再适配Xbox手柄最好，或者出switch版，我是不太喜欢搓玻璃，用电脑的话还不如玩别的游戏"
"从不寂寞","保密","无IP","15153500","5","","10000","2","","角色邀约（X）,原神相簿（√）,芭芭拉：为什么会这样呢，明明是我先的，活动送的角色也好，卡池出来的顺序也好，还是加入队伍升级也好，也是我先的。为什么会变成这样呢，第一次有了喜欢的人，有可能做一辈子的朋友，两件的事情重合了一起。而这两份快乐，又给我带来更多的快乐。得到的，本该是像梦境一样幸福的时间，但是为什么会变成这样呢？为什么现在旅行者打深渊宁愿选择班尼特也不选择我呢。[大哭][大哭][大哭]"
"止虑","保密","无IP","226797811","6","","10000","2","","我第一次后悔选妹妹啊[笑哭]可恶，我也要和诺艾尔贴贴"
"嘟嘟小可莉QAQ","男","无IP","96984388","5","","10000","2","","已经攒到66发了 期待全抽完温迪可莉罗莎莉亚满命 希望米哈游不要不知好歹"
"似月星河","保密","无IP","455330776","5","","10000","2","","求甘雨复刻啊（歪了琴团长），甘雨最戳我的Xp啦，最喜欢的却不能拥有[酸了]"
"Starry-星宇","男","无IP","228250106","5","原神","10000","2","","就只出个琴？我要唢呐谢谢[doge]"
"洛洛薇Vi","保密","无IP","623468704","5","原神","10000","2","","风花节的小游戏能不能活动后留着啊，初三狗只能速通拿奖励，想中考后玩着放松啊，这么有意思的游戏，不拿奖励我也想玩啊"
"小火腿登登酱","男","无IP","10514544","6","","10000","2","","[热词系列_知识增加]代吃KFC找我，我帮你吃，码给你"
"auxabois","保密","无IP","446272209","5","","10000","2","","哭了，学生党想肝没时间肝[大哭]如果是暑假该多好www"
"Sakura_冰爆","保密","无IP","353437732","5","","10000","2","","能换性别吗，这不难吧[笑哭]"
"雨尘的国服铠之路","保密","无IP","283263359","6","暮光幻影","10000","2","","有没有和我一样只当舰长不做旅行者但是一直关注原神发展的玩家[狗子]"
"黄桃西瓜汁","保密","无IP","284558208","6","崩坏3・天穹流星","10000","2","9","很高兴这次风花节能看到这么多角色出场，看来mhy还是关注了玩家们的建议与批评（也可能是二测就做好了海灯节不好大改了），总之希望原神能做的越来越好，加油吧，冲冲冲"
"芋泥啵啵重度依赖","男","无IP","288214998","5","","10000","2","","1.4版本中,朋友：你平时都玩什么音游呀？,原神玩家：原神。,朋友：？[脱单doge]"
"原源愿","保密","无IP","475743720","5","","10000","2","","啊啊啊联动的不能用现金买吗？[大哭]学生党的末路（只能找代吃了[脱单doge]）"
"碜员狈骄W友","保密","无IP","528755140","5","","10000","2","","腾讯新闻：原神抄袭糖豆人，原神，国产游戏的黑暗[doge]"
"Huisheng丶","男","无IP","456361356","5","EveOneCat2","10000","2","","求求多加几条获得圣遗物经验的方法吧，圣遗物经验获取方式太单一了[大哭]"
"凉卿如雪","女","无IP","5677911","6","","10000","2","","[笑哭][笑哭][笑哭]为什么公子复刻的这么早啊，我好希望他能推后一点，给点时间攒原石吧啊sir"
"IAanuziK","保密","无IP","33355978","6","Kizuna AI","10000","2","5","手柄可以玩这音游吗？[热词系列_知识增加]"
"神奇椰果","男","无IP","85536588","6","沈剑心","10000","2","","你甚至可以在原神里玩音游和糖豆人[脱单doge]"
"叫两只沈梦溪","保密","无IP","397316082","5","","10000","2","","游戏还有进步的空间，希望贵公司能够越做越好。[原神_晚安]"
"椿的幸福理论","男","无IP","22903399","6","良辰美景・不问天","10000","2","","战斗潮流（）,热狗潮流（）"
"叶梓折花","女","无IP","324008802","6","","10000","2","","建议那个弹琴可以弄成一个道具，可装备到快捷栏，随时都能弹，像光遇的乐器那样子"
"VL5能力者","女","无IP","108627762","6","","10000","2","","US6USDTLVKU2,ZT6DTDT5D2UW,WBPDBCSLV2DS"
"逝去的K⑹湃","男","无IP","152023489","6","","10000","2","","好家伙，在原神里面你可以玩到原神[嗑瓜子]"
"爱喝奶茶的四白","保密","无IP","39498590","6","","10000","2","","不是我说，你们蒙德人就是比璃月人多点生活情趣[doge][doge]"
"改名一定能中奖的啊","男","无IP","242570176","5","原神","10000","2","","公子复刻的也太早了吧，原石还没攒够啊"
"简单口嗨-极致享受","保密","无IP","52737698","6","","10000","2","","公子up就离谱，我实在想不到公子和蒙德有啥关系，一个连蒙德都可能没去过的人吧[笑哭]"
"雪之下雪乃ili","男","无IP","231217722","6","","10000","2","","能不能出一个剧情下随时切换主角性别的功能啊。选错了很难受啊[笑哭][笑哭]"
"白[princ","保密","无IP","496318048","4","","10000","2","","风花节这活动是不给我这种性能差的手机玩家活路啊？[笑哭]"
"小~家の青梅竹马","男","无IP","34509515","6","三周年恋曲","10000","2","","为什么有些兑换码不能用 求回答"
"家诚君","男","无IP","2624698","5","","10000","2","","US6USDTLVKU2,ZT6DTDT5D2UW,WBPDBCSLV2DS"
"竭源","女","无IP","393105387","6","","10000","2","","米卫兵续费一个版本[捂眼][捂眼]"
"AriszandasDeMiwa","男","无IP","13871548","6","","10000","2","","兑换码,WBPDBCSLV2DS,ZT6DTDT5D2UW,US6USDTLVKU2"
"古月逸忍","保密","无IP","362733927","5","","10000","2","","US6USDTLVKU2,ZT6DTDT5D2UW,WBPDBCSLV2DS"
"充满力量的椅子","保密","无IP","122400680","6","","10000","2","","希望不是劳动节[保佑]"
"HikariVid","保密","无IP","12978140","6","2021拜年纪","10000","2","","WBPDBCSLV2DS,ZT6DTDT5D2UW,US6USDTLVKU2"
"森内立香","保密","无IP","179093386","6","不吉波普不笑","10000","2","","我不想说的太失礼，但是请给龙哥准备冲击波"
"幽夜皇女断罪眼","保密","无IP","126257411","6","洛天依・最美的夜","10000","2","","前排"
"tigerko13","保密","无IP","3200330","6","","10000","2","","纯度大大得提高了"
"宅豆子与偷懒猫","保密","无IP","17158476","6","","10000","2","","WBPDBCSLV2DS,ZT6DTDT5D2UW,US6USDTLVKU2,原神的三个兑换码原石*300"
"早乙女亚芽里","保密","河北","40075553","6","","10000","2","10","回过头看1.4意义重大"
"源宝DN","男","无IP","62924282","6","","10000","2","","1人正在看[doge]"
"唐满星彤","保密","无IP","22667268","6","","10000","4","","现在的原神就是嗓门大决定一切，大部分玩家在大嗓门的口水下只能沉默。沉默的人多了这环境就差了。明白的人又从多数又变成了少数，少数又变得沉默，于是就越来越差了。[原神_躺平]"
"银耳燕窝粥","女","无IP","13250157","6","","10000","10","","老角色越来越弱，新角色越来越强，真有你的米哈游啊"
"Ml指名葵葵96","保密","无IP","330465154","5","","10000","3","","风花街比海灯节确实要好，但是还是无聊"
"飞侠海德斯","男","无IP","639554506","5","","10000","3","","我逛了几个游戏的评论区，骂娘的占了大部分。小部分无关紧要，全是水军可还行。"
"立月小long哥","男","无IP","403035343","6","","10000","3","","玩了半年左右的原神，米游社的角色养成计算器就是假的，最起码会多出一两倍摩拉以上！为什么？因为为了一套圣遗物，耍几天都不一定有个好的，好不容易一个感觉可以的，20级后发现就歪了，掉落能用率超低，升级能用率也低，还低的离谱，所以摩拉根本不够用！[捂脸][捂脸]真难肝！"
"批佧丘吖","男","无IP","45801257","6","","10000","3","","可以加强一下雷系嘛 哪怕加强一点点也好 球球了[大哭]"
"青小璃吖","保密","无IP","628902993","3","","10000","3","","在座的各位你们可以不出公子，但是我必须出。[doge]"
"泠林","男","无IP","293746706","5","","10000","3","","／ ￣￣ ＼　 ,|　`　` \　  ／````````````````````````````````＼,|　 　 |     |               亲爱的原神               |,\　　 　/ ∠         到时候直接别整个蒙德       |, ＼　　 イ　   \           献的花都是爷采的           |                      ,／　　　\          \                                          /,/　|　　　 \        `````````````````````````````````,|　|　　　 | |        ,|    |             | |"
"诲无垠","保密","无IP","123237252","6","","10000","2","","风花节改复刻了"
"折柳于灞桥","保密","无IP","1167950650","5","","10000","2","","在这个版本入坑的，时间过得太快了"
"四月有芳菲","女","无IP","73763449","5","","10000","2","","温迪好白呀，诶嘿[原神_G嘿]"
"哇哦biubiu","保密","无IP","21047518","6","2233幻星集","10000","2","","又是温迪即将到来之际咯[给心心]"
"匆匆无从","男","无IP","492157982","5","","10000","5","","劝新人不要看这美好pv入坑啊 这个游戏就是大号的八重樱村子[doge][doge] 没啥好玩的 一个角色卖至少1300 还不包括深坑的武器池  就连体力都要钱买  肝都救不了 还时不时有欧狗跳脸  线下大型玩家pvp 对线 圣遗物就是隔壁阴阳师御魂那一套  强化圣遗物全是防御生命  地图长期长草  ch长期不当人 双标有一手  对玩家有利的bug当天就给你修复了  对玩家不利的bug拖个大半年都不给你修 还有洗地党这是机制    实在要玩 我建议你不要玩雷系  那就是垃圾  打啥都免疫  [doge][doge]  特别是紫色的单手剑美少女[妙啊][妙啊][妙啊],地图开发效率慢  就喜欢塞点小游戏搪塞玩家  美称过节日  然后就是疯狂出新角色 新出的角色秒天秒地  喊了大半年的旧角色加强就当没看见   角色的养成周期极长  金币 经验书缺太多  20体力换4-5本紫书  或者6万 金币  一天160体力上限 养一个角色80级紫书371本   金币大几百万  还不包括天赋材料升级金币 就比如8级天赋就要26万  而且还卡技能材料  比如我这一个月就掉了8个吐息  1个爪子 1个羽毛  不巧的是我养的迪卢克和女仆 卡了一个月还是686 866  真的nb   50级以后闲的长草体力浓缩4次没了  天赋本最高级 4蓝4绿不能再多了 更别说紫色  或者武器材料本的金色了  如果你要刷圣遗物那就更是无底洞  几十个树脂进火本  都不定火本毕业 所以慎入坑  [妙啊][妙啊]"
"伊卡洛斯awsl","男","无IP","243654770","6","刀说异数","10000","3","","公子都复刻了，那钟离是不是[doge]"
"还是要幸福灬","男","无IP","23811238","5","星座系列：狮子座","10000","3","","你们的海灯节是我玩游戏这么多年来头一次在游戏大型活动里感到寂寞空旷的活动![翻白眼]"
"MZ-Tan","男","无IP","399957990","5","异常生物","10000","3","8","兄弟们顶我上去，我们确实是一直应该保持好的态度去反馈意见哒，原神官方相信你们也会看得到，期待原神以及原神的各方面会一直进步下去！"
"雪霁之时","男","无IP","23554273","6","","10000","3","","我来总结一下，四星角色新出galgame形式剧情（应该的应给的）。高人气角色刻晴也专门up了一次。然而，别的角色故事里依旧基本没有刻晴的戏份，传说任务遥遥无期。            刻晴党哭唧唧。,也是，本来就是骗流水的。"
"伊昔颜丶","女","无IP","1258676374","5","","10000","1","","很巧 之前风花节的时候我正好住院"
"账号已注销","保密","无IP","450713914","0","明日方舟音律系列","5000","1","","怀念，入坑版本"
"East小东","男","无IP","406761924","6","","10000","1","","1.4入的坑，第一个限定五星是温迪[打call]"
"超级硬币鸭","男","无IP","27801743","6","","10000","1","12","想不到弹琴活动风花节就出了万叶弹琴还以为是第一次 [嫌弃]"
"卢伟飞飞","男","无IP","75866704","6","","10000","1","","永别冬都了属于是"
"dxy1106174520","男","无IP","13179243","6","","10000","1","","温迪啥时候复刻阿[微笑]"
"水上清资","保密","无IP","10984864","6","小主安康","10000","1","","风花节都有1000原石，一周年扣的要死"
"Heisei誓约","保密","无IP","472858612","5","约战：精灵再临","10000","1","8","绝了，1.2的特别节目直接跳过了，弹幕都没法看[]"
"人饿了会捡垃圾吃的","保密","无IP","2454674","5","","10000","1","","每次特别节目的兑换码都没有换到[藏狐]"
"纸笔__","保密","无IP","389690564","6","","10000","1","","原宝原宝，考不考虑和【关于我转生变成史莱姆这档事】联动下！！！！！！"
"Trbcmp","保密","无IP","288783118","6","","10000","1","","新的邀约新的邀约新的邀约gkd[原神_哼]"
"星糖酱","女","无IP","1625959313","2","","10000","1","","好耶[原神_G嘿]"
"初夏桐言","女","无IP","382673139","4","","10000","1","","求视频前面的bgm！！(ω` )"
"路过的正E人","男","无IP","40664589","6","斗破苍穹","10000","1","3","b服500000001，求号主看到，想作为一个纪念"
"Eisk_3783","男","无IP","293611015","5","EveOneCat2","10000","1","2","原石。"
"洛星无痕","女","无IP","291972259","5","","10000","1","","温迪公子罗莎莉亚我都有，谁要来合我击剑[doge][doge]"
"不看回复固执己见自便","保密","无IP","679170755","5","原神","10000","1","","等等，两个荣誉骑士，那谁是深渊首脑[热词系列_知识增加]"
"zra真人啊","男","无IP","172927121","5","","10000","1","","温迪已出 芜湖"
"桐心不","保密","无IP","507750478","5","","10000","1","","[崩坏3_路过][崩坏3_魔法少女][崩坏3_糖葫芦]"
"7Firewalking","男","无IP","401581434","3","","10000","1","","昨天把琴歪出来了[doge]"
"Aisumongaアイスモンガ","保密","无IP","33306929","6","","10000","1","","温迪池歪了[大哭]，但是我更喜欢七七[doge]"
"song_pure","女","无IP","630169708","5","","10000","1","","wdnmd，刷一小时没刷到一次想打的挑战"
"贰鼠","保密","无IP","22245854","6","橘猫挂件","10000","1","","啥时候出主线啊，风花节都完了"
"光影会首-查尔斯","保密","无IP","5008619","6","灵笼","10000","1","","好想看主线啊啊啊啊gkdgkd"
"煎龙蛋要撒盐吗","男","无IP","33123194","6","格兰芬多","10000","1","","借楼问下一般一个版本大约持续多久啊？我昨天刚入坑"
"诵脑吗","男","无IP","49591504","6","","10000","1","","好家伙这几条非常人性化，而且相对好做，看看阴阳师就知道了[鼓掌]"
"魂魄妖梦啊啊","保密","无IP","49503699","5","","10000","1","","风之花    我要把温迪作为风之花献上。"
"lindouci","女","无IP","182629682","6","","10000","1","","更新后: 【1.4版本】,,若甘雨受到了两个角色带来的元素精通加成，只要在该加成效果持续期间(无论是先受到加成再施放元素爆发还是先施放元素爆发再受到加成)。元素爆发触发的超导反应均能享受到甘雨被提升过的元素精通加成，但该加成受到天赋持续时间约束，仅在两个天赋同时生效期间可达到峰值。,这是什么意思呢?打个比方:,,1.4版本之前:【砂糖为全队提升了400精通,持续8秒香菱开启了大招，持续14秒】,那么【香菱的大招在全程14秒里，都可以获得400精通】,,1.4版本以及之后: 【砂糖给全队增加了400精通,持续8秒香菱开启大招，持续14秒】,那么【香菱只能在砂糖增加精通的8秒之内,大招获得400精通,砂糖BUFF持续时间结束后，香菱大招不再有精通加成】"
"月见花微澜","保密","无IP","155667928","6","","10000","1","","已歪莫娜，前来抱怨"
"孤山の雨夜","保密","无IP","37047935","6","","10000","1","","罗莎莉亚在教会里的地位明显是行动派打手[喜极而泣]专门解决需要动手的事情"
"小鹿怦怦乱我心","保密","无IP","431053983","5","","10000","1","","单抽出奇迹！"
"^衣","男","无IP","435064192","5","","10000","1","9","罗莎莉亚会是限定吗？"
"答未","保密","无IP","500796356","5","","10000","1","","直到现在还没有个草系角色呢[doge]"
"死屋a","保密","无IP","457306825","4","","10000","1","","98→十连→温迪池→女仆x2，白泽，行秋→368→温迪池→女仆，白泽，刻晴。[热词系列_好活]"
"pqandpkqandlq","保密","无IP","386277386","5","","10000","1","","放假期间冒险等级不够搞不了活动，现在等级够了，开学了"
"月下斯人","女","无IP","410089211","5","","10000","1","","只有我风花节出后，游戏一直闪退吗"
"贺大杨字益达丶","保密","无IP","475659896","5","","10000","1","","虽然83抽出的 还是来还愿了"
"梅比乌鸦","保密","无IP","395597774","5","","10000","1","","《栖身在风与花的海洋》,          栖身在风与花的海洋！,   风    终末的嗟叹是蒲公英的形状,   花    清泉小镇的风车,   节    塞西莉亚花盛开的悬崖上,   快    吟游诗人的国土,   乐    充满着生与死爱与自由的交响,    ！   追寻着世间种种幻象,          在沉沦的悲凉里捧出一把土壤,          繁星依旧 北斗星凉,          此时美酒与微风尚好,          旅行者,          可否与我吟诗一首,          栖身在风与花的海洋！,                         ―白罗于2021年3月19日,               (想转载任意，标明原作者就行)"
"Never_逸轩","男","无IP","48585183","6","2021拜年纪","10000","1","","第三十发出了温迪，开心，撒花[原神_撒花],地点―――蒙德广场女神像,在此祝愿各位天上掉肉、单抽出金[原神_撒花]"
"起个ID可真是难","男","无IP","489201262","5","原神","10000","1","","希望蒙德人这次可以自己做风花[doge]"
"辛逝记芙蓉王","保密","无IP","437334151","5","","10000","1","","／ ￣￣ ＼　               ,|　`　` \　 ／￣￣￣￣￣￣￣￣￣￣￣\,|　 　 |     | 亲爱的原神                        |,\　　 　/ ∠ 请问什么时候出结婚系统   |, ＼　　 イ　   \ 经过这一次邀约任务         | ,／　　　\          \我已经被芭芭拉攻略了   | ,/　|　　    \          \  她把我的心都偷走了  |,|　|              | |         \我现在只想解咒      /,|    |              | |            ￣￣￣￣￣￣￣￣￣￣￣"
"卷积不是积","保密","无IP","479008610","5","","10000","1","","又出了七七，前来还怨"
"⑽-和奏","保密","无IP","143755692","6","神乐七奈","10000","1","","[原神_点赞]"
"太虚山的赤鸢仙人","保密","无IP","446944294","5","","10000","1","","不知不觉，已经从1.1白嫖到1.4了[吃瓜]"
"幽冥息A","男","无IP","185767505","6","","10000","1","8","没有温迪的最后3小时！"
"客卿の","男","无IP","433221601","6","泠鸢yousa登门喜鹊","10000","1","","提前许愿温迪"
"客卿の","男","无IP","433221601","6","泠鸢yousa登门喜鹊","10000","1","","出必还愿"
"丨想要一顿毒打丨","男","无IP","312042280","5","","10000","1","","好家伙，这回是吃的喝的都有了[doge][doge][doge]"
"ZAZCAT","男","无IP","153218013","5","洛天依8th生日纪念","10000","1","","温蒂！"
"阿见多","保密","无IP","701680928","5","","10000","1","","新怪物       x,每周必死   √"
"鄢","男","无IP","37840595","6","","10000","1","","希望能看见吧。。我想 在原神的世界里 有个家 之前没联机的时候看霄灯也是我自己一个人 真的感觉我只是个过客"
"dawningj","男","无IP","57399937","6","","10000","1","10","https://b23.tv/NBeE7q,胡桃重击没伤害bug什么时候修？不会比刻晴修的慢吧[doge][doge]"
"孤星而已","男","无IP","358247304","5","","10000","1","","没赶上公交   uid106843858"
"花绿树","男","无IP","244481726","5","","10000","1","","温迪的配音喵酱声音这么好听一定是是个大胖子[妙啊]"
"_傲世万物_","男","无IP","355578070","5","","10000","1","","有没有人带我玩原神啊，新手刚玩一个周，大佬求带，动态有我的原神id。[呲牙][呲牙]"
"普通的[蛲婕_小希","女","无IP","556790108","5","","10000","1","","求n配的茶播。"
"Ahebechi","保密","无IP","160186159","6","不良人","10000","1","","太好了，这次羽球的制作终于不用我一个人包下所有了[doge]"
"有空且追番66","男","无IP","397640279","4","","10000","1","","什么时候跟官服互通啊"
"LeapSoon","男","无IP","516969904","5","","10000","1","","-===十===-,／                   ＼　 ,丨 ｜  丨丿丿 \   \　    ／￣￣￣￣￣￣＼,丨 丨       <    |  |　 ／  亲爱的旅行者  \,丨\   \          J  J     ∠   记得预下载哦  / ,丨￣￣￣￣￣￣           \_______________/,J  ______________,   ／ ／　　　\, ／  / 应急食品 \"
"JFXsuger","保密","无IP","400659869","4","","10000","1","","点赞，必出温迪"
"獠牙416","保密","无IP","503465390","5","","10000","1","","甘雨什么时候复刻"
"呵呵这真是极好的","男","无IP","16095031","5","","10000","1","","请不要再和肯德基合作了，谢谢！"
"呵呵这真是极好的","男","无IP","16095031","5","","10000","1","","请不要再和肯德基合作了，谢谢，"
"呵呵这真是极好的","男","无IP","16095031","5","","10000","1","","请不要再和肯德基合作了，谢谢？"
"呵呵这真是极好的","男","无IP","16095031","5","","10000","1","","请不要再和肯德基合作了，谢谢。"
"一二月的细雨","保密","无IP","321311088","5","","10000","1","4","倒挂的七天神像，暗示暗元素吗[doge]"
"雨林冻原のDragonfly","保密","无IP","402770953","5","2233幻星集","10000","1","","给风神献上他最喜爱的祭品：鱼[OK]"
"雨林冻原のDragonfly","保密","无IP","402770953","5","2233幻星集","10000","1","","1.4四星出四个角色的邀约。1.5五星出五个角色邀约[doge]"
"KING头头","男","无IP","152341558","5","","10000","1","","求蒙德茶会的BGM啊！！！！！"
"Never_逸轩","男","无IP","48585183","6","2021拜年纪","10000","1","","来了来了"
"Never_逸轩","男","无IP","48585183","6","2021拜年纪","10000","1","","温迪我是你的信徒啊（飞扑"
"吾刻","保密","无IP","1813055760","2","","10000","1","","凑斤1W"
"{","男","无IP","690975308","5","又一充电中","10000","1","","常驻第一个金居然是狼末[疑惑]"
"热心白嫖的狗子","男","无IP","565822464","5","","10000","1","","-------------,（F   琴  ,    -------------[脱单doge]"
"小王大虫","男","无IP","119004552","6","","10000","1","","手机端能不能出个自定义键位啊？[大哭]"
"全食movie","男","无IP","373881563","5","","10000","1","","[原神_期待]"
"枝鹅什么时候结婚","保密","无IP","352607313","5","","10000","1","","有一对情侣，男的非常懦弱，做什么事情之前都让女友先试。女友对此十分不满。,一次，两人出海，返航时，飓风将小艇摧毁，幸亏女友抓住了一块木板才保住了两人的性命。,女友问男友：“你怕吗？”,男友从怀中掏出一把水果刀，说：“怕，但有鲨鱼来，我就用这个对付它。”女友只是摇头苦笑。,不久，一艘货轮发现了他们，正当他们欣喜若狂时，一群鲨鱼出现了，女友大叫：“我们一起用力游，会没事的！”男友却突然用力将女友推进海里，扒着木板朝货轮游去，并喊道：“这次我先试！”,女友惊呆了，望着男友的背影，感到非常绝望。,鲨鱼正在靠近，可鲨鱼对女友不感兴趣而径直向男友游去，男友被鲨鱼凶猛地撕咬着，他发疯似地冲女友喊道：“我爱你！”,女友获救了，甲板上的人都在默哀，船长坐到女友身边说：“小姐，他是我见过最勇敢的人。我们为他祈祷！”,“不，他是个胆小鬼。”女友冷冷地说。,“您怎么这样说呢？刚才我一直用望远镜观察你们，我清楚地看到他把你推开后用刀子割破了自己的手腕。鲨鱼对血腥味很敏感，如果他不这样做来争取时间，恐怕你永远不会出现在这艘船上。”,“什么？”女友听到真相如同晴天霹雳，她悲痛欲绝，伤心无比，,但她突然想到男友是玩原神的。生前一直苦于没有好友而不能快乐的体验联机模式，想要完成他的愿望。就把ID挂在这了,154118798  官服 留ID也行啊"
