"昵称","性别","IP","UID","等级","装扮","用户权重","获赞数","粉丝团等级","评论"
"无暇之铭","男","无IP","37277207","6","","10000","1","","这次直播真的不错，就是弹幕影响体验，素质极差，整天氵氵氵，泳装泳装泳装，有病吗，这样对他们的心血真的很不尊重，烦skr人[热词系列_害]"
"花","保密","无IP","37983112","6","","10000","1","","说不定刷屏恶心人的是故意有人来搞得[怪我咯]"
"El_CCCChristina","男","无IP","22195309","6","崩坏3・天穹流星","10000","1","7","官方可以屏蔽些直播弹幕吗..设置关键词之类的"
"真我刻印","保密","无IP","92677720","5","初音未来13周年","10000","1","","讲个笑话！每次直播我都能错过！[笑哭]"
"茶墨吧","保密","无IP","439266355","5","","10000","1","","刚入坑不久，也是第一次看直播，被弹屏素质震惊了，没想到。。"
"夏ゆず","保密","无IP","23008884","6","-阿库娅","10000","1","11","编剧这次估计被吓到了，疯狂剧透w 能把阵营战的语音补录上真的帮大忙了，期待新的活动剧情"
"肝乃欧气之缘","男","无IP","224382132","6","星座系列：狮子座","10000","1","10","这次直播挺有意思的，没之前那么尬了，米哈游加油[崩坏3_点赞]"
"蛋蛋的一夜","保密","无IP","319561312","5","","10000","1","","要5级了  不知道说啥好  先祝大家一发入魂吧[呲牙]"
"柠檬味的桃纸","男","无IP","9030736","6","","10000","1","","玩家真是太浮躁了"
"Yu_Ki_No","男","无IP","94885406","6","","10000","1","6","那位老哥真的吾辈楷模，牛逼"
"笑君舞剑","保密","无IP","38091320","6","","10000","1","","主线剧情版本更新后就播放吧，每次听到主线更新都很期待。但每次出来都要版本的后半段时间才能玩，等的好烦啊。特别是看了这次16章之后。特别想看后续。米哈游就别再继续拖了，先更主线内容吧"
"5万年神州钢板","保密","无IP","152885635","6","Kizuna AI","10000","1","","错过3.5个亿水晶[无语]"
"Liyo_里优","男","无IP","199643996","6","","10000","1","","言尽于此.jpg"
"如虎添翼v","男","无IP","7944508","6","","10000","1","","加班编剧口罩的鼻夹是不是没压下去[小电视_吃惊]"
"曜拥男】喙","保密","无IP","5673096","6","","10000","1","","昨天直播？？？？可恶啊错过一个亿啊"
"mizu丶","男","无IP","8071056","6","良辰美景・不问天","10000","1","5","这就是观星吗 爱了爱了[热词系列_泪目]"
"舰艇德茵婧","女","无IP","24073810","6","","10000","1","","希望刷兑换码和策划有事的人没了[保佑][保佑][保佑]"
"单秋人","保密","无IP","353408760","6","良辰美景・不问天","10000","1","","加班编剧要加工资，本场直播的MVP啊[doge]"
"脑瓜疼也想不出ID","男","无IP","8803756","6","","10000","1","","那个。。。弱弱的问一句，桌面上那个嘤嘤嘤的小飞机去哪买啊"
"高虚伪","保密","无IP","285414034","4","","10000","1","","求大佬翻请问女王超限是加强吗？"
"接放肆漫画七话腰斩","保密","无IP","28569000","6","","10000","1","2","别虐琪芽了，以后好好推自己的官配不香吗，前期夹私整幺蛾子，好好写我氪爆"
"绫濑汐音","保密","无IP","7196884","6","初音未来13周年","10000","1","","第一次没注意到有直播[酸了][酸了]"
"tao陶之药","男","无IP","26951162","6","","10000","1","","这直播我竟然都不知道"
"白色唷唷C","男","无IP","21124159","5","2021拜年纪活动专属","10000","1","3","这次直播效果其实还不错"
"逸^","男","无IP","336803835","6","","10000","1","","第一次在现场把直播全看完，但是看完下来弹幕的观感非常差，我因为是用手机看所以关了好几次弹幕"
"漫游群星Stellaris","男","无IP","293617904","6","崩坏：星穹铁道","10000","1","4","求求你们开个等级禁言吧[无语]"
"再熬夜就吃蟹特","女","无IP","31878612","6","斗破苍穹","10000","1","","[崩坏3_唢呐][崩坏3_唢呐][崩坏3_唢呐]"
"我想博学起来","男","无IP","36596617","5","","10000","1","","诸葛村夫 你敢！"
"公园嘻嘻嘻","保密","无IP","1945544","6","","10000","1","","昨天直播的时候真是一堆老希望工程了，笑死我了"
"frank9554","保密","无IP","2577263","6","","10000","1","10","大赞编剧讲的内容"
"p","保密","无IP","12079935","6","","10000","1","","淦，稀里糊涂的又忘了用兑换码[笑哭]"
"qwq丿憨憨","保密","无IP","352305679","5","","10000","1","","不小心看完直播了，150水晶没领[大哭]"
"DeepLittleRed","男","无IP","10065484","6","拜年祭粉丝专鼠","10000","1","","所以神之键是要出还是不出[tv_晕]"
"天诺杂碎5p一碗","保密","无IP","174450416","5","","10000","1","","等黑胖出来，当场用牛马牛强袭试刀[吃瓜]"
"默F世恶","保密","无IP","390809597","5","","10000","1","","凌晨三点多才发出，有毒吧。。。。可惜我没来得及看。。。。。我的二百五水晶啊！！！！[大哭][大哭][大哭]"
"夏依冬语","男","无IP","297015161","5","约战・狂三","10000","1","","早起党的胜利[崩坏3_开心]"
"坚谷邦","保密","无IP","10076522","6","","10000","1","6","大半夜的[笑哭]"
"愿化星辰守护かの","男","无IP","275214996","6","洛天依8th生日纪念","10000","1","6","深夜党的福利[哈欠]"
"葵翎儿","男","无IP","352101628","5","国民老公带回家","10000","1","6","我的250氵[大哭][大哭][大哭]"
"m笠","保密","无IP","24565012","6","","10000","1","","就算是录像也不能这么瞧不起人吧？删了，两个小时后再发[doge]"
"这个UP主很润","保密","无IP","297370966","5","","10000","1","","[doge][doge][doge]"
"这个UP主很润","保密","无IP","297370966","5","","10000","1","","熬夜对手机不好[doge]"
"炸鸡腿吃到饱","男","无IP","27316692","6","","10000","1","1","[doge]再晚两小时发"
"中二半X","男","无IP","15149427","6","贝拉kira","10000","1","","怎么回事 瞧不起谁呢 晚两小时发！[热词系列_知识增加]"
"37293027","男","无IP","37293027","6","","10000","1","","加班岳父[doge]"
"\田光","男","广东","1494931","6","","10000","1","","考古"
"黑岩菌控小四","保密","无IP","26430292","6","","10000","2","7","特意搜了下朔夜观星的意思，有一老哥说 没有月下，才好观星[笑哭][笑哭][笑哭]md绝了"
"喜欢艾露露的画魂","男","无IP","8281503","6","小希","10000","2","8","感觉除主世界外所有世界泡的德丽莎都和舰长炒CP的感觉！虽然我支持姬子阿姐，但还是想喊出那句话：“德丽莎世界第一可爱！”"
"Seele-_Vollerei","保密","无IP","295636220","5","","10000","2","","这评论的排序就离谱[疑惑]"
"时光流去何留余","保密","无IP","16448728","6","碧蓝之海","10000","2","","让我康康有多少只夜猫子[热词系列_知识增加][热词系列_知识增加][热词系列_知识增加]"
"百夜独炽","保密","无IP","131231379","6","原神","10000","2","2","再早点，瞧不起谁呢？[doge]"
"瑟瑟发抖菜鸡洛","男","无IP","179170130","6","2021拜年纪","10000","2","","瞧不起谁能？再晚两小时"
"水银灯和真奈子我你们","保密","无IP","324528814","5","","10000","2","","后崩坏书第二部什么出[呲牙][呲牙]"
"瑞君Zero","保密","无IP","23968939","6","崩坏3・天穹流星","10000","2","6","没看直播，只能看回放，你还上传这么慢，扣工资！[tv_doge]"
"蒸汽狮子座","保密","无IP","5438572","6","","10000","4","","两千块钱出不了卡夫卡两件套，,2断光,3极夜,古中,古下,迪上,卡上，,玩尼码呢，垃圾游戏就区死啊！！"
"若殇菌","男","无IP","8266262","6","","10000","2","","瞧不起谁呢 再晚点发"
"蒸汽狮子座","保密","无IP","5438572","6","","10000","3","","两千块钱出不了卡夫卡两件套，,2断光,3极夜,古中,古下,迪上,卡上，,玩尼玛，垃圾游戏就区死啊！！"
"蒸汽狮子座","保密","无IP","5438572","6","","10000","2","","两千块钱出不了卡夫卡两件套，,2断光,3极夜,古中,古下,迪上,卡上，,玩尼玛，垃圾游戏就区死啊！！"
"蒸汽狮子座","保密","无IP","5438572","6","","10000","2","","两千块钱出不了卡夫卡两件套，,2断光,3极夜,古中,古下,迪上,卡上，,玩尼码呢，垃圾游戏就区死啊！！"
"stallion-maniac","男","无IP","28302840","6","","10000","1","","我特么 糙 淦 我特么昨天忘了上线领水啊啊啊啊啊啊啊 糙 想一巴掌抽死自己"
"刻晴娜","保密","无IP","25594247","5","原神","10000","1","","直播弹幕不忍直视"
"-四条琉璃-","男","无IP","441767225","5","","10000","1","","在主线里还是没得舰长，气抖冷舰长什么时候才能站起来？（记在小本本上）[吃瓜]"
"捎巧擞教镜","男","无IP","7470394","6","星座系列：双鱼座","10000","1","","错过兑换码的+1[大哭]"
"少年纪啊啊啊","保密","无IP","36029866","5","国民老公带回家","10000","1","","上次直播感觉大伟哥旁边那个人声音像赫萝，这次的加班编剧像彩笔[doge]"
"万能女仆早坂","保密","无IP","357075556","6","","10000","1","","希望(ch)……"
"就没有什么好昵称吗","保密","无IP","288204139","6","原神","10000","1","","芽衣厨在哪里，救救芽衣！"
"亚索の疾风剑豪","保密","无IP","143516409","6","良辰美景・不问天","10000","1","","姬子皮肤在51：00分。喜欢姬子的可以直接去看[OK]"
"tatterfre","男","无IP","15140399","6","","10000","1","","唉，今天要返校，昨天没看直播。下个版本还会乳芽么?[doge]"
"哦豁_凉到底","男","无IP","219789997","6","公主连结凯露","10000","1","","不够尬！[doge]"
"2o2又开始吃土了","保密","无IP","17947604","6","原神","10000","1","","就这？删了五"
"阿伟丨丨","男","无IP","85335680","5","","10000","1","5","还可以再早点[doge]"
"摸鱼划水狗","男","无IP","1293883","6","","10000","1","","牛逼"
"以色列名宿","女","无IP","381559126","5","","10000","1","","女王是不是快变成最弱的律者了，，还有温蒂，那没事了[doge]，还有个垫底的[doge]"
"很多玩家","保密","无IP","213163220","6","","10000","1","","快"
"黛尔塔Official","保密","无IP","275967833","5","","10000","2","","之前评论被吞了，崩三你自己绿色不能不爱听啊真的是,昨天直播我也是看了，一堆人在哪里什么都聊，1求一期泳装复刻的，巴不得游戏死，估计出了自己不会买就会跟风口嗨，2乱几把ky联想的，3老婆狂粉…反正各种乱口嗨。现在评论区一片歌舞升平，控舆论这一块真有你的，编剧说什么我偷崩二的活那是《双观》，别尬黑了，新boss背景还是崩二追溯第二章呢。其次，一堆人喷崩二炼铜，桌子上新的三个小不点立牌怎么说？百口莫辩小不点系列出的比崩崩炼铜早，你上架一堆立牌还不如把你星梦爹放出来呢，星梦一个立牌就能抵这一堆的销量"
"辣东风","保密","无IP","92954139","6","","10000","2","10","你这实机操作根本没法看，建议下次请个大佬做实机展示，还有关键的新武器也不展示。日服每次直播都有大佬进行新角色新武器的实机展示，跟日服直播比差的不是一点半点[笑]"
"ASUSWA","男","无IP","3272632","6","","10000","1","","别控评宝贝"
"蒸汽狮子座","保密","无IP","5438572","6","","10000","1","","两千块钱出不了卡夫卡两件套，,2断光,3极夜,古中,古下,迪上,卡上，,玩尼码呢，垃圾游戏就区死啊！！"
"Olaolaol","保密","无IP","9197462","6","","10000","1","","希望ch有事，观星碎片搁这卖菜呢？一口价600，500不能再少了"
"雷吉德芙","男","无IP","68123504","6","","10000","1","","为什么你们对ch割你们这么不在意？都是咸鱼党？"
"雷吉德芙","男","无IP","68123504","6","","10000","1","","话说 啥时候 游戏ch不能喷了？  不喷  还是零点概率  舰长也只是一只人形舔狗  不喷 羽渡尘等一众装备早都出了   你咸鱼就咸鱼呗 别人追求强度  别人觉得不行，别人也可以喷   ,还有ch不是指的某个人"
"辣东风","保密","无IP","92954139","6","","10000","2","10","送的水连一抽都不够还不准说哦[点赞]那你下次别送水啊，这样就没人刷了，因为没人看了[滑稽]"
"大飞飞","保密","无IP","1516170","6","","10000","2","","笑死了 水晶都不能领了,你看我今年充不充钱就完事儿了"
"汕美女婿","保密","无IP","24084894","6","","10000","2","","隔壁战双宣布联动尼尔了[战双帕弥什_诶嘿]"
"蒸汽狮子座","保密","无IP","5438572","6","","10000","1","","两千块钱出不了卡夫卡两件套，,2断光,3极夜,古中,古下,迪上,卡上，,玩尼玛，垃圾游戏就区死啊！！"
"-诸葛孔明-","男","无IP","180493067","6","","10000","1","1","把蹦蹦蹦做成页游好了，什么？早就是了，那没事了"
"蒸汽狮子座","保密","无IP","5438572","6","","10000","1","","两千块钱出不了卡夫卡两件套，,2断光,3极夜,古中,古下,迪上,卡上，,玩尼码呢，垃圾游戏就区死啊！！"
"蒸汽狮子座","保密","无IP","5438572","6","","10000","1","","两千块钱出不了卡夫卡两件套，,2断光,3极夜,古中,古下,迪上,卡上，,玩尼玛，垃圾游戏就区死啊！！"
"想要好好活着","保密","无IP","43559024","6","崩坏3・天穹流星","10000","1","","观星的qte有点战双的味道"
"鸡场的鸡不香","男","无IP","15249901","6","","10000","1","","剧情和美工是不错的但是游戏本身屎一样，抽装备打排名加小游戏，又氪又肝不能挂机，好看外表下的烂游戏。"
"原宿之心","保密","无IP","35648588","6","","10000","0","","这段bgm也不一样，为啥都做好了不直接搬上来"
"Ctro233","保密","无IP","220143612","6","崩坏3・天穹流星","10000","0","","为什么花灯cg没有配音！"
"689立清华奏","男","无IP","556160757","5","","10000","0","3","快到周年庆剧情了，还是加班编剧吗？"
"其-将-铭-记","男","无IP","121945396","5","","10000","0","","ch别吃独食啊"
"墨江沫白","保密","无IP","19919159","6","星座系列：狮子座","10000","0","","渡鸦的海景房什么时候再给她做一个"
"爱睡午觉的画扇","保密","无IP","266684708","5","乐正绫五周年生日","10000","0","","所以以后观星只能叫他爸爸了[doge][doge][doge]"
"百技艺行","男","无IP","3648400","6","","10000","0","","[吃瓜]∠(  」∠)_"
"LockerWisdon","男","无IP","522033528","3","","10000","0","","和女王直接五星搭配aaa,意想不到,出人意料"
"辜诚挑战","保密","无IP","228208588","6","","10000","0","7","我来组成头部"
"澜晓兰","保密","无IP","38516590","6","","10000","0","6","直播好了，游戏体验差了[tv_皱眉][tv_皱眉]"
"来救","保密","无IP","3797744","6","快把我哥带走","10000","0","","命运石之门"
"_起灵__","保密","无IP","278440425","5","","10000","0","","[doge]"
"k423的夜辉","保密","无IP","287048348","5","","10000","0","4","我还看到了宿舍小飞机的实物!!"
"k423的夜辉","保密","无IP","287048348","5","","10000","0","4","好多心周边啊(￣ε(#￣) Σ"
"k423的夜辉","保密","无IP","287048348","5","","10000","0","4","小不点系列出新周边了(°°)"
"没有硬币改名字2233","保密","无IP","275629197","5","","10000","0","","米忽悠更新太慢了吧快一点了[无语]"
"CageCageeee","男","无IP","273430922","6","公主连结佩可莉姆","10000","0","","所以我这辈子能不能见到雷律了[翻白眼]"
"希仁大护法","男","无IP","53583430","6","EveOneCat2","10000","0","","BGM是啥啊啊啊啊，跪求[大哭]"
"成就众生清净愿","男","无IP","38058183","6","梦塔・雪谜城","10000","0","","什么时候更新好啊啊啊啊这都11：07了"
"佐贺偶像","保密","无IP","391384780","5","","10000","0","","网络连接失败！"
"唯你夏意渐深","男","无IP","37529838","6","","10000","0","","是不是说漏嘴了  主线第十七章把休伯利安关量子之海里了然后遇到观星？"
"奶茶酱不是喝的","男","无IP","106182914","5","新月冰冰","10000","0","","不是有个版本丽塔作为宰相辅助想成为歌手的德丽莎吗，还跟舰长处cp了，这是那这个德丽莎是观星吗？"
"黑暗贞德","保密","无IP","505574886","4","","10000","0","","3:00 为什么会直播？"
"没救了毁灭吧","女","无IP","210204661","5","","10000","0","","弱弱问问 这次有皮肤吗 可以白嫖吗 还没看完……[tv_笑哭]"
"l魂灼","保密","无IP","167345008","6","崩坏：星穹铁道","10000","0","","为什么每次直播我都会错过啊[大哭]我明明都特别关注了[捂脸]"
"绝对的戏言","男","无IP","3332933","6","","10000","0","","我已经弃坑了，进度太快，人又非，氪不过来了[捂脸]"
"为方便改名屯硬币","保密","无IP","190965562","5","","10000","0","","我忽然想让崩坏开放世界可以回到可以捡材料的时期"
"Missignal_Dev","女","无IP","35398117","6","斩兽之刃","10000","0","","在？啥时候优化一下桌面版？我8750H+1060 1080P桌面端高画质不开物理模拟和扭曲效果，深渊打怪10帧以下，别说手游了，PC平台我都没见过这么吃配置的游戏。模拟器就好多了，但用着麻烦"
"初夏花雪","女","无IP","323548063","5","崩坏3・天穹流星","10000","0","7","话说有没有人知道观星那段的bgm是啥..."
"萌萌哒伊芙","男","无IP","4108161","6","","10000","0","7","我怀疑有小号刷屏，但是我没有证据[吃瓜]"
"馒头wa馅desu","保密","无IP","282524594","5","","10000","0","","话说长空市人都没了，有什么实验好做？"
"赤鸢浮华上仙","保密","无IP","274351489","5","","10000","0","","弱弱地问一句，朔夜观星是A级女武神吗？"
"很会关心人","保密","无IP","508139925","5","","10000","0","","此时天父还只有90%"
"穹穹穹穹穹穹穹","男","无IP","103238730","6","","10000","0","","爷忘记领氵了 淦"
"上洞村人在江湖飘","保密","无IP","315957724","6","三周年恋曲","10000","0","7","两位编剧辛苦了"
"东北熊孩子户外","保密","无IP","478300141","5","","10000","0","","上国行switch啊 ！指定 老多人了"
"x战逃的漏网之鱼","保密","无IP","13705116","6","咩栗","10000","0","","我的眼神好看吗，你感到安心吗？那就对了，无数次蛋池沉船换来的[doge]"
"明德物","男","无IP","14201913","6","","10000","0","","呆鹅抱枕啥时候卖！"
"山夕月SY","男","无IP","2979172","6","梦塔・雪谜城","10000","0","1","这次有一个钟头啊 不容易"
"山夕月SY","男","无IP","2979172","6","梦塔・雪谜城","10000","0","1","这播放量着实有点[笑哭]"
"~的C","保密","无IP","287989378","5","进击的冰糖","10000","0","","什么时候更新"
"抱抱暴","保密","无IP","24222442","5","","10000","0","","【公主连结_怎么这样】"
"叶雨枫棠","保密","无IP","85344249","6","","10000","0","","空无超限了个空气"
"Tian-qing","男","无IP","403459559","5","","10000","0","","大佬们 冰塔全齐了了 该怎么配阵容啊"
"初ココロ","男","无IP","288191806","6","初音未来13周年","10000","0","","什么时候更新啊"
"辣东风","保密","无IP","92954139","6","","10000","0","10","5556658"
"你的小八吖","保密","无IP","238178795","5","","10000","0","","[doge][]"
"ssolreven","女","无IP","75995891","6","公主连结可可萝","10000","0","","好玩就得了"
"赤灯MD","保密","无IP","161875231","6","初音未来13周年","10000","0","3","woc是呆鹅的抱枕，gkd！我买！"
"高级饮水机助理","保密","无IP","22321425","6","","10000","0","","世界头号德丽莎厨出处37分"
"挚爱_五五开","男","无IP","363172090","5","","10000","0","","至少那位大佬让紫鸢从地底拉到了很多战场专用"
"不要在卷卷卷卷卷卷啦","男","无IP","73675187","6","天谕","10000","0","","昨天看直播水军弹幕太烦了[无语]"
"无人之舟","保密","无IP","354617198","6","梦塔・雪谜城","10000","0","6","问一下，具体什么时候4・0版本更新？"
"灰灰灰海","男","无IP","23292254","6","原神","10000","0","","编剧小哥哥你能看到我嘛？给你点个赞hhh，i了i了"
"百落红","保密","无IP","390181479","5","","10000","0","","错过了，好难受[大哭]"
"Dr-南行","保密","无IP","301165878","5","","10000","0","","这个版本要回忆杀"
"仙王降临","男","无IP","16472797","6","小试身手","10000","0","","戴口罩不如不露脸   感觉怪怪的"
"Excuse丨Me丨喵丨喵丨","保密","无IP","18069418","6","","10000","0","","很好昨晚一l入魂\希女王然也有"
"弦余a","女","无IP","10653532","6","","10000","0","3","喜欢健谈的编剧小哥！！！！好评[打call][打call][打call]"
"枕边吟诗作秀","男","无IP","64322702","6","","10000","0","","音频给我交了！"
"水逆退散了","男","无IP","49549465","5","","10000","0","4",""
"水逆退散了","男","无IP","49549465","5","","10000","0","4","厨不动了，爆率那叫一个高"
"一点橙意","男","无IP","474778564","5","","10000","0","5","能和darling in the franxx 联名吗"
"无瓷想睡觉","保密","无IP","176558376","5","崩坏3・天穹流星","10000","0","","世界蛇老板娘来啦，虽然没赶上昨天的直播。"
"纯白火山-offical","保密","无IP","429923891","4","纳米核心","10000","0","","[崩坏3_有主意了][崩坏3_糖葫芦]"
"螺旋状晶体","保密","无IP","1296852","6","","10000","0","5","这次的直播感觉比以前好了"
"雪-筱","保密","无IP","524362287","5","","10000","0","","唉"
"污滑稽","男","无IP","21860309","6","","10000","0","","今年给勿忘出件儿婚纱呗"
"鸣炙","男","无IP","258867297","6","","10000","0","","我有钱，我氪爆[tv_大哭]"
"老师天外仙","保密","无IP","25530904","6","","10000","0","","编剧真能聊，感觉这是最热闹的一次直播了"
"春天填充图册","男","无IP","89278893","6","","10000","0","","这次的直播效果很棒的[打call]"
"我滴任务完成啦哈哈","保密","无IP","276861531","5","","10000","0","","请务必继续尬下去[喜极而泣]"
"Order_阿包","保密","无IP","68290275","6","#EveOneCat","10000","0","","看到有人说姬子复活，感觉像假的，复活应该是不可能的，但是出角色就有可能"
"先给符华买犹大","保密","无IP","386275399","5","","10000","0","","看直播nt太多了，所以我看回放[妙啊][妙啊][妙啊]"
"-见素抱朴-","男","无IP","7616888","6","","10000","0","","玩halo玩到忘了有直播，水晶没拿到[笑哭]"
"みさか10777号","保密","无IP","156752724","6","原神","10000","0","","码过期了？！"
"羽扬大大","男","无IP","243184880","6","","10000","0","","我来问问两人的皮肤能白嫖吗"
"毕导FKU","男","无IP","131642270","5","菜菜子","10000","0","","崩坏三出bug了，怎么反馈？"
"棉花丹糖","男","无IP","307435281","5","","10000","0","","当时直播的时候发型老师基本没怎么说过话，直播间全靠加班编剧撑场子[笑哭]加班编剧辛苦了[呲牙],加班编剧真的很不错啊，聊了观星和那位放弃材料学专业的小哥的历史[doge][doge][doge]"
"木瓜星灵2333","保密","无IP","57586555","6","国民老公带回家","10000","0","","忘记看直播了"
"j菌冷离","保密","无IP","299424385","6","斗破苍穹","10000","0","","有码吗舰长们，发一下呗[doge]"
"异笑","保密","无IP","11949158","6","","10000","0","","又错过了[热词系列_我裂开了]"
"纸偶ド`ル","女","无IP","238162052","6","hanser","10000","0","7","太有石头门那味了"
"辛念思","男","无IP","31569274","6","","10000","0","","老活动复刻想要来，想看剧情，这回崩坏国记的前几个剧情都没看到，难受"
"铃仙本仙","保密","无IP","8122284","6","三周年恋曲","10000","0","","泳装为什么不能复刻？隔壁bl尺度比这大多了吧[doge]"
"Le_o","保密","无IP","288653037","5","","10000","0","","祈愿第三期还开吗[鸡腿]"
"我_我投降","保密","无IP","100676367","5","","10000","0","","交出来啊！"
"zzx6646","保密","无IP","10981261","6","","10000","0","","能不能把兑换码有效时间加长点？加长到当天晚上24点就行啊，这样想看直播的看直播，不想看直播的直接等人分享兑换码就行了，何必这样呢？"
"我想打咏春","保密","无IP","383790375","4","","10000","0","","丽塔没了[doge][doge][doge][doge][doge][doge][doge][doge][doge][doge][doge][doge][doge][doge][doge][doge][doge][doge]这些狗头够了吧"
"天道无尽","男","无IP","54242750","6","","10000","0","6","终于不是那么尬了"
"从此在天边","女","无IP","2385477","6","","10000","0","","崩崩崩养成成本太高了！策划放点水呀~~"
"宛若烟雨任平生","保密","无IP","277821942","6","","10000","0","","以后让角色设计编剧多来啊"
"到底奖学金","保密","无IP","21448584","5","","10000","0","","没有后崩吗"
"蟹蟹异术家","男","无IP","351357710","5","","10000","0","","崩坏三(×)[doge],崩坏四()[doge]"
"天下之器皆可舍","保密","无IP","35739069","6","","10000","0","","做的很好，加油"
"knight丶勿念","男","无IP","130716316","6","","10000","0","","话说4. 0版本什么时候更新亚"
"学会单推","保密","无IP","57866535","6","","10000","0","","错过了，哇哇哇"
"这个冰块不太冷","保密","无IP","9892617","6","崩坏3・天穹流星","10000","0","","错过了[蛆音娘_吃瓜群众]"
