"昵称","性别","IP","UID","等级","装扮","用户权重","获赞数","粉丝团等级","评论"
"暗是B","男","无IP","242303679","6","","10000","6","","想起来朋友让我领水晶，结果自己的都忘了[doge]那段时间睡觉或者考试来着。"
"一熠星Kiraoshi","保密","重庆","1710428","5","","10000","6","","又来回味了[脱单doge]17:00"
"宇宙露营","男","无IP","11603677","6","","10000","8","","这次直播很好看啊，不尬"
"南l八木0v0","保密","无IP","3120484","6","天才猫猫早凉・头像框","10000","9","7","这次观星剧情太虐了，所以说世界泡里面的侍女和侍卫到底是个啥,貌似是有自己思想的活生生的人,还是崩坏能产物，细思极恐哎,本来以为只是个玩乐的无厘头世界，没想到那么残酷，不会是所谓的其它真实的世界吧。"
"傲世流云","保密","无IP","188726603","6","崩坏：星穹铁道","10000","9","14","这个直播有收藏意义[OK]"
"图不灵Tubring","保密","无IP","83043963","6","","10000","10","2","还有一点我属实不理解，出一个出场技开关和锁词缀功能是不是会影响整个游戏UI和性能呀？？一测的时候商店界面大改版，二测三测又改回去了。？？？你游拿这点精力做一些对玩家真正有益的改动会死？从来都是避重就轻，整得花里胡哨又没实际意义,这只是对游戏的不理解，和本次直播无关。"
"东川墨","男","无IP","8486114","5","","10000","7","","以后还是想在直播里听点像这样的游戏开发过程中的故事，至少特意抽出时间来看的直播不无聊了。"
"伸爪爪俱乐部","保密","无IP","283993214","6","","10000","7","","如果想要好的弹幕氛围请屏蔽,2,希望,抽奖,十连,马，嘛，吗[鼓掌]"
"我可是未来的你啊","保密","无IP","282455070","5","","10000","5","","金属铜的炼制过程[doge]"
"Mr.www_w","男","无IP","14458500","6","","10000","5","","拉低中奖率的人是真的傻，不知道抽奖是抽米游社？？,一个个瞎了？？"
"摸鱼","保密","无IP","20763464","6","","10000","5","","吸血鬼不信神，也不信命运。但像这样出现在我面前的你，一定是我遇到过的最大的奇迹。,你的味道，令人安心，我会一直记得。,与你度过的每分每秒，都是我无可替代的宝贵回忆。,只要从内心祈愿，愿望就会实现对吧？,所以一定会，再见面的！ ,希望有一天这一段也能有配音[跪了][跪了][跪了]"
"琳家狐狸","男","无IP","95783758","6","乃琳Queen","10000","5","2","希望水军出事[保佑]"
"背负着德莉傻的犹大","保密","无IP","277403833","6","","10000","5","","那是我们编剧亲女儿，得加钱！[tv_doge]"
"辰梦星辉","保密","浙江","1976816361","5","","10000","6","","嘉年华回来看了，所以那位大佬是旭光老师吗？"
"沐x泽","保密","无IP","146580703","6","","10000","6","","一兑换码会放,二抽奖别在直播间拉低中奖率了，要抽奖就去米游社去,三一期泳装别想着复刻了，我也没有，想复刻你去找国家有关部门，加油，等着你的好消息"
"大吉祥艹王","女","无IP","177181561","5","原神","10000","6","","三连进度10%……,三连进度30%……,三连进度50%……,三连进度70%……,三连进度90%……,三连进度99%……,三连失败[doge],下次一定[doge]"
"伤风后","男","无IP","35147225","6","","10000","5","","你说烧鸡老师，和我潮流发型有什么关系[喜极而泣]https://www.bilibili.com/video/BV13V411C79P?t=127.8"
"纯白色誓约","男","无IP","11043983","6","崩坏：星穹铁道","10000","4","5","现在回来看，真的是求生欲极强啊[崩坏3_点赞]"
"飞窬","保密","无IP","16191994","6","","10000","4","","什么都不说了，编剧你倒是TMD还我姬子姐姐啊！！！"
"天清色等烟雨","保密","无IP","397419185","6","碧蓝之海","10000","4","5","第一次看崩三版本直播，感觉挺有趣的，加油蹦蹦蹦[打call]"
"冷静の泡面","男","无IP","138477079","6","星瞳梦幻童话头像框","10000","4","","其实我不太理解评论区的骂不送十连嫌福利少的人，我个人认为崩三之所以这样完全是这个类型手游完全是崩三垄断的原因啊，虽然你说比以前好多了什么的，那不是因为崩三竞争力降下来了么[嫌弃]，虽然直播不停地刷水兑换码确实那啥，但是也没必要为厂商说话吧。。"
"漫I客","男","无IP","20441365","6","公主连结凯露","10000","4","","话说观星加入星石兑换 八重霞还在吗 会不会下架"
"装师机","男","无IP","202415075","6","","10000","4","6","忘记昨天有直播错过了一个亿[tv_抓狂]"
"真龙利特雷诺_Official","保密","无IP","16796381","6","美波七海","10000","4","","加班编剧恰独食把隐藏片段给交了"
"乌鸦为什么不能坐飞机","保密","无IP","234178060","6","","10000","4","","编剧深夜加班有加班费吗？"
"焯人冲动","男","无IP","49972541","6","初音未来13周年","10000","4","","换成吴克就没有违和感了"
"了不起的血沼迅猛龙","保密","无IP","12488605","6","","10000","4","","看不起谁呢再晚两小时发[doge][doge]"
"楚莫风","保密","无IP","95662341","6","","10000","4","","删了，半小时每日刷新了在发。看不起我们劈叉人?[崩坏3_路过]"
"香子mVanilla","保密","无IP","88114271","6","2021拜年纪","10000","4","","就算是家里蹲，熬夜对身体也是不好的哦"
"羽瞳_p","保密","无IP","448094941","6","初音未来・16岁生贺头像框","10000","4","","woc，这么晚"
"账号已注销","保密","无IP","865316","0","原神","5000","10","4","我还是觉得没啥意思，可能我对观星没啥兴趣吧...（甚至配音那里我都面无表情）关于国记，鹅将军真就一走再也没回来过了啊丽塔丞相甚至亲自上战场还gg了...不过这次PV的BGM真的很赞，感觉雷律下版本就来了，感觉PV会更燃，稍微期待一下"
"图不灵Tubring","保密","无IP","83043963","6","","10000","10","2","有一说一，这次直播还行，内容算充实，剧情也到位了。,所以这跟游戏运营有什么关系呢？大伙们恶心的是水镜圣痕整的烂活和莫名其妙空降的神之键。先不说水镜和黄月英诸葛亮有屁关系，就这神之键用典都找不到根据的，你说出劫灭，那是凯文剧情有的，甚至你说下版本出羽渡尘我都理解。难道是自己说好的下版本不出羽渡尘，所以骗不了钱强行整个双枪？搁这和玩家打贸易战呢？不会是特朗普的走狗吧？？？所以ch是想着下下版本再出一个羽渡尘继续骗？那爷摊牌了，爷出10万，给我所有女武神加200面板，不过分吧？又不需要整神之键模型，也不需要空降恶心人，直接改数值彳亍不彳亍？反正一个版本＋10dlc，我算是提前20个版本氪到位了。,,总的说就是直播没毛病，怪咱弹幕ky，但是下版本属实恶心人"
"蒸汽狮子座","保密","无IP","5438572","6","","10000","10","","两千块钱出不了卡夫卡两件套，,2断光,3极夜,古中,古下,迪上,卡上，,玩尼玛，垃圾游戏就区死啊！！"
"青眼飞鱼","男","无IP","33402393","6","","10000","16","","emmm  我知道为啥叫卫兵了  我只不过是在崩三下面说了一些米哈游不好的点  也没有言语过激  就立刻有一大堆人来问候我  你喜欢它  我曾经喜欢  现在不喜欢  你有什么资格干涉我的意志  而且  我针对游戏  针对厂家  但没有针对玩家  但转眼有玩家针对我  还进行人身攻击  很有意思,还有那些说什么要*赶紧*  别在这找存在感  呵  我为什么要在你们身上找存在  不过是陪伴了我大半个大学的游戏  我曾经付出了很多很多的心血  我也曾热爱它  但它却一步一步消磨了我的热爱  我来  只想做个仪式性的道别  这样的资格  都不配？  评论区是只能存在卫兵们的溢美之词吗,说了这么多  也肯定还是有人看都不看直接喷   随你吧   我从来都没在乎过你们   从今以后  与崩三再无瓜葛  虽然  还是有那么一丝舍不得"
"超高校级多串","保密","无IP","2123851","6","","10000","5","","[滑稽]果然还是死宅最懂死宅，滔滔不绝"
"乱杀的西瓜","男","无IP","297686460","5","","10000","5","","[doge]"
"网络不好123","保密","无IP","315485710","6","","10000","5","","来了[OK][OK]"
"这个世界根本刹不住车","保密","无IP","25801018","6","EveOneCat2","10000","7","","好家伙，空降氪之键p话都不敢放，感恩戴德"
"永青一页_","保密","无IP","454621270","5","","10000","6","","空降神之键真就没人说呗[吃瓜]评论全在护ch是我没想到的"
"彼岸花丿研","男","无IP","204210913","6","星座系列：双鱼座","10000","3","","为什么花灯cg又没有配音！"
"玩游戏-就是要坑","男","无IP","177122667","6","","10000","3","","一人血书出电影"
"蝶盛","男","无IP","483201052","5","","10000","3","","同学安利给我，但我以为他只是个卡牌手游，就没去理。想现在要入坑，但是手机内存不够，可能要等到十月份才能换新的，问问大家那个时候入坑会不会晚了啊？[大哭]"
"M-Reims","保密","无IP","18155542","6","","10000","3","","水镜的立绘有那么差吗？黑皮这么不招人待见啊，感觉还行啊，金毛黑皮白丝小萝莉[tv_疑问]不至于吧"
"白丝黑丝爱丽丝","男","无IP","351351735","6","三周年恋曲","10000","3","","希儿的泳装还可复刻吗？[灵魂出窍][灵魂出窍][灵魂出窍][灵魂出窍][灵魂出窍]"
"b站刚子哥","女","无IP","95776595","6","","10000","3","","空降氪金神之键好像只字未提吧[无语]不给个解释？"
"舞见叶","男","无IP","517042172","5","","10000","3","","加油哇！一切都是梦想中的样子[热词系列_吹爆]"
"沙士混阿咖酚散","保密","无IP","12895343","6","新科娘","10000","3","10","新老婆！冲冲冲"
"樱陌蝶","保密","无IP","48133947","6","-阿库娅","10000","3","5","我的6星11th终于可以不用放仓库吃灰了"
"七炽","保密","无IP","456461045","5","三周年恋曲","10000","3","","就见证着评论的增加与赞数的变化"
"迪士尼在逃大宝界徐盛","保密","无IP","268087789","6","2233十一周年纪念","10000","3","","猝死党大胜利[doge]"
"一只摆猫","保密","无IP","385006282","5","","10000","3","","爱酱这么玩不睡的吗[吃瓜]说不定爱酱的背后是个大叔[滑稽]和我们一样通宵"
"牌佬唯一指定对象","男","无IP","155298407","5","","10000","3","","刚肝完体力"
"柚柚-柚柚柚","女","无IP","293746222","5","崩坏3・天穹流星","10000","3","10","这次终于不尬了[笑哭]"
"北村♂","男","上海","263905","6","","10000","3","","23年月10月，7.0版本特来回顾，这一期里关于舰长线，实在是有太多的重要内容了…"
"上杉绘梨衣-__-","保密","湖南","524961361","5","","10000","3","","看了好多遍...."
"比彻之愿的马斯顿","保密","无IP","24620450","6","","10000","6","","希望策划出事[保佑]"
"好香的血腥味","保密","无IP","11114758","6","EveOneCat2","10000","4","","希望训练一下主持人的语文功底，本来在讲那段紫苑厨员工入职追梦到亲手操刀制作观星时本来是一个励志故事，结果一句话愣是卡顿成4段说完，也没突出重点。听得人心里难受。主持起码把话讲的流畅吧。"
"小夏整挺好","男","无IP","1274983","6","公主连结佩可莉姆","10000","4","","希望ch没事"
"SNOWY537","保密","无IP","76816558","5","向晚大魔王","10000","4","","这次直播算是我看了三年里最好的一次了（尬什么的我已经免疫了）"
"炱","保密","无IP","23483867","6","","10000","4","","《论如何治疗尴尬症》直播回放"
"月饼月饼小月饼","保密","无IP","100965880","6","","10000","4","","各位早上好[微笑]"
"焦警233","保密","无IP","82348171","6","","10000","6","","在《崩坏3》后续的更新中，制作组将竭尽全力去避免直接改动已经存在的装备，角色，游戏机制等游戏内容。如果必须调整改动，制作组将经过内部讨论确定调整和处理方案，测试服上线测试，测试服反馈收集，后续处理措施和意见征集的流程，直到准备好合理的后续处理措施才会决定将对应调整上线。否则，绝不随意改动已有的游戏内容。,新年伊始，制作组将以最高的要求和最大的努力做出更多更好的游戏内容。,努力成为舰长喜欢的样子，才是《崩坏3》的最终目标。希望舰长能够一直陪伴着我们。"
"檬柠露","保密","无IP","1498341","6","-阿库娅","10000","2","","为什么花灯cg没有配音！"
"淝宅","保密","无IP","49093199","5","","10000","2","3","还是对下个版本空降神之键很无语，下个版本所有东西都很好除了这个神之键，就像一顿丰盛的晚饭，非要放一颗屎在里面。这把氪金神之键能给米忽悠带来多少流水我不清楚，但是像我这种原本观星肯定直接氪毕业的，因为这把神之键，下个版本不想抽卡的应该不只我一个吧[难过]，这么搞到底是增加流水，还是减少流水。然后因为我们下个版本不抽，攒下大量水晶，4.1的流水会不会也会变的很差，这把神之键能不能取消掉，真的很恶心人"
"MeineHing","男","无IP","379331178","5","","10000","2","","别急着更新啊我的幻海还没在量子奇点杀过瘾啊[大哭]"
"朴YYSS","保密","无IP","112009137","5","","10000","2","","看我头像行事[doge][doge][doge]"
"DragonNine的地藏御魂","保密","无IP","386340803","5","崩坏3・天穹流星","10000","2","","我参加过阵营的顺序是，崩坏国际，天命、海盗；崩坏国记零、煌这个顺其好巧啊！[doge]"
"风雪的缩影能发芽吗","保密","无IP","10076671","6","","10000","2","10","终于有个有趣的新角色了，可以再氪三万了吗[2233娘_大笑]"
"枯萎的基佬","男","无IP","2334918","6","","10000","2","","[doge]海景房升级为海底房"
"国际共运归来","男","无IP","228036614","5","","10000","2","","弹幕好像清理过一遍了"
"梦游型打野","保密","无IP","15152554","6","","10000","2","","忘了兑换码有时效，亏了一个亿[热词系列_锤]"
"一只枝","保密","无IP","20657195","6","","10000","2","","屑策划，快把语音给我交出来[doge][doge]"
"我就是谁都想上的热评","男","无IP","72933543","6","崩坏3・天穹流星","10000","2","","既然这次策划没有谈到伊甸双星，也就是说这东西不存在，如果下版本我看见了的话，那我就是一辈子的米黑[崩坏3_危险]"
"想食冷鸟憨","保密","无IP","17659886","6","hanser","10000","2","","什么时候出强身健体环我要和丞相大人贴贴"
"gfwy","保密","无IP","152983673","6","洛天依・最美的夜","10000","2","4","什么叫真正的橱力玩家啊，毕业放弃专业亲自设计德莉莎[笑哭]"
"诠释那一刻","男","无IP","49530852","6","三周年恋曲","10000","2","8","以前直播都是尬聊尬演 这次就不一样了，直接聊嗨了。给劲（建议内部人士扒一扒德莉莎喘息语音）[doge][doge][doge]"
"eulogy_song-颂歌","男","无IP","227720728","6","","10000","2","11","学材料能进米哈游？卧槽，我邻班专业就是材料，我是机电专业，我们大体上学的内容差不多，我也想进米哈游[哦呼]"
"以丶德丶服人","保密","无IP","476229503","5","","10000","2","","啊，来了嗷"
"学院长-德丽莎","男","无IP","95906029","5","","10000","2","","苟ch 我要喘息声！"
"二锅头女孩儿","保密","无IP","381386249","5","","10000","2","","希望那些刷屏的永远保底[鼓掌]"
"黄毛那","男","无IP","315157467","6","","10000","2","10","昨天直播了我去，我竟然没看[大哭]"
"Mc_Queen-","保密","无IP","89764318","6","泠鸢yousa登门喜鹊","10000","2","7","这次直播好有意思啊,但是什么能够修复一下舰桥bgm的bug啊,gkd[笑哭],我都听烦了[笑哭]"
"","保密","无IP","157714816","6","","10000","2","","还好机智的我只看转播[吃瓜]"
"亵渎一二三","保密","无IP","87369426","6","崩坏3・天穹流星","10000","2","15","国服崩三的尬仿佛成了某一种特色。[滑稽][滑稽]"
"爱莉快回来吧","男","无IP","8044355","6","","10000","2","11","杀龙忘记了点，兑换码换不了了。[tv_难过]"
"啥都没有的空白名","保密","无IP","154063811","6","hanser","10000","2","","好想给编剧整个发型"
"于同学的猫","男","无IP","160412534","5","","10000","2","","4.0版本舰长补给全保底，舰长副本零掉落[妙啊]"
"枫语汪","男","无IP","34122029","6","原神","10000","2","","(ω)猝死小队集合"
"菠萝鼎","保密","无IP","38589246","6","约战・狂三","10000","2","8","芽衣牛逼!"
"樱--永绝兮","男","无IP","46346593","6","三周年恋曲","10000","2","","看不起谁呢，下周四再发[滑稽]"
"三松居士","男","无IP","75533383","6","崩坏3・天穹流星","10000","10","","希望策划有事[保佑][保佑][保佑][保佑]"
"Bili_115425826","保密","无IP","115425826","6","","10000","7","","在？我的250水晶呐[笑]"
"雾里飞鱼","保密","无IP","64637129","6","","10000","6","5","隔壁十连和崩三十连有得比吗，我笑了。,三年崩三，十九个S，隔壁两年50多个三星，呵呵。"
"花舞君笑","男","无IP","160088210","6","战双帕弥什","10000","6","1","17年泳装有无复刻可能？[保佑]"
"阿空是我大舅哥","保密","无IP","384369838","5","","10000","4","7","舰长的加主线是米哈游的一个大招 是起死回生的神药 现在米哈游的发展势头很好不可能在现在加入的，而且舰长是通过量子之海穿梭的 在主线里量子之海是个个世界与宇宙的通道 比如在主线世界里幽兰戴尔和丽塔通过量子之海 传送到另一个宇宙世界 并且把那个宇宙吸收存放在幽兰黛尔体内   在官方主线CG中幽兰戴尔与凯文对战时也释放过宇宙来获取力量  说明穿梭宇宙是奥托发明出的某项技术 在目前已知宇宙只有在主线的奥托有这种能力  奥托还有穿梭时间的神之键 比如编年史里浮华记录篇和仲夏幻夜奥托让舰长穿梭过去找到拯救卡莲的结局但是都失败了那也是舰长的第一次时间旅行。在不信的话  想想奇迹漂流舰长在最后说的话  在奇迹漂流的舰长是见证过琪亚娜 姬子 浮华的成长史的  而且官方正在把活动里的舰长故事在慢慢链接（奇迹漂流前后 ） 所以不可能在奇迹漂流里有那么明显的吃书剧情的 除非编剧脑子那时被驴踢过  就目前来说官方在活动里埋的坑都是有因果的。,现在玩家对舰长期望太高 所以官方对舰长的加入风险也很大 ，利益不高风险却不小，盲目的让舰长上舰船可能会吃书 让剧情混乱 导致崩坏三这个游戏崩溃 大家唾弃，崩坏三是米哈游的支柱，官方不敢乱来去冒险。现在官方能做的可能就是给舰长这一角色去进行铺垫 去塑造。,米哈游的棋局很大 这才刚刚开始而已  从活动（圣诞狂想曲）开始就在铺垫了但是大家也看得出 活动剧情铺垫的很慢,对于舰长的加入我感觉会像电视剧里主角打Boss，奥特曼打怪兽一样 等亮了红灯才会放大[doge],有的游戏寿命长 有的寿命短 看发展吧"
"深渊wryyy","保密","无IP","258933613","6","","10000","4","","ch这个版本铁定出事[保佑]"
"花语雨间","女","无IP","23108698","6","初音未来13周年","10000","4","","96发强抽出火人偶，第二天告诉我常驻。崩坏国记ch一人的游戏，拿玩家逗着玩。云墨池子毒成狗，超限玩具，下版本又要出什么来着？这逼氪还觉得不比以前少？刷什么泳装复刻的我倒是觉得没得洗，复刻用屁股想也不可能，我好不容易肝出来的说白给就白给了？泳装出新角色的倒是可能，幽兰黛尔可能泳装吧。除了骂ch的其它没得洗。就开播前几分钟满屏全是刷ch的说明什么问题了吧？ch确实有问题，没得洗"
"子非的lml","保密","无IP","11559294","6","崩坏3・天穹流星","10000","3","","这次直播效果真的好，建议大伟哥给加班编剧加鸡腿"
"千山舒云暮","保密","无IP","38975693","6","","10000","3","","真就没人提空降伊甸双星呗[翻白眼]呵呵"
"justivil","保密","无IP","35196112","6","EveOneCat2","10000","3","","玩不动了，支持一下吧"
"超音速的蜗牛","男","无IP","106877714","6","碧蓝航线","10000","3","","我去，好早[doge]"
"戴和Deho","男","无IP","414075248","6","","10000","3","","舰长正常作息时间[doge]"
"路鸣泽-小魔鬼","保密","无IP","353259815","6","hanser","10000","2","","原来是你小子"
"迷迭香丶Rosmontis","保密","无IP","295725139","5","崩坏3・天穹流星","10000","5","","以下仅为个人观点，欢迎在评论下方留言，但我不一定会回复：,1.新版本的pv做的确实不错，直播效果比以往也要好。,2.但是你崩崩崩割韭菜这也是事实，米忽悠自己什么样自己心里清楚，做得过分了肯定有网友会喷，这不是简简单单就能解决的。,3.讲真更多玩家期待的是直播水晶码，要是没直播福利真会有这么多人看直播吗？,4.崩崩崩这圈子yygq的人难道还少了？直播对线弹幕我是没想到的，“请注意弹幕礼仪”？以前崩崩崩被黑的时候问候亲人的话满天飞，这圈子就这样，限制弹幕等级？有些圣母的优越感有点过头了。"
"可莉的小背包","女","无IP","26151529","5","hanser","10000","3","","大家觉得官方弹幕体验太差，可以去大up 比如赫萝的直播间看啊，能过滤很多网络乞丐和nt，弹幕风气也好，毕竟经常关注大up和最新咨询的也都算核心玩家了[小电视_笑]"
"ST-CASANOVA","男","无IP","97176277","5","呜米","10000","3","","渡鸦耍帅(),满地打滚(),惨之律者(),芽的下一棒乳鸦石锤[doge]"
"略知一二路人酱","保密","无IP","207461088","6","双生视界・花嫁","10000","3","","猝死小队集合[doge]"
"青史总让入无奈","男","无IP","238730165","6","","10000","5","","直播刷屏要氵这不是策划导致的吗，怕直播没人捧场放点氵，要没有氵你都看不到几条弹幕，别动不动站在道德制高点说话，上面有点冷"
"黑夜红发","男","无IP","152579229","6","初音未来・16岁生贺头像框","10000","1","","4.1直播直接寄刀片了"
"EPC_SG","男","无IP","1988665","6","","10000","1","","吃了最后生还者2的瓜之后，现在回来看编剧求生欲真强啊。"
"彼世星霜_DistantSora","男","无IP","597095","6","","10000","1","","48：20 ch：借小特之口解决玩家的所有争议[doge][doge][doge]这是第几层了"
"蒹葭染青衫","保密","无IP","292046377","5","","10000","1","","17分钟观星mark"
"y1就如此倜傥","男","无IP","202190034","6","2021拜年纪活动专属","10000","1","","现在豌豆荚数据转什么服了？[笑哭]"
"k423的夜辉","保密","无IP","287048348","5","","10000","1","4","还有岳母大人的立牌，也是先出的吧"
"诳嘈脑耘","女","无IP","346612044","6","","10000","1","","这是你们要的崩坏4[doge]"
"拳王康娜的老公","男","无IP","231644303","5","","10000","1","","我之前大半年没有玩崩坏了，只记得ID还能找回以前的账号吗[无语][无语][无语]"
"l魂灼","保密","无IP","167345008","6","崩坏：星穹铁道","10000","1","","为什么每次直播我都会错过啊[大哭]我明明都特别关注了"
"背负着德莉傻的犹大","保密","无IP","277403833","6","","10000","1","","17年的活动奖励和18年的泰坦霸王拳什么时候复刻？复刻也应该按顺序来啊！"
"这个昵称有Ren用吗","保密","无IP","168638996","6","","10000","1","6","现在的直播比早期好太多啦，更有料啦，也更有意思啦"
"账号已注销","保密","无IP","174046132","0","","5000","1","","唉，没直播，错过了250，哭了"
"Gottao_","男","无IP","353860320","6","","10000","1","","看见编剧了吧，把他抓起来[保佑][doge]"
"异次元小镇里","保密","无IP","125921838","6","","10000","1","","最好 最有意思的直播我居然不知道[喜极而泣]，给错过了。"
"一杯老茶-_-","男","无IP","430739760","5","原神","10000","1","","可"
"背负着德莉傻的犹大","保密","无IP","277403833","6","","10000","1","","要是新boss所有的部件都换成齿轮与时钟就有钟表涅之时之境的感觉了[tv_doge]"
"背负着德莉傻的犹大","保密","无IP","277403833","6","","10000","1","","这剧情不就是机器猫的时间机器吗？[tv_doge]"
"一生悬命精一杯","保密","无IP","4970345","6","","10000","1","12","很喜欢这一次得直播[OK]希望以后这样的爆料内容多来点[微笑]"
"天天都熬夜呀","保密","无IP","85655472","6","#EveOneCat","10000","1","","突然感觉这次错过直播不是什么坏事，毕竟没有看见那些水军发的恶心人的弹幕[OK]"
"可梦里终有她","保密","无IP","153162444","3","","10000","1","","说没说要出雷之律者的信息啊"
"hanser的大宝贝","保密","无IP","101681007","6","hanser","10000","1","11","另一个在摸鱼[doge]"
"人质关我咚咚咚什么事","男","无IP","86895102","6","","10000","1","","屑策划，交出月下语音[doge]"
"Rowic","保密","无IP","175870985","6","","10000","1","","只能看录播的高三党，一个月没见女武神了[委屈]"
