"昵称","性别","IP","UID","等级","装扮","用户权重","获赞数","粉丝团等级","评论"
"欢乐井盖人","保密","无IP","906373","6","明日方舟","10000","399","","预登录玩家更新之后回来看看，目前77级，以前好话说了很多了，今天就来吐槽一下。今天正好是弃坑一个月的日子，毕竟最喜欢的德丽傻出来了，但我想说・・・・现在这游戏确实越来越肝了。和当年游戏十分钟贴吧两小时的时候明显变了个样。又是舰团本，又要刷碎片，还要开放世界，马上更新之后还要再赶德丽傻的坑。(苦笑),当初说这游戏氪命，我是不信的。如今的趋势越来越往这方面发展了。说实话，我是不愿意把一天里面这么多时间花在手游上的，可能很多玩家浑身上下都是肝，但也有肝不动越来越累的玩家。,前几个版本的时候出了狂暴芯片，其实从根本上还是没有解决这个问题，一个碎片本，就算你再简单，再无脑，再秒杀，你在重复了半年之后相同的动作，总会多多少少有点嫌烦，因为你在开碎片本时，会经历点开+读取+无脑战斗（因为基本上你已经驾轻就熟了）这一段过程，可能时间不长，但量变产生质变，入坑6个月以上的玩家对于碎片扫荡问题，很多都懂的。,很多玩家可能会说，”扫荡？这回***械式重复本上下个决定。让玩家每天不至于玩个游戏玩到疲惫，本身放松的事却变得越来越累，也怪不得很多dalao会萌生弃坑的想法。,适当做一些减法，反而对游戏会有加成。,最后想说一点，有很多玩家会吐槽，”又没有人逼着你刷碎片？不想刷就不刷呗。“,・・・・・・・・・・・・・・・・・・,跟这些人争论会发生论点跑偏。只要知道这个碎片本使游戏体验变差就行了。这个跟你想不想没有关系，游戏体验变差，那自然就应该优化。这个不只关乎个人，也关乎很多的玩家在游戏时的体验，物极必反，肝爆必退，很多乘客都会变成咸鱼的(苦笑"
"吾名为头像是也","保密","无IP","45374791","6","EveOneCat2","10000","245","","萝莉大姨妈,可爱德莉傻,(￣～￣;)"
"深红流火丶","男","无IP","21300739","5","","10000","53","","修仙修到现在的举个爪（￣￣）"
"oo随心畅想","男","无IP","1512250","6","","10000","47","","以后换人讲吧，大伟明显不玩这游戏(_`)"
"老D不着急","男","无IP","8818429","6","","10000","39","","大伟，增加一下金币掉落吧。崩坏2金币溢出严重的中后期金币破亿。崩坏3中后期穷的叮当响。女武神后期点一下技能差不多5万金币。一次金币本6w一周正常可以打4次。极限（不准确应该更少吧）应该可以打18次（前提一到五的此类活动都不碰）。还要升级装备和圣痕。你难道以为我们玩家只养三个女武神吗？"
"小柠丶","男","无IP","6736655","6","","10000","29","","感觉出的频率有点快，骗氪手段明显，八重樱的语音模型等细节到现在还没修复就开始对大姨妈下手，怀疑大姨妈会和之前八重樱一样，出来前先up一波血舞3rd这些来骗氪，大姨妈出来后up一波武器泳装圣痕继续骗氪，强无敌"
"欧德马克","男","无IP","19099858","6","","10000","19","","开放世界的罪夜魔障那恶心的机制还没改？开放世界的短时间内无法连续捡垃圾的bug 还没修？联机与队友那单调的及时互动还没改？氪金福利还没改？白练还是一如既往的没落在角落里？瞄准机制还是那种忽左忽右的隔空划水卖萌？"
"鹏鹏讲中专志愿","保密","无IP","877269","6","工作细胞","10000","16","","不管什么手游，可能应该像任天堂学习。氪点是必需的，然而游戏真的是为单纯的快乐而设，有多少玩家坚持到现在，只是因为前期上头冲钱，全然没有了当初游戏动作类快感。1.5版本算是一个改变的开始，希望越做越好吧。三测玩家瞎逼逼了"
"碎碎碎雨石丶","男","无IP","11746131","6","春原庄的管理人小姐","10000","15","","说真的，这罪业，马上我也快20轮了，基本都要SL5、6次才能两次杀死狐狸和卡莲。毕业老咸鱼好说，这让萌新怎么活呢，越打难度越高慢慢的打不过了，奖励还那个样，萌新估计就不打了吧，变成形同虚设的两个BOSS。更新节奏也越来越快，我觉得不必那么快出新角色，至少得先把已有的机制完善了不是？（其实是战扩充失败至今没能攒到钻）下版本深渊难度提升，虽然是只大学狗，但也是没那么多时间来玩游戏的，就和热评说的一样，有些差不多已经成为累赘的内容可以适当做些减法了"
"木夜i","保密","无IP","19352492","5","","10000","15","","妈呀，八重樱才出不久，然后就又出了德莉傻，出德莉莎又一大堆剧情，然后又要肝了，我的天，怎么多要肝的也不多给点体力，哇，深渊也加强了，打个深渊又要好久，这样算来单单玩游戏就好几个小时，每天都要肝碎片，材料等等等，现在出了德莉莎肯定又多了许多材料，实在肝不动了。"
"红魔族的展望塔","男","无IP","10950298","6","明日方舟","10000","12","",",你们看我发现了什么？那面有一只落单的爱酱！我们可以试着捕捉她！一只爱酱可以为我们提供两个大头菜他们富含大量的维生素！不过爱酱是个智障很好对付。我们直接走到她的身边。嘿我抓到她了！她在一脸智障的看着我！我们把她的大头菜割下来其余部分就可以丢掉了，她富含的维生素是其他大头菜的六倍，当然，如果舰长缺水晶我们还可以用爱酱的头发还可以制成一顶原谅帽，卖给奥托大人。"
"混沌尽头の人理之恶","保密","无IP","23574257","5","","10000","12","","的确，相比之下，崩坏3已经是国产手游的中难得的良心作品，好的东西，当然应该予以鼓励支持。至于安利的事，敖厂长已经做过了。漫画也一直在，游戏也会一直玩下去的，支持崩坏3，支持原创，支持良心制作组！"
"米糕LGelo","保密","无IP","3290524","6","","10000","10","","紫色泳装充钱没跑了。上次冬公也说的是密切关注，1888。我不关心啥泳装啥小恶魔，你们居然泳装都敢出为啥还要和谐逆神巫女的胖次和勿忘的胸部大小？"
"小柠丶","男","无IP","6736655","6","","10000","10","","每次直播出来的策划都不一样，怕不是。。"
"妖精等天亮","男","无IP","8030204","6","少前小剧场","10000","10","","大伟：给大家看一下我们S级......,大姨妈：让我来制裁你们！！,........,大伟：啊给大家展示下我们的山吹啊,２３３３３３３"
"MRCha0s","保密","无IP","30775397","6","","10000","9","1","真是醉了，浮游炮，魔女时间，俯仰视角...这些尼尔都不是第一个产生的。这么多人吹尼尔想干啥。还是说b站低龄到无脑跟风了？"
"夜起听雨声","保密","无IP","40661966","5","","10000","8","","1.再不出来的话 我就把这里全部毁掉,2.向我朝拜吧，垃圾们,3.我这把犹大下去，你们都会死,4.要和德莉莎一起睡午觉吗,5.不知道这次能不能刷新最短战斗时间记录呢,以上德莉傻战斗嘲讽，不谢请赞谢谢,(⌒⌒)(⌒⌒)(⌒⌒)(⌒⌒)(⌒⌒)"
"唐裤裤","男","无IP","9074074","6","","10000","8","","其实你没必要这么想，你玩三个小时游戏不如给老板加三个小时班    比较少的说一个钟20块。然后就有60。60块钱可以换600晶    还有60天月卡呢"
"I危险流浪者I","男","无IP","36627631","4","","10000","8","","为了玩崩坏换了两次手机了:(￣△￣)"
"提督Frad","男","无IP","1746269","6","纳米核心","10000","8","","一个三星皮肤就摘了个帽子，大伟哥你良心不会痛吗c(`Д)"
"空条徐伦的静静","保密","无IP","12073099","6","请吃红小豆","10000","7","","此外，直播趣味性不高，建议公司来一个专业点的主持，直播时也可以找lex或者一些国产声优合作，有条件也可以请一些玩家过来做做游戏。不过大伟哥是一定要在的，虽然看得出大伟哥很努力，但也改变不了尬聊的事实，但有时候也会觉得挺可爱的。。"
"一s夕y匕","男","无IP","12398876","4","","10000","7","","，。，"
"雪中的喀秋莎","保密","无IP","6860511","6","","10000","6","","直播兑换码YVUZHWJTMF"
"一拳打爆下北","保密","无IP","13843312","6","","10000","6","","这cos的不是召唤婊吗？！？"
"情诺汐枫","男","无IP","29346851","6","崩坏3・天穹流星","10000","6","6","大伟的直播是我看到过最乱的"
"小坨的大坨","保密","无IP","37568749","6","","10000","5","","有时候心态决定一切，游戏而已嘛，不想玩儿的话，每天900好感度摸完下线(=ω=)"
"这波草率了","男","无IP","34146267","6","星座系列：双子座","10000","5","","策划的良心不会痛吗 现在打联机身心俱疲还不一定打的过"
"吼姆拉栖木","保密","无IP","13951292","6","","10000","5","","之前崩坏2崩坏3都肝的我每天开始写作业都得晚上十一点，每天光崩坏三就得一个多小时，碎片本每一波几个小怪大约多少血都算清楚了;现在每天打十分钟崩坏2就好了OvO"
"昔年似风","保密","无IP","24086423","4","","10000","5","","开房世界不能连续捡垃圾，罪业魔障不是满状态根本打不了，瞄准系统还是屎一样，低级和高级材料数量都不成正比"
"法米利昂史黛","保密","无IP","6690067","5","","10000","5","","这个策划巨特么恶心"
"柑橘味的缪尔赛思","保密","无IP","30716053","6","碧蓝航线2020","10000","4","","你能优化自瞄就行了"
"御空尘","男","无IP","27118007","6","2021拜年纪","10000","4","","什么时候把爆率提高点，开放世界不那么恶心就行了"
"玩具大全Ericyooy","男","无IP","4004248","6","","10000","4","6","两个版本之前婊游戏十分钟贴吧八小时，现在婊游戏肝？每天早上接驱魔下午清体力比以前强迫症早上还要打体力好多了，现在外传要结束了，20.30体力一关刷碎片或者刀币，清体力也就十几分钟，坑时间最多的是捡垃圾要等cd，深渊又臭又长，矩阵没排名根本没人打，如果有，请私加我们团←_←"
"跳舞的鹅肠","男","无IP","13192175","5","","10000","4","","只有我一个人觉得德莉莎的帽子应该去掉才可爱吗"
"怪君的梦","男","无IP","100332550","6","明日方舟","10000","4","","什么时候出樱犹，还有兔耳朵的德莉莎小公举啊(ω)"
"原谅他人的雷斯吉宁","保密","无IP","57418927","6","","10000","4","","为什么我要再看一遍？大伟难得翻车这么多次你不看？？？"
"德丽傻-阿波卡利斯","保密","无IP","20569574","6","见习爱神头像框","10000","4","10","祝各位舰长都能**抽中我，大伟哥和策划已经被我的犹大砸晕了。(｀ω)"
"abcde-aiueo","保密","无IP","200277169","5","","10000","3","","这个游戏，我会继续玩下去的。相信和我一样想法的舰长有很多，我们会陪伴崩崩崩和女武神们一路到底。,为所有的美好而战，这不是一句空话。"
"Soli_12,","保密","无IP","2851199","6","","10000","3","","德丽莎回城为什么没有语音"
"リハン月","女","无IP","10976780","5","","10000","3","","这游戏肝? 你去玩阴阳师(=ω=)"
"爱酱的小跟班","女","无IP","19174585","5","","10000","3","","德莉傻！准备出击(),准备好了吗ε=ε=(ノRQ)ノ"
"夜雨寄北永不掉线","保密","无IP","59201103","6","","10000","3","","www.ns3rd.com,各位舰长欢迎来到逆熵！"
"账号已注销","保密","无IP","45530579","0","","5000","3","","已出山吹，雪地，特来还愿"
"捉猫鼠","女","无IP","16192658","5","","10000","3","","下次直播请技术大佬来直播"
"拉克是个大八嘎","保密","无IP","134805","6","","10000","3","11","尼尔2本身就是个大杂烩游戏，哪来的脸去说其他人抄袭，而且万物起源尼尔的大部分选手，怕是根本没玩过尼尔，是视频通关选手哟"
"卢小ming","保密","无IP","2250039","6","","10000","3","","有时间玩就玩没时间玩就不玩，不要逼自己每天清日常刷碎片，肝不好就像我一样慢慢玩"
"二零醚酱","保密","无IP","6438394","6","言和7th生日纪念","10000","3","","德丽莎皮肤良心……不会痛么"
"I危险流浪者I","男","无IP","36627631","4","","10000","3","","有一个巨大的缺陷就是内存太大一般的手机根本玩不了。(￣△￣)"
"汀门信徒与琪亚娜的狗","女","无IP","17575782","6","","10000","3","","我怎么感觉大伟他自己也是第一次玩啊（￣￣）"
"MarsDDD","保密","无IP","3074537","6","","10000","3","","尼尔才出来多久，真心佩服mihoyo的速度[小电视_汗]"
"高町奈奈子","女","无IP","6401376","6","","10000","3","","说得好，那80级的萌新了？有福利吗？"
"abcde-aiueo","保密","无IP","200277169","5","","10000","2","","崩坏三一直没有变，变的只有扩大的玩家群体和被搅浑的社区环境"
"要不来干点刺激的事吧","保密","无IP","32521971","6","沈剑心","10000","2","","说崩3肝的人你是不是水晶都拿来买体力了？"
"登皇御城风","男","无IP","13654244","6","","10000","2","","切身感受  这游戏越来越不适合平民玩下去了  本来获得水晶的唯一途径就剩深渊了  你看看现在深渊这难度   本来觉得这游戏还不错  现在看来策划简直太…  我知道***公司存活不下去  但是为了挣钱把平民玩家赶紧杀绝真的不要紧吗  兑换系统，肝都爆了兑换出来的东西就这点威力？  呵呵哒"
"KedFcinye","男","无IP","62552417","6","少前小剧场","10000","2","","对于那些说越来越肝的人，真的，不是游戏变肝了，是你们想要的越来越多。我也不知道怎么会有人想出扫荡的，如果出了，就是这个游戏的毁灭，但愿说出话时先用脑子想想，别乱带节奏！,希望大家都是玩游戏，而不是游戏玩你。"
"Hinazuki-","女","无IP","33008683","6","hanser","10000","2","","。。。我预公测玩家，，70级。。150体力+领取的30+30体力。。每天的驱魔70左右。。还剩下110。。刷4关30体力的刀币，。半个小时差不多刷完。。虽然我深渊才到倒数第3个。矩阵也基本不打，但是总体时间还是够的(本人高一)。不明白你们肝帝一天肝1  2个小时的想法。。还有我是零氪党豹子头林冲  目前就差勿忘和月色。其他基本全s。。"
"唐裤裤","男","无IP","9074074","6","","10000","2","","后天就更新了。"
"空条徐伦的静静","保密","无IP","12073099","6","请吃红小豆","10000","2","","联机的奖励太少，不是大佬一关稍难联机要打很久，队友也动不动就不配合。高一点的与难度相符合的奖励才会给人讨伐以及攻略的感觉，玩家的快感才会提高。"
"团子已死有事烧纸","保密","无IP","13673227","6","","10000","2","","讲道理，直播真无聊，下次能不能找一个可以让我们喊666的大佬来，看大伟玩游戏简直急死人，不会玩就别玩了，光介绍或者解说就行了哈(_`)"
"一诺一卿言","女","无IP","7703521","6","","10000","2","","要不要考虑下把我的八重樱小姐姐的日语语音补上"
"盒中盒消息","保密","无IP","1750739","6","","10000","2","","再怎么吹崩三业界良心这次我也是不想袒护了，这次不会再抽德莉莎了，没有圣痕，没有武器，还不如继续玩我的鬼铠老婆"
"nualy","男","无IP","18978546","6","hanser","10000","2","6","弹幕小学生真多，你们能不能去写作业？不读书就算了，能不能多了解点游戏？给这刷无意义的字眼只能显示你自己的无知！→_→"
"纯白の美羽","保密","无IP","60237902","6","","10000","2","","我想说的是德莉莎有日语配音不，还有八重樱的日语配音还没出呢"
"春夏秋冬_xs","男","无IP","7153342","6","","10000","2","","不知道大伟哥是否还记得当年自己被大姨妈血虐（滑稽）"
"伪烟か","保密","无IP","19021316","6","","10000","2","","不氪金，就落后，氪金是第一战斗力"
"昔年似风","保密","无IP","24086423","4","","10000","2","","昨天直播翻车大成功"
"CherryCandy_","保密","无IP","11618688","6","梦塔・雪谜城","10000","2","","就不能把兑换码 1天有效嘛！520谁tm还看直播！！！"
"HTCB","男","无IP","7216045","6","星座系列：水瓶座","10000","2","","高级军官都上前线了我就问指挥层还有人吗？"
"Inn瞳0cenC旭E丶","男","无IP","11855033","6","","10000","2","","挂画:大伟你走吧，我救不了你"
"一般通过阴角人","保密","无IP","11567476","5","","10000","2","","诶…手机没空间了，刚把崩三卸了，看来过几天又要装回来了…"
"一般通过蕾忍","男","无IP","6686958","6","","10000","2","","（￣￣）这次直播还是一如既往的尴尬啊"
"你是一个一个一个峰峰","男","无IP","22143673","6","","10000","2","","嚎叫是我家，保护靠大家"
"七森天天蹲大牢","保密","无IP","21555299","6","","10000","2","","社会我姨妈,人傻话还多"
"半份地瓜","保密","无IP","23458546","6","","10000","2","","( _f｀)为了德莉莎,买上大姨妈,垫上姨妈巾,就等单抽爆"
"远走的荧光","保密","无IP","50321072","6","七海Nana7mi","10000","2","","德莉傻：抱头蹲防（￣￣）"
"纱布二刺螈","保密","无IP","29008197","6","","10000","2","","表示不相信抽卡概率了，伤心。。。"
"前路无明","保密","无IP","355137158","5","","10000","2","","2020前来考古，看看如今下水道当初的样子[抠鼻]"
"一纸清风","保密","河南","628428809","5","","10000","2","","考古"
"来者可是观星先生","男","无IP","393879438","6","崩坏：星穹铁道","10000","1","12","入坑版本，梦开始的地方[崩坏3_吃饭团]"
"星海夜曲","保密","无IP","229869795","6","不吉波普不笑","10000","1","","1.2入的坑，当时没时间肝，差点就退坑了，没想到抽出来了紫苑（萌新时期第一个S），结果就断断续续玩到现在了[笑哭]"
"你看那个binbin","保密","无IP","160939265","6","碧蓝航线","10000","1","","就是这个版本入的坑，但终究抵不过你smch的操作。就此终结。我走过四年，可惜以后见不到了。[笑]"
"夜雨寄北永不掉线","保密","无IP","59201103","6","","10000","1","","我有樱傻（樱火轮回德丽莎）技能截图跟模型，'q804390250，测试服数据。"
"普拉拉斯提科","保密","无IP","19853740","6","","10000","1","","不知道为什么感觉现在新玩家的成长周期过长。,玩法有创新，但是还是感觉不耐玩,想要召唤回老玩家，边边角角的改动一两个新人物的推出恐怕不太奏效,ost什么时候卖？隔壁都卖了好几个月了,希望多出几次材料，核心，碎片的up。一个月一次？,,(=ω=)"
"kritoing","保密","无IP","74732871","5","","10000","1","","有病啊，一直循环"
"小小黑贞","男","无IP","22020877","6","","10000","1","","萌新SNQ43W邀请码领福利"
"浮灬生灬","保密","无IP","45312526","5","","10000","1","","明天玫瑰扩充又开了，抽不到我就退坑，誓死不玩，看你们怎么赚钱"
"打工社畜雨滴","男","无IP","66319","6","","10000","1","13","讲道理 现在骗氪和策划简直不忍直视了    ,以前姬子版本还有调查问卷  为啥现在都没了  说好的良心手游呢,现在还有人骂，证明还有人关心这游戏 , 别等到全弃坑咸鱼没人关心了才改   杀鸡取卵  不如细水长流,难得国产有个那么好的游戏 又不是代理 被策划搞死才是最蠢的"
"千鄞逭","保密","无IP","20341084","5","","10000","1","","崩坏漫画到底有没有单行本实体书?看到去年8月有条发售预告，网上又搜不出来，求解"
"年轻的XP","男","无IP","2420608","6","","10000","1","","( _f｀)估计肯定有跟我一样第七关打不过来翻直播的"
"三生三世梦轮回","保密","无IP","39013492","5","","10000","1","","德莉莎都来了，符华还会远吗"
"香奈美高手","保密","无IP","39007804","6","","10000","1","","打怪不疼？那就插个犹大"
"KuromiAn","保密","无IP","15299820","6","初音未来13周年","10000","1","","果然德丽莎是不存在的，流下了非酋的泪水(；ω；`)"
"萌萌哒の绅士","保密","无IP","62674238","6","","10000","1","","(=ω=)泰坦:我这一拳下去，你绝对会死。就算有盾也会死"
"周天子本周","保密","无IP","73804001","5","","10000","1","","大伟，这一步棋好像走错了"
"水流不返","男","无IP","6565419","6","","10000","1","","我想问一下犹大的誓约怎么得"
"鸩鸣丶","保密","无IP","2076924","6","","10000","1","","不知道为什么一群人说肝的，你不想打挖矿啊，本人上午接下樱色轮回晚上睡觉前刷完，深渊原罪保级。晚上吃饭前进游戏挖矿，每日活跃度？想刷时候刷就是，游戏时间每天平均下来也就1小时，有时候半小时就搞定。,       玩游戏就是为了娱乐，现在很多人是被游戏玩，不是玩游戏。虽然我自己也弃坑了3个月之久（因为保底无限出重复圣痕气的），我也不说那么多了，这游戏肝？不存在的。体验了隔壁阴阳师后再说肝这个字吧。"
"风不知过","男","无IP","12250258","6","","10000","1","","看到怒操大伟和蛋池有毒后乐出声……"
"安郁丶","女","无IP","14604794","5","","10000","1","","大伟哥你说蛋池良心么。"
"NICEheihei","男","无IP","26495077","6","","10000","1","","存了4800水晶，到时候抽之前先洗洗脸"
"雨落笙歌g倾城颜","女","无IP","32056358","6","","10000","1","","啥时候更新"
"铃祈丶","保密","无IP","11455267","5","2233幻星集","10000","1","","唉，现在使劲出女武神有点肛（跟）不上呀，本人也是预登陆玩家现在75级了，平民党靠月卡要肝是挺吃力的，出新角色是好事，但感觉节奏快了点，平民党脸黑点的要抽新出的角色是挺吃力的（更别说扩充补给了限时的，在标准补给里还好说可以慢慢存水晶抽）[2233娘_无言][2233娘_喝水]"
"折月从不咕","男","无IP","6996700","6","","10000","1","","不出扫荡真的就每天登陆一下了，特么真的累，大学明年就去实习了，然后有毛时间打游戏"
"njfgjjhcj","男","无IP","66773956","3","","10000","1","","好圣痕真心难搞"
"押鬼","女","无IP","309240","6","普通小狗・梦幻塔罗","10000","1","","讲道理啊讲道理...崩三不想肝的话角色不氪也差不多能凑齐啊...月卡党表示60多基本可以把角色抽齐全刷上s...尤其像自己对装备没特别大执念，一把圣遗物上啥角色给谁...完全够用了啊....,而且最近活动挺良心啊，山吹皮肤只要刷个通关就能拿了啊qwq新版本也很期待...不想氪可以不氪嘛，不氪也可以玩的很好啊...我觉得崩3挺好玩的"
"游荡打捞失语的梦","保密","无IP","33944701","5","","10000","1","","我还是蛮喜欢这个游戏的  只是武器进化需要的崩坏结晶实在是坑爹有木有  现在68级了   五星武器更是没有一个    崩坏结晶获取途径再填几种多好  还有就是  多出点能和其他玩家一起玩的  pk啊  刷副本啊  总得来说还是蛮好的"
"⑤轩","男","无IP","163832","6","","10000","1","","真心觉得需要把游戏每天的时长控制在半小时以内，希望**的版本能省掉刷刷刷的时间，毕竟游戏的了大量的时间花在刷刷刷上容易使人疲劳。希望考虑在达成某些条件下能够有类似扫荡的模式，把刷碎片的时间放到一些挑战上。"
"核聚变糖葫芦","男","无IP","41892131","6","","10000","1","","没有超清版本的吗？好模糊啊"
"レム丶","女","无IP","8672605","6","2020拜年祭（鼠）","10000","1","","(=ω=)许愿S大姨妈"
"夜夜-Official","女","无IP","1868934","6","星座系列：处女座","10000","1","","mmp我从八点二十开始看，这直播录像从八点二十开始放......前二十分钟被吃了？"
"外来者のケ`キ","男","无IP","11176034","6","公主连结凯露","10000","1","2","大家听我一言，肝A大姨妈，抽攒钻抽犹大，平民圣痕，这样最合理(￣3￣)"
"欧颜魔王","男","无IP","6785206","6","碧蓝航线2020","10000","1","","崩坏3rd 氪金纪元"
"DC-秋名车山神","男","无IP","7526086","6","","10000","1","","爆率那么低，大伟你的良心不痛吗"
"临终雨","男","无IP","11481110","6","","10000","1","","能语音就好了――"
"NULL_0x48","男","无IP","23948398","6","","10000","1","","德莉莎的日语cv要是钉宫就好了（￣￣）"
"ReInMh","男","无IP","6919389","6","EveOneCat2","10000","1","","正式服里三吹那个皮肤只有自己的是蓝色罩什么时候修复"
"橙子味的ino","保密","无IP","33177496","6","实验品家庭","10000","1","","有人知道是么时候更新吗？"
"miledage","男","无IP","10793395","6","洛天依9th生日纪念","10000","1","","能给些体力任务么。。。"
"试图战胜被窝","男","无IP","24965118","6","不思议之旅","10000","1","","怒草大伟出德莉莎和犹大！！"
"Natsumeちゃん","男","无IP","35194101","5","","10000","1","","emyxgwmkkf"
"可燃性乌茶","男","无IP","5265528","6","","10000","1","","我觉得我这样的非洲人可能又抽不到了"
