"昵称","性别","IP","UID","等级","装扮","用户权重","获赞数","粉丝团等级","评论"
"Sennyuki风早千雪","男","无IP","23938690","6","异常生物","10000","2477","12","我就问一句话，什么时候出专辑[崩坏3_GKD]"
"青山渚的自由红薯协会","保密","无IP","34892786","6","","10000","3360","","EP内容仅为最高画质实机演示，实际画面效果请以自身手机配置为准[阴险]"
"汐柚一直转圈圈","保密","无IP","391267466","6","","10000","1286","","我全地图跑一遍了都没翻到那剩余的三个宝箱和boss，不得不夸你们一句，你们是真会藏[doge]"
"问肯局长是不是基","保密","无IP","23618219","6","崩坏：星穹铁道","10000","4725","25","哟，后崩坏书2啊，别再手机里抽烟了好不好[doge]"
"机动型カレ`Mk-2","男","无IP","13959558","6","崩坏3・天穹流星","10000","3923","12","第一首Ele Wh→Wheel（摩天轮）,第二首And Isl→Island（岛屿）,第三首Den Gar→Garden（花园）"
"silly沐","保密","无IP","6646795","6","圣诞节快乐","10000","474","6","后崩2模拟器真好玩！崩崩崩的音乐真的特别有感觉"
"影行高山","女","无IP","1720134735","5","","10000","772","","刚开始看还觉得有点奇怪，音乐不像视频展示的阳光和煦的下午，一看简介，发现音乐把“水面”“寂静”“回声”，这几个意象都呈现得特别好，是非常优秀的作品。,就是不知道剧情里有多少刀子了[吃瓜]"
"再给我来个包子呗","保密","无IP","450052651","6","","10000","675","","我觉得后崩2还可以再优化一下[笑哭]渣机真的不太够用啊(B`B)"
"d体X","保密","无IP","671486977","5","","10000","1485","","冷知识，,1，打任何东西都可以回能量，但除了有结晶的汽车。,2，主角上挑比跳更高，冲刺可以往上加一点高度。以此类推，我们可以用主角挑到原来需要钩锁的。,3，水里面也有宝箱，可以用布诺妮亚打过去。"
"歹匕礻申zz","保密","无IP","214546186","6","","10000","471","","这视频好像在告诉玩家我们的光影纹理很nb，只是怕你用不起[藏狐]"
"雨式葳","保密","无IP","3266218","6","","10000","3","","太喜欢太喜欢了，有十年前听泽野电音的那种感动了，可惜泽野现在已经很少写电音了[笑哭]"
"星穹铁道第一人气偶像","男","无IP","306473415","6","","10000","197","13","寒冷的冬日刚考完四级，唯有这大鸭鸭能给我一丝温暖[大哭]"
"时间之类","保密","无IP","86123717","6","","10000","1234","","祝各位舰长四六级都能考一百分，不用谢陌生人[崩坏3_路过]"
"Kato圣人惠","保密","无IP","514688510","5","崩坏3・天穹流星","10000","224","10","求求，让后崩二跟一一样的画质就行[崩坏3_拜托了][崩坏3_拜托了]"
"看我指着谁呢","男","无IP","159486280","6","","10000","3882","","挚友，下次要玩刺激的先知会一声，谢了,还好还好，差点就掉下去了,不要放松警惕，注意任务"
"湛蓝色的理智-","保密","北京","1188157124","5","","10000","8","","这么精美的地图，现在也沦落为无人问津，有一种时代逝去的失落感"
"深山莺不中","保密","无IP","398037370","6","","10000","10","","我用桌面版玩后崩画质可以拉满，但是很卡。用平板玩很流畅，但是画质调到最高也挺糊的（原神也是一样，可能是我平板太大了，不适应移动端的分辨率）。怎么样才能两全啊"
"sjidjfbfbrhr","保密","无IP","470531321","4","","10000","4530","","“队长，月之环可以戴腿上吗？”"
"是酥油饼酱","男","无IP","107268697","6","","10000","27","11","其实玩家在接近红色水晶还有声音哦，是一种空洞幽邃的声调，总之令人毛骨悚然[冷]"
"小光焰","女","无IP","325323162","6","还有醒着的么","10000","90","","玛德，刚刚才用小岛爆爆鸦凹了120的乐土，一点进b站就是没入乐园，搞得我以为是什么乐土攻略，现在我看到乐这个这就ptsd[藏狐]"
"silly沐","保密","无IP","6646795","6","圣诞节快乐","10000","474","6","后崩2模拟器真好玩！崩崩崩的音乐真的特别有感觉"
"歹匕礻申zz","保密","无IP","214546186","6","","10000","471","","这视频好像在告诉玩家我们的光影纹理很nb，只是怕你用不起[藏狐]"
"大佬带带我这萌新吧","保密","无IP","77073717","6","星座系列：金牛座","10000","419","","第一眼：没人乐园,第二眼：没（mei)入乐园,第三眼：没（mo)入乐园[辣眼睛]"
"韩亚雪c琳琳","保密","无IP","492404659","5","崩坏3・天穹流星","10000","372","","后崩好好玩呀，玩提米朵好快乐，战斗音乐也喜欢。就是……每日委托多加几次吧，两次太少了"
"椒盐vaii","保密","无IP","10242773","6","","10000","290","10","hoyo-mix崩坏的专辑识宝之后大半年没更新了，快安排一下吧[崩坏3_生气]"
"这确实挺开心的","男","无IP","36623024","6","","10000","274","7","求求你多来点高难boss 我最喜欢后崩坏书的越级杀boss了 打完三个意犹未尽"
"ogo","男","无IP","52892515","6","少女前线","10000","261","","摩天轮旁边的公园有个小水池，缇米朵跳进去触发了语音“哇~水好凉啊...”莱尔来一句“小缇...”什么什么的，然后自己也跳进去说了句“哇水真的好凉”,鸭鸭无奈的说了句“喂，你们俩个...”,贼可爱！[脸红]"
"星梦天阳","保密","无IP","503297999","5","","10000","260","9","真是的,就知道拿实机演示来唬人!!,就没点新鲜内容吗??[doge][doge]"
"雪影cr","保密","无IP","438604379","5","三周年恋曲","10000","244","","用亚当卡过去把收集的剧情先过了一遍[doge]《哇，水好凉啊》"
"Kato圣人惠","保密","无IP","514688510","5","崩坏3・天穹流星","10000","224","10","求求，让后崩二跟一一样的画质就行[崩坏3_拜托了][崩坏3_拜托了]"
"琴寄文乃","保密","无IP","44997998","6","魔法学院","10000","220","","没有莱尔是不是因为助战成员不能上场？[崩坏3_路过]"
"星穹铁道第一人气偶像","男","无IP","306473415","6","","10000","197","13","寒冷的冬日刚考完四级，唯有这大鸭鸭能给我一丝温暖[大哭]"
"留莜翎香","保密","无IP","99812655","6","原神","10000","182","8","nnd！下午考六级，但好想玩后崩啊AAAAA，已经憋了几天了[笑哭]"
"甘雨的老公本人","保密","无IP","3725514","6","崩坏：星穹铁道","10000","164","","求求了，宿舍圣痕小人能不能接着出。今天看了点宿舍视频，好想看见贝拉再见到女王[热词系列_泪目]"
"bili_36129319435","男","无IP","501156210","5","","10000","147","","自从玩了后崩二 我的手机都能煎蛋了  [doge]"
"雪辰沙","保密","无IP","352751792","5","","10000","112","","让我看看，有多少个小可爱给自己取名叫老公的？,还好后崩崩的男角色是莱尔好兄弟，不然……我看你们如何自食恶果[傲娇][傲娇][原神_喝茶]"
"七十二重神鸣曲","男","无IP","351286899","6","星座系列：双鱼座","10000","104","11","爱酱学精了，出EP了居然[doge][吃瓜]"
"小光焰","女","无IP","325323162","6","还有醒着的么","10000","90","","玛德，刚刚才用小岛爆爆鸦凹了120的乐土，一点进b站就是没入乐园，搞得我以为是什么乐土攻略，现在我看到乐这个这就ptsd[藏狐]"
"玻璃瓶子丨","保密","无IP","73732255","6","","10000","87","","有点打不动了，……这一期窝在红莲是真难受。第一关打了三遍时间不够[跪了]，伤害差了很多，算了，还是回窝的苦痛吧"
"姜禾麦冬","男","无IP","33616191","6","","10000","86","10","“拜托，你很弱唉”"
"噬魂のゼロ心烁","男","无IP","49876030","6","总之就是非常可爱","10000","70","10","缇米朵啥时候上舰啊[滑稽][呲牙][吃瓜]"
"游手好闲的姜女侠","男","无IP","501765414","5","白蛇2：青蛇劫起","10000","64","10","原神对三蹦子的影响越来越深了"
"风云阡陌","女","无IP","36314559","6","","10000","61","","曹，提米朵太可爱了，求求你让她上舰吧[大哭][大哭][大哭]"
"靠蚁suki","男","无IP","676282663","5","原神","10000","57","","什么懒狗公司，游戏里随便录几段就当mv了是吧[贝拉kira_拜托]"
"金色暗影__","保密","无IP","11610500","6","魔法学院","10000","47","","后崩二手机玩起来画面太糊了，优化也太差了吧"
"鹎期","女","无IP","14700040","6","崩坏：星穹铁道","10000","30","","你居然还有ep？？还藏了什么都拿出来看看（抖爱酱[初音未来_GKD]"
"dragonのdream","男","无IP","39754867","6","hanser","10000","29","","后崩画质拉满是这样的吗？手机早就顶不住了，是时候超限电脑了"
"是酥油饼酱","男","无IP","107268697","6","","10000","27","11","其实玩家在接近红色水晶还有声音哦，是一种空洞幽邃的声调，总之令人毛骨悚然[冷]"
"L许叶落","保密","无IP","332720272","6","明日方舟音律系列","10000","23","","哦豁～"
"繁星萤火虫","女","无IP","287463308","6","","10000","21","","我的破手机，你就不能给点力吗！我也想要这画质！！[tv_笑哭]"
"od名","男","无IP","29243449","6","","10000","17","","兄弟们，今天没事闲的看看背包发现有个吼姆，送给鸭鸭可以做任务，知道了的可以无视了，就是给不知道的提个醒[藏狐]"
"巨人不乖","保密","无IP","1846894668","5","","10000","17","","你这画质离谱"
"冰蓝老鼠","男","无IP","95493235","6","","10000","17","8","亲爱的米忽悠，你是忘记了你还有网易云要更新吗？"
"JoY","男","无IP","504166312","5","","10000","13","","就我个人的体验来说，崩三以来很有玩法和体验的版本，乐土难度也降了点，很舒服。奖励活动方面也在慢慢变好，崩三保持发展好这个态势，回归的老玩家自然会越来越多的。哎，真心希望别像以前那些逼肝逼氪的版本一样了。留住玩家的心，为这个游戏买单的人自然会越来越多。"
"深蓝的云彩","男","无IP","527666646","5","原神","10000","13","","感觉又要出一个舰桥外景了，就是后崩二为背景"
"古明に家の恋恋","保密","无IP","14117389","6","初音未来13周年","10000","13","","1播放16条评论，你们是不是有点离谱了（"
"阿巴超","男","无IP","37258920","6","","10000","12","4","求求你们了，投奥拓一票吧！！！我想看丝袜奥拓！！！求求你们了！！！求求大家了！！！投奥拓一票吧！！！投奥拓一票吧！！！求求了！！！！！求求！！！！了！！！！！！！[大哭][大哭][大哭][大哭][大哭][大哭][大哭][大哭][大哭][大哭][大哭][大哭][大哭][大哭][大哭][大哭][大哭][大哭]"
"我是甜咸鱼哟","保密","无IP","28207079","5","","10000","12","","00:01 Ele Wh  =wheel轮（摩天轮/旋转木马）,01:38 And IsL =island岛,03:00 Den Gar =garden花园"
"小谁家的诺言","保密","无IP","397972482","5","崩坏3・天穹流星","10000","12","","太好听了吧!我们一起玩后崩好不好，一起去![崩坏3_干杯]"
"迎向练习场的箭","男","无IP","24192508","6","","10000","12","","挚友，下次要玩刺激♂的先知会一声，谢了[捂脸]"
"乃琳捏","男","无IP","323392279","5","","10000","11","","第一次这么早！！！还有就是，好想玩新剧情能不能让我快点到十级[妙啊]"
"卡罗呢","保密","无IP","74404544","6","星座系列：双鱼座","10000","11","","游戏很好，孩子很喜欢，就是手机变成煎蛋了[doge][doge]"
"深山莺不中","保密","无IP","398037370","6","","10000","10","","我用桌面版玩后崩画质可以拉满，但是很卡。用平板玩很流畅，但是画质调到最高也挺糊的（原神也是一样，可能是我平板太大了，不适应移动端的分辨率）。怎么样才能两全啊"
"最爱琴里啦","男","无IP","94703977","6","星座系列：双子座","10000","10","","刚考完四级，他娘的坎儿井[辣眼睛]"
"傲世流云","保密","无IP","188726603","6","崩坏：星穹铁道","10000","10","14","[崩坏3_糖葫芦]好耶[崩坏3_糖葫芦]"
"Cosmo_polit_an","男","无IP","28967912","6","原神","10000","9","","没入乐园的曲子再不进新专辑我就要疯了"
"盐味砂糖酱","女","无IP","361095527","6","","10000","9","","请问爱酱如何看待第一偶像加赛的局势[脱单doge][脱单doge]"
"风间2887","男","无IP","65915684","5","","10000","8","","后崩二的策划是有什么大病吧，一天只能升一级我忍了，最后一级你还要分两天我是真心受不了，这tm是从并夕夕招过来的吧[生气]"
"爱莉希雅を郅筏皮","女","无IP","392746238","5","hanser","10000","8","","今天，我才车上看到一个小女孩在玩崩坏三。。。。。。。。。。。。。。。。。。。。。。。。。。。。。。。。。。。。。。。。。。。。。。。。。。。。。。。。。。。。。。。。。。。。。。。。。。。。。。。。。。。。。。。。。。。中间的忘了，就记得有一个回归邀请码：259958135,[doge]"
"心跳加速-","男","无IP","36176113","6","赏樱大会欧皇","10000","8","6","感觉好棒啊[崩坏3_吃饭团][崩坏3_吃饭团][崩坏3_赞]"
"月影心殇","保密","无IP","503382801","5","","10000","8","","后崩2很不错，就是一点费手机"
"湛蓝色的理智-","保密","北京","1188157124","5","","10000","8","","这么精美的地图，现在也沦落为无人问津，有一种时代逝去的失落感"
"翼击冫伊卡洛斯","保密","无IP","15628161","6","hanser","10000","7","","崩坏1s pro max超限机型,采用处理器 崩坏k423.0,屏幕 崩坏 CX屏,崩坏线性CX马达,崩坏CX四维扬声器 ,镜头 超限镜头模组 看的更清晰 看的更远 内置望远镜模组 拍照全方位 让你感受大千世界,手机采用崩坏超限材料打磨而成 更耐用 更防摔 防水   ,配件 魂钢数据线 充电头 ,编不下去了[脱单doge]"
"ZN锦_","保密","无IP","503991151","5","","10000","6","","问一下大家，现在入坑崩坏三还来得及吗"
"星与观星之日","男","无IP","37189189","6","","10000","6","","有没有和我一样第一眼看成没人乐园的[脱单doge]"
"辰星剑起","男","无IP","323711904","5","洛天依9th生日纪念","10000","6","","这2不比一好多了，一玩起来就是光污染，每a一下就闪一下眼睛都瞎了"
"Lingpansy","保密","无IP","381585795","5","","10000","6","","在，布狼牙传说最后那一段bgm能不能放出来？[脱单doge]"
"清色之羽","保密","无IP","1032866703","5","","10000","6","","这才是后崩二的最高画质，实际画质以手机配置为准"
"dragonのdream","男","无IP","39754867","6","hanser","10000","6","","试卷摸起来手感很好,字体很清晰,没有异味,中国之声音乐很好听,装订整齐,孩子很喜欢，下次还来"
"崩坏3第一伥鬼","男","无IP","397171198","6","崩坏3・天穹流星","10000","6","10","我超，你也有EP？"
"奈何涂山一抹红_","男","无IP","29686454","6","","10000","6","","605714366，蟹蟹大哥[脱单doge][保佑]"
"黑刀圣","保密","无IP","314729328","5","","10000","6","","鸭鸭子"
"苏夜联","男","无IP","22182125","5","","10000","5","6","后崩人脸为啥一会黑一会白（部分对话时候），好家伙黑白双煞是吧[热词系列_知识增加]，不过缇米朵是真的好大，嘿嘿嘿嘿，我的缇米朵"
"忘却的旋律喵","保密","无IP","130917066","6","良辰美景・不问天","10000","5","","啥时候能把后崩2的渲染分辨率拉高一点啊[哦呼]"
"素质zuan人","保密","无IP","341939208","5","","10000","5","","那个鬼脸吼姆可以送给乳鸭开任务哦(~_~;)"
"我是个废物不可利用","保密","无IP","395488153","5","","10000","5","","刷到我并点赞的单抽出乳鸭（好吧我就是骗赞）[doge][星星眼]"
"落日流浪","保密","无IP","488184419","5","","10000","5","","刚刚，今天真美好买的薪炎抱枕刚到没多久就有EP看，真不错[打call]"
"海螺精","女","无IP","39855098","6","明日方舟音律系列","10000","5","","草，你也玩ep[崩坏3_饿了]"
"绯世い","保密","无IP","327066098","5","星座系列：射手座","10000","5","","我本以为我的660可以再活多几年的，直到我昨天玩了后崩二[无语]"
"jastSasuke","男","无IP","449270194","4","","10000","4","","有谁跟我一样？根本就带不动后崩坏书二，进去不是黑屏就是死机[呆]"
"-普通市民李某-","男","无IP","32454046","6","","10000","4","","唉，后崩2啥都好，就是前期太长草了，一天就给俩日委，完全不够玩，越级打boss又手残，这就像是一碗非常美味的面摆在我面前，每天却只给我喝口汤，我想硬着头皮嗦口面，结果贼烫嘴"
"硬币养老","男","无IP","44979764","5","","10000","4","","全是实机，就不能做点CG动画[生气]"
"雅兮无双","保密","无IP","636503","6","","10000","4","10","这就是工业化吧[滑稽],期待下期虚空万藏讲堂开始谜语人"
"扉回","保密","无IP","2045440252","4","","10000","4","","这个后崩二啊，我全部拉满已经能感觉到有点拖手了，天玑1200有点不够用了[藏狐]"
"无意松雪疏疏下","保密","无IP","65574180","6","","10000","4","","我觉得可以出一套类似于彩蛋的成就 可玩性会增加一点"
"摇曳猫尾","保密","无IP","454107947","5","~るる","10000","4","4","玩后崩2有越来越有一种尼尔机械纪元的感觉"
"圆方正","保密","无IP","18885175","6","请吃红小豆","10000","4","","我想骑旋转木马"
"坂凛的板栗","男","无IP","15050501","6","","10000","4","","舰长，快回来填邀请码吧[大哭]"
"赛博癫痫患者","男","无IP","4738708","6","仲夏幻想","10000","4","","在？版本pv音乐更新下？我现在就想听到爱莉希雅pv音乐！[doge]"
"剑破天涯","保密","无IP","130070584","6","刺客伍六七","10000","4","","不知道是不是错觉，总感觉手机上的后崩二，画质挺糊的……"
"加奈奇遇记","男","无IP","9056651","6","","10000","4","","三蹦子也出ep了，"
"予蚁玫瑰_","女","无IP","271672681","6","异常生物","10000","4","","看EP莫名感动。全部任务做完之后就没上线了。这熟悉的风景短暂又惊险的旅行比崩三主线地图还感人[绊爱第二弹_睡觉]"
"雨式葳","保密","无IP","3266218","6","","10000","3","","太喜欢太喜欢了，有十年前听泽野电音的那种感动了，可惜泽野现在已经很少写电音了[笑哭]"
"苏忆伤","保密","无IP","282381123","5","","10000","3","","各位大佬们，新人入坑，想问一下，次生银翼这个角色池子结束前，我应该是抽不出来了，想问一下，它这个复刻是跟隔壁原神一样，每个版本固定几个角色吗？[tv_流泪]"
"念你如初SSS","男","无IP","34671601","6","","10000","3","","刘伟，你真女儿在搓螺旋丸哦[脸红]"
"账号已注销","保密","无IP","237568769","0","","5000","3","","我打算基于后崩世界观写一篇同人文,孙贤,主骑：假面骑士白练,强化形态：假面骑士白练・游侠,强化形态V2：假面骑士白练・月光,强化形态V3：假面骑士白练・天穹游侠,最终形态：假面骑士空,最强形态：假面骑士空・煌星破晓,,宋英涛,二骑：假面骑士绯红,强化形态：假面骑士绯红・强袭,强化形态V2：假面骑士绯红・断罪影舞,强化形态V3：假面骑士绯红・雷电鬼铠,最终形态：假面骑士雷,,张公兵,三骑：假面骑士战车,强化形态：假面骑士战车・山吹,强化形态V2：假面骑士战车・异度侵蚀,最终形态：假面骑士理,外传补充：假面骑士战车・次生银翼,,何莲,四骑：假面骑士凯旋,强化形态：假面骑士凯旋・深红,最终形态：假面骑士凯旋・月蚀,大纲已经想好了，主角的名字我也编好了，就是想不出细节[捂脸]"
"停车场反杀乌鸦","保密","无IP","219491448","6","纳米核心","10000","3","10","醒醒，改了吧，你已经不是第一偶像了[doge]"
"搓丸子的律化娜","保密","无IP","229921472","6","","10000","3","","光影和分辨率还是太低了，虽说手机一直在发热，但是我压的住（指手机上了水冷），倒是双u一直没跑满，还有压榨空间[doge]建议光影做的再高一点，我的手机还顶得住"
"182815037","保密","无IP","58123775","4","","10000","3","","爱酱，你又在拿游戏内录屏来氵视频哦，去做一个cg好不好？[doge]"
"0-神灵蝶火","保密","无IP","484075984","5","","10000","3","","缇米朵这么大，还能行动地如此灵活，可见力气绝对不小，所以一个人把吧台搬回来瞬间又觉得合理了起来呢[tv_笑哭][tv_流泪]"
"希儿芙乐艾official","女","无IP","57990517","6","希萝Hiiro","10000","3","","我大抵是要没了吧https://b23.tv/BV11M4y1c7Kr"
"开普勒天空立法者","男","无IP","499269663","5","","10000","3","","实名的我还在思考，我应该怎么合理搭配乐土，剧情，后崩2战场[热词系列_我裂开了]"
"igotader","保密","无IP","87998099","5","万界仙踪","10000","3","","我永远爱蹦蹦蹦[打call][打call][打call][打call][打call]"
"_籽","男","无IP","352977761","5","","10000","3","","这个委托每天就两个，太少了"
"小小号机","保密","无IP","455733973","5","Kizuna AI","10000","3","","气死了！50发五个月下！我要大鸭鸭！！！给我鸭子！"
"八p","男","无IP","15736071","6","","10000","3","9","没人乐园？"
"辛垣梨醢","保密","无IP","381583992","6","崩坏3・天穹流星","10000","3","13","无人静听"
"花与鸟与爱之诗","保密","无IP","176427313","6","泠鸢yousa登门喜鹊","10000","3","","能不能整个新的战斗音乐"
"阿尔提米西亚Artemisia","男","河南","522410703","5","约战・狂三","10000","3","","真成没人乐园了[tv_鬼脸]"
"枫风疯叶","女","无IP","27208806","6","","10000","2","","艹，看成了没人乐园"
"柴可夫撕鸡x","男","无IP","4103600","6","","10000","2","","爱酱不会真下岗了吧[热词系列_破防了]再看不到新角色宣传视频我要死了[tv_难过][tv_难过][tv_难过]"
"逸赴-","保密","无IP","163873347","5","","10000","2","9","角色预告呢？？"
"爱k坤","男","无IP","549604880","5","洛天依・最美的夜","10000","2","","@崩坏3第一偶像爱酱 你们有没有发现，后崩坏书2鸭鸭的必杀技在白热状态下也无法触发二阶段，这bug到现在还没有修复好（我也激活了必杀核心，主角和提米朵就没事，鸭鸭的话大概放十次才会触发一次）"
"吃饭第一名丶","男","无IP","433816469","4","","10000","2","","垃圾游戏就真的离谱两个保底圣痕就真的离谱歪了七八次我真的不能接受"
"灵波尔Ringpole","男","无IP","34591784","5","","10000","2","","原神长草期玩家，想问问崩坏3值得入坑吗[思考]"
"枫是我的老婆","保密","无IP","79122419","6","","10000","2","9","第一首真的好有乐园的感觉[星星眼]"
"改成19","男","无IP","689370243","5","","10000","2","","今天是12月24号，爱酱辞去了天命第一偶像的职位"
"麦浪sun","保密","无IP","438261002","5","","10000","2","","刚刚入坑，之前只玩过一会，现在的话水晶要不要攒着等过年啊[2233娘_困惑]音乐一直都好听啊"
"铃仙铃","保密","无IP","4020211","6","","10000","2","","万人血书提米朵上船（1/10000）[doge]"
"君相本明","男","无IP","394805043","6","百鬼幼儿园","10000","2","","www.mihoyo.com 【崩坏学园】2012年12月13日，末日登陆AppStore。啊咧？欧尼（奈）酱你素在看PV么？ (￣.￣)+ 喂喂，看过就快去AppStore下载啊！！！ 不下载看再多介绍也木有办法与伦家订立契约啊，呜啦啦啦~~~~"
"一串不存在的省略号","保密","无IP","189115905","6","","10000","2","","135455099感谢各位大佬QWQ"
"未来Vilei","女","无IP","12437031","6","","10000","2","6","没  人  乐  园"
"o馒头orz","保密","无IP","380590262","5","","10000","2","","麒麟9000表示无所畏惧，甚至还开小窗查起了攻略"
"大反派喵咪","女","无IP","104317874","6","","10000","2","","能不能，就是，能不能把第一首做进舰桥音乐[脸红]"
"上课时间快到了","男","无IP","1965745999","5","","10000","2","","我已经把后崩爬完强敌刮完了了什么时候更新强敌[doge]"
"RX-大白兔不吃奶糖","女","无IP","496351391","5","","10000","2","8","学生党，为了后崩2从米6换米8，845完美存活！[笑哭]"
"巨型白给仓鼠","男","无IP","843989","6","","10000","2","","《崩坏3》EP - 「没进乐园」[滑稽]"
"鸽子星绅士","保密","无IP","11660332","6","原神","10000","2","11","我的宝，下次请务必直播后崩二地图解锁，人走的路吗这是[崩坏3_看书]别人缇米朵一直滞空，我不断下滑，按了跳跃键跟没有一样[崩坏3_生气]"
"牛皮上天炸开花","保密","无IP","35538804","6","","10000","2","","3070显卡玩后崩2最高画质特效全开，GPU占用100%.温度75℃，原神1.5渲染都没这待遇，赛博朋克2077光追最高特效都跑不到100%,[辣眼睛]优化感人"
"诗新明","保密","无IP","481077593","5","橘猫挂件","10000","2","","这什么啊，好久没玩崩三，怎么把世界做这么好了"
"MZC若黎","男","无IP","34125656","5","","10000","2","","打那个护士的时候，我原本以为乱打都能过去就没走位，结果打到后面只剩下48血的鸭鸭，被迫丝血反杀[藏狐]"
