"昵称","性别","IP","UID","等级","装扮","用户权重","获赞数","粉丝团等级","评论"
"NeptuneC001","保密","无IP","89422597","6","","10000","0","","弱弱问一句，什么时候更新？[2233娘_困惑]"
"始adoc","保密","无IP","141784871","5","","10000","0","","被**制裁时我把这游戏误删了，然后我再也没有回来(s°口°)s(┴―┴"
"萌系冰糖","女","无IP","145113250","4","","10000","0","","这次更新会发放测试服资格吗？[星梦手记_问号][星梦手记_惺j认真]"
"雀-Hibari-","保密","无IP","45988113","6","2021拜年纪","10000","0","4","好帅"
"FFF团驻中国大使馆","男","无IP","2378783","6","","10000","0","","卡莲的男人绝不后退！"
"暮岭_","保密","无IP","3295848","6","三周年恋曲","10000","0","","我一年的欧气啊啊求出卡莲!!"
"虚拟品鉴家","保密","无IP","73822530","6","扇宝dlc头像框新","10000","0","","我看我要辍学去打工赚钱养活我的女武神了[小电视_发愁]，麻麻我养不起了"
"星海穹羽诗","保密","无IP","36572940","6","拜年祭粉丝专鼠","10000","0","","夜想曲好像有类似逆神的效果，标记，爆发"
"燕熙之","男","无IP","32907099","5","","10000","0","","为什么这么久了都没有测试服的视频？"
"Midgard1904","女","无IP","2078723","6","明日方舟","10000","0","","卡莲呜呜呜呜呜呜"
"炎月丶苍蓝","男","无IP","9599429","6","橘猫挂件","10000","0","","←_←你们这些人口口声声说要跳槽逆熵结果呢，还不是跑到对面魔法少女组了"
"账号已注销","保密","无IP","13307036","0","","5000","0","","(｀ω)"
"l三叶半夏l","保密","无IP","49707284","6","","10000","0","","超好看！为卡莲老婆氪爆！"
"呃啊转生转生","男","无IP","37058469","6","嘉然今天吃什么","10000","0","","P5！？"
"呃啊转生转生","男","无IP","37058469","6","嘉然今天吃什么","10000","0","","女神异闻录？？！"
"只做高质量视频","保密","无IP","305097858","5","","10000","0","","卧槽什么时候发的PV？"
"丶到即止","男","无IP","93207855","6","","10000","0","","那个氯化钠是不是幽兰戴尔呢？"
"带聪明","保密","无IP","108064649","5","","10000","0","","好帅"
"龙司莲","男","无IP","93671599","6","","10000","0","","什么时候更新啊"
"浪漫Pumpkin","保密","无IP","87702481","6","","10000","0","7","A...A接拉起?"
"御坂19099号","保密","无IP","167502633","6","","10000","0","","许愿卡莲！极东赛高~"
"御坂19099号","保密","无IP","167502633","6","","10000","0","","哇，这mod怪盗卡莲独立了Σ( ￣□￣||)"
"皮皮船冲鸭","男","无IP","8366858","6","原神","10000","0","","浮华无影腿[小电视_赞]"
"WiltMu","男","无IP","11316276","6","","10000","0","","这次两个角色都好帅啊，许愿新角色()"
"破⊥跽","男","无IP","50681639","6","EveOneCat2","10000","0","","请问一下直播的时候是几点?"
"bo良ki影","保密","无IP","25630787","6","","10000","0","3","woc卡莲和班长好帅"
"王乾伯","男","无IP","31939361","6","乃琳","10000","0","","什么都不要说了  我的手机快炸了"
"_羽-","保密","无IP","73846843","6","","10000","0","","死吧!奥托!"
"_羽-","保密","无IP","73846843","6","","10000","0","","原来我们的休伯利安怎么帅!"
"_羽-","保密","无IP","73846843","6","","10000","0","","燃爆!"
"楼下的小明同学","男","无IP","17002017","6","","10000","0","","许愿冰卡莲白班长"
"化作一阵雨","保密","无IP","35241411","5","","10000","0","","我的心已经被收下了(｀ω)"
"青丘山九尾狐","男","无IP","435674","6","","10000","0","","符华很帅 就是没啥特效 反之另一个卧槽 这特效 卧槽 帅的一批[小电视_我好兴奋]"
"明镜御心","女","无IP","8927199","6","","10000","0","","不得不说，这段音乐不错"
"凉半默","男","无IP","16501054","6","碧蓝航线2020","10000","0","","许愿冰莲出必还愿"
"风の五味","保密","无IP","290541339","3","","10000","0","","呜呜，我的老婆啊，昨天抽犹大把所有水晶全花光了，而且还没抽到(益)"
"落辰不会沉","男","无IP","287718883","6","星座系列：天蝎座","10000","0","","许愿冰卡"
"六枚硬币值","保密","无IP","87317223","6","","10000","0","","一个泰坦穿着？莫奈套？"
"音乐院长","男","无IP","236056834","5","","10000","0","","谁知道什么时候更新？"
"贰陆零零-","男","无IP","226853600","6","hanser","10000","0","5","兑换码都错过了[小电视_发愁]"
"非正","保密","无IP","15181314","6","","10000","0","","妈耶错过直播错过兑换码了[小电视_发愁]"
"曾慕多情シ","男","无IP","26248197","5","","10000","0","","我还是去日服吧国服氪不起吃保底[2233娘_大哭]"
"喜gPONY的ACG宅","男","无IP","1890211","5","","10000","0","5","怪盔卡一定收回!,另外,新符A不知用程度如何?"
"艾斯温特尔","保密","无IP","4818367","6","崩坏：星穹铁道","10000","0","","反正我也抽不到∠(  」∠)_"
"Rolancros","男","无IP","6087576","6","乃琳Queen","10000","0","","许愿勿忘，第六夜响曲"
"白梨花的休伯利安舰长","男","无IP","101320903","5","","10000","0","","许愿卡莲"
"恋恋の吃土大冒险","男","无IP","1115429","6","","10000","0","2","真香～"
"柳莳两载半春秋","保密","无IP","263362","6","","10000","0","","PV质量对比以前下滑好多。。。 或许，，游戏也是？"
"茴香怪","男","无IP","5049776","6","#EveOneCat","10000","0","","怎么还有3k氪可喷的说法的[小电视_发愁]"
"父〉钠咂ダ","保密","无IP","123832818","6","","10000","0","","许愿s卡莲，出了必还愿"
"_闪星尘_","男","无IP","161722993","5","","10000","0","","评论区撕逼的真多(`_`)!!"
"逆神巫女-八重樱","保密","无IP","171702636","6","碧蓝航线","10000","0","","看了评论里的东西，我现在好愉悦啊[2233娘_大笑]"
"PinkPina","保密","无IP","10128596","6","三周年恋曲","10000","0","","2.2以后是不是都不放直播录像了"
"深海深海丶","男","无IP","10020293","6","","10000","0","","米哈游制作实力就那样啦，虽然作为年份不是很久的公司来说已经很不错了r(￣￣)q"
"倒退向阳","保密","无IP","21105347","6","","10000","0","","我全都要"
"纯水之灵","男","无IP","6371672","6","","10000","0","","真香"
"薄雾知秋","男","无IP","67850206","5","","10000","0","","~啊啊啊啊啊啊啊"
"仙仙仙仙仙仙逸","男","无IP","9620498","5","","10000","0","","中华人民共和国著作权法实施条例第四条：著作权法和本条例中下列作品的含义：,　　（一）文字作品，是指小说、诗词、散文、论文等以文字形式表现的作品；,　　（二）口述作品，是指即兴的演说、授课、法庭辩论等以口头语言形式表现的作品；,　　（三）音乐作品，是指歌曲、交响乐等能够演唱或者演奏的带词或者不带词的作品；,　　（四）戏剧作品，是指话剧、歌剧、地方戏等供舞台演出的作品；,　　（五）曲艺作品，是指相声、快书、大鼓、评书等以说唱为主要形式表演的作品；,　　（六）舞蹈作品，是指通过连续的动作、姿势、表情等表现思想情感的作品；,　　（七）杂技艺术作品，是指杂技、魔术、马戏等通过形体动作和技巧表现的作品；,　　（八）美术作品，是指绘画、书法、雕塑等以线条、色彩或者其他方式构成的有审美意义的平面或者立体的造型艺术作品；,　　（九）建筑作品，是指以建筑物或者构筑物形式表现的有审美意义的作品；,　　（十）摄影作品，是指借助器械在感光材料或者其他介质上记录客观物体形象的艺术作品；,　　（十一）电影作品和以类似摄制电影的方法创作的作品，是指摄制在一定介质上，由一系列有伴音或者无伴音的画面组成，并且借助适当装置放映或者以其他方式传播的作品；,　　（十二）图形作品，是指为施工、生产绘制的工程设计图、产品设计图，以及反映地理现象、说明事物原理或者结构的地图、示意图等作品；,　　（十三）模型作品，是指为展示、试验或者观测等用途，根据物体的形状和结构，按照一定比例制成的立体作品。"
"Hiroy","保密","无IP","4447325","6","#EveOneCat","10000","0","","直接真人PK决战皇城好了。谁打赢，米忽悠都不会听谁的"
"sec4fun","保密","无IP","24683317","6","RNG战队","10000","0","","一粉顶十黑太真实了"
"HGHT_","保密","无IP","50918170","6","","10000","0","","在哪可以弄女武神原画他图片呐(=ω=)"
"三枪挑飞丈母娘丶","保密","无IP","20870442","6","","10000","0","","唉反正又抽不到"
"不会总是如此","保密","无IP","38317585","6","","10000","0","","卡莲cv是一个人吗！？"
"南-鸟","男","无IP","35377323","6","贝拉kira","10000","0","","不是很懂那群说动作抄袭的dalao。。。"
"爱丽丝威震天01","保密","无IP","73751157","6","","10000","0","","我不管，我就是喜欢崩坏。"
"LeonFc","男","无IP","8070055","6","拳皇","10000","0","","说实话玩这游戏之前我是玩刀剑神域记忆碎片的，和万代比，崩三算良心多了…万代一个月出两三个池子，钱包真的遭不住。"
"nayuki-","保密","无IP","19518327","6","citrus","10000","0","3","评论对喷还行2333"
"这是b站二次元请出去","保密","无IP","3011441","6","","10000","0","","也太帅了吧"
"逐一发送瑞士卷的渚","保密","无IP","7479131","6","meimeiverse","10000","0","","六个字:AWWBWG"
"潇允_","保密","无IP","198363844","5","","10000","0","","精彩！"
"AD102-300-A1","男","无IP","13248149","6","","10000","0","","845瑟瑟发抖"
"凉鱼-","保密","无IP","21291593","6","","10000","0","","专门进来看评论(￣3￣)"
"我说不了话5555","男","无IP","91857470","6","嘉然今天吃什么","10000","0","","那个一闪而过的女仆是谁啊(=ω=)"
"十六夜D夜的丈夫","保密","无IP","194957","6","","10000","0","","我都要！"
"冠位萌新","女","无IP","22136985","6","","10000","0","","(=ω=)"
"星野君野","女","无IP","10524263","6","星座系列：摩羯座","10000","0","","新深渊对刚上70级的人太不友好了[小电视_发愁] 苦痛稳保级到禁忌[小电视_发愁]"
"无名者卞鸥","男","无IP","77061154","5","","10000","0","","提前许愿卡莲_(:3」∠)_"
"Caesar白神凯","男","无IP","29565284","6","2021拜年纪","10000","0","","感觉抽卡最近完全不平衡。。。无数次十连保底……（昨天天命武库单抽9发连底都没保活动就结束了[小电视_赞]）难不成非得648走一波转运？"
"期盼着明天","男","无IP","60441764","6","三周年恋曲","10000","0","","嘤嘤嘤"
"缠绵的午后暖阳轻覆","男","无IP","13721236","6","","10000","0","","从200楼后全是撕"
"Space丿空白","男","无IP","162810391","6","","10000","0","11","十连许愿第六夜想曲，出必还愿[蛆音娘_卖萌]"
"燕熙之","男","无IP","32907099","5","","10000","0","","什么时候发直播啊爱酱，2.2你都没补呢。"
"七夜日露","男","无IP","139345","6","刺客伍六七","10000","0","","我连一个毕业角色都没有，养不过来了"
"兰陵狐","男","无IP","27035753","6","","10000","0","","期待2.3"
"小键丶","男","无IP","27186762","4","","10000","0","","这次初始s不是可以肝吗？那个远征啥啥的。就搞不懂一个劲的喷什么，不喜欢可以不氪啊"
"猫木困","女","无IP","6284931","6","","10000","0","","我永远喜欢怪盗卡莲。。但这和剧情什么关系"
"洛安生无忧","保密","无IP","15055732","6","EveOneCat2","10000","0","","氪黑鸭氪伤几次了还没出货。能不能让我白嫖个卡莲啊――"
"我预购了2042终极版","保密","无IP","158149099","6","","10000","0","","这不是me社的mod吗……"
"钟声一响","男","无IP","6448382","6","崩坏3・天穹流星","10000","0","","就想问一下什么地方抄袭了啊？"
"无形歌者无言舞者","男","无IP","100740512","6","碧蓝航线","10000","0","","wmuehwks3x"
"小白在这哟","男","无IP","37395276","6","","10000","0","","人类化身战争贪婪？没有战争和贪婪人类怎么进步？[小电视_发愁]"
"星之内海的兔子","男","无IP","31915567","6","","10000","0","","什么时候2.3更新啊"
"八重命轮","保密","无IP","157004696","6","","10000","0","","“骚话莲”的大招和我家鬼铠差不多嘛！(_`)"
"\色の彼岸花","男","无IP","21836929","5","","10000","0","","我到现在只有八重樱和丹樱。。。。。一个初始s都没有"
"独行r","保密","无IP","21893013","5","","10000","0","","什么时候上线"
"拆迁办贤余","保密","无IP","169967800","5","","10000","0","","轮回可以换冰卡莲啊，不就100天吗？咸鱼肝爆！"
"白饭伴稀粥","男","无IP","107958059","6","","10000","0","3","玩游戏开心就行了，用得着这样吗，评论戾气有点严重(￣△￣)"
"飞翔的福明","男","无IP","8675239","6","","10000","0","","变得越来越肝了，玩不动了"
"拆迁办贤余","保密","无IP","169967800","5","","10000","0","","咸鱼不氪金，出了卡莲就拜大伟"
"罗NALDO","男","无IP","2125021","6","三周年恋曲","10000","0","9","视频录播呢"
"IDScMcCc","保密","无IP","21880116","6","双生视界・花嫁","10000","0","","up周期短，逼着你氪金，你不氪？好，让你半年都拿不到这次up的东西，啧，这样谁会去玩啊,新角色抄袭，冰八鬼泣之前有改动，玩起来有鬼泣的感觉，异能卡莲完全照搬，为啥？急着玩人氪金就出角色，想不出来只好抄袭"
"妹控妹","保密","无IP","2297712","6","BW2020","10000","0","","爱酱大胜利！(Д)"
"我嗑CA那我让让你吧","保密","无IP","30677859","6","","10000","0","","突然有点想看新剧情的欲望了"
"燧石长矛","保密","无IP","7371802","6","","10000","0","","毕竟月卡党，随缘抽夜曲[小电视_发愁]"
"灼眼的喵帕斯","女","无IP","143233522","6","","10000","0","","我觉得有点不妥，新女武神的更新速度太快了吧，而且一个比一个厉害，平民玩家就算抽出来装备也跟不上啊。(平民玩家的想法，氪金大佬请无视。)"
"某银魂的坂田坂田","保密","无IP","12630400","6","","10000","0","","唉，又想为卡莲氪了"
"冰糖柚子冰","保密","无IP","107914637","6","仲夏幻想","10000","0","","许愿新卡莲(=ω=)"
"冰下云","女","无IP","73778406","6","绯赤艾莉欧","10000","0","","冰八！唉嘿嘿嘿[小电视_我好兴奋]"
"守护崩坏的世界","男","无IP","37899604","6","","10000","0","7","帅帅帅"
"不知道的不清楚的","保密","无IP","813180","6","","10000","0","","所以氯化钠又毁灭世界了？然后和崩崩一样开二周目？还是时间倒流吗？有点期待后续"
"精灵城R","男","无IP","25755264","6","凡人修仙传收藏集","10000","0","","之前是太忙了才弃坑。。没时间肝，不知道现状如何额@_@"
"Nora_ven","保密","无IP","36965529","6","","10000","0","","你们接着喊弃坑，有本事把米忽悠喊倒闭，键盘侠连自我思考都不会的吗？"
"猹狸狸狸子","男","无IP","2705732","6","异常生物","10000","0","","太久没关注，节奏已经这么多了吗[蛆音娘_吃瓜群众]"
"岐ki","男","无IP","1843952","6","","10000","0","","许愿第六夜想曲！！！"
"西泽轩逸FaTe","男","无IP","8186242","6","碧蓝航线","10000","0","","氪爆不改非洲命"
"Aksara丶调","男","无IP","2065991","6","","10000","0","","喂i，这个卡莲没有开放时间那个这么有感觉啊。,sao话莲不是这样的啊"
"自在观想法","保密","无IP","34144074","6","七濑胡桃","10000","0","","氪金是不可能再氪金的了！就算有钱也不会去氪！这辈子玩游戏也不会去氪金了！话就摆在这！爱信不信！"
"晴海桑提不起劲","男","无IP","34537710","6","战双帕弥什","10000","0","","进攻天命！"
"有智慧者智乃","保密","无IP","22922296","6","公主连结佩可莉姆","10000","0","","坐等直播录像"
"RainZhen_Mei奈绪","保密","无IP","180512104","6","","10000","0","","我庄某某，今天就是要回坑，为了2.3版本，哼,[小电视_好怒啊][小电视_好怒啊][小电视_好怒啊]"
"不管说什么都开摆","男","无IP","242513577","6","","10000","0","","我怀疑我的手机带不动( _f｀)"
"唔唉冻","男","无IP","226977861","6","至尊戒","10000","0","","希望优化下游戏，3t玩有时很卡"
"守不住的城","男","无IP","35279157","6","崩坏：星穹铁道","10000","0","6","冰卡：你的金就由我收下了（￣￣）"
"伊龙Eerong","保密","无IP","5793713","6","提摩西小队","10000","0","","所以这都啥事啊(Д≡д)!?"
"梦幻的世界线","保密","无IP","32234265","6","","10000","0","","这无影腿，丁叔是你吗"
"用户_3680","保密","无IP","39123222","6","","10000","0","","我的黑鲨还抗的住吗？,要不上AMD2400g？"
"改名可以让我中奖吗","男","无IP","10239348","6","","10000","0","","崩坏百裂脚？"
"kkdndbdk","男","无IP","101166697","4","","10000","0","","有时候看你们撕X也是一种乐趣"
"言墨飞","保密","无IP","173380952","6","","10000","0","","许愿  两个新人物 嘤嘤嘤"
"若水时光映你如月","男","无IP","24051908","6","","10000","0","5","我可以无限循环看！"
"d核","保密","无IP","104973357","6","2233幻星集","10000","0","","米忽悠还是赶紧找个时间针对游戏运行进行优化吧，对运行差的手机很是难受啊"
"新w雨","保密","无IP","39495314","5","","10000","0","","卡莲帅的让我想要氪金上万啊。"
"大咖娜","女","无IP","51272336","6","","10000","0","","#天命之战##天命之战##符华##记忆战场##崩坏3##不破不立##第六夜想曲#"
"账号已注销","保密","无IP","27730672","0","","5000","0","","抄袭?怎么抄袭了?我知道这次碎片商店疯狂试探玩家底线这是不好，但是抄袭?what？"
"抗压吧务团队69","男","无IP","6403032","5","","10000","0","","养老玩家就看看（￣￣）肝不动了氪不动了，米忽悠死活管我卵子事"
"零仙_","女","无IP","102120161","6","殿光镜影","10000","0","","诶嘿嘿，新人物。米忽悠你什么时候给我个犹大啊(s°口°)s(┴―┴"
"上隔云端","保密","无IP","26673942","6","","10000","0","","我连今天直播都不知道(`_`)!!"
"潇允_","保密","无IP","198363844","5","","10000","0","","直播我又没看，这次好像没大伟也没小姐姐，250水晶get"
"亦青城","保密","无IP","11656454","6","向晚大魔王","10000","0","","这游戏开始凉了吗Σ(д;)"
"Crimson-X","男","无IP","36083061","6","","10000","0","","卡莲：你的628就由我收下了~"
"终究回归现实","保密","无IP","4616423","6","","10000","0","","哇帅炸"
"命败_","保密","无IP","26552012","6","-阿库娅","10000","0","","老婆（大哭）"
"德丽傻-阿波卡利斯","保密","无IP","20569574","6","见习爱神头像框","10000","0","10","(=ω=)"
"疯狂的水草","男","无IP","15274842","6","绯赤艾莉欧","10000","0","","硬币已投，求还愿"
"花嫁月下初拥","保密","无IP","17725335","6","","10000","0","3","我都没怎么玩崩坏了，但是看到这pv又想回坑了"
"paradise改变","保密","无IP","24226561","5","","10000","0","","emmm……新角色也要2w8？"
"千帆过尽随遇而安","男","无IP","3650390","6","","10000","0","","啊？更新了？啊？啥时候的直播？我勒个去 我啥时候成回归舰长了？"
"E-esinE","男","无IP","88770372","6","EveOneCat2","10000","0","","弱弱的问一下有封面原图吗？"
"泡泡茶符","男","无IP","46459737","6","崩坏3・天穹流星","10000","0","","许愿怪盗卡莲出必还愿"
"凝弦音无","保密","无IP","12284856","6","异常生物","10000","0","","下一个人物好好独立构思吧。实在想不出来你可以多方面借鉴啊，你这样我这种铁杆粉都不太好意思维护你了。最近的节奏本来就够大了，你们真是自己给自己添堵。[2233娘_吐魂]"
"都城小角儿","男","无IP","59125069","6","","10000","0","","好帅啊啊啊啊！！！！"
"阿金5代","男","无IP","9293878","6","","10000","0","","春丽的百裂腿"
"慕玖萧","保密","无IP","11876095","6","乃琳Queen","10000","0","","我只想要新符华[2233娘_卖萌]"
"SKN鱼","女","无IP","22231062","6","","10000","0","","我们的舰原来那么cool啊"
"海漓b","保密","无IP","65150177","6","","10000","0","","看了视频，我有点担心新版本还能不能继续开全特效( _f｀)"
"の尼桑","男","无IP","39788079","6","","10000","0","13","出个一个冒险游戏吧！ 我的月卡已经守护不住蹦蹦蹦了，"
"喂_下雨了","保密","无IP","23150264","6","","10000","0","","卡莲我的心给你你来我的女武神仓库好不好QAQ（许愿第六夜曲）"
"维和老牛","保密","无IP","616083","6","","10000","0","","某舰长：我真的累了，想歇歇了~！"
"雨落潮平","男","无IP","73450153","5","","10000","0","","这游戏现在不做佛系玩家都玩不了"
"夏目你届到了吗","保密","无IP","57436021","6","","10000","0","","这BGM是什么啊"
"雪匆匆","保密","无IP","8628993","6","","10000","0","","毁掉这个游戏的不仅仅是策划，还有洗地狗"
"Ara的夏天","男","无IP","177222692","5","","10000","0","","中中小"
"冬夜星","男","无IP","1608896","6","","10000","0","3","住手，你只是一个手游"
"咕月の破晓","保密","无IP","8266744","6","初音未来13周年","10000","0","2","弃坑玩家就看看"
"铃原家的小金牛","男","无IP","32434855","6","三周年恋曲","10000","0","","B站不是吵架的好地方，要说戾气重，没原因是不可能的，越过了太多人的容忍底线，想吵架的还是去贴吧吧，那才叫精彩"
"狮子座的丞相","保密","无IP","7569923","6","","10000","0","","玩个游戏还这么爱搞事"
"魑璃钥","男","无IP","8496188","6","","10000","0","","好好的动画制片厂做什么游戏(=ω=)"
"魔袅","男","无IP","201540416","6","星座系列：射手座","10000","0","1","抄袭什么？你们在说啥？"
"鸽丨斯拉","男","无IP","2443516","6","","10000","0","","我特么氪爆"
"汐宇ETV","男","无IP","102163380","5","","10000","0","","为了崩坏三我已经一年多没碰过腾讯任何一款游戏了，这算真爱吗？"
"ようむ`","保密","无IP","2788008","6","","10000","0","","你游睿智是真的多，天天没事干就喜欢跟着节奏起哄，就不能安安静静当一条咸鱼吗"
"政法剑","男","无IP","11413726","6","","10000","0","","只能说，呵呵该！"
"冰枪凯文","男","无IP","5441542","6","崩坏3・天穹流星","10000","0","","你们不要做个pv都掉帧好吗，优化，b数？"
"莫莉森w","男","无IP","15145349","6","","10000","0","","感觉手机要玩不了了[小电视_哭泣]"
"syydnr00","保密","无IP","9553827","6","乃琳Queen","10000","0","","能支撑我一直玩这游戏的，也就那白嫖却能几乎全角色的欧气了(￣ε(#￣) Σ"
"Mr_Loren","男","无IP","15735309","6","原神","10000","0","","我爱卡莲呀……[小电视_我好兴奋]"
"丿M","男","无IP","13407871","6","","10000","0","","不管怎么说，这个版本至少一些繁琐的地方都进行了优化，深渊丶驱魔丶挖矿这些改变能够说明官方在下个版本在优化，本来我是差不多咸鱼了的，看到这波更新我才坚持了下来，总之优化需要时间，直接开婊也没有办法立即修改，请给予这个游戏能修改的时间。"
"企业心华","男","无IP","8092743","6","","10000","0","","有直播的录播吗？错过直播的我"
"立方咩_","女","无IP","86161616","6","","10000","0","","这次的pv真的很走心[小电视_赞]"
"YYYYC雪","保密","无IP","89268499","5","","10000","0","","现在我最期待的版本*(`)*"
"莞竹","男","无IP","18265214","6","星座系列：水瓶座","10000","0","","骂一下策划，其他不关我事，反正是咸鱼"
"静静的世界谁人能懂","男","无IP","29236550","6","","10000","0","","好久没玩了，问一下，啥情况？进攻天命总部？？？"
"随便取个名字就叫狗蛋吧","女","无IP","35215012","6","欧皇","10000","0","","pv真帅！！！希望崩3越来越好，（策划长点心吧……）"
"mrAidenPearce","男","无IP","12411466","6","","10000","0","","卡莲…什么时候变成这样的人了"
"米小坨","男","无IP","13875129","6","","10000","0","","米哈游啊  给个s级吧玩了快一年就一个鬼凯"
"lay_free","保密","无IP","217800024","6","异常生物","10000","0","","好像有点意思"
"芽衣不要哭了我会难过","男","无IP","16891472","6","","10000","0","","请问2.3版本几号更新？"
"黎恩舒华泽","保密","无IP","3758730","6","","10000","0","","去你大爷的前几天刚说啥时候打天命总部劳资就带着格里芬木星炮回坑，尼玛指望能在格里芬窑子护肝养老的计划看来又泡汤了[小电视_哭泣]"
"热血物语-五代X","男","无IP","6757505","6","","10000","0","","直播的时候看到一条弹幕：连月卡都不舍得氪的滚去玩亡者农药吧！,仔细想想真的心情复杂,居然有这种人[2233娘_郁闷]"
"逼死强迫症那还不简","男","无IP","6637456","6","2233幻星集","10000","0","","2.3米忽悠除虫计划了解一下"
