"昵称","性别","IP","UID","等级","装扮","用户权重","获赞数","粉丝团等级","评论"
"希沐樱","保密","无IP","159518037","5","","10000","1","","额额额额"
"钢琴曲的正确用法","女","无IP","35279633","5","","10000","1","","为什么同样是一分多钟，怎么感觉这个版本的PV比2.5版本的长好多？"
"海盐味桃子汽水","男","无IP","54683084","6","崩坏3・天穹流星","10000","1","","求背景bgm(；ω；`)"
"活煎~","保密","无IP","87343723","6","hanser","10000","1","","你的薪，就由我收下了(￣3￣)"
"初雨时风","保密","无IP","58436511","6","","10000","1","","符华已出，前来还愿，表白班长啊啊啊"
"天泣魔女-露莎卡","保密","无IP","87853985","5","","10000","1","","我拿存了一大周的钻又刷了两天的副本，得了2000多的钻，我忍下想要买八重樱皮肤的欲望，快速地把钻换成7张扩充卡，准备十连抽白夜执事，结果没忍住，一张一张抽掉了，只得了八个碎片T_T，又穷了，又得等到下大周了才能肝出来了T_T"
"罪人的未来","男","无IP","1429924","6","","10000","1","","16发出了3个鹦鹉一个火傻，好歹给个班长啊"
"Space丿空白","男","无IP","162810391","6","","10000","1","11","浓姬一套都出了，就是抽不到幽色咏叹调"
"冬--星","男","无IP","25357255","6","崩坏：星穹铁道","10000","1","1","游戏里的pv后面符华，卡莲那里变成一直循环同一段音乐…………节奏都对不上了…………搞不懂为什么改………………"
"名字不好听随便取名字","保密","无IP","132948916","5","","10000","1","","弗利沙世界第一可郏"
"KEROPE","男","无IP","20278450","6","明日方舟","10000","1","","许愿必出"
"洛斯汀","保密","无IP","4761886","6","","10000","1","8","哈哈哈 我今天班长和卡莲都出了，完美，，，，"
"日落下de孤影","保密","无IP","96019506","6","良辰美景・不问天","10000","1","","那个各位大大，为什么我更新之后所有cg放一半就自动跳过了啊。卸载游戏重新安装也没有用。。。。"
"l浪空l","男","无IP","66592918","6","三周年恋曲","10000","1","","话说我终于可以集齐cg了轩辕篇和蚩尤篇当出没打完"
"神奇小阿giaoo","女","无IP","38341617","4","","10000","1","","许愿，琦某人愿献祭无言贡献山西老杰怒*大伟，抽到必定还愿(｀ω)"
"@u麻衣__","女","无IP","2520143","6","原神","10000","1","","许愿卡连，出了必还愿"
"L1nkra","男","无IP","260184736","6","","10000","1","","许愿卡莲 出必还愿"
"肝脏修复姬","保密","无IP","60908034","5","","10000","1","","许愿卡莲，出必还愿"
"喜欢初音呐","保密","无IP","23774981","6","初音未来13周年","10000","1","3","许愿卡莲"
"威廉家的妖精仓库","男","无IP","172999781","6","","10000","1","","卡莲的声音好撩人呀！许愿第六夜想曲！"
"萝莉社的怪蜀黍","男","无IP","22700744","6","","10000","1","","WOC!看完真TM想回坑！但一想到策划喂shi。。。算了，还是拯救人理吧。"
"零落泪滴","男","无IP","5416389","6","","10000","1","","作为前怪盗团成员，为了卡莲那句偷心决定回坑了！不管强不强，我喜欢这个讲话的声音调调！"
"阿能在线抛光","保密","无IP","20207987","6","公主连结凯露","10000","1","","更新再回坑，然后又弃坑（求别骂我，我只是想看看有谁和我一样的）"
"御坂15647号","女","无IP","52417359","6","原神","10000","1","","许愿卡莲"
"ZZALUOB","保密","无IP","272281227","5","","10000","1","","好帅啊啊啊啊"
"又变大了啊","男","无IP","157673335","5","","10000","1","","许愿白夜执事（冰卡莲养不起）"
"月下绫音","保密","无IP","20708510","6","泠鸢yousa","10000","1","","(°`°〃)本来已经想少肝点崩坏看这情况。我tm肝爆（sF□′）s喋丞ぉ匦路华卡莲真tm帅!"
"截图先锋饶罗翔","男","无IP","20145273","6","","10000","1","","好诶，又是个不花钱＝没更新的大版本更新"
"请输入用户名","保密","无IP","558405","6","","10000","1","","新老婆们太帅了！,另外互动系统啥时候回归啊？想摸老婆了(°°)"
"-h13君-","女","无IP","9152293","6","","10000","1","6","符华天下第一"
"_-_空白_-_","男","无IP","36216309","6","白蛇2：青蛇劫起","10000","1","","被游戏耽搁的动漫公司"
"灿烂的紫蔷薇","女","无IP","286403171","5","","10000","1","","笨蛋娜你在哪？(；ω；`)"
"Dr-Wills","保密","无IP","97157586","6","洛天依8th生日纪念","10000","1","","新绝色:浮华――绿帽子的保镖"
"爱依丶休伯利安","男","无IP","15076892","6","","10000","1","6","我他妈贷款氪爆"
"请在输入新昵称","男","无IP","11255737","6","2233幻星集","10000","1","","人活着就是为了卡莲・卡斯兰纳！！"
"亚心王里","保密","无IP","15924259","6","","10000","1","","特斯拉有模了！！！！"
"天野真那","保密","无IP","18890391","6","","10000","1","","pv不错耶()"
"GIN银桑君","保密","无IP","38831753","5","","10000","1","","出不了第六夜想曲我就弃坑"
"GIN银桑君","保密","无IP","38831753","5","","10000","1","","手贱给休伯利安投了两个币"
"电费","男","无IP","534281","6","","10000","1","9","希望卡莲能脱掉头上的面具，跟德莉傻能脱头巾一样"
"伟大的精灵训练师","保密","无IP","18544510","6","","10000","1","","符华帅爆！！！"
"瘟室里的大凯菇","男","无IP","222681669","6","","10000","1","","终于不是PTT了。。。"
"sionalter","男","无IP","2507599","6","","10000","1","","评论区还真是狗咬狗一嘴毛"
"汤之花-幽奈","保密","无IP","29489144","6","","10000","1","6","这次PV比千年之羽的那个PV好太多了[小电视_赞]想要新角色但我tm根本氪不起啊[2233娘_郁闷]"
"空承康娜酱","保密","无IP","65824676","5","","10000","1","","这也太帅了吧，我又有玩下去的动力了"
"我愿化身为饿魔","保密","无IP","18199415","6","国民老公带回家","10000","1","","你的648就由我收下了（￣￣）"
"蜜汁叉烧坂","保密","无IP","27248048","6","","10000","1","5","真香"
"Pistail","男","无IP","1799315","6","","10000","1","4","说句良心话，游戏我tm吹爆，运营，呵呵。。。"
"轻音部黑夜行者","男","无IP","20992383","6","","10000","1","","表示初始s可以肝有什么不好的。。。。(￣△￣)(￣△￣)(￣△￣)(￣△￣)"
"平安网恋","保密","无IP","25010392","5","","10000","1","","三个初始A用到现在，没出现各位大神所说的根本玩不下去的情况，或许这就是强者的世界把"
"y纱","保密","无IP","27793096","6","挚爱花海","10000","1","2","一个上课要么打瞌睡要么中二病的学生党看你们互相伤害。(￣△￣)"
"懒惰的药罐","男","无IP","4211257","6","","10000","1","","爱玩玩不玩guan那没多事呢。"
"牛头人暴杀纯爱小鬼","男","无IP","3787157","6","","10000","1","","卡莲大招照搬闪乱，了解一下"
"喜欢mermer","保密","无IP","12757376","6","","10000","1","","无所谓，反正玩游戏嘛，自己开心就好。"
"人菜瘾大马枪怪","男","无IP","4606591","6","hanser","10000","1","","玩了这么久现在才知道休伯利安长啥样r(￣￣)q"
"醉中逐月丶","男","无IP","11281013","6","","10000","1","6","啥也别说了,肝已经没了,等个崩坏4,好么？[小电视_哭泣],手机已经玩不起了,来个PC端游吧[小电视_害羞]"
"Veive1","保密","无IP","6486038","6","","10000","1","","像我这种微氪5k左右的咸鱼，自我感觉游戏体验还算不错吧，没必要每次出新角色然后氪爆，何必呢[小电视_嘟嘴]"
"来自天境的雅特丽希诺","保密","无IP","7235081","6","国民老公带回家","10000","1","","加油努力，争取赶走更多的玩家"
"残阳忆","男","无IP","11038984","6","","10000","1","1","哈哈哈哈哈，真香！"
"Zwei118","男","无IP","16528075","6","崩坏3・天穹流星","10000","1","","米忽悠制片厂（￣￣）"
"逍遥风ShiaoYao","女","无IP","27062311","6","","10000","1","","我只求我老婆植物人的病能治好[小电视_发愁]"
"梦境使者-爱梅斯","女","无IP","35383633","6","斗破苍穹","10000","1","","感觉这次的PV和以前不一样了，是换人制作了吗()"
"国见玉子","保密","无IP","13417016","6","","10000","1","","这个卡莲里我看到了N.E.S.T.S的影子..零总的邪骸噬煞和经理覆面行星..不过只是像而已。,此评论无任何引战想法。"
"雪乃喜欢猫","男","无IP","84048178","5","明日方舟音律系列","10000","1","","弃不了弃不了"
"否L","保密","无IP","125352387","6","","10000","1","","emmmmm取几个cg好像没有法律意义上的抄袭呀，女武神够炫够帅就够了，为什么这么多人出来婊呢?看看腾讯游戏做大前各种复制抄袭为什么没那么多人婊？？？不是很懂呀？还有2.3版以我这个刚入坑没一年的新玩家来说挺福利的呀，各种肝初始s，送s，这么好的福利不应该夸么？你们为什么还要婊？以前，我是个米黑子，但现在我只想做个米卫兵"
"殁夜-","男","无IP","11609931","6","","10000","1","","成天撕来撕去烦不烦，不乐意就删游戏，又不缺你一个人[2233娘_无言]"
"左边的焦黑","保密","无IP","97084140","6","","10000","1","3","我就是闷头玩游戏，别逼我化身暴躁哥(;_)"
"被带飞的快龙","男","无IP","34639594","6","","10000","1","","没有什么退不退游的，不想玩怎么都是不想玩，不喜欢的怎么说都是不喜欢，至少我很喜欢崩坏三虽然本人黑的一匹[2233娘_卖萌]"
"月止水息","保密","无IP","146820728","6","明日方舟音律系列","10000","1","","大家氪，大家氪(;_)不对，我好像拿错剧本了"
"爱神皮咔秋","男","无IP","6598754","6","","10000","1","","许愿新角色(°°)"
"315of老渔夫","男","无IP","8129731","6","灵笼","10000","1","","啧，大伟哥真的还记得自己做的是手游吗........"
"AVALON2016","男","无IP","73392008","6","","10000","1","","四万氪表示没有什么不舒服的。。。尽管现在已经氪不动了"
"佛系游戏绫响酱","男","无IP","31242461","6","","10000","1","","如果出了第六夜想曲或者次元边境突破就不退坑了，最后一发648大伟策划你们看着吧"
"知人知面-","保密","无IP","37789272","6","","10000","1","5","真的崩坏了呢"
"冬日的志摩凛","保密","无IP","34913343","6","三周年恋曲","10000","1","","许愿卡莲，一发中必还愿[小电视_赞]"
"灯露椎Official","女","无IP","14348409","6","","10000","1","","退坑是不可能退坑的"
"喵波斯","保密","无IP","25202856","6","","10000","1","","班长超帅！！！"
"某个不科学の超电磁炮","保密","无IP","33957651","6","","10000","1","","完了，刚抽完一波十连"
"不撸就blue","保密","无IP","63510159","5","","10000","1","","米忽悠吃相越来越靠近tc了（滑稽）[小电视_害羞]"
"绝望圣诞","男","无IP","20273000","6","","10000","1","1","那些退坑shazi都是非洲人  大家不要理他们@.-@"
"人菜瘾大pAA","男","无IP","546091","6","","10000","1","","我就看看剧情和美工的成果"
"黑蒂晚安","保密","无IP","8306943","5","","10000","1","","嘛……休闲玩家看了看评论觉得还是休闲好……"
"所以自在","男","无IP","20629570","6","","10000","1","5","新PV很帅，又到了刷一遍版本PV的时候[小电视_害羞]"
"赶场情话R","保密","无IP","79387560","6","","10000","1","8","这么休闲的游戏，慢慢玩就是了啊！(；ω；`)"
"黑白天的鱼","女","无IP","7946900","6","","10000","1","","感觉好些人都是拿命玩游戏游戏玩的开心就玩玩，想卸就卸不是很好吗_(ω 」∠)_"
"狄威伽","男","无IP","16817836","6","全职高手","10000","1","7","不不不对新人不友好的的不是游戏现在萌新福利我这老玩家都羡慕  对新人不友好的是那些到处婊的人这种人在游戏里在生活里都是那个嘴脸→_→不玩滚行么 到处倒垃圾只能恶心别人同时告诉别人你是个垃圾桶"
"echoohce-","女","无IP","19892143","6","","10000","1","","（/TДT)/辣鸡手机闪退回不来啊啊啊"
"花枪_一壶酒","保密","无IP","15413759","6","","10000","1","","当初到70级就玩不下去，退了。"
"爱吃胖ci的小狂三","男","无IP","112777447","6","崩坏3・天穹流星","10000","1","6","我的船这么帅！！,我tm吹一辈子"
"北山望","男","无IP","46923724","6","","10000","1","1","要裱的就是本身游戏体验就不好，镶金也没用，对非洲人体验更差，要么苟要么滚，就这么简单。"
"漾离仄","男","无IP","3220083","6","灵笼","10000","1","","这么多说弃坑的老子记忆战场排名还是上不去"
"口巴口圭","男","无IP","17022159","5","","10000","1","","那……布洛妮娅要凉到什么时候呢……？"
"网友小番茄o","女","无IP","56319208","6","阿梓从小就很可爱","10000","1","","疯狂许愿卡莲"
"茗一口茶","保密","无IP","48586899","6","碧蓝航线","10000","1","","感觉樱色轮回那一个版本的宣传PV是最好看的，而且特燃。"
"真不该睁不开","保密","无IP","23006447","6","","10000","1","","偷心？p5天下第一"
"雪匆匆","保密","无IP","8628993","6","","10000","1","","985的人才们"
"jk荷叶","保密","无IP","23381731","6","","10000","1","","我永远喜欢米忽悠[小电视_太太喜欢]下个版本很期待，许愿新卡莲"
"超市番茄半价","保密","无IP","34087974","6","2021拜年纪活动专属","10000","1","","什么时候这游戏不是万氪以大佬没资格发言的，佩服佩服。"
"押鬼","女","无IP","309240","6","普通小狗・梦幻塔罗","10000","1","","QAQ什么时候出女仆装我就回坑！！！真的！！！"
"bilibiliyike","保密","无IP","8594049","6","","10000","1","","大伟哥曾经说过为爱买单，但我现在越来越看不到所谓的爱了----曾经为爱买单的我"
"辰雀","男","无IP","201511804","5","","10000","1","","等着新玩家被恶心，我们又又有戏看了"
"七彩滑稽","男","无IP","22959846","6","2021拜年纪活动专属","10000","1","","这是最精致的一次宣传pv，但也是戾气最严重的一次直播"
"汐宇ETV","男","无IP","102163380","5","","10000","1","","抽卡莲是不可能抽卡莲的，这辈子都不可能抽卡莲的，s级的操作又不会操作，只有靠瞎基八按，才可以维持玩下去的这酱紫，玩其。。玩其她角色的感觉了比玩卡莲好多了，玩其她角色各各都是主c，技能又炫酷 超喜欢这些a角色。"
"一条杂鱼w_w","保密","无IP","41791135","6","","10000","1","","求求你您游请个动作指导好不好！我想看到你们更多的原创动作，而不是照搬式的借鉴( _f｀)"
"音华羽","男","无IP","1555516","6","","10000","1","","游戏里也不提前说一下有直播，九点钟就领不了前两个水晶码了，这是第二次错过250水了。上一次很郁闷这次出乎意料的淡定，也不知道为什么。哪怕上线看看老婆，这游戏我也会继续玩下去，只是不会再往里面冲太多钱了，因为打水漂。也不会安利任何人，毕竟老实说出我的游戏体验就足以劝退那些想入坑的人了。,我对这游戏已经过了蜜月期和倦怠期，有太多失望和不满意还有郁闷，但是我还能坚持下去，毕竟看到芽衣和八重樱就足以支撑我玩下去了。"
"木莲子","男","无IP","38278465","6","","10000","1","","总感觉崩3也像tx一样吃香像难看了，在作死的边缘疯狂试探。而且崩3氪金体验还没tx好，没点自觉吗，这么做死真的好吗？（月卡党，氪过一次648，也没弃坑，美工真的没话说）"
"美如梦婧","保密","无IP","15195763","6","","10000","1","","这个算是继1.8版本pv以来最好的pv了"
"新月玫瑰的人形挂件","保密","无IP","149354126","6","明日方舟","10000","1","","水军黑的真无脑"
"_唐泠_","男","无IP","22754464","6","泠鸢yousa","10000","1","","留名"
"空幻玉耀","保密","无IP","23086832","6","","10000","1","","咸鱼玩家完全没有氪金的动力"
"Emprtset","男","无IP","66777705","6","崩坏3・天穹流星","10000","1","","这个版本不良心吗？"
"林伦","保密","无IP","13611839","6","","10000","1","","诸位同僚，这就是尼古拉斯・氪・大伟哥阁下为我们准备的休伯利安号，大声告诉我：帅吗？,ps：加油啊奥拓大人（绿）"
"识破through","保密","无IP","74055104","6","崩坏3・天穹流星","10000","1","12","都能肝，我tm肝爆"
"以及卡达桑","男","无IP","23542844","6","2021拜年纪","10000","1","7","现在都不打逆商打天命的吗？"
"Panda贰号","保密","无IP","421561","6","春原庄的管理人小姐","10000","1","","我觉得以前抄点就抄点吧，最近的浮华卡连抄的也太过了，完美照搬闪乱神乐，特别是这次的卡连和A卡连，完全一毛一样，mihoyo甚至直接全套做成了一套超长的平A，服气"
"漫漫长夜心无眠","保密","无IP","10038777","6","","10000","1","","这个是不是可以拆鬼角了"
"蠢木_木","男","无IP","23038906","6","","10000","1","8","策划对我们老玩家的福利真的是_(:3」∠)_"
"蔷薇一梦t","男","无IP","111178258","6","暮光幻影","10000","1","","感觉比1.4版本还要好，个人感觉"
"夜寒理月","男","无IP","182130674","6","明日方舟音律系列","10000","1","","律化娜还行（氯化钠）（￣￣）"
"I吃货老李I","男","无IP","165687789","6","","10000","1","","白执事真的是帅[小电视_赞]"
"FENG鸦","男","无IP","1758073","6","","10000","1","","还个毛的愿,一点诚意都没有,别的不说,出了怪盗卡莲就氪3张月卡"
"阿飒飒飒飒飒飒","男","无IP","67293","6","","10000","1","","为什么这期戾气最重，为什么引起这么老玩家不满,恐怕不都是来带节奏的水军吧"
"名濑由加奈","保密","无IP","21487431","6","","10000","1","","pv是真的吗，女武神不是一个人战斗了有军队配合了吗"
"弦余a","女","无IP","10653532","6","","10000","1","3","太帅了"
"鹬蚌相蒸","男","无IP","9171380","6","EveOneCat2","10000","1","3","为世界上所有的美好而战！今天也是！还有明天！"
"湘君白发多","男","无IP","5868073","6","","10000","1","","感觉pv越做越不用心了，，，是版本更新太快的原因吗，，，"
"打鼓真TM开心","男","无IP","1653091","6","","10000","1","","策划持续作死真的有点累了，哪里捡来的鬼才啊？"
"k楠昔北","男","无IP","10077220","6","","10000","1","","垃圾玩意 冲nm4000多  屁东西都没有,[2233娘_喝水]"
"科户濑-伊扎娜","保密","无IP","24651356","6","","10000","1","","不对这游戏保什么希望了，佛系的玩下去吧"
"冷冽的-","男","无IP","84514810","4","","10000","1","","这次直播什么鬼东西，全程尬，连稿子都不好好写了?"
"超废的时白","保密","无IP","30176577","6","","10000","1","","wmuehwks3x,glyygsksr7,yuyg9skjrf,三个直播兑换码w"
"EndessParadox","保密","无IP","6660422","6","","10000","1","","似李，骚话卡莲！！"
"泛左","男","无IP","11986074","6","","10000","1","","实话说每天捡垃圾刷深渊打战场，是真的会吐的，我都弃坑快三个月想起这些图还是很反感，更何况我不喜欢联机"
"改个好名就能中奖了","女","无IP","38428269","5","","10000","1","","这个卡莲战斗中会不会满嘴骚话。。。"
"90度热水","保密","无IP","15231509","6","","10000","1","","用心做cg，用脚做游戏"
"昔流不断","男","无IP","3720700","6","","10000","1","","角色什么的我觉得都OK，可最近几次活动确实是不冷不热的，没啥盼头"
"源石虫","保密","无IP","213296956","5","","10000","1","","话说动作有版权吗？"
"eldenbox","保密","无IP","33930699","6","","10000","1","","反正我觉得米哈游现在有点恶心，因为那神奇的抽奖系统( _f｀)"
"该用户巳被封禁","保密","无IP","271585308","5","明日方舟-愚夜密函","10000","1","","仔细看看，原来我的战舰那么大啊……芽衣，班长，琪亚娜，板鸭，姬子阿姨――我有多久没仔细看过你们的脸了。再陪我最后一年……好吗？"
"|户N","男","无IP","95997906","4","","10000","1","","以前玩着还挺开心的，现在……真能把人气成暴躁老哥(>_>)"
"泫尹ちゃん","保密","无IP","50781615","6","花丸晴琉","10000","1","3","你游玩家……emmm，无言以对"
"T霄V昭真君","男","无IP","157688950","6","","10000","1","","有些弹幕真的恶心"
"墨若拂尘","男","无IP","61932645","6","","10000","1","","直播弹幕也是没谁了，不跟着喷就是洗地的？"
"又保底了","男","无IP","184539427","6","","10000","1","","glyygsksr7"
"夜鸣酱","保密","无IP","21369542","6","洛天依蝶变头像框","10000","1","","我天命氪爆(｀ω)"
"微生紫安","保密","无IP","33145296","6","总之就是非常可爱","10000","1","","又更新了吗(；ω；`)835你要撑住啊"
"西瓜二手回收","男","无IP","6289893","6","","10000","1","","原来我的船这么帅的嘛_(:зf∠)_"
"德丽莎全肯定bot","女","无IP","104243311","6","","10000","1","7","“你的心 就由我收下了”"
"冷月咩咩","男","无IP","11231729","6","异常生物","10000","1","","标配许愿月光。[2233娘_耶]"
"FFF首席执政官","保密","无IP","107149273","4","","10000","1","","等等，see you in the next world呢？"
"Bino11","保密","无IP","32812844","5","崩坏3・天穹流星","10000","1","3","CG图没以前好看了……"
"MAmian9527","男","无IP","8979420","6","碧蓝航线","10000","1","","这次直播有没有兑换码？有的话请告知。帮帮没时间看直播的朋友们。"
"大书库与黑暗剑","保密","无IP","10281242","6","","10000","1","","我就是死，死这里，从休伯利安上跳下去，也不可能再氪一分钱！,真帅！再来一单"
"J1angzy","保密","无IP","251378245","6","星座系列：处女座","10000","1","","所以说互动系统呢"
"我更安静","保密","无IP","14038203","6","","10000","1","5","老婆依旧不能动，要她何用"
"苞菜精","女","无IP","224471820","5","","10000","1","","648准备好了()"
"阿沫吃了吗","女","无IP","37494408","6","","10000","1","","八重樱和热评我总要上一个"
"欧阳南北s","男","无IP","37054035","6","","10000","1","","非洲人无所畏惧[小电视_哭泣]"
"Ultraman-LEGEND","男","无IP","4087341","6","","10000","1","7","看来AI老板有去偷电了，这是副产品[蛆音娘_滑稽]"
"雪糕不甜","保密","无IP","13643827","6","","10000","1","","今晚卡莲和热评我一定要上一个[小A和小B_喝茶]"
"槐概俊痕Sphinx","男","无IP","14037105","5","","10000","1","","律化娜，你值得拥有！(￣△￣)"
"奈芙琳","保密","无IP","12613414","5","","10000","1","","前五十"
"飞星_","男","无IP","113573264","6","hanser","10000","1","","挤一挤"
"我就是君子如兰","男","无IP","207408049","6","","10000","1","8","前十"
"夕雾w","女","无IP","100357090","6","夏诺雅","10000","1","","前！"
"阿符的玩偶","保密","无IP","35356001","6","欧皇","10000","1","6","937[doge]"
"刺客七六5","男","无IP","343167059","6","良辰美景・不问天","10000","1","3","白夜战神！"
"止初之心","保密","无IP","488304488","5","","10000","1","","这就是物理战神诞生的版本吗"
"乌拉尔银狼QWQ","男","无IP","342856841","5","","10000","1","","入坑版本"
"八爪鱼突袭海鲜美式城","男","无IP","111225151","6","","10000","1","","2.2版本创的号，这个版本入坑"
"尘世闲游真菌啊","男","无IP","473247177","5","","10000","1","5","封面没眼镜的白执事好看啊 ，怎么不实装呢"
"蔡初唐","男","无IP","28468510","5","","10000","1","","现在你们都在矿区[doge]"
"溪云初沉","保密","无IP","109436664","6","","10000","1","","白夜不是物理战神？"
"你需要休息","保密","无IP","477094757","4","","10000","1","","BJM在网易云，找不到看我动态"
"九月要睡觉了","保密","无IP","389162349","6","泠鸢yousa登门喜鹊","10000","1","","白夜永远滴神！"
"春秋笔法离远点","保密","无IP","507106444","5","","10000","1","","我满脑子都在想:我、我的船，这是我的船(>ω<*)好漂亮，好大气，好壮观！"
"寻找海岸的粼妖","保密","无IP","397828280","5","","10000","1","","第六夜"
"沧光夕酒","男","无IP","383366366","5","","10000","1","","考古"
"逐云之云","男","无IP","183289163","6","碧蓝航线2020","10000","1","","原来已经这么久了( _f｀)"
"金色荣耀","保密","无IP","163116570","6","想去海边・头像框","10000","1","","3s白夜发来贺电"
"琪芽催婚协会","女","无IP","1407065","6","崩坏3・天穹流星","10000","1","5","卡莲:你的薪，就由我收下了~"
"顾侣傻不拉叽","女","无IP","111173237","2","","10000","1","","求bgm"
"沃白风","保密","河北","1594961900","5","","10000","1","","哇，是血！（凭吊古战场）"
"橘_子_汽_水","女","无IP","43490144","6","乐正绫五周年生日","10000","1","","冰卡才有30多碎片 我的肝撑不住了"
"识竟","男","湖南","482252032","5","","10000","1","","白夜帅我一脸[保卫萝卜_笔芯]"
"萌萌哒的月色","保密","无IP","224636508","6","","10000","1","4","回坑版本QAQ"
"霁从韵","女","无IP","138341725","6","","10000","1","","开头黑圣杯即视感"
