"昵称","性别","IP","UID","等级","装扮","用户权重","获赞数","粉丝团等级","评论"
"河蟹河蟹河蟹","女","无IP","4592964","6","","10000","1","","谁能告诉我被污染了怎么办，我跑到黄水晶那了但还是掉血了"
"暴走的菊花怪","女","无IP","10063789","6","","10000","1","11","史上最抠副本[小电视_差评]"
"轻羽轻羽轻","保密","无IP","168497241","5","双生视界・花嫁","10000","1","","这奖励给逗笑了"
"一般路过乐孑人","保密","无IP","19941548","6","","10000","1","","玩法就不说了，照搬乌龟本二阶段，手游端游也没法比，奖励好了自然有人去打"
"马桶冰淇淋","男","无IP","31917150","5","2021拜年纪","10000","1","","今晚晚饭是蚊子腿"
"怪人三百面相","女","无IP","130668493","6","","10000","1","","打着很无聊，视角很怪，奖励很低，很棒的联机呢"
"Isaaric","保密","无IP","94486312","6","","10000","1","","组队等两个75以下的用了15分钟，通关用了三十分钟，最后boss关视角差，还有个烦人的毒，结果就那么点蚊子腿奖励[小电视_差评]第一次出这种关卡你们没把握好我能理解，也请你们再多用心一点，中午又有一个朋友退坑了，我的热情也快耗尽了，这游戏再不改变靠美工也要留不住人了"
"咩走小队头号粉丝","保密","无IP","12269530","6","名侦探柯南M26","10000","1","","喂我打个半死福袋给个绿绿的片[2233娘_无言]"
"在下谷嗄","男","无IP","259093658","6","原神","10000","1","18","哎，建议去多考虑一下用户吧，现在这样这游戏凉的可能性很大"
"丨六月丶微烟","男","无IP","132554843","6","呜米","10000","1","","这视角能不能改一改，我tm是用丽塔技能复活过去的"
"血雨寒衣","保密","无IP","14429365","6","","10000","1","","然后深海城被我们打成废墟了[2233娘_困惑]"
"天慧-","男","无IP","35874353","6","战双帕弥什","10000","1","","我真想拿着最近新获得的但丁剑把策划连在天上一小时"
"一般路过乐孑人","保密","无IP","19941548","6","","10000","1","","真当乌龟本是好玩才有人刷的，给这么几个破烂什么意思,我就当做这个是普通乌龟了，等相当于raid乌龟的挑战难度出什么了"
"特此独特","保密","无IP","10054575","6","","10000","1","","灭杀安图恩2阶段 能源孵化火山？[小电视_发愁]"
"寒霜粥","女","无IP","65964519","6","","10000","1","","有挂机的体验贼差，还有boss战视角怎么回事？？还有不断的污染净化污染净化……？？？什么意思，我近战不配打boss是吗QAQ 直接带续航的都不想净了…"
"KeikioYishi","保密","无IP","13511986","6","","10000","1","","这团本我第一时间打了  一个字     滚[小电视_差评]"
"清风拂面R","保密","无IP","40845004","6","星座系列：双鱼座","10000","1","","这活动就是垃圾，视角调都不能调，奖励比蚊子腿还少，打30多分钟，就6个碎片，真特么鬼才。"
"bleary","保密","无IP","536441","6","","10000","1","","怕不是将来 圣痕和武器也能打团本存材料兑换图纸升级。,什么[请吃红小豆吧！_喝水],超界-猫上,圣耀-3rd,,黑天-xxxx,,,[请吃红小豆吧！_好难]"
"丫智子","保密","无IP","8449031","6","","10000","1","","2人掉线我说什么了？还不让队长走到其他队"
"沫沫大魔王哟","男","无IP","110652879","5","","10000","1","","一人掉线，全队升天"
"唯一的爱人张智慧","男","无IP","399755947","5","","10000","1","","嗯……这次更新东西不多，倒是期待新女武神比较多"
"曾闻花絮落","男","无IP","22915321","6","","10000","1","","能不能修复一下女王打团看不到怪的bug？"
"JOKER迪恩","保密","无IP","289179491","6","希萝Hiiro","10000","1","","我知道改编不是乱编,,但也请稍微改编一下吧~"
"アヤネル-","男","无IP","2269929","6","","10000","1","","连着打两次，体验简直天差地别，第一次12个人一起打平推体验还不错，第二次带一堆挂机的打的心态爆炸，奖励还少的可怜，真是佛了"
"ONEOKREOL","男","无IP","93744532","6","","10000","1","","毒奶粉打个团能翻个好装备，这打个团有个毛的好奖励嘛"
"贰千f转生到B界","男","无IP","8758184","6","有兽焉动画收藏集","10000","1","","视角真是难受，还有教程根本不全，有几个boss根本不知道要怎么打"
"十七岁八云紫","男","无IP","54136326","6","2233幻星集","10000","1","7","能不能别让老子掉线了？"
"吸血狂魔苏菲","男","无IP","102706862","6","","10000","1","","在座的哪一位男女老少的观众说 我这条评论一个字都没看过的你举手！有没有?没有一个人举手！,哪个b站用户，二级三级的萌新敢说这种话吗？,敢在公共场合这么问吗？,什么叫四级大佬啊（战术后仰、目光斜视）"
"天平诗浓","保密","无IP","2123314","6","","10000","1","","你游能不能出照顾萌新的活动，你游根本没有萌新好吗？"
"赤色慧猩","男","无IP","3089508","6","","10000","1","","打个辣鸡副本磨磨蹭蹭半个多小时，boss的视角锁定恶心的一批，花了那么多时间最后给的奖励跟打发要饭的没两样，这还打个头啊？你们测试服测得可真是个**"
"浅蓝流沙","保密","无IP","272491955","5","","10000","1","","给了三个红碎片~嘤嘤嘤"
"霞你好脏啊","保密","无IP","288274281","6","赏樱大会欧皇","10000","1","","刚才氪了200买了仿犹大人偶，亏不亏啊[无语]"
"g呢喃y方便后续w","男","无IP","17423600","6","橘猫挂件","10000","1","8","(ω)"
"ScroogeCarol","保密","无IP","10550225","6","","10000","1","","前文明遗产爱酱  ×,前朝包菜精爱酱  √"
"灰猫丶丶","男","无IP","276126049","6","hanser","10000","1","","通关一次溜了 没意思"
"不沾酱油的唐山人","保密","无IP","310907676","5","","10000","1","","看到水压那一刻我就有种**的预感，过了几遍，感觉和卢克机制差不多，但你这奖励也太敷衍了，花半个小时打团本最后就给几个绿豆，你给几个核心增幅材料我也能忍啊T^T"
"HedgehogSteve","男","无IP","165650291","6","EveOneCat2","10000","1","","打一局半小时起步…"
"百合百景","保密","无IP","698774","6","原神","10000","1","","75+满员，低级没人，太真实了"
"芝麻酱詈焯","男","无IP","14779546","6","白蛇2：青蛇劫起","10000","1","","[请吃红小豆吧！_倒地]不能调视角是真滴难受"
"桃饱会员咩咩","男","无IP","14208981","6","","10000","1","","这就是dnf乌龟机制吧。。。"
"来自非洲的咕噜熊","男","无IP","12766692","6","","10000","1","","还有，这个匹配绝对有问题，刚上来等萌新等了三分钟，然后一下来了两队萌新，这明显是说明匹配系统出问题了啊"
"蘑菇快还我式来","保密","无IP","6224544","6","双生视界・花嫁","10000","1","","已通两次的表示，啥都好说，就是我这破手机掉帧太厉害了"
"综合来说不是个人才","保密","无IP","13656028","6","","10000","1","","就是DNF乌龟，队伍里有几个打过DNF团的要舒服好多，知道压能源，不然基本就是莽boss"
"雪之下团子","男","无IP","31012587","6","","10000","1","","75以下的那两队根本匹配不到人，还得至少8个人，官服都要匹配很久更别说渠道服了，求求你把等级限制改一下吧，团本体验极差[2233娘_吐魂]"
"暮色缠身","男","无IP","4946955","6","拜年祭粉丝专鼠","10000","1","","一时抽一时爽，一直抽一直爽,剩余1次补给内必出[小电视_哭泣]"
"绯鱼不是罐头","男","无IP","19249934","5","","10000","1","","穿上西装 开团啦！[2233娘_大笑]"
"黑兔砸","保密","无IP","14165462","6","","10000","1","","有大佬带我嘛，我白练贼强[小电视_哭泣]"
"叙拉古大尾巴狼","保密","无IP","326964637","5","","10000","1","","(￣△￣)(￣△￣)"
"Timor暴君","男","无IP","92626759","6","","10000","1","","丽塔请用温柔的语气和舰长说话好吗？不要包菜化了"
"诉予山鬼听-","保密","无IP","110888028","6","","10000","1","","关上30大门"
"就是个新昵称","保密","无IP","87080757","6","","10000","1","","一路和队友莽过去的。"
"来自非洲的咕噜熊","男","无IP","12766692","6","","10000","1","","今天上午打了一次，体验还可以，不过流程稍微有点时间长了"
"欲刻晴天逢甘雨","男","无IP","11578550","6","泠鸢yousa","10000","1","","没流量更新的集合"
"幻樱残梦","保密","无IP","49129786","6","三周年恋曲","10000","1","3","乱锤就完事了"
"栀沫_","女","无IP","40122079","6","国民老公带回家","10000","1","5","emmm希儿…"
"Ograsm","男","无IP","38777513","5","","10000","1","","打主宰，打主宰，把他打成小猪仔，(⊙_⊙)，非酋默默微笑，头一次见杀猪那么麻烦"
"四文鱼五条悟","保密","无IP","21596199","6","","10000","1","","12团本开团啦！,现在有一个划水了，来11个大腿！"
"Devil丶但丁","男","无IP","3852648","6","","10000","1","","10连一个空无，都3把了！(_)_(:з」∠)_f***"
"休伯利安号的舰长","男","无IP","34452606","6","","10000","1","4","我想问问，新春活动送的鼠标垫呢[2233娘_疑问]"
"萌麦当","男","无IP","122054205","5","","10000","1","","最终阶段12个人的时候一直卡着，退了几个人后就可以进的有多少人[2233娘_大哭][2233娘_大哭]"
"折纸恋-","保密","无IP","286626939","5","","10000","1","","(⌒⌒)"
"三月四暮","男","无IP","182073120","6","","10000","1","","哼哼"
"HedgehogSteve","男","无IP","165650291","6","EveOneCat2","10000","1","","你以为我是丽塔？其实我是爱酱哒！"
"3少","保密","无IP","22857367","6","快把我哥带走","10000","1","","联机不规范，全队两行泪[2233娘_大哭]"
"德克士练鸡腿","保密","无IP","38126343","6","","10000","1","","哇！"
"染禾叶_","男","无IP","250880223","5","","10000","1","","可以"
"忆流","保密","无IP","11184747","6","良辰美景・不问天","10000","1","","前排"
"一颗流氓栗子","保密","无IP","492823352","5","","10000","0","","爱酱怕鬼怕怪兽[奸笑][奸笑][滑稽][滑稽]"
"瑾瑾丶","男","无IP","12917146","6","","10000","0","","这boss给人的感觉是克洛洛斯"
"椿V","保密","无IP","7174847","6","琉晶之礼","10000","0","","上香"
"逐云之云","男","无IP","183289163","6","碧蓝航线2020","10000","0","","挖[doge]"
"水逆退散了","男","无IP","49549465","5","","10000","0","4","这模式怎么没了？"
"星不会刀","男","无IP","11321996","6","","10000","0","","海渊之眼连开二保三保强拆来奶c++++++++++++++++++"
"人已螺旋升天逝世","保密","无IP","24996706","6","天依游学记・歌行","10000","0","","匹配不了，不知咋回事"
"啊啦德芙low","保密","无IP","34365445","6","","10000","0","","不行不行，我要把舰开到金星"
"玄幻天凡","男","河南","297628786","6","","10000","0","4","[无语]还有人到这里来挖墓[无语]。"
"三千繁华笔走沙","男","无IP","266649623","6","","10000","0","","来神恩来女王不要强袭速度开了！30w一位手动金团来两个老板速度开了！来神恩来c速度开了！来个神恩+++++++++！来个毕业女王3=1++++++++"
"虚假I数据","保密","无IP","38834659","6","","10000","0","","这挑战模式我全是D评价超时过的，。"
"落寂雨","保密","无IP","98589124","6","","10000","0","2","最后大boss该怎么打。。每次都是躺，伤害都不如别人一半，近战基本打不到"
"行左者","保密","无IP","287087287","5","","10000","0","","丽塔=爱酱"
"喜食四季大枣","保密","安徽","661419230","5","","10000","0","8","2023.3.3"
"战场の鬼丶土方q三","男","无IP","10635863","6","","10000","0","","点了一下就传过来了"
"白天没精神","男","无IP","2083378","6","战双帕弥什","10000","0","","我的手机怕是不行了"
"轩华QAQ","保密","无IP","10705626","6","","10000","0","","作战指南，抱大腿或者成为大腿"
"Thyons","男","无IP","33512969","5","","10000","0","","第一个画面莉莉娅怎么是绿毛？？"
"喵喵姐的沐泽","男","无IP","395172828","6","2021拜年纪活动专属","10000","0","","海渊之眼完全就是一个打不了的模式"
"喵喵姐的沐泽","男","无IP","395172828","6","2021拜年纪活动专属","10000","0","","策划能不能把等级限制改一下"
"喵喵姐的沐泽","男","无IP","395172828","6","2021拜年纪活动专属","10000","0","","现在海渊之眼根本没人打啊"
"复读叽叽子","女","无IP","32915827","6","","10000","0","","爱酱声音好像在哪里听过来着(｀ω)"
"在看繁樱落一乡","男","无IP","52914906","6","","10000","0","","睿智策划"
"今天狗蛋吃药了吗","保密","无IP","285727275","5","","10000","0","","。没人了解一下"
"天钩罗伯斯","保密","无IP","776560","6","","10000","0","","打一次要连续打一个小时，太烦人了。"
"佳与仁","保密","无IP","66469817","6","星座系列：摩羯座","10000","0","","什么游戏，逼氪，割韭菜，劝退，有什么好玩。除了无限制加强怪物，温度，就没点其他想法，这策划是当的跟**一样"
"苍山凉薄","保密","无IP","27568994","6","","10000","0","","2000"
"薛定谔的喵喵屋","保密","无IP","33539220","6","刺客伍六七","10000","0","","打过一次就没碰过了，呵呵"
"阿库娅酱","保密","无IP","1059401","6","碧蓝航线","10000","0","10","匹配～不到人啊，80级以下几乎没人来"
"西听日慕","保密","无IP","171854759","5","","10000","0","","上周我打的单人模式，为什么我这一周打不了联机了？是开了单人后只能开单人不能打联机了吗？"
"晓柏胧","保密","无IP","38214713","6","","10000","0","","打到最后，差不多完的时候突然卡退，我****"
"库利帕","保密","无IP","14649363","6","","10000","0","","新出那一天打完过两次，后来就组不到人了( _f｀)。。可能也有渠道服人少都原因？"
"叫一声银角大王","保密","无IP","37345947","6","萌妻食神","10000","0","","除了刚出那天可以匹配到人，一直到现在就压根没凑齐过八人开团。想打都没得打。"
"骊☆歌","保密","无IP","5053526","6","向晚大魔王","10000","0","","nm角色呢？真的恶心人，真当人人全把角色练了？"
"萝莉控都是丶好人","保密","无IP","7639917","6","","10000","0","","这个模式啥时候开启啊，为啥我的一直是未开启"
"部雪-","男","无IP","33576983","6","","10000","0","","20w伤害是怎么想的？次元泳牛+仿犹人偶最高一次才17w左右。不想给那个奖励直说，拐弯抹角的玩什么呢？"
"半夜落星","男","无IP","2735964","6","少前小剧场","10000","0","","挑战之路不错，也算是给这个开始没啥难度的游戏加了点没有排名影响的困难点，不过团本的奖励确实不行，付出与收获难成正比，少有的觉得这游戏奖励不行的活动"
"Linkclump","保密","无IP","19047824","6","","10000","0","","团本收益＝神秘掉落概率×1/12(分配概率)×1/8(补给概率)＜1.04%的五星装备"
"上天眷顾的二大爷","保密","无IP","73852729","6","","10000","0","3","我碰到了bugboss第二次打的时候boss直接被秒杀了"
"心之暗伤","男","无IP","13826540","6","星座系列：摩羯座","10000","0","","有点像火影的修罗副本啊"
"旅途的巡礼","保密","无IP","52955117","6","少女前线","10000","0","","没什么人啊"
"夹心Sandwich","保密","无IP","14558051","5","","10000","0","","问题太多了，我都要自闭了"
"吃纯爱狗粮","女","无IP","25266323","6","魔法学院","10000","0","","原来还能移动成员啊[蛆音娘_滑稽]"
"kotori真是太可爱了","男","无IP","35740981","6","战双帕弥什","10000","0","","我佛了 崩坏3也要打团了"
"书星辰","保密","无IP","22587491","6","茶啊二中","10000","0","","根本没人打...."
"-阳光大男孩_","男","无IP","176880255","6","","10000","0","","打了半天手都要废了，才发现啥都没有"
"宝多六花厨","男","无IP","14069886","6","崩坏3・天穹流星","10000","0","","23333排了八万年没人[小电视_发愁]"
"纪缘_","男","无IP","86737758","5","","10000","0","6","为何我的手机在哭泣？？？"
"淦不氪","保密","无IP","296149296","5","","10000","0","","2月5日抽颂歌套去了100抽给了上和中，算我倒霉，准备在辣鸡屋换下，等了一个半月都没有。没抽颂歌前上中下使劲来，你没有仓检鬼才信。旧深渊关闭时还换个卵子？"
"gaaaaaakki","保密","无IP","4299985","6","","10000","0","","这奖励说不出话"
"酵寥","男","无IP","49781311","6","绯赤艾莉欧","10000","0","","别想了我跑了一天没排到人"
"咕咕咕西斯空","男","无IP","23256048","6","","10000","0","","强袭打不到boss？……还是我没有找到boss的判定点"
"今天的小珈依旧懈怠","男","无IP","89617669","5","","10000","0","","通过时间长，奖励低"
"柠檬味的复读鸽","男","无IP","4431780","5","","10000","0","","地图怎么这么像陆珊瑚苔地（"
"喝冰水的冰水","保密","无IP","34245304","6","hanser","10000","0","","最后一关有啥水晶么，我们好像直接莽过去了，根本没管啥水晶"
"我也是流星","男","无IP","192393655","6","灵笼","10000","0","","还有就是明明还剩一分钟，马上就要把怪锤死了，污染值过高，建议小队退出？？？？？"
"夜灵的主人","男","无IP","285964189","6","","10000","0","4","预言：两周内改机制（游戏体验真的不是很好）"
"玲秋Wryyyyyyyyy","男","无IP","35905356","6","泠鸢yousa登门喜鹊","10000","0","","第一次打遇到好队友。。。打了半个小时，就是视角太蛋疼了"
"大郎该吃桃啦","保密","无IP","227536710","6","","10000","0","","冰塔大招的语音可以改回来吗，新版听着好难受"
"弥音暖兮夏已暮","保密","无IP","297550202","5","总之就是非常可爱","10000","0","","尼玛币的连着两次，等了好长时间匹配完就出来个重启游戏，什么意思？还让玩不了？"
"XQ小五郎","男","无IP","30361595","6","","10000","0","","两个号都过了一遍没啥用。"
"初kos","女","无IP","309596872","6","三周年恋曲","10000","0","3","为毛退了2个人精准卡就轮空了。。。。"
"橘子矛","保密","无IP","3836622","6","","10000","0","","这个好没意思"
"爱露薇恩","女","无IP","313245962","6","2233幻星集","10000","0","","emmmm,评论区里说匹配里八十级的秒够七十五以下的莫得,但我一个66级的匹配了半天123队全没人怎么回事"
"孢子","男","无IP","23204","6","","10000","0","","说实话现在这游戏的现状最不缺的就是八十级玩家，打团本一上来就是六个八十级等六个七十五级以下的，然后槽糕的视角，奖励无所谓，但是游戏体验是灾难性的"
"孤NChannel","保密","无IP","31379623","6","小桃","10000","0","","这个新章节的剧情也是致敬克苏鲁风格的，深海的环境，不可名状的怪物，以及瓦尔特杨和爱因斯坦听到的来自海渊之眼深处的低语，这都是克苏鲁作品的必备要素啊。"
"努力工作的素素","男","无IP","40113569","6","","10000","0","","[蛆音娘_吐血]有一种通了安图恩擎天还得打漩涡雷达的感觉"
"孤NChannel","保密","无IP","31379623","6","小桃","10000","0","","新章节，爱酱不幸受世界蛇或海渊之眼影响，黑化叛逃开跑休伯利安。"
"艺术先马区-文刂氵皮","男","无IP","177311645","5","","10000","0","","建议学dnf搞翻牌，普通奖励100水晶。金牌随机四星武器。"
"晓律仁","男","无IP","1624458","6","","10000","0","","[小电视_嘟嘴]除了抄袭借鉴一无所有的玩法"
"Eddy512","男","无IP","33726540","6","EveOneCat2","10000","0","","不知道你游没人玩？匹配等半天没人"
"秋陌染","男","无IP","108681146","5","","10000","0","","可以改一下匹配机制吗，别人打完三关，我自己还在等。"
"屋里打伞的小蘑菇","保密","无IP","13320435","6","贝拉kira","10000","0","","打的手疼，奖励就......mmp啊！"
"ghrg这是乱打的","保密","无IP","252587200","6","","10000","0","","我看的时候还以为出了新的开放世界呢"
"帝雷牙","男","无IP","3194611","6","斗破苍穹","10000","0","1","团本体验极差。。。。各种BUG，有时卡半天连个画面都出不来[小电视_无语]"
"天下辰","男","无IP","44692581","6","","10000","0","","这包菜保熟么？(●￣()￣●)"
"阿卡迪斯亚","男","无IP","37539211","6","","10000","0","","能不能跨服联机啊宝服的人很难受啊[小电视_发愁][小电视_发愁]排半天都没人。"
"啖μr","保密","无IP","53099091","6","","10000","0","","真以为这个东西好玩我们才打的?抄你也不抄的像一点就这么个辣鸡奖励玩个几把，打着打着少个人，队友跟个nao tan一样连个机关都不会踩 我fo辣"
"紫-影","保密","无IP","320581350","6","","10000","0","","奖励差，而且视角能不能改一改看着好不习惯"
"Ag0n1","保密","无IP","179554433","5","","10000","0","","打了半小时，就一点蚊子腿奖励"
"浅唱小忧伤","男","无IP","105526560","5","","10000","0","","爱酱声音怎么不一样了，我的错觉吗？"
"青云布丁","女","无IP","127265681","6","物述有栖","10000","0","","这次不是奥托解说了？爱酱的语调和奥托好像[小电视_嘟嘴]"
"十七岁の紫月","女","无IP","12542509","5","","10000","0","","水晶有毛线用，a就完事了"
"遗心者_红","男","无IP","348733598","5","","10000","0","","看了这么多评论 表示有群可靠队友真好（不服打我呀）"
"凌-月","保密","无IP","24427346","6","","10000","0","","真的等级要求真的很烦！难道不能像联机那样随意一点吗？排队排太久了，中途那些非80级的还跑了！"
"勇敢的氰化钾","保密","无IP","76056091","6","","10000","0","","活动游戏体验极差←_←"
"辉夜落雨","保密","无IP","17143187","6","","10000","0","","你那个74级以下的很迷，排队还要排这么久"
"景潇","男","无IP","11549476","6","","10000","0","3","学毒奶粉的话，奖励起码得是个补给卡吧。"
"IDFORM","保密","无IP","93848913","6","","10000","0","","这个团本真的令人醉了[2233娘_无言]，肝了快一个小时你就给我这么点东西"
"炽雪落归","男","无IP","240925391","5","","10000","0","","水可载舟，亦可覆舟。,对于国家如此，一个企业，一个公司，一个集团亦是如此。,对于国家而言，只有让百姓落到实处，让百姓切实的得到他们想要的，符合百姓利益的，才会让他们愿意接受这个国家，这个政府的统治。并且自发的愿意为这个国家出力，做贡献，说好话。,否则，这个政府将被推翻。秦朝如此，隋朝亦是如此，每个朝代末期，被推翻的国家皆是如此。,而一个企业，一个公司，一个集团也只有让他们的顾客获得到切实的利益，获得到切实的好处。这些顾客才会真正自发的掏出腰包，为你们送钱。,这是为什么呢？因为他们之前在你们这里得到了好处，得到了利益，并且还得知你们为了做这些甚至有亏本破产的危险。所以自然而然的就为你们送钱了。但他们为什么要这样做呢？因为他们希望得到比之前更多的好处以及利益。然后，一个企业，一个公司，一个集团再给他们真正的更多的好处以及更多的利益。然后他们在得到这些更多的好处以及更多的利益之后，他们又会想得到更加多的好处以及更加多的利益，自然而然的他们又会自发的给你送更多的钱。然后你们再给他们真正的更加多的好处以及更加多的利益。最后往往复复，生生不息，良性循环。,最后，一个企业，一个公司，一个集团将赚的腰鼓满满（那个成语忘记怎么说了）。而他们的顾客也确实获得了他们想要的利益。,但是，如果你们认为这样会导致破产，那就不对了。我们现在的中国破产了吗？没有啊！这中间你们需要把握一个度，即能让你自己赚钱，又会让顾客们他们自己的确获得了利益，最好的结果是他们会自发的为你们拉更多的顾客，自发的为你们提高口碑。并且不要认为那些自发的顾客有价值，那些不是自发的顾客就无价值。那些顾客是潜在价值，而如何让他们即自发的顾客与非自发的顾客又都会获得利益，这又需要一个度了。并且搞好内部团结是很重要的。否则每一个国家为什么都那么重视自己百姓的思想统一啊？,所以啊，米忽悠想要长远的发展下去吗？那就不要再看重眼前利益了，要长远，长远啊！求求你换一个策划或者让你们的策划长长脑子吧。书都白读了吗？啊！,当然，你们只是想圈钱的话，就当我没说。不过，我将从此对你们都不屑一顾 。甚至成为一个小黑粉。搞垮你们，思想搞乱了，你们就完了。"
"要睡了请明天来","男","无IP","90947165","6","","10000","0","","啊！是包菜！啊！我吃了"
