"昵称","性别","IP","UID","等级","装扮","用户权重","获赞数","粉丝团等级","评论"
"混沌影","保密","无IP","2863563","6","","10000","1608","","麻烦你们在学别的游戏打团本之前能不能学全一点，打完一次就几个绿碎片？！真以为玩家都是因为团本好玩才打的么？←_←"
"账号已注销","保密","无IP","106340701","0","碧蓝之海","5000","1022","","舰长副本零掉落"
"我想养一只猫吖","男","无IP","43310617","6","","10000","615","","中午被最后boss吊着打，最后boss视角太近了，半天找不到水晶，十分难受"
"栗山未来","男","无IP","107688072","6","","10000","338","","能不能在挑战boos的时候视角可以滑动，在打boos的时候根本看不到水晶在哪里"
"万化之月","男","无IP","190582320","5","","10000","301","","五万多岁的包菜(￣△￣)好吃吗？"
"Vythe","保密","无IP","21434043","6","","10000","100","","压能量......不对压水压！3队4队等级低去压水压！1队强压，2队补位！1队踩水晶啊！那个谁掉线了，不管了！那个退团的拉黑！水压压好！2队去boss！3队4队别闲着跟着去boss能打多少是多少！好，过了！翻牌！“献祭狗团长！”,,,全员绿豆。"
"白之月下人","男","无IP","14839192","6","格兰芬多","10000","55","","各位，这团本再恶心我都建议你们早打，不然过两天就彻底没人了[小电视_笑]"
"Lray5773","男","无IP","111890257","6","","10000","44","","这次版本更新的好玩之处没体验到，不足之处但是找到很多，尤其是关于团本。意见以及建议如下:,1.团本奖励太少。这是一切矛盾的出发点。我说这次团本的奖励比我去八重村逛一圈捡来的垃圾还少没人反对吧？本来以为是人偶材料的主要产出，稍微算了一下我真是笑出声:天赋库是个无底洞可以理解，全人偶系统通用。但一周5个人偶碎片，四星之前两个半月升一颗小星，一星到四星要两年。两个半月什么概念？普通初始a从零开始刷到3s。两年什么概念？入坑到脱坑×n。是不打算出其他人偶了吗？,2.匹配机制太烂。用等级限制强行要求老带新，可问题不在于新人没人带，而是团本没人打。米哈游肯定是做过玩家的等级分布调查的，但你能不能考虑到新老玩家的游戏频率不同做个加权，少放几个低等级的位置？搞得现在每次都是6等6。等级限制是画蛇添足，奖励可怜又雪上加霜。,3.早退成本过低。或者说根本没有惩罚，可能是因为奖励就这么点也没什么可罚的，所以我也不好“吹毛求疵”[2233娘_喝水]但能不能为了广大玩家的游戏体验，搞个门票制？时序漩涡了解一下。,4.bug太多。详情请参考本视频评论区。大版本更新，可以表示理解，但没必要。,5.策划情商太低。着重批评一下想出“普通版本”说法的策划。本来关于蚊子腿奖励，还可以解释为策划不懂人心、过于小气。结果提示这是先行的“普通版本”，后续还有挑战模式。这不是摆明了告诉我早就知道这次的团本不会让人满意，让我别着急等你放大招。美名其曰普通版，不就是测试版吗？团本测试了得有两三个版本了吧，虽然也不是没有拿正式服当测试服的先例，但起码光明正大地发公告，奖励也是****腿吧？拐弯抹角地拿我这个玩家当测试员使还不给工资？这是正常游戏运行的态度？要么别出，要么态度端正一点。,说策划重视团队副本吧，从你们的这波操作我真是看不出来；说策划不重视团队副本吧，又对不起你们拖拖拉拉几个版本、处心积虑地让玩家陪你打工。作为一个前DNF玩家，能不能请你们多学一点那边的团本怎么做的？游戏玩法又没有申请专利，内容做好了能提高玩家对很多小毛病的容忍程度，但现在这种态度让我想表示理解都觉得对不起我自己[2233娘_喝水]"
"天堂陨落","男","无IP","134015","6","","10000","37","","我说一句弱智模式 有人反对吗"
"天川雾浅","女","无IP","1446697","6","星座系列：水瓶座","10000","31","","多看看评论吧，每次一更新为嘛就没玩家夸你们好？多是吐槽和埋怨，游戏公司不多思考自己所作所为吗？,这次团本打了半小时，奖励是什么？我还不如拿星石换，体验这一次后，奖励不提升的话，就再也不打了。,日常任务里，使命分配不合理，今天打了一层深渊才满150点。,bug还超级多，昨天的联机破晓行动，神机锁血。,女武神武器圣痕出错。,半小时前的热更新后重启游戏，显示服务器繁忙。,联机看不到女武神输出伤害数值排行。,团本联机只要切换了一次女武神，确定后不进入地图也会消耗出战次数。,深渊卡顿影响。,贴吧bug整个贴里太多太多了，我只是列举我体验过的bug。,不讨论大更新的奖励提升和游戏优化问题，3.0真是所谓我从未体验过的全新bug版本。,告辞～"
"难得几回醉","男","无IP","53897182","5","","10000","27","","关于团本提个建议:,1.可以把奖励五个可选奖池：钻石池，人偶素材池，货币池，服装卡池，装备池。钻石池30到250水不等，人偶素材池可以保留当前奖励，货币池可以开出远古意志，联机玉等货币，服装卡池可以开出红卡，装备池以武器残虚影为主。匹配前先选择奖励池，通关后根据分等给予奖励；,,2.学习ff14的导师机制，对于高级区苦痛到无限的玩家，根据勋章等级给予一定的名师点奖励，每周设上限，同时丰富名师点商店可兑换的物品，鼓励高阶玩家多下本；,,3.对于中途如果有掉线的，可以根据掉线人数提高其他团员的奖励概率，对于恶意掉线的可以取消概率加成；,,4.订每周周六周日为集合打团日，这两天首通的可以获得额外30水奖励（每周一次）；,,5.部分副本机制进行优化。,,之前记忆战场，新深渊刚出的时候也是被不少人诟病，最后经过一定优化还是被玩家们接受了，路还有很长，多摸索吧。"
"神羽夜岚","男","无IP","2646811","6","","10000","26","","等待队友处理特别事务……,给大佬递茶……,给大佬递茶……,给大佬递茶……,给大佬递茶……,XXX已退出……,[蛆音娘_滑稽]"
"白魔法师伊涅斯塔","男","无IP","259895873","6","","10000","24","","你们对你游的新人数量没点AC数吗？六个80级等两个55级等十分钟？"
"没有炮塔只剩沙雕","男","无IP","20869542","6","","10000","22","","总结一下：喜闻乐见的抠门特色  你游倒是真信了大伟哥那句话――玩家会为他们喜欢的二次元文化消费,,注意一下   ,,首先，如果不喜欢何来消费？,你把玩家当冤大头吗？2.8直播之后开始各种硬植入周边广告，每次直播尬推周边，福利反而没有再多。,,新的游戏内容必然应有与之相应的奖励，你看那团本奖励拉到最后才看到的精准补给卡，暗示所有舰长都会在这堆屎块上说真香？"
"ホシノTom","男","无IP","14981586","6","明日方舟","10000","21","","新手本来能用的女武神就少，还限制出场次数和圣痕。。。真当新手会因为这个去氪金抽卡？？要么减少低等级的匹配数量要么解放低等级的女武神圣痕限制，不然新手都是打一点就退，一个队就一个人打，这样的体验你还不如出单人副本"
"污海的划水之策","男","无IP","63957221","6","","10000","19","","我觉得是换新策划了，最近的版本全是喂shi。,商店，各种商品就是来清老玩家库存的，喂shi+1,日常任务改版，tm周一周五打深渊，深渊下午三点开放，喂shi+1（还把周活跃和日常活跃分开了）,时序门票提高，喂shi+1,团本，不必多说，喂shi+1,新加挑战之路，肝度上升，喂shi+1,女儿可在记忆战场使用，秃分难度再提升，喂shi+1。,,哪怕二周年活动，我也觉得能接受。但这版本我是真的被恶心到了[小电视_差评]"
"Mr小影","男","无IP","11444610","6","至尊戒","10000","18","","12人副本是真的智障，①浪费时间，匹配你就不能统一60～80级么？75是什么鬼，匹配30分钟，开始游戏。②各种诡异视角，能不能出一个技能透明化的功能？boss技能根本看不清。③奖励真的太凄惨，浪费30分钟就这点蚊子腿，而且比其他的副本还要卡，845各种掉帧。开服到现在这个是真的让我恶心的副本了。④你出个女儿系统就是来恶心人的吧？谁养的起？赤鸢还好，仿犹大我的天，全部跟星石，软妹币，钻石挂钩，玩不玩？"
"桔律乙姬Plastic","男","无IP","20692833","6","明日方舟","10000","18","","亲爱的舰长：,团队挑战模式「海渊之眼」将会追加奖励,首次通关「海渊之眼」将会获得30个特拉洛克的真皮，每6个特拉洛克的真皮可以兑换1个特拉洛克的神经细胞，之后每次通关可以获得18个特拉洛克的真皮，特拉洛克的神经细胞可以用来升级苍海碧落系列武器。,首次成功通关「海渊之眼」将会获得400个海渊城贝壳，可以通过40个海渊城贝壳兑换1个特拉洛克的完好组织，15个特拉洛克的完好组织可以兑换一个苍海碧落系列武器自选礼盒。之后每次通关「海渊之眼」可以获得250个海渊城贝壳。,每次挑战「海渊之眼」系列关卡可以获得两次35-40女武神特别作战徽章，100个女武神自选作战徽章可以用来兑换水晶和A级女武神碎片自选礼盒（30个）或者天命・虚数核心+逆熵・虚数核心自选礼盒（40个）。,通关五次「海渊之眼」之后，开放全新团队挑战模式【天穹神殿】。,通关天穹神殿将会获得天空的眼泪，天空的眼泪可以升级苍海碧落系列武器为怒涛吞天系列武器。"
"曾落笔都不对","保密","无IP","349936906","5","","10000","17","","美工辛辛苦苦做了这么好的图  策划倒好  就给这点通关奖励 白费美工心血"
"季涟","男","无IP","13326862","6","崩坏3・天穹流星","10000","17","","等了半天才随机组成的野队，队友一退就少一次次数，三个人站位他在开始的地方死活不动弹，游戏里又没法打字，那么几个简短喊话什么用都没有，一个水压关硬生生拖了10分钟？？？？最后boss根本不知道自己在哪里打，水晶水晶满山找，污染污染解不了，靠着非队长的身份拿了mvp，一发奖励，嘿，几个碎块？？？？"
"Ankg哦哦","男","无IP","3642104","6","2233幻星集","10000","16","","保护机制？有用吗？有多少新手？新手真的会好好听指挥吗？中午打了一次  三四队全跑了，全程无交流，就我一个在说话。真的佛了。你就应该一二队是80级及以上，三四队79及以下，一次本带一两个5 60级的就好。我真的愿意带小号，但这样太恶心了。,这次教程算比较全面了，可还是有人不懂降水压，我们一队的队长也不懂，辣是真的妞皮，"
"猫亮了不玩了","保密","无IP","33916036","6","","10000","16","","中毒看不见水晶，队友死了看不见圈，球球把视角改了吧，boss那么大一坨我看的清[小电视_哭泣]"
"为什么取不了赫敏呢","女","无IP","2604420","6","","10000","14","","我寻思着，米哈游你们既然一直在用心在做有趣的活动，每次活动完也有调查问卷之类的。但是你们能不能用脑子想一下，为什么玩家对这几次的活动一直都不太满意？因为奖励啊，你们会不知道？贴吧，游戏群到处都会讨论奖励寒酸的问题，你们会不清楚？？  你做活动，把奖励提高一些，不就皆大欢喜了吗？有那么难？宁愿花心思在研究模式，花心思氪金。也不愿意做点让玩家开心的事情是吧？活该你游风评差[小电视_差评]"
"一般路过乐孑人","保密","无IP","19941548","6","","10000","13","","看了下评论区，有说没人玩的，有说照搬端游不可取的，有说时间太长的，我看来这一切其实都可以归结为奖励太差,如果按dnf爆荒古的爆率出蛋池，没蛋池的也有一两百张时序票子或者紫色肝物，还会没人打么[小电视_笑],说到底就是奖励太差，给个绿豆糊弄得了谁，没人愿意为这么个破玩法花时间，要是dnf当时开乌龟，辛辛苦苦打完全员10片异次元碎片，我看谁会去打"
"账号已注销","保密","无IP","40060865","0","","5000","12","2","米忽悠做个人吧，你真的要把所有玩家劝退才甘心？上千条评论全是骂的，可想而知这次更新是有多失败，既然上次夏活空中劈叉的文案被骂了之后就能改，为什么策划就是没有长进呢，这**策划是你游请来毁自己的吧？"
"土菲尔特","男","无IP","6675161","6","hanser","10000","12","","别的不多说，一出来就去匹配了，一开始队伍12人满的，第一图就退了一半，第一阶段结束就只剩我们1队了，中间再也没人进来，我们3个人硬生生花了近一个多小时，又是压水压又是打boss，愣是把12人本给打通了，然后3个人每人2个小绿豆，我12000多的评分，太真实了[小电视_赞]"
"小亚给他整个活","男","无IP","8401006","6","实验品家庭","10000","12","","你游多少萌新能耐着性子玩心里没数？成型期多长心里没数？非得新老玩家全劝退两开花？是不是觉得都夸你游画质所以准备除了画质啥也没有？打boss远程离得太远还会打空枪？要死要活打过去给点蚊子腿？一周一次？海渊之眼海你m啊？"
"灼烂之星","男","无IP","259853","6","明日方舟","10000","11","","12人团本，12个字概括：风险极高，体验极差，收益极低。第一次测试的时候就问题很多，攻略组提的那么多建议全都喂狗了，正式上线之后一点都没优化。佛了。既然要抄，就光明正大的把体系抄全了不好吗？放着隔壁dnf的门票机制不学，打着打着人都**了，一点惩罚也没有。费劲打了半天就那么几个材料，你们以为真的是因为团本好玩玩家才打的吗←_←"
"屠君姬","保密","无IP","1275737","6","","10000","11","","emmmm，今天上午才打完的团本，IOS服，零零碎碎的说一点点感受吧。首先，进团本1队2队75+这个还行，但是3队4队一定要55-74这个区间有点太难了...虽然说是理解你们想让新人也可以打团本而不是会因为要多拉几个80级的大佬而被踢出队伍，但是这个区间人真的好少啊，1队2队一秒满，3队4队等一年系列，其次，水压关有一些奇怪的BUG，比如说怪会生成在无法跨越的地形之外，也就是地图外，幸好有女王硬是磨死了，不然就直接关卡失败了。还有，部分关卡的提示不明确，比如熔岩与冰狱的熔岩提示“躲到石头背面”我一开始躲到石头后面，结果直接被吹到火里，幸好开大+赤鸢人偶大把血量救回来了，后来才知道要背靠石头面对熔岩帝王，然后就是最终BOSS了，污染范围基本把近战都包进去了，水晶还只有一个地方有，范围还小，基本上如果走了四分之一时间的污染你没到水晶边上，那你也就不用走了，然后就是打BOSS时候的视角，卡的是真的好，难受的不行，最后是打瘫痪的BOSS..这个就不多说了，人偶大家都懂，大佬的女儿，平民的花瓶，然后就是翻牌的奖励..花了半小时以上打这个团本，翻牌就放出来10个绿碎片，只有一个人翻到了金牌，也就是4个红..我当时就流出了非酋的泪水，惨啊，然后我看了一下，解锁技能栏要6个红，emmmm，突然心里平衡了一点"
"NOTA_Pr0","保密","无IP","186445907","6","HIME","10000","11","","手游设计了这样单局耗时很长的模式，我个人觉得不合理，而且奖励可能也和付出不太成正比"
"n都_","男","无IP","151977336","6","星尘","10000","10","","我真想弄死这苟策划，活动关卡麻烦的一比不说，土豆服务器加蚊子腿般的奖励，以及新每日强迫你打深渊战场才能拿150活跃，我打你emoji，半年没爆过粗口了，真尼玛恶心米忽悠。"
"约翰-提托","男","无IP","5519902","6","","10000","10","","提个意见，个人觉得这种大型副本，除了攻克高难boss跟团队配合带来的快感外，高收益的报酬跟“惊喜感”也至关啊...远了说，魔兽里摸尸时的期待，近了说，毒奶粉团本翻牌。虽然崩坏3类型和它们不一样，想直接出产某个部位的毕业装备基本不可能，但是总要有点不一样的东西吧。个人希望给的是副本专属的特殊装备，强度强于肝物低于蛋池；或者副本产出角色，甚至是人偶、武器的皮肤，不管怎么说，至少需要它具有纪念性的意义，这才是作为副本最好的报酬。此外，更希望有设计精妙的副本，要是有“首杀”这样能让人激动的boss纪念就更好了。,顺嘴说，我挺喜欢大型副本的设计，之前几个版本问卷里基本都提了相关意见，这次12人本的推出属实大满足，可喜可贺。只是我对人偶系统并不抱太多的好感，窃以为崩3并不太需要这样的“宠物”系统，这对于它自身的act属性甚至是有害的。就强度而言，过强的人偶要是成为刚需，那对于基数大的平民玩家又是噩耗一个，节奏必然接踵而来，过弱的人偶就是吉祥物，没有软用。我很不喜欢类似毒奶粉里节节攀升的宠物系统，这基本就是个单向门，只允许强度越来越高的。衷心希望策划可以严肃考虑人偶系统对于以后游戏的影响，我不知为什么，感到的是不安。"
"alpha与omega","男","无IP","284143986","6","","10000","10","","个人提几个建议：,1、要有掉线重连，并且有入场次数限制，以减少恶意跳车及大佬掉线导致的炸团,2、75级以下很难等，可以改成有75级以下成员团队可以增伤，这样实在等不到全是满级的也能开,3、不要为了表现BOSS的巨大而把视角固定为仰视，玩家的走位与看地面情况是很重要的,4、BOSS的打法机制过于单调，对于大型BOSS正面站撸有点不合逻辑。可以参考植物大战僵尸的僵尸博士打法，BOSS先无敌不攻击或少攻击，清小怪，然后BOSS狂暴躲技能，再虚弱变木桩，如此循环,5、奖励太少，完全对不起等待和打通的精力和时间，至少也得是与深渊差不多的奖励才有动力，甚至更好也不为过,之前玩dnf开95退的坑，安徒恩是拯救了整个游戏的团本，后面出的团本也没有超过它达到的高度，这是个很好的参考对象，有很多东西值得借鉴（上面的建议也大多参考dnf的团本）[小电视_笑]"
"断水流大兄贵","男","无IP","152954183","6","","10000","9","1","12个人太乱，还没时间沟通。4个队之间的交流那就更差了，三四梯队打最终boss抢的比我们80级2个梯队都快，最后留下我们满编的二梯队打柱子，留下3只80级咸鱼在风中凌乱，个个都是火车王，火车王灭团攻击怕是不会远了,～(￣￣～)"
"余小C真的很混ovo","男","无IP","33447827","6","贝拉kira","10000","9","","学DNF的打团模式翻牌奖励不学学吗？给这么点蚊子腿，漩涡团过了还有可能翻超界呢（虽然我是个非酋）"
"看不见我的哦","保密","无IP","5626740","6","","10000","8","","奖励是从策划的py里抠出来的？还有这shabi等级限制，你游还有多少新人心里没b数？最终boss就这么歧视近战？那个感染值有毛用？最骚的是由于一次性收到伤害过多导致感染值到达临界点建议退出？？？这tm是几个意思？？？"
"变成光守护翔明哥哥","保密","无IP","15326542","6","","10000","8","","每日改回来，团本别搞等级限制行吗？萌新那么多，等半天等不到个大佬，而且奖励还不高，我打了一次都不想打第二次[2233娘_汗]"
"阿海今天吃宵夜了吗","男","无IP","89876494","6","","10000","8","","老实说，我觉得奖励和攻略付出不对等，第一，队伍不好集齐，我们在晚上7点配对，光配到8人就配了7分钟，第二，难度有点儿高，必须要降水压，然后就会托长游戏时间，第三，中途会有人因为网络原因或者个人原因退出，导致攻略难度增高，时间又拖长。就拿我组的队来说，一开始12人，打到最后只剩7人，通关四层总耗时37分钟，但是奖励不过千多星石(这个玩意儿确实重要，但是千多对一个老玩家来说可以随便挣到)，然后几个玩偶突破碎片(这可以不用氵买到)，没有氵或者特殊奖励，我觉得没有人想再去过一次，价值太低，2.9版本里推出的时候都有氵，不知道策划为什么把氵去掉了，说句不好听的，不改估计又会成为孤儿本。[小电视_差评]"
"麻麻喊你回家","男","无IP","19205667","6","","10000","8","","等级限制就是万恶之源，一二队秒排三四队等半天，等到都好三四队新人不会不去降水压直接打boss老咸鱼去降水压，这也就算了大部分情况降了水压他们还是不好打，打不过就退出最后三次阶段还是剩下一二队老咸鱼一边降水压一边打，不难的本浪费了一二队所有人起码十几分钟的时间然后出来拿几个绿色碎片加一点星石...哇，我好快乐哦[小电视_害羞][小电视_害羞]"
"吃土先锋队","保密","无IP","91483065","5","","10000","8","","别的不说。能不能把等级限制取消。半天都没有75以下的！上边一排都是人。下边没人……"
"葱音未蓝","保密","无IP","11472254","6","斩兽之刃","10000","8","","队友招募问题，队员退出攻坚队无惩罚，最终boss战视角问题"
"琴瑟如昔","保密","无IP","16391432","6","","10000","7","","DNF团本最少还有深渊票，还能做出毕业装备，虽然以前制作周期长了点吧，但至少有个毕业的盼头，而且万一翻张卡或者武器出来血赚，而且也没觉得有什么***的设定（除了血量超级加倍），而这团本呢，战斗中最不习惯的就是锁定视角还有特效，经常性我是谁我在哪我怎么死了我现在在干嘛队友尸体在哪，其次队伍机制，基本就是个六人中型聊天室，至于各种bug就不想说了，最后就是奖励……团本好玩吗？不好玩，想打团本吗？不想打，那为什么打呢？因为奖励我无法拒绝。,我倒是开始怀疑是不是崩4要出来了，打算在崩3割波韭菜再劝退，然后让被劝退的玩家去玩崩4，最后留下粘性高的用户，退居二线成为第二个崩2"
"咔嚓咔嚓咔嚓咔","保密","无IP","14677147","6","","10000","7","","匹配：6爷等6DD；准备：瞎几把选人，前图用大哥；战斗；乱跑不踩圈，刚正日脸，吃Bug；Boss战：水压带着血压升，污染不清，大哥锁了没法用 告辞"
"不归之尊","保密","无IP","2228931","6","","10000","7","","你游有几个玩dnf的策划赶紧给老子爬，什么垃圾副本，抄鬼泣不行别的也抄，动动脑子搞几个原创玩法行吗，中途一次热更新全团掉了，匹配根本没有低级玩家，锁视角完全不知道在打什么，半个小时就给几个绿碎片"
"永橙木","男","无IP","9134814","6","","10000","7","","先别提奖励问题，我觉得下面那几个55级的八个玩家都凑不来，真的是想打都打不了emmmmmm米哈游真的觉得自己的血液很新鲜吗？"
"wyz诶","男","无IP","11159271","6","#EveOneCat","10000","7","","能不能把每日改回去? 这叫人怎么弄这个每日活动"
"银色装甲布狼牙","保密","无IP","2310180","6","","10000","6","","手机打这种大型副本已经是很耗时耗力，也不想想这么长的时间手机电量和散热有多少顶得住，匹配机制很蠢，本来人就少了还限制，奖励抠的不行，打这种副本不都是掉落一些好东西吗？这点奖励打发叫花子啊？叫花子都看不上说真的，又肝又累又抠门的奖励，活该被骂"
"依凌Star","保密","无IP","340922023","5","","10000","6","","一个小时没凑够八个人的举爪"
"Eheieh・天秤座","保密","无IP","33492720","5","","10000","6","","求置顶,boss视角可以被一些强行锁视角的动画打断，比如女王大招，冰卡大招，冰塔大招等。在固定的视角动画结束后角色视角就能随意改变了（目测是bug，不过锁视角确实难受，官方应该会改，先用bug将就一下）,最后奖励和表现没啥关系，全程不耗体力，点赞只有摸完大boss后的结算，抽卡嘛...反正我估计是全场输出最高（4队里最早撸boss而且伤害数字整体最高的一队，我又是队里mvp）但是我们队一个划水的最后抽出来了补给卡。（我是主c，另一个是辅助，划水的那个就打打退退最后才加回来的，完全躺赢）,所以说，最后那个卡池太坑，而且一周一次，还有任务4让宠物打伤害太耗时间，女王直接站撸了最终boss懒得再打任务4了（话说宠物太弱也很难打出那么高伤害啊，不然打到明年啊）"
