"昵称","性别","IP","UID","等级","装扮","用户权重","获赞数","粉丝团等级","评论"
"不沾酱油的唐山人","保密","无IP","310907676","5","","10000","0","","团本这东西只能说和玩家所想的出入太多，首先是这个难度问题，我不知道这个前期boss血量共享的设定意义在哪？但这个设定一出就很容易出现4拖8甚至1拖11不管大佬想不想，都会加快前期节奏，这就影响其他玩家体验（打着打着突然结束了），二是这个最终boss相比之前怪物太强了，视角还贼有限，boss技能很难都躲尤其是全屏球加激光，配上那个中毒简直就是强制扣血，操作空间小，最终战直接趴着让你打我都无语了，关卡平衡都被吃了？奖励就不提了，12人的团本，3人一组，为的就是让更多玩家能交流配合，在交互性上做的极差，那这跟联机有什么区别？"
"云山万里全是雾","男","无IP","8269108","6","","10000","0","","这个奖励是真的扣死了，而且打完了还得抽的机制是真的恶心，我积分第二，就给我10颗碎绿豆，我等到11个全抽完没看见卡，有一个划水掉线的没抽，然后马上跳转的下一个页面( _f｀)"
"墓碑の咏叹","男","无IP","34390774","6","英雄联盟全球总决赛官方收藏集","10000","0","","这模式真的垃圾 垃圾中的垃圾 等了半天等不到75级以下的玩家 打了半天还他么给我闪退 ！！你游优化真棒！"
"我好喜欢小高","男","无IP","10870660","6","","10000","0","","队员打着打着就挂机，队长没法踢人，进游戏没法开始，只能干等着，qnmd,还有，版本更新的bug不要太多，刷一次剧情关就跳错误"
"王源中路拉烟啊","保密","无IP","250686655","5","","10000","0","","奖励是什么？有人能大概说一下吗？"
"bili_298969438","男","无IP","298969438","6","","10000","0","","会很卡"
"清风拂面R","保密","无IP","40845004","6","星座系列：双鱼座","10000","0","","不会做副本就不要做，做的和s一样，被喷也是活该。"
"短-mio-鬼","女","无IP","17796183","6","","10000","0","","你们这是看不起白练啊 白练有团队远程扶人 增加容错率 凭什么看不起白练？[2233娘_困惑]滑稽"
"喵喵喵喵喵喵喵12","保密","无IP","249737136","5","","10000","0","","。。。"
"紫铁柱","保密","无IP","266690601","6","","10000","0","","还没打，也不会去打"
"seen-the-sky","男","无IP","138696888","5","异常生物","10000","0","","奖励太水  副本又臭又长  真以为像dnf那样？？？  人多就卡  救救游戏吧"
"L折羽","保密","无IP","239794381","5","","10000","0","","刚打完一把，56分钟，最后一关都不知道怎么过得97的血，突然就完事了，污染是什么机制，过去打完一套平a，然后就得找水晶，找水晶还费劲，我都靠着圣女和队友干，如果不是为了希儿花嫁，我都不会去打，"
"revdXD","保密","无IP","20918429","6","","10000","0","","打了20多分钟，就那么点东西，而且凑不齐12人，不停的有人退出，基本拿完活动奖励就不打了"
"寒冰女巫伊薇","保密","无IP","11495380","5","","10000","0","","下海了"
"RIRIxi","女","无IP","20477351","6","","10000","0","","进去就闪退！强制退出好烦躁！不玩了啦"
"挥洒墨香情","保密","无IP","21057158","6","初音未来13周年","10000","0","","奖励真渣"
"小余弦儿","男","无IP","13451051","6","","10000","0","10","特拉洛克，现已加入记忆战场套餐！（并没有！）"
"_阿祭_","男","无IP","11090671","6","#EveOneCat","10000","0","","人在叫，肝坏掉。"
"云里雾里魔理沙","男","无IP","20373974","6","","10000","0","","卡到爆炸啊……"
"明璃主","男","无IP","311831821","6","小希","10000","0","","打一小时后就炸团了( _f｀)"
"第六驱逐队-","男","无IP","22617189","6","初音未来13周年","10000","0","","我估摸着你游这帮策划是为了冲绩效，为了升职，各种喂屎已经全然不管玩家死活了。。。"
"游白暗","保密","无IP","11148515","6","","10000","0","","要开团了 快来人 [2233娘_大笑]"
"虐喵狂魔薛定谔","男","无IP","51715620","5","","10000","0","","第四阶段的视角就不能自由调节吗？设计现在这视角的怕不是个傻子"
"我真不想取名字","保密","无IP","14470363","6","","10000","0","","感觉是给崩坏4积累经验吧"
"五水硫酸铜大佐","男","无IP","22456118","5","","10000","0","1","米忽悠口碑又崩了"
"铛铛是个呆逼","男","无IP","19493489","6","","10000","0","","原来玩蹦蹦蹦的人真的都在玩毒奶粉吗"
"D往无乾真君","男","无IP","29193483","6","","10000","0","","休伯利安甲板清洁工申请加入攻坚队，这波混，下波躺"
"橙汁摆摆","女","无IP","5950477","6","","10000","0","4","我匹配了半个小时才进去一次，一开始连指导关卡都是转圈圈，而且中途莫名其妙地就卡掉线了，12人本最后只有8个人打，然后boss那关真的稀里糊涂打的，什么水晶闻所未闻，最后那个奖励是真的坑，求求你们做个团本能不能好了？？？"
"墨墨的黑君","男","无IP","8480441","6","墨清弦2nd生日纪念","10000","0","","你这更新的版本，不知道的还以为你游是个大型端游呢"
"肥非废非宅","保密","无IP","27915594","5","","10000","0","","匹配不到人怎么破"
"吹著Ll呆","保密","无IP","131383581","6","","10000","0","","拿完圣痕就懒得打了，奖励又少，打得又久，而且还恶心人，匹配半天60级到50之间的根本没人"
"这是不花币能看的吗","男","无IP","36284407","6","","10000","0","","欢迎大家加入攻坚群123456[小电视_无语]"
"苦痛滴人儿嘞","男","无IP","40442208","6","异常生物","10000","0","","一句话，奖励太差，没人打，玩个屁。。"
"_西瓜脆脆鲨","女","无IP","384163387","6","","10000","0","","(_)( ω )|ω）"
"OlegendO","保密","无IP","575909","6","","10000","0","","策划是猪吗？这团本等半小时永远都是只有6个人。玩你**啊，现在哪里还有75级以下的萌新，都是80级的老咸鱼，根本匹配不到人"
"能告诉我你的秘密吗","男","无IP","24329355","6","","10000","0","","我无限火力 开了两把 才打完一次这个 _"
"XF叶鑫","女","无IP","345293827","6","RNG战队","10000","0","","这一定有深海鱼滑稽"
"Professor---陈","保密","无IP","360392825","5","","10000","0","","很好很好，玩了新团本之后我意识到3.0真是个省钱省肝的版本"
"非洲酋长---","男","无IP","278098990","6","","10000","0","10","我最后一关用舞卡使劲苟，队友死了再去救，谁和我一样(°°)"
"星际怪盗稽德","男","无IP","114366586","5","","10000","0","","都打了一年多卢克了，这东西是真的小儿科"
"祁黯阳","保密","无IP","273084980","5","","10000","0","","而且卡的一批好吧，动不动进去没怪然后等别的队打"
"橙心kate","男","无IP","110698586","5","","10000","0","1","bug不谈，这可以优化，但奖励少，打起来又无聊，这有何意义"
"幽兰黛尔v","保密","无IP","108403426","5","","10000","0","","有些人可以是包菜，也可以是冰箱的主人(=ω=)"
"昭见玖","保密","无IP","43854786","6","幕华祭幽幽子1","10000","0","6","这视角我佛了，本来boss就难打几圈转下来找不到水晶，boss攻击动作也看不太清，你们拿头做的团本"
"⒉ㄑu","保密","无IP","81245837","6","三周年恋曲","10000","0","","跨服好友什么时候再开啊"
"千瞳万孔","男","无IP","8078244","6","不吉波普不笑","10000","0","4","要叫我老板[小电视_笑]"
"雨宫美绪","保密","无IP","49415688","6","","10000","0","","20分钟团本，打完后奖励连人偶两下技能都点不到了还有人再打就是啥子"
"骗氪骗肝苍小玄","保密","无IP","82500765","6","","10000","0","","这视角有毒，打的一脸懵逼"
"丿蝶吻痕丶","保密","无IP","8426605","6","崩坏3・天穹流星","10000","0","3","花了35分钟打团，奖励真心令我崩溃，什么鬼？2个绿碎片????"
"食投人的小脑仁","保密","无IP","29214711","6","星尘","10000","0","","所以以后会有四托的金团吗[蛆音娘_滑稽]"
"陌途居","保密","无IP","107444916","6","","10000","0","","都匹配不到人"
"大宝猫担心你没有喝酒","保密","无IP","64042877","5","","10000","0","","我打了38分钟，中途退出5个，结算的奖励找了半天才看出来，什么垃圾团本"
"大狗Alter","保密","无IP","40470798","6","","10000","0","","等级限制太蠢了"
"Ver3ta","保密","无IP","12235095","6","","10000","0","","卡的要死。。视角奇葩，奖励还少"
"★执笔丶永恒★","保密","无IP","22512962","6","","10000","0","","打那么就就给我四个绿碎，你这奖励也太抠了吧。"
"匪兵王","保密","无IP","681075","6","乃琳Queen","10000","0","","时间长，奖励差，视角难受，强行组75以下，快给我想想有什么能夸的"
"不夜天掌柜弦歌","男","无IP","283292821","5","","10000","0","","米忽悠你敢看回复不，哪怕一条！看看有没有人认为这个团本有可玩性的！！！！"
"胡萝卜鸽子","保密","无IP","150342731","6","","10000","0","","哇哦，反正到时候调查问卷问人偶和团本怎么样，我们肯定是要填不满意的。"
"寂夜莲华","保密","无IP","156194224","5","","10000","0","","麻烦在测试服搞定好游戏视角再拿到测试服好嘛，蚊子腿的奖励就不吐槽了，匹配机制必须要75级以下的玩家才能开始，抱歉，你游找不到大佬(￣△￣)舰团里都是一堆80级的萌新"
"苦痛滴人儿嘞","男","无IP","40442208","6","异常生物","10000","0","","打这个团本还不如，用徽章刷呢～一次给两个～"
"莲Al","保密","无IP","130658236","5","","10000","0","","只有我这次更新完频繁闪退吗？团本闪退人偶活动闪退联机还闪退，这是要劝退！？游戏重装了两三次了"
"网友拉拉菲尔","男","无IP","31355515","6","","10000","0","","最后一阶段打不过啊，铁头队友非要提前开点不打水压，结果死了三次，只拿了前面几个碎片就不得不退了，80级大佬们也退了"
"橙心kate","男","无IP","110698586","5","","10000","0","1","打起来麻烦，奖励有那么少，你米哈游还真是。。。,人偶免费送，还真是免费送啊。。。,今天十连暴死，真的被气自闭了"
"你喜欢什么颜色呢","男","无IP","13145460","6","","10000","0","","最后那个boss建议用冰丽塔打，都不用去找水晶的，战撸就完事了"
"逝羽寒霜","男","无IP","89593020","6","泠鸢yousa","10000","0","","说好的作战指南哪(□)/不讲讲怎么打吗233333"
"神威SAMA","男","无IP","12201189","6","","10000","0","","Woc，你们这新皮肤大招特效都不改?分身还是原皮模样玩毛线"
"满潜水月","保密","无IP","86905094","6","","10000","0","","白夜：攻略？技巧？（ò  ó）"
"殇沧月","保密","无IP","12193474","6","见习爱神头像框","10000","0","","3把Mvp领着最弟弟的奖励，虽然能理解有运气的关系，但是我还是气啊，能不能改一下伤害越高抽到好东西的概率越高啊"
"差一桑不差一","保密","无IP","52663159","6","三周年恋曲","10000","0","","排不到人怎么说？"
"可可绪雨","保密","无IP","10289235","5","","10000","0","","我打了35分钟打完了，给的是一坨粑粑？[呆]"
"冰糖大大っ","男","无IP","225410928","6","2021拜年纪","10000","0","10","叫我干嘛，我在洗甲板呢，很忙的！[蛆音娘_哼]"
"\粉^^","男","无IP","47353906","5","星座系列：双子座","10000","0","","更新后各种不好……不如 我们把爱酱拉到小黑屋吧[洛天依_滑稽]"
"吸吸管","男","无IP","226336552","6","","10000","0","","新boss是蟹老板跟章鱼哥？"
"SYNAPSELIZE","保密","无IP","8748259","6","","10000","0","","能不能好好考虑一下玩家的感受哦i让玩家能感受到收入与肝成正比?你看看新出的人偶与副本，那是个啥?"
"曾经的人","保密","无IP","11425172","6","","10000","0","","团本打了48min结果给了啥？几块不痛不痒的石头？有这时间我够刷通苦痛了OK？抠门都懒得说，女儿奶粉钱你们给吗？这是提前让玩家体验当父母的不易吗？退一万步讲老婆都没碰过结果多了两个小的。不仅喂了一嘴屎，屎还是绿的。现在我们都是绿托了[小电视_赞]"
"莲华.出淤泥而不染","保密","无IP","130654","6","Kizuna AI","10000","0","","加油，希望把玩家们都恶心走，然后去玩崩坏4给力哦铁汁"
"宁氪死流亡兮","保密","无IP","128581817","6","碧蓝航线2020","10000","0","","打这个完全没什么配合啊不懂的人乱打都不知道降水压，打了半个多小时才打完，庆幸的是打完后的奖励12个人只有我拿到了红石头他们全是绿石头(￣△￣)"
"l遣月岚","男","无IP","41027842","6","","10000","0","","老板，这个包菜保熟吗？"
"康娜酱吃什么","男","无IP","68361500","6","三周年恋曲","10000","0","","今天我打联机bug太多了，这个版本我要差评啦，再不修复，打个剧情也一堆bug！"
"阳光里的尘埃丶","保密","无IP","244485290","6","","10000","0","","就我一个团本总卡退吗？"
"撸猫狂魔丶叹","男","无IP","32136756","6","","10000","0","4","提示一下：爱酱也是上个纪元里的超级AI量子计算机，和那个人形机是不是有点像？还有你认为灰蛇进攻休伯利安为了什么？世界蛇哪里来的天命和逆熵的各种数据？这个爱酱……你个二五仔实锤了！！！"
"天命空中劈叉指挥官","保密","无IP","31116458","5","","10000","0","","抽空好不容易组上队打了一局，花了40多分钟，就获得几个玻璃球碎片?[小电视_差评]"
"飞雪不寒春即来","保密","无IP","35917255","6","","10000","0","","快压能量啊，火山关门啦[洛天依_滑稽]"
"月却青云-walia","男","无IP","264215","6","EveOneCat2","10000","0","","告诫新人不要买20w秘银和400w金币的火宝宝片，回坑最好也不要买，宝宝系统成长效率相当低，给的素材和以往的需求除了星石外完全无关，给新人造成的素材断层负担和体力负担也非常重"
"随神皆乐","保密","无IP","6936171","6","","10000","0","","[小电视_无语]熔岩帝王你怎么学会了黄道陨石"
"大雨永不停","女","无IP","1795655","6","","10000","0","","你游真是够抠门的，顶着一堆人掉线不回来打了半小时就给这点蚊子腿，wdnmd"
"难道你也是个音游人","保密","无IP","227706328","5","","10000","0","","组团不要紫莞，不要白练，不要快乐卡莲。(｀ω)"
"阳炎舞雪风","保密","无IP","22006721","6","星尘","10000","0","","卢克来个主c，3s升华套女王优先（错乱）"
"cominico","男","无IP","8199769","6","","10000","0","","还好我强袭肉，近身硬怼"
"你病得不轻","男","无IP","155160040","6","","10000","0","8","付出大于回报，奖励扣得要死，人偶养成成本巨高，玩不动了c( ￣д￣;)ノ"
"`狐-yea","保密","无IP","41264889","5","","10000","0","","奥拓呢？奥拓出来挨打！"
"提尔小比茨","保密","无IP","15334831","5","","10000","0","","我想嘴臭"
"短期素食","保密","无IP","171374177","6","实验品家庭","10000","0","","说实话，奖励有必要这么扣吗？真的是少的可怜好吗？你们缺这么点钱？打了半天给了啥？"
"霜","保密","无IP","135681462","5","原神","10000","0","","本人刚玩几个月，我发现巴比伦的囚徒6-13的紫方块炸不开，怎么办？剧情关卡在这了。"
"A_KBZ","男","无IP","13224421","6","崩坏3・天穹流星","10000","0","11","问一下，跨服好友怎么没了，还想和同学一起玩的呢(￣3￣)"
"小熊的奶黄包","男","无IP","10895471","6","","10000","0","","看看评论有几个是夸的。我刷了一路没发现一个。现在米忽悠就是不断用屎去试探玩家底线。"
"LuckyBlighter","保密","无IP","4103666","6","","10000","0","","视角难受的很"
"天汁地汁","女","无IP","13966058","6","","10000","0","","我怀疑当初设计游戏流程的人根本没玩过游戏，今天打boss简直了我的爹"
"-椎名ましろ-","保密","无IP","106271108","6","星座系列：摩羯座","10000","0","","什么时候才能变成开放世界？这小破图可玩性很高啊"
"欧欧欧冲冲冲","保密","无IP","19709225","6","鹿乃","10000","0","","打通1次花了1小时，两个傻子退了，退了也不知道拉人，打完奖励几个技能石，exm？"
"Fantasy丶K","保密","无IP","8018457","6","","10000","0","","DNF阿(   ` )σ"
"QingMo_XL","女","无IP","367772686","5","","10000","0","","我就来吐槽下，打着打着一堆人掉了，新的人基本都没进来，只能干看着别人打，嗯??"
"扣偌DIO哒","保密","无IP","31120107","6","","10000","0","","我 手 机 带 不 动！ ( _f｀)"
"里字玄","保密","无IP","205503533","5","","10000","0","","一人掉线，全队升天"
"爱心曲奇饼","女","无IP","40887819","6","","10000","0","","这点奖励真心是毫无兴趣，果然，最差的版本永远是下一个版本"
"丿林空丶饮鹿","保密","无IP","14326701","6","","10000","0","","心动女武神只能换一次能不能加个提示，要不就别加更换按钮，有病是吧"
"司机一脚油门没刹车","男","无IP","36010995","6","","10000","0","","懒得打，什么垃圾玩意"
"我丶的梦","保密","无IP","34040108","5","","10000","0","","敌人主要是队友，有些人不知道在干嘛！乱打（￣￣）"
"我丶的梦","保密","无IP","34040108","5","","10000","0","","不会打BOSS（￣￣）"
"雨泠离","男","无IP","93860604","6","","10000","0","","刚打完，很累，不想再打一遍"
"杪了","女","无IP","42586073","6","","10000","0","","妈的，打着打着就没人了，奖励还这么差"
"嘘一一不要说话","保密","无IP","10238873","6","","10000","0","","半个多小时打一次，就一点血犹大碎片，外加两个小绿珠子，还一周只能打一次，还有闪退风险，根本没有动力打"
"素锦流风","男","无IP","21029832","6","","10000","0","","打完半小时，然后发现除了手酸啥也没得"
"一只普通的黎爷","男","无IP","8867730","6","希萝Hiiro","10000","0","","真肝，而且遇到沙雕队友也挺烦[小电视_汗]"
"吴里曼","男","无IP","771747","6","明日方舟-愚夜密函","10000","0","","这次居然不是我们的中二大教主？"
"圈圈交叉","保密","无IP","184437200","6","","10000","0","","为什么就不能掉装备"
"橙子君wishes","男","无IP","85688178","6","","10000","0","","连买两个水晶号，怒抽不停，但是都没有出女王，同学一发入魂，对不起，是我卑微了，此生无缘抽卡游戏，休伯利安永别"
"手拿圣剑却不愿意透露姓名的法师","男","无IP","24774972","6","","10000","0","","绯红的技能可以无线放....."
"隔壁阿宅","保密","无IP","16241988","6","","10000","0","","请问新年全家福鼠标垫有到货的吗"
"凤凰夫君","保密","无IP","87467466","6","良辰美景・不问天","10000","0","","为什么不要用紫菀?"
"最喜欢姐姐大人了","保密","无IP","23430984","6","泠鸢yousa登门喜鹊","10000","0","","你们说的水晶，其实在你后面"
"无缘羁绊","保密","无IP","19555273","5","","10000","0","","团本劝退，蛋池骗氪"
"琉璃不染尘","男","无IP","34687340","5","2021拜年纪活动专属","10000","0","","我们两个队直接莽过去了，这个游戏过于真实了，怪物攻击什么的完全看不懂，直接靠aaaa大"
"Imipenem","保密","无IP","3866175","6","","10000","0","","等级限制快去掉吧，太没劲了，一周一打本来就人少，加个限制根本匹不到人。今天等了十分钟，直接三个队就开了，第三个队还不满员。,要是怕低等级玩家被排斥干脆就分区降难度吧，分组行动，就像当时打世界boss贝纳勒斯的时候一样。再再再不济球球你们把低级队去掉一个，真的体验极差。"
"逆鳞熵","男","无IP","303974311","6","","10000","0","","团本打吐了≥n≤这女儿放养了。"
"YZQSDBHYJ","男","无IP","1700128","6","","10000","0","","随机看脸福袋（1个）"
"果酱离歌JamLS","男","无IP","4563842","6","","10000","0","6","我只能说玩家间没有任何配合交流，这不叫打本，上次那个试验性的团本也没意思。靠着输出打死了，近战角色吃屎，我女王看着队友被污染"
"杰森storY","男","无IP","283783332","6","","10000","0","","今天我就4级啦～～～"
"3k院","保密","无IP","176961","6","","10000","0","","有个屁低等级玩家啊"
"REM0REM","保密","无IP","32353824","6","","10000","0","","看着就觉得麻烦"
"bnxvncc","男","无IP","11080549","6","","10000","0","","wdnmd,我带你们打"
"萌萌的圣骑吃米皮丶踢","女","无IP","51761245","5","","10000","0","","把等级限制解除，先把这点解决一下吧"
"白菜牧师","保密","无IP","223711452","5","","10000","0","","我的显卡。。。。。。。[小电视_发愁]我的内存[小电视_发愁]我的手机[小电视_发愁]"
"Deep_blue梦","保密","无IP","74228344","6","","10000","0","","打了半个小时就给了点蚊子腿，呵呵，再见"
"寒天9","男","无IP","43051297","6","","10000","0","","爱酱你能不能笑一笑，总是板着脸（头像）"
"errerer","保密","无IP","1428464","6","","10000","0","","收益有些太低了"
"月の银","保密","无IP","32862356","5","","10000","0","","打那个BOSS最好冰卡，特别无脑"
"九条明下班咯_Warming","保密","无IP","2414066","6","樱时祈愿","10000","0","","这个3.0版本为了劝退可谓是用心良苦"
"那三十二天","男","无IP","83159682","6","良辰美景・不问天","10000","0","","打一局打了一个小时，TM，玩个毛啊，手机电差点不够了"
"GuiltyNight","男","无IP","7916998","6","","10000","0","","那岂不是这个也要发展金团，飞机这些了"
"以身妄嫌","保密","无IP","92583056","6","","10000","0","","你们知道这个都没打吗 我还是今天早上更新后没多久去打的12个人的团 到最后7,个人在秀[小电视_发愁]"
"神舟不平板","保密","无IP","14626513","6","","10000","0","","天呐……又要换手机了"
"D_R_H","女","无IP","23929391","6","快把我哥带走","10000","0","","爱酱真可爱（*/＼*）"
"大耳朵Curio","保密","无IP","304234619","6","","10000","0","","打通一次闪退了两次……"
"岚中燃烧的生命","男","无IP","14536415","5","星座特典","10000","0","","周期长收益低也就算了，关键是有些二缺，打个水压不进光圈，到处闪避乱窜，打个boss用鬼铠，你80级是怎么升上去的，强烈建议加入踢人和队内语音，，本来三阶段打水压一起通，逼得我直接顶着60减伤强杀，气死我了"
"岚中燃烧的生命","男","无IP","14536415","5","星座特典","10000","0","","周期长收益低也就算了，关键是有些二缺，打个水压不进光圈，到处闪避乱窜，打个boss用鬼铠，你80级是怎么升上去的，强烈建议加入踢人和队内语音，，本来三阶段打水压一起通，逼得我直接顶着60减伤强杀，气死我了"
"京渊梓辛","男","无IP","37515426","6","碧蓝航线2020","10000","0","","体验感极差,已经退坑"
"十连九紫真君","保密","无IP","25321052","6","","10000","0","","奖励寒酸"
"某科学的观测者","保密","无IP","183359421","5","","10000","0","","水晶是什么？我打两次了"
"五更璃の彼氏","男","无IP","111389908","5","泰蕾莎","10000","0","","爱酱身份败露  是你墨小菊(￣△￣)"
"废柴师兄2","男","无IP","23311049","6","伍六七之玄武国篇","10000","0","","团本打了一个小时……"
"汤圆头哒","男","无IP","23213329","6","崩坏3・天穹流星","10000","0","","这。。崩坏3与勇士（￣￣）"
"王乾伯","男","无IP","31939361","6","乃琳","10000","0","","这个最后能抽到精准补给卡"
"我家贝蒂真可爱","保密","无IP","25750873","6","citrus","10000","0","","团本不要白练!挂机狗n**l[小电视_发愁]"
"一份烫烫烫的锟斤拷","保密","无IP","36207085","6","","10000","0","","打了一次以后绝对不会打了"
"の尼桑","男","无IP","39788079","6","","10000","0","13","努力有用的话，还要 绿四八 干嘛。"
"刘sing里gay轴","男","无IP","305203551","5","","10000","0","","低等级的人太少了"
"神马浮云爱情海","保密","无IP","37636324","6","","10000","0","","没人玩[2233娘_大笑]"
"Kiraboshi绮罗星","保密","无IP","372784089","6","","10000","0","","这副本奖励是什么啊"
"艾亚麻","男","无IP","8339699","5","","10000","0","","难打啊"
"这是个假John","男","无IP","11715162","6","","10000","0","","差个神恩开车啦！不要紫苑+++++++++"
"账号已注销","保密","无IP","27390739","0","","5000","0","","卢克压能量？？？超时空**台？？？？"
"SakuraW残月","男","无IP","18990301","6","","10000","0","","dnf团本都减负了，现在蹦蹦蹦还怎么肝，奖励又差"
"前不见后不见","男","无IP","10939845","5","","10000","0","","玩偶是巨坑，养不起"
"毁于丶一蛋","男","无IP","2350937","6","碧蓝之海","10000","0","11","团本体验好差啊。。如果不是为了完成活动任务，真的鹏都不想碰"
