"昵称","性别","IP","UID","等级","装扮","用户权重","获赞数","粉丝团等级","评论"
"千y叶","保密","无IP","68141887","5","","10000","2","","特么宝服根本匹配不到6个75等级以上的"
"ocho-dias","保密","无IP","77824408","6","","10000","2","","水晶都没有打你m呢"
"我口口剑呢","保密","无IP","4416291","6","明日方舟音律系列","10000","2","","这BOSS是为了推月魂的吧  四层BOSS 月魂不走位单手指操作直接砍死有2个队友的话BOSS一分半解决中间能打出的攻击都不超10次 真的是控到死"
"RC099","男","无IP","98820547","6","","10000","2","","其实我真想打这个，可是一直匹配不上。。。"
"星轮逆转","男","无IP","20110740","6","原神","10000","2","9","提升了奖励那是那么点奖励  所以没人愿意打 排不到人"
"稀茜草","男","无IP","164734365","6","秘林沉蝶","10000","2","","打过一次就不想打第二次了，一次打将近一个小时"
"胖虫33","男","无IP","364296","6","","10000","2","","东西不值钱，不肯发放，还卖的死贵。"
"沐月沫白","男","无IP","22496163","6","","10000","2","","视角是真的难受，玩个炎八，看不清连招，连自己都不知道在哪，全凭无脑aaaaaa."
"水原一之|","保密","无IP","280447990","5","","10000","2","","手机都可以煎蛋了，奖励还就那么点？"
"弗里德里克泰勒","保密","无IP","172501492","6","珈乐Carol","10000","2","1","奖励好低啊"
"不准偷吃我的小饼干b","保密","无IP","16617113","6","","10000","2","","我说话比较直     拉吉副本        打了一个多小时给点狗屎"
"杨家小","保密","无IP","350576499","5","","10000","2","","匹配了2个小时还没匹配到8人"
"高达头发的个","保密","无IP","2310911","6","崩坏3・天穹流星","10000","2","10","我寻思隔壁团本还能翻出毕业武器呢，这牌子出的都是些啥？[小电视_无语]"
"C君今天直播了吗","保密","无IP","37296471","5","","10000","2","","【游戏已经更新数据  请重新启动】"
"咸菜萝卜煲","男","无IP","9179661","6","","10000","2","","垃圾团本，这玩意有存在的意义？"
"褪色的梦_","保密","无IP","10757666","6","","10000","2","","啥时候崩坏3能玩狼人杀"
"勇敢的氰化钾","保密","无IP","76056091","6","","10000","2","","赶紧出个调查问卷让玩家发泄一下吧【小电视_好怒啊】"
"学肘","男","无IP","31944178","6","","10000","2","","辣鸡模式，连续打半小时给几颗绿豆，呵呵"
"希尔婪棋","女","无IP","10938446","6","","10000","2","","没有人感觉"
"想个办法吃你家大米","保密","无IP","33939725","6","","10000","2","","策划可以下锅了[蛆音娘_扶额]"
"荡涤诸恶の云仙","保密","无IP","155625152","6","","10000","2","1","不，各位，找到水晶也没用，因为你看见了距离你会认为还不如打多一些输出（我看着很远，不知道是不是视角问题，都是在边缘的跑过去都要多久）"
"花の华生","男","无IP","4613332","6","","10000","2","","z? 如何评价最后翻牌那个离开的团员拿了精确补给卡 反而我们一群活人全是碎片[2233娘_怒]"
"挖矿叶","保密","无IP","20621165","6","希萝Hiiro","10000","2","","不想说，这种团本最累了，打一次就不想打第二次"
"BILIBILImikun","保密","无IP","2805682","6","","10000","2","","把等级限制关了吧。。。人不够都开不了车。。。"
"北岸殒殁","男","无IP","3323515","6","","10000","2","7","卡成ppt，告辞了[小电视_嘟嘴]"
"紫罗兰的永恒妹妹","男","无IP","52993437","6","向晚大魔王","10000","2","","副本我觉得还行，就是这奖励我佛了，25分钟给三个绿豆子，你干脆不要给了"
"、胱","保密","无IP","23016368","6","","10000","2","","这个团本开来干什么？匹配不到80以下的人，玩nm？"
"Mr丨Sun","保密","无IP","2565897","6","","10000","2","","新出的人偶和这副本都挺搞笑的，逼着人肝？"
"迷路修女德丽莎","女","无IP","5793436","6","","10000","2","","奖励真抠，什么破玩意奖励。团本新意不错，还能再扣点吗一周翻一次牌好我忍了，重复第二遍带团员。给的都是什么玩意？"
"KIZUNAAIeR","男","无IP","97932106","5","","10000","2","","前文明留下的爱包菜岂不是要比德莉莎年龄更大？今天还在天命总部抱怨那些说德莉莎第一可爱 的人不知道岁数，不过现在看来世界第一可爱的爱酱更年长一些哦  (　) "
"一只辣鸡的音游狗","男","无IP","159181250","5","","10000","2","","这辣鸡团本最大的问题就是根本匹配不到等级低的玩家"
"尘世彼岸花","保密","无IP","108851973","6","","10000","2","8","我根本不知道boss咋死的[小电视_发愁]冰卡一直aaaaaaa，然后就打完了。什么机制之类的完全不了解[小电视_害羞]"
"鹏豆","男","无IP","4634720","6","碧蓝航线2020","10000","2","","看见那么多骂米忽悠的我就放心了"
"无ID的可怜人","男","无IP","2839107","6","","10000","2","","整个活动洋溢着s b的气息，什么j 8玩意儿？从玩法到奖励，你tm策划有脑子？"
"智威大表哥","男","无IP","35236018","6","","10000","2","","其实有个好手机也很重要，卡成鬼( _f｀)"
"sama最可爱的说","男","无IP","252459785","6","","10000","2","","在？150使命值反优化不解决？"
"卡池不沉船","男","无IP","48223554","5","","10000","2","","那啥，你们有没有考虑到你们游戏里最缺的就是不到80级的玩家啊"
"萨勒妮R芬妮一半","保密","无IP","401809604","5","","10000","2","","我们今天八个人一起打着怪都快死了，突然给我们来一个数据已经更新，妈的重登时候连个屁都没有"
"风雪奇迹","男","无IP","109644686","6","","10000","2","4","打团一打就是差不多一个小时，中途退出会很麻烦，匹配人也很麻烦，给的东西又这么少，等热度过去了谁会打。"
"遇到困y摆大","男","无IP","15719262","6","赏樱大会欧皇","10000","2","","团本我贡献最高 然后开了6个碎片？？？？？打你"
"烨枫","男","无IP","52869614","5","","10000","2","","现在80级的一大把，74级的是珍惜物种(￣△￣)"
"这次起个长点的名字","保密","无IP","85594561","6","","10000","2","","6=2，都懂[2233娘_无言]"
"有故事有酒的喵","男","无IP","65179048","6","","10000","2","","6条80级的咸鱼等70以下的大佬，CH真尼玛垃圾，SB"
"20岁了还没去过洗脚城","男","无IP","9204746","6","","10000","2","","等十几分钟心态爆炸，本来六个人完全可以轻松过的，却要等那两个七十四级以下的，恶心，屑策划，真是鬼才设计呢呵呵，你游有多少新玩家没点B数？"
"账号已注销210217","保密","无IP","14417251","6","","10000","2","","多多配音？？[小电视_吃惊]"
"深海恋人-斯卡蒂","男","无IP","28542778","5","","10000","2","","ch是跟米忽悠有仇么？这么往死里整，美工爸爸都快救不了你们了[2233娘_喝水]"
"恩雅official","男","无IP","16415599","6","","10000","2","5","道理我都懂，你们能不能把55-74的等级限制改了？这游戏有几个新人你们心里没点b数吗，我匹配了半个多小时都没人进3，4梯队。回舰团群里拉人，得，全体80的裹技[小电视_嘟嘴]"
"鹏豆","男","无IP","4634720","6","碧蓝航线2020","10000","2","","停氪弃坑，策划滚!"
"R94真宵","男","无IP","32621010","6","雪未来","10000","2","","奖励是什么东西，打发叫花子[2233娘_大笑]"
"诸神的黄昏SSS","男","无IP","16797369","6","碧蓝航线","10000","2","","奖励真的是过于辣鸡了，我打了分钟就得了3个那个半绿球那个玩意，我还以为那里搞错了←_←"
"内蒙古大学碧蓝","保密","无IP","51024402","6","","10000","2","","前几天说鬼泣抄崩3，现在这团本一出，过几天就该轮到dnf抄崩3了吧，毕竟崩3是原创的，中国的业~界~希~望~啊(￣△￣)"
"污海的划水之策","男","无IP","63957221","6","","10000","2","","我tm一个团长，两个队员退出，我一个人进不了关，看着二三四队打完[小电视_无语]"
"目标黑铁IV","保密","无IP","262338538","6","三周年恋曲","10000","2","","小八：舰长副本零掉落，舰长补给全保底"
"珍贵的时间啊","男","无IP","11877050","6","","10000","2","","道理我都懂，低级组根本没人啊！！！"
"Aurorari","男","无IP","236060362","6","","10000","2","","求求你了，修修bug吧，刷个碎片没有再来一次就算了，就连我自己退出去都会显示错误，每日每周改版改的什么玩意？强行提高在线时长？每天的150原本还比较好做，现在扣扣搜搜才有可能做完每日，甚至如果不用水晶换就没办法做完，有意思吗？干脆让普通玩家全部滚蛋好不好，学别人的团本行，学学别人的奖励行不？别人的团本是出产顶级装备防具的地方，你这团本给点星石，给几个绿豆完了？"
"阿尔贡石油","男","无IP","493230","6","","10000","2","10","下午打了一轮。,前两组80级老咸鱼瞬间组满，后两组中级组等了10多分钟才满 …… (s°口°)s(┴―┴"
"白井黑子ご","女","无IP","66312542","6","","10000","2","","副本投入与回报的比例，呵呵，活动2000体力450水。我宁愿罐子留着买个月卡。ch一年比一年牛批。我寻思着你人偶系统比养个老婆都能吃。作用呢？花里胡哨的有用？螃蟹一撞就飞地图外，测试服测试的bug呢？没有，要不你游把测试服当正式服用吧，反正你测试服也没bug。次次活动出问题，闹呢？"
"穿靴子的懒猫","男","无IP","16776065","6","","10000","2","","蚊子腿也是肉，可**这团本连蚊子腿都算不上吧，30分钟打下来，给了几个半球的绿片，用星石换，还没有3000，服了侧滑真的会玩,而且每周的碎片还给砍了，侧滑这就是米式优化吗？"
"飒爽叔","男","无IP","8102031","6","hanser","10000","2","7","等月卡领完我就退坑这游戏。。。。,,,去年5月我就这么说过"
"hoolin胡林","男","无IP","22429567","6","初音未来13周年","10000","2","","超大的组队，学生党越来越活不下了，直播兑换码不可以放松有点吗？"
"尕兔崽子","男","无IP","21498711","6","","10000","2","","真是服，打半个小时给了6个绿豆子。。。活动材料关1分钟给俩。活动策划是飘了吧[蛆音娘_扶额]"
"YL_178","男","无IP","34062073","6","","10000","2","","不会更新就不要更新学别人DNF更新个团本奖励还这么少，哦，是崩坏3啊，那没事了"
"隔壁大宝剑","保密","无IP","31010765","6","崩坏：星穹铁道","10000","2","","策划买菜必涨价"
"Dr风夏","男","无IP","223282566","6","2021拜年纪活动专属","10000","2","","正式服玩成测试服的感觉真睿智"
"画技拙劣reyousia","男","无IP","6422932","6","","10000","2","","希儿圣痕get，团本退出[小电视_笑]"
"一千繁花","男","无IP","45065996","6","","10000","2","","坑爹玩意，提前预订3.0版本最垃圾活动"
"渺青","男","无IP","8292634","6","","10000","2","","人家dnf至少有保底材料+卡片+毕业装备。。。。我觉着你这得改成。。。概率爆五星地图装，概率爆崩坏结晶，然后给的材料能自选升人偶的，或者黑白核，增幅核心也行啊"
"海c老人","男","无IP","336449333","6","","10000","2","","那个狗屎视角真是恶心死我了[小电视_差评]"
"千羽学园首席骑士","保密","无IP","352123544","6","","10000","2","","流程太长，过于消耗（真实世界的）体力，打着很累。另外看不到队友血条无法提前安排救援。"
"嘲笑の微笑","保密","无IP","166219","6","","10000","2","","为什么现在的游戏要强迫我和其他玩家交流合作呢。。。我只想当个单机玩收集老婆这么难的?"
"参加2017MFM的冰封蓝天","男","无IP","18333174","6","崩坏3・天穹流星","10000","2","14","2队4人莽过"
"殇远方","保密","无IP","50524047","6","","10000","2","","玩法没意思可以理解 毕竟很难弄出什么特别有趣的机制，可是给的东西又少又鸡肋，时间还长，我都在把它当收集游戏玩了，你能别让我那么肝么  还把每周活跃和每日分开 本来如果有天有事还可以那周活跃凑一下 现在真的是每天都得肝  而且新的每日任务都啥玩意  两次驱魔 五层深渊 真的是  强行要我每天都肝？"
"路过的傻猫猫","保密","无IP","23136675","6","","10000","2","","排不到人啊，而且奖励列表看着就没动力，团本是让你给有正常掉落的东西？"
"傲尚●肺","保密","无IP","32302841","5","公主连结可可萝","10000","2","","全员卡掉三次，卡着卡着有人炸了没人了"
"丶未始已末","男","无IP","836726","6","","10000","2","9","30分钟左右 嗯 2个绿碎片 真实 什么任务还要再打两遍？？？ 是在下输了,还有人偶系统 ,3.0果然厉害"
"立华奏最爱我了","男","无IP","11221934","6","","10000","2","6","很多人觉得少是因为数字小，但实际上总价值是挺高的，因为人偶相关的东西定价就比较高，比如仿犹大碎片价格是a人物碎片的两倍。"
"屎尿屁-烟火气","男","无IP","9995880","6","","10000","2","","各种恶心人，不知道你游测试服在测蛇皮…玩家的反馈就是个笑话"
"伏特加の梦","保密","无IP","24505821","6","格兰芬多","10000","2","","萝（莎）莉（娅）：不要把我当小孩 我体内可是有一只崩坏兽,德莉莎：呀嘞呀嘞，是相同类型的设定呢"
"-灵冰-","男","无IP","34083590","6","洛天依8th生日纪念","10000","2","1","反正活动浪费时间就算了，奖励还差，感觉还不如以前的世界boss爽[小电视_无语]"
"鸢一饕餮","女","无IP","23228416","6","","10000","2","","团本通关重点：找个大佬，然后在减压关躺好"
"久望九万","保密","无IP","10060842","6","","10000","2","","普通家庭马化腾，不知妻美刘强东；,悔创阿里杰克马，北大还行撒贝宁；,免费宠物米哈游！"
"樱花凋零之刻","男","无IP","12312362","6","2233十一周年纪念","10000","2","","弄个千分之一掉落的  团本专属 强度一线的武器"
"High_PIN_Warrior","保密","无IP","25960398","6","","10000","2","","我突然想到一个问题，你个包菜老是叫我“舰长”，然后我有一个船,所以这个船目前除了当战地出租车以外还能干啥？[2233娘_无言],还有，我是咋当上舰长的？还是说我的名字就是“舰长”？[蛆音娘_哭泣]"
"基金会scp166","保密","无IP","34045406","6","","10000","2","","还有居然不能踢人，两个人在那里划水居然不能踢，气死我了"
"诸葛猛夫","男","无IP","106942332","6","乙女音","10000","2","","白练姐，团满了(5/12)"
"欧德马克","男","无IP","19099858","6","","10000","2","","通关一次半小时，得到两个半块的绿石，wtf？？？"
"精神病好转","男","无IP","31550","6","","10000","2","","屎丢在地里面都能肥田  你这个团本能干啥    首先匹配不到人 然后  打完给几个绿珠子 真尼玛睿智 985CH"
"时有小雨丶","保密","无IP","8858858","6","","10000","2","","别你们还能进去打 我匹配永远都是6个80级大佬等CD组的人"
"梦想之翼-伴我行","保密","无IP","29865421","6","三周年恋曲","10000","2","","其实我更期待今年的崩坏剧场版"
"StarLightBreake","男","无IP","4297568","6","","10000","2","","看了之后觉得，唉这不就是个端游吗，搞什么手游啊靠[小电视_害羞]"
"无畏澡8强","男","无IP","7452553","6","","10000","2","","毒奶粉玩家表示……安图恩以上线，下一个团本会不会是卢克超时空鸟背漩涡[2233娘_卖萌]"
"她说她喜欢男人","保密","无IP","5547574","6","","10000","2","","求求你们把最低开始人数降低到6人吧！这游戏还有55-74级的人嘛？换了4个团都是6=2"
"北方栖姬","保密","无IP","15094774","6","","10000","2","","碰见bug，这大海怪蓝条才走了10%然后即死了ε=ε=(ノRQ)ノ"
"逗比的马铃薯","男","无IP","13944985","6","~るる","10000","2","","哪来的人，史派克滚出崩坏三"
"帅睿帅","男","无IP","14592499","6","","10000","2","9","啥都不说，吹爆米哈游美工[小电视_笑]"
"奶龙","男","无IP","80313","6","","10000","2","","爱酱和丽塔是同一个声优"
"二二两两","保密","无IP","121104098","6","战双帕弥什","10000","2","","特拉洛克：你们氪的金，全氪在我身上啦。看我不锤爆你们狗头[洛天依_滑稽]"
"MHZJX","保密","无IP","11331435","6","","10000","2","","低级根本看不到人的不可能只有我一个吧??"
"千人律者编号9527","保密","无IP","5739401","6","#EveOneCat","10000","2","","然而我依然卡在电梯"
"问就是打不过","保密","无IP","97205780","5","","10000","2","","丽塔，别以为我不知道是你绑架了爱酱，然后换成包菜头的声音当解说嘟嘴"
"雪之下团子","男","无IP","31012587","6","","10000","2","","团本体验极差。[2233娘_吐魂]"
"生吃丽塔","女","无IP","29106806","6","原神","10000","2","","一人掉线，全队上天[2233娘_郁闷]"
"深渊の帕瓦","男","无IP","34259950","6","","10000","2","","丽塔，别以为我不知道是你绑架了爱酱，然后换成包菜头的声音当解说[小电视_嘟嘴]"
"追凯特的人","男","无IP","15197574","6","春原庄的管理人小姐","10000","2","6","爱酱快百万粉丝了，蓝蓝的，闪闪的会不会来一点呢？[小电视_害羞]"
"阿卡姆巴","保密","无IP","45253696","6","","10000","2","","最后一关卡视角真的恶心"
"我必须驾驶EVA","男","重庆","4662303","6","","10000","2","11","看到这个视频，回忆涌现[笑哭]"
"转生成为魔剑使","男","无IP","44925908","6","","10000","1","","这模式没人玩都，要不模仿一下DNF的团本，虽说现在DNF团本也落后了"
"一根紫烟即极乐升天","男","无IP","154256783","6","","10000","1","","3,2,1上！嗜血什么的加起来，（五分钟后）boss放大招了！分散，好了赶快远离bossAOE技能！我去，T怎么倒了？灭了，灭了。等等，不好意思走错了"
"凌依华霄","保密","无IP","5536399","6","","10000","1","","水压越高，怪物越骚"
"喵喵姐的沐泽","男","无IP","395172828","6","2021拜年纪活动专属","10000","1","","海渊之眼完全匹配不到75级以上"
"羽飘林","男","无IP","66755708","5","BML2020暗黑版","10000","1","","DNF刚脱坑，崩崩崩又来了[2233娘_汗]"
"羽飘林","男","无IP","66755708","5","BML2020暗黑版","10000","1","","DNF乌龟？"
"如果不是吃荔枝丶","保密","无IP","244915618","6","星座系列：双鱼座","10000","1","","没啥人打 匹配不到人  奖励也是太少"
"城哥侃侃乐","保密","无IP","8178337","6","三周年恋曲","10000","1","","压能量就行了"
"Zhanglaodge_Zhu","保密","无IP","230137553","6","","10000","1","","这个团队挑战除了场景好看bgm好听没什么优点了( _f｀)冲着场景和bgm来的"
"摆烂的周欣晨","保密","无IP","159429328","6","崩坏：星穹铁道","10000","1","3","等等，攻略需要技巧？我都是硬肛过去的……"
"d小糖、水水","保密","无IP","902835","6","","10000","1","","团本我真是服了！！"
"鲤生梦","保密","无IP","8962752","5","","10000","1","","强烈建议狗侧滑加入深渊嗷  闪光掉点联机币嗷铁汁"
"米忽悠TM真该死啊","保密","无IP","93876605","6","洛天依9th生日纪念","10000","1","","其他的我就不说了，因为我根本没凑全过人(s°口°)s(┴―┴"
"绅士哥丶Coin","男","无IP","16660275","6","星座系列：天秤座","10000","1","","psn那个开发的怎么样了 今年玩的到吗。。"
"chqi12345678","男","无IP","10854855","5","","10000","1","","反正我划水出精准卡了"
"蜜内欧","保密","无IP","267848489","5","","10000","1","","不是我说嗷...你这点碎片加100水晶每周都会有人去打 100水晶一周保底就真的很过分？就现在这奖励打发叫花子你凭啥觉得玩家会来测试你这个坑爹玩意"
"好喝的过氧化氢","男","无IP","1745137","6","","10000","1","","这么点奖励谁打？当年安图恩那么多人玩不就是能出毕业的荒古和无尽？"
"爱吃柠檬的灯泡","男","无IP","4754847","6","","10000","1","","我感觉打是好打的  就是奖励太抠了[小电视_发愁]"
"大寄一场1","男","无IP","298046404","6","崩坏3・天穹流星","10000","1","","为毛连人都匹不到的"
"林鱿鱼萌萌哒","保密","无IP","9856392","5","","10000","1","","人凑不齐啊…休闲玩家根本玩不了…"
"幻视彩虹","保密","无IP","310267550","6","EveOneCat2","10000","1","3","最后一关的视角，，，哪有水晶啊我怎么看不到啊"
"逆天改命苍小玄","保密","无IP","18017850","6","","10000","1","11","[小电视_差评][小电视_差评][小电视_差评][小电视_差评]垃圾。呵呵，还有人举报，再来啊[小电视_差评]"
"咸菜萝卜煲","男","无IP","9179661","6","","10000","1","","策划滚出来道歉！wcn****！"
"浅唱小忧伤","男","无IP","105526560","5","","10000","1","","这个boss看得有点像鬼泣5里的。。。2333"
"失眠的雨","女","无IP","22027449","5","","10000","1","","你这团本也不咋地啊，关卡内又卡视角又差，打着打着人还没了。打了差不多一个小时，好不容易打完了就给几个破烂作奖励。"
"独言善断","保密","无IP","46036735","5","","10000","1","","6人跨服聊天室"
"恰葱到汝心","男","无IP","382438820","6","","10000","1","","如果十二个人在同一个地图就好玩了，还有为什么不出个对战模式？,比如1V1，2V2，4V4"
"白之月下人","男","无IP","14839192","6","格兰芬多","10000","1","","这东西关了就别再开了，浪费我流量。而且如果奖励没提升，就算修复了bug也依旧没人会玩。"
"小丿苏","保密","无IP","279045761","6","2233幻星集","10000","1","","这游戏新老玩家比例啥样心里没数？一堆80级老咸鱼进进出出一个钟头小号一个没有，打个锤子！"
"仙人猎手_","男","无IP","11940464","6","","10000","1","","大伟哥求求你百忙之中看一眼3崩子，让策划做个人吧，80级老玩家都感受到这波大更的劝退威力了[2233娘_吐魂]"
"比利发卡","保密","无IP","14748605","6","汉化日记","10000","1","","一把打一个小时，全是bug各种卡和进不去，打到第三阶段基本就剩一半人了，第四阶段连最低人数都不满足了全散了，打个锤子"
"CarsonWang_","男","无IP","191063606","6","泠鸢yousa","10000","1","","团本体验极差 打出来的东西没啥用  而且我昨天第一次玩 三轮后队里退了两个 我一个人还不能继续只能在界面待命 这是什么鬼设计  我到现在也没看见boss长啥样"
"Anpina","男","无IP","14964089","6","春原庄的管理人小姐","10000","1","2","不能学学CS：GO吗，有人退出了就自动补新匹配的玩家进来，不然怎么打..."
"李-恩菲尔德","保密","无IP","3999327","6","","10000","1","","10个人，有一个人是自己一队，这个时候能开始游戏，然后进图至少两个人。,单人那队的人：？？？"
"skykaddish","保密","无IP","908317","6","","10000","1","","匹配问题大，策划错估不同阶层玩家分布。奖励蚊子腿，打大半小时掉落不如日常关，谁还愿意去打？策划要这么抠门就别指望有什么好的活动反馈了，好好up你的空律去凑KPI吧，反正大老板也不关心玩家体验[小电视_差评]"
"hln天下第一","保密","无IP","24081211","6","","10000","1","","好歹团本你奖励多点啊[小电视_发愁]  打起来完全没啥动力"
"-SP24WR","男","无IP","6548965","6","碧蓝航线2020","10000","1","","这辣鸡模式又~~~长~~~又~~~臭~~~收益还贼低。进来前看到作战指南的标题，还以为能学到游戏里没有提示的窍门，然而还是和游戏里一样“降水压”就没了，真是浪费时间。"
"巴奥-萨基路加","男","无IP","821498","6","EveOneCat2","10000","1","","策划这么扣，上厕所肯定是把一格的厕纸分两半来擦[小电视_差评]"
"yoohannx","保密","无IP","23956651","6","","10000","1","","作为未知的崩坏兽异种，特拉洛克有着极强的破坏力（指可以操控玩家的视角怎么别扭怎么来"
"纯水无色","男","无IP","8271983","6","","10000","1","","根本匹不到75以下的人怎么说"
"星茶_冻","保密","无IP","11870924","6","茶啊二中","10000","1","","奖励垃圾，bug多，时间长，视角鸡肋。要么半天没人进来，要么突然加了一堆人，团长掉线还直接退出减次数(-_-#)要不是为了希儿礼装谁会去打这么恶心的团本啊(s°口°)s(┴―┴一个星期就一个福袋翻出来的奖励简直气死人好吗"
"末雪凌霜-","保密","无IP","4000102","6","","10000","1","","丽塔，别装了，快把你头上的包菜拿下来[小电视_笑]"
"注册一级炼金术师","男","无IP","3055573","6","","10000","1","","我玩了半天完全没搞懂。我要打谁？我在哪？我要做什么？有什么收益？"
"天天黑","男","无IP","1617032","6","","10000","1","","我他妈锤了一个钟头，12把九把全队第一，为啥我们队队长结算还排我前面？？？排第四你就给两个绿豆？？？疯了吧"
