"昵称","性别","IP","UID","等级","装扮","用户权重","获赞数","粉丝团等级","评论"
"天御之狐","保密","无IP","18539015","6","2233・群星闪耀时・双子座头像框","10000","5790","","大伟哥家的别墅又变大了(；ω；`)"
"~月A","保密","无IP","13592255","6","","10000","3324","","请大家多多支持崩坏3rd，bug什么的，60水晶大家当无事发生"
"月下我的老婆","保密","无IP","15765317","6","","10000","2681","","姬子第一版的跑步动作  有人说抄袭尼尔的我服了"
"昔年似风","保密","无IP","24086423","4","","10000","1605","","1.1姬子才不到2w播放量，1.4八重樱版本现在快到10w了( _f｀)"
"野中周处","保密","无IP","422652268","6","三周年恋曲","10000","1329","11","哎，看看以前pv的播放量，可能还有不少考古最近加上去的，现在pv都能100w了，想想真是唏嘘。开服玩家，只退过两次，一次手机问题，一次学校问题，3年多了，我还未放弃，以后也不会，除非崩3关服[微笑]"
"terraik","男","无IP","305860703","5","","10000","1167","","姬子，您好 ，您当年的学生现在全是律者了。您对此有何感想？[妙啊]"
"愿你健康平安","保密","无IP","161272098","6","崩坏3・天穹流星","10000","867","11","说个题外话，考古队们能不能在评论区考古？弹幕多了后会把以前的弹幕给顶替了，而且满屏的考古也着实影响观感[撇嘴]或许大家只是想表示自己热爱着这个游戏（其实对我而言三崩子不仅仅只是个游戏），但这种「爱」带来的破坏也不小噢！[tv_流汗],虽然我这么一条评论作不了太大改变，但我还是希望后来的观众们能稍稍留意下，给弹幕一个好的环境，而且大量无意义弹幕也是占用资源[拥抱]"
"哩鲤狸理","男","无IP","100885745","6","","10000","1022","7","什么姬轩辕，明明是姬麟"
"とある中二の乙女","女","无IP","20658683","6","阴阳师海国之境","10000","66","","谁当时能想到 米哈游编剧藏了多少刀呢[藏狐][藏狐][藏狐]"
"我才是xxxx","保密","无IP","26411822","5","","10000","187","","挖坟，这个时代的疾风强无敌啊啊啊啊啊( _f｀)"
"苏玛_","男","无IP","6071259","6","","10000","421","","这游戏真垃圾 谁充钱谁是狗 汪"
"颖龙玉","保密","无IP","18919542","6","","10000","297","6","这就我们老玩家开始的地方，当年80万老玩家现在还剩下多少。"
"东方_丈助","男","无IP","55780716","6","崩坏3・天穹流星","10000","236","","3年过去了，一个能打的都没有，就连侧滑都能吊打友商"
"绯红の樱幻","男","无IP","35047805","6","良辰美景・不问天","10000","135","5","为薪炎之律者诞生前来考古[大哭][大哭]"
"犹美利卡","男","无IP","76410565","6","","10000","113","","版本初都是红发大剑，快进到四年后卢老爷弟中弟[doge]"
"异世界魔法太落后","保密","无IP","66024558","6","","10000","57","","1.0入坑，中间几番进退，还是留了下来"
"Mikamikari","女","无IP","28455198","6","","10000","32","","姬子温柔地注视着你，不再言语。"
"咱就是传说的说","保密","无IP","12491579","6","初音未来13周年","10000","72","10","以此烈火，斩无不断。生生不息，薪火相传！！！[大哭][大哭][大哭]"
"东方烨","女","无IP","66956936","6","","10000","68","","忽然怀念起最初玩崩3的自己，可以泡在舰团探索一整天，在八重村把每一处都探索遍，白练绯红一样玩的很开心，没有战场排名困扰不用烦心深渊保级，从来不在乎角色强度也不去刻意搭配装备阵容。,无论怎样，那样的日子总归是一去不复返了。"
"野生凶恶归归子","保密","湖南","406498014","5","","10000","51","","“当一个故事要结束的时候，我们总会想起它的开始”[保卫萝卜_哭哭][保卫萝卜_哭哭][保卫萝卜_哭哭]"
"幽飘飘","女","山东","351187525","5","大王不高兴","10000","16","4","23年前来了，姬子阿姐你的学生们都已经成为了优秀的人，虽然策划和美工拉胯，但这并不影响你们的生辉。"
"请叫我se影师","保密","无IP","349664806","6","崩坏3・天穹流星","10000","62","3","好家伙5.9版本pv下面推荐1.1[笑哭]"
"Sangmi_不可食用","男","河南","386462452","6","原神","10000","24","","“当一个故事要结束的时候，我们总会想起它的开始”"
"请问是警察吗","男","无IP","23810539","6","","10000","53","","突然刷到这个，有点感慨,以前就傻傻的拿着几个角色简简单单的玩，不去管强度，更不用管ch，很快乐,现在已经找不到入坑那段时间的感觉了,唉 :-("
"折纸的小猫猫","男","无IP","353750813","5","","10000","25","5","我不出薪炎之律者没关系，但是给我点赞的必须一发出[doge][吃瓜]"
"万俟sauce","保密","无IP","123322731","6","星座系列：天蝎座","10000","40","","识律时代前来考古"
"此生只爱八重樱","女","无IP","413120114","5","崩坏3・天穹流星","10000","41","","愿薪火相传，美德不灭！,为世界所有美好而战！,我很喜欢崩坏三！,我爱这个故事！,我是舰长！,我确定！,[崩坏3_干杯][崩坏3_干杯][崩坏3_干杯]"
"寒冬的花","保密","无IP","57645445","6","星座系列：白羊座","10000","18","6","蚩尤关了，回来看看( _f｀)"
"laiciffo奈七S神","男","河北","275676274","5","希萝Hiiro","10000","18","","偷箱子时代前来考古"
"惠えりこ理子","保密","无IP","50993059","6","初音未来13周年","10000","33","7","来剧透:奥托成功救下了卡莲，和卡莲过上了幸福快乐的生活。阿姐兑现了和琪亚娜的诺言，天命最强女武神是琪亚娜"
"潇澜_非气大爆发ver","保密","黑龙江","149062265","5","RO姬头像挂件","10000","23","9","爱酱的预告下面为什么会有这个[崩坏3・光辉矢愿_彩虹水枪]"
"赛尔寄划","男","无IP","289097561","5","不思议之旅","10000","45","","呆鹅是真琪时代考古[doge]"
"童心Ace","保密","无IP","37520577","6","","10000","17","","5年过去了，薪火传承！"
"Abao秦白玖","保密","无IP","284108374","6","崩坏：星穹铁道","10000","19","","好家伙突然推送了这个[笑哭]"
"abcde-aiueo","保密","无IP","200277169","5","","10000","23","","崩坏三一直没有变，变的只有越来越恶劣的玩家群体和被搅浑的社区环境"
"坡坡上的汤圆七七","男","重庆","362804812","5","我是江小白","10000","27","","爱酱下面为什么会是这个宣传pv[脱单doge]"
"abcde-aiueo","保密","无IP","200277169","5","","10000","25","","这个游戏，我会继续玩下去的。相信和我一样想法的舰长有很多，我们会陪伴崩崩崩和女武神们一路到底。,为所有的美好而战，这不是一句空话。"
"森林一天长不出","女","无IP","8079689","6","","10000","21","","这游戏的前期剧情是怎么穿起来的啊，我是原神玩家，单纯的看薪火相传看哭了TnT想来找我之前的pv……但是我发现看不太懂[笑哭]"
"O7FE0","保密","无IP","80694310","6","","10000","16","3","考古，外传已关（￣へ￣）"
"我好喜欢涩涩啊","男","湖南","512409755","5","","10000","26","","我能坚持玩下去不是因为这个b游戏，是那个叫琪亚娜卡斯兰娜的女孩，她们的故事吸引着我"
"蜂蜜鱼籽酱","保密","无IP","32808557","5","干物妹！小埋","10000","20","","突然出现在推荐里"
"远星_star","女","无IP","442170235","5","","10000","24","","有没有刷薪炎然后进来的[doge]"
"神勇の豪","男","广西","35916898","6","2233幻星集","10000","19","3","为什么要打开按时间排序[doge]"
"在下永远喜欢Elysia","保密","湖北","629496303","5","春原庄的管理人小姐","10000","24","9","emmm从宇宙t人大爱衣过来，吃我洛阳铲[hanser动物套装_打压]"
"痴爱小祈","男","无IP","503053507","5","","10000","19","","那时候，天真的舰长们还不知道崩三的刀有多狠"
"Die-Walkvre","男","无IP","353272054","5","原神","10000","15","","你们都在喊姬子，有谁还记得被丢在蚩尤那里的杏"
"说得好但是","保密","无IP","27163940","5","","10000","10","","考古，有些英桀已经寄了"
"想和芽衣队长谈恋爱","女","无IP","208697611","6","","10000","15","","给我推了这个，进来看看[崩坏3_七][崩坏3_刀]"
"蛋蛋满堂0_o","保密","无IP","2319500","6","究极缝合乙女奇美拉","10000","14","","说好实话，姬子压根打不到人←_←"
"Mmmm曼曼","保密","无IP","15883204","6","","10000","21","","姬子:我的大刀早已饥渴难耐了。"
"Akie熙言","保密","无IP","38287161","6","原神","10000","13","11","以此烈火，斩无不断！"
"成分复杂的批发商","保密","无IP","76859084","5","","10000","13","","薪火相传，生生不息"
"kkoo2012","男","无IP","12034841","6","hanser","10000","13","9","以此烈火，斩无不断！"
"可以c不必","保密","无IP","13178985","6","","10000","13","2","是谁把这个帖子挖上了首页啊"
"议月","保密","无IP","33808372","6","刀说异数","10000","19","","给策划烧元宝"
"雪碧兑果粒橙","男","无IP","110870109","6","hanser","10000","19","1","原神：哥，咱家有钱了,[大哭]当年的播放量  这么少嘛"
"将一切鏖杀殆尽","保密","广东","531215762","5","","10000","19","","“当一个故事要结束的时候，我们总会想起它的开始”[保卫萝卜_哭哭][保卫萝卜_哭哭][保卫萝卜_哭哭][酸了][酸了][酸了][酸了][酸了]"
"皇天伏羲","男","重庆","433579674","6","星座系列：巨蟹座","10000","13","","为什么b站最近老是推送崩三的远古视频啊"
"飞翼FlyWing","男","无IP","6397805","6","","10000","13","","姬子，大家还在休伯利安上，等着你的回归。那时候，你还要给琪亚娜继续上课啊"
"红绳锁","男","无IP","363334548","5","","10000","19","","玩蹦三那会儿真的很纯粹，玩了原神才知道有个东西叫限定池，有种超值叫月卡。那会一个水精灵二能让我高兴好一会，长刀（能召唤出英魂战斗，在神之键中可以找到，好像是地藏御魂？）我每天上线必看十分钟，幻想着得到所有神之键，八重村可以让我跑过一遍又一遍。白练，绯红靠着商店升到s，找不到交流的人，却也玩的很开心"
"Liyuu王","保密","无IP","295005580","6","","10000","19","5","克利希娜时期考古"
"已经没有丝之歌了","保密","江苏","292020284","5","崩坏：星穹铁道","10000","16","","为什么在结局底下给我推这个啊，这下结尾和开始连起来了[委屈]"
"爱莉的小喇叭","男","江苏","1026691178","5","崩坏3・天穹流星","10000","16","","你为什么点开时间排序？是故意的还是不小心？[崩坏3・终焉归始_指点]"
"空xsama","男","无IP","42813768","6","三周年恋曲","10000","16","","为什么要在视频下面推远古视频，还是姬子的，刀我是不是？[辣眼睛]"
"mika小天使","男","无IP","39323318","6","","10000","16","","为啥会出现在我的首页[热词系列_知识增加]"
"断桥亦有雪","保密","江苏","167876565","6","","10000","15","","她曾经是个好游戏"
"给我掰点儿","男","无IP","81470211","6","崩坏3・天穹流星","10000","12","5","再见了，姬子老师[大哭]"
"四季初夏丶","男","无IP","491046036","5","崩坏3・天穹流星","10000","12","7","以此烈火，斩无不断！！"
"皇语天尘","男","无IP","381265343","6","泠鸢yousa登门喜鹊","10000","12","","突然在首页刷到，我tm真以为姬子要回来了，结果是以前的视频"
"带我走吧爱莉希雅","保密","湖北","678739668","5","","10000","12","","呜呜呜呜，刚从完结的预告片过来[大哭]"
"_-洛雪-","男","辽宁","389235731","5","","10000","17","","始源终焉前回来考古，崩坏3如今的地位，竟然沦为了结局都能给新人练手的工具[笑哭]"
"诗歌剧傻不拉几的","女","广东","589313879","5","","10000","14","6","最新短片预告下面推这个，你是懂首尾呼应的"
"Bili_667704254","保密","吉林","667704254","5","初音未来13周年","10000","14","","姬子出了，姬子又无了[大哭]"
"我还是什么都做不到","保密","无IP","438396501","5","","10000","16","","“我什么都做不到”，我们一起经历了这么多，原来只有这句话是真的。"
"月见里日向","女","福建","20228135","6","明日方舟","10000","8","","谁在考古。。。哦，是我"
"德丽莎sj第一可爱","保密","无IP","362060981","5","星座系列：双鱼座","10000","11","","让我看看哪个不知道好歹的在这下面给我冲"
"雪糕鲍鲍笛SIX","女","无IP","123334791","6","雪未来","10000","11","14","薪火相传，生生不息"
"彤云天","男","无IP","486302002","6","崩坏3・天穹流星","10000","11","11","薪火相传，生生不息"
"我下载了原神","保密","山东","358606119","5","魔法学院","10000","11","","2022年3月3日 12：00，故事完结，再见"
"南华依梦","保密","无IP","321830254","6","洛天依8th生日纪念","10000","11","11","骑着克利希娜前来考古"
"Elizzy_","保密","无IP","424645912","5","","10000","13","","怎么突然被推送了"
"F白千夏","男","无IP","32650543","6","","10000","22","","姐可是脱了衣服就会干到底的女人r(￣￣)q"
"暴走的smartcat","保密","无IP","332236331","5","","10000","15","","送钟时代前来考古[OK]"
"聚苯乙烯甲基","保密","无IP","155927333","5","格兰芬多","10000","10","","都是老玩家看最后一次吧！梦开始的地方"
"中世纪骑士阿求","保密","无IP","517077709","5","原神","10000","10","","考古队代表现前来考古[笑哭][笑哭][笑哭]"
"敲可耐的小初音","保密","无IP","342003616","6","初音未来13周年","10000","10","","新角色啊，好期待[星星眼]"
"好好学习啊-","男","无IP","351329228","6","","10000","10","","蹦蹦蹦三周年！！！"
"请输入昵称_______uuu","保密","江苏","439029955","4","","10000","10","","“当一个故事要结束的时候，我们总会想起它的开始”[保卫萝卜_哭哭][保卫萝卜_哭哭][保卫萝卜_哭哭]"
"黑贞の贤妻","保密","无IP","213915794","6","2021拜年纪活动专属","10000","10","","乐土狼人杀时代前来考古"
"花崎千秋つ","保密","山东","172719522","6","崩坏3・天穹流星","10000","12","","笑死，爱衣预告下面来的"
"青丝谁短长","保密","无IP","259608069","5","原神","10000","12","","谁在考古！？"
"Dr_明乾","男","无IP","445068691","5","","10000","12","","回来看一眼姬子………………姬子老师啊……"
"怎么绘世呀y","男","无IP","72472829","6","","10000","9","","《极具破坏力的巨剑战士》"
"纸小冰","保密","无IP","482840406","5","魔法学院","10000","9","","铁道时期前来考古[doge]"
"路鸣泽-小魔鬼","保密","无IP","353259815","6","hanser","10000","9","","姬子老师！我要成为最强的女武神！"
"天傲游","保密","无IP","278593","6","崩坏3・天穹流星","10000","9","12","第一个推荐视频居然是这个，好久了啊..."
"逸凌s","保密","无IP","98102099","6","良辰美景・不问天","10000","9","","姬子温柔地注视着你，不再言语"
"琪亚娜-Kiana","女","无IP","331838786","5","崩坏3・天穹流星","10000","9","8","我怎么忽然到这里来了Σ(っ °Д °;)っ，我刚刚还在看薪炎之律者呀？(°д°)"
"一般路过的喜多酱","男","无IP","1097209364","5","","10000","9","","余此烈火，斩无不断！"
"苍穹无殇","保密","无IP","103918744","5","","10000","9","","4.9版本前来考古"
"一生之敌傅里叶","保密","无IP","226600568","6","citrus","10000","9","","看看我刷到了什么[热词系列_知识增加]"
"ElyisanRealm","男","无IP","109393285","5","","10000","9","","姬子阿姨，真的回不来了吗..."
"纯白恶魔_","女","无IP","34199793","6","","10000","9","9","这个时候的崩崩崩还不是一个数值游戏[热词系列_害]不过版本PV越来越棒了[tv_点赞]"
"半分だけの爱","男","无IP","11804601","6","","10000","9","11","多长时间没见人叫她「姬轩辕」了……"
"马尔代夫代购臭鸡蛋","男","无IP","2822013","6","","10000","9","","强袭出场技释放不了了"
"同学要努力","男","河北","456183895","5","","10000","9","","当一个故事结束的时候,我们总会想起他的开始"
"尚云享芹忻","保密","湖北","323349725","5","","10000","9","","这可是我刚入坑的时候啊，姬子初上舰，一别六年了。"
"八重樱绽放于卡莲之上","男","四川","290033079","5","","10000","9","6","曾经你还是个让我爱不释手的游戏啊[大哭]"
"Zakkaざっか","男","无IP","30745378","5","","10000","9","","别推了x别刀了"
"努力变强的QK趣琪","男","无IP","11488326","6","原神","10000","10","","居然也给我推这个了[大哭][大哭][大哭]"
"那kiana","女","无IP","1254893389","4","","10000","10","","mhy编剧,听我说屑屑你因为铀你瘟暖了死寂卸卸你感谢铀你逝界更没离我要泄泄你因为铀你碍肠在腥底血血你 感谢铀你♂♂♂把腥辐氚递"
"幻樱の八重","男","无IP","67961051","6","崩坏：星穹铁道","10000","10","","突然上我首页了，姬子阿姐要回来了吗[大哭]"
"银凌烟","女","无IP","334712704","6","崩坏：星穹铁道","10000","8","","考古，音乐会结束了，铁道要来了！"
"神难葬者","保密","无IP","692801303","4","","10000","8","","永世回忆，5.1版本了已经"
"Rin__Shibuya","保密","无IP","347402526","5","","10000","8","8","你居然最终还是没了[大哭][大哭]"
"虎鲸呆毛拉面","男","无IP","8211124","6","","10000","8","","遇到你真是太好了！姬子[大哭]"
"新乃夜","男","无IP","33104479","6","hanser","10000","8","5","姬子老师，琪亚娜长大了"
"廑[","男","无IP","60644546","6","","10000","8","6","以此烈火，斩无不断！！！"
"中二少年jpg","男","无IP","257847744","6","崩坏3・天穹流星","10000","8","","以此烈火，斩无不断！"
"白-轻松解决-泷","女","无IP","202088256","5","","10000","8","","以此烈火，斩无不断！"
"我永远单推爱莉","女","无IP","300750413","6","","10000","8","","以此烈火，斩无不断！"
"名字是没有的啦","男","无IP","430259228","5","","10000","8","8","以此烈火，斩无不断"
"天羽の魂","男","无IP","49494937","6","","10000","8","3","以此烈火，斩无不断！"
"叫我溪陌就好","保密","无IP","22287998","6","洛天依8th生日纪念","10000","8","6","愿薪火相传，美德不灭"
"祁陵雾","男","无IP","325117439","6","","10000","8","","薪火相传，生生不息"
"正云风","保密","无IP","332729859","5","","10000","8","","琪亚娜:我会把这个世界变成你所期望的样子"
"吾心即宇宙z","男","无IP","13273125","6","","10000","8","","开服舰长碰巧刷到来考古了[藏狐]"
"夜冰挽歌","保密","新疆","254243913","6","","10000","8","","她自火中重生，她自火中微笑。"
"","保密","无IP","3923921","6","","10000","8","6","三发单抽证明这是汉娜和奥托薇拉up"
"临听雨落","保密","辽宁","470491525","5","","10000","8","","2023年3月4日，毕业舰长回来考古了！,往往一段故事的结束，..."
"宇智波小暗","保密","安徽","475231893","5","","10000","8","","以此为终"
"梦缘碟tourist","男","无IP","355838984","5","绯赤艾莉欧","10000","8","","考古，侵蚀之律者时代来也[崩坏3_你好]"
"且看菊花爆满山","保密","无IP","288316047","5","","10000","9","","2022春活肝完，考个古，兄弟们看着我了给个赞让我瞧瞧还有多少人会回来看视频"
"要来看羊吗","保密","无IP","277749181","5","EveOneCat2","10000","9","","姬子阿姨，新年快乐，有是新的一年啦，发生了好多事情，想跟你说又不知道从哪说起，后来想了想，应该不用说了吧，你一定都看见了，对吧"
"只想干饭i-","保密","无IP","251555106","5","","10000","9","","创死策划 克里希那"
"嘛行列式","保密","无IP","51259329","5","","10000","9","","这个姬子的新角色目前来说不建议各位去抽"
"呜啦啦旋风","男","无IP","187983831","5","","10000","9","","谁洛阳铲落这了？[思考]"
"渡鸦kira","男","无IP","19792168","6","Kizuna AI","10000","7","","以此烈火，斩无不断！"
"江雪之柔","女","无IP","197578247","6","","10000","7","5","以此烈火，斩无不断！"
"寄红豆予相思","保密","无IP","221796743","6","","10000","7","7","以此烈火，斩无不断！"
"超级健健同学","男","无IP","319257183","6","王子碰碰球","10000","7","","以此烈火，斩无不断。生生不息，薪火相传！"
"SuperBadSY","男","无IP","269349811","6","","10000","7","9","最微弱的星火也可以燃烧一切。"
"放开那狐狸让我来","保密","无IP","67051381","6","","10000","7","","以此烈火"
"要六枚硬币的屑昵称","女","无IP","590166704","5","碧蓝航线","10000","7","","姬子，再也回不来了…"
"鸟部山","保密","无IP","382567880","6","乃琳Queen","10000","7","6","熟悉又陌生，希望这个游戏会好起来吧"
"抠尼酱","保密","无IP","158606896","6","万界仙踪","10000","7","","火系大剑人上人"
"木言白白","男","无IP","32174726","6","hanser","10000","7","","矿场疾风是开服到现在最新的B级女武神[吃瓜]"
"234-432","保密","四川","485844588","5","","10000","7","","这下首尾呼应了[崩坏3_？]"
"ぴりぱら乾杯","保密","四川","490573835","5","星座系列：天蝎座","10000","7","","今天，我才车上看到一个小女孩在玩崩坏三。。。。。。。。。。。。。。。。。。。。。。。。。。。。。。。。。。。。。。。。。。。。。。。。。。。。。。。。。。。。。。。。。。。。。。。。。。。。。。。。。。。。。。。。。。中间的忘了，就记得有一个回归邀请码:12999223DF回归大佬填一下领300水，感谢，祝单抽出角色[神乐七奈_变猫猫]"
"独爱小桃","女","无IP","517310142","5","嘉然今天吃什么","10000","7","","蛇蛇泳装时代前来考古[妙啊]"
"k424ba","男","无IP","516269082","5","","10000","7","","领航者已经不在，未来的路，还得自己走下去"
"你已听不见","男","无IP","519849681","5","","10000","7","","我好想你啊 姬子阿姨[大哭][大哭] 米哈游快出个sp角色吧"
"一小梦一","男","无IP","183484816","6","洛天依8th生日纪念","10000","7","","我是刷到抽勿忘的视频来的[tv_doge]"
"Sakuraの恋","保密","无IP","321514276","6","良辰美景・不问天","10000","7","10","天元之路，开创！"
"泡泡保护协会","男","无IP","327317525","5","","10000","9","4","2021年2月12日，新春活动识律登场，前来考古"
"大主教噜啦啦噜啦啦","保密","无IP","1181161913","5","","10000","5","","我时还没入坑嘞-_-||"
"痒痒狮","女","河北","1271527862","4","","10000","5","","第一部完结[墨镜]"
"南瓜鸽子","保密","广东","353854277","5","","10000","5","","考古[脱单doge]"
"让沙哑情绪泛起涟漪","男","福建","85316928","6","茶啊二中","10000","8","","这是新游戏吗，萌新想入坑了[崩坏3・光辉矢愿_遨游]"
"アリス-W-月澄","男","无IP","486287693","5","初音未来13周年","10000","8","","姬子，琪亚娜现在成天命最强女武神了[doge]"
"辟谷沟子","男","无IP","516597678","5","","10000","8","","创死时代考古"
"火柴钰","保密","无IP","24255505","6","-阿库娅","10000","8","","奥托成功了？？？"
"螭cc","男","无IP","397758837","5","向晚大魔王","10000","8","","是什么让我刷到的？,奥托成功了？,[热词系列_知识增加]"
"Catcher江淮","保密","无IP","400286177","5","-阿库娅","10000","8","10","奥托成功了，这么多人都回来啦[崩坏3_干杯]"
"朝九凉","保密","无IP","385482302","5","hanser","10000","6","","薪火相传，生生不息"
"百分之九十九的冷漠","女","无IP","255732196","6","雪未来","10000","6","","薪火相传，生生不息！"
"髡hの幼刀","保密","无IP","244260247","5","","10000","6","","薪火相传，生生不息"
"假面愚者_zzfishzz","保密","无IP","288142148","6","","10000","6","","薪火相传，生生不息"
"东方璎","保密","无IP","485051677","6","","10000","6","","20210626，我们都是崩坏三的舰长"
"赤晓龙","保密","无IP","22944934","6","崩坏：星穹铁道","10000","6","13","薪火相传，生生不息。,为世上所有美好而战。"
"我永远喜欢姐姐","保密","无IP","428200329","5","","10000","6","2","元宝时期前来考古"
"超凶无情叽","保密","河北","520518389","3","","10000","6","","大结局做完来考古了[doge]唉，我3年青春没了[保卫萝卜_哭哭]"
"冷月の古风","男","吉林","23331577","6","名侦探柯南M26","10000","6","6","诅咒之剑勋章好不容易刷到了，封印之剑当初体力实在不够用啊，远古勋章就差这个和开服章[捂脸]"
"兔皮猫大人","女","四川","351385651","5","贝拉kira","10000","6","","那个时候姬子的胸口还没加布料"
"天战圣龙","男","无IP","287515790","5","","10000","6","7","考古"
"掉进粪坑的塔莫斯","女","无IP","321900374","5","良辰美景・不问天","10000","6","","好期待，什么更新啊[妙啊]"
