"昵称","性别","IP","UID","等级","装扮","用户权重","获赞数","粉丝团等级","评论"
"天蓝云扬","男","无IP","2535146","6","洛天依9th生日纪念","10000","2","9","绿托！你还我上仙！！！"
"勺豆瓣酱","保密","无IP","293784604","5","","10000","2","","主教大人，你的女仆，我笑纳了"
"珂学永无止境","保密","无IP","89609702","6","","10000","2","","符华怎么可能会死，绿托说了还要用到她,再说你们觉得就一个拟态的天火自裁能打死上仙？"
"妖孽aaa","男","无IP","113299514","6","","10000","2","","死绿托还我浮华上仙[我家大师兄脑子有坑_哭][我家大师兄脑子有坑_哭][我家大师兄脑子有坑_哭]"
"皮到上天","男","无IP","10981854","6","","10000","2","","还我班长[小电视_思索]"
"紫陌苦清漪","保密","无IP","253448039","6","","10000","2","","绿托，出来挨打"
"抵抗本身就是意义","保密","无IP","238759699","6","","10000","2","","我还没有神州平板，她就已经挂了"
"Sakuya-Xcarlet","男","无IP","51226721","6","三周年恋曲","10000","2","","主教大人卖完老婆终于开始卖女仆了"
"苏夜樱","保密","无IP","231030422","6","","10000","2","","深渊镰刀妹一刀过百万(=ω=)"
"Sincerely灬","保密","无IP","36318011","6","","10000","2","","绿托出来受死"
"妖气-乐尽天真","男","无IP","73798044","6","","10000","2","","有什么好讲的  削苹果刀教学实录←_←"
"堇墨sama","男","无IP","237607578","5","","10000","2","","爱酱：我介绍我自己Σ( ￣□￣||)"
"乡音年糕","男","无IP","4068461","6","","10000","2","","绿托，你配不上卡莲！你不配！"
"Ha丶Sakura","男","无IP","1948448","6","","10000","2","","王尔德池抽出一套西琳还没武器，绝了，这什么UP？还怎么舔丽塔？"
"不爱肝の阿呆","男","无IP","7974456","6","","10000","2","","(_)这绿托，都把德莉莎都给卖了！"
"深渊の帕瓦","男","无IP","34259950","6","","10000","2","","打天命，抢女仆！"
"枉然叹之","男","无IP","22834275","6","良辰美景・不问天","10000","2","","你好，如果右眼不需要可以捐给有需要的人"
"安兹乌尔恭大哥","保密","无IP","179072444","5","中野三玖","10000","2","","好胸"
"Ultraman-LEGEND","男","无IP","4087341","6","","10000","2","7","不错不错，人美声甜，还能高速杀怪，但是我还是更想要幽兰黛尔(°°)"
"加冕之时已至","男","无IP","12834291","6","","10000","2","","中二主教当然得有个中二女仆了[蛆音娘_滑稽]"
"令白鸟哀叹的天空之蓝","保密","无IP","5525509","5","总之就是非常可爱","10000","2","","30连王尔德中人偶师上绯狱丸下，放弃治疗，还是用零落吧，呜呜呜"
"Golden_Ingot","保密","无IP","32702966","6","","10000","2","","可是这跟我这个89抽sss了深红的睿智清洁工又有什么关系呢"
"皮都皮的那么帅","男","无IP","34955812","6","","10000","2","","绿拖必须死[小电视_好怒啊][小电视_好怒啊]"
"BEdown_TO_earth","男","无IP","39191798","6","","10000","2","4","说的好  但是IG流弊！！！"
"O花渐老_","女","无IP","27202495","6","","10000","2","","绿托你还我符华"
"良心商人阿卡丽","男","无IP","16539150","6","","10000","2","","奥托，你是主动凑上来挨打的？[2233娘_怒][2233娘_怒]"
"无常似尾花","保密","无IP","5063290","5","","10000","2","","求您别教我丽塔了，我想学学怎么拯救真红(￣ε(#￣)"
"北李灵烟","保密","无IP","284033735","5","","10000","2","4","来看你刚来时的样子"
"白伶Ely","男","无IP","42966022","6","初音未来13周年","10000","2","","丽塔生日快乐！"
"顶针不要坏我的好事","保密","无IP","692990239","5","原神","10000","2","","丽塔生日快乐[冰墩墩][冰墩墩]"
"6SNL","保密","无IP","422572615","5","","10000","1","","神里绫华、丽塔:“失礼了。”"
"做个梦就讲个故事","男","无IP","21905943","6","","10000","1","","丽塔生日快乐"
"安吉莉の言弹","女","无IP","383159773","5","星座系列：水瓶座","10000","1","","新剧情里丽塔不鸟你的命令了，狗奥托"
"没鼻子de海星","男","无IP","244103406","6","2233白色情人节","10000","1","","3s黯蔷薇加黑铁直接死不掉"
"寒鸦月Jackdaw","保密","无IP","164564218","6","崩坏：星穹铁道","10000","1","10","2000"
"是火花酱呀","男","无IP","7197613","6","","10000","1","","你比蔷薇更美丽"
"懒书礼R","保密","无IP","381553602","5","","10000","1","","敌人越多，她越兴奋"
"bili_有六币再改名","保密","河北","1695583681","3","","10000","1","","考古，时代的眼泪"
"ng-513","保密","无IP","85244945","5","","10000","1","","那个……有人吗……我是新萌……我昨天才刚玩……但是，我有野蔷薇了……那个……我想问一下……她的镰刀怎么得……(_)"
"key丶苍茫心印","保密","无IP","98977535","6","","10000","1","","萌新玩的第一天就有了（￣￣）"
"铁头骑土","男","无IP","80145985","6","","10000","1","","奥托，你的女仆，我的，你的孙女，我的，你的符华(大雾)，还是我的。"
"彼岸的远方无悔","男","无IP","41270783","6","","10000","1","","这我直接单抽出来了(｀ω)"
"无聊小男神","男","无IP","88113505","5","","10000","1","","萌新怎么玩，登录送的群青风暴怎么样啊"
"若星晴","保密","无IP","107850672","6","洛天依8th生日纪念","10000","1","","就我一个是做回归任务的吗。。。"
"我不会玩派克","保密","无IP","229822963","6","","10000","1","","来杯奥托茶"
"_注销_","保密","湖北","305332","6","","10000","1","","讲的很好，下次不要那种男声了，很出戏"
"想ID好麻烦啊狗带吧","保密","无IP","20023391","6","","10000","1","","快乐就完事了，打起来超爽"
"拔剑只为红颜笑","男","无IP","11273098","5","","10000","1","","丽塔的反转是不是就是希儿……"
"不宜糯死爱腻死","男","无IP","73947481","6","","10000","1","","我能说，丽塔的大招效果像极了英雄联盟老版剑姬的大招，不过丽塔的更为华丽！"
"看莪干嘛","保密","无IP","353087521","6","汉化日记","10000","1","","我好像抽到一个不得了的东西"
"bkb没开出来","保密","无IP","2039813","6","","10000","1","","投影！,厉害,时代,未来,假面骑士 丽塔J丽塔！"
"在天上飞的风筝","男","无IP","324890483","6","","10000","1","","这个大招每次放游戏都要闪退"
"lemon_tea02","保密","无IP","103458429","6","明日方舟音律系列","10000","1","","2个月没玩结果第一个抽到的就是她"
"守护2233娘","保密","无IP","23649662","5","三周年恋曲","10000","1","","我碎片合成获得的"
"林上飞鸟","男","无IP","2869391","6","乃琳Queen","10000","1","","最后那一下失礼了简直不要太美(°°)"
"百分透明","保密","无IP","2093708","6","","10000","1","","是你！:超高校级的女……对不起走错了(=ω=)"
"我不改名了还不行么","保密","无IP","52246032","5","","10000","1","","第一发武神，萌新入坑，毒奶粉的难民[蛆音娘_哭泣]"
"小丛雨是最棒的","保密","无IP","291916580","6","EveOneCat2","10000","1","","我刷了几个星期困难2 11才刷出来。。。"
"D夜冰兰","女","无IP","116134","6","","10000","1","10","新动画呢？"
"超搞笑级的小学生","保密","无IP","13654051","6","","10000","1","","简单来说就是aaa，有大开大"
"我就是路过进来坐坐的","保密","无IP","387124211","5","","10000","1","","单抽丽塔路过（￣￣）"
"伊琳久IRnine","保密","无IP","118710678","6","","10000","1","","哈哈哈那些弹幕笑死我了 造成语文伤害"
"玩家817597638","保密","无IP","495467846","5","崩坏3・天穹流星","10000","1","","[崩坏3_看书]"
"白熊撒","保密","无IP","277643320","4","","10000","1","","(=ω=)我怎么感觉这是个肉啊，血回的老快，但是伤害又贼高。"
"是haku","女","无IP","55891458","6","","10000","1","","出了丽塔就是出了杏跟爱酱(声优梗)"
"悲伤苦瓜卷","保密","无IP","227497469","6","","10000","1","2","求bgm"
"千秋落缘","男","无IP","293609137","5","","10000","1","","我看过下个版本的CG了开枪的是齐格飞。"
"_Booom_","保密","无IP","21041304","5","","10000","1","","我特么肝爆！"
"斤欠斤欠i","保密","无IP","188552115","4","","10000","1","","后悔看这个视频了，现在丽塔抽到ss真红才5个碎片"
"东瓜十三","男","无IP","53760655","6","","10000","1","","那个……昨天刚刚玩的，月卡推不推荐买呀"
"一点都爆笑","保密","无IP","263212436","5","","10000","1","","一开大就闪退→_→"
"Biteacat","男","无IP","241965299","5","","10000","1","","托哥，我的梦想就是侍奉天命，因为这样所行之恶，所造之杀孽就都将被赦免了，我的九年义务教育中有太多的罪孽需要被赦免，加入天命是唯一的机会，如果休伯利安缺人手，一定要联系我，当然厕所清洁工也可以，反正又没有WC。"
"迷茫的嘤嘤怪","保密","无IP","12720998","6","","10000","1","","今天第一把抽到丽塔（15号开玩到现在一共抽12次，我是木有钱的佛系玩家[小电视_嘟嘴]），来看看怎么玩"
"绯红008","男","无IP","3819712","6","","10000","1","","到现在丽塔换为秘书，站在舰桥不能动!什么时候修复？[小电视_发愁]"
"工不唐捐","保密","无IP","24637412","6","","10000","1","","十连出了女武神凯旋和暗蔷薇怎么玩(￣△￣)～(￣￣～)"
"是青鸟不是青鸾","男","无IP","233929785","6","崩坏：星穹铁道","10000","1","","绿托出来挨打"
"灾厄最帅","男","无IP","210178786","6","","10000","1","","等等，希尔怎么办啊？不出了？"
"负能量集合体及传播者","保密","无IP","8020488","5","","10000","1","","这个游戏手机会发烫吗"
"红染丶火之途","保密","无IP","37881530","6","全职高手","10000","1","18","136390970,有回归的玩家吗？求绑定～,如果是中级区的玩家，我也许能帮到你们深渊战场，本人长期使用地图装红莲保级，且战场二档，最近两次战场结算分别排名咸鱼安卓3服中级区122名和115名，如果你有合适的蛋池装应该能打更好的分数，咸鱼服还是挺好玩的～,求回归玩家绑定～！,|ω｀)"
"墨西哥企鹅卷","保密","无IP","23155298","6","","10000","1","","丽塔什么都好,就是开大闪退不好[小电视_汗]"
"^^SAMA","女","无IP","233927960","6","崩坏3・天穹流星","10000","1","","我什么也没有了(；ω；`)"
"踏月冰颜","男","无IP","8804716","6","","10000","1","","请问我该怎么喷文案才不会被举报呢？"
"此地不宜久留散了吧","男","无IP","106023736","6","原神","10000","1","","别人的丽塔回血，我的丽塔……算了吧！还是老实玩德莉莎吧！"
"零光吹喇叭","女","无IP","162758199","5","","10000","1","","红红火火恍恍惚惚我还有八个碎片哈哈哈（此人已疯）"
"泰坦灬炎","保密","无IP","32484661","5","地中海","10000","1","","略略略"
"泰坦灬炎","保密","无IP","32484661","5","地中海","10000","1","","略略略"
"不埋屎小姐","保密","无IP","5323347","6","","10000","1","","伤害比较低"
"润桑533","男","无IP","35847839","6","","10000","1","","谁知道噩梦第一章1-15怎么三星过  ，那个时空裂缝中必须杀死一个敌人，除了boss怪都是无敌的，杀了boss又不计。。。"
"可以叫我咖啡桌","保密","无IP","40876948","6","","10000","1","","为什么打金币关卡月光莫名其妙不能连分支了，只能打一轮，疯狂按平a也只转那么一下。"
"致佳妮","女","无IP","10521013","5","","10000","1","","战斗结束那个动作太撩人了！"
"轰炸鸡不是鸡","保密","无IP","15187860","6","","10000","1","","(｀ω)穷人的哭泣"
"可爱的大萌狸","保密","无IP","7816047","6","","10000","1","","两个十连精准一个断光一个丹朱.... 还不如大月卡来的痛快"
"幽兰呆尔","保密","无IP","240735487","6","","10000","1","","你以为她是丽塔其实她是包菜！但当你把她当成包菜时她有变回了丽塔"
"账号已注销","保密","无IP","320608715","0","","5000","1","","我毕业了。丽塔"
"账号已注销","保密","无IP","123642830","0","","5000","1","","单抽抽到了，还是攒的砖石，零氪（￣￣）"
"雪白白OffiCal","保密","无IP","21708330","6","总之就是非常可爱","10000","1","","奥托你给我过来挨打"
"ruijin6","保密","无IP","2863371","6","","10000","1","","奥托被绿也能赦免？"
"C-WL_Project","保密","无IP","81401972","6","","10000","1","","直播。。。。鸽了七分钟了。。。。。到现在还没出现QwQ"
"丨魔男丨","保密","无IP","53448967","6","hanser","10000","1","11","你们的剑姬回来辣"
"蚀离离","保密","无IP","249504247","6","","10000","1","","抽了五十多发一个丽塔也没有，全是原罪或者月下，姬子阿...姐也不给我(；ω；`),我的丽塔全是肝出来的，快到s了...话说黑丝女仆真好(^ω^ )"
"来自冬天没有暖气","保密","无IP","22504778","6","","10000","1","","我怎么回血和没有似的(Д≡д)!?"
"0south","保密","无IP","17002510","6","","10000","1","","一开大手机就秒退。。。"
"AnGerR","女","无IP","295342447","6","少女前线","10000","1","","性感奥托 在线解说（滑稽）"
"无情の路哥","男","无IP","37149346","6","","10000","1","","先用神恩打出脆弱效果然后换暗蔷薇出场，一个闪避再切真红出场[蛆音娘_滑稽]"
"AM6_","男","无IP","286203569","6","","10000","1","","上仙怎么了？本命上仙没打主线，求告知？"
"不学成花舞不改名","男","无IP","195203602","6","花园Serena","10000","1","","绿托出来挨打"
"抽为奖了","男","无IP","43139112","5","至尊戒","10000","1","","跑步的时候…嘿嘿嘿，你懂得"
"摸鱼的心愿SAMA","男","无IP","33653150","6","","10000","1","","原罪:打刻印。。。。。回血。。。。。。mmp！"
"清夏时[","保密","无IP","76673294","6","","10000","1","","本舰长才是幕后黑手，一切都是我在操控。"
"bili_204322554","保密","无IP","204322554","6","","10000","1","","怒放生命"
"烤鱼天妇罗","男","无IP","174824968","6","星座系列：白羊座","10000","1","3","中二绿托（￣￣）"
"丘犁越中","保密","无IP","319353261","6","","10000","1","","现在我感觉……极东支部的人应该不会死，齐格飞有可能会死。"
"葱花肉末饼","女","无IP","104545037","5","","10000","1","","可惜我绿托永远喜欢德莉傻呢（￣￣）"
"阿萨欣","女","无IP","3369983","6","","10000","1","","有大月卡厉害吗"
"坂本秋月の梦前光","男","无IP","14390924","6","HIME","10000","1","","你们的老婆其实是个包菜"
"生活在欧洲的海豹王","女","无IP","40672302","6","明日方舟","10000","1","","还是喜欢奥托大人(￣△￣),可恨之人，必有可怜之处。"
"妖迹","男","无IP","22880773","6","","10000","1","","绿托，出来挨打！[2233娘_怒]"
"追风喵","保密","无IP","5660455","6","花园Serena","10000","1","","62抽扩充没有真红和丽塔，反而月下2s+200碎，想死的感觉c(`Д)"
"楚轩爱","保密","无IP","8284157","6","","10000","1","","快去请符华上仙"
"昵称包含不可选用字符","男","无IP","22556230","6","","10000","1","","我就想知道这个幽兰戴尔不会又能变成奥托吧,感觉奥托近卫的s女武神都经历了非人的实验啊"
"慕汐OwO","女","无IP","34069015","5","","10000","1","","我的符华!!!"
"神奇陆小懒","保密","无IP","6392732","6","EveOneCat2","10000","1","","哈哈哈哈哈哈哈哈包菜头精分啦！！！"
"嬗_Hermit","保密","无IP","7335283","6","EveOneCat2","10000","1","","(｀ω)刚刚把丽塔肝到s级，来看看怎么玩"
"风闲云","保密","无IP","12796978","6","","10000","1","","我一定要得到丽塔，然后用来当看板娘……,毕竟这是个养成游戏！r(￣￣)q"
"君ゆゆゆ~","男","无IP","36269533","6","P+魔法少女头像框","10000","1","","女仆没有训练室呀，还是我没找到[小电视_发愁]"
"休怎一号","男","无IP","178656944","5","","10000","1","","希尔：光明正大记在小本本上"
"星晓声","女","无IP","7967912","6","","10000","1","","出来挨打！还我符华！！！QAQ"
"大哥爱洗澡","男","无IP","181940928","6","","10000","1","","求BGM！"
"炎阳-雪风","保密","无IP","37039525","5","","10000","1","","觉醒之后就变成希儿了"
"轩华QAQ","保密","无IP","10705626","6","","10000","1","","能多发点技能点吗。。。"
"-Noctis-","男","无IP","171125421","4","","10000","1","","花开奇怪的你走错了这里没有仓鼠"
"Chrysanthemumm","保密","无IP","2234681","5","","10000","1","","几百 狗贼奥托滚出来挨打:)"
"_k","保密","无IP","44043449","6","欧皇","10000","1","","顺便上仙觉醒拯救世界"
"言老魔","女","无IP","7937707","5","","10000","1","","只有我最看重那个雪绒花技能吗，就那个丢镰刀之后一秒内击杀回复生命，下深渊用那个打杂鱼，探路巨好用_(:3」∠)_"
"期待阿尔卡纳的到来","保密","无IP","11723717","6","","10000","1","","这只丽塔好漂亮，"
"一片云灬","男","无IP","1349280","6","","10000","1","","从不单打独斗...一个人围殴一群吗[小电视_无语]"
"喵癫喵癫","女","无IP","21160929","6","EveOneCat2","10000","1","","出来挨打！还我班长！"
"霜辉-名血","男","无IP","33963211","6","","10000","1","","符华好歹是曾经最强的，这么死了很奇怪的好不好[小电视_汗]"
"七つ一旋樱","保密","无IP","8394327","6","首批购买大会员","10000","1","3","丽塔的手感很不错，各种意义上的。[小电视_赞]"
"爱尼的抛瓦","男","无IP","94031932","6","崩坏3・天穹流星","10000","1","10","绿托，你出来。我在你头上加点buff( _f｀)"
"渡鸦001号","男","无IP","35520422","6","","10000","1","","我浮华上仙不可能死亡"
"未来无限劫","男","无IP","4071322","6","","10000","1","","丽塔你这么吊，你有本事去打舰团空间啊(滑稽),表示一不小心就会丢镰刀，没几下就把自己作死了，毕竟舰团空间没法以自己的力量回血"
"捡垃圾的三流诗人","保密","无IP","176933563","5","","10000","1","","绿托，还我班长（/TДT)/"
"聆荒","保密","无IP","2331114","6","碧蓝航线2020","10000","1","","弱弱弱弱问一句，50级丽塔25级圣痕，综合评分比，60级白夜35级圣痕，还高，丽塔不会比白夜还强吧？"
"他急了她急了","男","无IP","5491506","6","","10000","1","","丽塔中文CV是谁啊！"
"丧心病狂的百合厨","保密","无IP","298347246","6","","10000","1","","一个个嚷嚷什么，没注意剧情说平板还有用么？爆头而已，天命什么伤治不好……"
"MiniAimee贤贤","女","无IP","6648901","6","","10000","1","","丽塔刚出来的时候觉得没感觉，用完后觉得真香~战斗打击感，cv都超棒~另外……绿托！！！不准碰我的上仙！！！莫挨班长！！"
"丨团灬子丨","保密","无IP","5773843","6","原神","10000","1","","以为我是丽塔？其实我是爱酱哒！！！"
"阿杰在干啥","男","无IP","2231639","6","","10000","1","3","妖尾282集露西金牛座星灵装像爱酱[蛆音娘_滑稽]我放动态里了"
"-止渊","保密","无IP","4520434","6","seele","10000","1","","镰刀...希儿...."
"嗤笑灭亡","男","无IP","97882587","6","","10000","1","","我老婆符华要是死了，我特么不把绿托的几儿给他拔下来[那兔_你丫试试]"
"绫蔷薇","保密","无IP","50155358","6","少女前线","10000","1","1","[小电视_笑]我ID就叫绫蔷薇，三个多月前就入坑了，没想到丽塔是黯蔷薇，这么巧啊（试图暗示）"
"AEtian天爷","男","无IP","140247549","5","","10000","1","","反正老子抽不到"
"666","保密","无IP","335105907","6","","10000","1","","“马蛋”还我符华！"
"L吹雨^秋~落","保密","无IP","196288371","5","","10000","1","","奥托，出来挨打，你把我的符华上仙怎么了？"
"绫音诶歪诶","男","无IP","35763980","6","","10000","1","","奥托配音真的可以出道了"
"^^SAMA","女","无IP","233927960","6","崩坏3・天穹流星","10000","1","","饶命啊"
"_查理-曼_","男","无IP","51525690","6","","10000","1","","照这个速度幽兰黛尔早晚也会实装"
"叶秋chan","保密","无IP","1278715","6","EveOneCat2","10000","1","","说起来lita也是小N配的？"
"朝云暮风","男","无IP","23441072","5","洛天依8th生日纪念","10000","1","","解说中二"
"沈热闹","男","无IP","104203659","5","","10000","1","","我想看月轮教学_>`"
"晴海桑提不起劲","男","无IP","34537710","6","战双帕弥什","10000","1","","我永远喜欢丽塔(｀ω)"
"阿卡迪斯亚","男","无IP","37539211","6","","10000","1","","其实奥托如果真的搞出了复活也不是什么坏事，我觉的丽塔说的事可能是复活第七章幽兰戴尔看的那些死人。反正支持奥托大人。"
"凛时雨烬","保密","无IP","37602557","6","","10000","1","","不久前才吐槽完躬身阴影之人没角色教学，现在就出了，躬身阴影之人要走向光明吗(ω)"
"Hereirs","保密","无IP","43980253","6","","10000","1","","希儿：镰刀，黑名单加一"
"UHRF1阻断器改二","男","无IP","9145306","6","","10000","1","","前800"
"森然方寸","保密","无IP","162345808","6","小桃","10000","1","","所以丽塔为什么叛变了奥托，跑舰长这边来了？"
"无名客_骅","男","无IP","286729333","6","星座系列：白羊座","10000","1","","崩坏第一劳模 ，第一绿者，奥托"
"阿柚Go","男","无IP","27794416","6","明日方舟","10000","1","","hhh这台词每期都这么羞耻"
"骚话浩","保密","无IP","68958985","6","","10000","1","","奥拓还我浮华"
"黑灰乌鸦","男","无IP","1913642","6","","10000","1","","睿智的空中劈叉清洁工：主角大人主角大人，您欠我两年多的工资呢？等等！我们集体清洁工送您的辣么多绿帽您怎么没戴？快戴上!"
"Josselu","保密","无IP","7967713","6","","10000","1","","我只是想听听奥托怎么吹他的女仆。"
"爱里皆","保密","无IP","288325382","6","","10000","1","3","我一滴血，回到426，看人家，直接半管"
"四文鱼五条悟","保密","无IP","21596199","6","","10000","1","","班长干嘛啦?被奥托抓啦?()"
"卜严峻","保密","无IP","5484320","6","","10000","1","","希望加强女仆的专属套，现在的效果太弟弟了"
"一般网友白风","男","无IP","15031891","6","泠鸢yousa登门喜鹊","10000","1","","绿托你给我注意了，如果你敢符华杀了的话，我就...我就...让你头上更绿！"
"鱼冉尔","男","无IP","21243531","6","","10000","1","","绿托老贼敢动我老婆，你死定了!"
"星空はくや","男","无IP","97320614","6","","10000","1","5","绿托的中二病。。。诶，病入膏肓了，没救了。。。。。。。"
"Sukura狐狸菌","保密","无IP","65233366","5","","10000","1","","丽塔的闪避很可能是希儿的量子化了"
"_Cz-","男","无IP","5984498","6","","10000","1","","呵 最后是碎片换来的角色"
"香辣兔子","保密","无IP","22620998","6","EDG战队","10000","1","","绿托，你即使最后复活卡莲也没用，她们都将成为我的后宫，[小电视_害羞]死心吧"
"绯红夜","男","无IP","65187897","6","","10000","1","","说了这么多，就是大招输出割草，xswl"
"狗才摸鱼daze","男","无IP","6453532","6","","10000","1","","希尔：等我出来，就把你们全杀了[蛆音娘_滑稽]"
"LAOD","男","无IP","1299246","6","原神","10000","1","7","奥托出来挨打！"
"我的盘子呢","男","无IP","98646568","6","","10000","1","1","凯影：大姐，你滴镰刀，没有窝滴好看,～(￣￣～)"
"炭烧的咸鱼","男","无IP","23352377","5","","10000","1","","今天金币关我直接炸了，改进一下啊"
"虾条当辣","保密","无IP","88101629","6","","10000","1","","昨天刚把白夜肝到3S，又来。。。丽塔(3【】"
"轻烟往事","男","无IP","28232257","5","","10000","1","","什么时候出幽兰戴尔[小电视_害羞]"
"难以叫醒的梦中人","保密","无IP","55008085","6","阴阳师・平安物语","10000","1","","了解什么啊？⊙⊙？  直接大月卡  NB 就完事了(=ω=)"
"非洲之星大酋长","男","无IP","160975412","6","刺客伍六七","10000","1","","那个中二病五百年还没好喜欢穿绿衣服的变态又回来了"
"近朱者吃","保密","无IP","15331596","5","至尊戒","10000","1","","奥托prprpr"
"RyuzojiAkane","保密","无IP","108589435","6","中野二乃","10000","1","","神州平板跟绿托发生了什么？怎么这么多舰长说什么“还我上仙”?"
"落~家de嘤嘤嘤","保密","无IP","47704773","5","","10000","1","","大月卡NB"
"很笨的狗","男","无IP","175472039","4","","10000","1","","主教大人安好，看来这里有敢判者需要清理。"
"二宫宴鳐","保密","无IP","168187965","6","","10000","1","","怎么样啊？天命的小姐姐们？@女仆，向各位问好。"
"雷吉德芙","男","无IP","68123504","6","","10000","1","","符华还有什么神之键"
"埃琉德尼尔biu","男","无IP","314589805","6","崩坏3・天穹流星","10000","1","8","魔法女仆TaRiRi，抓住你啦～"
"Rango27","女","无IP","23205498","6","","10000","1","","绿托你还我上仙！"
"妃@","保密","无IP","73140810","6","初音未来13周年","10000","1","","王德尔圣痕感觉不能成为莉塔的专属圣痕，能力一般，下深渊续航能力太弱了"
