"昵称","性别","IP","UID","等级","装扮","用户权重","获赞数","粉丝团等级","评论"
"洛天依LUO","保密","无IP","1668516149","5","","10000","1","","奥托！！[大哭][大哭][大哭][大哭][大哭]"
"燕难知","保密","无IP","296948954","5","琉晶之礼","10000","1","","感觉……不如原来……乐土"
"黑眼圈de企鹅","男","无IP","11159356","6","崩坏3・天穹流星","10000","1","","神子歪莫娜，武器歪赫勒尔，mhy你没有心[捂脸]"
"Ex-Sword","保密","无IP","20558074","6","","10000","1","8","喵~[崩坏3_谈话]"
"高功耗核显","男","无IP","481323923","5","","10000","1","","你怎么抢了奥托的片场,还拍人节目啊[崩坏3_你好]"
"只会小调情感的7度","女","无IP","229008357","6","十年大会员","10000","1","","喵[doge]"
"米忽悠没有心","男","无IP","630251094","5","","10000","1","","汪汪汪[doge]"
"吃软饭的蟹儿","男","无IP","383832522","5","","10000","1","8","我说这么久怎么还没上热门，原来是大会员到期了，shushu不高兴了[doge]"
"时间の终焉","保密","无IP","399761521","5","","10000","1","6","看见奥托讲堂点进来高兴的以为又能看见奥托大人整活了，几分钟后。。。不知道为什么说不出的失落感，物是人非吧[无语]"
"账号已注销","保密","无IP","412725777","0","赏樱大会欧皇","5000","1","15","数一数二"
"夏花不语月惊蝉","女","无IP","242563518","6","","10000","1","","讲实话，有点涩[汤圆]"
"热心市民黄师傅000","男","无IP","185874798","6","","10000","1","","前无奥托，但是爱莉[doge]"
"喂她凝萌茶","保密","无IP","52872051","6","","10000","1","","崩坏现在开始出现原神的元素了，后崩的新boss战-风魔龙    ss冰猪-若陀龙王雷属性大招"
"老子就是没昵称","男","无IP","9995011","5","","10000","1","","奥托呜呜我的大发明家[大哭]你带我走吧[给心心][大哭]"
"顾依桑","女","无IP","7822330","6","","10000","1","","帽子形态的猫什么时候增加啊"
"berglas","男","无IP","364468896","5","","10000","1","","就效果来说确实不如奥托"
"Liyuu十年老粉","保密","无IP","524099379","5","hanser","10000","1","","这立绘能活着走出测试服，我很不理解[笑哭]"
"宝蓝色的权杖","男","无IP","645818724","5","","10000","1","","[原神_哼]的讲堂"
"NAyaharo","男","无IP","54276066","6","Kizuna AI","10000","1","","别奥托讲堂了，奥托已经在换衣服跑去神里家了，现在是爱莉讲堂[崩坏3_七][崩坏3_刀]"
"沐华春风","保密","无IP","6966713","6","","10000","1","","让奥托讲，实在不行让虚空万藏讲也行啊，不是这个声音没味啊[大哭][大哭][大哭]"
"她如歌","男","无IP","6046364","6","","10000","1","9","TA7M5BL8WQ83"
"游云浮羽","保密","无IP","208915278","5","约战：精灵再临","10000","1","","TA7M5BL8WQ83"
"抽不中奖不改昵称","保密","无IP","194442527","6","崩坏3・天穹流星","10000","1","","这是罐头发射器吗？技能全是召唤罐头[热词系列_知识增加]"
"咸鱼的个人修养","男","无IP","13469346","6","","10000","1","","这次武器池怎么这么好抽，30发出武器+圣痕上下，爱了爱了"
"枪枪鲲","保密","无IP","291421477","5","","10000","1","","奥拓讲堂（×）,爱丽讲堂（√）[脱单doge]"
"圣光化身-洛肯","保密","无IP","373520575","5","崩坏：星穹铁道","10000","1","","毕竟奥托没来过乐土，挺合理是吧[狗子]"
"Akukin丶","保密","无IP","10711869","6","","10000","1","12","要不以后改成爱莉讲堂吧[崩坏3_睿智]"
"蝶妈咪在那里","男","无IP","186786807","6","","10000","1","4","特殊版《粉色妖精小姐讲堂》[doge]"
"朔时Z","男","无IP","89199856","6","","10000","1","","主教大人已经寄了，各位可以给他多钉几颗钉，有啥事烧纸就行[doge]"
"八行璃","男","无IP","646580564","5","","10000","1","","罐头向敌人投掷了蹦蹦炸弹效果拔群"
"カセイ-Kasei","男","无IP","4069050","6","","10000","1","10","我只是想要一把武器而已。[tv_大哭],结果第四发十连才出，已经毕业了。[tv_笑哭],我本来就没有毕业的预定啊，我的水晶。[tv_流泪]"
"聆听风的瞬间","男","无IP","480293028","5","","10000","1","5","奥托：没办法原神给的太多了，所以我跳槽了[doge]"
"Aka阿菇","保密","无IP","364641036","5","崩坏：星穹铁道","10000","1","7","这又何尝不是一种ntr？[脱单doge][脱单doge]"
"暗箱操作的黑幕","保密","无IP","171022163","6","2020拜年祭（鼠）","10000","1","","其实进货指的是去梅比乌斯房间搜刮[doge]"
"戴月枫","男","无IP","1343110811","4","","10000","1","","物是人非[难过][保佑]"
"拾{B","女","无IP","413420148","5","洛天依9th生日纪念","10000","1","","我！是个＊P,原，方，使，现，碧，崩，战，双，战等"
"最近喜欢咖啡","保密","无IP","11458506","6","2233十一周年纪念","10000","1","6","这怎么听的这么像宵宫的配音，不会还真的是吧"
"云雀浮梦间-skylark","女","无IP","500253518","5","","10000","1","","奥托讲堂但是爱丽希娅[doge]"
"无名学者武明氏","保密","无IP","382329693","5","冬季","10000","1","","奥托不知何处去，讲堂依旧笑春风[热词系列_知识增加]"
"独爱云先生","男","无IP","501015393","5","工作细胞","10000","1","9","不如改为爱莉讲堂[doge][doge][doge]"
"腌萝卜-お","保密","无IP","95507410","6","三周年恋曲","10000","1","","奥托呢？我要奥托[大哭]"
"十","保密","无IP","381799255","5","星座系列：双鱼座","10000","1","","奥托讲堂没奥托何尝不是一种ntr[星尘_吃瓜]"
"欢愉之道尽在其中","保密","无IP","41117441","6","","10000","1","","奥托大人[大哭]，我的奥托大人[大哭]，你在游戏中没了[大哭]，怎么万恶的米哈游把你从讲堂也开除了啊[大哭]"
"桐和黑雪姬","保密","无IP","22813824","6","","10000","1","9","四个十连，三把武器好好好[星星眼][星星眼][星星眼]"
"最初的终焉","男","无IP","365299962","5","","10000","1","8","奥托讲堂却是爱莉希雅,这又何尝不是一种（）"
"黑白のInstantaneous","男","无IP","23465286","6","","10000","1","","“奥托”讲堂[doge]"
"个时玲珑_","女","无IP","26028702","6","","10000","1","","死去的奥托突然开始讲课（？）"
"云雀浮梦间-skylark","女","无IP","500253518","5","","10000","1","","我以为崩宝凉了，一时间原来是我来早了[藏狐]"
"若见花muse","女","无IP","10555837","6","鹿乃","10000","1","","主教一直都在啊 什么奥托不在？ 我说的是德丽莎主教 ,考哥。。。。"
"星铁代练小鱼仔","保密","无IP","474536251","6","","10000","1","","最后那声猫叫是爱莉还是帕朵[doge]"
"爱打牌的圣堂武士","男","无IP","343533200","5","","10000","1","","奥托怎么变成可爱的美少女了[doge]"
"知世简","保密","无IP","227093978","5","","10000","1","","所以我用老板娘打乐土还用付钱吗？[保卫萝卜_哇]"
"末路Kepler","男","无IP","38181793","6","","10000","1","","最后那一声喵，啊，我的心[原神_躺平]"
"对方正在输入_-_","保密","无IP","474318705","5","","10000","1","","毒池！！！！！"
"Aka阿菇","保密","无IP","364641036","5","崩坏：星穹铁道","10000","1","7","奥托讲堂却是爱莉希雅，这又何尝不是一种ntr[脱单doge][脱单doge]"
"暴走的隐形人","保密","无IP","33038759","6","","10000","1","","[脱单doge]"
"八行璃","男","无IP","646580564","5","","10000","1","","奥托讲堂 ×,爱莉希雅讲堂 "
"怜发如雪","保密","无IP","13748267","6","大理寺日志","10000","1","","00:16 是哪个旅行者出金了[doge]"
"Sleep丶奈城","男","无IP","498164401","5","EveOneCat2","10000","1","","秽土转生之术！"
"知世简","保密","无IP","227093978","5","","10000","1","","“超乖巧”"
"中野丶梓喵","男","无IP","2283058","6","-阿库娅","10000","1","16","成吨伤害！（字面意义）"
"-CHARA","男","无IP","89278740","6","","10000","1","","奥托讲堂特邀嘉宾：爱莉希雅[doge]"
"知世简","保密","无IP","227093978","5","","10000","1","","睡午觉的好地方？是我们的被窝不香了吗？[大哭]"
"花满彼岸","男","无IP","14304906","6","","10000","1","","我要戴帽子的猫猫，明明有模型[星星眼]"
"--冲田小姐大胜利--","男","无IP","124636499","5","星座系列：巨蟹座","10000","1","","“奥托”讲堂"
"铃仙-胰A院-因幡","男","无IP","356147216","6","","10000","1","","靠，我乐土里的旧配音怎么全没了啊，资源都下了，你们也这样吗？"
"-白---泽-","男","无IP","184290485","6","三周年恋曲","10000","1","7","云皇兄，我想不出骚话"
"世界一かわいいのユニ","女","无IP","12359475","6","EveOneCat2","10000","1","10","爱丽希雅讲堂[虎年]"
"大尾巴狼雷狗子","保密","无IP","20798683","6","","10000","1","","对不起[害羞]，帕朵的sp技能我看成弱智的生存之道了[妙啊]"
"知世简","保密","无IP","227093978","5","","10000","1","","你们好鸭！猫猫滴狗狗们[脱单doge]"
"达达鸭oa","男","无IP","520138872","5","","10000","1","","奥托讲堂[doge]"
"诚如君之所说","男","无IP","85444254","6","异常生物","10000","1","","我怀疑奥托在世界蛇给自己留了条后路，但我没有证据[思考]"
"眠羽_","保密","无IP","168192820","6","良辰美景・不问天","10000","1","","爱占奥巢（"
"_的猫","男","无IP","7729187","6","","10000","1","7","不是奥托讲堂吗？"
"-~千-","保密","无IP","389203052","6","三周年恋曲","10000","1","","还以为奥拓复活了呢～"
"希儿服了诶","男","无IP","304203580","4","","10000","1","","卧槽，主教又诈尸了？"
"Dale浪神","男","无IP","89810360","5","","10000","1","","奥托讲堂[doge]"
"是G","男","无IP","481031975","4","","10000","1","4","等你很久啦，撸猫撸猫。[嗑瓜子][妙啊]"
"柚裴丶","保密","无IP","404655485","5","","10000","1","","百万大咖，无人问津"
"璐卡利欧","男","无IP","139271219","6","公主连结凯露","10000","1","","天命前主教珍贵音频[doge]"
"麦当当奶昔","保密","无IP","20909279","6","","10000","1","","教主音容犹在"
"如宣-","保密","无IP","1400098557","4","","10000","1","","喵～[doge][doge]"
"哦卡密です","男","无IP","319183016","5","","10000","1","","奥拓讲堂没有奥拓，这何尝不是。。。。"
"星月七季","保密","无IP","38703460","6","","10000","1","","金鱼来喽"
"一蓑烟雨tx","保密","无IP","266676793","6","明日方舟-愚夜密函","10000","1","","《奥托讲堂》[热词系列_知识增加]"
"贰陆零零-","男","无IP","226853600","6","hanser","10000","1","5","[hanser_贴贴]"
"破损米","保密","无IP","17751024","6","罗小黑战记","10000","1","","猫猫！"
"德糕望重","男","无IP","357659002","6","初音未来13周年","10000","1","","只有我把好运气看成了好色气吗[笑哭]"
"渐忘症持续发病中","男","无IP","189729684","5","","10000","1","","我奥托没了害得加班是吧[傲娇]"
"圣重阳起床了","保密","无IP","292549590","5","原神","10000","1","","乐土血是不是又调回去了"
"名字老长一串了","男","无IP","435674217","6","","10000","1","","好，寄"
"39276658","保密","无IP","352852706","5","","10000","1","","我要武器啊[崩坏3_七][崩坏3_十][崩坏3_米][崩坏3_长][崩坏3_刀]"
"_Yunr_","保密","无IP","283099437","6","夏诺雅","10000","1","","好耶"
"最喜欢朵朵惹","保密","无IP","355110092","5","","10000","1","","已阅"
"-hfjcfjdbs","保密","浙江","1680068339","4","","10000","0","","奥托灵堂"
"宝蓝色的权杖","男","安徽","645818724","5","","10000","0","","有一种两性花，雌蕊在授粉后柱头上会长出新芽，而雄蕊会慢慢凋零。一次，一只蜜蜂问雌蕊：“授粉之后雄蕊就会凋零了，你会想念它吗？”,雌蕊此时已经长出了芽苞，它回答道：“芽已结，我不相思。”_(:з」∠)_"
"谐","保密","广东","57653268","6","","10000","0","11","4444硬币[热词系列_这次一定]"
"秋有鱼","男","河北","10053963","6","","10000","0","","准备开溜搁哪呢？"
"雏名枝夏","男","安徽","365147644","5","希萝Hiiro","10000","0","10","真好"
"X繁体","保密","山东","75083610","6","小主安康","10000","0","","mhy编剧,听我说谢谢你因为有你温暖了四季谢谢你感谢有你世界更美丽我要谢谢因为有你爱常在心底谢谢你 感谢有你♂♂♂把幸福传递"
"-Apkeniqo-","保密","福建","435216463","5","一周年纪念装扮","10000","0","","芽衣姐……我不想死……"
"蕾塞的苦茶子","保密","湖南","1039497580","4","","10000","0","","mhy编剧,听我说谢谢你因为有你温暖了四季谢谢你感谢有你世界更美丽我要谢谢因为有你爱常在心底谢谢你 感谢有你♂♂♂把幸福传递"
"风向苍松","男","河北","649746430","5","","10000","0","","mhy编剧,听我说谢谢你因为有你温暖了四季谢谢你感谢有你世界更美丽我要谢谢因为有你爱常在心底谢谢你 感谢有你♂♂♂把幸福传递"
"-向晚轻寒-","男","贵州","155852059","6","","10000","0","10","编辑我睡不着"
"woqinimade","保密","河南","550523104","5","","10000","0","","mhy编剧,听我说谢谢你因为有你温暖了四季谢谢你感谢有你世界更美丽我要谢谢你因为有你爱常在心底谢谢你 感谢有你♂♂♂把幸福传递"
"沈虹羽","男","辽宁","472319940","5","","10000","0","","mhy编剧,听我说屑屑你因为铀你瘟暖了死寂卸卸你感谢铀你逝界更没离我要泄泄你因为铀你碍肠在腥底血血你 感谢铀你♂♂♂把腥辐氚递"
"圆桌的鬼神Cipher","男","湖南","379754097","5","雪未来","10000","0","9","mhy编剧,听我说谢谢你因为有你温暖了四季谢谢你感谢有你世界更美丽我要谢谢你因为有你爱常在心底谢谢你 感谢有你♂♂♂把幸福传递"
"flowey_blossom","保密","山西","362368552","5","","10000","0","","mhy编剧,听我说谢谢你因为有你温暖了四季谢谢你感谢有你世界更美丽我要谢谢你因为有你爱常在心底谢谢你 感谢有你♂♂♂把幸福传递"
"饿の魔","保密","重庆","504468958","5","快把我哥带走","10000","0","","mhy编剧,听我说谢谢你因为有你温暖了四季谢谢你感谢有你世界更美丽我要谢谢因为有你爱常在心底谢谢你 感谢有你♂♂♂把幸福传递"
"风向苍松","男","河北","649746430","5","","10000","0","","mhy编剧,听我说屑屑你因为铀你瘟暖了死寂卸卸你感谢铀你逝界更没离我要泄泄你因为铀你碍肠在腥底血血你 感谢铀你♂♂♂把腥辐氚递"
"水草","保密","广东","362440464","5","","10000","0","","编剧你还我猫猫[大哭]"
"断翼-穷","男","北京","1603994785","4","","10000","0","","mhy编剧,听我说谢谢你因为有你温暖了四季谢谢你感谢有你世界更美丽我要谢谢你因为有你爱常在心底谢谢你 感谢有你♂♂♂把幸福传递"
"Mazam-","保密","上海","2014251188","5","原神","10000","0","","mhy编剧,听我说屑屑你因为铀你瘟暖了死寂卸卸你感谢铀你逝界更没离我要泄泄你因为铀你碍肠在腥底血血你 感谢铀你♂♂♂把腥辐氚递"
"源起八方","男","山东","405007165","5","","10000","0","","恭喜你，编剧，终于倾尽所能，证明自己，值得一杀，但这不是战斗，而是一场追猎，哈哈哈哈哈哈哈哈哈哈哈哈哈哈，现在同样是尽你所能，开始奔逃吧！！！"
"末の虹林","男","江苏","7853281","6","星座系列：白羊座","10000","0","","呜呜呜，猫猫太让我感动了，呜呜"
"i曦月k","男","北京","1508682109","4","","10000","0","","水里有矿的哦"
"沉眠云","保密","青海","2090782381","4","","10000","0","","嘶，我才知道猫猫是辅助"
"五彩斑斓的绿色","男","无IP","626137489","4","","10000","0","","mhy编剧,听我说屑屑你因为铀你瘟暖了死寂卸卸你感谢铀你逝界更没离我要泄泄你因为铀你碍肠在腥底血血你 感谢铀你♂♂♂把腥辐氚递"
"__Elysia_","保密","无IP","352141670","6","明日方舟","10000","0","","猫猫生日快乐"
"九君丰","保密","无IP","1474331201","4","","10000","0","","mhy编剧,听我说屑屑你因为铀你瘟暖了死寂卸卸你感谢铀你逝界更没离我要泄泄你因为铀你碍肠在腥底血血你 感谢铀你♂♂♂把腥辐氚递"
"我_爱莉希雅的狗","保密","无IP","689958979","4","","10000","0","","mhy编剧,听我说谢谢你因为有你温暖了四季谢谢你感谢有你世界更美丽我要谢谢你因为有你爱常在心底谢谢你 感谢有你♂♂♂把幸福传递"
"价值6个硬币的名","保密","无IP","398658676","5","","10000","0","","mhy编剧,听我说屑屑你因为铀你瘟暖了死寂卸卸你感谢铀你逝界更没离我要泄泄你因为铀你碍肠在腥底血血你 感谢铀你♂♂♂把腥辐氚递"
"小鱼干喵易有限公司","保密","无IP","185825983","5","","10000","0","","mhy编剧,听我说屑屑你因为铀你瘟暖了死寂卸卸你感谢铀你逝界更没离我要泄泄你因为铀你碍肠在腥底血血你 感谢铀你♂♂♂把腥辐氚递"
"花树明丶","保密","无IP","1371474687","5","","10000","0","","mhy编剧,听我说屑屑你因为铀你瘟暖了死寂卸卸你感谢铀你逝界更没离我要泄泄你因为铀你碍肠在腥底血血你 感谢铀你♂♂♂把腥辐氚递"
"把我名字还回来啊","保密","无IP","60951246","6","","10000","0","","编剧你睡了吗，我睡不着"
"哈哈卡22","保密","无IP","1818517584","4","","10000","0","","mhy编剧,听我说屑屑你因为铀你瘟暖了死寂卸卸你感谢铀你逝界更没离我要泄泄你因为铀你碍肠在腥底血血你 感谢铀你♂♂♂把腥辐氚递"
"伟大的特勒西","保密","无IP","525172748","5","","10000","0","","mhy编剧,听我说屑屑你因为铀你瘟暖了死寂卸卸你感谢铀你逝界更没离我要泄泄你因为铀你碍肠在腥底血血你 感谢铀你♂♂♂把腥辐氚递"
"天燃desu","保密","无IP","411586347","5","","10000","0","","mhy编剧,听我说谢谢你因为有你温暖了四季谢谢你感谢有你世界更美丽我要谢谢你因为有你爱常在心底谢谢你 感谢有你♂♂♂把幸福传递"
"摆烂的包菜w","保密","无IP","1503024380","4","","10000","0","","mhy编剧,听我说屑屑你因为铀你瘟暖了死寂卸卸你感谢铀你逝界更没离我要泄泄你因为铀你碍肠在腥底血血你 感谢铀你♂♂♂把腥辐氚递"
"watyan","女","无IP","485000243","5","碧蓝航线","10000","0","","mhy编剧,听我说谢谢你因为有你温暖了四季谢谢你感谢有你世界更美丽我要谢谢你因为有你爱常在心底谢谢你 感谢有你♂♂♂把幸福传递"
"天依天依殿下","保密","无IP","404893699","5","","10000","0","8","mhy编剧,听我说屑屑你因为铀你瘟暖了死寂卸卸你感谢铀你逝界更没离我要泄泄你因为铀你碍肠在腥底血血你 感谢铀你♂♂♂把腥辐氚递"
"风兮梦倚","男","无IP","400828308","5","","10000","0","","[tv_流泪]"
"秋枫萨玛","男","无IP","382455681","5","","10000","0","","mhy编剧,听我说谢谢你因为有你温暖了四季谢谢你感谢有你世界更美丽我要谢谢你因为有你爱常在心底谢谢你 感谢有你♂♂♂把幸福传递"
"LinBoh707","保密","无IP","456759966","5","明日方舟音律系列","10000","0","","mhy编剧,听我说谢谢你因为有你温暖了四季谢谢你感谢有你世界更美丽我要谢谢你因为有你爱常在心底谢谢你 感谢有你♂♂♂把幸福传递"
"账号已注销","保密","无IP","2142523946","0","","5000","0","","mhy编剧,听我说谢谢你因为有你温暖了四季谢谢你感谢有你世界更美丽我要谢谢你因为有你爱常在心底谢谢你 感谢有你♂♂♂把幸福传递"
"X清涵","男","无IP","443929102","5","","10000","0","","mhy编剧,听我说谢谢你因为有你温暖了四季谢谢你感谢有你世界更美丽我要谢谢你因为有你爱常在心底谢谢你 感谢有你♂♂♂把幸福传递"
"一月三鸭","保密","无IP","1372983327","4","","10000","0","","mhy编剧,听我说谢谢你因为有你温暖了四季谢谢你感谢有你世界更美丽我要谢谢因为有你爱常在心底谢谢你 感谢有你♂♂♂把幸福传递"
"再见了Cheems","男","无IP","354176793","5","","10000","0","","不懂就问，为什么炎律可以和猫猫搭配啊，猫猫不是冰辅嘛[疑惑][疑惑]"
"瘦叔来找你2","保密","无IP","442233651","5","","10000","0","","mhy编剧,听我说谢谢你因为有你温暖了四季谢谢你感谢有你世界更美丽我要谢谢你因为有你爱常在心底谢谢你 感谢有你♂♂♂把幸福传递"
"这破名字花了我6个币_","保密","无IP","1175319389","4","","10000","0","","mhy编剧,听我说谢谢你因为有你温暖了四季谢谢你感谢有你世界更美丽我要谢谢你因为有你爱常在心底谢谢你 感谢有你♂♂♂把幸福传递"
"天之天变","男","无IP","516126378","5","","10000","0","","mhy编剧,听我说谢谢你因为有你温暖了四季谢谢你感谢有你世界更美丽我要谢谢你因为有你爱常在心底谢谢你 感谢有你♂♂♂把幸福传递"
"一把小九九丶","保密","无IP","503113682","5","崩坏3・天穹流星","10000","0","","mhy编剧,听我说谢谢你因为有你温暖了四季谢谢你感谢有你世界更美丽我要谢谢你因为有你爱常在心底谢谢你 感谢有你♂♂♂把幸福传递"
"我会永远喜欢汤圆儿","男","无IP","412930113","5","","10000","0","","mhy编剧,听我说谢谢你因为有你温暖了四季谢谢你感谢有你世界更美丽我要谢谢你因为有你爱常在心底谢谢你 感谢有你♂♂♂把幸福传递"
"小天使西琳哒","保密","无IP","163898127","5","","10000","0","","mhy编剧,听我说谢谢你因为有你温暖了四季谢谢你感谢有你世界更美丽我要谢谢你因为有你爱常在心底谢谢你 感谢有你♂♂♂把幸福传递"
"改名叫小邓","保密","无IP","481833375","6","三周年恋曲","10000","0","","mhy编剧,听我说谢谢你因为有你温暖了四季谢谢你感谢有你世界更美丽我要谢谢你因为有你爱常在心底谢谢你 感谢有你♂♂♂把幸福传递"
"三笠治好了我的性冷淡","保密","无IP","502471762","4","","10000","0","","mhy编剧,听我说谢谢你因为有你温暖了四季谢谢你感谢有你世界更美丽我要谢谢因为有你爱常在心底谢谢你 感谢有你♂♂♂把幸福传递"
"该昵称已存在233333333","保密","无IP","113032309","6","","10000","0","","mhy编剧,听我说谢谢你因为有你温暖了四季谢谢你感谢有你世界更美丽我要谢谢因为有你爱常在心底谢谢你 感谢有你♂♂♂把幸福传递"
"甜了荔枝","保密","无IP","429520851","5","","10000","0","","mhy编剧,听我说谢谢你因为有你温暖了四季谢谢你感谢有你世界更美丽我要谢谢因为有你爱常在心底谢谢你 感谢有你♂♂♂把幸福传递"
"深海的spira","保密","无IP","252304967","6","","10000","0","","[热词系列_知识增加]"
"某未知的神净讨魔","保密","无IP","359901608","5","","10000","0","","mhy编剧,听我说谢谢你因为有你温暖了四季谢谢你感谢有你世界更美丽我要谢谢因为有你爱常在心底谢谢你 感谢有你♂♂♂把幸福传递"
"不想再保底了","保密","无IP","415160830","5","","10000","0","","mhy编剧,听我说谢谢你因为有你温暖了四季谢谢你感谢有你世界更美丽我要谢谢你因为有你爱常在心底谢谢你 感谢有你♂♂♂把幸福传递"
"o何小胖o","保密","无IP","101549722","6","公主连结凯露","10000","0","","mhy编剧,听我说谢谢你因为有你温暖了四季谢谢你感谢有你世界更美丽我要谢谢你因为有你爱常在心底谢谢你 感谢有你♂♂♂把幸福传递"
"小B游LH","女","无IP","343058477","5","","10000","0","","mhy编剧,听我说谢谢你因为有你温暖了四季谢谢你感谢有你世界更美丽我要谢谢你因为有你爱常在心底谢谢你 感谢有你♂♂♂把幸福传递"
"破碎的尽头","男","无IP","13968498","5","至尊戒","10000","0","","mhy编剧,听我说谢谢你因为有你温暖了四季谢谢你感谢有你世界更美丽我要谢谢你因为有你爱常在心底谢谢你 感谢有你♂♂♂把幸福传递"
"一曲清词","保密","无IP","678471484","5","","10000","0","","mhy编剧,听我说谢谢你因为有你温暖了四季谢谢你感谢有你世界更美丽我要谢谢你因为有你爱常在心底谢谢你 感谢有你♂♂♂把幸福传递"
"音","男","无IP","442620954","5","崩坏：星穹铁道","10000","0","","mhy编剧,听我说谢谢你因为有你温暖了四谢谢你感谢有你世界更美丽我要谢谢因为有你爱常在心底谢谢你 感谢有你♂♂♂把幸福传递"
"禁夜开摆","男","无IP","354562713","5","","10000","0","","mhy编剧,听我说谢谢你因为有你温暖了四季谢谢你感谢有你世界更美丽我要谢谢你因为有你爱常在心底谢谢你 感谢有你♂♂♂把幸福传递"
"天年汐","男","无IP","609050375","5","春原庄的管理人小姐","10000","0","","mhy编剧,听我说谢谢你因为有你温暖了四季谢谢你感谢有你世界更美丽我要谢谢你因为有你爱常在心底谢谢你 感谢有你♂♂♂把幸福传递"
