"昵称","性别","IP","UID","等级","装扮","用户权重","获赞数","粉丝团等级","评论"
"鸽子精_喜欢","保密","无IP","384531212","3","","10000","5","","丽塔.洛丝薇瑟本身是天命组织抓来作为早期女武神崩坏能适应性实验的众多孤儿之一-，而经过天命数年崩坏适应性实验最终幸存下来的她引起现任天命主教奥托.阿波卡利斯对于人类崩坏能承受极限的极大兴趣，为了便于今后对此特殊个体的观察，  奥托选择收留了她，取名丽塔，洛丝薇瑟并让她加入到女武神编队中。,,      对于丽塔而言，若能为收留自己并给予名字的奥托主教排忧解难，将会是自己莫大的荣幸。于是在天命内部宣布秘密调查逆熵复活第六律者失败时炸毁的实验室后，她主动请缨，率领一队女武神执行此次调查任务。,,      在击杀了实验室废墟附近徘徊的数只崩坏兽后，丽塔和她的小队在实验室深处发现了一把被崩坏能环绕的镰刀，当小队成员试图联系奥托主教确认情况时，丽塔确被一种无形的力量吸引过去，她拿起了镰刀，随即感受到一个声音在脑海中响起，“等我希儿出去，就把你们都杀了”。自此，丽塔:洛丝薇瑟正式成为了希儿附身的宿主。奥托明白只有丽塔才能压制死之律者的意识和其武器蕴含的力量，也允许她继续将这个武器留在身边。,,      希儿并非只是想寻找一个可以承受自己力量的宿主，她试图接管丽塔的身体获得控制权，然后把欺负布洛尼娅姐姐的人都杀掉并且毁灭这些迟迟不让自己出场的睿智侧滑。"
"VJia初音ミク","保密","无IP","8638104","6","","10000","5","","镰刀女王：大锅你愣镰刀没窝愣好看，也没窝愣滴大唉()"
"神州符壮实","保密","无IP","170089740","6","拜年祭粉丝专鼠","10000","5","","奥托你小心点(｀ω)"
"是乌翼不是鸟冀","男","无IP","13650450","6","EveOneCat2","10000","5","","讲真这次看到绿托大人的模型我真的笑的喷了出来[2233娘_大笑]"
"Liar-T","男","无IP","164673321","6","","10000","5","","苟奥托你要是敢把班长杀了我就弄死你"
"姜洛辰","男","无IP","12430586","6","","10000","5","2","舰长：丽塔你走！**思夜想的女人才不是你！！[小电视_哭泣],希儿：舰长大人。。。[小电视_太太喜欢],舰长：你以为，你夺走了她的武器，抢走了众人的目光，我就会爱上你的大长腿做舔狗吗！！！[小电视_好怒啊],希儿：舰长大人您别说了，希儿还能继续等下去――[小电视_哭泣],舰长：但是我还不会放弃！我的648只属于你！镰刀女王！！！[冷兔_喜欢],希儿：！！！！！！！！！！,【您已与服务器永久断开连接】"
"假面骑士Niema","保密","无IP","89448243","6","公主连结可可萝","10000","5","","心疼姬子qwq，为什么真红那里全是大月卡，到了这大家都是prprprpr"
"林轩和暮云落","女","无IP","616717661","4","","10000","5","","这个怎么得，新手一见钟情，想要[大哭][大哭]"
"咕噜咕噜小水也","保密","无IP","33709522","6","EveOneCat2","10000","4","","看了蔷薇一梦之后的我整个人都不好了( _f｀)"
"秋风与细雨","保密","无IP","171432805","4","","10000","4","","大号有丽塔没镰刀 小号有镰刀没丽塔，"
"千叶黛","女","江西","12160792","6","","10000","4","","就因为弹丸论破是小众游戏，就可以抄角色吗……哎。最近发现了一些类似的事，感觉很失望。"
"异世界的龙傲天","保密","无IP","124368139","6","","10000","4","","为什么我第一眼看成雷姆了（￣へ￣）"
"展僚","男","无IP","2094757","6","","10000","4","","这英雄是不是很强啊，萌新刚开出这个，比我所有的女武神战力都高，问题是我还没武器"
"竹取绮罗幽云处彡","保密","无IP","36590937","6","三周年恋曲","10000","4","","自从有了丽塔，我才知道我不是什么空中劈叉清洁工，而是舰长大人"
"Bili_24898678","男","无IP","24898678","5","","10000","4","","好了教学看完了，女仆去哪里领呢"
"赫国龙鸣","男","无IP","55912690","6","","10000","4","","最喜欢一个女生拿着比她大俩头的镰刀在那瞎jb乱挥的角色了hh"
"老国王瓦里安乌瑞恩","男","无IP","17158873","6","","10000","4","","现在骂编剧会有人点赞吗？"
"抹茶土豆南小鸟","保密","无IP","165795838","6","EDG战队","10000","4","","抽出来镰刀加全套圣痕的来露个脸。。"
"时之环-安格列","男","无IP","262462998","6","","10000","4","","奥托，符华姐姐要是死了，我就把三个卡莲拉倒无限深渊25层死一天"
"一只卡修斯","保密","无IP","172473600","6","洛天依9th生日纪念","10000","4","","是我卡了吗？用月下使用普通攻击时，德莉莎一直拿着斧子干了起来，没换。"
"账号已注销","保密","无IP","100956923","0","","5000","4","","把一律核心吃了已经六核了……告诉我当时这种实力谁能打败?这除了终焉律者就基本上最强了，塞西莉娅到底怎么同归于尽的，坐等mhy填坑( _f｀)"
"哥谭好市民小丑君","保密","无IP","161728028","5","","10000","4","","为什么丽塔在侍奉我而不是绿托?等等!莫非我们就是绿托!不!我没绿，我没绿"
"静陌无雨","女","无IP","10959178","6","EveOneCat2","10000","4","","绿托！出来挨打！"
"阿S","保密","无IP","122427796","5","初音未来13周年","10000","4","","班长怎么了鸭？"
"Liney24","保密","无IP","289051008","6","EveOneCat2","10000","4","","噫，好，我中了"
"Line_Yu","男","无IP","29323454","6","","10000","4","","我神州平板要是出了什么事绿托你的女仆也别想要了c(`Д)"
"我一点都不安息","保密","无IP","30919097","6","","10000","4","1","奥托还我符华上仙！出来挨打"
"Allen-Kaslana","男","无IP","223133259","6","星座系列：射手座","10000","4","11","就没人注意浮华有2把神之键吗？没用的那把没准可以保命哦～(｀ω)"
"枭雄z","男","无IP","12385003","6","","10000","4","","奥托我ri你先人板板"
"慎晋冰","男","无IP","226352228","5","","10000","4","","奥托进本了就等着挨打吧"
"冰色爱恋","保密","无IP","53601227","6","","10000","4","","我每次看教学视频的重点是在最后奥拓对她们的评价"
"酱酱喜欢吃拉面","保密","无IP","141512255","6","","10000","4","","死***奥托你还我上仙![小电视_好怒啊]"
"李昂子爱","女","无IP","28200353","6","崩坏：星穹铁道","10000","4","14","绿托还我符华"
"Levelfive御坂","保密","无IP","367454773","5","","10000","4","","绿的不能再绿的绿托，还我神州平板， 本舰长活着就是为了班长大人"
"终极艾克斯","保密","无IP","249672041","6","","10000","4","","奥托！还我浮华上仙"
"白羽樱雅","保密","无IP","12898153","6","","10000","4","10","奥托出来挨打，还我上仙!"
"非洲之星大酋长","男","无IP","160975412","6","刺客伍六七","10000","4","","我就算是死，死外边跳下去也绝不会背叛希尔的。嗯！真香！这黑丝！这胸！对不起班长我叛变了。我永远喜欢丽塔.jpg"
"将死你","男","无IP","33009493","6","良辰美景・不问天","10000","4","","欢迎来到每月的奥拓骚话时间[小电视_笑]"
"沙柏章","保密","无IP","16557558","6","","10000","4","","你个老神棍，还我上仙"
"这是一个普通名字","男","无IP","204793273","6","","10000","4","","奥托大人：我于杀戮之中盛放，亦如黎明中的花朵"
"miki瞳光","保密","无IP","57020405","6","","10000","4","4","死奥托你还我符华仙"
"合金装备布狼牙_","保密","无IP","29782217","6","","10000","4","","左眼不需要的话可以...可以让我看看吗[小电视_害羞]"
"牛头纯爱狂战士","男","无IP","37315684","6","","10000","4","","我今天中午单抽，超想玩丽塔，去聊天区说怒*大伟哥保我出丽塔。,然后……,然后我出了个真红……,,这真的是非到一定程度了。[小电视_发愁][小电视_发愁][小电视_发愁]"
"一条~","保密","无IP","161854752","6","还有醒着的么","10000","4","","先别管教学，求求你们出个能在乱斗竞速结算界面举报的功能吧[小电视_嘟嘴]已经遇见几个神仙了，就只能干看着不能举报，特别心塞"
"立立A","保密","无IP","15122922","6","","10000","4","","希儿：镰刀都出了，下一个是不是……    镰刀婊：没错，就是老娘[2233娘_大笑]"
"盗版侧-西卡罗","男","无IP","7641681","6","小东人鱼","10000","4","","绿托你敢杀符华我就把卡莲拱了c(`Д)！三个！！"
"繁星の落幕","保密","无IP","11782358","6","","10000","4","","符华要是有个三长两短，我就当回猪把你家卡莲拱了！"
"名非名","男","无IP","38727543","5","","10000","4","","杀符华？怕不是要觉醒，绿托大人，小心新身体被打爆哦！"
"风和日丽马孔多","保密","无IP","73747782","5","","10000","4","","我一个朋友丽塔块抽成SS了，我才用碎片攒成A[蛆音娘_扶额]"
"夏叶晚枫","男","无IP","23399300","6","","10000","4","","真难相信丽塔和爱酱是一个人配的。"
"黑色管弦乐队","男","无IP","269254716","6","洛天依9th生日纪念","10000","4","","希尔：新角色是用镰刀的所以……,丽塔：没错就是在下"
"蔷薇一梦t","男","无IP","111178258","6","暮光幻影","10000","4","","听说四级号需要打破自己的第一次(=ω=)"
"愿望把世界种满香菜","女","无IP","8026960","6","EveOneCat2","10000","4","","希儿：等我出来，什么垃圾丽塔，你死定了[小电视_嘟嘴]"
"黑猫今天吃饭了没","保密","无IP","32070571","6","花园Serena第二弹","10000","4","","爱酱:里塔老婆可爱不可爱？,舰长:可爱！,爱酱:里塔老婆美不美？,舰长:美！,爱酱:里塔老婆厉害不厉害？,舰长:厉害！,爱酱:氪648.2让里塔老婆sss好不好？,舰长:…滚！,[2233娘_委屈]"
"向月色奔去","保密","无IP","350300167","5","","10000","3","","我想要她的专属镰刀[酸了]"
"想个名字都那么难不想了","男","无IP","153241141","5","","10000","3","","丽塔：老娘丽指导，绝杀先掐表。剩下十几秒，战术打不了。拉开我单打，老娘就是diao。我是波特兰开拓者队的丽塔・利拉德，你们也可以叫我丽指导"
"珠泪哀歌--塞壬人鱼","男","山东","63016896","6","","10000","3","6","暗蔷薇至今是我崩三里玩过的最丝滑的的角色"
"欧气与希望","女","无IP","287082879","3","","10000","3","","别人用丽塔，血条越打越多，我用就是越打越少_(:3」∠)_"
"那年夏日未闻花名","保密","无IP","16513137","6","琉晶之礼","10000","3","8","第一次发现这个系列，还有我超喜欢奥托大人他的声音好苏。"
"美cattttt","保密","无IP","4825082","6","","10000","3","","旁白好骚"
"赤朦秘苑","保密","无IP","17555295","6","","10000","3","","不知是错觉还是什么，这个角色闪避特别呆板，有时候按了闪避都没反应，而且出时空断裂时总会卡一下，烦死人。"
"天元寒帝","男","无IP","262277141","6","","10000","3","10","丽塔关卡第一关怎么过，碰一次就完了我是来十几次于是我放弃了不就是5水晶吗        (_)"
"首先管好你自己","男","无IP","197304854","6","","10000","3","","没人发现绿托的小丑身体和班长的白夜衣服一模一样？"
"绘星空灬","保密","无IP","35798044","6","","10000","3","","我猜过段时间b站就会有，快乐丽塔，10级流血的视频[小电视_嘟嘴]"
"踩H","保密","无IP","30019559","6","","10000","3","","希望再出一个八重樱，看看奥托大人怎么介绍"
"流泪头","保密","无IP","199974973","5","","10000","3","","恭喜今天三崩子评分升到了7.8"
"账号已注销","保密","无IP","45055512","0","崩坏3・天穹流星","5000","3","","奥拓，出来受死！"
"纱の夜","男","无IP","6864899","6","","10000","3","","这位带着绿色圆顶帽的中二拓你的女仆已被我签收[小电视_赞]，听说你那还有个S级的金发萌妹什么时候能交出来呢？(｀ω)"
"秋月英梨梨","保密","无IP","177745273","6","","10000","3","","奥托大人，你的女仆啥时候能觉醒成希尔啊"
"蝶sh杀","保密","无IP","11611025","6","明日方舟音律系列","10000","3","","策划怎么可能让班长死呢，这个角色坑太多，而且说不定开枪的齐格飞"
"寒樱落花","保密","无IP","39784456","5","","10000","3","","绿托要敢动我上仙，我就拿剧情策划的狗头祭天！(s°口°)s(┴―┴"
"沐璃子想被carry","男","无IP","22929477","6","还有醒着的么","10000","3","","别讲解了，过来挨打吧！"
"鲸光光初号机","保密","无IP","38028667","5","时光代理人","10000","3","","辣鸡奥托你敢动我班长？？!"
"怪盗塔菲","保密","无IP","26929671","6","崩坏3・天穹流星","10000","3","","奥托还是一样的绿"
"雨天的艾莉丝酱","保密","无IP","10619584","6","","10000","3","2","希望能把符华的教程视频也补上，符华很强，但是真的很难用。月轮和白夜"
"M大力","男","无IP","17804176","6","","10000","3","","狗托你还我符华上仙啊啊啊啊啊啊啊"
"mako_-","男","无IP","354644608","6","","10000","3","","我感觉希儿就是丽塔的灵魂觉醒                    （￣￣）"
"有何无镜","保密","无IP","16355650","6","","10000","3","","奥拓:一切都是命运的指引,八重樱:没错，我绿你也是命运的指引"
"一叶知鳅","男","无IP","157524509","6","明日方舟","10000","3","3","狗托还我班长（/TДT)/"
"黑暗恋情","男","无IP","12791021","6","","10000","3","","我就问谁有勇气在人多的地方看绿托的视频"
"1优雅","保密","无IP","340215101","6","汉化日记","10000","3","1","绿托，要是符华上仙死了，刀片伺候"
"八云紫十三纬度级","女","无IP","14820302","6","进击的冰糖","10000","3","","奥托:克隆人在营养舱里的时候不可能有衣服。"
"贝多VAN病毒","男","无IP","6767584","6","","10000","3","","绿托你还敢在这说骚话，休伯利安自杀式袭击警告！"
"wulinofuture","保密","无IP","43294681","6","一起看电竞","10000","3","","这些都不重要，我现在只想知道平民怎么在三秒打八万伤害在第九章噩梦9-4[小电视_差评][小电视_差评][小电视_差评]"
"窗边瞳子","保密","无IP","29150903","6","","10000","3","","爱酱终于变成女武神了[2233娘_喝水]"
"海豹轰炸机","男","无IP","6789046","5","","10000","3","","消灭奥拓暴政，丽塔属于舰长"
"路西法亚","男","无IP","38945172","5","","10000","3","","空岛的bug好多啊，我卡出去两次了都，还有怪物，不是上天就是遁地的……"
"阴影中路过的JOKER","男","无IP","34228054","5","","10000","3","","以前：奥托大人，要加油啊！！,现在：奥托！你个扑 街  山 铲！给我出来受死！c(`Д)给我去吃烤肉！"
"YW评级","保密","无IP","130916981","6","","10000","3","","奥托大人的声音真的苏爆了ε=ε=(ノRQ)ノ"
"李二狗official","男","无IP","11004354","6","","10000","3","","看来奥拓大人很会用女仆嘛"
"Striving丶辉仔","保密","无IP","246377134","6","","10000","3","","奥托你要是敢杀浮华的话，我就让我的卡莲被猪拱"
"玛修基列莱特Alter","男","无IP","170192484","6","精灵王","10000","3","","操作难度较低，练了练了"
"小声点我正看着呢","男","无IP","28654817","6","","10000","3","10","我就特别喜欢丽塔放大的时候叮的一下，然后说一句失礼了(｀ω)"
"抹布0","男","无IP","298547785","5","","10000","3","","当你兴奋地抢到前排时……,却发现没有可以编出的段子……,于是就这样眼睁睁的看着热评从手中流逝掉……,需要用心去体会的绝望……"
"egsmks","女","无IP","21590180","5","","10000","3","","赶紧记忆战场出绿托，我打爆他狗头"
"只是单纯的想换个名字","保密","无IP","282870424","5","","10000","3","8","李德（1900年～1974年），奥地利人，共产国际派驻中国的军事顾问。1900年9月28日生于德国慕尼黑，1974年8月15日卒于柏林。原名奥托。第一次世界大战期间参加德国***。1918年参与创建巴伐利亚苏维埃。1926年被德国政府逮捕监禁。"
"花鸟彡风月","男","无IP","12335298","6","夏诺雅","10000","3","","其实这把镰刀叫拉亚斯特，而解说叫凯隐。[小电视_笑][小电视_笑]"
"mega亚安","保密","无IP","57069094","5","","10000","3","","第一"
"黑山基地c区前台","男","无IP","9161575","6","","10000","2","","至今为止，我啥珍贵的皮肤都没有，就是不缺丽塔和女王的皮肤。,我入坑是为了女王，而我继续玩下去的动力则是丽塔给我的。"
"V|晃","保密","无IP","33386622","6","呜米","10000","2","","梦开始的时候"
"YANGDR_","男","无IP","174398710","6","","10000","2","6","30级2s了，新手福利太好了"
"xxMarkrovxx","男","无IP","242158396","6","少前小剧场","10000","2","","造成政治伤害"
"懒摇白羽扇__","保密","无IP","390147707","5","","10000","2","","丽塔的闪避 抓住你了 特别好听 我的第一个ss  第一个氪金买衣服的女武神"
"松坂砂糖b","女","无IP","67176163","6","初音未来13周年","10000","2","","阿芙王尔德一套，毕业打卡（￣￣）"
"明了不明了了","男","无IP","395894648","5","","10000","2","","每次怪很多用丽塔开大清屏的时候就闪退"
"人间天使珈百璃","保密","无IP","261624582","5","","10000","2","","一个月前刚玩第一个十连就抽到了神恩颂歌和暗蔷薇(⌒⌒)"
"⒚妤楗ぅ扩`大和","保密","无IP","59134968","6","","10000","2","","爱酱 你就交代吧 其实你就是绿托对不对！！！"
"朴源想趴桌就睡","男","无IP","204918311","5","","10000","2","","丽塔，影铁不好看，红心皇后也不行，我只爱女仆"
"巫夜凌","保密","无IP","96430139","5","","10000","2","","战骑士・月兔,混合驱动型创造形成装甲,大招可以分为两种形态：,全身配色为红色的速度型女武神战甲和全身配色为蓝色的重装型女武神战甲！,若持有专属武器：Dangerous trigger的同时开启大招五秒不关闭就会进入全身配色为黑色的暴乱状态，暴乱状态女武神装甲威力大幅提升攻击不分敌友且玩家无法操作无法切换女武神，每秒燃烧生命至死亡为止"
"miku家の紫清","保密","无IP","21607316","6","","10000","2","","s级深渊试水，怎么说呢……一个分支下去直接自杀……[蛆音娘_扶额]"
"养只呆毛镇镇宅","女","无IP","40455201","6","","10000","2","","行了，绿托，你看看还有谁在你手下。姬子阿姨和浮华要有事，幽南黛尔你也不用想了，是我的了。[蛆音娘_生气][蛆音娘_生气][蛆音娘_生气]"
"踏月冰颜","男","无IP","8804716","6","","10000","2","","b服一堆初始号活动补给刷屏这天没法聊了 (_`)"
"txigvirzhg","保密","无IP","39666141","5","","10000","2","","蔷薇超好用，刚抽到，开心(=ω=)"
"浮世A4","男","无IP","177368676","6","","10000","2","","就我一个肝出来的吗？"
"啦私聊啦","女","无IP","302409974","3","","10000","2","","讲了跟没讲一样"
"kurumi时崎","男","无IP","18737298","6","希萝Hiiro","10000","2","","绿托辛辛苦苦积累的人气瞬间破灭[蛆音娘_滑稽]爱酱大胜利！"
"啊我又懂了","保密","无IP","14538068","6","","10000","2","","明天第4发10连，奥托你要是还不把真红放出来，就等着喝我和卡莲的喜酒吧"
"为世人献上爱丽丝","保密","无IP","23154670","6","崩坏3・天穹流星","10000","2","","丽塔大招放一次掉一次线的难道就我一个吗？包菜头呢？能不能出来给个说法啊！"
"椋糖","女","无IP","51194780","6","小桃","10000","2","","你们真不觉得一把拟态就能干翻符华是很荒谬的事吗…（自我安慰）"
"阶斗历史矛盾运动","保密","无IP","1276888","6","领风者","10000","2","","丽塔攻击的理念不是收割，是清扫啊…[小电视_哭泣]"
"小梦忆夏","保密","无IP","71151037","6","花园Serena","10000","2","","你以为给我女仆我就不会计较你打我家平板的事吗？这女仆真香[小电视_笑]"
"沐白Kvin","保密","无IP","102096700","6","","10000","2","","许愿阿芙洛狄忒，出必还愿"
"吴里曼","男","无IP","771747","6","明日方舟-愚夜密函","10000","2","","那么奥托大人，这位女仆我也收下了，以后您那还有人请记得叫咱哦~"
"普陀区汉本科","男","无IP","37883877","6","","10000","2","","绿托我劝你善良，别逼我开启绿托raid"
"逍遥散の梦","保密","无IP","42412200","6","星尘","10000","2","","奥 托 家 的 龙 女 仆(无端迫害)"
"飘飘然的乐纸","女","无IP","12132331","6","","10000","2","3","许愿阿芙洛狄忒，出必还愿"
"食堂泼了辣酱","保密","无IP","186846848","5","","10000","2","","新出的再怎么强，月轮还是秒天秒地"
"老欢子","男","无IP","30481559","6","","10000","2","","丽塔，露丝，微色"
"R__","保密","无IP","10295920","6","","10000","2","","丽塔没有日文配音好难受"
"樱殇1929","保密","无IP","65600137","5","","10000","2","","班长凉了我。。。。就上八重樱！"
"汞","男","无IP","129912","6","","10000","2","","这就是爱酱的精分角色吗？"
"某傲娇的电击少女","男","无IP","6018215","6","","10000","2","","莉塔的黑丝胖次和鬼铠同款[小电视_害羞]"
"那位网友","男","无IP","168675682","6","救赎","10000","2","","超喜欢丽塔大结束时那个像响指的声音，感觉世界都安静了"
"佛安道","保密","无IP","35742005","6","精灵王","10000","2","","组团绿绿托（1/10000）(=ω=)"
"账号已注销","保密","无IP","319514800","0","","5000","2","","丽塔加第六夜加神恩，日穿所有关卡，亲测[星梦手记_未来认真]"
"湘北麒麟儿","男","无IP","4541021","6","","10000","2","","其实我一直有个疑问，符华不是比奥托活的更久的远古神仙一样的存在吗，而且还是战斗类型的？为什么感觉很弱呢，我还以为会是无敌的存在，最起码和后世的这些女武神应该不是一个等级的吧，居然和丽塔五五开。我只玩过游戏，游戏剧情倒是都看了，但真的云里雾里，而且也不知道符华为啥还受命于奥托……有没有大佬解惑.._:(_`」 ∠):_ …"
"ユキ友奈","保密","无IP","38031754","6","","10000","2","","希儿：等我出来就把你们这些插队的都杀了[2233娘_怒]"
"yjm484","保密","无IP","6475489","6","碧蓝航线","10000","2","","刚打完剧情奥托出来挨打！！"
"就当借口","保密","无IP","86379244","6","hanser","10000","2","","抽出丽塔后来了个副产品真红。。。养不起啊"
"Red-Ray","男","无IP","103767346","6","","10000","2","","奥托，乖乖站好"
"一笙灬随风","保密","无IP","19422563","6","C酱です","10000","2","","奥托！出来挨打！"
"南小小鸟鸟鸟","男","无IP","12997457","6","","10000","2","","希尔：等我出来了我要把这些插队的都杀了[2233娘_吐魂]"
"千纸折","男","无IP","97222287","5","","10000","2","","绿托黑丝阿符有点什么事的话，你就等着一群sss级女武神在你家天命门口等着吧mmp"
"结诚英","女","无IP","13856559","6","","10000","2","","这其实是梅林的女体吧，走路都带花。"
"羽渊梓曦","保密","无IP","28225966","6","","10000","2","","奥托你还我浮华上仙(s°口°)s(┴―┴"
"千面fox","保密","无IP","59356041","6","","10000","2","","这蛋池概率我想笑，六十发没出一个王尔德或者阿芙洛狄忒，说up我就笑了笑"
"荔枝苹果树","保密","无IP","99454310","6","2020拜年祭（鼠）","10000","2","7","奥托出来挨打，就是你向我老婆符华开的枪？()"
"-maka-","男","无IP","103387310","6","","10000","2","","低配手机丽塔一放大就闪退(s°口°)s(┴―┴"
"小药丸是要完了","保密","无IP","275647773","6","请吃红小豆","10000","2","","奥拓（凯隐）:拉亚斯特你不要我了QAQ"
"途方に暮れて","男","无IP","12782104","5","","10000","2","","可以这角色手感不太行，就连做视频的都被泰坦拍了两下。普攻时闪避太慢"
"轻烟薄雾未闻花名","保密","无IP","43811992","2","","10000","2","","丽塔洛丝薇瑟崩坏第一黑丝裤袜"
"千乐入耳","男","无IP","7524144","6","原神","10000","2","","这个版本最优先推荐培养的新角色，虽然以往出新角色我都不太推荐当前版本就去培养，但是这次的丽塔倒是个例外。"
"浅草至","男","无IP","318548020","5","","10000","2","","真的没有一个人说是拉姆吗"
"五年前的时崎狂三","男","无IP","39875910","6","","10000","2","","奥托，我弄死你，"
"h家FT","保密","无IP","5615010","6","白蛇2：青蛇劫起","10000","2","","绿托还我上仙！"
"容我想想昵称","男","无IP","44945000","6","","10000","2","","今天40连下去提了3把镰刀，我的王尔德呢( _f｀)"
"玉","男","无IP","12159414","6","","10000","2","","我出600水晶复活班长！"
"高能神烦狗","男","无IP","49867080","6","","10000","2","","下一个阿福一定会欧拉了绿托"
"小火小火小小火","保密","无IP","37839015","6","","10000","2","","你以为我是丽塔，其实我是爱酱哒！cv都是怪物系列啊"
"YouMin酱","男","无IP","182523772","6","冬季","10000","2","","就我觉得策划突然不是睿智了吗（￣￣）"
