"昵称","性别","IP","UID","等级","装扮","用户权重","获赞数","粉丝团等级","评论"
"O^客O","保密","无IP","381710475","6","灵笼","10000","1","","嗯，很强，很好看，很牛逼，所以菲谢尔你什么时候才能变成这样？你真的很脆[捂脸]"
"一把丛雨","男","无IP","356909267","5","","10000","1","","真就没拳套呗[热词系列_好家伙][热词系列_知识增加]"
"崩坏丶星穹轨道","男","无IP","95872934","5","","10000","1","","关于因为我太强，所以去当辅助摸鱼这件事--符华"
"饭吃不吃吃不饭","男","无IP","349778098","5","明日方舟","10000","1","","尝龟密码：我什么都做不到,上仙限定密码：我什么都做得到,[doge][doge][doge]"
"雨夕叁叁","男","无IP","27494251","6","三周年恋曲","10000","1","11","憨符[OK]"
"狐狸苏兮","保密","无IP","450185841","4","","10000","1","","哇哦！,好耶！,就凭你?,你弱爆了！,我将～扭转万向！,太虚之握！,哈哈哈哈～～"
"泽野ion","保密","无IP","689814594","4","","10000","1","","钱包：空,寿命：懂,[doge][doge][doge][doge][doge][doge]"
"庭前旧梅","保密","无IP","507445512","5","","10000","1","","新理解,辅助？当然是符华自己辅助自己啦[调皮]"
"西行寺幽幽子","男","无IP","2929536","6","","10000","1","","符・克劳德・华"
"金色暗影__","保密","无IP","11610500","6","魔法学院","10000","1","","为什么单独针对白夜？为什么单独针对白夜？"
"-xiu--","保密","无IP","211121078","6","","10000","1","3","嗨，我人真好[doge]"
"アトリちゃん","保密","无IP","490833738","5","","10000","1","","这辅助？"
"MeineHing","男","无IP","379331178","5","","10000","1","","还我上仙[大哭]"
"秦瑜12138","女","无IP","516137556","4","","10000","1","","给你三连了，不要不识抬举[doge]"
"摸鱼苍狼","男","无IP","9862316","6","双生视界・花嫁","10000","1","","啊!冲这黑符的配音，我又回来了"
"口嫌体正傲娇喵","男","无IP","15913220","6","","10000","1","","我TM眼睛都要被闪瞎了。"
"-黄金船-","男","无IP","12386962","6","","10000","1","","符华已经很累了，符华想要休息，但你们考虑过她的心情吗？，没有，你们只想要继续压榨打了几万年工还没假休的老班长，好继续出新角色[热词系列_保护]"
"粟Aikeli","保密","无IP","498303134","5","","10000","1","","果然，把人都杀光了我就是最强辅助了。（你）"
"霜","保密","无IP","135681462","5","原神","10000","1","","如果这次识律强度不下毒，那这真就冲业绩啦"
"ZHP安墨","男","无IP","107029441","6","原神","10000","1","","崩坏意识：你们是我带过最差的一届律者[大哭][大哭][大哭]"
"绯红之梦great","保密","无IP","346614891","5","","10000","1","","求一发入魂"
"0o让我触手可得oo","保密","无IP","35136470","6","异常生物","10000","1","","4.6啥时候更新啊"
"天才欧阳","男","无IP","13103456","6","","10000","1","","好家伙，我tm直接好家伙。,别人的律者密码：“我什么都做不到”,到黑虎阿符这直接反着来：“我什么都做得到”,可以，不愧是你。,（这TM是辅助？又一个把敌人杀光队友就不需要我辅助的C位辅助呗。）"
"茶猞与梦","保密","无IP","324301330","6","崩坏3・天穹流星","10000","1","7","这次的表现...太完美了！"
"樱花雪心","保密","无IP","87842870","6","明日方舟音律系列","10000","1","","新的符华=2个老婆[doge]"
"炎芊羽","女","无IP","186714001","5","崩坏3・天穹流星","10000","1","","我什么都做得到！！！[原神_晚安]"
"秋里乘凉夏吃糖","男","无IP","1620048","6","汉化日记","10000","1","","全员律者，不瞒了，其实俺也是（说着拿起了扫把）"
"天字一号护卫","女","无IP","352086039","4","","10000","1","","钟离，你看看人家[doge][doge]"
"sunbq66","男","无IP","358375307","5","电子喵","10000","1","","只要把敌人全杀了，主C就安全了[OK]"
"常磐柯南","保密","无IP","129350","6","","10000","1","","等等……,律者从符华身体里面诞生……然后拆了天命……跑回老家……大战各路牛鬼蛇神……,emmm……你他喵的再写西游记吗？"
"霜","保密","无IP","135681462","5","原神","10000","1","","普通人 律者化,符华 让律者认为自己是守护者 让律者符化,这差异可见上仙这万年记忆之可怕"
"tuuyjj","保密","无IP","1738221","6","","10000","1","","天动万象？ 不行,扭转万象？ 行！"
"心晴煎蛋","保密","无IP","17232651","6","少女前线","10000","1","6","物（武）理（力）辅助确认[OK]"
"酸红豆","男","无IP","85928557","6","明日方舟音律系列","10000","1","","撒，来细数马老师的中二次数吧,事到如今还数的清嘛！？,[doge]"
"然批不能处","保密","无IP","245836305","6","","10000","1","3","来呀，出来呀，之前喷皮肤的，来呀，磕头啊[2021]"
"穆雨仄","保密","无IP","43256827","6","星座系列：白羊座","10000","1","","离谱的辅助符律，希望上线的时候策划不会像隔壁一样，献祭全家"
"星野ikura","保密","无IP","172836471","6","","10000","1","","黑华：以后有什么要我帮忙的尽管开口,我：我单身,符华：寸劲开天！"
"无糖可乐是什么","女","无IP","18595549","6","","10000","1","5","我想看三英（理律空律雷律）战吕布（识律）的视频！"
"本宫羿","男","无IP","1672424","6","初音未来13周年","10000","1","","就看后面剧情里琪亚娜和上仙怎么忽悠这个倒霉的傻孩子了[妙啊]"
"木子尹心","男","无IP","323338036","5","","10000","1","","不是虽然我知道铁打的辅助，流水的主C但是我还是希望这次符华是主C，前几个律者都是主C到我上仙这里就变成辅助？策划搞咩啊。"
"草木葳蕤b","男","无IP","168276993","6","2020拜年祭（鼠）","10000","1","","马老师，李在赣神魔[笑哭]"
"落花止不住","男","无IP","204949139","6","拜年祭粉丝专鼠","10000","1","","所以，她的武器是什么类别？？？？新开一个？"
"宇阔","保密","无IP","592361567","5","崩坏3・天穹流星","10000","1","9","问一下，为什么主线那个符华我打不出大招啊？是本来就用不了大，还是我操作问题？"
"天野灯り","男","无IP","129593193","6","","10000","1","","氟（符）的电负性最大，所以和铝（律）成为化合物的时候现负价，所以叫氟（符）化铝（律），而钠（娜）电负性小于氯（律），所以化合的时候现正价，是为氯（律）化钠（娜），我好像发现了什么不得了的事实"
"不可思议的布克斯","保密","无IP","881378","6","P+魔法少女头像框","10000","1","","米哈游不讲武德，欺负我这个刚抽完甘雨钱包羞涩的老旅行者，这样子好吗？,当然好！我识律抽爆！[滑稽]"
"谛樱","保密","无IP","289484228","6","泠鸢yousa","10000","1","","别的律者：“我什么都做不到”然后成为了律者,而黑符：“我什么都做的到”任何律者成为了符华，好家伙这我是这真没想法的[崩坏3_二胡][崩坏3_二胡]"
"Seeleの团子","男","无IP","143469677","6","夏诺雅","10000","1","","《辅助》,把人全杀了主C就不用上场了"
"卡斯-兰娜","男","无IP","410753468","5","","10000","1","4","放大招的时候头发烧成短发了"
"坎公小公主yyds","男","无IP","325869666","5","","10000","1","","人物设计思路总结，因为没有氯化氟，所以设计成了氟化氯[doge]"
"欧气让我吸一口","保密","无IP","416969374","5","","10000","1","","这个声音感觉…很尬很中二，如果是像女王那种经过后期的就好了…就预告pv里符华那声音，真不错的"
"宣誓~","男","无IP","36488730","6","","10000","1","6","你已经凉了爱酱"
"希儿希er希","保密","无IP","404913907","5","hanser","10000","1","","许愿识律，出必还愿"
"微笑二十六","男","无IP","754343","6","","10000","1","","最强的辅保C肯定是鲨光，C什么不是吉祥物吗[吃瓜]"
"若得青叶飞","保密","无IP","16827643","6","2021拜年纪","10000","1","3","请问希儿的剧情？[doge]请问姐妹情？请问牙医？"
"喵垒个喵","男","无IP","14238517","6","","10000","1","","盲猜过年的时候会有一波识律符华给拜年大伟哥或其他人的拜年热潮"
"莫奈_Official","保密","无IP","8035132","6","EveOneCat2","10000","1","","空律：物理一姐？[疼],理律：骑行撞人？[吓],雷律：律者人权卡保值一年起？[尴尬],炎律：一年只出一个律者？[翻白眼],,识律：[歪嘴]"
"点击加载资料","女","无IP","535666977","5","","10000","1","","呼叫马老师[doge]"
"bili_31188832856","保密","无IP","552849572","5","","10000","1","","新的版本密码？“我什么都做得到”[滑稽]"
"初音的小跟班儿","男","无IP","21739958","6","","10000","1","","就不能设计个裙子吗？[无语]"
"我是安可安","保密","无IP","122957975","5","异常生物","10000","1","","我要回归，谁都不能阻止我，原神也不行[歪嘴]"
"闲的l","男","无IP","75040145","5","三周年恋曲","10000","1","","律者成为符华，可是就如同上的即使拥有记忆，但是还是做出崩坏有利的事情，毕竟一个文明传承的记忆何其庞大。即使如此强大的对抗崩坏信念依旧让她做出对崩坏有利益的事情。所以说她只是一个自认为是崩坏对抗着的身份。本质意义上来说她现在是崩坏。但是她终究是新生，也就是她是拥有可能性的也就是她能成为瓦尔特一样的叛变律者。所以说终究会被舰长引领吗？“你对我针不戳”这句话带表了有个人接近了她，究竟是舰长在把她拉入人类阵营还是被崩坏意识拉进崩坏阵营呢？毕竟崩坏的意识也是在她脑中去引导她，所以我觉得，识之律者可能被引导成为人类的阵营。"
"青玄の幽","男","无IP","281110506","5","","10000","1","","这是拳套武器[疑惑][疑惑]"
"爱哦Miku酱","保密","无IP","1113464","6","","10000","1","","女王现在可能只有一点比符华强了：胸部[doge]"
"爱哦Miku酱","保密","无IP","1113464","6","","10000","1","","女王：所以爱是会消失的对吗[哭泣]"
"天之胧月","保密","无IP","34450673","6","","10000","1","","建议改成主c"
"姚以缇","保密","无IP","513301318","5","2233白色情人节","10000","1","","律三家吊打凤律，然后符律吊打律三家？那风律到底是有多拉[doge]"
"DDの舰长","男","无IP","401150930","5","Kizuna AI","10000","1","","辅助角色（指给自己辅助）[doge][doge][吃瓜]"
"小识没有脑袋","男","无IP","37168400","6","","10000","1","","我感觉上个纪元的剧情比这个纪元的剧情有意思多了，上个纪元有种史诗的感觉，这个纪元纯就是哄小孩。。。"
"转发抽奖从不中真君","男","无IP","15476018","6","","10000","1","","希儿密码：你什么都做不到。,雷律密码：我什么都做不到。,八律：我什么都做得到。（律者盗号）"
"进厂生活人","保密","无IP","29851643","6","","10000","1","10","我挺希望看到融合战士华开大虚剑神和氟化氯对打的短片的[小电视_笑]"
"莱斯灵","保密","无IP","7822592","6","雪未来","10000","1","","锄大地"
"若得青叶飞","保密","无IP","16827643","6","2021拜年纪","10000","1","3","[doge]关于联动，推荐魔法少女小圆，让老虚教教编剧，所谓的悲剧和绝望怎么写？看看自己笔下的角色？板鸭，希儿，牙医。为什么亲都亲了的两个人结果给的是姐妹情？看看牙医？呵呵你们制作组自己相信是姐妹情嘛？还有所谓的舰长。呵呵友哈巴赫加486这是什么玩意？是故事人物？还在疯狂加戏加设定。好好看看吧。舰长参与的剧情还能叫故事嘛？制作组欠希儿一个板鸭告白的未来。别拿平行世界骗人。看看舰长这种平行世界都能疯狂加戏。凭什么不给她们一个正确的未来？我一个百合控怎么在桃子堆里活下来的？"
"DDの舰长","男","无IP","401150930","5","Kizuna AI","10000","1","","快到保底的我无所畏惧[doge][doge][doge]许愿是什么，我不知道。[笑哭][笑哭][笑哭]"
"您已被管理员屏蔽","保密","无IP","344268070","6","星座系列：水瓶座","10000","1","","策划接着爬懒得骂了,美工NB！三个武器是真的帅爆了[星星眼]"
"点击加载资料","女","无IP","535666977","5","","10000","1","","氯化氟赛高！"
"逆夜・夜言","男","无IP","24375522","6","","10000","1","","切链刃的状态下，可以打出来的那个满屏的锁链攻击，真的好像链死枪庭院[笑哭][doge]"
"九日没有九","女","无IP","225199404","6","","10000","1","","你说进了圣芙蕾雅宿舍，会不会和草履虫因为抢吃的吵起来[doge][doge][doge]这波这波是煮饭婆又多了一个娃"
"骑士の誓言","男","无IP","147003","6","","10000","1","7","它会用枪,它能放石柱,它很帅,它设定上是神仙,它剧情里非常牛逼,它假死过,它实际上是个辅助,,它是谁"
"尾巴她有一只猫猫","女","无IP","158620001","6","请吃红小豆","10000","1","","我怎么感觉声音变了[辣眼睛]还是原配音吗？"
"多元重奏","男","无IP","349723","6","","10000","1","","御三家：我什么都做不到,识律：我什么都做得到,空律和雷律换身衣服 挺了挺胸：你能做到这个吗,（你的好友板鸭已下线）"
"Q潇湘夜雨R","男","无IP","40506558","6","hanser","10000","1","","马老师发生了甚么事？也太帅啦[妙啊]"
"紫之创的二臂制作人","保密","无IP","514526923","3","","10000","1","","以前：迟到，永无止尽    现在：你弱爆了"
"一只偷渡的咸鱼娜","保密","无IP","158456299","6","","10000","1","","律者竟是我自己"
"奈奈647","女","无IP","690449185","5","","10000","1","","魂钢脸蛋：简称魂蛋[doge][doge]"
"唯爱符华长歌行","男","无IP","323557526","5","2233十一周年纪念","10000","1","","真就退坑后米忽悠get到了崩三真正的核心了吗[doge],我的钅阿不,我的lsp之魂已经在燃烧啊！！！"
"葬骨于泓川","保密","无IP","881591","6","","10000","1","","合着年年春节出符华呗？ 让我们一起期待明年的符华"
"鱿鱼由于有雨忧郁了","保密","无IP","140409484","6","原神","10000","1","","识之律者对应的是什么"
"飞向未曾止步的征服","保密","无IP","572145","6","崩坏：星穹铁道","10000","1","","30连扩充保底[吃瓜]"
"Fat图图","男","无IP","96604","6","","10000","1","","车车:""昨天晚上我在八重村输给了一台无锋重剑，她用羽渡尘过弯，她速度很快，我只看见她有一个平板的招牌，请问你知道她是谁吗”"
"秋枫霜降","保密","无IP","368101036","5","","10000","1","7","之前那个华呢？"
"主打一个以上香示尊敬","保密","无IP","510335093","5","总之就是非常可爱","10000","1","","注意点，再敢隔壁钟离卖家秀，你懂的后果[微笑]"
"玄螭371","保密","无IP","15512567","5","","10000","1","","失智律者[doge][doge]"
"快乐的IX","保密","无IP","28891095","6","良辰美景・不问天","10000","1","","大剑辅助单手剑，单手剑辅助长枪，长枪辅助鞭刃，鞭刃辅助大剑。这是辅助（确信）[doge]"
"本宝宝就不取名字嘛","保密","无IP","333449872","6","","10000","1","8","钟离，看看人家"
"明月205","保密","无IP","5391860","6","","10000","1","4","觉得这个配音差点意思，"
"创世纪灵天云","保密","无IP","102697891","6","2021拜年纪活动专属","10000","1","11","许愿识之律者！！"
"喵喵教主摇摆猫咪","保密","无IP","305678888","5","雪未来","10000","1","","这不得给上仙来把天火自裁？[doge]"
"漫路长空","男","无IP","83949668","6","EDG战队","10000","1","","有个大佬说过，因为稳定性不同，所以自然界出现氟化氯的可能性大于氯化氟。所以，律者成为符华早有证据[doge][doge][doge][doge]"
"狂暴能厨组长","男","无IP","171754407","6","明日方舟-愚夜密函","10000","1","","好奇怎么切换武器[神SMea_咩]"
"包菜入侵-","男","无IP","290821613","6","原神","10000","1","","干死原神，崩坏长存"
"囹翎羚","保密","无IP","241592774","5","","10000","1","","马老师识律[tv_doge]，拜年剑法"
"寒霜冰星","男","无IP","482364384","4","","10000","1","","我去，我昨天才保底[笑哭]"
"传说试驾","保密","无IP","12168000","6","","10000","1","","那个。。。能踩我吗[doge][doge]"
"血腥的白菜","保密","无IP","20877193","5","","10000","1","","辣鸡辅助：只能辅助特定的输出，能力依赖输出强度，不能站场，多数还不能抗，招式打击力弱。,真正的辅助：能打能抗能杀，招式霸气，自己就能灭敌，别说输出强度弱，输出甚至不出场都能辅起来，安全可靠！[星星眼]"
"本宝宝就不取名字嘛","保密","无IP","333449872","6","","10000","1","8","还好我猜到了[歪嘴][歪嘴][歪嘴]"
"l莫邪l","保密","无IP","12265738","6","刺客伍六七","10000","1","","我什么都做得到[滑稽][笑哭]，太艹了，这就是新的密码吗？"
"幽灵灵_","男","无IP","295632720","6","","10000","1","","逻 辑 带 师,你以为我是氯化氟？其实我是氟化氯哒！[doge]"
"阿文的随手录","男","无IP","23189436","6","","10000","1","","说实话，我这两天才刚买鬼泣五来玩，这强烈的既视感太浓了吧？这活脱脱一个但丁连招的影子呀，我操，花里胡哨的[辣眼睛][辣眼睛][辣眼睛][辣眼睛][辣眼睛][辣眼睛][辣眼睛][辣眼睛]"
"账号已注销","保密","无IP","435503211","0","","5000","1","1","如何让黑符的声望提高，让玩家对其有好感,答，先把绿托干了"
"夜木o","保密","无IP","10903888","6","","10000","1","","我符华又辅又c"
"整活老川异闻录","保密","无IP","749999","6","十四周年站庆","10000","1","","拜年剑法警告！！"
"食用油","保密","无IP","2186422","6","崩坏3・天穹流星","10000","1","13","这个太帅了"
"传说の笨蛋⑨","保密","无IP","509812","6","","10000","1","","天下竟有背着三把武器的辅助"
"纸匠丶枫叶","男","无IP","282514817","5","","10000","1","","几命能用，圣遗物要什么，比甘雨怎么样[doge]"
"AeniNo","保密","无IP","173926097","6","","10000","1","","淦这让我一个还没放假的学生党怎么办……,让我出让我出让我出qwq[大哭]"
"木有中二病","保密","无IP","177156912","6","","10000","1","","黑符: 只要我把敌人都杀了主C们就无敌了[OK]"
"呆萌小静茹","保密","无IP","90090300","5","魔法学院","10000","1","","小姑娘？！暗示保底20几起了[滑稽][doge]"
"阿梓今天恰什么","男","无IP","176035594","6","神乐七奈","10000","1","","帅帅帅"
"梅林-路西法","男","无IP","64997303","5","战双帕弥什","10000","1","","现在有用三把武器的角色了，什么时候蓬莱寺九霄考虑一下?"
"神韵太虚","保密","无IP","137076637","6","","10000","1","7","符华不能是律者，但律者可以是符华是从eva里的侵蚀三号机并被定义为使徒里得来的灵感吗？？？[疑惑][doge]"
"鸩白丶丶","保密","无IP","88232120","6","","10000","1","","神恩g了[doge][滑稽]"
"狂刷饭卡的少年","男","无IP","4824247","6","崩坏3・天穹流星","10000","1","10","黑符：你别跑呀！我真的只是个辅助！,深渊关底boss:我信nm个鬼[大哭]"
"雪幽monarch","保密","无IP","33230588","6","","10000","1","","许愿识律"
"tan淼","保密","无IP","627632582","4","","10000","1","","识之律者（x）,失智律者（√）[吃瓜]"
"秦逝水","保密","无IP","3182784","6","","10000","1","","密码已更改[doge]"
"炽若红镰","男","无IP","3057274","6","","10000","1","7","OH，我的上帝，[热词系列_爱了爱了]"
"_霁雨","保密","无IP","226716815","6","星座系列：双鱼座","10000","1","","浮华3rd"
"夏川真凉好き","保密","无IP","647204374","5","","10000","1","","妈呀这是呆鹅和符华武器换着玩啊[doge][doge]"
"O限单兵","保密","无IP","157500690","5","","10000","1","","氯化氟（×）,氟化氯（）"
"孤落のr","保密","无IP","32201877","6","原神","10000","1","","不对啊，这才多久又一个律者？？？？"
"苍白茕茕","保密","无IP","696392852","4","","10000","1","","感觉……氟化律的比符华的大[doge][doge]"
"森少key","保密","无IP","266033457","5","神乐七奈","10000","1","","板鸭：一起逮虾户？[doge]"
"你的槽点多的发指","男","无IP","349970439","5","幻星集","10000","1","","把敌人鲨干净自家C就安全了,把敌人打到丝血C就能一击秒杀了[doge]"
"海棠不该在归墟吃泡面","保密","无IP","437252704","4","","10000","1","","许愿许愿，许愿，必将还愿"
"","保密","无IP","284776534","5","","10000","1","","舰长之外全员绿者[doge]"
"摸鱼萌新拾h","保密","无IP","22729648","6","雪未来","10000","1","11","谁还不是个武器大师了[doge]"
"桃色晴はる","保密","无IP","112359759","6","鹿乃","10000","1","","都说星猫突兀出现是强了八律风头，其实是为了让剧情铺垫两个版本出八律。惨，幽兰黛尔惨"
"整蛊专家乐高雨","保密","无IP","286040879","6","","10000","1","","识符好![崩坏3_入欧][崩坏3_脱非][崩坏3_快乐][崩坏3_注入灵魂]"
"一名航长承让","保密","无IP","92363405","6","崩坏3・天穹流星","10000","1","4","安娜:呃!律者在我体内诞生我压不住他了 。,第八律者:咦！我是符华，我要消灭崩坏。[崩坏3_注入灵魂]"
"CocOvio","男","无IP","34576426","6","","10000","1","","看完这个才理清楚黑符和符华的关系[笑哭]所以就是律者在死去的符华的身体里降生了，他们现在是两个人格共用一个身体，黑符多半还是会成为崩坏二五仔[笑哭]现在符华在她的身体里，从剧情来看符华一直在引导黑符，黑符也因为继承了符华的记忆，很乐意很主动的去对抗崩坏，他们现在就像希儿和黑希，琪亚娜和西琳，还有芽衣和雷律，只不过她们的律者人格都是作为副人格，符华这边是律者人格作为主人格了，结果每一个律者都有两个人格，布洛妮娅没有是因为她是继承而不是原生律者，非要说的话她那个律者人格的位置被盟主占了，全员律者预定了，希儿也几乎已经实锤是死律了[笑哭]"
"苦瓜瓜丶","男","无IP","358746396","6","公主连结可可萝","10000","1","","为什么cv感觉不一样了"
"bili_242123222","男","无IP","242123222","6","","10000","1","","马老师在中二的道路上越走越远[捂脸]"
"川大双留法免张薇","男","无IP","27090803","5","","10000","1","","退陆登舰"
"可爱の死人","男","无IP","12990386","6","","10000","1","","变律者：我什么都做不到。,反过来就能变回去了。,变回去：我什么都做得到。"
"黎殇就是欧皇","男","无IP","209731191","6","","10000","1","","怎么辅助C位打怪？帮C位把怪都打了,不会强攻的辅助，不是好符华,官不生我黑虎阿符，剑道万古如长夜（御剑飞行・迫真）,符：是我成了谁又是谁成了我？,最后……总觉得八律奶凶奶凶的，嗯~谁让她还是只是一个出生不久的孩子（迫真）呢？！,我清楚你不是符华，我不会把你当她的替代品，所以……我来照顾你啊那么就叫你――符傲天吧（确信）！"
"`灬M","男","无IP","249460728","5","Kizuna AI","10000","1","3","妈耶，闪电五连鞭，符大师直呼内行[滑稽]"
"blueけけ","男","无IP","150077031","5","刺客伍六七","10000","1","","所以，刚把水用完"
"o心~","保密","无IP","347183924","5","","10000","1","","在？给原神抢流水？[doge]"
"此生追随公羊儒","女","无IP","30248238","6","","10000","1","","辅助吗？看来炎律输出稳了[吃瓜]"
"愉沉","男","无IP","176849943","6","","10000","1","","改成生物c吧，求求了[大哭]"
"BlueMountians","男","无IP","100714820","6","崩坏3・天穹流星","10000","1","","冲 干翻原神，三蹦子永存！"
"TmMaceYw","男","无IP","345945114","5","","10000","1","","许愿这次过年抽出来识律和火呆鹅啊啊啊啊"
"纯乎天理","保密","无IP","506583939","5","","10000","1","","燃起来了"
"超级可爱娜娜酱","保密","无IP","62763192","5","","10000","1","","我什么都做得到！（指出货）"
"devil-cosmos","保密","无IP","3840404","6","","10000","1","","你的羽渡尘可以拿来放生吗？,黑符：干霖娘[doge]"
"刷子君ss","保密","无IP","8026591","6","拜年祭粉丝专鼠","10000","1","","这不就是隔壁尼禄的拜年剑法吗[无语]"
"喜欢吃清心","男","无IP","103418677","6","","10000","1","","我想要符华回来[大哭]"
"柠檬MR-LEMON","男","无IP","327314003","5","EveOneCat2","10000","1","","我可以不出识律，但是大家一定一发必出（严肃认真）"
"サン先生","男","无IP","2029263079","5","","10000","1","","这不是闪电五连鞭？"
"chatbyd","男","无IP","686121917","5","初音未来13周年","10000","1","","松果痰抖闪电鞭[doge]"
"溜爷君","保密","无IP","299858106","5","","10000","1","","虽然黑符也不错，但我最爱的还是符华，希望符华不会出什么幺蛾子，编剧同志耗子尾汁。[狗子][狗子][狗子]"
