"昵称","性别","IP","UID","等级","装扮","用户权重","获赞数","粉丝团等级","评论"
"兔兔嘎了","男","无IP","348353056","6","","10000","0","","某钟离:以普遍理性而言，未来可期。我这一击，天动万象；,阿识:我将――扭转万象[doge]"
"腐宅千秋酱","男","无IP","44955576","6","三周年恋曲","10000","0","","出必还愿"
"lcjakakka","保密","无IP","475605812","2","","10000","0","","用我所有舍友单身一辈子求2w出全套黑符"
"3元一次方程组","男","无IP","11357076","6","","10000","0","","这个角色是谁配音的？"
"折翼の舞","保密","无IP","30237745","6","","10000","0","","又到了充钱时间了吗"
"无中友","保密","无IP","17512199","5","至尊戒","10000","0","","思想指导:吕秀才"
"游戏咸鱼玩家","男","无IP","65829762","5","三周年恋曲","10000","0","","我抽黄金呆鹅还剩40发保底没抽了 正好抽下识律[doge]"
"维多利加布洛瓦","女","无IP","4950443","6","小希","10000","0","","我已经准备好钱了[hanser_冲鸭]"
"天命の逆熵b","保密","无IP","663149836","3","","10000","0","","我什么都做不到→（角色）律化,我什么都做得到→（律者）符化,不愧是你！符华上仙！"
"Night丶遗忘","男","无IP","59119908","6","","10000","0","5","强烈建议出个无雷律衣服眼镜版的，我总觉得雷律眼镜看着很奇怪，不合适，后崩的可以但是雷律真的不行"
"养鸡技术哪家强","女","无IP","105981400","6","","10000","0","1","所以黑渊白花打算什么时候出嘛"
"夜半饮雨c","男","无IP","287781460","5","2021拜年纪","10000","0","","ch咋不出来说两句[doge]"
"我爱锻炼我爱锻炼","男","无IP","88472532","6","明日方舟音律系列","10000","0","","她不是符华，但我爱屋及乌"
"朗基努斯sss","保密","无IP","176503512","6","小主安康","10000","0","","大招持续砍劈，感觉有点像持续砍柴[doge]"
"真我之铭爱莉","保密","无IP","167863885","5","咩栗","10000","0","","出来就是无敌！BOSS危险！[热词系列_危][热词系列_危][热词系列_危]"
"提灯挽月落梦扶桑","男","无IP","282970148","5","","10000","0","","杀完敌人，就是好辅助"
"胡桃往生堂第77代堂主","保密","无IP","1172317222","2","","10000","0","","这些好了，全员律者，是真成律者学院。"
"苏州新车二手车业务","男","无IP","113425610","6","茶啊二中","10000","0","","扩充还剩30发保底的我丝毫不慌[笑哭]，原来打算留着出呆鹅的。"
"咖","保密","无IP","746182","6","","10000","0","","虚假的岩王爷：钟离,真正的岩王爷：符华"
"人类a完","男","无IP","386181096","5","","10000","0","9","不懂就问，识律是第八律者，那前七律者除了空，风，理，雷，冰还有哪些来着[doge]"
"古明地祭雪","女","无IP","283247905","6","","10000","0","3","好家伙"
"史东薇尔","男","无IP","2806341","6","","10000","0","","啊这 一到过年就出符华吗"
"h川YUE","女","无IP","481506211","5","","10000","0","6","这TM叫辅助，明明是一看就觉得可以弄死别人的那种"
"下次真的一定绝不白嫖","保密","无IP","381708821","5","","10000","0","","所以黑符和辅助有什么关系？[doge]"
"宗加可","男","无IP","241895545","6","","10000","0","","尼禄：？？？"
"blibli永存","男","无IP","97504922","6","星座系列：狮子座","10000","0","12","短片短片gkd[崩坏3_点赞][崩坏3_脱非][崩坏3_入欧]"
"腐朽的诗","保密","无IP","488844950","5","","10000","0","","别的辅助弥补c的短板或者提升c的伤害，而黑符：等着奥，这就把怪杀了助助兴[doge]"
"来看看你年纪家家","保密","无IP","95649935","5","","10000","0","","动画短片啥时候出啊"
"米酷v","男","无IP","16972529","6","","10000","0","5","单方面吊打奥托这件事毕竟是大家喜而乐见[吃瓜]"
"作业就剩一点了","女","无IP","266675656","6","精灵王","10000","0","","扩充还有三十发保底，小问题[doge][doge][doge]"
"ベ冷枫ミ","男","无IP","432895291","4","原神","10000","0","","不是拳头吗换了武器？"
"千野雪羽","女","无IP","1737772","6","","10000","0","","有的辅助可以削弱对面的防御，有的辅助可以削弱对面的抗性，所以我黑符作为辅助可以削弱对面的血量不是很合理吗[doge]"
"TOMSD","保密","无IP","28079215","5","","10000","0","","完了，扩充池子还有100发保底。[辣眼睛]"
"风轻云淡奶油","保密","无IP","382495746","6","","10000","0","","我突然意识到一个问题，识律是精神方面的。这个肉体强度应该是符华本身的巅峰时期。相对于识律精神能力，黑符更喜欢这种简单粗暴的攻击方式"
"Alegro_","男","无IP","53568916","6","","10000","0","","还有五十发保底，过年应该能抽出来"
"超爱楠宝贝","男","无IP","472178433","5","","10000","0","","识律也太可爱了吧[捂眼]"
"我正矛盾","保密","无IP","277913947","5","","10000","0","","全  员  律  者"
"我所谓的深爱","保密","无IP","508449545","4","","10000","0","","既然符华不能成为律者，那就让律者成为符华[歪嘴]"
"去冰三分糖醋鹅","保密","无IP","17379114","6","","10000","0","2","有个问题，律者都必须披散头发吗[笑哭]"
"无聊的轩玄","男","无IP","51339017","5","","10000","0","","可以当副c吧，辅助能力好像也不是很强"
"去冰三分糖醋鹅","保密","无IP","17379114","6","","10000","0","2","这波啊我感觉我春节会回坑[星星眼]"
"智慧的艾林","保密","无IP","389382495","5","","10000","0","","识之律者（×）,小孩律者（√）"
"Eisen-undblut","男","无IP","302076629","5","","10000","0","","谁和我一样准备买下一个初始号[doge][doge][doge]"
"Hello郭先森","男","无IP","382026291","6","","10000","0","","老肩巨猾"
"布洛尼鸭鸭","女","无IP","28442144","6","鹿乃","10000","0","","辅助＝我辅助我自己[原神_交给我吧]"
"恋ols","保密","无IP","352444369","5","","10000","0","","这波是武器大师"
"尚文盾陆游玩","保密","无IP","392309757","6","","10000","0","","这是?DNF剑魔＋火影照美冥a?[疑惑][吃瓜][doge]"
"用户3193857301","保密","无IP","165653339","6","","10000","0","","弹幕那个以前当律者要自卑现在当律者要自负的tmd笑死我了"
"_Rei__","保密","无IP","436491735","6","2233幻星集","10000","0","2","律者符化[doge]"
"-桥天-","男","无IP","39692681","6","","10000","0","","许愿识律"
"芋头初号机","保密","无IP","53667703","6","原神","10000","0","","这个浮华最后v3要是不能c我就给你们数值ch送锦旗"
"孤叶恋风月","男","无IP","185833703","5","","10000","0","","呆鹅、符华一起接待了钟先生，一番交谈后呆鹅忍不住笑出声……,钟：你在笑什么？,呆鹅：我想起高兴的事情。,钟：什么高兴的事情？,呆鹅：我出新s了，强度爆表！,另外一边，符华憋笑失败同样笑出了声…,钟：你又笑什么？,符华：我的新s也强的离谱！,钟：你们的新s是一个人？,两人憋笑失败，符华开口：咳，不是！我是个《辅助》！,  请问，上述片段中的“钟先生”全名叫什么？被称作什么？出自哪里？"
"化就离开过一遍","保密","无IP","10715606","6","","10000","0","3","建议米哈游策划每天给美工磕头上班[崩坏3_特效][崩坏3_唢呐][崩坏3_琵琶][崩坏3_二胡][崩坏3_笛子][崩坏3_镲]"
"趴在主人头上的猫","保密","无IP","25633646","6","","10000","0","","哟西 符华不可以成为律者 但是律者可以成为符华  没毛病 逻辑鬼才[初音未来_无语]"
"账号已注销","保密","无IP","1991536673","0","","5000","0","","识律的坐骑看预告片是能骑也能炸，游戏里可以吗[喜欢][喜欢][喜欢]"
"萌萌哒的欧内酱","保密","无IP","399877508","6","","10000","0","4","马老师我是你粉丝[打call]"
"ISOmer-异构体","男","无IP","106135032","6","","10000","0","","你告诉我打击感这么强的角色，是个辅助？,不行，我一定要让她主C.jpg（滑稽）"
"云隐归幽径","保密","无IP","698533071","4","","10000","0","","有一说一，拿重剑攻击的识律太狂了，感觉就是攻速加快的姬子[捂脸]"
"梦游小新","男","无IP","39903451","6","原神","10000","0","6","别搞的像隔壁吊机一样，后跳带剑气就行"
"猫听完也死了","保密","无IP","2280645","6","","10000","0","","现在三蹦子里角色是不是已经没有不是律者的人了？"
"ガ梦晨","男","无IP","222179065","6","异常生物","10000","0","3","你告诉我这是辅助？[笑哭]"
"史莱姆麻婆","男","无IP","4382224","6","","10000","0","10","阿符阿符阿符"
"这样的话难办","保密","无IP","386469992","4","","10000","0","","大概什么时候出啊 求告知"
"惹梦A","保密","无IP","24908261","6","","10000","0","","想回坑了"
"水煮萝卜加点盐","保密","无IP","63574600","6","","10000","0","","扩充池马上就保底了[大笑]"
"不渡七海","保密","无IP","8130852","6","","10000","0","","策划给大家拜个早年了！"
"风轻云淡奶油","保密","无IP","382495746","6","","10000","0","","怎么就八律呀，前面是不是少了几个律者。理，空，雷，风，冰。然后直接就识律。我感觉姬子会回来，然后变成了炎之律者，希儿会变成死之律者的。这样的话，应该就刚刚好了。"
"那该多么遗憾","男","无IP","329493991","4","","10000","0","","以前的辅助算了加个buff就下场了，现在的辅助我将扭转一切，把对面全干死才是保护我方c位的最好方法[]"
"飞天的神仙鱼","男","无IP","11517559","6","","10000","0","","姬子出律者回坑！"
"彼女の亚丝娜","男","无IP","8323041","6","原神","10000","0","3","卧槽卧槽卧槽"
"--","保密","无IP","364928067","6","","10000","0","","球球，一定要保留输出能力，可太想打输出了"
"一切皆弱小一切可更强","保密","无IP","171197607","6","还有醒着的么","10000","0","11","一天不到112万[doge]"
"Any_ccd","保密","无IP","21593835","6","","10000","0","","退坑半年 一脸懵逼[疑惑]"
"甘蒙","男","无IP","21304981","6","原神","10000","0","5","nmd，燃起来了，想回坑。"
"回眸丶沙漠狐","男","无IP","162948316","5","汉化日记","10000","0","","回游了"
"落日朝暮","保密","无IP","697923120","3","","10000","0","","对了，谁能告诉我符华仙人为什么不出手办。         当然还有她的女武神。[tv_疑问]"
"ad91057","男","无IP","14824420","6","","10000","0","","那个枪更接近戟的用法啊，枪多是软枪，枪头小多用来挑和刺。戟头部重量大，横扫突刺下劈上挑都可以。"
"千尘墨雨","男","无IP","211779012","5","","10000","0","","这声优换的太伤了"
"伊瑟伊瑟琳","男","无IP","32174744","6","","10000","0","","有兴趣抢隔壁的活做个北辰芽衣出来吗"
"星空Re","男","无IP","32480693","6","C酱です","10000","0","","作弊码：我什么都做得到！[doge]"
"风舞林曦","保密","无IP","350748659","6","","10000","0","8","好……好帅，上仙天下第一[打call][打call]"
"横扫千星の城主酱","男","无IP","277060094","6","","10000","0","10","播放量冲鸭！[打call]"
"凝冰渡海","男","无IP","3542254","6","良辰美景・不问天","10000","0","10","好家伙，这拜年剑法，i了i了"
"拉姆棉被王","保密","无IP","320398229","5","","10000","0","","无语，又来个s，崩坏三 女武神真过气这么快"
"影影约约ovo","女","无IP","67269636","6","","10000","0","4","这次抽不了黑符了，孩子去抽明日香的武器水晶都花完了，还差一个中位没出[大哭][大哭]"
"洛千彦","保密","无IP","91549312","5","","10000","0","","有种大哥（lao po）变闺女的感觉[热词系列_妙啊][热词系列_吹爆]"
"Hegemonism","保密","无IP","52855586","6","","10000","0","","食之律者、饭之律者"
"叉劈长舰","保密","无IP","618347623","4","星座系列：双鱼座","10000","0","","配音有点怪"
"愤怒国宝","保密","无IP","350803","6","","10000","0","","还这么平"
"传说-哒","保密","无IP","604551909","5","","10000","0","","黑符：只要我把对面都撒了别人还是以为我是个辅助"
"七海猫猫头","保密","无IP","3877893","5","黑潮之上","10000","0","","没水了啊[大哭]"
"河岛遥-","男","无IP","646220028","5","","10000","0","","我银行卡又要空了"
"伊瑟伊瑟琳","男","无IP","32174744","6","","10000","0","","说实话看了pv根本感觉不到辅助元素 不如直接设计两种模式强调辅助能力或者输出能力这样还能光明正大骗氪"
"老铁的二次元","保密","无IP","158146820","5","","10000","0","","啥时候更新[笑哭][笑哭]"
"爱吃糖的鸠霓","保密","无IP","479135678","5","","10000","0","","兄弟们，等我出了识律，当时的我可能因为肝的问题在医院跟你们聊天了[OK]，我搞定了"
"紫锦轩","保密","无IP","275847813","4","","10000","0","","快进到我辅助我自己，我什么都做的到，我真好看"
"Vancelovekoki","保密","无IP","30979408","5","","10000","0","","武器匣确实帅，问题是，定位是辅助，不就是为了切换用的吗？这么多招式后面用得上吗？感觉定位C更好呀[呆][呆]"
"乙鱼有坂","男","无IP","12809554","5","公主连结凯露","10000","0","","这个感觉挺疼的"
"圣枪天君","男","无IP","496793037","5","","10000","0","","奶奶的，剧情里面这段怎么和草履虫打，头都给打卸掉了[笑哭][笑哭][笑哭]"
"混乱迷城","保密","无IP","522829696","5","hanser","10000","0","","不是吧一年仨律者"
"奈羽-","保密","无IP","27140597","6","2020拜年祭（鼠）","10000","0","","水晶全抽eva联动的皮肤用掉了[笑哭]"
"玄兰殇","保密","无IP","628354796","4","","10000","0","","悍妇锄地的可xswl[喜极而泣]"
"海在等待洋","保密","无IP","10778448","6","","10000","0","","这可别砍过了啊，好不容易出个强势上仙[tv_doge]"
"QED495年波纹","男","无IP","18392950","6","","10000","0","5","好耶[热词系列_知识增加]"
"常守朱监视官","男","无IP","5668600","6","","10000","0","","这定位辅助…萌新还能抽吗？我主c是幻海梦蝶[疑惑]"
"我很会恶搞","男","无IP","54794047","5","","10000","0","","符华律了，符华律了！"
"leafa莉法","保密","无IP","14139881","6","","10000","0","","好家伙好家伙好家伙"
"堕落语风","女","无IP","23951221","6","","10000","0","","这TM是辅助？"
"肝夫克利斯特拉帝","男","无IP","22048504","6","","10000","0","","56是冰星，第七是谁啊，怎么直接第八识律了"
"卑微晓封","保密","无IP","2944346","6","","10000","0","","没忍住1.5W水把黑希毕业了。。"
"嘤花树下的小樱","男","无IP","89620312","6","","10000","0","","所以雷律的律者人格去哪了？漫画之前有后来就没提到过了"
"重山为岳","保密","无IP","40736943","6","","10000","0","","bgm什么时候发！！"
"Ayulyh","男","无IP","65549808","6","","10000","0","","冲冲冲"
"椰国皇后","保密","无IP","109268245","6","约战・狂三","10000","0","","我的妈耶…"
"迷茫却看淡红尘","保密","无IP","595884889","3","","10000","0","","好评，真的好评(o^^o)"
"初小时a","男","无IP","401381926","5","","10000","0","","能让浮华负担补助了吗"
"kenanCrazy","男","无IP","1700956","6","","10000","0","","你管这叫辅助？？！！！"
"夜如渊","男","无IP","10775628","6","","10000","0","","第一次看见崩3辅助角色攻击方式这么刚，怕是要干翻主C自己做主C"
"Cat_小样","男","无IP","1505437","6","","10000","0","","嗨呀，火剑冰枪雷鞭多好呀"
"我抽个锤子","男","无IP","29056243","6","明日方舟音律系列","10000","0","","看得出来，米忽悠缺钱了（关我屁事），lz白嫖蛀虫[无语]"
"淋着雨做梦","保密","无IP","441731361","5","","10000","0","","所以为什么理律up了装备不up？"
"TheZoner","保密","无IP","6429883","6","","10000","0","","请问你这剑法能搓红刀和蓝拳吗"
"狂笑之符","保密","无IP","388283895","4","","10000","0","","只要能活过测试服，律化符可以嚣张至少一年，想想当年的牛下，神恩，不过很大的可能性是活不过，因为嚣张一年别的辅助C就没流水了"
"渔猫Feather","男","无IP","108885356","6","五月织姬头像框","10000","0","","……这，刚抽完艾伦，结果出了一套福尔摩斯，现在就一个十连，看来我得多关注消息啊"
"自闭青年不自闭","保密","无IP","211515798","6","","10000","0","","大家都挺猛地 怎么到策划那就拉了胯呢"
"狂笑之符","保密","无IP","388283895","4","","10000","0","","刚集齐律三家，识律就来了，许愿"
"接受批评_整装前行","男","无IP","32854186","6","","10000","0","6","说实话，我觉得这应该是三年内最后一个符华角色了"
"neko仙人","男","无IP","388211192","5","2021拜年纪","10000","0","","好耶"
"neko仙人","男","无IP","388211192","5","2021拜年纪","10000","0","","我没水晶了QAQ[大哭][大哭]"
"某lv6的泪爷","男","无IP","99008814","6","","10000","0","","希望之后的剧情，别剧情杀或者让他走向黑暗。挺喜欢这个角色的。"
"neko仙人","男","无IP","388211192","5","2021拜年纪","10000","0","","我没水晶了QAQ[大哭]"
"看见辰星","保密","无IP","110648616","5","","10000","0","","那么姬子呢 姬子的身体什么时候回来？"
"爱我狸","保密","无IP","65290398","6","明日方舟","10000","0","","炎律啥时候的消息?最近刚刚回坑"
"最初和最后的雪夜","保密","无IP","40242407","6","","10000","0","","这一波是奔着年终奖和压岁钱来的！"
"我和你荡秋迁","保密","无IP","431664247","5","","10000","0","","新角色几命质变?0命能不能玩?"
"老猫Y66","男","无IP","178529123","5","","10000","0","","许愿识律,出必还愿"
"被风吹的忘忧草","保密","无IP","226151526","5","","10000","0","","夜深了人静了一些节奏狗又出来叫曲了[滑稽][滑稽][滑稽]"
"钟离别踢枪了踢我","保密","无IP","479828219","5","","10000","0","","就，很慕，这才是认认真真做出来的角色吧！又美有强"
"DTexas","保密","无IP","7426614","6","","10000","0","","这个倒拇指也太经典了，K'直呼内行"
"bbz白象牙","男","无IP","4294354","6","","10000","0","2","所以动画短片呢？预告了三个月了都[辣眼睛]"
"晓白丶晓梦","保密","无IP","39631018","5","","10000","0","","这货输出高的一批，然而米忽悠给他的定位是辅助[doge][doge][doge][doge][doge]"
"春秋凝梦","保密","无IP","37825574","6","多多poi","10000","0","8","我就希望出角色和武器就可以，能玩就行[doge]"
"森林与鹿Jay","男","无IP","20256129","6","一周年纪念装扮","10000","0","","许愿识律，出必还愿"
"布里咕姆","保密","无IP","23660780","6","崩坏3・天穹流星","10000","0","7","这符华我可以！！"
"一只来自火星的宅","保密","无IP","35450633","6","希萝Hiiro","10000","0","","这可太帅了"
"心-ここみ","保密","无IP","38530058","6","","10000","0","","八律简直就是编剧的吐槽机，剧情里那些奇奇怪怪的我也想吐槽的设定全给吐了一遍"
"好鬼挂住","男","无IP","144106359","6","","10000","0","","怎么让我想起DNF的锄大地[辣眼睛]"
"时光流转日月生辉","保密","无IP","165718193","5","","10000","0","","许愿识律"
"尤克特拉希尔的倾倒","女","无IP","32973610","6","公主连结凯露","10000","0","","为什么没有策划讲话？[热词系列_知识增加]"
"冥月R","保密","无IP","355206339","5","","10000","0","","大哥大嫂过年好[doge]"
"生命在于白嫖丶","保密","无IP","20991380","6","","10000","0","","[滑稽][滑稽][滑稽][滑稽][滑稽][滑稽]"
"十二星辉","保密","无IP","27894693","4","","10000","0","","给看不懂蛋白质分析一下：以前单S机制伤害足够用了，2S加强伤害或加点机制，单S大家都一样的，不必抽！[tv_发怒][tv_发怒]新S绝对是残疾人，肯定会把伤害被动或机制放在S1，2上产生质变！只要不是蛋白质肯定不会相信司马策划会好心把2S技能伤害放在S1.2.3上！如果有只不过是为了更好的诱导B氪和骗氪罢了[气愤]以前单S是被双S或3S吊打的，大家都在同一个组都是一样的就无所谓了，而新的调整就是S1，2，3吊打那些同S却没有S1.2，3的导致同组更加内卷，而你会被这些S1.2.3逼的掉杯或掉段[凛冬-生气]以前氪金分3档，[凛冬-生气][气愤][辣眼睛]现在分无数档！大家一起把命座婊回去[保佑][打call]"
"锦筠I","男","无IP","115066886","5","","10000","0","","可以，我爱了"
"提瓦特幼儿园园长","男","无IP","17499520","6","","10000","0","4","好耶"
"`w","保密","无IP","111705631","5","","10000","0","","符华:我是辅助,众女武神:你放屁!你放屁!"
"十二星辉","保密","无IP","27894693","4","","10000","0","","老角色大家知根知底，[气愤]司马策划肯定不敢改！但是新角色呢？！以策划尿性肯定会把单S伤害机制技能抽出来放在S123的！绝不会好心把双S技能放在单S的S123上！如果有只不过是为了更好的骗氪B氪罢了！以前大家单S是一样的，而现在对比双S成本，单S的S123就能吊打单S的，你能不氪吗？只会同组更加内卷！以前氪金分3档，[气愤][凛冬-生气][辣眼睛][辣眼睛]现在分无数档，大家一起把命座婊回去[保佑][打call][捂脸]"
"a1205060734-平原之舞","保密","无IP","10582503","6","约战・白之女王","10000","0","","我叫黑虎阿符，你准备受死吧[滑稽]"
"Aimsan","保密","无IP","27726300","6","","10000","0","","反正都做成这样了不如直接做成主c得了"
"念晚心","男","无IP","27553613","6","","10000","0","","米卫兵们充钱[吃瓜]"
"和泉京香","女","无IP","13790612","6","","10000","0","","看这播放量和评论现在还在玩三蹦子的还是不少啊，我的好友基本上全弃坑了[笑哭]"
"丶落樱花","保密","无IP","14332564","6","","10000","0","","这个符华太可爱了[打call][打call][打call]"
"艾尔海森叫我回家吃饭","女","无IP","23193635","6","","10000","0","10","崩坏3x,律者3"
"十二星辉","保密","无IP","27894693","4","","10000","0","","老角色大家知根知底，[气愤]司马策划肯定不敢改！但是新角色呢？！以策划尿性肯定会把单S伤害机制技能抽出来放在S123的！绝不会好心把双S技能放在单S的S123上！如果有只不过是为了更好的骗氪B氪罢了！以前大家单S是一样的，而现在对比双S成本，单S的S123就能吊打单S的，你能不氪吗？只会同组更加内卷！以前氪金分3档，[气愤][凛冬-生气][辣眼睛][辣眼睛]现在分无数档，大家一起把命座婊回去[保佑]"
"琉璃夜空snake","男","无IP","22229464","6","","10000","0","","我想氪648抽的，但是一个648貌似不够三万氵[大哭]"
"爱城华恋是勇者","男","无IP","1758645","6","","10000","0","","有一说一 我感觉我之前黑符皮肤。。。上当了！"
"泰拉之星","保密","无IP","86011231","5","","10000","0","","地爆天星指日可待"
"铁棍山药精","保密","无IP","394032539","5","良辰美景・不问天","10000","0","","我将，天动万象[doge][doge]"
"伦敦塔桥0","男","无IP","313226891","6","星座系列：巨蟹座","10000","0","","拜年刀法?[吃瓜](许愿识律）"
"一盘葱包","保密","无IP","44663793","6","","10000","0","","“只要我杀光就是对队友最好的辅助”[OK]"
"日月星一","保密","无IP","263602741","6","","10000","0","","就我怎么感觉现在这个上仙的身体某个地方长肉了？[辣眼睛]"
"恰巧是雨","男","无IP","25895446","6","","10000","0","","30发之内必出，别问，问就是。。。[大哭][大哭]"
"ヂ","保密","无IP","414874829","5","","10000","0","","怕是马老师是压抑了太久了"
"萌新零","保密","无IP","274380700","5","汉化日记","10000","0","","大剑？"
"假装上条当麻","保密","无IP","323410642","6","","10000","0","","你们的文案是疯了吗？，一点不掩饰了，阴阳怪气，有话直说，言多必失？我们说的不对吗，干脆直接把你们公司的账户发给每个玩家，每个人天天给你们打钱，你们看怎么样啊？[吃瓜]"
"动1次打1次","男","无IP","28445464","5","","10000","0","","这不放一首自欺欺人歌?"
"克比牢大164","男","无IP","298263049","5","","10000","0","","神经病吧？又来一把超限？？？落地超限搞成常态？你当人人仓库材料那么多？！！当初你米哈游说好的是为了提升老角色的出场率！你的良心喂了狗吗？"
"不破のG","保密","无IP","299528736","5","","10000","0","","黑符黑符！"
"克诺克Z","男","无IP","169407878","6","","10000","0","","阿符不打拳了，青结"
"吃瓜群众还好","保密","无IP","77602484","6","","10000","0","","真是辅助么。。。是必抽的角色么。。。真没水了"
"天空之龙奥西里斯","保密","无IP","216043253","6","斯莱特林","10000","0","","我一发十连就出识律了[抠鼻]"
"娇滴滴过","保密","无IP","305733665","4","2021拜年纪","10000","0","","这？"
"十二星辉","保密","无IP","27894693","4","","10000","0","","513"
