"昵称","性别","IP","UID","等级","装扮","用户权重","获赞数","粉丝团等级","评论"
"equation24","女","无IP","2386651","6","罗小黑战记","10000","2179","2","另外编剧也明说了，她不是符华。我挺喜欢这小孩的，但是我更喜欢符华，所以希望后面剧情能让阿符和她多一些理解吧，变成姐妹情不好吗（"
"bananaMace","女","无IP","1589613","6","花园花玲头像框","10000","13971","6","“我 什么都做得到！” 每一个角色背后 都有好多好多好多好多人的努力呀，很荣幸成为其中一环[小电视_笑]看着这个视频 想起配战斗语音的那个下午，导演笨笨和我绞尽脑汁想着战斗气息字头的搭配 哈哈哈，算上武器匣一共四种武器 每种武器有连招有分支 每个招式有好几个动作 每一个动作要录几条作为备选，还挺挑战也挺有趣的。希望大家喜欢她～"
"紫薯芋圆冰","女","无IP","360766318","6","","10000","12233","8","理律：我什么都做不到！,空律：我什么都做不到！,雷律：我什么都做不到！,识律：我什么都做得到！,理律、空律、雷律：？？？？？,识律：你们弱爆了！[阴险],[doge][doge][doge][doge]"
"卡比不愉悦","保密","无IP","8828863","5","","10000","33754","","新的版本密码？“我什么都做得到”[滑稽]"
"夜下瓜猹","男","无IP","12135989","6","崩坏3・天穹流星","10000","31384","6","符华不能成为律者……,但律者可以成为符华啊!,逻辑鬼才[热词系列_知识增加]"
"GoGonuts","保密","无IP","11521993","5","","10000","23780","","别家律者密码：我什么都做不到,符华：我什么都做的到？"
"B-T-7-274","男","无IP","85917213","6","","10000","12719","6","这叫辅助？攻击方式比c位还狠[doge][doge]"
"一孤侠道","男","无IP","13888325","6","崩坏3・天穹流星","10000","8957","3","符华: 拯救崩三还要靠我自己"
"真我无瑕爱莉希雅","保密","无IP","302488041","5","","10000","6202","","请问视频中哪里可以看出的符华的辅助能力[doge]"
"小虚owx","保密","无IP","412693308","5","崩坏3・天穹流星","10000","10719","","黑符:我什么都做得到,某煮饭婆:我什么都做不到,[狗子]"
"大郎吃药了","保密","无IP","221259393","5","三周年恋曲","10000","9587","","宣发：她有三种武器！,现实：上完buff多呆一秒都是操作失误"
"y狼的夜明","保密","无IP","350226777","5","","10000","8837","","希望节奏比4.4小，这样就能知道当时节奏是谁带起来的了[doge]"
"饱经风霜的企鹅兽","保密","无IP","13192244","6","#EveOneCat","10000","5190","","拜年剑法hhhhh[笑哭]"
"磁爆步兵54","男","无IP","3443416","6","","10000","3827","","失智律者，憨憨黑符[doge]"
"德生生生生生生生生生","保密","无IP","23644277","6","雪未来","10000","4397","","没起床的懒狗来集合[雪未来_忍住不笑]"
"开摆","保密","无IP","30480177","6","仲夏幻想","10000","3417","","你跟我说这是辅助？！[阿库娅_惊讶]"
"果蝇轰","男","无IP","8469526","6","","10000","3284","11","我什么都做……得到[热词系列_知识增加]!"
"弱音命","男","无IP","36048749","6","","10000","2882","","虚假的辅助：上buff，叠被动，换人[doge],真正的辅助：我直接把boss秒了，主c分就上去了[歪嘴]"
"怠惰的黑猫","女","无IP","151306471","6","","10000","2063","8","符华不能成为律者，但是律者可以成为符华也太草了"
"诗音夜枫月","保密","无IP","32652531","6","星座系列：水瓶座","10000","2651","3","emmm，这攻击方式，你确定这是个辅助？,G？G！？？？[热词系列_知识增加]"
"拙见DAZE","男","无IP","49913198","6","战双帕弥什","10000","2215","","我将，扭转万象！！"
"_嘉心饼干_","保密","无IP","39049131","5","嘉然今天吃什么","10000","405","","我符华不是yyds？[歪嘴]"
"白河CoCo","保密","无IP","9451763","6","","10000","2630","","黑符可以常驻，但上仙绝对不能消失！！"
"白泽在吃草","保密","无IP","306168408","6","提摩西小队","10000","337","","哈哈哈哈哈！我将扭转......,大幻梦！森罗万象！狂气断罪眼！,可恶！这是哪儿的记忆！"
"起床了欧尼酱","男","无IP","97368655","6","","10000","1321","","我还见过被背后背5把剑的辅助呢[笑哭]"
"酱油籽君","保密","无IP","179506637","5","","10000","404","6","不是，你管这叫物理辅助？[呆][呆]"
"遗忘之人-符华","保密","无IP","14704655","6","神乐七奈","10000","315","","你这个是把敌人都杀光的辅助吧[神乐七奈_震惊]"
"未情护果","保密","无IP","12347439","6","","10000","1867","","拜年剑法太艹了[笑哭]"
"甘_Lzaya","男","无IP","243190723","6","原神","10000","445","7","这么帅的普攻当主C不香吗[崩坏3_哭哭]"
"恰柠檬的微笑菌","男","无IP","351929464","6","甘雨","10000","1731","2","什么都做的到……,可以给我暖床嘛[神乐七奈_好耶]"
"朔望月丶","男","无IP","28852212","6","hanser","10000","298","10","芽衣：我什么都做不到,黑符：我什么都做得到[doge]"
"雷电将军","女","无IP","399710091","6","原神","10000","855","13","角色编剧：符华不能成为律者但律者可以成为符华啊[笑哭]这波还真是律者符化"
"啦啦哟呦","女","无IP","98865982","5","","10000","269","","什么叫符华3rd啊，律者意识在在符华记忆面前瞬间成弟弟，说到底还是太强了啊，相比起其他人死命压制律者意识差别太大了[热词系列_知识增加]"
"崩坏3第一伥鬼","男","无IP","397171198","6","崩坏3・天穹流星","10000","856","10","动画短片gkd！"
"郭风笑","男","无IP","107247953","5","","10000","282","","主要抽这个角色是因为她有锁链（锁链控）[doge][笑哭][笑哭]"
"中二雪碧","保密","无IP","37407429","6","","10000","900","","吃我大幻梦森罗万象之狂气断罪…Ciallo～(∠ω< )⌒★"
"uuz真的能吃吗","保密","无IP","258762336","5","","10000","255","","在剧情中感觉黑符有一点可爱[笑哭]"
"每天就只想摸鱼","男","无IP","400053136","5","","10000","808","","律者密码变了青结"
"暗ling","男","无IP","158429645","6","","10000","225","9","符华不可以成为律者，但律者可以成为符华啊[热词系列_好家伙]"
"小B[景","保密","无IP","14181667","6","","10000","835","","解锁密码：我什么都做得到！"
"kangkangi_","男","无IP","161627710","6","双生视界・花嫁","10000","205","","角色塑造很完美，,但她是辅助。,各种打击感很棒，,但她是辅助。,强大的作战能力，,但她是辅助。[doge]"
"天音籁心","保密","无IP","26736333","6","","10000","532","","你这个符华……她会用弓吗？[热词系列_知识增加],就是那种会放乌鸦的那钟"
"Rafa-ela","女","无IP","372398487","6","","10000","64","10","好帅 想要 完了我不专一了[热词系列_知识增加]"
"言西Tt","男","无IP","8953349","6","2021拜年纪","10000","1043","2","退坑太久，不懂就问，这是符华彻底放飞自我了么[捂脸]"
"欣_Z","男","无IP","36262771","6","","10000","188","","一个在pv里看起来完全是输出，但他（她）却是一名辅助的角色是谁？！钟离：没错，正是在下！[doge]"
"WahlohneBedauern","保密","无IP","11530489","6","","10000","557","9","快让璃月的那个六千岁小伙子看看，什么是辅助[doge]"
"柯哀粉","男","无IP","20479012","6","初音未来13周年","10000","149","","好家伙，原来制作组也想暴打奥托[OK][OK]"
"21号-XXl","保密","无IP","22116184","6","战双帕弥什","10000","414","","识之律者（）,失智律者（）"
"空山新林归鹧鸪u","保密","无IP","167316272","5","","10000","115","","""符华不可以成为律者，ok,但律者可以成为符华啊"",这波啊。。。这波是编剧遵循化学规律，氟比氯的非金属性强，更容易得电子，所以律化符(FCl)不行，符化律(ClF)，彳亍！[doge][doge][doge]"
"极崩匠","男","无IP","456803242","6","天依游学记・歌行","10000","588","21","万人血书：姬子阿姨回来吧[doge]"
"不慌233","男","无IP","49664054","6","","10000","455","","现在比较怕识律的原本应该在S0就开的辅助功能给放到S1S2之类的，这完全取决于mhy的节操，但众所周之mhy不要信誉和节操，韭菜能割一波是一波。,女王是因为我们已经知道她SS强度了，但以后的新S技能如何，全凭策划的节操了，因为我们不知道她原本S是什么强度了，那以后毕业成本翻倍是很可能的。,以住的辅助基本单S0星完全成形，SS和SSS顶多小质变，现在只要看识律的大质变是单S0星还是S+1星/2星解锁基本就可以知道以后的趋势了，如果是后者，不谈对别人的建议，我自己是决对停止月卡和大月卡及以上充值了，因为这代表以后S角色毕业不仅要一个角色+一套专属，还要外加1~2张整角色卡，花费水晶将多20000~56000不等，这时候就完全成游戏玩人了。"
"教条","保密","无IP","150383578","6","洛天依歌行四方头像框","10000","338","","甚至可以在御剑形态下去用平板撞人[doge]"
"北纬陌城","女","无IP","35456987","6","hanser","10000","102","","我，什么都做得到！,芽衣：？？？"
"梦中有花亦有酒","男","无IP","11438579","6","三周年恋曲","10000","338","","a：我只会上单,b：我只会中单,c：我只会打野,d：我只会ADC,e：我什么都会,ABCD：好，那你去辅助吧"
"silly沐","保密","无IP","6646795","6","圣诞节快乐","10000","99","6","辅助：把敌人打死就算保护队友了[doge][支持]"
"饺局分子","保密","无IP","179242432","6","","10000","338","","之前：舰长徒手摇动休伯利安号,现在：舰长徒手撼动太虚山[doge]"
"小伍-","保密","无IP","55861063","5","","10000","102","","这个点还没起床的都在床上吧[2233娘_耶]"
"别叫我去画画","男","无IP","39689644","6","魔法学院","10000","372","","那个砍砍砍好鬼畜啊[笑哭][吃瓜]"
"乌拉乌拉转圈圈","保密","无IP","321425043","6","RNG战队","10000","92","","主要还是这原画太戳我xp系统了[doge]"
"阿果真的累了","男","无IP","21769708","6","崩坏3・天穹流星","10000","405","10","“对面都被我挂上脆弱了为什么要切主c？那多浪费时间啊，我直接上去输出不是最大收益了么”――什么都做的到的天下无敌最美丽最帅气的嗨符大人"
"努力摆烂的白寒酥","男","无IP","85540340","6","hanser","10000","86","","像极了你家带了狂暴的奶妈[doge][doge][doge]"
"半夏Asper","保密","无IP","35171078","6","","10000","109","9","笑死我了，能不能带点新节奏，“剧情强力角色不能当辅助”这边带不起来啊，崩三辅助才是神啊[吃瓜][吃瓜][吃瓜]"
"桔皮绿茶","保密","无IP","20658038","6","","10000","95","","从美工到动作到编剧，都希望把它做成一个强而有力的角色，那么到底是谁把它做成了辅助定位呢？[抠鼻]"
"是个橘子w","女","无IP","353462134","4","","10000","63","","芽衣：我什么都做不到,仙人：我什么都做的到"
"旅者的游侠","保密","无IP","411611183","6","","10000","62","4","宝剑:言多必弑,长枪:有话直槊,链刃:阴阳怪器,,剑影刀光非我愿,入世出世皆随心,一生仗剑凭意气,招之即来挥即去,,来虽无痕去有踪,香消影散震欲聋,岂信魍魉能作祟,墨羽幽幽化为虹,,百般兵刃千般劲,剑气连绵无穷尽,枪槊既见瑕玷处,从来英雄不容情,,凡间俗世皆苦海,幻尘想叶以为船,我欲以身济天下,只忧碌碌不得安,,刀叉剑戟斧钩叉,敌来盾挡斩刃下,紫微难能循我意,押韵太难算了吧,,吟诗作对难煞我,这技能文案我吹爆，放荡不羁，但又隐露出原符华五万年来生活的一些侧面。与云墨丹心对比一下。云墨丹心为古神州清心静欲的仙人之姿，识之律者更像是游离于古神州江湖游离的侠客，放荡不羁，潇洒自由。比起叫她为识之律者，是崩坏的意志，倒不如说接受了符华全部记忆的她更像是符华自我的另一面。所以，我再次爆吹！！！,不过，这技能名要怎么翻译至外服去？"
"末辰啊","保密","无IP","287745632","5","citrus","10000","35","","符 三 岁，又狂又帅又憨哈哈哈哈[笑哭]"
"久远寺有栖-","保密","无IP","73149130","5","","10000","62","","看这动作模组，快进到“黑符本来是个输出，米哈游为balabala才改成辅助的，而且符华还是中国角色，米哈游其心当诛”[doge]"
"弓_厶","保密","无IP","564943902","5","","10000","54","5","山吹：削减敌人攻击,神恩：削减敌人防御,云墨：削减敌人抗性,黑符：削减敌人血量[doge]"
"李-歌德","男","无IP","351916751","6","崩坏：星穹铁道","10000","62","","这是辅助？我辅助我自己！[doge]"
"空之律者-律化娜","保密","无IP","183787390","6","原神","10000","46","","鸭子有摩托，雷律有龙，黑符有御剑飞行，女王.....[doge]"
"一朝梦醒空暮雪","保密","无IP","6850827","6","","10000","46","","虽然这孩子挺熊但还是蛮可爱的，一直觉得舰上少了点什么，大概就是这种暴躁小姑娘吧（点名特斯拉上舰"
"胱忠第一黑希厨麦麦","保密","无IP","440122817","5","","10000","45","","你见过上午9点的崩坏3吗？"
"秋枫霜降","保密","无IP","368101036","5","","10000","47","7","“符华不可以变成律者，但律者能变成符华呀。”,我懂这句话是什么意思了！,“主C不可以变成辅助，但辅助能变成主C呀！”[doge]"
"鲜霞鱼板面","男","无IP","87640813","6","崩坏3・天穹流星","10000","45","8","是辅助，攻击方式很帅，和隔壁钟离有的一拼。,但她是符华上仙,干翻原神，崩坏长存[doge]"
"D夜-Sakuya-","保密","无IP","37678590","6","雪未来","10000","37","","草，那个拜年剑法笑到我了[笑哭][笑哭][笑哭]"
"风色之诗","保密","无IP","8418756","6","初音未来13周年","10000","40","","你们没发现一个问题么，识之律者完全没有自己的能力，她的确接管了符华的身体所有拥有了强大的实力，但是她作为识之律者的力量也就是操控人心的能力完全没发挥出来，识律想要操控人心居然还需要借助羽渡尘，再看看理律不需要虚空万藏就能随便投影，空律不需要千界一程就能穿越空间，雷律也是自己就随便放电"
"三月兔月三","保密","无IP","240385798","6","总之就是非常可爱","10000","34","1","你是辅助吗？,是,是吗？,是 那时候我还有很多武器,你就不是辅助,你说我不是辅助？,不是,我说我也不是辅助，这根本就特喵不是辅助"
"厄楣","男","无IP","434265469","5","中国绊爱2nd纪念","10000","33","","我可以保底但在场各位都一发出符华[doge]"
"三司绚濑か","保密","无IP","174956832","5","","10000","37","","好"
"要吃个橘枳吗","女","无IP","494964146","5","罗伊","10000","31","","识宝不管是人设还是手感都是我在崩三里最喜欢的[亲亲][亲亲]"
"罪恶V5","男","无IP","12502066","6","","10000","30","","符化律：我什么都做的到。[OK],我:那你罩杯大一号如何[doge]"
"风枫M","保密","无IP","497221676","5","崩坏3・天穹流星","10000","30","","虚假的辅助:神恩，sp积攒速度慢 山吹:无脆弱能力 影舞:毫无时空,真正的辅助:识之律者:高额的倍率，极快的攻速，炫酷的技能[OK]"
"猹仔想摸鱼","男","无IP","86212796","6","","10000","30","","虚假的辅助 给主C上个buff就退场,真实的辅助 帮主C把怪全都干掉"
"百合百景","保密","无IP","698774","6","原神","10000","31","","崩3：小原子啊，最近许多舰长都玩原神去了 你们原神有啥好的,原神：是前辈啊。我们有很多种武器种类，有单手剑、双手剑、枪，还有远距离武器...,崩3：能使用同时使用单手剑、双手剑、枪，还有远距离武器。,原神：？，哦，我们还有年纪特别小的角色，和年纪特别大的角色。,崩3：年纪很大，又很小。了解了。,原神：？？？对了，我们还有物理系统，这个前辈没有。我们的角色可以差柱子，还有角色可以把角色抬高。,崩3：柱子、抬高...原来是这样做的吗，我学会了。"
"Debonair丿","保密","无IP","383532038","5","呜米","10000","25","","“因为浮华之前在剧情里一直被限制，没有施展出全部实力，这次我们希望她能变得更加的强力，战斗力暴增，所以我们还是选择？把她做成了辅助[思考]”"
"乌鸦ぃ","男","无IP","89871003","6","挚爱花海","10000","25","","我是来打败律者的[doge],打着打着，舰桥上律者越来越多了[doge]"
"姚以缇","保密","无IP","513301318","5","2233白色情人节","10000","29","","奥托：住手！你这卑微的肮脏的蛆虫，我可是第一绿者！我^%#+=#%,符律：奥托的魂钢脸蛋在我拳头下噶吱作响的声音真是太美妙啦！[doge]"
"啊爷我是你粥孙贼","男","无IP","22189547","6","hanser","10000","28","","老婆抽我，老婆抽我，快用你的鞭子尽情的鞭笞我、蹂躏我[喜欢][喜欢][喜欢]"
"-Ravio-","女","内蒙古","571492661","5","雪未来","10000","19","","小识永远最好看！人设也超可爱！再看始源和终焉都什么东西，凯文要输我笑一辈子[热词系列_爱了爱了]"
"凝眸一瞬沧海桑田","保密","湖北","250332754","6","星尘","10000","9","","板砖一出，谁与争锋！识之律者女士万岁！"
"不平凡的河豚","男","无IP","252464554","6","","10000","26","6","你们看到的是可爱的黑符，我看到的是被崩坏诱导摧毁对抗崩坏组织的为所欲为的识之律者。我是认真看每一章剧情，黑符仗着自己有力量想做什么就做什么，因为符华记忆影响还有善念那天被崩坏彻底洗脑那这个世界就玩完了。（这是我个人看法不同意的随意）[崩坏3_路过]"
"天谴使者","保密","无IP","269404702","6","星座系列：摩羯座","10000","22","","所以动画短片[妙啊]不可能没有吧，这是律者呀"
"烟霄微月澹长空","保密","无IP","44750307","6","三周年恋曲","10000","22","","松果痰抖闪电鞭[吃瓜]"
"姆下渊","保密","无IP","325045044","6","","10000","22","8","好帅的动作，好憨的语音[热词系列_爱了爱了]"
"98k纯金版滑稽","保密","无IP","504227047","5","","10000","25","","律化密码:我什么都做不到。,符化密码:我什么都做的到。[热词系列_知识增加][doge]"
"丶拾灬柒","男","无IP","182789202","5","","10000","20","","我好奇黑符出来后，绿托要怎么介绍[捂脸]，用中二的语气说“识之律者，出场暴打天命主教”[热词系列_知识增加]"
"Le-iris","女","无IP","184562707","5","琉晶之礼","10000","20","","小识是我入坑的原因，我真心希望剧情对小识好一点，别老是欺负人家小孩子,这是第一个让我怀疑自己不仅是女同还炼铜的角色( b- b)つロ"
"咸鱼已自闭","保密","无IP","301922524","6","","10000","29","","黑钟离魔怔的就别来这边带节奏了，抱歉，崩三辅助才是yyds[吃瓜]"
"寂寞如雨的烟花","保密","无IP","23438658","6","","10000","19","10","刀枪剑戟斧钩叉,敌来盾挡斩刃下,紫薇难能循我意,押韵太难算了吧[笑哭]"
"打火机不好吃","男","无IP","21188218","6","EveOneCat2","10000","22","","众所周知，氯是一种电负性很强的卤素,在遇到钠和镁等金属元素的时候，可以把它们氧化为氯化钠和氯化镁,但是氟是电负性最强的元素，所以当氯和氟发生反应时，会生成氟化氯[doge]"
"灰尘灬丶","保密","江苏","50282320","6","崩坏：星穹铁道","10000","18","","“我什么都做不到” 琪亚娜变成律者,“我什么都做不到” 芽衣变成律者,“我什么都做不到” 布洛尼亚变成律者,“我什么都做得到！” 律者变成符华"
"里见Y","男","辽宁","456838247","5","崩坏3・天穹流星","10000","18","10","当时是真的惊艳，帅,现在再回看，识宝还是帅"
"小仁同志","男","无IP","400947606","5","原神","10000","18","","编剧【请】不要对小识下刀[崩坏3_无辜]"
"Re_Refrain","保密","无IP","34689701","6","","10000","27","","这游戏名叫《呆鹅3rd》（阴阳怪气）,这游戏名叫《符华3rd》（满脸骄傲）,你以为少数人掌握的才是正义？不，多数人即为正义。"
"丨小糸侑丨","保密","无IP","351441259","5","","10000","24","","那一年的周年庆《崩坏3》对阵《原,,神》，最终流水对比是40:1。当时我看见爱酱颓坐在椅子.上泣不成声，这个画面我永生难忘。,,那一-刻我在想，如果我符华能顺利公测，我一定要赢下所有。,,如今企划已经摆在眼前，我必须考虑会不,,会是我此生仅有的机会。,,我相信米哈游能有现在的霸主地位，《崩,,坏3》功不可没。重铸‘崩坏”荣光，我辈义,,不容辞。我将扭转万象。[滑稽][滑稽][滑稽]"
"羽了个溪","保密","广西","1039281823","4","","10000","12","","我是识之律者女士的狗！识宝妈妈爱你！识宝啊啊啊啊啊啊啊！识宝你怎么那么可爱！我的心我的全部都是你的我可爱的识宝！！我永远爱你我可爱的识宝！我永远是识宝单推人！识门！！！！"
"冷辣椒椒椒","保密","河北","209706946","5","hanser","10000","29","7","始源和终焉不如理之律者和识之律者的一根毛"
"Italeaf","女","无IP","79094498","5","","10000","17","","大伙们，不要冲识宝，识宝早就看透了一切，就像她说的一样，想想都觉得恶心"
"岳野雪","保密","无IP","5702952","6","2021拜年纪活动专属","10000","17","","巫师3，鬼泣，p5s，战神等游戏都有拜年剑法(挥刀快速下劈)这个动作，一些在弹幕和评论区说抄袭尼禄的小鬼们能不能看出这个动作到底抄的谁？我例举的以上游戏又是谁抄了谁的动作？不要告诉我玩act动作游戏的就只认识一个尼禄哦"
"苍穹之上的赋羽","保密","无IP","165862269","5","一周年纪念装扮","10000","17","","说实话，我不喜欢这个设定。八律说好听点是律者，说不好听就是夺舍符华，如果这个设定成立，那么符华很可能将永远死去，我喜欢的是那个即使独自对抗崩坏也要守护神州的上仙，而不是一个夺舍后披着符华外衣的律者，在我心中，上仙是可以对抗崩坏神的存在，却让律者打败了，夺舍了。我喜欢的是那个心中唯有守护的上仙，而不是一个长着符华脸的律者。我仅代表自己，如果不认同我也别喷我，我只代表自己。"
"丹青回龙夕照_","男","无IP","176277040","6","崩坏3・天穹流星","10000","16","","黑符说要相信科学 然后御剑飞走了[doge]"
"_火炎-焱D_","保密","无IP","42943514","6","","10000","16","","后面这几个版本出的新角色都没有识宝惊艳了，"
"幻羽_Max","男","无IP","189896753","6","","10000","15","","懂了，把敌人全打死，减少主c站场时间，提高主c生存空间，新定位辅助[doge]"
"sx1513","男","无IP","4391827","6","","10000","15","","米哈游:虽然我做的角色不管怎么看都是输出，但我就是要她/他当辅助"
"辰林灬","保密","无IP","511809782","4","","10000","15","","别再给我发信息了，对不起，我怕胡桃误会[doge]"
"SeLoray","保密","无IP","16067340","6","BW2020","10000","15","","草这个连劈…拜年剑法，大哥大嫂过年好[doge][doge][doge]"
"识竟","男","湖南","482252032","5","","10000","15","","剧情里小识只出生了大概半年吧，编剧不会忍心刀一个孩子吧[保卫萝卜_哭哭]"
"账号已注销","保密","无IP","273844351","0","","5000","18","","原来这是辅助吗 我玩那个开放世界玩了一天了全靠她打伤害[藏狐] 官服35级萌新"
"穆衬瓷都","保密","无IP","1113865033","3","","10000","21","","――阿贝多，你想干什么？！！,――时代变了，我们不用做其他角色，可以做自己了......对，真正的自己――过去的我……经历失败，受过背叛，失去所有，而现在……呵呵呵呵……我将掌控一切……这就是完全的白垩，完全的炼金，完全的……我！[藏狐],,我将，扭转万象！！！！！！[doge]"
"一只大羊稽","男","无IP","178803803","6","国民老公带回家","10000","14","7","阿伟你又在翻评论时间找下面的猴啊,去休息一下吧，看会儿书好不好"
"Lex不可能是个女孩","保密","无IP","8036083","6","崩坏3・天穹流星","10000","14","","琪亚娜：我什么都做不到，我救不了妈妈,密码输入正确：,锤爆逆熵,布洛妮亚：我什么都做不到，我救不了希儿,密码输入正确：,一车撞爆特拉洛克,希尔：我什么都做不到，我救不了布洛妮亚,密码输入正确：,一拳锤爆量子之海,芽衣：我什么都做不到，我救不了琪亚娜,密码输入正确：,一刀锤爆虚数造物,黑符：我什么都做得到,密码输入错误：,被琪亚娜与符华当场锤爆"
"西红柿操鸡蛋蛋","保密","无IP","2961581","6","","10000","14","","策划:符华,你因为剧情问题所以你没有办法发挥你全盛时期的力量.,符华:好.,,策划:黑符,你是一个辅助.,黑符:不好."
