"昵称","性别","IP","UID","等级","装扮","用户权重","获赞数","粉丝团等级","评论"
"Fearlly","男","无IP","19861062","6","2233幻星集","10000","4","","正式服我们是一定不会轻易修改角色参数和各种加成的,ch:这个不符合预期，绯红砍一下,玩家:（有的生气，有的开biao）,ch:这个佐罗不符合预期，给全服发个200压一下,玩家:你打发叫花子呢，别人几十连抽的，说改就改,现在我个人觉得:剧情改了又改，角色出来又出，跟下饺子一样，圣痕武器无论有没有用，都在出，虽然崩坏2是一个你不秒别人，就会被秒的游戏，但是每一个boss都是有各种技巧的，崩坏3，剧情说换就换，没有好的装备和角色这个账号废了一半，崩坏2虽然也会这样，但毕竟已经老游戏，活动送的东西有的也非常强，而且崩坏2。。。带节奏少，暗改也少（至少我留在崩坏2的时间没有遇到过），崩坏3，贴吧根本不是一个可以自由交流的地方，这个游戏是好游戏，无奈遇到太多的****（自己领悟这个星星是什么）"
"茉柚子","男","无IP","27933413","6","罗小黑战记","10000","4","","已经弃坑的就看着，果然不出所料，我的弃坑原因大概对氪金大佬来说也都不是事，崩崩崩总氪金5000元，对大佬来说应该算是微氪或无氪，在周年庆活动那蚊子腿奖励和高肝度中虽然生存了下来，也努力的看着操作大佬的攻略把代练者之证打了出来。到了万神纪活动时，也就仅仅攒了4000水晶留着抽下个版本的角色，可卡莲皮肤把我4000水晶骗走了，我得到了7个南瓜币和一个我根本不需要的圣痕，然后这补给就关闭了。心态崩了，想努力也除了氪金拿不到其余的硬币，毕竟周年庆活动奖励实在是太差能拿出来的水晶就那么点了。本想继续攒着抽丽塔可现在也一无所有，只有7个硬币和一个下水道圣痕在告诉我我之前有4000水晶，而这蛋池根本不值得我氪金去抽了，这个游戏也不值得了。"
"_逆模因_","保密","无IP","78078105","6","","10000","4","","现在真的想弃坑国服，然后买个日服初始号，爽得一批，直播是全服发奖励的，貌似不需要看直播也不需要兑换码，崩坏三在日本就是个弟弟，它要敢像国服一样，那它在日本会完全失去市场..."
"AokiYoshimitsu","男","无IP","35405767","6","瑰丽华服","10000","4","","真的…这游戏在我心中的地位居然被约战手游反超了…我指的是游戏体验…"
"Me鸢一折纸","保密","无IP","13951758","5","","10000","4","","怨气最重的一次直播！连策划都不敢出来了。这辣鸡策划，你还是辞了吧！"
"永恒童话世界","男","无IP","44844056","5","","10000","4","","人玩游戏＆游戏玩人，取决于自己"
"空前绝后之剑","男","无IP","10089514","6","","10000","4","","还有，我不知道策划这次又什么操作，我看直播也只是为了水晶，有情报姬和各位up主根本没必要看直播就能知道更新有什么内容。你们爱骂就骂"
"邓永昌","保密","无IP","12965580","6","","10000","4","","大佬们，退坑才是对策划最好的报复啊。你们想想，你们充的每一分钱里都有策划一份工资，你们打的每一次联机都为我这种给游戏充钱的智障提供游戏体验继续充钱。只有退坑，才能不给恶心人的策划多挣一分钱。再给个建议，卸载是不管用的，你们哪一天又想玩了还有机会装回来，要退的话建议熔号。"
"--何以为家--","男","无IP","39251445","6","","10000","4","","能好好做下平衡吗？不要再出角色了"
"Hatsukoi39","保密","无IP","2218493","6","","10000","4","","机会给的够多了1.3就出了0.98的事现在都2.7了，耐心和热情已经消磨殆尽，巴不得你游赶紧凉掉，充的钱就当打水漂了(_)什么？为啥不融号？我为什么被气到了要摔玩具，除了我自己受损失以外有什么好处吗还是说我融号这些人给我钱[2233娘_喝水]"
"ViXolXet","保密","无IP","91495452","5","","10000","4","","开服到现在氪3w了，最近还是受不了退坑了，希望蹦蹦蹦能改好，很喜欢这个ip。像之前啥模式都没有女武神也没几个的时候，玩的比现在开心多了，抽想抽的角色武器圣痕。这一次次搞的我心凉。"
"zltZhao","保密","无IP","8613352","6","","10000","4","","洗地的全部进入黑名单。[小电视_笑]"
"abcde-aiueo","保密","无IP","200277169","5","","10000","3","","崩坏三一直没有变，变的只有扩大的玩家群体和被搅浑的社区环境"
"纯到考公不翻书","保密","无IP","276913943","6","","10000","3","","策划能不能用鬼铠打一次氯化钠？打不赢吃屎行不行[小电视_困惑]"
"踏月冰颜","男","无IP","8804716","6","","10000","3","","你们玩游戏都不关心剧情人设的吗 都在舔丽塔......"
"没穿裤子258","男","无IP","35827651","6","原神","10000","3","","本来我就差五个碎片，就能搞出雷电女王的鬼铠了，所有女武神晋升和解锁碎片都翻了一倍，你让我们这些玩家怎么弄？出来挨打"
"何氏族广辈","男","无IP","7255802","6","","10000","3","","舔狗舔的最后一无所有"
"f城e言","保密","无IP","2777381","6","","10000","3","","舔狗最后一无所有"
"胧_羽","男","无IP","5722773","6","","10000","3","4","听说这次直播有水军[小电视_嘟嘴]"
"__青尘","男","无IP","11009742","6","","10000","3","","直播时出现动画资源未下载，提前把这些过一遍下载动画资源能花多少时间，然而就是没有做这个准备，不用心做做得好才怪了"
"乌托邦帝国主义","保密","无IP","11322061","6","","10000","3","","能不能出更又意思的玩法之类...  次次出角色 圣痕..."
"蓝猫","男","无IP","83169","6","","10000","3","","食之无味 弃之可惜"
"珑馨丶","女","无IP","29030986","5","","10000","3","","好好的ip，非要搞臭"
"渡尘poi","保密","无IP","235742789","5","","10000","3","","复读机那段被删了"
"YYYYC雪","保密","无IP","89268499","5","","10000","3","","……b战的用户都好年轻啊(￣￣)"
"柳生雾隐","男","无IP","6702447","6","citrus","10000","3","","awwbwg――我只是个被贴吧黑屋的希儿厨"
"修仙的康娜","保密","无IP","84516196","6","崩坏3・天穹流星","10000","3","6","快住手这不是重剑角色！"
"X79金星级气态主板","男","无IP","811462","6","","10000","3","2","看过最水的一次直播，偏偏我还让徒弟去看，真是。。。。w(Д)w"
"账号已注销","保密","无IP","326957666","0","","5000","3","","感觉活动不活动已经无所谓了    每周不就是打2次8层深渊     跑15局世界任务    捡3天垃圾    挂7天远征    前两天膨胀到把攒的2000+氵全买了标配      反正强度什么的无所谓了咸就完了    你怎么婊ch人家不还是该怎么玩怎么玩    一个游戏玩这么累不值得( ¨ )"
"猫与少年a阿","男","无IP","152035699","4","","10000","3","","什么时候更新"
"邻家小林","保密","无IP","233653140","6","明日方舟","10000","3","","上课错过350氵（1/10000）"
"y电","男","无IP","17828627","6","","10000","3","","啥时候出希尔(=ω=)"
"十三岁的索菲","保密","无IP","33287415","5","","10000","3","","策划吃翔长大的，所以认为所有人都和你一样"
"Levelfive御坂","保密","无IP","367454773","5","","10000","3","","昨天看直播的时候，评论骂声一片看得我一脸懵逼，发生了什马"
"S心所欲_","保密","无IP","20606417","6","","10000","3","","出的问题不给玩家说明  以后见一次黑一次"
"-千曜-","保密","无IP","11855992","6","","10000","3","","这不是录播！,连鬼畜都没了(=ω=)"
"爱吃糖的德丽莎","保密","无IP","47769288","6","","10000","3","7","我没看直播，也没点视频播放，但我能猜到弹幕素质"
"54801637110_bili","保密","无IP","381414145","4","","10000","3","","热评第三个那个**衣是真的恶心，我说啥了？就拉黑我？我不就是在第18楼回复了一句话，因为没有婊策划，而且下面评论就一直怼我，就因为这个？我现在终于知道为什么崩3评论区戾气这么重了，在评论区像它这种人实在太多了，戾气不重才怪."
"Angelalili","保密","无IP","10052173","5","","10000","3","","还是那句话，你要是不想钱浪费，就别玩手游，请问现在什么手游是不坑钱的？别跟我说单机手游。"
"Sclyxm","男","无IP","13542864","6","","10000","3","","在座的各位节奏随便带，我不婊也不洗，崩三凉了也就脱了手游坑了(￣△￣)"
"EQT卓帝","男","无IP","7765763","5","","10000","3","","找到我们熟 找到我们熟 找到我们熟 找到我们熟为止(ω)～滑稽"
"Newbien","保密","无IP","31327354","6","","10000","3","","换个策划真的是国产手游之光"
"圣爱音伟大无需多言","保密","无IP","20623298","6","贝拉kira","10000","3","","米卫兵精神胜利给力嗷 守护米卫兵最后一片净土"
"拾块钱的店址手表","男","无IP","23452211","5","","10000","3","","爱玩玩不玩衮( BB )"
"哩子。owo","女","无IP","491902","6","天官赐福动画","10000","3","","请问录播有鬼畜那一段吗[小电视_害羞]"
"黄皮耗子大战哈喽凯蒂","保密","无IP","28847594","5","","10000","3","","自家洗地水军贼喊捉贼可还行，下播了还在洗这么敬业难怪我拿不到群号"
"AD钙奶肉丸","保密","无IP","2072775","6","","10000","3","","睿智 985策划 [2233娘_喝水]"
"圣爱音伟大无需多言","保密","无IP","20623298","6","贝拉kira","10000","3","","米哈游分化玩家真的很有一套，250水晶加上以前玩家自己攒的抽出个好东西，然后这些玩家就开始疯狂护主，这招够狠！[2233娘_大笑]"
"提瓦特幼儿园园长","男","无IP","17499520","6","","10000","3","4","玩法依旧单调，换汤不换药，又出来新女武神新武器圣痕新皮肤骗氪，还是那么扣的米忽悠，还是那副恶心嘴脸，我现在体力都懒得清了，一上线想到深渊记忆战场开放世界还有那扣13的活动就脑壳痛，还请快点出蹦四"
"擦擦汗大人","男","无IP","11480327","6","择天记","10000","3","4","希望崩坏越来越好"
"天水晴空","男","无IP","23291370","6","夏诺雅","10000","3","","下个版本别人就能看到你有多少过气装备了，你还在说你氪的金没用嘛？[小电视_好怒啊]"
"琴瑟无言寄相思","男","无IP","475364","6","","10000","3","","找到我们熟，找到我们熟，找到我们熟[小电视_笑]"
"下蛋鲲鲲","保密","无IP","260264743","6","拜年祭粉丝专鼠","10000","3","","能不能把复读的那一段放出来"
"具象化","男","无IP","298200","6","","10000","3","","我说了，出卡丁车关卡，出开放世界联机，像DNF一样，自己捡自己的不就行了。角色可以出但是要用爱来出。你们自己说过要爱这个世界的。可是瞧瞧你们的态度，瞧瞧现在你们的工作人员是真的爱崩坏世界么？不是。就是技术过硬，可是论技术，欧美大厂你们能比上哪个？我玩别的不好么？要不是感受到制作者还有那么一点爱这个世界我能留下继续玩？初心再哪里？*你们大爷。"
"斯乌艾戈","保密","无IP","22223204","5","","10000","3","","找到我们熟……找到我们熟……找到我们熟……我还以为是我卡了"
"克莱默尔","保密","无IP","34420686","6","","10000","3","","看到评论大家都没留手我就放心了[2233娘_大笑]"
"世界第一打野seven酱","保密","无IP","10589944","5","","10000","3","","快快快，冲冲冲，崩三卫兵在行动"
"奶哥k35","男","无IP","13118220","6","","10000","3","","哦，天呐，我有女仆丽塔可以玩了，真是太开心了，我永远喜欢女仆丽塔！"
"世界第一打野seven酱","保密","无IP","10589944","5","","10000","3","","mihoyo：我就是作死怎么了？你们能拿我怎么办？反正发个60水就有一堆米卫兵来洗"
"我永远喜欢舔初音","男","无IP","25889190","6","","10000","3","","洗地狗丰富了我的黑名单"
"云峰sss","男","无IP","33430679","6","","10000","3","4","说真的，以前我玩蹦蹦蹦不会觉得无聊的，但是现在，玩着玩着的，就会犯困……我昨天买了个初始号，从十级五六百体力，一直打到35级，期间睡着了三次…说真的，这游戏对新手来说不是太好玩，什么都没有，然后我用肝出来的1.8W水(包括初始号原本有的)抽了下奖池，就一个S的神恩，1.8水，一个S，一堆没用的A，几个无用圣痕，"
"汪酱的肥皂盒子","保密","无IP","9592095","6","","10000","3","","看了直播惨不忍睹的直播弹幕，再看了看现在乌烟瘴气的评论区，能感觉到一个游戏正在被一场节奏风暴摧残。先是策划操作失误引发玩家怒婊，然后背别有用心的人带起了婊的节奏；然后另外一边的玩家看不下去就开始无脑洗白，无意中又带起了洗的节奏。就这么着，mhy史上最波澜壮阔的玩家内部战争，拉开了序幕(｀ω)"
"被爱の无爱者","男","无IP","66593545","6","初音未来13周年","10000","3","","现在真是佛系玩崩3，抱着唯一一个初始s紫苑瑟瑟发抖(明明是初始a)……"
"赛里斯大列巴","男","无IP","29525768","6","不吉波普不笑","10000","3","","那么，我先来,放 松 事 故,人类的本质是？（）,找到我们熟（￣￣）"
"希露菲真的太可爱了","保密","无IP","44505650","6","","10000","3","","找到我们熟(□)/,找到我们（/TДT)/,找到我Σ(д;) ,找(Д≡д)!?,找(Д≡д)!?"
"天涯亦海","保密","无IP","249244228","6","","10000","3","","我就我问你们这个版本，为什么不出暴怒深渊让氯化钠吃吃屎"
"夕枫w","女","无IP","22611084","6","公主连结可可萝","10000","3","","希尔：怎么还没有我!"
"水大饺咯","男","无IP","179391463","6","","10000","3","","那个：找到我们熟,怎么删了呀，多有意思的一段啊,(｀ω)"
"欧某系-罗伊","男","无IP","10100380","6","","10000","3","","复读机砸坏了？"
"飞花般绚丽","保密","无IP","39615961","6","赏樱大会欧皇","10000","3","10","复读机那一段可以单独投一个稿件，就投鬼畜区就好"
"捡肥皂的猫","男","无IP","18732153","6","原神","10000","3","","9万水晶攒了半年看来是时候出手了[小A和小B_司令]"
"ジャンヌオルタ","保密","无IP","36023908","6","","10000","3","","丽塔：开始清扫舰长(°°)"
"琪亚娜c卡斯兰娜","保密","无IP","44595897","6","梦塔・雪谜城","10000","3","","这次直播弹幕没法看[小电视_发愁]"
"春风里丶","男","无IP","137105323","6","","10000","3","","大声告诉我，人的本质是什么(°°)"
"abcde-aiueo","保密","无IP","200277169","5","","10000","2","","这个游戏，我会继续玩下去的。相信和我一样想法的舰长有很多，我们会陪伴崩崩崩和女武神们一路到底。,为所有的美好而战，这不是一句空话。"
"醒醒点火","保密","无IP","348555589","5","","10000","2","","白骑士，影骑士，血骑士，真红骑士,,,估计后面大伟哥会加入初音"
"GGDavid","男","无IP","32942900","6","","10000","2","","我老是感觉丽塔蕾丝胸外穿"
"552c","男","无IP","86427168","6","崩坏3・天穹流星","10000","2","","献祭个策划，"
"Mk23的指挥官","保密","无IP","41814695","6","","10000","2","4","鸡蛋里挑骨头，真恶心-_-||"
"雷电芽衣吾之爱妻","男","无IP","18321205","6","","10000","2","","别说有水军了 这游戏根本没人雇人来黑"
"风暴迫近","女","无IP","158390499","5","","10000","2","","感谢崩坏3为我们创造了一个精致的游戏，一个精致的世界。,但是，崩坏3距离游戏界的“伟大”“神话”，似乎总是间隔着一道天堑。"
"靠卖烟生活的嫣桦","女","无IP","346093769","3","","10000","2","","我来个预言，明年不出希儿我直播吃shi[蛆音娘_die]"
"后崩坏书","男","无IP","37910272","6","","10000","2","","好想要女王皮肤啊，买18888水晶也好啊，让大佬花1888直接获得，让月卡党花100（至少我需要要花100的月卡）去肝，可不可以啊，ch啊，我再也不说你睿智了_(┐「ε:)_（求愿意肝的大家把我顶上去）"
"可能是速冻饺子","保密","无IP","11366340","6","EveOneCat2","10000","2","","策划出来挨打(￣△￣)(￣△￣)抽死"
"喀秋莎SaSa","男","无IP","87087000","6","原神","10000","2","","事实证明，这是一个要电脑玩的起来的手游"
"CutecatZzz","女","无IP","260881604","5","","10000","2","","找到我们熟，，"
"彼世星霜_DistantSora","男","无IP","597095","6","","10000","2","","复读机砸烂了2333"
"畏光症","保密","无IP","87865103","6","","10000","2","","兑换码多少"
"AliceSherryClare","女","无IP","67801787","5","洛天依9th生日纪念","10000","2","","献祭策划～(￣￣～)"
"名濑由加奈","保密","无IP","21487431","6","","10000","2","","有可能成为舰长cp的就只有姬子和符华了吧，然而姬子的人气真是气人[2233娘_大哭]"
"还是睡布醒","男","无IP","4770016","6","","10000","2","","怎么说，虽然每个版本都发生过各种各样的事情，但是每次直播最后大伟哥都会认认真真的说一些感谢玩家的话，虽然大家也都知道可能就是些客套的话而已，但看大伟哥那个认真老实的样子也就“啊行吧，再信你们一个版本，下个版本好好做啊的真香”了。这只是一个方面吧，不过感觉玩家想要的的确是很多的福利啦水晶啦，但最重要的其实还是运营对玩家的态度吧(￣3￣)[小电视_嘟嘴]"
"战且慢一罪浮夸","男","无IP","53293786","5","citrus","10000","2","","连住几个版本都说这是最垃圾的版本了，然后下限疯狂被破，好失望啊"
"4KHDR动画Channel","保密","无IP","159555849","6","","10000","2","","这个游戏 欧洲人的游戏体验是极好的"
"噜噜噜噜炉","保密","无IP","10917421","6","2021拜年纪活动专属","10000","2","","awwbwg"
"enjoy也是joy","女","无IP","36251847","6","","10000","2","","这届玩家戾气真重――豹子头咸鱼"
"是v额v我","男","无IP","99686640","6","","10000","2","","感觉这次直播真敷衍，直播的人甚至不会玩那个新模式。甚至连个金币码都扣"
"Z璐大酋长","男","无IP","39606564","6","黄绿合战5th","10000","2","13","不如直接倒闭成为回忆吧"
"惧场","男","无IP","85574719","6","","10000","2","","别让游戏凉了就行"
"红有三的骑士","保密","无IP","1947778","6","","10000","2","","爱玩玩不玩滚警告，顺便坐等歪出来机姬"
"Mr.www_w","男","无IP","14458500","6","","10000","2","","骂奖励的都是sb，也不想想其他tx，wy他们有啥奖励,国内手游还能玩啥,但是暗改没得商量"
"即将成为lv5的id","保密","无IP","38060510","4","","10000","2","","啊呜呜博物馆,没钱别玩崩坏三【大哭】,策划祭天，法力无边,汉娜中下，丝麻策划"
"丶起源丶","男","无IP","29995831","6","","10000","2","","你看看，有人理你们三个吗？[2233娘_汗]"
"一字曰心","保密","无IP","35691870","6","三周年恋曲","10000","2","","希望开放世界的bug可以修复一下，老是卡到地图外面[小电视_发愁][小电视_发愁][小电视_发愁]"
"破喉咙也不会有人","男","无IP","120009094","6","","10000","2","","有史以来最鬼畜的一次直播！"
"爆裂丶苦茶子","女","无IP","85048767","6","","10000","2","","策划这次不认真啊"
"猫厂榨汁机","男","无IP","3742062","6","初音未来13周年","10000","2","","在弃坑的边缘反复徘徊，反正就一句话，屏蔽画师和建模师，就看策划，策划良心，就继续玩继续氪，策划继续喂屎，那我现在也没那么好的胃口了，吃屎也是能吃腻的口牙，这个夏天吃撑了口牙。,什么画师拯救世界，玩笑话可以说说，哪个游戏真的只能靠画师了，那么，为什么不放弃游戏去做漫画呢？去画的，我把我的工资放在那儿了，画出好漫画，漫画书周边全给你买了。"
"bili_123300793","男","无IP","123300793","6","","10000","2","","你会骗氪到最后一刻，直到新的s出现"
"暗夜の星语","保密","无IP","129470957","6","还有醒着的么","10000","2","1","水军真多( _f｀)"
"树林林林林林林","保密","无IP","8800322","5","","10000","2","","啊呜呜博物馆"
"11abc06","保密","无IP","2401867","6","明日方舟音律系列","10000","2","","我TM有种玫瑰要被‘暗杀’的预感( _f｀)"
"MedizinischeBox","保密","无IP","155959590","6","","10000","2","9","视频中貌似有个崩坏中和剂，马萨卡,我的女王要离我而去了（/TДT)/"
"Russell_v","男","无IP","294853768","5","","10000","2","","女王皮肤都没播[小电视_差评]"
"DragonFFL","男","无IP","7812266","6","罗小黑战记","10000","2","","别的不婊，我就挺想问问文案是不是很喜欢百合，做宅向游戏还来百合元素，我已经看不惯很久了，买个衣服给小八还在那想着卡莲喜不喜欢，给草履虫换衣服还时时刻刻想芽衣？？？？？我可去你x的百合世界，洗地狗这么喜欢这个充满绿油油的世界请交给你们守护，还好早就弃坑了，告辞"
"盐渍杂鱼","保密","无IP","26426077","5","","10000","2","","咦，昨晚直播，我居然不知道，再次错过水晶[小电视_哭泣]"
"天狐-裂痕","保密","无IP","38376338","6","拜年祭粉丝专鼠","10000","2","","突然发现作为一个玩家，我完全不知道这段时间崩坏3发生了什么……"
"灰兔与盾","男","无IP","36005634","6","","10000","2","","现在心情很复杂，每次版本结束都弃坑不想再玩，每次一出新版本又忍不住回坑，藕断丝连的感觉很难受"
"白开心的洛殇","保密","无IP","17718881","6","","10000","2","","新版本其实也蛮期待的，还好我心态比较好，玩崩坏3都挺随缘的，抽不到想抽的就比较闲鱼混低保，这么过吧，游戏也就这样了,还能还能怎么办。你游玩家还是别婊了，崩坏官方只重视万氪玩家（十万以上），新s滚就看出来了"
"山丁","男","无IP","19905662","6","","10000","2","","充钱是不可能的了，当初的3000千多还不如买部手机算了[小电视_差评]"
"雪夜相思","保密","无IP","238335296","5","星座系列：巨蟹座","10000","2","","这直播的啥？2.7版本出来了给你们看看新角色新皮肤。你不直播我们都知道，直接发码就完事了呗，有必要直播吗？直播都不用心，游戏能用心吗？糊弄玩家就完事了屎反正有人吃。"
"无情铁手酱","女","无IP","27496812","6","","10000","2","","awwbwg警告，贪得无厌警告，不识好歹警告"
"朴实的MrOp","男","无IP","634367","6","","10000","2","","安慰我，吧务哥！[小电视_害羞]"
"FDrag0n","男","无IP","1268710","6","格兰芬多","10000","2","","天天觉醒，没钱氪了[小电视_差评]"
"-爱夜夜夜夜夜","男","无IP","27825978","5","","10000","2","","洗地tg们早啊[小电视_笑]"
"用羽毛作曲","男","无IP","31927631","5","","10000","2","","既然说玩到关服那就是真的玩到关服了。但是当初那些和我一起开始玩的人都逐渐退游了，不希望到最后只剩下那么寥寥几人在坚持。为什么会导致这样的后果，玩家也有一部分原因，当然，策划不能不背锅。游戏也明显再走下坡路了。但是我仍然希望能找到当初解接触这个游戏的感觉。"
"光盘巨头西卡罗","男","无IP","130804664","6","","10000","2","","爱玩玩不玩滚，阴阳人请取关，这些不是我们喷，是他们就是这么骂我们的。"
"瘟神来临","保密","无IP","172830332","5","","10000","2","","(｀ω之前你们屏蔽了六字真言，现在我们补上，awwbwg"
"野生陆行鸟","男","无IP","15701712","6","精灵王","10000","2","","这点火伤烤个鸡翅都烤不熟啊[小电视_无语]"
"神威CLANNAD","男","无IP","11940054","6","国民老公带回家","10000","2","","话说姬子从重剑士变成鬼剑士了"
"来自天境的雅特丽希诺","保密","无IP","7235081","6","国民老公带回家","10000","2","","啧，你们三位背锅侠也真是不容易啊"
"神威CLANNAD","男","无IP","11940054","6","国民老公带回家","10000","2","","当年我辛辛苦苦攒炎八装备，攒齐之后发现都在用冰八，冰八攒一半发现神恩才是深渊帝王，等扩充攒水晶肝神恩三次失败之后我决定还是苦痛养老比较适合我[蛆音娘_吃瓜群众]"
"-爱夜夜夜夜夜","男","无IP","27825978","5","","10000","2","","到底为什么直播弹幕不堪入目那些xdg还没有点B数吗？[小电视_困惑]"
"u田劾","男","无IP","222303","6","","10000","2","","55555 策划 nmsl"
"Juz1p","保密","无IP","12536420","6","","10000","2","","爱文物博物馆(｀)"
"雨落初夏夜","保密","无IP","24317040","6","","10000","2","","你们住B站的吗"
"我不是王德发","保密","无IP","74354245","6","EveOneCat2","10000","2","","终于中了一次测试服资格却在今天晚上才发现[2233娘_大哭][2233娘_大哭]"
"CitrusYzz","保密","无IP","38344192","6","","10000","2","","有些人就是给了水晶屁事还多"
"秀知院学院藤原千花","男","无IP","38548327","6","-阿库娅","10000","2","","兑换码不能用有什么用。"
