"昵称","性别","IP","UID","等级","装扮","用户权重","获赞数","粉丝团等级","评论"
"超可爱泪痕","女","无IP","171408917","5","","10000","1","","咸骑士・月卡路过"
"鱼大杂","保密","无IP","25019143","6","","10000","1","","我来看看有没有大月卡用户拉我进群"
"白音梦见子","保密","无IP","16362825","6","异常生物","10000","1","","许愿大月卡"
"紫云小姐姐","保密","无IP","21974271","6","","10000","1","6","大月卡[洛天依_哈哈哈]"
"FF圣骑士","男","无IP","6761095","6","","10000","1","","辣鸡策划"
"天庭之主叶凡","保密","无IP","37837083","5","","10000","1","","水军还洗吗"
"萌新km","男","无IP","6552288","6","","10000","1","","awwbwg，真红真的太搞笑了"
"红豆团子灬","保密","无IP","203035014","6","","10000","1","","5:22，emmmmmm( _f｀)"
"潘芝露","女","无IP","28830676","6","","10000","1","","我（c）爱（n）你（m）"
"辰星案","男","无IP","37923138","6","","10000","1","","你们开服了吗，我这还在维护( _f｀)"
"账号已注销","保密","无IP","33887849","0","","5000","1","","弃坑停氪玩家滚"
"曹十九","男","无IP","196124268","6","","10000","1","","策划是真的不玩游戏，发我80个碎片已经表名了一切，都是狼D"
"账号已注销","保密","无IP","304251602","0","","5000","1","","应用宝服无法登入游戏，官方什么时候修复一下"
"沉默是后","保密","无IP","65954059","6","","10000","1","","游戏什么时候更新？"
"五河あ七罪","男","无IP","28801550","6","良辰美景・不问天","10000","1","10","能先把策划安排一下吗,[小电视_发愁]"
"夜想要魔刀","保密","无IP","16371935","6","伍六七之玄武国篇","10000","1","","直播时候鬼畜笑的我肚子疼"
"孤独隐月","保密","无IP","7926020","5","","10000","1","","战场女王威武，你游策划越来越厉害了(滑稽)"
"脑浆少年","男","无IP","32790388","6","绯赤艾莉欧","10000","1","","我们找到了熟我们找到了熟我们找到了熟我们找到了。。。我一开始以为是我网卡了_>`"
"GYFe1","女","无IP","296289721","6","","10000","1","","谁记得直播时突然鬼畜，哈哈哈笑死了"
"xhfusjdbf","女","无IP","214307469","6","","10000","1","","[蛟游也魂P心，我只P心∏槿绾巍１廊我最喜g的就是∏檫@一c了。。。"
"BluJ4zz","保密","无IP","160190854","6","","10000","1","","你们继续，我一个咸鱼真的一点感觉都没有，包括我周围的崩坏玩家"
"星w","男","无IP","4269681","6","天宝伏妖录","10000","1","","爱玩玩不玩滚(°°)"
"我好爱吃肉","男","无IP","284963718","6","星座系列：狮子座","10000","1","4","下次直播前排练一下吧。"
"梅克尔丨斯卡雷特","女","无IP","809486","6","2233夏日冰品","10000","1","","有没有官托之类的玩家啊…例如王叔叔……,[小电视_嘟嘴]"
"舞月枭","保密","无IP","59376185","6","","10000","1","","awwbwg(°°)"
"方面包Darkness","保密","无IP","40231494","6","崩坏3・天穹流星","10000","1","","准备不足？[小电视_发愁]"
"Luboys","男","无IP","18715147","5","中野五月","10000","1","","awwbwg"
"金步摇-","保密","无IP","140040633","5","","10000","1","","awwbwg"
"三天睡不够","男","无IP","280552568","5","","10000","1","","我求求你们了不要让姬子阿姨死啊! 我一定氪648!"
"背负着德莉傻的犹大","保密","无IP","277403833","6","","10000","1","","红色？有角？三倍速？(=ω=)"
"Karabinerd","保密","无IP","32841062","6","","10000","1","","awwbwg"
"梦幻之剑","男","无IP","14077813","6","","10000","1","3","大伟这么多次没出现了但是发型老师每次都在？难道是…………"
"冰极灵","保密","无IP","216501018","6","","10000","1","","许愿真红，出必还愿"
"XM107","保密","无IP","830660","6","","10000","1","10","这次真的不是直播事故？[小电视_无语]"
"隆朝野","保密","无IP","256228695","5","","10000","1","","有官方鬼畜吗，10分钟完整版"
"莉娜的狗","女","无IP","38999359","5","三周年恋曲","10000","1","","大伟哥一直不说k423本体在哪里，可见本体威力有多大。上打发策划员，下载立绘师。还能打大伟哥不敢说。所以可见体才是最终boss。"
"修仙的康娜","保密","无IP","84516196","6","崩坏3・天穹流星","10000","1","6","许愿真红，出必还愿"
"圣芙蕾雅学院副院长","男","无IP","94498545","6","良辰美景・不问天","10000","1","5","只想要德丽莎"
"账号已注销","保密","无IP","17790376","0","","5000","1","","玩的还是太累了。虽说我也不是氪了很多，零零总总1600。真的是把我恶心到了。awwbwg。那我就滚了吧"
"yokawa提不起劲","男","无IP","17167434","6","","10000","1","","阿武隈八万刚，上次看到这个还是3年前逛萌百阿武隈词条的时候"
"没有忘却诺言","男","无IP","263227082","6","","10000","1","","为什么没有复读呢？"
"TheEggTart","保密","无IP","36012521","6","","10000","1","","咳咳，我想说，ch真******，没人反对吧？( _f｀)"
"灰色的绵羊～","保密","无IP","28542386","6","","10000","1","10","awwbwg"
"隐市修仙","保密","无IP","179348015","6","","10000","1","","索然无味的直播，还不如直接发水晶到邮箱得了。(￣△￣)"
"我只是有点贰","女","无IP","8931793","6","夏诺雅","10000","1","","后排看戏[芮小凸小凹_警告]"
"秋临枫落初号机","男","无IP","13167213","6","","10000","1","","安慰我博物馆"
"花鸟彡风月","男","无IP","12335298","6","夏诺雅","10000","1","","我寻思着，贴吧大佬不是都计划好直播时刷什么了吗？[小电视_赞]"
"学肘","男","无IP","31944178","6","","10000","1","","这次周年挑战赛真的恶心到我了"
"日蚀灬吟音","男","无IP","13628269","6","双生视界・花嫁","10000","1","","我就想说一句，说好的讲女王皮肤呢？是被三个人同时遗忘了么？？？这集体失忆厉害了"
"樱小路珂瑞丝","保密","无IP","13782427","6","初音未来13周年","10000","1","","对于我这种fgo下来的玩家，表示崩崩崩的游戏强度已经很低了，至少不用熬夜刷材料[小电视_发愁]"
"L富儆绿H","男","无IP","38846470","6","异常生物","10000","1","","昨天没时间看直播  错过了水晶[小电视_哭泣]"
"圣巢虫师交响曲","保密","无IP","355561948","6","","10000","1","","说得好，我选择崩崩。,我也听说过真红加按键精灵可以制霸深渊，真的可以这么操作的话深渊肯定木有体验，肯定又是一堆退坑潮流……留下来的要么佛系，要么肝帝，要么真爱，要么氪皇，要么咸鱼……但是肝帝肝不出来、真爱持续失望、氪皇氪不出货、咸鱼持续掉线时，也就佛系了，然而佛系又不争不抢，花钱买真红不划算啊，那你出这个是给哪部分玩家服务的？,然而我就厉害了，我就属于纯属是享受战斗时的快感的类型，变强与否与我无关，打得爽就行。当然我肯定不会肝真红，整出来又怎样，反正你养不起；能养又怎样，你不怕被削？还是慢慢来吧。"
"埋人宝","男","无IP","13926695","6","","10000","1","","awwbwg"
"凋零骑士只听死核","保密","无IP","22847744","6","新科娘","10000","1","","这期直播真得水，所有新版本直播里最水的一期，仿佛策划巴不得赶紧下班的样子"
"薯饼永远可爱","保密","无IP","109844943","6","","10000","1","","不满肯定是有的...但还是希望大家能理智对待...游戏环境的好坏，有很大一部分还是取决于玩家( _f｀)我依旧希望崩三能走得更长远，寄予期望"
"无线电波_loyaltome","男","无IP","115330680","6","","10000","1","","这次姬子应该是版本之子"
"wood7777","男","无IP","277028945","6","黑白无双","10000","1","","哈哈，请水军三个字，洗的，真是笑死我了。。。"
"好气呀啊","男","无IP","21250176","6","","10000","1","","第一次见到怨气这么重的直播，满屏的弹幕喷策划，米哈游确实该想想钱到底应该怎么赚，氪个两单三单零提升估计也只有米哈游敢这么搞，整个直播不但时间短，3个主持有气无力，全程尬聊，估计自己都觉得无趣"
"MrYoung___","男","无IP","28161462","6","嘉然今天吃什么","10000","1","","找到我们熟 找到我们熟 找到我们熟"
"吃不饱的嘤嘤怪","男","无IP","19944165","5","2021拜年纪活动专属","10000","1","","每次抽扩充都基本上86发后才出，一个小号到76还是只有次元鬼铠"
"柠檬草精灵咯","保密","无IP","327343797","5","","10000","1","","好尴尬的直播，能不能换个懂游戏善于言谈的人，全程尬聊没意思"
"再也不皮的可达鸭","保密","无IP","322102873","6","","10000","1","","睿智策划，没错。下面动不动问候全家的是什么，玩家情绪的宣泄，那可真是不得了"
"西线国防军上等兵","男","无IP","277404824","6","","10000","1","","谁有直播出问题官方鬼畜那一段？"
"克格勃驻地球办事处","保密","无IP","360252433","6","","10000","1","","抱着米忽悠送的抱枕吃瓜看戏，反正崩3不倒陪你到老"
"笔锋SAMA","保密","无IP","14153586","6","","10000","1","","今年周年祭我得看见了两位数的科技孤儿。。。虽然对圣痕立绘十分满意，但看着排行榜上一群科技孤儿在留言嚣张是真的烦心。。。"
"相遇那个夏季","男","无IP","8662445","6","","10000","1","","爱玩玩不玩滚警告"
"睿智二五仔","保密","无IP","229627907","5","","10000","1","","怒*大伟出神恩[2233娘_耶]"
"夜巅丶咩咩","保密","无IP","848822","6","","10000","1","","AWWBWG"
"Nostoker","女","无IP","91380749","5","","10000","1","","找到我们熟"
"Ito_miku","男","无IP","296749785","6","贝拉kira","10000","1","","以前直播都是几百万人气吧，现在只有100万左右了，啧啧"
"木狸是只猫","男","无IP","3095236","6","","10000","1","","游戏莫得意思了，新角色出个不停，有啥意思？"
"你打得不错-","保密","无IP","303050062","6","恬豆","10000","1","","策划死嘛"
"清凉山主","男","无IP","6589476","6","","10000","1","","首充一次加月卡党，没有女王黑鸭紫苑，战场9w红莲升降机，也玩的舒服，只是觉得氪的多没什么意义，除了收集福利，顶多红莲保级，无限大佬，战场1-2档，也不比我多到哪里去，抽卡抽到想要的开心，抽不到就分，白夜出了三个版本了我终于在万圣补给抽到了猫乐下"
"菲尔斯米契","保密","无IP","20027737","6","碧蓝航线","10000","1","","女王皮肤1888?"
"我喜欢尼亚海尤达嘉","保密","无IP","36933691","5","","10000","1","","不怪玩家戾气重的，策划都不干人事只知道骗氪喂食"
"圣爱音伟大无需多言","保密","无IP","20623298","6","贝拉kira","10000","1","","啊呜呜比我高警告"
"YW评级","保密","无IP","130916981","6","","10000","1","","收藏系统真是对非酋不友好(;_)"
"因幡月夜_Official","保密","无IP","39462344","5","绯赤艾莉欧","10000","1","","awwbwg?[洛天依_吃包群众][洛天依_吃包群众]"
"战歌咕哒子","保密","无IP","28758283","6","公主连结凯露","10000","1","","还没入坑的可以撤了，已经入坑的赶紧的收拾收拾弃坑吧r(￣￣)q"
"夜奏","保密","无IP","6956196","6","","10000","1","","找到我们熟"
"Isaaric","保密","无IP","94486312","6","","10000","1","","丰富黑名单[蛆音娘_吃瓜群众]"
"清之曙光","男","无IP","28654448","6","","10000","1","","那些“米卫兵”看了下，都是零级号。基本上都是骂策划的，你看看国际服待遇就这么好，而国服呢？搞不懂米忽悠这样下去是想干什么，真当你策划不玩崩崩崩啊？( _f｀)……还是那句话（awwbwg），没入坑的赶紧卸载，入坑的赶紧退坑(;_)"
"秦渡川","男","无IP","49718636","5","","10000","1","","awwbwg"
"想要大姨妈判多少年","男","无IP","34868322","6","原神","10000","1","6","活动送的都是蚊子腿---->蚊子腿抽出了犹大---->真香(ω)"
"BronyaJumpa","男","无IP","42317287","6","-阿库娅","10000","1","","看真红表现这么好，深渊不会升温吧，我刚进高级区[蛆音娘_扶额]"
"_逆模因_","保密","无IP","78078105","6","","10000","1","","求ch一件事，为用女王打深渊的人专门做一个深渊吧...女王这个锅炉工真的无敌...我以前轻轻松松的套路变成了极限操作的套路...真的没话说"
"L循h","保密","无IP","181616","6","碧蓝航线2020","10000","1","","快乐策划下岗了...这期上来的策划心里没点数吗[2233娘_大笑]"
"呆呆小小猪猪","保密","无IP","38840703","6","刺客伍六七","10000","1","","你出任你出，抽到算我输"
"花葬半月","男","无IP","289173094","6","Kizuna AI","10000","1","6","中间辣个人是谁（没开声音不知道）"
"你知道我是红酱","保密","无IP","16514086","6","","10000","1","","这么优秀的人设画风bgm就被ch花式玩爆真带不动"
"AF・阿法","男","无IP","22752844","6","","10000","1","","来，和我大声喊:找到我们熟!"
"Gouku77","保密","无IP","87455166","6","干物妹！小埋","10000","1","","昨天，是不是爱酱黑入了直播间？这也是你的提高人气计划吗？[小电视_吃惊]"
"断钢菌","保密","无IP","98738600","5","","10000","1","","话好好说，女王皮肤可以全民肝出来可以吗"
"夜阁少龙","保密","无IP","34512069","6","","10000","1","","刚退坑，不知道为什么还想来看录播"
"且与美酒伴桃花","男","无IP","6977692","6","","10000","1","","AWWBWG   GJG"
"白彦少佐","保密","无IP","59496061","6","登乐V计划","10000","1","9","兑换码多少呀[小电视_赞][小电视_害羞]"
"梦缘穹","女","无IP","93997454","6","","10000","1","4","猜到会有人喷，但没想到还有水军"
"Miku-Elysia","保密","无IP","3952286","6","多多poi","10000","1","11","矛盾的产生有一大原因来自大家理解能力与角度的不同"
"莫凌Siegfried","女","无IP","35363986","6","泠鸢yousa登门喜鹊","10000","1","","当最良心的游戏遇上最沙币的策划"
"暗猫不是猫","保密","无IP","22741616","5","","10000","1","","咦直播的作用不就只是250氵吗？"
"不见之","保密","无IP","2597841","6","","10000","1","","原来的版本直播我都是期待的心态，这次看都不想看，大概是热情不在了吧"
"Pistail","男","无IP","1799315","6","","10000","1","4","策划该骂骂，游戏该玩玩[小电视_笑]"
"晨海望舒_单推北钻DD环","保密","无IP","4052581","6","物述有栖","10000","1","1","大型翻车现场[小电视_差评]"
"冰糖加醋加酱油","保密","无IP","103080572","5","","10000","1","","那些骂说有水军的，我可以告诉你，没有。我还记得人少了。贴吧被封号的人很多吧？tap被删评论的人也多吧？所以说很正常。"
"二桃杀三士_","保密","无IP","46206753","6","","10000","1","","安慰我博物馆[小电视_害羞]"
"秋月英梨梨","保密","无IP","177745273","6","","10000","1","","婊的人其实挺烦的，之前一直婊女王弱，现在深渊被女王烧上去了心里高兴了？我倒是女王毕业打无限都很轻松，但是我以前的徒弟问我没有氯化钠怎么打穿20w度红莲，我真的想不到回答"
"Y番长","男","无IP","13921654","6","明日方舟音律系列","10000","1","6","我只知道一件事希尔看来有希望了"
"远山千世","保密","无IP","30928816","6","","10000","1","","555，崩小将又开始举报了，awwbwg，求你们接着举报我吧"
"你の斜光","保密","无IP","2000186","6","","10000","1","","简直敷衍了事，这是可是官方直播！结果打个游戏连怎么玩都不知道…直播流程的稿子都舍不得看下吗？最右边的肥仔真不知道他是来干嘛的？[小电视_无语]"
"豆子神","男","无IP","4762027","6","","10000","1","","阿伟网吧网管"
"csslayer","男","无IP","12640","6","崩坏3・天穹流星","10000","1","23","这次直播质量很差…"
"连咸鱼都称不上的死鱼","男","无IP","4404090","6","良辰美景・不问天","10000","1","","我还以为爱酱不会传这次的屑播了呢[小电视_差评]"
"GolDenSiR-Studio","保密","无IP","19838508","6","初音未来13周年","10000","1","","垃圾"
"丶萌心丶","男","无IP","19932558","6","2021拜年纪活动专属","10000","1","","弃坑了"
"LAOD","男","无IP","1299246","6","原神","10000","1","7","洗地的来我评论报个名，我一个个拉黑"
"猫头嘤本嘤","保密","无IP","26732089","6","明日方舟音律系列","10000","1","","我只想知道希儿还打算出吗?"
"是木酒不是九","男","无IP","46277401","6","","10000","1","","加强姬子啊(屎)"
"薰衣草的故乡","男","无IP","28631578","4","","10000","1","","以为发生了什么，进游一看，什么事都没有，在问了几句，大佬却专注于秀次元圣痕的能量值，4十级萌新在问毕业神恩好不好用，心一下就放下了，在此谢过各位的人气支持与宣传，外加官方复读与慕攻势会让更多人知道崩三，让新人更多点，让我以能秀下我的村正，本人十月一，80级小萌新，各位大佬能收我当师傅吗？8至20外，基本随传随到，B服，"
"昵称不存在或已被使用","保密","无IP","8648070","6","","10000","1","","AWWBWG[小电视_赞]"
"Amanda木子","保密","无IP","38647790","5","","10000","1","","说好的律化娜服装介绍呢？"
"潜行吧Kiana","男","无IP","85826226","6","","10000","1","9","秃头爱酱，在线修仙(￣△￣)"
"桐梓m","男","无IP","7147704","6","","10000","1","","啊呜呜博物馆"
"-muri-","女","无IP","2280684","6","","10000","1","","再这么扩下去会不会占4G啊[芮小凸小凹_哎]"
"某科学的仓鼠","男","无IP","239143703","6","","10000","1","","我在b站有房"
"果皇果皇果ovo","保密","无IP","12620734","6","星座系列：射手座","10000","1","","我记得有一段复读机模式....[小电视_笑]"
"Mimuheye","男","无IP","36120141","6","原神","10000","1","","你好漂亮啊，姬子阿y ～姐"
"VK3601H","男","无IP","1479163","6","碧蓝航线2020","10000","1","","啊呜呜博物馆(｀ω)"
"安兹乌尔恭大哥","保密","无IP","179072444","5","中野三玖","10000","1","","修仙"
"咸鱼舰长ぃの花嫁","保密","无IP","29020980","6","","10000","1","","容我说一句：这次直播也太尴尬了吧[小电视_笑][小电视_笑]"
"祈啡","男","无IP","57128889","6","星座系列：巨蟹座","10000","1","","鬼畜呢？"
"全夜行","保密","无IP","294972630","6","","10000","1","","这么努力的吗？难道是偷电被发现罚加班？[2233娘_大笑]"
"流心随想","保密","无IP","21350457","5","","10000","1","","看2.7的圣痕，感觉我的毕业玫瑰要重修了[2233娘_无言]"
"一切的一切都是虚无的","保密","无IP","177702311","5","碧蓝之海","10000","1","","真香骑士-黑丝女仆,参上！"
"我永远喜欢时崎狂三","保密","无IP","3166039","6","时崎狂三及白之女王","10000","1","","。。。。问题来了。。看录播有啥。。兑换码又用不了"
"有马公生A1","保密","无IP","95816574","6","","10000","1","","熬夜福利"
"法兰克大鱿鱼","男","无IP","31861286","6","格兰芬多","10000","1","","虽然涉嫌抢楼。。还是希望评论区能少点戾气"
"逛街哇着走","保密","无IP","25719425","5","鬼灭之刃","10000","1","","第二"
"UI2085","保密","无IP","49395180","6","","10000","1","","肝！,[小电视_我好兴奋]"
"ME社社长","男","无IP","10937390","6","星座系列：金牛座","10000","1","10","(°°)这么晚还不睡，爱酱的一头包菜怕是要掉光了[小电视_嘟嘴]"
"苍耳刺","保密","无IP","7274974","6","","10000","1","","爱酱不要啊！爱酱！[蛆音娘_害怕]"
"法兰克大鱿鱼","男","无IP","31861286","6","格兰芬多","10000","1","","乌拉"
"玄幻天凡","男","无IP","297628786","6","","10000","0","4","这是我登上战舰那一天看到的宣传视频, 就是这一跃而下的镜头深深吸引着我的眼睛. 现在他变了变得陌生而又疏远, 没有，当时我在所有游戏中看到他那种感觉了。但是我不知道该说些什么, 人都是会变的，何况是一个游戏, 一个四年老玩家。游戏名称，玄幻天。应用宝服和国服一区"
"@草糖","保密","无IP","33968372","6","泠鸢yousa","10000","0","","直播节奏没有最大只有更大"
"m友人Am","男","无IP","439285337","5","","10000","0","","2020前来挖坟"
"喜食四季大枣","保密","安徽","661419230","5","","10000","0","8","2023.3.3"
"Pe7anut小花生","保密","无IP","133555737","6","","10000","0","","生前录像"
"TB_45742359","保密","无IP","2957232","6","","10000","0","","开了血之狂暴的姬子……"
"玉衡星我爱你","男","无IP","11741940","6","","10000","0","","没有大伟哥 差评。崩坏学园3"
"SanBerigaldi","保密","无IP","8243072","5","","10000","0","","崩3新回入坑舰长可以帮助一下，填一下新入回坑id 34175642  舰长可以拿到a级女武神自选石和水晶哦，祝大家欧气满满(^ω^ )，十分感谢！【小电视_害羞】"
"红染丶火之途","保密","无IP","37881530","6","全职高手","10000","0","18","ID 136390970,有回归的玩家吗？求绑定～(￣￣)～,如果是中级区的玩家，我也许能帮到你们深渊战场，本人长期使用地图装红莲保级，且战场二档，最近两次战场结算分别排名咸鱼安卓3服中级区122名和115名，如果你有合适的蛋池装应该能打更好的分数，咸鱼服还是挺好玩的～,欢迎交流～,求回归玩家或者11月1日后注册的新玩家绑定～！,|ω｀)"
"人啊要舍得高兴","保密","无IP","110781782","5","","10000","0","","自从满级以后，出货率直线下降，六十发，没见真红的影儿，她去哪嗨了呀!"
"Kakera欠片","男","无IP","4624883","6","少前小剧场","10000","0","","我觉得牺牲的人可能是齐格飞。"
"博","保密","无IP","284653613","6","星座系列：摩羯座","10000","0","9","天火大剑要多少代币换呀[小电视_害羞]"
"Nisang菌","保密","无IP","263056227","6","喂，看见耳朵啦","10000","0","","许愿"
"八云落雪","保密","无IP","11428987","6","","10000","0","","那个，一发出了真红，但没武器就很难受(s°口°)s(┴―┴"
"谁敢说如","男","无IP","155584804","5","茶啊二中","10000","0","","一发真红"
"阿冥の天","保密","无IP","43675098","6","","10000","0","","两发出五个角色，两个丽塔，两个角色升了S一个直接升了SS，然而我他妈只想要一个真红"
"我不做人jojo","保密","无IP","24333481","6","","10000","0","","许愿真红骑士"
"起点读书--点娘_","男","无IP","47986000","5","","10000","0","","祈愿丽塔"
"wx鸟","男","无IP","290857396","5","","10000","0","","标配十连抽，保底B级符华。后来又抽了几次，出了两个战车。连说好的保底a级都没有。瞬间感觉无爱，直接退坑。"
"蒂法丶洛克哈特","保密","无IP","19836888","5","","10000","0","","大伟哥，你到是管下外挂啊，战场深渊科技泛滥，就没看到治理。"
"出言OuTUS","男","无IP","26888135","6","明日方舟音律系列","10000","0","","我昨天玩那个第九章体验，玩打律化娜那一关，我以为得把她打死，结果贼难打，超过240秒之后我就想，一不做二不休吧，留给她打到最后一管血最后一格的时候才发现，站在红圈里就能出发剧情……我可能是个傻子……"
"exp_nero","男","无IP","28170763","6","EveOneCat2","10000","0","","所以希尔呢。。。"
"没穿裤子258","男","无IP","35827651","6","原神","10000","0","","我真是呵呵了，真想打人"
"雪鸢yukitobi","保密","无IP","39427245","6","","10000","0","4","所以女王衣服还是没有说啊什么鬼啊"
"好莱坞特效人","保密","无IP","53477402","6","","10000","0","","…………666吧。"
"生闻声丶","男","无IP","234529030","4","","10000","0","","策划出来挨打。"
"忽再回","保密","无IP","185832680","6","","10000","0","","awwbwg还行"
"西奥多拉-","保密","无IP","76493561","4","","10000","0","","需要崩3年度大会员礼包的可以私信我加个微信，安卓的，价格好说（大号充了年会但不玩游戏）"
"阶斗历史矛盾运动","保密","无IP","1276888","6","领风者","10000","0","","话说皮肤预览小按钮，要做真一点就允许女武神打死舰长，要好好做预览就干脆自由视角，现在这样怀着惊喜点了预览结果还是那些角度还停不了，挺鸡肋的。"
"亿杯威士忌","男","无IP","12538343","6","崩坏3・天穹流星","10000","0","","怒草大伟！求求你我只要月蚀以后不管出什么我都可以抽不到！必还原！许愿月蚀！"
"莱克斯卢瑟","保密","无IP","227400737","5","","10000","0","","（￣ c￣）yyξ"
"吾丶人g邪魔","男","无IP","17590365","6","","10000","0","","国服追加补偿100  为啥苹果是300呀？"
"江南一枝","保密","无IP","13874265","6","","10000","0","","ios的还没更新完！！！"
"故鼎","保密","无IP","17307079","6","","10000","0","","这ios延迟更新这么久的吗"
"热血苍月","保密","无IP","223830341","4","","10000","0","","ios还没更完吗？"
"夏天丶大海和烟花","保密","无IP","8824400","6","","10000","0","","iOS还没更新完，逼我开夜班车吗"
