"昵称","性别","IP","UID","等级","装扮","用户权重","获赞数","粉丝团等级","评论"
"橘子卿","男","无IP","70538088","6","","10000","817","","还是大伟哥潮流发型粉白策划还有那个小姐姐来直播更有趣，这次直播看的心不在焉"
"死亡人鱼","男","无IP","5725190","6","","10000","349","","抢个前排[小电视_笑]"
"依旧这么生草","保密","无IP","23235267","6","黄绿合战5th","10000","348","","[小电视_嘟嘴]辣鸡游戏策划你玩游戏？骗氪就玩事了，能学陈睿徐逸玩玩BGO好吗？"
"丘处姬QAQ","保密","无IP","29631795","6","嘉然今天吃什么","10000","333","","那天阳光刚刚好，大家都是安慰我帮我肝。"
"星辰猪猪那么可爱","保密","无IP","36041397","6","","10000","55","","怎么说呢，策划可以骂，但是今天的情况就是瞎子也能看出来，有人带节奏，有人雇水军炸直播间，你们对策划不满去贴吧随便婊，但是直播间跟风带节奏只能让这个游戏凉的更快，到最后没有新人，你们就算是肝秃了头也没什么游戏体验了。崩坏三有很多地方做的不好，但是也有很多的方面让我喜欢，批评这个游戏可以，但是你要是想毁了这个游戏我就cn****"
"柚冰Ybin","保密","无IP","170582435","5","","10000","51","","人身攻击，瞎姬霸婊，狂带节奏，嗯，还行，看聊天频道我还以为这游戏玩家素质都挺好的，还行还行。咱能婊到点子上么？暗改婊暗改，明削婊明削。这尼玛弹幕里婊的都是些什么鬼，最后连TM250氵都能婊上，真的婊上瘾了？人家婊是为了让官方重视问题，这些人婊怕是纯粹在搞事哦[小电视_差评][小电视_差评]"
"B型航空母舰-大凤","男","无IP","43760958","5","","10000","46","","突然想起一句话，每一个米黑从前都是一个米卫兵。,有多爱，就有多恨"
"雅历纳格布","保密","无IP","14105036","6","明日方舟-愚夜密函","10000","42","","这次直播水军带的满天飞，真不觉得有多出气。,举个例子，就像自己家孩子外面小偷小摸，恨不得往死里打，结果刚开始还没骂多久，外面就来一群人打着“为民除害”的旗子，进来就把人给枪毙了。。。,直播本身也是醉了，弹幕更不想看，米忽悠感觉在梦游，也不知道都在干什么。,   最近这么多婊来婊去的，水军是少不了，本身也出问题，加上大部分人本身就不是追求什么“公道”，只要是能发泄、能谩骂、能有个噱头的东西吸引眼球就行了（没错，典型代表就是那些个傻  雕图和突然一些个热传的段子）。,不过算了，现在本来就当单机玩。fgo前段时间不也是被婊的飞天，怎么公关也不是粉丝、撕了就能解决的，是要官方能给个让大部分人满意的答复才行的，很大一部分玩家要求不高（fgo作为例子）。米忽悠这点做的不够好，反应真的很迟钝，总觉得基本没怎么给玩家一个正反馈。,   最后，米忽悠是比较氪的，不氪不是不能玩，靠肝也行，但体验不太好，最近活动比较扣（还能接受，只是国庆活动某种程度上没什么意义，都懒得肝）；而部分玩家也挺贪的，部分，不多评论。,  如果还觉得这款游戏能救一下的，看了今天这个直播，稍微动动脑，发言论的时候想想是不是自己想说的；如果觉得这款游戏没救了的，发个中肯点的差评，江湖不见也都挺好，没必要为了一个不喜欢（或者是恶心到自己）的游戏去和人撕半天，最后烦上加烦。,毕竟嘛，入过坑，挥挥衣袖走的潇洒点也挺不错的。"
"书剑生L","保密","无IP","19104573","5","新科娘","10000","40","","但凡游戏策划，就没有不被骂的，有些人总有一种逻辑就是我骂你是为你好，我充了很多所以我为什么不是大佬，讲真世上没有策划填得满人心这个坑，人玩游戏是为了自我追求，如果不想玩了，崩三又不是流氓软件，绝对可以完全卸载，有何故在这里气愤填膺，还有那些说赔钱的，那些买了10年彩票没中奖的彩民有让彩票发行商赔钱么，为了发泄自己的情绪连基本的理智都没有了。崩三到现在至少没有出大逃杀模式，崩三现在一直在探索自己的玩法，崩三的文案一直都很有趣，崩三没有pvp，你不会被大佬们摁在地上摩擦得毫无尊严，这次的直播是出了设备问题，策划也没有“感谢某某送的大电视，来来来兄弟们礼物走一波”，屏蔽一些等级直接少一大片弹幕，台上的人会有点失望么，我想就算习惯了也会有，所以有点敷衍也是情理之中，嘛行吧反正你们也就想要250水，直播结束的很快，策划也知道你们领完就跑，所以不拖拉，挺好的，难道你们是想像广场上派礼物的那些家伙一样，吹了2小时后扔几包洗衣粉？有某局在，国内的环境本来就不怎么好，一个因为市面上没有我们想玩的游戏就开始自己做游戏的米哈游能够成功也算是个奇迹。前几年年改剑姬削刀妹的时候各大平台纷纷说这么改英雄联盟迟早凉，我已经退了，没爱了云云，s8了，凉了么。同样的例子还有很多，策划面试时就已经被HR确认过他们绝对可以承受所有的bb和非议，所以骂，没有任何意义，因为一个游戏真正的好坏，素来是由玩家主体和市场决定的，也许说得很残忍，但说实在，无论是不是大佬，一个人的怨气，谁在乎呢？"
"5个硬币想改名","男","无IP","273317836","6","","10000","39","","舰长一到店，所有喝酒的女武神便都看着他笑，有的叫道，“舰长，你肝上又添上新伤疤了！”他不回答，对柜里说，“开两发精准补给，再补一张扩充。”便排出三张大卡。他们又故意的高声嚷道，“你一定又偷氪了金了！”舰长睁大眼睛说，“你怎么这样凭空污人清白……”“什么清白？我前天亲眼见你卖了课本，半夜数钱。”舰长便涨红了脸，额上的青筋条条绽出，争辩道，“微氪不能算氪……微氪！……读书人的事，能算氪么？”接连便是难懂的话，什么“非酋固穷，什么“者乎”之类，引得众女武神都哄笑起来：店内外充满了快活的空气。 舰长开完三张卡，涨红的脸色渐渐复了原，律化娜便妩媚地问道，“舰长，你当真想要我么？”舰长看着问他的人，显出不屑置辩的神气。他们便接着说道，“你怎的连半个 S 也捞不到呢？”舰长立刻显出颓唐不安模样，脸上笼上了一层灰色，嘴里说些话:“律化娜是吧，米哈游里有我的人，你早晚是我的。”不苟言笑的白练噗嗤一下大笑起来，“舰长，这辈子只有我陪你了”。 有几回，其他几个女武神听得笑声，也赶热闹，围住了舰长。他便给他们经验芯片吃，一人一张。女武神升了半级，仍然不散，水汪汪都望着舰长。舰长着了慌，伸开五指将背包罩住，弯腰下去说道，“不多了，我已经不多了。”直起身又看一看背包，自己摇头说，“不多不多！多乎哉？不多。”于是这一群女武神都在笑声里走散了。"
"独行-于此","男","无IP","317528864","5","","10000","39","","我怎么说呢，一群人带节奏，有眼睛的都看出来了，骂骂ch是崩3玩家常事，而弹幕还有在骂玩家的?这还不是敌游带节奏?还有tm有人在带节奏说什么只发250水?崩坏3直播250水不是众所周知的了么?很明显不是玩家了啊！我只希望那些人理智，为人最好明白一点"
"ubxiy177","保密","无IP","303122226","2","","10000","35","","热评那个指挥官，“都没开弹幕”就评价”史上最失败，戾气最重直播“？可还行 。虽说这次直播氛围确实不好，但你一个没开弹幕的知道的可真多！,,然后你还提到“2.7暗改”，你确定你不是在心理暗示玩家？让新老玩家加深对崩3的质疑？,,什么“团灭结局新节奏”，一个游戏公司剧情怎么发展照一定要按你的意愿来走？你怎么就知道团灭不会开启新的剧情？新的故事线？况且官方也说过不会团灭。一个故事的叙述讲究“起承转合”，复联结局也gg了一半，是不是观众就要让漫威退票？说话阴阳怪气的，照你的意思是说，哪怕团灭剧情没人带节奏，你也要带头冲锋去“婊”是不是？,,别扯“爱之深，痛之切”，你要真心希望崩3好，就多提点意见，像这样模棱两可地吃瓜可“真舒服”。"
"YumeSekI","男","无IP","22085833","6","","10000","24","","抛开运营策划不谈，支撑着我玩下去的是有着自己特点，世界观严谨宏大的剧情和可爱的角色们。,,作为一个佛系pve玩家……不懂你们在激动啥"
"54801637110_bili","保密","无IP","381414145","4","","10000","22","","以前不看贴吧游戏体验增加百分之百，我看现在不看b站游戏体验还得增加百分之五十(=ω=)"
"异常点丢失","男","无IP","14612714","6","","10000","20","","我就是偶尔玩玩，有心情了上线刷够1日常150，挂好探索。可以作为一种中学生亲戚的招待节目。装备只要紫色全锁定，无材料，水晶有就抽。,如果米忽悠活得够久，还能留给下个月要出生的孩子长大玩。然后指着一堆角色说:这是你二三四五六七八九...妈妈。"
"沙和华","保密","无IP","36490681","6","登乐V计划","10000","20","","策划年年换，怕不是和dark伟有交易(｀ω)"
"看到请提醒我去读首诗","男","无IP","39370729","6","","10000","19","","直播的水晶没领到的清洁工，把你们的扫把起来让我看到你们"
"路过的氵王","保密","无IP","291532877","6","","10000","18","1","评论里面一堆黑名单。。。而我几乎没有在关于崩坏3的视频下面屏蔽过别人。。。我想了想，好像发现了什么(o;"
"我两年没去东莞","男","无IP","9159777","6","梦塔・雪谜城","10000","18","","说实话这次直播确实有够烂，感觉什么都讲了，但又感觉什么都没讲，太敷衍了吧，s而且直播事故有点多，一是开头的复读机，二是新开放世界找不到丽塔？[小电视_发愁]，还有弹幕一直在问的女王皮肤也就展示一下没有说明获取途径，最后一个兑换码一个主持人还带着玩闹的语气说为什么不是十万水晶[小电视_汗]，不知道为什么听完这句话真的有点难受[小电视_嘟嘴]"
"莫负-流年","男","无IP","37111356","6","崩坏3・天穹流星","10000","16","10","戾气太大。作为一个非酋，补给全吃保底，我都不说话。不理解，为什么性格就这么暴躁，整天骂人还有理了(*`*)智障"
"黑人牙渣","男","无IP","4758592","6","崩坏：星穹铁道","10000","16","11","介绍天命新地图的时候，中间那位主持人讲没用，一路点跳过？？这么敷衍的吗？直播都看得出潮流发型老师想讲下剧情（米忽悠这次第九章剧情很长，想一下之前周年庆吃力不讨好的一二章重置，这不是听进去玩家说的剧情烂开始上心了吗？），中间那位，强度党？也热爱游戏，但应该不是我想的那种热爱，但这样，新地图不等爱酱引导完，一路点跳过的主持，还是请只在比赛的时候来聊套路和怎样打出高伤害吧，引导游戏还是另请高明吧"
"SH云生","保密","无IP","8985341","5","","10000","16","","真的是b站终于也像贴吧一样成了垃圾场了，直播弹幕真的不堪入目"
"GoTheK","保密","无IP","11373165","6","","10000","15","","官方贴吧吧务团队封号理由：爱玩玩不玩滚、本吧不解决智商问题；有图有真相"
"刷题魔神","保密","无IP","11226127","6","","10000","15","10","这届玩家事我见过最贪的，素质最低的（确信"
"UnreaL丨星空","男","无IP","27576361","6","崩坏3・天穹流星","10000","15","","越来越敷衍的直播  想念大伟哥的尬聊[蛆音娘_吐血]"
"账号已注销","保密","无IP","5391690","0","","5000","14","","好消息是米卫兵真以为是水军在骂 太把自己主子当回事了吧"
"星尘宝宝的提款姬","男","无IP","19223291","6","星尘","10000","14","","策划甚至没敢露脸，这直播质量也是丢人的不行，复读还行？音效爆炸还行？还有我求求你们不要拿米忽悠的睿智操作变成梗出来玩了，说的就是你b级女武神紫苑[小电视_发愁]"
"遗忘的梧桐树","男","无IP","13658926","6","","10000","13","","到底谁才是云玩家？到底谁才是老玩家？,说句不好听的，连高级区都没到的你没资格洗。才玩了几天？你懂个**。"
"陌路星云","男","无IP","288796835","5","崩坏3・天穹流星","10000","12","","测试服律化娜的冰之女王皮肤抄袭石锤视频av2094957，严重抄袭，没得洗了（滑稽）"
"吾乃上帝的爹","男","无IP","351844839","5","罗小黑战记","10000","12","","tap刷低分的神秘组织，贴吧刷awwbwg的贪得无厌的喷子，直播刷屏的“敌厂”水军……嗯！都是敌厂的阴谋！！！敌厂把自己的二次元acg动作游戏隐藏起来！隐藏了两年，目的就是等崩坏3倒，只要崩坏3一倒“他们”立马就把自隐藏了两年的acg动作游戏搬出来取代崩坏3！！策划你一定不要向这些反派势力认输！我相信这一切都是某个神秘组织干的！不要以为你们把取代崩坏3的游戏隐藏得那深我就会不知道，告诉你们我清楚得很！"
"吃书少女天野远子","男","无IP","7696117","6","","10000","12","","得，热评基本全换，一切节奏全部删掉，我算是看透了米忽悠的嘴脸了"
"泽心的说","男","无IP","11600129","6","","10000","12","","眼睁睁地看着自己曾经最喜欢的国产手游因为睿智侧滑的内部原因而变成这个鬼样子，昔日的爆肝热情也已经被无良活动和日复一日的高强度每日给消磨殆尽。骗氪就完事了，管你低氪玩家什么体验。我不是水军，我只想说说自己心里的难受。不说了，我去肝目前最喜欢的舰b了( _f｀)"
"勇者鲁卡Luca","男","无IP","146252238","6","","10000","12","","部分玩家又贪又婊,策划内心又深又黑,这是为什么呢？因为策划脑子里只剩下暗改，,   也许本意是“惊喜”吧，但可惜不该有的惊喜还是不要出现吧。"
"望海映月","保密","无IP","100279147","6","","10000","12","","骂不仅仅是骂，是希望他能意识到问题，然后改。现在最起码还有人骂，继续这样不用一年，直播间或许就只有几百个洗地的在那刷，“这游戏真好玩”“下个角色什么时候出？”，那样的直播间甚至是蹦蹦蹦才是米忽悠愿意看到的？"
"Z2z7F","男","无IP","39742046","6","","10000","11","","2.7最好的氪金指南：,不买月卡，不氪真红，,记忆战场，不打女王，,坚持一月，策划滚蛋，,家里有矿，可以无视。"
"圣爱音伟大无需多言","保密","无IP","20623298","6","贝拉kira","10000","11","","Awwbwg！yyrqqg!bbbfzzlwt！"
"Ela・brujah","女","无IP","9182947","6","","10000","11","","啧，玩家之间能不能考虑一下对方的感受，虽然我是一个月卡白嫖玩家，我也是随缘出货，但是每次削或者暗改一些蛋池圣痕武器或者女武神我都为大力氪出来的玩家痛心，可能这就是游戏策划的上限决定的吧，无法从多个角度开发新打法骗氪只能用新角色强过老角色的经典方法。我不是说崩崩崩新玩法不够多，开机甲玩吼姆已经是做的很多挺上心了，但是这些似乎替代深渊一代版本一代神而且老角色有些被迫退环境的事。没必要对比其他游戏，没必要拿fgo王者之类的蹭热度，就单独看崩崩崩，我个人总觉得崩崩崩有点走向某国内巨头公司的老路子了，毕竟公司要营业，业绩骗氪是少不了，如果能让玩家掏早钱没话说那岂不是更好。我不是学策划的，我只能希望策划多关心一下玩家的情绪，不一定每次都要满足，但是现在的情况似乎还不够。"
"葱烧豚骨毛","男","无IP","139301731","6","贝拉kira","10000","11","","为了游戏能更好的发展，我们有啥怼啥，不凭空捏造，差评必须中肯有据并且保有素质。那些只为一己私利不管不顾宁可毁掉一款游戏而肆意谩骂的狗，我在这祝您寿比昙花。"
"秋月之爱莉孤身走暗巷","保密","无IP","16836476","6","","10000","11","","测试服律化娜的冰之女王皮肤抄袭石锤视频av2094957，严重抄袭，没得洗了"
"玄玄君","男","无IP","13930728","6","洛天依8th生日纪念","10000","11","","awwbwg 有个二级小号一直洗地，就不能把名字改一下吗，一点都不专业。,还有日服环境好的原因是 如果出现鬼铠感电 0.98 雷切 鬼角 佐罗等情况的话，能被罚到破产[小电视_差评]"
"芙拉斯","保密","无IP","240754517","5","","10000","11","","婊的话请有素质的婊，这里是b站，当年的弹幕礼仪你们都没有好好看吗？"
"鹿里个鹿","男","无IP","7641917","6","星座系列：双鱼座","10000","11","","等一堆喷的biao的全退游就可以舒服的玩游戏了，大概就像阴阳师的状态，现在随便看一下心情都不好，我只想开心的玩游戏"
"代码写不完辣","男","无IP","28741833","6","","10000","11","","以前不觉得带节奏这种事有多恶劣，现在看来我错了，这节奏带的直接连看直播的心情都没了，全程在举报和屏蔽关键字。但恶心人的是什么吧，是你特么刚屏蔽了几个关键字，人家带节奏的给你换个说法重新发，这特么的已经不是发泄不满这么简单了，这已经实在在恶意攻击了！,什么，你说关弹幕？大家为什么不关弹幕？还不是为了跟一起看的小伙伴交流吹逼吐槽，本该是个其乐融融的环境，被某帮人搅的乌烟瘴气的，*你们妈的，一帮垃圾！,你有火你不想玩了可以，忍不住了说两句也是可以理解的，但请不要破坏其他人的观看好么，替别人考虑一下这么难的么？非要刷屏恶心人？这么自私的么？[小电视_差评]"
"我是彩币-大麋鹿","男","无IP","39290781","5","","10000","10","","我说一下自己的看法，策划捅这么大篓子，这么多骂声，米忽悠不可能看不见，不会有拿自己生命开玩笑的公司，不会有拿自己饭碗开玩笑的策划，任何创新都是有风险的，被玩家捧的是创新，成功，被玩家骂的就是策划祭天，游戏背锅，近期崩坏三的走向完全就是在自掘坟墓，是个老玩家都会骂，新玩家也跟风无脑喷，但是我们的骂的原因是想让崩坏三改变啊！不是被人带节奏成对喷啊。"
"浅间智单推人","保密","无IP","348025791","6","物述有栖","10000","10","","我真服了，人家策划都没来就策划祭天啥的。这仨人一个文案（左），一个玩家（右），中间那个是通讯中心（月光中心）的站长。喷他们三个干什么！"
"圣爱音伟大无需多言","保密","无IP","20623298","6","贝拉kira","10000","10","","测试服律化娜的冰之女王皮肤抄袭石锤视频av2094957，严重抄袭，没得洗了"
"我只是有点贰","女","无IP","8931793","6","夏诺雅","10000","10","","一场闹剧，有些米卫兵真的是洗地洗的可以，这个游戏发展成为这种情况跟官方搞一言堂是脱不了关系的。周年庆扣不扣有没有意思我们撇开不说，官方各种暗改不符合预期才是真正矛盾所在，被玩家发现后舆论控制，各种疯狂删禁，然后装死连个官方的道歉都没有，呵呵。"
"远山千世","保密","无IP","30928816","6","","10000","10","","说剧情不好自己写剧情的，我文笔不好写不出来，不过在这里安利一本蹦三同人：在天命当舰长的日子，完美填上米忽悠吃书日常，更让人欣慰的是主角舰长的存在，不在是可有可无的清洁工，而是一个活生生的，有人格魅力的，不可或缺的存在(｀ω)只希望舰长的戏份能更多些，不是看着女武神们迎接自己悲惨的命运，更有能力去加入其中，改变逆境，成为她们之中的一员，这样也能无愧我“舰长”的名号了"
"柚冰Ybin","保密","无IP","170582435","5","","10000","10","","剧情团灭＝新节奏，官方送250水晶＝骂玩家250，先不提ch睿智操作，光这群玩家就够崩3凉一半了[小电视_赞]"
"散勇化骁摸幺鱼","保密","无IP","27601100","6","","10000","10","","我不喜欢发言，但我觉得水军和跟风的人这样子搞真的会把米忽悠搞凉了，要婊去评论区或者贴吧啊！至少别在弹幕里发这些狗。屎的评论可以吗?,推荐随意跟风的人去玩steam上的the hex，不要以为骂了米忽悠之后就事不关己，一个人在遭受极大的压力之下，要么坚强的活下来，要么坚持不住崩溃。以此类推……,我不否认大部分人希望的事米忽悠越办越好，可是你们真的没发现有水军和习惯跟风的人在带节奏吗？他们就是故意要在弹幕里发狗。屎的内容。所以，请慎重自己的发言。"
"葡萄酸果甜","保密","无IP","13695058","5","","10000","10","","这次是不是有水军带节奏啊，满屏的骂策划。把屏蔽等级设置成不同的发现弹幕完全不一样，是不是有意为之←_←"
"saki黯翼","男","无IP","5625922","6","","10000","10","","没有那个,找到我们熟……,找到我们熟……,找到我们熟……,找到我们熟……,找到我们熟……,找到我们熟……,找到我们熟……,找到我们熟……,找到我们熟……,找到……,找到……,找到……,找到……,找到……,找到……,找到……,差评"
"落花赠清风","保密","无IP","11258270","6","雾山五行收藏集","10000","9","","没错，我就是哪个又贪又婊的，其实我并不关心这游戏发展的好坏，每周打打深渊驱魔记忆就下游戏还是很舒服的，每次看见有人黑我就会混如其中，不为别的，就是为了婊出那点奖励，别跟我谈感情，就是这么真实，玩个游戏我为什么还有在乎这游戏的感受，我只知道拿奖励是真的爽，哈哈哈哈哈哈哈"
"圣爱音伟大无需多言","保密","无IP","20623298","6","贝拉kira","10000","9","","米卫兵又开始精神胜利乐，骂完拉黑算什么本事，有种出来叫啊"
"狂诳kuang","男","无IP","5985807","6","一周年纪念装扮","10000","9","","对面问题  策划从不祭天，官方从不发言，洗地从不缺钱   玩个游戏我氪金了也没游戏体验，我连喷都不喷，我不就白花这冤枉钱了嘛[2233娘_喝水]"
"54801637110_bili","保密","无IP","381414145","4","","10000","9","","b站小学生是真的多，只会带节奏，爱酱的另一个视频评论区评论很多骂弹幕都是没素质的，这个视频评论区竟然又变成了骂的好…这两个评论区加上弹幕是三波人吗，为什么差别都这么大，还是单纯的带节奏？"
"小林_こばやし","男","无IP","34129471","6","","10000","9","","崩坏3就是我喜欢的游戏，我就是爱玩，怎样！！！！"
"长夜-梦我","男","无IP","182187325","6","崩坏3・天穹流星","10000","9","6","这回妥妥的有人带节奏，没水军就奇了怪了"
"言叶的锯子","保密","无IP","6821371","6","","10000","9","","很烂的一场直播，求你们不要再请右边那两个人来直播侮辱观众了好吗"
"贞德真的只是我老婆","男","无IP","8593913","6","幻星集・命运的选择","10000","9","","还有人说直播弹幕不堪入目的，你xdg和策划心里没点b数？"
"玩具大全Ericyooy","男","无IP","4004248","6","","10000","9","6","看了全程弹幕撕逼，带的节奏尴尬的一批，裱点无非明削暗改，节奏被带的这么大开始互喷是谁的功劳，当然是睿智喷子，上来AWWBWG，米兵卫洗地，赚钱群号加我一个，弄得现在我也想说  爱玩玩不玩滚，阴阳人请取关,顺便建议米忽悠最后一版测试服放最后数据，数值还能看，佐罗这种真的容易让人心态爆炸,最后，每期水晶250，水军上来就暗示什么你们这节奏真带的睿智，我还真以为是两波玩家互喷呢"
"等不到1223","男","无IP","106589279","6","","10000","8","","律化娜一共有几颗宝石？记忆战场有哪几颗没有实装？几个版本以来那些女武神强势？下个版本要出什么样的女武神？我想请官方回答一下这几个问题，如果你们回答这是巧合，我想问你们自己信吗？如果回答不是，那你们策划是真的厉害。咱们骗氪能要点脸 吗？呵呵！"
"大大飞镖","男","无IP","109035684","6","","10000","8","","米忽悠我求你们去拯救一下中国动画吧 游戏不太适合你们→_→"
"Fine-Asian","男","无IP","107926314","6","崩坏3・天穹流星","10000","8","","策划不要老是发3s碎片，自己肝到3s，然后再削一刀，你就明白为什么说你睿智了。策划：我又不玩的。"
"寻三玖","女","无IP","35179636","6","约战・狂三","10000","8","","你们婊暗改我没话说，但你们一些人，后面开始的都婊的是啥，直播水晶，剧情，周年庆奖励？这些都有啥好婊的"
