"昵称","性别","IP","UID","等级","装扮","用户权重","获赞数","粉丝团等级","评论"
"-砂","保密","广东","1481915552","5","","10000","1","","老婆[喜欢][喜欢][喜欢][喜欢][给心心][给心心][给心心][给心心][给心心][给心心]啊啊啊啊啊啊啊啊啊啊啊啊啊[大哭][大哭][大哭][大哭][大哭][大哭]"
"爱睡觉的小魔王","保密","浙江","8229773","6","","10000","5","","你们符华厨如果只看到华给别人当叠战力的buff，那可真是有够÷的，已经开始可怜上仙了[崩坏3・光辉矢愿_擦地]"
"哦豁喔呕","保密","四川","496618299","5","","10000","1","","齐格飞:队友呢?救一下啊"
"故人到底入不入我梦","保密","贵州","510318058","5","","10000","1","7","不说垫不垫工具人什么的了，看见阿华和凯文有一次针锋相对真的很伤心啊……明明是那么重要的同伴[大哭][大哭][大哭]"
"天使的守护之翼","男","山东","436925164","6","魔法学院","10000","1","5","小的偷电大的偷网是吧[doge]"
"毛毛狗Letsgo","男","广东","320038428","5","崩坏：星穹铁道","10000","1","","上仙死了秒退游[崩坏3・光辉矢愿_遨游]"
"FL1号","男","黑龙江","480135406","5","","10000","1","","1"
"窝下次还敢","保密","江西","356480305","3","","10000","1","","[抠鼻]打起来打起来，最好就来个不要停的群体退游，群体融号视频也走起，哈哈哈哈，每次看到米家玩家打起来就乐不停"
"139平","保密","陕西","1864222708","5","","10000","1","","看来识律要么没了，要么奔月了[再见]"
"会唱歌的云雀","女","浙江","403088353","5","","10000","1","","所以为什么吞我评论？我应该没有说什么吧？"
"于此绽放直至荼靡","男","云南","441780863","5","","10000","2","8","众所周知，米忽悠是个细节怪，那么0：25那里虫虫按键盘那段我觉得一定也有什么意义。坐等大佬解答（送我上去！）"
"若得青叶飞","保密","贵州","16827643","6","2021拜年纪","10000","1","3","[哦呼]你出的那堆垃圾结果还不是磙去深渊战场凹分啊？然后那地方疯狂加“难度”从希儿出来那一刻就是这个恶性发展！根本就没变过"
"洛天依LUO","保密","广东","1668516149","5","","10000","1","","怎么，编剧不继续踩主角团了？[吃瓜]"
"阿勒c","保密","河南","21038653","5","","10000","3","","丑b爱酱。真辣眼睛。活动不准备过了！以后剧情不会全是壮汉吧。！？？！草。那个垃圾恶趣味设计师设计的[辣眼睛][辣眼睛][辣眼睛][辣眼睛]"
"空山樱落时","保密","陕西","8957667","6","原神","10000","0","","@机器工具人 听歌识曲"
"迟北北同学","保密","黑龙江","687840943","5","","10000","0","","爱衣太好看了！"
"客服大祥老师的耳机","保密","江西","629300003","5","崩坏3・天穹流星","10000","0","","已经沉力（悲）"
"外星草履虫","保密","河南","205015593","5","崩坏3・天穹流星","10000","0","10","“永恒轮回的不沉之船”"
"补野","保密","江苏","666013858","4","","10000","0","","welcome ![打call]"
"你家见见的","女","湖北","272493491","5","","10000","0","","这个welcome简直神了"
"ShineWR","女","河南","357522473","5","雪未来","10000","0","","好康，差一个币1w诶"
"繁猩猩","女","江西","500215256","3","","10000","0","","帅"
"名花了六硬币","男","广东","294879365","5","","10000","0","2","期待"
"森芋zill","保密","山东","698827523","3","","10000","0","","[脱单doge]"
"蒙-_-古-_-上-_-单-_-","保密","江苏","162060724","6","","10000","0","","崩坏3兑换码:YSPRYS3AKN8P"
"命伪名","男","山东","199691591","6","","10000","0","","好久不玩了，这不奇亚娜嘛"
"香橙派宝","保密","广西","334595057","5","","10000","0","","名言：我以后再也不骂策划了[脱单doge]因为我那泡蛇到墙上的jy不知道为什么蛇踏马凤梨去了[捂脸]"
"潜行易","保密","上海","416210211","4","","10000","0","","这是官方？"
"瑞树汉化喵铃酱","保密","广西","234116554","5","","10000","0","","爱酱，真的好玩，上头！停不下来！"
"聆桃愿","男","广西","448536658","5","神乐七奈","10000","0","","爱门"
"咸粽子RX","男","广西","297322589","5","","10000","0","","大佬们填一下邀请码吧175745068EY"
"夏祭游鱼","保密","山西","28618949","6","原神","10000","0","","听歌"
"原神老牌玩家","保密","江苏","24360326","5","","10000","0","","好喜欢小爱酱[脱单doge][原神_哼哼]"
"aimagination","保密","江苏","191984660","6","","10000","0","","包包包......包菜？？[惊讶]"
"快乐小春春","男","湖北","325607333","6","小主安康","10000","0","","看样子。爱衣难道经历了所有的轮回"
"对影子告白l","男","福建","513199963","5","","10000","0","","604262295LF   邀请码  谢谢啦宝贝"
"我叫三鲜不是饺子","男","韩国","73494089","5","","10000","0","","我说实话，这次音乐非常出色，但角色形象和技能华丽度不够！跟这首电音不太搭配！（崩友误伤）"
"艾丝妲_Official","保密","河南","691484434","5","国民老公带回家","10000","0","","welcome―"
"费6个硬币改的名字","保密","河北","310850796","6","","10000","0","","609895514FP"
"辉总司令","保密","福建","23060691","6","","10000","0","10","BV19g411q76Z"
"深海舌鲆~","保密","黑龙江","20938380","6","","10000","0","","这是不是相当于隔壁派蒙进池子[辣眼睛]"
"导向蓟吧","男","福建","605799162","5","","10000","0","","世界名画之大姨妈抗凯文一击两个月"
"红染丶火之途","保密","广东","37881530","6","全职高手","10000","0","18","这动作设计，是融入了艺术体操里的圈操，开大最后那一下特别明显，我记得以前看圈操的时候也有这类似的动作。"
"账号已注销","保密","江苏","3461577476934331","0","","5000","0","","谁还记得，包菜之前只是德莉莎在遗迹里面挖出来的机器人[滑稽]"
"御坂10039号-","保密","湖南","1606691049","5","","10000","0","","呃呃，毒唯差不多得了"
"熙仔不会吃饭","女","湖北","3493076018399512","3","","10000","0","","大家包菜都几级了，都到sss了吗"
"御坂15509号","保密","辽宁","1032981622","5","","10000","0","","625276955AL"
"16338484694819","保密","四川","1287930793","3","","10000","0","","BBH3NWJL"
"愧疚于你的无上忠告","男","河北","2046880237","4","","10000","0","","其实怎么说呢？爱酱小时候其实就是圆生菜，也就是咱们所说的包菜，当爱酱变成大爱酱时，其实不是圆生菜了，也不是包菜，而是大白菜，好耶！！！包菜变成大白菜喽[给心心][给心心][给心心]"
"现场活捉抖M","保密","福建","1734841822","4","拉文克劳","10000","0","","崩坏三永远的神"
"白车轴草Kuruma","保密","广东","433876201","6","2020拜年祭（鼠）","10000","0","","这封面怎么一股涩图味"
"一只幻夏","保密","云南","1574054","6","","10000","0","","你宁愿出包菜，也不出杏大爷[藏狐]"
"_-Z|-_","保密","陕西","76360743","6","","10000","0","","琪亚娜？"
"CN丶似幻","男","辽宁","121722677","6","星座系列：巨蟹座","10000","0","","我在淘宝买的雷律那把伞坏了，为什么不支持维修？难道就是让我们买回去当个装饰品？"
"符华上仙的苟","保密","四川","108158471","5","原神","10000","0","","[原神_哭哭]符华不要寄啊呜呜呜"
"御坂15509号","保密","辽宁","1032981622","5","","10000","0","","大家都在担心符华，只有我还在担心大姨妈[doge]"
"REBIRTH_TOGRS","男","广东","511233614","4","","10000","0","","这color bass戳我xp[喜欢]"
"碎骨兔0019","保密","江苏","601341004","4","","10000","0","","既然有爱衣Λ那是不是还有ωφξλθεαβ"
"碎骨兔0019","保密","江苏","601341004","4","","10000","0","","就每人关注爱衣说话吗，永恒轮回的不沉之船，这难道是外传舰长的休伯利安，爱衣也是船上的人？"
"一生单推樱斩小姐","女","河北","297352943","5","","10000","0","","AI门"
"嗷呜特曼","女","广西","5615847","6","","10000","0","","虽然游戏a了，但还关注官方的原因，就是为了每次PV的音乐和美术"
"sleele","保密","江苏","1089176163","4","","10000","0","","你们都在关心小识和上仙 就我一个人注意到大姨妈都困在圣痕空间3个月了吗[微笑]"
"我好慌呀-","男","江苏","349453114","5","","10000","0","","帮帮孩子吧( ω ),627938887GF"
"疏影斜携","男","湖北","472979829","5","","10000","0","","Welcome"
"樱凛歌","男","广东","570505767","5","","10000","0","","耶耶耶，终于等到雷律白送了"
"月初不想上班","男","新疆","33799101","6","","10000","0","","米哈游，一个合作伙伴罢了，没有人比我爱酱更懂崩坏"
"fzzl矿泉水","保密","甘肃","11537755","6","C酱です","10000","0","","我想入坑了"
"bili_32267650495","保密","广西","524590948","5","","10000","0","","音乐是什么，有人知道吗"
"阿尔法百合子","保密","陕西","133364","6","","10000","0","","又迫害新形态保护期就一个CG的摩托鸭"
"嗷呜特曼","女","广西","5615847","6","","10000","0","","天啊好久不玩了，竟然把向导（？做成女武神了[哦呼]"
"白狼Narita","男","江苏","678715287","5","三周年恋曲","10000","0","","这个电音，一瞬间我以为我打开了cytus"
"逃避m","保密","重庆","1532993196","2","","10000","0","","BBH3NWJL"
"爱染川 式","保密","广东","354871","6","古守血[","10000","0","8","welcome！[崩坏3・光辉矢愿_小喇叭][崩坏3_点赞][崩坏3_呼呼呼]"
"悍妇大毛裤","男","辽宁","9676606","6","","10000","0","","伊甸之星：兄弟们，我是走程序还是直接碎[原神_G嘿]"
"02很甜","男","贵州","503020657","5","","10000","0","","527095643FL"
"EILIAN-W","男","山东","643373392","5","","10000","0","","弹幕呢"
"御神木下君","保密","陕西","34867958","6","","10000","0","9","鸭鸭你的驾照呢？"
"开心才会生活美好","男","云南","67166634","6","","10000","0","","我都忘了今天更新[藏狐]"
"啊对对好好好","女","重庆","249530091","6","","10000","0","","问一下德丽莎怎么样了啊 身体被打没了吗[保卫萝卜_哭哭]"
"丑人咕叽送饺子","男","重庆","358246405","5","崩坏3・天穹流星","10000","0","","BNWSDCZH"
"双子月夜的奶酪","男","山东","490079202","5","","10000","0","","吸欧气[崩坏3・光辉矢愿_吃西瓜冰][崩坏3・光辉矢愿_吃西瓜冰][崩坏3・光辉矢愿_吃西瓜冰]"
"爱莉希雅的粉白胖次","男","河南","187815383","5","","10000","0","","还不如让缇米朵上舰"
"一只木水目","男","宁夏","354494188","5","","10000","0","","老祖:我在听，你继续"
"黄泉","保密","江西","1620734514","4","不稳定发电机","10000","0","","祖传小区真的很有在月球的波动感[眠眠兔_喜欢]"
"_你当像鸟飞过你的山","男","福建","81270155","6","","10000","0","","坐等新年s"
"威拉赫姆","男","北京","889490","6","明日方舟","10000","0","","这不是爱酱吗"
"是棉花也拦不住我","保密","湖南","283798805","5","","10000","0","9","祖传小曲还是那么好听"
"催更是福","保密","上海","1461085962","5","","10000","0","","请问一下新版本几号啊[思考]"
"一生单推樱斩小姐","女","河北","297352943","5","","10000","0","","爱门（指爱衣・休伯利安）"
"明确但枫叶","男","河北","544783178","5","不思议之旅","10000","0","","一声艾一嘛听的我鸡皮疙瘩"
"风语羽翼","保密","广东","349092419","5","","10000","0","","宇宙t人[崩坏3_糖葫芦]"
"文森特的双枪地狱犬","男","广东","35651891","6","明日方舟音律系列","10000","0","","爱酱这个原画，左右配重五斤半啊[妙啊]"
"玄学大师白孑与","保密","重庆","36095088","5","良辰美景・不问天","10000","0","","御三家都白送了，这要是腾讯不得在收一波韭菜"
"爱门和波门","男","广东","10714349","6","","10000","0","","金刚芭比"
"凛いのり","保密","广西","349838616","5","","10000","0","","这个背景音乐名字是什么"
"d爷狠高调丶","男","青海","5368364","6","崩坏3・天穹流星","10000","0","9","冲冲冲"
"水如镜月似花","保密","山东","272082342","5","希萝Hiiro","10000","0","","羽兔这一身装扮跟境界线上的地平线里的伊丽莎白很像啊[doge]"
"月之银糖","女","浙江","176926620","5","2233幻星集","10000","0","","所以主教女士又没有戏份了吗【悲】"
"Egoimer_时光","保密","安徽","85958106","6","三周年恋曲","10000","0","","祖传小曲真的好听~"
"曲终终有人散","男","福建","383640154","5","","10000","0","","有音乐的踹我一下"
"星宫夜","男","重庆","19451253","6","","10000","0","","御三家的新装甲难道是鸭鸭的最先?"
"幻极圣尊","保密","湖南","49508843","6","公主连结凯露","10000","0","","[热词系列_三连][热词系列_猛男必看]"
"偷亲一口谈宋","保密","重庆","30854383","6","#EveOneCat","10000","0","","爱酱建模丑死了"
"贝拉喜欢蜘蛛","保密","安徽","84051092","6","嘉然今天吃什么","10000","0","","乳鸭了"
"汗颜ace","保密","陕西","52812675","5","","10000","0","","羽兔：理之律者不过如此,鸭鸭：你就是给老娘送经验的，等老娘新装甲出来就扬了你"
"账号已注销","保密","山东","398482019","0","12周年夏日狂欢","5000","0","","半路出来的三流货色叫板主角团？"
"改名字用了六个币","保密","河南","669483813","4","","10000","0","","几号更新6.2啊"
"海岸coast线","保密","四川","192091084","5","","10000","0","","模型改了吗"
"你始终都是最优选","保密","广西","384383146","2","","10000","0","","为素裳举牌[给心心]"
"西琳我的西琳最爱你了","保密","河北","403676624","6","","10000","0","","我去，colour bass，米忽悠居然写dubstep了"
"","保密","江西","270423488","6","","10000","0","","几号更新？"
"繁花落吹雪尽","女","四川","104362709","5","崩坏：星穹铁道","10000","0","","音乐还是一如既往的强啊"
"账号已注销","保密","广东","317308470","0","","5000","0","3","想看爱酱跟普罗米修斯贴贴[脸红]"
"周无卿_nvfY","女","黑龙江","495726996","5","","10000","0","","新pv凉了"
"猛谷中单","保密","湖南","436392659","5","","10000","0","","所以德莉莎现在还没睡醒吗[妙啊]"
"橘子也要开花","保密","河南","291332378","6","崩坏3・天穹流星","10000","0","12","Welcome[崩坏3_吃咸鱼]"
"的呵呵五十","保密","四川","94822996","6","","10000","0","","鸭鸭：数据收集的差不多了，你知道这是你第几次试图击败我[doge]"
"ACC丶2562","男","黑龙江","589967174","5","","10000","0","","@王兵开"
"我想活official","保密","广东","500450007","5","2233十一周年纪念","10000","0","","啊啊啊啊啊这个音乐爱了"
"咖喱咖啡","男","上海","9295158","6","汉化日记","10000","0","","羽兔：理之律者，不过如此,鸭鸭：我什么都做不到,[doge]"
"摇曳鹭荧-","女","广东","266743314","6","崩坏：星穹铁道","10000","0","","感觉不如大慈树王…画质[脱单doge][脱单doge]"
"好的好的减肥茶","保密","北京","1474044292","5","","10000","0","","兑换码就过期了？"
"沧流水影","男","山东","1631710622","4","","10000","0","","趁人少，欺负一下up[tv_doge],,不要展开，是那种接龙信息！,{\__/},(  . ),/ >,你看到这个硬币了吗,,{\__/},(  - ),< \,吃了也不给你,,{\__/},(  . ),/ >,开玩笑啦给你给你,,{\__/},(  - ),< \,诶，我又抢回来啦,{\__/},(  . ),/ >,给你啦给你啦不开玩笑辣,,{\__/},(  - ),< \,诶，骗你的略略,,Σ(っ °Д °;)っ,诶诶你怎么哭辣,,{\__/},(  . ),/ >硬币 点赞,给你给你都给你,发现了：好吧，你展开了，那么在24个小时之内，把这句评论转发到10个作品，否则倒一辈子霉，我也是受害者[藏狐],2分钟前,回复"
"男生应该和男生恋爱","保密","广东","488392092","5","","10000","0","","不要搞，窝里斗（来我被窝里斗）_(:з」∠)_"
"新纪元の无敌者","保密","广东","17018237","5","","10000","0","","就想要丽塔须弥装，比泳装都带劲"
"嗨MK","保密","江西","544447464","3","","10000","0","","md"
"贯穿星辰の鹅","男","江苏","287407914","5","花园Serena第二弹","10000","0","","啥时候给大姨妈也整套装甲[崩坏3_哭哭哭]"
"星火不烬","男","广西","506345645","5","","10000","0","","不喜欢"
"皇甫の天晴","男","北京","6416662","6","","10000","0","4","琪亚娜：呀咯……凯文！,凯文：嚯嚯，不逃跑反而向我凯文走来吗？,后面忘了（"
"泉奈的微笑","保密","湖北","693080517","5","","10000","0","","这么丑的东西还真上舰了啊，不能改一下？"
"皮套人e想恰我一粒米","男","湖北","276613564","5","","10000","0","","省流：理之律者不过如此[doge]"
"シモン","保密","加拿大","102943","6","-阿库娅","10000","0","","这能忍？这不买她手脚？[星星眼]"
"喜欢黑暗的不止你一个","男","辽宁","286366141","6","崩坏3・天穹流星","10000","0","11","又乳鸭？又乳鸭？"
"VVJTa","男","广东","488905628","5","崩坏3・天穹流星","10000","0","","最凉的一个版本pv"
"洛天依LUO","保密","广东","1668516149","5","","10000","0","","普罗米修斯不是跟塞西莉亚待在一起吗？还变成了圣痕[吃瓜]"
"玩B站的中二病患者awa","保密","广东","1460400094","5","","10000","0","","这位不就是包菜头爱酱吗[三星堆]"
"金色提","男","福建","37841248","6","","10000","0","","羽兔:我不是针对谁，我是说，在座的各位都是乐色[doge]"
"一堆积木堆堆堆","保密","陕西","432191845","5","","10000","0","","让符华和小识活着吧球球了我就这一个愿望"
"叱沐白樱","男","江苏","50390237","4","","10000","0","","UT6QG87P88N3"
"火焰是哈布的","保密","广西","27188449","5","2021拜年纪","10000","0","","琪亚娜万岁"
"l遣月岚","男","北京","41027842","6","","10000","0","","welcome"
"蒙鼓人科普","男","江苏","12199296","6","赏樱大会・初级","10000","0","","我觉着吧正经律者得同时有权能和核心，核心的话有权能可以直接合成出来，但是前提是得有充足的崩坏能。后崩说大部分崩坏都被封印在月球了，小识没能量聚不了核心，最多也就是个三秒律者，一开大就没蓝了。最强专属技能模因感染用不了，应该没啥事。[doge],不过主线的he我觉得很悬，主要有两个问题:,①如果主角团不牺牲，那必须得牺牲凯文，凯文挚友亲朋都寄了，将大部分崩坏能都聚集起来自封。结合后崩牺牲的是草履虫来看，很可能是利用圣痕空间的特性在大世界隔离出一个小世界，缓慢释放崩坏能导致主世界浓度有限无法诞生律者，同时圣痕空间内部没有文明，不构成试炼条件。,②已经逝去的人再也回不来了，不管结果如何，棺材板盖上的人已经没救了，因为有平行世界的概念，即使重置世界，只不过是个人跳到另外一个分支而已，已经发生的不会改变。,最后是对主线完结，新世界的猜想:,1.逐火之蛾篇。讲前代文明面对注定末日的挣扎，或者整出一个新的分支世界，毕竟主线已经诞生了战胜崩坏的可能性。,2.卡莲新生篇，讲述在没有奥托的世界线，天命的发展变迁，同时可以讲上仙当年的情况。不过感觉这个最多做一个番外，毕竟能讲的不多需要大量原创。,3.平行世界篇。这个是我纯猜的，假设当年二崩以齐格飞爆种[doge]战死为结局，主视角放在从小在天命长大的圣女琪亚娜身上，主教是魔怔人卡莲，琪亚娜无意发现天命的秘密决定叛逃，和逆熵首领雷电龙马女儿芽衣相遇，和她的保镖板鸭。"
"月面沉默且操纵风水","女","山东","452949128","5","","10000","0","","我超"
"汪汪的茉莉让人着迷","女","四川","31008811","6","","10000","0","","请问一下什么时候兑换码过期？现在上班手机没下崩3[大哭]"
"_祝我早逝且无来生_","保密","吉林","10070871","6","","10000","0","","爱酱有这么大？明明就比符华大一点还有限，你说对吧符华[脱单doge]"
"牛马叁柒","保密","宁夏","24323227","5","","10000","0","","凉凉崩坏三[吃瓜]"
"夏安安520","女","河北","213043764","6","","10000","0","","[原神_哇][打call][原神_哇][打call][原神_哇][打call],是新版本PV，好耶！！！,等不及得到爱酱（绿发安安）了hahahahahaha！！！,[原神_哇][打call][原神_哇][打call][原神_哇][打call]"
"Evil_Morty","保密","上海","3616005","6","崩坏：星穹铁道","10000","0","","[崩坏3・光辉矢愿_小喇叭][崩坏3・光辉矢愿_小喇叭][崩坏3・光辉矢愿_小喇叭]"
"姐姐家的虎崽","女","海南","1254116583","4","","10000","0","","嫦娥姐姐[打call]"
"茶壶先生Mr-Teapot","男","江西","330479320","6","","10000","0","","浮华die了"
"Axel-刃","男","辽宁","15082059","6","","10000","0","","羽兔 你可知有个地方叫做记忆战场么 [阴险]"
"9vp1b3d9b5lj17","保密","河南","186914507","3","","10000","0","","爱酱不是休伯利安的主控ai吗"
"我爱你爱莉希雅啊啊啊","保密","黑龙江","173664271","5","","10000","0","","6.0 6.1 6.2pv音乐名字都是什么啊[崩坏3・光辉矢愿_不可以看][崩坏3・光辉矢愿_不可以看][崩坏3・光辉矢愿_不可以看]"
"拾忆翎","男","日本","486399351","5","崩坏：星穹铁道","10000","0","","你说这是环刃？我说这是呼啦圈[脱单doge]"
"吃喝玩乐林一新","男","广东","8940276","6","","10000","0","","识宝没了那失去了气氛组，这天命多无聊啊[doge][doge]"
"SakuraとL","保密","山东","385635528","5","原神","10000","0","","[崩坏3・光辉矢愿_遨游]"
"VVJTa","男","广东","488905628","5","崩坏3・天穹流星","10000","0","","期待下月的鸭鸭高达"
"最喜欢学习","男","福建","14457930","6","至尊戒","10000","0","","渡鸦居然还出了皮肤，还有就是，AI不应该和雷属性更契合吗？怎么整个红烧包菜了[抠鼻]"
"账号已注销","保密","美国","402497214","0","","5000","0","","下下版本再说，大概率过渡主线，还没到大的[妙啊]"
"-ufbi-","保密","广东","321136027","6","","10000","0","","鸭鸭：车车是有极限哒！所以我不考驾照啦！出来吧弑神装甲！[崩坏3_点赞]"
"我永远喜欢碳烤绯玉丸","保密","重庆","77200971","5","三周年恋曲","10000","0","3","请问这游戏不充钱能玩吗"
"超越无极之剑","保密","广东","350265061","5","","10000","0","","崩三"
"GolDenSiR-Studio","保密","广西","19838508","6","初音未来13周年","10000","0","","我趣"
"AzurTempest","男","江苏","20981722","6","碧蓝航线2020","10000","0","","懂了，下下个版本鸭鸭新装甲[脱单doge]"
"即墨百歌","保密","广东","259494377","6","2021拜年纪活动专属","10000","0","12","Welcome！好帅的电音,首先是夸夸爱衣的旁白好有感觉，再聊聊蛮有意思的画面：就像我们无法看到阿波尼亚口中“丝线和烛火”般的未来，作为拟似时间晶体中诞生的生命，爱衣会以什么视角看待时间也是未知抽象的，过去和未来一览无余吗？从中间穿插的蜂巢样监视器里，黑屏后的字母写着Failed，想到长光游戏服务器的比喻，再加上“舰长扮演舰长”的活动，和爱衣“原来你也玩崩坏三啊”这类挑明真实感的台词，或许这个角色在设计上是有意站在第四面墙这边的，甚至她看故事的方式和玩家看故事的方式有一定同构性也未可知。,崩坏的世界行至此处已有丰富的前提和铺垫可供无数命题探讨和展开，每一次思考这种可能存在的设计意义或（听别人分析）哲学意义都是一种极有趣的活动，所以期待大包菜的发挥！虽然肯定没有主角团的笔墨程度，但能给出怎样充满新意的展示，我是十分期待的[崩坏3・光辉矢愿_比心]"
"冬雨甜","保密","河南","423802850","4","电子喵","10000","0","","开刀了是吧刀了是吧！！"
"丽瑟尔-阿尔伯特-爱茵","保密","广东","444659373","5","","10000","0","","我对这次剧情只有一个奢望，让爱茵看到乔伊斯[崩坏3・光辉矢愿_瞄准][崩坏3・光辉矢愿_策划][崩坏3・光辉矢愿_编剧][崩坏3・光辉矢愿_大伟哥][崩坏3・光辉矢愿_up主]"
"50岁事天命主教","男","贵州","1320079951","5","","10000","0","","为什么要辱鸭[doge]"
"宵枭枭","男","河南","26166401","6","洛天依9th生日纪念","10000","0","","黑希能被希尔感觉到，但是无法联系无法转变人格"
"灰色的八月","保密","中国台湾","179995725","5","原神","10000","0","","又…又又辱，真是太^份了，我什Nr後才能站起恚舛独洌米哈[我下次辱得我一"
"某蛋疼的大理段氏","男","四川","48275247","5","拉文克劳","10000","0","","没有识宝！！识宝是被刀了么？？？"
"真理の直通车","男","重庆","479406438","6","机动战士高达SEED","10000","0","","好耶，是鸭鸭主线！！！[hanser动物套装_好！]"
"YukiRedd","保密","中国台湾","94309141","4","","10000","0","","c姐"
"_dddd_","男","河北","526426558","5","","10000","0","","兑换码：UT6QG87P88N3"
