"昵称","性别","IP","UID","等级","装扮","用户权重","获赞数","粉丝团等级","评论"
"知觉沸腾","保密","重庆","36943177","6","乐正绫五周年生日","10000","7177","","最初的御三家里，唯有布洛妮娅还未走出自己的路;主线第二阶段的各位羽化者们，唯有理之律者还没有展现出属于自己的「无限未来」的可能性;抗击崩坏的各位先辈里，也唯有名为乔伊斯的温柔青年几乎被人遗忘，他永远沉睡在1955年的曼哈顿，直到现在都没有发出属于自己的嗓音。,三十万人的意志对于布洛妮娅既是指引可能性的明灯，也是带有压迫感的枷锁。这一次的主线以“真理”为名，不知道布洛妮娅是否会冲破前人的枷锁、找到无信者的信仰呢？那个本纪元最初的律者又是否会再次出现，为约阿希姆未能尽全的传承补上最后一块拼图呢？,,毕竟，“空间的维度可是无限的啊。”"
"a言言a","男","安徽","407400307","5","","10000","168","","羽兔：理之律者不过如此,板鸭：你再骂？[脱单doge][脱单doge]"
"Sennyuki风早千雪","男","未知","23938690","6","异常生物","10000","2703","12","那句“Welcome”电音帅到我心里去了！[崩坏3・光辉矢愿_遨游]"
"灶神的眷属","保密","安徽","442472214","5","","10000","883","","刀其他人我能接受，别刀小识[大哭][大哭]"
"希儿芙乐艾official","女","河南","57990517","6","希萝Hiiro","10000","2159","","爱衣休伯利安:,那一年是帕朵取代渡鸦的日子，当时我看见渡鸦一直在地上打滚，这个画面我永生难忘。,　　那一刻我在想，如果我能成为一名火辅，我一定要赢下所有。如今最强火辅就在眼前，我必须考虑这会不会是我此生仅有的机会。,　　我相信火系能有过去的霸主地位，渡鸦功不可没。重铸火辅的荣光，吾辈义不容辞!"
"究极无敌巨帅气的符华","女","浙江","508297483","5","","10000","78","","我求求你崩坏3，让符华活着给她一个好结局好不好[大哭][大哭][大哭]我真的不感想像她和小识死了的画面[大哭][大哭]求求你[大哭]我不奢求什么了，就让她好好活着好吗[大哭][大哭]我真的很喜欢符华这个角色，我也从来没想过我会对一个虚拟的角色付出这么多的情感[大哭]当我看到PV里华跪倒在凯文面前我眼泪都不自觉得往下流[大哭][大哭][大哭]求你了崩坏3[大哭]让她活下去[大哭][大哭][大哭][大哭]"
"珐露珊的裙子","保密","河南","1760178527","5","","10000","71","","有人发现希儿不见了吗？[大哭][大哭][大哭]鸭鸭的主场没希儿我有一些不好的预感[大哭][大哭][大哭]"
"StarWind星寰浴风","男","广西","36979795","6","","10000","4005","","为新火辅爱酱的诞生献上渡鸦礼炮[doge]"
"磁爆步兵54","男","浙江","3443416","6","","10000","3549","","也许岳母不能上舰，但羽兔可以上舰呀[藏狐]"
"艾丝妲_Official","保密","河南","691484434","5","国民老公带回家","10000","45","","无敌的上仙又倒下了，哦我忘了，她就没站起来过[吃瓜]"
"X-STATION","保密","广东","396025514","5","","10000","1","","BGM又鲨疯了[喜欢]！！！"
"长颈鹿锯锹","男","甘肃","1396038828","5","崩坏3・天穹流星","10000","6","","一定是包菜干的[崩坏3_X]"
"L-御风","保密","湖南","498387127","5","","10000","173","","相比符华，凯文背负得更多，也必然更加强大。但是，编剧你真把她当工具人，让她一直吃瘪，你觉得合适吗，不说打赢凯文，起码得让她活下去，在战胜凯文的事情上有参与感，有至关重要的作用，比如削弱凯文的力量，甚至直接逼出凯文的救世形态什么的，这样班长逼格拉满，凯文也不会说弱到哪去，对大家都好[辣眼睛]"
"嘬一口冷酷毒汁儿","保密","广东","525183155","4","","10000","139","","我真的不希望小识因为后崩无律者这种理由就必须被刀[大哭]"
"舂葵","保密","福建","321904674","5","","10000","15","","我感觉羽兔最后那句是故意的，她看着就像好人，应该是为了让大鸭鸭进化"
"巧克力曲奇拯救世界","保密","广东","24029624","6","崩坏：星穹铁道","10000","76","","符识被刀也罢，垫子也罢，先出个新装甲再走行不行[藏狐][藏狐][藏狐]"
"趑|-r崎狂三","女","广东","37618251","6","约战・狂三","10000","8","","凯文有阿波利亚的戒律，识律的能力对凯文效果不大，现在这个所谓的太虚剑气就是当初梅博士用阿波利亚的戒律改的弱化版，符华也不能完美的控制，华实力在十三英杰里能不能进前五都是未知的，律者在英杰面前都是被拿捏的货，不要说现在这个时代律者更弱了，符华真的没有什么实力和凯文打，更不要说逼凯文，如果编剧来个爱的力量当我没有说……"
"账号已注销","保密","福建","424218626","0","","5000","4","","大姨妈应该也有人为崩落形态吧。。。。斯。根据科斯莫人为崩落不可逆的的情报，与大姨妈后崩一直没露脸，不会是崩落成什么不可名状的样子了吧。。。。"
"欧噶斯","保密","福建","321219064","6","","10000","62","","天天看琪亚娜成长成长真的会谢,符华和鸭鸭一个前文明战士一个乌拉尔银狼，剧情反而没怎么表现她们的实力[微笑]"
"琪亚娜是我老婆啊","保密","山东","77342649","5","","10000","8","","凯文新形态什么时候出？[脱单doge]"
"a言言a","男","安徽","407400307","5","","10000","168","","羽兔：理之律者不过如此,板鸭：你再骂？[脱单doge][脱单doge]"
"陌谖","女","江苏","226342475","6","明日方舟","10000","226","","所以德丽莎呢？难道大姨妈到主线完结了都不能拥有断片了吗？"
"珐露珊的裙子","保密","河南","1760178527","5","","10000","71","","有人发现希儿不见了吗？[大哭][大哭][大哭]鸭鸭的主场没希儿我有一些不好的预感[大哭][大哭][大哭]"
"一只天使羊","保密","广东","2681643","6","崩坏3・天穹流星","10000","53","11","那句welcome好有感觉！,爱酱的圣痕简直要笑死了 这必须抽啊"
"究极无敌巨帅气的符华","女","浙江","508297483","5","","10000","78","","我求求你崩坏3，让符华活着给她一个好结局好不好[大哭][大哭][大哭]我真的不感想像她和小识死了的画面[大哭][大哭]求求你[大哭]我不奢求什么了，就让她好好活着好吗[大哭][大哭]我真的很喜欢符华这个角色，我也从来没想过我会对一个虚拟的角色付出这么多的情感[大哭]当我看到PV里华跪倒在凯文面前我眼泪都不自觉得往下流[大哭][大哭][大哭]求你了崩坏3[大哭]让她活下去[大哭][大哭][大哭][大哭]"
"艾丝妲_Official","保密","河南","691484434","5","国民老公带回家","10000","45","","无敌的上仙又倒下了，哦我忘了，她就没站起来过[吃瓜]"
"银隼_","保密","江苏","162142800","5","崩坏：星穹铁道","10000","50","8","你说的对，但是《100sp》是娜塔莎小姐研发的一款全新的打sp游戏.....[doge]"
"鸡莫","保密","安徽","37727210","6","","10000","190","","别tm让符华吃瘪了，在搞已经让人觉得恶心了"
"巧克力曲奇拯救世界","保密","广东","24029624","6","崩坏：星穹铁道","10000","76","","符识被刀也罢，垫子也罢，先出个新装甲再走行不行[藏狐][藏狐][藏狐]"
"有生之年能看到吗","男","安徽","315622780","5","","10000","57","","让我仔细看看条形码[doge]"
"我怎么活啊","女","河南","1455150949","4","","10000","66","","符华不崩落是吧,被动挨打是吧,你再这样，我要闹了[大哭]"
"旁白桑并不爱说话","保密","河北","1959099243","4","","10000","45","","识之律者女士修改了你的意识，符华打败了凯文[崩坏3・光辉矢愿_不可以看]"
"KDiotima","保密","福建","176490353","6","","10000","47","7","这个welcome太吊了"
"烟取竹","保密","湖南","325551984","5","","10000","45","","敢刀了符华和小识，我就看着你睡，编剧！！！[阴险][阴险]"
"磁爆步兵54","男","浙江","3443416","6","","10000","44","","也许岳母不能上舰，但羽兔可以上舰呀[藏狐],爱酱，你也不想让德丽莎知道你偷了这么多电吧？[阴险],所以你要怎么偿还呢？[阴险]"
"选择性必修3","保密","河北","1489811006","4","","10000","34","","“荔枝律者，不过如此”[脱单doge]"
"橙姚郁","女","黑龙江","30317822","6","","10000","667","","KFCFKXQ4VIVO50"
"艾丝妲_Official","保密","河南","691484434","5","国民老公带回家","10000","32","","符华我的符华你不许刀她"
"王昱翔嘟嘟","保密","河北","361173417","6","","10000","169","","非常好短短的视频我知道班长又输了[翻白眼]"
"中也最原枝的苦茶","保密","浙江","476117969","4","","10000","36","","别搞上仙和识宝"
"江流逆水渡白衣","保密","云南","57071603","6","","10000","279","","编辑啊你这是让符华党意难平啊，那么多外挂硬是一个没剩，还没有新装甲。工具人用玩就丢啊[崩坏3・光辉矢愿_瞄准][崩坏3・光辉矢愿_策划][崩坏3・光辉矢愿_编剧][崩坏3・光辉矢愿_大伟哥][崩坏3・光辉矢愿_up主]"
"皎洁明月照我心","女","广西","44369988","5","","10000","31","","上仙别拼命了我真的你真的，我哭死"
"清谭之语","保密","北京","90896238","6","","10000","457","4","设计角色胸部别那么大了行吗？从什么开始审美就慢慢变歪了，同质化太严重了"
"欧噶斯","保密","福建","321219064","6","","10000","62","","天天看琪亚娜成长成长真的会谢,符华和鸭鸭一个前文明战士一个乌拉尔银狼，剧情反而没怎么表现她们的实力[微笑]"
"来看看你年纪家家","保密","上海","95649935","5","","10000","357","","果然符华还是得当垫子使，你编剧甚至都不让她参团，仿佛主角团从来没有这个人一样。"
"虹之音","保密","福建","3734353","6","","10000","34","11","高情商：理之律者，不过如此。,低情商：我来给你送外挂了。"
"嘬一口冷酷毒汁儿","保密","广东","525183155","4","","10000","139","","我真的不希望小识因为后崩无律者这种理由就必须被刀[大哭]"
"清理型二向箔","男","河北","17841726","6","","10000","114","11","工具人何苦为难工具人，凯文和上仙一起喝茶看戏不好吗，看编剧让少数人用美好能量大杀四方"
"Apsarass","女","辽宁","66770342","5","","10000","127","","上仙主线就没有赢过。。。"
"一个很优秀的名字","女","江苏","35931198","6","EveOneCat2","10000","33","","受不了了，符华要是真死了我估计也崩溃了"
"黄豆花卷","女","山东","8446196","6","","10000","117","","好希望符华回太虚山睡觉算了……………好吧！能不能要么和识宝一起寄要么都别寄"
"迪小酷","保密","山西","289192489","6","崩坏3・天穹流星","10000","27","10","没人？！崩三凉辣！[doge]"
"@与槲寄生","保密","浙江","568320155","5","","10000","223","","你要让符华和小识死在凯文那里，还不如渡尘那里死了算了"
"莫诺","男","福建","1809693","6","","10000","30","","照狗编剧得尿性，华跟识律铁定得寄一个"
"L-御风","保密","湖南","498387127","5","","10000","173","","相比符华，凯文背负得更多，也必然更加强大。但是，编剧你真把她当工具人，让她一直吃瘪，你觉得合适吗，不说打赢凯文，起码得让她活下去，在战胜凯文的事情上有参与感，有至关重要的作用，比如削弱凯文的力量，甚至直接逼出凯文的救世形态什么的，这样班长逼格拉满，凯文也不会说弱到哪去，对大家都好[辣眼睛]"
"zz小星运","保密","湖南","1156571221","3","","10000","25","","上仙不要啊[大哭]"
"长风曦歇","女","未知","392676090","5","","10000","25","","凯文你别动我上仙啊[大哭][大哭]"
"海中东方已见光芒","男","山东","76359583","6","星尘","10000","439","6","感觉现在丽塔根本没什么出场机会，更没啥存在感（仅有那点存在感也是给呆鹅百合贴贴，毫无独立性），毕竟米哈游一开始就定位纯工具人背景板角色，除了反派担当就是其他角色高级背景板一直吃瘪，现在干脆不配出场，我觉得普通人不如最后一课燃烧生命至少高光一波印象深刻"
"伦太郎的彩虹糖","女","新疆","431790013","6","","10000","69","","我超！我的阿符怎么了！！！？？？"
"无尽战神伊蕾娜","保密","浙江","1526406177","5","","10000","24","5","后崩没见着小识，CH你别跟我说识宝要献祭主角队啊"
"三笠笠ミ","保密","广东","11250707","6","崩坏3・天穹流星","10000","22","11","本来不想抽的[傲娇],但因为圣痕过于生草，我心动了[喜欢],,[崩坏3_赞]"
"黎明前兆","男","海南","21939609","6","","10000","25","10","米忽悠，你甚至不愿意给这两位当世最后的英桀做一段动画短片[傲娇]这也略写是吧别告诉我甚至连战斗都不给啊，德丽莎的待遇总不至于都享受不到吧[委屈]"
"星九或酒","保密","浙江","568687046","4","","10000","51","","能让大部分厨子觉得自己厨的角色在当工具人，没法共情就是没法共情，为什么有的人还在替编剧说话呢"
"A澄の","保密","广东","610749220","5","公主连结可可萝","10000","21","","不懂就问，这是侵蚀律降临了来侵入了吗，直播好卡[热词系列_知识增加]"
"ulbldw","保密","黑龙江","25067633","6","","10000","81","","建模虽然丑，但丑的特别，也就是特别的丑[doge]"
"呜呜37你带我走吧","女","江西","361090279","5","","10000","20","5","浮华:难道老实人就该被人用枪指着吗？[原神_哼]"
"一个奇葩的人qp","男","河南","407390554","5","","10000","20","","看到最后一段，我属实蚌埠住了。你们不仅要乳鸦也要乳鸭是吧？[藏狐]"
"腿麻蹲蹲","女","上海","22683724","6","","10000","32","","不找其他角色垫一下编剧不会塑造角色是吧？？？"
"布洛妮娅を郅筏皮","男","福建","20785072","6","良辰美景・不问天","10000","37","7","虽然但是，我还是想要帅气的原爱衣[崩坏学园2_记仇], , , , , , ,爱酱你欠我的手办用什么还,爷是催鸭鸭比例手办小助手，快来和我一起刀爱酱8,你一刀~我一刀~,让爱酱下条动态就是出鸭鸭比J例K手J办K,[崩坏学园2_白眼][崩坏学园2_白眼][崩坏学园2_白眼][崩坏学园2_白眼][崩坏学园2_白眼][崩坏学园2_白眼][崩坏学园2_白眼]"
"冰小泽","保密","福建","433901538","5","","10000","19","","凯文不可能真的杀符华，但符华真的可能烧命把自己杀了[灵魂出窍]"
"TabuDeri","保密","陕西","75796247","6","春原庄的管理人小姐","10000","18","7","上仙什么时候发动侵蚀的力量啊，毕竟做过这么多手术"
"你手机要没电了啊","保密","河南","53593369","6","崩坏3・天穹流星","10000","18","10","板鸭：有力量就能为所欲为吗?,羽兔：抱歉，有力量就能为所欲为，理之律者，不过如此"
"暗喵の独白","女","重庆","435281348","5","","10000","55","","唉，怎么说，看淡了已经。从接触崩坏三就一直喜欢符华，这么久了不是吃瘪就是当工具人，真就历历浮生无法败败败败而后败[藏狐][藏狐]，对于崩坏三而言符华只是一个推进剧情的垫脚石对吧?只是一个为了弥补崩二没国风角色的遗憾对吗？老实说，最为一个华厨我已经累了。"
"清墨尽染","男","新疆","282211291","6","","10000","19","","一开始乳草履虫，然后草履虫站起来了，之后乳芽，然后芽衣站起来了，现在开始乳鸭了，大家知道下个剧情大C是谁了吧[脱单doge]"
"又是闪吹的一天","保密","湖北","628227173","4","","10000","15","","你要是敢刀阿华和小识，我他妈劈了你丫编剧！[阴险]"
"舂葵","保密","福建","321904674","5","","10000","15","","我感觉羽兔最后那句是故意的，她看着就像好人，应该是为了让大鸭鸭进化"
"长颈鹿锯锹","男","甘肃","1396038828","5","崩坏3・天穹流星","10000","6","","一定是包菜干的[崩坏3_X]"
"柳筠Mandy","女","重庆","226595326","5","崩坏：星穹铁道","10000","14","6","符华不能出事符华不能出事符华不能出事！！！！！！！！！"
"平平无奇的夹板清洁工","保密","福建","1056468933","5","魔法学院","10000","14","6","小包菜偷电，大包菜偷网[阴险]miHomo，你干的好啊"
"星辰永不落幕","男","安徽","525662428","5","提摩西小队","10000","16","","求求你别惦记你那开放世界了，别搞开放世界，求求了"
"青空のくちなし","保密","山东","569581598","5","崩坏3・天穹流星","10000","13","22","草莓小哥直播乳鸦，望周知[保佑]@蹦蹦草莓 [脱单doge]"
"第四十五号勇者","保密","四川","11787639","6","","10000","12","","为了那句“welcome”再看一遍"
"非洲第一舰长","保密","安徽","1636397465","4","","10000","12","","对符厨好点 让华活下去吧[大哭]"
"V~","女","广东","1335140353","5","","10000","12","","凯文老祖 你不会对你的战友下死手对吧[大哭]"
"辞于镜兮","保密","湖北","367234092","5","","10000","12","","UT6QG87P88N3,KFCFKXQ4VIVO50,需者自取[doge]"
"Moxser","保密","上海","385361203","5","","10000","14","","我觉得这个角色设定的就是破第四面墙的呀，链接了舰长和角色，并没有很唐突啊"
"鸡莫","保密","安徽","37727210","6","","10000","20","","你编剧自己看看自己写的让不让角色厨好过，尊不尊重角色，继续塞美好能量又能顶多大用处了，无语[藏狐]"
"SegmentTree_线段树","保密","辽宁","387283358","6","","10000","11","7","这个welcome真的太绝了"
"贪吃的芙芙","男","新疆","454528226","6","hanser","10000","13","9","虽然但是，山吹在现在确实不过如此[脱单doge]"
"奇怪的比安卡丶","保密","陕西","33440587","6","","10000","10","","这个welcome真是太带感了"
"丽塔的爱宠","女","河北","437460298","5","星座系列：水瓶座","10000","10","","乐土商店能不能加点东西，七八千币没地方用[呆]"
"海上生明月com","男","江苏","37710219","5","","10000","10","","只要华不开崩落，局势就说明还有得救[再见]"
"曾经谭海难为水灬","女","安徽","57481013","6","","10000","10","","大伙别慌，符华大概率不会死的，但我更担心的是识宝，编剧不太会动符华但大概率会让识宝替符华干些蠢事[辣眼睛]"
"翎花散尽","保密","江西","1464506137","5","","10000","10","","阿华老婆，你一定要好好的啊[大哭][大哭][大哭]"
"德古马都・绝帝","男","北京","7040157","6","大王不高兴","10000","15","",".(⌒濉 ⌒濉), /（） （）\,｜ /  v /) \,/ \ \ __/ ( / ∩ )丶,/ v＿屺u ノu ｜,L＿＿ ＿＿＿/ ＿＿|,理 之 律 者 不 过 如 此,[崩坏3_生气]"
"美喵仙阿","女","辽宁","6659066","6","","10000","9","","渡鸦：失败总是贯穿人生的始终 这就是人生吧"
"Z言言言言","男","安徽","392611224","5","","10000","9","","爱酱快说，你是不是偷电了"
"9230n","保密","中国香港","1781763094","5","","10000","13","","K 能不能不要每次都吃T 每次都要o新角色|_石 真的UЫ巧塑造的 之前把理律嗄苊枋龅亩害 F在子]了嗄艹园T 有嗄苷映园T"
"莳舟过深海","保密","重庆","448012998","5","","10000","8","","你他妈不给符华一个好结局，我天天诅咒你[微笑][微笑]"
"apoplectic_man","保密","福建","435629186","5","","10000","8","","不管怎么样，coma你敢搞阿华我跟你没完"
"琪亚娜是我老婆啊","保密","山东","77342649","5","","10000","8","","凯文新形态什么时候出？[脱单doge]"
"路过の某人君","保密","天津","81682896","6","原神","10000","12","10","乳鸭是吧[傲娇]乳鸭是吧[傲娇]乳鸭是吧[傲娇]乳鸭是吧[傲娇]乳鸭是吧[傲娇]乳鸭是吧[傲娇]乳鸭是吧[傲娇]乳鸭是吧[傲娇]"
"选择的真相","男","广东","21198437","6","","10000","10","","能别在这浪费符华的时间了吗。[藏狐]"
"手撕冠位的咕哒子","女","内蒙古","198597671","5","言和7th生日纪念","10000","29","","有一说一，你一个厨力向游戏，愣是让一个角色反反复复给另一个角色垫，真的不觉得离谱吗？[辣眼睛],我可以接受华战败，甚至可以接受她屡败屡战，但我不能接受她为了垫别的角色而屡战屡败[无语]"
"ccE雨","男","河南","212616138","6","","10000","7","","上一个这样对符华的，我们已经对他开香槟了[脱单doge]"
"凌云志数学","男","陕西","638057887","5","","10000","7","","这绝对是崩坏三最离谱的一个PV。这特效，这配乐，太强了。"
"磁爆步兵54","男","浙江","3443416","6","","10000","7","","爱酱，你也不想让德丽莎知道你偷了这么多电吧？[阴险]"
"牧月-忍冬","男","云南","111202477","6","崩坏3・天穹流星","10000","7","12","骇兔舰桥语音:想和休伯利安的人工智能约会？放弃吧你们不可能的 （爷是不是喜欢块头大的女孩[滑稽] 刘易斯姐姐？[喜欢]）"
"有良--","女","安徽","31940373","6","","10000","6","","没事就打开反复循环那句welcome"
"一生单推樱斩小姐","女","河北","297352943","5","","10000","6","","我会为世界上所有的美好而战！决战的时刻到了！伺机而动嘿嘿+喝喝羽箭锋回+12sp砰+3sp砰+3sp砰+3sp羽箭锋回+12sp砰+3sp砰+3sp砰+3sp羽箭锋回+12sp砰+3sp砰+3sp砰+3sp羽箭锋回+12sp砰+3sp砰+3sp砰+3sp羽箭锋回+12sp砰+3sp砰+3sp砰+3sp, 羽箭锋回+12sp砰+3sp砰+3sp砰+3sp羽箭锋回+12sp砰+3sp砰+3sp砰+3sp羽箭锋回+12sp砰+3sp砰+3sp砰+3sp羽箭锋回+12sp砰+3sp砰+3sp砰+3sp羽箭锋回+12sp砰+3sp砰+3sp砰+3sp♀可恶！我来为你♀送上解脱离上离下炎上之光喝啊！决战的时刻到了！嘿♀♀哈！轰！嘿♀♀♀嘿♀哈♀呀♀♀以此烈火斩无不断"
"キズナアイ","保密","北京","2192799","6","","10000","6","9","内容质量对不起PV音乐和剪辑"
"_加藤惠__","男","山东","237219295","5","","10000","6","","我要看华崩落!"
"趑|-r崎狂三","女","广东","37618251","6","约战・狂三","10000","8","","凯文有阿波利亚的戒律，识律的能力对凯文效果不大，现在这个所谓的太虚剑气就是当初梅博士用阿波利亚的戒律改的弱化版，符华也不能完美的控制，华实力在十三英杰里能不能进前五都是未知的，律者在英杰面前都是被拿捏的货，不要说现在这个时代律者更弱了，符华真的没有什么实力和凯文打，更不要说逼凯文，如果编剧来个爱的力量当我没有说……"
"履刑者9527","男","安徽","429917259","5","","10000","6","","XT6RYQ6P997P"
"江道江道离","男","辽宁","76731735","6","汉化日记","10000","6","6","hoyomix稳定发挥"
"至冬国悍妇","保密","四川","122431280","5","","10000","6","2","这次的终章只打了主线，支线是一个也懒的摸，宝箱也是懒得找了，到了现在甚至懒得上线了。[无语]"
"哈哈来不来","男","江苏","385362624","6","","10000","6","","羽兔：理之律者不过如此,彗星驱动：6"
"洛天依LUO","保密","广东","1668516149","5","","10000","6","","Hanser阿姨，不过如此[热词系列_不孤鸟]"
"bili_527328192","保密","新疆","527328192","5","崩坏3・天穹流星","10000","6","","下版本高达鸭:羽兔也不过如此[doge]"
"姬子阿姐丶","女","广西","10197441","6","原神","10000","6","","可想而知渡鸦作为新时代的辅助结果机制却烂到不行设计师是怎么想出来的，看看这个爱衣，虽然不好看吧却有一种强度的美，令人感慨"
"Wu糖可乐正常冰","男","广东","136071023","6","崩坏3・天穹流星","10000","6","6","直播的时候谁说的黑暗体操，艹，出来！"
"我觉得我可以打十个","男","广东","88077820","5","崩坏3・天穹流星","10000","6","11","官方乳鸦，笑死我了[大笑],受不了网络暴力.jpg"
"何以致朝暮","保密","山东","220298575","5","良辰美景・不问天","10000","8","6","“渡鸦前辈，100大还是175大？”,爱衣如此问道,“…175”渡鸦回答到：,“不对”,“100？”渡鸦声音有些急促。,“也不对，于我之前100大，从我之后175大！天不生我爱酱，火队万古如长夜！sp来”,渡鸦：“你有病吧”"
"你是否还好呢","男","山东","39681704","6","","10000","8","","UT6QG87P88N3 "
"Evol5tionz","保密","吉林","171394036","5","","10000","5","","电音人听得出来，Hoyo-Mix这家伙又进化了[藏狐]"
"接受批评_整装前行","男","山东","32854186","6","","10000","5","6","你执意要刀符华那请让她善终吧，走之前留下个新装甲就好[难过],不过我跟编剧从此势不两立[生气]"
"代吃代睡5r一次","男","辽宁","488537047","5","","10000","5","","等你羽兔出来必须拿理律打你个无伤"
"何以致朝暮","保密","山东","220298575","5","良辰美景・不问天","10000","5","6","我爱酱，站在深渊门前，向所有的人立誓，将为火队的sp而战，证明100小于175。重铸火队荣光，爱衣义不容辞―爱门"
"悠悠荡荡jjgwh","保密","福建","434818842","5","碧蓝航线","10000","5","","1304157992ER"
