"昵称","性别","IP","UID","等级","装扮","用户权重","获赞数","粉丝团等级","评论"
"Mislana","保密","广东","422331398","5","","10000","1","","本人ID:146500126，请大家速速和鄙人互留言板留个脚印，并来逼人的宿舍串个门点个赞，？不互？不互都看不起你们[~るる_嚣张][~るる_嚣张][~るる_嚣张][~るる_嚣张]（老样子不忘初心的给此视频点赞收藏）"
"炎の极","保密","山东","100908525","5","2233十一周年纪念","10000","1","","UT6QG87P88N3"
"逸凌s","保密","安徽","98102099","6","良辰美景・不问天","10000","1","","为爱酱的诞生，献上渡鸦礼炮！"
"姬-你-太-美","保密","四川","259467658","4","","10000","1","","UT6QG87P88N3"
"没错我就是榴莲","男","广西","283860612","5","","10000","1","","那个圣痕自选箱是活动圣痕?看起来好像不是爱酱的"
"自由_之枫","男","山东","57030684","5","良辰美景・不问天","10000","1","","对不起，我满脑子都是t人的声音[崩坏3・光辉矢愿_惊]"
"宅晨苟","保密","广东","20911544","6","","10000","1","","笑死，符华又倒下了"
"四川中路的maple","女","上海","52692683","6","","10000","1","3","有没有回归玩家，互填邀请码？有没有回归玩家，互填邀请码？有没有回归玩家，互填邀请码？有没有回归玩家，互填邀请码？有没有回归玩家，互填邀请码？"
"咸鱼の猫粮","保密","海南","349272979","5","","10000","1","","哇塞音乐好酷[点赞][点赞][点赞]"
"依旧飒然","保密","湖北","259142723","5","初音未来13周年","10000","1","","鸭鸭！ 不要做无畏的挣扎你已经被我看中马上放下羞涩与我结婚！！不要做无畏的挣扎你已经被我看中马上放下羞涩与我结婚！！不要做无畏的挣扎接触你前 我是个自卑腼腆的人 连和人说句话都不敢 感谢你 让我变得开朗自信 我现在已经狂的不是人了！嗨！我的老婆！"
"墨青锋青锋青锋青锋","男","内蒙古","189097524","6","良辰美景・不问天","10000","1","9","上仙不寄就满足了"
"玉山白雪飘铃","男","内蒙古","275132629","5","","10000","1","","这背景音乐太带感了"
"柠檬鲸Lemon","保密","上海","11888624","6","","10000","1","","错，这个曲子他们到底还能变奏多少次"
"东山野望","保密","福建","106383530","6","","10000","1","","荔枝律者 不过乳此[脱单doge]"
"当麻肩膀上的奥帝努斯","保密","四川","400886301","5","","10000","1","","鸭鸭单开，鸭之后多半芽虫双出，池子已经麻木了，看鸭搓不搓我xp，我还要抽v2v呢[吃瓜]"
"套汉子の马","保密","湖北","402345596","5","","10000","1","","我的小识要好好的啊[大哭][大哭][大哭]"
"7845129","保密","云南","22291355","5","真白花音冬日绮梦头像框","10000","1","","为什么我感觉爱衣丢刀像是德莱文接斧子"
"爱吃-牛角包","男","吉林","227728803","6","","10000","1","","全篇下来就记住一句话“理之律者，不过如此”[笑哭]"
"椰羊yee","保密","江苏","674674893","5","","10000","1","","这个声线给人的感觉就是一会儿丽塔一会儿绫华又一会儿回到爱酱或变成香菱[妙啊]"
"刻刻柏","保密","广东","344438701","6","","10000","1","3","welcome！"
"Rdogs吉尔","男","福建","349800480","6","明日方舟音律系列","10000","1","","为什么我昨天梦到结局是凯文与虫一起被关在月球上大眼瞪小眼。。。"
"人途无途己途","保密","河南","13063680","6","原神","10000","1","10","贝拉：摇滚时间到！为反抗高歌！"
"卖盒饭的小哥","保密","四川","23477278","6","","10000","1","","帕朵:那就证明我是第一队伍,伊甸:因为我是雷队,识宝:说，我会守住物伤的一切,爱酱:重铸火队荣光，吾辈义不容辞,渡鸦:攒够100能量就算成功"
"德尔王","男","湖北","13252595","6","","10000","1","","XT6RYQ6P997P"
"浮生篱夕","男","广东","389549301","4","","10000","1","","UT6QG87P88N3"
"小树大","男","广东","229098758","6","","10000","1","","这个版本的祖传小曲格外好听啊[吃瓜]"
"草本植物kana-","保密","浙江","18494195","6","汉化日记","10000","1","","给鸭鸭一个成长的机会，剧情给我他妈长长长长长，别让我说出理之律者不过如此!"
"战忽局萌新员工","保密","黑龙江","691445791","5","","10000","1","","上仙：累了，小识你搓片羽渡尘，我再寄一回，到点了叫我[原神_哼]"
"45板","保密","河北","61401762","5","","10000","1","","111111111大哥雷律真送吗[脱单doge]"
"猎枭丶","保密","山西","455076312","5","","10000","1","10","BV1Td4y1w73y[脱单doge]pv纯音乐来了"
"罗浮神策将军景元","男","河南","169354162","6","崩坏：星穹铁道","10000","1","6","所以说这羽兔的cv就直接是岳母不装了啊，我就知道米忽悠怎么可能放过这个机会"
"o_oA_AV_V","保密","河北","1111430505","5","","10000","1","","菜门[脱单doge]"
"逍遥_剑侠","保密","山东","11728003","6","汉化日记","10000","1","","鸭鸭又要吃瘪了，好诶[给心心][给心心][给心心]"
"希小姐的玩具箱","保密","河北","4337483","6","","10000","1","9","现在只有鸭鸭没有觉醒了，看PV希儿也不在，难道是希儿没了鸭鸭觉醒吗"
"粗茶浅饮","保密","江苏","449495184","5","","10000","1","","爱衣像《崩坏3rd琪亚娜》里的爱酱战斗形态啊[热词系列_知识增加]"
"Coky陈畅然","保密","重庆","529206467","5","","10000","1","","hoyo mix nb"
"咕咕爱吃阮饭","男","山西","499849877","5","异常生物","10000","1","9","hoyo-mix稳定发力"
"星渊游士","男","河北","243842102","6","异常生物","10000","1","","其实看起来这个pv，符华也没咋着，意料之中，同时那个样子，看不出来啥也有可能是单纯力竭"
"咕咕爱吃阮饭","男","山西","499849877","5","异常生物","10000","1","9","晚上有事，前来考古[tv_doge]"
"中二病也要当up主","男","河北","86818871","6","","10000","1","","我永远喜欢崩坏三"
"园神的乌托邦","保密","上海","42880066","5","","10000","1","","渡鸦居然比云墨寄的更快....[脱单doge][滑稽]"
"希海璃殇Seeaki","保密","俄罗斯","475795833","5","琉绮Ruki","10000","1","","羽兔：理之律者，不过如此,山吹：？你等我抄起伊甸之星就是一炮"
"J一","男","上海","36317872","5","","10000","1","","渡鸦，100sp… 哇是衣服[妙啊]"
"白色-夜空","保密","福建","403944648","5","星座系列：双子座","10000","1","","开头爱衣演示那段音乐叫什么，好喜欢啊"
"希海璃殇Seeaki","保密","俄罗斯","475795833","5","琉绮Ruki","10000","1","","《100sp》是由渡鸦自主研发的一款全新攒sp游戏。故事发生在「崩坏3深渊与战场」的世界，在这里你被将被授予「数二数三的火辅」的头衔，引导火辅之力。在你攒sp时邂逅火伤坦克的麻痹与炮火，和地板一起相互摩擦，寻找失落的sp，同时，寻找「100>175」的真相。"
"悦_ovo","保密","辽宁","1766693681","5","崩坏：星穹铁道","10000","1","","渡鸦寿衣准备好了[脱单doge]"
"赭石timing","保密","江苏","365968536","5","","10000","1","","邀请码511931951EU[脱单doge]"
"孤鸿绯樱","保密","河北","424652831","5","","10000","1","","我有一件事,音乐[打call][脱单doge]"
"Moziku","男","云南","1700509","6","","10000","1","","这包菜不会是爷船上跑出去的那个吧[脱单doge]"
"爱莉希雅-Alicia","保密","山东","1647740262","4","","10000","1","","不懂就问，舰长们，6.2啥时候更新啊，6.1没活动太无聊了"
"李嘉图呆死","男","重庆","293461971","6","星座系列：双鱼座","10000","1","8","直播录像呢，快发！,[脱单doge]"
"旅行者丶宵宫","保密","安徽","1908411097","3","","10000","1","","！！"
"-阳冬-","保密","湖南","1584580761","4","","10000","1","","各位，周年庆马上到了，水晶规划好了吗[脱单doge]"
"指尖-绝影","保密","四川","547924460","5","崩坏：星穹铁道","10000","1","","角色卡是什么意思啊"
"阿七丶Qi","男","浙江","11407286","6","星座系列：白羊座","10000","1","10","鸭：6"
"未被神明注视着的人","保密","山东","433358971","5","","10000","1","","6.2啥时候更新呀[doge]"
"洗衣机kid","保密","河北","1077656749","5","","10000","1","","不管怎么说，爱衣圣痕必抽好吧[doge]"
"浓香茶","男","北京","381864837","5","","10000","1","","音乐和祖传小调好听好听[星星眼][星星眼]"
"Yolo凉子","保密","河南","354775257","5","","10000","1","5","崩三要凉了[doge]"
"神威CLANNAD","男","广东","11940054","6","国民老公带回家","10000","1","","哎呀妈呀[笑哭]"
"盐松鼠糖","男","河北","607497284","5","","10000","1","","家人们没敢看pv，来个看过的家人跟我说声pv里面有明示或者暗示凯文会死吗？[保卫萝卜_哭哭][保卫萝卜_哭哭][保卫萝卜_哭哭]"
"为美好世界献上希望","男","河北","34692317","6","","10000","1","9","第一第二偶像都自机上舰了，第三偶像能不能自觉一些[崩坏3_疑问]"
"羊羊得依","保密","四川","406913692","5","","10000","1","","理之律者，不过如此"
"游手好闲浪大人","男","重庆","104564757","6","碧蓝之海","10000","1","","KELCOME!~"
"向娜塔莎小姐道歉","男","天津","287760885","5","hanser","10000","1","","最速领挂，最速吃瘪，不胜传说鸭鸭是吧[崩坏3_？]"
"颜值主播玖月","保密","辽宁","1841788118","4","","10000","1","","534110864LE大佬们帮帮忙"
"老夫中二少年","保密","河南","1829995112","4","","10000","1","","圣痕挺有意思，但是你这角色建模。。。[热]"
"nm浅笑","保密","上海","33588584","6","","10000","1","","鸭鸭和渡鸦：我们受不了网暴[热][热]"
"临_","男","广东","542017044","5","原神","10000","1","","感谢米哈游的馈赠，兑换码的水晶出了安息鸢尾[藏狐]"
"星与你消散","保密","河北","478911158","4","","10000","1","","这是……呼啦圈？"
"鲨勒霓w","男","云南","56137324","6","斯莱特林","10000","1","","来了，已经开始期待明年的演唱会了，明年演唱会我一定要听到这BGM[脱单doge][脱单doge][脱单doge]"
"暗Lo","保密","四川","4908169","6","","10000","1","","这不就琪亚娜吗"
"酷酷滴小猫","男","四川","78158865","6","","10000","1","","虽然包菜可能很强，但是没渡鸦皮瑟"
"片山晋吴","保密","浙江","179657332","5","","10000","1","7","希儿在新亚特拉帮小空做委托（[崩坏3・光辉矢愿_安详]"
"星魂之愿","保密","湖南","495856631","5","碧蓝航线","10000","1","9","ut6qg87p88n3"
"_猫眼螺_","男","广东","185659040","6","2233十一周年纪念","10000","1","","羽兔这脸和申鹤好像G"
"柠柠C","男","江苏","97232317","6","","10000","1","","这个PV好帅啊！[蛆音娘_吃惊]"
"小光焰","女","四川","325323162","6","还有醒着的么","10000","1","","渡鸦，你放心，你因为新衣服会暂时成为我的看板娘，当然也只是“暂时”[doge]"
"家暴只用刀砍","男","湖南","438564173","5","","10000","1","","下个版本毫无玩点"
"诺依无言","女","湖北","352454695","5","","10000","1","","对于永恒轮回的不沉之船而言，所谓崭新的开始，拥有两种完全相反的含义。在终焉所封禁的无尽时间里，这类抗争已然上演了无数次，并且，最后一次，也即将拉开帷幕。我希望，她们得以触及那唯一的可能，留下属于自己的故事。我曾经梦到过那样的未来。,爱衣【休伯利安∧】，出击！"
"冷雨weather","保密","山东","351313760","5","","10000","1","","求德丽莎新角色"
"千本の刃奏でる","男","上海","1452854327","5","","10000","1","","这波啊，这波就叫作崩坏三第一偶像争夺战，一年前你夺走的，如今我大包菜全都抢回来了！！！[歪嘴][歪嘴][歪嘴]"
"隔壁大老宅","保密","山东","13648189","6","","10000","1","","崩3我最最最喜欢的角色 就是岳母了,可他米哈游就是不出啊（恼）,但是 拿羽兔凑合一下 也不是不行,谁让咱有“建安风骨”呢,[doge][doge][doge]"
"女王敲可爱","保密","北京","399128577","5","崩坏3・天穹流星","10000","1","7","理之律者，不过如此[给心心]"
"空之律者-律化娜","保密","湖北","183787390","6","原神","10000","1","","AI门[保佑]"
"爱莉小姐的狗勾","保密","江苏","12716402","6","","10000","1","","最后都要辱鸭[崩坏3・光辉矢愿_瞄准][崩坏3・光辉矢愿_编剧]"
"柑橘味彼方","男","江苏","4607843","6","","10000","1","3","这边吉祥物实装女武神了，隔壁派蒙什么时候实装啊[tv_流泪][tv_流泪]"
"名字太粗太大了O_o","保密","河南","47148756","5","2021拜年纪","10000","1","","这建模不说了，开大那脖子那感觉真奇怪[热]"
"天命前任主教奥托","男","陕西","226267376","6","","10000","1","","礼貌鸭鸭:你吗？[崩坏3_红包]"
"忘卿ya","女","广东","27790926","4","","10000","1","","UT6QG87P88N3,KFCFKXQ4VIVO50,需者自取[doge]"
"月下-弦","男","广东","389556825","5","","10000","1","10","乳芽，乳鸭，乳鸦，yaya受不了[崩坏3_X]"
"诗叙往生","男","湖北","353824785","5","","10000","1","","“理之律者，不过如此”[doge]"
"0醉梦仙霖0","男","广东","25241654","6","","10000","1","","警惕官方乳鸦，渡鸦疯狂打滚[doge]"
"鸡哥-Official","男","河南","384112820","5","","10000","1","11","鸭鸭又被辱了[大哭]"
"红枫溪-","女","广东","193272296","5","","10000","1","","理之律者不过如此[脱单doge][脱单doge][脱单doge]"
"里见Y","男","辽宁","456838247","5","崩坏3・天穹流星","10000","1","10","如果下版本是板鸭主场，然后新主线最后给板鸭出新装甲，那会有动画短片吗？[崩坏3・光辉矢愿_吃西瓜冰]"
"随风摇晃","女","广东","88090944","6","","10000","1","10","帅"
"列车第一偶像三月七","男","陕西","505873726","5","","10000","1","","羽兔好美[打call]"
"真男人卫宫士郎2号","保密","河北","2032501282","5","","10000","1","5","来了[星星眼][星星眼]"
"崩坏神奥托","保密","广东","1648772547","5","","10000","1","12","想问一下崩坏星穹铁道什么时候出？[脱单doge]"
"恍如昨日初逢","保密","辽宁","31638505","6","战双帕弥什","10000","1","","鸭鸭怎么又吃瘪了"
"stone1s","保密","湖南","243797400","5","原神","10000","1","","拜托，这个理律超逊的啦[doge]"
"周公不解梦meng","男","吉林","511142466","5","","10000","1","","[来古-注意]"
"空之律者-律化娜","保密","湖北","183787390","6","原神","10000","1","","AI门"
"自砸招牌的战地记者","女","天津","494909474","5","","10000","1","9","偷电狂魔爱酱"
"逆熵AI","保密","浙江","6365772","6","#EveOneCat","10000","1","8","我要扫条形码"
"蝶舞丶幻梦","男","湖北","21051212","6","崩坏3・天穹流星","10000","1","11","是不是该把名字改回去了啊，偷电狂魔爱酱"
"里见Y","男","辽宁","456838247","5","崩坏3・天穹流星","10000","1","10","官方乳鸦[崩坏3・光辉矢愿_小喇叭]"
"崩坏神奥托","保密","广东","1648772547","5","","10000","1","12","UT6QG87P88N3"
"是萌光吖iiii","保密","江西","424191978","5","泠鸢yousa登门喜鹊","10000","1","","前瞻兑换码[OK]UT6QG87P88N3"
"爱莉希雅_OFFICAL","保密","湖北","421377810","5","崩坏3・天穹流星","10000","1","8","爱酱的建模真的不改改吗？真心怪[热][热]"
"空之律者-律化娜","保密","湖北","183787390","6","原神","10000","1","","渡鸦:怎么会逝呢？,当初说渡鸦打滚是因为小岛爆爆鸦的梗，因为小岛被炸气到打滚,现在说渡鸦打滚……[脱单doge],“可恶！”"
"下北泽の大天使_","男","山东","471958600","5","","10000","1","","ut6qg87p88n3"
"一无是处的废柴大叔","保密","广东","1872434652","5","","10000","1","","省流：没有活谁给你氪金[吃瓜]"
"颜知Yanz","男","黑龙江","343938927","6","还有醒着的么","10000","1","","羽兔――浮梦若薇,？？？[仓鼠_阿巴]"
"红短裤的小男孩","保密","江西","269777839","5","","10000","1","","在？八重樱和卡莲还有新装甲吗？"
"逍遥鸟雨","男","广东","388957","6","普通小狗・梦幻塔罗","10000","1","","文物：千劫的剑"
"关于我没想名字这件事","保密","河南","1660840694","4","","10000","1","","UT6QG87P88N3"
"起名太难了啊哈","保密","四川","484806612","5","#EveOneCat","10000","1","","bgm真的爽"
"归零_Zeroing","男","黑龙江","507186018","5","","10000","1","","我先来...,忘复制了看别人的吧[doge]"
"星野爱あい","保密","河北","1180738145","5","美月もも","10000","1","","羽兔新主人"
"良洛zzz","男","河南","25633176","6","","10000","1","","还跟啊尬聊哪[笑哭]"
"A澄の","保密","广东","610749220","5","公主连结可可萝","10000","1","","让我们猜猜爱酱来了后，谁被踢出火队[doge]"
"X-STATION","保密","广东","396025514","5","","10000","1","","BGM又鲨疯了[喜欢]！！！"
"02Sumire","保密","上海","23371014","6","崩坏3・天穹流星","10000","1","11","[崩坏3・光辉矢愿_彩虹水枪][崩坏3・光辉矢愿_比心][崩坏3・光辉矢愿_遨游]"
"A澄の","保密","广东","610749220","5","公主连结可可萝","10000","1","","不懂就问，这是侵蚀律又降临了吗[热词系列_知识增加]"
"挽狂庇诩鹊","保密","云南","474713921","5","碧蓝之海","10000","1","11","理之律者不过如此[doge]"
"磁爆步兵54","男","浙江","3443416","6","","10000","1","","爱酱，你也不想让德丽莎知道你偷了这么多电吧？[阴险],所以你要怎么偿还呢？[阴险]"
"疯狂偷吃铝热","保密","广西","360723583","5","","10000","1","","6.2，渡鸦:恐怖片"
"取名好难-1","保密","安徽","175995074","4","","10000","1","","[打call]"
"刺客是真滴辣鸡","男","广东","2003040","6","","10000","1","","渡鸦的谢幕皮肤"
"LXZhao","男","广东","3969836","6","","10000","1","11","UT6QG87P88N3"
"赛希琳","保密","北京","1446349241","3","","10000","1","","我趣，要发刀了，最后一次，我突然有不好的预感[辣眼睛]"
"乌拉尔银狼--","男","湖北","175811830","6","","10000","1","","又在辱鸭呜呜呜呜"
"要乐奈Rana","保密","山东","437205946","5","呜米","10000","1","","酱门[三星堆]"
"像是繁星-暗淡了的","保密","广东","164147490","5","良辰美景・不问天","10000","1","","UT6QG87P88N3"
"kaglen","男","上海","494421066","5","崩坏3・天穹流星","10000","1","","来力[崩坏3・光辉矢愿_回眸]"
"疯狂偷吃铝热","保密","广西","360723583","5","","10000","1","","UT6QG87P88N3"
"]]]初号机","男","江苏","283980631","6","","10000","1","10","[doge]"
"赫高","男","新疆","1218920682","5","","10000","1","","UT6QG87P88N3"
"洛洛sama丶","保密","上海","1867389575","5","","10000","1","","我先来,干翻（），（）永存[打call]"
"看书就是一种幸福","保密","重庆","373575076","5","","10000","2","","是我地错觉吗！感觉下巴是不是有点尖了。"
"熙小棠","男","巴拿马","86185184","6","","10000","2","","这pv的配音和音乐真8错，虽然游戏不玩，但是pv每期都看"
"\い","女","山西","483142433","5","","10000","2","","有没有可能，上仙是已经与识律合体并且开了人为崩落才让劫灭断了。布洛妮娅是已经被羽兔从律者形态打回了山吹形态，然后羽兔才说，理律不过如此[doge][doge]"
"惘","保密","安徽","384562161","5","","10000","2","","神州平板又凉了"
"柚子德里奇","男","上海","448464","6","citrus","10000","1","","那一年的决赛是冰队对阵火队，最终比分175:100。当时我看见渡鸦躺地打滚泣不成声，这个画面我永生难忘。那一刻我在想，如果我能成为一名女武神，我一定要赢下所有。如今深渊战场就在眼前，我必须考虑这会不会是我此生仅有的机会。我相信元素队能有过去的霸主地位，云墨功不可没。重铸火队荣光，爱衣义不容辞！"
"蕊馨明","保密","上海","248347554","6","","10000","3","","放弃了，不干了，符华死了就退坑，要不是符华谁受你这个策划的气。[微笑]"
"66侠到此一游","保密","福建","1619078751","3","","10000","1","","好喜欢那句welcome[微笑]"
"枫羽穗玉","女","河南","545241825","5","2233幻星集","10000","1","","@是沐子秋"
"问题儿童香油怪","男","四川","255268406","6","","10000","1","","这小曲味道太冲了"
"我爱貔貅爱我","保密","广东","1185304905","5","","10000","1","","可怜我琪亚娜最后还是要走上终焉的道路[委屈][委屈]"
"曦缘墨晨","保密","河南","444617309","5","","10000","1","","官方准备什么时候把它分在游戏宣传PV那一栏里？还是有什么深意吗？"
"秋yal","保密","福建","310281155","5","","10000","7","","这玩意真的要上舰了吗？真想把这头发给掀了，这制作组的审美也是够zz的，这东西能上舰简直掉价，崩三最丑的一个"
"一般路过学院","保密","广东","93558102","6","","10000","4","","咱别老拿老角色垫行吗，，，我玩这游戏就是为了能看到她有个好结局，我也真的很希望她能幸福"
"百香果茉莉花茶","男","北京","5484056","6","嘉然今天吃什么","10000","4","","这应该是出新角色视频热度最低的一次了吧，个人感觉大爱酱太别扭了，丑到不丑，但这四肢和头组合起来有种不协调感"
"天外大仓鼠","男","黑龙江","20609642","6","","10000","10","","这一天，爱莉抢走了所有游戏的流量[doge]"
"诸葛波波兔","男","辽宁","51582923","6","2020拜年祭（鼠）","10000","2","","不过如此？你辣么流弊去跟杨打吧"
"找个病友发病","男","湖北","440739063","5","碧蓝航线","10000","2","","给华出个新装甲吧，出个崩落也行啊，一直剧情垫板游戏辅助，出个主c给凯文打一场至少风光一点啊，好歹也是爱莉之前人气挺高的一个角色，别整得这么不光彩啊，她就不配有新装甲和主角团站在一起吗？[笑哭][大哭][无语][doge]"
"奥是的呢","男","辽宁","1143667376","4","精灵王","10000","3","8","作为路人说一句哈，蔡徐坤真的挺无辜的，三观很正，玩游戏不屑作弊，靠自己的实力取胜。有自己的作品，歌唱的好，舞蹈也很不错。有些ikun确实做得不对，但那丝行为请勿上升到偶像。不是他的错。蔡徐坤挺好一男孩，是好多少女的梦，玩梗没错，但不要不停的玩梗，四年了，你们也累了吧。我代表不理智ikun向各位道歉，不要黑蔡徐坤了。,(一条五元，截图发过来支付宝保证到账记得删括号)"
"苦练两年半篮球_","男","四川","592147225","5","","10000","2","","现在pv都只有四十多万播放量了吗，感觉崩崩快要凉了[][灵魂出窍]"
"修仙者无畏","男","广东","8366769","5","","10000","1","","bgm是什么，求！"
"蘑菇673195661","女","广东","111845628","6","","10000","1","","你看这动作好看吗"
"风向苍松","男","河北","649746430","5","","10000","1","","你说的对，但是《100sp》是由渡鸦自主研发的一款全新攒sp游戏。故事发生在「崩坏3深渊与战场」的世界，在这里你被将被授予「数二数三的火辅」的头衔，引导火辅之力。在你攒sp时邂逅火伤坦克的麻痹与炮火，和地板一起相互摩擦，寻找失落的sp，同时，寻找「100>175」的真相。"
"爱们66","男","湖南","1529994042","5","","10000","1","9","剧情能不能越来越甜[崩坏3・光辉矢愿_回眸][崩坏3・光辉矢愿_回眸]"
"青冰银雪","保密","内蒙古","698456736","5","魔法学院","10000","1","","这次PV又凉了"
"木木木木木脑袋","男","安徽","35023876","6","","10000","1","","上仙又跪了[大哭]"
"Camille阿富汗猎犬","保密","北京","502192106","5","茶啊二中","10000","1","","五分钟！！"
"麟鸢糖","保密","辽宁","34926296","6","崩坏：星穹铁道","10000","2","","屡战屡败，败一次出一个新角色，6"
"__星与你消失之日_-","保密","河南","1984801881","4","","10000","1","","白嫖雷律哈哈哈哈哈哈哈哈哈，我来了！[脱单doge]"
"德丽莎世界超级可爱","男","山西","298389503","5","原神","10000","1","","建议官方把主角团从御三家改成前文明那几个"
"王二少0524","保密","河南","322377639","6","BML2020暗黑版","10000","1","","所以，米哈游是不是把舰长忘了？"
"长夜梦蝶","保密","安徽","372031038","5","明日方舟音律系列","10000","2","","所以说德丽莎呢？我的德丽莎在哪呢？[崩坏3_谈话]"
"夜孤知冷逸","男","安徽","105255599","5","","10000","1","","就只是看看崩坏三pv的热度，呵呵。"
"空调散热板-","保密","江苏","590000473","5","","10000","3","","你真行，你真行。雷律刚出来的时候真TM的个逼的是t0。白送 可以，真可以。你真牛逼 你是真牛逼"
"若得青叶飞","保密","贵州","16827643","6","2021拜年纪","10000","2","3","[哦呼]能不能让凯文一刀弄死主角团？劳资好弃坑,无聊透顶！甜蜜的主线动不动就断章"
