"昵称","性别","IP","UID","等级","装扮","用户权重","获赞数","粉丝团等级","评论"
"向美好的每一天至敬","保密","无IP","401481965","5","","10000","3","","我们建起了塔让女武神住在了塔顶，ch则把女武神赶到了下面的羊圈里。当我们开始拆塔的时候ch不为所动甚至加据予盾，拆的时路人，圈外人，吃瓜的边看戏边嘲笑我们。塔倒了ch遍体鳞伤的ch哭着求我们回去，我们一人一口痰淹死了它。塔倒时那些看戏嘲笑我们的来帮我们一起推，当中有碧蓝玩家，少前玩家，焊接玩家，战双玩家以及我们曾经嘲笑过的解神者玩家……"
"两滩沈梦蜥","保密","无IP","382662785","5","中野二乃","10000","3","","女武神在北欧神话里不本来就是用身体奖励杰出的勇士吗？这不就奖励外服舰长了吗？米哈游你太厉害了"
"Designdarkness","保密","无IP","293588305","6","","10000","3","","兔女郎服在西方文化圈是有很深的暗示色彩，除了性以外，还有地位低，比中国的洗头小妹都低，因为她们是免费的，还有一些他们才懂得梗，这些都是国内的人都不清楚的。利用这些信息差塑造出来的优越感刺激非常大，再加上这两年本国对他们产生的焦虑需要发泄。这季度赚的会是非常美丽数字。而且这也算是一种投名状，表现自己态度非常低下。（复制一位老哥的）,几年下来氪了小几万了，知道吗现实这个价格你可以玩到不少真的兔女郎，而我用这钱在游戏里给外国人养了兔女郎。所谓神州仙人，在人家眼里一样是个卖肉的兔女郎罢了。你心中的女神，在洋人的眼里，就是只鸡罢了。这种跳脸级别的侮辱，可能那些觉得能接受的玩家是我国最后一批太监吧？（复制的）"
"渣渣辉ge","男","无IP","28010563","6","","10000","3","","《关于你的崩坏3老婆在舰长年前扮兔女郎赚钱还债这件事》"
"末日纯爱战士","保密","无IP","28826297","6","","10000","3","","《关于你的崩坏3老婆在舰长年前扮兔女郎赚钱还债这件事》"
"寄梦浮华","保密","无IP","354584403","5","出游季","10000","3","","外服活动可真tm好啊"
"正义的肃反","男","无IP","231712446","6","","10000","3","","带人真就是人上人啊"
"爱的战士白兰地","保密","无IP","4633157","6","","10000","3","","立即推：mhy想让各位舰长修炼道心种魔"
"吃货洛天依殿下v","男","无IP","18067492","6","","10000","3","","为什么外服要搞兔女郎恶心玩家的活动？国内外剧情不一致区别对待"
"璇六玑","保密","无IP","45426589","6","洛天依・最美的夜","10000","3","","这是嫌我们氪的少了是吗"
"正义无比的太阳骑士","保密","无IP","285304534","6","BML2020暗黑版","10000","3","","ex，退坑了拜拜"
"星哟木木","保密","无IP","130807066","6","良辰美景・不问天","10000","3","","建议崩三外服直接关闭，建议此次策划全员死马[点赞]"
"czm009-173","保密","无IP","21215875","6","HINA","10000","3","","本来新板鸭高高兴兴刷碎片，现在倒好看完这差别待遇，恶心，就是非常恶心，恶心啊"
"寰宇滞留","保密","无IP","527606674","5","","10000","3","","什么ntr扎不多德勒这不全体弃坑？"
"张若无","保密","无IP","86256888","6","","10000","3","",".                        / /) ,                       / ../,                     /... ./,                    /... ./,              //' ...'/`.,          /'/.../... ./... ....--,        ('(...(... ....... ,~/'...'),         \.......... ..... ..\/..../,           ''...\.... ..... . _..,             \....... ..... ..(,               \..... ..... ...\,     死    吧   ，煞    笔    策   划"
"和煦宇文","男","无IP","228499469","6","","10000","3","","我不知道有没有，我从19年入坑开始就稍微打一打之外马上就佛系了，深渊什么乱七八糟要肝的东西只打过三次，零氪，一个月一次十连(假如有什么活动可能会多一点)从来不管什么养角色什么的，有就有没有就没有，就放在仓库里吃灰，玩了这两年只有一个毕业的，这游戏没有啥太吸引我的地方包括建模、角色、剧情什么的，为啥我舍不得退游呢，因为算是我第一个手机游戏吧，就留着这点当初的怀念一直没退，作为一个学生党哪来那么多钱给你搞什么所谓口中的老婆，有空闲的钱全部都塞给g胖了，反正我是觉得买这些虚无的东西不如买一些能让自己开心的东西"
"_灵","保密","无IP","629920496","5","花园Serena第二弹","10000","3","","我靠！这个PV越看越爽，越看越顺眼[不问天_赞]日常表白美工。除了3.6PV就是这个最强了[不问天_赞]"
"名字太多先不取了","保密","无IP","17609674","6","明日方舟音律系列","10000","3","","有人教学最后一关一卡一卡的么，尤其放大的时候[笑哭]"
"盒饭狂魔","保密","无IP","25558462","6","","10000","3","","天穹游侠，空之律者低空模式,断罪影舞，雷之律者省电模式,迷城骇兔，理之律者无理模式,雾都迅羽，失智律者理智模式"
"Xun梦_","男","无IP","76031643","5","泠鸢yousa登门喜鹊","10000","3","","巴不得这个游戏凉了就舒服了，也不会有人喷了，策划你爱咋滴咋滴，反正到时候人少玩了剩下的佛系玩具也没几个会凹分那就舒服了[OK]"
"不当咕咕咕的鸽子","保密","无IP","403445921","6","","10000","3","12","一样，大家都一样，我每天几乎登录几分钟下线，但是每次剧情或者活动剧情都认真看，角色喜欢就抽，不在乎强度深渊都是记起来就打，记不起来就算了，不强求，战场也不打，所以我也希望留块净土让我们这些老咸鱼呆呆！"
"智慧西琳","保密","无IP","640009605","5","崩坏3・天穹流星","10000","3","","布朗尼：每次我黑进去都能看到这个家伙，dio华。,你这家伙，在看我对吧？"
"狐诌","男","无IP","1737743","6","","10000","3","","晚上好，天穹市！昨天的局部崩坏，最后伤亡是满打满算的整整三十个！多亏了没完没了的帮派火并，光世界蛇就挂了十个。但有一台天父也挂了，我看你们全得赔钱，因为特斯拉肯定咽不下这口气。神城医药再次发生停电。电网遭人破坏，又是网络黑客干的好事。与此同时，奥托的不灭之刃还在人行道上替崩坏能泄露的受害者收尸。而在瑞文斯（Raven's）呢…好吧…瑞文斯还是那个瑞文斯。我是你们的咸鱼舰长。和我一起，开始逐梦之市的新一天吧。"
"一块大的小饼干","保密","无IP","96811729","6","","10000","3","","虽然我粉黑道千金，但是请问视频最后的大。。。姐姐什么时候上舰啊[doge]"
"我现在就要玩GTA6","男","无IP","19959697","6","","10000","3","","石锤了，下版本渡鸦冰c"
"松Kyou","保密","无IP","27104423","6","hanser","10000","3","","太好看了呜呜呜呜[hanser_痛哭][hanser_痛哭]"
"给主播来一拳","保密","无IP","112184","6","乃琳Queen","10000","3","","重装小兔成精了！"
"门刀臣也想要展开","男","无IP","11018020","6","良辰美景・不问天","10000","3","","布朗尼！都几点了！还不回来！"
"isvz","男","无IP","670491353","3","","10000","3","","这次的鸭子好帅"
"帝临神华","保密","无IP","528009878","5","","10000","3","","怎么刷新一次一个热评就消失了[傲娇][傲娇][傲娇]"
"亘古冥辉","男","无IP","176507554","5","洛天依8th生日纪念","10000","3","7","希望新的版本不要让我这个新人失望[doge]"
"如月真绫的指导","保密","无IP","89618306","6","","10000","3","","ch祝你每天吃饭都是团圆饭[崩坏3_危险]"
"hqdfh","保密","广东","192986671","6","雾山五行","10000","3","","有点好奇黑希和布朗尼有关系吗[热词系列_知识增加]"
"壬生狼-Okita","保密","无IP","202606127","5","原神","10000","8","4","骂够了吧，敢不敢拿出点实际行动啊，每条视频都有人刷，烦死了"
"数字信号处理","保密","无IP","4390616","6","崩坏3・天穹流星","10000","7","10","要退的赶紧退，一个个戏那么多,退了还能给深渊降降温"
"liqourzzz","男","无IP","95732654","6","","10000","7","10","这视频也来刷[辣眼睛][辣眼睛]，相当败坏观感"
"账号已注销","保密","无IP","85320935","0","","5000","7","","建议给呆鹅黑渊白花加个技能  一击必杀"
"Luoooshin","保密","无IP","85606614","6","2021拜年纪活动专属","10000","16","6","又删是吧,删一次我发一次,米黑都是哪儿来的？还不是策划整出来的，我以前不也是个mwb，甚至还特意去抢个编号，想想之前是mwb的时候，原神被骂的最凶的时候还到处去对线，还真是贴吧老哥说的活脱脱的一个伞兵，崩3都这样了，原神以后还能好哪儿去，最后chsqj"
"RANSDF","保密","浙江","12387110","6","","10000","2","","我直接第3发出了！！！！！"
"摩托鸭","男","无IP","23361309","6","崩坏：星穹铁道","10000","6","11","王者都删了就差崩坏了[辣眼睛]"
"归燕然","保密","无IP","20852148","6","","10000","6","","百善孝为先"
"BigGEr_89","男","无IP","610161831","5","","10000","6","","哟哟哟，这不是卡莲嘛"
"去码头整点劳赎","女","无IP","316306875","6","","10000","8","8","玩归玩，骂归骂，别再pv下面冲ch[思考]"
"OfforBY","保密","湖北","1010834564","5","","10000","62","","2023.6.2考古，你被妹妹抄袭啦[脱单doge]"
"北仑20年租房","保密","无IP","286490951","5","","10000","5","","（很重要请看一下）我觉得这老哥的话挺有道理的，转发一下,同志们，诚如诸位所见，mhy发了新的动态，这或许意味着最终的战斗即将开始,此举已成功分散了我们的火力，大量火力已经被吸引到了新三条，短短两个小时直冲一万评,但是我们在主战场的火力已经严重不足，我们在官方发表的、唯一一个相关公告下的火力已经被严重分散了，这是mhy所乐见的,自昨夜删评以来，mhy的动向已经十分清晰了,分化，降温，回马一枪糖衣炮弹,我预计在两天之内，mhy会有下一步动作：,首先vbxz们会大举反扑――我们已被分化，刷屏战场失利,而后官方会趁机大撒好处――失利后迫不及待的回利,最后在vbxz的呼号里此事终结――我们成为跪着要饭的,同志们我要说的是，我们现在冲的不是mhy,不是兔女郎,不是,我们冲的是中国玩家的脊梁之气！,解神者在进犯我们底线后我们重拳出击打跑了他们，但是这次在众人围望的情况下，mhy公然踏碎我们的底线，这意味着什么？,意味着中国――这全世界五分之一的巨大市场，不过是一群一回紧二回松的【】！！,我们这一次打的不是mhy，是要打所有试图进犯我们底线的僭越者！！,打得一拳开，免得百拳来！！！,我们这一次，不止要得利，我们必须要完全胜利！,我们要打得mhy跪下，我们要打得mhy听话！！,我们这一次要打出！所有中国玩家的应得权益！！,我们要打到！！,中国游戏市场！,听！,中国玩家的话！！！,【砖】。,最后祝福贵黄油蒸蒸日上"
"雪一月一清","男","无IP","271951399","6","","10000","5","","ch baba aini"
"敲级摸鱼","保密","无IP","232637779","6","","10000","5","","美工yyds[蛆音娘_卖萌]，策划爬[蛆音娘_无语]"
"Super_Holy","保密","无IP","20566849","6","","10000","4","","超级哈尼机器人001号为您服务，本机现在处于测试模式,本次搜索的关键词为崩坏3"
"神马风云","保密","无IP","34317126","6","","10000","4","","听说崩三台服周年庆要到了，没准mhy会赶在台服周年庆和技嘉一块做个联合活动呢"
"最终鬼畜妹。","男","无IP","30525724","6","","10000","4","","这已经不是乐子的问题了，因为兔女郎被扯出来的越来越多，外服专属活动一堆、国服没有甚至没有一个属于自己的专属活动，只要是国服有的活动，外服都能享有，之后的客服态度以及作弊的容忍度也一件件被爆出来，外服被抓三次才会被封号。之后又出现阴阳通告，2号宣布的下架视频，结果14号还在推特上，最后居然是用私人分享的方式解决，这么多问题都是由兔女郎带出来的，可以说米哈游搞出来的问题已经太多了，而且还不知道好好处理。"
"奇葩科主任","男","无IP","85827208","6","","10000","4","","亲爱的琪亚娜，生下你的那天起，就忍不住会想象你长大以后扮兔女郎的样子，一不小心就把你长大后的兔女郎也给订做好了>w<,哎呀，真是迫不及待的想把这件兔女郎亲手送给你啊。,――爱你的，塞西莉亚"
"御之云","保密","无IP","316280857","5","","10000","4","","我的被删了，再发,cv10581872,cv10574728,我每天都发，每个动态都发，每个崩坏ip游戏都发，曾经救了我一命的就是这个东西？"
"搁浅的鲨yu","保密","无IP","94405140","6","","10000","4","","米哈游是不是想说,外国人行,中国人不行,[妙啊]"
"区区毛玉","男","无IP","30834959","6","-阿库娅","10000","4","","一群为世界上所有美好而战的女武神，去赌场当兔女郎？？？？？？？,,最后一课战死的姬子阿姐――当兔女郎,,胆小害羞但誓死保护姐姐的希儿――当兔女郎,,作为神州形象守护神州大地的仙人符华――当兔女郎,,不惜一切去守护与老师的承诺的琪亚娜――当兔女郎,,愿陷入黑暗换琪亚娜回到光明的芽衣――还tm是兔女郎？"
"_那没事了","男","无IP","23362341","5","","10000","4","","侧滑，酸辣[大笑]，快进到蒸蒸日上"
"幻海时雨","保密","无IP","438823147","5","星尘","10000","4","","服了 有必要吗 钟离下面也是你们这帮，鸭鸭下面也是。是直播没骂够吗 直播的录像就在下面"
"薪炎桃桃","保密","无IP","23887556","6","","10000","4","10","你游凉凉[打call]"
"YXRed-","保密","无IP","349134601","5","","10000","4","","什么时候原批才能少点[辣眼睛]"
"搁浅的鲨yu","保密","无IP","94405140","6","","10000","4","","这条不冲了，等下条[脱单doge]"
"阿努巴拉克_","保密","无IP","26236926","6","兔年吉祥|雪","10000","4","","明 晚 深 渊 结 算[doge]"
"木-棍-君","保密","无IP","25693913","6","","10000","4","","这。。。如果被敌人抓了会是什么下场。"
"萌圆_Meny","保密","无IP","436080177","5","崩坏3・天穹流星","10000","4","","这个新角色能辅助神里吗[doge]"
"幽兰笔墨","保密","无IP","525674596","5","","10000","4","","看来我回归还来的急吧"
"乌垃垃","男","无IP","8842987","6","","10000","4","","可爱"
"唯爱丶礼弥","男","无IP","31440425","6","","10000","4","","我直接大喊:.,老婆！[脱单doge]"
"改名字以提高中奖率","保密","无IP","351236685","5","崩坏3・天穹流星","10000","4","11","鸭鸭，我的鸭鸭[脱单doge]"
"ACGNV是我永远的理想乡","男","无IP","409544136","5","2021拜年纪","10000","8","","强度党在底下冲就是为了游戏好，鸭厨鹅厨就是愚蠢只吃角色会毁了游戏，都是天桥底下卖艺的，怎么说书的就非得看不起耍猴的。"
"落寞寂典","保密","无IP","180017765","6","2021拜年纪","10000","8","","呀又炸了呀ch，幸好爸爸跑得快，否则就被波及到了"
"OYSTER____","男","无IP","28100541","6","","10000","9","","黑渊白花倍率太低了，求加强[辣眼睛]"
"竹林中鸟","保密","无IP","65435521","5","","10000","5","","大生意，鸡场的大生意是什么啊"
"被爆打的方糖","保密","无IP","6355115","6","冬季","10000","5","","我不看测试服消息，不看官方公告，不看版本直播，不就是留给你们冲的战场吗？战场够大了吧，连我唯一的角色PV净土也要让给你们?差不多得了，不是人人都和你们一样火气这么大。给老咸鱼们留点地方吧"
"消逝の夜翎","男","无IP","19102542","5","","10000","5","","在？要不要我抽个黑渊白花贯穿你们mhy坟头？[呲牙][呲牙][呲牙]"
"雪尘心灬","保密","无IP","83765120","6","","10000","5","","点燃动作之魂还要看我罗志祥[doge]"
"怒沙Delta","保密","无IP","650540248","5","","10000","5","","看到评论区骂ch的，我都服了，点赞点到手软[doge][doge][doge]"
"惠天王","保密","无IP","5172551","6","崩坏3・天穹流星","10000","5","7","鸭鸭 帅！,策划 爬！"
"STICKTOstickoto","男","无IP","671269660","5","","10000","5","","rnm狗策划退钱[生气]"
"白蓝鸟要睡觉觉鸟","女","无IP","88155917","6","星尘","10000","2","","古战场[脱单doge]"
"泽羽伊瑞","保密","无IP","21762414","6","神乐七奈","10000","2","4","米哈游在外服也发了个道歉公告,公告大意如下：,,我们收到了来自中国服务器的反馈，国服认为「兔女郎活动」的装束与舞蹈动作是不合时宜的，因此我们会下架这个活动的相关内容，同时对之前送的八重樱兔女郎圣痕进行修改。,,（话说符华的那个挂坠呢？不改吗？）,,最后，还给了外服玩家500水晶，好像还有十张卡,然后，,,外服玩家炸了，认为这一切都是中国服务器，是国服玩家惹的祸，让他们不能再看到「兔女郎活动」的相关内容了。,,于是，他们开始攻击中国服务器和中国玩家（有推特的可以去亲自看看）,,虽然是被骂了哈,,但这并非是外服玩家的问题,,他们不过是被推送了一个活动，然后玩了，最后却发现活动全部被取消，肝到手的东西也被修改。,,那么问题在哪里呢。,,「兔女郎活动」，米哈游很早就开始策划了。,,之所以不在国服上线，是因为米哈游明显知道这个活动在国内上不了，会产生问题，但依旧是做了，上了。,,因此，这个问题的根子在米哈游身上。,,而现在，在对外服的公告上，米哈游给的理由是什么？,,“由于收到了来自中国服务器的反馈”,,什么意思？,,意思就是国服玩家觉得这个有问题，所以我下架了。,,于是，这个锅就被甩到“中国服务器和国服玩家”身上来了。,,这不被外服玩家冲才叫见鬼。,,这波啊,,米哈游活动上完了，外服好感刷到了，末了还用国服玩家收了波尾，,,让外服玩家把矛头指向国服玩家，给自己洗了个干干净净。,,高啊！"
"emiya110","保密","无IP","11497649","6","","10000","2","","我现在只想崩坏3彻底凉"
"呜呼呼芴","男","无IP","262524893","6","","10000","2","","特别喜欢骇兔呢"
"大红莲团的西蒙","男","无IP","23183104","6","","10000","2","","本次公关的最大难点在于如何混淆视听。,mhy的底线是：“玩家可以扯我们的蛋，但是坚决不能打我们的脸。”,因为，一旦风・波过去，蛋还能捡回来。,可脸若是被刮花了，mhy拿什么去钓凯子？,,所以，分锅，首先要分给策划，可能是985策划，,也可能是海归策划，必须是个究极临・时・工。,突出的就是个不接地气，关键时刻，杀之，以・平・民・愤。,总而言之，mhy是好的，旗下的IP是干净的，,里面的姑娘们依然是值得中国玩家投钱的。,（正如二战胜利后，天・皇是受人蒙蔽的，马鹿是该枪毙的，,小日......子过得不错的日本百姓，都是无辜的。hetui~）,,其次，要分化玩家，就要先融入玩家，反装忠，然后在关键时刻跳反。,重要的就是带一些乱七八糟的节奏，阻止消费者之间的抱团行为。,要求：带起的节奏都各有几分道理，但都无伤大雅，mhy能够轻易化解。,目的：炮制一出冲・塔玩家无理取闹的大戏，突出mhy善良无辜的形象。,博取中立单位的同情心，同时制造事端，内・部・分・裂・冲・塔意愿坚决的玩家。,,最后，建议内鬼使用魔怔人身份，在相关和不相关的用户交互区，,发表恶劣言辞，积极扩大矛盾、扰乱视听。关键要让魔怔人一词，,成为所有人厌恶的焦点，mhy水军可以借机占领道德制高点。,再把魔怔人的帽子，扣在冲・塔玩家头上，,如果能进一步把友商拉下水，那就是大功一件。,你们的身份我们知晓，你们的功绩...... ,―――――――――摘自《mhy立体防御白皮书：舆・论・篇》"
"风筝的纸鸢","男","无IP","470210865","5","2021拜年纪活动专属","10000","2","","身为老舰长，即使角色出的速度越来越快，服装越来越多，我都照氪，现在发现原来我是氪金母猪，小丑竟是我自己。 ,所以。。。。 ,流水少了就想出新角色？ ,黑渊白花命之座，区别对待兔女郎 ,就装死？,各位，传下去，这是我们的诉求：我们要求米哈游能够做出并答应以下回应: ,1.决策人公开承认近期的决策失误，并做出道歉 ,2整改乃至关闭台服，提高国服待遇标准，不再区别对待国服玩家,3.删除外网的所谓“外服周年特供活动”（即兔女郎）的一切相关视频和内容，并对此事件向国内全体玩家出面道歉 ,4.对在外网恶意针对国人讨好外服玩家的行为给出合理的解释，并对国内全体玩家出面道歉。并做出像样的承诺,5.道歉声明和道歉视频上传外网，做到内外-致，不要再表面一套背后-套 ,6.将本该属于国服玩家的福利和国服活动实装.上线，从此不准再出现外服特供 ,7.不再侵害玩家的底线，积极听取玩家意见并给出反馈，而不是冷处理,8.以后在外网的一切行为不准触及国家底线,不准触及国内玩家底线，不准再出现夹带私货的行为 ,9.提高国内的活跃度，多与玩家互动，听取玩家意见 10.不得再出现外服比国服优先的行为。。,都来复制粘贴熬"
"账号已注销","保密","无IP","417270101","0","","5000","2","","很喜欢刘伟在四周年上说过的一句话：琪亚娜就像是他的女儿一样。当他的女儿真惨，还得穿兔女郎跳舞给人看[呲牙][呲牙][呲牙][呲牙][呲牙]"
"懒喵灬","保密","无IP","13672512","6","魔兽世界怀旧服","10000","2","","这大生意，我想看兔女郎赌场跳舞"
"司马逍遥仙","男","无IP","8701020","6","","10000","2","","恭喜鸡场破圈[热词系列_好耶]"
"逍遥随松","男","无IP","360799437","5","2021拜年纪","10000","2","","没要十年脑梗，干不出这事"
"籽月哒","保密","无IP","34887887","6","拜年祭粉丝专鼠","10000","2","","[doge]早就不玩了，兄弟们[doge]"
"偾樨","保密","无IP","2422459","6","","10000","2","","性感荷官在线热舞"
"浮云--初见","保密","无IP","382941441","5","欧皇","10000","2","","狗都不玩"
"洛水应鸢一","男","无IP","317092957","4","","10000","2","","什么大生意？板鸭不是没去国外吗？"
"星空凌夜雪","保密","无IP","124059592","6","","10000","2","8","这次剧情还不错，就是结尾有一般，还有就是希望多一些舰长线和沙雕文案，那样才有趣，希望以后的活动剧情可以越来越好[呲牙]"
"二游古神遍地走","保密","无IP","1110040593","3","","10000","2","","https://b23.tv/n2XanU"
