"昵称","性别","IP","UID","等级","装扮","用户权重","获赞数","粉丝团等级","评论"
"赛马娘明志","保密","无IP","501483213","5","","10000","0","","请问什么时候更新啊？"
"鱼中的水瓶","保密","无IP","298008366","6","崩坏3・天穹流星","10000","0","","woc了！！！把琪亚娜留下――！,（实在不行，呆鹅也可以）,换老婆警告[doge]"
"沫筱慕","保密","无IP","346441908","5","洛天依9th生日纪念","10000","0","","那位大人呢？没那位大人的解说没有灵魂！"
"满潜水月","保密","无IP","86905094","6","","10000","0","","就我感觉一些老角色打不出伤害来了吗？[大哭]"
"钮泽堡","男","无IP","1864928","6","","10000","0","","奥，反正肯定没有"
"星期89","保密","无IP","255263720","5","","10000","0","","谢谢大家的码[呲牙][呲牙]"
"橘柑橘柑","男","无IP","187541208","5","","10000","0","","bgm是啥"
"itsukaS","女","无IP","361074","6","","10000","0","","看来新剧情 幽兰黛尔把琪亚娜 带走了。。。。应该是要在幽兰黛尔手下接受调教训练了"
"黄大叔久美子酱","保密","无IP","157198749","6","","10000","0","","你这视频发的好活跃啊[热词系列_吹爆]"
"鱼嗅嗅嗅羞羞","男","无IP","397774940","4","","10000","0","","脱坑许久，不佛不敢回坑，即使你米哈游让我白嫖所有女武神[捂眼]"
"雪一月一清","男","无IP","271951399","6","","10000","0","","冰镰刀冰镰刀冰镰刀冰镰刀冰镰刀冰镰刀冰镰刀冰镰刀冰镰刀冰镰刀冰镰刀冰镰刀冰镰刀冰镰刀冰镰刀冰镰刀冰镰刀冰镰刀冰镰刀冰镰刀冰镰刀冰镰刀冰镰刀冰镰刀冰镰刀冰镰刀冰镰刀冰镰刀冰镰刀冰镰刀冰镰刀冰镰刀冰镰刀冰镰刀冰镰刀冰镰刀冰镰刀冰镰刀冰镰刀冰镰刀冰镰刀冰镰刀冰镰刀冰镰刀冰镰刀冰镰刀冰镰刀冰镰刀冰镰刀冰镰刀冰镰刀冰镰刀冰镰刀冰镰刀冰镰刀冰镰刀冰镰刀冰镰刀冰镰刀冰镰刀"
"账号已注销","保密","无IP","479515648","0","","5000","0","","什么时候出S级幽兰戴尔，就是有俩替身那个。"
"逐风の旅","保密","无IP","15077429","6","良辰美景・不问天","10000","0","","鸭子还是丸啊"
"叶子asahi","女","无IP","111967880","6","","10000","0","","幽兰呆鹅是不是能把亚空之矛当武器甩女王[doge]"
"晓研zero","男","无IP","225932798","5","","10000","0","","何时更新啊"
"焰烬罪灭","女","无IP","20323133","6","崩坏3・天穹流星","10000","0","","幽兰黛尔出了那岳母就不远了吧[2233娘_大笑]"
"ii枝","女","无IP","435264068","5","罗小黑战记","10000","0","","她是真的大（指头发）"
"呆鹅人ん","男","无IP","179114582","5","","10000","0","","直播录像，搞快点，搞快点"
"Evol樱","男","无IP","95625442","6","","10000","0","","幽兰终于来了"
"艾梵酱","保密","无IP","7335330","6","罗小黑战记","10000","0","","奇怪的玩法增加了[热词系列_知识增加]"
"墨羲_","男","无IP","10274180","5","崩坏3・天穹流星","10000","0","","呆鹅，呆鹅，呆鹅[蛆音娘_滑稽]"
"取名困难症路过","男","无IP","277736647","6","初音未来13周年","10000","0","","刚看了这次的直播，发现一群人有奖励了还在哪一个劲刷，那些刷拉低中奖率的就不说了。最后还有在那刷“就这？”的。我搞不懂是为什么。按发的码跟平时也差不多啊，就是把金币换成星石了。搞不懂。"
"湫桐七条街","保密","无IP","34052316","4","","10000","0","","我本来想看一下评论，有没有提一下最后琪安娜出场的，结果评论区乱七八糟的，都不知道吵什么……我是错过了什么重要事情么？"
"飞翔火焰","男","无IP","26893546","6","","10000","0","","个人猜测:新章里芽衣想带回琪亚娜，结果幽兰黛尔抢先一步找到，芽衣欲想夺回，由于实力差距太大，最终琪亚娜被幽兰黛尔带回天命总部。。。(可能想法。。。)"
"星野静流__","保密","无IP","35835657","6","","10000","0","","我姬子呢？"
"NO-鹿","男","无IP","489739049","5","总之就是非常可爱","10000","0","","许愿s幽兰戴尔"
"Dido_Doll","男","无IP","179415013","6","初音未来13周年","10000","0","6","PV的BGM还是那么好听[惊喜]"
"依怜霜","保密","无IP","16570498","6","崩坏3・天穹流星","10000","0","6","【千羽幻梦】梦(893239742) 21:01:57,@米其林肥宅  NS6CZT24XHX3,7TPCYB34EYW9,4B6VYTJLXYZU,CT6A2U55XHZG,FSPCGA35EGHW,5B6VGSK5WZYM"
"AS泠枫","男","无IP","388382818","5","洛天依8th生日纪念","10000","0","","嘿嘿，莫名想笑[星星眼][微笑][吃瓜]"
"暮色的圣象","保密","无IP","15965865","6","2233十一周年纪念","10000","0","","看样子武器是长枪"
"铲屎一号","男","无IP","281114284","5","","10000","0","","在？冰镰刀加强一下啊？？？？"
"高洁的海燕","男","无IP","192334861","5","","10000","0","","nb！"
"账号已注销","保密","无IP","439689365","0","","5000","0","","许愿白嫖[吃瓜]"
"泓fukaaiiiiiiii","保密","无IP","92617595","5","citrus","10000","0","","在?超限呢？"
"火恐症","男","无IP","398930646","6","明日方舟","10000","0","","出货我 ci shi[滑稽]"
"hdbdhdjsh","保密","无IP","43216798","6","良辰美景・不问天","10000","0","","她来了她来了！这就是脚踏祥云进来了？"
"暝明昏暗","保密","无IP","392655223","5","","10000","0","","在？3.8版本啥时候更新？"
"关定一","保密","无IP","12687978","6","","10000","0","","后崩坏书莫得排面啊  还真是随手做出来的啊"
"李妖道","男","无IP","20339592","6","","10000","0","","黑渊白花应该迟早会出"
"白小d","男","无IP","304514418","6","新月冰冰","10000","0","","我现在已经劝认识的人都不要氪金了。这是个怎样的世界，我希望更多人知道。尽管我个人力量很小，我也会在各大论坛上说，阐述自己的观点。时间终会证明一切，游戏失去了热爱，末日就不远了。,如果你也是对ch这档事不满，请也劝周围人不要氪金，没必要了，这个游戏变了。它变了。。。"
"酸酸糖醋鱼","保密","无IP","15222312","5","","10000","0","","丽塔：S装甲已打包好。请舰长按时签收"
"oO基洛夫飞船Oo","保密","无IP","7197069","5","","10000","0","","“你这是干嘛，呆鹅？”,“和绿托做了比交易，芽衣，带她回天命，就自由了”[蛆音娘_滑稽]"
"Gary丶凌","男","无IP","24712579","6","2020拜年祭（鼠）","10000","0","7","幽兰黛尔能肝的，许愿是什么操作[doge]"
"审查官H","保密","无IP","17458033","6","","10000","0","","我是真的没钱"
"程程小小虫虫","男","无IP","29008006","6","约战・白之女王","10000","0","","先出个A，然后一个S甩你脸上。[笑]"
"大大凉白开","男","无IP","51023565","6","","10000","0","","所以说崩坏3的世界观不会像崩坏学园2的世界观被重置了[喜欢]"
"壹梦灬","男","无IP","389113004","6","","10000","0","","四年了，终于等到你！[大哭]"
"sIpace","男","无IP","351607052","6","崩坏3・天穹流星","10000","0","10","命运之线仍在转动（最后一串英文直译，感觉要和先行者扯上关系了）[崩坏3_路过]"
"十七不悔","男","无IP","430403193","5","名侦探柯南","10000","0","","比较关注什么时候更新[无语][无语]"
"呆毛灬菌","保密","无IP","332870083","5","","10000","0","","别叨叨公关了，把造谣的给我抓出来，这p图已经算是违法了[笑][笑]"
"不是很顺口","男","无IP","91275653","6","刺客伍六七","10000","0","","我觉得有点像咸鱼突刺"
"蕾系男孩","保密","无IP","12949388","6","","10000","0","","塔子姐，永远滴神[呲牙][呲牙][呲牙]"
"-Amedes","保密","无IP","50336989","6","","10000","0","","好了 我的丽塔也不是我的了[热词系列_知识增加]"
"LaugherLanger","男","无IP","82692516","5","","10000","0","","说吧，怎么个氪法[无语]"
"不变呀","女","无IP","255733493","5","","10000","0","","许愿幽兰黛尔"
"十年矿工","保密","无IP","275137098","5","","10000","0","","标 枪 哥"
"旅行者_男","保密","无IP","280459412","3","","10000","0","","https://m.weibo.cn/detail/4476996840657958#comment"
"竹","男","无IP","324998499","5","","10000","0","7","大佬们，这个A级幽兰黛尔有没有必要氪毕业 还是等S幽兰黛尔毕业"
"兰茶蓝","保密","无IP","456589896","6","","10000","0","","第二神之键出来呢？[无语][无语][无语][疑惑][疑惑]"
"嘀九","男","无IP","2875852","6","","10000","0","","还有许愿呆鹅的就nm离谱"
"账号已注销","保密","无IP","488397290","0","","5000","0","","我求求你们了查一下内鬼吧，我还真没想到会有这种死法"
"不如怀念sama","男","无IP","4649158","6","","10000","0","","大家加油磕"
"移花慕芸","保密","无IP","13518413","5","汉化日记","10000","0","","看来要出黑渊百花了"
"头发别走啊","保密","无IP","383205382","5","","10000","0","","什么时候更新啊"
"大仨","男","无IP","4483556","6","","10000","0","","我现在只想知道下个版本镰刀要不要超限，听人说又是垃圾一个"
"黑夜的hymn","男","无IP","86269677","6","明日方舟","10000","0","","今天直播间发生了什么，刚才网太差去玩游戏了"
"驴小美_","男","无IP","339027186","6","","10000","0","3","在?能不能不要迫害我煮饭婆了?"
"稳健的人防","保密","无IP","351554348","5","","10000","0","","除非单抽出奇迹，唉，普通玩家太难了"
"弦宇在摆烂","保密","无IP","340229548","5","明日方舟音律系列","10000","0","","你们好像在对我的新老婆想些很失礼的事情啊~"
"杯具也红尘","男","无IP","382145807","5","崩坏3・天穹流星","10000","0","11","琪亚娜，我要带你回到休伯利安"
"I夜半花落I","保密","无IP","224471378","5","","10000","0","","我已经没有钱拯救崩坏世界了×,我已经没有爱拯救崩坏世界了"
"千瞳万孔","男","无IP","8078244","6","不吉波普不笑","10000","0","4","哇，很酷哦，呆鹅[鸡腿][鸡腿]"
"西方V记者","男","无IP","9851707","6","","10000","0","","看来黑渊白花有希望了"
"猫非鱼1","保密","无IP","103260535","5","","10000","0","","水晶码用不了"
"小熊家的孔雀鱼","男","无IP","248887678","6","Kizuna AI","10000","0","","???"
"Starshards-","保密","无IP","94574136","6","","10000","0","","在？你们公关从法国招的？"
"木木玄-","保密","无IP","18072054","6","","10000","0","","八重村飙车又添一人"
"浅见Asuka","保密","无IP","4261892","6","","10000","0","","等我出来了要把那些叫我幽兰戴尔的都杀了！"
"无尘之翼","保密","无IP","61570606","6","崩坏3・天穹流星","10000","0","6","可以了可以，我们的虫子在量子海，活着就好"
"优柔寡断的中立生物","保密","无IP","291797162","6","","10000","0","","是可可利亚我死了[打call]"
"Shadow130","保密","无IP","34529968","6","","10000","0","2","一个初始A弹幕怎么这么多许愿，真就都肝不出来呗"
"涯詈谏丶","男","无IP","244886","6","汉化日记","10000","0","","主线好久没做了[笑哭]"
"si想","男","无IP","106153898","6","","10000","0","","卧槽"
"会飞的橙孑","保密","无IP","29409771","6","","10000","0","","u1s1我想知道琪亚娜为什么不跟芽衣回去（本人不看漫画剧情资源不下载）"
"能用积芭弹钢琴","男","无IP","130564626","6","","10000","0","","呆鹅大招能吃到牛吗"
"F衍","保密","无IP","179401263","6","","10000","0","","强袭再次觉醒？"
"来杯无糖气泡水","男","无IP","47194854","5","刺客伍六七","10000","0","","听说有人许愿我[doge]"
"火锅料高级特工","男","无IP","3936744","6","","10000","0","","Lancer即视感"
"rの葬る","保密","无IP","252959781","6","约战：精灵再临","10000","0","","黑渊白花终于要出来了吗"
"仓鼠囤咸鱼","保密","无IP","349510980","5","","10000","0","","个人感觉冰箱不弱啊，每次联机比我黑希伤害还要高好多[捂脸]"
"0973","保密","无IP","37588911","5","","10000","0","","爱酱又偷电打游戏了吧"
"风翩翎","保密","无IP","113355080","6","国民老公带回家","10000","0","","幽 兰 戴 尔"
"Jayce晴天","男","无IP","102877010","5","","10000","0","","一群人在这刷斯卡蒂，也不见你们有，也不见你们用丽塔，虚伪"
"默丿言","保密","无IP","177823006","6","","10000","0","","大爱崩三"
"ddugh","保密","无IP","310742222","6","hanser","10000","0","","我们ios有吗"
"流浪剑客范德彪","保密","无IP","14901791","6","","10000","0","","你们不要吵了，都说了是冰箱的主人了。冷宫不懂么[妙啊]"
"季染Jinran","男","无IP","350888901","6","","10000","0","","盲猜后面岳母在黑渊白花上闹鬼，挽回琪亚娜，幽兰戴尔觉醒岳母。"
"LCrossy","男","无IP","262508572","6","","10000","0","4","不介绍一下下版本的超限武器？"
"平平无奇Neko酱","女","无IP","472187652","6","","10000","0","","许愿许愿！！"
"九朝哟","保密","无IP","3382397","6","","10000","0","","兑换码看我动态"
"中二幻灵","保密","无IP","252482267","5","2233幻星集","10000","0","","豪哥又要氪了吗?"
"最近丶最静","男","无IP","8643972","6","","10000","0","","包菜精在我手上，谁出刀？"
"躲避QQ","保密","无IP","37793968","6","","10000","0","","什么时候出呢  3.8版本"
"我是大BUG","男","无IP","27401143","6","","10000","0","","超限来不来？"
"大蚊子b","男","无IP","2348363","6","","10000","0","","五凌s光"
"夜色灬","男","无IP","16093618","6","","10000","0","","在？冰镰刀"
"Red叉","保密","无IP","8560025","6","","10000","0","","冰塔是杀了ch妈了吗？这么对她？"
"李某人ZM","保密","无IP","35424012","5","2021拜年纪","10000","0","","天命天花板"
"枪之勇者Arthur","男","无IP","20764455","6","","10000","0","","总感觉有点像真三7里面的赵云"
"2o23我要上岸","男","无IP","8094524","6","","10000","0","","优蓝带耳的CV是谁？？？？？"
"三-真神","保密","无IP","46779839","5","","10000","0","","直播限时码（3.8版本）NS6CZT24XHX3  100氵7TPCYB34EYW9 150氵4B6VYTJLXYZU   2000星石CT6A2U55XHZG  60体力fspcga35eghw    2w金币+材料"
"白小d","男","无IP","304514418","6","新月冰冰","10000","0","","古有云，“得道者多助，失道者寡助”。你今天敷衍的了玩家，以后就是玩家离开你。"
"铃_音","保密","无IP","304260958","6","花园Serena第二弹","10000","0","","幽兰戴尔一出，是不是要出骑士枪，镰刀武器就装不了，又是少不了一波氪"
"在靠近一点就要爆炸","保密","无IP","490395439","5","hanser","10000","0","","所以黑渊白花是武器"
"C氏基","保密","无IP","52637921","6","","10000","0","","芽衣的剧情似乎有点东西了，那下个cg就是你！雅诗兰黛[doge]"
"SPLIT-SPIRIT","男","无IP","182711929","5","","10000","0","","请问月轮皮肤有说怎么获得吗"
"晒足一百八十斤","男","无IP","71094042","5","","10000","0","","y1s1崩崩崩策划马biss"
"TR初学者","保密","无IP","290144659","5","","10000","0","","什么时候更新3.8"
"请上级医师指导","男","无IP","35145609","6","崩坏3・天穹流星","10000","0","","开始攒氵，坐等S呆鹅[doge]"
"铃山鹿海御浪前","男","无IP","147125289","6","","10000","0","10","公关...."
"世界第一可爱cff","女","无IP","6433575","6","","10000","0","","材料有限，本来想弄个断光超限，毕竟迅雷很强，而且我也有ss月轮。一上b战又看到冰镰刀超限了，打算材料先攒起来留着给丽塔，看到v3这个鬼样子，得，我去超限断光了。"
"开车的司机dalao","男","无IP","11184730","6","良辰美景・不问天","10000","0","","各位谁知道兑换码发一下"
"男人不变态做什么男人","保密","无IP","12748992","6","","10000","0","","“纵使冰箱被削，我也要化身流星，点燃ch全家，让冰镰刀变回大家所期望的样子”塔子姐，永远滴神！！"
"京诚帅哥","保密","无IP","23079587","6","","10000","0","1","诶，别说这现在b站下面评论越来越有wb那味了，个个脏话小王子啊"
"木乔本王不奈奈","保密","无IP","455794733","5","","10000","0","4","我寻思着一个白嫖的a，你们许愿啥？"
"摆烂的法则已经制定","男","无IP","122514711","6","","10000","0","","为什么看到油篮化而就想笑"
"淋尼","男","无IP","259535298","6","","10000","0","","求你们了，把超限斯卡弟删除吧！不想加强就不要出，这样大家都高兴！[吐]"
"其其猫想当石头","女","无IP","31546509","6","VirtuaReal岁末相庆头像框","10000","0","","我们好歹是个s吧，毕业了到现在就皮肤出的欢，好不容易真的有超限，表面笑嘻嘻给丽塔过生日，暗地里就觉得活该丽塔是花瓶，做啥啥弱，我真的伤心透了"
"亦N寤H","男","无IP","359488982","5","","10000","0","","这是又要出一种武器了吗。长矛？"
"男人不变态做什么男人","保密","无IP","12748992","6","","10000","0","","“纵使冰箱被削，我也要化身流星，点燃ch全家，让冰镰刀变回大家所期望的样子”塔子姐，永远滴神！！！"
"淋尼","男","无IP","259535298","6","","10000","0","","求你们了，把超限斯卡弟删除吧！不想加强就不要出，这样大家都高兴！[呆]"
"Oiyoyo","男","无IP","294184138","5","","10000","0","","终于出来了"
"独爱秋雪","保密","无IP","326699725","6","","10000","0","","“纵使冰箱被削，我也要化身流星，点燃ch全家，让冰镰刀变回大家所期望的样子”"
"男人不变态做什么男人","保密","无IP","12748992","6","","10000","0","","“纵使冰箱被削，我也要化身流星，点燃ch全家，让冰镰刀变回大家所期望的样子”塔子姐，永远滴神！"
"nigture","保密","无IP","40383141","6","","10000","0","","一个初始A，新版本都是白送，弹幕全刷什么许愿，有啥意思呢"
"其其猫想当石头","女","无IP","31546509","6","VirtuaReal岁末相庆头像框","10000","0","","表面笑嘻嘻给我家丽塔过生日，结果你就换来一个还不如不超限的武器，真就压着我们丽塔真爱党咯，丽塔活该是花瓶咯，这和故意拿别人的期待别人的喜欢当钱榨有什么区别，我女舰长，也是为了冰箱去年三月丽塔生日的时候入坑的，真就犯贱该我喜欢个没啥用的式神了"
"淋尼","男","无IP","259535298","6","","10000","0","","求你们了，把超限斯卡弟删除吧！不想加强就不要出，这样大家都高兴！"
"好香的血腥味","保密","无IP","11114758","6","EveOneCat2","10000","0","","公关是谁，自己扣自己一顶锅？[疑惑]"
"看来是旧病复发","保密","无IP","157481768","6","","10000","0","","出了算我输[妙啊]水晶才一千[妙啊]"
"silent沈沉末","保密","无IP","34152881","6","","10000","0","","许愿"
"宇宙人电风扇","保密","无IP","2863070","5","","10000","0","","法国公关 太牛批了"
"淋尼","男","无IP","259535298","6","","10000","0","","求你们了，把超限斯卡弟删除吧！不想加强就不要出来，这样大家都高兴"
"Omnsicipotence","男","无IP","205249214","6","","10000","0","","公司是不是有内鬼，一堆事。"
"坟头长草了","保密","无IP","223914971","5","良辰美景・不问天","10000","0","","不求a级只求s级必出[热词系列_妙啊][热词系列_妙啊]"
"夏暑芒夏","保密","无IP","338223486","5","","10000","0","","听说下周四还是周五才更新[疑惑]，我都开学了[捂脸]"
"千~","保密","无IP","35825090","6","","10000","0","","xynmmm呢xy"
"しょっか","男","无IP","32199188","6","向晚大魔王","10000","0","","公关策划都给爬"
"12号的moon","男","无IP","249046374","6","","10000","0","4","还没正式服上线呢。玩家们努力喷喷。其实从上版本的超限就不行了。[崩坏3_吃瓜][崩坏3_吃瓜]"
"夜色阑珊冬亦凉","男","无IP","281146643","6","","10000","0","","法国公关，不战而降。"
"q离曜","保密","无IP","38232027","6","","10000","0","","所以芽衣又吃瘪了[笑哭]"
"AbgrundKirche","保密","无IP","67942185","6","","10000","0","","加点冰箱专属攻速不行吗？你们心知肚明哪里不足不是吗？v1的那些加强说明了你们完全知道这个角色弱在哪[怪我咯]"
"淋尼","男","无IP","259535298","6","","10000","0","","求你们了，把超限斯卡弟删除吧！大家来和我复读"
"宇宙人电风扇","保密","无IP","2863070","5","","10000","0","","为啥 后崩坏书没怎么讲啊"
"四m保of会","保密","无IP","1306607","5","","10000","0","","如果出了物理呆鹅，凹暴击会不会很难？,毕竟幸运E,[热词系列_知识增加][热词系列_知识增加][热词系列_知识增加]"
"白瓢嘤嘤怪","保密","无IP","39708921","6","","10000","0","","命运的线还在纺，这是指什么"
"斥之梦","男","无IP","300802146","6","明日方舟","10000","0","","有的角色表面是a实际是c"
"末嘘幽","保密","无IP","261837768","5","","10000","0","","此时芽衣正在赶来的路上[笑哭]"
"禁止使用本账号","保密","无IP","15266502","6","","10000","0","","这什么啊？？？芽琪党彻底崩盘了？我的青春结束了[小电视_无语]"
"莫如今天绝对没有熬夜","保密","无IP","156583537","6","中国绊爱2nd纪念","10000","0","","能不能给我芽衣留点面子，别老被人揍[委屈]"
"稳健的人防","保密","无IP","351554348","5","","10000","0","","我没水晶了啊啊啊啊啊啊啊啊啊啊啊啊啊啊啊"
"Luna_Prayer","男","无IP","201131490","6","黑潮之上","10000","0","","我又有新老婆啦哈哈啊哈"
"莱茵憨儿","男","无IP","31973880","6","","10000","0","2","迪兰达尔翻译成幽兰黛尔的也是人才。"
"骑芽娜出击","保密","无IP","250876150","5","碧蓝航线","10000","0","","发完第三个码的时候我一直在等第四个码 想不到ch光速下播 直到屏幕变黑 我才恍然惊醒 原来ch没码了"
"兼职旁白的翻译机器","保密","无IP","23530634","6","","10000","0","","咿 呀 剑 法"
"唉-哟-吼","保密","无IP","12046226","6","","10000","0","5","米忽悠你这公关也是nt玩意，憨的一p[笑]"
"大萌子233","男","无IP","7125809","6","嘉然今天吃什么","10000","0","","贴吧测试服集中讨论帖之前的平均评论数也就1200左右 这次有望突破4000"
"璀璨的橘子","保密","无IP","178164766","5","2021拜年纪","10000","0","","所以说到底几号更新？"
"不齐三水","保密","无IP","306226165","6","","10000","0","5","法国公关属实牛逼[捂脸]"
"尚寐","男","无IP","13885129","6","小桃","10000","0","","往小说是怂了低头就认，往大说就不管啥事先低头认就是了，你说你这是怂怕了，还是敷衍就对了[笑]"
"喵咧哥咪","保密","无IP","37632787","6","","10000","0","","许愿"
"大杯乐椰奶","男","无IP","11454514","6","明日方舟","10000","0","","...我现在只想知道后面会不会出新丽塔角色[崩坏3_琵琶]"
"-Kafka","男","无IP","143365092","6","雪未来","10000","0","","真就当没人玩丽塔呗"
"致青春丶","男","无IP","17921510","6","","10000","0","","纵使冰箱被削，我也要化身流星，点燃ch全家，让冰镰刀变回大家所期望的样子"
"如缘梦","男","无IP","92173131","5","","10000","0","","米忽悠:我们的宣传pv绝对真实,舰长:所以这就是把游戏画面放进来的理由"
"xe束花","保密","无IP","29213632","6","星座系列：金牛座","10000","0","","在？天霜之斯卡蒂？"
"提尔比茨一动不动","保密","无IP","30256312","5","","10000","0","","世界名画《芽衣正在赶来的路上》"
"15弘极速烤鸭46","男","无IP","49658652","6","","10000","0","","有一瞬间我感觉我大强袭又要增强了[妙啊]"
"KKOAPBD","保密","无IP","50982845","5","","10000","0","","能不能认真对待超限啊"
"KKOAPBD","保密","无IP","50982845","5","","10000","0","","丽塔，我再强调一遍，丽塔"
"通栏辅助","女","无IP","40089310","6","","10000","0","","在？还招公关吗，就这谁上谁都行。"
"苏镜子","保密","无IP","68410129","6","","10000","0","","在？幽兰戴尔对巨型敌人的投掷表现呢？[doge]"
"-Kafka","男","无IP","143365092","6","雪未来","10000","0","","同样是氪出来的初始S和五星武器，为什么差别这么大！"
"四季御名奶昔","保密","无IP","133317552","6","","10000","0","","丽塔祭日[打call]"
"那不勒斯冰淇淋","女","无IP","326407092","5","明日方舟音律系列","10000","0","","就是她抢我丽塔老婆？"
"六芒星丶幻日夜羽","男","无IP","6752636","6","citrus","10000","0","","！马没远永，猪划策！神滴远永，姐子塔"
"某琴fk","男","无IP","181791","6","","10000","0","3","又开始乳芽了……  一个强袭遇到了天命最强呆鹅，怎么看都是要被暴打。"
"梁咏仙","保密","无IP","25866382","6","","10000","0","","所以我到底是多了一个老婆，还是被带走了一个老婆呢"
"淋尼","男","无IP","259535298","6","","10000","0","","求你们了，把超限斯卡弟删除吧！大家来和我复读[喜极而泣]"
"Bili_Yeats","男","无IP","47656011","6","崩坏3・天穹流星","10000","0","7","这就是天命最强女武神雅诗兰黛吗？"
