"昵称","性别","IP","UID","等级","装扮","用户权重","获赞数","粉丝团等级","评论"
"莱鸡月","男","无IP","8687189","5","","10000","1","","孝子能不能随便挑一个解释一下啊,0.98mhy概率诈骗，实际概率与文案不符合。开天剑  原效果为主动攻击削弱100%防御，后因为骗氪改为80%。凰剑在1.8版本之前效果为火伤增加118%?来着？后因为炎八新角色砍为每击附加118火伤?2.2，2.3连着2个S，炽翎，冰卡  惹到氪金佬 ，停氪弃坑新S滚，然后连续2版本送这2个S角色。空中劈叉，第二次夏日活动文案直接骂玩家是空中劈叉的睿智清洁工。二周年就是个nt周年庆，让玩家各种肝肝肝凹排名拿限定徽章。双塌缩，好像是月轮可以靠闪避打出双塌缩低成本打龙虾，后面修复。黑皮蛋改版，战圣鬼 直接秒黑蛋 不符合预期，直接官方修改黑蛋设定。游骑兵十字架，这个武器可以低成本拿丽塔BOSS高分，后因为低成本 直接不符合预期给你改数据。无限激光，山吹未增幅前大招在激光攻击时候可以直接释放不会终止攻击，即利用大招攻击脆弱敌人回血，再利用量子2主动聚怪，可以低成本打无尽深渊，最开始官方确定了是设定没问题，后面直接翻脸 不符合预期，更改了这个技能。大月卡蛋黄，最开始出凭证没有说过那个蛋黄期限，后面4.2版本突然说那个东西有期限了，导致玩家之前几个版本想屯蛋黄换后续好东西的直接玩完，然后官方并且推出  玩家亏本蛋黄置换蛋紫的方案，公然压榨玩家。佐罗套，这套圣痕在beta服有bug，快乐猎人可以触发  回血更多，降低无尽深渊成本，官方不修复，但是在佐罗套up后几个小时突然说修复，然后补偿了1k水晶来着？连10连都不够。雷刀-鬼角  这装备一直都有个问题  攻击附带40%雷伤来着？忘了  反正给月光用当初很厉害 超越了电磁炮，后面几个版本后不符合预期 补偿点水晶修复...反正多的去了。 只要威胁到官方的利益  从装备到玩家自己开拓的玩法，全部砍。"
"KelvinKHan","男","无IP","335335592","5","","10000","1","6","woc，我生日那天开播！,好开心[给心心]"
"阿飘233333","男","无IP","355678409","5","","10000","1","","西林和贝拉[热词系列_好耶]"
"鸽子星绅士","保密","无IP","11660332","6","原神","10000","1","11","我是真的没想到，好耶！[原神_小事一桩][原神_交给我吧][原神_干杯]"
"等待mhy道歉的米游伥","男","无IP","10896289","6","七濑胡桃","10000","1","8","这次又是外包给了哪家公司啊？会不会又逼着人家公司删除微博啊？"
"D级小白","保密","无IP","360739082","6","","10000","1","","吓得 我看了下日期确认不是愚人节[doge]"
"topmongolia","男","无IP","345876541","6","崩坏：星穹铁道","10000","1","","愚人节居然是真的[tv_思考][tv_点赞]"
"莱鸡月","男","无IP","8687189","5","","10000","1","","听人家背地里谈论，mhy刚来中国的时候也是个正常人，但终于没有本事，又不会营生；于是愈过愈穷，弄到将要讨饭了。幸而明白了中国二次元游戏钱好骗，便做做二次元游戏，换一碗饭吃。可惜他又有一样坏毛病，便是不把中国玩家当人。如是几次，看他发动态的人也没有了。mhy没有法，便免不了偶然做些恰烂钱的事。,mhy喝过半碗酒，涨红的脸色渐渐复了原，旁人便又问道，“mhy，你当真爱简中服？”mhy看着问他的人，显出不屑置辩的神气。他们便接着说道，“你为什么不到外网去说呢呢？”mhy立刻显出颓唐不安模样，脸上笼上了一层灰色，嘴里说些话；这回可是最喜欢舰长了之类，一些不懂了。在这时候，众人也都哄笑起来：店内外充满了快活的空气。"
"空中劈叉的咸鱼开拓者","男","无IP","167456161","6","崩坏：星穹铁道","10000","1","9","[热词系列_好耶]"
"鸽子星绅士","保密","无IP","11660332","6","原神","10000","1","11","什么东西！我发现了什么？！[原神_吃惊]"
"莫卡烦","男","无IP","452255148","5","","10000","1","","[热词系列_好耶]"
"账号已注销","保密","无IP","1452761547","0","","5000","1","","好耶[打call]！！"
"紫色猫耳玉衡星","男","无IP","73472826","6","","10000","1","","好[打call][脱单doge]"
"困倦的旅行者","保密","无IP","407128877","6","","10000","1","","[热词系列_好耶]"
"Su花不是花","保密","无IP","510033280","5","","10000","1","","明人不说暗话，我想白嫖[妙啊]"
"bili_501506075","保密","无IP","501506075","5","","10000","1","","什么垃圾，给爷整笑了"
"九天绝弦","保密","无IP","39589115","6","","10000","1","","离谱"
"太羽智梦","男","无IP","267689551","5","","10000","1","","原来我自己就是愚人众"
"不熟的糖碗星淇淋骑士","男","无IP","62799131","6","嘉然今天吃什么","10000","1","","好！"
"South丶birds","男","无IP","15354354","6","向晚大魔王","10000","1","","这次先不骂CH了[藏狐]"
"来栖晓雨宫莲花","男","无IP","77955223","6","EDG战队","10000","1","","节奏发展到现在这种时候，抓着两边正不正当手段干不干净其实意义不大，现在想方设法让自己持之以恒才是最有意义的。"
"南水告","男","无IP","4264734","6","2021拜年纪","10000","1","","大中午发的，米桑发动态不来句晚上好？"
"往事如风般逝去","男","无IP","251527861","6","花园Serena","10000","1","9","纳尼"
"盐海冰沙","男","无IP","455550298","5","","10000","1","4","得他们开学了，我们可能放假了，我听我老师说，可能会提前放假[呲牙]有好戏看了[吃瓜][吃瓜][吃瓜]"
"星与辰尘与土","男","无IP","175997273","6","","10000","1","","全是好评dddd"
"千胤集","男","无IP","434623311","5","星座系列：双子座","10000","1","6","好耶，另外给你们个传送门@崩坏3第一偶像爱酱 [吃瓜]"
"夕枫夜苑","女","无IP","228293429","5","","10000","1","","四月一号还想骗我？哼哼，太嫩了！,什么？！现在是六月十九号？？_(:з」∠)_"
"东云莲华","女","无IP","481903323","5","","10000","1","","草，好"
"以此烈火薪炎不灭","男","无IP","402309816","5","","10000","1","","加油 大家继续刷，要刷的上10万才行哦。"
"bili_501506075","保密","无IP","501506075","5","","10000","1","","吐口痰就走[吐]"
"望夕阳者","男","无IP","443578803","6","战双帕弥什","10000","1","","崩二？那加油吧!前排提醒，这里不是战场撤"
"识破through","保密","无IP","74055104","6","崩坏3・天穹流星","10000","1","12","什么？把大陆内的人当愚人是吧？愚人节活动也敢出就是为了恶心人是吧？"
"战魂天翔","男","无IP","438331866","6","","10000","1","","隔壁使魔也不过了玩玩"
"崩崩崩萌新小舰长","男","无IP","618697048","5","","10000","1","5","我去愚人节成真了。"
"沃日戈","保密","无IP","229582400","6","崩坏3・天穹流星","10000","1","7","卧槽！真的出了"
"背麻袋的小陈","保密","无IP","131249282","6","","10000","1","","若水呢"
"拾玖Nov","男","无IP","39281371","6","","10000","1","","若水呐若水呢！！！"
"萌新_墨\","保密","无IP","20623395","6","","10000","1","3","tnl学园gkd[doge]"
"醉P不知天在水","男","无IP","27993860","6","良辰美景・不问天","10000","1","3","剧场开始，请选择你的英雄有序入场"
"Lokae","男","无IP","57242263","6","贝拉kira","10000","1","","精准对冲要是有用，节奏4月就应该结束了[吃瓜]现在可不就是带航海时代咯,官号动态看得，官号动画怎么看不得？前者下头可惨烈多了。,建议各位普通人自觉关弹幕不看评论[吃瓜]。一来mhy自作自受，二来你控制不了别人只能控制你自己[吃瓜]你的每一条出警和对线都是在毁坏你想要的观看环境喔"
"风雪千姬","保密","无IP","175835866","5","","10000","1","9","好家伙"
"萤火虫琪亚娜","保密","无IP","121264363","4","崩坏3・天穹流星","10000","1","","真有啊[哦呼][笑哭]"
"惠痴3号","男","无IP","352369576","6","","10000","1","","赤鸢的cc是谁啊"
"秦心Shin","男","无IP","15602744","6","","10000","1","","好耶!"
"爱上时崎狂三","男","无IP","14842771","6","","10000","1","","除了复制粘贴还是复制粘贴，废物"
"羽辰丶SK","男","无IP","32843549","6","","10000","1","","好耶[doge]"
"-杠精本精-","男","无IP","479017447","5","罗小黑战记","10000","1","","？？？这不是愚人节发的吗？？？"
"b站的爸比","男","无IP","177636402","6","","10000","1","","那个吸血鬼人偶现在看好像芽衣[笑哭]"
"螺旋丸仙人","保密","无IP","1645746181","3","","10000","1","","什么时候死啊？"
"白色的的的的的","保密","无IP","671653342","5","魔法学院","10000","1","","这是啥？[脱单doge]"
"丶Vvvvv2v的加特林","保密","无IP","12826405","6","","10000","1","11","好耶[崩坏3_快乐][崩坏3_快乐]"
"四季4SEASON","男","无IP","249489969","5","崩坏3・天穹流星","10000","1","8","愚人节出的pv我还以为是假的"
"余无音","男","无IP","22919047","6","崩坏3・天穹流星","10000","1","12","好耶[打call]"
"一缕心弦","保密","无IP","344984644","4","","10000","1","","还要20天 好久啊"
"神算子d依白","女","无IP","29462198","6","","10000","1","","贝拉！！贝拉"
"御坂13751号","女","无IP","475582336","5","崩坏3・天穹流星","10000","1","","小特天下第一[崩坏3_干杯]"
"怠惰的黑猫","女","无IP","151306471","6","","10000","1","8","又是泡面，可恶，给我拍小说和主线啊kora"
"高性能小邪神desu","保密","无IP","130947016","6","崩坏3・天穹流星","10000","1","","游戏也不玩了，只能看看番了"
"账号已注销","保密","无IP","1409269913","0","","5000","1","","某些其他游戏的拱火人，我呢是建议你们去原神的评论区拱火，在这里拱只能显得你们很拉"
"bbbbronya","男","无IP","8555153","6","hanser","10000","1","","没啥好冲的。讲真，至少人偶们没啥黑点。咱们也应该久违的来放松一下下了，省的来气。"
"安娜单推人","保密","无IP","480478026","5","向晚大魔王","10000","1","6","孝嘻了，不会真有人对数据发情吧？"
"凡石上的灵木","男","无IP","85472920","6","星座系列：巨蟹座","10000","1","","83级了，1只[歪嘴]"
"夏志13","保密","无IP","2018003","6","","10000","1","",".×÷PvZ_Tools_v2.3.4,±ó÷v2.6.0.5,òPlantsVsZombies.exe・,.°°ê÷÷±,bugò・§ò±,ó,.÷á¨・・¨°,.°±CEmto÷・òá,°í±"
"远D","男","无IP","702385710","5","","10000","1","","卧槽，上次愚人节发的，日期还不可能，没想到是真的[惊讶]"
"账号已注销","保密","无IP","674004253","0","","5000","1","","ttk！yzmttk！"
"玲珑晓白","保密","无IP","67965149","6","早稻叽","10000","1","","什么？刚放假就开学了？还要自我介绍[doge]"
"火锅里的鱼片","男","无IP","383047971","5","","10000","1","","罗德岛幼儿园呢？gkd！"
"激萌阿虎V3","保密","无IP","85777008","4","","10000","1","","冲烂这个狗动画"
"枫缘夕","保密","无IP","32741372","6","","10000","1","8","好耶好耶"
"异之七彩","男","无IP","154182143","5","","10000","1","","若水:???"
"坐等西南风","男","无IP","457284201","5","","10000","1","","游戏继续玩但一毛都不会再氪了策划接着骂动漫就看看"
"Minase_Paru","保密","无IP","293662356","6","崩坏3・天穹流星","10000","1","","？？？还真有了"
"贱贱的加菲猫","保密","无IP","22195542","6","","10000","1","","我就想知道西琳肿么了，疯狂砸键盘[呲牙][呲牙][呲牙]"
"会写诗的绵羊","男","无IP","449737371","5","崩坏3・天穹流星","10000","1","","刚从群里面过来[抠鼻]"
"绯乐喵","保密","无IP","13798965","6","星座系列：射手座","10000","1","","好耶"
"黑夜璀如白昼","女","无IP","219578733","6","中国绊爱2nd纪念","10000","1","","居然是真的啊！！！！！！！！"
"镧系金属","保密","无IP","500000489","5","hanser","10000","1","","小祖宗睡醒了！"
"没名了好难过","男","无IP","448326960","5","","10000","1","","原来之前那个是真的吗[笑哭]"
"-老嘤捉小稽-","男","无IP","282097985","6","","10000","1","","看起来是个沙雕番[doge]"
"幻想华乐","保密","无IP","402173665","5","崩坏3・天穹流星","10000","1","","你们这个是什么游戏啊，你们这是害人不浅啊，你们这个游戏.麻烦你们，真的太过分了你们搞这个游戏干什么,一天到晚啊搞这些什么游戏啊动漫啊会害死你们哒!你们没有前途我跟你说你们这四百多个人好好学习不好吗,一天到晚崔主网有什么意思有，什么意思啊。麻预你们重视一下你们生活的目标好不好有一点学习目标好不，一天到晚上网是不是人啊，你们一天到晚上网[doge][doge]"
"可爱的摩卡莫莉","保密","无IP","122610216","5","","10000","1","","好耶[吃瓜]"
"木生EshAn","保密","无IP","1754185460","5","","10000","1","","无聊的人又开始刷存在感了，喜欢一直提tnl建议直接左拐"
"梦里行云","男","无IP","27347940","6","","10000","1","4","感觉像是希儿一日游的画风？？"
"炎芊羽","女","无IP","186714001","5","崩坏3・天穹流星","10000","1","","[崩坏3_拜托了]"
"浅水蟹","保密","无IP","39271867","6","","10000","1","","鸡场又想搞这些未成年营业是吧"
"美少男战士D","男","无IP","351658195","6","至尊戒","10000","1","7","好起来了"
"衾孀","男","无IP","411284529","6","崩坏3・天穹流星","10000","1","11","[热词系列_好耶][热词系列_好耶]"
"过期Apian娘","男","无IP","26085097","6","新科娘","10000","1","","呵呵"
"掉了亿根头发","男","无IP","435416030","5","","10000","1","","当个动漫公司多好"
"螃蟹男神","保密","无IP","38530426","6","国民老公带回家","10000","1","","吃里扒外的狗东西，爬"
"uyuiusag","保密","无IP","414832113","6","精灵王","10000","1","","好耶"
"Citrus晴柚","保密","无IP","353294867","5","","10000","1","6","我永远喜欢小特 苍小玄 贝拉[打call]"
"h殇ノ","男","无IP","2907959","6","梦塔・雪谜城","10000","1","","一码归一码"
"W","男","无IP","38400865","6","三周年恋曲","10000","1","","好家伙，真出啊"
"混乱棉花糖总部","保密","无IP","351093236","5","","10000","1","","啊啊啊啊啊啊啊啊[打call][打call][打call][打call]"
"律x传说","男","无IP","227482450","5","","10000","1","","好耶"
"紫龙の","男","无IP","382381022","5","","10000","1","","我还以为是愚人节的视频给顶上来了呢[笑哭]"
"吾王醉了","保密","无IP","283368982","6","初音未来13周年","10000","1","","犹大好飒啊[崩坏3_糖葫芦][崩坏3_糖葫芦]"
"铁道第一偶像维里塔斯","女","无IP","32271869","6","崩坏：星穹铁道","10000","1","7","[热词系列_好耶]超期待"
"世虞子","男","无IP","339818799","5","","10000","1","","这是动漫区啊，冲这里官方也不会看的，住手啊，我只是路过来看个番[笑哭]"
"亚空的征服者","男","无IP","914283","6","崩坏：星穹铁道","10000","1","12","还有个凯文人偶！！"
"坐等西南风","男","无IP","457284201","5","","10000","1","","为什么贝拉至少带一下连个台词都没有"
"家用电脑","保密","无IP","33301078","6","","10000","1","7","不是爷的若水呢？"
"格雷海月","保密","无IP","445532097","5","","10000","1","","新番预告看上去不错，但你态度不行。"
"苏格拉底不想死","保密","无IP","164695711","5","","10000","1","","赚钱了终于捡起做动画的初心了吗[大哭]"
"-无奏-","保密","无IP","37060331","6","C酱です","10000","1","","所以说，你们都不玩了，为什么还要来冲呢？自己逼自己看不难受？"
"暴走哈基米","保密","无IP","627172104","4","","10000","1","","好耶"
"独孤丨月","男","无IP","16583448","6","原神","10000","1","","米哈游真是让人又爱又恨[doge]"
"叶好人","保密","无IP","170282190","6","崩坏3・天穹流星","10000","1","","啊啊啊啊啊啊！追番！！！"
"亚空的征服者","男","无IP","914283","6","崩坏：星穹铁道","10000","1","12","武装人偶们！！好耶！"
"超级无敌大爱莉","保密","无IP","310286599","5","星座系列：双鱼座","10000","1","","不错不错白嫖[doge]"
"取新名字真费劲","男","无IP","325671989","6","","10000","1","","好！！！！！！！！！！！！"
"横扫千星の城主酱","男","无IP","277060094","6","","10000","1","10","[热词系列_知识增加][热词系列_好活][热词系列_芜湖起飞][热词系列_三连][热词系列_打卡]"
"东神c","男","无IP","248018281","6","刺客伍六七","10000","1","10","直接好耶！"
"红色惊叹收集者","保密","无IP","285932","6","2021拜年纪","10000","1","","犹大和赤鸢这两个非氪金人偶居然也有戏份？"
"衾孀","男","无IP","411284529","6","崩坏3・天穹流星","10000","1","11","举报cd了，大家加油"
"衾孀","男","无IP","411284529","6","崩坏3・天穹流星","10000","1","11","[热词系列_好耶][热词系列_好耶]"
"为什么我总是不中奖","女","无IP","39242354","5","","10000","1","","[脱单doge][脱单doge][脱单doge]"
"鹿鸣Iris","保密","无IP","387608736","6","","10000","1","10","好耶，动画化了，果然不只是愚人节快乐~"
"菠萝屋的海绵","男","无IP","44727178","6","","10000","1","","这玩意儿居然还是真的[惊讶]"
"星白アキラ","保密","无IP","398524319","5","","10000","1","","听说我刷不到的圣遗物都跑爱酱评论区来了"
"DucdeReims","保密","无IP","407715782","5","","10000","1","","属实是顶上战争了"
"咸矿泉与淡水鱼","保密","无IP","651530065","5","","10000","1","","别做游戏了，改行做动漫不好吗[妙啊]"
"北区第一指挥","男","无IP","274250902","6","","10000","1","","？ 我直接化身动漫米卫兵[藏狐]"
"落谋","女","无IP","277365804","6","","10000","1","","好诶！！！[热词系列_好耶]"
"梓にゃん","保密","无IP","677903808","5","hanser","10000","1","","能不能长一点[崩坏3_开心]"
"账号已注销","保密","无IP","487150713","0","","5000","1","","冲（完)了[doge]"
"--Kadi--","男","无IP","347984207","6","","10000","1","7","当你们都以为是愚人节笑话结果却不是的时候，这何尝又不是一个愚人节笑话(=ω=)BV19Z4y1F72E"
"歌者omn","保密","无IP","259452865","6","2021拜年纪","10000","1","7","今天就是天王老子来了我也要追"
"魔法少女丶miku酱","保密","无IP","16964410","6","初音未来13周年","10000","1","","太棒了[初音未来_nice][初音未来_加油][初音未来_GKD][初音未来_干杯][初音未来_期待][初音未来_喜欢][初音未来_抱抱]"
"欲氙","男","无IP","278034342","5","崩坏3・天穹流星","10000","1","","好耶"
"v使日薄西山","男","无IP","12087145","6","崩坏3・天穹流星","10000","1","7","愚人节企划成真了[崩坏3_吃惊]"
"爱因斯坦不说谎","男","无IP","314140191","6","","10000","1","5","我靠！新番耶~[喜欢]"
"云起丶风飞扬","男","无IP","285462578","6","崩坏3・天穹流星","10000","1","9","好耶[doge]"
"爱首忆1","保密","无IP","353299283","6","","10000","1","11","什么奇怪的番剧[辣眼睛][doge]"
"旧城以西的空城","保密","无IP","97535635","6","","10000","1","","好耶[2233娘_耶]"
"我做你的","男","无IP","134211093","5","","10000","1","1","不会吧不会吧，真的有人护着一个不敢直视玩家的官方吧，打一下给个枣就好了？给个枣就不生气了？如果真的有种人，那建议您这边去宠物医院检查一下脑子"
"夏悠言12138","男","无IP","184054601","5","","10000","1","","芜湖"
"诚信无私奉献","保密","无IP","547189908","4","灵笼","10000","1","","一人血书第二次崩坏大电影[打call]"
"天远青山暮","男","无IP","46027269","6","","10000","1","5","冲冲冲[打call]"
"氪金西内","男","无IP","562071967","5","崩坏3・天穹流星","10000","1","","4月1号那天居然不是开玩笑吗的。好耶[崩坏3_干杯]"
"z_XI","男","无IP","36998442","6","碧蓝航线2020","10000","1","3","原来仿犹大的配音是芭芭拉吗哈哈哈哈哈哈"
"缘桌骑士","保密","无IP","40386326","5","","10000","1","","好耶[打call]"
"北区第一指挥","男","无IP","274250902","6","","10000","1","","这不是愚人节玩笑？垂死病中惊坐起，好。"
"新月睚眦","男","无IP","2022434","6","初音未来13周年","10000","1","","不冲二创[雪未来_等一等]"
"橙色最终","保密","无IP","25520401","6","","10000","1","","气抖冷。人偶都动画化了隔壁巴比伦学院什么时候安排上啊（恼）"
"统御家","男","无IP","3285881","6","","10000","1","","没水晶不看[藏狐][藏狐]"
"猥琐的狗头","保密","无IP","13017117","6","","10000","1","","盲猜一小时后这里会变成战场，虽然现在还一片祥和[doge]"
"一般通过右鹭","女","无IP","478096953","5","EveOneCat2","10000","1","","好耶！"
"玉米例","男","无IP","45004863","6","","10000","1","","不要人偶学院，我要第二次崩坏。我瓦尔特，愿成为人类之盾向你宣战"
"不河里","男","无IP","475391828","5","","10000","1","","米哈游动漫公司终于要干点正事了嘛[doge]"
"还想再睡一下","保密","无IP","5621416","6","","10000","1","","米哈游本来就不是游戏公司，这波是不忘初心[doge][藏狐]"
"爱莉希雅EIysia","保密","无IP","687832811","5","","10000","1","","当时还以为是假的呢，没想到是真的 [尴尬]"
"缘桌骑士","保密","无IP","40386326","5","","10000","1","","我tm直接追番[脱单doge]"
"汝妻污养之","保密","无IP","338221831","6","","10000","1","","我的餐桌泡面番呢[登门喜鹊_emm]"
"暗中观察人事部会长","保密","无IP","40648072","6","崩坏：星穹铁道","10000","1","7","艹还真有动画，可以看小祖宗了"
"黑馆泽依","男","无IP","360751174","5","神SMea","10000","1","","我崩坏大电影呢我崩坏大电影呢我崩坏大电影呢两年前看见的规划书现在有没有消息了"
"Ko1shi_","保密","无IP","85303780","6","","10000","1","","盲猜有人说评论区被xz占领然后开始阴阳怪气[吃瓜]"
"mc","男","无IP","117027604","5","","10000","1","","[热词系列_咕咕][热词系列_咕咕][热词系列_咕咕][热词系列_咕咕][热词系列_咕咕][热词系列_咕咕][热词系列_咕咕][热词系列_咕咕][热词系列_咕咕][热词系列_咕咕][热词系列_咕咕][热词系列_咕咕][热词系列_咕咕][热词系列_咕咕][热词系列_咕咕][热词系列_咕咕][热词系列_咕咕]"
"痛苦实验期","保密","无IP","87191995","6","崩坏3・天穹流星","10000","1","8","听到了吗？不要在芭芭拉的地盘乱来[doge][doge][doge]"
"mc","男","无IP","117027604","5","","10000","1","","[热词系列_咕咕][热词系列_咕咕][热词系列_咕咕][热词系列_咕咕][热词系列_咕咕][热词系列_咕咕][热词系列_咕咕][热词系列_咕咕][热词系列_咕咕][热词系列_咕咕][热词系列_咕咕][热词系列_咕咕][热词系列_咕咕][热词系列_咕咕][热词系列_咕咕][热词系列_咕咕][热词系列_咕咕]"
"洪水淹了龙王庙","女","无IP","565395455","5","星座系列：双子座","10000","1","","[热词系列_好耶]是新动画！好耶！好耶！好耶！[打call][打call][打call][打call]"
"姜氏之子","男","无IP","383419685","6","洛天依9th生日纪念","10000","1","","好家伙[热词系列_知识增加][热词系列_知识增加]#人偶学园#"
"ZhongApocalypse","男","无IP","6751249","6","hanser","10000","1","3","《关于因为女武神餐桌鸽了太久所以今年只能是武装人偶来出场的这件事》"
"l1-ke","男","无IP","52144615","6","","10000","1","","评论区里真是一片和谐捏[给心心]"
"鹧__鸪","男","无IP","351735635","5","星座系列：双鱼座","10000","1","","女武神餐桌第三季能安排一下吗"
"孤星灬","保密","无IP","249213161","6","","10000","1","","给爷4"
"mc","男","无IP","117027604","5","","10000","1","","[热词系列_咕咕][热词系列_咕咕][热词系列_咕咕][热词系列_咕咕][热词系列_咕咕][热词系列_咕咕][热词系列_咕咕][热词系列_咕咕][热词系列_咕咕][热词系列_咕咕][热词系列_咕咕][热词系列_咕咕][热词系列_咕咕][热词系列_咕咕][热词系列_咕咕][热词系列_咕咕][热词系列_咕咕]"
"阵痛的菊花","男","无IP","3019683","6","少前小剧场","10000","1","","建议开崩4得了，崩三让他烂在土里"
"不存在的花火","保密","无IP","40304906","6","少女前线","10000","1","","这同人做得很不错啊,嗯？[2233娘_吃惊]"
"青烟の歌","保密","无IP","349708136","6","","10000","1","","彳亍，米桑biss"
"分解分解分解","保密","无IP","21535875","6","","10000","1","","惊了！真有！带崩二使魔玩下嘛"
"风花雪月yu2","女","无IP","355210893","6","","10000","1","","什么ch祭天啊？这种话就忽悠忽悠XXS，这公司的高层都是烂的。pg歪的，就赶紧飞出去"
"二次元时间的开始","保密","无IP","434778571","5","","10000","1","","？？？好耶[星星眼]"
