"昵称","性别","IP","UID","等级","装扮","用户权重","获赞数","粉丝团等级","评论"
"会唱歌的云雀","女","浙江","403088353","5","","10000","0","","1w水多一点点下池捞出S1加专武，从仓库里捞出列泰列直接乐土上岗"
"殁","男","云南","1079336236","3","","10000","0","","华年逢殃，殁际逐星火，迁灭难戗。眠觉作鸢先行，旧种新长。故友诀去成孤月，独经岁，苦照廖苍。执命诛魔，柒芒会一，身形几丧。,,笑涕俱忘，渡尽八荒尘，挚情又盎。再临太虚锐锋，摒祛心障。终竟剑向篡权主，取骸影，明日始创。瘟神荫下，燃羽灼天，灾除惑戕"
"紫","男","广东","429396988","5","","10000","0","","新年有符华吗"
"阿文想睡觉-","男","江西","106409879","6","良辰美景・不问天","10000","0","","过年复刻不[藏狐]"
"故渊306","保密","上海","508625687","5","","10000","0","","毕业了，但是是羽兔[崩坏3・终焉归始_窒息]"
"是凝不是零","保密","贵州","306308946","5","","10000","0","","谁家圣痕连歪三个啊，爱酱你有什么头绪吗[原神_哼]"
"我的密码是-","保密","福建","1440864680","4","","10000","0","","准备了21抽，没出，现在是剩余47抽必出[藏狐]"
"我代言邪恶","男","江苏","2189894","6","","10000","0","","砸光水晶圣痕全了没专武，有什么过度的吗，过年再补了[笑哭]"
"八重之月","保密","黑龙江","91720239","6","星座系列：双鱼座","10000","0","","老子武器技能呢？"
"崩坏3第一深情奥托","男","江苏","111984278","6","","10000","0","3","嗯啊，所以真理什么时候扩充"
"宅猫提尔","男","广东","29960614","6","","10000","0","6","乐土普攻流拿个刹那加攻速，符师傅今日要打几十个[脱单doge][脱单doge]"
"RE-LIEF-","保密","福建","149231642","5","","10000","0","","萌新提问，2S符华毕业装备，S0真理毕业装备，差一个辅助是用渡鸦还是爱衣(有渡鸦全套，爱衣一件没有，顺带一提连猫环都没[委屈])"
"黄金的光泽","保密","辽宁","1724554811","5","","10000","0","","为第一部最后的角色，献上100抽c(°°)ノ"
"伯特利-道尔","保密","河南","1256611233","3","","10000","0","","10连抽，成功中了之前积攒的29抽内的保底[墨镜]"
"穆枭sama","男","云南","252346010","5","","10000","0","","死生，真理，渡尘全是最后十多发才出的，同样的玩，舍友每次一发十连就出，要不要那么杀熟，我是真破防了[大哭][大哭]"
"一只路过的阿尔加利亚","男","安徽","1070294718","5","2233幻星集","10000","0","","三种架势加一个格挡……你是符华还是堇紫泪滴？"
"-游戏就只是为了游戏-","保密","天津","22243906","6","三周年恋曲","10000","0","","小识：这可是最强的符华，我妈厉害吧！[热词系列_肥肠自信]"
"东方星痕","男","广东","1886878","6","崩坏：星穹铁道","10000","0","","啊？你怎么知道我10抽就出了？"
"铅笔盒军团","保密","浙江","6469952","6","原神","10000","0","10","兄弟们 攒的6w水，230发下去，10个崩华[脱单doge],现在起我就是米卫兵了[脱单doge][脱单doge][脱单doge]"
"万抽无金策天凤","男","安徽","310010587","6","刀说异数","10000","5","3","全新生物属性火焰元素伤害S级角色「浮生・渡尘之羽」登场！,历历浮生，无非败而后成。,经此万年，于异星的天际，「原初」的羽翼将再次振翅而飞。,,今天，就有请识之律者女士来为大家介绍她的作战技巧吧！,,配音演员：,识之律者――Mace"
"Away丶阿伟","保密","浙江","313219165","5","","10000","0","","上正式服前又被削了，真有你的"
"-Boge-","男","天津","14480437","6","约战・狂三","10000","0","","不是奥托解说我不听"
"伊丽莎白卡拉图兰","保密","湖南","354509030","5","","10000","0","","两个十连俩[脱单doge]她心里有我"
"坚定支持米哈游","男","江苏","170905135","6","崩坏：星穹铁道","10000","0","9","30发，角色+专武，没有圣痕[吃瓜]"
"糖醋椒盐SoySauce","保密","浙江","248960107","5","","10000","0","","新号抽了140抽左右，人物和装备毕业，无装备云墨包菜，高级区勉强苦痛"
"落渊明","保密","浙江","123168148","5","","10000","0","","20000氵毕业，还剩12000氵"
"虞聊生","男","河南","29670486","6","","10000","0","","为何我没有武器池？"
"萌之上即是荡漾物语","保密","四川","120126582","5","","10000","0","","终于第一次十连就抽出来[脱单doge][脱单doge][脱单doge][脱单doge][脱单doge]"
"G白鳞祈","男","上海","143706873","5","","10000","0","5","最强？都不肯放太虚剑神，还是不是最强状态[崩坏3・终焉归始_咀嚼]"
"沐_遮","保密","安徽","436252167","4","","10000","0","","十抽已出"
"神梧桐","男","广西","362221088","6","洛天依9th生日纪念","10000","0","","，三把武器[大哭]"
"巳zzzz柳","保密","山东","3537112760584660","3","","10000","0","","哇偶，好看的呀[爱心]"
"苦痛三扛把子","保密","四川","67629411","5","","10000","0","","总感觉打击感越来越差了，只是感觉因为我还没上游戏体验"
"唐泽雪","保密","浙江","179513951","6","hanser","10000","0","","整得跟赛尔号精灵一样"
"是侯泽宇啊","男","河北","30680105","6","","10000","0","","问问清楚，符华洗什么词缀？别和上次大月下似的又白洗了[笑哭]"
"悠哉悠哉老咸鱼","保密","新疆","1939461","6","","10000","0","","哪怕是最强的符华胸口依然和钢板一样没有起伏[doge][doge][doge]"
"一只bro","保密","安徽","94767965","5","","10000","0","","啊~真威武啊"
"归元道尊","保密","广东","447539246","6","","10000","0","","符华在队里循环到底怎么连招啊 属实没玩明白[藏狐]"
"幽幽子级恐暴龙二号舰","保密","山东","3266947","6","雪未来","10000","0","","歪了，歪了，干李良[大哭]"
"咕咕咕顾小墨","保密","江苏","20093787","6","","10000","0","","所以UI替换选项在哪呢？"
"纯欧血脉","女","西藏","84115365","5","一周年纪念装扮","10000","0","","单抽符华，十连两专武＋圣痕上"
"污渍永远的神点点点","保密","山东","602186928","5","","10000","0","","我玩希儿的没有聚怪乐土不会吧咋办[笑哭]"
"小布小布小布在吗","保密","安徽","1532665888","4","","10000","0","","有中下，上用什么替代？用列文虎克还是拉格纳？"
"帅理智","男","广东","89931839","6","原神","10000","0","11","去年真理亏损丝了170抽s0差个中，今年150抽s2毕业还行吧"
"军酩","保密","山东","1553313559","5","一周年纪念装扮","10000","0","","妈妈生的，精准池四连歪，圣痕武器一个木有，刷了一下午的英桀试炼我真的吐了[无语]"
"灰い狐フォックス","男","四川","512800545","5","EveOneCat2","10000","0","","改ui"
"天魔魔龙","男","广东","8162028","6","约战・狂三","10000","0","","没有符华，都是希儿"
"溯GL8","保密","贵州","410470345","5","","10000","0","","水晶抽完卸载了，我的崩坏3完结了"
"圣邪lol","保密","浙江","23953558","6","少女前线","10000","0","","来了"
"吾愿已了","保密","广东","17225381","6","","10000","0","","60出角色，50装备毕业[doge]"
"栀子在努力学习吗","女","山东","1194851975","4","","10000","0","","大佬们，萌新现在2w氵，要抽符华吗，还是留氵等过年？"
"奥托主教请接帽","男","四川","675156603","5","刺客伍六七","10000","3","","剩余15抽必出,哥们有什么头绪吗( )"
"祈铭心","男","湖南","109123868","6","2021拜年纪","10000","0","11","1.9w水啥也没捞到[微笑][微笑][微笑]"
"膨胀的peng","男","重庆","375132826","5","","10000","0","","好消息：20抽出了崩落华,坏消息：抽武器全是武器[星星眼]"
"我永远郅工朕倍莉特","男","山东","301818749","5","","10000","0","","伟大的识之律者女士[doge]"
"绕指柔剑","男","云南","28072333","6","请吃红小豆","10000","0","","没抽到"
"二哈不吃鱼","男","天津","384247167","6","","10000","0","","这个小识怎么像ai配音，，，，被强迫的哈哈哈"
"职业搓澡工笑哥哥","男","浙江","35711833","6","","10000","0","","冲了2000还没毕业呢[热][热][热][热]，甚至只有s1"
"国际Nobody大师","保密","广西","7749424","6","","10000","0","","一发入魂[歪嘴]前来还愿，再许愿专武"
"古月川儿","女","上海","579748961","4","","10000","0","11","[2023]"
"桃子没核啊","保密","浙江","3493140113656587","3","","10000","0","","她大招的伤害和消耗的生命值挂钩吗"
"Black__Star_","保密","江西","261502067","5","天官赐福动画","10000","0","3","抽了一个圣痕中两把武器[tv_思考]加上自选箱就差一个圣痕就能毕业了，但是没水了"
"符华上仙吖","保密","四川","1176896227","2","","10000","0","","15000水就一只。。。。。。。[笑哭]"
"春日雨夏蝉鸣","男","黑龙江","32378518","6","崩坏3・天穹流星","10000","0","","抽了几根毛[大哭]"
"小心迦","保密","山东","1744807933","4","","10000","0","","[大哭][大哭][大哭][大哭]你们怎么这么欧"
"支配律者114514号","保密","山东","499236390","5","","10000","0","","词缀洗啥？攻击还是生命，我群友有说大生命的"
"最爱的鸭鸭","男","四川","350992491","5","","10000","3","","五十抽啥都没有[大哭]"
"蝶火不息","男","广东","1402420632","4","","10000","0","","[OK]"
"爱莉希雅的死忠","男","陕西","504237611","5","","10000","0","","一万多水没一个符华"
"焱雨p雪","保密","湖北","2990919","6","","10000","0","","60发毕业s0符华，感觉这是最欧的一次了[doge]"
"越过银匙之门","保密","山西","608723","6","原神","10000","0","","圣痕齐了，没武器。没事，符华妈妈完全可以用识宝宝的神之键对吧"
"大洋布瑞恩","保密","广西","19179024","4","","10000","0","","这是拜早年么，还没过年就这么欢乐了"
"沈小璞","保密","安徽","1936015882","4","","10000","0","","RTQAUJSJ2ZUX"
"一汀烟雨杏花寒w","男","山东","153208335","6","2233白色情人节","10000","0","10","第二"
"蓬莱山牙医","保密","贵州","3493143160817774","4","","10000","0","","80抽差评[tv_吐血]"
"芊墨麦茶","女","浙江","289415406","5","","10000","1","","识之律者女士万岁[打call][打call]"
"清啊静","保密","广东","353876785","5","","10000","0","","4把武器了，别来了[笑哭]"
"诚如是而言","男","湖南","4993394","6","Kizuna AI","10000","0","11","21发出，谢谢您嘞[打call]"
"祈铭心","男","湖南","109123868","6","2021拜年纪","10000","0","11","1.9w水啥也没捞到[微笑][微笑][微笑]"
"叱咤星海鱼猫猫","保密","浙江","65402958","5","星座系列：天蝎座","10000","0","","火系太多能用了还是得等月下"
"符华的天命之人","保密","四川","510063830","5","","10000","0","","有武器，圣痕是刚需吗？真的很喜欢符华啊[脱单doge]萌新探头"
"子曰非~","保密","湖北","44406581","5","一周年纪念装扮","10000","0","","六十抽送圣痕，但是我三十抽出了阿华，那接下来三十抽，我要继续嘛[笑哭][笑哭]"
"游手-浩闲","保密","北京","340407230","5","","10000","0","","我一万水晶没出一个，请问一下是我的问题吗？"
"小晗不坏","男","内蒙古","289449367","6","","10000","0","","物理抖动回来了"
"419605","男","广东","1270668627","5","崩坏：星穹铁道","10000","1","","十抽出了，谢谢老婆[保佑],华门[保佑]"
"Fightwithago","保密","安徽","32353477","6","","10000","0","10","声线有一种小识突然变得很淑女的感觉"
"幻x梦x泪","保密","青海","4118336","6","","10000","0","","200抽S2+圣痕[doge]"
"一叶知秋awa","保密","山东","401120326","5","","10000","0","","抽到了就是不会用，呜呜呜"
"我滴个娘啊","保密","湖南","184841719","5","","10000","0","","来啦来啦[doge]"
"空空不白","保密","北京","628382791","5","","10000","0","","160抽s2结束，2.0随他去了。"
"墨羽qy","保密","河北","442458537","5","","10000","0","11","第一"
"殁","男","云南","1079336236","3","","10000","0","","浮生历为往世英，,赤鸢常守州中灵。,千岁过隙苦怆去，,仙鸟涅破娑影。"
"课本处处有RJ","男","河北","385367696","6","洛天依・最美的夜","10000","0","","十抽出了，但是武器和圣痕一个没有[藏狐]"
"w天的牧师","男","吉林","295630925","5","泠鸢yousa","10000","0","5","好久没看过这个系列了，为了符华再看一次。"
"大白吐奶糖^","保密","湖南","161111783","6","国民老公带回家","10000","0","","大招没和普通攻击连携有点可惜啊，也是唯一一个进攻方式和大招无关的符华了[藏狐]，真・大招（点一下）[doge]"
"看到请叫我去学会计","保密","四川","171370353","5","","10000","0","","第一"
"北鹭渊","保密","山西","3493084778203238","4","EveOneCat2","10000","0","","40发角色20发武器+下，我现在应该抽20角色池哪个自选还是直接抽武器池"
"S天有汉","男","广东","109221186","3","","10000","0","","十连出了的话，是继续抽精准还是等过年复刻凑累消呢[思考]"
"大朵钩钩云","保密","江西","36453073","5","2233幻星集","10000","0","","历历浮生，无非败而后成。,今时往昔，凡障皆破！"
"HatsuneJoy","保密","广东","27719770","6","仲夏幻想","10000","0","","大保底，真障憬恫ぢ芷还橙"
"最爱披萨老师的雪莉","女","湖北","1589430686","5","","10000","0","","第一！"
"墨星月言","保密","广东","298723857","5","","10000","0","","仅一发十连就成功出货，只拿来当收藏的，我真是太酷了[墨镜]"
"就像喝了烈酒","保密","广东","20897802","6","三周年恋曲","10000","1","","识律跟崩落符华不是同一个人吗[doge]"
"梦のAき","男","广东","9810079","6","2233白色情人节","10000","0","12","一把十连出符华，没水晶抽武器圣痕[笑哭]，"
"萝莉爱好者","男","广东","65797","6","hanser","10000","0","9","最强也是最平[滑稽]"
"魂魄妖萌萌","男","四川","12366475","6","","10000","0","","180抽，wwnm"
"我的科技毁天灭地","保密","北京","28152110","5","","10000","0","","阿修罗霸皇拳。,,时隔20年，终于拿出来用了。我本以为会是魔兽世界先拿去用，结果居然是崩三，而且是符华，也算合情合理了。"
"放假时间可以吗","保密","江苏","530973908","5","","10000","0","","2万水晶一点儿没了[辣眼睛]只有武器，没有圣痕上中下[大哭]"
"我真的好喜欢符华","男","浙江","354726950","6","明日方舟","10000","0","14","符华，我的未婚妻！[神乐七奈_忘崽牛奶][崩坏3_开心][崩坏3_开心][崩坏3_开心]"
"千人律者127号","保密","浙江","1778050332","5","","10000","0","","爱酱我吃柠檬，20发符华毛都没有，给个迅羽或者崩华碎片也好啊"
"落Z枫","保密","江苏","89324920","6","崩坏：星穹铁道","10000","0","10","120抽五只[doge]难得欧一次"
"萨加希罗","男","黑龙江","20015589","6","","10000","0","","感觉玩的手法真是麻烦，游戏里教学最后的演示连招，看完完事后，自己操作，感觉难，尤其是那个长按闪避接普攻，有几次无法触发，不明白怎么回事。最后的三角色演示能打出70多万，自己操作33万，试了好几次，上不去，不知差了那步骤"
"子龙Official","保密","湖南","23250955","6","良辰美景・不问天","10000","0","","抽不起一点，攒了3w不知道等谁"
"渡尘平板真君","男","广西","27389307","6","","10000","0","9","池子太毒了，连着出了4把武器，人麻了"
"魔法少女贰狗","保密","安徽","21222940","6","雪未来","10000","0","","nmm的，整个新年cg我以为要祝我们舰长生日快乐，耐着性子看完最后没舰长事[无语]不过打发了我120水还行"
"Loeat","男","福建","233675411","6","","10000","0","12","不知在未来，符华统御的力量能不能有所体现"
"爱妃FWQ","保密","广东","102102365","5","","10000","0","","3万水晶就一个符华 三把武器 圣痕一直歪 4年每天在线玩家真的没动力玩了再见吧"
"玉露共霜","保密","吉林","444309739","5","良辰美景・不问天","10000","0","","要么你给所有火系角色加个点燃，要么你把那个逼点燃天忘了好不好[捂脸]"
"梦觉见花落丶","保密","广东","293862947","5","","10000","0","","[崩坏3・光辉矢愿_彩虹水枪][崩坏3・光辉矢愿_彩虹水枪]"
"灭霸娜","男","山西","39771472","6","","10000","0","5","80发没出，要保底了[大哭]"
"落魄的妖狐","保密","山东","39204801","6","","10000","0","","老年机苹果xr，iOS12.2，更新完后一直闪退，就是点进去直接就退出去了，被迫退游了[大哭][大哭][大哭][大哭]"
"账号已注销","保密","河南","3493124754115213","0","","5000","0","","刚入坑抽到了这个值得练吗[星星眼]"
"往生堂l胡桃","男","广东","85712966","5","崩坏3・天穹流星","10000","0","","符华池把终焉毕业了"
"八云罪歌","男","日本","11694133","6","","10000","1","","60抽还没出[大哭]"
"我永远喜欢琪亚娜丶","男","安徽","40675637","6","","10000","0","","一百抽毕业了，还出了双黄[doge]"
"尘世闲游-陵薮市朝","保密","江苏","1408235928","5","","10000","0","","全新生物属性火焰元素伤害S级角色「浮生・渡尘之羽」登场！,历历浮生，无非败而后成。,经此万年，于异星的天际，「原初」的羽翼将再次振翅而飞。,,今天，就有请识之律者女士来为大家介绍她的作战技巧吧！,,配音演员：,识之律者――Mace,[doge]"
"莱纳你睡啊","男","辽宁","194658864","6","","10000","0","","问个问题，崩符值得花五万水抽到ss吗"
"纸阳小白鼠","男","河南","403233800","5","","10000","0","","识之律者女士万岁[喜欢][喜欢]"
"梦起云纱石沉溪","保密","天津","259285382","6","","10000","0","","我问一下哈，我现在没有月卡，苦痛红莲升降，能不能在池子结束前弄三发十连"
"阿里叶叶","保密","重庆","2147382731","5","","10000","0","","[吃瓜][吃瓜][吃瓜]"
"万万没想到我是傻狗","保密","山东","10980010","5","","10000","0","","[妙啊]感觉这个符华有点花里胡哨啊"
"CHAINERCHAIN","保密","辽宁","15498568","6","","10000","0","6","[大哭]为什么每次双倍刻印我用符华都打不过，是太拉了么…武器抢的云墨丹心，圣痕少个中"
"斯麦陆斯麦陆","男","广东","308895790","6","良辰美景・不问天","10000","0","","[doge]"
"纸鸢_korschum","女","陕西","433349099","5","","10000","0","","今天大家的爆率好像特别高，奇怪"
"879922583","男","浙江","10823098","6","","10000","0","","3W6左右水晶毕业了S2崩落符华，但水晶只剩下960了......"
"吾妻爱莉希雅","男","安徽","250054771","6","仲夏幻想","10000","0","11","[打call]"
"宸琳018","保密","福建","3493077889059218","2","","10000","0","","[吃瓜]"
"红萌馆的管家","保密","河南","13366113","6","快把我哥带走","10000","0","","离保底80抽出的，然后1w5水晶单s毕业，望周知"
"无生往","保密","江苏","1297042344","4","","10000","0","","你怎么知道我八十抽屁都没有[歪嘴][歪嘴]"
"劾浣","女","湖北","15668257","6","","10000","0","2","寄了"
"行程问题","男","广西","396190666","5","明日方舟音律系列","10000","0","","华！！！！！！！我的华！！！！！！！"
"晓月悠风","男","河南","440612","6","至尊戒","10000","0","","满脑子都是膈肌膈肌膈肌~"
"g笑--","保密","陕西","297625578","6","","10000","0","","[doge]凉了"
"只求富贵","男","江苏","93851259","6","","10000","0","","你逼我退游啊...."
"身兼数职清洁工","保密","山东","508208443","5","","10000","1","","妈"
"逆天某某人","保密","江西","401498160","5","","10000","1","","真的丑，赶紧出符华的9k水皮肤"
"带着香菜呱","保密","辽宁","1488618334","4","","10000","1","","这个ui真的丑死了 手感也像史 不删是因为我推在他手里  要不是角色设计和剧情确实吊  这个逼ui改的高低给你冲烂[微笑]"
"kpoi佑","男","四川","1607917636","3","","10000","0","","话说回来，我们崩坏三玩家怎么从来都没有吐槽过强度膨胀的问题，而隔壁原神出个角色就在吐槽强度膨胀，强行出强度氪金。还说什么某个角色是某个角色机制怪。拜托，每个版本崩坏3都会给一个s级角色定制一个3s战场boss"
"值成","男","浙江","6990252","6","星座系列：双子座","10000","1","11","50抽人物+装备全齐了[吃瓜]我就奇怪为啥火系的大c都没点燃！太掉价了。"
"羁风尘","男","天津","672331992","5","一周年纪念装扮","10000","0","12","谁懂啊，230抽才SS，米哈游你真该死啊！屯屯鼠凭什么就这么非[笑哭]"
"木槿紫菀佩兰","保密","广东","384999","6","崩坏3・天穹流星","10000","0","13","[打call][打call][打call][打call][打call][打call][打call][打call][打call][打call][打call][打call][打call][打call][打call][打call]"
"寸劲开天肖战升天","保密","上海","413477522","5","","10000","0","","230抽SS2[妙啊]"
"这一别或许永别","男","福建","406937475","5","","10000","0","","是我理解错了吗？到了20必出s女武神，出s女武神了再20抽不是必出吗？"
"114514型号应急食品","男","广西","454509523","4","","10000","0","","20抽没出[大哭][大哭][大哭]现在没氵了"
"啊我记性不好","保密","河南","1336679115","5","","10000","0","","不好看"
"风雪11111丨1","男","安徽","2138177027","4","","10000","0","","1"
"紫罗兰斯洛特","保密","江西","188297291","6","","10000","0","","火符普攻流和分支流那个更强"
"夜与冰之歌","保密","广东","37826937","6","","10000","0","","6"
"香槐亦解忧l","男","江苏","381324370","6","","10000","0","","四万水没毕业，真尼玛好玩[星星眼]"
"关于不知道要叫什么","男","河北","455656792","5","","10000","1","","您觉得这合适吗？[辣眼睛][辣眼睛][辣眼睛]"
"这看乐子多事件美逝啊","男","河南","620750797","5","","10000","0","","剩余21抽必出,xdm有什么头绪吗[大哭]"
"长歌黎-Li","女","河北","174089657","5","","10000","0","","mad什么时候把这坨屎一样的ui改回去"
"啊露西法撒余","保密","山西","159992482","6","","10000","0","5","崩批"
"扣屁老登喝茉莉花茶","保密","北京","3493263216478649","3","","10000","0","","各位舰长来看小丑"
"屑猫猫rua","男","四川","97092937","6","2021拜年纪","10000","0","","垃圾界面改回来了吗？"
"沙雕541","男","福建","381656924","6","崩坏：星穹铁道","10000","0","","结算动作好拉，跟云墨比不了一点。"
"中国_科比","保密","江苏","435789748","5","","10000","0","","这是讲解角色的不视频，不知道某些人晒抽卡图刷什么优越感？估计都是只抽不玩的人，本来就没抽出任何东西，被你们这些人搞的心情很差[笑]"
"劳鲁安兹","男","广东","4141013","6","","10000","9","","给个旧UI的切换选项吧"
"你好我对你一见钟情","女","山东","588004102","5","","10000","1","","临时上线前又被大砍一刀，谢谢你ch，现在第一部的收官之作，最具有中国风的角色，同时也是我最喜欢的一个角色，火符被你砍死了。你现在开心了吧？你这个冷漠无情的人，我永远都不会原谅你，永远不会！,（转）"
"想抱莉莉娅的云天","女","山西","74126025","6","星座系列：天蝎座","10000","7","8","[崩坏3_幸福]今天玩新角色教学，不会点，莉莉娅在旁边喊笨蛋。莉莉娅真可爱！[崩坏3_星星眼][崩坏3_星星眼][崩坏3_星星眼]然后一起玩捉迷藏去了"
"武装蛇蛇","男","福建","17751501","5","","10000","0","","想让阿符用大腿夹脸"
"你好我对你一见钟情","女","山东","588004102","5","","10000","0","","加强s1强度[藏狐]（个人觉得强度一般般）"
"__琪亚娜_卡斯兰娜_","保密","山西","516983572","5","崩坏：星穹铁道","10000","30","","4房一位老兄的，顺带一提，本人20抽出了[吃瓜]"
"深海舌鲆鱼_心海","女","浙江","516046264","5","","10000","21","","谢谢，4发出"
"我有嬷瘾身","保密","广西","22842883","6","","10000","3","6","十连三金，我怎么会做这样的梦"
"-识","保密","河南","373177446","5","","10000","36","","这可是最强的老古董，所以她值得最好的"
"int_Sakura","保密","江苏","515052307","5","","10000","3","8","120抽ss毕业[崩坏3_路过][崩坏3・终焉归始_窒息]"
"磁爆步兵54","男","浙江","3443416","6","","10000","39","","这个好"
"梅花_Q","女","辽宁","43681957","6","","10000","21","","上仙也太平了吧[脱单doge]"
"芝麻酱詈焯","男","河北","14779546","6","白蛇2：青蛇劫起","10000","3","","在 送点氵不够用啊"
"一个路过的屑名字","男","江苏","498296386","5","","10000","2","","13抽已出，前来还愿[脱单doge]"
"肉松和肉柳是乖小孩啦","保密","广东","286041309","5","","10000","1","","一发十连[滑稽]"
"没梦想的吴锦","男","贵州","472690597","5","崩坏3・天穹流星","10000","1","","大家晚上好[脱单doge][脱单doge]"
