"昵称","性别","IP","UID","等级","装扮","用户权重","获赞数","粉丝团等级","评论"
"不是时常","保密","无IP","344375918","6","崩坏3・天穹流星","10000","282","","啊？？？？不是愚人节玩笑啊？？？？？！,wc血犹女儿我来了呜呜呜呜呜呜呜血犹世界第二可爱！！！！！世界第一可爱当然是吸血猫wwwwww"
"洛雨天云","男","无IP","430040760","5","","10000","385","","刚才打深渊时，看到B站发的消息，人偶学院pv。我就在想，愚人节不是早过了吗？,表情变化[疑惑][嘟嘟][打call]"
"德丽莎-吃土","保密","无IP","524009452","6","","10000","247","","游戏公司,动漫公司"
"EX香菜","男","无IP","470191486","5","","10000","139","5","emmm，我猜这个动画是个带私货的，人偶学院，从而引出天火人偶（小凯文，雾都假期出现过），然后实装到游戏，正巧辅助崩三的炎律，如果对了来刀我[doge]"
"洛樱殒汐","女","无IP","2066213","6","三周年恋曲","10000","118","","这支配剧场开了几个月了还在开，属实好活，经费给的足足的"
"__Citrus__","保密","无IP","303040232","6","","10000","44","","杜老师！是杜老师啊！杜老师我是你的粉丝啊杜老师！！！[脱单doge]"
"w磁悬浮呆毛w","男","无IP","294813760","5","崩坏3・天穹流星","10000","132","","关弹幕看的话观影体验肯定会翻倍[doge]"
"零的0次方","男","无IP","36000304","5","","10000","40","","苍玄伏羲,丹朱女娲,赤鸢精卫,请不要忘记她们真正的名字！！！[大哭]"
"再临的兔斯基","男","无IP","109640936","5","","10000","40","","不知道我的记忆有没有出错，貌似这家伙3个月下来新仇还是旧账一个都没解决[藏狐]"
"崩坏三第一偶像爱酱","女","无IP","274314436","6","","10000","357","7","好耶[打call][打call][打call]"
"_洛樱瞳","女","无IP","22958043","5","","10000","130","","这边又出番了？,原宝，学着点[脱单doge][脱单doge]"
"23_L","保密","无IP","404100067","5","崩坏3・天穹流星","10000","144","","我还信誓旦旦的在同学面前说这个绝对不是真的，又得倒立洗头了[藏狐][藏狐]"
"A取名真是难A","保密","无IP","59630903","5","明日方舟-愚夜密函","10000","514","","若水呢？我的若水呢？[星星眼]"
"观星大人tri","保密","无IP","507030457","5","","10000","36","","按热度那些被锁的热评只是金絮其外的假象，按时间才是败絮其中的事实"
"执羽羽羽羽羽子","女","无IP","73726813","5","","10000","244","6","再怎么我也要说[热词系列_好耶][热词系列_吹爆]诶，我就是开心，就是玩儿"
"LolicoNeet","男","无IP","4786210","6","原神","10000","139","5","四月一号愚人节我记得有个人偶预告来着，好家伙成真了[热词系列_妙啊][热词系列_妙啊]"
"o0___0o","保密","无IP","39281913","6","仲夏幻想","10000","43","3","有一说一，虽然流水没涨，但是深渊温度涨了，崩宝儿还是很厚道的[给心心][给心心][给心心]"
"午夜黑色","男","无IP","470151472","5","良辰美景・不问天","10000","179","","4月1那个竟然是真的[疑惑][疑惑]"
"gsc给老子切腹","保密","无IP","3944448","6","","10000","124","11","居然是真的。。话说原神漫画啥时候更新，还有bbb的神州小说呢"
"岂不妙哉","保密","无IP","404348","6","","10000","173","10","能不能带上崩2那一堆使魔啊[害羞]"
"NieR-stars","男","无IP","87684507","6","向晚大魔王","10000","1174","","79级了，只有一个人偶"
"姆下渊","保密","无IP","325045044","6","","10000","1088","8","当你以为是假的时候是真的，这也是一种愚人节[tv_doge]"
"龙隐梦殇","男","无IP","11252879","5","异常生物","10000","980","12","居然真有[笑哭],当你以为这是愚人节玩笑的时候，玩笑成真了，这亦是一种“愚人”[崩坏3_路过]"
"憨憨唯爱","保密","无IP","86935894","5","hanser","10000","928","","hanser又唱歌啦"
"雪瑟萧然","保密","无IP","11500870","6","格兰芬多","10000","912","6","踏马的，餐桌第三季呢！漫画也不更了，视觉小说也鸽了那么久，你们在干嘛啊啊啊啊！哼哼啊啊啊啊啊啊啊啊！[抓狂]"
"蕾姆尕天使","男","无IP","35634409","6","原神","10000","689","4","我只希望能长一点，不要OPED就占了三分之二[辣眼睛]"
"雷电派蒙","保密","无IP","22190454","6","椎名菜羽","10000","682","7","骂策划归骂策划，冲游戏归冲游戏，看个番可没策划，就安心看吧"
"好司机d","男","无IP","200648361","6","","10000","614","3","你都能做人偶动漫了 出个免费人偶不过分吧，这玩意的氪金s人偶比可肝的初始a人偶多合理吗。。。。"
"伊梦依人","男","无IP","22197763","6","洛天依8th生日纪念","10000","603","6","我以为是个愚人节笑话呢，居然还真有[崩坏3_点赞]"
"异空间第一巴拉巴","男","无IP","403765014","6","原神","10000","597","","当你认为自己被骗了的时候他没有骗你，这何尝不是一种被骗[脱单doge]"
"-不香的鱼干-","男","无IP","313033049","5","","10000","545","","不懂就问，为什么评论区热评们都那么亚撒西，按时间顺序却那么多人在骂呢？"
"GKD无聊看看","男","无IP","2994178","6","","10000","544","","B站现在比微博还能空评[吃瓜]"
"A取名真是难A","保密","无IP","59630903","5","明日方舟-愚夜密函","10000","514","","若水呢？我的若水呢？[星星眼]"
"箜陨","保密","无IP","240801962","5","绯赤艾莉欧","10000","510","","只要把我的氪金的钱退回来 劳资当场反水MVB[doge]"
"Sennyuki风早千雪","男","无IP","23938690","6","异常生物","10000","486","12","小祖宗！小祖宗天下第一！！！啊啊啊！！#人偶学园#"
"御坂17666号","男","无IP","197511329","6","hanser","10000","472","5","不要看评论这个世界都是美好的[OK]"
"璜珀","男","无IP","73749124","6","原神","10000","471","","叔叔的热评机制有够逆天的[辣眼睛]"
"米约尔","保密","无IP","1477590602","5","","10000","455","","10分钟之后再来，我看我还看不看得懂评论区[脱单doge]"
"文章爆护","男","无IP","609361630","5","多多poi","10000","445","","游戏该喷喷，番还是要看的[脱单doge]"
"请注意审题","男","无IP","38737070","6","大理寺日志","10000","419","","假的，那只鸟是平板，平板，平板，重要的事说三遍[崩坏3_点赞]"
"fyanbe","男","无IP","386373987","6","崩坏3・天穹流星","10000","397","8","好家伙，原来不是愚人节限定[doge]"
"洛雨天云","男","无IP","430040760","5","","10000","385","","刚才打深渊时，看到B站发的消息，人偶学院pv。我就在想，愚人节不是早过了吗？,表情变化[疑惑][嘟嘟][打call]"
"-御坂@-","女","无IP","8414863","6","","10000","376","","贝拉：我个5星人偶不配有一句台词？？？[辣眼睛],若水：别骂了别骂了，你好歹露脸了"
"莱鸡月","男","无IP","8687189","5","","10000","357","","刚刚测试了：充（）也是限制词汇"
"崩坏三第一偶像爱酱","女","无IP","274314436","6","","10000","357","7","好耶[打call][打call][打call]"
"半夜晨","保密","无IP","9196235","6","崩坏3・天穹流星","10000","322","","找你们这个整法，隔壁不会是出圣遗物学院吧？校长是你们最熟悉的生命防御真君？[疑惑]"
"相若无言","男","无IP","476656280","6","","10000","313","10","这晓月怎么一股皇女味[doge]"
"米浴__","保密","无IP","402388931","5","圣诞节快乐","10000","312","","人偶学园每集时长[吃瓜],↓"
"乐园の食客","保密","无IP","308799303","5","hanser","10000","311","","很明显，流水下来了，玩家前所未有的流失，以及可能快要出的崩四，必须的把玩家和口碑拉回来，前段时间的开池子发现没用，现在事情也快过了3月了，有的人累了，有的人心也开始软了，所以打打角色感情牌，一是尽可能的把人和流水拉回来，其次也是为了换回点口碑培养新玩家以至于崩四出的时候不那么惨。,,不过不好意思，我们这届玩家特记仇,复制粘贴......."
"神威CLANNAD","男","无IP","11940054","6","国民老公带回家","10000","311","","我担心评论区会不和谐"
"不是时常","保密","无IP","344375918","6","崩坏3・天穹流星","10000","282","","啊？？？？不是愚人节玩笑啊？？？？？！,wc血犹女儿我来了呜呜呜呜呜呜呜血犹世界第二可爱！！！！！世界第一可爱当然是吸血猫wwwwww"
"怨丶@刃","保密","无IP","39602560","6","","10000","282","11","看番就看番行吧，要冲去游戏官方跟游戏相关的动态下冲，这部番将是我十多年看番以来第一次关弹幕"
"德丽莎-吃土","保密","无IP","524009452","6","","10000","247","","游戏公司,动漫公司"
"执羽羽羽羽羽子","女","无IP","73726813","5","","10000","244","6","再怎么我也要说[热词系列_好耶][热词系列_吹爆]诶，我就是开心，就是玩儿"
"哔哩哔哩国创","保密","无IP","98627270","6","罗小黑战记","10000","243","","#人偶学园#定档啦！7月10日起每周六12:00，一起来看超萌的武装人偶呀~"
"の尼桑","男","无IP","39788079","6","","10000","237","13","居然 还真有啊[doge]"
"Zone-Tan","女","无IP","36877962","6","","10000","234","","我的天，每刷新一次，热评就改一次[尴尬]"
"夕色永远喜欢卡缇娅","男","无IP","10344062","6","","10000","226","11","做这种Q版粉丝向动画是只贴钱的，没啥引流能力。这种100%纯度的玩家福利，还是别来这里骂了。"
"小老弟有问题","男","无IP","179578272","6","崩坏3・天穹流星","10000","220","","@原神 凭什么提瓦特没有动画片？"
"东京人净爱撒谎","保密","无IP","19680431","6","","10000","218","","支持人偶超限！！！[热词系列_咕咕][热词系列_咕咕][热词系列_咕咕]"
"天使之翼恶魔之心","男","无IP","143147906","6","向晚大魔王","10000","214","2","咕咕咕"
"ManuRiber","男","无IP","302400617","6","三周年恋曲","10000","208","","人都是自私的 所以请把钱退给我就行了 我马上洗地[脱单doge]"
"尘世彼岸花","保密","无IP","108851973","6","","10000","200","8","当你以为是玩梗，实际上没有玩梗，也是一种玩梗[doge]"
"Moonlight_Walz","保密","无IP","36959981","6","","10000","200","11","愚人节玩笑居然变真的了[笑哭]"
"变成光守护卡芙卡小姐","保密","无IP","34952253","6","","10000","197","7","草了，这么多年了终于要有资金正儿八经地做动画了吗？mhy我劝你不要不识好歹，把第二次崩坏搞出来行吗？除此之外还能不能多多搞几个视觉小说，逆熵和神州折剑录行吗？没错我就是喂不饱的狼。[OK]"
"菲谢尔","保密","无IP","488790231","5","","10000","194","9","催催隔壁原神让他们也出点这东西"
"s1永恒","保密","无IP","16448978","6","公主连结凯露","10000","191","","奈斯[哈哈]什么时候来个崩坏大电影就完美了"
"熵-夜魂","男","无IP","316199971","5","魔法学院","10000","190","","新人快跑！！！[热词系列_知识增加]"
"封昭昭233","男","无IP","390502313","5","","10000","186","","这歌是Hanser唱的吧[doge]"
"和大的啊大","男","无IP","26957615","6","崩坏3・天穹流星","10000","183","","西琳打的第几关呀，哈哈哈哈(ω)hiahiahia"
"守护最可爱的七七","男","无IP","431233233","5","hanser","10000","179","","我记得你说的是四月末开播吧？鸽了也这么久？不得一集二十分钟谢罪？"
"午夜黑色","男","无IP","470151472","5","良辰美景・不问天","10000","179","","4月1那个竟然是真的[疑惑][疑惑]"
"再临的兔斯基","男","无IP","109640936","5","","10000","175","","历史是一个圆还是螺旋的我可能看不出来，但我知道下一批的魔怔人还会从你的玩家里出现。"
"岂不妙哉","保密","无IP","404348","6","","10000","173","10","能不能带上崩2那一堆使魔啊[害羞]"
"阿坎-奥古蒂姆","保密","无IP","79958733","6","崩坏3・天穹流星","10000","171","","为什么点赞少的评论总是在点赞多的评论上面[疑惑][疑惑]"
"当每个字都成为梗之时","男","无IP","14501298","6","崩坏3・天穹流星","10000","170","6","所以崩坏大电影啥时候安排上[崩坏3_疑惑]"
"Horizon邃宇","男","无IP","276405722","6","崩坏：星穹铁道","10000","164","9","趁敌军还没到，我先高兴一下"
"螃蟹男神","保密","无IP","38530426","6","国民老公带回家","10000","157","","玩这个游戏的不比那些装模作样吃瓜的人更有资格评论？为什么真正被伤害的人不能说出自己的心里话？？？"
"曦阳木鱼","保密","无IP","28665517","6","","10000","156","","热知识：崩三官方相关不看评论区关弹幕体验立升百分百[藏狐]"
"枫河柳","保密","无IP","23428585","6","","10000","155","","既然三个月都坚持下来了，那么还是很期待国服周年庆的时候会是个什么样子"
"残年哟","男","无IP","17107109","6","","10000","155","2","快进到人偶池轮流骗氪。"
"人类一定战胜崩坏","男","无IP","3829650","6","","10000","155","","爱玩玩，不玩喵"
"洲洲hQAQ","女","无IP","436549149","5","","10000","149","","希望多给贝拉和西琳戏份[鼓掌]"
"萤火虫琪亚娜","保密","无IP","121264363","4","崩坏3・天穹流星","10000","146","","哈哈哈，我还以为是愚人节玩笑来着[大笑][大笑][大笑]，竟然真的有！"
"歌者omn","保密","无IP","259452865","6","2021拜年纪","10000","146","7","给看动漫的玩家一个清静不行吗？一个个冲来冲去2个月都没看懂在冲什么"
"23_L","保密","无IP","404100067","5","崩坏3・天穹流星","10000","144","","我还信誓旦旦的在同学面前说这个绝对不是真的，又得倒立洗头了[藏狐][藏狐]"
"木糖酿成醇","保密","无IP","272485960","5","","10000","140","2","既然是人偶咱就说说人偶吧，除了最初的两个免费的，剩下出的人偶是不是全是氪金人偶啊？"
"清柠魔","男","无IP","89214384","5","","10000","140","","就等着出大电影了[滑稽]"
"EX香菜","男","无IP","470191486","5","","10000","139","5","emmm，我猜这个动画是个带私货的，人偶学院，从而引出天火人偶（小凯文，雾都假期出现过），然后实装到游戏，正巧辅助崩三的炎律，如果对了来刀我[doge]"
"LolicoNeet","男","无IP","4786210","6","原神","10000","139","5","四月一号愚人节我记得有个人偶预告来着，好家伙成真了[热词系列_妙啊][热词系列_妙啊]"
"系风","保密","无IP","191184767","6","想去海边・头像框","10000","133","","hanser又在唱儿歌了哦[崩坏3_红包]"
"梧桐景花","男","无IP","35218946","6","","10000","132","10","呵，又想骗我[无语]……G?！是真的?，我TM直接追番！[脱单doge]"
"w磁悬浮呆毛w","男","无IP","294813760","5","崩坏3・天穹流星","10000","132","","关弹幕看的话观影体验肯定会翻倍[doge]"
"天使的守护之翼","男","无IP","436925164","6","魔法学院","10000","131","5","我还以为上次愚人节真的是跟我开玩笑[笑哭]"
"_洛樱瞳","女","无IP","22958043","5","","10000","130","","这边又出番了？,原宝，学着点[脱单doge][脱单doge]"
"倾留蚁hhh","男","无IP","29077795","6","","10000","129","","女武神餐桌也搞快点呀～[OK]"
"风雨门","男","无IP","12509540","6","","10000","126","2","我甚至听不到一声晚上好"
"一个不孤独的人","保密","无IP","83528363","6","","10000","126","","发一条友善的评论[doge][doge][doge]"
"gsc给老子切腹","保密","无IP","3944448","6","","10000","124","11","居然是真的。。话说原神漫画啥时候更新，还有bbb的神州小说呢"
"孙骆驼","保密","无IP","2006928102","5","洛天依・最美的夜","10000","123","","扣帽子比思考容易多了。"
"观星大人tri","保密","无IP","507030457","5","","10000","122","","m闪电战：第一时间得到消息＋统一行动＋高度统一＋快速幽灵以达到歌舞升平的假象。"
"古鹰SS","男","无IP","179944351","5","","10000","120","1","感情米哈游什么都不能做，出个动画都要被说挡刀[辣眼睛]"
"我单推希儿哒","男","无IP","3217367","5","阴阳师海国之境","10000","120","","那个金色的人偶只配当一个背景板了吗[doge]"
"苏泠s","女","无IP","286270231","5","","10000","119","4","大电影什么时候出啊[笑哭][星星眼]"
"椎名千Qの日","保密","无IP","115676208","6","干物妹！小埋","10000","119","","终于想起来自己是动画公司了吗？做啥游戏？赶紧再多出个24集的二崩动画[吃瓜]"
"洛樱殒汐","女","无IP","2066213","6","三周年恋曲","10000","118","","这支配剧场开了几个月了还在开，属实好活，经费给的足足的"
"长岛冰灬茶","保密","无IP","318977350","5","","10000","116","7","我只希望有些人别乱冲，爱酱我已经取关了，随你们冲，番剧这边还是少刷点吧，留给还在玩的玩家一点清净吧[保佑][保佑][保佑]求求了"
"八雪小猫咪","保密","无IP","32982493","6","","10000","115","4","诸位，冲要冲对人，不要乱冲，看个泡面番大家都和和气气的好不好"
"zhuLR","男","无IP","35612873","6","","10000","114","","晚上好呀[大笑][大笑][大笑]"
"图书的牧羊管","男","无IP","39342249","6","崩坏3・天穹流星","10000","113","8","米忽悠重工名不虚传[脱单doge][脱单doge][脱单doge][doge][doge][doge]"
"洛水海惊鸿","保密","无IP","107842739","6","","10000","110","","钟离古战场,https://b23.tv/VEPAI2,https://b23.tv/6qChrn,https://b23.tv/uSOPqB,[嫌弃]"
"巴拉龟巴拉龟","男","无IP","287944006","6","明日方舟-愚夜密函","10000","110","","借理中客来拉偏架的行为是最为恶心的"
"天鞅ex","保密","无IP","1365230610","3","","10000","109","","许多舰长表示现在的氪金人偶数量明显不够，希望继续推出更多强力的氪金人偶[保佑]"
"Diaoserhui","保密","无IP","290812304","6","","10000","109","7","我就喜欢沙雕动画，不亏是我。"
"月影","保密","无IP","398901265","5","崩坏3・天穹流星","10000","107","","大电影什么时候来捏[傲娇]"
"内务部泰拉分部","男","无IP","106313834","6","明日方舟","10000","105","","评论翻完了，黑名单成功扩列50+[崩坏3_点赞]"
"秋色的红枫","男","无IP","349768802","5","","10000","104","","B站这个热评机制，是专门为带节奏弄得吧[无语]"
"霜系主神","保密","无IP","1278896251","2","","10000","103","","当你以为这是假的时候，给你来个真的，这也是一种愚人节玩笑[脱单doge][脱单doge]"
"L谷川千里x","保密","无IP","7824568","6","总之就是非常可爱","10000","101","","虽然我动态都是原神抽奖，但喷米哈游的都是水军，我纯路人[吃瓜]"
"缪缪我的缪缪-","男","无IP","454898448","5","明日方舟-愚夜密函","10000","101","6","↓人偶学园单集长度"
"又双-又双-","保密","无IP","470703069","5","","10000","100","","米哈游就一动漫公司，懂个屁的游戏[doge][doge][doge]"
"虚无-黑天鹅","保密","无IP","315631071","5","","10000","100","","米哈游动漫公司，啥时候也给原神整一个[tv_微笑]"
"一群大师","保密","无IP","392886951","5","","10000","98","","第一个小老师送的，良心,第二个犹大破盾加可肝,第三个晓月直接可以副c,之后小祖宗小若水小贝拉，连凹分流程都变了，哈哈哈哈这就是你米哈游的初心吗？快进到小炎律一刀破了冰律的盾"
"为太阳的光","保密","无IP","964782","6","","10000","97","","叔叔都麻了，这事你让业界随便一个公司来能做出这种事？ 我都不信"
"Trace溯影迹","女","无IP","433595570","5","明日方舟音律系列","10000","96","","BGM是Hanser唱的啊啊啊啊啊[打call][吃瓜]"
"肥宅G","男","无IP","13434835","6","至尊戒","10000","95","","太TM可爱了，话说，为什么人偶我每次都是100%超级大保底[大哭]"
"轻折影","男","无IP","30267304","6","","10000","95","","我怕派蒙误会[doge]"
"z_XI","男","无IP","36998442","6","碧蓝航线2020","10000","94","3","趁这评论区还乱着悄悄说一声,我好想当贝拉小姐的小猫啊[给心心][给心心],想想每天被贝拉小姐抱在怀里轻轻顺毛[tv_害羞],被她生气的时候踩在脚下[tv_调皮],用她那小小的黑丝小jio～[tv_流鼻血],啊～～～贝拉小姐～～,(不会有人看到的，对吧)"
"小肥羊酱W","保密","无IP","245019269","6","良辰美景・不问天","10000","94","10","等一下，我的记忆一下子就被打开了，我记得以前好像崩三有个这个活动来着。[笑哭][笑哭]当时好像还说是要出番[笑哭]竟然是真的[笑哭][打call][打call]"
"y","保密","无IP","381144618","5","","10000","92","","就不能把评论关了，多省事[疑惑]"
"账号已注销","保密","无IP","620450745","0","","5000","92","","还《成分》要没这战斗力，你以为靠那帮刷投降的能顶得住百万塞尔达？"
"sub_猫","保密","无IP","374318504","5","","10000","90","","游戏动态骂不满足，现在还要来污染看番的地方吗，给还在玩的人留个干净的地方吧"
"观星大人tri","保密","无IP","507030457","5","","10000","89","","有本事每个动态都能把热评锁了"
"一如鹊","保密","无IP","9816460","6","崩坏3・天穹流星","10000","89","11","啊啊啊啊啊啊啊真的不是愚人节玩笑吗 [崩坏3_干杯][崩坏3_干杯][崩坏3_干杯]gkd！！！以及我要大电影！！！！！"
"SSSS-zero","保密","无IP","507020103","5","","10000","88","","我以为是二创，结果终于又出番，女武神的餐桌根本不够看好不好？希望这次能多一点"
"Hfdwec","男","无IP","303982700","6","","10000","87","","怎么就人偶厨啊？崩坏兽厨、死士厨、泰坦厨和圣痕厨呢？"
"樱小路希儿","保密","无IP","1220062976","5","","10000","87","","剃须，捡到人偶……好怪啊"
"啊啾啊酋酋","女","无IP","38699012","5","","10000","86","","退很久了，就最近jz这事真的很心寒，自己喜欢的角色被这样zaota，不过这也是老米你自己作的，我当时退就是被sybh气退的，不说番剧，现在角色的钱不好赚了是吧，改恰人偶了，我真的很同情人偶，从一开始就是你们赚钱的靶子，结果现在还是逃脱不了命运，滋笨就是这么无情，我也不是不支持新人入坑，自己玩好游戏才是最好的，但是就老米这态度，我还真不好说"
"Aozaki-Toki","保密","无IP","351751721","6","","10000","86","","大家好！我是tx水军，tx拖了三年没发工资，如果mhy给我发工资的话我反向洗地mhy！[吃瓜][doge]"
"Liella推","男","无IP","29675458","6","","10000","86","","盲猜这番得关弹幕或不看评论区了，怕有崩3的节奏刷过来[笑哭]"
"爱莉の黑茶","男","无IP","432144865","5","","10000","84","","有一说一可以冲mhy不过大伙在番剧里还是和气点吧毕竟都是图开心的"
"崩坏世界的龙傲天","保密","无IP","487265188","5","","10000","83","","话说兔女郎刚搬运回来的时候，弹幕都是awsl，老婆真美，和讨论建模粗糙，节奏一起来咋都成了骂老婆的，米哈游是策划挨千刀，但关老婆什么事？[疑惑][疑惑][疑惑]"
"灶门祢豆子可爱の","女","无IP","415539880","5","2233十一周年纪念","10000","81","","某些人也是厉害，放过主要矛盾抓着次要矛盾说个没完。 米哈游要是态度好一点会有现在玩家间互相攻击的画面吗。"
"长山香柰","保密","无IP","547005125","5","","10000","79","","米哈游动漫公司，啥时候也给崩2整一个[tv_难过]"
"卡哇狗期那","保密","无IP","72402696","6","","10000","77","","让我看看是哪个不啸籽还没把全人偶氪满星"
"咻还是那个咻","男","无IP","101128041","6","崩坏：星穹铁道","10000","77","","给还在玩的人一个看番地方都不给？[微笑]"
"空之律者-律化娜","保密","无IP","183787390","6","原神","10000","77","","哈哈哈哈，草还以为是四月一的愚人节玩笑呢，来真的啊[笑哭]"
"账号已注销","保密","无IP","647432414","0","","5000","76","","不冲二创是谁签订的契约我不知道，但不冲官方这个契约我真没签过。,崩坏3第一偶像爱酱，三小时前投稿：崩坏3「人偶学园」动画PV。,出品：米哈游miHoYo"
"海洋中的炎理在学习","保密","无IP","183386437","6","","10000","76","","远离崩三，失去的是锁链，得到的是[给心心]"
"沙鱼今天有腹肌了吗","男","无IP","5395809","6","嘉然今天吃什么","10000","76","","崩坏3就明显懂水军咋刷，都刷的好耶。"
"一刃一心一刀斩情","保密","无IP","152252356","6","星座系列：双子座","10000","76","","友情提示想入坑的，番可能好看，但是游戏不要玩！"
"-小自闭-","保密","无IP","275049105","5","","10000","75","","看了最近大家没少氪啊，mwb加油！10单648气死米黑！[给心心]"
"天鞅ex","保密","无IP","1365230610","3","","10000","75","","可能捡人吃剩的就是特供？,https://b23.tv/ytq8bv"
"糖块渣子","保密","无IP","495698137","5","","10000","75","","给我个快乐的暑假，懂我意思吧"
"片刻思绪","男","无IP","390479591","5","","10000","74","","《永远都是一分钟前的热评》"
