"昵称","性别","IP","UID","等级","装扮","用户权重","获赞数","粉丝团等级","评论"
"d丧b","男","无IP","12282542","6","","10000","26433","","测试已经开始了，是上一场测试的延续…,,玩家有玩家的底蕴，我们不是滤清【测试者】后剩余的残渣。从测试之外，我们取得否定测试的力量。现在，踏入星穹之人。你的旅途已经告终，但你仍未越过最后的门扉。若你理解旅途的意义，就上前来。击败我，命令我让路，向你证明你比我更适合测试她。然后，就去纺织所有的命运吧。[doge]"
"月下吹火","保密","无IP","33591862","6","夏诺雅","10000","1372","","“对不起，也许我来的不是时候”,“不，你来的正是时候”"
"情苑","保密","无IP","354334495","5","","10000","18","","垃圾桶的尊严,使用后我方全体下回合防御力提升20％,很难解释为什么垃圾桶会有尊严，不过它的尊严非常沉重[doge][doge][doge]"
"Metalmare","保密","山东","410729482","5","","10000","15","","崩坏三剧情用卡农结束，崩铁从卡农开始，观感简直不要太舒适"
"hardvirus","男","无IP","70247543","6","","10000","9","","看了直播后，客观评价 mhy在音乐动画剧情上表现出色。但整体玩法机制表现平庸甚至糟糕，没有脱离传统的回合制大框架没有多少亮点，换个p又是新游戏，即使以后推出新模式也会显得无聊和乏味，而且抽卡模式下搞回合制不可避免会出现新出角色上碾压旧角色（更适合pvp玩法，大概率以后pvp），而且无法靠操作解决，如果是单机这种开发完成后买断制反而适合。其实我更希望mhy做成即时回合制游戏那样花样更多操作性和技巧性更强，甚至整体机制都会不同（参考ff6，ff6过于经典放在现在也非常有创意，不得不说ff6的设计出神入化，不论是游戏机制，角色设计（每个角色都有独特攻击要素，吹爆），幻兽系统更是一绝）反观星穹铁道 机制上只有平庸，快进到策划项目经理给美术 音乐磕头。"
"袅袅西秋风","保密","四川","1348251258","4","","10000","26","","以卡农为终，以卡农为始。伴随着【千界一乘】驶向星空，一个旧的故事已然终结，而随着【千界一乘】再一次出现在屏幕上，一个新的故事已然到来！,再见了！所有的女武神，以及崩坏兽、千人律者、侵蚀之律者以及那些认识的、不认识的人和事，以及那个让人难忘的故事。,然后，你好！星穹铁道！[大哭]"
"EmeraldFlamel","男","广东","27659219","6","罗小黑战记","10000","25","","以卡农为终，也以卡农为始,是不是也可以解读成，崩三的文明成功的拥抱了终焉，与“童年”告别，也来到了星铁的起点？（很笼统的说法）"
"火火火菌","男","无IP","492133","6","公主连结凯露","10000","71","","崩坏系列就是米哈游给EVA写的一沓情书（确信）"
"丰97","男","无IP","12247813","6","","10000","6","","没有资格的，就像我。[doge]你们不一定是未被选召的孩子，说不定是暗黑四天王小丑皇呢"
"孔颜反","保密","无IP","471701359","4","","10000","20","","演出效果还不错，地图也比我预想中的好，RPG和剧情虽然没过完不过也尚可，战斗玩法方面要看更新速度，虽然战斗本身机制很老套，不过这个游戏也未必需要精于此道....然后就是遗物系统这个巨坑，机制设计师不会觉得自己很幽默吧？还有就是原味有点弄了，收收味"
"星渊游士","男","无IP","243842102","6","异常生物","10000","5","","精彩的剧情演出和人物设计这玩意儿二次元游戏公司里独一份，继承原神的养成“圣遗物”总共6件，看起来可以4+2或者5+1。,     回合制属于经典一点，这个玩意儿各大up应该都有提，一贯的没做太大创新，而是重点做轻量化还原并调整。具体还分有肉鸽和深渊挑战还有一个特别的条件挑战玩法，打发时间不错，没有PVP看起来社交弱，这也是祖传的。日常看起来时间也短，体力也少，想肝也肝不了多少，咸鱼玩家推荐。,    想玩传统经典二次元RPG游戏，就来这儿吧，可以玩的番剧名副其实，绝对符合米哈游对自己的自我定位一家动漫公司，主打内容游戏玩法保守。,   挺符合我对这家公司的理解，主要把二次元做成游戏，而不是往游戏里加二次元，制作游戏的技术绝对够强。"
"SyUNC一个猫猫头","保密","无IP","6605209","6","瑰丽华服","10000","9","","Banzai Bonsai Tensai,Tradition - Kanon D-Dur (from ＂Neon Genesis Evangelion＂),老EVA厨了"
"断翎作Q","保密","无IP","412882004","5","","10000","4","","我喜欢，我会玩的，但是我知道也有人不喜欢。回合制玩法注定无法吸引到很多原崩玩家，同时也可能吸引到一些喜欢回合制但不玩原崩的玩家。没必要拿着回合制玩法讨论来讨论去的，二测玩法单调是有点单调，作为回合制又没啥大问题，测试就是用来要提意见的嘛[原神_喝茶],没必要摁头让别人喜欢这游戏，也没必要拉踩别的游戏或者拿别的游戏拉踩。"
"SORAxZERO","男","无IP","28839599","6","","10000","75","","我想我来的不是时候,不，你来的正是时候,,              爷,绝区零             星穹铁道"
"杰帕德单推人","女","无IP","8527627","6","","10000","9","","让我比较惊讶的是居然有弹幕连无实物表演都看不懂，硬说这是bug……着实令人语塞[笑哭],没看过空气小提琴，总看过空气吉他吧？多少文艺作品里用惯了的桥段……即使都没见过，但凡有一点审美，应该也能马上意会出这种表现形式所要传达的东西是什么吧。弹幕说是bug的那位，你可以说是既无审美又爱自说自话了..…"
"大白胖纸","男","无IP","7812709","6","","10000","50","","2022年的卡农是离不开爆炸了是吧"
"穗织丛雨丸","保密","无IP","1928120516","5","","10000","9","","说实话我更看好零妹[思考]，只能说老米有点大胆搞回合制开放世界，就像当年赌崩一崩二崩三一样[笑哭]"
"第零局","男","无IP","43417886","6","","10000","27","","希望能有家园系统，类似于原神诚哥壶，但是是以列车车厢的形式首尾相连的(其实可以参考电影雪国列车，只不过车厢内部空间比外表看起来大很多)，,,刚开始就车头、餐车、硬座，货厢之类的必要性车厢，但每通关一个世界就能获得一个世界特色车厢和一个特殊功能车厢(世界车厢和特殊功能车厢也可以在世界里另外做任务或者版本活动获得)，,,比如通关姬子的世界获得姬子世界特色车厢和观景台车厢，,,通关内测的双层世界(贝洛柏格)获得上下层车厢(上下层的功能和装饰不一样，靠车厢两头的楼梯和车厢中间的齿轮电梯链接两层），然后列车又解锁一个特殊功能车厢，比如图书馆车厢(图书馆里的书可以交代一些世界观)，,,再通关下一个世界再解锁一个世界特色车厢和一个特殊功能车厢，比如电影院车厢(可以放一些本游戏或其他游戏的cg短片）,,以此类推，每通关并解锁一个世界车厢就开放一个特殊功能车厢比如植物园车厢、水族馆车厢、酒吧车厢、沙滩车厢、泳池车厢，农业车厢等等(最好尽可能让车厢地形立体化)，,,外表千万要看起来就不一样，除了最开始的初始车厢看着像绿皮，其他特殊车厢的最好都有复合车厢风格的车厢外壳。,,如果有获得角色才能添加的个人房间，可以绑定在世界特色车厢里，列车熄灯等休息时间可以在这里找到他们，,,甚至世界特色车厢可以有一些功能性比如在固定时间有角色去打工卖点素材和特色食品(也可以在特殊车厢帮忙)，或者版本活动及世界任务添加功能进世界车厢,,自由活动时间可以在公共车厢和世界车厢或者自己的个人房间找到休闲放松的角色，成员自由活动的时候大概率会在自己世界的特殊风格车厢和自己喜欢的功能车厢里，,,比如姬子喜欢在自己世界风格车厢和观景台车厢，,,希奥拉(渡鸦同位体)喜欢在双层世界车厢的药店和医疗车厢，,,老杨喜欢在崩三风格(假如有)车厢和图书馆车厢，,,丹恒喜欢在自己世界车厢个人房间和植物园车厢，,,三月七喜欢到处乱窜不固定，,,列车长就常住车头驾驶室的夹层或办公室里，,,主角也可以随便找个地方(车厢)安排一个不大的个人小窝，在旅途中有个像家一样的房间。,,对话可以知道一些他们的故事，不同的角色在一个车厢也可以有所互动。,,如果有派遣角色到通关世界扫荡的功能那就在列车上都找不到派遣角色"
"意外的jhx","保密","山东","288219617","5","","10000","20","","有没有人注意到，崩三动画短片毕业旅行背景里的卡农在这个短片里接上了[给心心]"
"弦上VF","男","无IP","189205","6","","10000","6","","说实话，如果这段过场的“D大调卡农”没有契合主题特殊意义的话，建议换曲子。相信经常听古典的玩家看这段过场，真的容易被bgm出戏到，就是那种“制作组很想让场景氛围高雅起来，但实际上俗得令人尴尬”的感觉[藏狐]。,不否认这段卡农是首动听的音乐。但如果想引用“古典音乐”来衬托卡夫卡此时的高雅、或与故事情节冲突的反差感，那么“D大调卡农”真有点托不起场子，或者说直白点就是“太俗”（曲子本身还行，但它真的已经被各种合适亦或不合适的场合用烂了）。同样是大众印象里听过的曲子，用点巴赫的咏叹调、无伴奏小提琴，或者柴可夫斯基D小协的开头独奏不比这个合适么？,不排除有mhy想致敬eva的因素，但真的没必要用同一首曲子，形式上致敬而让察觉的玩家会心一笑，个人认为就足够了。eva那个时代卡农至少没被各种娱乐节目或者自媒体烙上俗套的既视感。,另外，不知道正式服这段cg是否会有小提琴模型，如果有的话，这段卡夫卡明显是独奏，不要再放一整段听不到独奏小提琴的群奏提琴曲子了[笑哭]"
"萌宠教主","保密","无IP","23976014","6","国民老公带回家","10000","88","","好耶！三月七我来了，嘿嘿嘿，我的三月七"
"狼人杀官方","保密","无IP","198427927","6","","10000","247","","多年脑血栓动起来了！！"
"I白糖I","保密","无IP","33380276","6","EveOneCat2","10000","52","","前排出售千律核心[来古-呆滞]"
"暴恶嗤笑","保密","无IP","628992344","5","","10000","194","4","是谁让你卡农配战斗场面的，我猜是Eva。[脱单doge]"
"火火火菌","男","无IP","492133","6","公主连结凯露","10000","71","","崩坏系列就是米哈游给EVA写的一沓情书（确信）"
"一般路过的p社玩家","男","无IP","362086377","5","希萝Hiiro","10000","172","","我就是轨道运营专业的啊，专业对口啊，为什么不给我资格啊[Hiiro_泪目][Hiiro_王酸奶]"
"某声悠","男","无IP","7817472","6","","10000","177","","上个pv看见卡芙卡：姐姐推我！,现在看见卡芙卡：妈！！！！"
"时间之类","保密","无IP","86123717","6","","10000","47","","反派这么穷的啊，连把小提琴都买不起的吗[doge]"
"寒雪无忆曲江南","男","无IP","8040869","6","","10000","119","","起飞，芜起飞"
"6的飞起的鱼","男","无IP","515427829","5","","10000","46","7","现在来看动画的都是没有资格的吧[藏狐]"
"彩虹上的旅人","保密","无IP","4169780","6","","10000","110","","这人物和场景建模加上人物表情系统……我感觉星穹铁道就像是番剧里插入了回合制玩法[笑哭]，我决定当番追了[歪嘴]"
"浅水墨鱼","男","无IP","173328628","6","绯赤艾莉欧","10000","45","","看了一天的测试，感觉铁道不是主打玩法，剧情演出和人物场景建模渲染才是重心，所以玩法自然越简单越好，一个猜想不一定对啊"
"背书包的老牌咸鱼","保密","无IP","1723722018","5","","10000","90","","喷子：mhy新pv画面是西洋乐器，为什么不是唢呐！[doge]"
"时间之类","保密","无IP","86123717","6","","10000","759","","《米哈游新作暴死？开服第一天竟无一人氪金》[doge]"
"太明湖畔","保密","无IP","22145949","6","星座系列：水瓶座","10000","81","","随便进几个直播间，都有刷回合制告辞，什么不玩的，怎么刚通网啊[藏狐]"
"霍宝Moira","保密","无IP","12344893","6","星座系列：双鱼座","10000","68","","卡芙卡好疯  我好爱[喜欢][喜欢]"
"拿弓子的波塞东","保密","无IP","504090336","6","","10000","88","","爷来的太是时候了"
"大白胖纸","男","无IP","7812709","6","","10000","50","","2022年的卡农是离不开爆炸了是吧"
"SORAxZERO","男","无IP","28839599","6","","10000","75","","我想我来的不是时候,不，你来的正是时候,,              爷,绝区零             星穹铁道"
"道法孜然羊肉串","女","江苏","176528687","5","","10000","37","","卡农。。。米哈游你是故意的还是不小心的[笑哭]"
"cwq大丈夫","男","无IP","87998057","6","","10000","37","","《一幕短剧》×,《亿伥悲剧》√"
"空谷依幽","保密","无IP","304008878","6","","10000","67","","看看我刷到了什么？一只可爱的铁道，让我们悄悄靠近它，扭掉头，鸡肉味嘎嘣脆[星星眼]"
"陌小舞丶","保密","无IP","5142497","6","","10000","62","","有资格的已经进游戏了，就剩下我们一堆没资格的在这看pv[跪了][跪了][跪了][跪了][跪了]"
"鲜丰水果官方","保密","无IP","519528064","6","","10000","68","","铁道游击队出击！！！！[哈哈][哈哈][哈哈]"
"一洄yar","保密","无IP","676044096","5","","10000","57","","有些人已经拿到了测试资格，而有些人还在守着视频过日子[doge]"
"小紫的小号","女","无IP","14829832","6","","10000","64","","你来的正是时候[doge]"
"碧风落空7","男","无IP","517410833","5","","10000","41","","不愧是你米哈游，这bgm配的太有EVA那味儿了"
"--杌--","男","无IP","286906284","5","仲夏幻想","10000","41","","进游戏还要更新四个g[藏狐]"
"芭万-希official","保密","无IP","14661136","6","崩坏：星穹铁道","10000","54","","崩二主线逐火全通，幻海填海人，崩三主线全通，苦痛保级，25号漫游测试我就不去了，怕认错游戏[doge]我错了，放我进去，让我访问！！！"
"天线宝宝的宝宝奶昔","保密","无IP","435903172","5","","10000","35","","艹前面我还觉得优雅，非常优雅，然后后面一听到不是时候我就dna动了，结果还真是你来得正是时候，笑死[doge]"
"仿生初音会甩电子葱吗","男","无IP","85293596","6","崩坏3・天穹流星","10000","61","","EVA用欢乐颂，你mhy用卡农是吧,这下员工入职前被拉去看一伯遍EVA成真了[崩坏3_饿了]"
"风鸣雪","保密","无IP","398949099","6","明日方舟音律系列","10000","60","8","两次没有资格，我要黑化!米哈游你罪大恶极!这个世界一点都不美好，薪炎――!拔剑!,[蛆音娘_哭泣]"
"古月一璃","男","无IP","99206726","6","","10000","53","","铁道没有测试资格我很生气,所以能不能发10个纠缠之缘补偿我[doge]"
"小云风雨","男","无IP","318899765","6","异常生物","10000","44","","有没有一种可能，小提琴的模型没有加载出来[doge]"
"348EC7","保密","无IP","491585404","5","","10000","53","","首先，我是女铜……,最后，卡夫卡小姐你带我走吧[大哭]"
"越后光卫T","男","无IP","353836311","6","","10000","53","","玩不了星穹 只能去玩低配版星穹 赛尔号了[doge][doge][doge][doge]"
"狂气の际","男","无IP","40776256","5","","10000","33","","冷知识，eva旧剧场版死与新生的片尾曲就是卡农[崩坏3_呼呼呼]"
"虚无虚空","男","天津","2928765","6","hanser","10000","32","","卡农结束，卡农开始。,以我为终，以为为始。"
"沉か寂","保密","无IP","36329746","6","原神","10000","32","","我为崩三流过血，我为崩二出过力，我为原神锄过大地，为未定东波西走，放我进去，我要见大伟哥！[大哭]"
"水彩colar","保密","无IP","1819358896","5","领风者","10000","56","","有些公司啊，就是用心做PV用脚做游戏。。。哦，mhy啊，他们连PV都不会做，只能放实机[脱单doge]"
"荻原红叶","保密","无IP","28764799","6","","10000","40","","回合制游戏做得好玩策略性很重要，目前战斗内不能使用道具，参战角色和非参战角色不能交换出场，角色主动技能单一，又没有原神那样角色之间的元素反应或者破晓传奇那样的连携技，如此看来策略空间其实很小，不知道要怎么做到保证策略与趣味,jrpg回合制好玩的也不少，苏菲的炼金工房2，除了战斗中使用调和好的道具，还有两个角色间的双重触发和双重攻击机制，大大增加了决策空间,目前看来战斗系统的创新实在有限"
"告别了地球","保密","无IP","505380740","5","","10000","29","","垃圾游戏,你问我为什么垃圾？,因为我没有资格 只能云了[doge]"
"3418920301","男","无IP","7250858","6","崩坏：星穹铁道","10000","28","6","草，官方玩梗,“看来我来的不是时候”,“你来的正是时候”"
"云开sama","男","无IP","32249519","6","","10000","56","","没有资格，开骂"
"岚七灯","男","无IP","44925972","6","2021拜年纪","10000","45","","不得不说，古典提琴曲加上机甲战斗，高科技场所报警紧急疏散，EVA味太浓了，不愧是你mhy[崩坏3_划水]"
"袅袅西秋风","保密","四川","1348251258","4","","10000","26","","以卡农为终，以卡农为始。伴随着【千界一乘】驶向星空，一个旧的故事已然终结，而随着【千界一乘】再一次出现在屏幕上，一个新的故事已然到来！,再见了！所有的女武神，以及崩坏兽、千人律者、侵蚀之律者以及那些认识的、不认识的人和事，以及那个让人难忘的故事。,然后，你好！星穹铁道！[大哭]"
"YIC星子今天学习了吗","保密","无IP","86932943","6","2020拜年祭（鼠）","10000","41","","你看外面的小怪像不像抢测试服资格的你[脱单doge]"
"EmeraldFlamel","男","广东","27659219","6","罗小黑战记","10000","25","","以卡农为终，也以卡农为始,是不是也可以解读成，崩三的文明成功的拥抱了终焉，与“童年”告别，也来到了星铁的起点？（很笼统的说法）"
"幸祜の猫","保密","无IP","346734262","6","","10000","25","","卧槽，在我生日时发，谢谢！[崩坏3_呼呼呼][崩坏3_呼呼呼]"
"进化中","女","无IP","1650855","6","","10000","28","","卡芙卡可是能成为我母亲的女人，emm，她好像真的是我母亲[吓],卡芙卡妈妈～ 我好想你[吓]"
"第零局","男","无IP","43417886","6","","10000","27","","希望能有家园系统，类似于原神诚哥壶，但是是以列车车厢的形式首尾相连的(其实可以参考电影雪国列车，只不过车厢内部空间比外表看起来大很多)，,,刚开始就车头、餐车、硬座，货厢之类的必要性车厢，但每通关一个世界就能获得一个世界特色车厢和一个特殊功能车厢(世界车厢和特殊功能车厢也可以在世界里另外做任务或者版本活动获得)，,,比如通关姬子的世界获得姬子世界特色车厢和观景台车厢，,,通关内测的双层世界(贝洛柏格)获得上下层车厢(上下层的功能和装饰不一样，靠车厢两头的楼梯和车厢中间的齿轮电梯链接两层），然后列车又解锁一个特殊功能车厢，比如图书馆车厢(图书馆里的书可以交代一些世界观)，,,再通关下一个世界再解锁一个世界特色车厢和一个特殊功能车厢，比如电影院车厢(可以放一些本游戏或其他游戏的cg短片）,,以此类推，每通关并解锁一个世界车厢就开放一个特殊功能车厢比如植物园车厢、水族馆车厢、酒吧车厢、沙滩车厢、泳池车厢，农业车厢等等(最好尽可能让车厢地形立体化)，,,外表千万要看起来就不一样，除了最开始的初始车厢看着像绿皮，其他特殊车厢的最好都有复合车厢风格的车厢外壳。,,如果有获得角色才能添加的个人房间，可以绑定在世界特色车厢里，列车熄灯等休息时间可以在这里找到他们，,,甚至世界特色车厢可以有一些功能性比如在固定时间有角色去打工卖点素材和特色食品(也可以在特殊车厢帮忙)，或者版本活动及世界任务添加功能进世界车厢,,自由活动时间可以在公共车厢和世界车厢或者自己的个人房间找到休闲放松的角色，成员自由活动的时候大概率会在自己世界的特殊风格车厢和自己喜欢的功能车厢里，,,比如姬子喜欢在自己世界风格车厢和观景台车厢，,,希奥拉(渡鸦同位体)喜欢在双层世界车厢的药店和医疗车厢，,,老杨喜欢在崩三风格(假如有)车厢和图书馆车厢，,,丹恒喜欢在自己世界车厢个人房间和植物园车厢，,,三月七喜欢到处乱窜不固定，,,列车长就常住车头驾驶室的夹层或办公室里，,,主角也可以随便找个地方(车厢)安排一个不大的个人小窝，在旅途中有个像家一样的房间。,,对话可以知道一些他们的故事，不同的角色在一个车厢也可以有所互动。,,如果有派遣角色到通关世界扫荡的功能那就在列车上都找不到派遣角色"
"名刀新飞","保密","湖南","442985166","5","","10000","22","","回来考古，崩三以卡农结尾。星铁以卡农开头，mhy真的，我哭死"
"老白宏","男","无IP","420946397","5","原神","10000","22","","总不能他们中了奖还能进测试资格吧"
"M梅川内酷M","男","无IP","10605108","6","","10000","22","","有测试资格的，别玩了，都是bug.小提琴模型都没刷出来，建议给我，我来吃这坨屎[doge]"
"哇你超帅的","保密","无IP","3492530","6","早稻叽","10000","22","","“看来我来的不是时候”,“不，我想你来的正是时候”[Hiiro二周年_好耶]"
"和武安","男","无IP","510447811","5","拜年祭粉丝专鼠","10000","21","","现在在看的，都是没资格的人吧[doge][酸了]"
"过去的清风","保密","无IP","111138090","6","赏樱大会欧皇","10000","20","","17年开始接触米哈游到现在我就没进过他们的测试服"
"布洛妮娅を郅筏皮","男","无IP","20785072","6","良辰美景・不问天","10000","34","","原来爷是人造人,原来鸭是爷的妈,[崩坏学园2_满头叹号][崩坏学园2_满头叹号], , , , , , ,穹宝你欠我的开服用什么还,爷是催穹宝公测小助手，快来和我一起刀穹宝8,你一刀~我一刀~,让穹宝下条动态就是铁J道K公J测K,[崩坏学园2_绷不住了][崩坏学园2_绷不住了][崩坏学园2_绷不住了][崩坏学园2_绷不住了][崩坏学园2_绷不住了][崩坏学园2_绷不住了][崩坏学园2_绷不住了]"
"胎迷的姑妈","男","无IP","364888173","5","","10000","23","","怎么说呢，二测回合制玩法还是很单一，能不能优化得狠一点，回合制玩起来还是有意思的"
"绍辉煌上煌","保密","无IP","510932830","5","","10000","611","","你觉得这个视频有什么问题？,○违法违禁,●没有资格,○低俗,○血腥暴力,○人身攻击,○不良言语,○青少年不良信息,○有其他问题,●不够瑟瑟,为帮助审核人员更快处理，请补充详细信息,多行文本框限400字,未选择任何文件,支持JPG／PNG等格式，最多上传 5 张,提交,[doge]"
"普莱瑞斯-The鲨","男","美国","98552429","5","","10000","18","","崩坏3第一部分的结局,崩坏-星穹铁道的开始[热词系列_妙啊]"
"维恩一木子","男","无IP","31274398","6","","10000","18","","可恶为什么不让丹恒给我做人工呼吸"
"`不会治愈","男","无IP","26082631","6","碧蓝航线","10000","18","","我为崩三流过血，我为崩二出过力，我为原神锄过大地，为未定东波西走，放我进去，我要见大伟哥！[大哭]"
"cbhssr","保密","无IP","36213009","6","","10000","18","","像我们这样的妖精，当然只可能“来的正是时候”呀"
"宝贝你好馋人","保密","广西","2129934123","3","","10000","17","","毕业旅行卡农后部分[tv_doge]"
"意外的jhx","保密","山东","288219617","5","","10000","20","","有没有人注意到，崩三动画短片毕业旅行背景里的卡农在这个短片里接上了[给心心]"
"账号已注销","保密","无IP","2109509731","0","","5000","16","","不是吧，为啥真多人那么着急大肆宣扬说自己不会玩，你们是怕别人想玩这游戏吗[doge]，不过我的评价还是不如当初原神开服说原神暴死的言论多。"
"xin_yun","保密","无IP","74198424","6","","10000","16","","左（星穹铁道）拥（我）,绝区零：或许我来的不是时候,我：不，你来的正是时候,左（星穹铁道）拥：我：右（绝区零）抱"
"胡桃老婆の狗","男","无IP","331856711","6","夏日萌菜头像框","10000","24","","黑塔:我管它叫，元宇宙,爷:这热度就别蹭了,,[doge][doge]"
