"昵称","性别","IP","UID","等级","装扮","用户权重","获赞数","粉丝团等级","评论"
"bili_500822716","保密","无IP","500822716","4","","10000","1","","7月10日开放假"
"有_烟_无_伤","女","无IP","417072434","4","","10000","1","","游戏内有英配吗"
"伯云花飞","女","无IP","549202819","4","","10000","1","","鸭鸭好评"
"巨大的丑东西","保密","无IP","63902847","5","","10000","1","","你们都是我的翅膀！[妙啊]"
"来一桶冰淇淋","保密","无IP","13477018","6","","10000","1","","[大哭]我到处找景元视频的样子真的很狼狈"
"orchid小T","保密","无IP","102608638","6","崩坏：星穹铁道","10000","1","","不懂就问，为什么英配这个BGM比其他版本音量小一点[辣眼睛]"
"果酱壶","保密","无IP","402568785","6","崩坏3・天穹流星","10000","1","","elegant，very elegant[doge]"
"鼹鼠党小弟","男","无IP","2692848","6","崩坏：星穹铁道","10000","1","","仔细想想，如果雅利洛6号如果后面解冻了。米哈游这…解冻后一个星球的地图…"
"キスsu","保密","无IP","381730634","6","","10000","1","","这种感觉，真的好像eva。欢快的音乐配上杀戮"
"陆知乔y","保密","无IP","1998702207","4","","10000","1","","@具足虫の狗 为什么还不公测啊还预约不到等的我好累[灵魂出窍]"
"维寒迪之春","男","无IP","399889774","5","原神","10000","1","10","最后这段很难绷得住[doge]"
"爱哭的小胖崽","女","无IP","27245669","5","琉晶之礼","10000","1","","不，你来的正是时候。【名场面    不你来的正是时候-哔哩哔哩】 https://b23.tv/qoANteH"
"鸢`折","保密","无IP","35341199","6","星座系列：处女座","10000","1","","喜欢的游戏+喜欢的音乐  双厨狂喜[给心心]"
"奉孝的小酒馆","男","无IP","9054847","6","","10000","1","","回合游戏应该要多考验策略战斗，希望别是数值碾压，不然就是碾压看动画的游戏了。回合制精髓很多"
"盐海冰沙","男","无IP","455550298","5","","10000","1","","等一下，银狼日语声优是我想的那个吗？是我想到的那个人吗？是她的声优吗？法露露的也在，哦，这次阵容比隔壁还大呀[doge]"
"无尽祝福","保密","无IP","1580320162","5","","10000","1","","这游戏我试玩了一下，总体上来说，在回合制游戏里面算是很好的了，但他让我觉得没有什么新的东西。不符合我对米哈游的期望。再看吧，毕竟还是测试。"
"巴金","男","无IP","676114433","6","荧荧荧","10000","1","","[hanser动物套装_打call][hanser动物套装_打call][hanser动物套装_打call]"
"评论被吞了","男","无IP","356567795","6","","10000","1","","转圈圈×114514"
"Bronya----","保密","无IP","40328451","6","群星闪耀时天蝎座","10000","1","","我为崩二砸过蛋!我为崩三流过泪！我为原神流过血!我为鹿鸣舔过脚！为什么不给我资格!大伟哥!让我进去！我要见大伟哥！"
"想说想","保密","无IP","274010952","5","","10000","1","6","我为原神流过血！我为原神流过血！放我进去！我要见大伟！！！"
"戟蚀","保密","无IP","596290583","5","良辰美景・不问天","10000","3","","原神58级，稻妻神像满级，这次星穹铁道展台我就不去了，怕认错游戏。,震惊，会展上一小伙竟怒砸手机。,中国游戏史上最黑暗的时候到来了。,为什么氪金手头没有出路，让铁道告诉你答案。,论星穹铁道所展现出的非买断制手游原罪。,[doge]"
"张飞挑灯战黛玉","保密","无IP","1848073488","5","","10000","3","","我为崩三冲策划，我为原神冲策划，为什么不给我测试资格!让我进去，我要*大伟[tv_发怒][tv_发怒]"
"白幼泠乃","保密","无IP","519849127","5","","10000","1","","新二测感观（仅个人看法）（印象最深）（如若没说，可以自行补充）,1.卡夫卡:妈！！！,2.黑塔:转圈圈～太魔性了这句台词，还有这么大的钻石没见过吧，送给你了～太可爱了吧，扯远了，她是一个聪明但又有趣的天才，打破了我对于常规天才的看法，虽然是天才，但是好可爱，那种可爱是无法形容的，玩过或看过的都应该能理解，不说了，黑塔就是天！！！,3.爷:好飒啊，但是剧情越往后就越发感觉主角有点憨，总感觉是错觉，大概吧,4.姬子，老・仰卧起坐・再就业・杨:姬子这回很好啊，起码平安无事就好，老杨，我在想这人也太能活了，从崩三到星穹再就业，真是强大,5.可可利亚:你咋又喜闻乐见新手村第一个当boss了，看完剧情后，唯一对可可利亚就只有这人彻底疯了这一种看法，真可可利亚，新手村村长,6.鸭子:可爱昵，又飒又幼，脸上的婴儿肥真的太刑了，还有鸭的衣服太瑟了，啊，斯巴拉西呦，不过多赘述了，你们可自行观看,7.垃圾桶:垃圾桶也有垃圾桶的尊严！！！,8.丹恒，三月七:好帅，嘿嘿嘿，好可爱，嘿嘿嘿"
"咕咕爱吃阮饭","男","无IP","499849877","5","异常生物","10000","1","","@崩坏3第一偶像爱酱 [原神_干杯]"
"爱白嫖的酒子","保密","无IP","8327837","6","崩坏3・天穹流星","10000","1","","EVA风是什么回事？不是很懂EVA，米哈游学习了EVA哪里？（真不了解EVA。。。）"
"应该改名就能中奖","保密","无IP","99249816","5","","10000","1","","我们都是失败者[酸了][酸了][酸了][酸了]"
"品鉴迎宾酒的德川","男","无IP","426162121","5","明日方舟音律系列","10000","1","","没玩过，问下铁道的回合制好玩吗[来古-疑问]"
"酱香-小鱼干","保密","无IP","401538046","6","","10000","1","","[滑稽]本集暗线,开端：爆炸就是派大星,鸭鸭：你们都是我的翅膀"
"Leaieily","保密","无IP","2052485811","4","","10000","1","","公测会有PVP吗"
"二次元之ACG","男","无IP","34310790","6","","10000","1","","我为崩三出过力，我为原神流过血，你们怎么能不给我铁道游击队测试资格！放我进去，我要见大伟！"
"无能为力的娜娜酱","女","无IP","349450771","6","星座系列：处女座","10000","1","","我为崩二砸过蛋，我为崩三出过力，我为未定流过泪，我为原神流过血，你们怎么能不放我进去，我要见大伟！"
"暴力柯基宝宝","保密","无IP","158640594","6","","10000","1","","卡农好评"
"晓玉吃芒果","保密","无IP","383300644","6","珈乐Carol","10000","1","","eva味儿要溢出屏幕了"
"玻璃瓶子丨","保密","无IP","73732255","6","","10000","1","","怎么回事？千律不是都消灭了吗？[崩坏3_？],怎么冒出来这么多[崩坏3_七][崩坏3_十][崩坏3_刀]"
"party_is_over_","男","无IP","34853476","5","","10000","1","","我似乎触碰到了LV6的境界，隐隐间仿佛感觉一层膜将破未破，各位道友，如若各位道友助我突破LV6，大成之后，我定将这次一定、一键三连等修炼法器与各位分享！"
"无名书画动天涯","保密","无IP","313355179","5","","10000","1","","哦豁，恰好有测试资格[doge][doge][doge]"
"业余厨房小助手","男","无IP","426221787","5","暮光幻影","10000","1","","在？什么时候开服？[doge]"
"空闲的时候没空","保密","无IP","1105115304","5","","10000","1","","转圈圈[doge][doge]"
"两个孤单的影子","男","无IP","8206926","6","罗小黑战记","10000","1","","我为崩二砸过蛋，我为崩三秃过头，我为原神锄大地，我为未定打嘴炮，你们怎么能不给我绝区0测试资格！放我进去，我要见大伟！[大哭][大哭][大哭]"
"RKKKKK丶","保密","无IP","408754104","5","碧蓝航线","10000","1","","你我不能没有资格，就像西方不能没有耶路撒冷[保卫萝卜_哭哭]"
"Kogis默黔","保密","无IP","435186456","5","","10000","1","11","穹宝，快放我进去转圈圈～[保卫萝卜_哭哭][保卫萝卜_哭哭]"
"阳明滩大桥南","保密","无IP","472328437","5","","10000","1","","好家伙全是原神和崩坏3的声优"
"忘插电源的初号机","女","无IP","301551952","5","","10000","1","","最激烈的场面配最舒缓的音乐，你跟痞子学坏了[蛆音娘_吃瓜群众]"
"ScarAmzi丶","保密","无IP","357666316","5","2233幻星集","10000","1","","白狼开大了属于是[酸了]"
"Che11Y_","男","无IP","34429991","5","","10000","1","","手部还有颤音，我去"
"One-Last-Kiss","男","无IP","2008782338","5","","10000","1","","这很EVA[原神_喝茶]"
"八重凌-空中劈叉","男","无IP","147041621","6","崩坏3・天穹流星","10000","1","","这个世界根本就不美好！X！[崩坏3_哭哭]"
"账号已注销","保密","无IP","1166622467","0","","5000","1","","嘿呦呦呦，没本事的废柴们给我站稳听好,这是内燃机总冠军八十八度矿底，代表下层说唱的黎明，给你们带来震撼心灵的陷阱,孤独的孩子看头顶的月,冷漠的城市飘冰冷的雪,沉默,沮丧,看不透眼前这残破景象,要守护你,要守护他,无忧的你妄说空虚的话,生自地下也成长于地下,秘密却让他回不了家,顾不上尊严,顾不上生死,只想去找他的爸爸妈妈,一点点火,一点点光,深夜他决定逃出这地方,病痛和饥饿在不断的呼喊,他咬着牙逃离了城市中央,踢踢踏踏  踢踢踏踏,黑暗中伸出了他的爪牙,捂住嘴屏住息不发出声响,心肌跳快窒息受不了煎熬,还付出过，荧光闪烁,难以强撑的意识渐弱,大雪纷飞的夜闭上了眼,爸妈的声音开始渐行渐远,贝洛伯格的夜,谎言藏不住恨怨,那女人冷着眼,旁观发生的一切,嗯嗯嗯～,贝洛伯格的夜,谎言灭不了火焰,嗯嗯嗯嗯嗯～,他最后的笑容,预示这黎明将歇,（可能会有很多不对的地方，可以指出来[脱单doge]）"
"匹诺曹之颅","男","无IP","28669877","6","","10000","1","","圣堂武士们，开始折跃!"
"星途绘梦","男","无IP","420986778","5","","10000","1","","居然有骇兔，是不是说会有舰长？[doge]"
"情难自渡--","保密","无IP","76026598","5","","10000","1","","这么频繁地发动态，tnnd，给句痛快话，给不给资格，不要逼我求你[tv_生气][tv_生气]"
"yueyuii","保密","无IP","1878931931","3","","10000","1","","好耶"
"石田v君工作室","男","无IP","22949671","6","","10000","1","","快点端出来吧我已经等不及了[脱单doge]"
"かえkaeru","保密","无IP","550611432","5","崩坏3・天穹流星","10000","1","","卡农！"
"秋风熙日","保密","无IP","1727354","6","","10000","1","","卡芙卡的英配真的绝了！"
"罪ぅぉ","保密","无IP","187807","6","","10000","1","","你没有资格，正应如此你没有资格..............."
"VC66CCFF","女","无IP","290925422","5","","10000","1","","EVA味儿太冲了，不愧是你，mihoyo"
"靠蚁suki","男","无IP","676282663","5","原神","10000","1","","你那逼养成系统改改吧，圣遗物是真的不想再刷了[hanser动物套装_no！]"
"柴油收音机","男","无IP","27056280","6","","10000","1","","“对不起，也许…我来的不是时候”[委屈],“不，你来的正是时候”[歪嘴],        ,――――“你好，俺是焦恩俊”[脸红]"
"迷你仙灵","男","无IP","5572140","5","","10000","1","","原宝还在长草，你偷偷测试却不带我？这个仇我记下了！[doge]"
"粥粥人的尊严","男","无IP","514321","6","","10000","1","7","看到开头那个虚空拉小提琴的女人了吗，快喊她妈妈[doge]"
"途刺","保密","无IP","1649429163","5","","10000","1","","感觉节奏已经起来了。"
"-silverfox-","男","无IP","332134684","5","星座系列：天秤座","10000","1","","转圈圈~"
"乐纺什么时候结婚","保密","无IP","401591972","5","","10000","1","","妈！"
"-三生之玖-","男","无IP","499768284","5","hanser","10000","1","","期待崩坏二联动崩坏三联动原神联动星穹铁道[脱单doge]"
"-AngLEI-","男","无IP","351634890","5","","10000","1","","你来的是不是时候我不知道，反正我来的肯定不是时候[呆]"
"Violetsapphire","女","无IP","252570283","6","星尘","10000","1","","咩？我丹恒怎么一句话都没有啊呜呜呜 我要听日配！我要听伊东健人啊啊啊啊啊啊！[星尘_大哭]"
"木头仙人板板","男","无IP","357526332","6","","10000","1","","星穹铁道8.4分，看来这个游戏是不需要玩的了[doge]"
"半花夏开","女","无IP","238056056","5","","10000","1","","好耶[原神_哇]"
"Kaede-chan","保密","无IP","6414769","6","","10000","1","","老婆[2233塔罗牌_AWSL][2233塔罗牌_比心心]https://b23.tv/tfmDXLo"
"Seaglow","保密","无IP","1613531011","5","","10000","1","","哈哈哈……这次文案真的是放飞自我了，看up主直播的时候笑死我了哈哈哈……"
"金猫湿王","男","无IP","8648612","6","良辰美景・不问天","10000","1","","从崩2到崩3到原神我都不知道氪了多少。为啥不给我上车，要氪金我有氪金。要热爱我有热爱我。为啥不给我上车[抓狂]"
"繁星Nova","保密","无IP","479870678","5","","10000","1","4","测试已经开始了，是上一场测试的延续，米哈游为欲望的轮廓镀上7种光辉，以此昭示，他们的权柄可被企及,,但现世的基底埋藏着阴燃的残骸，那是对僭越者的警示，「高天之上的测试资格从来不是为你预留的位置」，但僭越之人啊，不要就此驻足，谁都不能隔岸观火，看吧..."
"星辰钟塔的杰克巴尔多","男","无IP","424668067","5","","10000","1","","战斗系统过于单薄的问题，我认为二测是不会把这种游戏核心内容公开的，还是期待一下后面的测试吧。ui和原神太像了，我甚至怀疑是原神废案换个皮...后续一定要改啊！"
"Elysia丨爱莉希雅","保密","无IP","33539335","5","","10000","1","","有一说一，星穹铁道没有自己的灵魂。缝了崩三和原神，却没办法让人眼前一亮或充满期待感。至少画面有种说不出沉闷和空洞，音乐也失去了它应有的作用。整体让人喜欢不起来。游玩节奏也是乱的，没有玩游戏的爽快感。希望公测会变更好吧。绝区零更有米哈游原来的那股味儿。"
"审查官_黎世","保密","无IP","490947708","5","","10000","1","","更新：我突然想起来这个卡池好像是四个五星限定的样子，麻蛋，血压升高。,更新：刚看到有二倍速，观感提升不少。但问题还是那些，只是降低了一点。而且我又发现一个令人血压升高是地方，就是怪的盾条有点厚，而且好像还得带相应属性的角色才能打掉。这要是一不小心没带破盾角色，那体验就简直了，不过图里有换人的地方，还行。,然后我还想说一句，有些人有没有搞错，测试服就是挑毛病的时候，哪里不爽直接说，不然到正式服还是一堆毛病你还想不想要游戏体验了？,刚看完别人直播，这个养成系统真的给人一种疲惫感，这直接和原神重合了，希望能有点创新。如果不改希望能减少一下养成成本。第一次抽出之后命座可肝也好，技能和装备升级消耗材料和角色升级材料减少也好，不然一进游戏真的会给人一种疲惫感，毕竟是回合制不是开放世界。你游戏内容再好，我一进游戏就累也不想玩啊。而且就现在来看，低练度的时候观赏性真的不好。再加上这破养成系统，就给我一种不是玩游戏而是打工的感觉。,建议那个圣遗物不要再有升级系统了，或者武器没有也行。不然就削减材料消耗。建议命座去掉或者能在第一次抽到后可肝，mhy别抠抠搜搜的了。不然真的会给人一种坐牢的感觉。,要不你出一套新的养成系统也行。"
"白天唉","男","无IP","1223997333","4","","10000","1","","虚空弹奏，优雅，太优雅了[打call]"
"白天唉","男","无IP","1223997333","4","","10000","1","","[打call]"
"我叫排大炮","男","无IP","34858626","6","","10000","1","","我看你也挺急的，要不明天公测？"
"琉璃瓦雨滴","男","无IP","4503809","6","","10000","1","","赵敏:也许我来的不是时候!,李寻欢:不,你来的正是时候!,[热词系列_知识增加]"
"账号已注销","保密","无IP","1229101393","0","","5000","1","","决定了，要给你的玩家起一个难听的绰号，就叫穷批吧[傲娇]"
"jr_ashleey","保密","无IP","2066689543","5","","10000","1","","看到我了啊 那你一定也没拿到资格吧[doge][doge]"
"路人九符尘","男","无IP","215756559","5","刺客伍六七","10000","1","","卡农又响了……快按住锅姨[tv_doge]"
"QipomeloMei","保密","无IP","1695964213","5","","10000","1","","默默的问一句，有琪芽吗，崩三的琪芽太苦了，是平行世界的话，希望别让她们这么苦了[大哭]不过按照编辑惯例，不刀是不可能的了[捂脸]"
"目送拂晓之车mizi","男","无IP","16517289","6","","10000","1","","我从上午看直播一直到下午，堪称精致的建模和演出效果，最后选择了古老的回合制玩法不是很能理解。"
"M眼R","女","无IP","491444682","5","","10000","1","","eva欢乐颂；星铁卡农,这波啊，这波是米哈游跟eva二次联动[doge]"
"河浅咯","女","无IP","179795518","5","","10000","1","","为什么 丹恒是鱼冻和totto啊啊啊啊啊 我的钱包真的不够你们掏了"
"魍魉君","男","无IP","411201","6","","10000","1","","一千块一个鸡猴马，是真的离谱"
"幻想乐章ぃ","男","无IP","30161326","6","","10000","1","","草，你这个梗玩的我属实没绷住啊[笑哭][笑哭]"
"迷路的海豹球","男","无IP","94514017","5","","10000","1","","有eva配欢乐颂那味了"
"悲情ya","保密","无IP","87412298","5","崩坏：星穹铁道","10000","1","7","我看的好好的，最后没绷住笑喷了[笑哭]"
"天意书生","保密","无IP","6188817","6","","10000","1","","不，你来的正是时候！一手鸭鸭一手卡夫卡，妙啊[脱单doge]"
"小野寺惠","男","无IP","43498777","6","明日方舟音律系列","10000","1","","卡芙卡真的好色好色啊，我好喜欢啊[捂眼]"
"bilbil整活大师","男","无IP","549294658","5","","10000","1","","短剧？是千人！（错乱）"
"Kaede-chan","保密","无IP","6414769","6","","10000","1","","老婆[2233塔罗牌_AWSL]https://b23.tv/3ckSeTy"
"空心结衣","女","无IP","5681915","6","","10000","1","","又一轮长跑[崩坏3_给你一拳],今晚深渊结算[崩坏3_七][崩坏3_十][崩坏3_米][崩坏3_长][崩坏3_刀]"
"罪之罚","男","无IP","33326461","6","","10000","1","","来人，上欢乐颂[原神_哼]"
"听听那个声音","男","无IP","288688654","6","良辰美景・不问天","10000","1","","一股子EVA味"
"飘来飘去的泡沫","女","无IP","25696930","6","","10000","1","","这也太eva了草"
"最喜欢吃白丝雪糕了","保密","无IP","2090616438","3","","10000","1","","卡夫卡好涩[doge]"
"-Fatui","保密","无IP","21602679","6","","10000","1","","eva！你还是忘不了它"
"柴某永远喜欢爱莉希雅","女","无IP","521396332","5","","10000","1","","垂死病中惊坐起。"
"亚莉莎-舒华泽","男","无IP","86837543","5","","10000","1","","有节奏了，可以玩了"
"荒谷-CX","男","无IP","439940131","6","崩坏3・天穹流星","10000","1","8","我为崩三流过泪，我为原神出过血，我为绝区零投过币，快给我资格[委屈][委屈][委屈]"
"单推因幡めぐる","男","无IP","627367411","5","","10000","1","","teri teri[doge]"
"月小兔专属私人助理","保密","无IP","1005648207","5","崩坏3・天穹流星","10000","1","","开始思考……,放弃思考。,掏出千律核心,这个世界，从来都不美好！！！"
"喵脆鲨","女","无IP","388384363","6","","10000","1","","然而我就没抢到过mhy的任何游戏测试资格，令人感叹"
"赛高粉","保密","无IP","80362628","5","","10000","1","","背景音乐是卡农啊米哈游还是没忘记EVA呢[doge][热词系列_优雅]"
"-YaKiol-","保密","无IP","150914401","6","","10000","1","","会不会国庆开公测啊"
"人类灭绝前希望能中奖","保密","无IP","25154429","6","","10000","1","","崩坏能是纽带[崩坏3_X]"
"伊伊星","男","无IP","472954189","6","","10000","1","6","【卡芙卡：我在听（moon halo）别打扰我（狗头）-哔哩哔哩】 https://b23.tv/brM4vgr[doge]"
"一只花酿鸡","男","无IP","44165372","6","公主连结凯露","10000","1","","这个应该没有原神需要的手机配置高吧，我希望我的手机带的动"
"大砖头啷死你","男","无IP","399119540","5","","10000","1","","二测还是一般"
"斗转星流","男","无IP","301492108","6","","10000","1","","六角形对角开的门也太星际公民了！希望以后有更多类似的场景，甚至飞船！"
"医学云之君","男","无IP","23354878","5","","10000","1","","和我有什么关系？我连游戏都下载不了[大哭]"
"几沐尘","保密","无IP","287158758","5","","10000","1","","我要见大伟[大哭][大哭]"
"请叫我清茳","保密","无IP","65678942","6","","10000","1","","大的要来了[doge][嗑瓜子]"
"再见了希尔","男","无IP","194667829","6","泠鸢yousa登门喜鹊","10000","1","","没有测试资格的我，什么都做不到！"
"改名原来要6个硬币啊","保密","无IP","477366032","5","","10000","1","","爆炸x卡农，我串到开端去了[doge]"
"孤傲的网游战士","保密","无IP","415876010","6","","10000","1","","小提琴的模型是没加载出来吗[思考]"
"德丽莎sj第一可爱","保密","无IP","362060981","5","星座系列：双鱼座","10000","1","","看到那个小提琴了吗？是我！[打call][打call][打call]"
"长不大的小烁烁","保密","无IP","224706062","5","","10000","1","","主角的大招语音能不能换一个，这跟金克丝一样的台词太出戏了也"
"挑檎","男","无IP","98992790","6","","10000","1","","看来外星人并不是想摧毁这个卫星啊，而是想占领。"
"wuhu倦梦还","男","无IP","96254924","5","","10000","1","","焦里焦气的[妙啊]"
"Amon-003","保密","无IP","398591086","5","","10000","1","","这个pv一看就有很严重的抄袭问题，比如说背景的蓝色星球与地球过于类似！"
"李天希希希","保密","无IP","94224977","6","","10000","1","","嗯？发现新的xcw"
"DARK_LAO","男","无IP","296857213","6","崩坏：星穹铁道","10000","1","","徐老师刚从隔壁薄纱完愚人众就跑来拉虚空小提琴啦[脱单doge]"
"账号已注销","保密","无IP","2072727585","0","","5000","1","","没人来？我先来，星铁bgm抄袭卡农实锤[doge]"
"灼眼之霞","男","无IP","5133300","6","","10000","1","","快节奏的当下，不知道回合制游戏会不会被大家接受，但是我自己还是很喜欢的，期待公测[小电视_赞]"
"sinezx","男","无IP","39374057","6","hanser","10000","1","","新游戏终于听到Hanser了，很满意，非常满意！"
"申屠为","保密","无IP","177215662","5","","10000","1","","没有中的来这里集合[酸了]"
"露易丝莱恩","保密","无IP","216582457","6","","10000","1","","崩坏真是eva味儿够浓的[藏狐]"
"云天灬外","保密","无IP","412650045","5","","10000","1","","卡芙卡小姐的演奏我能听一整天[打call][打call]"
"蹦蹦蹦gghf","男","无IP","381972282","5","","10000","1","","我为崩三出过力，我为原神流过血，你们怎么能不给我铁道游击队测试资格！放我进去，我要见大伟！[大哭]"
"无意松雪疏疏下","保密","无IP","65574180","6","","10000","1","","米哈游还是忘不了eva"
"第四十五号勇者","保密","无IP","11787639","6","","10000","1","","崩坏果然还是少不了eva啊[脱单doge]"
"钢琴芭蕾萨克斯","男","无IP","111214456","6","至尊戒","10000","1","","莫名想起铁道游击队之歌"
"云天灬外","保密","无IP","412650045","5","","10000","1","","放开我，卡芙卡小姐不能没有我，就像我不能没有她一样，放我进去！[抓狂][抓狂]"
"账号已注销","保密","无IP","308129747","0","","5000","1","","枪神纪的开头动画最帅，而且只能在装完游戏第一次启动能看到"
"シモン","保密","无IP","102943","6","-阿库娅","10000","1","","草，这也能玩梗[笑哭]"
"猪刚鬣脚皮泡水喝","保密","无IP","287863589","6","","10000","1","","看了两次测试，觉得[笑哭][笑哭]有种在galgame里面塞了地图和回合制养成系统一样"
"中二少年阿森","保密","无IP","398848861","5","","10000","1","","米哈游只做二次元吗？"
"长歌行-星月","保密","无IP","499103288","4","","10000","1","","什么时候公测！！！[傲娇]"
"鹿鸣Iris","保密","无IP","387608736","6","","10000","1","","看来我来的不是时候,不，你来的正是时候"
"我只是个路过的捷德","男","无IP","224723034","6","","10000","1","","这小兵莫名有种基夫使徒的味道。[笑哭]"
"夜寐眠","男","无IP","10419625","6","","10000","1","","你们都是我的翅膀[脱单doge]"
"七七望着你","保密","无IP","100343655","6","三周年恋曲","10000","1","","没你没我给赞没币"
"放我亿条生路","男","无IP","1739124455","4","","10000","1","","好活![tv_鬼脸]"
"假面骑士Cronus","男","无IP","8353694","6","刺客伍六七","10000","1","","你没资格啊，你没资格啊，正因为如此，你没资格啊[doge]"
"森林防火3289","女","无IP","32888190","6","","10000","1","","可恶，可恶可恶。你们一群傻瓜，白痴。为什么挡我的路。为什么没有选择我。为什么！！！明明都是舰行者！[脱单doge]"
