"昵称","性别","IP","UID","等级","装扮","用户权重","获赞数","粉丝团等级","评论"
"账号已注销","保密","美国","1968329049","0","","5000","10363","","目前来看仙舟应该是主要3个种族,人（李素裳，景元）,狐狸（听云）,龙,仙舟有自己的命途和星神,其中有些人和崩3中的其实就是一个人，但是你简单可以理解成是不同平行世界下的,比如马飞马（崩铁里叫延青，马飞马神州小说里原名也是马延青）,仙舟科技很发达，影响力到了别的世界都有所耳闻,和天才俱乐部一样"
"舂葵","保密","福建","321904674","5","","10000","328","","神舟联盟官方声优：米家游戏配音，欢迎补充,景元：孙晔（后崩坏书男主、凯亚、戴因）,罗刹：赵路（奥托、神里绫人、左然）,素裳：陈婷婷（铁道女主、李素裳、安娜、莫娜、妮可她）,青雀：刘十四（克莱茵）,符玄：花玲（德莉莎、观星、月下、可莉、纳西妲）,彦卿：喵☆酱（幽兰黛尔、温迪）,停云：蒋丽/小n（丽塔、神里绫华、香菱）,白露：多多（萝莎莉亚、派蒙、菲米莉丝）,丹恒：鱼冻（夜枭、达达利亚）"
"你的影月月","男","辽宁","431073645","6","","10000","314","","所以三测啥时候开！"
"水果小鱼","男","四川","563229","6","","10000","35","","近年的国产游戏大部分都把狐狸要素给和风了，竟然还能在国产游戏中看到国风狐狸莫名的有点小感动[笑哭]。"
"广东牌圣左颂星","保密","广东","268343852","5","","10000","14","","期待匹诺康尼又能给我整出什么大活，已经闻到腥风血雨的味道了"
"杜鹃衔叶","保密","云南","514752316","4","","10000","12","","1.3考古，太空喜剧喜不喜我不知道，但我知道同为崩坏的往事乐土是挺“乐”的[灵魂出窍]"
"永远喜欢三月七ovo","保密","广东","265502312","6","","10000","86","10","而且最让我惊喜的是，每天逛地图都能发现一些有趣的对话和各种发病文案，重复逛地图的枯燥感比原神少了很多"
"加糖的卡布奇诺_","保密","湖北","455747442","5","","10000","19","","饮月开大也追不上白露的原因找到了"
"不如瘫在床上睡","男","山西","297526605","6","","10000","18","","时隔这么久看，竟然感觉更欢乐了！一开始都没注意开头的垃圾桶。"
"奥术光辉的冰川尖刺","男","河南","435032813","6","","10000","29","","太空喜剧，指：因为我已触摸过天空"
"账号已注销","保密","江苏","696072827","0","","5000","19","","那个彦卿对应神州折剑录中的马非马,罗刹对应奥托,素裳对应李素裳,话说我符奶奶呢？"
"戒律深罪之槛_official","保密","河北","470512153","6","","10000","181","","这是什么停尸间，崩坏三死的全转生到这了"
"刻雨甘晴luo","保密","福建","1187529973","5","","10000","31","","希望你的剧情和PV一样开心[脸红]"
"魔块绿","保密","广东","17714414","6","","10000","31","","你是太空喜剧吗,镜流同行任务:我觉得我是"
"i谷凛_","男","北京","62536365","6","","10000","171","5","崩坏系列的前作崩二崩三都是讲百合故事的媚宅游戏，铁道如何犹未可知，但我希望不论你是为了什么来玩这个游戏的，心里都能有个底。玩什么游戏，就守什么游戏的规矩。,爱护纸片人，尊重大家的老婆老公，从你我做起。"
"天气很酷","保密","安徽","477049443","4","","10000","20","9","个人希望某些人呢，在这能别吵官方主角这个问题，原那边吵的已经够多了吧。。。。[笑哭]本来这节奏就挺莫名其妙的。。。"
"与君共山河611","保密","黑龙江","1016985361","4","","10000","28","","冷知识，1.3版本后，这个pv里的角色已全部入池"
"喵姜酱","女","北京","3772334","6","实验品家庭","10000","57","","玩了俩月多再返回来看开头的垃圾桶，会心一笑，不能没有垃圾桶啊"
"蠢蠢鱼冻sang","保密","甘肃","35303886","6","","10000","207","","呜呼，哇偶，要来啦[脱单doge][打call][打call][打call]"
"博boooring林","男","广东","28208129","6","","10000","24","","太空喜剧：指只有在太空中（列车上）才是喜剧"
"陶典典","女","山东","370910889","6","星座系列：水瓶座","10000","1186","","00:33  00:35 卡芙卡啊啊啊啊啊啊！妈！！！妈！！！！！！！！"
"爱笑的我叫无名","男","未知","172954028","6","citrus","10000","725","","爷挖到宝了！"
"咸蛋翅根","男","河北","241354151","5","","10000","773","","景元的盛世美颜，谢谢停云姐[脱单doge]"
"离h","男","未知","592718237","5","","10000","1995","","pv中所有的手机壳,,00:24 ,,,,00:28 ,,,,00:56 ,,,00:58 "
"烨梵施","女","湖南","396839588","5","","10000","381","","佩拉手机壳是 未定事件簿 [妙啊]"
"WindPoro","保密","未知","6814377","6","自设模板","10000","344","","omg好多美女！[奥比岛_喜欢][奥比岛_喜欢][奥比岛_喜欢]"
"星辰-雨主","男","河南","501142904","5","","10000","381","","报圣上：穹贵妃生了！！！！！！！"
"外币_巴伯","保密","未知","277725363","6","咩栗","10000","146","","不会有人不想扫码吧?"
"珈璃蹲","男","广东","7968307","6","原神","10000","412","10","这是你吗,是,这压根就！,那时候，我还很老。。,我不做老东西了！[崩坏3・终焉归始_燃起来了]"
"阿波尼亚乐土过家家","女","湖北","551934699","5","","10000","282","","00:12"
"我永远喜欢主教大人","保密","江苏","411337754","5","","10000","216","","00:47 啊啊啊啊啊啊啊啊啊啊罗刹大人啊啊啊啊啊我永远喜欢罗刹[崩坏3・终焉归始_cool][崩坏3・终焉归始_燃起来了][崩坏3_吃咸鱼]"
"韦德赫伯特","保密","河北","37727985","6","原神","10000","77","","蓄意轰拳！"
"橙汁圣诞","保密","内蒙古","103053415","5","","10000","187","","直说吧，视频里的最后能活几个[doge]"
"凌语LTH","女","黑龙江","349980055","6","原神","10000","477","","彦卿！！！！！！哦哦哦哦哦哦哦我最爱的少年！！！！彦卿！！！！！！我爱你啊啊啊啊啊啊啊啊啊啊！！！！！！"
"八月岚樱","女","未知","501330533","4","","10000","88","","被撅力（喜）"
"龙汉牧天尊","男","未知","170573611","5","","10000","89","","卡芙卡妈妈"
"里见Y","男","辽宁","456838247","5","崩坏3・天穹流星","10000","249","","岁月真的是把杀猪刀啊[崩坏3・光辉矢愿_不可以看]"
"顺网线爬过去找角色黑","保密","河北","424154166","5","","10000","677","","主教大人！！！！！我的亡妻！！！（阳光且健康的跑步）（跨栏）（阳光且健康的跑步）（三分投球）（七彩广播体操）我命中注定的外敷!!!!!!!（扭转呼啦圈）啊啊啊啊啊啊!!!!（三分投球入框）（跳舞）（随风飘荡）（自信)（幸福）（沐浴阳光）（冲刺）（舒坦）（头不昏了）（胸口无不适）（精神振奋）（食欲大增）（脚步轻盈）（温柔）（暖心）（宁静）（热爱生活）（清风徐来）（亢奋）（奋发图强）（强身健体）（体内有热流涌动）（上房揭瓦）"
"_艮生","女","上海","12953543","6","","10000","131","","玩什么都厨女主，但是铁道的女主真的是格外在我的xp上啊[原神_哇]"
"西瓜酥Su","保密","未知","280011366","6","崩坏：星穹铁道","10000","254","","急急急[崩坏3・终焉归始_窒息]"
"月亮与猫与你","女","未知","65547739","6","全职高手","10000","89","","未定NXX五人组/doge，米哈游出周边！"
"再重名我真的要闹了","女","安徽","631134327","4","","10000","100","","啊，顺便提一嘴，原神来的姐妹们，老杨有官配的[原神_嗯]"
"i谷凛_","男","北京","62536365","6","","10000","85","5","我发现有的人是真神奇，角色还没出呢，就一人分饰两角，是又当服务员成天到处端水，又作厨子扯“官方ooc”。,现在的角色就出了一张脸和寥寥数语的介绍，你到底厨了个什么啊？不会是你臆想出来的样子吧？真是苦了彦卿这个角色了，以后肯定会是腥风血雨。"
"故事跃迁者","保密","广东","423768942","5","","10000","126","","对不起，我也不想看到的，但一定要让你们看到[tv_偷笑]"
"R{","保密","四川","89027114","6","","10000","68","","我终于懂了这个pv开局为什么是翻垃圾桶[doge]"
"s属性大爆发studying","保密","山西","28407683","5","","10000","67","","现在知道为什么在最开头星姐在开垃圾桶盖了[脱单doge]"
"雒娅","保密","浙江","478958022","5","崩坏：星穹铁道","10000","73","","你滴，好好滴优化，2077滴不要，闪退滴不要，崩服滴不要，人设滴不崩，数值滴不胀，我滴，氪金大大滴有。[崩坏3・终焉归始_指点]"
"深树霜天","男","重庆","413008887","5","碧蓝航线","10000","159","","我先说好，老杨是有媳妇的，厨可以，但别骂老杨他媳妇"
"柑宝","保密","四川","187681452","6","崩坏：星穹铁道","10000","697","","明天就公测好不好？[原神_拜托]"
"Rockyyyy","男","上海","3929429","6","至尊戒","10000","110","","这建模真他妈爆杀原[大哭][大哭][大哭]"
"负电荷反应","保密","广东","313628555","5","","10000","216","","米哈游 上仙同位体的建模能不能让丹朱做？,就安赤鸢圣痕做。[热词系列_三连]"
"SpikeJoe_紫檀","男","安徽","2329781","6","崩坏3・天穹流星","10000","147","","热知识:日本人都知道九尾狐是中国传过来的，某些中国人却不知道"
"-玩原玩的-确信","男","四川","178145227","5","","10000","56","","万恶之源[笑哭]"
"橘味是真的香啊","女","广东","650051538","5","","10000","40","","01:20 停云:吃我一拳"
"蜀黎悲歌","保密","辽宁","1536819598","5","","10000","67","","到现在才知道为什么要从垃圾桶里开拍[doge][doge]"
"真我愿景","女","云南","517848377","5","","10000","103","","大家发现没，这角色穿模了，穿过我的手机膜，我中弹啦，啊啊啊啊啊啊啊啊~[原神_嗯][原神_嗯]"
"芙来运转好运开头","保密","河南","2072933762","5","","10000","37","","看这里青雀把符太卜扑倒了[脱单doge][脱单doge]"
"到底还是不明白","保密","河南","1671067208","4","","10000","64","","自制滴四神通缉令[热词系列_知识增加][热词系列_知识增加][热词系列_知识增加]"
"露水没有毒","保密","内蒙古","22585832","6","","10000","62","","真不错上一个pv是男的这次就是女的[doge][doge]你做得好啊"
"斯塔尼亚-","男","浙江","269905","6","初音未来13周年","10000","73","","星穹列车根本不欢迎我！我传送回列车直接给我卡太空外面不开门，呜呜呜"
"空耳狂魔","男","四川","3127528","6","","10000","1125","","白露，我的白露，我要吸你的龙角角，rua你的龙尾巴"
"丞灰","保密","安徽","440140941","5","","10000","61","","哭了[保卫萝卜_哭哭]"
"MsWrHbK","保密","北京","8011380","6","","10000","61","","终于知道开头开垃圾桶是什么意思了"
"你群最菜仓鼠","保密","吉林","204053546","6","三周年恋曲","10000","61","","[doge]"
"林里寻","女","河南","357919741","6","","10000","70","","希望回合制能劝退一波人[崩坏3・光辉矢愿_安详]"
"30岁开始打鸟","保密","广东","437900820","6","灵笼","10000","85","7","扫码结果[脱单doge]"
"泽浠ZexI","女","江苏","404230281","6","天官赐福动画","10000","78","","你的手机壳上怎么是未定啊哈哈哈哈 00:24"
"白蝴蝶与树","保密","广东","524283188","5","魔法学院","10000","82","","我need公厕！！！！！！[暹罗猫小豆泥_呆滞][暹罗猫小豆泥_呆滞][暹罗猫小豆泥_呆滞][暹罗猫小豆泥_不要]"
"狐诌","男","河北","1737743","6","","10000","31","","01:21"
"丸子鱼-Meatballfish","女","未知","394942081","6","","10000","45","","我发布了一篇笔记，快来看看吧~"
"向娜塔莎小姐道歉","男","黑龙江","287760885","5","hanser","10000","55","","佩拉同学，原来你也…… 00:26"
"Aihara_Me1","男","上海","348673778","6","崩坏3・天穹流星","10000","32","","世界名画 01:21"
"氨基酸不肯吃饭","保密","江苏","172012147","5","","10000","52","","我超！我居然真的抽中了！"
"菁英华","男","未知","364988977","4","","10000","186","","可爱滴捏"
"账号已注销","保密","安徽","1821345010","0","","5000","50","","崩坏ip系列游戏，主要角色百合为主，主角的作用仅为角色们的朋友以及剧情推动者，某些反感百合的人就不要强行玩又喷百合cp绑定了"
"全能的天才M诚士郎","男","陕西","650481618","4","","10000","23","","还有15天公测"
"我是希儿的枸","保密","河南","1109449510","5","","10000","46","","为什么没有武装直升机，你们是不是搞性别歧视？[原神_嗯][原神_嗯][原神_嗯][原神_生气][原神_生气][原神_生气]"
"Lingxiii_","女","广西","107791334","6","良辰美景・不问天","10000","22","","哼，哼，哼，啊啊啊啊啊"
"杏仁豆腐会带来美梦吗","保密","湖南","507196070","5","","10000","45","","米游社预约界面是男主，PV是女主。,穹妹，你是懂端水的[脱单doge][脱单doge],多跟未定学学端水呀！主角的水一定要端平！[原神_生气][原神_生气]"
"芭妮玛阳了","保密","广西","284231665","6","","10000","44","","飞光回来的，你小子崩字开头最好是喜剧嗷[生气]"
"人妄狂之","保密","广东","1589495527","5","","10000","41","","急急急急急，我是大风急官"
"影之侍","男","河北","14075464","6","三周年恋曲","10000","39","","好想摸摸她的角啊,好在意啊好在意啊"
"夏日笼罩的唐恩","女","河北","357661608","5","","10000","40","","趁没人，弱弱问一句，真的没人嗑奥裳嘛[脱单doge]"
"玩过鸢是我的赛博案底","保密","中国香港","1359498052","5","崩坏：星穹铁道","10000","38","","你是会端水的，主角轮流上pv"
"语风yu","保密","江西","23731694","6","七濑胡桃","10000","36","","省流[hanser_怂呐]"
"是小草哇","保密","湖南","519207090","5","","10000","37","","你怎么知道我抽到了星穹铁道测试资格？.jpg[doge]"
"超想吃番茄","女","未知","7086255","6","","10000","35","","你又勾引我！,快端上来！明天三测后天公测别逼我跪下求你！！"
"乘桴浮不起来","女","重庆","33932583","6","","10000","32","","怎么感觉彭导音线回不去了[无悔华夏_吃瓜]"
"于十行珏","女","湖北","142465198","6","","10000","31","","你最好是喜剧[脸红]"
"因光而遇-","保密","河南","516561102","4","","10000","41","","怎么能这么好看啊老婆啊啊啊啊啊,原神？真的不熟,求求原宝也出这种高马尾毛茸茸大将军和这种少侠，现在男性戳我xp的真的好少[大哭]"
"清奇-奇","保密","广西","1219461088","4","","10000","33","","罗浮没有垃圾桶这合理吗[原神_生气]"
"紫颂果","保密","江苏","384797308","5","Kizuna AI","10000","30","","我现在就要玩！"
"伊卡洛斯の太阳","男","广东","3493130921839120","4","","10000","33","","说好的太空喜剧呢？你新出的pv，你自己看过了吗？[阴险]"
"图戈泡泡","男","河北","1785660616","5","","10000","29","","撩又撩的很,公测又不肯[酸了][酸了][酸了]"
"非亚飞","男","北京","2934967","6","向晚大魔王","10000","39","","还没公测，这节奏就来了，生怕吵不起来啊，真是米氏特色"
"萤火微热","保密","江苏","9596177","6","公主连结凯露","10000","28","","蹦蹦蹦已经被原做掉啦，瓦尔特都被人说成钟离啦[崩坏3・光辉矢愿_安详]"
"虚拟歌姬好果汁儿","男","四川","287807129","5","洛天依8th生日纪念","10000","28","","一个没有符华的崩坏游戏注定只能度过一个较为失败的游戏生涯......,星！穹！,重振上仙荣光，吾辈义不容辞！！！"
"乱蝉嘶","保密","甘肃","10550814","6","","10000","39","","旧事重提 ：https://space.bilibili.com/463937,这个人之前空口煎炒绝区零，却关注了崩铁"
"享受猫生","保密","马来西亚","473009491","5","","10000","28","","星铁的角色都设计得有种分不出星级的美（？）[热词系列_知识增加]"
"言默I别给我推恒右了","保密","四川","519598490","5","崩坏：星穹铁道","10000","25","","停云拿景元的照片出来卖，什么奸商行为？请务必也给我一份。[脱单doge]"
"阿尔托莉雅如是说","保密","山东","321839035","5","2021拜年纪活动专属","10000","24","","米哈游你最好不要刀我，主角的笑让我想起了炎拳里的阿格尼"
"陶典典","女","山东","370910889","6","星座系列：水瓶座","10000","24","","00:53 新增角色：青雀 00:57 符玄 01:01 彦卿 01:06 景π，啊对不起，是景元[可爱联盟新年_嘿嘿] 01:12 停云 01:19 白露女鹅！！！！！！！！[可爱联盟新年_好]"
"逃逸吉他手","保密","湖北","11594303","6","","10000","22","","让我买景元的照片（流口水）（流口水）我要买！！！我要买！！！！！"
"文念云正好","保密","天津","1802209901","5","","10000","22","","[脱单doge]"
"西门萧遥","男","河南","32238456","5","","10000","22","","这是要补上神舟折剑录的缺憾吗"
"向娜塔莎小姐道歉","男","黑龙江","287760885","5","hanser","10000","22","","这么抽象的通缉令真的能找到人吗 00:12"
"星夜无邪","男","河北","3493144461052733","3","","10000","23","","不烦垃圾桶的日子是无趣的[脱单doge]"
"Vistean","女","四川","218812299","6","","10000","23","","守护全世界最好的垃圾桶[脱单doge]"
"阿井二号机","男","广东","3038886","6","","10000","32","","当一个以崩坏为前缀的游戏，自称喜剧开始，我就产生了怀疑 [崩坏3_差不多得了]"
"鲶尾鲶尾","保密","广东","428365991","5","","10000","32","","总有人把崩三马非马跟崩铁彦卿混为一谈，还恶意攻击角色[翻白眼],看官这边请[脱单doge]BV1PP4y167tB"
"-AngLEI-","男","浙江","351634890","5","","10000","21","","爷对垃圾桶是真爱啊"
"染","男","江苏","383812718","5","","10000","29","","啊啊啊啊啊，我好急啊，我要玩星穹[大哭]"
"没点伤害还讲什么道理","保密","山东","3493125469243443","2","","10000","30","","哈哈xdm米哈游被人说靠游戏数量取胜笑不活了"
"我也一样---","男","山西","497363211","5","","10000","22","6","你最好真的是喜剧"
"理之律者合体","保密","广东","1635977831","4","","10000","20","","[喜极而泣][喜极而泣][喜极而泣]，你们看看停云的表情"
"退休剑首镜流","女","未知","144839432","5","","10000","19","","马非马lily"
"银新海","男","山东","1103735999","4","","10000","19","","这就是太空喜剧吗？爱了爱了[墨镜]"
"杨可帅Ukulele","保密","广东","265647033","6","拜年祭粉丝专鼠","10000","22","","喜剧的内核是悲剧是吧[doge]"
"鸽妤0v0","保密","福建","1517758850","4","","10000","31","","看了一下好离谱……居然有人不知道九尾狐比日本的什么狐狸传说早出现吗？居然有人不知道宋朝还是南朝宋的（反正有个时期）我国狐神特别流行吗？流行到到处都有狐狸神像的那种。不会真的有人觉得狐狸日本特产吧不是吧不是吧。"
"铭子煎饼不煎鱼","保密","黑龙江","1185362138","5","","10000","24","","我要跳坑了！极度喜欢一些国风元素！呜呜呜等正式服！（阿贝多老婆我事先跟你请假）"
"千之依","保密","广东","1152872715","4","","10000","16","","佩拉：嘿嘿，真有乐子[喜极而泣]"
"你也去斯卡布罗集市吗","保密","山东","1535422594","5","","10000","21","","停云：[生气]"
"丰饶星神-药师","男","山东","351735029","5","原神","10000","30","8","表情包来哩"
"逮鸭","保密","山东","347535507","6","","10000","14","","小细节[2233娘_卖萌]"
"DARK_LAO","男","中国香港","296857213","6","崩坏：星穹铁道","10000","12","","01:20 小女子要暴起伤人辣！"
"世纪末的名侦探","男","美国","2097397431","4","名侦探柯南","10000","11","","须弥学者为了学术研究从提瓦特来到了这里，她真的我哭死[doge]"
"枯树下的白石灰","保密","北京","355918612","5","","10000","11","","扫了，啥也没有"
"菜B桑のFreeG","保密","吉林","210300628","6","#EveOneCat","10000","20","","怎么说呢，墙上通缉令画的是很形象，就算没人样也能一眼看出是谁[tv_笑哭]"
"守拙无慕","男","广东","610743436","5","","10000","20","","明人不说暗话，符玄是我的【崩坏3・终焉归始_燃起来了】"
"ハジメ初","男","北京","12510518","6","#EveOneCat","10000","20","","你甜蜜最好是喜剧嗷，过个支线挺乐的突然捅我一刀是吧[保卫萝卜_哭哭]"
"景星兆庆云","女","湖北","402404783","5","崩坏：星穹铁道","10000","19","11","01:24 "
"秘制坚果","男","山东","1092196297","5","","10000","19","","00:17"
"xiao小白菜","保密","江苏","203929","6","","10000","20","","快公测()"
"风凌巡","男","福建","38315008","6","碧蓝航线","10000","19","","你最好真的是喜剧[阴险]"
"十王司冥差","保密","广东","3493126482168059","3","","10000","19","","看完《飞光》才发现玩的是崩坏系列[tv_笑哭],XXX[tv_生气]"
"十五夜稚草_Aster","保密","未知","177689708","6","","10000","17","","虽然是米家游戏，画面不错。但是是回合制，不一定好玩，这次三测大家就别报名了，先让我去看看[tv_doge]"
"脆弱的心情不好了呢","保密","浙江","1404592340","4","","10000","18","","急急急急急！！！！景元的池子还有4天。[tv_大哭][tv_大哭][tv_大哭][tv_大哭][tv_大哭][tv_大哭]"
"远山赴风","保密","广东","15564654","6","","10000","18","","目前为止支线大部分都是刀子 太爱你辣米桑"
"星巡のyuuくん","男","上海","404629560","5","","10000","17","","如果你内置麻将三缺一就是神作[doge]"
"Viskty","保密","广西","31265489","6","","10000","16","","景元，marry me"
"洪无极","男","福建","47129767","6","","10000","16","","让我见三月七！让我见黑塔！让我见虎克！让我见白露！让我见坏女人卡芙卡！让我见银狼！让我见洪无极（女主）！让我见三月七！让我见黑塔！让我见虎克！让我见白露！让我见坏女人！让我见银狼！让我见洪无极（女主）！让我见姬子！让我见布诺妮亚！让我见艾丝妲！让我见佩拉！让我见希露瓦！"
"捡到个纳西妲","保密","宁夏","286155539","5","2021拜年纪","10000","17","","这下小女子是真要暴起伤人了[doge]"
"乱浮萍","女","上海","2075633862","4","","10000","17","","你最好给我是太空喜剧，不然我跟你没完[阴险],www稻妻五人组四人全刀，好家伙仙舟五人组四个没彻底死成，狐狸姐姐又要被刀了对吧。"
"zi子茶","女","四川","501372957","5","","10000","16","","生气了，大家都在晒欧，就我一个人50抽硬出一个克拉拉吗[天官赐福花怜生日快乐_水逆退散]"
"花绳捏","保密","未知","410901300","5","","10000","16","","为了卖手机壳而做了一款游戏，他真的，我哭死"
"阿杰sein","男","北京","346390393","5","","10000","20","","对不起 翻垃圾桶翻出个头像我是真的没绷住[跪了]"
"海萌伊露","保密","贵州","280233335","6","","10000","15","","兄弟们我中了三个资格，打算分享一下。米游社那边不是可以邀请好友抽吗，我就大号没中邀请了一个小号，顺便把问卷填了，结果就收到了一份米游社通过的消息，今天又收到了个tap的，在我和群里面水友吹逼分享运气的时候，tap的小号又中了……多了两个资格拿来没用，官方还不如给别人，那两个号啥东西都没得。,,今天上海鲜市场淘东西的时候发现隔壁海鲜市场卖100一个资格，这奸商的事咱不干，到时候我10号直接发出来给水友们都玩一下过过手瘾"
"星空jiang","保密","海南","39194309","6","","10000","15","","卡莲有没有机会转生到你这当个活人。。。"
"多放葱不要辣","保密","广西","634080727","5","","10000","15","","李依李狂喜"
"mX","男","福建","540046603","4","","10000","15","","你们都在选老婆是吧，那主教我就抱走了啊[给心心]"
"好像不错鼓捣鼓捣","保密","山东","661509512","5","崩坏：星穹铁道","10000","15","","佩拉这是？"
"叶渝鱼鱼儿","保密","黑龙江","386459313","5","","10000","17","","尽力了[脱单doge]"
"阿库娅_desu","保密","江西","291324587","6","","10000","16","","想不出什么话来，就祝大家拿到测试资格吧！[热词系列_大吉大利][热词系列_大吉大利][热词系列_大吉大利]"
"萌萌的Enkidu","保密","陕西","454286145","4","","10000","15","","乐不思原"
"VisanJ","男","广东","426517711","5","","10000","15","","当我看见亮晶晶的东西就想去看看，结果翻遍全部垃圾桶，我说嘛怎么PV有翻垃圾桶的镜头，谁没事翻垃圾桶，没错就是我，我会去，该死的米哈游在这等着我"
"情人","男","湖南","330303339","6","公主连结佩可莉姆","10000","15","","4.26公测 农历的三月七号"
"机械降神--","保密","山东","27210645","6","","10000","15","","得知师叔返老还童后的李素裳：老马啊，G，老马！G――"
