"昵称","性别","IP","UID","等级","装扮","用户权重","获赞数","粉丝团等级","评论"
"是井由君ね","保密","山东","401149433","6","EveOneCat2","10000","3","","快让我玩.......[崩坏3・终焉归始_咕蛹者]"
"坠入喵塘","保密","安徽","291253083","5","快把我哥带走","10000","3","","嘿嘿嘿"
"永逝与永恒的梅之爱","女","广东","39174680","6","EveOneCat2","10000","3","","啊啊啊啊啊我高考一定要玩！！"
"独坐竹林","保密","内蒙古","700840152","5","","10000","3","","好耶[打call][打call][打call][打call][打call][打call][打call][打call][打call][打call][打call][打call][打call][打call][打call][打call]"
"枣椰早","女","四川","274996967","5","崩坏：星穹铁道","10000","3","","有主机端吗？[原神_唔]"
"-KAMEDA-","男","山西","437256506","5","","10000","3","","好，好大的饼[哦呼][哦呼][哦呼]"
"热心市民白先生--","男","吉林","407445867","5","","10000","3","","可以，我最喜欢仙帝[哦呼]"
"princepocky","男","湖南","357959004","5","","10000","3","","银狼我的，谁都别抢！（估计没人看得见）"
"呜梦","男","上海","454112479","4","碧蓝航线","10000","3","","给我一个资格我还你双倍充值一套！"
"秋~の寂","男","湖北","521326318","5","","10000","3","","快点端上来罢！"
"T滕T","保密","上海","1070728895","4","","10000","3","","卡芙卡！妈！！！"
"小鸟游玖悦","保密","河北","290427010","5","崩坏3・天穹流星","10000","3","","啊啊啊啊，我受不了啦，我要玩星穹铁道啊，为什么还不公测啊，我要发电了啊[崩坏3_拜托了][崩坏3_拜托了][崩坏3_拜托了]"
"日光辰_","男","江西","174006500","5","","10000","3","","隔壁建模都成啥样了[微笑]"
"不再企望","男","陕西","28933298","6","","10000","3","8","无所谓，我会出手，凤凰显形"
"亚璃子与灯露椎","女","天津","397214538","6","","10000","3","","我是仙家军 漩涡"
"今天出门突然-_-","保密","广东","62434764","6","","10000","3","9","你好，可以v我一个三测机会吗[脱单doge]"
"墨溪剪辑","女","江苏","3493088479676421","4","魔法学院","10000","3","","好耶！@崩坏星穹铁道"
"枫海怡音_","男","浙江","500766065","5","原神","10000","3","","黑塔，符玄，都是我的[保卫萝卜_哇]"
"摆烂一整天快乐一星期","女","陕西","51360370","6","","10000","3","","这不是老婆们和我的家庭展示片嘛[脱单doge]"
"K416舰长","保密","四川","174582454","6","崩坏：星穹铁道","10000","3","14","明人不说暗话，收款码给我，扫钱给你，把照片都交出来！"
"叶花泉","保密","浙江","1004427042","3","","10000","3","","黑塔[爱心][爱心][爱心]"
"火系大剑纯爱人","男","陕西","361387492","6","","10000","3","","我现在就要玩星穹铁道啊啊啊啊啊"
"暗研菌QAQ","男","河南","94322370","6","星座系列：双鱼座","10000","3","","2月10日开始测试，测试几天？7天，那3月7日公测吧[打call][打call][打call]"
"yitamle","保密","安徽","669670778","3","","10000","3","","1小时还热乎[脱单doge]"
"红日月初","保密","山东","39404212","5","","10000","3","","我看到了开头的垃圾桶[tv_doge]"
"忱之梦","保密","湖北","509472517","4","","10000","3","","PV撩得很，要玩又不肯，不充让我滚，无情又残忍[tv_doge]"
"Aptonwn","保密","湖北","33012189","6","","10000","3","","穹宝，快点公测吧[抓狂]急急急现在就想玩崩坏:星穹铁道"
"姬子QAQ","女","新西兰","242912718","5","","10000","3","","让我玩让我玩[大哭][大哭][大哭]我受不了了快让我玩[大哭]我馋到要发疯了让我玩啊！！！"
"默丿言","保密","上海","177823006","6","","10000","3","","这音乐，这快乐的氛围，要是在1号发布，我愿称之为绝杀[歪嘴][歪嘴]"
"账号已注销","保密","安徽","1821345010","0","","5000","3","","发现个点，白露还是飞机跑"
"梦辞归盼","男","江苏","503130049","5","","10000","3","","我，现在就想玩星穹铁道，快端上来吧，还有，黑塔白露好可爱，我是她们的狗！！！[脱单doge][脱单doge][脱单doge]"
"燕山月羌笛柳","保密","四川","484598842","5","","10000","3","","看完了，很棒！不过我阿鸡都在，上仙呢？"
"潜影座星韵","保密","江苏","436823305","6","","10000","3","","“无所谓，我会出手”[笑哭]"
"沾裳泪","男","安徽","351879571","5","泠鸢yousa","10000","3","","给我内测资格"
"我永远喜欢Hua","女","陕西","1679554714","4","公主连结可可萝","10000","3","","快出符华好不好，我给她氪满[保卫萝卜_哇][保卫萝卜_哇]，老婆啊老婆[保卫萝卜_哭哭]"
"冰色-零之下もら","男","辽宁","107481544","5","铃音Suzune收藏集","10000","3","","想玩想玩"
"帝君的桂花酒","保密","黑龙江","1715040030","5","","10000","3","","bgm好评啊好评啊[星星眼]"
"kakiato","保密","法国","240982253","6","崩坏：星穹铁道","10000","3","","明人不说暗话，我喜欢彦卿！[打call],这边仙舟角色设计比璃月更戳我啊"
"一只云枫呐","女","江苏","510181863","5","","10000","3","","急急急，我是超级急急人，快让我触发时空断裂加速啊kora'aaaaDD"
"L1uzlho","男","河北","670868983","5","","10000","3","","再不公测我就快死了[2023]"
"阿阿阿阿钿","保密","山东","622487351","4","","10000","3","","0.5倍速勉强看清...[热词系列_三连]"
"至序圣华","保密","河南","447221411","5","","10000","3","","哇"
"囤货的帕朵","女","河南","489400025","4","","10000","3","","啊哈哈，人好多啊[藏狐]"
"我不是鼋神","保密","湖北","1207782676","4","","10000","3","","太空喜剧（×）,家庭纪录片（）"
"-王子-","男","广东","12955224","6","明日方舟音律系列","10000","3","","b服和官服可以填两次问卷喔[doge]"
"我不是鼋神","保密","湖北","1207782676","4","","10000","3","","为什么？为什么？为什么没有上仙的异时空同位体？不！！！"
"EL・Alonewarde","男","河北","25143370","6","","10000","3","6","我不跟各位抢内测资格 我等公测 请叫我小天使[崩坏3_路过]"
"梦星是萌新","男","江苏","594869855","5","","10000","3","","大家随便说，分扣我们南京的[脱单doge],但是不能跟我抢黑塔，你们没有自己的老婆嘛？！[傲娇]"
"喵都保护协会","保密","新疆","498551988","5","","10000","3","","佩拉，嘿嘿我的佩拉[喜欢][喜欢][喜欢]"
"不能吃的橙子鸭","保密","湖北","185790975","6","","10000","3","","快端上来吧[原神_哇]"
"Zay-chik","保密","未知","384193267","5","","10000","3","","仙不灭！快放我进去玩弄小仙帝！！！"
"9_99_感冒灵","保密","四川","3461562561988673","4","","10000","3","","哈哈哈哈，星穹铁道来喽！[doge]"
"Lilyの花","保密","湖南","22018588","6","","10000","3","6","手机壳版权费给我狠狠地收！（648能不能便宜点[抠鼻]）"
"说你绞旱奈谟哥","男","河南","332746065","5","","10000","3","","我不管 你最好公测[大哭]"
"Steven_Finch","保密","美国","156931642","5","鹿乃","10000","3","","感觉有点子《永生之酒》和《无头骑士》的风格www"
"mX","男","福建","540046603","4","","10000","3","","赶紧端上来啊！[星星眼]希望是和崩三、原差不多的卡池机制吧，我tm直接屯满主教[打call]"
"Luxink","男","安徽","287551986","6","雪未来","10000","3","","明人不说暗话，我喜欢三月七(=ω=)"
"捏了捏白柳的屁股说","女","浙江","403612472","5","","10000","3","","[崩坏3・终焉归始_燃起来了][崩坏3・终焉归始_燃起来了][崩坏3・终焉归始_燃起来了][崩坏3・终焉归始_燃起来了]"
"-月-下-","保密","山东","1660369466","5","","10000","3","","求中测试资格[打call]"
"叮・陈晓娜・当","保密","福建","7567778","6","","10000","3","","省流：别急[脱单doge]"
"波涛恋人","保密","山西","536521882","5","","10000","3","","[崩坏3・终焉归始_燃起来了][崩坏3・终焉归始_燃起来了][崩坏3・终焉归始_燃起来了][崩坏3・终焉归始_燃起来了]今年开服，我就去翘屁股给你们撅[崩坏3・终焉归始_燃起来了][崩坏3・终焉归始_燃起来了][崩坏3・终焉归始_燃起来了][崩坏3・终焉归始_燃起来了]"
"某科学的超皮卡丘","男","山西","454288438","5","","10000","3","","仙帝，是仙帝啊！大家快来看啊，有一只可爱的小仙帝[星星眼]"
"风铃多多","保密","福建","641879443","5","","10000","3","","快公测！"
"23度心情","保密","河南","483963437","5","","10000","3","","公测搞快点！我要上车！[抓狂][抓狂][抓狂]"
"神里R华","保密","山东","57747963","6","神里绫华","10000","3","","要来了吗，要来了吗，要来了吗[崩坏3_送你一朵花]"
"姬子你带我走吧","女","北京","1094386981","5","","10000","3","","垂死病中惊坐起[大哭]"
"一直迷路的旅法师","保密","河南","1264841827","5","初音未来13周年","10000","3","","仙舟的星神我记得强的爆炸[doge]mhy夹带私货"
"吾主叮当在上","男","福建","24054955","6","还有醒着的么","10000","3","","仙舟好帅，满足我对赛博仙侠的一切想象[崩坏3・终焉归始_cool]"
"花_喜","女","美国","18949230","6","","10000","3","","米哈游的男女角色设计都很棒，但是不知道为什么星铁的所有男角色都能精准地命中XP准备入坑的同时仿佛已经看到了自己钱包不保的未来（目前散兵海哥专武四连歪，哈哈[微笑]"
"每天都好困困困困困啊","保密","四川","3461576151534008","4","","10000","3","","啊啊啊啊啊啊啊啊啊景元啊啊啊啊啊啊啊啊啊速速放下羞涩跟我结婚[脱单doge][脱单doge][喜欢][喜欢][喜欢][喜欢]"
"天才紫猴PM","保密","辽宁","386188335","5","","10000","3","","我！在此立誓！,卡芙卡玩到关服，无论版本，无论强度！"
"泠珞_","女","山东","519243375","5","","10000","3","","期待仙舟的剧情[一周年纪念_awsl]"
"奈的名字","男","广东","372660029","5","三周年恋曲","10000","3","","米哈游，我劝你不要这么过分啊，一大早放出这么精彩的短篇，里面的新角色爷很喜欢，你必须立刻马上给爷公测，不然爷以后玩米游都不充钱[doge][doge][doge]"
"姜蒋江_","男","湖南","480453875","5","","10000","3","","快开服！！！米哈游你不要不识抬举[喜欢][喜欢][喜欢]"
"晓晨桑","男","云南","74679957","6","","10000","3","","明人不说暗话，我是来讨要测试资格的("
"笼中龟","男","浙江","9112917","6","名侦探柯南","10000","3","","我建议公测名额设置为2亿，这样有助于收集玩家意见。"
"哪有打牌一直输","保密","海南","34812706","6","","10000","3","","到时候剧情米哈游你最好是喜剧[doge]"
"萸Stan","保密","福建","267620480","6","崩坏3・天穹流星","10000","3","","又在翻了，应该是文学没看够[崩坏学园2_有一说一]"
"正解进行时","女","云南","258664441","5","","10000","3","","可恶啊，不能让老杨的老婆露露面吗？[辣眼睛]我超想念她的"
"顾玖曦awa","女","江苏","526798489","5","","10000","3","","明人不说暗话  景元兄是我的了  谁同意谁反对"
"摸鱼头儿","男","广东","282924404","5","欧皇","10000","3","10","有了版号就是活跃啊"
"红槭独为白蕊留","女","江西","394121960","6","","10000","3","","黑塔磕绀海组，构图还有李素裳和主教，你是什么游戏[hanser动物套装_让你皮]"
"我的鸭鸭天下第一","保密","四川","100560297","5","","10000","3","","已经迫不及待了，快点端上来罢，我要继续体验罗浮的兽耳娘[傲娇]"
"琪露诺是天才哟","女","广西","364179329","6","","10000","3","","这是可以说的吗？角色的外形都很好，但是最后出场有中文配音的两位角色其中的男性角色，是不有点太像钟离了多，少会有点跳戏？"
"湮-伏特加","保密","西藏","492184115","5","","10000","3","","女主！女主！女主！多出出场辣！哦内该！"
"顾城同志","女","山东","147086672","6","","10000","3","","素裳，我的素裳[喜欢][喜欢][喜欢]"
"芋圆土豆饼","女","重庆","639527802","5","","10000","3","","发了这么多视频，这游戏一定公测了吧[脱单doge]"
"崩坏大师兄","保密","浙江","94498429","5","","10000","3","","又要上各国热搜了[脱单doge]"
"豪笑三声嘿嘿嘿","男","浙江","325324612","5","","10000","3","","绝区零！你看看人家穹宝！[保卫萝卜_哭哭][保卫萝卜_哭哭][保卫萝卜_哭哭]"
"我真的是糊了呀","女","山西","1884444349","4","","10000","3","","帅[崩坏3・终焉归始_燃起来了]"
"ベ断笺锦烟ミ","男","内蒙古","396723470","5","hanser","10000","3","","好耶，期待[原神_出货吧]"
"普雷尔公爵","保密","北京","281561","6","原神","10000","3","","这下罗浮折剑录了哈哈哈哈，所以大师姐和二师姐是不是也来啊[滑稽]"
"清酒淡浮生","保密","云南","400327665","5","","10000","3","","你的剧情最好一直那么欢乐[藏狐]"
"柏泽燕zky","男","河南","454091253","5","","10000","3","","手机:你……你不要这样，我……我已经装不下了"
"菜所长","男","广东","671493079","4","","10000","3","","许愿资格，崩宝我等你等的好苦啊[大哭]要不赶紧公测我给你氪六十八"
"Nero-AllanPoe","保密","四川","22937962","6","崩坏：星穹铁道","10000","3","6","听好了嗷！你不让我测试，那就会让我觉得很没面子！下场就是你不要不知好歹弃我钱包于不顾！[鹿鸣_生气][鹿鸣_抓狂][鹿鸣_开心]"
"陪着黑塔转圈圈","保密","山东","179296819","5","原神","10000","3","","我去，这个表情，米哈游是真的一代比一代进步啊[给心心][给心心][给心心]"
"爱摸鱼的小团雀","保密","四川","291064069","5","","10000","3","","新的老公老婆，大家快来选啊[doge][脱单doge]（三月七和佩拉和黑塔我就先刑一步了）[脱单doge][保卫萝卜_哇]"
"奔流城的黑鳟鱼","保密","内蒙古","9928550","6","异常生物","10000","3","","彭导这声线是彻底回不去了[笑哭]"
"德丽莎sj第一可爱","保密","河南","362060981","5","星座系列：双鱼座","10000","3","","为什么你这里默认主角是女的啊[doge]"
"秋名FD3s","男","北京","90949884","6","洛天依・最美的夜","10000","3","","看起来这么搞笑，应该不会有吧[脱单doge]"
"听说我帅","保密","江苏","360184242","5","","10000","3","","发布时间是2023年1月24日，所以，2+0+2+3等于7，4+1-2=3，所以三月七，所以今天公测[tv_鬼脸]"
"硬朗的半吨仙人","保密","河南","355943800","5","","10000","3","","有个角色名是黑塔？我村名也叫黑塔[微笑]"
"洛辰喵","女","山东","306679362","6","崩坏：星穹铁道","10000","3","11","好可爱"
"世o眠","保密","美国","11717812","6","","10000","3","","你终于生了啊穹宝[tv_难过]快点公测罢已经等不及了"
"呆萌の萌冰","女","天津","133483318","5","","10000","3","","景元!主教!我的老婆!"
"伊蕾娜--Elaina","男","安徽","492233743","5","崩坏3・天穹流星","10000","3","","仙不灭"
"但愿缘浅","保密","重庆","186436218","6","","10000","3","","1：12,的仙舟狐狸！啊啊啊啊啊啊，奸商狐狸！！！大尾巴！大耳朵！,1：25,白露右下角，主角腿旁边的那一个小年兽是什么？可爱好可爱好可爱(.)是角色还是伴身兽什么的？如果是角色就好了，怎么会这么可爱？\(////)\太可爱了叭"
"万叶べr","保密","浙江","153999110","6","","10000","3","","虽然但是，罗刹大人是我的[无悔华夏_点赞]"
"星优璃奈","女","江苏","40063983","5","","10000","3","","早上背了静夜思，怎么看到景元就忘了是什么思？景元喂我吃点静夜就想起来了"
"幸黄昏至拂晓","男","河南","357835968","5","","10000","3","8","挚爱景元，不6+5不搞其他角色[脱单doge]"
"Binggo-该帐号封禁中","男","河北","601022836","5","","10000","3","","看样子铁道继承一脉相承的百合豚要素，女主贴贴好耶[崩坏3・光辉矢愿_比心]"
"玄臻真祯","保密","河北","502585587","5","","10000","3","","老杨的cv还没有换回来啊，公测的时候总得换回戴超行老师吧"
"第六虚空生物","男","未知","890488","6","","10000","3","","这些年来最喜欢的女自机形象设计，很适合拥抱[崩坏3・终焉归始_窒息]"
"Nemesis-报应","保密","河南","487701110","5","","10000","3","","嘿，朋友，你记得有个叫往世乐土的东西吧,你说的最好真的是个喜剧"
"英语废中废","保密","四川","172754089","6","","10000","3","","虽然之前中过一次二测资格了但不妨碍我再求一次奇迹发生[脱单doge],好吧中不了也没关系，祝这个视频一键三连的朋友们都能中测试资格[脱单doge]"
"凉拌鸢尾","保密","山东","402341656","5","","10000","3","","马哈鱼!!!!!!!我现在就要玩!!!!!!星――穹――铁――道――!!!!!!!!!我要我要我要我要[大哭][大哭][大哭][大哭]"
"凝寒-鸽子Official","女","北京","235649991","6","碧蓝航线2020","10000","3","","看白露的反应其实也有可能是麒麟，毕竟麒麟一般来说象征祥瑞和丰饶才会引起众人追抢（当然也可能不是麒麟）之前动态提到白露可能与药也有关系，所以我觉得麒麟可能更高一点"
"薪","女","河北","645732736","4","言和7th生日纪念","10000","3","","罗刹！！！！（阳光且健康的跑步）（跨栏）（阳光且健康的跑步）（三分投球）（七彩广播体操）耶!!!!!!!（扭转呼啦圈）啊啊啊啊啊啊!!!!（三分投球入框）（跳舞）（随风飘荡）（自信）（幸福）（沐浴阳光）（冲刺）（舒坦）（头不昏了）（胸口无不适）（精神振奋）（食欲大增）（脚步轻盈）（温柔）（暖心）（宁静）（热爱生活）（清风徐来）（亢奋）（奋发图强）（强身健体）（体内有热流涌动）（上房揭瓦）（跳舞）（冲出银河系）（有劲儿）"
"只若初见悲画扇","男","吉林","7687065","6","","10000","3","","爷怎么还在翻垃圾桶[惊讶]"
"某二点五刺螈人","保密","陕西","437042102","5","","10000","3","","爷真可爱[喜欢][喜欢]，我要变成爷[doge]"
"夕阳绽放","保密","山东","204290476","6","","10000","3","","快进到姬子上最后一课[2233娘_大笑]"
"巧克力色的妖精","男","浙江","5519065","6","","10000","3","","我就说一句话，崩3开服也是这么欢快的[脱单doge]"
"印第安纳汤姆","男","江西","11782163","6","","10000","3","","爷笑地好屑[笑哭]"
"奥托阿波卡利斯单推人","女","安徽","346296944","6","向晚大魔王","10000","3","2","看主角们笑得这么开心，这一定是一款能给大家带来笑容的游戏！"
"晚风渐息丶","保密","广西","386349220","6","崩坏3・天穹流星","10000","3","10","2.10开测，测两周，3.7就能公测了，嗯，就这样，没问题[崩坏3・终焉归始_指点]"
"米可nya","保密","安徽","1825148722","5","明日方舟","10000","3","","小仙帝小小的软软的，可爱爱，嘿嘿嘿"
"Jizix-子c","保密","四川","87973135","6","","10000","3","","转圈圈～"
"卯月之花","女","河南","36717213","6","","10000","3","4","崩坏三满级原神满级未定夏推人崩二有账号，云星穹云绝区零满级，米籍正确，给我资格！不要逼我跪下来求你！！"
"白泉","男","河南","35854498","5","","10000","3","","让我想起成田良悟"
"夜弥散华","男","湖北","21217942","6","","10000","3","","绝区0今年有望没有？"
"别查成分了你又不是FBI","男","浙江","4076579","6","","10000","3","","原神里哥哥作为pv出场默认人物，崩坏铁道里终于是妹妹了吗"
"滴水后湛蓝的涟漪","保密","陕西","38054189","6","崩坏：星穹铁道","10000","3","","爷真好看，对，就是这种性冷淡的感觉[崩坏3・终焉归始_cool]"
"清歌予R","保密","日本","16100145","6","","10000","3","7","明人不说暗话，景元的照片爷全包了"
"迷路的小西琳","男","四川","476846016","5","","10000","3","","命途之上，从伟大到可笑，只有一步之遥。这话感觉有什么深意啊"
"Moca_","保密","四川","436623797","6","","10000","3","","好欢快的旋律呀，这个系列游戏一定很温馨吧[doge]"
"寻泽sd","男","湖南","35570690","6","洛天依8th生日纪念","10000","3","","从此，我的单调人生只剩黑白了,,黑塔，我的黑塔！,白露，我的白露！"
"林停云_","男","贵州","19123322","6","鹿乃","10000","3","","坏了，我成里面的角色了[鹿乃_？？？]"
"被子君咕咕叫","男","山东","352382284","5","","10000","3","","听好了米哈游，我要你早日公测，不公测的话，我将无能为力[doge]"
"黄无昏","男","广东","80777053","6","崩坏：星穹铁道","10000","3","","看起来角色地图完成度已经非常之高了，所以说。。。[阴险]今年三月七能不能公测啊"
"清风cleaning","男","山西","496692216","5","","10000","3","5","你们有谁发现？，女主一开始在翻l垃圾桶"
"PSSF23","男","美国","18895629","6","不吉波普不笑","10000","3","","[哦呼][哦呼][哦呼]“本次您下载的「跃迁测试」版本将持如下语：简体中、繁体中、英语、韩语、语、俄语、泰语、越南语、印尼语、班语、德语、法语和葡语。”"
"あかいろ月","保密","重庆","31138645","6","异常生物","10000","3","","仙舟罗浮做的真好啊，想要测试资格[洛天依]"
"纯金大白兔","保密","浙江","85653558","5","","10000","3","","美术力爆炸啊我太喜欢铁道的美术和音乐了呜呜呜呜呜呜(Д｀)"
"jgvfrjrrdhurgb","女","安徽","11188219","5","","10000","3","","罗刹和小李子99"
"若若丽娅-","女","安徽","471567473","5","","10000","3","","啊啊啊来了好多新老婆！快公测啊啊！"
"天华只想睡大觉","男","吉林","3493118127114561","4","小试身手","10000","3","","仙不灭[崩坏3・终焉归始_燃起来了][崩坏3・终焉归始_燃起来了][崩坏3・终焉归始_燃起来了]"
"艾因_Eins","保密","贵州","438494555","5","崩坏3・天穹流星","10000","3","","好耶！鸭鸭我的，我和鸭鸭贴贴！[崩坏3・终焉归始_出击]"
"久九X感冒灵","男","浙江","518183562","5","","10000","3","","这个佩拉居然看绀海组，真棒"
"-一念千殇-","女","四川","294091531","5","公主连结凯露","10000","3","","3月7公测，你懂的[doge]"
"水节飞","保密","陕西","299648882","5","","10000","3","","主角又在翻垃圾桶了[崩坏3・终焉归始_嘲笑]"
"羽熙","女","湖南","10827119","6","","10000","3","","[脱单doge]谁也不能阻止我翻垃圾桶！"
"风滚云烟飞","保密","山西","1299598490","4","","10000","3","","有罗刹，素裳，彦卿,懂了，这不折剑录吗，都出独立游戏了（"
"我与黑塔转圈圈","保密","河南","433846009","5","","10000","3","","快进到出角色同款手机壳[脱单doge]"
"私は忘れない","保密","广东","1682266830","4","","10000","3","","所以……主教大人！你在哪里[灵魂出窍]"
"想开高达的夏亚","男","福建","40057558","6","碧蓝航线","10000","3","","PV怎么欢乐 想必这个游戏肯定是个合家欢的喜剧故事吧"
"禾白少汐","保密","河北","1843618604","5","","10000","3","","丹恒宝看起来不是很乐意的样子[妙啊]"
"戏言玩家213","男","黑龙江","117817","6","星座系列：天秤座","10000","3","7","你最好真的是个喜剧！米哈游！！"
"初迟川尔","保密","安徽","1311167871","4","","10000","3","","你小子跟你姐姐们发PV的习惯怎么不一样啊[吃瓜]"
"咬鱼钩的三好青年","男","美国","62376887","6","","10000","3","","身在曹营，心在铁道"
"精致暴风","男","河南","188691827","6","原神","10000","3","","我好急我好急啊，急急急急急！只因死了！[鹿鸣_生气]"
"丰饶_药师","保密","浙江","662110818","4","","10000","3","","仙虫狂喜"
"沉袈雨official","女","贵州","1590379435","5","","10000","3","","不怎么玩过崩坏系列的可以玩这部星穹铁道吗？（萌新疑问）"
"丰饶星神-药师","男","山东","351735029","5","原神","10000","3","8","女主 可爱 超了[喜欢]"
"懒卟啦叽","保密","江西","66023762","5","","10000","3","","开屏垃圾桶暗示各位都是垃圾[doge][doge][doge][doge][doge]"
"绝世白露斩仙帝","保密","山东","476538253","5","","10000","3","","星穹列车即将发车:公测马上就要开始了,目前列车正在加急筹备中，银河冒险之旅即将开启:目前制作组正在加紧赶工，公测马上就要来了,在此之前，1月24日也将开启新一轮测试招募:公测之前，1.24先来招募一次三测吧,大家都满心期待。为此玩家聚在一起建立了QQ频道j18w702482，喜欢星铁的大家一起来玩吧[喜欢][打call][打call][打call]"
"龙门小贩","男","安徽","510896051","5","","10000","3","","你不要截图扫码了，我试了，没用的，以及，关爱空巢姬子和瓦大爷[doge]"
"百年做梦","保密","河北","86010553","6","","10000","3","","高价收购景元帅照！！！"
"酒针","保密","河南","1627838482","4","","10000","3","","不愧是太空喜剧，明明什么都没说，但我却笑疯了[脱单doge]"
