"昵称","性别","IP","UID","等级","装扮","用户权重","获赞数","粉丝团等级","评论"
"饮多滴水","保密","广东","34282708","6","","10000","1","","沉船了，小保底出静流，专武80抽歪了[大哭]"
"我即是无双","男","陕西","449240542","5","","10000","1","","130发出了，那既然这样，就没办法抽专武啦，用克拉拉的武器吧"
"全自动兔老将","男","重庆","19583280","6","原神","10000","1","","坏消息：歪了渡鸭。,好消息：大小保底加起来一共60抽[doge]"
"90后退休生活w","男","山西","384727141","5","","10000","1","","她，曾是罗浮剑首，如云翳障空，卫蔽仙舟；她，曾是云上五骁，盗月光一线，无罅飞光…后来她身堕魔阴，受云骑围剿，不知所踪。如今她再次归来，究竟是敌是友？,敬请收看星际和平娱乐特别节目《走近星穹》――「镜流：名师出高徒」。中文CV：,叽米――刘北辰,景元――孙晔,彦卿――喵酱"
"爱喝AD钙b","保密","广西","385475175","5","公主连结佩可莉姆","10000","1","","很难想象杜老师配音时的精神状态[脱单doge]"
"梦一梦梦想","保密","广东","327370308","5","#EveOneCat!","10000","1","","隔壁歪到发麻[笑哭]这边也歪到发麻[大哭]没办法，没星琼了，只能揣着大保底等复刻或新xp了[灵魂出窍]"
"五彩缤纷的黑色1021","保密","四川","30340995","6","","10000","1","","八十抽歪了彦卿抽了镜流，这下祖孙同行了"
"身将客星隐","女","四川","303458186","5","","10000","1","","景元确实挺高的，至少两米那么高。"
"发呆的小白菜","保密","内蒙古","3678511","6","","10000","1","","镜流一进拍照就带眼罩，什么表情也没有，谁有什么头绪吗[大哭]"
"温胭\","保密","江西","3537116795505358","3","","10000","1","","镜流师祖，可是我要等阮梅，这样吧，你和她商量一个来[脱单doge][脱单doge][脱单doge]"
"堕天灬冰","保密","内蒙古","18225463","6","","10000","1","","次次大保底，有什么头绪吗？"
"久思z_","男","山东","33348778","5","崩坏：星穹铁道","10000","1","","140抽拿下01，全是小保底，一个也没歪[崩坏：星穹铁道_心]"
"璃月叶师傅","男","四川","7333525","6","崩坏：星穹铁道","10000","1","","你只交了一份的钱，却来了两个人[doge]"
"博弈233","男","山东","37770832","6","崩坏：星穹铁道","10000","1","","镜流：我tm杀杀杀杀杀杀杀杀杀杀"
"玖月不白给","保密","四川","1129786792","3","","10000","1","","你说得对，但是（>_<）"
"沙雕在看我","保密","福建","65825453","6","崩坏：星穹铁道","10000","1","","有没有大佬有qq群聊啊[doge]我身边就我一个人玩好无聊[大哭]看着别人聊也不会很寂寞"
"海中贵族大菠萝","男","江苏","32772757","6","","10000","1","","为什么我镜流和光锥都歪了[给心心][给心心]"
"Nahidog","保密","湖北","87920746","6","希萝Hiiro","10000","1","7","八十发才一只青雀，镜流都出了，整的我魔芋爽犯了"
"苏打打君","保密","河北","495022759","5","快把我哥带走","10000","3","","各位下午好[墨镜]"
"Lv6-未元物质","男","安徽","434001630","6","","10000","1","","镜流是苍城仙舟的幸存者，苍城被活体恒星吞噬时被罗浮的云骑军所救，为了让镜流摆脱阴影，云骑队长（大概）教授给了镜流剑术,后来镜流有了朋友，有了无罅飞光的称号，而她的师傅则埋骨沙场,然后便是失去白珩，斩杀孽龙，最后入魔阴身而魔怔,嘶……感觉好像某位仙人呢,但隔壁符华可没有把什么大规模杀伤性武器带回老家[辣眼睛]"
"或真敷面妖","保密","四川","4524674","6","","10000","1","","啊啊啊求你们用镜流去抓猪打罐子，太抽象了[笑哭]"
"sakuraの花言~","保密","上海","660101853","5","","10000","1","","麻了，孩子角色专武全歪，还全歪鸭鸭"
"蓝影璃城","男","广东","229008513","6","沈剑心","10000","1","","[歪嘴][歪嘴][歪嘴]大家好！我的镜流是虚数属性，虚无命途太厉害啦[墨镜][墨镜][墨镜]"
"一秒前的一瞬间","保密","山东","30720561","6","","10000","1","","说出来大家可能不信 我用60抽大保底抽了个好看的镜流 虽然我完全不用她 本来想满命停云和青雀 但是桑博他出的实在是太多了 他们三个都五了，突出一个意犹未尽[笑哭][笑哭][笑哭]"
"是323啊","保密","湖南","1023932264","4","","10000","1","","你怎么知道我20抽……[墨镜]"
"时丿默","保密","广东","29866305","6","","10000","1","","歪了彦卿。确实是名师出高徒，指抽名师的卡池会出来她的徒孙[脱单doge]"
"云游星航","男","河北","35565247","6","","10000","1","","刘北辰老师好忙[doge]"
"成为咸鱼的咸鱼","男","福建","123510598","6","","10000","1","","120发0加1过来还愿[脱单doge]"
"井朝有酒井朝醉","保密","河北","23307314","6","","10000","1","","一份出场费邀请两位嘉宾，叽米，你指的是自己和莱欧斯利吗[doge]"
"阎王殿下12","保密","湖南","3493134482803206","4","","10000","1","","太酷了 十连出金"
"杀戮-の-天使","男","福建","1049318260","4","","10000","1","","为什么今天更新后游戏内部会闪屏[酸了][酸了]"
"ZDSAQW","保密","广西","470970946","5","","10000","1","","更新完之后我角色放大有时候会卡死，但银狼放大一定会卡死，是银狼黑了我的手机还是mhy总部被银狼黑了"
"自由小风风","男","四川","1918672902","4","","10000","1","","快到能消除时间？让我想到一位故人[脱单doge]"
"天使不能躺着睡","保密","吉林","15560467","6","","10000","1","","[嫌弃]上个池子大保底，这个池子还是大保底。你游能不能让人活了？"
"暗夜支配者燕双鹰","男","陕西","305321429","5","","10000","1","","152抽"
"song哔哔","保密","江苏","418998795","4","","10000","1","","250抽1+1前来还愿"
"牵x_散步","男","河南","1688680","6","碧蓝之海","10000","1","","徒孙：为忠义为守护挥剑,师祖：0分，挥剑就是为了砍人[doge]"
"阙音风铃","保密","江苏","389673399","5","碧蓝航线","10000","1","","各位听我说，打分枪，镜流是0分[doge][doge]"
"黑色暗幽灵","男","新疆","65746924","6","","10000","1","","据四川的朋友介绍，当你和女朋友吵架时，对方情绪激动时，可以对她说出四个字∶魔法披风。会有奇效。众所周知，静流有着疯批美人一说，因此她情绪不稳定的时候是需要安抚的，所以在你们安抚静流的时候不妨对她说上一句魔法披风。会收获意想不到的惊喜。"
"路边的一棵菜","保密","广东","316796736","5","","10000","1","","169发0+1+如泥酣眠前来还愿[doge]"
"叶莲不是鬼火","保密","福建","660205640","5","","10000","1","","70发0+1镜流"
"与之化矣","保密","江苏","22308330","6","","10000","1","","还以为是静水流深，才发现是镜"
"BigBottle","男","江西","11702854","6","","10000","1","","什么意思，景元可以帮徒弟去问问师傅，上次主线结尾景元和静流谈起来了呗"
"Siseluian","男","湖北","3403679","6","至尊戒","10000","1","","为什么我的静流是一个大叔啊唯!!!"
"さんlove","保密","江西","671082082","5","刺客伍六七","10000","1","","82抽才出[墨镜]"
"一一一S夜一一一","男","浙江","21545930","5","","10000","1","","镜流秘技范围内可以破坏箱子"
"獭獭开獭獭开獭獭开","男","广东","19775337","6","","10000","1","","你怎么知道我 11 抽出镜流[doge]，还是小保底[doge]"
"-苦多","男","四川","493926371","5","","10000","1","","这节目还挺好看的，讲技能但是不枯燥[妙啊]"
"太空人喜之郎_","保密","美国","15394969","5","","10000","1","","铁宝，你这个是不是放错合集了？不应该放在走近星穹合集里面吗？怎么放到前瞻合集里了"
"瑶万水","女","河北","387275515","6","早稻叽","10000","1","","北辰老师今天中午好忙呀"
"星之魔女ftl","保密","重庆","526822315","5","","10000","1","","强度爆炸"
"不要红枣只要核桃","保密","江苏","316539744","6","","10000","1","","80抽老杨命座，歪个白露也行啊……"
"酶雎蔽","保密","广东","65820096","6","","10000","1","","本来就很喜欢镜流，现在1+1只用了130抽就能达成，所以变得更喜欢了"
"傲慢阿喵","男","黑龙江","2577738","6","","10000","1","","我老婆三月新衣服也太好看了把！！！可爱也要有个限度啊！！"
"公子","男","天津","351086066","5","","10000","1","","220抽0+1，前来还怨[无语]"
"十香是梦","女","广东","449508782","5","三周年恋曲","10000","1","","我们星铁自己的那维莱特[doge]"
"今天儿是个好日子","保密","天津","171444187","5","","10000","1","","70抽专武瓦尔特[大哭][大哭][大哭]"
"菠萝手机Pphone","保密","湖南","1441361068","5","2233十一周年纪念","10000","1","","新版本第一发就出了，谢谢啊，大家中午好！"
"我比影子更寂静丶","保密","广东","78022105","5","","10000","1","","你怎么知道我单抽出镜流"
"迷露踏雪","男","安徽","297220797","5","2233白色情人节","10000","1","","青雀终于满命了[脱单doge][脱单doge]"
"一生所爱灰原哀","保密","广东","25686851","6","","10000","1","","五星冰系用剑巡猎[墨镜]"
"波赛月","男","新疆","93468026","5","原神","10000","1","","大爱叽米，而且我感觉赛博朋克2077那个电台开场白也是叽米配的呢"
"手","保密","北京","258329831","6","斯莱特林","10000","1","","来的早，不如来的巧！"
"民国豌豆","保密","湖南","484465441","5","","10000","1","","我最喜欢的组合还是镜流和彦卿，大姐姐就是要配小男孩。[doge]"
"两百多硬币","保密","山东","7205108","6","","10000","1","","景元的猫猫嘴好可爱啊啊啊"
"白峰不想当咸鱼QAQ","男","广东","287772328","6","择天记","10000","1","","杰帕德，我恨你！你丫要三张光锥干嘛！气死我了"
"啊哈huanyu","男","上海","604960773","5","","10000","1","","谢谢，80抽出卿卿了"
"村里最皮的狐狸","男","山东","2381204","6","","10000","1","","镜流出了，就是我这个镜流有点奇怪，她不用剑，成天背着个琴盒，嚷嚷着什么“冰雪铸成此志，永不终结”"
"Kuyahuo","保密","广东","7943920","6","EveOneCat2","10000","1","","镜流配合刃能够让刃快速启动，让刃的被动能够快速打出，实现伤害最大化,这波啊，这波叫名师出高徒[doge]"
"回旋的折刀","男","重庆","448374677","5","公主连结凯露","10000","1","","出货了各位！十连双金+专武+白露的专武=181抽[脱单doge][脱单doge]"
"欣欣子很乖呀","女","江西","1973986760","4","萌妻食神","10000","1","","镜流老婆和光锥已出，前来还愿[爱心][爱心][爱心]"
"晴空的风见","保密","重庆","100914588","6","约战・狂三","10000","1","","麻了，280抽拿下0+1，角色光锥都歪了[大哭]"
"墨色倾城北","保密","广东","206126756","6","","10000","1","","叽米老师今天真忙，两家营业[tv_斜眼笑]"
"lol","男","湖南","28627169","6","星座系列：处女座","10000","1","","盖亚！！！！！！！"
"Alin_Neoly","男","辽宁","169904200","5","不吉波普不笑","10000","1","","你有被一位身患魔阴身的美少女暴打过吗？我倒是可以给你安排一场。"
"有魔阴身的阿元","保密","山东","519987618","5","","10000","1","","镜流歪了。。魔芋爽发作了啊啊啊啊[无语]"
"魔怔哲学家","保密","黑龙江","66763841","6","","10000","1","","我每个池子都吃了保底，各位有什么头猪吗[无语]"
"鱿鱼得了犹豫症很忧郁","保密","山西","1220870895","4","","10000","1","","手贱抽个小保底，结果没歪[保卫萝卜_哭哭][保卫萝卜_哭哭][保卫萝卜_哭哭]"
"寻梦阁-忆梦","保密","广东","694418115","5","","10000","1","","我中了，毁灭，白发红瞳甚至还可以叫人发射恐怖的毁灭射线[墨镜]"
"意恐_","男","四川","1716215931","5","","10000","1","","160大保底拿下镜流老婆[墨镜]但30抽拿下专武[墨镜]"
"永远喜欢宵宝","男","江苏","697696247","4","","10000","1","","在我学习最艰苦的时候遇见了你，镜流已出，4+1前来还愿，爱你哟！下次满命[打call]"
"CyberMondaynight","保密","河南","385331629","5","","10000","1","","140抽0+1[墨镜]"
"巅峰有酒","保密","北京","130182175","4","","10000","1","","毁灭 白毛 女性角色   没错   克流流 就是你了[大哭][大哭][大哭]"
"时雨雨时时","保密","广东","18791475","6","","10000","1","","服了，从开服到现在，全部大保底，行，随缘玩了，充钱是不可能充钱的，充钱了就更后悔[呲牙]"
"神里绫华の女友","男","安徽","249477052","5","原神","10000","1","6","一刻也没有为2.5条悟的离去哀悼，出现在公众视野的全新白毛蒙眼系强者是――罗浮剑首镜流"
"阿能偶尔滴神","男","河南","1842100498","4","","10000","1","","200抽2+1镜流,七金g还愿"
"yit君","男","贵州","27344899","6","拜年祭粉丝专鼠","10000","1","","有没有人知道为啥丹恒房间进不去呀"
"清奇-奇","保密","广西","1219461088","4","","10000","1","","同行好痛啊啊啊啊啊啊啊啊啊！！！！"
"愚者游荡人间","保密","河南","3546375578978975","3","","10000","1","","抽到了镜流，160抽，银狼，159，刃，166，谢谢米哈游[藏狐][藏狐][藏狐]"
"吃甜糖1_30-1-0","保密","广东","447385326","6","2021拜年纪活动专属","10000","1","","一刻也没有为2.5条悟的离去哀悼，出现在公众视野的全新白毛蒙眼系强者是――『罗浮千代剑首』镜流[doge]"
"Refbrain","保密","湖南","435435830","6","","10000","1","4","你们关注的只有镜流，不像我这个老东西，只关注1.4了1.4了[墨镜][墨镜][墨镜]"
"胡哲岷","男","浙江","350047908","5","精灵王","10000","1","","嘿嘿，0+1镜流"
"月影心殇","保密","广东","503382801","5","","10000","1","","日常80发出货"
"你的bl咯","男","浙江","441419419","5","","10000","1","","许愿镜流，出必还愿"
"章鱼鸽白猊","保密","浙江","21131082","6","鹿乃","10000","1","8","她魔芋爽叫得好大声，在外面根本不敢外放（[嘘声]"
"启丶星","保密","新疆","35961717","6","","10000","1","","[脱单doge]"
"叽叽叽米花","保密","辽宁","14737444","6","","10000","1","","你们米游社什么时候上架在线客服啊，每个游戏都有就你们家没有[疑惑][疑惑][疑惑]"
"诸柔","保密","吉林","1380387290","5","","10000","1","","歪了，我又哭又闹！呜呜呜呜！"
"米饭吃的快","男","广西","630027595","4","","10000","1","","毁灭军团，出击[星星眼]"
"马忽悠小姐の狗","女","江苏","8131029","6","崩坏3・天穹流星","10000","1","","[doge]什么，介绍我老公？"
"钚想当非酋","男","天津","1640075211","5","","10000","1","","20抽0+1[doge]"
"如叁悦兮","男","江苏","1417184787","4","","10000","1","","角色没歪 武器歪了 啊啊啊啊 马哈鱼你赔我[大哭][大哭][大哭][大哭][大哭]"
"鸟茶","保密","陕西","332116118","5","","10000","1","","趁这四下无人:我是镜流的狗！"
"delicate-ones","保密","上海","514729710","5","至尊戒","10000","1","","镜流杀我！[崩坏3・终焉归始_骑马]"
"梦丿黑殇","保密","湖北","36228400","5","","10000","1","","今夜明珠色，当随满月开。"
"汪星人胖胖w","男","四川","1284174816","4","","10000","1","","1111"
"帕姆特制爱酱炸派蒙","保密","北京","1469731273","5","","10000","1","","我是镜流的扑满！"
"Neekort","女","安徽","46301885","5","","10000","1","","[星星眼]"
"灵","女","河南","14526297","5","星座系列：双子座","10000","18","","谢谢大伟哥一发给的双黄蛋！！！！！！！还出的龙妹！！！！有她的专属光锥就差她！！本来想开服池子换的，现在可以去换杨叔了！芜湖！！！开服到现在所有的姐姐妹妹都是一发出抽齐了！所有的五星男角色只有杰哥！其他的死活就是抽多少不给出！！！！好叭，作为零氪党！我也知足了！！！叩谢！！！！！[双子座_贴贴][双子座_爱你]"
"一只扁扁的河豚","保密","浙江","325871025","6","","10000","2","","hhh，太扭曲啦，这就是扭曲的美味吗（突然体会到了某位教主的爽感[笑哭]）。这几天甚至评论区比剧情都扭，扭，都可以扭[歪嘴]。正好看完mygo，这波是直接续杯，又乐又爽[喜极而泣]"
"我是陈澄呀","男","浙江","14881826","6","崩坏：星穹铁道","10000","2","","萌新建了一个星穹的聊天QQ群，欢迎各路萌新大佬加入，放松玩游戏，愉快聊天（785551940）"
"李彦祖吖","保密","江苏","3546379811031965","3","","10000","2","","万人血书，镜流被刀卸崩铁（1/10000）[笑]"
"相信光的迪迦啊","男","山东","2107746349","3","","10000","2","","镜流歪了退游，诚信卖号，看动态，骗子勿扰"
"AvA丨AvA","男","江苏","19129038","6","","10000","2","","我需要剧情跳过"
"名字不知为何物","男","广西","245027479","6","","10000","2","","现在是不是有bug？我苹果12系统ios16，过剧情的时候时不时会没有声音"
"莫棠璃","保密","重庆","363215426","4","","10000","2","","30抽，人和专武都有了，别羡慕，上一个池子都垫了，都歪了，最后只剩30抽，这是我应得的！！！"
"-最爱美琴小姐-","保密","内蒙古","700383793","5","","10000","1","","妈的次次保底次次歪，没动力玩了"
"bili_457802665","保密","江西","457802665","5","2233幻星集","10000","2","","抽到了 毁灭命途的 后面还有个机器人[呲牙]"
"朔星望月","保密","四川","479887693","4","Sonny头像框","10000","1","","这个剧情……认真的吗？[辣眼睛]"
"之","保密","河北","330454406","6","星座系列：双鱼座","10000","2","","镜流真是强大，凭借自身实力硬压魔阴身，不愧是剑首。"
"拉文克劳的贝蒙斯坦","保密","山东","85415649","6","拉文克劳","10000","2","","好消息：单手剑，冰系,坏消息：巡猎命途"
"翻书风z","男","山东","295626405","5","公主连结可可萝","10000","2","","2+1全没歪 舒服了[呲牙][呲牙][呲牙][呲牙]"
"猫猫头cato","保密","浙江","89138042","5","","10000","2","","不得不佩服文案组和叽米这个选角[支持]"
"观星家的刺客先生","男","江苏","674574816","5","总之就是非常可爱","10000","2","","镜流姐姐你好我是你的狗[doge]"
"苏半夏-","保密","江苏","24782367","6","星尘","10000","1","","217发，0+0，马上要0+1了。米哈游能不能死一死。玩到现在都是大保底，天天大保底，盯着我小平民薅羊毛。开服到现在全都是七八十抽歪一次，再七八十抽大保底，角色歪完光锥歪。全勤大小月卡还氪了些直充的开服玩家，到现在就四个up角色，没有一个专属光锥。这说的过去吗,,所以我反馈过问题能不能搞个“连着出几次大保底之后小保底给中一次”的机制，结果倒好，直接给我大保底光锥还弄到72抽都没出（ps：角色90抽保底，73抽以后加概率，光锥80抽保底，六十几抽加概率，正常不到七十抽也该出了）"
"死都不会中奖","保密","广西","2091385659","4","","10000","11","8","希望有人能用一下，只是0+1。为了升级把信用点用完了"
"清野凛是神呢","保密","广东","383515858","6","洛天依蝶变头像框","10000","3","","开服歪倒现在好好好"
"艾俄洛斯哥哥","保密","四川","475252616","6","","10000","6","","你剧情能不能好一点啊？？这么点破事愣是拖了这么久也是6"
"北枫东樊","保密","广东","190249552","5","","10000","2","","30抽，1+1，祝大家不歪！[脱单doge]"
"米诺高峰少女","保密","江苏","16608944","5","神乐七奈","10000","1","","你好"
"手持戟耙的虚鲲","男","天津","323615892","5","","10000","1","","战技消耗队友生命值造成冰伤，是镜流没错[doge]"
"FrenzyJ","保密","中国香港","104950058","5","","10000","1","","还有谁[微笑]"
"-Chaos-ァザ-","保密","安徽","1931856100","5","","10000","1","","160抽0+1，爱死镜流了[脱单doge]"
"蝶舞天涯沦落人","男","广东","65933543","6","","10000","1","","大家中午好[笑哭]"
"从此无忧_","保密","海南","394713200","5","","10000","2","","强烈建议，回合制游戏不要像原神一样一点体力扣扣搜搜，上个线体力没了，啥都干不了，蝗灾通完了重复打没好的奖励，建议出活动的时候能给玩家获得体力的奖励，至于多少，看玩家肝不肝了"
"猫咪威廉","保密","河南","392604523","5","","10000","2","","40抽0+2前来还愿，感谢镜流姐姐嘿嘿嘿"
"你76兰那罗就差我了","保密","湖北","697676699","4","年度猫片","10000","3","","开了李猛干！"
"课代表冰可乐","女","广西","172836605","6","斩兽之刃","10000","5","","没人说剧情吗？？？？我觉得镜流同行剧情完全崩了啊，这次编剧明显把握不住，变成妥妥的仙舟版小时代了[辣眼睛]"
"凌炎link","男","河南","23251047","6","名侦探柯南","10000","2","","mhy你真该死啊，自闭了"
"A计算","保密","江西","496108522","5","","10000","1","","歪了克拉拉，在这里拉托"
"Yukimiya_rinne","保密","辽宁","87696570","6","2233幻星集","10000","4","","云上五骁的分别，最痛苦的不是入魔的静流，不是永无彼岸的应星，更不是轮回转生忘却过往的丹恒，而是扎扎实实记住了这一切却什么都做不到，甚至阻止不了的景元。那副看似懒散的外表下隐藏着黄金岁月过后足矣压垮常人的过往。"
"月下山城","男","重庆","88204040","6","至尊戒","10000","2","","四十发出的，我只想垫垫[疼],我想要那头猪去找箱子啊[笑哭]"
"月夜晨雨","男","广东","18376861","6","","10000","1","","今天又是欧气满满的一天，非酋可以来骂我泄愤，毕竟你们替我负重前行"
"看哦开","保密","重庆","108056110","5","","10000","1","","一发十连，静流师祖来我身边"
"-_-星莹舰长","保密","安徽","85456326","6","","10000","1","","零氪账号，品鉴一下[脱单doge]"
"叶秋661","保密","内蒙古","1772600777","3","","10000","1","","虎克是SZ"
"@小路月","男","江苏","3881721","5","崩坏3・天穹流星","10000","8","","大伟咱能不能把那些劣迹coser封了举报了别给他们沾边蹭热度的机会,咱米家不缺那点黑流量对吗 我现在看到大数据推来的相关视频有某些恶心人的coser真的倒胃口 点名白出,咱米家自己的角色控制一下cos的授权可以吗 求求了[崩坏3・光辉矢愿_比心]"
"咕噜咕咕咕噜咕","保密","山东","318628501","5","","10000","1","","能不能出个自定义切换是否戴眼罩的设置呀，镜流真的好看[星星眼][星星眼]@崩坏星穹铁道"
"冰心一弦雪","女","上海","92442488","6","崩坏：星穹铁道","10000","1","8","彦卿他真的，太爱剑了，以至于我抽出镜流之后，常驻的保底紧跟着出了他[OK]"
"星河美术馆","男","陕西","499266468","5","萤舞沉眠","10000","1","","（RQ）"
"长行九歌","保密","山东","382165268","6","","10000","1","","萌新太难了，肝了几天任务把给资源全去抽角色，抽了60抽一个姬子三停云，本来还想氪点抽充。然后一想这运气还氪个p，直接止损[OK][OK][OK]准备买点吃的奖励一下自己[脱单doge]"
"重生的火龙骑士","男","江西","201247374","6","新月冰冰","10000","1","","我麻了，80发出的镜流，上次的饮月君40发啊，卡妈也是30发，这就是平衡之道吗[大哭]"
"超级机枪豌豆-","保密","河北","521282091","5","","10000","1","","问个题外话，为啥我银狼一开大手机就死机了[疑惑]"
"一本正经钟先森","男","广东","124937751","6","","10000","1","","[OK]歪了白露，果然我是来抽白珩的[捂脸]"
"五海野玫瑰_","男","江苏","688706951","5","","10000","1","","银河铁道之夜，我好心痛"
"SeaGod","男","四川","4854220","6","","10000","1","","抽每个up都要150+ 这游戏到底能不能玩了"
"兆饼忠","男","江西","328907030","5","","10000","1","","让我出个武器吧，谢谢[给心心]"
"不发不好看","保密","广东","14644798","6","","10000","1","","云上五小集合"
"不懂法法师","女","上海","42881057","5","","10000","1","","真可爱啊彦卿嘿嘿"
"真爱十香呀","男","陕西","1348242490","5","","10000","1","","为什么这次更新后，我登不进去了，一直卡在界面"
"妖刀C-EVA","男","广西","76984707","6","","10000","1","","老登，活动做完了，完全不够完啊！给我接着出[阴险]"
"一搬砖拍死你","保密","广东","200019869","6","","10000","1","5","用上全部准备换光锥的750个星元才出来静流，还好没歪[笑哭]"
"M0rtal_","男","辽宁","59421581","6","","10000","1","","更新完有没有平板用手柄模式闪退的同伴啊，难受死了[辣眼睛]"
"瞧把你恁的","男","四川","394875882","6","","10000","1","","我的静流放大招一个星球炸了[脱单doge]"
