"昵称","性别","IP","UID","等级","装扮","用户权重","获赞数","粉丝团等级","评论"
"别跟我说话这很烦","女","河南","1540713766","5","","10000","349","","当初看到这个PV的时候，还以为刃是一个特别厉害的角色可以到处追杀丹恒，结果玩了游戏才知道刃的实力并没有我们想象中的那么厉害，甚至可以说是有点弱但就是打不死，铁道战令的一个光锥里提到了，在刃追杀丹恒的这期间，丹恒用枪捅穿了他好几次，但刃是不死之身，所以他只需要等一段时间就能满血复活，然后继续追杀丹恒，最后丹恒实在是被烦的受不了，才开始了逃亡的生活"
"你猜笑笑笑不笑","女","江苏","36488590","6","","10000","1236","","《冷面小青龙不会梦到笑面小黑龙》[脱单doge]"
"蠢蠢鱼冻sang","保密","未知","35303886","6","","10000","704","","来晚了来晚了，开始啦"
"鱿鱼丝和普朗克常数","保密","山东","89245164","5","","10000","10","","无论是刃还是丹恒...怎么看出来跟隔壁某人像的[疑惑]虽然都是一家人但没必要这么牵强吧，被跳脸说自推长得像无关无感角色真的emmm不太好"
"布洛妮娅を郅筏皮","男","福建","20785072","6","良辰美景・不问天","10000","14","","刃这给人的感觉就是“今天砍谁，明天砍谁，后天砍谁”[崩坏学园2_满头叹号]话说这意思是下次测试出仙舟吗[崩坏学园2_有一说一], , , , , , ,穹宝你欠我的开服用什么还,爷是催穹宝公测小助手，快来和我一起刀穹宝8,你一刀~我一刀~,让穹宝下条动态就是铁J道K公J测K[崩坏学园2_绷不住了][崩坏学园2_绷不住了][崩坏学园2_绷不住了][崩坏学园2_绷不住了][崩坏学园2_绷不住了][崩坏学园2_绷不住了][崩坏学园2_绷不住了]"
"FirstCola","保密","浙江","626117390","4","","10000","12","","刃：人歪了5个，代价是3个648，景元没有你，丹恒有你一个,丹：危险，这个人说对了"
"账号已注销","保密","安徽","1161236474","0","","5000","10","","丹恒的配音是谁啊，感觉比鱼冻强[doge][doge][doge]"
"今月夕","女","北京","25820974","6","茶啊二中","10000","5","","回来看了眼简介，嗯……有一种空境俯瞰风景的感觉……是飞翔还是漂浮呢？"
"Kinoko59","男","北京","4996448","6","","10000","8","","玩之前：残忍追猎者,玩之后：勺子杀人魔"
"佐茶に","保密","上海","4447904","6","","10000","11","","回来看小团雀了，为什么游戏里是删了吗（可恶"
"我推每天刷新啊","保密","上海","643599403","5","","10000","8","","我来瞎掰：,刃剑指着丹恒，说“你是其中之一”，意思是不是丹恒是刃要找的人，而且看这个架势，似乎丹恒是刃要杀的人。,刃对景元说“你不是其中之一”，看表情，是没什么杀意的，反而是有点……嘲讽和恶意（？），景元大概不是刃要杀的。,,丹恒上车的原因应该是为了自保吧，毕竟在之前对开拓星神的描述里，上了列车是有保命的好处的，也就是说……丹恒是被刃追杀，然后上了列车。,,在一个片段中，疑似出现景元、丹恒、刃三个人的武器，周围是疑似战场的地方，有许多的残剑……,我没记错的话，仙舟是追杀永生怪物的，刃也是，,如果丹恒和仙舟有关系--丹恒是属于仙舟的，那么他怎么脱离了，来到了列车？因为刃的追杀吗？,,淦，我在说什么……？"
"禾禾知千","女","河北","41330698","6","","10000","6","","梦魇pv一周年"
"-望尘-","男","吉林","525283406","5","","10000","120","","我要上仙！仙舟没有上仙叫什么仙舟！快把上仙放出来！"
"号主已养胃","男","安徽","383382714","4","","10000","8","","这三个都好帅啊，衣服设计的也好看，璃月什么时候能有这样的成男啊[大哭]快点公测吧好喜欢[大哭]"
"江山画写意","保密","加拿大","484404175","5","","10000","83","","景元不是其中之一，第一句和景元说的。,丹恒是其中之一，第二句是和丹恒说的。,弹幕怎么还有人没看懂啊？"
"半全半全","男","广东","514184122","4","","10000","8","","《崩坏：星穹铁道》剧情PV：「梦魇」,,当过去重新站在了你的面前，你会逃避，还是远离？,,中文CV：,刃――刘以嘉,丹恒――李春胤,帕姆――蒋丽,,日文CV：,刃――三木真一郎,丹恒――伊东健人,帕姆――长泽美树"
"一口吞糯米团","保密","云南","13759873","6","","10000","354","","丹恒不是被追杀怕的原来[tv_目瞪口呆]刃每次追杀小青龙都被小青龙鲨了，但是刃一直在复活！根本鲨不完！然后丹恒被吓怕了[tv_目瞪口呆]我之前还以为他是被鲨怕了呢"
"秋月阮阮","保密","重庆","503783083","5","","10000","11","","刚开始：这不是大行秋吗？听说还有喜欢的人虽然死了，不抽不抽,过了剧情后：我是刃的狗，就要小寡夫[初音未来_大笑][初音未来_大笑]"
"不歌呀","女","重庆","498052908","5","","10000","511","","对刃的初印象：清冷阴郁美强惨,           现印象：邪魅狂狷歪嘴龙王（bushi）[脱单doge]"
"来自凯尔莫罕","保密","北京","3138310","6","","10000","4","","抢不到必胜客联动预约，含泪吃饼[大哭][大哭][大哭][大哭][大哭][大哭][大哭][大哭][大哭][大哭][大哭][大哭][大哭][大哭][大哭]"
"江凉呦","保密","山东","65972071","6","","10000","117","","梦魇(×),生孩子(√)[脱单doge]"
"鹿与蝴蝶结_","保密","河北","8914695","5","","10000","155","","看到冷面小青龙躺在床上一脸痛苦的样子我就能想象的到那些色批up主会用什么方式来给他治疗[doge]"
"镜子3939","女","河南","564454758","5","原神","10000","71","","这仨武器从左到右分别是刃 丹恒 景元的武器[思考]"
"望君泽川ポ","女","安徽","1754494562","5","","10000","104","","看视频的时候，丹恒喂了我一片柠檬，我受不了酸味，对着丹恒直呼:“太涩了！太涩了！”"
"怎么到了这就无信号了","女","广西","543854262","5","~るる","10000","132","","为什么穿衣服睡觉？[|雪_头大][|雪_头大]"
"曾经谭海难为水灬","女","安徽","57481013","6","","10000","91","","太好了，是刃要up了吗，我都迫不及待要抽他了[打call][打call]"
"快乐星正TM","保密","天津","35085560","6","三周年恋曲","10000","87","","鱼冻小N痛失网名[doge]"
"冰眸青草","女","海南","267711388","6","","10000","110","","景元、丹恒、刃，三个男人一台戏？[热词系列_知识增加]"
"绒阿云","女","贵州","38986655","6","崩坏：星穹铁道","10000","90","","你醒啦，你热度被你姐姐抢走了[脱单doge]所以快公测吧[原神_哇][原神_哇]"
"暗箱操作的黑幕","保密","广东","171022163","6","2020拜年祭（鼠）","10000","83","","你姐停服了趁现在公测吧[脱单doge]"
"秘烤肋排","男","辽宁","621784675","5","","10000","88","","当钟离公子代餐的滚当谢谢喵"
"为什么说我昵称违规","男","辽宁","56450166","5","","10000","43","","你说得没错，但丹恒的确是我老婆[妙啊]"
"言默I别给我推恒右了","保密","广东","519598490","5","崩坏：星穹铁道","10000","158","","这个人怎么了啊？？？！！！！丹恒你把话说啊！！！三个男人，我快乐死了[tv_大哭]"
"远星_star","女","新疆","442170235","5","","10000","48","","我看你也挺急的要不咱们就开服吧[崩坏3・光辉矢愿_彩虹水枪][崩坏3・光辉矢愿_彩虹水枪][崩坏3・光辉矢愿_彩虹水枪][崩坏3・光辉矢愿_彩虹水枪][崩坏3・光辉矢愿_彩虹水枪][崩坏3・光辉矢愿_彩虹水枪]"
"祁道长两米六","女","贵州","38226070","6","拜年祭粉丝专鼠","10000","36","","我看你也挺急的，不然就公测了吧[脱单doge][脱单doge]"
"谢绝抬杠","女","河北","596832259","5","萌宠小狗","10000","29","","跟你俩姐抢热度?很好你赢了，我等更新等的好苦[保卫萝卜_哭哭]"
"为我主献上故乡银月","保密","广东","318735754","6","","10000","29","","刃想杀丹恒先过我这关！,规则，就是用来打破的，呀哈！[原神_小事一桩]"
"奉天姐姐香软甜","保密","四川","13129073","6","","10000","26","","丹恒，我美丽的老婆~"
"凝菌い","保密","湖南","8036113","6","","10000","20","","00:54卡在了奇怪的地方[微笑]"
"阮与梅","保密","广东","280796913","6","","10000","183","","[崩坏3・光辉矢愿_瞄准][崩坏3・光辉矢愿_策划][崩坏3・光辉矢愿_编剧][崩坏3・光辉矢愿_大伟哥][崩坏3・光辉矢愿_up主]"
"竹觅知音","女","黑龙江","365720722","4","","10000","24","","人有五名，代驾有三个，也就是五个人坐三辆车走，每辆车必须有人，一共150种坐法。[脱单doge][脱单doge][脱单doge]"
"犹如远方传来的乐声","男","广西","605071565","5","","10000","21","","好想掐住刃的脖子，看着他露出几分疑惑又带着几分不屑的神情 仿佛在说：“你这样是杀不死我的”"
"灰不溜秋小雪球","保密","四川","397546035","6","电子喵","10000","21","","喜欢相爱相杀，请让我买对股谢谢"
"柒梦尤瑟","保密","辽宁","324864007","5","至尊戒","10000","83","","你姐姐11点开门，如果你这波10点开门将是绝杀,[脱单doge]"
"旧人残颜","保密","海南","267371264","5","","10000","15","","原来早就有提示了啊[思考]"
"_Misaki__","女","江苏","112337075","6","","10000","20","","撩又撩得很，公测又不肯[崩坏学园2_绷不住了]"
"小狐狸Tartaglia","保密","新疆","1912839","6","萌宠小狗","10000","37","","某些单推人搁这骂丹恒的，人家刃有自己的cp白月光，别开错炮了！抱走丹恒。"
"他们叫我条子","保密","天津","397864774","5","","10000","20","","低情商：景元，我打不过你,高情商：景元，你不是其中之一"
"南舟客-希灵审查官","男","安徽","431163540","6","","10000","87","","必胜客崩了，悲，来看看铁道吧[崩坏3・光辉矢愿_安详]"
"云纱繁梦","保密","重庆","543248576","5","","10000","15","","我只求不要搞景刃cp就行[微笑]"
"叁水犬奇","女","云南","387089645","5","梦100","10000","13","","所以五名三个到底指的是啥啊[原神_嗯]有没有考据"
"璃奈璃的板子","保密","浙江","347535582","5","","10000","88","","我超"
"格蕾修单推人_","保密","湖北","1943586445","5","","10000","12","","小n痛失网名[doge]"
"渡小土","保密","河南","292602331","5","泠鸢yousa登门喜鹊","10000","11","","[崩坏3・光辉矢愿_瞄准][崩坏3・光辉矢愿_策划][崩坏3・光辉矢愿_编剧][崩坏3・光辉矢愿_大伟哥][崩坏3・光辉矢愿_up主]"
"乌萨斯第一扛把子凛冬","女","吉林","185665822","6","","10000","11","","哪里像散兵了弹幕怎么一堆刷的"
"致_爱莉希雅","女","浙江","1049182182","5","原神","10000","14","","！看我发现了什么[崩坏3・光辉矢愿_彩虹水枪]"
"P深至攵ミ命_","保密","河北","457221447","4","","10000","11","","停服让我满相遇[脱单doge]"
"渚薰等小狗君","女","江苏","284231004","5","","10000","12","","眼睛别改，之前的很好看"
"想要彻底的自由","保密","广东","373432281","5","","10000","11","","传下去，星穹今天开始公测了[doge]"
"林中雾呦","男","天津","488318070","5","","10000","93","","才，才没有一直刷新呢……只是刚好看到了而已[傲娇]"
"_-_DIO_-_","保密","江苏","515402907","5","","10000","10","","不如今天公测，正面硬刚。干翻原神，崩坏永存！[doge]"
"-鹤茶-","女","重庆","29321194","5","","10000","27","","都出这么多PV了，游戏一定公测很久了吧[脱单doge]"
"一杯克己","女","广东","11412288","6","EveOneCat2","10000","9","","救命，这里面的男角色都好戳xp，懂了，出了就从ys跑路（对不起魈宝一秒[脱单doge]）"
"通辽汗国在逃刺客","保密","山东","1339887329","5","","10000","10","","原神的维护让我们相遇"
"不提壶","保密","黑龙江","35080028","6","斩兽之刃","10000","8","","景元和刃，我素未谋面的老婆[2233娘_大哭]"
"头缒居","男","山东","211969917","5","","10000","8","","我看你也挺急的，不如咱直接公测吧[崩坏3・光辉矢愿_回眸]"
"记住我叫晓光a","保密","江苏","13613825","6","少女前线","10000","8","","[崩坏3・光辉矢愿_小喇叭][崩坏3・光辉矢愿_小喇叭][崩坏3・光辉矢愿_小喇叭]"
"正当年少时-","保密","江苏","449575934","5","","10000","8","","逃避，，还是远离？[思考][崩坏3・光辉矢愿_瞄准][崩坏3・光辉矢愿_up主]"
"天国の式神","男","中国香港","13386521","6","","10000","8","","爱酱的声音，听起来不太聪明的样子[脱单doge]"
"Buttten丶千琴","男","贵州","167946052","5","","10000","68","","让我看看是谁因为原神更新来到了这里,噢～原来是我啊"
"电绝缘圈圈圆圆","保密","广西","77998880","6","","10000","9","","日配的刃好强的声压"
"ZMI昝","男","天津","491106286","5","","10000","53","","还是那句话，快公测我忍不住充钱了[傲娇]"
"夏a","男","河北","91541675","6","","10000","8","","省流：哼哼…啊啊啊啊[doge]"
"工业盐-魔怔完全体","女","重庆","272724592","6","","10000","7","","丹恒丹恒丹恒我的老婆我给你攒大保底！！！"
"号主已养胃","男","安徽","383382714","4","","10000","8","","这三个都好帅啊，衣服设计的也好看，璃月什么时候能有这样的成男啊[大哭]快点公测吧好喜欢[大哭]"
"若若","女","北京","226304124","5","","10000","8","","崩外人都会对刃心动的程度，等公测[脱单doge]"
"tiancaigg","保密","福建","604823964","5","","10000","8","","人有五名，“冷面小青龙”"
"可笑的小东东","男","河北","401100801","5","我是江小白","10000","7","","好家伙，[脱单doge]"
"西里sirius","保密","广西","27242573","6","阴阳师海国之境","10000","6","","卖，都可以卖，我要看腥风血雨打起来[脱单doge]"
"陆瑾虞","保密","宁夏","1525917888","5","","10000","6","11","【《崩坏：星穹铁道》银狼原创曲手书「越权访问」-哔哩哔哩】 https://b23.tv/unzpfdz"
"于于于念","保密","云南","384861517","5","","10000","6","","这个月一定要拿到版号啊！别逼我跪下了求你"
"混沌のぐだ子","女","爱尔兰","11591065","6","原神","10000","10","","推广词：你J干K嘛[热词系列_知识增加]小黑子竟然是mhy"
"4399游戏盒","保密","福建","251347544","6","","10000","6","","[热词系列_知识增加]前脚原神开服，后脚星穹铁道pv！！！吃不下了哇！！"
"熊人a","保密","湖南","1485001557","5","","10000","6","","丹恒老公你怎么了"
"xuededong_","保密","广东","110834779","5","","10000","6","","草是新饼！！！！！！！！！！"
"猪儿丶","女","重庆","6231782","6","至尊戒","10000","7","","救命三个人都好帅啊啊啊啊啊啊啊啊啊啊啊啊啊啊啊"
"派蒙不会梦到怪兽公主","男","广西","7198276","6","","10000","7","","你能不能提前拿个版号让大家安安心( b- b)つロ"
"绫人的主人","女","河南","433945624","5","","10000","6","","三个男人一台戏，我爱看[脱单doge]"
"Misakigadelira","女","重庆","402259257","5","","10000","6","","公测！"
"devil-cosmos","保密","云南","3840404","6","","10000","7","","日配换成子安武人的话，大家就能看到神舟承太郎大战星核猎人dio[吃瓜]"
"夏季五时","女","海南","4731120","6","EveOneCat2","10000","6","","我这次能买对股吗"
"阿芒君很忙","保密","广西","287097011","5","","10000","7","","想跟你姐姐抢热度？[doge]"
"梦想一书","保密","山西","51131925","5","","10000","6","","传下去，魅魔突袭梦中丹恒！"
"默然哀伤","保密","四川","71397791","6","","10000","6","","持名龙尊 饮月君"
"加载出现错误","男","山东","361176791","5","","10000","30","","还好发的早，再晚一小时就没人看了[doge][doge][doge]"
"季鸿鹜","保密","浙江","690610868","5","","10000","24","","最新的那个pv里也有丹恒溺水的画面诶，这里也有。原来铺垫了这么久？"
"sscnpt_鲨了所有卡嬷","保密","山东","514622203","5","","10000","10","","我还以为刃是高冷酷男，没想到是玛丽苏霸总[脱单doge][脱单doge]"
"你猜笑笑笑不笑","女","江苏","36488590","6","","10000","1236","","《冷面小青龙不会梦到笑面小黑龙》[脱单doge]"
"你怎么神经兮兮的","保密","广东","505528251","5","崩坏：星穹铁道","10000","4393","","隔壁停服让我们相遇[脱单doge]"
"买一架通往天堂的阶梯","保密","江西","2093732345","4","","10000","6","","刃的中配我好喜欢"
"北方飘来的南烟","保密","江苏","513824726","5","拉文克劳","10000","8","","不是，为什么我首页刷到的标题是：你↑干↓嘛↑～  原来你也是小黑子[doge]"
"飞儿百合","保密","山东","439228575","5","","10000","15","10","都在等姐姐更新吧"
"假的吧真","保密","山西","1352396100","4","","10000","7","","这个剧情的经凑感太棒了"
"莫_得_钱_财_","女","陕西","355159026","5","","10000","17","","看来没来晚[脱单doge],我看你也挺急的，不如先公测吧[脱单doge]"
"不歌呀","女","重庆","498052908","5","","10000","511","","对刃的初印象：清冷阴郁美强惨,           现印象：邪魅狂狷歪嘴龙王（bushi）[脱单doge]"
"屿-","女","湖北","357401333","5","","10000","12","","mhy我想要刀上的小团雀[委屈]景元是不是取下来了，至少告诉我他放哪了"
"蠢蠢鱼冻sang","保密","未知","35303886","6","","10000","704","","来晚了来晚了，开始啦"
"安德切尔q","保密","德国","452264987","5","","10000","5","","OK，都是我老婆[脱单doge][脱单doge]"
"这个世界没救了_","女","山东","256240597","6","","10000","5","","亲爱的刃，你横竖长着都是我xp，更让我想起几年前的本命莲华（食物语的），呃呃，但是我是单推人，为了我不被二创创死，那么，这份喜爱之情我会暂时溺在我心里，qq了，我真的不想被腐女腐男创死"
"是超天酱本尊了","男","江苏","1873546106","5","","10000","5","","信不信，现在星穹铁道都有私服了[辣眼睛]"
"竹林的辉夜姬","保密","河南","141464132","6","","10000","5","","画饼是吧，画饼是吧，画饼是吧！！！！！！有本事就开公测！！！！[tv_白眼]"
"一口吞糯米团","保密","云南","13759873","6","","10000","354","","丹恒不是被追杀怕的原来[tv_目瞪口呆]刃每次追杀小青龙都被小青龙鲨了，但是刃一直在复活！根本鲨不完！然后丹恒被吓怕了[tv_目瞪口呆]我之前还以为他是被鲨怕了呢"
"__池也__","保密","广东","85271753","5","","10000","5","","歪？是叫刃是吗？开门！！结婚！！[脱单doge]"
"扶影あ","女","云南","1044378878","5","","10000","5","","许愿符华识宝能来星穹"
"御坂10413号","女","湖南","294874529","5","星座系列：双子座","10000","5","","给个建议不要买创作推广，用这个的大部分都是推销带货导致大部分人现在看到就下意识划过了"
"cy长一","女","山东","36267125","6","","10000","5","","我超，日配丹恒是伊东老师！？这也太棒了（掩面哭泣"
"巴力毗珥啮合","男","吉林","623861805","5","","10000","5","","你说得对(?)，但是已经发生的过去并不重要(?)"
"蜜茶耶比","男","重庆","255635748","5","","10000","5","","刃我的刃[大哭][大哭][大哭][大哭]快点公测吧好想玩"
"拒绝加班从识宝做起","保密","江苏","604004553","4","","10000","4","","丹恒！丹恒麦外敷！一天不看丹恒我就#恶心#头晕#面色苍白#出汗#腹痛#血压下降#休克#昏迷#体温增高#浑身无力发冷#没有食欲#昏昏欲睡呕吐"
"堇妤","女","天津","19269558","5","","10000","4","","刃老婆[喜欢]什么时候能让我玩到[保卫萝卜_哭哭]"
"函关_","保密","广东","327606769","5","","10000","4","","你～干～嘛～"
"若叶姬色同学","保密","广东","362986127","5","","10000","4","","撩又撩的很，公测又不肯"
"我芙永存","保密","湖南","439033513","5","异常生物","10000","4","","我家希儿呢[崩坏3・光辉矢愿_瞄准][崩坏3・光辉矢愿_up主]"
"柚子y_o_u_zi","保密","江西","114294524","5","","10000","4","","运营一个不存在的游戏很难吧(ω)"
"帕斯Passerby","保密","河南","23181375","6","星座系列：巨蟹座","10000","4","","隔壁联动寄了，来看pv[崩坏3_给你一拳]"
"双鱼Liter","保密","河北","313673389","5","","10000","4","","卧槽"
"HA_阡陌","男","海南","328119476","6","咩栗","10000","823","","小n之前直播还说以后配音可能就会永本名了因为不让有英文，还说以后配音演员写蒋丽不写小n的时候粉丝们不要以为她不配音转行了[笑哭][笑哭][笑哭]"
"Cc玩意儿","男","福建","199304041","6","","10000","5","","米哈游能不能不要乱做pv扭曲事实啊[疑惑],丹恒明明睡在我的床上怎么变成打地铺了[无语]无语"
"账号已注销","保密","四川","3493132398234492","0","","5000","5","","等丹恒up"
"__kira","保密","重庆","21922146","6","","10000","4","","就爱禁欲系，他禁我不禁"
"义尔原","保密","湖北","301845459","5","","10000","4","","这个男人,这个男人他....[doge]"
"煮饭婆可爱捏","男","江苏","352394713","5","","10000","4","","你干嘛～哎呦～～"
"域犬","保密","四川","36013160","6","异形舞台头像框","10000","4","","我推广:你干嘛[喜极而泣]就离谱"
"砖家们真砖业啊","男","上海","480850724","5","","10000","6","","首页：“你↑干↓嘛∽”,小黑子，露出鸡脚了吧[傲娇]"
"Void_Archives","保密","江苏","1535756606","5","","10000","4","","我超"
"Neon__tetra","保密","四川","502376160","5","","10000","4","","公测！[抓狂][抓狂][抓狂]"
"Kirizer","保密","广西","486002902","5","","10000","4","","你干嘛哈哈哎哟"
"小天天和小强","保密","广东","2007889","6","","10000","4","","急急急！我是急急国王！！快给我测试资格！！！"
"识之律者女土万岁","女","江苏","1461793614","3","","10000","4","","我等着两天后你的新pv[doge]"
"熊淌","保密","河北","10795707","6","","10000","4","","刃也太帅了，miki声音也好听[草莓大福_激动]"
"魔法少女心的栗","保密","福建","21806780","6","泠鸢yousa","10000","4","","运营一款不存在的游戏一定很累吧[滑稽]"
"Hesitate在塔","女","江苏","2007832819","4","","10000","4","","刃好帅 老公"
"荔枝创si全世界","保密","广东","1987223393","3","","10000","4","","甚至连汗都有建模"
"枯易浔茗","女","江苏","2080118380","5","","10000","4","","刃太好看啦！"
"崩菠染が消えた日","保密","河北","520654576","2","","10000","4","","怎么还不公测！,,是催铁道出琪芽小助手，V我三测资格祝我在仙舟大杀四方[支持][支持][支持][支持]"
"于于于念","保密","云南","384861517","5","","10000","4","","你到底公不公测，你别逼我发货嗷[原神_哼]"
"哦豁哟西安北","保密","河南","1049631799","4","","10000","4","","求求了，加强一下姬子吧[大哭]"
"Gamer-彻虚_太岚长城","男","河南","76595910","6","小试身手","10000","326","3","五名，精神状态上的5种类型，即威武顽强，高傲骄横，刚愎自用，贪婪疑忌，优柔寡断。《孙膑兵法・五名五恭》指出“兵有五名，一曰威强，二曰轩骄，三曰刚至，四曰助忌，五曰重柔”，主张对威武顽强的敌军，用示弱的办法对待；对高傲骄横的敌军，就故作恭敬以待机消灭；对刚愎自用的敌军，用引诱的办法战胜；对贪婪疑忌的敌军，则威迫其正面，骚扰其侧翼，用深沟高垒断绝其粮道；对优柔寡断的敌军，用鼓噪的办法恐吓，用袭击的办法触动，待其出来便打击，不出来便围困。"
"月夜星晓","保密","重庆","29250849","5","","10000","4","","欲癫   思IP  恐升温    随止[脱单doge]"
"吉伊の妈妈","女","江苏","10308908","6","","10000","4","","路过被刃扣了[大哭]话说四星还是五星啊"
"判官大人的呆头鹅","保密","重庆","3493142739290221","3","","10000","4","","刃厨梦开始的地方"
"B_nnK","女","山东","542204051","5","崩坏：星穹铁道","10000","152","","Get不到丹恒也无所谓啦，毕竟每个人的喜好不同，1000个人心里还有1000个哈姆雷特呢，希望在未来漫长的旅途中，你可以遇到相同喜好的人,永别了，没品味的东西（微笑）"
"Jeff与Green","男","陕西","55499804","6","","10000","5","","太搞了，第一次见没公测的游戏200w粉丝[喜极而泣]"
"Sky陀","女","江苏","512922686","4","","10000","3","","刃啊，我命中注定的老婆啊，我活着的意义就是你，你是我的信仰我的救赎我的神明，你是我无可替代的存在啊，我都是因为你才肝的游戏啊，到时我要是没抽出你，我真的会悬梁自尽的好吗[Vox Akuma_祈祷][Vox Akuma_祈祷][Vox Akuma_祈祷][Vox Akuma_祈祷][Vox Akuma_祈祷]"
"赦罪师-奎萨图什塔","女","甘肃","15677544","5","崩坏：星穹铁道","10000","3","","省流：刃是1"
