"昵称","性别","IP","UID","等级","装扮","用户权重","获赞数","粉丝团等级","评论"
"-爱练字的王同学","保密","广东","161745883","6","","10000","1","","我以为阿波尼亚哈哈哈"
"再见丶夕阳下的理想","保密","陕西","40102944","6","初音未来13周年","10000","1","","抽完阮梅抽黄泉[初音未来圣诞快乐_爱了]"
"冠位酒吞厨","女","河北","62883856","5","","10000","1","","在？发点星琼"
"小时hoolle","男","广东","249249719","4","","10000","1","","我只关心会不会做饭[doge]"
"__黑桃","男","浙江","18621277","6","","10000","1","","难得是穹当视频的主角  我们男主站起来了[奋斗]"
"洋芋花1a秒了","男","北京","415404559","5","","10000","0","","这比例你看正常吗？[辣眼睛]虎克的头比穹大了多少？"
"憋眼的猫","男","贵州","6049152","6","","10000","1","","不行了，又得等芽衣。[给心心]"
"F零陵","保密","山西","1683940650","4","","10000","1","","窝敲！芽衣姐！[星星眼][星星眼][星星眼]"
"欢乐の喜剧人","保密","广西","99016136","6","","10000","1","","你好，十连[脱单doge]"
"今天当上up主了吗","保密","广东","5900873","6","","10000","2","","我去芽衣！那我要开始攒水了，啊不是，攒星琼[点赞]"
"优贴贴吖","保密","贵州","408731841","4","","10000","1","","发型没内味儿啊。。。"
"SFEN","男","广东","71277722","6","","10000","1","","很喜欢网友的一句话：笑死，颁给一个手游[吃瓜]"
"是Yoon呀o","保密","天津","22205838","6","","10000","1","","是芽衣还是黄泉啊 有没有懂的[DOTA2 dodo_大笑]"
"a冷瞳","保密","广东","384122377","3","","10000","1","","《我什么都做不到！》[doge]"
"chaosystem","保密","贵州","3185194","6","","10000","1","","悲观的说，中间忘了，会被压死，后面忘了[脱单doge]"
"takiたき","保密","四川","24453789","6","","10000","1","","快端上来吧！！他们什么都会做的[大哭][大哭][大哭][大哭]"
"非洲联盟首席酋长","男","浙江","141029759","6","总之就是非常可爱","10000","1","","中午好，最佳移动游戏的玩家们"
"毛毛ee","保密","湖北","450103345","4","","10000","1","","我叫黄泉V我50封你做大将军[doge]"
"闪电侠5代","保密","广东","249445559","5","","10000","1","","好了，我要从现在开始囤星穹了[脱单doge]"
"看牛魔看","保密","山东","3546566962973026","2","","10000","2","","那些人，那些事，初见如故，常看常新。,在各位开拓者的支持下，《崩坏：星穹铁道》荣获“TGA 2023 最佳移动游戏”。你的陪伴就是这个故事继续下去的意义。,,中文CV：,黑天鹅――杨梦露,黄泉――菊花花,,日文CV：,黑天鹅――生天目仁美,黄泉――泽城美雪,,英文CV：,黑天鹅――Arryn Zech,黄泉――Allegra Clark,,韩文CV：,黑天鹅――,黄泉――"
"LunaKinred","男","湖北","85391334","6","","10000","1","","什么时候有德莉莎[doge]"
"瞳を刻む","男","广东","237829481","6","星座系列：处女座","10000","2","","啊这，对不起了我的阮饭！！我更喜欢芽衣的饭！！！！！[doge]"
"荣耀行军","保密","河北","699996035","5","2233十一周年纪念","10000","1","","好耶！是芽衣！我开始屯星琼了！"
"无垠之陆","保密","重庆","354148960","5","","10000","1","","来个崩三和星铁联动吧"
"崩环星穹铁道第一偶像","保密","江苏","290275156","5","2021拜年纪","10000","1","","来了来了，她来了，那个芽衣大小姐，她回来了[脱单doge]"
"瞻仰风景","男","广东","62816966","6","少前小剧场","10000","1","","如果一个角色，CV是芽衣，长得像芽衣，动作像芽衣，身材像芽衣，那她就是芽衣！！"
"多啦a梦的圆脸","女","湖北","15994477","6","","10000","1","11","匹诺康尼大舞台！有梦你就来！"
"无名且路人88","保密","广西","409252416","5","","10000","1","","没露脸的时候有一点芽衣的感觉，带上脸就不像了，还挺好的，不会一眼演员"
"永世红莲QAQ","保密","浙江","10164161","6","","10000","1","","后面还有个北辰芽衣"
"月墨沐","男","湖北","1303675878","5","","10000","1","8","好耶！1600！！！"
"易大师的无尽之刃","男","四川","335355690","6","","10000","2","","可喜可贺，先给兄弟们来1600抽没问题吧"
"永远不能中奖","男","浙江","516986940","5","2233十一周年纪念","10000","1","","有一说一，黑天鹅排面这么高，强度可不能低了啊[藏狐]"
"CrowleyA","女","广东","294723710","6","","10000","1","","星琼！星琼！星琼！[脱单doge]"
"氚渐斑驳","男","广西","202144912","6","提摩西小队","10000","1","","不懂的还以为下版本就去匹诺康尼了呢"
"芙九_","女","山东","226349769","6","","10000","1","","我擦！我真的猜对了，黄泉就是芽衣[星星眼]"
"此ID暂无人使用","女","广东","288742171","4","","10000","1","","卧槽芽衣"
"老非酋王T_T","保密","湖南","1031773442","4","","10000","1","","大胆点，自选五星。[OK]"
"曜莱菜","男","重庆","671466764","4","明日方舟","10000","1","","1600啊，银狼呢，救一下啊[doge]"
"原稀瓜","男","甘肃","3494372175776124","3","","10000","1","","我，好期待"
"是北旧呀","男","广东","1863506467","4","","10000","2","","青出于蓝胜于蓝，刚出未满一周岁就获奖了，我们铁道太强辣[打call]"
"当星星划过夜空","女","河南","109505590","6","","10000","1","","我们崩铁要有自己的雷电芽衣……[脱单doge][脱单doge][脱单doge]"
"梦漫无边际","男","美国","383545601","4","","10000","1","","等奖了 隔壁原是不是也要发点[藏狐]"
"高海千歌Mikan","男","山东","51103015","6","崩坏：星穹铁道","10000","1","10","恭喜星铁获奖[崩坏：星穹铁道_心],顺便黄泉cv，中配菊花花，日配泽城美雪，果然是米家知名女演员雷电芽衣女士[崩坏3・终焉归始_电力充足][崩坏3・终焉归始_电力充足][崩坏3・终焉归始_电力充足]"
"舍不得剪回家的","保密","湖南","1477141823","5","崩坏：星穹铁道","10000","0","","还是忘不掉崩三啊，故事都结束了还想记住。,天穹―巡海"
"风霜与夜雪","保密","广西","370315321","6","EveOneCat2","10000","1","3","是不是意味着2.0皮诺康尼卡池是黄泉黑天鹅[喜欢][喜欢]阮饭都变得不那么重要了"
"寻猫诀","保密","上海","523881149","4","","10000","1","","黄泉 有一种想满命的美[滑稽]"
"你谁啊跟你很熟吗","男","广东","649557161","4","","10000","1","","谢谢穹宝带我家丹恒出场[给心心]"
"Mizuki__","男","重庆","1328166990","5","","10000","1","","芽衣[脱单doge][喜欢][给心心][嘟嘟][惊喜][鼓掌][点赞]"
"苗木染","保密","四川","1858346897","5","","10000","1","","芽衣都出了那爱莉还远吗[打call]"
"lululalulu-","女","辽宁","1789732555","4","","10000","1","","恭喜恭喜！刚开始那个光好看！"
"爱丽丝的金木樨","保密","广东","8485406","6","","10000","1","","老杨要汗流浃背了"
"小起子LiGetupzq","男","山东","476055772","5","异常生物","10000","1","","最喜欢的一集，恭喜恭喜，永远喜欢星穹铁道|"
"为霜涵","男","山东","88080614","5","","10000","1","","我要在星穹铁道看罪人挽歌"
"两仪遵道恒长b","女","云南","2503407","6","罗小黑战记","10000","3","","我直接开始存专票等黄泉[tv_大哭]"
"I猫猫虫I","保密","浙江","13173993","6","初音未来13周年","10000","1","","出新手村了，以后的故事会越来越刀的[doge]"
"什激棠","男","美国","33769417","6","","10000","1","","日语01:35 左上角写错成Houkai了！1600抽全服失忆[doge]"
"大魔骑兵","保密","江西","305227834","5","","10000","1","","还要再熬过1.6才去皮诺康妮啊，好难熬啊[无语]"
"有趣的程序员","男","新加坡","234978716","6","","10000","717","","【内容总结】：,《崩坏：星穹铁道》是一款移动游戏，荣获了“TGA 2023 最佳移动游戏”奖项。视频通过展示游戏角色和参与者的配音成员，强调了游戏的故事性和新颖性。根据观众评论，视频中提到了一位名为寻海游侠黄泉的角色，他可能是游戏的下一位主角。,,【时间线】:,- 00:09 - 视频展示了关于星空的预言集。,- 00:15 - 视频讲述了一些曾经的故事。,- 00:18 - 强调了角色之间的默契和新鲜感。,- 00:41 - 角色和记忆都是难忘的。,- 00:44 - 角色们只是一个开始。,- 00:56 - 挑战和喜悦都将伴随故事的结局。,- 01:16 - 游戏的历程将继续下去。,- 01:23 - 视频提到了一位名为寻海游侠黄泉的角色。,,可能感兴趣的问题 (触发提问请回复: 问一下+问题):,1. 视频中的《崩坏：星穹铁道》游戏获得了什么奖项？,2. 视频中提到的黄泉角色在游戏中扮演什么样的角色？,3. 视频中强调的故事性和新颖性如何体现在这款游戏中？,,内容由AI自动总结, 总结内容仅供参考~ @VisionPro 触发了视频总结, 触发方式是 @有趣的程序员 总结一下"
"算是老萌新","保密","湖北","1472980280","5","","10000","1","","看了好感动[委屈][点赞][点赞][点赞]"
"进击的北","保密","甘肃","1028846381","5","","10000","1","","因为爱雷电将军所以我爱雷电芽衣所以我爱菊花花老师，黑天鹅也是啊啊啊啊啊，我快疯了，我要抽爆这些角色[大哭][大哭][大哭][大哭][大哭][大哭]"
"贰灬","保密","江苏","22927496","5","","10000","1","","斯诺康尼！芽衣！！！！！！！！"
"Zz1505505","保密","安徽","3494372446308454","3","","10000","1","","不愧是我最喜欢的游戏"
"flowerplayer","男","陕西","37374866","6","至尊戒","10000","1","","所以什么时候送十连[OK]"
"涅_Official","保密","重庆","382109617","5","","10000","1","","还有1600星穹[doge]"
"快去study","保密","天津","24780120","6","原神","10000","1","","是铁道芽衣[脱单doge]"
"凉风习习IOS","保密","辽宁","8496255","5","","10000","1","","都2023最佳移动游戏了，这不给发个三个五个大保底的星琼让大家一起乐呵乐呵？？？[妙啊][妙啊][妙啊][妙啊][妙啊]"
"若曦成烟","保密","广西","1078674852","4","","10000","1","","下一站！匹诺康尼！[打call]"
"我这人很懒-_-","男","四川","321111799","5","","10000","1","","黄泉是代号吧，他是芽衣？"
"叶东耀辉","男","江苏","1296653928","4","","10000","1","","穹帅的"
"沈曦罢","保密","浙江","1705312796","5","","10000","1","","几时上线 我要看手工区大佬做黑天鹅姐姐手中的书[星星眼]"
"在下安居士","男","黑龙江","514345718","5","","10000","1","","马上114.5w力（悲）"
"食之梦者","保密","广东","488177551","5","","10000","1","","恭喜恭喜"
"吃饱饱睡觉觉了","保密","江苏","1075298614","4","","10000","1","","芽衣[喜欢][喜欢][喜欢]"
"连山楚","保密","湖南","2648872","6","","10000","1","","匹诺康尼建筑风格有点百老汇的感觉？[思考]"
"风尘未","保密","广东","401866598","5","全职高手","10000","1","","菊花花，好耶[打call][打call]"
"树独ryh","保密","四川","122111848","5","","10000","1","","那个就是芽衣，我不管！[星星眼][星星眼][星星眼]"
"落叶归根不归土","男","辽宁","21845121","6","崩坏3・天穹流星","10000","1","","来点单体c吧，仙舟毁灭三大爹把风头抢完了，一个烧血一个烧战技点一个烧队友，其他命途能打的都没几个"
"M6托儿所所长","男","河南","35224433","6","","10000","1","","福神组天下第一！[doge]"
"白朴投币制","保密","河北","2131252821","4","","10000","1","","欢迎来到梦之城，我是你们最爱的主持人叽米（￣￣）"
"夙谨","保密","河北","139831227","4","","10000","2","","黑天鹅手中的书谁能做出来！！我喜欢[原神_哇]来个教程我也要"
"ロリ-マジ-天使","保密","上海","35892637","6","","10000","1","","冬马和芽衣[惊喜][惊喜][惊喜]"
"景星麟元踏浪雪","保密","湖北","359700584","5","黑白无双","10000","1","","九条和将军（）"
"真的吃点好的吧","保密","广东","21193644","6","","10000","1","","你司真的对同位素念念不忘啊，所以我星铁的琪亚娜什么时候端上来呢"
"正在干饭的绫华","男","河南","648062250","4","","10000","1","","明年绝区零奖项预订 别问我怎么知道的 因为一代更比一代强[脱单doge]"
"@D美","女","陕西","9014897","5","citrus","10000","1","","小手一抖 十连到手[妙啊][支持]"
"女帝家的路飞桑","男","安徽","1142697395","4","","10000","1","","不就得个奖吗？这不是每年固定的星琼和原石吗？别急，明年还会有的"
"角卷西瓜羊","保密","中国台湾","477862284","5","公主连结凯露","10000","1","","89张票全梭哈完0金,幸好看到这视频,一定是黑天鹅要我留住小保底的[墨镜]"
"文泽路站","保密","山东","403311937","5","","10000","1","","杨梦露这个声音抓耳"
"Dyvdhk","保密","河南","313155427","5","","10000","1","","那些人，那些事，初见如故，常看常新。"
"橙汁撑死鱼","男","天津","1023251460","5","崩坏：星穹铁道","10000","2","","从1.2就说要去匹诺康尼了，到现在害没去呢[傲娇]"
"溺死于过往","保密","新疆","287939736","5","","10000","2","","省流：,1，黑天鹅或将加入列车组,2，官方配队打蝗灾：饮月，藿藿，银枝，银河棒球侠,3，我们崩铁将迎来一位长得像芽衣，配色像芽衣，招式像芽衣，CV也是芽衣，自称为黄泉的芽衣"
"彼岸依尘","保密","广西","5868261","3","","10000","1","","老杨：来了，都来了。"
"斐同寻常Qshy","保密","福建","2836863","6","原神","10000","1","7","著名女演员:雷电芽衣"
"星宇小透明","保密","马来西亚","1143078069","2","","10000","8","","中配是菊花花然后日配是泽城美雪，我已经知道你是谁了然后我也准备好了[星星眼]"
"Z0o0e","女","福建","19826160","6","绽放收藏集头像框","10000","1","","这回是穹啊，等星宝了"
"TCHGY","保密","四川","651247374","5","","10000","1","","星琼什么时候发哦"
"只是一般路过小白","保密","广东","13873499","6","","10000","1","","这面部建模，和夜兰一个级别的好看"
"白玉楼的小少爷","男","上海","38033372","6","良辰美景・不问天","10000","1","","芽衣也来了，那么虫虫还会远吗？"
"tndwelcome","男","天津","155802","6","星座特典","10000","1","","[吃瓜]老杨：你们一个个身怀绝技，分身无数，合着就我一个真是自己跑来的[妙啊]"
"莱欧斯利--","男","北京","1508604210","5","","10000","1","","恭喜！"
"请不要看","男","广东","1465923","6","","10000","1","","你奖，我1600[doge]"
"钮钴禄-风纪委员-超","保密","黑龙江","648148018","4","","10000","1","","啊?星穹出了不到一年啊"
"饮一杯玖","保密","广东","321346429","5","","10000","1","","我还以为要出了巡猎主角再开新地图，那新主角要到什么时候开"
"CyberMondaynight","保密","河南","385331629","5","","10000","1","","芽衣[喜欢][喜欢]"
"北山流南","男","四川","610255216","5","","10000","1","","恭喜！"
"随缘逐流666","保密","陕西","496527535","4","","10000","1","4","芽衣[妙啊]"
"Linger聆","女","四川","1673771087","4","","10000","1","","哇哦恭喜恭喜！！！特别好所以请送星琼"
"最靓休伯利安舰长","保密","广东","18751756","6","崩坏：星穹铁道","10000","1","","现在开始算，等皮诺康曹得60天2个月[藏狐]"
"那空空_","保密","广东","345050188","5","","10000","1","","星琼！！"
"_-_-----_--___","保密","广西","628516797","5","","10000","1","","热泪盈眶，我们中国人自己的年度最佳！实至名归！[喜欢][喜欢][喜欢][喜欢]"
"二次元灬小达","男","山东","100408696","6","呜米","10000","1","","准时，哈哈哈！"
"小蜜蜂提莫爽爽粉","男","安徽","35342381","6","","10000","1","","无法拒绝各种芽衣[doge]"
"iTenStars","男","湖北","199587136","5","","10000","5","","黄泉面部我觉得不好看，能不能改改，背面太帅了！！！希望能优化优化！！！[打call]"
"夜班恐惧症","男","浙江","8099597","6","","10000","1","","常看常新"
"西琳世界第一","保密","重庆","1745104069","4","","10000","1","7","芽衣太敬业了，崩崩到崩铁都有[洛天依]"
"一个人的晚昏","男","福建","272047966","5","","10000","1","","决定了，存钻等芽衣"
"平平无奇的矿工罢了","保密","河南","689704769","4","","10000","1","","黑天鹅！！卡妈已经等了你好久了呜呜呜[保卫萝卜_哇]"
"aaer27","保密","天津","33487654","5","","10000","1","","十连，整快点"
"匿铭人士Ming","男","广东","202546645","6","","10000","1","","琪亚娜也快有了吧[doge]"
"高塔上的凡星","男","陕西","5420954","6","","10000","1","","姐姐没完成的，就由妹妹来实现吧~"
"再问弄了you","保密","福建","3461577671969414","4","","10000","1","","@梦忆幽然"
"金龙jinlong","男","北京","15206175","6","","10000","1","","姬子、布洛妮娅、芽衣、希儿、华，还差谁呢？是谁刚过完生日呢？"
"月华照澈万川","男","河北","1856907174","5","崩坏：星穹铁道","10000","1","7","九条加芽衣，不错"
"爆辣牛轧糖","保密","广西","167524380","6","","10000","1","","芽厨开始攒满命芽衣[喜欢]"
"浮生-烨夜","保密","福建","3493263663172127","4","","10000","1","","很好，1600直接银枝出了"
"奈良的星空じ","保密","江苏","510735066","4","","10000","1","","黄泉的命途是什么"
"素食主义且养猫02","男","北京","521419012","5","重庆狼队嗷呜狼狼收藏集","10000","1","","星球的设定星战既视感"
"查询wang_g精神状态","男","天津","3461568379488308","4","","10000","1","","哦哦哦哦哦哦哦哦哦哦哦,,――――该评论来自塞了个麒麟710低功耗暖手宝时常热断网的华为WATCH3微型腕上取暖器"
"风无色无味","女","江苏","32726824","6","","10000","1","","芽衣！！！"
"不嗑以太的大贤者","男","广东","24735051","6","","10000","1","","我的芽衣，终于来了[打call]"
"IG丶青松","保密","广西","390944969","5","不良人","10000","1","","《崩坏4:银河》呢？[doge]"
"和地球拼了","男","福建","23972655","5","","10000","5","","看弹幕都在说黄泉像芽衣但我觉得更像10年后的希尔  至少穿衣打扮和配色很像"
"K点の","男","福建","355595232","5","","10000","0","","谢谢你的十连小号出的大号毛都没有"
"Max_hard","男","广东","418182702","4","","10000","0","","30出[给心心][给心心][给心心][给心心]米哈游我爱你[给心心][给心心][给心心][给心心]"
"0时莫希0","保密","河北","617546196","4","","10000","1","","@企鹅带带北极熊 怎么还不来看啊啊啊啊啊啊啊"
"合金电钻布狼牙","保密","陕西","479395890","5","","10000","0","","谢谢你的1600，使我银枝旋转出仓[doge]"
"~るる_officaI","保密","上海","3798398","6","-阿库娅","10000","1","","抽到黄泉会不会在中午和晚上送我体力啊[doge][doge]"
"莳色不是矢色","女","上海","401839841","5","","10000","4","","好耶，是穹的长镜头[打call]"
"你好我叫阿哈","男","四川","347137943","5","","10000","1","","匹诺康尼，黄泉我来辣"
"橘君omo","男","陕西","403220189","5","记忆U盘","10000","2","","好耶，至少1600啦[脱单doge]"
"可乐姜饼人","保密","安徽","350714932","5","","10000","1","","好早一个，一个好早[星星眼]"
"入卿卿卿卿","女","湖南","168740501","5","","10000","1","","愿此行，终抵达群星"
"FrogEurope","保密","重庆","2055757485","3","","10000","1","","只要把黄泉放进队伍里面你就相当于有了103个人直接比一般人多出99个知道为什么吗？因为如果有芽衣在的话就相当于有100个人的力量啦"
"来瓶82年の拉菲","保密","广东","109208728","5","","10000","1","9","恭喜入选"
"杀死Perkz","保密","四川","384024045","5","","10000","1","","黄泉英配有点可惜不是雷电将军的英配"
"skyline云水","男","新疆","2143710372","3","","10000","1","","恭喜"
"阿奎TCG","男","河北","3362600","6","爱上她的理由","10000","1","","匹诺康尼！[大笑]"
"你脑子呢弟弟","保密","河南","386470175","6","","10000","2","","对不起了阮梅，我是芽衣的[滑稽]"
"KPRaat","保密","浙江","3285673","6","","10000","1","7","芽衣！不过对比希儿和布洛妮娅，发型变化有点大了，居然遮了半边脸"
"沉迷阎魔腿子","男","河南","17036900","6","","10000","1","","我来破坏一下气氛。,东仓泰山，西仓黄泉，南仓白神，北仓阿海。,樊少皇主演的《力王》"
"FrogEurope","保密","重庆","2055757485","3","","10000","1","","瓦尔特杨：这开拓之旅可真是越来越有趣了"
"随便写写就好了","保密","天津","483249712","5","","10000","1","","哦吼吼吼，杨梦露配的黑天鹅和芽衣的同素异形体黄泉太棒了！！！[喜欢][喜欢][喜欢]"
"面包车车的屑爷","男","河北","280378106","6","2021拜年纪活动专属","10000","5","","恭喜老米！恭喜各位开拓者，愿此程，终抵群星！"
"天才美少女March7th","保密","江苏","388683096","5","","10000","1","","所以崩铁有两个芽衣咯？一个是黄泉（雷电芽衣），一个是北辰芽衣（崩二的，雷电芽衣祖宗）"
"玄问记录","男","福建","604258578","5","","10000","1","","除了刘海，衣服和发型都是更接近后崩芽衣，刀也是雷律的，应该不是北辰。"
"NordreenThola","保密","天津","476074481","5","","10000","1","","化名黄泉，你是不是有一个不太拗口的名字[doge]"
"企鹅Spheniscidae","女","江苏","73850917","6","言和7th生日纪念","10000","1","","布洛妮娅（搂着希儿）：芽衣，你虫呢"
"我爱绿南京","男","江苏","13432317","5","","10000","3","","大家发财嘎"
"丨|L丨","保密","浙江","651973033","5","","10000","1","","在匹诺康尼的有；同谐家族，公司，欢愉愚者，巡海游侠，无名客，记忆黑天鹅，毁灭泯灭帮。星核猎手不知道跟不跟。匹诺康尼怎么还没炸"
"李伟看","男","福建","3537124563356304","3","","10000","1","","如果一个人，她长得像芽衣，配色像芽衣，招式像芽衣，CV也是芽衣，那么她就是芽衣[喜欢]"
"阴阳人钓阴阳鱼","保密","浙江","376971953","6","黄绿合战5th","10000","1","","芽衣姐..."
"谢礼尔Cheryl","女","浙江","54144828","5","崩坏：星穹铁道","10000","1","","第一眼：菊花花？！,第二眼：泽城美雪？！？！"
"FrogEurope","保密","重庆","2055757485","3","","10000","1","","黄泉已经有了芽衣的标准配置[支持]"
"战爽坤凡自幼善言","保密","山东","356609866","5","崩坏：星穹铁道","10000","1","","非常好星琼，使我的阮梅旋转"
"奶油生菜NB","保密","广东","443096385","5","","10000","1","","芽衣![给心心]600抽+后续星琼妄图拿下6+5"
"你帝释不释想上天","女","广东","400464557","4","","10000","1","","BGM！"
"babooNAN","保密","广东","42263836","5","刺客伍六七","10000","1","","等一手星铁钟离[偷笑]"
"各一份如果他","保密","北京","1438390647","3","","10000","1","","菊花花终于要来了"
"巴尔泽剪刀","保密","河南","1059286016","4","","10000","1","","其实老杨十几年前在量子之海里就已经见过无数同位体了，在星铁这几年也见了不少，90多的老杨早就习惯了，再看到黄泉这种长着熟人脸的也不会有什么大反应的（除非见到逆熵创始成员才肯定是要激动的）"
"苍蓝色的花","男","安徽","35589904","6","花丸晴琉","10000","1","","你好，1600星琼谢谢[doge]"
"木木馨宝","男","江苏","44441284","6","","10000","1","","果然是杨梦露老师，果然又是芽衣，那么阮饭吃完后就等您们二位了[滑稽]"
"南舟客-希灵审查官","男","安徽","431163540","6","","10000","1","","芽衣，何时来的？是了，我也爱你[喜欢][喜欢],[崩坏3・光辉矢愿_比心][崩坏3・光辉矢愿_比心][崩坏3・光辉矢愿_比心][崩坏3・光辉矢愿_比心][崩坏3・光辉矢愿_比心]"
"不要偏头痛le","保密","湖南","519443384","5","","10000","1","","芽衣！"
"朔雨暮湫ノ","女","浙江","505375455","5","","10000","1","","芽衣！芽衣！[喜欢][喜欢][喜欢]"
"sump黑晓","保密","河北","107998920","5","崩坏：星穹铁道","10000","0","","[吃瓜][吃瓜][吃瓜][吃瓜][吃瓜][吃瓜]"
"豁青莲","男","辽宁","10050499","6","","10000","1","","米家知名紫发女演员"
"静流的夫君","保密","广东","20414361","6","","10000","1","","好的芽衣，没问题的芽衣"
"葛优只爱打高端局","男","江西","1328304974","5","","10000","0","","我21级目前就这些，需要考虑配对吗？还是说随便带？"
"摸一凹喵喵喵喵喵","保密","江苏","85286113","6","-阿库娅","10000","1","10","老杨：这也是熟人那也是熟人！"
"会变成废人","保密","河北","3546585474533838","2","","10000","0","","又有新的地方可以探索了(=ω=)"
"11清酒000","男","陕西","13174935","6","","10000","1","","那个。。。得奖了可以画个贺图么，想看"
"不放纸鸢","保密","广西","440155130","4","","10000","1","","强袭强无敌"
