"昵称","性别","IP","UID","等级","装扮","用户权重","获赞数","粉丝团等级","评论"
"喵脆鲨","女","湖北","388384363","6","","10000","1","","新角色卢卡技能完整版：,天赋技沙场豪情,卢卡的普攻会交替进行一次左拳和右重拳，并总是以左拳开始。攻速可以同时加成两只手的攻速。同时，右重拳的出拳速度更快，同时造成额外物理伤害。,天赋二屈人之威,卢卡手痒难耐，渴望打架，每回合开始时提高自身30%的速度并使前两次的攻击伤害额外提高。,战技蓄意轰拳,被动：卢卡受到的100%伤害会存为豪气，上限为卢卡最大生命值的一半，豪气会在未受到伤害的回合内清零。主动：卢卡向三个敌方目标施加一记重拳，并消耗所有豪气；处于中间的敌人会受到依据消耗的豪气值来决定的额外物理伤害，不处于中间上的敌人则会受到物理伤害。同时，释放后卢卡也会获得一层数值等于消耗的豪气值的护盾，护盾会在一回合后消失。,天赋三强手碎颅,卢卡在一回合内受到至少两名敌人的攻击时，有概率将随机两名敌人猛撞到一起，造成物理伤害并减速50%，持续一回合，如果两侧都至少有一名敌人，那么所有被猛撞的敌人还都会被眩晕一回合。,终结技叹为观止,卢卡擒住一名敌方单位，扛着该单位前行，然后将该其猛摔到地上。该敌人附近的所有敌方单位都会受到额外的物理伤害并被减速99%，持续一回合。敌人离卢卡着陆的位置越远，受到的伤害越低。"
"闪耀的小江","保密","河南","593735174","5","多多poi","10000","1","","红色系，小男孩，用拳头作战，是开心超人没错了[笑哭]"
"九虚之誓","保密","北京","7106353","6","","10000","1","","又是火系拳师！好帅"
"浮生一什么露","男","内蒙古","21822757","5","","10000","1","","是义体，赛博精神病？"
"贝斯之魔神","保密","北京","696936396","5","白神遥","10000","1","","池子里真的有卢卡吗，我五十抽下去屁都没有[大哭]"
"S相啸魔S","男","内蒙古","392326789","5","2233夏日冰品","10000","1","","哟，这不Nero嘛？[滑稽]"
"辰蓝双星旅遥","保密","江苏","7950202","6","","10000","1","","寸金开天令"
"小熊猫-手作","女","山东","1955570198","5","","10000","1","","好捏吗？？我想捏"
"究极巨tm可爱的露露","女","安徽","530891594","5","崩坏：星穹铁道","10000","1","","哈哈，抢自己姐姐流量是吧？[呲牙][doge]"
"余夏焚音","保密","广东","3079177","6","拜年祭粉丝专鼠","10000","1","","不如你姐姐啊[doge][doge][doge][doge]"
"鲇川天理win","男","广西","3493141118191820","4","","10000","1","","没有任何故事的一个人"
"","保密","重庆","475589304","4","","10000","1","","我已经不玩了，开拓等级25，抽了50发一个金都没有，剧情里打可可利亚配队换了又换，再怎么也打不过去[微笑][微笑][微笑]"
"克罗咩","女","日本","2243079","6","赫奇帕奇","10000","0","","迪卢克和莱欧斯利那一夜犯下的错（ky删抱歉）"
"你是_梦中虚妄","男","福建","3493084530739378","4","","10000","0","","卢关卢关我的朋友（无端"
"纽约时刻","男","福建","149516539","5","纳米核心","10000","0","","诺克提的外表，凯亚的性格"
"VanDerBilt02","男","吉林","49610003","5","","10000","0","","他一定很酷，因为卢卡库"
"炖猫汤","男","河南","64532218","6","","10000","0","","开拓者：无所谓，横竖都是一球棒的事。"
"lqz山","保密","贵州","595864311","3","","10000","0","","迪卢克和凯亚的孩子 [脱单doge]"
"GrayJC","保密","浙江","156029091","5","2021拜年纪","10000","0","","新增卢卡击杀语音：趴着别动[doge]"
"黎R丁真","男","广西","486249809","5","","10000","0","","只剩下雪白的灰"
"天穹白逸","保密","浙江","352565358","5","","10000","0","","加强镜流"
"开拓者Mercedes","保密","上海","3537119335155916","3","崩坏：星穹铁道","10000","0","","开场白我在哪里听过[tv_doge]"
"EDG_Xiamu","男","福建","365317260","6","崩坏：星穹铁道","10000","0","","要是他对上开拓者会怎么样[吃瓜]"
"呵呵鳕","保密","天津","523532094","4","","10000","0","","就在刚刚，进入卢卡的同行任务，刚进竞技场有段动画，之后进入对话的时候，要是退出来，再进的话就会黑屏，没反应了我该咋办？[大哭]"
"逸--_","保密","山东","399919142","5","","10000","0","","原来是25届[灵魂出窍]"
"通り晓雨","保密","湖北","12753026","6","","10000","0","","卢卡同行任务，卡西迪和机器人是在致敬《安多》吗？"
"长笙qqq","女","山东","1981828313","4","","10000","0","","犯法"
"为了工资而学习","保密","江苏","85806455","5","","10000","0","","这个角色不是我的菜"
"憨憨荧妹单推人","男","浙江","139183178","6","七濑胡桃","10000","0","","栩原岳人配的卢卡在哪？？？"
"特暴龙wxsa","男","河北","1861888630","4","","10000","0","","下期走进星穹的主角是不是白露呀？"
"安迷丽hhh","女","陕西","524529563","5","","10000","0","","天照大神拳！"
"梦木lx","女","广东","16105843","6","","10000","0","","抽不出来啊，丢进去一个小保底，白露都歪出来一只，我卢卡在哪呢？"
"墨断秋","男","四川","28353730","6","","10000","0","","卢卡光看立绘肯定以为是火毁灭，谁能想到是物理虚无"
"Delta-_-_-","女","湖北","662741171","5","","10000","0","","这个建模有一种阿贝多的美感……"
"五人制文具","保密","云南","520258477","3","","10000","0","","红色调，机械臂，拳王，渴望打架，懂了，是白虎的地下拳王。@非人学园"
"一只会说话の番茄","保密","山东","1996725143","5","","10000","0","","铁甲飞拳!"
"Clemmenson","男","宁夏","33918497","5","","10000","0","","叽米枕头几号这是？"
"玖安东尼娅","保密","广西","1622425374","4","","10000","0","","所以我还是有个问题“义体打拳到底违不违规”[辣眼睛]"
"乐观的梦涛","男","浙江","3461581526534816","4","","10000","0","","我还以为是泪眼卢卡[doge]"
"二十四歌节气","男","湖北","189912224","6","","10000","0","","卢卡连续获得了多少届搏击冠军[doge]"
"10的15000000次方","保密","辽宁","175452903","5","","10000","0","","虚无(×),巡猎()"
"Hibikom","女","广东","12804207","6","初音未来13周年","10000","0","","卢卡不歪，玩到官服！"
"智慧の羽毛球","女","江苏","3493126985485278","3","横扫全场","10000","0","","《拾枝杂谈》"
"一只狐乎乎","女","广东","340046","6","#EveOneCat","10000","0","","卢卡的配音可不可以统一一下音量"
"我过阳关道","保密","四川","22932276","5","","10000","0","","这家伙打血多的怪是真的强"
"him一起走","保密","浙江","1085137507","4","","10000","0","","我知道了虚无是个分类垃圾桶"
"M灵I","保密","福建","23599811","6","","10000","0","","有个问题[思考]我到现在都不认识这个人，他一直发信息给我，好出戏啊"
"夏沫浅晨","男","广东","13878001","6","崩坏：星穹铁道","10000","0","","感觉四星角色没pv有点可惜"
"扔掉小皮筋吧","保密","广东","1776663121","5","","10000","0","7","@AI视频小助理 总结一下"
"洁世一可爱捏","保密","广东","283717107","5","","10000","0","","mhy你私了一个卢卡也不给我[微笑]希露瓦都满命了也不给一个卢卡，生日送的一百星琼也是希露瓦[笑]"
"小派不会输","保密","四川","3493108354386742","3","","10000","0","","这次的叽米可以说彻底放飞自我了[doge]"
"无命纪渊","保密","四川","3537110596324001","3","","10000","0","","哈哈哈"
"没名字用513","保密","江西","1485391796","4","","10000","0","","为了饮月，下次抽你"
"坤岩896577891","保密","广东","518738845","5","","10000","0","","这个卢卡他会千兆四重奏吗[脱单doge]"
"水河漓","保密","湖北","480138696","5","神乐七奈","10000","0","","我觉得星穹铁道可以像阴阳师那样做御魂（遗器）的弃置与整理的方案，难道说这样不更方便很多很多吗？[辣眼睛]@崩坏星穹铁道"
"小鲨鱼古拉_","保密","湖北","357252381","6","","10000","0","","矢吹丈"
"迪德莉佩格","女","天津","511406540","5","","10000","0","","卢卡有点像开心超人[doge][妙啊][doge][妙啊](这是可以说的吗？"
"Cthgua","保密","江苏","2677533","6","白蛇2：青蛇劫起","10000","0","","卢卡银手"
"一颗小小的余晖","保密","浙江","1956915389","5","崩坏：星穹铁道","10000","0","","他奶奶滴，妈妈刚出的那天我就出了他[笑哭],我第一反应是，他谁啊[笑哭]"
"猪兔家王富贵er","男","四川","311084148","6","","10000","0","","哎，这个解说的声音好像yxlm一个做角色攻略的up主，叫啥来着[笑哭]"
"faith_n","保密","山东","417063671","4","","10000","0","","单抽一发就中但没练[脱单doge]"
"符七_","女","广东","128694759","5","","10000","0","","没抽妈，但是抽到了卢卡，卢卡要养吗，还是说养素裳比较卢卡好"
"弈沐_Riku","保密","上海","52787598","6","","10000","0","","所以拳击场怎么不更新奖励[脱单doge]"
"MiKu刻晴都是我老婆","男","新疆","391423106","6","","10000","0","9","桑博满命了希露瓦满命了，一个这个都没有"
"压缩世界","保密","广东","45243628","5","","10000","0","","卢卡的通行任务呢？"
"艾笠d","保密","四川","34271793","5","","10000","0","","上同行"
"心做し°","保密","河北","16648676","6","赏樱大会欧皇","10000","0","","义肢为什么要举哑铃啊"
"意义-观察吗","保密","四川","1545020264","4","","10000","0","","像不像八角笼中[妙啊]"
"墨白胖熊猫","男","中国香港","8528236","6","良辰美景・不问天","10000","0","","所以叽米其实是啊哈养的把"
"波特卡斯-D-艾斯S","男","湖北","343562221","6","梦塔・雪谜城","10000","0","","六车拳西[doge]"
"五郎也是狗","女","山西","1499751260","4","","10000","0","","这卢卡好像和赛诺有点像[微笑]"
"passL","男","北京","665277","6","","10000","0","","希望以后别空降角色，至少有点角色塑造再进卡池让我抽"
"-MingDong","保密","广东","232798065","5","","10000","0","","90抽未见卢卡。卡夫卡都来了"
"八月无提","男","广东","29192559","6","2021拜年纪","10000","0","","这简介八十八度矿低不加条语音吗？"
"崩坏星穹铁桶","保密","湖南","3494373398415627","2","","10000","0","","有时候，我觉得自己是一个多情的垃圾桶，总是在意你们的举手投足，希望你们也能关注我。"
"L-聆","保密","广东","437344053","6","","10000","0","","叽米文才真好，啪啪啪啪"
"泥泞之星","男","甘肃","1882294371","5","","10000","0","","话说到底啥时候跟他遇见过我咋完全没印象"
"不受","男","广东","433942284","5","洛天依8th生日纪念","10000","0","","我直接：嗨！老公[害羞]"
"时","保密","广东","1960862524","3","","10000","0","","好的，下次上号升你"
"绥__青","男","山东","39644389","6","","10000","0","","卢卡 布拉奇（"
"脆脆鲨_w","保密","上海","14098367","6","萌宠小狗","10000","0","","你就不能把第二个登场的换成强一点的对手，接下一个大加战技加裂伤没倒下显得新角色很菜"
"darkness异世界的魔物","保密","陕西","39539010","6","良辰美景・不问天","10000","0","","笑死,50抽了抽不到卢卡[大哭]，许愿。。四星就不能加个保底吗，比如优先出没有的角色"
"陌上人如喵-","保密","未知","2108029823","3","","10000","0","","嗯……听到对手教练上场那段后，感觉刘北辰老师可以取代宝木给沈剑心配音……"
"我是夜影","男","江苏","2027584689","4","","10000","0","","家人们，谁懂啊？第一次抽卡，结果五命卢卡外加一个爹[笑哭]"
"柯蕾多尔啦","保密","安徽","3461577894267691","4","","10000","0","","诺克提[脱单doge]"
"邦邦邦啦啦啦啦啦","保密","新疆","17627534","5","","10000","0","","解说有点东西啊你说是吧，哈基米"
"无敌暴龙战神兽pong","保密","江西","652390423","4","","10000","0","","还没玩，那位大佬可以告诉我这个游戏下载后要加载几个G？[原神_哇][原神_哇]"
"咿呀1828","保密","陕西","381906485","5","","10000","0","","多可爱的弟弟呀，可惜我80抽都出不来[保卫萝卜_哭哭]"
"莫莫无雯","保密","海南","482901214","6","原神","10000","0","","他这个拳头我一直感觉很像隔壁崩三后崩里卡罗尔的拳头[喜极而泣][喜极而泣][喜极而泣]"
"匿名用户059","保密","重庆","672609460","4","","10000","0","","你什么时候更新星际和平播报？"
"Obreezing","男","江西","439789604","5","","10000","0","","官方大大我看到有视频说下载快手极速版可以领几千星穹与官方合作，请问是否属实"
"星夜叶音","女","福建","25620108","6","","10000","0","","60来发一个杰哥（78）一个妈妈没卢卡[笑哭]"
"松间F月_","保密","广东","225294682","5","","10000","0","","卢卡真的好帅啊啊啊"
"晃悠悠的蓝莓","保密","海南","26394109","5","2021拜年纪","10000","0","","四星没PV 只有解说吗 [笑哭]"
"以我残躯化为烈火","女","江西","483394609","5","","10000","0","","不尬啊，我觉得一股夜之城味[脱单doge]怀念起大名鼎鼎的时光"
"纯情左律重拳出击","保密","山东","487058015","3","","10000","0","","杂鱼！"
"鸿雪最可爱","保密","江苏","291279891","5","良辰美景・不问天","10000","0","","穹宝啊，你啥时候线下联动啊"
"胡稻鲤","保密","四川","1025177758","4","","10000","0","","不好意思，第一眼看成了绝少里的大门大[笑哭][笑哭][笑哭]"
"奈明一","保密","湖北","34737412","5","","10000","0","","@AI视频小助理"
"正义の红毛","保密","广西","363909114","5","","10000","0","","本来就很喜欢卢卡，看完《八角笼中》更是喜欢到爆炸[打call]"
"Ai_长乐未央","保密","陕西","288370909","5","","10000","0","","赛博打拳！！！"
"神有一叹兮","保密","山东","497940963","4","","10000","0","","侧滑加强景元，不然四全价"
"陶森特山雀","保密","北京","494538160","6","","10000","0","","他跟末日铁拳谁更厉害？"
"怎会如此_-","保密","河北","3493085849847954","3","","10000","0","","嘶哈嘶哈"
"箐","保密","四川","435802419","5","","10000","0","","太帅了"
"老中医的自我修养","男","四川","3461562362759690","4","","10000","0","","哈哈，为啥说卢卡可以用叽米啊"
"比带土还要爱琳","男","福建","3493079700998433","3","","10000","0","","崩溃了80抽卡芙卡没出怎么办"
"柠九家的柠檬酸","保密","河北","226197585","5","不思议之旅","10000","0","","只因（）"
"黄金的果实","保密","山东","402424726","5","明日方舟","10000","0","","提！高！模！拟！宇！宙！对！应！祝！福！出！现！概！率！特！别！是！欢！愉！"
"林厌心","保密","福建","210119832","5","","10000","0","","不懂就问，你任务策划是不是原的啊，龙图三变又臭又长"
"提米的大鞋学费","保密","河南","252074523","5","","10000","0","","都在说符玄在下半，但后面没啥想要的啊，赶快公布卡池顺序[脱单doge]"
"提米的大鞋学费","保密","河南","252074523","5","","10000","0","","在？能不能把符玄放上半[脱单doge]"
"咕漏不是骷髅","保密","江苏","1617393560","4","","10000","0","","想入坑，想问一下有什么建议吗"
"米忽悠再不出金斯玛","保密","河南","227036883","4","","10000","0","","要是可以联机就好了，比如两个人一起战斗"
"我一定要活五十亿年","男","未知","439240235","5","","10000","0","","感谢感谢，最近运气真好，三款游戏都免费抽到了想要的人物[吃瓜]，可恶啊，为什么我买双色球就没有这样的运气？[辣眼睛]"
"死吧我想","保密","河北","1227679006","3","","10000","0","","这里有一个10开头的账号价格可以商量。"
"膝盖要上天","保密","广东","332732760","6","","10000","0","","百鬼丸点赞"
"传说中的懒馒头","男","河北","3494377456405089","3","","10000","0","","又是看不懂的丘丘语[OK]"
"我真的好喜欢猫猫","保密","贵州","1122571214","4","","10000","0","","他在下城区掀起风暴！穿过每条街道，观众奔走相告；八角笼中喧闹，对手绝望哀嚎；他的红发燃烧，他的铁拳狂暴，善人为他尖叫，恶党只能逃跑！"
"只因_有你","保密","山西","3493126761089208","3","","10000","0","","以为是火系，结果是物理，后来看见是物理伤害又以为是毁灭，结果是虚无[大笑][大笑][大笑]"
"幻冖夜","男","广东","283746044","6","","10000","0","","我感觉有点像姬子的弟弟的感觉[喜极而泣]"
"水彩colar","保密","辽宁","1819358896","5","领风者","10000","0","","bgm是什么来着"
"饭量巨大","保密","未知","1760790419","4","","10000","0","","我把他和物理主角放一对，帅的不要不要的[doge][doge][doge]"
"敲艾景元元","保密","河北","3493112649353803","2","","10000","0","","我智库里为什么没有点刀哥"
"辉月姬如雪","女","山东","3461570776533243","3","","10000","0","","[哦呼]"
"Mona-_","男","广东","284230046","6","","10000","0","","60发一只卢卡都没出[辣眼睛]"
"抱着月亮的天狗","保密","广东","46691969","5","","10000","0","","卢卡、萧翟：我们词儿呢[藏狐]"
"布罗修斯","女","浙江","294063083","5","实验品家庭","10000","0","","米哈游多来点这种，直女爱看"
"233秒素晴","保密","上海","28282671","6","","10000","0","","他在下城区掀起风暴！穿过每条街道，观众奔走相告；八角笼中喧闹，对手绝望哀嚎；他的红发燃烧，他的铁拳狂暴，善人为他尖叫，恶党只能逃跑！"
"普克托利","男","重庆","1702925855","4","","10000","0","","卢卡：开心铁拳~~[奋斗]"
"优势放心我会送","保密","云南","623001391","5","","10000","0","","慢着这讲解声音让我想起来了，英雄联盟新角色解说[微笑]"
"达格莱斯","保密","广西","476994797","4","","10000","0","","那对手的枪支，炮弹以及我的四打一要怎么办？"
"海表森","保密","江苏","10700231","6","中野二乃","10000","0","","银狼发点体力啊"
"|洋から来た大清","男","湖南","2094647034","4","","10000","0","","卢卡，为了我好吗？成为炎拳吧"
"茗森零驿","男","辽宁","493093201","5","初音未来13周年","10000","0","","优化一下吧，全都是bug，我都快烦死了"
"稚渊Ocean","女","江苏","275582178","5","2233幻星集","10000","0","","义肢好戳我xp（对手指）,抽到了！准备去练了！"
"钟离大人唯一的狗_","女","新疆","475712189","5","","10000","0","","卢卡跟迪卢克其实不太像，银枝那个气质才是真像"
"南宫玉","保密","山东","1516314","5","","10000","0","","众所周知，我是一个修车的，身上带着机械手臂也很合理吧[doge]"
"IOS昧成年","女","湖北","289170209","4","","10000","0","","老师好可爱哈哈哈"
"全知全能宇宙统治者","保密","山东","1100646450","4","","10000","0","","星穹铁道我要做卡芙卡的狗"
"爱我墨律","男","广东","67508055","5","","10000","0","","男版楚雨荨是吧[笑哭]"
"氢氧化亚咩跌","保密","广东","1084566519","4","","10000","0","","米卡可以拐卢卡吗？"
"卿不晓我心","保密","广西","1070374856","5","","10000","0","","@枭与蒲公英之约 好像迪卢克"
"月瑞涵","保密","山东","447640440","4","","10000","0","","可是卢卡他笑起来那么好看！啊啊啊啊啊啊啊啊！"
"梓茉汐","保密","广西","62907712","6","百妖谱","10000","0","","为什么每次都能那么准点啊，不是要审核吗？求大佬解惑[思考]"
"久保渚D啦","保密","广东","1664649774","2","","10000","0","","芽衣姐真的会出吗？有吗有吗有吗，会吗会吗会吗"
"时空边缘-鱼儿","男","浙江","178084383","6","崩坏：星穹铁道","10000","0","","错啦！,卢卡技能介绍,普攻：屈人之威,卢卡手痒难耐，渴望打架。卢卡的下次攻击将基于目标的最大生命值来造成额外伤害并叠加战意。卢卡也会在场上有一名以上敌方英雄时获得速度加成。,天赋：沙场豪情,卢卡的普通攻击会交替使用左重拳和右重拳。右重拳稍微强一些和快一些每次攻击与被攻击都会增加战意，并在积攒足够战意时立即插入回合，向与自己同位置的敌人猛烈轰击并扩散周围两名敌人, 天赋增强:主目标会造成无视防御的真实伤害,战技 强手裂颅:,卢卡选择两名敌人并将其撞击在一起，造成双倍弱点击破值，并获得两层战意,天赋增强:卢卡造成弱点击破时，立即在造成伤害时消耗掉该层弱点击破持续伤害 并将倍率提升至？？？％,终结技：叹为观止,卢卡将一名敌方带到空中，然后将其猛砸到地上，在该着陆后对其附近的所有敌人造成伤害和减速效果 并使被扩散目标受到的伤害附带敌方最大生命百分比加成。[脱单doge]"
"随机舔一口鸣上岚","男","广东","601303239","4","","10000","0","","我去，天城一彩"
"啵啵啾吼","保密","辽宁","88818542","5","星座系列：双鱼座","10000","0","","卢卡，我冲到卡妈大保底，姐姐6命，桑博7个，桑博专武两个(已经6个了)，卢卡硬是一个没有啊[小电视_哭泣]"
"落地成喵_","保密","湖北","1522555","6","","10000","0","","我一直以为他是火系[笑哭][笑哭]"
"冷向珊半鬼","保密","云南","535649216","4","","10000","0","","老登，快送点星穹，抽没了"
"呆蠢不萌","保密","河北","267300227","5","","10000","0","","小保底从来不歪，炫耀.jpg[doge]"
"御坂小美","男","湖北","259459781","5","橘猫挂件","10000","0","","能不能和fate出个联动，我直接抽爆"
"霓雨之虹","保密","上海","688918141","5","","10000","0","","感觉强化普攻打存护猪会破盾破的很快啊"
"玄夜灵梦","男","河南","578795981","5","","10000","0","","他在下城区掀起风暴！穿过每条街道，观众奔走相告；八角笼中喧闹，对手绝望哀嚎；他的红发燃烧，他的铁拳狂暴，善人为他尖叫，恶党只能逃跑,6"
"荔娱","保密","北京","1617649152","3","","10000","0","","有点像真侍魂2里的莱锡路[笑哭]"
"小釉同学","保密","新疆","1980428261","3","","10000","0","","包月（不含探索和收集）,,小包月，含每日委托和清体力：70-100元。仅委托或仅体力大概30-50,,大包月，全包含委托、体力、派遣、纪行、活动、声望、深渊、尘歌壶等：180-250元。,,探索和剧情：,,蒙德地图100%（不含雪山）：160元。,,璃月地图100%（不含层岩）：380元。,,稻妻地图100%（不含渊下宫）：450元。,,须弥雨淋100%：500,,须弥沙漠100%：450,,主线魔神任务，25-30每个,,传说任务，20每个,,长支线（神樱大祓、远吕羽氏等），20,,森林书、沙漠书：150元,,材料收集：,,风神瞳收集满35元。岩神瞳满70元。雷神瞳满120元。曹神通满180元。,,大世界采集材料0.1元每个。怪物材料0.2元每个。"
"路卡比奥","男","天津","22754462","6","","10000","0","","之前我看到他的名字我就意识到了，这我必须抽个他啊[doge][doge]"
"季玻长","男","广东","509303298","5","","10000","0","","你怎么知道我十发出金"
"庥了","女","河南","535363875","4","","10000","0","","五十发一个没有[微笑]"
"小夜的柿子熊","男","江苏","32981933","6","","10000","0","","才发现叽米是刘北辰老师配的音，好强啊老师[跪了]"
"神的徘徊","保密","广东","473188012","5","","10000","0","","火箭拳，火箭拳是男人的浪漫[星星眼]"
"Tata小石头","男","四川","223918946","5","","10000","0","","为什么不能脱衣服"
"千之依","保密","广东","1152872715","4","","10000","0","","所以为什么不是毁灭[辣眼睛]"
"木木风禾","女","重庆","35482610","6","","10000","0","","(BB)"
"sll200","保密","广西","116741010","5","","10000","0","","[鸡腿]"
"伟大的阳光","男","天津","30607999","6","","10000","0","","卢卡全名是叫卢卡・布拉西嘛[doge]异世界教父的头马[doge][doge]"
"汉戟书魂","保密","山东","142596929","5","","10000","0","","谢谢米哈游[害羞][害羞]卢卡我领走了，顺带卡芙卡一起[害羞][害羞]我真的很喜欢拳手"
"五胞胎凝视","保密","福建","457690227","5","","10000","0","","我还挺喜欢卢卡的，他给我一种热血漫男主的感觉，看着他的时候总会有好几个动漫和漫画在我脑中闪过[傲娇]"
"温胭\","保密","江西","3537116795505358","3","","10000","0","","呜呜让刃亲自给我发消息！不要逼我求你！"
"温胭\","保密","江西","3537116795505358","3","","10000","0","","穹宝我要听刃说我爱你[大哭]"
"XY星域SD","保密","广东","1989456397","5","","10000","0","","我的实力，是货真价实的"
"鱼-梦-仙","保密","广东","3537113362467036","2","","10000","0","","官方，我有一个剧情能不能说一下"
"--吃-瓜--","保密","广东","147155685","4","","10000","0","","希尔歪了，银狼歪了，罗刹歪了[嫌弃]，我看你米忽悠还歪不歪我这准备抽的卡芙卡！全特么大保底！"
"皆貌幌牖画啦","女","安徽","1215074136","5","","10000","0","","卡池里根本没有卢卡！！！！！！！！！"
