"昵称","性别","IP","UID","等级","装扮","用户权重","获赞数","粉丝团等级","评论"
"簸卧","保密","福建","178402336","6","挚爱花海","10000","19025","","感谢UP，我本来还有800年寿命，看完up的视频当场就变了魔阴身，直接少走了800年弯路，愿慈怀药王保佑你，丰门"
"蕾铠","男","广西","484335","6","","10000","937","","饮料：洞天隐月苍龙濯世,炸鸡：炎枪，冲锋,送餐：帮帮我，肯德基爷爷,外卖：随蝴蝶一起消散吧，旧日的幻影,外卖2：试探就到此为止了，万剑，天来,宣传：此番美景我虽求而不得，却能邀诸位共赏,饮料2：就让你们看看，这葫芦里卖的是什么药"
"肯德基","保密","上海","275338136","6","","10000","18200","","#崩坏星穹铁道# #星穹铁道肯德基# #崩铁 帮帮我肯德基爷爷#  开拓者一定都学会了帕[脱单doge]"
"破坏领主","男","江西","148172","6","","10000","6","","这边的美食指南和隔壁的完全不一样啊[脱单doge][脱单doge][脱单doge]"
"我即是无双","男","陕西","449240542","5","","10000","3237","","我到底是犯了什么病才会相信星穹铁道真的想教会我做饭"
"琉金流星","男","上海","525981799","5","原神","10000","733","","右下角,《请勿模仿》,《这个可以模仿》"
"咖啡巫OMO","保密","未知","258944923","6","","10000","14","","第一眼：太抽象了[尴尬],看了眼id：是星铁能整出来的活[鼓掌]"
"乖璃_","男","山东","10697165","6","","10000","7","","0基础也能做的肯德基冰激凌,冰雪铸成此志，永不终结"
"大小曦-","保密","上海","515851737","4","","10000","9","","[脱单doge]"
"网络里仅有抽象","男","江苏","496273773","5","","10000","2310","","谢谢你，买了一杯饮料，现在我们村在抗洪[脸红]"
"六月里的微笑","保密","河南","442441242","3","","10000","5","","联动的店再多几个又能怎样！本来肯德基离我家就远，联动的店离我家更远！[大哭]"
"不愿透露姓名的软某人","保密","江苏","36439175","6","","10000","6","","看完这个视频表面我还活着，其实走了有一会了_(:з」∠)_"
"canhead罐头","男","四川","13490355","6","","10000","7","","二命小龙人是不是可以第二杯半价？[妙啊]"
"玫瑰茄泡水不好喝","保密","山东","13342797","5","","10000","4","","该说不说，史瓦罗大佬的大衣真帅啊,感觉适合帅老头冬季出街（在说什么）"
"我想有只曼基康","保密","云南","34367628","6","星座系列：金牛座","10000","18","","好家伙，我这里万达商场门口，左边肯德基，右边必胜客，必胜客原神的角色海报还贴在窗户上，不知道肯德基会不会贴星铁的[笑哭]不知道的还以为来到米哈游办公楼了"
"koykos","保密","河南","355789712","5","","10000","17152","","在肯德基上班，已经绝望了，22号后厨排班上午只有我一个人[大哭]店长压根没意识到事情的严重性"
"我曾经也是个舰长啊","男","辽宁","434829215","5","崩坏：星穹铁道","10000","6","","不知道大家有没有注意到，肯德基爷爷在跑动的时候那个男生的头发是会随着方向变的，可能大概是想表达肯德基爷爷速度很快之类的吧，不得不说mhy真是细节狂魔"
"纸片猫猫特调","保密","山东","15129235","5","","10000","8","","非常好炸鸡，这使我的脸庞烧糊,这视频的运镜演员站位和配乐使我相信应该致敬了这个视频【三秒日式炸r教W-哔哩哔哩】 https://b23.tv/QjNKZv9,原视频是非常好作品，美味炸虾使人心动"
"白笛fue","男","广东","28959316","5","良辰美景・不问天","10000","9212","","注意右下角，前面两个“请勿模仿”，肯德基爷爷帮帮的写着“这个可以模仿”[doge]"
"提呐里","保密","湖南","26189945","5","","10000","6","","超好看！"
"六子彤","保密","江苏","88949288","5","","10000","100","","我喊的时候你可千万别售罄啊[藏狐][藏狐]"
"炎之心flame","男","广东","86886993","6","洛天依9th生日纪念","10000","91","","古有天火烤披萨,今有炎枪烤炸鸡,[洛天依9th_敲碗等]"
"淹子_","保密","辽宁","431472874","6","星座系列：白羊座","10000","89","","这一幕似曾相识，有种拿天火圣裁烤三明治的美感"
"初い寒幽幽","男","福建","453946057","5","神乐七奈","10000","66","","丹恒和三月七都去当联动角色了，那我就穿一下开拓者的衣服来吃kfc诶嘿诶嘿~"
"永远の巧克力","保密","江苏","472215042","5","电子喵","10000","66","","可是...联动套餐里没有炸鸡腿啊，他为什么可以在里面掏出这么大一个鸡腿！？隐藏套餐吗？[笑哭][笑哭][笑哭]"
"米游姬派蒙","保密","广东","84675700","6","还有醒着的么","10000","948","","后面那个克拉拉什么鬼啊"
"琉金流星","男","上海","525981799","5","原神","10000","733","","右下角,《请勿模仿》,《这个可以模仿》"
"菠萝辉虹","女","湖南","442664616","5","","10000","773","","那么这个配音还是孙烨老师吗[笑哭]"
"蕾铠","男","广西","484335","6","","10000","937","","饮料：洞天隐月苍龙濯世,炸鸡：炎枪，冲锋,送餐：帮帮我，肯德基爷爷,外卖：随蝴蝶一起消散吧，旧日的幻影,外卖2：试探就到此为止了，万剑，天来,宣传：此番美景我虽求而不得，却能邀诸位共赏,饮料2：就让你们看看，这葫芦里卖的是什么药"
"芷若爱芷彤","男","广东","1446250685","4","","10000","569","","先有的崩3，然后是原神，最后是崩铁"
"有稀吖","女","浙江","273707124","6","","10000","4847","","我为什么会以为他真的想教我做菜"
"有生之年能看到吗","男","安徽","315622780","5","","10000","615","","选用的食材是叽米吗[doge]"
"sisicy","保密","山东","67412491","5","三周年恋曲","10000","520","","纯路人，崩铁制作组都这样吗"
"薯王菲利普","男","山东","9922895","6","","10000","4621","","很喜欢景元将军的一句话：疯狂疯狂星期四 原味鸡两块九块九"
"一节骨头","男","广东","29624976","6","","10000","539","","米哈游的广告还是一如既往，有种在麦当劳喊出帮帮我肯德基先生的美"
"我即是无双","男","陕西","449240542","5","","10000","3237","","我到底是犯了什么病才会相信星穹铁道真的想教会我做饭"
"白泽Eric","男","河北","316312525","5","","10000","461","","炸鸡我以为会用姬子的那个…不知道叫啥，跟卫星一样的东西轰炸[笑哭]（达摩克利斯之剑？）"
"慕流盼","女","浙江","515298109","4","","10000","3771","","我：“帮帮我，肯德基爷爷！[委屈]”,店员（打包好给你）：“离开肯德基。[阴险]”"
"夜猫伏昼","男","海南","32648928","6","","10000","440","","至此，广告出现新流派，史称米氏创人意识流。[跪了]"
"网络里仅有抽象","男","江苏","496273773","5","","10000","2310","","谢谢你，买了一杯饮料，现在我们村在抗洪[脸红]"
"天天背锅崩坏娘","保密","重庆","20313793","6","","10000","428","","啊？这封面我怎么看出了当初那个跳舞的肯德基老爷子样貌（ò  ó）"
"万叶的围巾","保密","浙江","1056892165","5","崩坏3・天穹流星","10000","2357","","感谢UP，我本来要堕入魔阴身了，看完up的视频当场就悟了，瓦达西红豆巴卡，立刻被接引成了神使，愿圆环之理护佑您，圆门"
"没吃饭吃我一枪","保密","上海","1433266558","5","","10000","467","7","丹恒的技能原来是这么用的！,（刚放学直接就看到联动。[笑哭]"
"炸鱼的巴巴托斯","保密","广东","1517960029","4","","10000","4978","","我感觉那个套餐价格不是很合理。55块一个堡，一个鸡腿，一杯可乐，个人感觉有点小贵。我就想知道有没有便宜一点的套餐啊。"
"lhl1313","男","四川","335207096","6","","10000","43","","大家晚饭吃嘛嘛香！"
"4399游戏盒","保密","福建","251347544","6","","10000","2242","","这个艺术对于一个盒子来说有点太超前了[热词系列_知识增加]"
"公子的腿环","保密","湖南","691207353","5","","10000","481","","要是我线下买的时候饮料不是丹恒扣出来的我不喝[傲娇][傲娇][傲娇][傲娇]"
"ERIC-1041","保密","湖南","351162236","6","","10000","1350","","该死，我本人就是肯德基宅急送的骑手，天知道这次联动会不会把我们爆单爆到自动停单（"
"花花DVD","女","山东","660100574","5","","10000","338","","家人们[微笑]这里没有主题店，只吃那个55的套餐还需要喊口号吗[微笑]"
"姬子是我舰长哒","男","马来西亚","453875195","5","","10000","2705","","我觉得可以出个皮肤，史瓦罗 - 肯德基爷爷，试想一下用这皮然后克拉拉开大突然蹦出一个肯德基爷爷，真帅[崩坏3・终焉归始_cool]"
"白彦少佐","保密","广东","59496061","6","登乐V计划","10000","1133","","所以说真的要跟店员说那句社死的话嘛？,帮帮我！肯德基爷爷！[笑哭]"
"新世纪纯美战士","保密","山东","34617766","6","国民老公带回家","10000","214","","肯德基爷爷给我一种《龙族》里昂热的感觉"
"GC阐释","保密","陕西","49972017","6","春原庄的管理人小姐","10000","1173","","姐姐是怎么忍住不笑的哈哈哈"
"诸位共赏真君","男","黑龙江","1799048963","4","崩坏：星穹铁道","10000","29","","大家晚上好[doge]"
"毁灭_还是叫刻晴吧","男","广西","1531330351","4","","10000","1034","","没有爆衣跳舞环节[妙啊]"
"琥珀绮","保密","湖南","893353","6","碧蓝之海","10000","204","","肯德基爷爷为什么没有撕开衣服？[滑稽]"
"HikariFCd","保密","广东","186662427","6","","10000","1058","","你好，我想喝：,星芋啵啵，仙人快乐茶，苏打豆汁儿,全都叫我出去做好吗（尤其是第三个）[doge]"
"倚竹听溪","保密","广东","88850855","6","","10000","174","","这做出来不是烤鸡吗？怎么是炸鸡[傲娇]"
"野蛮熊先生","保密","江西","386137790","6","","10000","902","","看之前:哇，我这个不会做饭的一个人也能尝试做美食了？,看之后:[呆]（啊？我不会啊）"
"渺青","男","河南","8292634","6","","10000","122","","这肯德基爷爷没有撕衣服一身肌肉那个招牌动作我不是很认可[doge]"
"民国豌豆","保密","湖南","484465441","5","","10000","181","","所以说乘坐星穹列车会发炸鸡块吗？[doge][doge]"
"Aruo奥珀薇尔","女","北京","507871060","5","","10000","98","","这个肯德基爷爷好帅啊，演员叫啥呀"
"温泉蛋不要温泉","保密","江苏","105505","6","","10000","104","","这么抽象的吗[崩坏：星穹铁道_呆]"
"小芳芳好看o","保密","安徽","3493144932911230","4","","10000","243","","我为什么会以为他真的想教我做菜"
"阿恒所言极是","保密","福建","3546384221341733","2","","10000","21","","我抱着学习的心态观看，你却给我整这死出[辣眼睛]"
"宁波银行信用卡","保密","上海","1576770770","6","","10000","84","","我从没想过 炸鸡居然是炎枪冲锋 另外 什么时候肯德基能出个带电的套餐 下次让妈妈来教我[妙啊]"
"语核","保密","北京","3493130724706733","4","","10000","3245","","以为肯德基限定风之翼终于能复刻了，再一看是星铁[笑哭]"
"肆懿而为","男","安徽","1775638668","4","","10000","72","","所以，是不是22号就可以去主题店了"
"莫莫无雯","保密","海南","482901214","6","原神","10000","66","","开始联动了是吧[吃瓜]说吧，这次的口号是什么[吃瓜][吃瓜][吃瓜]"
"天天背锅崩坏娘","保密","重庆","20313793","6","","10000","34","","小伙伴们是否和我一样想起了这个( ○ Д ○)"
"文豪莫言","男","四川","1000630347","4","碧蓝航线","10000","61","","一个社死肯德基广告搞得我都想入坑了[笑哭][笑哭]"
"圭月山风","男","甘肃","87411205","6","乐正绫五周年生日","10000","61","","杨叔，我害怕"
"LUCYNAKushlnada","男","上海","13444421","6","至尊戒","10000","17","","帮帮我，肯德基爷爷！"
"老柏仔","男","广西","107984970","5","","10000","339","","“眼一直闭”"
"猫洁莉娜_Official","保密","上海","19887435","6","","10000","57","","为什么炸鸡不用那个“人类从不掩饰掌控星空的欲望，当然，也包括我在内”[思考]"
"萌到橘头自然沉","男","贵州","15077451","6","暮光幻影","10000","54","","把我尿都笑出来几滴[C酱兔兔纪念装扮_鹅鹅鹅]"
"甜甜妹子哇","保密","安徽","3493139664865610","3","","10000","262","","起初，人们以为这只是一句玩梗，直到崩铁策划把它加到联动活动里..."
"生活总是晴天呀","男","江苏","51896114","6","全职高手","10000","49","","那个，就不能喊“帮帮我，肯德基大爷”吗？,我年纪大了，实在是喊不出口。"
"弈旅袭","保密","山东","470989622","5","","10000","49","","视频中虽是整活，但是剧情里符玄偷偷传了一套万能料理秘籍给开拓者：,就是晚上睡前把材料和食谱准备好，然后睡一觉，睡醒之后，饭就做好啦！要是起的比往常早的话，还能碰到不知从哪来的罗刹[墨镜]"
"冰淇淋宁雨","保密","柬埔寨","1926750009","4","","10000","147","","刷了半天，难道这个梗已经过时了吗？这不明摆着是在玩梗模仿“三秒炸鸡”吗！连每一小节最后贴出宣传图时突然升起的摇滚乐也气质一样！看到这条评论的！现在就去b站给我搜三秒炸鸡！！跟这个一样好笑！！！c(`Д)"
"樱萍Apple","女","广东","1723817","6","","10000","46","","啊这？？？？？？太抽象了"
"不思进取夜一酱","男","江苏","38674539","5","","10000","46","","这个肯德基并不是很爷爷[辣眼睛][辣眼睛]"
"刃下狼血","男","江苏","193006350","6","","10000","45","","啊？"
"电音天使-初音未来","保密","广东","5079253","6","初音未来13周年","10000","45","","这不让肯德基老爷爷跳那段母亲节广告的舞蹈？[滑稽]"
"t与自己和解","保密","湖南","2134163811","5","","10000","43","","帮帮我肯德基爷爷[大哭][大哭]衡阳一个主题店也没有[大哭][大哭][大哭]"
"燃烧世界","男","广东","6495281","6","明日方舟音律系列","10000","48","","这里没人管,偷偷抄1遍，还有49999遍,如是我闻:,,一时千手慈怀药王游化诸界，与莳者九万九千九百九十九人俱，住罗喉下，而为说法。,,尔时倏忽令使问千手慈怀药王言:「众生有疾，万类皆苦。一切有情众生，缚于生老病苦，何谓苦本?」,,千手慈怀药王言:「生老病苦，皆归于死。生者之苦，苦于有涯。老者之苦，苦于必至。病者之苦，苦于近死。是故生老病苦，谓有死。从有死，则为苦本。」,,倏忽令使合掌言:「一切有情众生，有灭尽日，有轮回日，何断生老病苦?」,,千手慈怀药王告倏忽令使言:「是彼众生，囿于形骸，如囚入笼，受三苦刑。吾今植永寿神木，令彼众生解脱，生无涯，老不至，死回生，断离烦恼。」,,尔时倏忽令使作是念言:「药王慈怀，建木生发。莳者一心，同登极乐。」,,「药王慈怀，建木生发。莳者一心，同登极乐。」,,尔时莳者九万九千九百九十九人俱言:「药王慈怀，建木生发。莳者一心，同登极乐。」,,说是语时，莳者九万九千九百九十九人俱，皆断生老病苦。"
"勋宗来了","男","河北","1531035835","4","","10000","42","","这种艺术也许对于星穹列车来说很正常，但是对于地球来说还是太超前了"
"air-moonlight","保密","浙江","23665130","6","","10000","42","","一下子感觉崩崩和崩崩崩好正常[笑哭]"
"熊猫明启","男","福建","2104766428","3","","10000","42","","感谢UP，我本来要压制不住魔阴身，看up的视频的时候手机掉到脚趾挖的三室一厅，伸手去拿的时候掉进2.5次元，现在已经是次元扑满了"
"FurAlice","男","江苏","14219976","6","战双帕弥什","10000","42","","所以为什么别的地方app都能显示联动餐了，扬州这边只有亚运会喜羊羊[辣眼睛]"
"花式躺输不带重复","男","四川","26497253","6","","10000","40","","这次没有去现场喊“帮帮我，肯德基爷爷”的线下活动吗[doge]"
"woaijuege","保密","上海","287371695","5","","10000","40","","我朋友本来不想买的现在她想买了，，这何尝不是一种成功的营销("
"大瀚王朝","男","福建","396529861","5","","10000","40","","你怎么知道我连歪了2次克拉拉[大哭]"
"夜岚_晴雅","男","马来西亚","364504820","6","2233幻星集","10000","9357","","可以，很符合我对崩铁制作组精神状态的想象。"
"荆楚熊氏","保密","陕西","396876593","6","","10000","8651","","可以，很符合我对崩铁制作组精神状态的想象。"
"两剂败毒散","保密","北京","630319641","5","雪未来","10000","45","4","上次原神短片太正常了以至于我看着没感觉。这次终于不正常了，下次争取更加发病"
"PomeloSt","男","江西","8198922","6","明日方舟","10000","39","","很好，我店是南昌唯二两家主题店之一[百变星瞳_两眼一黑]"
"通辽唯一奇迹","保密","浙江","626034776","5","","10000","43","","感谢肯德基帮我堕入魔阴身让我少走800年弯路，十王司和幽囚狱的饭还是蛮好吃的，再次感谢肯德基让我过上朝九晚五食宿全免的健康生活[滑稽]"
"大喊大叫的鸺","保密","福建","24865495","5","","10000","37","","在肯德基上班+1，这波是工资回收计划[笑]"
"没有你的颜色","男","四川","131456688","6","崩坏3・天穹流星","10000","37","","我等着各位去点餐喊那尴尬的口号[tv_坏笑]"
"帷幕VMovie","女","辽宁","2169841","6","崩坏：星穹铁道","10000","40","","啊？[崩坏：星穹铁道_震惊],灵感已经有了…嗯…敬请期待！,开始整活！[惊喜]"
"冰攻厂BeSo","保密","广东","9068441","6","异常生物","10000","39","","不愧是星铁的运营组 整活花样真的多"
"柠檬挞pockey","保密","广东","4722528","6","#EveOneCat","10000","33","","家人们，之前都在外服模拟人生，最近才回内地，马上要第一次参加这种kfc联动活动，有没有人告诉我一下，外卖能点到吗？有完整周边吗？"
"炎焱sama","男","湖北","412789272","5","","10000","33","","emm，kfc软件上还没上这个套餐吗，还是说我这边没有"
"摸鱼型饭团","保密","江苏","1723954958","4","","10000","31","","星穹铁道保姆级教学，教你0基础做美食！相信自己，你一定会有所收获！赶紧跟着视频操作，开启你的美食练习吧！[兔年]"
"催更鸽","保密","广东","198402240","6","","10000","11","","虽然，但是,oh～薅你毛"
"繁羽disaster","男","辽宁","89029184","6","崩坏：星穹铁道","10000","30","","不愧是你，这活整的[崩坏：星穹铁道_呆][崩坏：星穹铁道_呆][崩坏：星穹铁道_呆]"
"一棵二叉树_","女","辽宁","97243088","5","圣诞节快乐","10000","29","","看完直接少走五十年弯路堕入魔阴身，精神状态领先百分之八十的仙舟人[微笑]"
"丹樨木","保密","湖南","37958498","6","","10000","29","","正襟危坐准备学习教程,看完第一个：啊？"
"吃瓜的指挥官","保密","四川","353455837","5","","10000","28","","该怎么说呢，不愧是一家的，和隔壁某米游戏一样很会整活[呆]"
"上官星研","女","河北","129049219","6","星座系列：白羊座","10000","28","","祖传生草小视频[吃瓜]"
"Eltwk","保密","广东","27137868","6","","10000","27","","查询制作组精神状态[崩坏3・光辉矢愿_彩虹水枪]"
"大唐嘤嘤虾","男","甘肃","286404937","6","星座系列：摩羯座","10000","26","","[抠鼻]打算专门那天去kfc，带一壶热水，看着喊口号哈哈哈哈哈"
"かっこよさ","男","广东","1576116332","5","","10000","26","","啊啊啊，这些我都做不到，我要魔阴身了！！,呃哼哼哼哼，啊啊啊啊啊[辣眼睛]"
"叶の鑫","保密","四川","507262511","5","","10000","30","","我:帮帮我，肯德基爷爷,店员:离开肯德基（威胁）"
"银白卷卷","男","黑龙江","497445119","5","","10000","25","","某日，一群克拉拉来到肯德基站台门前：推开门的时候，必须甩手推门的同时高喊：“大门是用来推开的！”,,进入店内，点餐的时候，必须摸着下吧沉吟：“让我看看，你这单里卖的什么餐”,,点好单了，得和服务员说：“帮帮我，肯德基爷爷”,,服务员面带微笑的回答：“在我这儿，你可以买到任何东西，呵呵，只要钱到位。 ”,,厨师热菜的时候得中二的高喊：“随油锅一起消散吧，旧日的猛禽”,,玩家拿套餐的时候服务员要说：“这么大的套餐，送给你”,,玩家领餐及开动前，要有仪式感的说:“人类从不掩饰想吃肯德基的欲望，当然也包括我”,,吃的时候，边吃边沉吟：“套餐之间，有着无穷的可能性。将炸鸡抽骨吃肉，探索美食的过程，就是我们正在进行的旅途。”,,玩家吃完离开时，要来一句酷酷的话作为结尾：“美妙的食光总有尽头,该说再见了”"
"影墨鱼","保密","湖南","516287623","5","","10000","25","","脑子好像不太对劲，好像要堕入魔芋爽了"
"律法豌豆","保密","广东","442400025","5","","10000","25","","原姐的小尬剧原来跑你这了[妙啊]"
"IIlllIIIll","男","北京","3345617","6","#EveOneCat","10000","24","","上次开服前的广告，精神状态就是大杀四方[笑哭]这次联动的依旧稳定发挥"
"黄某人是个棒槌","保密","四川","37112606","5","","10000","24","","22号起，但是前一天是疯狂星期四[辣眼睛][辣眼睛]"
"梦染星230V","保密","广东","359497382","6","星座特典","10000","24","","我知道你在找什么[崩坏3_差不多得了],BV19h41197CR"
"大小曦-","保密","上海","515851737","4","","10000","9","","[脱单doge]"
"路人-_-","女","江西","2043823042","4","","10000","9","","01:22 这个可以模仿[滑稽][滑稽][滑稽]"
"枫香之冬熙","男","四川","14455685","6","EveOneCat2","10000","23","","笑死我了，很难想象一个朋友在麦当劳喊“帮帮我，肯德基爷爷”，然后店员大喊“离开麦当当∠(｀ω*)”"
"窝踏马吃吃吃","男","中国澳门","309702","6","花园Serena","10000","23","","我决定不喊  一直盯着店员[公主连结_冷漠]"
"神里绫华の女友","男","安徽","249477052","5","原神","10000","29","6","啊？真叫「帮帮我，肯德基爷爷」啊？[热词系列_知识增加]"
"雨も","女","湖南","494781045","5","泠鸢yousa登门喜鹊","10000","22","","？啊，精神状态很稳定[粉红兔子恋与篇_什么]"
"磁爆步兵54","男","浙江","3443416","6","","10000","40","","哦薅你毛,我听说你有世界上最好的妈妈（指卡芙卡）"
"惭","女","河南","225389269","6","洛天依蝶变头像框","10000","27","8","帮帮我，肯德基爷爷！[崩坏：星穹铁道_哭哭]"
"夜岚_晴雅","男","马来西亚","364504820","6","2233幻星集","10000","24","","啊？？？真叫「帮帮我，肯德基爷爷」啊？,还我“异世相遇,尽享美味”[委屈],[热词系列_知识增加]"
"诺诺诺wan","女","广东","1622772418","4","","10000","20","","谢谢崩铁，本来要堕入魔阴身的，看这个视频手机掉床缝里了，去捞的时候卡住了，卡到2.5次元变成次元扑满了[辣眼睛]"
"麻烦来一碗bill玉米片","保密","广东","8154564","6","汉化日记","10000","20","","试图查询游戏组的精神状态[doge]"
"笛blublu","保密","广东","10006795","6","崩坏：星穹铁道","10000","20","","我希望这个活动过去后我能看到一大堆cos克拉拉or景元元去喊帮帮我，肯德基爷爷的视频[脱单doge]"
"边镜","保密","江苏","2730070","6","","10000","20","","这个广告本身就是在玩那个三秒厨房的梗吧[笑哭]既视感太强了"
"草鱼Oxc","男","重庆","1074309142","3","","10000","23","","建议把香凌带来现场烹饪奇葩料理[妙啊][doge]"
"金柯垃灰太狼","男","湖北","302167327","5","星座系列：双鱼座","10000","34","","很符合我对星铁制作组精神状态的刻板印象[笑哭]"
"玄枵EDDIE","男","四川","6607508","6","","10000","19","","此番美景， 我虽两眼一黑， 却能邀诸位共赏。[笑]"
"七夜x_","保密","安徽","1877827179","4","","10000","19","","这下真的是 帮帮我，肯德基爷爷[保卫萝卜_哇]"
"缘之龙月","男","广东","102576048","5","","10000","19","","帮帮我，肯德基爷爷[保卫萝卜_哇][保卫萝卜_哇][保卫萝卜_哇]"
"Lilian啊啊","保密","四川","17098833","5","","10000","28","","大家晚上好"
"真理永存-理门在上","男","广东","22170219","6","","10000","18","","三个战技点，一杯三块吗[脱单doge]"
"我想有只曼基康","保密","云南","34367628","6","星座系列：金牛座","10000","18","","好家伙，我这里万达商场门口，左边肯德基，右边必胜客，必胜客原神的角色海报还贴在窗户上，不知道肯德基会不会贴星铁的[笑哭]不知道的还以为来到米哈游办公楼了"
"群星晨夜","保密","广东","1731008319","4","","10000","18","","星穹铁道制作组，仿佛让我看到了：,BV1ho4y1j7Ps,米哈游总部没了的回忆。[脱单doge][脱单doge]"
