"昵称","性别","IP","UID","等级","装扮","用户权重","获赞数","粉丝团等级","评论"
"居居想吃番番鸭","女","江苏","291233379","6","","10000","1","","镜流来！镜流来！镜流从四面八方来！魂兮归来！魂兮归来！啊啊...我的镜流！啊啊.....魂兮归来！（做法）（跳大神）（围炉转圈）（上香）（做法）（做法）（念咒）（旋转）（摇铃）（跳大神）（低声吟唱）（摇铃）（甩旗）"
"闪耀一君","保密","福建","1200056893","4","","10000","1","","好像崩坏三里的特斯拉，没戴眼镜的样子。[星星眼]"
"XMNoise","保密","广东","152434737","6","","10000","1","","大伟哥动捕好可爱[脱单doge]"
"滑稽于万物之上","保密","四川","491398116","5","","10000","93","","我很担心评论区的各位啊，未来小三月被刀的时候可怎么办呐，那场面我都不敢想，现在我仿佛已经能听到心碎一地的声音了[doge]"
"流萤单推人","保密","黑龙江","480909985","5","小试身手","10000","1","9","28:56"
"xu9p60","男","福建","2710003","6","","10000","1","","白珩不就是现在的白露嘛[思考]我记得不知道在哪里看到过的，可能是饮月的同行？丹枫跟刃就是为了复活白珩，才引发的那个大事件，白露就是那时候诞生的，所以白露算是白珩的蜕生之后现在的身份了。"
"0醉梦仙霖0","男","广东","25241654","6","","10000","12","","鹿鸣的技术用上了？最有趣的一次前瞻直播，下次也要三月七直播呀[给心心]"
"是你的辅助丫","女","四川","4503410","6","","10000","128","","不懂就问，镜流外面四件是冰套更好还是暴击率那套更好？"
"我洗个头亏你还称","男","湖南","1808120297","5","","10000","1","","连个前瞻都塞这么多梗，我真的是服了[笑哭]"
"抖M的贞德厨","男","广东","40962551","6","","10000","2","","神君还不如一只猪"
"日行一膳x日行一饿","男","河南","450126687","5","","10000","19","","看到十管燃料直接飞过来的[打call]"
"别碰我的车和狗","保密","四川","234005286","5","","10000","24","","刃和镜流组队会不会贫血[doge]"
"浮尘_流年若往昔","男","浙江","675824897","5","","10000","3","","兄弟们，三个up抽啥好呀？抽镜流的话我就只有个大鸭鸭，没罗没刃，星琼也只够抽角色，不够专武的。目前比较偏托帕和希儿，一方面是准备我有克拉拉专武，准备抽个托帕给克拉拉当辅助，但是又被希儿的强度吸引，可是要组量子队的话我又组不出来，大家建议我抽哪个？[笑哭]（零氪，极限三选一）"
"嘿_我的猫","男","江苏","497095663","5","","10000","3","","无尽位面还有几天出啊，没啥可玩的了"
"绚烂灼眼","保密","河南","86906252","5","","10000","1","","r(￣S￣)q"
"冯叫兽","男","上海","40397","6","","10000","3","","看到托帕的账账可以寻扑满我满脑子都是：就是你小子把皇军带到这儿呢？[doge]"
"罗兰戏炎","保密","浙江","1873087204","4","","10000","118","","下个版本时间是5周，比之前短了几天"
"一位transient","男","河北","646904448","5","","10000","1","","我们都有光明的未来，蚌埠住了，这都敢说，直接最后一期[笑哭]"
"不灭它","保密","陕西","528691444","4","","10000","2","","马上就是1.5直播，这1.4是一点也待不下去了[doge]"
"萝卜鱼是小萝卜","保密","安徽","282357913","5","","10000","2","","好喜欢叽米哈哈"
"素寒笙","女","江西","436544444","5","","10000","42","","为什么这个版本只有五周？卡池和深渊怎么安排"
"三十三画__","男","陕西","314890671","5","","10000","1","","三月妻"
"天使鹅军","保密","广西","3493116562639085","3","","10000","13","","我是萌新玩家，有人能告诉我燃料有什么用吗？[微笑],还有，新手剧情的布洛妮太难打了，打了我两个小时才打过[大哭][大哭][大哭][大哭][大哭]"
"CX-D03","保密","广西","187896941","6","","10000","26","","在那个战线里可以玩蚕食者幻影吗(=ω=)"
"lzaw","男","山西","34090352","6","","10000","1","","小三月太可爱了太可爱了太可爱了太可爱了太可爱了太可爱了太可爱了太可爱了太可爱了太可爱了太可爱了太可爱了太可爱了太可爱了太可爱了太可爱了太可爱了太可爱了太可爱了太可爱了太可爱了太可爱了太可爱了太可爱了太可爱了太可爱了太可爱了太可爱了太可爱了太可爱了太可爱了太可爱了太可爱了太可爱了太可爱了太可爱了太可爱了太可爱了太可爱了太可爱了太可爱了太可爱了太可爱了太可爱了太可爱了太可爱了太可爱了太可爱了太可爱了太可爱了太可爱了太可爱了太可爱了太可爱了太可爱了太可爱了太可爱了"
"Nice阳崽","保密","河南","183517183","6","三周年恋曲","10000","1","4","来喽来喽！,MBM7WFF5PECC,FSMPWFE56EUG,NT4NEEFM6EV4,KFCGIVEME50"
"Timor略略","保密","广东","96778134","5","全职高手","10000","2","","很棒的视频，加油(*°°*)八(*°°*)"
"前往色彩斑斓的明天","保密","中国台湾","383573501","5","","10000","2","","乙太战线结束后如果选择留下扑满，那真能在列车上养一只了[滑稽]"
"影之雷者","保密","广东","480257416","5","","10000","13","","玲宝这个外号不单可以指玲可 还可以指符玄 因为 花玲"
"影之雷者","保密","广东","480257416","5","","10000","37","","举杯邀明月 对影成三人，月既不解饮 影徒随我身，所以李白跨时空写崩铁的证据有了"
"优雅与气质耶","保密","江西","3493294354991350","3","至尊戒","10000","2","","一集动漫的时间[打call][打call][打call]"
"姬Z","男","陕西","628669454","5","星座系列：双鱼座","10000","3","","NT4NEEFM6EV4"
"泠鸢ysaou","保密","广西","437771294","5","hanser","10000","304","","你怎么送得比人家周年庆还多[吃瓜]"
"青海剑客李长青","男","江苏","94657687","6","","10000","2","","这次动捕是大伟哥吗[脱单doge]"
"我爱米哈游的up","保密","山东","1677280402","2","","10000","3","","你又来拜托，蝗灾现在全国的人都少的可怜，又来一个"
"核心橙老司机","保密","湖北","114683026","4","","10000","9","","省流:,一、兑换码: ,MBM7WFF5PECC,FSMPWFE56EUG,NT4NEEFM6EV4,过期时间：23年09月30日12:00:00 ,二、卡池,上半卡池:新五星镜流 属性:冰 命途:毁灭(四星：停云，青雀，桑博) ,下半卡池:复刻希儿，新五星托帕 属性:火 命途:巡猎 新四星桂乃芬 属性:火 命途:虚无 (四星：桂乃芬，卢卡，素裳) ,三、活动: ,1.巡星之礼(签到送十连),2.以太战线(联机活动，类似宝可梦玩法，自选四星：希露瓦，佩拉，虎克，卢卡),3.模拟宇宙・无尽位面,四、新增内容与系统优化,雅利洛-Ⅵ新增2张地图(造物之柱，旧武器试验场),新增镜流同传任务――云无留迹,新增剧情回顾功能,详情请看：【【星穹铁道】1.4前瞻直播总结】 https://www.bilibili.com/video/BV1Kw411e7XB/?share_source=copy_web&vd_source=786cc1bf2a23077e94ec46ae477a5ca4"
"我是冬啊","保密","江苏","84925583","5","","10000","15","","所以轮到你进化了对吧，对吧对吧[偷笑]"
"哈哈哈哈哈贺","保密","广东","386136608","6","","10000","2","","哇，这个托帕秘技有点离谱"
"休与月眠","女","江西","125101312","6","崩坏：星穹铁道","10000","29","","家人们下个版本寰宇蝗灾还在吗？平常太忙了根本没时间打[大哭]"
"THE裁缝","男","新疆","628402310","5","","10000","2","","我何德何能在10月20日刷到[笑哭]"
"流阎","男","北京","51081102","5","原神","10000","2","4","焯！主线打不过了[大哭]"
"疏期","保密","四川","565478913","5","","10000","0","","原来我三次前瞻都错过了"
"陈白o","保密","广东","519833411","5","","10000","0","","遥遥领先"
"深渊魔女艾蕾娅","保密","上海","25954103","5","","10000","0","","目前这个组合应该可以，罗刹，镜流，景元，刃，这四个放在一起好像挺好玩的"
"rqyl_1614","保密","内蒙古","2011631614","4","","10000","0","","@有趣的程序员 总结一下"
"Badalandabad","男","山东","95666565","5","","10000","0","","谁家炮仗能放出蘑菇云啊……"
"青苑-QY","男","福建","525209771","5","","10000","0","","最喜欢贝洛博格"
"鸭池","保密","广东","7895634","6","","10000","0","","没有，都散了吧"
"清漪121","保密","四川","3461572588472999","4","","10000","0","","蹲"
"量产型咕哒子","保密","湖南","1243957826","4","","10000","0","","镜流PV咋还不出。。"
"魅惑的TA","保密","四川","593088424","2","","10000","0","","申请了专利能发点星琼不"
"某小保底没歪的希厨","保密","湖北","3537108142655568","3","","10000","0","","警察：你犯法了，跟我走一趟o我：规则就是用来打破的！[tv_doge][tv_doge][tv_doge]"
"Generations裂空","保密","广东","2141307430","3","","10000","0","","如果一个刃，再加一个符玄，镜流岂不开心坏了？"
"坚定那光","男","重庆","42442713","6","至尊戒","10000","0","","听说成都是homo聚集地是真的吗[doge]"
"会飞的龙猫122","保密","重庆","2743156","6","","10000","0","","谢谢你  三月七"
"Mr丶沫然","男","重庆","26886659","6","快把我哥带走","10000","0","","150抽了还不出啊，你不要太过分了[tv_吐血],我认识的就没有一个像我一样一直非的"
"Mute一all","保密","黑龙江","1794289081","4","","10000","0","","那个地中海手套找不到同款[呆][呆]"
"清黎qla","保密","浙江","1942076436","5","","10000","0","","不知道为啥，总感觉镜流终结技的红眼没有凶狠的感觉，反而看上去有些...呆？"
"_lingyuqi","保密","美国","399463651","5","斗破苍穹","10000","0","","速速出叽米，我必抽，劝你快点出[脱单doge]"
"爱吃辣条的柯","保密","广东","1629314642","3","","10000","0","","官方你什么时候复刻卡芙卡啊！"
"孤狼贵族_跳跳虎","男","福建","474089573","5","","10000","0","","所以1.4是有宝可梦对战吗[喜极而泣]"
"罗子君君子兰","保密","福建","1901845147","5","拉文克劳","10000","0","","不是，星穹铁道没有每日委托嘛，那我缺的原石谁来给我补啊"
"牧童遥指种花家","保密","广东","479031494","5","白蛇2：青蛇劫起","10000","0","","星铁真的太有意思了[脱单doge][妙啊]"
"马克尔Macker","男","安徽","1167825942","3","横扫全场","10000","0","","封面致敬崩三！！！！！！！！！！！"
"蕤雪儿","保密","广东","384135856","3","","10000","0","","谢谢小三月，小三月果然是爱我的[脱单doge]"
"能饮一杯无23333","男","日本","1503813271","5","","10000","0","","我去，刚走就搞线下是吧[大哭]"
"纠结的景","保密","广西","440134363","5","至尊戒","10000","0","","那个，表演赛是拿了第一名以后就进cg唱歌跳舞那种？[doge]"
"光明顶一星","保密","江苏","1032691966","2","","10000","0","","哇哦"
"觉君在","保密","上海","327007027","3","","10000","0","","[OK]"
"魈魈夜","男","广东","2632250","6","碧蓝航线","10000","0","","谢谢三哥[崩坏3・终焉归始_给你水晶][崩坏3・终焉归始_给你水晶][崩坏3・终焉归始_给你水晶][崩坏3・终焉归始_给你水晶]"
"海思陌","保密","河南","3493257141029733","4","2233十一周年纪念","10000","0","","[热词系列_爱了爱了]"
"芙宁娜_德_忠犬","保密","陕西","320323482","5","","10000","0","","MMD让我有些想歪的感觉"
"封aw","女","江苏","1957670120","3","","10000","0","","星铁的策划如果一直这样，我能吹一辈子。"
"wdcm20844","男","福建","202350979","3","","10000","0","","许愿镜流不歪！！！"
"寂寞丶雨声","男","山东","521869608","5","电子喵","10000","0","","在？什么时候优化cg音质炸裂的问题"
"-不会数学的数学家","保密","山西","603886695","4","","10000","0","","动作指导：大伟哥[doge][微笑]"
"途刺","保密","湖南","1649429163","5","","10000","0","","镜流[喜欢][喜欢][喜欢]"
"途刺","保密","湖南","1649429163","5","","10000","0","","[喜欢][喜欢][喜欢][喜欢]"
"积极世界auw","男","广东","1158442753","3","","10000","0","","终于知道扑满的60星琼哪来的了……"
"科匕-布莱蒽特","保密","河北","3493108710902566","3","","10000","0","","北京南站是京沪高铁和京津城际的起点"
"三十三画__","男","陕西","314890671","5","","10000","0","","三月妻[喜欢]"
"洁宝九罐王","保密","广东","3493130399648460","4","","10000","0","","太可爱啦！！！！"
"赵相机的御用相机","保密","云南","3461562733955810","5","","10000","0","","叽米，你不是还有一座水下堡垒吗"
"AtlasPrime","男","黑龙江","11366740","6","原神","10000","0","","好好好，赞助Dota2是吧，我忏悔，当初玩了两周觉得不想玩第二个原神就卸了是我太肤浅，我立刻下回来，买本子的钱下版本抽一个满命角色"
"yooooooooooki","男","中国香港","329407309","5","","10000","0","","快更新啊，这1.3是一秒都待不下去了"
"琴帝-叶音竹","男","山西","21152104","6","沈剑心","10000","0","","许愿镜流[吃瓜]"
"喻","男","江西","371080850","6","","10000","0","","https://b23.tv/BV1yN4y1f7bq 来点播放量[鸡腿]"
"zk泰儿","保密","湖北","511089641","5","","10000","0","4","好好好[大笑]"
"吾辈飘渺也1","保密","北京","7935705","6","刺客伍六七","10000","0","","各位我想问问 下个版本寰宇虫灾还有吗"
"管人今天痴什么","女","湖北","178409730","5","","10000","0","","抽了托帕我还有机会抽银枝吗，只充小月卡得话"
"夕阳下的橘喵","男","福建","23920568","6","EveOneCat2","10000","0","","看了桂乃芬的介绍之后突发奇想，谛听可不可以像银魂里面的伊丽莎白那样玩梗？比如露一节满是腿毛的小腿+里面是大伟哥之类的？[妙啊]"
"心态崩了bb","男","河北","510379406","5","","10000","0","","感觉又要出一个新的绝佳搭配了，镜流和刃，镜流给队友能放血，而且只放一点点，刃是不管敌人还是队友，只要掉血就加一层被动，绝配，大保底已经握好了，等镜流开池的那天，我就要薄纱大虫子[doge]"
"哎呦呦哈哈哈哈","男","河南","87644933","6","","10000","0","","三月七太可爱了！"
"内讧必输","男","四川","122255766","5","","10000","0","","这期前瞻质量好好啊"
"雅号丶葛饰北斋","女","广东","36059164","6","","10000","0","","镜流什么时候和彦卿打过啊，这个剧情在哪里啊"
"间水月_owo","男","福建","399634468","6","春原庄的管理人小姐","10000","0","","吾愿称之为最强前瞻直播"
"博格ovo","保密","山东","1010226714","4","","10000","0","7","不愧是我的三月妻[给心心]"
"腾讯眼光","保密","贵州","388059250","5","","10000","0","","加强希儿。。。。。大招特效！！"
"笙箜崆","保密","湖南","520243575","5","黑白无双","10000","0","","300星穹没了[捂脸]"
"不明真相的意大利炮","男","四川","6048504","6","","10000","0","","第一次版本pv比前瞻播放低"
"哆小啦C小梦","女","四川","336786271","6","公主连结佩可莉姆","10000","0","","三月七可爱捏[doge]"
"整活干部W","保密","辽宁","357480741","6","进击的冰糖","10000","0","","才看到封面的动作是虫虫[崩坏3_开心]"
"这个up主就是逊啦","保密","辽宁","1832080449","4","","10000","0","","为什么走路会鬼畜啊，打架也会[笑哭]"
"景元的dog","保密","江西","3493129789377404","4","","10000","0","","所以……给我加强景元啊焯！[生气][生气]"
"安乐先别死","保密","湖南","484682466","3","","10000","0","","在线问萌新能抽镜流吗（"
"地狱中疯狂变态的林恩","男","山西","3493117617507057","4","","10000","0","","几号才更新呀？"
"欲闻君名","保密","江西","2008490961","5","","10000","0","","三月七老婆[嘟嘟][嘟嘟][嘟嘟]"
"你d马尾飘扬","男","上海","442109545","5","","10000","0","","新手想问下，新手池20抽出金，后面继续抽还有几率出金吗"
"生椰拿铁微糖少冰","男","四川","85349071","6","","10000","0","","镜流教的剑，为什么景元用的是大刀[doge]"
"旧城以西丶Z","保密","云南","400959961","5","","10000","0","","充3个648，符玄给我歪个鸭鸭，不再充一分钱了，特码的"
"峨眉半山","保密","山东","1311586534","3","","10000","0","","74抽已垫好，这就是我对自身运气的绝对把控，托帕必不歪[OK]"
"来份夜宵去睡觉","保密","广东","1152028826","2","","10000","0","","镜流不歪，青雀满命，停云一只越多越好，出必还愿！"
"初星爱花花","女","北京","1083088297","4","","10000","0","","为啥北京就没啥活动啊[大哭]"
"{色","男","海南","12564433","6","异常生物","10000","0","","好家伙害有1000人在看，[崩坏3・光辉矢愿_吃西瓜冰]"
"晓亮哩","保密","河南","538611761","5","名侦探柯南","10000","0","","镜流不歪 玩到关服"
"Eeいい","保密","广东","923807","5","","10000","0","","燃料收到 这就充爆"
"飞行矮堇瓜l","保密","河北","1836459910","4","","10000","0","","6"
"飞行矮堇瓜l","保密","河北","1836459910","4","","10000","0","","道铁穹星，坏崩"
"一千只酥饺","保密","湖北","17884666","4","","10000","0","","小三月太可爱了"
"欧气提升","保密","福建","1758716620","4","","10000","0","","00:04"
"摩乍","男","安徽","1392385828","4","","10000","0","","问题反馈怎么添加视频"
"混剪的记","保密","浙江","2014684763","3","","10000","0","","看的就是符玄分不分担队友打的伤害？"
"Taizi灬小雨","保密","辽宁","6916242","6","","10000","0","","抽镜流会不会送那个无尽的酒杯[doge]"
"shhxkmwqa37","男","重庆","356345130","5","","10000","0","","3月7垫了吧，游戏里建模哪样这么大"
"6个硬币就改个这名","保密","贵州","509732942","4","","10000","0","","我想问什么时候更新版本，任务全做完了，没星琼了"
"月是心上白白","保密","江苏","633175204","5","","10000","0","","等不了了[星星眼]"
"IISoomq","保密","福建","2100689458","5","","10000","0","","1.4预下载什么时候啊啊"
"你的昵称才三个字符","保密","安徽","320538421","6","","10000","0","","双倍奖励好，缓解养成压力。星铁那个养成周期实在是太长了，两个池子都过去了，一队还没有养好。如果有双倍奖励，预计能更快把二队拉起来。"
"荆棘谷i山","女","山东","9336849","6","白蛇2：青蛇劫起","10000","0","","你怎么知道我9发出符玄？"
"yes抽卡不歪真君","保密","江苏","455006450","2","","10000","0","","镜流不歪玩到关服"
"LY落岩","保密","山东","3493093366040670","3","","10000","0","","静流和刃绝配啊，帮助刃叠被动"
"月色流霜衣盛雪","女","美国","15790054","6","","10000","0","","星穹这是越做越好了啊"
"是赌狗不是甲亢呀","男","山东","512605810","5","","10000","0","","我靠"
"花海潮华海","保密","吉林","3461576700988220","3","","10000","0","","穹宝！！我的不够我养饮月君了[委屈][委屈][保卫萝卜_哭哭][保卫萝卜_哭哭][保卫萝卜_哭哭][保卫萝卜_哭哭]"
"994423","保密","云南","1818665389","4","","10000","0","","@防锋杜渐 看了吗，哈哈哈，笑死"
"\G山溪","保密","广西","6845404","6","","10000","0","5","自选四星没有诚意啊，居然没有停云青雀[嫌弃]"
"爱六加衣","保密","浙江","32643288","5","","10000","0","","叽米不歪，玩到关服。"
"Redemptio-----","女","广东","401615860","5","","10000","0","","问：本期视频一共出现了多少梗[doge]"
"剑雪笺文","男","海南","40608465","6","明日方舟音律系列","10000","0","","加强姬子，不然再出一个强的也行。"
"账号已注销","保密","山东","1167639538","0","","5000","0","","频道tag失效了？？？"
"烈日圆月","保密","四川","487075944","4","","10000","0","","我一走路人就与灵魂分离了"
"烈日圆月","保密","四川","487075944","4","","10000","0","","出bog了"
"伊空业羽","保密","广西","402766065","5","","10000","0","","对了，角色升级技能要的东西是不是太多了？我感觉后面一天就升一级，而且遗器也难刷"
"simonssphy","保密","安徽","15795038","5","","10000","0","","这声音感觉像鹿鸣？？？"
"世界繁华落幕","保密","贵州","229871483","5","金鱼记忆","10000","0","","扑满：w,我们中/出了一个叛徒"
"望仔牛女乃吖","保密","北京","577962367","5","","10000","0","","有没有大佬能科普下桂乃芬名字的梗是什么，没看懂@( b- b)つロ"
"可乐雪片","男","湖北","1175360377","4","","10000","0","","我刚刚看到有人要抽云上五骁，我想到了快乐的事（白露）[doge][doge]"
"20210505光军辉","保密","广东","1324872752","3","","10000","0","","[2023]"
"bX","保密","湖南","693934148","4","","10000","0","","回复 @筱筱松松 :看到了"
"优雅マスタ`","男","山东","667612041","4","中野三玖","10000","0","","兑换码是什么"
"间歇性游戏障碍患者","保密","广西","27570802","5","","10000","0","","托帕：把你手机给我,账账：这是你在星际和平公司旗下的信用额度，每天还的量还不到每日任务多"
"清远abyss","男","吉林","491979770","5","","10000","0","","总觉得视频里的三月动作好像鹿鸣的"
"我与69个萌妹的远征","男","山西","567214339","5","","10000","0","","铁血战士的bug没啦 我怎么完成这成就呢？"
"九幽第一仙","保密","广西","477931307","5","","10000","0","","十个燃料，刷装备，总结：血本无归。MHY日了狗"
"浮不起的刘司马","男","山东","2031529","6","","10000","0","","我踏马直接杰帕德卡夫卡可可利亚加彦卿"
"乃琳上单","保密","内蒙古","227875742","5","","10000","0","","等会儿，彦卿不能又要挨揍了吧？"
"蠹腐君","保密","上海","354485367","6","","10000","0","","叽米什么时候入池"
"邵化火","保密","安徽","634273408","5","","10000","0","","CA6PSVDV8N回归邀请码，大佬们求求了。"
"祈愿伶0","男","山东","1600679650","4","","10000","0","","兑换码是什么呀"
"Aliceyuri百合","女","浙江","8742071","6","","10000","0","","姬子要起飞了，淦，但我没有[生气]"
"T-T-F-F","保密","山西","1695760670","4","","10000","0","","6"
"我想要换一个新昵称","保密","安徽","192425750","6","","10000","0","","许愿托帕"
"特级肘术师牢大","保密","浙江","1995518405","4","","10000","0","","卡妈和托帕见面会不会打起来"
"昌都林芝拉萨","保密","广东","290331611","5","","10000","0","","模拟宇宙新活动会常驻吗，新手表示打不过啊[笑哭]"
"姬及几济","男","江苏","59722069","6","","10000","0","","镜流的BGM感觉想仙侠旋律里加了一点|浦由记的感觉"
"翘筱","保密","广东","523351760","3","","10000","0","","cc"
"落落莓小团雀","男","浙江","1206934124","4","","10000","0","","三月七，出击！"
"十三可乐可乐","保密","广东","345574422","5","","10000","0","","为啥我角色武器都基本是80才出，，，玩得是真的好累，，，"
"全自动愚者","保密","广东","475602838","5","","10000","0","7","三月七真的好可爱啊!!!"
"无心の阿陌","男","加拿大","17622252","6","良辰美景・不问天","10000","0","","吉米头是秃的啊[doge]"
"单推迦娜","保密","辽宁","1336578111","3","","10000","0","","三月你对我真好.还特地给我发邮件提醒我来看"
"西瓜噗哩","男","吉林","169520343","6","","10000","0","","我忘兑换了！！！[无语]"
"Telcontar","男","浙江","2383315","6","","10000","0","7","真tm可爱，超级tm可爱"
"你这头小猪猪","男","广东","1162506913","5","崩坏：星穹铁道","10000","0","","怎么感觉1.4剧情会是，镜流像饮月临终交代，交代完去自首。景元知道镜流自首后，联系我们让列车组带她离开仙舟，[doge]然后就是主角团去监狱强捞镜流，刚好1.5二个新角色都是罗浮十王司的。,[妙啊]跟着列车组，魔阴身不代表不能救治"
"テタチ","保密","山东","1603796090","3","","10000","0","","战斗不显示数据BUG你倒是修复啊"
"言熠FLATF","女","湖南","1395666990","3","","10000","0","","镜流不歪玩到关服"
"静","保密","广东","10928456","5","碧蓝航线","10000","0","","什么？有兑换码？"
"沧海桑田也比不过","保密","海南","3494363493567071","3","","10000","0","","[doge][doge][doge]"
"艾伦阿格尼Z","保密","江苏","3546381511821684","3","","10000","0","","你们都喜欢一边渡劫一边过年吗？"
"桃井咚太郎","男","上海","26433113","6","拜年祭粉丝专鼠","10000","0","","好好好"
"性感电子","保密","广东","1537306","6","","10000","0","","[打call][打call][打call]"
"地下室外卖员","男","山东","1365522903","5","","10000","0","","问一下0命饮月军和一命克拉拉哪个练起来更好？[笑哭]"
"激情魈售员","保密","河北","424412636","4","原神","10000","0","","有没有星铁代肝的"
"bili_52514435187","保密","安徽","442044989","5","","10000","0","","这提醒晚了。。"
"两袖清风富贵家","男","黑龙江","374801472","5","","10000","0","","1"
