"昵称","性别","IP","UID","等级","装扮","用户权重","获赞数","粉丝团等级","评论"
"喜欢下雨呢","保密","河北","332221149","6","","10000","2","","这期前瞻真的很出彩啊，全程看下来就很快乐，很多名场面还会反复看哈哈哈表扬！叽米这主持人非常棒啊，配音是哪个老师有点耳熟想不起来[大笑]"
"属于你的夜生活","保密","广东","1690273239","4","","10000","2","","加强姬子加强姬子加强姬子，次次抽卡歪姬子[大哭][大哭]"
"IG丶SKT丶幻舞玲珑","保密","湖北","1911114833","5","","10000","2","","我要点名一款二字游戏"
"来做我の招财猫","男","福建","12460366","6","格兰芬多","10000","2","","wc，兑换码忘记换了"
"在梦境中挣扎","男","河北","1133063955","5","","10000","2","","这次前瞻的质量是真的高[热词系列_吹爆]"
"笨蛋-曜痴","男","河北","485975025","5","电子喵","10000","2","","[笑哭]刷到这个之前刚想到兑换码没换"
"道具雨w","保密","江苏","3357760","5","","10000","2","","怎么获得体力啊[大哭][大哭][大哭]"
"魈魈鸟","保密","四川","437099605","5","","10000","2","","希尔复刻了，是不是景元也快要复刻了，可以补命座了[星星眼][星星眼]"
"洛琪希零贰六花希露菲","保密","广东","321356919","6","","10000","2","","请问0命鸭鸭搭配镜流值不值得花600星芒兑换鸭鸭专武"
"末江","保密","湖南","344899452","5","","10000","2","","咋晚看的视频，玩了一上午，码给忘换了，痛苦[大哭][大哭]"
"永n","保密","中国香港","375035979","5","","10000","2","","希望之後[蜓e可以有一位置存下通P了的∏[大哭]有r候真的想再看一遍"
"貌似没啥好起的名字","保密","广东","391239022","5","泠鸢yousa","10000","2","","兄弟们我刚刚用三月七送的十管燃料，吧三月七等级行记拉满了[tv_色]，家人们我做的对吗( b- b)つロ"
"香草拌抹茶","男","辽宁","104146159","5","","10000","2","","痛失兑换码，希望可以延长一下时间"
"漫夜幻风","男","江西","33577723","6","","10000","2","","当你看到我的时候，说明兑换码已经过期了，没关系我也是[tv_大佬]"
"mark_dark","保密","浙江","639946216","4","","10000","2","","不幸地通知各位，兑换码过期了……"
"应急食品太空特供版","保密","河北","362149388","5","","10000","2","","看到我的时候离兑换码过期只有1分钟了[doge]"
"掌心枕梦","男","四川","515451210","5","","10000","2","6","直播效果最好的一集[点赞],这下之后的前瞻节目也不得不看了"
"Z艾天下第一","男","马来西亚","432611678","5","激情三连","10000","2","","上半究竟是什么神仙池子，四星都好香[打call]"
"-C-r-e-e-p-e-r-","男","辽宁","515057572","5","#EveOneCat","10000","2","","刚开始第一个短片的解说员气势不够啊，斗魂竞技场那个要是来就无敌了"
"无极逆转TvT","保密","广西","1387379820","2","","10000","2","","感谢三月的燃料！"
"白马踏轻尘","保密","山东","390277486","5","","10000","2","","这次两个星琼活动，要是跟以前一样就是1000+500或者1200+500，还是说这是两个大活动或者又会加签到活动？"
"杂志的黑粉头子","保密","吉林","37960070","6","","10000","2","","托帕姐姐还多久，我想当那只猪"
"列车胡闹","保密","山东","3493289978235186","3","","10000","2","","感谢三月姐送来的十管燃料[星星眼]"
"老那个菜狗","保密","云南","538360193","5","","10000","2","","感谢三月老婆送来的十罐体力瓶，谢谢小三月，小三月最好啦！[保卫萝卜_哇][保卫萝卜_哇][保卫萝卜_哇][保卫萝卜_哇]"
"今天是个好天气O_o","男","广东","74349297","5","","10000","2","","在小三月的一声一声“咱”迷失自我、她把我当自己人诶！她心里有我！[大哭][打call][脱单doge]"
"@麒wow","保密","浙江","223629777","6","-阿库娅","10000","2","","符玄抽完15抽又歪了个姬子，这下有大保底镜流稳了[脱单doge]"
"曜の黎明","男","浙江","23055136","6","","10000","2","","我不管了 三月七家妻真好 真好 觉醒了别忘记我就好 忘记我 我就得开挖掘机去了 为什么呢 去挖编剧的ZF[阴险]"
"难鸣诚","男","河南","4814338","6","异常生物","10000","2","","饮月  斩月   下一个是什么？"
"皓皓哈哈呵呵嘿嘿","男","北京","518805217","5","","10000","2","","我有一个小小的问题：,1.4新剧情能超过俩小时吗[大哭]"
"就有特别多的人","保密","浙江","407486244","5","","10000","2","","听三月七讲话好舒服[请吃红小豆吧！_倒地]"
"想太多了007","男","韩国","12366807","6","","10000","2","","本次特别节目中的一切人物、故事、设定仅为节目包装，均与《崩坏：星穹铁道》原作无关，展示画面与奖励等均为研发中内容，非最终上线版本，请以上线版本为准。"
"薛定谔的价值","男","河北","356272","6","","10000","2","","这期节目文案写了多长时间[吃瓜], 都可以当相声来看了, 米哈游捡到宝了"
"篱笆下的玖","保密","江苏","348480197","5","","10000","2","","小三月好好好好好好好好可爱[喜欢]"
"忘生星空","保密","四川","481612963","5","约战：精灵再临","10000","2","8","小3月送了10个体力，我来看看。"
"冥柒夜","保密","广西","499882298","5","hanser","10000","2","","以后二字游戏别联系了，我怕你妹妹崩铁误会[doge]"
"千秋_HTA","男","河北","1418592962","3","激情三连","10000","2","","没看直播，请问一下兑换码是什么[保佑][保佑]"
"韦德安泰","男","河北","4159541","6","","10000","2","","希望下次前瞻直播能有不止一个人的3D直播场景，比如让开拓者摸摸三月七的头，或者让3D的卡夫卡跳个舞"
"要看日落更要看日出","保密","广东","286483051","5","","10000","2","","哇，收完小三月的邮件之后，去抽卡池，抽出最后一只小三月了，满命三月七[给心心][喜欢]"
"IVY15463","女","美国","181445274","6","星座系列：金牛座","10000","2","","希儿和托帕的武器池是分开的，太好惹，别像原那样搞双up就行"
"丶STFU丶","保密","广东","281933742","6","崩坏：星穹铁道","10000","2","","有一个细节，三月的字幕描边是粉色，姬子是红色[tv_doge]"
"_不用了_","保密","上海","623337085","4","","10000","2","","呜呜呜官方那个外国的联动三月七和丹恒立牌吧唧国内会上架嘛，如果能上架我就不找代购了[大哭]"
"亚索yasuo丶","保密","浙江","24665153","6","","10000","2","","谁懂啊，很多高质量的视频有时候我都会不给3连，但是一个前瞻我服服帖帖的狂连！[大哭]"
"罚你玩轮胎","保密","河南","39382211","6","","10000","2","","崩铁真是越来越好了，当初选择投资这游戏太对了，每一次优化都在证明我的选择是正确的"
"北方没有白桦林","女","湖北","32095650","5","","10000","2","","小三月送给大家的兑换码哦[兔年],MBM7WFF5PECC,FSMPWFE56EUG,NT4NEEFM6EV4"
"晾一晾就干了","女","山东","164789463","6","","10000","2","","两点半了还有一点二万人没睡[tv_目瞪口呆]"
"饭饭饭饭11","男","重庆","401754264","5","","10000","2","","谢谢三月七[给心心][给心心][给心心]"
"三月七我好喜欢你","女","湖北","1659799500","5","崩坏：星穹铁道","10000","2","","大家都是夜猫子吗怎么都不睡"
"不长胖的北极熊","男","四川","28657021","5","崩坏：星穹铁道","10000","2","","每个版本送十连，遥遥领先！"
"丿温茶","保密","江苏","291486098","5","","10000","2","","亚雷，好久没有看过这么让人激动的前瞻了。感谢小三月的十管燃料[打call]"
"DongL789","保密","河北","380753054","5","","10000","2","10","三月七这直播技术属实遥遥领先了，下次前瞻也来吧，喜欢看"
"怀念200000","保密","湖北","1808827520","3","","10000","2","","这个桂乃芬，总会想起“侯桂芬，你藏的真深啊[tv_偷笑]”"
"古河汐月","保密","山东","43872041","6","泠鸢yousa登门喜鹊","10000","2","3","视频包含以下内容：,《记忆不佳小主持》,《星际崩可梦》,《新任领导的职场压力》,《自首与救赎》,《大型连续剧等镜流完结篇》,《热度优先卖艺人》,《文化沙漠の起名》,《仙州习俗：谐音梗扣钱》,《含有消防安全危险内容》,《疑似子母河冰泉》,《降维打击》,《遛猪小妹在线收债》,《汤达人再填一口汤》,《自动寻路寻宝机》,《多功能刮刮乐》,《扁平化管理》,《总监 您 万万不可与快速贯口》,《蝶又立锋锷》,《收视顶梁柱》,《打工人的怨气》,《金色叽咪》,《什么都抓只会害了你》,《走了吧 走了呀～ 都走了吧? 都走了呀》,《特殊癖好》,《双倍奖励》,《成都联动》,《三月七百度语音包》,《炫迈联动》,《加班是不可能加班的》,《忘记下播小事故》"
"Maki_Jr","保密","美国","32088567","6","崩坏：星穹铁道","10000","2","","遥遥领先于原神！"
"吹萨克斯の狂三","保密","云南","453506034","5","公主连结凯露","10000","2","","托帕：像你这样的小扑满，生来就是要被妈妈吃掉的，反抗？反抗是没有用的，你以为你能逃出妈妈的手掌心嘛？[崩坏：星穹铁道_暴富]"
"毛球卷","男","广西","21309604","6","","10000","2","","妈耶，为什么这边每一个都想抽啊！！！隔壁看看，这样设计的角色又有趣，又活泼，看着就讨喜想抽与被抽[星星眼]"
"Oo湾仔a^oO","男","河北","7483861","6","","10000","2","","叽米，你和隔壁帕米是什么关系[doge]"
"建木叶Askr","男","浙江","11313787","6","","10000","2","","模拟宇宙无尽模式强推符玄专武？拜托，续航问题拿几个丰饶祝福不就搞定了吗"
"曦阳丿","保密","辽宁","382503950","6","hanser","10000","2","","因为小三月的十管燃料来的，大晚上越看越精神，我现在就要玩！！！"
"御坂10384号","保密","福建","234550297","5","","10000","2","","本来想要镜流  看到下半卡池的角色  镜流是谁 我不要了"
"普通混子人RW","保密","云南","76668978","6","","10000","2","","云上五骁,战技点毁灭者,我要把你们塞在一个队伍里！"
"秋山呜mio酱","男","重庆","367665535","5","","10000","2","","这前瞻就挺有意思的，隔壁周年前瞻没啥感觉[tv_笑哭]"
"臊眉耷目","男","陕西","1301936133","5","","10000","2","","连歪三个版本了，再说说不过去了"
"养乐多W_","保密","重庆","44138676","6","","10000","2","","这我天，这个时间点还有3w人看，就算放假了，你们也不能那么熬啊[doge]"
"是泷某呀","女","广东","2072557786","5","","10000","2","","我的生日诶[给心心][给心心][给心心]"
"丶","女","新疆","29606134","6","","10000","2","","终于学日配按角色来做节目了吗，从原说到现在终于改了，以前那个是真的尬的一批现在好多了"
"不懂别假装","男","广东","29990514","5","","10000","2","","景元：难怪我当将军，果然我才是最正常的那个"
"桃子有毒啊","保密","海南","138539702","5","","10000","2","","复刻池的保底继承吗"
"Asekelake","保密","浙江","483416984","5","洛天依・最美的夜","10000","2","","可爱三月七拯救你的不开心(｀ω)"
"看谛听嘉嚎友","保密","湖北","13879867","6","崩坏：星穹铁道","10000","2","","姬子:桂乃芬我看你打扮颇具仙舟特色，长相却又不太像仙舟人，你究竟是什么人[脱单doge]"
"kkzzia","保密","海南","16060720","6","","10000","2","","三月七！我的超人。点开链接就是前瞻，谢谢七酱的十管体力！！！！"
"bili_11091086535","保密","天津","3461566567549445","4","","10000","2","","角色省流:,身一直剑,债一直催,活一直整,头一直射[doge]"
"Koeru_","男","河南","284450752","6","hanser","10000","2","","这次的前瞻也太好看了[大笑][大笑]"
"Tindred丶テンズ","保密","广西","33702530","5","","10000","2","","小三月宝贝，不送我10管燃料也会爱你的哟[嘟嘟]"
"猫箱反转是好漫画","男","湖南","646848064","5","","10000","2","","三月七好可爱"
"最古のdebu","保密","江西","6928935","6","","10000","2","","谢谢三月妻[初音未来_喜欢]"
"再睡一夏0706","男","天津","9182035","6","","10000","2","","列车长：冷，下回直播给件衣服[冷]"
"强势好","保密","广东","260821892","5","","10000","2","","MBM7WFF5PECC,FSMPWFE56EUG,NT4NEEFM6EV4"
"愤怒486","男","浙江","502280394","4","","10000","2","","这下不得不点名一款二字游戏了[doge][doge]"
"坐等可莉复刻真君","男","江苏","1386373926","3","","10000","2","","MBM7WFF5PECC,FSMPWFE56EUG,NT4NEEFM6EV4"
"我在枝江当Tom","男","江苏","24545923","5","向晚大魔王","10000","2","","MBM7WFF5PECC,FSMPWFE56EUG,NT4NEEFM6EV4"
"德玛西亚杯具了","保密","山西","1073890804","5","","10000","2","","谢谢三月七"
"啵萝星冰乐","男","浙江","291238312","5","乃琳Queen","10000","2","","我啪的一下就进来了，谢谢你三月妻[大哭]"
"Starufal","男","广西","10832396","5","刺客伍六七","10000","2","","还不快谢谢三月七[打call][打call][打call][打call]"
"大fu人家哦","保密","河南","3493272915806456","3","","10000","2","","小三月给咱送燃料了"
"我还是喜欢","男","江苏","442142240","5","","10000","2","","十管燃料让我们相遇！！！[哦呼][哦呼]"
"\いり人","保密","四川","510693967","5","","10000","2","","收到燃料来补看节目[脱单doge]"
"流岚虹彩","保密","黑龙江","3493264598501494","4","","10000","2","","大家快上号，十管燃料！！！！！！！！！！"
"人间怪物d","男","辽宁","67912660","4","","10000","2","","谢谢三月七送的10管体力[坎公骑冠剑_吃鸡]"
"善良的挽挽","保密","陕西","480002968","3","","10000","2","","谢谢三月七姐给的十个燃料。"
"拾杏明昭","保密","四川","292090603","5","","10000","2","","三月,爱你!还有你的燃料!"
"知羽落尘","男","江苏","1035041500","4","","10000","2","","什么？十个？表扬！"
"燕小浩","保密","山东","70735288","5","","10000","2","","10管燃料，三月妻！！！"
"阿尔托莉雅_阿瓦隆","保密","浙江","396272816","5","雪未来","10000","2","","人有五名，毁灭有三个，景元，你不是其中之一[doge]"
"苍茫的星空","男","河南","348029091","5","","10000","2","","我听过牛市和熊市，第一次看到托帕的天赋叫猪市[笑哭]"
"西湖雅座一位有请","保密","山东","1750493","6","","10000","2","","谢谢你三月七[大哭]"
"随风而来的信","男","浙江","57217046","5","三周年恋曲","10000","2","","10瓶燃料干得漂亮 3月7"
"可还行吧嗯","保密","江苏","438064469","5","","10000","2","","你真的我哭死，送10管体力[点赞][脱单doge]"
"小哩堂太G一郎","保密","浙江","11665924","6","","10000","2","","快说谢谢三月七"
"姬Z","男","陕西","628669454","5","星座系列：双鱼座","10000","2","","MBM7WFF5PECC"
"一条无聊的懒苟","保密","江苏","403740844","5","","10000","2","","看完前瞻更加喜欢托帕了，托帕是我第一个看立绘就非常喜欢的角色，结果看了技能也非常有趣，不管强度怎么样0+1必须拿下"
"初次与未来的声音相遇","保密","湖北","147795425","6","","10000","2","","三月七的表情好细腻啊，老米又在炫技"
"勇者喜之狼","男","山东","3494373434067763","3","","10000","2","10","这活动这奖励比某游强多了"
"白和_Crane","男","河北","341846406","5","","10000","2","","MBM7WFF5PECC,FSMPWFE56EUG,NT4NEEFM6EV4"
"波卡米洛","女","四川","3461574819842408","3","","10000","2","","中秋快乐[呲牙]阖家团圆[调皮]幸福美满[害羞]避灾避祸【愉快】事事顺心【濉恐足常乐【憨笑】如意安康[加油]学习进步【笑脸】事业有成【666】平安喜乐【旺柴】运气好到爆"
"鸽子售卖机","女","辽宁","388957431","6","","10000","2","","MBM7WFF5PECC"
"Elysia请带我走吧","保密","河北","525178104","5","","10000","2","","@亚食人 快看看，这不得说道说道[OK]"
"坏了个坏坏","女","江苏","504625434","6","罗小黑战记","10000","2","","复刻角色池子和up池子抽的数共享麽"
"雨落无声0","男","浙江","438278961","4","","10000","2","","MBM7WFF5PECC,FSMPWFE56EUG,NT4NEEFM6EV4"
"散叶流枫","女","浙江","66757760","6","","10000","2","","真的好喜欢星铁的前瞻，真的是三月七本人和我介绍！！！[打call][打call][打call]"
"SOLA的雨","男","重庆","407457125","5","崩坏：星穹铁道","10000","2","","MBM7WFF5PECC,FSMPWFE56EUG,NT4NEEFM6EV4"
"阿狸家小确幸","保密","吉林","629262674","5","","10000","2","","金色账账的臀，银河公司的魂[打call][打call]"
"凉歌鸿夜","男","浙江","1339850","6","崩坏：星穹铁道","10000","2","10","下播忘记关闭直播 主播的职业生涯就..........."
"_971","保密","安徽","384769562","6","","10000","2","6","各位注意1.4版本11.15日结束，只有5周"
"六_木_","男","广东","602003","6","绯赤艾莉欧","10000","2","","[打call]鹿鸣的技术运用太棒了 三月七可爱"
"MSR_霖川","保密","江苏","506400714","4","","10000","2","","下辈子我一定要投胎做一枚扣子，别在托帕和克洛琳德的胸口，体会那种想放手但又舍不得那种被拉扯的快感[热]"
"晴空下着雨","保密","广东","693955592","5","可爱泰蕾莎・头像框","10000","2","","帕帕帕[可爱泰蕾莎_雌小鬼]"
"赤血染红枪","男","江苏","434279233","6","","10000","2","","所以卡芙卡是吃了炫迈才可以无穷动无穷吗[脱单doge]"
"开心猫猫猫猫猫","保密","重庆","406775377","3","","10000","2","","MBM7WFF5PECC,FSMPWFE56EUG,NT4NEEFM6EV4"
"汐昀离","男","四川","366711564","5","一周年纪念装扮","10000","2","","我来力[doge]"
"三木森Hanson","男","浙江","25305899","6","","10000","2","","谢谢你的10个燃料"
"波奇郁代了","男","山东","3494364093352267","3","崩坏：星穹铁道","10000","7","","谢谢三月七[星星眼]"
"樱花飞舞的季节","保密","海南","10540617","6","","10000","2","","寰宇蝗灾不不会关闭吧？？我还有好多成就没拿到呢"
"无苦集灭道l","保密","陕西","543929332","5","","10000","2","","中配给镜流加大分，得好好看看技能前瞻了"
"Hyacinth_yt","保密","广东","26682475","6","","10000","2","","三月七真的好可爱,提一嘴 我从看见三月七的第一眼就觉得这姑娘不是特别好看（对于二次元角色的设计来说 个个都是特点明显的美女）,但是三月七真的给我一种邻家少女的感觉 不是美若天仙的好看 单纯靠可爱和灵动的性格让人对她印象深刻 和这样的人在一起 感觉什么时候心情都会很好"
"零优you君or酱","男","江苏","360407369","6","明日方舟-愚夜密函","10000","2","","镜流鞋很好看，很容易出汗感觉会脚臭"
"欧尼酱Official","保密","山东","530591","6","","10000","215","","三月七身上为什么一股子鹿味儿，各位开拓者有头绪吗[傲娇]"
"丿不爱吃鱼","保密","湖北","519537091","3","","10000","325","","卧槽，为啥同一个公司，这游戏这么大方"
"那食不食怖纳噬草","男","江苏","405308202","5","","10000","13","","好家伙，看来以后直接送自选常驻5星和光锥指日可待了[doge]"
"牛郎之道","保密","江苏","1416014891","5","","10000","330","","模拟宇宙又有新东西了，真好。不过无尽模式的话，应该是那种能吃到祝福越多的角色越厉害吧？你们觉得是谁？我先来：点刀哥，巡猎，丰饶，繁育，欢愉，毁灭都能吃到加成[滑稽]"
"心游物外","男","广东","205973158","6","","10000","215","","动作自然的角色，瞬间似乎有了血肉灵魂，不再像游戏里面站桩的NPC，也不再只有生硬套路的对话。如果三月七这种技术能运用到所有角色上，那么二游就是米一家天下了。这种自然流畅的角色，似乎瞬间活了过来，这种技术绝对会对其他二游厂商形成碾压趋势。"
"识之粽咝∈","保密","山东","537766401","4","","10000","380","","三月七在这次前瞻里说了一句我感觉很奇特的话，不会是之后的刀子吧，当你有机会做出选择的时候，不会让自己后悔"
"龙斩者の黑岩长剑","保密","山西","3537118957669138","2","","10000","3","","14个小时了，还有1.7万人在看，牛逼牛逼"
"xiaolada","保密","上海","37345647","5","","10000","74","","整个前瞻的环节设置，对话剧本都摇摇领先。"
"ikun的只因你太美","保密","山西","1232719528","4","","10000","4","","隔壁二字滚出来！学学你妹[生气][生气]"
"富户桃子","保密","四川","40348333","6","","10000","302","","感觉这次直播，是不是给三月用上了鹿鸣的技术啊，真的太丝滑了[脱单doge]"
"zz2zk","保密","澳大利亚","1946681372","5","","10000","260","","卧槽，三月七给我发邮件了！！送了我600体力！！"
"爆炒神里绫华_","保密","湖北","647716789","5","原神","10000","1138","","为什么当年让饮月君来守望不死建木？因为只有他能成功克制。毕竟仙舟人常说“饮月”克“建”（隐约可见）[doge], 仙舟人参加活动，谁没有来？,素裳，因为她没有起床，所以裳不起[doge],仙舟人参加完活动要找谁？,景元，因为他是闭幕将军[doge],你知道罗刹的棺材里装的是什么吗？,是雎鸠啦，因为棺关雎鸠，载核之舟[墨镜],大家放心，钱已经扣了[doge]"
"捉妖二把刀","保密","广东","38149642","6","","10000","1488","","从很多地方可以看到镜流师徒三代的传承,镜流曾问过景元有没有教过彦卿如何对付魔阴身，“一剑贯穿丹腑，断其生息”，后续景元应对拿丰饶做身体的幻胧的时候，神君的攻击部位正好呼应了这种做法,镜流的大招“天河泻梦”，彦卿在和丹恒刃交战时的大招叫天河泻"
"小米兔一号","保密","湖北","628497215","5","","10000","6","","好家伙，回放比pv播放量多"
"iむな","保密","湖北","1707155395","5","","10000","9","","怎么还有这么多人，虽然知道这期很好看"
"汐沐KN","保密","广东","177716806","5","崩坏：星穹铁道","10000","3726","11","省流:,一、兑换码: ,MBM7WFF5PECC,FSMPWFE56EUG,NT4NEEFM6EV4,过期时间：23年09月30日12:00:00 ,二、卡池,上半卡池:新五星镜流 属性:冰 命途:毁灭(四星：停云，青雀，桑博) ,下半卡池:复刻希儿，新五星托帕 属性:火 命途:巡猎 新四星桂乃芬 属性:火 命途:虚无 (四星：桂乃芬，卢卡，素裳) ,三、活动: ,1.巡星之礼(签到送十连),2.以太战线(联机活动，类似宝可梦玩法，自选四星：希露瓦，佩拉，虎克，卢卡),3.模拟宇宙・无尽位面,四、新增内容与系统优化,雅利洛-Ⅵ新增2张地图(造物之柱，旧武器试验场),新增镜流同传任务――云无留迹,新增剧情回顾功能,详情请看：【【星穹铁道】1.4前瞻直播总结】 https://www.bilibili.com/video/BV1Kw411e7XB/?share_source=copy_web&vd_source=786cc1bf2a23077e94ec46ae477a5ca4"
"抽卡必180保","保密","广东","3493113177835996","4","","10000","4","","到谁周年庆啊？？？？[微笑][微笑][微笑]"
"魔法妮可香香鸡","保密","云南","25636905","6","","10000","33","","三月给了我十管，我也给她十管[给心心]"
"脱碳三叶草","保密","山东","439401817","5","初音未来13周年","10000","2507","","前瞻总结：小三月可爱捏,兑换码 MBM7WFF5PECC,       FSMPWFE56EUG,       NT4NEEFM6EV4,卡池  上半 镜流(我老婆 冰毁灭,四星 停云、青雀、桑博,下半 托帕(追加攻击拐 火巡猎 + 桂乃芬(灼烧dot队 火虚无 + 希儿复刻,四星 桂乃芬、卢卡、素裳,凝滞虚影 托帕桂乃芬新材料,开拓续闻 未来市场、镜流同行任务 云无留迹、,雅利洛Ⅵ公司员工新怪物,支持剧情回顾功能，可以暂停看剧情上下文,新活动  以太战线(什么宝可梦) 四星自选希露瓦、佩拉、卢卡、虎克,        模拟宇宙无尽位面 超级奇物超级祝福  怪海车轮战,祖传签到十连,位面分裂异器盈界 双倍仪器,线下 成都列车环游记(没我事,联动活动  百度地图三月七语音包,Keep联动跑步(帕姆语音包,炫迈联动,、"
"风流倜傥叮当猫","男","上海","17052332","6","","10000","47","","虽然不懂行，但是这个三月七技术力感觉比隔壁很多皮套公司都高啊，有懂哥说说么"
