"昵称","性别","IP","UID","等级","装扮","用户权重","获赞数","粉丝团等级","评论"
"笙鸪","女","江西","24966598","6","","10000","1","","复制粘贴顶一下，[微笑],今天是12.11号，新忘却深渊开启，实战测试在双精英怪的情况下，银枝180能量二段大招【弹射】伤害鞭尸非常严重，操作非常差。希望官方不要装死，冷处理了事，给个公告。如果这不是BGU就是大招文案虚假宣传，试用诈骗 。我们玩家作为消费者，必须维护自己的权益。[OK][OK][OK]"
"奥义丨无影","保密","吉林","3461576313014546","3","","10000","0","","如果以后这个战斗场景被做进忘却之庭..........[doge]"
"ww龙D","保密","天津","450294359","5","EveOneCat2","10000","0","","新手抽了个克拉拉，还天天保底抽不出银枝，你要失去我了，我现在已经没有玩的动力了[捂脸]"
"一只_稻草人","保密","上海","593549638","5","","10000","0","3","得似"
"勇者阿邓","男","四川","8050266","6","","10000","1","","朋友们，我现在55级 C只有燕青和克拉拉 需要抽银枝吗？"
"E一下再水龙冲击波","男","安徽","7751182","6","首批购买大会员","10000","0","","我把所有能做的任务做了 抽了60发才出[tv_呕吐]"
"米饼不息之河","保密","江苏","1217196348","4","","10000","0","","米哈游我的银枝在哪里！！！[大哭]彦卿都已经歪了三命了岂可修啊！到现在就没有不歪的喂！"
"t与自己和解","保密","湖南","2134163811","5","","10000","1","","银枝不歪续月卡，银枝歪了小月卡都不氪了[微笑]非麻了"
"走向黑暗吧","保密","贵州","3493265416391551","2","","10000","0","","你召唤的是金子呢？还是这个木子呢？还是我这个银子呢？"
"惠惠-第一可爱","保密","广西","174976634","5","2021拜年纪","10000","0","","歪了，前来还怨[墨镜]"
"子年腊月","男","河北","59547253","5","","10000","0","","银枝的bug能看看吗？能给玩家一些回复么？"
"坏先生的兔子小姐o","女","浙江","32352642","6","","10000","0","","啥 上车打起来了是什么鬼"
"破碎的骨白鸽","保密","斯洛伐克","3537119767169270","3","","10000","0","","歪了，艹[笑哭]"
"平平安安小逍遥","保密","广东","58891939","5","","10000","0","","emmm抽寒鸦判官不小心歪出一命……"
"Kegemo111","保密","河北","279771420","6","","10000","0","","枝你太美[doge][doge][doge]"
"_吾妻02","男","山东","91554706","6","干物妹！小埋","10000","0","","歪了，前来还怨[辣眼睛]"
"匿名妖怪","男","贵州","307070244","5","","10000","1","","她真的。。。[大哭]宁愿30抽给我出银狼也不给我一个寒鸦[笑哭]"
"逸雪逸雨","保密","湖南","436082697","5","","10000","0","","我的地板[大哭]"
"网卡死了无语子","女","山西","1943988853","5","","10000","0","","四十抽连人带光锥娶走啦！谢谢老米对回游人士的支持！"
"抽屉柜里黑斑猫","女","陕西","445700396","5","","10000","0","","同行任务我喜欢G，给真理医生留的大保底忍不住抽了[傲娇]"
"直布骆驼","保密","山东","508270484","4","初音未来13周年","10000","0","","刚刚入坑，什么都不懂，有没有路过的大佬说说这位角色适合抽取嘛，不知道是不是主c啊"
"龙大少小华子","保密","江苏","385128227","4","","10000","1","","复制粘贴顶一下，[微笑],今天是12.11号，新忘却深渊开启，实战测试在双精英怪的情况下，银枝180能量二段大招【弹射】伤害鞭尸非常严重，操作非常差。希望官方不要装死，冷处理了事，给个公告。如果这不是BGU就是大招文案虚假宣传，试用诈骗 。我们玩家作为消费者，必须维护自己的权益。[OK][OK][OK]"
"啥都想干的可乐腌瓜","保密","广西","10038840","6","","10000","0","","帕姆：寻人（划掉）寻仇"
"拾今不月","保密","马来西亚","1901217906","4","","10000","0","","来还愿[脱单doge]"
"千羽夏奈","保密","江西","86093067","5","","10000","0","","个人感觉银枝剧情有点无聊，特效也不如寒鸦好看"
"羁绊清雨","保密","上海","266778635","6","","10000","0","","这不来个纯美命途？"
"偷电尼亚","保密","江苏","125441504","6","","10000","2","","120抽下去连银枝一根毛都没看到[笑]"
"夜萱夜萱","保密","河南","29998880","4","","10000","0","","找到了，在我家，"
"西林风歌","保密","山东","46885","6","","10000","0","","大保底才出了银枝，已经无力再进光锥池，好在常规池出了张姬子的，也能用..."
"小明别慌","男","湖南","356352962","5","","10000","0","","最寒酸的同行"
"委屈牛牛","保密","辽宁","89710924","4","乃琳Queen","10000","0","","呃呃 [明前奶绿爱丽丝表情包_呃呃]"
"芒飒","男","福建","56160900","6","","10000","0","","140抽还没出，你专逮着我薅是吧[大哭]"
"-北方的狼王-","男","湖南","352611795","5","","10000","0","","好耶，bug要修复了"
"来不来生","保密","云南","346840063","5","","10000","0","","这是绑着停云啊"
"八云家的大少爷丶墨","保密","重庆","319305082","6","公主连结佩可莉姆","10000","0","","什么玩意，从开服到现在就没一次不是大保底[疑惑][生病]"
"无念毋念勿念","保密","吉林","480192673","3","","10000","0","","崩铁送了十五发，14发出了银枝，崩门永存！"
"布丁布丁mouD兜兜","保密","江西","351092894","5","","10000","0","","大保底80抽，马哈鱼我恨死你了"
"捣捣捣捣捣捣捣捣","女","中国香港","2758312","6","","10000","0","","[脱单doge][脱单doge][脱单doge]"
"初晴priest","保密","河北","689738306","5","明日方舟-愚夜密函","10000","0","","up池八十一抽出了银枝，常驻池八十抽出了老杨专武，没歪就是胜利！话说老杨专武可以给谁用啊，今天我可以让我的肝休息一下了[tv_困]"
"Xuan_Yin玄音","保密","浙江","1575436571","4","","10000","0","","银枝：我要为世界上所有的美好而战（doge）"
"嘴叼二踢脚","保密","辽宁","594523839","5","","10000","0","","坏消息:歪了,好消息:软妹到手了"
"某某欤某某","男","湖北","229117461","6","一周年纪念装扮","10000","0","","看到你们都歪了那我就放心了[墨镜]"
"缘晓陆","保密","辽宁","526902103","5","原神","10000","0","","萌新：银枝手里的玫瑰什么品种的[脱单doge],玩家：银枝,萌新：对,萌新：怎么不说话,玩家：就叫银枝,萌新：？[辣眼睛]"
"米伊jpg","保密","山西","2130703804","4","","10000","0","","不对啊，帕姆不是下不了列车吗[思考]"
"爱吃糖の梦奇","男","浙江","382513564","5","","10000","0","","严谨与科学是在暗戳戳说某个大量物理伤害的老爷子吗？[脱单doge]"
"猴猴别急捏","保密","河南","36212688","6","","10000","0","","捍卫银河中的美捍卫银河中的美捍卫银河中的美捍卫银河中的美捍卫银河中的美捍卫银河中的美捍卫银河中的美捍卫银河中的美捍卫银河中的美"
"星茂永恒","男","辽宁","166666108","6","至尊戒","10000","0","","又歪了"
"Zr_s","女","北京","169288440","6","拉文克劳","10000","0","","bug还不修？@崩坏星穹铁道"
"长庚入月","保密","广东","353781191","5","碧蓝之海","10000","0","","抱歉，我还是等阮妈[tv_doge]"
"残阳T墨泪","保密","福建","440720415","5","","10000","0","","大招改的别扭的一批，为啥要改大招啊，原版还好啊[疑惑]"
"傻乎乎的烤面包机-","女","山东","353871043","5","","10000","0","","次次160我服了"
"符华上仙的家犬符尘","保密","安徽","1452406329","4","","10000","0","","帕姆的耳朵，好想rua一下[喜欢][喜欢][喜欢]"
"克莱恩Reinhardt","男","江苏","23245058","6","","10000","0","","《不善言辞》：狗路过都夸两句[doge]"
"初墨九尘","男","云南","388572958","5","","10000","0","","跳过了，我是阮梅的狗[喜欢]"
"薄荷入口心微凉","男","河南","25176768","5","","10000","0","","歪了"
"番茄炒蛋-精装版","男","浙江","33509377","6","良辰美景・不问天","10000","0","","同行任务全是群体怪，记得带上你们群体攻击角色"
"白草净华-幽宫启蜇","保密","江苏","1039965439","5","","10000","0","","帕姆：老杨这人不用找了，这人拉黑[doge]"
"YFTK原雪","保密","吉林","441769862","5","","10000","0","","非常好的连歪，使我心态爆炸，从1.2开始平均76抽出金还回回歪，我是不是什么特别贱的人啊[保卫萝卜_哭哭]"
"BLBL株式会社","保密","山东","3493104512403956","3","","10000","0","","抽银狼歪老杨，抽银枝歪姬子是吧"
"oir_annan","女","甘肃","3124023","6","","10000","0","","mhy你真的罪大恶极，连着两个卡池150的大保底，光锥也歪，真的玩不了一点[保卫萝卜_哭哭]"
"巴力毗珥啮合","男","吉林","623861805","5","","10000","0","","纯美抖S骑士,,鞭尸大王,,仅此一家"
"柯哀欧尼酱","男","云南","24848274","6","BW2021","10000","0","","难道是寰宇蝗灾又回来了？"
"柠檬镇的星星","男","云南","27568053","6","梦100","10000","0","","哈哈哈哈哈哈哈哈哈哈哈，小保底歪了歪了哈哈哈哈哈哈哈哈哈，是长发是长发哈哈哈哈哈哈哈，大保底出银枝哈哈哈哈哈哈哈哈"
"刘某自挂东南枝","男","广东","35345305","6","星座系列：白羊座","10000","0","","刚在拳击场试用了银枝，什么逼伤害啊对单有16W[辣眼睛](可能是给了些buff我没注意)，我2+0龙丹打三才17W"
"桐谷和人KIRITO君","保密","广东","8532158","6","公主连结佩可莉姆","10000","1","","评论区是不是都找错人了[脱单doge]"
"云烟净雪","保密","辽宁","255655917","5","","10000","0","","他这人，有点意思"
"子路zza","男","安徽","517051425","5","","10000","0","","快170多抽才出一个银枝，你对得起我辛辛苦苦攒的这么多石头么米哈游，我还打算抽专武，现在抽你♀"
"旱海浩天","保密","河南","1126662284","5","横扫全场","10000","0","6","真他妈逼服了，攒了170多抽。从零开始，就他妈出了个杰帕德。恶心。还不如直接取消大小保底机制了。直接100抽保底得了。妈的，高高兴兴的去抽了。结果想杀米哈游的心都有了。"
"阿w仔","男","广东","5081084","6","","10000","0","","这个节目也能把四国语言都放上b站吗请问"
"在下是左然老婆","保密","云南","99211024","5","","10000","0","","谢谢你，歪得彻彻底底[微笑]"
"百步不回头","保密","四川","67957687","5","","10000","0","","什么时候修复80抽不出金的bug啊？我原神崩铁都这样是不是不太对劲啊[微笑][微笑][微笑]"
"陈子昂再不入狱","男","黑龙江","420252393","5","","10000","0","","狗！！！！！！我100抽，你给我来个瓦尔特我受不了了[大哭][大哭][大哭][大哭][大哭][大哭]"
"小兵冰qwq","保密","广东","355360886","5","良辰美景・不问天","10000","0","","我最讨厌两种人，一个是说话说一半的人。"
"建系有瘾","保密","湖北","1544884450","3","","10000","0","","歪了姬子，我跟你爆了"
"霜雪雾凇冰花ii","保密","山东","379260569","4","","10000","0","","歪了[微笑]米哈游你盖斯啊[大哭][大哭][大哭]"
"要努力的努力汪","男","广东","6732857","6","星座系列：双鱼座","10000","0","2","《好人》[doge]"
"十一芯","男","上海","365658017","4","","10000","0","","wflbb别歪白露了，真的要成为白露人柱力了[翻白眼]"
"老艾啊老艾啊啊啊","保密","四川","628045634","5","","10000","0","","帕姆最无语的一集[原神_哼]"
"此梧","保密","江西","3493144536549883","2","","10000","0","","三命姬子，服了，歪点别的我谢谢你[微笑][微笑][微笑]"
"我们一起去月球吧","保密","广西","327598341","5","","10000","0","","今天是12.11号，新忘却深渊开启，实战测试在双精英怪的情况下，银枝180能量二段大招【弹射】伤害鞭尸非常严重，操作非常差。希望官方不要装死，冷处理了事，给个公告。如果这不是BGU就是大招文案虚假宣传，试用诈骗 。我们玩家作为消费者，必须维护自己的权益。[OK][OK][OK]"
"药糕_","男","山东","407917014","5","","10000","0","","氪金必歪，白嫖一次不歪是吧藿藿三连歪，银枝已经2练歪了连续五练歪，每次78抽左右"
"好爱吃大白米饭","女","上海","3494377840183610","5","","10000","0","","评论区看的我笑死"
"蓬莱山牙医","保密","贵州","3493143160817774","4","","10000","0","","玩个der！80抽出克拉拉我还继续抽个屁[tv_鬼脸]"
"国歌怎么唱的来着","保密","山东","15340974","6","天官赐福动画","10000","0","","强力的割草机器"
"37185455","保密","安徽","3493142011578403","3","","10000","2","","呵，没出[墨镜]"
"时间3急需","保密","河南","1334490313","4","","10000","3","","别装死冷处理"
"黑SRX","男","天津","26872","6","公主连结佩可莉姆","10000","0","","小保底必歪的游戏真服了[笑哭]"
"眼看喜VC","男","福建","1202790024","4","","10000","0","","剧情后面发现他还没死呢"
"无名士第n号","保密","广东","2126031445","4","","10000","0","","凭什么智识个个都要下毒"
"爱猫的鱼呀","男","福建","236090622","5","不思议之旅","10000","1","","低命纯纯牛马角色[无语]"
"维小桃保护协会会长","保密","黑龙江","14171701","6","","10000","0","5","原来不是找恩人，是找仇人[笑哭]"
"极支糖浆","男","上海","476826753","5","","10000","0","","鞭尸狂魔，全抽空气上了[吃瓜]"
"NekoChyang","男","广东","8225194","6","hanser","10000","0","","u1s1这期有点水"
"云云白泽","女","辽宁","272457542","5","","10000","0","","崩三和原神有什么区别 感觉很像啊"
"精神力の三七二十一","男","北京","10698453","5","","10000","0","","这次的同行和活动是不是有点太水了，一股好番转烂番水时长的感觉，赶紧开新剧情吧，绷不住了"
"老木寒","男","福建","293333472","5","","10000","0","","我最开始做的时候，感觉银枝表演颇为浮夸，但是当他向虫子冲去的时候，我的脑海里浮现的是唐吉诃德向着风车冲去。,别林科夫说“骑士小说表现出对个人人格的爱护和尊重，为压迫者和被压迫者牺牲全部力量甚至自己生命的勇敢精神，把女子作为爱和美在尘世的代表。”,这恰是对银枝的写照。"
"崩坏的旅者","男","四川","439400154","6","","10000","0","","确实没毛病哈"
"塞西妮亚","保密","四川","373700405","5","","10000","0","","两个号都歪了[辣眼睛]"
"小小小暖风","女","浙江","625105194","4","","10000","0","","艹艹艹艹洗你船渣米忽悠[生气][生气][大哭]银狼我不要了[热]你赢了米二饼，两次池两次大保底要吃满还是不出，你"
"小小小暖风","女","浙江","625105194","4","","10000","0","","银狼又吃大保底(皿#)半年前不出现在边不出，怎么不洗啊你米忽悠[生气][生气]过奋，两次池子全吃满还是不出"
"师神神","保密","浙江","66457200","6","","10000","1","","在？改改银支大招鞭尸？"
"桂花芝麻糖包","保密","上海","651518","6","","10000","0","","歪了两个白露[微笑][微笑][微笑]米哈游你不是人"
"小昂热可汗","女","内蒙古","628437688","5","","10000","1","","由于星铁过于安逸且梗多，所以放弃了原神，但是一直在歪[大哭]"
"无限的造物i","保密","河北","263232594","6","崩坏3・天穹流星","10000","1","","一开始觉得挺一般的，试用完之后突然觉得还不赖"
"风白Fbi","保密","天津","193574298","6","三周年恋曲","10000","0","","人物挺好，就是剧情挺傻比的，既跟主线没联动，有没有像藿藿那样的系列任务。没说两句话就跟主角团感情特别好似的了，短短过个剧情就没了，真就没活儿硬整,真挺傻比的"
"C巧黑塔不会受伤","男","湖南","337193741","5","EveOneCat2","10000","0","","二段大招鞭尸不改一下吗[笑哭]还不容易抽个男限定有这种问题我真是醉了命座还是不补了，这个别人不说我都没发现"
"JPNanababy","男","重庆","285523996","5","","10000","0","","比原欧多了"
"顾-杰-0225","男","上海","79203722","6","美月もも","10000","0","9","男C嘎嘎出，下一个限定女C什么时候出啊，没人抽了，钱花不掉了啊，米哈游"
"挠碳真多耻与为伍","保密","河南","332720940","5","","10000","0","","想要一只寒鸦，硬是让我抽了70抽才来一只[辣眼睛]cjb"
"有点猛的MUJI酱","保密","浙江","13233083","6","","10000","0","","米桑，你有什么头绪吗"
"你不知道的初音狂三","男","辽宁","12597140","6","黄绿合战5th","10000","0","8","银枝歪了前来抱怨（80歪的三连歪）"
"程统御从心","保密","广东","1586332919","4","","10000","0","","挠谭掘掘博士"
"毕宿5","男","湖南","4269946","6","","10000","0","","和隔壁原神一样，四星比五星难出是吧[笑哭]"
"吵吵闹闹朵树人","保密","河北","441769160","6","刺客伍六七","10000","0","5","60发5金，银枝是爱我的[doge]"
"小昂热可汗","女","内蒙古","628437688","5","","10000","0","","我的银枝去哪了[大哭]"
"为影献上永恒","保密","四川","690160559","5","原神","10000","0","6","20发就出血赚[doge]之后10发还出了克拉拉 大保底有了"
"Iいちか","保密","广东","478389283","5","","10000","0","","你是真该死啊[委屈]90发才出第一个寒鸦，银枝都60发出来了"
"不过守成","保密","广西","1878687588","4","","10000","0","","变欧狗了[喜极而泣]"
"quin小希","男","湖南","359193292","5","","10000","0","","我超，第70抽给我歪了个姬子"
"希露艾儿","保密","黑龙江","1080995775","4","崩坏：星穹铁道","10000","0","4","堂堂限五播放量比四星还低[崩坏：星穹铁道_送花]"
"GoldenW利WA心","保密","加拿大","3546389606828555","2","","10000","0","","歪了垃圾布洛妮娅"
"鹿乃降临我身边","保密","山东","248416851","5","小东人鱼","10000","0","","歪了 死"
"v吹雪v","男","湖北","344497765","5","","10000","0","","你也是正义人？"
"蓝羽君_y","男","北京","190734347","5","","10000","0","","怎么看怎么像个老gay"
"跳瓦骑士","男","山东","453220309","6","","10000","0","","歪了姬子，100多抽没一个新角色，米哈游我日你大坝"
"大虾蹦蹦大混子","男","湖北","349101205","5","","10000","0","","剧情里面放个能把我灭队的是什么意思，带点脑子吧真的醉了"
"爱摸鱼的小团雀","保密","四川","291064069","5","","10000","0","","鸭鸭歪了，米忽悠你不是人啊啊啊[保卫萝卜_哭哭][保卫萝卜_哭哭][保卫萝卜_哭哭][大哭][大哭][大哭]"
"俺乃常山豹子头林黛玉","保密","吉林","344609289","5","","10000","0","","又歪，无语"
"素食主义且养猫02","男","北京","521419012","5","重庆狼队嗷呜狼狼收藏集","10000","0","","看得我尴尬死了"
"德花诺诺奶双豆","保密","山东","107201127","6","","10000","0","","烦死了[大哭][大哭][大哭]歪了"
"SuifengQWQ","保密","山西","13936061","6","原神","10000","0","","寻人启事：寻找一位高贵、美丽的红发骑士。其人谈吐风雅，身手不凡，曾在星穹列车内洒下大量难以清扫的玫瑰花瓣，致使列车长不得不加班大扫除。若能提供此人线索，星穹列车必有重赏。,这是悬赏吧[喜极而泣]"
"只有离别不能重逢","保密","湖南","2095491832","5","","10000","0","","真服了，怎么有这么nt的同行任务，卡妈dot队都没打过银枝，策划你怎么想的[疑惑][疑惑][疑惑]"
"fxszhk","保密","辽宁","38700468","6","","10000","0","","尊敬的星铁官方，我是UID103011774的哥哥，在昨夜他去世了，因为他未满十八岁，所以是没有用自己的手机号码，且他本人没有留下手机密码，我恳求你们可以把他的账号密码给我，谢谢。"
"好的吧1235","保密","广西","3461572653484731","2","","10000","9","","《中华人民共和国反不正当竞争法》 第九条 经营者不得利用广告或者其他方法，对商品的质量、制作成分、性能、用途、生产者、有效期限、产地等作引人误解的虚假宣传、广告的经营者不得在明知或者应知的情况下代理、设计、制作、发布虚假广告。"
"紫罗兰斯洛特","保密","江西","188297291","6","","10000","0","","太离谱了，这游戏数值膨胀太快了"
"TheUtopiar","保密","四川","3298925","6","","10000","4","","新卡池出来内容半小时就整完了，就这点内容加上不耐玩的玩法，前景堪忧啊，产量赶紧上来吧。请来更多的“野火”，而不是疯狂出新卡池和复刻。"
"一枝青莲镇九霄","保密","上海","351469350","6","","10000","1","","银枝的伤害不会太超标吗，现在这个趋势数值膨胀已经感觉没法玩了"
"灵儿R","保密","河南","1421321800","3","","10000","1","","开服玩家，有点无聊，于是1.5开始开的小号，新手池老杨，霍霍池鸭子，常住颜卿，克拉啦专武。现忍不住了，于是用小号解馋。（大号大保底，准备吃阮饭，抽个寒鸦就停手，结果10抽3紫，1命寒鸦，艾斯达补够6命。）小号（开括等级52）保低银枝，仪器都才刚刷，直接四件套毕业，这运气我就服了，逆天。但你嘛的，抽专武歪姬子的，这很银枝[大哭][大哭][大哭]。"
"星与观星之日","男","江苏","37189189","6","","10000","0","","我的1w水被朋友抽1命藿藿了[笑哭]"
"冰仔丨","保密","河北","3493104061516147","3","","10000","0","","一般般吧"
"赛博精_神_V震天","男","河南","50402012","6","","10000","2","","还能玩吗？哥？为啥原神，星穹轨道，每次都是大保底啊？"
"devil-cosmos","保密","云南","3840404","6","","10000","0","","纯你太美"
"司徒巧竹木","保密","山东","3494362497419543","3","崩坏：星穹铁道","10000","11","","有了帕姆的庇护不歪是必然的[崩坏：星穹铁道_打招呼]"
"31196999037_bili","保密","中国香港","438948630","5","","10000","0","","你这咋还带官方剧透呢[doge]"
"oir_annan","女","甘肃","3124023","6","","10000","0","","mhy你真该死啊[微笑]"
"AT-凰天","男","未知","1529549723","4","","10000","8","","红发，五星，骑士，好人，会追尾，会和主角打起来。"
"御坂5879号","保密","江西","241990911","6","喂，看见耳朵啦","10000","16","","这哪是银枝的角色试用啊？这是绝灭大君模拟器[辣眼睛]对面五个人，停云挨了四下打，一下子我就蚌埠住了"
"闪耀的小江","保密","河南","593735174","5","多多poi","10000","12","","只有我想到了这群小家伙吗？[doge]"
"小呀嘛小甜菜_","保密","北京","404599563","5","","10000","1","","看完同行任务我整个人都不好了，什么玩意儿啊？太差劲了吧，不会做可以不做的"
"苦味木糖醇","男","广东","231148584","6","崩坏3・天穹流星","10000","2","","正文、美德、大蠊，越代入越上头，又是时间机。"
"憨之声","保密","陕西","177671391","6","hanser","10000","21","","鸭门"
"果兔奶虎","女","辽宁","27687530","6","EveOneCat2","10000","0","","30抽带着寒鸦一起出了，谢谢你纯美骑士"
"Magicskullwym","男","北京","12444968","6","","10000","0","","第一次在星铁希望剧情可以跳过"
"社恐芝士喵","女","江苏","572390468","5","2233白色情人节","10000","2","","你怎么知道我五抽出银枝[doge]"
"少女粉色信笺","男","广西","384869912","5","","10000","3","","世界观好大，感觉主角团就是个小卡拉米"
"无糖可苦可乐","男","新疆","211004543","6","至尊戒","10000","1","","萌新 70抽吧 歪了个布洛妮娅 和  银枝[思考]，但是专武没法子抽了…没票子了 真难抽"
"洞主-胡凯利","保密","广东","225140529","6","","10000","1","","花点心思在主线吧[辣眼睛]"
"甜缘松鼠","男","河北","504989548","5","公主连结可可萝","10000","607","","到我了，到我了，我想听那个[doge]"
"WYX2023xm","男","湖北","294099923","5","","10000","336","","伟大的“卡神”它还在输出，请文案组务必把这段写进下版本的剧情故事里[妙啊]"
"无尽的陨落","男","天津","13247556","6","","10000","143","","纯美骑士他真的，我哭死，从未如此切身的体会到来自纯美骑士的帮助[酸了]"
"逾了三集的币","保密","江苏","2066869646","4","","10000","20","","我的银枝有三卷大面筋[墨镜]"
"なんで春日影","保密","陕西","491337486","3","","10000","19","","[崩坏3・终焉归始_嘲笑][崩坏3・终焉归始_嘲笑][崩坏3・终焉归始_嘲笑]笑死,被人偷上了列车还得扫他的花瓣，笑死,枪每回插到地上都在他的心头上乐"
"于是跳起了圆舞曲","男","广东","371080784","5","","10000","18","","虽然歪到老杨让我心头一寒，但下发10连就直接来了还真给面子啊[星星眼]"
"下次一定换来的名字","男","广东","225429259","6","2021拜年纪活动专属","10000","14","","找到了，找到了3个"
"岛零","保密","广东","37542283","6","初音未来13周年","10000","8","","第一次刷物理本，请问物理套都是这么快毕业的么。[星星眼][星星眼]"
