"昵称","性别","IP","UID","等级","装扮","用户权重","获赞数","粉丝团等级","评论"
"子の亦","男","江苏","1354465253","5","","10000","0","","我的银枝出了，物理，但是白毛"
"把字条传给风","保密","安徽","521682710","5","","10000","0","","主c有饮月和镜流，目前混沌满星没问题，有克拉拉，推荐抽银枝吗，听说混沌2.0银枝很爽，但抽了银枝，阮梅就不稳了[思考]"
"永恒的雷电将军","男","广东","387628463","5","","10000","0","","既然有骑士，那肯定也有公主，比如崩铁爱莉希雅[吃瓜]"
"大发明家奥托","女","四川","27736990","6","","10000","0","","说话不带帕。肯定不是帕姆。"
"一朵悠悠的白云啊","女","山东","446115282","5","","10000","0","","@RE三木"
"格氏试剂法","男","广东","5113543","6","","10000","0","","姬你太美！"
"社会闲散长颈鹿","保密","福建","413129271","6","","10000","0","","歪了克拉拉 4连歪了"
"启灵元神的儿子","男","湖南","1322698167","4","","10000","0","","啊"
"舒尔坝","保密","河南","383768991","4","","10000","0","","帕姆声音咋有点不对劲  小n不会感染支原体了吧[吃瓜][吃瓜]"
"游戏玩家-三阳","保密","湖南","275349024","6","2020拜年祭（鼠）","10000","0","","歪了"
"安度使","男","重庆","31200856","6","","10000","0","","枝门"
"灰食","保密","贵州","10606334","6","","10000","0","","1.6啥时候前瞻呀，有哪位盆友知道嘛"
"-_二三","保密","河北","443067384","4","","10000","0","","谢谢mhy和银枝还有崩铁，一发10连就出来了，纯美，万岁！"
"通辽汗国建州卫指挥使","保密","广东","11546750","6","洛天依・最美的夜","10000","0","","若能提供此人线索，星穹列车必有重赏。,这真的不是通缉令？[doge]"
"-名字有什么用-","女","河南","673889253","5","","10000","0","","是银枝，也是枝银[doge]"
"有山有水sss","男","江西","3493126150818588","4","","10000","0","","小保底别歪[保佑]"
"MikuKina","女","广东","168278488","6","","10000","0","","连歪四五次"
"bili_54727119918","保密","江苏","1832202135","5","","10000","0","","又歪了杰哥[微笑]有没有0+1银枝加个好友"
"PP榴莲君","保密","浙江","7459041","6","原神","10000","0","","已拥有，谢谢宝来我列车[兔兔茶话会_送fafa]"
"亚丝拉琪_","保密","江苏","510155763","5","原神","10000","0","","歪了小李她六师叔[笑哭]"
"峡谷の守法人","男","山东","471030745","5","","10000","0","","好消息：二十抽小保底出了[脱单doge],坏消息：毁灭三C都有，且想吃阮饭[大哭]"
"雍北为鬼畜而来","男","云南","48244923","6","良辰美景・不问天","10000","0","4","你怎么知道我30抽一只银枝，一只寒鸦[脱单doge]"
"睿愚的粉海星","男","江西","487895831","4","","10000","0","","有人很多说银枝单防景元元[笑哭]崩铁优，等我抽个来反驳[脱单doge]"
"不要红枣只要核桃","保密","江苏","316539744","6","","10000","0","","160抽，巨大大保底"
"崩坏的八重火垣","男","新疆","69202338","5","","10000","0","","我暂时不抽银枝，我就想捞个雪衣的妹妹，为啥都40发了还不给我[tv_笑哭]"
"萝莉爱好者","男","广东","65797","6","hanser","10000","0","","冷知识:列车长也是包菜[滑稽]"
"以南VVvvVVVv","保密","四川","472377553","5","","10000","0","","做任务马上幻视堂吉诃德"
"蒙德幼儿园园长德丽莎","男","云南","179627131","6","碧蓝航线","10000","0","","枝银你太美（）"
"请你喝茶w","男","上海","14459629","6","月下贵人改大版","10000","0","","咋样，目前主c只有静流和景元，要抽一个嘛，感觉景元不太好用呢"
"帷瑜","女","重庆","3493293149129157","3","","10000","0","","本来打算抽寒鸦的，但是耐不住他这么想见我，30发直接来了，四命寒鸦，还给了我个保底，七十几还是八十几的时候歪了姬子"
"花花花花憩","保密","湖北","478643142","5","","10000","0","","1+1[tv_doge]枝门"
"居先生のファン","女","福建","6527301","6","","10000","0","","歪了布洛尼亚，美滋滋[滑稽]终于有了"
"iefnfisj","保密","广东","13987429","6","","10000","0","","0+1没歪[大笑][大笑][大笑]"
"美梦怡","女","河北","16765265","5","公主连结佩可莉姆","10000","0","","[无语]求个银枝助战"
"不寐倦L更","保密","广东","1553718","6","少女前线","10000","0","10","谢谢你，78抽我的大鸭鸭1命了，再会了我的银枝，下次再见呜呜呜"
"霸娇给我爬","保密","湖北","1514184775","4","","10000","0","","过完剧情了，第十次后悔为什么要在霍霍池子垫[大哭]为什么垫了二十发就小保底了还没歪啊啊啊啊啊啊啊啊这不合时宜的运气"
"-幻_影-","男","福建","495451936","5","碧蓝航线","10000","0","","谢谢你，我连吃两个大保底"
"浮芙烧","保密","上海","7804701","6","","10000","0","","省流：银枝有路怒症（误"
"纯美骑士","女","浙江","325758991","5","","10000","0","","[打call]"
"等君越","保密","广东","32683720","3","","10000","0","","歪了杨叔，虽然我不知道下一个要抽什么，不过TA已经稳了"
"祁玖陆十三","保密","黑龙江","165413434","5","","10000","0","","有没有好心的大佬借我一个银枝玩玩的，呜呜呜"
"克尔缇娜","保密","河北","104974414","5","三周年恋曲","10000","0","","我寒鸦沉了"
"seele可爱捏","保密","天津","496168529","5","","10000","0","","轮契怎么这么难抽，60发就一张"
"狮木木","女","江苏","14898469","6","","10000","0","6","捍卫银河中的美！"
"朝E","保密","山西","341973640","6","","10000","0","","帕姆嗓子是不是哑了[惊讶]"
"北冰洋搬砖","保密","山东","37726062","6","","10000","0","","抽银枝歪了杰哥，抽专武歪了银河铁道之夜...也不是不能用[难过]"
"不是纯爱就行","保密","山西","1647054180","5","斯莱特林","10000","0","","你好短啊"
"脉子","女","辽宁","7879424","6","","10000","0","","抽到了！亲亲"
"漫沙陨穹","男","福建","17364090","6","","10000","0","","怎么总是给我歪杰哥啊，新手期第一个金就是杰哥 后面抽主C每次都歪杰哥 太痛苦了"
"丶陌念丶","保密","甘肃","94897350","5","","10000","0","","赛诺；像我吗？"
"雪竹低寒翠","女","山东","388473903","5","","10000","0","","银枝到手了只有0命寒鸦[保卫萝卜_哭哭]"
"阿拆家的小七","保密","山东","531450003","5","","10000","0","","逆天，我20抽抽出三个玲可"
"o陌寒o","男","四川","586674329","5","","10000","0","","那么多人歪，只有我没歪，我就放心了[滑稽]"
"极饿骑","保密","无IP","3493257172486156","3","","10000","0","","纯“美”骑士[doge]"
"田UwU","保密","中国台湾","40627047","4","","10000","1","","明明是银枝主题板，留言一堆歪楼的：其他角色的、生日签到的，请善待二次元男性好吗[藏狐]|||||反正都是歪（楼）抽歪我看你们也是应得[辣眼睛]"
"某人的女装照","保密","山西","14495170","6","2021拜年纪","10000","0","","我还以为有洗车星，结果就一个通行[热]"
"哥书南","保密","福建","1126010892","4","","10000","0","","30抽出金惊喜，然后歪了龙女[笑哭]"
"白雪下的世界","保密","江苏","352860045","6","","10000","0","","又一次歪了白露[大哭]"
"柚落QWQ","保密","江苏","362500531","5","","10000","0","","100抽小保底抽出了银枝，寒鸦一个没有，只能祈祷小保底阮梅不歪了"
"jeune清茶","保密","江苏","33800029","5","格兰芬多","10000","0","","歪了"
"大白米菜","保密","广东","1394529218","4","","10000","0","","为啥没有寒鸦pv[大哭]"
"今天的愚者也很缺钱","女","重庆","678997270","5","","10000","0","","赞美伊德莉拉！[领结猫_深情]"
"超越bro_","女","广东","1663912","6","崩坏3・天穹流星","10000","0","10","寻仇启事[大笑]"
"杉津大熊","男","北京","8348914","6","圣诞节快乐","10000","0","","银枝剧情钢琴曲也太好听了吧！"
"晴风行歌","保密","江西","18762567","6","","10000","0","","啊啊啊啊啊啊这期好有趣啊"
"清音碧乐","男","芬兰","37778561","6","崩坏3・天穹流星","10000","0","","银狼歪了，前来抱怨"
"-咕-_","保密","广东","399671330","5","","10000","0","","喜欢你美女！"
"工具人1145号","保密","黑龙江","248396167","6","","10000","0","","星穹去哪了"
"NOLANELD","男","山东","4697017","6","","10000","0","","帕姆的声线是不是和游戏里的不一样啊？[辣眼睛]"
"零","女","广东","498735185","5","","10000","0","","大保底垫了52抽了，快点来吧，刚过完同行任务，毫不犹豫开了个月卡，本来星铁想随缘不氪的[笑哭]"
"sunnyming814","保密","未知","7023950","6","","10000","0","","不想知道花瓣去哪里，我就想知道披风去哪里了？为什么开大招没有披风？_(:з」∠)_"
"一叶丿离","保密","广东","673939258","3","","10000","0","","[桃源_给花花][桃源_给花花][桃源_给花花]"
"一切艾因都将被猫塑","保密","江苏","507622265","5","","10000","0","","杰哥一命了[灵魂出窍][灵魂出窍][灵魂出窍]"
"-o闫-","男","重庆","532686584","4","","10000","0","","为什么银枝是纯美骑士？,答:枝银你太美[崩坏：星穹铁道_打招呼]"
"亮仔不是崽","男","黑龙江","97504108","6","干物妹！小埋","10000","0","","问下抽到银枝的大佬们，他真的有试用时那么高的伤害吗"
"Tceメ秋裤","保密","山东","289164918","5","","10000","0","8","大保底！mhy！！！[大哭]"
"卡芙卡小姐请和我结婚","保密","广东","1436674334","5","","10000","0","","蒙德城的迪卢克，应约而来！[doge]"
"映微OWO","保密","福建","22355874","6","","10000","0","","三命白露[墨镜][墨镜][墨镜]"
"欢乐豆仙人","男","安徽","169239486","5","异常生物","10000","0","","各位大佬，目前输出只有静流，这次的池子有必要抽吗？[给心心]"
"椎名そら殿下的舔狗","保密","河北","111343537","6","","10000","0","","20抽大保底银狼，打算再抽40垫一下池子结果10抽银枝20抽专武最后10抽寒鸦"
"小浩B","保密","广东","94517321","6","总之就是非常可爱","10000","0","","这期的卡池：枝狼[tv_鬼脸]"
"西m硝子にしみや","男","新疆","294030055","6","","10000","0","","我就想要个寒鸦 五十抽一个没有[笑哭]"
"九拾丶","保密","山东","327477293","6","","10000","0","","虽然我还没抽到，但是，啊！美门！"
"晨露陌曦","保密","山东","517857933","5","","10000","0","","每次都吃保底出的服了本来想抽阮梅的但银枝的人格 魅力 外观我好喜欢让我一个男的都动心啦[害羞][害羞]"
"白恒樱","保密","浙江","693279880","5","","10000","0","","家人们谁懂啊，160抽一个寒鸦都没有"
"桂花树条","女","浙江","415145770","5","橘猫挂件","10000","0","","感谢银枝没歪，没想到专武池子20发出了，这下可以为阮梅垫池子了[打call][打call]"
"芈面","保密","浙江","3853216","5","","10000","0","","10连一紫，80保底歪"
"小卟不是二刺猿","保密","江西","306165502","5","","10000","0","","纯美，永驻！[打call][打call]"
"是叶子君呀","保密","江苏","450899059","5","","10000","0","","问问0+1要怎么养，词条带点啥啊"
"言毓","女","云南","450601454","5","EveOneCat2","10000","0","","100抽一只寒鸦没有，哈哈[墨镜]"
"酷洛修斯","男","广东","1321599","6","","10000","0","","枝狼，启动！"
"昀月照云灯","保密","四川","13165043","6","刺客伍六七","10000","0","","我在想，要怎样才能不次次大保底呢[黎明觉醒_怒了鸦]"
"-宫本武藏-","保密","广东","1944136","6","公主连结可可萝","10000","0","","本来就是想抽个鸦鸦，结果40发两个都来了"
"茶淑_pp","保密","江苏","197778107","6","","10000","0","","他真好看"
"庄蜩","女","辽宁","37369145","6","","10000","0","10","问问三四星光锥推荐用啥？"
"bili_38421724","保密","四川","38421724","5","","10000","0","","改不改遗器爆率"
"嘴角沾血的熊","保密","广东","289371063","5","","10000","0","","寻人启事改为通缉令了[滑稽]"
"木白玖","女","陕西","13843798","6","","10000","0","","感觉这次同行姬子和老杨都没啥反应，挺奇怪的"
"网恋散兵被骗8888","保密","广东","20331745","5","","10000","0","","光锥吃满。以世界之名+1。大号两张了"
"热血的大蛇","男","湖北","56800588","6","","10000","0","","不瞒各位纯美骑士跟黑骑士之间我选择了黑骑士!黑骑士又帅又飒![给心心][给心心][给心心]"
"倾倒银河","女","河南","325860359","5","崩坏：星穹铁道","10000","0","","啊列车组剧情摩多摩多！很喜欢这次的剧情[嘟嘟]银枝也很彻底的贯彻了对“纯美”的忠贞呢。"
"内卷摸鱼两手抓","男","湖南","1776271350","4","","10000","0","7","以后列车组会不会遇到丰饶民？"
"晴雨有何","保密","广东","493642987","5","春原庄的管理人小姐","10000","0","","枝银你太美[脱单doge]"
"息诤","保密","陕西","74961719","6","","10000","1","","一出场尬得我直抠脚趾，这画风和现任大守护者一定很合得来"
"苏秋白酱","保密","河南","319044919","5","公主连结凯露","10000","0","","这个简介很有意思，帕姆发的寻人启事哎"
"究竟是谁抢了我的昵称","男","江西","261754790","6","EveOneCat2","10000","0","","10抽出了，谢谢银枝！"
"经夜年愁","男","山东","501324178","5","","10000","0","6","刚抽出来，拉了50就开了银枝任务，结果剧情打不过中途还不能换配队[笑哭][笑哭][笑哭]"
"chgs866","男","福建","314799416","5","巅峰荣耀","10000","1","","。。。。60抽下去一只寒鸦都不给。。不敢期望出黄。但是你特么一只都紫的鸭鸭都不给我，属实当头一棒"
"达咩啊啊啊啊啊","男","辽宁","330419065","4","","10000","0","","地板 我的地板啊[doge]"
"非必勿增","男","云南","10344081","6","","10000","0","","158抽直接快进到退游"
"穿西服的兔子君","男","黑龙江","20609205","6","花园花玲头像框","10000","0","","许愿银枝啊啊啊啊"
"你的爱还不够啊","男","山东","164505404","6","","10000","0","","这个节目多久没请过人类嘉宾帕[歪嘴]（胀胀、尾巴大爷、列车长帕姆）"
"Sunの星神","保密","陕西","57194477","5","格兰芬多","10000","0","","追尾了车，上车就和咱打了起来。说的没毛病，但就是哪里怪怪的。"
"深渊教团骑士殿下-宸","男","河北","1003547053","5","","10000","0","","大家好，我上一个卡池抽的快大保底了，等明天我凑够了个十连就来炫耀[脱单doge]"
"1加仑","保密","山西","75379924","4","","10000","0","","捞个寒鸦走人大保底留着[大笑]"
"I明月夜I","保密","广西","9208109","6","","10000","0","","本来只想捞个寒鸦，但没想到有意外之喜"
"不寐倦L更","保密","广东","1553718","6","少女前线","10000","0","10","嗯，我的银枝歪了鸭鸭，再摆也好也是非，我已经平衡好我心态了。[藏狐]难过"
"盈盈茶","女","福建","37553313","6","","10000","0","","哥，71抽了！还不来啊？"
"指尖上的笑笑","男","广东","27459933","6","崩坏3・天穹流星","10000","0","11","「纯美」- 姬子,[崩坏3・光辉矢愿_比心]"
"LochLein","保密","北京","23465542","6","异常生物","10000","0","","我来还愿!"
"绝天神云","男","湖南","431994049","4","植物大战僵尸2","10000","0","5","垫了四十抽后砸十抽寒鸦出了，不用保底真爽"
"凯亚么么叽","女","四川","286524137","5","","10000","0","","不是  他怎么还有第二阶段[微笑]"
"总之就是非常好涩","男","广东","497627969","5","","10000","0","","他只是一个路过的纯美骑士[脱单doge]"
"一个小笨猪","男","广东","34928341","6","","10000","0","","单抽出奇迹，6[小电视_赞]"
"迷途在路","保密","山东","27023091","6","","10000","0","9","大保底，恨来自星穹列车"
"温言水","女","安徽","507193575","5","","10000","0","","感谢你，角色武器都没歪[保佑]"
"酸溜溜的酱醋鱼","保密","广东","520691805","3","","10000","0","","你说有没有可能姬子是银枝的姐姐？"
"camedd-official","男","辽宁","34360935","6","EveOneCat2","10000","0","","20抽歪鸭 40抽大保底交了[藏狐]"
"可可Dbchen","女","四川","14898786","6","","10000","0","","抽银狼出3命杰哥，逆天[笑哭]"
"罗城主救我","保密","黑龙江","483941738","5","","10000","0","","105抽寒鸦0个银枝0个.真有你的"
"鸡涌与承小新","女","广西","108180722","6","原神","10000","0","","纯美精神永存[兔年]"
"原神代肝梅绅士小号","男","福建","17105140","6","原神","10000","0","","省流：我的地板！"
"已经开始脑溢血了","男","浙江","453564196","5","崩坏：星穹铁道","10000","0","6","77抽啊2命鸭了啊，我武器上回还是72歪的彦卿的，俩池子都大保底了啊[大哭]"
"爱麋鹿的我麋了路","女","江苏","108341642","5","2233白色情人节","10000","0","","兄弟们问一下，银枝先抽命座还是专武"
"梦ALFLA","保密","广东","10714396","5","","10000","0","","没有寒鸦，痛哭流涕[笑哭]"
"---超绝最可爱天使酱---","女","浙江","470330996","5","","10000","0","","帕姆的耳朵到底是个什么构造？就像猫猫和猫猫的尾巴一样不是一个生物？我很好奇[思考]"
"梦者生于眠","保密","上海","86717009","6","花园Serena第二弹","10000","0","","本期卡池名称：枝狼：银氏二度[doge]"
"人间有个童生","保密","河北","352446326","5","","10000","0","","开秘技闪瞎人家狗眼的同时偷袭，骑士精神在哪里"
"Lychnis-","保密","湖北","523068122","5","","10000","0","","大保底 攒了150抽 晚上下班回家就抽卡[星星眼][星星眼][星星眼]"
"岩王帝君屁股厨","女","山东","13380315","6","LeXBurner头像框","10000","0","","太好看了银枝 这是我五十抽应得的"
"梦境丶凉秋","保密","广东","2080510166","3","","10000","0","","抽到了抽到了"
"勇者糯米丝儿","保密","重庆","287904709","6","","10000","0","","银枝1命了，还拄拐"
"希眸子","保密","福建","456058082","6","三周年恋曲","10000","0","","活动奖励都拿不到[灵魂出窍]"
"该_用户已注_销","保密","北京","3546380463246119","3","","10000","0","","咱就是说啊，银枝都说了不管输赢，为啥我输了就重新打一遍？啊？mhy？你在干什么？！"
"苍萝卜卜卜","保密","海南","8019363","6","EveOneCat2","10000","0","","我一定会买银枝玫瑰的！！！！！！『我谨在此，以一朵玫瑰的沉重份量，向你致意。』"
"冷丶jin","保密","江苏","3594478","6","","10000","0","","我怎么想到帝皇之子了呢"
"有没有容易中奖的名字","保密","广西","34970203","6","大王不高兴","10000","0","","连金没歪耶哈哈哈！他好爱我[妙啊][妙啊]"
"youmakemeblue","保密","无IP","509925148","5","","10000","0","","纯美永恒"
"巫尼贝Nica","保密","贵州","629898904","5","异常生物","10000","0","","家人们，我限定池才出三个五星，第一个是常驻（布洛妮娅），第二个是饮月，第三个是银枝池子里的杰帕德，每一个金75抽以上才出，我甚至这次原神芙宁娜抽出迪希雅，大家有什么头绪吗[墨镜]"
"东南岸_","男","北京","113636208","5","洛天依8th生日纪念","10000","0","","看到你们歪了 我也不难过了[栗栗子表情包_biu]"
"我爱上了面包i","男","浙江","31228407","6","崩坏3・天穹流星","10000","0","5","在？你这池子没有寒鸦？[大哭][大哭]"
"孤单的手握着","男","河北","16418815","6","","10000","0","","家人们歪了姬子，练他还是青雀[笑哭]"
"萦慕流风","保密","重庆","255847222","5","","10000","0","","74了！你别再歪了啊！！！（跪下）"
"FinallD","保密","天津","273751661","5","卡拉彼丘","10000","0","","五星都歪出来了，我寒鸦呢？？？？？？？"
"苍萝卜卜卜","保密","海南","8019363","6","EveOneCat2","10000","0","","银枝的个人曲实在是太好听啦[初音未来_大笑][初音未来_大笑][初音未来_大笑][初音未来_大笑][初音未来_大笑][初音未来_大笑]好喜欢，把列车的音乐直接换了然后循环，舍不得离开啦[初音未来_大笑][初音未来_大笑][初音未来_大笑]赞颂纯美星神伊岳蚶，赞美授勋骑士枝枝！！！！"
"Feirnmmm","女","湖南","323580113","5","","10000","0","","寒鸦呢？我的寒鸦呢？银枝不给我，寒鸦也不给我[大哭][大哭][大哭][大哭]"
"常乐天君--阿哈","保密","山东","403330224","5","","10000","0","","问：这一期为什么是俩个up池，答：因为是双银，双银等于双人（我们这有些地方，人的发音很像银）"
"天狼在世","男","辽宁","23990084","6","2021拜年纪活动专属","10000","0","","为什么我的银枝老了，都开始拄拐杖了[墨镜]"
"美味的饺子丶","保密","广东","157668740","5","","10000","0","","坏了，丢了20抽想抽寒鸦，结果出来2只银枝[藏狐]"
"流浪i","男","湖南","17818615","6","","10000","0","","服了，四个号，都是四五十抽，没一个出的，都是四星[tv_难过]"
"繁星曦月","保密","广东","26426845","6","","10000","0","","是什么寻人启事？这分明就是通缉令啊[脱单doge][吃瓜][吃瓜]"
"是骏骏崽哇","男","辽宁","323521071","5","","10000","0","","50发下去全是光锥，你在干什么老米[大哭]"
"-青鸢-","保密","江苏","28170760","5","星座系列：双子座","10000","0","","布洛妮娅2命了，帕姆有什么思路吗？"
"是月月安啊","保密","山东","400935674","5","崩坏：星穹铁道","10000","0","","大保底和武器小保底都吃满了，不过出了就好[给心心]银枝你是一个特别纯粹漂亮的美人[给心心]"
"3222222433","保密","重庆","402608771","3","","10000","0","","感觉不强"
"蔡鸡是个菜鸡","男","云南","293704042","6","","10000","0","","没想着抽银枝[妙啊]想着给之后池子垫一垫 二十抽他就带着两只富婆来了[妙啊]这么搞下去我要赞颂纯美喽[doge]"
"凌菊微步","保密","湖北","13440661","5","","10000","0","","做完同行任务 送的三张唱片 有张播放就会化身为dj夜店小王子了[脱单doge]"
"_Kou","保密","广西","1381784826","5","","10000","0","","哈哈哈哈出了（大保底…）"
"弱水3001","女","广东","522623427","5","","10000","0","","74发大保底还没出，先来给你一脚[藏狐]"
"绫人袖子里的奶茶","保密","福建","90608251","6","","10000","0","","不是吧，一百抽都没有寒鸦"
"雾酱sora","保密","浙江","1489122928","4","崩坏：星穹铁道","10000","0","","歪了，我心好痛"
"顿顿吃辣妹","男","浙江","88437092","5","","10000","0","","两个号为了抽寒鸦玲可艾丝妲，顺便给阮梅垫卡池，结果一个干出1命银枝，一个0命银枝，还都是40-50抽出的，我这俩号在之前都是歪+大保底的，现在都白白浪费星穹白垫了，难道因为银枝太冷门，阮梅太热门，出金概率改了吗？"
"Nucinante","保密","安徽","5807556","5","碧蓝之海","10000","0","","歪了，踢你一脚"
"赤慕wy","女","湖北","102840971","6","星座系列：水瓶座","10000","0","","230抽1＋1，还附带了个杨叔和杰帕德"
"David-wJ","男","上海","82196556","6","","10000","0","","纯美的女神伊德莉拉美貌盖世无双"
"菠萝菠萝你蹦不哒丫","保密","上海","44008358","5","","10000","0","","歪了克拉拉。。目前已3命...0+1银枝 伤害爆炸。。。入股不亏。。又美又能打。。智识的希望[喜欢]"
"椰椰冰な","保密","辽宁","698124187","5","","10000","0","","小N配的太逗了[配音演员小N_可爱捏]"
"箴言ehamphe","保密","山东","630026923","5","","10000","0","","喜提一命彦卿"
"莫罕达斯肝帝X","保密","湖北","234438415","5","","10000","0","","枝银你太美"
"仓鼠上车轮_","保密","广东","25107561","5","","10000","0","","我的银枝为什么是巡猎[辣眼睛]"
"不吉卜普不笑","男","山东","34503029","6","攻略组","10000","0","","彦卿！"
"秃头甜辣烧饼","男","山西","628366514","5","","10000","0","","小保底没歪，现在走安心等真理了[脱单doge][脱单doge][脱单doge]"
"秃头甜辣烧饼","男","山西","628366514","5","","10000","0","","真好看啊银枝"
"最喜三鲜伊面","男","河南","237658638","6","","10000","0","","垫十五发，今天抽了一百发出俩银枝，呢么我的寒鸦呢？啊？我今天又多抽十几个艾丝妲！"
"烟乔乔湮","保密","湖北","11610384","6","","10000","0","","一命布洛妮娅了谢谢你"
"秃头甜辣烧饼","男","山西","628366514","5","","10000","0","","打架的bgm真好听啊[星星眼][星星眼][星星眼][星星眼]"
"常乐天君--阿哈","保密","山东","403330224","5","","10000","0","","谢谢你"
"每天都在睡觉的Z","女","四川","176635959","5","","10000","0","","银枝怎么配队啊？我打算带一个雷神充能，带个死生律减抗，遗器带四绝缘。那么四号位给谁呢"
"皎月与我","女","广东","337006955","5","","10000","0","","我歪了，我卸载了[脱单doge]"
"汐屿白暮","男","云南","433217564","5","崩坏3・天穹流星","10000","0","","不想抽银枝，等阮梅吧，想吃阮饭[doge]"
"时来了没","女","四川","27471155","6","崩坏：星穹铁道","10000","0","9","“捍卫银河中的美”[笑哭]"
